(201382, -86, 4);10;י;158038;(3, 13, 2, 5, 158038);41715;(3, 13, 2, 2, 41715);כי;2;2;אדם כי יהיה בעור בשרו שאת או ספחת או בהרת והיה בעור בשרו לנגע צרעת והובא אל אהרן הכהן או אל אחד מבניו הכהנים
(201382, -86, 4);20;כ;158124;(3, 13, 3, 6, 158124);41739;(3, 13, 3, 2, 41739);הכהן;2;2;וראה הכהן את הנגע בעור הבשר ושער בנגע הפך לבן ומראה הנגע עמק מעור בשרו נגע צרעת הוא וראהו הכהן וטמא אתו
(201382, -86, 4);50;נ;158210;(3, 13, 4, 10, 158210);41762;(3, 13, 4, 3, 41762);לבנה;3;3;ואם בהרת לבנה הוא בעור בשרו ועמק אין מראה מן העור ושערה לא הפך לבן והסגיר הכהן את הנגע שבעת ימים
(201382, -86, 4);6;ו;158296;(3, 13, 5, 20, 158296);41785;(3, 13, 5, 5, 41785);והנה;1;5;וראהו הכהן ביום השביעי והנה הנגע עמד בעיניו לא פשה הנגע בעור והסגירו הכהן שבעת ימים שנית
(201382, -86, 4);50;נ;158382;(3, 13, 6, 34, 158382);41806;(3, 13, 6, 9, 41806);הנגע;2;9;וראה הכהן אתו ביום השביעי שנית והנה כהה הנגע ולא פשה הנגע בעור וטהרו הכהן מספחת הוא וכבס בגדיו וטהר
(201382, -86, 4);400;ת;158468;(3, 13, 7, 40, 158468);41827;(3, 13, 7, 10, 41827);לטהרתו;5;10;ואם פשה תפשה המספחת בעור אחרי הראתו אל הכהן לטהרתו ונראה שנית אל הכהן
(201382, -86, 4);50;ן;158554;(3, 13, 9, 28, 158554);41849;(3, 13, 9, 8, 41849);הכהן;4;8;נגע צרעת כי תהיה באדם והובא אל הכהן
(201382, -86, 4);200;ר;158640;(3, 13, 11, 35, 158640);41872;(3, 13, 11, 9, 41872);יסגרנו;4;9;צרעת נושנת הוא בעור בשרו וטמאו הכהן לא יסגרנו כי טמא הוא
(201382, -86, 4);5;ה;158726;(3, 13, 13, 7, 158726);41895;(3, 13, 13, 2, 41895);הכהן;3;2;וראה הכהן והנה כסתה הצרעת את כל בשרו וטהר את הנגע כלו הפך לבן טהור הוא
(201382, -86, 4);10;י;158812;(3, 13, 15, 17, 158812);41920;(3, 13, 15, 5, 41920);החי;3;5;וראה הכהן את הבשר החי וטמאו הבשר החי טמא הוא צרעת הוא
(201382, -86, 4);5;ה;158898;(3, 13, 17, 28, 158898);41944;(3, 13, 17, 7, 41944);וטהר;3;7;וראהו הכהן והנה נהפך הנגע ללבן וטהר הכהן את הנגע טהור הוא
(201382, -86, 4);1;א;158984;(3, 13, 19, 43, 158984);41967;(3, 13, 19, 11, 41967);אל;1;11;והיה במקום השחין שאת לבנה או בהרת לבנה אדמדמת ונראה אל הכהן
(201382, -86, 4);1;א;159070;(3, 13, 21, 17, 159070);41990;(3, 13, 21, 5, 41990);אין;1;5;ואם יראנה הכהן והנה אין בה שער לבן ושפלה איננה מן העור והיא כהה והסגירו הכהן שבעת ימים
(201382, -86, 4);40;ם;159156;(3, 13, 23, 3, 159156);42013;(3, 13, 23, 1, 42013);ואם;3;1;ואם תחתיה תעמד הבהרת לא פשתה צרבת השחין הוא וטהרו הכהן
(201382, -86, 4);4;ד;159242;(3, 13, 24, 45, 159242);42036;(3, 13, 24, 13, 42036);אדמדמת;2;13;או בשר כי יהיה בערו מכות אש והיתה מחית המכוה בהרת לבנה אדמדמת או לבנה
(201382, -86, 4);200;ר;159328;(3, 13, 25, 76, 159328);42059;(3, 13, 25, 21, 42059);צרעת;2;21;וראה אתה הכהן והנה נהפך שער לבן בבהרת ומראה עמק מן העור צרעת הוא במכוה פרחה וטמא אתו הכהן נגע צרעת הוא
(201382, -86, 4);50;ן;159414;(3, 13, 27, 9, 159414);42080;(3, 13, 27, 2, 42080);הכהן;4;2;וראהו הכהן ביום השביעי אם פשה תפשה בעור וטמא הכהן אתו נגע צרעת הוא
(201382, -86, 4);5;ה;159500;(3, 13, 28, 42, 159500);42103;(3, 13, 28, 11, 42103);המכוה;5;11;ואם תחתיה תעמד הבהרת לא פשתה בעור והוא כהה שאת המכוה הוא וטהרו הכהן כי צרבת המכוה הוא
(201382, -86, 4);70;ע;159586;(3, 13, 30, 30, 159586);42129;(3, 13, 30, 9, 42129);העור;2;9;וראה הכהן את הנגע והנה מראהו עמק מן העור ובו שער צהב דק וטמא אתו הכהן נתק הוא צרעת הראש או הזקן הוא
(201382, -86, 4);70;ע;159672;(3, 13, 31, 39, 159672);42155;(3, 13, 31, 12, 42155);העור;2;12;וכי יראה הכהן את נגע הנתק והנה אין מראהו עמק מן העור ושער שחר אין בו והסגיר הכהן את נגע הנתק שבעת ימים
(201382, -86, 4);6;ו;159758;(3, 13, 32, 45, 159758);42179;(3, 13, 32, 13, 42179);בו;2;13;וראה הכהן את הנגע ביום השביעי והנה לא פשה הנתק ולא היה בו שער צהב ומראה הנתק אין עמק מן העור
(201382, -86, 4);50;נ;159844;(3, 13, 34, 12, 159844);42203;(3, 13, 34, 4, 42203);הנתק;2;4;וראה הכהן את הנתק ביום השביעי והנה לא פשה הנתק בעור ומראהו איננו עמק מן העור וטהר אתו הכהן וכבס בגדיו וטהר
(201382, -86, 4);400;ת;159930;(3, 13, 35, 13, 159930);42225;(3, 13, 35, 4, 42225);הנתק;3;4;ואם פשה יפשה הנתק בעור אחרי טהרתו
(201382, -86, 4);90;צ;160016;(3, 13, 37, 24, 160016);42248;(3, 13, 37, 7, 42248);צמח;1;7;ואם בעיניו עמד הנתק ושער שחר צמח בו נרפא הנתק טהור הוא וטהרו הכהן
(201382, -86, 4);200;ר;160102;(3, 13, 39, 23, 160102);42271;(3, 13, 39, 6, 42271);בהרת;3;6;וראה הכהן והנה בעור בשרם בהרת כהות לבנת בהק הוא פרח בעור טהור הוא
(201382, -86, 4);5;ה;160188;(3, 13, 41, 30, 160188);42296;(3, 13, 41, 9, 42296);הוא;1;9;ואם מפאת פניו ימרט ראשו גבח הוא טהור הוא
(201382, -86, 4);40;מ;160274;(3, 13, 43, 29, 160274);42318;(3, 13, 43, 8, 42318);אדמדמת;3;8;וראה אתו הכהן והנה שאת הנגע לבנה אדמדמת בקרחתו או בגבחתו כמראה צרעת עור בשר
(201382, -86, 4);2;ב;160360;(3, 13, 45, 16, 160360);42340;(3, 13, 45, 5, 42340);בגדיו;1;5;והצרוע אשר בו הנגע בגדיו יהיו פרמים וראשו יהיה פרוע ועל שפם יעטה וטמא טמא יקרא
(201382, -86, 4);5;ה;160446;(3, 13, 46, 39, 160446);42363;(3, 13, 46, 12, 42363);למחנה;5;12;כל ימי אשר הנגע בו יטמא טמא הוא בדד ישב מחוץ למחנה מושבו
(201382, -86, 4);6;ו;160532;(3, 13, 49, 1, 160532);42388;(3, 13, 49, 1, 42388);והיה;1;1;והיה הנגע ירקרק או אדמדם בבגד או בעור או בשתי או בערב או בכל כלי עור נגע צרעת הוא והראה את הכהן
(201382, -86, 4);3;ג;160618;(3, 13, 50, 13, 160618);42413;(3, 13, 50, 4, 42413);הנגע;3;4;וראה הכהן את הנגע והסגיר את הנגע שבעת ימים
(201382, -86, 4);200;ר;160704;(3, 13, 51, 65, 160704);42437;(3, 13, 51, 19, 42437);העור;4;19;וראה את הנגע ביום השביעי כי פשה הנגע בבגד או בשתי או בערב או בעור לכל אשר יעשה העור למלאכה צרעת ממארת הנגע טמא הוא
(201382, -86, 4);5;ה;160790;(3, 13, 52, 61, 160790);42464;(3, 13, 52, 21, 42464);הנגע;1;21;ושרף את הבגד או את השתי או את הערב בצמר או בפשתים או את כל כלי העור אשר יהיה בו הנגע כי צרעת ממארת הוא באש תשרף
(201382, -86, 4);2;ב;160876;(3, 13, 54, 11, 160876);42489;(3, 13, 54, 3, 42489);וכבסו;3;3;וצוה הכהן וכבסו את אשר בו הנגע והסגירו שבעת ימים שנית
(201382, -86, 4);1;א;160962;(3, 13, 55, 54, 160962);42513;(3, 13, 55, 16, 42513);טמא;3;16;וראה הכהן אחרי הכבס את הנגע והנה לא הפך הנגע את עינו והנגע לא פשה טמא הוא באש תשרפנו פחתת הוא בקרחתו או בגבחתו
(201382, -86, 4);200;ר;161048;(3, 13, 56, 53, 161048);42537;(3, 13, 56, 16, 42537);העור;4;16;ואם ראה הכהן והנה כהה הנגע אחרי הכבס אתו וקרע אתו מן הבגד או מן העור או מן השתי או מן הערב
(201382, -86, 4);1;א;161134;(3, 13, 58, 6, 161134);42565;(3, 13, 58, 2, 42565);או;1;2;והבגד או השתי או הערב או כל כלי העור אשר תכבס וסר מהם הנגע וכבס שנית וטהר
(201382, -86, 4);10;י;161220;(3, 13, 59, 35, 161220);42590;(3, 13, 59, 10, 42590);השתי;4;10;זאת תורת נגע צרעת בגד הצמר או הפשתים או השתי או הערב או כל כלי עור לטהרו או לטמאו
(201382, -86, 4);1;א;161306;(3, 14, 3, 4, 161306);42614;(3, 14, 3, 1, 42614);ויצא;4;1;ויצא הכהן אל מחוץ למחנה וראה הכהן והנה נרפא נגע הצרעת מן הצרוע
(201382, -86, 4);7;ז;161392;(3, 14, 4, 40, 161392);42636;(3, 14, 4, 10, 42636);ארז;3;10;וצוה הכהן ולקח למטהר שתי צפרים חיות טהרות ועץ ארז ושני תולעת ואזב
(201382, -86, 4);400;ת;161478;(3, 14, 6, 33, 161478);42662;(3, 14, 6, 11, 42662);התולעת;2;11;את הצפר החיה יקח אתה ואת עץ הארז ואת שני התולעת ואת האזב וטבל אותם ואת הצפר החיה בדם הצפר השחטה על המים החיים
(201382, -86, 4);300;ש;161564;(3, 14, 7, 33, 161564);42684;(3, 14, 7, 9, 42684);ושלח;2;9;והזה על המטהר מן הצרעת שבע פעמים וטהרו ושלח את הצפר החיה על פני השדה
(201382, -86, 4);1;א;161650;(3, 14, 8, 65, 161650);42708;(3, 14, 8, 18, 42708);לאהלו;2;18;וכבס המטהר את בגדיו וגלח את כל שערו ורחץ במים וטהר ואחר יבוא אל המחנה וישב מחוץ לאהלו שבעת ימים
(201382, -86, 4);6;ו;161736;(3, 14, 9, 75, 161736);42732;(3, 14, 9, 22, 42732);ורחץ;1;22;והיה ביום השביעי יגלח את כל שערו את ראשו ואת זקנו ואת גבת עיניו ואת כל שערו יגלח וכבס את בגדיו ורחץ את בשרו במים וטהר
(201382, -86, 4);5;ה;161822;(3, 14, 10, 69, 161822);42752;(3, 14, 10, 16, 42752);בלולה;5;16;וביום השמיני יקח שני כבשים תמימם וכבשה אחת בת שנתה תמימה ושלשה עשרנים סלת מנחה בלולה בשמן ולג אחד שמן
(201382, -86, 4);1;א;161908;(3, 14, 12, 25, 161908);42775;(3, 14, 12, 7, 42775);אתו;1;7;ולקח הכהן את הכבש האחד והקריב אתו לאשם ואת לג השמן והניף אתם תנופה לפני יהוה
(201382, -86, 4);9;ט;161994;(3, 14, 13, 50, 161994);42798;(3, 14, 13, 14, 42798);כחטאת;3;14;ושחט את הכבש במקום אשר ישחט את החטאת ואת העלה במקום הקדש כי כחטאת האשם הוא לכהן קדש קדשים הוא
(201382, -86, 4);2;ב;162080;(3, 14, 14, 62, 162080);42821;(3, 14, 14, 17, 42821);בהן;1;17;ולקח הכהן מדם האשם ונתן הכהן על תנוך אזן המטהר הימנית ועל בהן ידו הימנית ועל בהן רגלו הימנית
(201382, -86, 4);30;ל;162166;(3, 14, 16, 40, 162166);42843;(3, 14, 16, 11, 42843);השמאלית;5;11;וטבל הכהן את אצבעו הימנית מן השמן אשר על כפו השמאלית והזה מן השמן באצבעו שבע פעמים לפני יהוה
(201382, -86, 4);4;ד;162252;(3, 14, 17, 52, 162252);42866;(3, 14, 17, 15, 42866);ידו;2;15;ומיתר השמן אשר על כפו יתן הכהן על תנוך אזן המטהר הימנית ועל בהן ידו הימנית ועל בהן רגלו הימנית על דם האשם
(201382, -86, 4);6;ו;162338;(3, 14, 19, 1, 162338);42890;(3, 14, 19, 1, 42890);ועשה;1;1;ועשה הכהן את החטאת וכפר על המטהר מטמאתו ואחר ישחט את העלה
(201382, -86, 4);50;ן;162424;(3, 14, 20, 41, 162424);42911;(3, 14, 20, 10, 42911);הכהן;4;10;והעלה הכהן את העלה ואת המנחה המזבחה וכפר עליו הכהן וטהר
(201382, -86, 4);400;ת;162510;(3, 14, 22, 5, 162510);42935;(3, 14, 22, 2, 42935);תרים;1;2;ושתי תרים או שני בני יונה אשר תשיג ידו והיה אחד חטאת והאחד עלה
(201382, -86, 4);4;ד;162596;(3, 14, 23, 42, 162596);42958;(3, 14, 23, 11, 42958);מועד;4;11;והביא אתם ביום השמיני לטהרתו אל הכהן אל פתח אהל מועד לפני יהוה
(201382, -86, 4);300;ש;162682;(3, 14, 25, 27, 162682);42982;(3, 14, 25, 8, 42982);האשם;3;8;ושחט את כבש האשם ולקח הכהן מדם האשם ונתן על תנוך אזן המטהר הימנית ועל בהן ידו הימנית ועל בהן רגלו הימנית
(201382, -86, 4);6;ו;162768;(3, 14, 27, 1, 162768);43005;(3, 14, 27, 1, 43005);והזה;1;1;והזה הכהן באצבעו הימנית מן השמן אשר על כפו השמאלית שבע פעמים לפני יהוה
(201382, -86, 4);7;ז;162854;(3, 14, 28, 30, 162854);43028;(3, 14, 28, 10, 43028);אזן;2;10;ונתן הכהן מן השמן אשר על כפו על תנוך אזן המטהר הימנית ועל בהן ידו הימנית ועל בהן רגלו הימנית על מקום דם האשם
(201382, -86, 4);300;ש;162940;(3, 14, 29, 31, 162940);43052;(3, 14, 29, 10, 43052);ראש;3;10;והנותר מן השמן אשר על כף הכהן יתן על ראש המטהר לכפר עליו לפני יהוה
(201382, -86, 4);400;ת;163026;(3, 14, 31, 25, 163026);43077;(3, 14, 31, 8, 43077);ואת;3;8;את אשר תשיג ידו את האחד חטאת ואת האחד עלה על המנחה וכפר הכהן על המטהר לפני יהוה
(201382, -86, 4);40;מ;163112;(3, 14, 33, 12, 163112);43102;(3, 14, 33, 4, 43102);משה;1;4;וידבר יהוה אל משה ואל אהרן לאמר
(201382, -86, 4);10;י;163198;(3, 14, 35, 16, 163198);43126;(3, 14, 35, 5, 43126);והגיד;4;5;ובא אשר לו הבית והגיד לכהן לאמר כנגע נראה לי בבית
(201382, -86, 4);10;י;163284;(3, 14, 36, 63, 163284);43151;(3, 14, 36, 19, 43151);יבא;1;19;וצוה הכהן ופנו את הבית בטרם יבא הכהן לראות את הנגע ולא יטמא כל אשר בבית ואחר כן יבא הכהן לראות את הבית
(201382, -86, 4);5;ה;163370;(3, 14, 38, 5, 163370);43172;(3, 14, 38, 2, 43172);הכהן;1;2;ויצא הכהן מן הבית אל פתח הבית והסגיר את הבית שבעת ימים
(201382, -86, 4);5;ה;163456;(3, 14, 40, 7, 163456);43194;(3, 14, 40, 2, 43194);הכהן;3;2;וצוה הכהן וחלצו את האבנים אשר בהן הנגע והשליכו אתהן אל מחוץ לעיר אל מקום טמא
(201382, -86, 4);300;ש;163542;(3, 14, 41, 32, 163542);43217;(3, 14, 41, 9, 43217);אשר;2;9;ואת הבית יקצע מבית סביב ושפכו את העפר אשר הקצו אל מחוץ לעיר אל מקום טמא
(201382, -86, 4);70;ע;163628;(3, 14, 43, 11, 163628);43240;(3, 14, 43, 3, 43240);הנגע;4;3;ואם ישוב הנגע ופרח בבית אחר חלץ את האבנים ואחרי הקצות את הבית ואחרי הטוח
(201382, -86, 4);2;ב;163714;(3, 14, 44, 39, 163714);43263;(3, 14, 44, 11, 43263);בבית;1;11;ובא הכהן וראה והנה פשה הנגע בבית צרעת ממארת הוא בבית טמא הוא
(201382, -86, 4);5;ה;163800;(3, 14, 46, 16, 163800);43289;(3, 14, 46, 6, 43289);הסגיר;1;6;והבא אל הבית כל ימי הסגיר אתו יטמא עד הערב
(201382, -86, 4);70;ע;163886;(3, 14, 48, 29, 163886);43312;(3, 14, 48, 9, 43312);הנגע;4;9;ואם בא יבא הכהן וראה והנה לא פשה הנגע בבית אחרי הטח את הבית וטהר הכהן את הבית כי נרפא הנגע
(201382, -86, 4);9;ט;163972;(3, 14, 50, 4, 163972);43336;(3, 14, 50, 1, 43336);ושחט;4;1;ושחט את הצפר האחת אל כלי חרש על מים חיים
(201382, -86, 4);8;ח;164058;(3, 14, 51, 59, 164058);43362;(3, 14, 51, 17, 43362);השחוטה;3;17;ולקח את עץ הארז ואת האזב ואת שני התולעת ואת הצפר החיה וטבל אתם בדם הצפר השחוטה ובמים החיים והזה אל הבית שבע פעמים
(201382, -86, 4);10;י;164144;(3, 14, 52, 55, 164144);43382;(3, 14, 52, 13, 43382);ובשני;5;13;וחטא את הבית בדם הצפור ובמים החיים ובצפר החיה ובעץ הארז ובאזב ובשני התולעת
(201382, -86, 4);3;ג;164230;(3, 14, 55, 9, 164230);43405;(3, 14, 55, 2, 43405);הבגד;3;2;ולצרעת הבגד ולבית
(201382, -86, 4);6;ו;164316;(3, 15, 2, 4, 164316);43425;(3, 15, 2, 1, 43425);דברו;4;1;דברו אל בני ישראל ואמרתם אלהם איש איש כי יהיה זב מבשרו זובו טמא הוא
(201382, -86, 4);40;ם;164402;(3, 15, 3, 37, 164402);43449;(3, 15, 3, 10, 43449);החתים;5;10;וזאת תהיה טמאתו בזובו רר בשרו את זובו או החתים בשרו מזובו טמאתו הוא
(201382, -86, 4);4;ד;164488;(3, 15, 5, 23, 164488);43472;(3, 15, 5, 6, 43472);בגדיו;3;6;ואיש אשר יגע במשכבו יכבס בגדיו ורחץ במים וטמא עד הערב
(201382, -86, 4);2;ב;164574;(3, 15, 7, 15, 164574);43495;(3, 15, 7, 4, 43495);יכבס;3;4;והנגע בבשר הזב יכבס בגדיו ורחץ במים וטמא עד הערב
(201382, -86, 4);7;ז;164660;(3, 15, 9, 21, 164660);43518;(3, 15, 9, 6, 43518);הזב;2;6;וכל המרכב אשר ירכב עליו הזב יטמא
(201382, -86, 4);5;ה;164746;(3, 15, 11, 12, 164746);43542;(3, 15, 11, 5, 43542);הזב;1;5;וכל אשר יגע בו הזב וידיו לא שטף במים וכבס בגדיו ורחץ במים וטמא עד הערב
(201382, -86, 4);9;ט;164832;(3, 15, 13, 5, 164832);43567;(3, 15, 13, 2, 43567);יטהר;2;2;וכי יטהר הזב מזובו וספר לו שבעת ימים לטהרתו וכבס בגדיו ורחץ בשרו במים חיים וטהר
(201382, -86, 4);50;נ;164918;(3, 15, 14, 27, 164918);43589;(3, 15, 14, 8, 43589);שני;2;8;וביום השמיני יקח לו שתי תרים או שני בני יונה ובא לפני יהוה אל פתח אהל מועד ונתנם אל הכהן
(201382, -86, 4);5;ה;165004;(3, 15, 15, 44, 165004);43613;(3, 15, 15, 12, 43613);יהוה;2;12;ועשה אתם הכהן אחד חטאת והאחד עלה וכפר עליו הכהן לפני יהוה מזובו
(201382, -86, 4);2;ב;165090;(3, 15, 17, 33, 165090);43638;(3, 15, 17, 10, 43638);וכבס;3;10;וכל בגד וכל עור אשר יהיה עליו שכבת זרע וכבס במים וטמא עד הערב
(201382, -86, 4);5;ה;165176;(3, 15, 19, 27, 165176);43662;(3, 15, 19, 8, 43662);בבשרה;5;8;ואשה כי תהיה זבה דם יהיה זבה בבשרה שבעת ימים תהיה בנדתה וכל הנגע בה יטמא עד הערב
(201382, -86, 4);300;ש;165262;(3, 15, 21, 10, 165262);43686;(3, 15, 21, 3, 43686);במשכבה;3;3;וכל הנגע במשכבה יכבס בגדיו ורחץ במים וטמא עד הערב
(201382, -86, 4);5;ה;165348;(3, 15, 23, 6, 165348);43710;(3, 15, 23, 3, 43710);המשכב;1;3;ואם על המשכב הוא או על הכלי אשר הוא ישבת עליו בנגעו בו יטמא עד הערב
(201382, -86, 4);40;ם;165434;(3, 15, 24, 40, 165434);43734;(3, 15, 24, 11, 43734);ימים;4;11;ואם שכב ישכב איש אתה ותהי נדתה עליו וטמא שבעת ימים וכל המשכב אשר ישכב עליו יטמא
(201382, -86, 4);40;מ;165520;(3, 15, 25, 63, 165520);43760;(3, 15, 25, 20, 43760);כימי;3;20;ואשה כי יזוב זוב דמה ימים רבים בלא עת נדתה או כי תזוב על נדתה כל ימי זוב טמאתה כימי נדתה תהיה טמאה הוא
(201382, -86, 4);1;א;165606;(3, 15, 26, 70, 165606);43784;(3, 15, 26, 20, 43784);כטמאת;4;20;כל המשכב אשר תשכב עליו כל ימי זובה כמשכב נדתה יהיה לה וכל הכלי אשר תשב עליו טמא יהיה כטמאת נדתה
(201382, -86, 4);40;ם;165692;(3, 15, 29, 5, 165692);43806;(3, 15, 29, 1, 43806);וביום;5;1;וביום השמיני תקח לה שתי תרים או שני בני יונה והביאה אותם אל הכהן אל פתח אהל מועד
(201382, -86, 4);5;ה;165778;(3, 15, 30, 28, 165778);43831;(3, 15, 30, 8, 43831);עלה;3;8;ועשה הכהן את האחד חטאת ואת האחד עלה וכפר עליה הכהן לפני יהוה מזוב טמאתה
(201382, -86, 4);1;א;165864;(3, 15, 32, 2, 165864);43852;(3, 15, 32, 1, 43852);זאת;2;1;זאת תורת הזב ואשר תצא ממנו שכבת זרע לטמאה בה
(201382, -86, 4);200;ר;165950;(3, 16, 1, 5, 165950);43874;(3, 16, 1, 1, 43874);וידבר;5;1;וידבר יהוה אל משה אחרי מות שני בני אהרן בקרבתם לפני יהוה וימתו
(201382, -86, 4);5;ה;166036;(3, 16, 2, 41, 166036);43900;(3, 16, 2, 14, 43900);הקדש;1;14;ויאמר יהוה אל משה דבר אל אהרן אחיך ואל יבא בכל עת אל הקדש מבית לפרכת אל פני הכפרת אשר על הארן ולא ימות כי בענן אראה על הכפרת
(201382, -86, 4);6;ו;166122;(3, 16, 3, 31, 166122);43925;(3, 16, 3, 10, 43925);ואיל;1;10;בזאת יבא אהרן אל הקדש בפר בן בקר לחטאת ואיל לעלה
(201382, -86, 4);6;ו;166208;(3, 16, 4, 79, 166208);43948;(3, 16, 4, 22, 43948);בשרו;4;22;כתנת בד קדש ילבש ומכנסי בד יהיו על בשרו ובאבנט בד יחגר ובמצנפת בד יצנף בגדי קדש הם ורחץ במים את בשרו ולבשם
(201382, -86, 4);70;ע;166294;(3, 16, 6, 35, 166294);43971;(3, 16, 6, 10, 43971);ובעד;3;10;והקריב אהרן את פר החטאת אשר לו וכפר בעדו ובעד ביתו
(201382, -86, 4);6;ו;166380;(3, 16, 8, 39, 166380);43993;(3, 16, 8, 10, 43993);וגורל;3;10;ונתן אהרן על שני השעירם גרלות גורל אחד ליהוה וגורל אחד לעזאזל
(201382, -86, 4);70;ע;166466;(3, 16, 10, 29, 166466);44013;(3, 16, 10, 7, 44013);יעמד;2;7;והשעיר אשר עלה עליו הגורל לעזאזל יעמד חי לפני יהוה לכפר עליו לשלח אתו לעזאזל המדברה
(201382, -86, 4);80;פ;166552;(3, 16, 11, 47, 166552);44036;(3, 16, 11, 14, 44036);פר;1;14;והקריב אהרן את פר החטאת אשר לו וכפר בעדו ובעד ביתו ושחט את פר החטאת אשר לו
(201382, -86, 4);400;ת;166638;(3, 16, 13, 6, 166638);44058;(3, 16, 13, 2, 44058);את;2;2;ונתן את הקטרת על האש לפני יהוה וכסה ענן הקטרת את הכפרת אשר על העדות ולא ימות
(201382, -86, 4);4;ד;166724;(3, 16, 14, 32, 166724);44082;(3, 16, 14, 9, 44082);קדמה;2;9;ולקח מדם הפר והזה באצבעו על פני הכפרת קדמה ולפני הכפרת יזה שבע פעמים מן הדם באצבעו
(201382, -86, 4);20;כ;166810;(3, 16, 15, 52, 166810);44106;(3, 16, 15, 16, 44106);כאשר;1;16;ושחט את שעיר החטאת אשר לעם והביא את דמו אל מבית לפרכת ועשה את דמו כאשר עשה לדם הפר והזה אתו על הכפרת ולפני הכפרת
(201382, -86, 4);30;ל;166896;(3, 16, 16, 50, 166896);44127;(3, 16, 16, 12, 44127);לאהל;4;12;וכפר על הקדש מטמאת בני ישראל ומפשעיהם לכל חטאתם וכן יעשה לאהל מועד השכן אתם בתוך טמאתם
(201382, -86, 4);200;ר;166982;(3, 16, 17, 66, 166982);44151;(3, 16, 17, 19, 44151);ישראל;3;19;וכל אדם לא יהיה באהל מועד בבאו לכפר בקדש עד צאתו וכפר בעדו ובעד ביתו ובעד כל קהל ישראל
(201382, -86, 4);1;א;167068;(3, 16, 19, 15, 167068);44174;(3, 16, 19, 5, 44174);באצבעו;2;5;והזה עליו מן הדם באצבעו שבע פעמים וטהרו וקדשו מטמאת בני ישראל
(201382, -86, 4);40;מ;167154;(3, 16, 21, 3, 167154);44195;(3, 16, 21, 1, 44195);וסמך;3;1;וסמך אהרן את שתי ידו על ראש השעיר החי והתודה עליו את כל עונת בני ישראל ואת כל פשעיהם לכל חטאתם ונתן אתם על ראש השעיר ושלח ביד איש עתי המדברה
(201382, -86, 4);70;ע;167240;(3, 16, 21, 89, 167240);44220;(3, 16, 21, 26, 44220);השעיר;3;26;וסמך אהרן את שתי ידו על ראש השעיר החי והתודה עליו את כל עונת בני ישראל ואת כל פשעיהם לכל חטאתם ונתן אתם על ראש השעיר ושלח ביד איש עתי המדברה
(201382, -86, 4);80;פ;167326;(3, 16, 23, 18, 167326);44244;(3, 16, 23, 6, 44244);ופשט;2;6;ובא אהרן אל אהל מועד ופשט את בגדי הבד אשר לבש בבאו אל הקדש והניחם שם
(201382, -86, 4);400;ת;167412;(3, 16, 24, 51, 167412);44268;(3, 16, 24, 14, 44268);ואת;3;14;ורחץ את בשרו במים במקום קדוש ולבש את בגדיו ויצא ועשה את עלתו ואת עלת העם וכפר בעדו ובעד העם
(201382, -86, 4);6;ו;167498;(3, 16, 26, 43, 167498);44290;(3, 16, 26, 11, 44290);ואחרי;1;11;והמשלח את השעיר לעזאזל יכבס בגדיו ורחץ את בשרו במים ואחרי כן יבוא אל המחנה
