(270810, 52, 4);30;ל;155994;(3, 11, 13, 18, 155994);41159;(3, 11, 13, 6, 41159);לא;1;6;ואת אלה תשקצו מן העוף לא יאכלו שקץ הם את הנשר ואת הפרס ואת העזניה
(270810, 52, 4);5;ה;156046;(3, 11, 14, 19, 156046);41173;(3, 11, 14, 5, 41173);למינה;5;5;ואת הדאה ואת האיה למינה
(270810, 52, 4);400;ת;156098;(3, 11, 17, 3, 156098);41188;(3, 11, 17, 1, 41188);ואת;3;1;ואת הכוס ואת השלך ואת הינשוף
(270810, 52, 4);5;ה;156150;(3, 11, 19, 9, 156150);41201;(3, 11, 19, 2, 41201);החסידה;6;2;ואת החסידה האנפה למינה ואת הדוכיפת ואת העטלף
(270810, 52, 4);6;ו;156202;(3, 11, 20, 24, 156202);41215;(3, 11, 20, 8, 41215);הוא;2;8;כל שרץ העוף ההלך על ארבע שקץ הוא לכם
(270810, 52, 4);3;ג;156254;(3, 11, 21, 48, 156254);41231;(3, 11, 21, 15, 41231);לרגליו;3;15;אך את זה תאכלו מכל שרץ העוף ההלך על ארבע אשר לא כרעים ממעל לרגליו לנתר בהן על הארץ
(270810, 52, 4);10;י;156306;(3, 11, 22, 36, 156306);41245;(3, 11, 22, 10, 41245);למינהו;3;10;את אלה מהם תאכלו את הארבה למינו ואת הסלעם למינהו ואת החרגל למינהו ואת החגב למינהו
(270810, 52, 4);30;ל;156358;(3, 11, 23, 22, 156358);41258;(3, 11, 23, 7, 41258);רגלים;3;7;וכל שרץ העוף אשר לו ארבע רגלים שקץ הוא לכם
(270810, 52, 4);50;נ;156410;(3, 11, 25, 9, 156410);41272;(3, 11, 25, 3, 41272);מנבלתם;2;3;וכל הנשא מנבלתם יכבס בגדיו וטמא עד הערב
(270810, 52, 4);10;י;156462;(3, 11, 26, 29, 156462);41285;(3, 11, 26, 8, 41285);איננה;2;8;לכל הבהמה אשר הוא מפרסת פרסה ושסע איננה שסעת וגרה איננה מעלה טמאים הם לכם כל הנגע בהם יטמא
(270810, 52, 4);30;ל;156514;(3, 11, 27, 9, 156514);41299;(3, 11, 27, 3, 41299);על;2;3;וכל הולך על כפיו בכל החיה ההלכת על ארבע טמאים הם לכם כל הנגע בנבלתם יטמא עד הערב
(270810, 52, 4);70;ע;156566;(3, 11, 27, 61, 156566);41314;(3, 11, 27, 18, 41314);הערב;2;18;וכל הולך על כפיו בכל החיה ההלכת על ארבע טמאים הם לכם כל הנגע בנבלתם יטמא עד הערב
(270810, 52, 4);9;ט;156618;(3, 11, 29, 8, 156618);41328;(3, 11, 29, 3, 41328);הטמא;2;3;וזה לכם הטמא בשרץ השרץ על הארץ החלד והעכבר והצב למינהו
(270810, 52, 4);5;ה;156670;(3, 11, 30, 16, 156670);41339;(3, 11, 30, 3, 41339);והלטאה;6;3;והאנקה והכח והלטאה והחמט והתנשמת
(270810, 52, 4);70;ע;156722;(3, 11, 31, 40, 156722);41353;(3, 11, 31, 12, 41353);הערב;2;12;אלה הטמאים לכם בכל השרץ כל הנגע בהם במתם יטמא עד הערב
(270810, 52, 4);30;ל;156774;(3, 11, 32, 50, 156774);41371;(3, 11, 32, 18, 41371);כלי;2;18;וכל אשר יפל עליו מהם במתם יטמא מכל כלי עץ או בגד או עור או שק כל כלי אשר יעשה מלאכה בהם במים יובא וטמא עד הערב וטהר
(270810, 52, 4);80;פ;156826;(3, 11, 33, 14, 156826);41386;(3, 11, 33, 5, 41386);יפל;2;5;וכל כלי חרש אשר יפל מהם אל תוכו כל אשר בתוכו יטמא ואתו תשברו
(270810, 52, 4);2;ב;156878;(3, 11, 34, 19, 156878);41401;(3, 11, 34, 6, 41401);יבוא;2;6;מכל האכל אשר יאכל אשר יבוא עליו מים יטמא וכל משקה אשר ישתה בכל כלי יטמא
(270810, 52, 4);40;ם;156930;(3, 11, 35, 15, 156930);41415;(3, 11, 35, 4, 41415);מנבלתם;6;4;וכל אשר יפל מנבלתם עליו יטמא תנור וכירים יתץ טמאים הם וטמאים יהיו לכם
(270810, 52, 4);40;מ;156982;(3, 11, 36, 11, 156982);41429;(3, 11, 36, 4, 41429);מקוה;1;4;אך מעין ובור מקוה מים יהיה טהור ונגע בנבלתם יטמא
(270810, 52, 4);1;א;157034;(3, 11, 37, 24, 157034);41443;(3, 11, 37, 8, 41443);אשר;1;8;וכי יפל מנבלתם על כל זרע זרוע אשר יזרע טהור הוא
(270810, 52, 4);20;כ;157086;(3, 11, 39, 2, 157086);41458;(3, 11, 39, 1, 41458);וכי;2;1;וכי ימות מן הבהמה אשר היא לכם לאכלה הנגע בנבלתה יטמא עד הערב
(270810, 52, 4);40;מ;157138;(3, 11, 40, 6, 157138);41472;(3, 11, 40, 2, 41472);מנבלתה;1;2;והאכל מנבלתה יכבס בגדיו וטמא עד הערב והנשא את נבלתה יכבס בגדיו וטמא עד הערב
(270810, 52, 4);5;ה;157190;(3, 11, 40, 58, 157190);41485;(3, 11, 40, 15, 41485);הערב;1;15;והאכל מנבלתה יכבס בגדיו וטמא עד הערב והנשא את נבלתה יכבס בגדיו וטמא עד הערב
(270810, 52, 4);70;ע;157242;(3, 11, 42, 20, 157242);41501;(3, 11, 42, 7, 41501);על;1;7;כל הולך על גחון וכל הולך על ארבע עד כל מרבה רגלים לכל השרץ השרץ על הארץ לא תאכלום כי שקץ הם
(270810, 52, 4);30;ל;157294;(3, 11, 43, 2, 157294);41517;(3, 11, 43, 1, 41517);אל;2;1;אל תשקצו את נפשתיכם בכל השרץ השרץ ולא תטמאו בהם ונטמתם בם
(270810, 52, 4);6;ו;157346;(3, 11, 44, 8, 157346);41531;(3, 11, 44, 3, 41531);יהוה;3;3;כי אני יהוה אלהיכם והתקדשתם והייתם קדשים כי קדוש אני ולא תטמאו את נפשתיכם בכל השרץ הרמש על הארץ
(270810, 52, 4);40;ם;157398;(3, 11, 44, 60, 157398);41542;(3, 11, 44, 14, 41542);נפשתיכם;7;14;כי אני יהוה אלהיכם והתקדשתם והייתם קדשים כי קדוש אני ולא תטמאו את נפשתיכם בכל השרץ הרמש על הארץ
(270810, 52, 4);30;ל;157450;(3, 11, 45, 35, 157450);41557;(3, 11, 45, 10, 41557);לאלהים;1;10;כי אני יהוה המעלה אתכם מארץ מצרים להית לכם לאלהים והייתם קדשים כי קדוש אני
(270810, 52, 4);5;ה;157502;(3, 11, 46, 27, 157502);41569;(3, 11, 46, 7, 41569);החיה;4;7;זאת תורת הבהמה והעוף וכל נפש החיה הרמשת במים ולכל נפש השרצת על הארץ
(270810, 52, 4);50;ן;157554;(3, 11, 47, 25, 157554);41582;(3, 11, 47, 6, 41582);ובין;4;6;להבדיל בין הטמא ובין הטהר ובין החיה הנאכלת ובין החיה אשר לא תאכל
(270810, 52, 4);50;נ;157606;(3, 12, 2, 7, 157606);41597;(3, 12, 2, 3, 41597);בני;2;3;דבר אל בני ישראל לאמר אשה כי תזריע וילדה זכר וטמאה שבעת ימים כימי נדת דותה תטמא
(270810, 52, 4);5;ה;157658;(3, 12, 2, 59, 157658);41610;(3, 12, 2, 16, 41610);דותה;4;16;דבר אל בני ישראל לאמר אשה כי תזריע וילדה זכר וטמאה שבעת ימים כימי נדת דותה תטמא
(270810, 52, 4);10;י;157710;(3, 12, 4, 25, 157710);41622;(3, 12, 4, 6, 41622);בדמי;4;6;ושלשים יום ושלשת ימים תשב בדמי טהרה בכל קדש לא תגע ואל המקדש לא תבא עד מלאת ימי טהרה
(270810, 52, 4);6;ו;157762;(3, 12, 5, 11, 157762);41639;(3, 12, 5, 4, 41639);וטמאה;1;4;ואם נקבה תלד וטמאה שבעים כנדתה וששים יום וששת ימים תשב על דמי טהרה
(270810, 52, 4);9;ט;157814;(3, 12, 6, 10, 157814);41652;(3, 12, 6, 3, 41652);טהרה;1;3;ובמלאת ימי טהרה לבן או לבת תביא כבש בן שנתו לעלה ובן יונה או תר לחטאת אל פתח אהל מועד אל הכהן
(270810, 52, 4);30;ל;157866;(3, 12, 6, 62, 157866);41668;(3, 12, 6, 19, 41668);אהל;3;19;ובמלאת ימי טהרה לבן או לבת תביא כבש בן שנתו לעלה ובן יונה או תר לחטאת אל פתח אהל מועד אל הכהן
(270810, 52, 4);200;ר;157918;(3, 12, 7, 42, 157918);41681;(3, 12, 7, 10, 41681);תורת;3;10;והקריבו לפני יהוה וכפר עליה וטהרה ממקר דמיה זאת תורת הילדת לזכר או לנקבה
(270810, 52, 4);50;נ;157970;(3, 12, 8, 35, 157970);41697;(3, 12, 8, 12, 41697);בני;2;12;ואם לא תמצא ידה די שה ולקחה שתי תרים או שני בני יונה אחד לעלה ואחד לחטאת וכפר עליה הכהן וטהרה
(270810, 52, 4);5;ה;158022;(3, 13, 1, 14, 158022);41710;(3, 13, 1, 4, 41710);משה;3;4;וידבר יהוה אל משה ואל אהרן לאמר
(270810, 52, 4);2;ב;158074;(3, 13, 2, 41, 158074);41726;(3, 13, 2, 13, 41726);בשרו;1;13;אדם כי יהיה בעור בשרו שאת או ספחת או בהרת והיה בעור בשרו לנגע צרעת והובא אל אהרן הכהן או אל אחד מבניו הכהנים
(270810, 52, 4);50;ן;158126;(3, 13, 3, 8, 158126);41739;(3, 13, 3, 2, 41739);הכהן;4;2;וראה הכהן את הנגע בעור הבשר ושער בנגע הפך לבן ומראה הנגע עמק מעור בשרו נגע צרעת הוא וראהו הכהן וטמא אתו
(270810, 52, 4);90;צ;158178;(3, 13, 3, 60, 158178);41754;(3, 13, 3, 17, 41754);צרעת;1;17;וראה הכהן את הנגע בעור הבשר ושער בנגע הפך לבן ומראה הנגע עמק מעור בשרו נגע צרעת הוא וראהו הכהן וטמא אתו
(270810, 52, 4);40;מ;158230;(3, 13, 4, 30, 158230);41768;(3, 13, 4, 9, 41768);מראה;1;9;ואם בהרת לבנה הוא בעור בשרו ועמק אין מראה מן העור ושערה לא הפך לבן והסגיר הכהן את הנגע שבעת ימים
(270810, 52, 4);5;ה;158282;(3, 13, 5, 6, 158282);41782;(3, 13, 5, 2, 41782);הכהן;1;2;וראהו הכהן ביום השביעי והנה הנגע עמד בעיניו לא פשה הנגע בעור והסגירו הכהן שבעת ימים שנית
(270810, 52, 4);20;כ;158334;(3, 13, 5, 58, 158334);41794;(3, 13, 5, 14, 41794);הכהן;2;14;וראהו הכהן ביום השביעי והנה הנגע עמד בעיניו לא פשה הנגע בעור והסגירו הכהן שבעת ימים שנית
(270810, 52, 4);30;ל;158386;(3, 13, 6, 38, 158386);41807;(3, 13, 6, 10, 41807);ולא;2;10;וראה הכהן אתו ביום השביעי שנית והנה כהה הנגע ולא פשה הנגע בעור וטהרו הכהן מספחת הוא וכבס בגדיו וטהר
(270810, 52, 4);5;ה;158438;(3, 13, 7, 10, 158438);41820;(3, 13, 7, 3, 41820);תפשה;4;3;ואם פשה תפשה המספחת בעור אחרי הראתו אל הכהן לטהרתו ונראה שנית אל הכהן
(270810, 52, 4);20;כ;158490;(3, 13, 8, 6, 158490);41833;(3, 13, 8, 2, 41833);הכהן;2;2;וראה הכהן והנה פשתה המספחת בעור וטמאו הכהן צרעת הוא
(270810, 52, 4);4;ד;158542;(3, 13, 9, 16, 158542);41846;(3, 13, 9, 5, 41846);באדם;3;5;נגע צרעת כי תהיה באדם והובא אל הכהן
(270810, 52, 4);8;ח;158594;(3, 13, 10, 40, 158594);41860;(3, 13, 10, 11, 41860);ומחית;3;11;וראה הכהן והנה שאת לבנה בעור והיא הפכה שער לבן ומחית בשר חי בשאת
(270810, 52, 4);40;מ;158646;(3, 13, 11, 41, 158646);41874;(3, 13, 11, 11, 41874);טמא;2;11;צרעת נושנת הוא בעור בשרו וטמאו הכהן לא יסגרנו כי טמא הוא
(270810, 52, 4);70;ע;158698;(3, 13, 12, 48, 158698);41888;(3, 13, 12, 13, 41888);ועד;2;13;ואם פרוח תפרח הצרעת בעור וכסתה הצרעת את כל עור הנגע מראשו ועד רגליו לכל מראה עיני הכהן
(270810, 52, 4);9;ט;158750;(3, 13, 13, 31, 158750);41902;(3, 13, 13, 9, 41902);וטהר;2;9;וראה הכהן והנה כסתה הצרעת את כל בשרו וטהר את הנגע כלו הפך לבן טהור הוא
(270810, 52, 4);5;ה;158802;(3, 13, 15, 7, 158802);41917;(3, 13, 15, 2, 41917);הכהן;3;2;וראה הכהן את הבשר החי וטמאו הבשר החי טמא הוא צרעת הוא
(270810, 52, 4);50;נ;158854;(3, 13, 16, 17, 158854);41933;(3, 13, 16, 6, 41933);ונהפך;2;6;או כי ישוב הבשר החי ונהפך ללבן ובא אל הכהן
(270810, 52, 4);5;ה;158906;(3, 13, 17, 36, 158906);41947;(3, 13, 17, 10, 41947);הנגע;1;10;וראהו הכהן והנה נהפך הנגע ללבן וטהר הכהן את הנגע טהור הוא
(270810, 52, 4);400;ת;158958;(3, 13, 19, 17, 158958);41960;(3, 13, 19, 4, 41960);שאת;3;4;והיה במקום השחין שאת לבנה או בהרת לבנה אדמדמת ונראה אל הכהן
(270810, 52, 4);50;ן;159010;(3, 13, 20, 21, 159010);41974;(3, 13, 20, 6, 41974);מן;2;6;וראה הכהן והנה מראה שפל מן העור ושערה הפך לבן וטמאו הכהן נגע צרעת הוא בשחין פרחה
(270810, 52, 4);5;ה;159062;(3, 13, 21, 9, 159062);41988;(3, 13, 21, 3, 41988);הכהן;1;3;ואם יראנה הכהן והנה אין בה שער לבן ושפלה איננה מן העור והיא כהה והסגירו הכהן שבעת ימים
(270810, 52, 4);50;ן;159114;(3, 13, 21, 61, 159114);42001;(3, 13, 21, 16, 42001);הכהן;4;16;ואם יראנה הכהן והנה אין בה שער לבן ושפלה איננה מן העור והיא כהה והסגירו הכהן שבעת ימים
(270810, 52, 4);5;ה;159166;(3, 13, 23, 13, 159166);42016;(3, 13, 23, 4, 42016);הבהרת;1;4;ואם תחתיה תעמד הבהרת לא פשתה צרבת השחין הוא וטהרו הכהן
(270810, 52, 4);300;ש;159218;(3, 13, 24, 21, 159218);42030;(3, 13, 24, 7, 42030);אש;2;7;או בשר כי יהיה בערו מכות אש והיתה מחית המכוה בהרת לבנה אדמדמת או לבנה
(270810, 52, 4);80;פ;159270;(3, 13, 25, 18, 159270);42043;(3, 13, 25, 5, 42043);נהפך;3;5;וראה אתה הכהן והנה נהפך שער לבן בבהרת ומראה עמק מן העור צרעת הוא במכוה פרחה וטמא אתו הכהן נגע צרעת הוא
(270810, 52, 4);5;ה;159322;(3, 13, 25, 70, 159322);42057;(3, 13, 25, 19, 42057);הכהן;3;19;וראה אתה הכהן והנה נהפך שער לבן בבהרת ומראה עמק מן העור צרעת הוא במכוה פרחה וטמא אתו הכהן נגע צרעת הוא
(270810, 52, 4);40;מ;159374;(3, 13, 26, 41, 159374);42071;(3, 13, 26, 11, 42071);מן;1;11;ואם יראנה הכהן והנה אין בבהרת שער לבן ושפלה איננה מן העור והוא כהה והסגירו הכהן שבעת ימים
(270810, 52, 4);40;ם;159426;(3, 13, 27, 21, 159426);42083;(3, 13, 27, 5, 42083);אם;2;5;וראהו הכהן ביום השביעי אם פשה תפשה בעור וטמא הכהן אתו נגע צרעת הוא
(270810, 52, 4);80;פ;159478;(3, 13, 28, 20, 159478);42098;(3, 13, 28, 6, 42098);פשתה;1;6;ואם תחתיה תעמד הבהרת לא פשתה בעור והוא כהה שאת המכוה הוא וטהרו הכהן כי צרבת המכוה הוא
(270810, 52, 4);300;ש;159530;(3, 13, 29, 4, 159530);42111;(3, 13, 29, 1, 42111);ואיש;4;1;ואיש או אשה כי יהיה בו נגע בראש או בזקן
(270810, 52, 4);100;ק;159582;(3, 13, 30, 26, 159582);42127;(3, 13, 30, 7, 42127);עמק;3;7;וראה הכהן את הנגע והנה מראהו עמק מן העור ובו שער צהב דק וטמא אתו הכהן נתק הוא צרעת הראש או הזקן הוא
(270810, 52, 4);6;ו;159634;(3, 13, 31, 1, 159634);42144;(3, 13, 31, 1, 42144);וכי;1;1;וכי יראה הכהן את נגע הנתק והנה אין מראהו עמק מן העור ושער שחר אין בו והסגיר הכהן את נגע הנתק שבעת ימים
(270810, 52, 4);6;ו;159686;(3, 13, 31, 53, 159686);42159;(3, 13, 31, 16, 42159);בו;2;16;וכי יראה הכהן את נגע הנתק והנה אין מראהו עמק מן העור ושער שחר אין בו והסגיר הכהן את נגע הנתק שבעת ימים
(270810, 52, 4);6;ו;159738;(3, 13, 32, 25, 159738);42173;(3, 13, 32, 7, 42173);והנה;1;7;וראה הכהן את הנגע ביום השביעי והנה לא פשה הנתק ולא היה בו שער צהב ומראה הנתק אין עמק מן העור
(270810, 52, 4);30;ל;159790;(3, 13, 33, 5, 159790);42188;(3, 13, 33, 1, 42188);והתגלח;5;1;והתגלח ואת הנתק לא יגלח והסגיר הכהן את הנתק שבעת ימים שנית
(270810, 52, 4);400;ת;159842;(3, 13, 34, 10, 159842);42202;(3, 13, 34, 3, 42202);את;2;3;וראה הכהן את הנתק ביום השביעי והנה לא פשה הנתק בעור ומראהו איננו עמק מן העור וטהר אתו הכהן וכבס בגדיו וטהר
(270810, 52, 4);6;ו;159894;(3, 13, 34, 62, 159894);42216;(3, 13, 34, 17, 42216);וטהר;1;17;וראה הכהן את הנתק ביום השביעי והנה לא פשה הנתק בעור ומראהו איננו עמק מן העור וטהר אתו הכהן וכבס בגדיו וטהר
(270810, 52, 4);200;ר;159946;(3, 13, 36, 2, 159946);42229;(3, 13, 36, 1, 42229);וראהו;2;1;וראהו הכהן והנה פשה הנתק בעור לא יבקר הכהן לשער הצהב טמא הוא
(270810, 52, 4);10;י;159998;(3, 13, 37, 6, 159998);42243;(3, 13, 37, 2, 42243);בעיניו;3;2;ואם בעיניו עמד הנתק ושער שחר צמח בו נרפא הנתק טהור הוא וטהרו הכהן
(270810, 52, 4);6;ו;160050;(3, 13, 38, 6, 160050);42257;(3, 13, 38, 2, 42257);או;2;2;ואיש או אשה כי יהיה בעור בשרם בהרת בהרת לבנת
(270810, 52, 4);200;ר;160102;(3, 13, 39, 23, 160102);42271;(3, 13, 39, 6, 42271);בהרת;3;6;וראה הכהן והנה בעור בשרם בהרת כהות לבנת בהק הוא פרח בעור טהור הוא
(270810, 52, 4);6;ו;160154;(3, 13, 40, 23, 160154);42286;(3, 13, 40, 7, 42286);טהור;3;7;ואיש כי ימרט ראשו קרח הוא טהור הוא
(270810, 52, 4);3;ג;160206;(3, 13, 42, 16, 160206);42301;(3, 13, 42, 5, 42301);בגבחת;2;5;וכי יהיה בקרחת או בגבחת נגע לבן אדמדם צרעת פרחת הוא בקרחתו או בגבחתו
(270810, 52, 4);5;ה;160258;(3, 13, 43, 13, 160258);42314;(3, 13, 43, 4, 42314);והנה;2;4;וראה אתו הכהן והנה שאת הנגע לבנה אדמדמת בקרחתו או בגבחתו כמראה צרעת עור בשר
(270810, 52, 4);90;צ;160310;(3, 13, 44, 4, 160310);42327;(3, 13, 44, 2, 42327);צרוע;1;2;איש צרוע הוא טמא הוא טמא יטמאנו הכהן בראשו נגעו
(270810, 52, 4);4;ד;160362;(3, 13, 45, 18, 160362);42340;(3, 13, 45, 5, 42340);בגדיו;3;5;והצרוע אשר בו הנגע בגדיו יהיו פרמים וראשו יהיה פרוע ועל שפם יעטה וטמא טמא יקרא
(270810, 52, 4);300;ש;160414;(3, 13, 46, 7, 160414);42354;(3, 13, 46, 3, 42354);אשר;2;3;כל ימי אשר הנגע בו יטמא טמא הוא בדד ישב מחוץ למחנה מושבו
(270810, 52, 4);3;ג;160466;(3, 13, 47, 15, 160466);42369;(3, 13, 47, 5, 42369);נגע;2;5;והבגד כי יהיה בו נגע צרעת בבגד צמר או בבגד פשתים
(270810, 52, 4);200;ר;160518;(3, 13, 48, 29, 160518);42383;(3, 13, 48, 8, 42383);בעור;4;8;או בשתי או בערב לפשתים ולצמר או בעור או בכל מלאכת עור
(270810, 52, 4);2;ב;160570;(3, 13, 49, 39, 160570);42399;(3, 13, 49, 12, 42399);בערב;1;12;והיה הנגע ירקרק או אדמדם בבגד או בעור או בשתי או בערב או בכל כלי עור נגע צרעת הוא והראה את הכהן
(270810, 52, 4);60;ס;160622;(3, 13, 50, 17, 160622);42414;(3, 13, 50, 5, 42414);והסגיר;3;5;וראה הכהן את הנגע והסגיר את הנגע שבעת ימים
(270810, 52, 4);6;ו;160674;(3, 13, 51, 35, 160674);42428;(3, 13, 51, 10, 42428);או;2;10;וראה את הנגע ביום השביעי כי פשה הנגע בבגד או בשתי או בערב או בעור לכל אשר יעשה העור למלאכה צרעת ממארת הנגע טמא הוא
(270810, 52, 4);1;א;160726;(3, 13, 51, 87, 160726);42442;(3, 13, 51, 24, 42442);טמא;3;24;וראה את הנגע ביום השביעי כי פשה הנגע בבגד או בשתי או בערב או בעור לכל אשר יעשה העור למלאכה צרעת ממארת הנגע טמא הוא
(270810, 52, 4);70;ע;160778;(3, 13, 52, 49, 160778);42460;(3, 13, 52, 17, 42460);העור;2;17;ושרף את הבגד או את השתי או את הערב בצמר או בפשתים או את כל כלי העור אשר יהיה בו הנגע כי צרעת ממארת הוא באש תשרף
(270810, 52, 4);30;ל;160830;(3, 13, 53, 16, 160830);42475;(3, 13, 53, 5, 42475);לא;1;5;ואם יראה הכהן והנה לא פשה הנגע בבגד או בשתי או בערב או בכל כלי עור
(270810, 52, 4);300;ש;160882;(3, 13, 54, 17, 160882);42491;(3, 13, 54, 5, 42491);אשר;2;5;וצוה הכהן וכבסו את אשר בו הנגע והסגירו שבעת ימים שנית
(270810, 52, 4);5;ה;160934;(3, 13, 55, 26, 160934);42504;(3, 13, 55, 7, 42504);והנה;4;7;וראה הכהן אחרי הכבס את הנגע והנה לא הפך הנגע את עינו והנגע לא פשה טמא הוא באש תשרפנו פחתת הוא בקרחתו או בגבחתו
(270810, 52, 4);400;ת;160986;(3, 13, 55, 78, 160986);42519;(3, 13, 55, 22, 42519);בקרחתו;5;22;וראה הכהן אחרי הכבס את הנגע והנה לא הפך הנגע את עינו והנגע לא פשה טמא הוא באש תשרפנו פחתת הוא בקרחתו או בגבחתו
(270810, 52, 4);2;ב;161038;(3, 13, 56, 43, 161038);42534;(3, 13, 56, 13, 42534);הבגד;2;13;ואם ראה הכהן והנה כהה הנגע אחרי הכבס אתו וקרע אתו מן הבגד או מן העור או מן השתי או מן הערב
(270810, 52, 4);2;ב;161090;(3, 13, 57, 26, 161090);42551;(3, 13, 57, 8, 42551);בערב;4;8;ואם תראה עוד בבגד או בשתי או בערב או בכל כלי עור פרחת הוא באש תשרפנו את אשר בו הנגע
(270810, 52, 4);5;ה;161142;(3, 13, 58, 14, 161142);42568;(3, 13, 58, 5, 42568);הערב;1;5;והבגד או השתי או הערב או כל כלי העור אשר תכבס וסר מהם הנגע וכבס שנית וטהר
(270810, 52, 4);3;ג;161194;(3, 13, 59, 9, 161194);42583;(3, 13, 59, 3, 42583);נגע;2;3;זאת תורת נגע צרעת בגד הצמר או הפשתים או השתי או הערב או כל כלי עור לטהרו או לטמאו
(270810, 52, 4);40;מ;161246;(3, 13, 59, 61, 161246);42599;(3, 13, 59, 19, 42599);לטמאו;3;19;זאת תורת נגע צרעת בגד הצמר או הפשתים או השתי או הערב או כל כלי עור לטהרו או לטמאו
(270810, 52, 4);30;ל;161298;(3, 14, 2, 32, 161298);42612;(3, 14, 2, 8, 42612);אל;2;8;זאת תהיה תורת המצרע ביום טהרתו והובא אל הכהן
(270810, 52, 4);200;ר;161350;(3, 14, 3, 48, 161350);42626;(3, 14, 3, 13, 42626);הצרוע;3;13;ויצא הכהן אל מחוץ למחנה וראה הכהן והנה נרפא נגע הצרעת מן הצרוע
(270810, 52, 4);6;ו;161402;(3, 14, 4, 50, 161402);42639;(3, 14, 4, 13, 42639);ואזב;1;13;וצוה הכהן ולקח למטהר שתי צפרים חיות טהרות ועץ ארז ושני תולעת ואזב
(270810, 52, 4);10;י;161454;(3, 14, 6, 9, 161454);42654;(3, 14, 6, 3, 42654);החיה;3;3;את הצפר החיה יקח אתה ואת עץ הארז ואת שני התולעת ואת האזב וטבל אותם ואת הצפר החיה בדם הצפר השחטה על המים החיים
(270810, 52, 4);8;ח;161506;(3, 14, 6, 61, 161506);42669;(3, 14, 6, 18, 42669);החיה;2;18;את הצפר החיה יקח אתה ואת עץ הארז ואת שני התולעת ואת האזב וטבל אותם ואת הצפר החיה בדם הצפר השחטה על המים החיים
(270810, 52, 4);6;ו;161558;(3, 14, 7, 27, 161558);42683;(3, 14, 7, 8, 42683);וטהרו;1;8;והזה על המטהר מן הצרעת שבע פעמים וטהרו ושלח את הצפר החיה על פני השדה
(270810, 52, 4);300;ש;161610;(3, 14, 8, 25, 161610);42698;(3, 14, 8, 8, 42698);שערו;1;8;וכבס המטהר את בגדיו וגלח את כל שערו ורחץ במים וטהר ואחר יבוא אל המחנה וישב מחוץ לאהלו שבעת ימים
(270810, 52, 4);6;ו;161662;(3, 14, 9, 1, 161662);42711;(3, 14, 9, 1, 42711);והיה;1;1;והיה ביום השביעי יגלח את כל שערו את ראשו ואת זקנו ואת גבת עיניו ואת כל שערו יגלח וכבס את בגדיו ורחץ את בשרו במים וטהר
(270810, 52, 4);400;ת;161714;(3, 14, 9, 53, 161714);42725;(3, 14, 9, 15, 42725);ואת;3;15;והיה ביום השביעי יגלח את כל שערו את ראשו ואת זקנו ואת גבת עיניו ואת כל שערו יגלח וכבס את בגדיו ורחץ את בשרו במים וטהר
(270810, 52, 4);100;ק;161766;(3, 14, 10, 13, 161766);42739;(3, 14, 10, 3, 42739);יקח;2;3;וביום השמיני יקח שני כבשים תמימם וכבשה אחת בת שנתה תמימה ושלשה עשרנים סלת מנחה בלולה בשמן ולג אחד שמן
(270810, 52, 4);2;ב;161818;(3, 14, 10, 65, 161818);42752;(3, 14, 10, 16, 42752);בלולה;1;16;וביום השמיני יקח שני כבשים תמימם וכבשה אחת בת שנתה תמימה ושלשה עשרנים סלת מנחה בלולה בשמן ולג אחד שמן
