(179668, -95, 4);20;ך;153258;(3, 9, 7, 35, 153258);40441;(3, 9, 7, 10, 40441);חטאתך;5;10;ויאמר משה אל אהרן קרב אל המזבח ועשה את חטאתך ואת עלתך וכפר בעדך ובעד העם ועשה את קרבן העם וכפר בעדם כאשר צוה יהוה
(179668, -95, 4);2;ב;153353;(3, 9, 9, 5, 153353);40467;(3, 9, 9, 1, 40467);ויקרבו;5;1;ויקרבו בני אהרן את הדם אליו ויטבל אצבעו בדם ויתן על קרנות המזבח ואת הדם יצק אל יסוד המזבח
(179668, -95, 4);4;ד;153448;(3, 9, 10, 29, 153448);40493;(3, 9, 10, 8, 40493);הכבד;4;8;ואת החלב ואת הכלית ואת היתרת מן הכבד מן החטאת הקטיר המזבחה כאשר צוה יהוה את משה
(179668, -95, 4);4;ד;153543;(3, 9, 12, 32, 153543);40519;(3, 9, 12, 9, 40519);הדם;2;9;וישחט את העלה וימצאו בני אהרן אליו את הדם ויזרקהו על המזבח סביב
(179668, -95, 4);7;ז;153638;(3, 9, 14, 34, 153638);40542;(3, 9, 14, 9, 40542);המזבחה;3;9;וירחץ את הקרב ואת הכרעים ויקטר על העלה המזבחה
(179668, -95, 4);30;ל;153733;(3, 9, 17, 16, 153733);40564;(3, 9, 17, 4, 40564);וימלא;4;4;ויקרב את המנחה וימלא כפו ממנה ויקטר על המזבח מלבד עלת הבקר
(179668, -95, 4);30;ל;153828;(3, 9, 18, 64, 153828);40589;(3, 9, 18, 17, 40589);על;2;17;וישחט את השור ואת האיל זבח השלמים אשר לעם וימצאו בני אהרן את הדם אליו ויזרקהו על המזבח סביב
(179668, -95, 4);5;ה;153923;(3, 9, 20, 38, 153923);40610;(3, 9, 20, 8, 40610);המזבחה;6;8;וישימו את החלבים על החזות ויקטר החלבים המזבחה
(179668, -95, 4);300;ש;154018;(3, 9, 22, 45, 154018);40635;(3, 9, 22, 12, 40635);והשלמים;3;12;וישא אהרן את ידו אל העם ויברכם וירד מעשת החטאת והעלה והשלמים
(179668, -95, 4);1;א;154113;(3, 9, 24, 35, 154113);40661;(3, 9, 24, 10, 40661);ואת;2;10;ותצא אש מלפני יהוה ותאכל על המזבח את העלה ואת החלבים וירא כל העם וירנו ויפלו על פניהם
(179668, -95, 4);30;ל;154208;(3, 10, 1, 62, 154208);40684;(3, 10, 1, 15, 40684);לפני;1;15;ויקחו בני אהרן נדב ואביהוא איש מחתתו ויתנו בהן אש וישימו עליה קטרת ויקריבו לפני יהוה אש זרה אשר לא צוה אתם
(179668, -95, 4);2;ב;154303;(3, 10, 3, 35, 154303);40710;(3, 10, 3, 10, 40710);בקרבי;4;10;ויאמר משה אל אהרן הוא אשר דבר יהוה לאמר בקרבי אקדש ועל פני כל העם אכבד וידם אהרן
(179668, -95, 4);5;ה;154398;(3, 10, 4, 67, 154398);40737;(3, 10, 4, 19, 40737);הקדש;1;19;ויקרא משה אל מישאל ואל אלצפן בני עזיאל דד אהרן ויאמר אלהם קרבו שאו את אחיכם מאת פני הקדש אל מחוץ למחנה
(179668, -95, 4);200;ר;154493;(3, 10, 6, 43, 154493);40759;(3, 10, 6, 10, 40759);תפרעו;3;10;ויאמר משה אל אהרן ולאלעזר ולאיתמר בניו ראשיכם אל תפרעו ובגדיכם לא תפרמו ולא תמתו ועל כל העדה יקצף ואחיכם כל בית ישראל יבכו את השרפה אשר שרף יהוה
(179668, -95, 4);40;מ;154588;(3, 10, 7, 22, 154588);40785;(3, 10, 7, 7, 40785);תמתו;2;7;ומפתח אהל מועד לא תצאו פן תמתו כי שמן משחת יהוה עליכם ויעשו כדבר משה
(179668, -95, 4);6;ו;154683;(3, 10, 9, 44, 154683);40811;(3, 10, 9, 13, 40811);תמתו;4;13;יין ושכר אל תשת אתה ובניך אתך בבאכם אל אהל מועד ולא תמתו חקת עולם לדרתיכם
(179668, -95, 4);4;ד;154778;(3, 10, 11, 43, 154778);40835;(3, 10, 11, 12, 40835);ביד;3;12;ולהורת את בני ישראל את כל החקים אשר דבר יהוה אליהם ביד משה
(179668, -95, 4);10;י;154873;(3, 10, 12, 92, 154873);40859;(3, 10, 12, 23, 40859);קדשים;4;23;וידבר משה אל אהרן ואל אלעזר ואל איתמר בניו הנותרים קחו את המנחה הנותרת מאשי יהוה ואכלוה מצות אצל המזבח כי קדש קדשים הוא
(179668, -95, 4);5;ה;154968;(3, 10, 14, 41, 154968);40884;(3, 10, 14, 10, 40884);אתה;3;10;ואת חזה התנופה ואת שוק התרומה תאכלו במקום טהור אתה ובניך ובנתיך אתך כי חקך וחק בניך נתנו מזבחי שלמי בני ישראל
(179668, -95, 4);50;נ;155063;(3, 10, 15, 48, 155063);40907;(3, 10, 15, 11, 40907);לפני;3;11;שוק התרומה וחזה התנופה על אשי החלבים יביאו להניף תנופה לפני יהוה והיה לך ולבניך אתך לחק עולם כאשר צוה יהוה
(179668, -95, 4);50;נ;155158;(3, 10, 16, 57, 155158);40933;(3, 10, 16, 16, 40933);הנותרם;2;16;ואת שעיר החטאת דרש דרש משה והנה שרף ויקצף על אלעזר ועל איתמר בני אהרן הנותרם לאמר
(179668, -95, 4);2;ב;155253;(3, 10, 18, 7, 155253);40959;(3, 10, 18, 3, 40959);הובא;3;3;הן לא הובא את דמה אל הקדש פנימה אכול תאכלו אתה בקדש כאשר צויתי
(179668, -95, 4);1;א;155348;(3, 10, 19, 53, 155348);40984;(3, 10, 19, 14, 40984);ותקראנה;5;14;וידבר אהרן אל משה הן היום הקריבו את חטאתם ואת עלתם לפני יהוה ותקראנה אתי כאלה ואכלתי חטאת היום הייטב בעיני יהוה
(179668, -95, 4);10;י;155443;(3, 11, 2, 10, 155443);41008;(3, 11, 2, 4, 41008);ישראל;1;4;דברו אל בני ישראל לאמר זאת החיה אשר תאכלו מכל הבהמה אשר על הארץ
(179668, -95, 4);30;ל;155538;(3, 11, 4, 12, 155538);41034;(3, 11, 4, 5, 41034);תאכלו;4;5;אך את זה לא תאכלו ממעלי הגרה וממפרסי הפרסה את הגמל כי מעלה גרה הוא ופרסה איננו מפריס טמא הוא לכם
(179668, -95, 4);60;ס;155633;(3, 11, 5, 31, 155633);41059;(3, 11, 5, 9, 41059);יפריס;5;9;ואת השפן כי מעלה גרה הוא ופרסה לא יפריס טמא הוא לכם
(179668, -95, 4);1;א;155728;(3, 11, 7, 42, 155728);41086;(3, 11, 7, 12, 41086);לא;2;12;ואת החזיר כי מפריס פרסה הוא ושסע שסע פרסה והוא גרה לא יגר טמא הוא לכם
(179668, -95, 4);2;ב;155823;(3, 11, 9, 48, 155823);41113;(3, 11, 9, 14, 41113);ובנחלים;2;14;את זה תאכלו מכל אשר במים כל אשר לו סנפיר וקשקשת במים בימים ובנחלים אתם תאכלו
(179668, -95, 4);40;מ;155918;(3, 11, 11, 12, 155918);41138;(3, 11, 11, 4, 41138);מבשרם;1;4;ושקץ יהיו לכם מבשרם לא תאכלו ואת נבלתם תשקצו
(179668, -95, 4);1;א;156013;(3, 11, 13, 37, 156013);41165;(3, 11, 13, 12, 41165);ואת;2;12;ואת אלה תשקצו מן העוף לא יאכלו שקץ הם את הנשר ואת הפרס ואת העזניה
(179668, -95, 4);30;ל;156108;(3, 11, 17, 13, 156108);41191;(3, 11, 17, 4, 41191);השלך;3;4;ואת הכוס ואת השלך ואת הינשוף
(179668, -95, 4);1;א;156203;(3, 11, 20, 25, 156203);41215;(3, 11, 20, 8, 41215);הוא;3;8;כל שרץ העוף ההלך על ארבע שקץ הוא לכם
(179668, -95, 4);400;ת;156298;(3, 11, 22, 28, 156298);41243;(3, 11, 22, 8, 41243);ואת;3;8;את אלה מהם תאכלו את הארבה למינו ואת הסלעם למינהו ואת החרגל למינהו ואת החגב למינהו
(179668, -95, 4);9;ט;156393;(3, 11, 24, 24, 156393);41267;(3, 11, 24, 6, 41267);יטמא;2;6;ולאלה תטמאו כל הנגע בנבלתם יטמא עד הערב
(179668, -95, 4);5;ה;156488;(3, 11, 26, 55, 156488);41291;(3, 11, 26, 14, 41291);הם;1;14;לכל הבהמה אשר הוא מפרסת פרסה ושסע איננה שסעת וגרה איננה מעלה טמאים הם לכם כל הנגע בהם יטמא
(179668, -95, 4);2;ב;156583;(3, 11, 28, 15, 156583);41318;(3, 11, 28, 4, 41318);יכבס;3;4;והנשא את נבלתם יכבס בגדיו וטמא עד הערב טמאים המה לכם
(179668, -95, 4);400;ת;156678;(3, 11, 30, 24, 156678);41341;(3, 11, 30, 5, 41341);והתנשמת;3;5;והאנקה והכח והלטאה והחמט והתנשמת
(179668, -95, 4);20;כ;156773;(3, 11, 32, 49, 156773);41371;(3, 11, 32, 18, 41371);כלי;1;18;וכל אשר יפל עליו מהם במתם יטמא מכל כלי עץ או בגד או עור או שק כל כלי אשר יעשה מלאכה בהם במים יובא וטמא עד הערב וטהר
(179668, -95, 4);300;ש;156868;(3, 11, 34, 9, 156868);41398;(3, 11, 34, 3, 41398);אשר;2;3;מכל האכל אשר יאכל אשר יבוא עליו מים יטמא וכל משקה אשר ישתה בכל כלי יטמא
(179668, -95, 4);10;י;156963;(3, 11, 35, 48, 156963);41423;(3, 11, 35, 12, 41423);וטמאים;5;12;וכל אשר יפל מנבלתם עליו יטמא תנור וכירים יתץ טמאים הם וטמאים יהיו לכם
(179668, -95, 4);30;ל;157058;(3, 11, 38, 11, 157058);41450;(3, 11, 38, 4, 41450);על;2;4;וכי יתן מים על זרע ונפל מנבלתם עליו טמא הוא לכם
(179668, -95, 4);6;ו;157153;(3, 11, 40, 21, 157153);41475;(3, 11, 40, 5, 41475);וטמא;1;5;והאכל מנבלתה יכבס בגדיו וטמא עד הערב והנשא את נבלתה יכבס בגדיו וטמא עד הערב
(179668, -95, 4);70;ע;157248;(3, 11, 42, 26, 157248);41503;(3, 11, 42, 9, 41503);עד;1;9;כל הולך על גחון וכל הולך על ארבע עד כל מרבה רגלים לכל השרץ השרץ על הארץ לא תאכלום כי שקץ הם
(179668, -95, 4);10;י;157343;(3, 11, 44, 5, 157343);41530;(3, 11, 44, 2, 41530);אני;3;2;כי אני יהוה אלהיכם והתקדשתם והייתם קדשים כי קדוש אני ולא תטמאו את נפשתיכם בכל השרץ הרמש על הארץ
(179668, -95, 4);40;מ;157438;(3, 11, 45, 23, 157438);41554;(3, 11, 45, 7, 41554);מצרים;1;7;כי אני יהוה המעלה אתכם מארץ מצרים להית לכם לאלהים והייתם קדשים כי קדוש אני
(179668, -95, 4);4;ד;157533;(3, 11, 47, 4, 157533);41577;(3, 11, 47, 1, 41577);להבדיל;4;1;להבדיל בין הטמא ובין הטהר ובין החיה הנאכלת ובין החיה אשר לא תאכל
(179668, -95, 4);10;י;157628;(3, 12, 2, 29, 157628);41603;(3, 12, 2, 9, 41603);וילדה;2;9;דבר אל בני ישראל לאמר אשה כי תזריע וילדה זכר וטמאה שבעת ימים כימי נדת דותה תטמא
(179668, -95, 4);400;ת;157723;(3, 12, 4, 38, 157723);41627;(3, 12, 4, 11, 41627);תגע;1;11;ושלשים יום ושלשת ימים תשב בדמי טהרה בכל קדש לא תגע ואל המקדש לא תבא עד מלאת ימי טהרה
(179668, -95, 4);30;ל;157818;(3, 12, 6, 14, 157818);41653;(3, 12, 6, 4, 41653);לבן;1;4;ובמלאת ימי טהרה לבן או לבת תביא כבש בן שנתו לעלה ובן יונה או תר לחטאת אל פתח אהל מועד אל הכהן
(179668, -95, 4);7;ז;157913;(3, 12, 7, 37, 157913);41680;(3, 12, 7, 9, 41680);זאת;1;9;והקריבו לפני יהוה וכפר עליה וטהרה ממקר דמיה זאת תורת הילדת לזכר או לנקבה
(179668, -95, 4);5;ה;158008;(3, 12, 8, 73, 158008);41706;(3, 12, 8, 21, 41706);וטהרה;5;21;ואם לא תמצא ידה די שה ולקחה שתי תרים או שני בני יונה אחד לעלה ואחד לחטאת וכפר עליה הכהן וטהרה
(179668, -95, 4);1;א;158103;(3, 13, 2, 70, 158103);41734;(3, 13, 2, 21, 41734);אל;1;21;אדם כי יהיה בעור בשרו שאת או ספחת או בהרת והיה בעור בשרו לנגע צרעת והובא אל אהרן הכהן או אל אחד מבניו הכהנים
(179668, -95, 4);1;א;158198;(3, 13, 3, 80, 158198);41759;(3, 13, 3, 22, 41759);אתו;1;22;וראה הכהן את הנגע בעור הבשר ושער בנגע הפך לבן ומראה הנגע עמק מעור בשרו נגע צרעת הוא וראהו הכהן וטמא אתו
(179668, -95, 4);10;י;158293;(3, 13, 5, 17, 158293);41784;(3, 13, 5, 4, 41784);השביעי;4;4;וראהו הכהן ביום השביעי והנה הנגע עמד בעיניו לא פשה הנגע בעור והסגירו הכהן שבעת ימים שנית
(179668, -95, 4);80;פ;158388;(3, 13, 6, 40, 158388);41808;(3, 13, 6, 11, 41808);פשה;1;11;וראה הכהן אתו ביום השביעי שנית והנה כהה הנגע ולא פשה הנגע בעור וטהרו הכהן מספחת הוא וכבס בגדיו וטהר
(179668, -95, 4);5;ה;158483;(3, 13, 7, 55, 158483);41831;(3, 13, 7, 14, 41831);הכהן;3;14;ואם פשה תפשה המספחת בעור אחרי הראתו אל הכהן לטהרתו ונראה שנית אל הכהן
(179668, -95, 4);6;ו;158578;(3, 13, 10, 24, 158578);41856;(3, 13, 10, 7, 41856);והיא;1;7;וראה הכהן והנה שאת לבנה בעור והיא הפכה שער לבן ומחית בשר חי בשאת
(179668, -95, 4);60;ס;158673;(3, 13, 12, 23, 158673);41881;(3, 13, 12, 6, 41881);וכסתה;3;6;ואם פרוח תפרח הצרעת בעור וכסתה הצרעת את כל עור הנגע מראשו ועד רגליו לכל מראה עיני הכהן
(179668, -95, 4);9;ט;158768;(3, 13, 13, 49, 158768);41908;(3, 13, 13, 15, 41908);טהור;1;15;וראה הכהן והנה כסתה הצרעת את כל בשרו וטהר את הנגע כלו הפך לבן טהור הוא
(179668, -95, 4);2;ב;158863;(3, 13, 16, 26, 158863);41935;(3, 13, 16, 8, 41935);ובא;2;8;או כי ישוב הבשר החי ונהפך ללבן ובא אל הכהן
(179668, -95, 4);400;ת;158958;(3, 13, 19, 17, 158958);41960;(3, 13, 19, 4, 41960);שאת;3;4;והיה במקום השחין שאת לבנה או בהרת לבנה אדמדמת ונראה אל הכהן
(179668, -95, 4);5;ה;159053;(3, 13, 20, 64, 159053);41985;(3, 13, 20, 17, 41985);פרחה;4;17;וראה הכהן והנה מראה שפל מן העור ושערה הפך לבן וטמאו הכהן נגע צרעת הוא בשחין פרחה
(179668, -95, 4);50;נ;159148;(3, 13, 22, 26, 159148);42011;(3, 13, 22, 8, 42011);נגע;1;8;ואם פשה תפשה בעור וטמא הכהן אתו נגע הוא
(179668, -95, 4);40;מ;159243;(3, 13, 24, 46, 159243);42036;(3, 13, 24, 13, 42036);אדמדמת;3;13;או בשר כי יהיה בערו מכות אש והיתה מחית המכוה בהרת לבנה אדמדמת או לבנה
(179668, -95, 4);200;ר;159338;(3, 13, 26, 5, 159338);42062;(3, 13, 26, 2, 42062);יראנה;2;2;ואם יראנה הכהן והנה אין בבהרת שער לבן ושפלה איננה מן העור והוא כהה והסגירו הכהן שבעת ימים
(179668, -95, 4);5;ה;159433;(3, 13, 27, 28, 159433);42085;(3, 13, 27, 7, 42085);תפשה;4;7;וראהו הכהן ביום השביעי אם פשה תפשה בעור וטמא הכהן אתו נגע צרעת הוא
(179668, -95, 4);1;א;159528;(3, 13, 29, 2, 159528);42111;(3, 13, 29, 1, 42111);ואיש;2;1;ואיש או אשה כי יהיה בו נגע בראש או בזקן
(179668, -95, 4);1;א;159623;(3, 13, 30, 67, 159623);42140;(3, 13, 30, 20, 42140);הראש;3;20;וראה הכהן את הנגע והנה מראהו עמק מן העור ובו שער צהב דק וטמא אתו הכהן נתק הוא צרעת הראש או הזקן הוא
(179668, -95, 4);5;ה;159718;(3, 13, 32, 5, 159718);42168;(3, 13, 32, 2, 42168);הכהן;1;2;וראה הכהן את הנגע ביום השביעי והנה לא פשה הנתק ולא היה בו שער צהב ומראה הנתק אין עמק מן העור
(179668, -95, 4);5;ה;159813;(3, 13, 33, 28, 159813);42194;(3, 13, 33, 7, 42194);הכהן;3;7;והתגלח ואת הנתק לא יגלח והסגיר הכהן את הנתק שבעת ימים שנית
(179668, -95, 4);60;ס;159908;(3, 13, 34, 76, 159908);42219;(3, 13, 34, 20, 42219);וכבס;4;20;וראה הכהן את הנתק ביום השביעי והנה לא פשה הנתק בעור ומראהו איננו עמק מן העור וטהר אתו הכהן וכבס בגדיו וטהר
(179668, -95, 4);40;מ;160003;(3, 13, 37, 11, 160003);42244;(3, 13, 37, 3, 42244);עמד;2;3;ואם בעיניו עמד הנתק ושער שחר צמח בו נרפא הנתק טהור הוא וטהרו הכהן
(179668, -95, 4);200;ר;160098;(3, 13, 39, 19, 160098);42270;(3, 13, 39, 5, 42270);בשרם;3;5;וראה הכהן והנה בעור בשרם בהרת כהות לבנת בהק הוא פרח בעור טהור הוא
(179668, -95, 4);10;י;160193;(3, 13, 42, 3, 160193);42297;(3, 13, 42, 1, 42297);וכי;3;1;וכי יהיה בקרחת או בגבחת נגע לבן אדמדם צרעת פרחת הוא בקרחתו או בגבחתו
(179668, -95, 4);2;ב;160288;(3, 13, 43, 43, 160288);42321;(3, 13, 43, 11, 42321);בגבחתו;3;11;וראה אתו הכהן והנה שאת הנגע לבנה אדמדמת בקרחתו או בגבחתו כמראה צרעת עור בשר
(179668, -95, 4);80;פ;160383;(3, 13, 45, 39, 160383);42345;(3, 13, 45, 10, 42345);פרוע;1;10;והצרוע אשר בו הנגע בגדיו יהיו פרמים וראשו יהיה פרוע ועל שפם יעטה וטמא טמא יקרא
(179668, -95, 4);200;ר;160478;(3, 13, 47, 27, 160478);42372;(3, 13, 47, 8, 42372);צמר;3;8;והבגד כי יהיה בו נגע צרעת בבגד צמר או בבגד פשתים
(179668, -95, 4);2;ב;160573;(3, 13, 49, 42, 160573);42399;(3, 13, 49, 12, 42399);בערב;4;12;והיה הנגע ירקרק או אדמדם בבגד או בעור או בשתי או בערב או בכל כלי עור נגע צרעת הוא והראה את הכהן
(179668, -95, 4);70;ע;160668;(3, 13, 51, 29, 160668);42426;(3, 13, 51, 8, 42426);הנגע;4;8;וראה את הנגע ביום השביעי כי פשה הנגע בבגד או בשתי או בערב או בעור לכל אשר יעשה העור למלאכה צרעת ממארת הנגע טמא הוא
(179668, -95, 4);80;פ;160763;(3, 13, 52, 34, 160763);42455;(3, 13, 52, 12, 42455);בפשתים;2;12;ושרף את הבגד או את השתי או את הערב בצמר או בפשתים או את כל כלי העור אשר יהיה בו הנגע כי צרעת ממארת הוא באש תשרף
(179668, -95, 4);20;כ;160858;(3, 13, 53, 44, 160858);42484;(3, 13, 53, 14, 42484);בכל;2;14;ואם יראה הכהן והנה לא פשה הנגע בבגד או בשתי או בערב או בכל כלי עור
(179668, -95, 4);3;ג;160953;(3, 13, 55, 45, 160953);42510;(3, 13, 55, 13, 42510);והנגע;4;13;וראה הכהן אחרי הכבס את הנגע והנה לא הפך הנגע את עינו והנגע לא פשה טמא הוא באש תשרפנו פחתת הוא בקרחתו או בגבחתו
(179668, -95, 4);200;ר;161048;(3, 13, 56, 53, 161048);42537;(3, 13, 56, 16, 42537);העור;4;16;ואם ראה הכהן והנה כהה הנגע אחרי הכבס אתו וקרע אתו מן הבגד או מן העור או מן השתי או מן הערב
(179668, -95, 4);70;ע;161143;(3, 13, 58, 15, 161143);42568;(3, 13, 58, 5, 42568);הערב;2;5;והבגד או השתי או הערב או כל כלי העור אשר תכבס וסר מהם הנגע וכבס שנית וטהר
(179668, -95, 4);9;ט;161238;(3, 13, 59, 53, 161238);42597;(3, 13, 59, 17, 42597);לטהרו;2;17;זאת תורת נגע צרעת בגד הצמר או הפשתים או השתי או הערב או כל כלי עור לטהרו או לטמאו
(179668, -95, 4);5;ה;161333;(3, 14, 3, 31, 161333);42621;(3, 14, 3, 8, 42621);והנה;4;8;ויצא הכהן אל מחוץ למחנה וראה הכהן והנה נרפא נגע הצרעת מן הצרוע
(179668, -95, 4);400;ת;161428;(3, 14, 5, 23, 161428);42645;(3, 14, 5, 6, 42645);האחת;4;6;וצוה הכהן ושחט את הצפור האחת אל כלי חרש על מים חיים
(179668, -95, 4);5;ה;161523;(3, 14, 6, 78, 161523);42674;(3, 14, 6, 23, 42674);המים;1;23;את הצפר החיה יקח אתה ואת עץ הארז ואת שני התולעת ואת האזב וטבל אותם ואת הצפר החיה בדם הצפר השחטה על המים החיים
(179668, -95, 4);2;ב;161618;(3, 14, 8, 33, 161618);42700;(3, 14, 8, 10, 42700);במים;1;10;וכבס המטהר את בגדיו וגלח את כל שערו ורחץ במים וטהר ואחר יבוא אל המחנה וישב מחוץ לאהלו שבעת ימים
(179668, -95, 4);1;א;161713;(3, 14, 9, 52, 161713);42725;(3, 14, 9, 15, 42725);ואת;2;15;והיה ביום השביעי יגלח את כל שערו את ראשו ואת זקנו ואת גבת עיניו ואת כל שערו יגלח וכבס את בגדיו ורחץ את בשרו במים וטהר
(179668, -95, 4);50;נ;161808;(3, 14, 10, 55, 161808);42749;(3, 14, 10, 13, 42749);עשרנים;4;13;וביום השמיני יקח שני כבשים תמימם וכבשה אחת בת שנתה תמימה ושלשה עשרנים סלת מנחה בלולה בשמן ולג אחד שמן
(179668, -95, 4);5;ה;161903;(3, 14, 12, 20, 161903);42774;(3, 14, 12, 6, 42774);והקריב;2;6;ולקח הכהן את הכבש האחד והקריב אתו לאשם ואת לג השמן והניף אתם תנופה לפני יהוה
(179668, -95, 4);1;א;161998;(3, 14, 13, 54, 161998);42799;(3, 14, 13, 15, 42799);האשם;2;15;ושחט את הכבש במקום אשר ישחט את החטאת ואת העלה במקום הקדש כי כחטאת האשם הוא לכהן קדש קדשים הוא
(179668, -95, 4);6;ו;162093;(3, 14, 15, 1, 162093);42824;(3, 14, 15, 1, 42824);ולקח;1;1;ולקח הכהן מלג השמן ויצק על כף הכהן השמאלית
(179668, -95, 4);80;פ;162188;(3, 14, 16, 62, 162188);42849;(3, 14, 16, 17, 42849);פעמים;1;17;וטבל הכהן את אצבעו הימנית מן השמן אשר על כפו השמאלית והזה מן השמן באצבעו שבע פעמים לפני יהוה
(179668, -95, 4);40;ם;162283;(3, 14, 17, 83, 162283);42874;(3, 14, 17, 23, 42874);האשם;4;23;ומיתר השמן אשר על כפו יתן הכהן על תנוך אזן המטהר הימנית ועל בהן ידו הימנית ועל בהן רגלו הימנית על דם האשם
(179668, -95, 4);1;א;162378;(3, 14, 19, 41, 162378);42900;(3, 14, 19, 11, 42900);את;1;11;ועשה הכהן את החטאת וכפר על המטהר מטמאתו ואחר ישחט את העלה
(179668, -95, 4);10;י;162473;(3, 14, 21, 45, 162473);42925;(3, 14, 21, 13, 42925);עליו;3;13;ואם דל הוא ואין ידו משגת ולקח כבש אחד אשם לתנופה לכפר עליו ועשרון סלת אחד בלול בשמן למנחה ולג שמן
(179668, -95, 4);300;ש;162568;(3, 14, 23, 14, 162568);42951;(3, 14, 23, 4, 42951);השמיני;2;4;והביא אתם ביום השמיני לטהרתו אל הכהן אל פתח אהל מועד לפני יהוה
(179668, -95, 4);2;ב;162663;(3, 14, 25, 8, 162663);42977;(3, 14, 25, 3, 42977);כבש;2;3;ושחט את כבש האשם ולקח הכהן מדם האשם ונתן על תנוך אזן המטהר הימנית ועל בהן ידו הימנית ועל בהן רגלו הימנית
(179668, -95, 4);20;כ;162758;(3, 14, 26, 20, 162758);43003;(3, 14, 26, 7, 43003);הכהן;2;7;ומן השמן יצק הכהן על כף הכהן השמאלית
(179668, -95, 4);1;א;162853;(3, 14, 28, 29, 162853);43028;(3, 14, 28, 10, 43028);אזן;1;10;ונתן הכהן מן השמן אשר על כפו על תנוך אזן המטהר הימנית ועל בהן ידו הימנית ועל בהן רגלו הימנית על מקום דם האשם
(179668, -95, 4);80;פ;162948;(3, 14, 29, 39, 162948);43054;(3, 14, 29, 12, 43054);לכפר;3;12;והנותר מן השמן אשר על כף הכהן יתן על ראש המטהר לכפר עליו לפני יהוה
(179668, -95, 4);80;פ;163043;(3, 14, 31, 42, 163043);43082;(3, 14, 31, 13, 43082);וכפר;3;13;את אשר תשיג ידו את האחד חטאת ואת האחד עלה על המנחה וכפר הכהן על המטהר לפני יהוה
(179668, -95, 4);50;נ;163138;(3, 14, 34, 13, 163138);43110;(3, 14, 34, 5, 43110);כנען;2;5;כי תבאו אל ארץ כנען אשר אני נתן לכם לאחזה ונתתי נגע צרעת בבית ארץ אחזתכם
(179668, -95, 4);6;ו;163233;(3, 14, 36, 12, 163233);43135;(3, 14, 36, 3, 43135);ופנו;4;3;וצוה הכהן ופנו את הבית בטרם יבא הכהן לראות את הנגע ולא יטמא כל אשר בבית ואחר כן יבא הכהן לראות את הבית
(179668, -95, 4);400;ת;163328;(3, 14, 37, 27, 163328);43162;(3, 14, 37, 7, 43162);הבית;4;7;וראה את הנגע והנה הנגע בקירת הבית שקערורת ירקרקת או אדמדמת ומראיהן שפל מן הקיר
(179668, -95, 4);10;י;163423;(3, 14, 39, 15, 163423);43186;(3, 14, 39, 4, 43186);השביעי;4;4;ושב הכהן ביום השביעי וראה והנה פשה הנגע בקירת הבית
(179668, -95, 4);10;י;163518;(3, 14, 41, 8, 163518);43211;(3, 14, 41, 3, 43211);יקצע;1;3;ואת הבית יקצע מבית סביב ושפכו את העפר אשר הקצו אל מחוץ לעיר אל מקום טמא
(179668, -95, 4);400;ת;163613;(3, 14, 42, 47, 163613);43236;(3, 14, 42, 12, 43236);את;2;12;ולקחו אבנים אחרות והביאו אל תחת האבנים ועפר אחר יקח וטח את הבית
