(301653, 56, 4);50;ן;155213;(3, 10, 17, 47, 155213);40947;(3, 10, 17, 13, 40947);נתן;3;13;מדוע לא אכלתם את החטאת במקום הקדש כי קדש קדשים הוא ואתה נתן לכם לשאת את עון העדה לכפר עליהם לפני יהוה
(301653, 56, 4);40;מ;155269;(3, 10, 18, 23, 155269);40964;(3, 10, 18, 8, 40964);פנימה;4;8;הן לא הובא את דמה אל הקדש פנימה אכול תאכלו אתה בקדש כאשר צויתי
(301653, 56, 4);9;ט;155325;(3, 10, 19, 30, 155325);40979;(3, 10, 19, 9, 40979);חטאתם;2;9;וידבר אהרן אל משה הן היום הקריבו את חטאתם ואת עלתם לפני יהוה ותקראנה אתי כאלה ואכלתי חטאת היום הייטב בעיני יהוה
(301653, 56, 4);10;י;155381;(3, 10, 19, 86, 155381);40991;(3, 10, 19, 21, 40991);בעיני;5;21;וידבר אהרן אל משה הן היום הקריבו את חטאתם ואת עלתם לפני יהוה ותקראנה אתי כאלה ואכלתי חטאת היום הייטב בעיני יהוה
(301653, 56, 4);6;ו;155437;(3, 11, 2, 4, 155437);41005;(3, 11, 2, 1, 41005);דברו;4;1;דברו אל בני ישראל לאמר זאת החיה אשר תאכלו מכל הבהמה אשר על הארץ
(301653, 56, 4);60;ס;155493;(3, 11, 3, 10, 155493);41021;(3, 11, 3, 3, 41021);פרסה;3;3;כל מפרסת פרסה ושסעת שסע פרסת מעלת גרה בבהמה אתה תאכלו
(301653, 56, 4);6;ו;155549;(3, 11, 4, 23, 155549);41037;(3, 11, 4, 8, 41037);וממפרסי;1;8;אך את זה לא תאכלו ממעלי הגרה וממפרסי הפרסה את הגמל כי מעלה גרה הוא ופרסה איננו מפריס טמא הוא לכם
(301653, 56, 4);400;ת;155605;(3, 11, 5, 3, 155605);41051;(3, 11, 5, 1, 41051);ואת;3;1;ואת השפן כי מעלה גרה הוא ופרסה לא יפריס טמא הוא לכם
(301653, 56, 4);5;ה;155661;(3, 11, 6, 19, 155661);41068;(3, 11, 6, 6, 41068);הוא;1;6;ואת הארנבת כי מעלת גרה הוא ופרסה לא הפריסה טמאה הוא לכם
(301653, 56, 4);200;ר;155717;(3, 11, 7, 31, 155717);41083;(3, 11, 7, 9, 41083);פרסה;2;9;ואת החזיר כי מפריס פרסה הוא ושסע שסע פרסה והוא גרה לא יגר טמא הוא לכם
(301653, 56, 4);30;ל;155773;(3, 11, 8, 33, 155773);41099;(3, 11, 8, 9, 41099);לכם;1;9;מבשרם לא תאכלו ובנבלתם לא תגעו טמאים הם לכם
(301653, 56, 4);1;א;155829;(3, 11, 9, 54, 155829);41114;(3, 11, 9, 15, 41114);אתם;1;15;את זה תאכלו מכל אשר במים כל אשר לו סנפיר וקשקשת במים בימים ובנחלים אתם תאכלו
(301653, 56, 4);50;נ;155885;(3, 11, 10, 49, 155885);41128;(3, 11, 10, 13, 41128);נפש;1;13;וכל אשר אין לו סנפיר וקשקשת בימים ובנחלים מכל שרץ המים ומכל נפש החיה אשר במים שקץ הם לכם
(301653, 56, 4);90;צ;155941;(3, 11, 11, 35, 155941);41143;(3, 11, 11, 9, 41143);תשקצו;4;9;ושקץ יהיו לכם מבשרם לא תאכלו ואת נבלתם תשקצו
(301653, 56, 4);1;א;155997;(3, 11, 13, 21, 155997);41160;(3, 11, 13, 7, 41160);יאכלו;2;7;ואת אלה תשקצו מן העוף לא יאכלו שקץ הם את הנשר ואת הפרס ואת העזניה
(301653, 56, 4);2;ב;156053;(3, 11, 15, 7, 156053);41176;(3, 11, 15, 3, 41176);ערב;3;3;את כל ערב למינו
(301653, 56, 4);20;ך;156109;(3, 11, 17, 14, 156109);41191;(3, 11, 17, 4, 41191);השלך;4;4;ואת הכוס ואת השלך ואת הינשוף
(301653, 56, 4);4;ד;156165;(3, 11, 19, 24, 156165);41205;(3, 11, 19, 6, 41205);הדוכיפת;2;6;ואת החסידה האנפה למינה ואת הדוכיפת ואת העטלף
(301653, 56, 4);300;ש;156221;(3, 11, 21, 15, 156221);41222;(3, 11, 21, 6, 41222);שרץ;1;6;אך את זה תאכלו מכל שרץ העוף ההלך על ארבע אשר לא כרעים ממעל לרגליו לנתר בהן על הארץ
(301653, 56, 4);5;ה;156277;(3, 11, 22, 7, 156277);41238;(3, 11, 22, 3, 41238);מהם;2;3;את אלה מהם תאכלו את הארבה למינו ואת הסלעם למינהו ואת החרגל למינהו ואת החגב למינהו
(301653, 56, 4);10;י;156333;(3, 11, 22, 63, 156333);41251;(3, 11, 22, 16, 41251);למינהו;3;16;את אלה מהם תאכלו את הארבה למינו ואת הסלעם למינהו ואת החרגל למינהו ואת החגב למינהו
(301653, 56, 4);30;ל;156389;(3, 11, 24, 20, 156389);41266;(3, 11, 24, 5, 41266);בנבלתם;4;5;ולאלה תטמאו כל הנגע בנבלתם יטמא עד הערב
(301653, 56, 4);5;ה;156445;(3, 11, 26, 12, 156445);41281;(3, 11, 26, 4, 41281);הוא;1;4;לכל הבהמה אשר הוא מפרסת פרסה ושסע איננה שסעת וגרה איננה מעלה טמאים הם לכם כל הנגע בהם יטמא
(301653, 56, 4);40;ם;156501;(3, 11, 26, 68, 156501);41295;(3, 11, 26, 18, 41295);בהם;3;18;לכל הבהמה אשר הוא מפרסת פרסה ושסע איננה שסעת וגרה איננה מעלה טמאים הם לכם כל הנגע בהם יטמא
(301653, 56, 4);400;ת;156557;(3, 11, 27, 52, 156557);41311;(3, 11, 27, 15, 41311);בנבלתם;5;15;וכל הולך על כפיו בכל החיה ההלכת על ארבע טמאים הם לכם כל הנגע בנבלתם יטמא עד הערב
(301653, 56, 4);5;ה;156613;(3, 11, 29, 3, 156613);41326;(3, 11, 29, 1, 41326);וזה;3;1;וזה לכם הטמא בשרץ השרץ על הארץ החלד והעכבר והצב למינהו
(301653, 56, 4);1;א;156669;(3, 11, 30, 15, 156669);41339;(3, 11, 30, 3, 41339);והלטאה;5;3;והאנקה והכח והלטאה והחמט והתנשמת
(301653, 56, 4);6;ו;156725;(3, 11, 32, 1, 156725);41354;(3, 11, 32, 1, 41354);וכל;1;1;וכל אשר יפל עליו מהם במתם יטמא מכל כלי עץ או בגד או עור או שק כל כלי אשר יעשה מלאכה בהם במים יובא וטמא עד הערב וטהר
(301653, 56, 4);300;ש;156781;(3, 11, 32, 57, 156781);41373;(3, 11, 32, 20, 41373);יעשה;3;20;וכל אשר יפל עליו מהם במתם יטמא מכל כלי עץ או בגד או עור או שק כל כלי אשר יעשה מלאכה בהם במים יובא וטמא עד הערב וטהר
(301653, 56, 4);20;כ;156837;(3, 11, 33, 25, 156837);41390;(3, 11, 33, 9, 41390);כל;1;9;וכל כלי חרש אשר יפל מהם אל תוכו כל אשר בתוכו יטמא ואתו תשברו
(301653, 56, 4);20;כ;156893;(3, 11, 34, 34, 156893);41405;(3, 11, 34, 10, 41405);וכל;2;10;מכל האכל אשר יאכל אשר יבוא עליו מים יטמא וכל משקה אשר ישתה בכל כלי יטמא
(301653, 56, 4);10;י;156949;(3, 11, 35, 34, 156949);41420;(3, 11, 35, 9, 41420);יתץ;1;9;וכל אשר יפל מנבלתם עליו יטמא תנור וכירים יתץ טמאים הם וטמאים יהיו לכם
(301653, 56, 4);400;ת;157005;(3, 11, 36, 34, 157005);41434;(3, 11, 36, 9, 41434);בנבלתם;5;9;אך מעין ובור מקוה מים יהיה טהור ונגע בנבלתם יטמא
(301653, 56, 4);70;ע;157061;(3, 11, 38, 14, 157061);41451;(3, 11, 38, 5, 41451);זרע;3;5;וכי יתן מים על זרע ונפל מנבלתם עליו טמא הוא לכם
(301653, 56, 4);2;ב;157117;(3, 11, 39, 33, 157117);41467;(3, 11, 39, 10, 41467);בנבלתה;1;10;וכי ימות מן הבהמה אשר היא לכם לאכלה הנגע בנבלתה יטמא עד הערב
(301653, 56, 4);400;ת;157173;(3, 11, 40, 41, 157173);41480;(3, 11, 40, 10, 41480);נבלתה;4;10;והאכל מנבלתה יכבס בגדיו וטמא עד הערב והנשא את נבלתה יכבס בגדיו וטמא עד הערב
(301653, 56, 4);70;ע;157229;(3, 11, 42, 7, 157229);41497;(3, 11, 42, 3, 41497);על;1;3;כל הולך על גחון וכל הולך על ארבע עד כל מרבה רגלים לכל השרץ השרץ על הארץ לא תאכלום כי שקץ הם
(301653, 56, 4);40;ם;157285;(3, 11, 42, 63, 157285);41513;(3, 11, 42, 19, 41513);תאכלום;6;19;כל הולך על גחון וכל הולך על ארבע עד כל מרבה רגלים לכל השרץ השרץ על הארץ לא תאכלום כי שקץ הם
(301653, 56, 4);1;א;157341;(3, 11, 44, 3, 157341);41530;(3, 11, 44, 2, 41530);אני;1;2;כי אני יהוה אלהיכם והתקדשתם והייתם קדשים כי קדוש אני ולא תטמאו את נפשתיכם בכל השרץ הרמש על הארץ
(301653, 56, 4);20;כ;157397;(3, 11, 44, 59, 157397);41542;(3, 11, 44, 14, 41542);נפשתיכם;6;14;כי אני יהוה אלהיכם והתקדשתם והייתם קדשים כי קדוש אני ולא תטמאו את נפשתיכם בכל השרץ הרמש על הארץ
(301653, 56, 4);5;ה;157453;(3, 11, 45, 38, 157453);41557;(3, 11, 45, 10, 41557);לאלהים;4;10;כי אני יהוה המעלה אתכם מארץ מצרים להית לכם לאלהים והייתם קדשים כי קדוש אני
(301653, 56, 4);40;מ;157509;(3, 11, 46, 34, 157509);41571;(3, 11, 46, 9, 41571);במים;2;9;זאת תורת הבהמה והעוף וכל נפש החיה הרמשת במים ולכל נפש השרצת על הארץ
(301653, 56, 4);6;ו;157565;(3, 11, 47, 36, 157565);41585;(3, 11, 47, 9, 41585);ובין;1;9;להבדיל בין הטמא ובין הטהר ובין החיה הנאכלת ובין החיה אשר לא תאכל
(301653, 56, 4);10;י;157621;(3, 12, 2, 22, 157621);41601;(3, 12, 2, 7, 41601);כי;2;7;דבר אל בני ישראל לאמר אשה כי תזריע וילדה זכר וטמאה שבעת ימים כימי נדת דותה תטמא
(301653, 56, 4);30;ל;157677;(3, 12, 3, 15, 157677);41614;(3, 12, 3, 3, 41614);ימול;4;3;וביום השמיני ימול בשר ערלתו
(301653, 56, 4);300;ש;157733;(3, 12, 4, 48, 157733);41629;(3, 12, 4, 13, 41629);המקדש;5;13;ושלשים יום ושלשת ימים תשב בדמי טהרה בכל קדש לא תגע ואל המקדש לא תבא עד מלאת ימי טהרה
(301653, 56, 4);10;י;157789;(3, 12, 5, 38, 157789);41645;(3, 12, 5, 10, 41645);ימים;1;10;ואם נקבה תלד וטמאה שבעים כנדתה וששים יום וששת ימים תשב על דמי טהרה
(301653, 56, 4);50;ן;157845;(3, 12, 6, 41, 157845);41661;(3, 12, 6, 12, 41661);ובן;3;12;ובמלאת ימי טהרה לבן או לבת תביא כבש בן שנתו לעלה ובן יונה או תר לחטאת אל פתח אהל מועד אל הכהן
(301653, 56, 4);9;ט;157901;(3, 12, 7, 25, 157901);41677;(3, 12, 7, 6, 41677);וטהרה;2;6;והקריבו לפני יהוה וכפר עליה וטהרה ממקר דמיה זאת תורת הילדת לזכר או לנקבה
(301653, 56, 4);300;ש;157957;(3, 12, 8, 22, 157957);41693;(3, 12, 8, 8, 41693);שתי;1;8;ואם לא תמצא ידה די שה ולקחה שתי תרים או שני בני יונה אחד לעלה ואחד לחטאת וכפר עליה הכהן וטהרה
(301653, 56, 4);200;ר;158013;(3, 13, 1, 5, 158013);41707;(3, 13, 1, 1, 41707);וידבר;5;1;וידבר יהוה אל משה ואל אהרן לאמר
(301653, 56, 4);5;ה;158069;(3, 13, 2, 36, 158069);41724;(3, 13, 2, 11, 41724);והיה;4;11;אדם כי יהיה בעור בשרו שאת או ספחת או בהרת והיה בעור בשרו לנגע צרעת והובא אל אהרן הכהן או אל אחד מבניו הכהנים
(301653, 56, 4);5;ה;158125;(3, 13, 3, 7, 158125);41739;(3, 13, 3, 2, 41739);הכהן;3;2;וראה הכהן את הנגע בעור הבשר ושער בנגע הפך לבן ומראה הנגע עמק מעור בשרו נגע צרעת הוא וראהו הכהן וטמא אתו
(301653, 56, 4);400;ת;158181;(3, 13, 3, 63, 158181);41754;(3, 13, 3, 17, 41754);צרעת;4;17;וראה הכהן את הנגע בעור הבשר ושער בנגע הפך לבן ומראה הנגע עמק מעור בשרו נגע צרעת הוא וראהו הכהן וטמא אתו
(301653, 56, 4);70;ע;158237;(3, 13, 4, 37, 158237);41770;(3, 13, 4, 11, 41770);העור;2;11;ואם בהרת לבנה הוא בעור בשרו ועמק אין מראה מן העור ושערה לא הפך לבן והסגיר הכהן את הנגע שבעת ימים
(301653, 56, 4);10;י;158293;(3, 13, 5, 17, 158293);41784;(3, 13, 5, 4, 41784);השביעי;4;4;וראהו הכהן ביום השביעי והנה הנגע עמד בעיניו לא פשה הנגע בעור והסגירו הכהן שבעת ימים שנית
(301653, 56, 4);6;ו;158349;(3, 13, 6, 1, 158349);41798;(3, 13, 6, 1, 41798);וראה;1;1;וראה הכהן אתו ביום השביעי שנית והנה כהה הנגע ולא פשה הנגע בעור וטהרו הכהן מספחת הוא וכבס בגדיו וטהר
(301653, 56, 4);20;כ;158405;(3, 13, 6, 57, 158405);41812;(3, 13, 6, 15, 41812);הכהן;2;15;וראה הכהן אתו ביום השביעי שנית והנה כהה הנגע ולא פשה הנגע בעור וטהרו הכהן מספחת הוא וכבס בגדיו וטהר
(301653, 56, 4);20;כ;158461;(3, 13, 7, 33, 158461);41826;(3, 13, 7, 9, 41826);הכהן;2;9;ואם פשה תפשה המספחת בעור אחרי הראתו אל הכהן לטהרתו ונראה שנית אל הכהן
(301653, 56, 4);20;כ;158517;(3, 13, 8, 33, 158517);41839;(3, 13, 8, 8, 41839);הכהן;2;8;וראה הכהן והנה פשתה המספחת בעור וטמאו הכהן צרעת הוא
(301653, 56, 4);5;ה;158573;(3, 13, 10, 19, 158573);41854;(3, 13, 10, 5, 41854);לבנה;4;5;וראה הכהן והנה שאת לבנה בעור והיא הפכה שער לבן ומחית בשר חי בשאת
(301653, 56, 4);1;א;158629;(3, 13, 11, 24, 158629);41869;(3, 13, 11, 6, 41869);וטמאו;4;6;צרעת נושנת הוא בעור בשרו וטמאו הכהן לא יסגרנו כי טמא הוא
(301653, 56, 4);70;ע;158685;(3, 13, 12, 35, 158685);41885;(3, 13, 12, 10, 41885);עור;1;10;ואם פרוח תפרח הצרעת בעור וכסתה הצרעת את כל עור הנגע מראשו ועד רגליו לכל מראה עיני הכהן
(301653, 56, 4);1;א;158741;(3, 13, 13, 22, 158741);41899;(3, 13, 13, 6, 41899);את;1;6;וראה הכהן והנה כסתה הצרעת את כל בשרו וטהר את הנגע כלו הפך לבן טהור הוא
(301653, 56, 4);200;ר;158797;(3, 13, 15, 2, 158797);41916;(3, 13, 15, 1, 41916);וראה;2;1;וראה הכהן את הבשר החי וטמאו הבשר החי טמא הוא צרעת הוא
(301653, 56, 4);6;ו;158853;(3, 13, 16, 16, 158853);41933;(3, 13, 16, 6, 41933);ונהפך;1;6;או כי ישוב הבשר החי ונהפך ללבן ובא אל הכהן
(301653, 56, 4);70;ע;158909;(3, 13, 17, 39, 158909);41947;(3, 13, 17, 10, 41947);הנגע;4;10;וראהו הכהן והנה נהפך הנגע ללבן וטהר הכהן את הנגע טהור הוא
(301653, 56, 4);2;ב;158965;(3, 13, 19, 24, 158965);41963;(3, 13, 19, 7, 41963);בהרת;1;7;והיה במקום השחין שאת לבנה או בהרת לבנה אדמדמת ונראה אל הכהן
(301653, 56, 4);80;פ;159021;(3, 13, 20, 32, 159021);41977;(3, 13, 20, 9, 41977);הפך;2;9;וראה הכהן והנה מראה שפל מן העור ושערה הפך לבן וטמאו הכהן נגע צרעת הוא בשחין פרחה
(301653, 56, 4);200;ר;159077;(3, 13, 21, 24, 159077);41992;(3, 13, 21, 7, 41992);שער;3;7;ואם יראנה הכהן והנה אין בה שער לבן ושפלה איננה מן העור והיא כהה והסגירו הכהן שבעת ימים
(301653, 56, 4);2;ב;159133;(3, 13, 22, 11, 159133);42007;(3, 13, 22, 4, 42007);בעור;1;4;ואם פשה תפשה בעור וטמא הכהן אתו נגע הוא
(301653, 56, 4);6;ו;159189;(3, 13, 23, 36, 159189);42022;(3, 13, 23, 10, 42022);וטהרו;1;10;ואם תחתיה תעמד הבהרת לא פשתה צרבת השחין הוא וטהרו הכהן
(301653, 56, 4);40;מ;159245;(3, 13, 24, 48, 159245);42036;(3, 13, 24, 13, 42036);אדמדמת;5;13;או בשר כי יהיה בערו מכות אש והיתה מחית המכוה בהרת לבנה אדמדמת או לבנה
(301653, 56, 4);5;ה;159301;(3, 13, 25, 49, 159301);42052;(3, 13, 25, 14, 42052);הוא;1;14;וראה אתה הכהן והנה נהפך שער לבן בבהרת ומראה עמק מן העור צרעת הוא במכוה פרחה וטמא אתו הכהן נגע צרעת הוא
(301653, 56, 4);400;ת;159357;(3, 13, 26, 24, 159357);42066;(3, 13, 26, 6, 42066);בבהרת;5;6;ואם יראנה הכהן והנה אין בבהרת שער לבן ושפלה איננה מן העור והוא כהה והסגירו הכהן שבעת ימים
(301653, 56, 4);5;ה;159413;(3, 13, 27, 8, 159413);42080;(3, 13, 27, 2, 42080);הכהן;3;2;וראהו הכהן ביום השביעי אם פשה תפשה בעור וטמא הכהן אתו נגע צרעת הוא
(301653, 56, 4);40;מ;159469;(3, 13, 28, 11, 159469);42095;(3, 13, 28, 3, 42095);תעמד;3;3;ואם תחתיה תעמד הבהרת לא פשתה בעור והוא כהה שאת המכוה הוא וטהרו הכהן כי צרבת המכוה הוא
(301653, 56, 4);6;ו;159525;(3, 13, 28, 67, 159525);42110;(3, 13, 28, 18, 42110);הוא;2;18;ואם תחתיה תעמד הבהרת לא פשתה בעור והוא כהה שאת המכוה הוא וטהרו הכהן כי צרבת המכוה הוא
(301653, 56, 4);40;מ;159581;(3, 13, 30, 25, 159581);42127;(3, 13, 30, 7, 42127);עמק;2;7;וראה הכהן את הנגע והנה מראהו עמק מן העור ובו שער צהב דק וטמא אתו הכהן נתק הוא צרעת הראש או הזקן הוא
(301653, 56, 4);10;י;159637;(3, 13, 31, 4, 159637);42145;(3, 13, 31, 2, 42145);יראה;1;2;וכי יראה הכהן את נגע הנתק והנה אין מראהו עמק מן העור ושער שחר אין בו והסגיר הכהן את נגע הנתק שבעת ימים
(301653, 56, 4);5;ה;159693;(3, 13, 31, 60, 159693);42161;(3, 13, 31, 18, 42161);הכהן;1;18;וכי יראה הכהן את נגע הנתק והנה אין מראהו עמק מן העור ושער שחר אין בו והסגיר הכהן את נגע הנתק שבעת ימים
(301653, 56, 4);400;ת;159749;(3, 13, 32, 36, 159749);42176;(3, 13, 32, 10, 42176);הנתק;3;10;וראה הכהן את הנגע ביום השביעי והנה לא פשה הנתק ולא היה בו שער צהב ומראה הנתק אין עמק מן העור
(301653, 56, 4);6;ו;159805;(3, 13, 33, 20, 159805);42193;(3, 13, 33, 6, 42193);והסגיר;1;6;והתגלח ואת הנתק לא יגלח והסגיר הכהן את הנתק שבעת ימים שנית
(301653, 56, 4);30;ל;159861;(3, 13, 34, 29, 159861);42207;(3, 13, 34, 8, 42207);לא;1;8;וראה הכהן את הנתק ביום השביעי והנה לא פשה הנתק בעור ומראהו איננו עמק מן העור וטהר אתו הכהן וכבס בגדיו וטהר
(301653, 56, 4);200;ר;159917;(3, 13, 34, 85, 159917);42221;(3, 13, 34, 22, 42221);וטהר;4;22;וראה הכהן את הנתק ביום השביעי והנה לא פשה הנתק בעור ומראהו איננו עמק מן העור וטהר אתו הכהן וכבס בגדיו וטהר
(301653, 56, 4);100;ק;159973;(3, 13, 36, 29, 159973);42236;(3, 13, 36, 8, 42236);יבקר;3;8;וראהו הכהן והנה פשה הנתק בעור לא יבקר הכהן לשער הצהב טמא הוא
(301653, 56, 4);9;ט;160029;(3, 13, 37, 37, 160029);42252;(3, 13, 37, 11, 42252);טהור;1;11;ואם בעיניו עמד הנתק ושער שחר צמח בו נרפא הנתק טהור הוא וטהרו הכהן
(301653, 56, 4);20;כ;160085;(3, 13, 39, 6, 160085);42267;(3, 13, 39, 2, 42267);הכהן;2;2;וראה הכהן והנה בעור בשרם בהרת כהות לבנת בהק הוא פרח בעור טהור הוא
(301653, 56, 4);9;ט;160141;(3, 13, 40, 10, 160141);42282;(3, 13, 40, 3, 42282);ימרט;4;3;ואיש כי ימרט ראשו קרח הוא טהור הוא
(301653, 56, 4);5;ה;160197;(3, 13, 42, 7, 160197);42298;(3, 13, 42, 2, 42298);יהיה;4;2;וכי יהיה בקרחת או בגבחת נגע לבן אדמדם צרעת פרחת הוא בקרחתו או בגבחתו
(301653, 56, 4);5;ה;160253;(3, 13, 43, 8, 160253);42313;(3, 13, 43, 3, 42313);הכהן;1;3;וראה אתו הכהן והנה שאת הנגע לבנה אדמדמת בקרחתו או בגבחתו כמראה צרעת עור בשר
(301653, 56, 4);300;ש;160309;(3, 13, 44, 3, 160309);42326;(3, 13, 44, 1, 42326);איש;3;1;איש צרוע הוא טמא הוא טמא יטמאנו הכהן בראשו נגעו
(301653, 56, 4);10;י;160365;(3, 13, 45, 21, 160365);42341;(3, 13, 45, 6, 42341);יהיו;1;6;והצרוע אשר בו הנגע בגדיו יהיו פרמים וראשו יהיה פרוע ועל שפם יעטה וטמא טמא יקרא
(301653, 56, 4);6;ו;160421;(3, 13, 46, 14, 160421);42356;(3, 13, 46, 5, 42356);בו;2;5;כל ימי אשר הנגע בו יטמא טמא הוא בדד ישב מחוץ למחנה מושבו
(301653, 56, 4);40;מ;160477;(3, 13, 47, 26, 160477);42372;(3, 13, 47, 8, 42372);צמר;2;8;והבגד כי יהיה בו נגע צרעת בבגד צמר או בבגד פשתים
(301653, 56, 4);5;ה;160533;(3, 13, 49, 2, 160533);42388;(3, 13, 49, 1, 42388);והיה;2;1;והיה הנגע ירקרק או אדמדם בבגד או בעור או בשתי או בערב או בכל כלי עור נגע צרעת הוא והראה את הכהן
(301653, 56, 4);200;ר;160589;(3, 13, 49, 58, 160589);42405;(3, 13, 49, 18, 42405);צרעת;2;18;והיה הנגע ירקרק או אדמדם בבגד או בעור או בשתי או בערב או בכל כלי עור נגע צרעת הוא והראה את הכהן
(301653, 56, 4);400;ת;160645;(3, 13, 51, 6, 160645);42420;(3, 13, 51, 2, 42420);את;2;2;וראה את הנגע ביום השביעי כי פשה הנגע בבגד או בשתי או בערב או בעור לכל אשר יעשה העור למלאכה צרעת ממארת הנגע טמא הוא
(301653, 56, 4);5;ה;160701;(3, 13, 51, 62, 160701);42437;(3, 13, 51, 19, 42437);העור;1;19;וראה את הנגע ביום השביעי כי פשה הנגע בבגד או בשתי או בערב או בעור לכל אשר יעשה העור למלאכה צרעת ממארת הנגע טמא הוא
(301653, 56, 4);90;צ;160757;(3, 13, 52, 28, 160757);42453;(3, 13, 52, 10, 42453);בצמר;2;10;ושרף את הבגד או את השתי או את הערב בצמר או בפשתים או את כל כלי העור אשר יהיה בו הנגע כי צרעת ממארת הוא באש תשרף
(301653, 56, 4);200;ר;160813;(3, 13, 52, 84, 160813);42470;(3, 13, 52, 27, 42470);תשרף;3;27;ושרף את הבגד או את השתי או את הערב בצמר או בפשתים או את כל כלי העור אשר יהיה בו הנגע כי צרעת ממארת הוא באש תשרף
(301653, 56, 4);5;ה;160869;(3, 13, 54, 4, 160869);42487;(3, 13, 54, 1, 42487);וצוה;4;1;וצוה הכהן וכבסו את אשר בו הנגע והסגירו שבעת ימים שנית
(301653, 56, 4);1;א;160925;(3, 13, 55, 17, 160925);42502;(3, 13, 55, 5, 42502);את;1;5;וראה הכהן אחרי הכבס את הנגע והנה לא הפך הנגע את עינו והנגע לא פשה טמא הוא באש תשרפנו פחתת הוא בקרחתו או בגבחתו
(301653, 56, 4);1;א;160981;(3, 13, 55, 73, 160981);42518;(3, 13, 55, 21, 42518);הוא;3;21;וראה הכהן אחרי הכבס את הנגע והנה לא הפך הנגע את עינו והנגע לא פשה טמא הוא באש תשרפנו פחתת הוא בקרחתו או בגבחתו
(301653, 56, 4);5;ה;161037;(3, 13, 56, 42, 161037);42534;(3, 13, 56, 13, 42534);הבגד;1;13;ואם ראה הכהן והנה כהה הנגע אחרי הכבס אתו וקרע אתו מן הבגד או מן העור או מן השתי או מן הערב
(301653, 56, 4);2;ב;161093;(3, 13, 57, 29, 161093);42553;(3, 13, 57, 10, 42553);בכל;1;10;ואם תראה עוד בבגד או בשתי או בערב או בכל כלי עור פרחת הוא באש תשרפנו את אשר בו הנגע
(301653, 56, 4);30;ל;161149;(3, 13, 58, 21, 161149);42570;(3, 13, 58, 7, 42570);כל;2;7;והבגד או השתי או הערב או כל כלי העור אשר תכבס וסר מהם הנגע וכבס שנית וטהר
(301653, 56, 4);40;מ;161205;(3, 13, 59, 20, 161205);42586;(3, 13, 59, 6, 42586);הצמר;3;6;זאת תורת נגע צרעת בגד הצמר או הפשתים או השתי או הערב או כל כלי עור לטהרו או לטמאו
(301653, 56, 4);300;ש;161261;(3, 14, 1, 13, 161261);42603;(3, 14, 1, 4, 42603);משה;2;4;וידבר יהוה אל משה לאמר
(301653, 56, 4);30;ל;161317;(3, 14, 3, 15, 161317);42618;(3, 14, 3, 5, 42618);למחנה;1;5;ויצא הכהן אל מחוץ למחנה וראה הכהן והנה נרפא נגע הצרעת מן הצרוע
(301653, 56, 4);90;צ;161373;(3, 14, 4, 21, 161373);42632;(3, 14, 4, 6, 42632);צפרים;1;6;וצוה הכהן ולקח למטהר שתי צפרים חיות טהרות ועץ ארז ושני תולעת ואזב
(301653, 56, 4);1;א;161429;(3, 14, 5, 24, 161429);42646;(3, 14, 5, 7, 42646);אל;1;7;וצוה הכהן ושחט את הצפור האחת אל כלי חרש על מים חיים
(301653, 56, 4);400;ת;161485;(3, 14, 6, 40, 161485);42663;(3, 14, 6, 12, 42663);ואת;3;12;את הצפר החיה יקח אתה ואת עץ הארז ואת שני התולעת ואת האזב וטבל אותם ואת הצפר החיה בדם הצפר השחטה על המים החיים
