(122220, -67, 4);30;ל;78737;(2, 1, 17, 22, 78737);20784;(2, 1, 17, 5, 20784);ולא;2;5;ותיראן המילדת את האלהים ולא עשו כאשר דבר אליהן מלך מצרים ותחיין את הילדים
(122220, -67, 4);4;ד;78804;(2, 1, 18, 29, 78804);20800;(2, 1, 18, 7, 20800);מדוע;2;7;ויקרא מלך מצרים למילדת ויאמר להן מדוע עשיתן הדבר הזה ותחיין את הילדים
(122220, -67, 4);400;ת;78871;(2, 1, 19, 39, 78871);20815;(2, 1, 19, 9, 20815);העברית;6;9;ותאמרן המילדת אל פרעה כי לא כנשים המצרית העברית כי חיות הנה בטרם תבוא אלהן המילדת וילדו
(122220, -67, 4);5;ה;78938;(2, 1, 21, 3, 78938);20831;(2, 1, 21, 1, 20831);ויהי;3;1;ויהי כי יראו המילדת את האלהים ויעש להם בתים
(122220, -67, 4);300;ש;79005;(2, 1, 22, 35, 79005);20849;(2, 1, 22, 10, 20849);תשליכהו;2;10;ויצו פרעה לכל עמו לאמר כל הבן הילוד היארה תשליכהו וכל הבת תחיון
(122220, -67, 4);2;ב;79072;(2, 2, 2, 26, 79072);20868;(2, 2, 2, 8, 20868);טוב;3;8;ותהר האשה ותלד בן ותרא אתו כי טוב הוא ותצפנהו שלשה ירחים
(122220, -67, 4);2;ב;79139;(2, 2, 3, 48, 79139);20885;(2, 2, 3, 13, 20885);בה;1;13;ולא יכלה עוד הצפינו ותקח לו תבת גמא ותחמרה בחמר ובזפת ותשם בה את הילד ותשם בסוף על שפת היאר
(122220, -67, 4);10;י;79206;(2, 2, 5, 18, 79206);20905;(2, 2, 5, 6, 20905);היאר;2;6;ותרד בת פרעה לרחץ על היאר ונערתיה הלכת על יד היאר ותרא את התבה בתוך הסוף ותשלח את אמתה ותקחה
(122220, -67, 4);1;א;79273;(2, 2, 6, 12, 79273);20922;(2, 2, 6, 3, 20922);את;1;3;ותפתח ותראהו את הילד והנה נער בכה ותחמל עליו ותאמר מילדי העברים זה
(122220, -67, 4);1;א;79340;(2, 2, 7, 25, 79340);20939;(2, 2, 7, 7, 20939);וקראתי;4;7;ותאמר אחתו אל בת פרעה האלך וקראתי לך אשה מינקת מן העברית ותינק לך את הילד
(122220, -67, 4);40;ם;79407;(2, 2, 8, 34, 79407);20958;(2, 2, 8, 10, 20958);אם;2;10;ותאמר לה בת פרעה לכי ותלך העלמה ותקרא את אם הילד
(122220, -67, 4);6;ו;79474;(2, 2, 9, 63, 79474);20977;(2, 2, 9, 18, 20977);ותניקהו;1;18;ותאמר לה בת פרעה היליכי את הילד הזה והינקהו לי ואני אתן את שכרך ותקח האשה הילד ותניקהו
(122220, -67, 4);6;ו;79541;(2, 2, 10, 61, 79541);20993;(2, 2, 10, 16, 20993);משיתהו;6;16;ויגדל הילד ותבאהו לבת פרעה ויהי לה לבן ותקרא שמו משה ותאמר כי מן המים משיתהו
(122220, -67, 4);6;ו;79608;(2, 2, 12, 1, 79608);21011;(2, 2, 12, 1, 21011);ויפן;1;1;ויפן כה וכה וירא כי אין איש ויך את המצרי ויטמנהו בחול
(122220, -67, 4);2;ב;79675;(2, 2, 13, 26, 79675);21029;(2, 2, 13, 7, 21029);עברים;2;7;ויצא ביום השני והנה שני אנשים עברים נצים ויאמר לרשע למה תכה רעך
(122220, -67, 4);200;ר;79742;(2, 2, 14, 42, 79742);21046;(2, 2, 14, 11, 21046);כאשר;4;11;ויאמר מי שמך לאיש שר ושפט עלינו הלהרגני אתה אמר כאשר הרגת את המצרי ויירא משה ויאמר אכן נודע הדבר
(122220, -67, 4);5;ה;79809;(2, 2, 15, 32, 79809);21064;(2, 2, 15, 9, 21064);משה;3;9;וישמע פרעה את הדבר הזה ויבקש להרג את משה ויברח משה מפני פרעה וישב בארץ מדין וישב על הבאר
(122220, -67, 4);6;ו;79876;(2, 2, 16, 29, 79876);21081;(2, 2, 16, 7, 21081);ותמלאנה;1;7;ולכהן מדין שבע בנות ותבאנה ותדלנה ותמלאנה את הרהטים להשקות צאן אביהן
(122220, -67, 4);50;נ;79943;(2, 2, 17, 39, 79943);21095;(2, 2, 17, 9, 21095);צאנם;3;9;ויבאו הרעים ויגרשום ויקם משה ויושען וישק את צאנם
(122220, -67, 4);6;ו;80010;(2, 2, 19, 28, 80010);21111;(2, 2, 19, 7, 21111);וגם;1;7;ותאמרן איש מצרי הצילנו מיד הרעים וגם דלה דלה לנו וישק את הצאן
(122220, -67, 4);40;ם;80077;(2, 2, 20, 46, 80077);21130;(2, 2, 20, 13, 21130);לחם;3;13;ויאמר אל בנתיו ואיו למה זה עזבתן את האיש קראן לו ויאכל לחם
(122220, -67, 4);10;י;80144;(2, 2, 22, 32, 80144);21150;(2, 2, 22, 10, 21150);הייתי;5;10;ותלד בן ויקרא את שמו גרשם כי אמר גר הייתי בארץ נכריה
(122220, -67, 4);400;ת;80211;(2, 2, 23, 58, 80211);21166;(2, 2, 23, 14, 21166);ותעל;2;14;ויהי בימים הרבים ההם וימת מלך מצרים ויאנחו בני ישראל מן העבדה ויזעקו ותעל שועתם אל האלהים מן העבדה
(122220, -67, 4);90;צ;80278;(2, 2, 24, 45, 80278);21183;(2, 2, 24, 12, 21183);יצחק;2;12;וישמע אלהים את נאקתם ויזכר אלהים את בריתו את אברהם את יצחק ואת יעקב
(122220, -67, 4);50;ן;80345;(2, 3, 1, 30, 80345);21201;(2, 3, 1, 9, 21201);מדין;4;9;ומשה היה רעה את צאן יתרו חתנו כהן מדין וינהג את הצאן אחר המדבר ויבא אל הר האלהים חרבה
(122220, -67, 4);5;ה;80412;(2, 3, 2, 30, 80412);21219;(2, 3, 2, 8, 21219);הסנה;4;8;וירא מלאך יהוה אליו בלבת אש מתוך הסנה וירא והנה הסנה בער באש והסנה איננו אכל
(122220, -67, 4);6;ו;80479;(2, 3, 3, 36, 80479);21237;(2, 3, 3, 10, 21237);מדוע;3;10;ויאמר משה אסרה נא ואראה את המראה הגדל הזה מדוע לא יבער הסנה
(122220, -67, 4);5;ה;80546;(2, 3, 4, 56, 80546);21255;(2, 3, 4, 15, 21255);הנני;1;15;וירא יהוה כי סר לראות ויקרא אליו אלהים מתוך הסנה ויאמר משה משה ויאמר הנני
(122220, -67, 4);40;מ;80613;(2, 3, 6, 4, 80613);21273;(2, 3, 6, 1, 21273);ויאמר;4;1;ויאמר אנכי אלהי אביך אלהי אברהם אלהי יצחק ואלהי יעקב ויסתר משה פניו כי ירא מהביט אל האלהים
(122220, -67, 4);5;ה;80680;(2, 3, 6, 71, 80680);21290;(2, 3, 6, 18, 21290);האלהים;4;18;ויאמר אנכי אלהי אביך אלהי אברהם אלהי יצחק ואלהי יעקב ויסתר משה פניו כי ירא מהביט אל האלהים
(122220, -67, 4);400;ת;80747;(2, 3, 7, 65, 80747);21307;(2, 3, 7, 17, 21307);את;2;17;ויאמר יהוה ראה ראיתי את עני עמי אשר במצרים ואת צעקתם שמעתי מפני נגשיו כי ידעתי את מכאביו
(122220, -67, 4);6;ו;80814;(2, 3, 8, 61, 80814);21325;(2, 3, 8, 17, 21325);ודבש;1;17;וארד להצילו מיד מצרים ולהעלתו מן הארץ ההוא אל ארץ טובה ורחבה אל ארץ זבת חלב ודבש אל מקום הכנעני והחתי והאמרי והפרזי והחוי והיבוסי
(122220, -67, 4);1;א;80881;(2, 3, 9, 23, 80881);21340;(2, 3, 9, 7, 21340);אלי;1;7;ועתה הנה צעקת בני ישראל באה אלי וגם ראיתי את הלחץ אשר מצרים לחצים אתם
(122220, -67, 4);200;ר;80948;(2, 3, 10, 35, 80948);21358;(2, 3, 10, 10, 21358);ישראל;3;10;ועתה לכה ואשלחך אל פרעה והוצא את עמי בני ישראל ממצרים
(122220, -67, 4);10;י;81015;(2, 3, 12, 2, 81015);21376;(2, 3, 12, 1, 21376);ויאמר;2;1;ויאמר כי אהיה עמך וזה לך האות כי אנכי שלחתיך בהוציאך את העם ממצרים תעבדון את האלהים על ההר הזה
(122220, -67, 4);30;ל;81082;(2, 3, 12, 69, 81082);21393;(2, 3, 12, 18, 21393);על;2;18;ויאמר כי אהיה עמך וזה לך האות כי אנכי שלחתיך בהוציאך את העם ממצרים תעבדון את האלהים על ההר הזה
(122220, -67, 4);1;א;81149;(2, 3, 13, 61, 81149);21411;(2, 3, 13, 16, 21411);אליכם;1;16;ויאמר משה אל האלהים הנה אנכי בא אל בני ישראל ואמרתי להם אלהי אבותיכם שלחני אליכם ואמרו לי מה שמו מה אמר אלהם
(122220, -67, 4);10;י;81216;(2, 3, 14, 42, 81216);21430;(2, 3, 14, 12, 21430);ישראל;1;12;ויאמר אלהים אל משה אהיה אשר אהיה ויאמר כה תאמר לבני ישראל אהיה שלחני אליכם
(122220, -67, 4);1;א;81283;(2, 3, 15, 49, 81283);21447;(2, 3, 15, 14, 21447);אלהי;1;14;ויאמר עוד אלהים אל משה כה תאמר אל בני ישראל יהוה אלהי אבתיכם אלהי אברהם אלהי יצחק ואלהי יעקב שלחני אליכם זה שמי לעלם וזה זכרי לדר דר
(122220, -67, 4);100;ק;81350;(2, 3, 16, 11, 81350);21465;(2, 3, 16, 4, 21465);זקני;2;4;לך ואספת את זקני ישראל ואמרת אלהם יהוה אלהי אבתיכם נראה אלי אלהי אברהם יצחק ויעקב לאמר פקד פקדתי אתכם ואת העשוי לכם במצרים
(122220, -67, 4);10;י;81417;(2, 3, 16, 78, 81417);21480;(2, 3, 16, 19, 21480);פקדתי;5;19;לך ואספת את זקני ישראל ואמרת אלהם יהוה אלהי אבתיכם נראה אלי אלהי אברהם יצחק ויעקב לאמר פקד פקדתי אתכם ואת העשוי לכם במצרים
(122220, -67, 4);80;פ;81484;(2, 3, 17, 46, 81484);21496;(2, 3, 17, 11, 21496);והפרזי;3;11;ואמר אעלה אתכם מעני מצרים אל ארץ הכנעני והחתי והאמרי והפרזי והחוי והיבוסי אל ארץ זבת חלב ודבש
(122220, -67, 4);6;ו;81551;(2, 3, 18, 37, 81551);21513;(2, 3, 18, 10, 21513);ואמרתם;1;10;ושמעו לקלך ובאת אתה וזקני ישראל אל מלך מצרים ואמרתם אליו יהוה אלהי העבריים נקרה עלינו ועתה נלכה נא דרך שלשת ימים במדבר ונזבחה ליהוה אלהינו
(122220, -67, 4);10;י;81618;(2, 3, 18, 104, 81618);21528;(2, 3, 18, 25, 21528);ליהוה;2;25;ושמעו לקלך ובאת אתה וזקני ישראל אל מלך מצרים ואמרתם אליו יהוה אלהי העבריים נקרה עלינו ועתה נלכה נא דרך שלשת ימים במדבר ונזבחה ליהוה אלהינו
(122220, -67, 4);400;ת;81685;(2, 3, 20, 16, 81685);21545;(2, 3, 20, 4, 21545);והכיתי;5;4;ושלחתי את ידי והכיתי את מצרים בכל נפלאתי אשר אעשה בקרבו ואחרי כן ישלח אתכם
(122220, -67, 4);200;ר;81752;(2, 3, 21, 23, 81752);21563;(2, 3, 21, 7, 21563);מצרים;3;7;ונתתי את חן העם הזה בעיני מצרים והיה כי תלכון לא תלכו ריקם
(122220, -67, 4);40;מ;81819;(2, 3, 22, 44, 81819);21580;(2, 3, 22, 11, 21580);ושמתם;3;11;ושאלה אשה משכנתה ומגרת ביתה כלי כסף וכלי זהב ושמלת ושמתם על בניכם ועל בנתיכם ונצלתם את מצרים
(122220, -67, 4);30;ל;81886;(2, 4, 1, 36, 81886);21597;(2, 4, 1, 10, 21597);בקלי;3;10;ויען משה ויאמר והן לא יאמינו לי ולא ישמעו בקלי כי יאמרו לא נראה אליך יהוה
(122220, -67, 4);6;ו;81953;(2, 4, 3, 17, 81953);21614;(2, 4, 3, 4, 21614);וישלכהו;1;4;ויאמר השליכהו ארצה וישלכהו ארצה ויהי לנחש וינס משה מפניו
(122220, -67, 4);6;ו;82020;(2, 4, 4, 37, 82020);21630;(2, 4, 4, 10, 21630);ידו;3;10;ויאמר יהוה אל משה שלח ידך ואחז בזנבו וישלח ידו ויחזק בו ויהי למטה בכפו
(122220, -67, 4);8;ח;82087;(2, 4, 5, 48, 82087);21647;(2, 4, 5, 12, 21647);יצחק;3;12;למען יאמינו כי נראה אליך יהוה אלהי אבתם אלהי אברהם אלהי יצחק ואלהי יעקב
(122220, -67, 4);400;ת;82154;(2, 4, 6, 57, 82154);21664;(2, 4, 6, 15, 21664);מצרעת;5;15;ויאמר יהוה לו עוד הבא נא ידך בחיקך ויבא ידו בחיקו ויוצאה והנה ידו מצרעת כשלג
(122220, -67, 4);1;א;82221;(2, 4, 8, 10, 82221);21683;(2, 4, 8, 4, 21683);יאמינו;2;4;והיה אם לא יאמינו לך ולא ישמעו לקל האת הראשון והאמינו לקל האת האחרון
(122220, -67, 4);1;א;82288;(2, 4, 9, 22, 82288);21700;(2, 4, 9, 7, 21700);האתות;2;7;והיה אם לא יאמינו גם לשני האתות האלה ולא ישמעון לקלך ולקחת ממימי היאר ושפכת היבשה והיו המים אשר תקח מן היאר והיו לדם ביבשת
(122220, -67, 4);10;י;82355;(2, 4, 9, 89, 82355);21716;(2, 4, 9, 23, 21716);והיו;3;23;והיה אם לא יאמינו גם לשני האתות האלה ולא ישמעון לקלך ולקחת ממימי היאר ושפכת היבשה והיו המים אשר תקח מן היאר והיו לדם ביבשת
(122220, -67, 4);1;א;82422;(2, 4, 10, 58, 82422);21736;(2, 4, 10, 18, 21736);אל;1;18;ויאמר משה אל יהוה בי אדני לא איש דברים אנכי גם מתמול גם משלשם גם מאז דברך אל עבדך כי כבד פה וכבד לשון אנכי
(122220, -67, 4);100;ק;82489;(2, 4, 11, 43, 82489);21758;(2, 4, 11, 15, 21758);פקח;2;15;ויאמר יהוה אליו מי שם פה לאדם או מי ישום אלם או חרש או פקח או עור הלא אנכי יהוה
(122220, -67, 4);50;נ;82556;(2, 4, 13, 15, 82556);21777;(2, 4, 13, 5, 21777);נא;1;5;ויאמר בי אדני שלח נא ביד תשלח
(122220, -67, 4);6;ו;82623;(2, 4, 14, 59, 82623);21796;(2, 4, 14, 17, 21796);הוא;2;17;ויחר אף יהוה במשה ויאמר הלא אהרן אחיך הלוי ידעתי כי דבר ידבר הוא וגם הנה הוא יצא לקראתך וראך ושמח בלבו
(122220, -67, 4);5;ה;82690;(2, 4, 15, 45, 82690);21813;(2, 4, 15, 12, 21813);פיהו;3;12;ודברת אליו ושמת את הדברים בפיו ואנכי אהיה עם פיך ועם פיהו והוריתי אתכם את אשר תעשון
(122220, -67, 4);10;י;82757;(2, 4, 16, 45, 82757);21832;(2, 4, 16, 14, 21832);לאלהים;5;14;ודבר הוא לך אל העם והיה הוא יהיה לך לפה ואתה תהיה לו לאלהים
(122220, -67, 4);6;ו;82824;(2, 4, 18, 34, 82824);21853;(2, 4, 18, 11, 21853);ואשובה;1;11;וילך משה וישב אל יתר חתנו ויאמר לו אלכה נא ואשובה אל אחי אשר במצרים ואראה העודם חיים ויאמר יתרו למשה לך לשלום
(122220, -67, 4);5;ה;82891;(2, 4, 19, 14, 82891);21869;(2, 4, 19, 4, 21869);משה;3;4;ויאמר יהוה אל משה במדין לך שב מצרים כי מתו כל האנשים המבקשים את נפשך
(122220, -67, 4);70;ע;82958;(2, 4, 20, 27, 82958);21888;(2, 4, 20, 8, 21888);על;1;8;ויקח משה את אשתו ואת בניו וירכבם על החמר וישב ארצה מצרים ויקח משה את מטה האלהים בידו
(122220, -67, 4);10;י;83025;(2, 4, 21, 27, 83025);21905;(2, 4, 21, 7, 21905);מצרימה;4;7;ויאמר יהוה אל משה בלכתך לשוב מצרימה ראה כל המפתים אשר שמתי בידך ועשיתם לפני פרעה ואני אחזק את לבו ולא ישלח את העם
(122220, -67, 4);200;ר;83092;(2, 4, 22, 4, 83092);21923;(2, 4, 22, 1, 21923);ואמרת;4;1;ואמרת אל פרעה כה אמר יהוה בני בכרי ישראל
(122220, -67, 4);20;כ;83159;(2, 4, 23, 39, 83159);21941;(2, 4, 23, 10, 21941);אנכי;3;10;ואמר אליך שלח את בני ויעבדני ותמאן לשלחו הנה אנכי הרג את בנך בכרך
(122220, -67, 4);30;ל;83226;(2, 4, 25, 20, 83226);21958;(2, 4, 25, 6, 21958);ערלת;3;6;ותקח צפרה צר ותכרת את ערלת בנה ותגע לרגליו ותאמר כי חתן דמים אתה לי
(122220, -67, 4);6;ו;83293;(2, 4, 27, 8, 83293);21976;(2, 4, 27, 2, 21976);יהוה;3;2;ויאמר יהוה אל אהרן לך לקראת משה המדברה וילך ויפגשהו בהר האלהים וישק לו
(122220, -67, 4);2;ב;83360;(2, 4, 28, 18, 83360);21994;(2, 4, 28, 6, 21994);דברי;2;6;ויגד משה לאהרן את כל דברי יהוה אשר שלחו ואת כל האתת אשר צוהו
(122220, -67, 4);2;ב;83427;(2, 4, 30, 4, 83427);22012;(2, 4, 30, 1, 22012);וידבר;4;1;וידבר אהרן את כל הדברים אשר דבר יהוה אל משה ויעש האתת לעיני העם
(122220, -67, 4);5;ה;83494;(2, 4, 31, 21, 83494);22031;(2, 4, 31, 6, 22031);יהוה;2;6;ויאמן העם וישמעו כי פקד יהוה את בני ישראל וכי ראה את ענים ויקדו וישתחוו
(122220, -67, 4);40;מ;83561;(2, 5, 1, 31, 83561);22049;(2, 5, 1, 9, 22049);אמר;2;9;ואחר באו משה ואהרן ויאמרו אל פרעה כה אמר יהוה אלהי ישראל שלח את עמי ויחגו לי במדבר
(122220, -67, 4);10;י;83628;(2, 5, 2, 33, 83628);22068;(2, 5, 2, 10, 22068);ישראל;1;10;ויאמר פרעה מי יהוה אשר אשמע בקלו לשלח את ישראל לא ידעתי את יהוה וגם את ישראל לא אשלח
(122220, -67, 4);20;ך;83695;(2, 5, 3, 34, 83695);22085;(2, 5, 3, 8, 22085);דרך;3;8;ויאמרו אלהי העברים נקרא עלינו נלכה נא דרך שלשת ימים במדבר ונזבחה ליהוה אלהינו פן יפגענו בדבר או בחרב
(122220, -67, 4);40;מ;83762;(2, 5, 4, 19, 83762);22101;(2, 5, 4, 5, 22101);למה;2;5;ויאמר אלהם מלך מצרים למה משה ואהרן תפריעו את העם ממעשיו לכו לסבלתיכם
(122220, -67, 4);40;ם;83829;(2, 5, 5, 30, 83829);22117;(2, 5, 5, 8, 22117);והשבתם;6;8;ויאמר פרעה הן רבים עתה עם הארץ והשבתם אתם מסבלתם
(122220, -67, 4);30;ל;83896;(2, 5, 7, 19, 83896);22135;(2, 5, 7, 6, 22135);ללבן;2;6;לא תאספון לתת תבן לעם ללבן הלבנים כתמול שלשם הם ילכו וקששו להם תבן
(122220, -67, 4);300;ש;83963;(2, 5, 8, 33, 83963);22152;(2, 5, 8, 9, 22152);תשימו;2;9;ואת מתכנת הלבנים אשר הם עשים תמול שלשם תשימו עליהם לא תגרעו ממנו כי נרפים הם על כן הם צעקים לאמר נלכה נזבחה לאלהינו
(122220, -67, 4);4;ד;84030;(2, 5, 9, 8, 84030);22169;(2, 5, 9, 2, 22169);העבדה;4;2;תכבד העבדה על האנשים ויעשו בה ואל ישעו בדברי שקר
(122220, -67, 4);1;א;84097;(2, 5, 10, 36, 84097);22187;(2, 5, 10, 10, 22187);אמר;1;10;ויצאו נגשי העם ושטריו ויאמרו אל העם לאמר כה אמר פרעה אינני נתן לכם תבן
(122220, -67, 4);90;ץ;84164;(2, 5, 12, 4, 84164);22205;(2, 5, 12, 1, 22205);ויפץ;4;1;ויפץ העם בכל ארץ מצרים לקשש קש לתבן
(122220, -67, 4);6;ו;84231;(2, 5, 13, 43, 84231);22222;(2, 5, 13, 10, 22222);בהיות;4;10;והנגשים אצים לאמר כלו מעשיכם דבר יום ביומו כאשר בהיות התבן
(122220, -67, 4);30;ל;84298;(2, 5, 14, 62, 84298);22239;(2, 5, 14, 16, 22239);כתמול;5;16;ויכו שטרי בני ישראל אשר שמו עלהם נגשי פרעה לאמר מדוע לא כליתם חקכם ללבן כתמול שלשם גם תמול גם היום
(122220, -67, 4);50;ן;84365;(2, 5, 16, 3, 84365);22257;(2, 5, 16, 1, 22257);תבן;3;1;תבן אין נתן לעבדיך ולבנים אמרים לנו עשו והנה עבדיך מכים וחטאת עמך
(122220, -67, 4);10;י;84432;(2, 5, 17, 17, 84432);22273;(2, 5, 17, 4, 22273);נרפים;4;4;ויאמר נרפים אתם נרפים על כן אתם אמרים נלכה נזבחה ליהוה
(122220, -67, 4);200;ר;84499;(2, 5, 19, 3, 84499);22291;(2, 5, 19, 1, 22291);ויראו;3;1;ויראו שטרי בני ישראל אתם ברע לאמר לא תגרעו מלבניכם דבר יום ביומו
(122220, -67, 4);50;ן;84566;(2, 5, 20, 18, 84566);22308;(2, 5, 20, 5, 22308);אהרן;4;5;ויפגעו את משה ואת אהרן נצבים לקראתם בצאתם מאת פרעה
(122220, -67, 4);2;ב;84633;(2, 5, 21, 44, 84633);22324;(2, 5, 21, 11, 22324);בעיני;1;11;ויאמרו אלהם ירא יהוה עליכם וישפט אשר הבאשתם את ריחנו בעיני פרעה ובעיני עבדיו לתת חרב בידם להרגנו
(122220, -67, 4);70;ע;84700;(2, 5, 22, 32, 84700);22340;(2, 5, 22, 9, 22340);לעם;2;9;וישב משה אל יהוה ויאמר אדני למה הרעתה לעם הזה למה זה שלחתני
(122220, -67, 4);10;י;84767;(2, 6, 1, 6, 84767);22360;(2, 6, 1, 2, 22360);יהוה;1;2;ויאמר יהוה אל משה עתה תראה אשר אעשה לפרעה כי ביד חזקה ישלחם וביד חזקה יגרשם מארצו
(122220, -67, 4);5;ה;84834;(2, 6, 2, 8, 84834);22377;(2, 6, 2, 2, 22377);אלהים;3;2;וידבר אלהים אל משה ויאמר אליו אני יהוה
(122220, -67, 4);70;ע;84901;(2, 6, 3, 44, 84901);22396;(2, 6, 3, 13, 22396);נודעתי;4;13;וארא אל אברהם אל יצחק ואל יעקב באל שדי ושמי יהוה לא נודעתי להם
(122220, -67, 4);400;ת;84968;(2, 6, 5, 10, 84968);22416;(2, 6, 5, 3, 22416);שמעתי;4;3;וגם אני שמעתי את נאקת בני ישראל אשר מצרים מעבדים אתם ואזכר את בריתי
(122220, -67, 4);6;ו;85035;(2, 6, 6, 23, 85035);22434;(2, 6, 6, 7, 22434);והוצאתי;1;7;לכן אמר לבני ישראל אני יהוה והוצאתי אתכם מתחת סבלת מצרים והצלתי אתכם מעבדתם וגאלתי אתכם בזרוע נטויה ובשפטים גדלים
(122220, -67, 4);3;ג;85102;(2, 6, 6, 90, 85102);22447;(2, 6, 6, 20, 22447);גדלים;1;20;לכן אמר לבני ישראל אני יהוה והוצאתי אתכם מתחת סבלת מצרים והצלתי אתכם מעבדתם וגאלתי אתכם בזרוע נטויה ובשפטים גדלים
(122220, -67, 4);400;ת;85169;(2, 6, 7, 63, 85169);22462;(2, 6, 7, 15, 22462);מתחת;2;15;ולקחתי אתכם לי לעם והייתי לכם לאלהים וידעתם כי אני יהוה אלהיכם המוציא אתכם מתחת סבלות מצרים
(122220, -67, 4);400;ת;85236;(2, 6, 8, 55, 85236);22478;(2, 6, 8, 14, 22478);ונתתי;3;14;והבאתי אתכם אל הארץ אשר נשאתי את ידי לתת אתה לאברהם ליצחק וליעקב ונתתי אתה לכם מורשה אני יהוה
(122220, -67, 4);300;ש;85303;(2, 6, 9, 47, 85303);22497;(2, 6, 9, 14, 22497);קשה;2;14;וידבר משה כן אל בני ישראל ולא שמעו אל משה מקצר רוח ומעבדה קשה
(122220, -67, 4);30;ל;85370;(2, 6, 12, 9, 85370);22516;(2, 6, 12, 3, 22516);לפני;1;3;וידבר משה לפני יהוה לאמר הן בני ישראל לא שמעו אלי ואיך ישמעני פרעה ואני ערל שפתים
(122220, -67, 4);30;ל;85437;(2, 6, 13, 11, 85437);22533;(2, 6, 13, 3, 22533);אל;2;3;וידבר יהוה אל משה ואל אהרן ויצום אל בני ישראל ואל פרעה מלך מצרים להוציא את בני ישראל מארץ מצרים
(122220, -67, 4);30;ל;85504;(2, 6, 14, 2, 85504);22551;(2, 6, 14, 1, 22551);אלה;2;1;אלה ראשי בית אבתם בני ראובן בכר ישראל חנוך ופלוא חצרן וכרמי אלה משפחת ראובן
(122220, -67, 4);6;ו;85571;(2, 6, 15, 8, 85571);22567;(2, 6, 15, 2, 22567);שמעון;4;2;ובני שמעון ימואל וימין ואהד ויכין וצחר ושאול בן הכנענית אלה משפחת שמעון
(122220, -67, 4);400;ת;85638;(2, 6, 16, 16, 85638);22583;(2, 6, 16, 5, 22583);לתלדתם;2;5;ואלה שמות בני לוי לתלדתם גרשון וקהת ומררי ושני חיי לוי שבע ושלשים ומאת שנה
(122220, -67, 4);400;ת;85705;(2, 6, 17, 23, 85705);22598;(2, 6, 17, 5, 22598);למשפחתם;6;5;בני גרשון לבני ושמעי למשפחתם
(122220, -67, 4);10;י;85772;(2, 6, 19, 12, 85772);22614;(2, 6, 19, 3, 22614);מחלי;4;3;ובני מררי מחלי ומושי אלה משפחת הלוי לתלדתם
(122220, -67, 4);6;ו;85839;(2, 6, 20, 44, 85839);22633;(2, 6, 20, 14, 22633);ושני;1;14;ויקח עמרם את יוכבד דדתו לו לאשה ותלד לו את אהרן ואת משה ושני חיי עמרם שבע ושלשים ומאת שנה
(122220, -67, 4);6;ו;85906;(2, 6, 22, 21, 85906);22649;(2, 6, 22, 5, 22649);וסתרי;1;5;ובני עזיאל מישאל ואלצפן וסתרי
(122220, -67, 4);30;ל;85973;(2, 6, 23, 63, 85973);22667;(2, 6, 23, 18, 22667);אלעזר;2;18;ויקח אהרן את אלישבע בת עמינדב אחות נחשון לו לאשה ותלד לו את נדב ואת אביהוא את אלעזר ואת איתמר
(122220, -67, 4);2;ב;86040;(2, 6, 25, 19, 86040);22683;(2, 6, 25, 6, 22683);מבנות;2;6;ואלעזר בן אהרן לקח לו מבנות פוטיאל לו לאשה ותלד לו את פינחס אלה ראשי אבות הלוים למשפחתם
(122220, -67, 4);40;מ;86107;(2, 6, 26, 16, 86107);22700;(2, 6, 26, 5, 22700);אמר;2;5;הוא אהרן ומשה אשר אמר יהוה להם הוציאו את בני ישראל מארץ מצרים על צבאתם
(122220, -67, 4);90;צ;86174;(2, 6, 27, 27, 86174);22717;(2, 6, 27, 7, 22717);להוציא;4;7;הם המדברים אל פרעה מלך מצרים להוציא את בני ישראל ממצרים הוא משה ואהרן
