(113310, -65, 4);2;ב;149970;(3, 7, 21, 27, 149970);39562;(3, 7, 21, 9, 39562);בבהמה;2;9;ונפש כי תגע בכל טמא בטמאת אדם או בבהמה טמאה או בכל שקץ טמא ואכל מבשר זבח השלמים אשר ליהוה ונכרתה הנפש ההוא מעמיה
(113310, -65, 4);4;ד;150035;(3, 7, 22, 3, 150035);39578;(3, 7, 22, 1, 39578);וידבר;3;1;וידבר יהוה אל משה לאמר
(113310, -65, 4);30;ל;150100;(3, 7, 24, 11, 150100);39597;(3, 7, 24, 3, 39597);וחלב;3;3;וחלב נבלה וחלב טרפה יעשה לכל מלאכה ואכל לא תאכלהו
(113310, -65, 4);6;ו;150165;(3, 7, 25, 36, 150165);39615;(3, 7, 25, 11, 39615);ליהוה;4;11;כי כל אכל חלב מן הבהמה אשר יקריב ממנה אשה ליהוה ונכרתה הנפש האכלת מעמיה
(113310, -65, 4);20;כ;150230;(3, 7, 27, 11, 150230);39631;(3, 7, 27, 4, 39631);תאכל;3;4;כל נפש אשר תאכל כל דם ונכרתה הנפש ההוא מעמיה
(113310, -65, 4);2;ב;150295;(3, 7, 29, 23, 150295);39648;(3, 7, 29, 6, 39648);המקריב;6;6;דבר אל בני ישראל לאמר המקריב את זבח שלמיו ליהוה יביא את קרבנו ליהוה מזבח שלמיו
(113310, -65, 4);30;ל;150360;(3, 7, 30, 25, 150360);39665;(3, 7, 30, 7, 39665);החלב;3;7;ידיו תביאינה את אשי יהוה את החלב על החזה יביאנו את החזה להניף אתו תנופה לפני יהוה
(113310, -65, 4);10;י;150425;(3, 7, 31, 25, 150425);39681;(3, 7, 31, 6, 39681);והיה;3;6;והקטיר הכהן את החלב המזבחה והיה החזה לאהרן ולבניו
(113310, -65, 4);40;מ;150490;(3, 7, 33, 14, 150490);39696;(3, 7, 33, 4, 39696);השלמים;4;4;המקריב את דם השלמים ואת החלב מבני אהרן לו תהיה שוק הימין למנה
(113310, -65, 4);10;י;150555;(3, 7, 34, 30, 150555);39713;(3, 7, 34, 8, 39713);לקחתי;5;8;כי את חזה התנופה ואת שוק התרומה לקחתי מאת בני ישראל מזבחי שלמיהם ואתן אתם לאהרן הכהן ולבניו לחק עולם מאת בני ישראל
(113310, -65, 4);400;ת;150620;(3, 7, 35, 3, 150620);39729;(3, 7, 35, 1, 39729);זאת;3;1;זאת משחת אהרן ומשחת בניו מאשי יהוה ביום הקריב אתם לכהן ליהוה
(113310, -65, 4);6;ו;150685;(3, 7, 36, 19, 150685);39746;(3, 7, 36, 6, 39746);ביום;3;6;אשר צוה יהוה לתת להם ביום משחו אתם מאת בני ישראל חקת עולם לדרתם
(113310, -65, 4);1;א;150750;(3, 7, 37, 34, 150750);39761;(3, 7, 37, 7, 39761);ולמלואים;6;7;זאת התורה לעלה למנחה ולחטאת ולאשם ולמלואים ולזבח השלמים
(113310, -65, 4);50;נ;150815;(3, 7, 38, 52, 150815);39778;(3, 7, 38, 15, 39778);קרבניהם;4;15;אשר צוה יהוה את משה בהר סיני ביום צותו את בני ישראל להקריב את קרבניהם ליהוה במדבר סיני
(113310, -65, 4);400;ת;150880;(3, 8, 2, 30, 150880);39795;(3, 8, 2, 9, 39795);ואת;3;9;קח את אהרן ואת בניו אתו ואת הבגדים ואת שמן המשחה ואת פר החטאת ואת שני האילים ואת סל המצות
(113310, -65, 4);4;ד;150945;(3, 8, 3, 25, 150945);39814;(3, 8, 3, 8, 39814);מועד;4;8;ואת כל העדה הקהל אל פתח אהל מועד
(113310, -65, 4);200;ר;151010;(3, 8, 5, 23, 151010);39833;(3, 8, 5, 7, 39833);אשר;3;7;ויאמר משה אל העדה זה הדבר אשר צוה יהוה לעשות
(113310, -65, 4);200;ר;151075;(3, 8, 7, 20, 151075);39850;(3, 8, 7, 5, 39850);ויחגר;5;5;ויתן עליו את הכתנת ויחגר אתו באבנט וילבש אתו את המעיל ויתן עליו את האפד ויחגר אתו בחשב האפד ויאפד לו בו
(113310, -65, 4);300;ש;151140;(3, 8, 8, 3, 151140);39868;(3, 8, 8, 1, 39868);וישם;3;1;וישם עליו את החשן ויתן אל החשן את האורים ואת התמים
(113310, -65, 4);50;נ;151205;(3, 8, 9, 28, 151205);39886;(3, 8, 9, 8, 39886);המצנפת;4;8;וישם את המצנפת על ראשו וישם על המצנפת אל מול פניו את ציץ הזהב נזר הקדש כאשר צוה יהוה את משה
(113310, -65, 4);8;ח;151270;(3, 8, 10, 22, 151270);39905;(3, 8, 10, 6, 39905);וימשח;5;6;ויקח משה את שמן המשחה וימשח את המשכן ואת כל אשר בו ויקדש אתם
(113310, -65, 4);20;כ;151335;(3, 8, 11, 40, 151335);39925;(3, 8, 11, 12, 39925);כליו;1;12;ויז ממנו על המזבח שבע פעמים וימשח את המזבח ואת כל כליו ואת הכיר ואת כנו לקדשם
(113310, -65, 4);1;א;151400;(3, 8, 13, 9, 151400);39942;(3, 8, 13, 3, 39942);את;1;3;ויקרב משה את בני אהרן וילבשם כתנת ויחגר אתם אבנט ויחבש להם מגבעות כאשר צוה יהוה את משה
(113310, -65, 4);1;א;151465;(3, 8, 14, 5, 151465);39959;(3, 8, 14, 2, 39959);את;1;2;ויגש את פר החטאת ויסמך אהרן ובניו את ידיהם על ראש פר החטאת
(113310, -65, 4);100;ק;151530;(3, 8, 15, 24, 151530);39978;(3, 8, 15, 8, 39978);קרנות;1;8;וישחט ויקח משה את הדם ויתן על קרנות המזבח סביב באצבעו ויחטא את המזבח ואת הדם יצק אל יסוד המזבח ויקדשהו לכפר עליו
(113310, -65, 4);10;י;151595;(3, 8, 15, 89, 151595);39993;(3, 8, 15, 23, 39993);עליו;3;23;וישחט ויקח משה את הדם ויתן על קרנות המזבח סביב באצבעו ויחטא את המזבח ואת הדם יצק אל יסוד המזבח ויקדשהו לכפר עליו
(113310, -65, 4);8;ח;151660;(3, 8, 16, 64, 151660);40011;(3, 8, 16, 18, 40011);המזבחה;5;18;ויקח את כל החלב אשר על הקרב ואת יתרת הכבד ואת שתי הכלית ואת חלבהן ויקטר משה המזבחה
(113310, -65, 4);400;ת;151725;(3, 8, 18, 7, 151725);40030;(3, 8, 18, 2, 40030);את;2;2;ויקרב את איל העלה ויסמכו אהרן ובניו את ידיהם על ראש האיל
(113310, -65, 4);2;ב;151790;(3, 8, 19, 27, 151790);40048;(3, 8, 19, 8, 40048);סביב;2;8;וישחט ויזרק משה את הדם על המזבח סביב
(113310, -65, 4);200;ר;151855;(3, 8, 21, 17, 151855);40065;(3, 8, 21, 5, 40065);רחץ;1;5;ואת הקרב ואת הכרעים רחץ במים ויקטר משה את כל האיל המזבחה עלה הוא לריח ניחח אשה הוא ליהוה כאשר צוה יהוה את משה
(113310, -65, 4);1;א;151920;(3, 8, 21, 82, 151920);40083;(3, 8, 21, 23, 40083);את;1;23;ואת הקרב ואת הכרעים רחץ במים ויקטר משה את כל האיל המזבחה עלה הוא לריח ניחח אשה הוא ליהוה כאשר צוה יהוה את משה
(113310, -65, 4);6;ו;151985;(3, 8, 23, 6, 151985);40100;(3, 8, 23, 2, 40100);ויקח;1;2;וישחט ויקח משה מדמו ויתן על תנוך אזן אהרן הימנית ועל בהן ידו הימנית ועל בהן רגלו הימנית
(113310, -65, 4);6;ו;152050;(3, 8, 24, 1, 152050);40117;(3, 8, 24, 1, 40117);ויקרב;1;1;ויקרב את בני אהרן ויתן משה מן הדם על תנוך אזנם הימנית ועל בהן ידם הימנית ועל בהן רגלם הימנית ויזרק משה את הדם על המזבח סביב
(113310, -65, 4);30;ל;152115;(3, 8, 24, 66, 152115);40135;(3, 8, 24, 19, 40135);רגלם;3;19;ויקרב את בני אהרן ויתן משה מן הדם על תנוך אזנם הימנית ועל בהן ידם הימנית ועל בהן רגלם הימנית ויזרק משה את הדם על המזבח סביב
(113310, -65, 4);100;ק;152180;(3, 8, 25, 34, 152180);40154;(3, 8, 25, 11, 40154);הקרב;2;11;ויקח את החלב ואת האליה ואת כל החלב אשר על הקרב ואת יתרת הכבד ואת שתי הכלית ואת חלבהן ואת שוק הימין
(113310, -65, 4);100;ק;152245;(3, 8, 26, 22, 152245);40171;(3, 8, 26, 6, 40171);לקח;2;6;ומסל המצות אשר לפני יהוה לקח חלת מצה אחת וחלת לחם שמן אחת ורקיק אחד וישם על החלבים ועל שוק הימין
(113310, -65, 4);30;ל;152310;(3, 8, 27, 11, 152310);40190;(3, 8, 27, 4, 40190);על;2;4;ויתן את הכל על כפי אהרן ועל כפי בניו וינף אתם תנופה לפני יהוה
(113310, -65, 4);8;ח;152375;(3, 8, 28, 28, 152375);40207;(3, 8, 28, 7, 40207);המזבחה;5;7;ויקח משה אתם מעל כפיהם ויקטר המזבחה על העלה מלאים הם לריח ניחח אשה הוא ליהוה
(113310, -65, 4);6;ו;152440;(3, 8, 29, 32, 152440);40224;(3, 8, 29, 8, 40224);יהוה;3;8;ויקח משה את החזה ויניפהו תנופה לפני יהוה מאיל המלאים למשה היה למנה כאשר צוה יהוה את משה
(113310, -65, 4);30;ל;152505;(3, 8, 30, 27, 152505);40242;(3, 8, 30, 8, 40242);על;2;8;ויקח משה משמן המשחה ומן הדם אשר על המזבח ויז על אהרן על בגדיו ועל בניו ועל בגדי בניו אתו ויקדש את אהרן את בגדיו ואת בניו ואת בגדי בניו אתו
(113310, -65, 4);50;נ;152570;(3, 8, 30, 92, 152570);40261;(3, 8, 30, 27, 40261);בניו;2;27;ויקח משה משמן המשחה ומן הדם אשר על המזבח ויז על אהרן על בגדיו ועל בניו ועל בגדי בניו אתו ויקדש את אהרן את בגדיו ואת בניו ואת בגדי בניו אתו
(113310, -65, 4);6;ו;152635;(3, 8, 31, 49, 152635);40279;(3, 8, 31, 14, 40279);תאכלו;5;14;ויאמר משה אל אהרן ואל בניו בשלו את הבשר פתח אהל מועד ושם תאכלו אתו ואת הלחם אשר בסל המלאים כאשר צויתי לאמר אהרן ובניו יאכלהו
(113310, -65, 4);40;ם;152700;(3, 8, 32, 15, 152700);40294;(3, 8, 32, 3, 40294);ובלחם;5;3;והנותר בבשר ובלחם באש תשרפו
(113310, -65, 4);30;ל;152765;(3, 8, 33, 57, 152765);40312;(3, 8, 33, 16, 40312);ימלא;3;16;ומפתח אהל מועד לא תצאו שבעת ימים עד יום מלאת ימי מלאיכם כי שבעת ימים ימלא את ידכם
(113310, -65, 4);5;ה;152830;(3, 8, 35, 24, 152830);40329;(3, 8, 35, 6, 40329);ולילה;5;6;ופתח אהל מועד תשבו יומם ולילה שבעת ימים ושמרתם את משמרת יהוה ולא תמותו כי כן צויתי
(113310, -65, 4);40;ם;152895;(3, 8, 36, 23, 152895);40346;(3, 8, 36, 6, 40346);הדברים;6;6;ויעש אהרן ובניו את כל הדברים אשר צוה יהוה ביד משה
(113310, -65, 4);30;ל;152960;(3, 9, 2, 7, 152960);40362;(3, 9, 2, 2, 40362);אל;2;2;ויאמר אל אהרן קח לך עגל בן בקר לחטאת ואיל לעלה תמימם והקרב לפני יהוה
(113310, -65, 4);40;מ;153025;(3, 9, 3, 18, 153025);40380;(3, 9, 3, 5, 40380);לאמר;3;5;ואל בני ישראל תדבר לאמר קחו שעיר עזים לחטאת ועגל וכבש בני שנה תמימם לעלה
(113310, -65, 4);6;ו;153090;(3, 9, 4, 25, 153090);40396;(3, 9, 4, 6, 40396);יהוה;3;6;ושור ואיל לשלמים לזבח לפני יהוה ומנחה בלולה בשמן כי היום יהוה נראה אליכם
(113310, -65, 4);100;ק;153155;(3, 9, 5, 31, 153155);40414;(3, 9, 5, 10, 40414);ויקרבו;3;10;ויקחו את אשר צוה משה אל פני אהל מועד ויקרבו כל העדה ויעמדו לפני יהוה
(113310, -65, 4);10;י;153220;(3, 9, 6, 42, 153220);40431;(3, 9, 6, 12, 40431);יהוה;1;12;ויאמר משה זה הדבר אשר צוה יהוה תעשו וירא אליכם כבוד יהוה
(113310, -65, 4);1;א;153285;(3, 9, 7, 62, 153285);40449;(3, 9, 7, 18, 40449);את;1;18;ויאמר משה אל אהרן קרב אל המזבח ועשה את חטאתך ואת עלתך וכפר בעדך ובעד העם ועשה את קרבן העם וכפר בעדם כאשר צוה יהוה
(113310, -65, 4);10;י;153350;(3, 9, 9, 2, 153350);40467;(3, 9, 9, 1, 40467);ויקרבו;2;1;ויקרבו בני אהרן את הדם אליו ויטבל אצבעו בדם ויתן על קרנות המזבח ואת הדם יצק אל יסוד המזבח
(113310, -65, 4);5;ה;153415;(3, 9, 9, 67, 153415);40485;(3, 9, 9, 19, 40485);המזבח;1;19;ויקרבו בני אהרן את הדם אליו ויטבל אצבעו בדם ויתן על קרנות המזבח ואת הדם יצק אל יסוד המזבח
(113310, -65, 4);40;מ;153480;(3, 9, 10, 61, 153480);40502;(3, 9, 10, 17, 40502);משה;1;17;ואת החלב ואת הכלית ואת היתרת מן הכבד מן החטאת הקטיר המזבחה כאשר צוה יהוה את משה
(113310, -65, 4);6;ו;153545;(3, 9, 12, 34, 153545);40520;(3, 9, 12, 10, 40520);ויזרקהו;1;10;וישחט את העלה וימצאו בני אהרן אליו את הדם ויזרקהו על המזבח סביב
(113310, -65, 4);1;א;153610;(3, 9, 14, 6, 153610);40535;(3, 9, 14, 2, 40535);את;1;2;וירחץ את הקרב ואת הכרעים ויקטר על העלה המזבחה
(113310, -65, 4);70;ע;153675;(3, 9, 15, 34, 153675);40552;(3, 9, 15, 10, 40552);לעם;2;10;ויקרב את קרבן העם ויקח את שעיר החטאת אשר לעם וישחטהו ויחטאהו כראשון
(113310, -65, 4);50;נ;153740;(3, 9, 17, 23, 153740);40566;(3, 9, 17, 6, 40566);ממנה;3;6;ויקרב את המנחה וימלא כפו ממנה ויקטר על המזבח מלבד עלת הבקר
(113310, -65, 4);50;נ;153805;(3, 9, 18, 41, 153805);40583;(3, 9, 18, 11, 40583);בני;2;11;וישחט את השור ואת האיל זבח השלמים אשר לעם וימצאו בני אהרן את הדם אליו ויזרקהו על המזבח סביב
(113310, -65, 4);5;ה;153870;(3, 9, 19, 33, 153870);40599;(3, 9, 19, 8, 40599);והמכסה;6;8;ואת החלבים מן השור ומן האיל האליה והמכסה והכלית ויתרת הכבד
(113310, -65, 4);300;ש;153935;(3, 9, 21, 12, 153935);40614;(3, 9, 21, 4, 40614);שוק;1;4;ואת החזות ואת שוק הימין הניף אהרן תנופה לפני יהוה כאשר צוה משה
(113310, -65, 4);200;ר;154000;(3, 9, 22, 27, 154000);40631;(3, 9, 22, 8, 40631);וירד;3;8;וישא אהרן את ידו אל העם ויברכם וירד מעשת החטאת והעלה והשלמים
(113310, -65, 4);2;ב;154065;(3, 9, 23, 43, 154065);40647;(3, 9, 23, 12, 40647);כבוד;2;12;ויבא משה ואהרן אל אהל מועד ויצאו ויברכו את העם וירא כבוד יהוה אל כל העם
(113310, -65, 4);6;ו;154130;(3, 9, 24, 52, 154130);40666;(3, 9, 24, 15, 40666);וירנו;1;15;ותצא אש מלפני יהוה ותאכל על המזבח את העלה ואת החלבים וירא כל העם וירנו ויפלו על פניהם
(113310, -65, 4);10;י;154195;(3, 10, 1, 49, 154195);40681;(3, 10, 1, 12, 40681);עליה;3;12;ויקחו בני אהרן נדב ואביהוא איש מחתתו ויתנו בהן אש וישימו עליה קטרת ויקריבו לפני יהוה אש זרה אשר לא צוה אתם
(113310, -65, 4);6;ו;154260;(3, 10, 2, 29, 154260);40698;(3, 10, 2, 7, 40698);וימתו;5;7;ותצא אש מלפני יהוה ותאכל אותם וימתו לפני יהוה
(113310, -65, 4);10;י;154325;(3, 10, 3, 57, 154325);40717;(3, 10, 3, 17, 40717);וידם;2;17;ויאמר משה אל אהרן הוא אשר דבר יהוה לאמר בקרבי אקדש ועל פני כל העם אכבד וידם אהרן
(113310, -65, 4);20;כ;154390;(3, 10, 4, 59, 154390);40734;(3, 10, 4, 16, 40734);אחיכם;4;16;ויקרא משה אל מישאל ואל אלצפן בני עזיאל דד אהרן ויאמר אלהם קרבו שאו את אחיכם מאת פני הקדש אל מחוץ למחנה
(113310, -65, 4);200;ר;154455;(3, 10, 6, 5, 154455);40750;(3, 10, 6, 1, 40750);ויאמר;5;1;ויאמר משה אל אהרן ולאלעזר ולאיתמר בניו ראשיכם אל תפרעו ובגדיכם לא תפרמו ולא תמתו ועל כל העדה יקצף ואחיכם כל בית ישראל יבכו את השרפה אשר שרף יהוה
(113310, -65, 4);20;כ;154520;(3, 10, 6, 70, 154520);40766;(3, 10, 6, 17, 40766);כל;1;17;ויאמר משה אל אהרן ולאלעזר ולאיתמר בניו ראשיכם אל תפרעו ובגדיכם לא תפרמו ולא תמתו ועל כל העדה יקצף ואחיכם כל בית ישראל יבכו את השרפה אשר שרף יהוה
(113310, -65, 4);80;פ;154585;(3, 10, 7, 19, 154585);40784;(3, 10, 7, 6, 40784);פן;1;6;ומפתח אהל מועד לא תצאו פן תמתו כי שמן משחת יהוה עליכם ויעשו כדבר משה
(113310, -65, 4);300;ש;154650;(3, 10, 9, 11, 154650);40802;(3, 10, 9, 4, 40802);תשת;2;4;יין ושכר אל תשת אתה ובניך אתך בבאכם אל אהל מועד ולא תמתו חקת עולם לדרתיכם
(113310, -65, 4);50;ן;154715;(3, 10, 10, 18, 154715);40818;(3, 10, 10, 4, 40818);ובין;4;4;ולהבדיל בין הקדש ובין החל ובין הטמא ובין הטהור
(113310, -65, 4);300;ש;154780;(3, 10, 11, 45, 154780);40836;(3, 10, 11, 13, 40836);משה;2;13;ולהורת את בני ישראל את כל החקים אשר דבר יהוה אליהם ביד משה
(113310, -65, 4);6;ו;154845;(3, 10, 12, 64, 154845);40852;(3, 10, 12, 16, 40852);יהוה;3;16;וידבר משה אל אהרן ואל אלעזר ואל איתמר בניו הנותרים קחו את המנחה הנותרת מאשי יהוה ואכלוה מצות אצל המזבח כי קדש קדשים הוא
(113310, -65, 4);1;א;154910;(3, 10, 13, 33, 154910);40869;(3, 10, 13, 9, 40869);הוא;3;9;ואכלתם אתה במקום קדוש כי חקך וחק בניך הוא מאשי יהוה כי כן צויתי
(113310, -65, 4);2;ב;154975;(3, 10, 14, 48, 154975);40886;(3, 10, 14, 12, 40886);ובנתיך;2;12;ואת חזה התנופה ואת שוק התרומה תאכלו במקום טהור אתה ובניך ובנתיך אתך כי חקך וחק בניך נתנו מזבחי שלמי בני ישראל
(113310, -65, 4);5;ה;155040;(3, 10, 15, 25, 155040);40903;(3, 10, 15, 7, 40903);החלבים;1;7;שוק התרומה וחזה התנופה על אשי החלבים יביאו להניף תנופה לפני יהוה והיה לך ולבניך אתך לחק עולם כאשר צוה יהוה
(113310, -65, 4);300;ש;155105;(3, 10, 16, 4, 155105);40919;(3, 10, 16, 2, 40919);שעיר;1;2;ואת שעיר החטאת דרש דרש משה והנה שרף ויקצף על אלעזר ועל איתמר בני אהרן הנותרם לאמר
(113310, -65, 4);70;ע;155170;(3, 10, 17, 4, 155170);40935;(3, 10, 17, 1, 40935);מדוע;4;1;מדוע לא אכלתם את החטאת במקום הקדש כי קדש קדשים הוא ואתה נתן לכם לשאת את עון העדה לכפר עליהם לפני יהוה
(113310, -65, 4);30;ל;155235;(3, 10, 17, 69, 155235);40954;(3, 10, 17, 20, 40954);עליהם;2;20;מדוע לא אכלתם את החטאת במקום הקדש כי קדש קדשים הוא ואתה נתן לכם לשאת את עון העדה לכפר עליהם לפני יהוה
(113310, -65, 4);200;ר;155300;(3, 10, 19, 5, 155300);40971;(3, 10, 19, 1, 40971);וידבר;5;1;וידבר אהרן אל משה הן היום הקריבו את חטאתם ואת עלתם לפני יהוה ותקראנה אתי כאלה ואכלתי חטאת היום הייטב בעיני יהוה
(113310, -65, 4);9;ט;155365;(3, 10, 19, 70, 155365);40988;(3, 10, 19, 18, 40988);חטאת;2;18;וידבר אהרן אל משה הן היום הקריבו את חטאתם ואת עלתם לפני יהוה ותקראנה אתי כאלה ואכלתי חטאת היום הייטב בעיני יהוה
(113310, -65, 4);1;א;155430;(3, 11, 1, 26, 155430);41004;(3, 11, 1, 8, 41004);אלהם;1;8;וידבר יהוה אל משה ואל אהרן לאמר אלהם
(113310, -65, 4);6;ו;155495;(3, 11, 3, 12, 155495);41022;(3, 11, 3, 4, 41022);ושסעת;1;4;כל מפרסת פרסה ושסעת שסע פרסת מעלת גרה בבהמה אתה תאכלו
(113310, -65, 4);5;ה;155560;(3, 11, 4, 34, 155560);41038;(3, 11, 4, 9, 41038);הפרסה;5;9;אך את זה לא תאכלו ממעלי הגרה וממפרסי הפרסה את הגמל כי מעלה גרה הוא ופרסה איננו מפריס טמא הוא לכם
(113310, -65, 4);60;ס;155625;(3, 11, 5, 23, 155625);41057;(3, 11, 5, 7, 41057);ופרסה;4;7;ואת השפן כי מעלה גרה הוא ופרסה לא יפריס טמא הוא לכם
(113310, -65, 4);5;ה;155690;(3, 11, 7, 4, 155690);41076;(3, 11, 7, 2, 41076);החזיר;1;2;ואת החזיר כי מפריס פרסה הוא ושסע שסע פרסה והוא גרה לא יגר טמא הוא לכם
(113310, -65, 4);50;נ;155755;(3, 11, 8, 15, 155755);41094;(3, 11, 8, 4, 41094);ובנבלתם;3;4;מבשרם לא תאכלו ובנבלתם לא תגעו טמאים הם לכם
(113310, -65, 4);10;י;155820;(3, 11, 9, 45, 155820);41112;(3, 11, 9, 13, 41112);בימים;4;13;את זה תאכלו מכל אשר במים כל אשר לו סנפיר וקשקשת במים בימים ובנחלים אתם תאכלו
(113310, -65, 4);50;נ;155885;(3, 11, 10, 49, 155885);41128;(3, 11, 10, 13, 41128);נפש;1;13;וכל אשר אין לו סנפיר וקשקשת בימים ובנחלים מכל שרץ המים ומכל נפש החיה אשר במים שקץ הם לכם
(113310, -65, 4);50;ן;155950;(3, 11, 12, 8, 155950);41146;(3, 11, 12, 3, 41146);אין;3;3;כל אשר אין לו סנפיר וקשקשת במים שקץ הוא לכם
(113310, -65, 4);5;ה;156015;(3, 11, 13, 39, 156015);41166;(3, 11, 13, 13, 41166);הפרס;1;13;ואת אלה תשקצו מן העוף לא יאכלו שקץ הם את הנשר ואת הפרס ואת העזניה
(113310, -65, 4);5;ה;156080;(3, 11, 16, 22, 156080);41184;(3, 11, 16, 7, 41184);השחף;1;7;ואת בת היענה ואת התחמס ואת השחף ואת הנץ למינהו
(113310, -65, 4);5;ה;156145;(3, 11, 19, 4, 156145);41201;(3, 11, 19, 2, 41201);החסידה;1;2;ואת החסידה האנפה למינה ואת הדוכיפת ואת העטלף
(113310, -65, 4);400;ת;156210;(3, 11, 21, 4, 156210);41218;(3, 11, 21, 2, 41218);את;2;2;אך את זה תאכלו מכל שרץ העוף ההלך על ארבע אשר לא כרעים ממעל לרגליו לנתר בהן על הארץ
(113310, -65, 4);5;ה;156275;(3, 11, 22, 5, 156275);41237;(3, 11, 22, 2, 41237);אלה;3;2;את אלה מהם תאכלו את הארבה למינו ואת הסלעם למינהו ואת החרגל למינהו ואת החגב למינהו
(113310, -65, 4);300;ש;156340;(3, 11, 23, 4, 156340);41253;(3, 11, 23, 2, 41253);שרץ;1;2;וכל שרץ העוף אשר לו ארבע רגלים שקץ הוא לכם
(113310, -65, 4);5;ה;156405;(3, 11, 25, 4, 156405);41271;(3, 11, 25, 2, 41271);הנשא;1;2;וכל הנשא מנבלתם יכבס בגדיו וטמא עד הערב
(113310, -65, 4);6;ו;156470;(3, 11, 26, 37, 156470);41287;(3, 11, 26, 10, 41287);וגרה;1;10;לכל הבהמה אשר הוא מפרסת פרסה ושסע איננה שסעת וגרה איננה מעלה טמאים הם לכם כל הנגע בהם יטמא
(113310, -65, 4);2;ב;156535;(3, 11, 27, 30, 156535);41305;(3, 11, 27, 9, 41305);ארבע;3;9;וכל הולך על כפיו בכל החיה ההלכת על ארבע טמאים הם לכם כל הנגע בנבלתם יטמא עד הערב
(113310, -65, 4);9;ט;156600;(3, 11, 28, 32, 156600);41323;(3, 11, 28, 9, 41323);טמאים;1;9;והנשא את נבלתם יכבס בגדיו וטמא עד הערב טמאים המה לכם
(113310, -65, 4);6;ו;156665;(3, 11, 30, 11, 156665);41339;(3, 11, 30, 3, 41339);והלטאה;1;3;והאנקה והכח והלטאה והחמט והתנשמת
(113310, -65, 4);200;ר;156730;(3, 11, 32, 6, 156730);41355;(3, 11, 32, 2, 41355);אשר;3;2;וכל אשר יפל עליו מהם במתם יטמא מכל כלי עץ או בגד או עור או שק כל כלי אשר יעשה מלאכה בהם במים יובא וטמא עד הערב וטהר
(113310, -65, 4);10;י;156795;(3, 11, 32, 71, 156795);41377;(3, 11, 32, 24, 41377);יובא;1;24;וכל אשר יפל עליו מהם במתם יטמא מכל כלי עץ או בגד או עור או שק כל כלי אשר יעשה מלאכה בהם במים יובא וטמא עד הערב וטהר
(113310, -65, 4);40;מ;156860;(3, 11, 34, 1, 156860);41396;(3, 11, 34, 1, 41396);מכל;1;1;מכל האכל אשר יאכל אשר יבוא עליו מים יטמא וכל משקה אשר ישתה בכל כלי יטמא
(113310, -65, 4);40;מ;156925;(3, 11, 35, 10, 156925);41415;(3, 11, 35, 4, 41415);מנבלתם;1;4;וכל אשר יפל מנבלתם עליו יטמא תנור וכירים יתץ טמאים הם וטמאים יהיו לכם
(113310, -65, 4);5;ה;156990;(3, 11, 36, 19, 156990);41431;(3, 11, 36, 6, 41431);יהיה;2;6;אך מעין ובור מקוה מים יהיה טהור ונגע בנבלתם יטמא
(113310, -65, 4);10;י;157055;(3, 11, 38, 8, 157055);41449;(3, 11, 38, 3, 41449);מים;2;3;וכי יתן מים על זרע ונפל מנבלתם עליו טמא הוא לכם
(113310, -65, 4);30;ל;157120;(3, 11, 39, 36, 157120);41467;(3, 11, 39, 10, 41467);בנבלתה;4;10;וכי ימות מן הבהמה אשר היא לכם לאכלה הנגע בנבלתה יטמא עד הערב
