(164051, -94, 4);5;ה;77195;(1, 50, 11, 21, 77195);20384;(1, 50, 11, 6, 20384);האבל;1;6;וירא יושב הארץ הכנעני את האבל בגרן האטד ויאמרו אבל כבד זה למצרים על כן קרא שמה אבל מצרים אשר בעבר הירדן
(164051, -94, 4);1;א;77289;(1, 50, 13, 13, 77289);20410;(1, 50, 13, 4, 20410);ארצה;1;4;וישאו אתו בניו ארצה כנען ויקברו אתו במערת שדה המכפלה אשר קנה אברהם את השדה לאחזת קבר מאת עפרן החתי על פני ממרא
(164051, -94, 4);1;א;77383;(1, 50, 14, 19, 77383);20434;(1, 50, 14, 5, 20434);ואחיו;2;5;וישב יוסף מצרימה הוא ואחיו וכל העלים אתו לקבר את אביו אחרי קברו את אביו
(164051, -94, 4);200;ר;77477;(1, 50, 15, 56, 77477);20460;(1, 50, 15, 16, 20460);הרעה;2;16;ויראו אחי יוסף כי מת אביהם ויאמרו לו ישטמנו יוסף והשב ישיב לנו את כל הרעה אשר גמלנו אתו
(164051, -94, 4);300;ש;77571;(1, 50, 17, 47, 77571);20486;(1, 50, 17, 14, 20486);שא;1;14;כה תאמרו ליוסף אנא שא נא פשע אחיך וחטאתם כי רעה גמלוך ועתה שא נא לפשע עבדי אלהי אביך ויבך יוסף בדברם אליו
(164051, -94, 4);1;א;77665;(1, 50, 19, 19, 77665);20509;(1, 50, 19, 5, 20509);תיראו;4;5;ויאמר אלהם יוסף אל תיראו כי התחת אלהים אני
(164051, -94, 4);9;ט;77759;(1, 50, 21, 28, 77759);20535;(1, 50, 21, 8, 20535);טפכם;1;8;ועתה אל תיראו אנכי אכלכל אתכם ואת טפכם וינחם אותם וידבר על לבם
(164051, -94, 4);40;מ;77853;(1, 50, 23, 28, 77853);20559;(1, 50, 23, 8, 20559);מכיר;1;8;וירא יוסף לאפרים בני שלשים גם בני מכיר בן מנשה ילדו על ברכי יוסף
(164051, -94, 4);30;ל;77947;(1, 50, 24, 71, 77947);20585;(1, 50, 24, 20, 20585);לאברהם;1;20;ויאמר יוסף אל אחיו אנכי מת ואלהים פקד יפקד אתכם והעלה אתכם מן הארץ הזאת אל הארץ אשר נשבע לאברהם ליצחק וליעקב
(164051, -94, 4);10;י;78041;(1, 50, 26, 23, 78041);20608;(1, 50, 26, 7, 20608);ויחנטו;2;7;וימת יוסף בן מאה ועשר שנים ויחנטו אתו ויישם בארון במצרים
(164051, -94, 4);6;ו;78135;(2, 1, 3, 8, 78135);20629;(2, 1, 3, 2, 20629);זבולן;3;2;יששכר זבולן ובנימן
(164051, -94, 4);10;י;78229;(2, 1, 7, 4, 78229);20653;(2, 1, 7, 1, 20653);ובני;4;1;ובני ישראל פרו וישרצו וירבו ויעצמו במאד מאד ותמלא הארץ אתם
(164051, -94, 4);10;י;78323;(2, 1, 9, 19, 78323);20680;(2, 1, 9, 7, 20680);ישראל;1;7;ויאמר אל עמו הנה עם בני ישראל רב ועצום ממנו
(164051, -94, 4);10;י;78417;(2, 1, 11, 9, 78417);20704;(2, 1, 11, 2, 20704);עליו;3;2;וישימו עליו שרי מסים למען ענתו בסבלתם ויבן ערי מסכנות לפרעה את פתם ואת רעמסס
(164051, -94, 4);1;א;78511;(2, 1, 12, 41, 78511);20728;(2, 1, 12, 11, 20728);ישראל;4;11;וכאשר יענו אתו כן ירבה וכן יפרץ ויקצו מפני בני ישראל
(164051, -94, 4);6;ו;78605;(2, 1, 15, 1, 78605);20752;(2, 1, 15, 1, 20752);ויאמר;1;1;ויאמר מלך מצרים למילדת העברית אשר שם האחת שפרה ושם השנית פועה
(164051, -94, 4);400;ת;78699;(2, 1, 16, 45, 78699);20774;(2, 1, 16, 11, 20774);והמתן;4;11;ויאמר בילדכן את העבריות וראיתן על האבנים אם בן הוא והמתן אתו ואם בת הוא וחיה
(164051, -94, 4);4;ד;78793;(2, 1, 18, 18, 78793);20797;(2, 1, 18, 4, 20797);למילדת;5;4;ויקרא מלך מצרים למילדת ויאמר להן מדוע עשיתן הדבר הזה ותחיין את הילדים
(164051, -94, 4);6;ו;78887;(2, 1, 19, 55, 78887);20820;(2, 1, 19, 14, 20820);תבוא;3;14;ותאמרן המילדת אל פרעה כי לא כנשים המצרית העברית כי חיות הנה בטרם תבוא אלהן המילדת וילדו
(164051, -94, 4);30;ל;78981;(2, 1, 22, 11, 78981);20842;(2, 1, 22, 3, 20842);לכל;3;3;ויצו פרעה לכל עמו לאמר כל הבן הילוד היארה תשליכהו וכל הבת תחיון
(164051, -94, 4);1;א;79075;(2, 2, 2, 29, 79075);20869;(2, 2, 2, 9, 20869);הוא;3;9;ותהר האשה ותלד בן ותרא אתו כי טוב הוא ותצפנהו שלשה ירחים
(164051, -94, 4);1;א;79169;(2, 2, 4, 6, 79169);20894;(2, 2, 4, 2, 20894);אחתו;1;2;ותתצב אחתו מרחק לדעה מה יעשה לו
(164051, -94, 4);400;ת;79263;(2, 2, 6, 2, 79263);20920;(2, 2, 6, 1, 20920);ותפתח;2;1;ותפתח ותראהו את הילד והנה נער בכה ותחמל עליו ותאמר מילדי העברים זה
(164051, -94, 4);2;ב;79357;(2, 2, 7, 42, 79357);20944;(2, 2, 7, 12, 20944);העברית;3;12;ותאמר אחתו אל בת פרעה האלך וקראתי לך אשה מינקת מן העברית ותינק לך את הילד
(164051, -94, 4);50;נ;79451;(2, 2, 9, 40, 79451);20970;(2, 2, 9, 11, 20970);ואני;3;11;ותאמר לה בת פרעה היליכי את הילד הזה והינקהו לי ואני אתן את שכרך ותקח האשה הילד ותניקהו
(164051, -94, 4);10;י;79545;(2, 2, 11, 4, 79545);20994;(2, 2, 11, 1, 20994);ויהי;4;1;ויהי בימים ההם ויגדל משה ויצא אל אחיו וירא בסבלתם וירא איש מצרי מכה איש עברי מאחיו
(164051, -94, 4);6;ו;79639;(2, 2, 12, 32, 79639);21021;(2, 2, 12, 11, 21021);ויטמנהו;1;11;ויפן כה וכה וירא כי אין איש ויך את המצרי ויטמנהו בחול
(164051, -94, 4);1;א;79733;(2, 2, 14, 33, 79733);21044;(2, 2, 14, 9, 21044);אתה;1;9;ויאמר מי שמך לאיש שר ושפט עלינו הלהרגני אתה אמר כאשר הרגת את המצרי ויירא משה ויאמר אכן נודע הדבר
(164051, -94, 4);10;י;79827;(2, 2, 15, 50, 79827);21069;(2, 2, 15, 14, 21069);וישב;2;14;וישמע פרעה את הדבר הזה ויבקש להרג את משה ויברח משה מפני פרעה וישב בארץ מדין וישב על הבאר
(164051, -94, 4);40;ם;79921;(2, 2, 17, 17, 79921);21089;(2, 2, 17, 3, 21089);ויגרשום;7;3;ויבאו הרעים ויגרשום ויקם משה ויושען וישק את צאנם
(164051, -94, 4);5;ה;80015;(2, 2, 19, 33, 80015);21112;(2, 2, 19, 8, 21112);דלה;3;8;ותאמרן איש מצרי הצילנו מיד הרעים וגם דלה דלה לנו וישק את הצאן
(164051, -94, 4);30;ל;80109;(2, 2, 21, 32, 80109);21140;(2, 2, 21, 10, 21140);למשה;1;10;ויואל משה לשבת את האיש ויתן את צפרה בתו למשה
(164051, -94, 4);5;ה;80203;(2, 2, 23, 50, 80203);21164;(2, 2, 23, 12, 21164);העבדה;5;12;ויהי בימים הרבים ההם וימת מלך מצרים ויאנחו בני ישראל מן העבדה ויזעקו ותעל שועתם אל האלהים מן העבדה
(164051, -94, 4);1;א;80297;(2, 2, 25, 10, 80297);21188;(2, 2, 25, 3, 21188);את;1;3;וירא אלהים את בני ישראל וידע אלהים
(164051, -94, 4);10;י;80391;(2, 3, 2, 9, 80391);21214;(2, 3, 2, 3, 21214);יהוה;1;3;וירא מלאך יהוה אליו בלבת אש מתוך הסנה וירא והנה הסנה בער באש והסנה איננו אכל
(164051, -94, 4);70;ע;80485;(2, 3, 3, 42, 80485);21239;(2, 3, 3, 12, 21239);יבער;3;12;ויאמר משה אסרה נא ואראה את המראה הגדל הזה מדוע לא יבער הסנה
(164051, -94, 4);20;כ;80579;(2, 3, 5, 30, 80579);21264;(2, 3, 5, 9, 21264);כי;1;9;ויאמר אל תקרב הלם של נעליך מעל רגליך כי המקום אשר אתה עומד עליו אדמת קדש הוא
(164051, -94, 4);10;י;80673;(2, 3, 6, 64, 80673);21288;(2, 3, 6, 16, 21288);מהביט;4;16;ויאמר אנכי אלהי אביך אלהי אברהם אלהי יצחק ואלהי יעקב ויסתר משה פניו כי ירא מהביט אל האלהים
(164051, -94, 4);40;מ;80767;(2, 3, 8, 14, 80767);21312;(2, 3, 8, 4, 21312);מצרים;1;4;וארד להצילו מיד מצרים ולהעלתו מן הארץ ההוא אל ארץ טובה ורחבה אל ארץ זבת חלב ודבש אל מקום הכנעני והחתי והאמרי והפרזי והחוי והיבוסי
(164051, -94, 4);400;ת;80861;(2, 3, 9, 3, 80861);21334;(2, 3, 9, 1, 21334);ועתה;3;1;ועתה הנה צעקת בני ישראל באה אלי וגם ראיתי את הלחץ אשר מצרים לחצים אתם
(164051, -94, 4);10;י;80955;(2, 3, 10, 42, 80955);21359;(2, 3, 10, 11, 21359);ממצרים;5;11;ועתה לכה ואשלחך אל פרעה והוצא את עמי בני ישראל ממצרים
(164051, -94, 4);2;ב;81049;(2, 3, 12, 36, 81049);21386;(2, 3, 12, 11, 21386);בהוציאך;1;11;ויאמר כי אהיה עמך וזה לך האות כי אנכי שלחתיך בהוציאך את העם ממצרים תעבדון את האלהים על ההר הזה
(164051, -94, 4);40;ם;81143;(2, 3, 13, 55, 81143);21409;(2, 3, 13, 14, 21409);אבותיכם;7;14;ויאמר משה אל האלהים הנה אנכי בא אל בני ישראל ואמרתי להם אלהי אבותיכם שלחני אליכם ואמרו לי מה שמו מה אמר אלהם
(164051, -94, 4);1;א;81237;(2, 3, 15, 3, 81237);21434;(2, 3, 15, 1, 21434);ויאמר;3;1;ויאמר עוד אלהים אל משה כה תאמר אל בני ישראל יהוה אלהי אבתיכם אלהי אברהם אלהי יצחק ואלהי יעקב שלחני אליכם זה שמי לעלם וזה זכרי לדר דר
(164051, -94, 4);7;ז;81331;(2, 3, 15, 97, 81331);21459;(2, 3, 15, 26, 21459);זכרי;1;26;ויאמר עוד אלהים אל משה כה תאמר אל בני ישראל יהוה אלהי אבתיכם אלהי אברהם אלהי יצחק ואלהי יעקב שלחני אליכם זה שמי לעלם וזה זכרי לדר דר
(164051, -94, 4);5;ה;81425;(2, 3, 16, 86, 81425);21483;(2, 3, 16, 22, 21483);העשוי;1;22;לך ואספת את זקני ישראל ואמרת אלהם יהוה אלהי אבתיכם נראה אלי אלהי אברהם יצחק ויעקב לאמר פקד פקדתי אתכם ואת העשוי לכם במצרים
(164051, -94, 4);6;ו;81519;(2, 3, 18, 5, 81519);21504;(2, 3, 18, 1, 21504);ושמעו;5;1;ושמעו לקלך ובאת אתה וזקני ישראל אל מלך מצרים ואמרתם אליו יהוה אלהי העבריים נקרה עלינו ועתה נלכה נא דרך שלשת ימים במדבר ונזבחה ליהוה אלהינו
(164051, -94, 4);7;ז;81613;(2, 3, 18, 99, 81613);21527;(2, 3, 18, 24, 21527);ונזבחה;3;24;ושמעו לקלך ובאת אתה וזקני ישראל אל מלך מצרים ואמרתם אליו יהוה אלהי העבריים נקרה עלינו ועתה נלכה נא דרך שלשת ימים במדבר ונזבחה ליהוה אלהינו
(164051, -94, 4);70;ע;81707;(2, 3, 20, 38, 81707);21551;(2, 3, 20, 10, 21551);אעשה;2;10;ושלחתי את ידי והכיתי את מצרים בכל נפלאתי אשר אעשה בקרבו ואחרי כן ישלח אתכם
(164051, -94, 4);10;י;81801;(2, 3, 22, 26, 81801);21575;(2, 3, 22, 6, 21575);כלי;3;6;ושאלה אשה משכנתה ומגרת ביתה כלי כסף וכלי זהב ושמלת ושמתם על בניכם ועל בנתיכם ונצלתם את מצרים
(164051, -94, 4);30;ל;81895;(2, 4, 1, 45, 81895);21600;(2, 4, 1, 13, 21600);לא;1;13;ויען משה ויאמר והן לא יאמינו לי ולא ישמעו בקלי כי יאמרו לא נראה אליך יהוה
(164051, -94, 4);10;י;81989;(2, 4, 4, 6, 81989);21622;(2, 4, 4, 2, 21622);יהוה;1;2;ויאמר יהוה אל משה שלח ידך ואחז בזנבו וישלח ידו ויחזק בו ויהי למטה בכפו
(164051, -94, 4);5;ה;82083;(2, 4, 5, 44, 82083);21646;(2, 4, 5, 11, 21646);אלהי;3;11;למען יאמינו כי נראה אליך יהוה אלהי אבתם אלהי אברהם אלהי יצחק ואלהי יעקב
(164051, -94, 4);10;י;82177;(2, 4, 7, 19, 82177);21671;(2, 4, 7, 6, 21671);וישב;2;6;ויאמר השב ידך אל חיקך וישב ידו אל חיקו ויוצאה מחיקו והנה שבה כבשרו
(164051, -94, 4);1;א;82271;(2, 4, 9, 5, 82271);21695;(2, 4, 9, 2, 21695);אם;1;2;והיה אם לא יאמינו גם לשני האתות האלה ולא ישמעון לקלך ולקחת ממימי היאר ושפכת היבשה והיו המים אשר תקח מן היאר והיו לדם ביבשת
(164051, -94, 4);6;ו;82365;(2, 4, 10, 1, 82365);21719;(2, 4, 10, 1, 21719);ויאמר;1;1;ויאמר משה אל יהוה בי אדני לא איש דברים אנכי גם מתמול גם משלשם גם מאז דברך אל עבדך כי כבד פה וכבד לשון אנכי
(164051, -94, 4);6;ו;82459;(2, 4, 11, 13, 82459);21746;(2, 4, 11, 3, 21746);אליו;4;3;ויאמר יהוה אליו מי שם פה לאדם או מי ישום אלם או חרש או פקח או עור הלא אנכי יהוה
(164051, -94, 4);300;ש;82553;(2, 4, 13, 12, 82553);21776;(2, 4, 13, 4, 21776);שלח;1;4;ויאמר בי אדני שלח נא ביד תשלח
(164051, -94, 4);4;ד;82647;(2, 4, 15, 2, 82647);21802;(2, 4, 15, 1, 21802);ודברת;2;1;ודברת אליו ושמת את הדברים בפיו ואנכי אהיה עם פיך ועם פיהו והוריתי אתכם את אשר תעשון
(164051, -94, 4);80;פ;82741;(2, 4, 16, 29, 82741);21828;(2, 4, 16, 10, 21828);לפה;2;10;ודבר הוא לך אל העם והיה הוא יהיה לך לפה ואתה תהיה לו לאלהים
(164051, -94, 4);1;א;82835;(2, 4, 18, 45, 82835);21856;(2, 4, 18, 14, 21856);אשר;1;14;וילך משה וישב אל יתר חתנו ויאמר לו אלכה נא ואשובה אל אחי אשר במצרים ואראה העודם חיים ויאמר יתרו למשה לך לשלום
(164051, -94, 4);80;פ;82929;(2, 4, 19, 52, 82929);21880;(2, 4, 19, 15, 21880);נפשך;2;15;ויאמר יהוה אל משה במדין לך שב מצרים כי מתו כל האנשים המבקשים את נפשך
(164051, -94, 4);90;צ;83023;(2, 4, 21, 25, 83023);21905;(2, 4, 21, 7, 21905);מצרימה;2;7;ויאמר יהוה אל משה בלכתך לשוב מצרימה ראה כל המפתים אשר שמתי בידך ועשיתם לפני פרעה ואני אחזק את לבו ולא ישלח את העם
(164051, -94, 4);300;ש;83117;(2, 4, 22, 29, 83117);21931;(2, 4, 22, 9, 21931);ישראל;2;9;ואמרת אל פרעה כה אמר יהוה בני בכרי ישראל
(164051, -94, 4);90;צ;83211;(2, 4, 25, 5, 83211);21954;(2, 4, 25, 2, 21954);צפרה;1;2;ותקח צפרה צר ותכרת את ערלת בנה ותגע לרגליו ותאמר כי חתן דמים אתה לי
(164051, -94, 4);200;ר;83305;(2, 4, 27, 20, 83305);21980;(2, 4, 27, 6, 21980);לקראת;3;6;ויאמר יהוה אל אהרן לך לקראת משה המדברה וילך ויפגשהו בהר האלהים וישק לו
(164051, -94, 4);5;ה;83399;(2, 4, 29, 10, 83399);22005;(2, 4, 29, 3, 22005);ואהרן;3;3;וילך משה ואהרן ויאספו את כל זקני בני ישראל
(164051, -94, 4);10;י;83493;(2, 4, 31, 20, 83493);22031;(2, 4, 31, 6, 22031);יהוה;1;6;ויאמן העם וישמעו כי פקד יהוה את בני ישראל וכי ראה את ענים ויקדו וישתחוו
(164051, -94, 4);3;ג;83587;(2, 5, 1, 57, 83587);22056;(2, 5, 1, 16, 22056);ויחגו;4;16;ואחר באו משה ואהרן ויאמרו אל פרעה כה אמר יהוה אלהי ישראל שלח את עמי ויחגו לי במדבר
(164051, -94, 4);1;א;83681;(2, 5, 3, 20, 83681);22081;(2, 5, 3, 4, 22081);נקרא;4;4;ויאמרו אלהי העברים נקרא עלינו נלכה נא דרך שלשת ימים במדבר ונזבחה ליהוה אלהינו פן יפגענו בדבר או בחרב
(164051, -94, 4);10;י;83775;(2, 5, 4, 32, 83775);22104;(2, 5, 4, 8, 22104);תפריעו;4;8;ויאמר אלהם מלך מצרים למה משה ואהרן תפריעו את העם ממעשיו לכו לסבלתיכם
(164051, -94, 4);300;ש;83869;(2, 5, 6, 31, 83869);22128;(2, 5, 6, 9, 22128);שטריו;1;9;ויצו פרעה ביום ההוא את הנגשים בעם ואת שטריו לאמר
(164051, -94, 4);300;ש;83963;(2, 5, 8, 33, 83963);22152;(2, 5, 8, 9, 22152);תשימו;2;9;ואת מתכנת הלבנים אשר הם עשים תמול שלשם תשימו עליהם לא תגרעו ממנו כי נרפים הם על כן הם צעקים לאמר נלכה נזבחה לאלהינו
(164051, -94, 4);200;ר;84057;(2, 5, 9, 35, 84057);22176;(2, 5, 9, 9, 22176);בדברי;4;9;תכבד העבדה על האנשים ויעשו בה ואל ישעו בדברי שקר
(164051, -94, 4);40;מ;84151;(2, 5, 11, 34, 84151);22203;(2, 5, 11, 11, 22203);מעבדתכם;1;11;אתם לכו קחו לכם תבן מאשר תמצאו כי אין נגרע מעבדתכם דבר
(164051, -94, 4);2;ב;84245;(2, 5, 14, 9, 84245);22226;(2, 5, 14, 3, 22226);בני;1;3;ויכו שטרי בני ישראל אשר שמו עלהם נגשי פרעה לאמר מדוע לא כליתם חקכם ללבן כתמול שלשם גם תמול גם היום
(164051, -94, 4);30;ל;84339;(2, 5, 15, 25, 84339);22250;(2, 5, 15, 6, 22250);אל;2;6;ויבאו שטרי בני ישראל ויצעקו אל פרעה לאמר למה תעשה כה לעבדיך
(164051, -94, 4);40;ם;84433;(2, 5, 17, 18, 84433);22273;(2, 5, 17, 4, 22273);נרפים;5;4;ויאמר נרפים אתם נרפים על כן אתם אמרים נלכה נזבחה ליהוה
(164051, -94, 4);3;ג;84527;(2, 5, 19, 31, 84527);22299;(2, 5, 19, 9, 22299);תגרעו;2;9;ויראו שטרי בני ישראל אתם ברע לאמר לא תגרעו מלבניכם דבר יום ביומו
(164051, -94, 4);2;ב;84621;(2, 5, 21, 32, 84621);22321;(2, 5, 21, 8, 22321);הבאשתם;2;8;ויאמרו אלהם ירא יהוה עליכם וישפט אשר הבאשתם את ריחנו בעיני פרעה ובעיני עבדיו לתת חרב בידם להרגנו
(164051, -94, 4);10;י;84715;(2, 5, 22, 47, 84715);22344;(2, 5, 22, 13, 22344);שלחתני;6;13;וישב משה אל יהוה ויאמר אדני למה הרעתה לעם הזה למה זה שלחתני
(164051, -94, 4);6;ו;84809;(2, 6, 1, 48, 84809);22372;(2, 6, 1, 14, 22372);וביד;1;14;ויאמר יהוה אל משה עתה תראה אשר אעשה לפרעה כי ביד חזקה ישלחם וביד חזקה יגרשם מארצו
(164051, -94, 4);10;י;84903;(2, 6, 3, 46, 84903);22396;(2, 6, 3, 13, 22396);נודעתי;6;13;וארא אל אברהם אל יצחק ואל יעקב באל שדי ושמי יהוה לא נודעתי להם
(164051, -94, 4);40;ם;84997;(2, 6, 5, 39, 84997);22423;(2, 6, 5, 10, 22423);מעבדים;6;10;וגם אני שמעתי את נאקת בני ישראל אשר מצרים מעבדים אתם ואזכר את בריתי
(164051, -94, 4);9;ט;85091;(2, 6, 6, 79, 85091);22445;(2, 6, 6, 18, 22445);נטויה;2;18;לכן אמר לבני ישראל אני יהוה והוצאתי אתכם מתחת סבלת מצרים והצלתי אתכם מעבדתם וגאלתי אתכם בזרוע נטויה ובשפטים גדלים
(164051, -94, 4);1;א;85185;(2, 6, 8, 4, 85185);22465;(2, 6, 8, 1, 22465);והבאתי;4;1;והבאתי אתכם אל הארץ אשר נשאתי את ידי לתת אתה לאברהם ליצחק וליעקב ונתתי אתה לכם מורשה אני יהוה
(164051, -94, 4);1;א;85279;(2, 6, 9, 23, 85279);22490;(2, 6, 9, 7, 22490);ולא;3;7;וידבר משה כן אל בני ישראל ולא שמעו אל משה מקצר רוח ומעבדה קשה
(164051, -94, 4);10;י;85373;(2, 6, 12, 12, 85373);22516;(2, 6, 12, 3, 22516);לפני;4;3;וידבר משה לפני יהוה לאמר הן בני ישראל לא שמעו אלי ואיך ישמעני פרעה ואני ערל שפתים
(164051, -94, 4);200;ר;85467;(2, 6, 13, 41, 85467);22542;(2, 6, 13, 12, 22542);פרעה;2;12;וידבר יהוה אל משה ואל אהרן ויצום אל בני ישראל ואל פרעה מלך מצרים להוציא את בני ישראל מארץ מצרים
(164051, -94, 4);6;ו;85561;(2, 6, 14, 59, 85561);22565;(2, 6, 14, 15, 22565);ראובן;3;15;אלה ראשי בית אבתם בני ראובן בכר ישראל חנוך ופלוא חצרן וכרמי אלה משפחת ראובן
(164051, -94, 4);200;ר;85655;(2, 6, 16, 33, 85655);22586;(2, 6, 16, 8, 22586);ומררי;4;8;ואלה שמות בני לוי לתלדתם גרשון וקהת ומררי ושני חיי לוי שבע ושלשים ומאת שנה
(164051, -94, 4);300;ש;85749;(2, 6, 18, 43, 85749);22609;(2, 6, 18, 11, 22609);ושלשים;2;11;ובני קהת עמרם ויצהר וחברון ועזיאל ושני חיי קהת שלש ושלשים ומאת שנה
(164051, -94, 4);8;ח;85843;(2, 6, 20, 48, 85843);22634;(2, 6, 20, 15, 22634);חיי;1;15;ויקח עמרם את יוכבד דדתו לו לאשה ותלד לו את אהרן ואת משה ושני חיי עמרם שבע ושלשים ומאת שנה
(164051, -94, 4);6;ו;85937;(2, 6, 23, 27, 85937);22656;(2, 6, 23, 7, 22656);אחות;3;7;ויקח אהרן את אלישבע בת עמינדב אחות נחשון לו לאשה ותלד לו את נדב ואת אביהוא את אלעזר ואת איתמר
(164051, -94, 4);5;ה;86031;(2, 6, 25, 10, 86031);22680;(2, 6, 25, 3, 22680);אהרן;2;3;ואלעזר בן אהרן לקח לו מבנות פוטיאל לו לאשה ותלד לו את פינחס אלה ראשי אבות הלוים למשפחתם
(164051, -94, 4);50;נ;86125;(2, 6, 26, 34, 86125);22705;(2, 6, 26, 10, 22705);בני;2;10;הוא אהרן ומשה אשר אמר יהוה להם הוציאו את בני ישראל מארץ מצרים על צבאתם
(164051, -94, 4);1;א;86219;(2, 6, 28, 16, 86219);22729;(2, 6, 28, 5, 22729);אל;1;5;ויהי ביום דבר יהוה אל משה בארץ מצרים
(164051, -94, 4);70;ע;86313;(2, 6, 30, 22, 86313);22757;(2, 6, 30, 7, 22757);ערל;1;7;ויאמר משה לפני יהוה הן אני ערל שפתים ואיך ישמע אלי פרעה
(164051, -94, 4);200;ר;86407;(2, 7, 2, 22, 86407);22781;(2, 7, 2, 7, 22781);ואהרן;4;7;אתה תדבר את כל אשר אצוך ואהרן אחיך ידבר אל פרעה ושלח את בני ישראל מארצו
(164051, -94, 4);70;ע;86501;(2, 7, 4, 14, 86501);22806;(2, 7, 4, 4, 22806);פרעה;3;4;ולא ישמע אלכם פרעה ונתתי את ידי במצרים והוצאתי את צבאתי את עמי בני ישראל מארץ מצרים בשפטים גדלים
(164051, -94, 4);70;ע;86595;(2, 7, 5, 30, 86595);22830;(2, 7, 5, 9, 22830);על;1;9;וידעו מצרים כי אני יהוה בנטתי את ידי על מצרים והוצאתי את בני ישראל מתוכם
(164051, -94, 4);4;ד;86689;(2, 7, 7, 35, 86689);22855;(2, 7, 7, 10, 22855);בדברם;2;10;ומשה בן שמנים שנה ואהרן בן שלש ושמנים שנה בדברם אל פרעה
(164051, -94, 4);10;י;86783;(2, 7, 9, 60, 86783);22882;(2, 7, 9, 18, 22882);יהי;1;18;כי ידבר אלכם פרעה לאמר תנו לכם מופת ואמרת אל אהרן קח את מטך והשלך לפני פרעה יהי לתנין
(164051, -94, 4);200;ר;86877;(2, 7, 11, 9, 86877);22906;(2, 7, 11, 3, 22906);פרעה;2;3;ויקרא גם פרעה לחכמים ולמכשפים ויעשו גם הם חרטמי מצרים בלהטיהם כן
(164051, -94, 4);2;ב;86971;(2, 7, 13, 7, 86971);22927;(2, 7, 13, 2, 22927);לב;2;2;ויחזק לב פרעה ולא שמע אלהם כאשר דבר יהוה
(164051, -94, 4);30;ל;87065;(2, 7, 15, 36, 87065);22954;(2, 7, 15, 10, 22954);על;2;10;לך אל פרעה בבקר הנה יצא המימה ונצבת לקראתו על שפת היאר והמטה אשר נהפך לנחש תקח בידך
(164051, -94, 4);40;מ;87159;(2, 7, 16, 64, 87159);22978;(2, 7, 16, 16, 22978);שמעת;2;16;ואמרת אליו יהוה אלהי העברים שלחני אליך לאמר שלח את עמי ויעבדני במדבר והנה לא שמעת עד כה
(164051, -94, 4);300;ש;87253;(2, 7, 18, 20, 87253);23005;(2, 7, 18, 5, 23005);ובאש;4;5;והדגה אשר ביאר תמות ובאש היאר ונלאו מצרים לשתות מים מן היאר
(164051, -94, 4);3;ג;87347;(2, 7, 19, 66, 87347);23032;(2, 7, 19, 20, 23032);אגמיהם;2;20;ויאמר יהוה אל משה אמר אל אהרן קח מטך ונטה ידך על מימי מצרים על נהרתם על יאריהם ועל אגמיהם ועל כל מקוה מימיהם ויהיו דם והיה דם בכל ארץ מצרים ובעצים ובאבנים
(164051, -94, 4);1;א;87441;(2, 7, 20, 38, 87441);23056;(2, 7, 20, 11, 23056);את;1;11;ויעשו כן משה ואהרן כאשר צוה יהוה וירם במטה ויך את המים אשר ביאר לעיני פרעה ולעיני עבדיו ויהפכו כל המים אשר ביאר לדם
(164051, -94, 4);6;ו;87535;(2, 7, 21, 40, 87535);23079;(2, 7, 21, 10, 23079);לשתות;4;10;והדגה אשר ביאר מתה ויבאש היאר ולא יכלו מצרים לשתות מים מן היאר ויהי הדם בכל ארץ מצרים
(164051, -94, 4);2;ב;87629;(2, 7, 23, 11, 87629);23104;(2, 7, 23, 3, 23104);ויבא;3;3;ויפן פרעה ויבא אל ביתו ולא שת לבו גם לזאת
