(120469, 64, 4);40;מ;227925;(4, 23, 7, 27, 227925);60127;(4, 23, 7, 8, 60127);מלך;1;8;וישא משלו ויאמר מן ארם ינחני בלק מלך מואב מהררי קדם לכה ארה לי יעקב ולכה זעמה ישראל
(120469, 64, 4);10;י;227989;(4, 23, 8, 25, 227989);60147;(4, 23, 8, 10, 60147);יהוה;1;10;מה אקב לא קבה אל ומה אזעם לא זעם יהוה
(120469, 64, 4);200;ר;228053;(4, 23, 10, 8, 228053);60163;(4, 23, 10, 3, 60163);עפר;3;3;מי מנה עפר יעקב ומספר את רבע ישראל תמת נפשי מות ישרים ותהי אחריתי כמהו
(120469, 64, 4);5;ה;228117;(4, 23, 11, 16, 228117);60180;(4, 23, 11, 5, 60180);מה;2;5;ויאמר בלק אל בלעם מה עשית לי לקב איבי לקחתיך והנה ברכת ברך
(120469, 64, 4);40;מ;228181;(4, 23, 12, 34, 228181);60198;(4, 23, 12, 10, 60198);אשמר;3;10;ויען ויאמר הלא את אשר ישים יהוה בפי אתו אשמר לדבר
(120469, 64, 4);1;א;228245;(4, 23, 13, 59, 228245);60217;(4, 23, 13, 18, 60217);תראה;3;18;ויאמר אליו בלק לך נא אתי אל מקום אחר אשר תראנו משם אפס קצהו תראה וכלו לא תראה וקבנו לי משם
(120469, 64, 4);10;י;228309;(4, 23, 15, 2, 228309);60234;(4, 23, 15, 1, 60234);ויאמר;2;1;ויאמר אל בלק התיצב כה על עלתך ואנכי אקרה כה
(120469, 64, 4);6;ו;228373;(4, 23, 16, 32, 228373);60252;(4, 23, 16, 9, 60252);שוב;2;9;ויקר יהוה אל בלעם וישם דבר בפיו ויאמר שוב אל בלק וכה תדבר
(120469, 64, 4);5;ה;228437;(4, 23, 17, 51, 228437);60271;(4, 23, 17, 15, 60271);יהוה;4;15;ויבא אליו והנו נצב על עלתו ושרי מואב אתו ויאמר לו בלק מה דבר יהוה
(120469, 64, 4);5;ה;228501;(4, 23, 19, 26, 228501);60289;(4, 23, 19, 8, 60289);ההוא;2;8;לא איש אל ויכזב ובן אדם ויתנחם ההוא אמר ולא יעשה ודבר ולא יקימנה
(120469, 64, 4);6;ו;228565;(4, 23, 21, 15, 228565);60306;(4, 23, 21, 5, 60306);ולא;1;5;לא הביט און ביעקב ולא ראה עמל בישראל יהוה אלהיו עמו ותרועת מלך בו
(120469, 64, 4);10;י;228629;(4, 23, 23, 2, 228629);60322;(4, 23, 23, 1, 60322);כי;2;1;כי לא נחש ביעקב ולא קסם בישראל כעת יאמר ליעקב ולישראל מה פעל אל
(120469, 64, 4);1;א;228693;(4, 23, 24, 16, 228693);60340;(4, 23, 24, 5, 60340);וכארי;3;5;הן עם כלביא יקום וכארי יתנשא לא ישכב עד יאכל טרף ודם חללים ישתה
(120469, 64, 4);20;ך;228757;(4, 23, 25, 30, 228757);60359;(4, 23, 25, 10, 60359);ברך;3;10;ויאמר בלק אל בלעם גם קב לא תקבנו גם ברך לא תברכנו
(120469, 64, 4);10;י;228821;(4, 23, 27, 2, 228821);60377;(4, 23, 27, 1, 60377);ויאמר;2;1;ויאמר בלק אל בלעם לכה נא אקחך אל מקום אחר אולי יישר בעיני האלהים וקבתו לי משם
(120469, 64, 4);2;ב;228885;(4, 23, 28, 5, 228885);60395;(4, 23, 28, 2, 60395);בלק;1;2;ויקח בלק את בלעם ראש הפעור הנשקף על פני הישימן
(120469, 64, 4);6;ו;228949;(4, 23, 29, 32, 228949);60413;(4, 23, 29, 10, 60413);והכן;1;10;ויאמר בלעם אל בלק בנה לי בזה שבעה מזבחת והכן לי בזה שבעה פרים ושבעה אילם
(120469, 64, 4);30;ל;229013;(4, 24, 1, 6, 229013);60430;(4, 24, 1, 2, 60430);בלעם;2;2;וירא בלעם כי טוב בעיני יהוה לברך את ישראל ולא הלך כפעם בפעם לקראת נחשים וישת אל המדבר פניו
(120469, 64, 4);50;נ;229077;(4, 24, 1, 70, 229077);60447;(4, 24, 1, 19, 60447);פניו;2;19;וירא בלעם כי טוב בעיני יהוה לברך את ישראל ולא הלך כפעם בפעם לקראת נחשים וישת אל המדבר פניו
(120469, 64, 4);1;א;229141;(4, 24, 3, 11, 229141);60463;(4, 24, 3, 3, 60463);ויאמר;3;3;וישא משלו ויאמר נאם בלעם בנו בער ונאם הגבר שתם העין
(120469, 64, 4);10;י;229205;(4, 24, 4, 34, 229205);60481;(4, 24, 4, 10, 60481);וגלוי;5;10;נאם שמע אמרי אל אשר מחזה שדי יחזה נפל וגלוי עינים
(120469, 64, 4);5;ה;229269;(4, 24, 6, 33, 229269);60496;(4, 24, 6, 8, 60496);יהוה;4;8;כנחלים נטיו כגנת עלי נהר כאהלים נטע יהוה כארזים עלי מים
(120469, 64, 4);10;י;229333;(4, 24, 8, 6, 229333);60512;(4, 24, 8, 2, 60512);מוציאו;4;2;אל מוציאו ממצרים כתועפת ראם לו יאכל גוים צריו ועצמתיהם יגרם וחציו ימחץ
(120469, 64, 4);20;כ;229397;(4, 24, 9, 12, 229397);60527;(4, 24, 9, 4, 60527);וכלביא;2;4;כרע שכב כארי וכלביא מי יקימנו מברכיך ברוך וארריך ארור
(120469, 64, 4);2;ב;229461;(4, 24, 10, 32, 229461);60543;(4, 24, 10, 10, 60543);בלק;1;10;ויחר אף בלק אל בלעם ויספק את כפיו ויאמר בלק אל בלעם לקב איבי קראתיך והנה ברכת ברך זה שלש פעמים
(120469, 64, 4);20;כ;229525;(4, 24, 11, 22, 229525);60561;(4, 24, 11, 7, 60561);כבד;1;7;ועתה ברח לך אל מקומך אמרתי כבד אכבדך והנה מנעך יהוה מכבוד
(120469, 64, 4);200;ר;229589;(4, 24, 12, 40, 229589);60578;(4, 24, 12, 12, 60578);דברתי;3;12;ויאמר בלעם אל בלק הלא גם אל מלאכיך אשר שלחת אלי דברתי לאמר
(120469, 64, 4);30;ל;229653;(4, 24, 13, 58, 229653);60598;(4, 24, 13, 19, 60598);מלבי;2;19;אם יתן לי בלק מלא ביתו כסף וזהב לא אוכל לעבר את פי יהוה לעשות טובה או רעה מלבי אשר ידבר יהוה אתו אדבר
(120469, 64, 4);8;ח;229717;(4, 24, 14, 44, 229717);60615;(4, 24, 14, 12, 60615);באחרית;3;12;ועתה הנני הולך לעמי לכה איעצך אשר יעשה העם הזה לעמך באחרית הימים
(120469, 64, 4);4;ד;229781;(4, 24, 16, 15, 229781);60632;(4, 24, 16, 5, 60632);וידע;3;5;נאם שמע אמרי אל וידע דעת עליון מחזה שדי יחזה נפל וגלוי עינים
(120469, 64, 4);2;ב;229845;(4, 24, 17, 31, 229845);60648;(4, 24, 17, 8, 60648);כוכב;4;8;אראנו ולא עתה אשורנו ולא קרוב דרך כוכב מיעקב וקם שבט מישראל ומחץ פאתי מואב וקרקר כל בני שת
(120469, 64, 4);10;י;229909;(4, 24, 18, 23, 229909);60665;(4, 24, 18, 6, 60665);שעיר;3;6;והיה אדום ירשה והיה ירשה שעיר איביו וישראל עשה חיל
(120469, 64, 4);200;ר;229973;(4, 24, 20, 23, 229973);60680;(4, 24, 20, 6, 60680);ויאמר;5;6;וירא את עמלק וישא משלו ויאמר ראשית גוים עמלק ואחריתו עדי אבד
(120469, 64, 4);2;ב;230037;(4, 24, 21, 38, 230037);60696;(4, 24, 21, 10, 60696);בסלע;1;10;וירא את הקיני וישא משלו ויאמר איתן מושבך ושים בסלע קנך
(120469, 64, 4);10;י;230101;(4, 24, 24, 3, 230101);60715;(4, 24, 24, 1, 60715);וצים;3;1;וצים מיד כתים וענו אשור וענו עבר וגם הוא עדי אבד
(120469, 64, 4);30;ל;230165;(4, 24, 25, 29, 230165);60733;(4, 24, 25, 8, 60733);הלך;2;8;ויקם בלעם וילך וישב למקמו וגם בלק הלך לדרכו
(120469, 64, 4);10;י;230229;(4, 25, 2, 22, 230229);60748;(4, 25, 2, 5, 60748);ויאכל;2;5;ותקראן לעם לזבחי אלהיהן ויאכל העם וישתחוו לאלהיהן
(120469, 64, 4);1;א;230293;(4, 25, 4, 10, 230293);60762;(4, 25, 4, 3, 60762);אל;1;3;ויאמר יהוה אל משה קח את כל ראשי העם והוקע אותם ליהוה נגד השמש וישב חרון אף יהוה מישראל
(120469, 64, 4);40;מ;230357;(4, 25, 5, 6, 230357);60780;(4, 25, 5, 2, 60780);משה;1;2;ויאמר משה אל שפטי ישראל הרגו איש אנשיו הנצמדים לבעל פעור
(120469, 64, 4);1;א;230421;(4, 25, 6, 24, 230421);60796;(4, 25, 6, 7, 60796);אל;1;7;והנה איש מבני ישראל בא ויקרב אל אחיו את המדינית לעיני משה ולעיני כל עדת בני ישראל והמה בכים פתח אהל מועד
(120469, 64, 4);80;פ;230485;(4, 25, 7, 5, 230485);60813;(4, 25, 7, 2, 60813);פינחס;1;2;וירא פינחס בן אלעזר בן אהרן הכהן ויקם מתוך העדה ויקח רמח בידו
(120469, 64, 4);2;ב;230549;(4, 25, 8, 20, 230549);60830;(4, 25, 8, 6, 60830);הקבה;3;6;ויבא אחר איש ישראל אל הקבה וידקר את שניהם את איש ישראל ואת האשה אל קבתה ותעצר המגפה מעל בני ישראל
(120469, 64, 4);40;מ;230613;(4, 25, 9, 7, 230613);60847;(4, 25, 9, 2, 60847);המתים;2;2;ויהיו המתים במגפה ארבעה ועשרים אלף
(120469, 64, 4);300;ש;230677;(4, 25, 11, 24, 230677);60863;(4, 25, 11, 7, 60863);השיב;2;7;פינחס בן אלעזר בן אהרן הכהן השיב את חמתי מעל בני ישראל בקנאו את קנאתי בתוכם ולא כליתי את בני ישראל בקנאתי
(120469, 64, 4);1;א;230741;(4, 25, 12, 4, 230741);60880;(4, 25, 12, 2, 60880);אמר;1;2;לכן אמר הנני נתן לו את בריתי שלום
(120469, 64, 4);30;ל;230805;(4, 25, 13, 42, 230805);60897;(4, 25, 13, 11, 60897);לאלהיו;3;11;והיתה לו ולזרעו אחריו ברית כהנת עולם תחת אשר קנא לאלהיו ויכפר על בני ישראל
(120469, 64, 4);10;י;230869;(4, 25, 14, 46, 230869);60914;(4, 25, 14, 13, 60914);בית;2;13;ושם איש ישראל המכה אשר הכה את המדינית זמרי בן סלוא נשיא בית אב לשמעני
(120469, 64, 4);6;ו;230933;(4, 25, 16, 8, 230933);60931;(4, 25, 16, 2, 60931);יהוה;3;2;וידבר יהוה אל משה לאמר
(120469, 64, 4);30;ל;230997;(4, 25, 18, 31, 230997);60948;(4, 25, 18, 9, 60948);על;2;9;כי צררים הם לכם בנכליהם אשר נכלו לכם על דבר פעור ועל דבר כזבי בת נשיא מדין אחתם המכה ביום המגפה על דבר פעור
(120469, 64, 4);3;ג;231061;(4, 25, 19, 11, 231061);60966;(4, 25, 19, 3, 60966);המגפה;3;3;ויהי אחרי המגפה
(120469, 64, 4);300;ש;231125;(4, 26, 2, 26, 231125);60985;(4, 26, 2, 9, 60985);עשרים;2;9;שאו את ראש כל עדת בני ישראל מבן עשרים שנה ומעלה לבית אבתם כל יצא צבא בישראל
(120469, 64, 4);70;ע;231189;(4, 26, 3, 31, 231189);61001;(4, 26, 3, 8, 61001);על;1;8;וידבר משה ואלעזר הכהן אתם בערבת מואב על ירדן ירחו לאמר
(120469, 64, 4);90;ץ;231253;(4, 26, 4, 51, 231253);61017;(4, 26, 4, 13, 61017);מארץ;4;13;מבן עשרים שנה ומעלה כאשר צוה יהוה את משה ובני ישראל היצאים מארץ מצרים
(120469, 64, 4);80;פ;231317;(4, 26, 6, 8, 231317);61031;(4, 26, 6, 2, 61031);משפחת;3;2;לחצרן משפחת החצרוני לכרמי משפחת הכרמי
(120469, 64, 4);80;ף;231381;(4, 26, 7, 40, 231381);61043;(4, 26, 7, 8, 61043);אלף;3;8;אלה משפחת הראובני ויהיו פקדיהם שלשה וארבעים אלף ושבע מאות ושלשים
(120469, 64, 4);100;ק;231445;(4, 26, 9, 37, 231445);61058;(4, 26, 9, 9, 61058);קרואי;1;9;ובני אליאב נמואל ודתן ואבירם הוא דתן ואבירם קרואי העדה אשר הצו על משה ועל אהרן בעדת קרח בהצתם על יהוה
(120469, 64, 4);1;א;231509;(4, 26, 10, 20, 231509);61076;(4, 26, 10, 6, 61076);אתם;1;6;ותפתח הארץ את פיה ותבלע אתם ואת קרח במות העדה באכל האש את חמשים ומאתים איש ויהיו לנס
(120469, 64, 4);40;מ;231573;(4, 26, 12, 5, 231573);61094;(4, 26, 12, 2, 61094);שמעון;2;2;בני שמעון למשפחתם לנמואל משפחת הנמואלי לימין משפחת הימיני ליכין משפחת היכיני
(120469, 64, 4);8;ח;231637;(4, 26, 13, 4, 231637);61105;(4, 26, 13, 1, 61105);לזרח;4;1;לזרח משפחת הזרחי לשאול משפחת השאולי
(120469, 64, 4);4;ד;231701;(4, 26, 15, 5, 231701);61119;(4, 26, 15, 2, 61119);גד;2;2;בני גד למשפחתם לצפון משפחת הצפוני לחגי משפחת החגי לשוני משפחת השוני
(120469, 64, 4);7;ז;231765;(4, 26, 16, 13, 231765);61132;(4, 26, 16, 3, 61132);האזני;3;3;לאזני משפחת האזני לערי משפחת הערי
(120469, 64, 4);100;ק;231829;(4, 26, 18, 16, 231829);61146;(4, 26, 18, 5, 61146);לפקדיהם;3;5;אלה משפחת בני גד לפקדיהם ארבעים אלף וחמש מאות
(120469, 64, 4);10;י;231893;(4, 26, 20, 9, 231893);61162;(4, 26, 20, 3, 61162);יהודה;1;3;ויהיו בני יהודה למשפחתם לשלה משפחת השלני לפרץ משפחת הפרצי לזרח משפחת הזרחי
(120469, 64, 4);90;ץ;231957;(4, 26, 21, 11, 231957);61175;(4, 26, 21, 3, 61175);פרץ;3;3;ויהיו בני פרץ לחצרן משפחת החצרני לחמול משפחת החמולי
(120469, 64, 4);80;ף;232021;(4, 26, 22, 32, 232021);61188;(4, 26, 22, 7, 61188);אלף;3;7;אלה משפחת יהודה לפקדיהם ששה ושבעים אלף וחמש מאות
(120469, 64, 4);10;י;232085;(4, 26, 24, 12, 232085);61202;(4, 26, 24, 3, 61202);הישבי;2;3;לישוב משפחת הישבי לשמרן משפחת השמרני
(120469, 64, 4);7;ז;232149;(4, 26, 26, 4, 232149);61216;(4, 26, 26, 2, 61216);זבולן;1;2;בני זבולן למשפחתם לסרד משפחת הסרדי לאלון משפחת האלני ליחלאל משפחת היחלאלי
(120469, 64, 4);80;פ;232213;(4, 26, 27, 6, 232213);61228;(4, 26, 27, 2, 61228);משפחת;3;2;אלה משפחת הזבולני לפקדיהם ששים אלף וחמש מאות
(120469, 64, 4);40;מ;232277;(4, 26, 29, 9, 232277);61242;(4, 26, 29, 3, 61242);למכיר;2;3;בני מנשה למכיר משפחת המכירי ומכיר הוליד את גלעד לגלעד משפחת הגלעדי
(120469, 64, 4);80;פ;232341;(4, 26, 30, 18, 232341);61256;(4, 26, 30, 5, 61256);משפחת;3;5;אלה בני גלעד איעזר משפחת האיעזרי לחלק משפחת החלקי
(120469, 64, 4);300;ש;232405;(4, 26, 32, 8, 232405);61268;(4, 26, 32, 2, 61268);משפחת;2;2;ושמידע משפחת השמידעי וחפר משפחת החפרי
(120469, 64, 4);80;פ;232469;(4, 26, 33, 40, 232469);61285;(4, 26, 33, 13, 61285);צלפחד;3;13;וצלפחד בן חפר לא היו לו בנים כי אם בנות ושם בנות צלפחד מחלה ונעה חגלה מלכה ותרצה
(120469, 64, 4);1;א;232533;(4, 26, 35, 1, 232533);61300;(4, 26, 35, 1, 61300);אלה;1;1;אלה בני אפרים למשפחתם לשותלח משפחת השתלחי לבכר משפחת הבכרי לתחן משפחת התחני
(120469, 64, 4);1;א;232597;(4, 26, 36, 2, 232597);61313;(4, 26, 36, 1, 61313);ואלה;2;1;ואלה בני שותלח לערן משפחת הערני
(120469, 64, 4);300;ש;232661;(4, 26, 37, 40, 232661);61327;(4, 26, 37, 9, 61327);וחמש;4;9;אלה משפחת בני אפרים לפקדיהם שנים ושלשים אלף וחמש מאות אלה בני יוסף למשפחתם
(120469, 64, 4);2;ב;232725;(4, 26, 38, 43, 232725);61341;(4, 26, 38, 9, 61341);האשבלי;4;9;בני בנימן למשפחתם לבלע משפחת הבלעי לאשבל משפחת האשבלי לאחירם משפחת האחירמי
(120469, 64, 4);70;ע;232789;(4, 26, 40, 11, 232789);61353;(4, 26, 40, 3, 61353);בלע;3;3;ויהיו בני בלע ארד ונעמן משפחת הארדי לנעמן משפחת הנעמי
(120469, 64, 4);1;א;232853;(4, 26, 41, 31, 232853);61367;(4, 26, 41, 7, 61367);וארבעים;2;7;אלה בני בנימן למשפחתם ופקדיהם חמשה וארבעים אלף ושש מאות
(120469, 64, 4);20;כ;232917;(4, 26, 43, 1, 232917);61382;(4, 26, 43, 1, 61382);כל;1;1;כל משפחת השוחמי לפקדיהם ארבעה וששים אלף וארבע מאות
(120469, 64, 4);400;ת;232981;(4, 26, 44, 23, 232981);61395;(4, 26, 44, 5, 61395);משפחת;5;5;בני אשר למשפחתם לימנה משפחת הימנה לישוי משפחת הישוי לבריעה משפחת הבריעי
(120469, 64, 4);20;כ;233045;(4, 26, 45, 27, 233045);61408;(4, 26, 45, 6, 61408);למלכיאל;4;6;לבני בריעה לחבר משפחת החברי למלכיאל משפחת המלכיאלי
(120469, 64, 4);200;ר;233109;(4, 26, 47, 37, 233109);61423;(4, 26, 47, 9, 61423);וארבע;3;9;אלה משפחת בני אשר לפקדיהם שלשה וחמשים אלף וארבע מאות
(120469, 64, 4);5;ה;233173;(4, 26, 49, 10, 233173);61436;(4, 26, 49, 3, 61436);היצרי;1;3;ליצר משפחת היצרי לשלם משפחת השלמי
(120469, 64, 4);70;ע;233237;(4, 26, 50, 46, 233237);61448;(4, 26, 50, 9, 61448);וארבע;5;9;אלה משפחת נפתלי למשפחתם ופקדיהם חמשה וארבעים אלף וארבע מאות
(120469, 64, 4);200;ר;233301;(4, 26, 52, 18, 233301);61465;(4, 26, 52, 5, 61465);לאמר;4;5;וידבר יהוה אל משה לאמר
(120469, 64, 4);6;ו;233365;(4, 26, 54, 38, 233365);61480;(4, 26, 54, 9, 61480);פקדיו;5;9;לרב תרבה נחלתו ולמעט תמעיט נחלתו איש לפי פקדיו יתן נחלתו
(120469, 64, 4);50;ן;233429;(4, 26, 56, 21, 233429);61497;(4, 26, 56, 6, 61497);בין;3;6;על פי הגורל תחלק נחלתו בין רב למעט
(120469, 64, 4);300;ש;233493;(4, 26, 57, 58, 233493);61511;(4, 26, 57, 12, 61511);משפחת;2;12;ואלה פקודי הלוי למשפחתם לגרשון משפחת הגרשני לקהת משפחת הקהתי למררי משפחת המררי
(120469, 64, 4);8;ח;233557;(4, 26, 58, 56, 233557);61524;(4, 26, 58, 12, 61524);משפחת;4;12;אלה משפחת לוי משפחת הלבני משפחת החברני משפחת המחלי משפחת המושי משפחת הקרחי וקהת הולד את עמרם
(120469, 64, 4);4;ד;233621;(4, 26, 59, 44, 233621);61541;(4, 26, 59, 12, 61541);ותלד;4;12;ושם אשת עמרם יוכבד בת לוי אשר ילדה אתה ללוי במצרים ותלד לעמרם את אהרן ואת משה ואת מרים אחתם
(120469, 64, 4);10;י;233685;(4, 26, 60, 36, 233685);61559;(4, 26, 60, 10, 61559);איתמר;2;10;ויולד לאהרן את נדב ואת אביהוא את אלעזר ואת איתמר
(120469, 64, 4);7;ז;233749;(4, 26, 62, 27, 233749);61574;(4, 26, 62, 7, 61574);זכר;1;7;ויהיו פקדיהם שלשה ועשרים אלף כל זכר מבן חדש ומעלה כי לא התפקדו בתוך בני ישראל כי לא נתן להם נחלה בתוך בני ישראל
(120469, 64, 4);5;ה;233813;(4, 26, 63, 3, 233813);61592;(4, 26, 63, 1, 61592);אלה;3;1;אלה פקודי משה ואלעזר הכהן אשר פקדו את בני ישראל בערבת מואב על ירדן ירחו
(120469, 64, 4);5;ה;233877;(4, 26, 64, 10, 233877);61609;(4, 26, 64, 3, 61609);היה;3;3;ובאלה לא היה איש מפקודי משה ואהרן הכהן אשר פקדו את בני ישראל במדבר סיני
(120469, 64, 4);40;מ;233941;(4, 26, 65, 17, 233941);61627;(4, 26, 65, 6, 61627);ימתו;2;6;כי אמר יהוה להם מות ימתו במדבר ולא נותר מהם איש כי אם כלב בן יפנה ויהושע בן נון
(120469, 64, 4);80;פ;234005;(4, 27, 1, 20, 234005);61645;(4, 27, 1, 5, 61645);חפר;2;5;ותקרבנה בנות צלפחד בן חפר בן גלעד בן מכיר בן מנשה למשפחת מנשה בן יוסף ואלה שמות בנתיו מחלה נעה וחגלה ומלכה ותרצה
(120469, 64, 4);20;כ;234069;(4, 27, 1, 84, 234069);61662;(4, 27, 1, 22, 61662);ומלכה;4;22;ותקרבנה בנות צלפחד בן חפר בן גלעד בן מכיר בן מנשה למשפחת מנשה בן יוסף ואלה שמות בנתיו מחלה נעה וחגלה ומלכה ותרצה
(120469, 64, 4);1;א;234133;(4, 27, 2, 58, 234133);61677;(4, 27, 2, 14, 61677);לאמר;2;14;ותעמדנה לפני משה ולפני אלעזר הכהן ולפני הנשיאם וכל העדה פתח אהל מועד לאמר
(120469, 64, 4);10;י;234197;(4, 27, 3, 62, 234197);61694;(4, 27, 3, 17, 61694);ובנים;4;17;אבינו מת במדבר והוא לא היה בתוך העדה הנועדים על יהוה בעדת קרח כי בחטאו מת ובנים לא היו לו
(120469, 64, 4);6;ו;234261;(4, 27, 5, 1, 234261);61714;(4, 27, 5, 1, 61714);ויקרב;1;1;ויקרב משה את משפטן לפני יהוה
(120469, 64, 4);40;ם;234325;(4, 27, 7, 24, 234325);61731;(4, 27, 7, 7, 61731);להם;3;7;כן בנות צלפחד דברת נתן תתן להם אחזת נחלה בתוך אחי אביהם והעברת את נחלת אביהן להן
(120469, 64, 4);10;י;234389;(4, 27, 8, 24, 234389);61748;(4, 27, 8, 7, 61748);כי;2;7;ואל בני ישראל תדבר לאמר איש כי ימות ובן אין לו והעברתם את נחלתו לבתו
(120469, 64, 4);30;ל;234453;(4, 27, 10, 7, 234453);61767;(4, 27, 10, 3, 61767);לו;1;3;ואם אין לו אחים ונתתם את נחלתו לאחי אביו
(120469, 64, 4);10;י;234517;(4, 27, 11, 39, 234517);61783;(4, 27, 11, 10, 61783);אליו;3;10;ואם אין אחים לאביו ונתתם את נחלתו לשארו הקרב אליו ממשפחתו וירש אתה והיתה לבני ישראל לחקת משפט כאשר צוה יהוה את משה
(120469, 64, 4);30;ל;234581;(4, 27, 12, 11, 234581);61799;(4, 27, 12, 3, 61799);אל;2;3;ויאמר יהוה אל משה עלה אל הר העברים הזה וראה את הארץ אשר נתתי לבני ישראל
(120469, 64, 4);40;מ;234645;(4, 27, 13, 19, 234645);61817;(4, 27, 13, 5, 61817);עמיך;2;5;וראיתה אתה ונאספת אל עמיך גם אתה כאשר נאסף אהרן אחיך
(120469, 64, 4);30;ל;234709;(4, 27, 14, 41, 234709);61833;(4, 27, 14, 10, 61833);לעיניהם;1;10;כאשר מריתם פי במדבר צן במריבת העדה להקדישני במים לעיניהם הם מי מריבת קדש מדבר צן
(120469, 64, 4);300;ש;234773;(4, 27, 16, 22, 234773);61850;(4, 27, 16, 6, 61850);בשר;2;6;יפקד יהוה אלהי הרוחת לכל בשר איש על העדה
(120469, 64, 4);400;ת;234837;(4, 27, 17, 54, 234837);61866;(4, 27, 17, 13, 61866);עדת;3;13;אשר יצא לפניהם ואשר יבא לפניהם ואשר יוציאם ואשר יביאם ולא תהיה עדת יהוה כצאן אשר אין להם רעה
(120469, 64, 4);40;מ;234901;(4, 27, 18, 44, 234901);61887;(4, 27, 18, 15, 61887);וסמכת;3;15;ויאמר יהוה אל משה קח לך את יהושע בן נון איש אשר רוח בו וסמכת את ידך עליו
(120469, 64, 4);400;ת;234965;(4, 27, 20, 4, 234965);61902;(4, 27, 20, 1, 61902);ונתתה;4;1;ונתתה מהודך עליו למען ישמעו כל עדת בני ישראל
(120469, 64, 4);6;ו;235029;(4, 27, 21, 32, 235029);61918;(4, 27, 21, 8, 61918);האורים;3;8;ולפני אלעזר הכהן יעמד ושאל לו במשפט האורים לפני יהוה על פיו יצאו ועל פיו יבאו הוא וכל בני ישראל אתו וכל העדה
(120469, 64, 4);300;ש;235093;(4, 27, 22, 10, 235093);61936;(4, 27, 22, 3, 61936);כאשר;3;3;ויעש משה כאשר צוה יהוה אתו ויקח את יהושע ויעמדהו לפני אלעזר הכהן ולפני כל העדה
(120469, 64, 4);6;ו;235157;(4, 27, 23, 11, 235157);61952;(4, 27, 23, 3, 61952);ידיו;4;3;ויסמך את ידיו עליו ויצוהו כאשר דבר יהוה ביד משה
(120469, 64, 4);30;ל;235221;(4, 28, 2, 19, 235221);61970;(4, 28, 2, 6, 61970);אלהם;2;6;צו את בני ישראל ואמרת אלהם את קרבני לחמי לאשי ריח ניחחי תשמרו להקריב לי במועדו
(120469, 64, 4);200;ר;235285;(4, 28, 3, 20, 235285);61986;(4, 28, 3, 6, 61986);תקריבו;3;6;ואמרת להם זה האשה אשר תקריבו ליהוה כבשים בני שנה תמימם שנים ליום עלה תמיד
(120469, 64, 4);5;ה;235349;(4, 28, 4, 25, 235349);62003;(4, 28, 4, 8, 62003);השני;1;8;את הכבש אחד תעשה בבקר ואת הכבש השני תעשה בין הערבים
(120469, 64, 4);10;י;235413;(4, 28, 6, 6, 235413);62017;(4, 28, 6, 2, 62017);תמיד;3;2;עלת תמיד העשיה בהר סיני לריח ניחח אשה ליהוה
(120469, 64, 4);200;ר;235477;(4, 28, 7, 35, 235477);62033;(4, 28, 7, 9, 62033);שכר;3;9;ונסכו רביעת ההין לכבש האחד בקדש הסך נסך שכר ליהוה
(120469, 64, 4);6;ו;235541;(4, 28, 9, 1, 235541);62049;(4, 28, 9, 1, 62049);וביום;1;1;וביום השבת שני כבשים בני שנה תמימם ושני עשרנים סלת מנחה בלולה בשמן ונסכו
(120469, 64, 4);400;ת;235605;(4, 28, 10, 6, 235605);62064;(4, 28, 10, 2, 62064);שבת;3;2;עלת שבת בשבתו על עלת התמיד ונסכה
(120469, 64, 4);30;ל;235669;(4, 28, 11, 44, 235669);62079;(4, 28, 11, 10, 62079);ואיל;4;10;ובראשי חדשיכם תקריבו עלה ליהוה פרים בני בקר שנים ואיל אחד כבשים בני שנה שבעה תמימם
(120469, 64, 4);200;ר;235733;(4, 28, 12, 41, 235733);62095;(4, 28, 12, 10, 62095);עשרנים;3;10;ושלשה עשרנים סלת מנחה בלולה בשמן לפר האחד ושני עשרנים סלת מנחה בלולה בשמן לאיל האחד
