(n,d,k);LetterGematriaNumberValue;Letter;LetterPositionIndex;LetterCoordinatesD5K;WordNumber;WordCoordinatesDWTK;Found in Word in Text;LetterPositionIndex In Word;WordNumberInVerse;Found In Verse
(38808, -92, 4);10;י;76;(1, 1, 2, 48, 76);20;(1, 1, 2, 13, 20);פני;3;13;והארץ היתה תהו ובהו וחשך על פני תהום ורוח אלהים מרחפת על פני המים
(38808, -92, 4);8;ח;168;(1, 1, 5, 20, 168);44;(1, 1, 5, 5, 44);ולחשך;3;5;ויקרא אלהים לאור יום ולחשך קרא לילה ויהי ערב ויהי בקר יום אחד
(38808, -92, 4);2;ב;260;(1, 1, 7, 19, 260);68;(1, 1, 7, 5, 68);ויבדל;3;5;ויעש אלהים את הרקיע ויבדל בין המים אשר מתחת לרקיע ובין המים אשר מעל לרקיע ויהי כן
(38808, -92, 4);30;ל;352;(1, 1, 9, 7, 352);92;(1, 1, 9, 2, 92);אלהים;2;2;ויאמר אלהים יקוו המים מתחת השמים אל מקום אחד ותראה היבשה ויהי כן
(38808, -92, 4);9;ט;444;(1, 1, 10, 47, 444);115;(1, 1, 10, 12, 115);טוב;1;12;ויקרא אלהים ליבשה ארץ ולמקוה המים קרא ימים וירא אלהים כי טוב
(38808, -92, 4);7;ז;536;(1, 1, 12, 21, 536);141;(1, 1, 12, 6, 141);זרע;1;6;ותוצא הארץ דשא עשב מזריע זרע למינהו ועץ עשה פרי אשר זרעו בו למינהו וירא אלהים כי טוב
(38808, -92, 4);300;ש;628;(1, 1, 14, 24, 628);165;(1, 1, 14, 6, 165);השמים;2;6;ויאמר אלהים יהי מארת ברקיע השמים להבדיל בין היום ובין הלילה והיו לאתת ולמועדים ולימים ושנים
(38808, -92, 4);70;ע;720;(1, 1, 16, 3, 720);185;(1, 1, 16, 1, 185);ויעש;3;1;ויעש אלהים את שני המארת הגדלים את המאור הגדל לממשלת היום ואת המאור הקטן לממשלת הלילה ואת הכוכבים
(38808, -92, 4);10;י;812;(1, 1, 17, 16, 812);206;(1, 1, 17, 4, 206);ברקיע;4;4;ויתן אתם אלהים ברקיע השמים להאיר על הארץ
(38808, -92, 4);10;י;904;(1, 1, 20, 2, 904);229;(1, 1, 20, 1, 229);ויאמר;2;1;ויאמר אלהים ישרצו המים שרץ נפש חיה ועוף יעופף על הארץ על פני רקיע השמים
(38808, -92, 4);5;ה;996;(1, 1, 21, 37, 996);253;(1, 1, 21, 10, 253);הרמשת;1;10;ויברא אלהים את התנינם הגדלים ואת כל נפש החיה הרמשת אשר שרצו המים למינהם ואת כל עוף כנף למינהו וירא אלהים כי טוב
(38808, -92, 4);40;ם;1088;(1, 1, 22, 40, 1088);276;(1, 1, 22, 10, 276);בימים;5;10;ויברך אתם אלהים לאמר פרו ורבו ומלאו את המים בימים והעוף ירב בארץ
(38808, -92, 4);10;י;1180;(1, 1, 25, 2, 1180);300;(1, 1, 25, 1, 300);ויעש;2;1;ויעש אלהים את חית הארץ למינה ואת הבהמה למינה ואת כל רמש האדמה למינהו וירא אלהים כי טוב
(38808, -92, 4);4;ד;1272;(1, 1, 26, 25, 1272);323;(1, 1, 26, 6, 323);כדמותנו;2;6;ויאמר אלהים נעשה אדם בצלמנו כדמותנו וירדו בדגת הים ובעוף השמים ובבהמה ובכל הארץ ובכל הרמש הרמש על הארץ
(38808, -92, 4);1;א;1364;(1, 1, 27, 33, 1364);344;(1, 1, 27, 8, 344);ברא;3;8;ויברא אלהים את האדם בצלמו בצלם אלהים ברא אתו זכר ונקבה ברא אתם
(38808, -92, 4);8;ח;1456;(1, 1, 28, 75, 1456);368;(1, 1, 28, 19, 368);חיה;1;19;ויברך אתם אלהים ויאמר להם אלהים פרו ורבו ומלאו את הארץ וכבשה ורדו בדגת הים ובעוף השמים ובכל חיה הרמשת על הארץ
(38808, -92, 4);30;ל;1548;(1, 1, 29, 79, 1548);398;(1, 1, 29, 27, 398);לאכלה;1;27;ויאמר אלהים הנה נתתי לכם את כל עשב זרע זרע אשר על פני כל הארץ ואת כל העץ אשר בו פרי עץ זרע זרע לכם יהיה לאכלה
(38808, -92, 4);5;ה;1640;(1, 1, 31, 19, 1640);425;(1, 1, 31, 6, 425);עשה;3;6;וירא אלהים את כל אשר עשה והנה טוב מאד ויהי ערב ויהי בקר יום הששי
(38808, -92, 4);6;ו;1732;(1, 2, 2, 39, 1732);448;(1, 2, 2, 9, 448);ביום;3;9;ויכל אלהים ביום השביעי מלאכתו אשר עשה וישבת ביום השביעי מכל מלאכתו אשר עשה
(38808, -92, 4);400;ת;1824;(1, 2, 4, 9, 1824);471;(1, 2, 4, 2, 471);תולדות;6;2;אלה תולדות השמים והארץ בהבראם ביום עשות יהוה אלהים ארץ ושמים
(38808, -92, 4);5;ה;1916;(1, 2, 5, 51, 1916);495;(1, 2, 5, 15, 495);יהוה;4;15;וכל שיח השדה טרם יהיה בארץ וכל עשב השדה טרם יצמח כי לא המטיר יהוה אלהים על הארץ ואדם אין לעבד את האדמה
(38808, -92, 4);80;פ;2008;(1, 2, 7, 33, 2008);521;(1, 2, 7, 9, 521);ויפח;3;9;וייצר יהוה אלהים את האדם עפר מן האדמה ויפח באפיו נשמת חיים ויהי האדם לנפש חיה
(38808, -92, 4);20;כ;2100;(1, 2, 9, 22, 2100);546;(1, 2, 9, 6, 546);כל;1;6;ויצמח יהוה אלהים מן האדמה כל עץ נחמד למראה וטוב למאכל ועץ החיים בתוך הגן ועץ הדעת טוב ורע
(38808, -92, 4);300;ש;2192;(1, 2, 10, 43, 2192);570;(1, 2, 10, 11, 570);ראשים;3;11;ונהר יצא מעדן להשקות את הגן ומשם יפרד והיה לארבעה ראשים
(38808, -92, 4);5;ה;2284;(1, 2, 13, 20, 2284);596;(1, 2, 13, 6, 596);הסובב;1;6;ושם הנהר השני גיחון הוא הסובב את כל ארץ כוש
(38808, -92, 4);70;ע;2376;(1, 2, 15, 29, 2376);620;(1, 2, 15, 8, 620);עדן;1;8;ויקח יהוה אלהים את האדם וינחהו בגן עדן לעבדה ולשמרה
(38808, -92, 4);400;ת;2468;(1, 2, 17, 41, 2468);645;(1, 2, 17, 12, 645);מות;3;12;ומעץ הדעת טוב ורע לא תאכל ממנו כי ביום אכלך ממנו מות תמות
(38808, -92, 4);6;ו;2560;(1, 2, 19, 43, 2560);671;(1, 2, 19, 13, 671);ויבא;1;13;ויצר יהוה אלהים מן האדמה כל חית השדה ואת כל עוף השמים ויבא אל האדם לראות מה יקרא לו וכל אשר יקרא לו האדם נפש חיה הוא שמו
(38808, -92, 4);5;ה;2652;(1, 2, 20, 42, 2652);696;(1, 2, 20, 10, 696);השדה;4;10;ויקרא האדם שמות לכל הבהמה ולעוף השמים ולכל חית השדה ולאדם לא מצא עזר כנגדו
(38808, -92, 4);30;ל;2744;(1, 2, 22, 18, 2744);719;(1, 2, 22, 5, 719);הצלע;3;5;ויבן יהוה אלהים את הצלע אשר לקח מן האדם לאשה ויבאה אל האדם
(38808, -92, 4);7;ז;2836;(1, 2, 24, 7, 2836);745;(1, 2, 24, 3, 745);יעזב;3;3;על כן יעזב איש את אביו ואת אמו ודבק באשתו והיו לבשר אחד
(38808, -92, 4);5;ה;2928;(1, 3, 1, 22, 2928);768;(1, 3, 1, 6, 768);השדה;4;6;והנחש היה ערום מכל חית השדה אשר עשה יהוה אלהים ויאמר אל האשה אף כי אמר אלהים לא תאכלו מכל עץ הגן
(38808, -92, 4);200;ר;3020;(1, 3, 3, 11, 3020);795;(1, 3, 3, 3, 795);אשר;3;3;ומפרי העץ אשר בתוך הגן אמר אלהים לא תאכלו ממנו ולא תגעו בו פן תמתון
(38808, -92, 4);6;ו;3112;(1, 3, 5, 25, 3112);821;(1, 3, 5, 7, 821);ממנו;4;7;כי ידע אלהים כי ביום אכלכם ממנו ונפקחו עיניכם והייתם כאלהים ידעי טוב ורע
(38808, -92, 4);200;ר;3204;(1, 3, 6, 58, 3204);843;(1, 3, 6, 15, 843);מפריו;3;15;ותרא האשה כי טוב העץ למאכל וכי תאוה הוא לעינים ונחמד העץ להשכיל ותקח מפריו ותאכל ותתן גם לאישה עמה ויאכל
(38808, -92, 4);30;ל;3296;(1, 3, 8, 11, 3296);865;(1, 3, 8, 3, 865);קול;3;3;וישמעו את קול יהוה אלהים מתהלך בגן לרוח היום ויתחבא האדם ואשתו מפני יהוה אלהים בתוך עץ הגן
(38808, -92, 4);20;כ;3388;(1, 3, 9, 30, 3388);888;(1, 3, 9, 8, 888);איכה;3;8;ויקרא יהוה אלהים אל האדם ויאמר לו איכה
(38808, -92, 4);400;ת;3480;(1, 3, 11, 53, 3480);913;(1, 3, 11, 15, 913);אכלת;4;15;ויאמר מי הגיד לך כי עירם אתה המן העץ אשר צויתיך לבלתי אכל ממנו אכלת
(38808, -92, 4);30;ל;3572;(1, 3, 13, 50, 3572);937;(1, 3, 13, 12, 937);ואכל;4;12;ויאמר יהוה אלהים לאשה מה זאת עשית ותאמר האשה הנחש השיאני ואכל
(38808, -92, 4);10;י;3664;(1, 3, 15, 11, 3664);963;(1, 3, 15, 3, 963);בינך;2;3;ואיבה אשית בינך ובין האשה ובין זרעך ובין זרעה הוא ישופך ראש ואתה תשופנו עקב
(38808, -92, 4);1;א;3756;(1, 3, 16, 42, 3756);986;(1, 3, 16, 11, 986);ואל;2;11;אל האשה אמר הרבה ארבה עצבונך והרנך בעצב תלדי בנים ואל אישך תשוקתך והוא ימשל בך
(38808, -92, 4);20;ך;3848;(1, 3, 17, 71, 3848);1009;(1, 3, 17, 18, 1009);בעבורך;6;18;ולאדם אמר כי שמעת לקול אשתך ותאכל מן העץ אשר צויתיך לאמר לא תאכל ממנו ארורה האדמה בעבורך בעצבון תאכלנה כל ימי חייך
(38808, -92, 4);70;ע;3940;(1, 3, 19, 41, 3940);1035;(1, 3, 19, 13, 1035);עפר;1;13;בזעת אפיך תאכל לחם עד שובך אל האדמה כי ממנה לקחת כי עפר אתה ואל עפר תשוב
(38808, -92, 4);5;ה;4032;(1, 3, 22, 7, 4032);1060;(1, 3, 22, 2, 1060);יהוה;2;2;ויאמר יהוה אלהים הן האדם היה כאחד ממנו לדעת טוב ורע ועתה פן ישלח ידו ולקח גם מעץ החיים ואכל וחי לעלם
(38808, -92, 4);70;ע;4124;(1, 3, 23, 20, 4124);1085;(1, 3, 23, 5, 1085);עדן;1;5;וישלחהו יהוה אלהים מגן עדן לעבד את האדמה אשר לקח משם
(38808, -92, 4);1;א;4216;(1, 4, 1, 3, 4216);1110;(1, 4, 1, 1, 1110);והאדם;3;1;והאדם ידע את חוה אשתו ותהר ותלד את קין ותאמר קניתי איש את יהוה
(38808, -92, 4);5;ה;4308;(1, 4, 2, 46, 4308);1137;(1, 4, 2, 14, 1137);אדמה;4;14;ותסף ללדת את אחיו את הבל ויהי הבל רעה צאן וקין היה עבד אדמה
(38808, -92, 4);10;י;4400;(1, 4, 5, 5, 4400);1161;(1, 4, 5, 2, 1161);קין;2;2;ואל קין ואל מנחתו לא שעה ויחר לקין מאד ויפלו פניו
(38808, -92, 4);2;ב;4492;(1, 4, 7, 24, 4492);1187;(1, 4, 7, 7, 1187);תיטיב;5;7;הלוא אם תיטיב שאת ואם לא תיטיב לפתח חטאת רבץ ואליך תשוקתו ואתה תמשל בו
(38808, -92, 4);10;י;4584;(1, 4, 9, 6, 4584);1211;(1, 4, 9, 2, 1211);יהוה;1;2;ויאמר יהוה אל קין אי הבל אחיך ויאמר לא ידעתי השמר אחי אנכי
(38808, -92, 4);4;ד;4676;(1, 4, 11, 16, 4676);1237;(1, 4, 11, 5, 1237);האדמה;3;5;ועתה ארור אתה מן האדמה אשר פצתה את פיה לקחת את דמי אחיך מידך
(38808, -92, 4);40;מ;4768;(1, 4, 13, 23, 4768);1266;(1, 4, 13, 7, 1266);מנשוא;1;7;ויאמר קין אל יהוה גדול עוני מנשוא
(38808, -92, 4);300;ש;4860;(1, 4, 15, 23, 4860);1291;(1, 4, 15, 8, 1291);שבעתים;1;8;ויאמר לו יהוה לכן כל הרג קין שבעתים יקם וישם יהוה לקין אות לבלתי הכות אתו כל מצאו
(38808, -92, 4);200;ר;4952;(1, 4, 17, 17, 4952);1315;(1, 4, 17, 5, 1315);ותהר;4;5;וידע קין את אשתו ותהר ותלד את חנוך ויהי בנה עיר ויקרא שם העיר כשם בנו חנוך
(38808, -92, 4);6;ו;5044;(1, 4, 18, 51, 5044);1340;(1, 4, 18, 13, 1340);ומתושאל;1;13;ויולד לחנוך את עירד ועירד ילד את מחויאל ומחייאל ילד את מתושאל ומתושאל ילד את למך
(38808, -92, 4);2;ב;5136;(1, 4, 21, 10, 5136);1367;(1, 4, 21, 3, 1367);יובל;3;3;ושם אחיו יובל הוא היה אבי כל תפש כנור ועוגב
(38808, -92, 4);6;ו;5228;(1, 4, 23, 13, 5228);1393;(1, 4, 23, 3, 1393);לנשיו;5;3;ויאמר למך לנשיו עדה וצלה שמען קולי נשי למך האזנה אמרתי כי איש הרגתי לפצעי וילד לחברתי
(38808, -92, 4);70;ע;5320;(1, 4, 25, 8, 5320);1417;(1, 4, 25, 3, 1417);עוד;1;3;וידע אדם עוד את אשתו ותלד בן ותקרא את שמו שת כי שת לי אלהים זרע אחר תחת הבל כי הרגו קין
(38808, -92, 4);30;ל;5412;(1, 4, 26, 34, 5412);1447;(1, 4, 26, 11, 1447);הוחל;4;11;ולשת גם הוא ילד בן ויקרא את שמו אנוש אז הוחל לקרא בשם יהוה
(38808, -92, 4);40;ם;5504;(1, 5, 2, 37, 5504);1472;(1, 5, 2, 10, 1472);ביום;4;10;זכר ונקבה בראם ויברך אתם ויקרא את שמם אדם ביום הבראם
(38808, -92, 4);4;ד;5596;(1, 5, 4, 40, 5596);1496;(1, 5, 4, 11, 1496);ויולד;5;11;ויהיו ימי אדם אחרי הולידו את שת שמנה מאת שנה ויולד בנים ובנות
(38808, -92, 4);5;ה;5688;(1, 5, 7, 11, 5688);1523;(1, 5, 7, 4, 1523);הולידו;1;4;ויחי שת אחרי הולידו את אנוש שבע שנים ושמנה מאות שנה ויולד בנים ובנות
(38808, -92, 4);300;ש;5780;(1, 5, 9, 10, 5780);1547;(1, 5, 9, 3, 1547);תשעים;2;3;ויחי אנוש תשעים שנה ויולד את קינן
(38808, -92, 4);8;ח;5872;(1, 5, 11, 15, 5872);1571;(1, 5, 11, 5, 1571);חמש;1;5;ויהיו כל ימי אנוש חמש שנים ותשע מאות שנה וימת
(38808, -92, 4);1;א;5964;(1, 5, 13, 42, 5964);1593;(1, 5, 13, 10, 1593);מאות;2;10;ויחי קינן אחרי הולידו את מהללאל ארבעים שנה ושמנה מאות שנה ויולד בנים ובנות
(38808, -92, 4);10;י;6056;(1, 5, 16, 2, 6056);1617;(1, 5, 16, 1, 1617);ויחי;2;1;ויחי מהללאל אחרי הולידו את ירד שלשים שנה ושמנה מאות שנה ויולד בנים ובנות
(38808, -92, 4);1;א;6148;(1, 5, 17, 35, 6148);1639;(1, 5, 17, 9, 1639);מאות;2;9;ויהיו כל ימי מהללאל חמש ותשעים שנה ושמנה מאות שנה וימת
(38808, -92, 4);50;נ;6240;(1, 5, 19, 46, 6240);1663;(1, 5, 19, 12, 1663);ובנות;3;12;ויחי ירד אחרי הולידו את חנוך שמנה מאות שנה ויולד בנים ובנות
(38808, -92, 4);40;ם;6332;(1, 5, 22, 18, 6332);1686;(1, 5, 22, 4, 1686);האלהים;6;4;ויתהלך חנוך את האלהים אחרי הולידו את מתושלח שלש מאות שנה ויולד בנים ובנות
(38808, -92, 4);30;ל;6424;(1, 5, 24, 15, 6424);1710;(1, 5, 24, 4, 1710);האלהים;3;4;ויתהלך חנוך את האלהים ואיננו כי לקח אתו אלהים
(38808, -92, 4);300;ש;6516;(1, 5, 26, 31, 6516);1733;(1, 5, 26, 8, 1733);ושמונים;2;8;ויחי מתושלח אחרי הולידו את למך שתים ושמונים שנה ושבע מאות שנה ויולד בנים ובנות
(38808, -92, 4);40;ם;6608;(1, 5, 28, 17, 6608);1755;(1, 5, 28, 4, 1755);ושמנים;6;4;ויחי למך שתים ושמנים שנה ומאת שנה ויולד בן
(38808, -92, 4);10;י;6700;(1, 5, 30, 15, 6700);1779;(1, 5, 30, 4, 1779);הולידו;4;4;ויחי למך אחרי הולידו את נח חמש ותשעים שנה וחמש מאת שנה ויולד בנים ובנות
(38808, -92, 4);300;ש;6792;(1, 5, 32, 11, 6792);1805;(1, 5, 32, 4, 1805);חמש;3;4;ויהי נח בן חמש מאות שנה ויולד נח את שם את חם ואת יפת
(38808, -92, 4);10;י;6884;(1, 6, 2, 26, 6884);1833;(1, 6, 2, 7, 1833);כי;2;7;ויראו בני האלהים את בנות האדם כי טבת הנה ויקחו להם נשים מכל אשר בחרו
(38808, -92, 4);5;ה;6976;(1, 6, 4, 7, 6976);1858;(1, 6, 4, 2, 1858);היו;1;2;הנפלים היו בארץ בימים ההם וגם אחרי כן אשר יבאו בני האלהים אל בנות האדם וילדו להם המה הגברים אשר מעולם אנשי השם
(38808, -92, 4);200;ר;7068;(1, 6, 5, 11, 7068);1883;(1, 6, 5, 4, 1883);רבה;1;4;וירא יהוה כי רבה רעת האדם בארץ וכל יצר מחשבת לבו רק רע כל היום
(38808, -92, 4);1;א;7160;(1, 6, 7, 20, 7160);1910;(1, 6, 7, 6, 1910);אשר;1;6;ויאמר יהוה אמחה את האדם אשר בראתי מעל פני האדמה מאדם עד בהמה עד רמש ועד עוף השמים כי נחמתי כי עשיתם
(38808, -92, 4);4;ד;7252;(1, 6, 9, 17, 7252);1937;(1, 6, 9, 6, 1937);צדיק;2;6;אלה תולדת נח נח איש צדיק תמים היה בדרתיו את האלהים התהלך נח
(38808, -92, 4);10;י;7344;(1, 6, 12, 2, 7344);1962;(1, 6, 12, 1, 1962);וירא;2;1;וירא אלהים את הארץ והנה נשחתה כי השחית כל בשר את דרכו על הארץ
(38808, -92, 4);6;ו;7436;(1, 6, 13, 46, 7436);1989;(1, 6, 13, 14, 1989);והנני;1;14;ויאמר אלהים לנח קץ כל בשר בא לפני כי מלאה הארץ חמס מפניהם והנני משחיתם את הארץ
(38808, -92, 4);5;ה;7528;(1, 6, 15, 27, 7528);2015;(1, 6, 15, 9, 2015);התבה;1;9;וזה אשר תעשה אתה שלש מאות אמה ארך התבה חמשים אמה רחבה ושלשים אמה קומתה
(38808, -92, 4);5;ה;7620;(1, 6, 16, 63, 7620);2036;(1, 6, 16, 15, 2036);תעשה;4;15;צהר תעשה לתבה ואל אמה תכלנה מלמעלה ופתח התבה בצדה תשים תחתים שנים ושלשים תעשה
(38808, -92, 4);1;א;7712;(1, 6, 18, 21, 7712);2063;(1, 6, 18, 6, 2063);אל;1;6;והקמתי את בריתי אתך ובאת אל התבה אתה ובניך ואשתך ונשי בניך אתך
(38808, -92, 4);40;מ;7804;(1, 6, 20, 13, 7804);2087;(1, 6, 20, 3, 2087);ומן;2;3;מהעוף למינהו ומן הבהמה למינה מכל רמש האדמה למינהו שנים מכל יבאו אליך להחיות
(38808, -92, 4);1;א;7896;(1, 6, 21, 43, 7896);2111;(1, 6, 21, 13, 2111);לאכלה;2;13;ואתה קח לך מכל מאכל אשר יאכל ואספת אליך והיה לך ולהם לאכלה
(38808, -92, 4);5;ה;7988;(1, 7, 2, 6, 7988);2138;(1, 7, 2, 2, 2138);הבהמה;3;2;מכל הבהמה הטהורה תקח לך שבעה שבעה איש ואשתו ומן הבהמה אשר לא טהרה הוא שנים איש ואשתו
(38808, -92, 4);6;ו;8080;(1, 7, 3, 31, 8080);2162;(1, 7, 3, 8, 2162);לחיות;4;8;גם מעוף השמים שבעה שבעה זכר ונקבה לחיות זרע על פני כל הארץ
(38808, -92, 4);50;נ;8172;(1, 7, 4, 77, 8172);2187;(1, 7, 4, 20, 2187);פני;2;20;כי לימים עוד שבעה אנכי ממטיר על הארץ ארבעים יום וארבעים לילה ומחיתי את כל היקום אשר עשיתי מעל פני האדמה
(38808, -92, 4);40;מ;8264;(1, 7, 7, 34, 8264);2214;(1, 7, 7, 10, 2214);מפני;1;10;ויבא נח ובניו ואשתו ונשי בניו אתו אל התבה מפני מי המבול
(38808, -92, 4);50;נ;8356;(1, 7, 9, 26, 8356);2240;(1, 7, 9, 9, 2240);ונקבה;2;9;שנים שנים באו אל נח אל התבה זכר ונקבה כאשר צוה אלהים את נח
(38808, -92, 4);300;ש;8448;(1, 7, 11, 42, 8448);2265;(1, 7, 11, 12, 2265);לחדש;4;12;בשנת שש מאות שנה לחיי נח בחדש השני בשבעה עשר יום לחדש ביום הזה נבקעו כל מעינות תהום רבה וארבת השמים נפתחו
(38808, -92, 4);6;ו;8540;(1, 7, 13, 16, 8540);2289;(1, 7, 13, 6, 2289);ושם;1;6;בעצם היום הזה בא נח ושם וחם ויפת בני נח ואשת נח ושלשת נשי בניו אתם אל התבה
(38808, -92, 4);6;ו;8632;(1, 7, 14, 51, 8632);2314;(1, 7, 14, 13, 2314);למינהו;6;13;המה וכל החיה למינה וכל הבהמה למינה וכל הרמש הרמש על הארץ למינהו וכל העוף למינהו כל צפור כל כנף
(38808, -92, 4);300;ש;8724;(1, 7, 16, 26, 8724);2341;(1, 7, 16, 7, 2341);כאשר;3;7;והבאים זכר ונקבה מכל בשר באו כאשר צוה אתו אלהים ויסגר יהוה בעדו
(38808, -92, 4);10;י;8816;(1, 7, 18, 12, 8816);2364;(1, 7, 18, 3, 2364);וירבו;2;3;ויגברו המים וירבו מאד על הארץ ותלך התבה על פני המים
(38808, -92, 4);40;מ;8908;(1, 7, 20, 11, 8908);2390;(1, 7, 20, 4, 2390);מלמעלה;1;4;חמש עשרה אמה מלמעלה גברו המים ויכסו ההרים
(38808, -92, 4);400;ת;9000;(1, 7, 22, 9, 9000);2413;(1, 7, 22, 3, 2413);נשמת;4;3;כל אשר נשמת רוח חיים באפיו מכל אשר בחרבה מתו
(38808, -92, 4);300;ש;9092;(1, 7, 23, 66, 9092);2440;(1, 7, 23, 20, 2440);וישאר;3;20;וימח את כל היקום אשר על פני האדמה מאדם עד בהמה עד רמש ועד עוף השמים וימחו מן הארץ וישאר אך נח ואשר אתו בתבה
(38808, -92, 4);2;ב;9184;(1, 8, 1, 47, 9184);2466;(1, 8, 1, 14, 2466);ויעבר;4;14;ויזכר אלהים את נח ואת כל החיה ואת כל הבהמה אשר אתו בתבה ויעבר אלהים רוח על הארץ וישכו המים
(38808, -92, 4);8;ח;9276;(1, 8, 3, 27, 9276);2488;(1, 8, 3, 7, 2488);ויחסרו;3;7;וישבו המים מעל הארץ הלוך ושוב ויחסרו המים מקצה חמשים ומאת יום
(38808, -92, 4);10;י;9368;(1, 8, 5, 27, 9368);2511;(1, 8, 5, 7, 2511);העשירי;4;7;והמים היו הלוך וחסור עד החדש העשירי בעשירי באחד לחדש נראו ראשי ההרים
(38808, -92, 4);70;ע;9460;(1, 8, 7, 24, 9460);2535;(1, 8, 7, 7, 2535);עד;1;7;וישלח את הערב ויצא יצוא ושוב עד יבשת המים מעל הארץ
(38808, -92, 4);2;ב;9552;(1, 8, 9, 36, 9552);2559;(1, 8, 9, 10, 2559);התבה;3;10;ולא מצאה היונה מנוח לכף רגלה ותשב אליו אל התבה כי מים על פני כל הארץ וישלח ידו ויקחה ויבא אתה אליו אל התבה
(38808, -92, 4);1;א;9644;(1, 8, 11, 5, 9644);2586;(1, 8, 11, 2, 2586);אליו;1;2;ותבא אליו היונה לעת ערב והנה עלה זית טרף בפיה וידע נח כי קלו המים מעל הארץ
(38808, -92, 4);80;פ;9736;(1, 8, 12, 39, 9736);2611;(1, 8, 12, 10, 2611);יספה;3;10;וייחל עוד שבעת ימים אחרים וישלח את היונה ולא יספה שוב אליו עוד
(38808, -92, 4);4;ד;9828;(1, 8, 13, 81, 9828);2636;(1, 8, 13, 22, 2636);האדמה;3;22;ויהי באחת ושש מאות שנה בראשון באחד לחדש חרבו המים מעל הארץ ויסר נח את מכסה התבה וירא והנה חרבו פני האדמה
(38808, -92, 4);10;י;9920;(1, 8, 17, 5, 9920);2660;(1, 8, 17, 2, 2660);החיה;3;2;כל החיה אשר אתך מכל בשר בעוף ובבהמה ובכל הרמש הרמש על הארץ הוצא אתך ושרצו בארץ ופרו ורבו על הארץ
(38808, -92, 4);2;ב;10012;(1, 8, 18, 21, 10012);2685;(1, 8, 18, 6, 2685);בניו;1;6;ויצא נח ובניו ואשתו ונשי בניו אתו
(38808, -92, 4);30;ל;10104;(1, 8, 20, 36, 10104);2709;(1, 8, 20, 9, 2709);ומכל;4;9;ויבן נח מזבח ליהוה ויקח מכל הבהמה הטהרה ומכל העוף הטהור ויעל עלת במזבח
(38808, -92, 4);40;ם;10196;(1, 8, 21, 71, 10196);2735;(1, 8, 21, 21, 2735);האדם;4;21;וירח יהוה את ריח הניחח ויאמר יהוה אל לבו לא אסף לקלל עוד את האדמה בעבור האדם כי יצר לב האדם רע מנעריו ולא אסף עוד להכות את כל חי כאשר עשיתי
(38808, -92, 4);1;א;10288;(1, 9, 1, 6, 10288);2762;(1, 9, 1, 2, 2762);אלהים;1;2;ויברך אלהים את נח ואת בניו ויאמר להם פרו ורבו ומלאו את הארץ
(38808, -92, 4);5;ה;10380;(1, 9, 2, 51, 10380);2788;(1, 9, 2, 15, 2788);האדמה;1;15;ומוראכם וחתכם יהיה על כל חית הארץ ועל כל עוף השמים בכל אשר תרמש האדמה ובכל דגי הים בידכם נתנו
(38808, -92, 4);4;ד;10472;(1, 9, 5, 6, 10472);2816;(1, 9, 5, 3, 2816);דמכם;1;3;ואך את דמכם לנפשתיכם אדרש מיד כל חיה אדרשנו ומיד האדם מיד איש אחיו אדרש את נפש האדם
(38808, -92, 4);70;ע;10564;(1, 9, 6, 32, 10564);2841;(1, 9, 6, 10, 2841);עשה;1;10;שפך דם האדם באדם דמו ישפך כי בצלם אלהים עשה את האדם
(38808, -92, 4);40;ם;10656;(1, 9, 9, 31, 10656);2866;(1, 9, 9, 8, 2866);זרעכם;5;8;ואני הנני מקים את בריתי אתכם ואת זרעכם אחריכם
(38808, -92, 4);20;כ;10748;(1, 9, 11, 22, 10748);2891;(1, 9, 11, 6, 2891);יכרת;2;6;והקמתי את בריתי אתכם ולא יכרת כל בשר עוד ממי המבול ולא יהיה עוד מבול לשחת הארץ
(38808, -92, 4);10;י;10840;(1, 9, 12, 52, 10840);2916;(1, 9, 12, 14, 2916);חיה;2;14;ויאמר אלהים זאת אות הברית אשר אני נתן ביני וביניכם ובין כל נפש חיה אשר אתכם לדרת עולם
(38808, -92, 4);400;ת;10932;(1, 9, 15, 5, 10932);2939;(1, 9, 15, 1, 2939);וזכרתי;5;1;וזכרתי את בריתי אשר ביני וביניכם ובין כל נפש חיה בכל בשר ולא יהיה עוד המים למבול לשחת כל בשר
