(231976, 64, 4);20;ך;228200;(4, 23, 13, 14, 228200);60203;(4, 23, 13, 4, 60203);לך;2;4;ויאמר אליו בלק לך נא אתי אל מקום אחר אשר תראנו משם אפס קצהו תראה וכלו לא תראה וקבנו לי משם
(231976, 64, 4);4;ד;228264;(4, 23, 14, 8, 228264);60222;(4, 23, 14, 2, 60222);שדה;2;2;ויקחהו שדה צפים אל ראש הפסגה ויבן שבעה מזבחת ויעל פר ואיל במזבח
(231976, 64, 4);30;ל;228328;(4, 23, 15, 21, 228328);60240;(4, 23, 15, 7, 60240);עלתך;2;7;ויאמר אל בלק התיצב כה על עלתך ואנכי אקרה כה
(231976, 64, 4);30;ל;228392;(4, 23, 17, 6, 228392);60258;(4, 23, 17, 2, 60258);אליו;2;2;ויבא אליו והנו נצב על עלתו ושרי מואב אתו ויאמר לו בלק מה דבר יהוה
(231976, 64, 4);100;ק;228456;(4, 23, 18, 19, 228456);60276;(4, 23, 18, 5, 60276);בלק;3;5;וישא משלו ויאמר קום בלק ושמע האזינה עדי בנו צפר
(231976, 64, 4);1;א;228520;(4, 23, 19, 45, 228520);60294;(4, 23, 19, 13, 60294);ולא;3;13;לא איש אל ויכזב ובן אדם ויתנחם ההוא אמר ולא יעשה ודבר ולא יקימנה
(231976, 64, 4);1;א;228584;(4, 23, 21, 34, 228584);60311;(4, 23, 21, 10, 60311);אלהיו;1;10;לא הביט און ביעקב ולא ראה עמל בישראל יהוה אלהיו עמו ותרועת מלך בו
(231976, 64, 4);300;ש;228648;(4, 23, 23, 21, 228648);60328;(4, 23, 23, 7, 60328);בישראל;3;7;כי לא נחש ביעקב ולא קסם בישראל כעת יאמר ליעקב ולישראל מה פעל אל
(231976, 64, 4);30;ל;228712;(4, 23, 24, 35, 228712);60345;(4, 23, 24, 10, 60345);יאכל;4;10;הן עם כלביא יקום וכארי יתנשא לא ישכב עד יאכל טרף ודם חללים ישתה
(231976, 64, 4);1;א;228776;(4, 23, 26, 11, 228776);60364;(4, 23, 26, 3, 60364);ויאמר;3;3;ויען בלעם ויאמר אל בלק הלא דברתי אליך לאמר כל אשר ידבר יהוה אתו אעשה
(231976, 64, 4);100;ק;228840;(4, 23, 27, 21, 228840);60383;(4, 23, 27, 7, 60383);אקחך;2;7;ויאמר בלק אל בלעם לכה נא אקחך אל מקום אחר אולי יישר בעיני האלהים וקבתו לי משם
(231976, 64, 4);300;ש;228904;(4, 23, 28, 24, 228904);60400;(4, 23, 28, 7, 60400);הנשקף;3;7;ויקח בלק את בלעם ראש הפעור הנשקף על פני הישימן
(231976, 64, 4);2;ב;228968;(4, 23, 29, 51, 228968);60418;(4, 23, 29, 15, 60418);ושבעה;3;15;ויאמר בלעם אל בלק בנה לי בזה שבעה מזבחת והכן לי בזה שבעה פרים ושבעה אילם
(231976, 64, 4);200;ר;229032;(4, 24, 1, 25, 229032);60435;(4, 24, 1, 7, 60435);לברך;3;7;וירא בלעם כי טוב בעיני יהוה לברך את ישראל ולא הלך כפעם בפעם לקראת נחשים וישת אל המדבר פניו
(231976, 64, 4);10;י;229096;(4, 24, 2, 17, 229096);60452;(4, 24, 2, 5, 60452);וירא;2;5;וישא בלעם את עיניו וירא את ישראל שכן לשבטיו ותהי עליו רוח אלהים
(231976, 64, 4);40;ם;229160;(4, 24, 3, 30, 229160);60468;(4, 24, 3, 8, 60468);ונאם;4;8;וישא משלו ויאמר נאם בלעם בנו בער ונאם הגבר שתם העין
(231976, 64, 4);2;ב;229224;(4, 24, 5, 14, 229224);60486;(4, 24, 5, 4, 60486);יעקב;4;4;מה טבו אהליך יעקב משכנתיך ישראל
(231976, 64, 4);40;מ;229288;(4, 24, 7, 7, 229288);60502;(4, 24, 7, 3, 60502);מדליו;1;3;יזל מים מדליו וזרעו במים רבים וירם מאגג מלכו ותנשא מלכתו
(231976, 64, 4);6;ו;229352;(4, 24, 8, 25, 229352);60516;(4, 24, 8, 6, 60516);לו;2;6;אל מוציאו ממצרים כתועפת ראם לו יאכל גוים צריו ועצמתיהם יגרם וחציו ימחץ
(231976, 64, 4);2;ב;229416;(4, 24, 9, 31, 229416);60531;(4, 24, 9, 8, 60531);ברוך;1;8;כרע שכב כארי וכלביא מי יקימנו מברכיך ברוך וארריך ארור
(231976, 64, 4);400;ת;229480;(4, 24, 10, 51, 229480);60548;(4, 24, 10, 15, 60548);קראתיך;4;15;ויחר אף בלק אל בלעם ויספק את כפיו ויאמר בלק אל בלעם לקב איבי קראתיך והנה ברכת ברך זה שלש פעמים
(231976, 64, 4);5;ה;229544;(4, 24, 11, 41, 229544);60565;(4, 24, 11, 11, 60565);יהוה;4;11;ועתה ברח לך אל מקומך אמרתי כבד אכבדך והנה מנעך יהוה מכבוד
(231976, 64, 4);1;א;229608;(4, 24, 13, 13, 229608);60584;(4, 24, 13, 5, 60584);מלא;3;5;אם יתן לי בלק מלא ביתו כסף וזהב לא אוכל לעבר את פי יהוה לעשות טובה או רעה מלבי אשר ידבר יהוה אתו אדבר
(231976, 64, 4);2;ב;229672;(4, 24, 13, 77, 229672);60603;(4, 24, 13, 24, 60603);אדבר;3;24;אם יתן לי בלק מלא ביתו כסף וזהב לא אוכל לעבר את פי יהוה לעשות טובה או רעה מלבי אשר ידבר יהוה אתו אדבר
(231976, 64, 4);1;א;229736;(4, 24, 15, 11, 229736);60619;(4, 24, 15, 3, 60619);ויאמר;3;3;וישא משלו ויאמר נאם בלעם בנו בער ונאם הגבר שתם העין
(231976, 64, 4);7;ז;229800;(4, 24, 16, 34, 229800);60637;(4, 24, 16, 10, 60637);יחזה;3;10;נאם שמע אמרי אל וידע דעת עליון מחזה שדי יחזה נפל וגלוי עינים
(231976, 64, 4);40;מ;229864;(4, 24, 17, 50, 229864);60653;(4, 24, 17, 13, 60653);ומחץ;2;13;אראנו ולא עתה אשורנו ולא קרוב דרך כוכב מיעקב וקם שבט מישראל ומחץ פאתי מואב וקרקר כל בני שת
(231976, 64, 4);6;ו;229928;(4, 24, 19, 1, 229928);60670;(4, 24, 19, 1, 60670);וירד;1;1;וירד מיעקב והאביד שריד מעיר
(231976, 64, 4);400;ת;229992;(4, 24, 20, 42, 229992);60684;(4, 24, 20, 10, 60684);ואחריתו;6;10;וירא את עמלק וישא משלו ויאמר ראשית גוים עמלק ואחריתו עדי אבד
(231976, 64, 4);100;ק;230056;(4, 24, 22, 13, 230056);60702;(4, 24, 22, 5, 60702);קין;1;5;כי אם יהיה לבער קין עד מה אשור תשבך
(231976, 64, 4);50;נ;230120;(4, 24, 24, 22, 230120);60720;(4, 24, 24, 6, 60720);וענו;3;6;וצים מיד כתים וענו אשור וענו עבר וגם הוא עדי אבד
(231976, 64, 4);10;י;230184;(4, 25, 1, 13, 230184);60737;(4, 25, 1, 3, 60737);בשטים;4;3;וישב ישראל בשטים ויחל העם לזנות אל בנות מואב
(231976, 64, 4);5;ה;230248;(4, 25, 2, 41, 230248);60751;(4, 25, 2, 8, 60751);לאלהיהן;6;8;ותקראן לעם לזבחי אלהיהן ויאכל העם וישתחוו לאלהיהן
(231976, 64, 4);5;ה;230312;(4, 25, 4, 29, 230312);60769;(4, 25, 4, 10, 60769);והוקע;2;10;ויאמר יהוה אל משה קח את כל ראשי העם והוקע אותם ליהוה נגד השמש וישב חרון אף יהוה מישראל
(231976, 64, 4);10;י;230376;(4, 25, 5, 25, 230376);60785;(4, 25, 5, 7, 60785);איש;2;7;ויאמר משה אל שפטי ישראל הרגו איש אנשיו הנצמדים לבעל פעור
(231976, 64, 4);10;י;230440;(4, 25, 6, 43, 230440);60800;(4, 25, 6, 11, 60800);לעיני;5;11;והנה איש מבני ישראל בא ויקרב אל אחיו את המדינית לעיני משה ולעיני כל עדת בני ישראל והמה בכים פתח אהל מועד
(231976, 64, 4);20;כ;230504;(4, 25, 7, 24, 230504);60818;(4, 25, 7, 7, 60818);הכהן;2;7;וירא פינחס בן אלעזר בן אהרן הכהן ויקם מתוך העדה ויקח רמח בידו
(231976, 64, 4);10;י;230568;(4, 25, 8, 39, 230568);60836;(4, 25, 8, 12, 60836);ישראל;1;12;ויבא אחר איש ישראל אל הקבה וידקר את שניהם את איש ישראל ואת האשה אל קבתה ותעצר המגפה מעל בני ישראל
(231976, 64, 4);40;ם;230632;(4, 25, 9, 26, 230632);60850;(4, 25, 9, 5, 60850);ועשרים;6;5;ויהיו המתים במגפה ארבעה ועשרים אלף
(231976, 64, 4);30;ל;230696;(4, 25, 11, 43, 230696);60868;(4, 25, 11, 12, 60868);ישראל;5;12;פינחס בן אלעזר בן אהרן הכהן השיב את חמתי מעל בני ישראל בקנאו את קנאתי בתוכם ולא כליתי את בני ישראל בקנאתי
(231976, 64, 4);300;ש;230760;(4, 25, 12, 23, 230760);60886;(4, 25, 12, 8, 60886);שלום;1;8;לכן אמר הנני נתן לו את בריתי שלום
(231976, 64, 4);6;ו;230824;(4, 25, 14, 1, 230824);60902;(4, 25, 14, 1, 60902);ושם;1;1;ושם איש ישראל המכה אשר הכה את המדינית זמרי בן סלוא נשיא בית אב לשמעני
(231976, 64, 4);20;כ;230888;(4, 25, 15, 10, 230888);60919;(4, 25, 15, 3, 60919);המכה;3;3;ושם האשה המכה המדינית כזבי בת צור ראש אמות בית אב במדין הוא
(231976, 64, 4);4;ד;230952;(4, 25, 17, 9, 230952);60937;(4, 25, 17, 3, 60937);המדינים;3;3;צרור את המדינים והכיתם אותם
(231976, 64, 4);400;ת;231016;(4, 25, 18, 50, 231016);60954;(4, 25, 18, 15, 60954);בת;2;15;כי צררים הם לכם בנכליהם אשר נכלו לכם על דבר פעור ועל דבר כזבי בת נשיא מדין אחתם המכה ביום המגפה על דבר פעור
(231976, 64, 4);30;ל;231080;(4, 26, 1, 17, 231080);60971;(4, 26, 1, 5, 60971);ואל;3;5;ויאמר יהוה אל משה ואל אלעזר בן אהרן הכהן לאמר
(231976, 64, 4);40;ם;231144;(4, 26, 2, 45, 231144);60989;(4, 26, 2, 13, 60989);אבתם;4;13;שאו את ראש כל עדת בני ישראל מבן עשרים שנה ומעלה לבית אבתם כל יצא צבא בישראל
(231976, 64, 4);200;ר;231208;(4, 26, 4, 6, 231208);61006;(4, 26, 4, 2, 61006);עשרים;3;2;מבן עשרים שנה ומעלה כאשר צוה יהוה את משה ובני ישראל היצאים מארץ מצרים
(231976, 64, 4);30;ל;231272;(4, 26, 5, 14, 231272);61021;(4, 26, 5, 3, 61021);ישראל;5;3;ראובן בכור ישראל בני ראובן חנוך משפחת החנכי לפלוא משפחת הפלאי
(231976, 64, 4);400;ת;231336;(4, 26, 6, 27, 231336);61034;(4, 26, 6, 5, 61034);משפחת;5;5;לחצרן משפחת החצרוני לכרמי משפחת הכרמי
(231976, 64, 4);80;פ;231400;(4, 26, 8, 5, 231400);61048;(4, 26, 8, 2, 61048);פלוא;1;2;ובני פלוא אליאב
(231976, 64, 4);5;ה;231464;(4, 26, 9, 56, 231464);61063;(4, 26, 9, 14, 61063);משה;3;14;ובני אליאב נמואל ודתן ואבירם הוא דתן ואבירם קרואי העדה אשר הצו על משה ועל אהרן בעדת קרח בהצתם על יהוה
(231976, 64, 4);20;כ;231528;(4, 26, 10, 39, 231528);61081;(4, 26, 10, 11, 61081);באכל;3;11;ותפתח הארץ את פיה ותבלע אתם ואת קרח במות העדה באכל האש את חמשים ומאתים איש ויהיו לנס
(231976, 64, 4);80;פ;231592;(4, 26, 12, 24, 231592);61097;(4, 26, 12, 5, 61097);משפחת;3;5;בני שמעון למשפחתם לנמואל משפחת הנמואלי לימין משפחת הימיני ליכין משפחת היכיני
(231976, 64, 4);8;ח;231656;(4, 26, 13, 23, 231656);61109;(4, 26, 13, 5, 61109);משפחת;4;5;לזרח משפחת הזרחי לשאול משפחת השאולי
(231976, 64, 4);90;צ;231720;(4, 26, 15, 24, 231720);61123;(4, 26, 15, 6, 61123);הצפוני;2;6;בני גד למשפחתם לצפון משפחת הצפוני לחגי משפחת החגי לשוני משפחת השוני
(231976, 64, 4);6;ו;231784;(4, 26, 17, 4, 231784);61136;(4, 26, 17, 1, 61136);לארוד;4;1;לארוד משפחת הארודי לאראלי משפחת האראלי
(231976, 64, 4);1;א;231848;(4, 26, 18, 35, 231848);61150;(4, 26, 18, 9, 61150);מאות;2;9;אלה משפחת בני גד לפקדיהם ארבעים אלף וחמש מאות
(231976, 64, 4);8;ח;231912;(4, 26, 20, 28, 231912);61165;(4, 26, 20, 6, 61165);משפחת;4;6;ויהיו בני יהודה למשפחתם לשלה משפחת השלני לפרץ משפחת הפרצי לזרח משפחת הזרחי
(231976, 64, 4);40;מ;231976;(4, 26, 21, 30, 231976);61179;(4, 26, 21, 7, 61179);לחמול;3;7;ויהיו בני פרץ לחצרן משפחת החצרני לחמול משפחת החמולי
(231976, 64, 4);300;ש;232040;(4, 26, 23, 11, 232040);61193;(4, 26, 23, 3, 61193);למשפחתם;3;3;בני יששכר למשפחתם תולע משפחת התולעי לפוה משפחת הפוני
(231976, 64, 4);10;י;232104;(4, 26, 24, 31, 232104);61205;(4, 26, 24, 6, 61205);השמרני;6;6;לישוב משפחת הישבי לשמרן משפחת השמרני
(231976, 64, 4);8;ח;232168;(4, 26, 26, 23, 232168);61219;(4, 26, 26, 5, 61219);משפחת;4;5;בני זבולן למשפחתם לסרד משפחת הסרדי לאלון משפחת האלני ליחלאל משפחת היחלאלי
(231976, 64, 4);10;י;232232;(4, 26, 27, 25, 232232);61231;(4, 26, 27, 5, 61231);ששים;3;5;אלה משפחת הזבולני לפקדיהם ששים אלף וחמש מאות
(231976, 64, 4);200;ר;232296;(4, 26, 29, 28, 232296);61245;(4, 26, 29, 6, 61245);ומכיר;5;6;בני מנשה למכיר משפחת המכירי ומכיר הוליד את גלעד לגלעד משפחת הגלעדי
(231976, 64, 4);5;ה;232360;(4, 26, 30, 37, 232360);61260;(4, 26, 30, 9, 61260);החלקי;1;9;אלה בני גלעד איעזר משפחת האיעזרי לחלק משפחת החלקי
(231976, 64, 4);400;ת;232424;(4, 26, 32, 27, 232424);61271;(4, 26, 32, 5, 61271);משפחת;5;5;ושמידע משפחת השמידעי וחפר משפחת החפרי
(231976, 64, 4);6;ו;232488;(4, 26, 33, 59, 232488);61290;(4, 26, 33, 18, 61290);ותרצה;1;18;וצלפחד בן חפר לא היו לו בנים כי אם בנות ושם בנות צלפחד מחלה ונעה חגלה מלכה ותרצה
(231976, 64, 4);300;ש;232552;(4, 26, 35, 20, 232552);61304;(4, 26, 35, 5, 61304);לשותלח;2;5;אלה בני אפרים למשפחתם לשותלח משפחת השתלחי לבכר משפחת הבכרי לתחן משפחת התחני
(231976, 64, 4);400;ת;232616;(4, 26, 36, 21, 232616);61317;(4, 26, 36, 5, 61317);משפחת;5;5;ואלה בני שותלח לערן משפחת הערני
(231976, 64, 4);8;ח;232680;(4, 26, 37, 59, 232680);61332;(4, 26, 37, 14, 61332);למשפחתם;5;14;אלה משפחת בני אפרים לפקדיהם שנים ושלשים אלף וחמש מאות אלה בני יוסף למשפחתם
(231976, 64, 4);40;מ;232744;(4, 26, 38, 62, 232744);61344;(4, 26, 38, 12, 61344);האחירמי;6;12;בני בנימן למשפחתם לבלע משפחת הבלעי לאשבל משפחת האשבלי לאחירם משפחת האחירמי
(231976, 64, 4);30;ל;232808;(4, 26, 40, 30, 232808);61358;(4, 26, 40, 8, 61358);לנעמן;1;8;ויהיו בני בלע ארד ונעמן משפחת הארדי לנעמן משפחת הנעמי
(231976, 64, 4);2;ב;232872;(4, 26, 42, 4, 232872);61372;(4, 26, 42, 2, 61372);בני;1;2;אלה בני דן למשפחתם לשוחם משפחת השוחמי אלה משפחת דן למשפחתם
(231976, 64, 4);40;ם;232936;(4, 26, 43, 20, 232936);61385;(4, 26, 43, 4, 61385);לפקדיהם;7;4;כל משפחת השוחמי לפקדיהם ארבעה וששים אלף וארבע מאות
(231976, 64, 4);6;ו;233000;(4, 26, 44, 42, 233000);61399;(4, 26, 44, 9, 61399);הישוי;4;9;בני אשר למשפחתם לימנה משפחת הימנה לישוי משפחת הישוי לבריעה משפחת הבריעי
(231976, 64, 4);40;ם;233064;(4, 26, 46, 3, 233064);61411;(4, 26, 46, 1, 61411);ושם;3;1;ושם בת אשר שרח
(231976, 64, 4);8;ח;233128;(4, 26, 48, 13, 233128);61427;(4, 26, 48, 3, 61427);למשפחתם;5;3;בני נפתלי למשפחתם ליחצאל משפחת היחצאלי לגוני משפחת הגוני
(231976, 64, 4);1;א;233192;(4, 26, 50, 1, 233192);61440;(4, 26, 50, 1, 61440);אלה;1;1;אלה משפחת נפתלי למשפחתם ופקדיהם חמשה וארבעים אלף וארבע מאות
(231976, 64, 4);1;א;233256;(4, 26, 51, 15, 233256);61453;(4, 26, 51, 4, 61453);ישראל;4;4;אלה פקודי בני ישראל שש מאות אלף ואלף שבע מאות ושלשים
(231976, 64, 4);40;מ;233320;(4, 26, 53, 19, 233320);61470;(4, 26, 53, 5, 61470);במספר;2;5;לאלה תחלק הארץ בנחלה במספר שמות
(231976, 64, 4);100;ק;233384;(4, 26, 55, 11, 233384);61485;(4, 26, 55, 3, 61485);יחלק;4;3;אך בגורל יחלק את הארץ לשמות מטות אבתם ינחלו
(231976, 64, 4);10;י;233448;(4, 26, 57, 13, 233448);61502;(4, 26, 57, 3, 61502);הלוי;4;3;ואלה פקודי הלוי למשפחתם לגרשון משפחת הגרשני לקהת משפחת הקהתי למררי משפחת המררי
(231976, 64, 4);10;י;233512;(4, 26, 58, 11, 233512);61515;(4, 26, 58, 3, 61515);לוי;3;3;אלה משפחת לוי משפחת הלבני משפחת החברני משפחת המחלי משפחת המושי משפחת הקרחי וקהת הולד את עמרם
(231976, 64, 4);200;ר;233576;(4, 26, 58, 75, 233576);61529;(4, 26, 58, 17, 61529);עמרם;3;17;אלה משפחת לוי משפחת הלבני משפחת החברני משפחת המחלי משפחת המושי משפחת הקרחי וקהת הולד את עמרם
(231976, 64, 4);1;א;233640;(4, 26, 59, 63, 233640);61547;(4, 26, 59, 18, 61547);ואת;2;18;ושם אשת עמרם יוכבד בת לוי אשר ילדה אתה ללוי במצרים ותלד לעמרם את אהרן ואת משה ואת מרים אחתם
(231976, 64, 4);5;ה;233704;(4, 26, 61, 16, 233704);61563;(4, 26, 61, 4, 61563);בהקריבם;2;4;וימת נדב ואביהוא בהקריבם אש זרה לפני יהוה
(231976, 64, 4);400;ת;233768;(4, 26, 62, 46, 233768);61580;(4, 26, 62, 13, 61580);התפקדו;2;13;ויהיו פקדיהם שלשה ועשרים אלף כל זכר מבן חדש ומעלה כי לא התפקדו בתוך בני ישראל כי לא נתן להם נחלה בתוך בני ישראל
(231976, 64, 4);1;א;233832;(4, 26, 63, 22, 233832);61597;(4, 26, 63, 6, 61597);אשר;1;6;אלה פקודי משה ואלעזר הכהן אשר פקדו את בני ישראל בערבת מואב על ירדן ירחו
(231976, 64, 4);20;כ;233896;(4, 26, 64, 29, 233896);61614;(4, 26, 64, 8, 61614);הכהן;2;8;ובאלה לא היה איש מפקודי משה ואהרן הכהן אשר פקדו את בני ישראל במדבר סיני
(231976, 64, 4);10;י;233960;(4, 26, 65, 36, 233960);61632;(4, 26, 65, 11, 61632);איש;2;11;כי אמר יהוה להם מות ימתו במדבר ולא נותר מהם איש כי אם כלב בן יפנה ויהושע בן נון
(231976, 64, 4);5;ה;234024;(4, 27, 1, 39, 234024);61651;(4, 27, 1, 11, 61651);מנשה;4;11;ותקרבנה בנות צלפחד בן חפר בן גלעד בן מכיר בן מנשה למשפחת מנשה בן יוסף ואלה שמות בנתיו מחלה נעה וחגלה ומלכה ותרצה
(231976, 64, 4);300;ש;234088;(4, 27, 2, 13, 234088);61666;(4, 27, 2, 3, 61666);משה;2;3;ותעמדנה לפני משה ולפני אלעזר הכהן ולפני הנשיאם וכל העדה פתח אהל מועד לאמר
(231976, 64, 4);30;ל;234152;(4, 27, 3, 17, 234152);61682;(4, 27, 3, 5, 61682);לא;1;5;אבינו מת במדבר והוא לא היה בתוך העדה הנועדים על יהוה בעדת קרח כי בחטאו מת ובנים לא היו לו
(231976, 64, 4);2;ב;234216;(4, 27, 4, 11, 234216);61701;(4, 27, 4, 4, 61701);אבינו;2;4;למה יגרע שם אבינו מתוך משפחתו כי אין לו בן תנה לנו אחזה בתוך אחי אבינו
(231976, 64, 4);10;י;234280;(4, 27, 5, 20, 234280);61719;(4, 27, 5, 6, 61719);יהוה;1;6;ויקרב משה את משפטן לפני יהוה
(231976, 64, 4);5;ה;234344;(4, 27, 7, 43, 234344);61736;(4, 27, 7, 12, 61736);אביהם;4;12;כן בנות צלפחד דברת נתן תתן להם אחזת נחלה בתוך אחי אביהם והעברת את נחלת אביהן להן
(231976, 64, 4);40;ם;234408;(4, 27, 8, 43, 234408);61753;(4, 27, 8, 12, 61753);והעברתם;7;12;ואל בני ישראל תדבר לאמר איש כי ימות ובן אין לו והעברתם את נחלתו לבתו
(231976, 64, 4);1;א;234472;(4, 27, 10, 26, 234472);61772;(4, 27, 10, 8, 61772);לאחי;2;8;ואם אין לו אחים ונתתם את נחלתו לאחי אביו
(231976, 64, 4);400;ת;234536;(4, 27, 11, 58, 234536);61787;(4, 27, 11, 14, 61787);והיתה;4;14;ואם אין אחים לאביו ונתתם את נחלתו לשארו הקרב אליו ממשפחתו וירש אתה והיתה לבני ישראל לחקת משפט כאשר צוה יהוה את משה
(231976, 64, 4);5;ה;234600;(4, 27, 12, 30, 234600);61805;(4, 27, 12, 9, 61805);הזה;3;9;ויאמר יהוה אל משה עלה אל הר העברים הזה וראה את הארץ אשר נתתי לבני ישראל
(231976, 64, 4);50;ן;234664;(4, 27, 13, 38, 234664);61822;(4, 27, 13, 10, 61822);אהרן;4;10;וראיתה אתה ונאספת אל עמיך גם אתה כאשר נאסף אהרן אחיך
(231976, 64, 4);40;מ;234728;(4, 27, 14, 60, 234728);61838;(4, 27, 14, 15, 61838);מדבר;1;15;כאשר מריתם פי במדבר צן במריבת העדה להקדישני במים לעיניהם הם מי מריבת קדש מדבר צן
(231976, 64, 4);50;נ;234792;(4, 27, 17, 9, 234792);61856;(4, 27, 17, 3, 61856);לפניהם;3;3;אשר יצא לפניהם ואשר יבא לפניהם ואשר יוציאם ואשר יביאם ולא תהיה עדת יהוה כצאן אשר אין להם רעה
(231976, 64, 4);70;ע;234856;(4, 27, 17, 73, 234856);61872;(4, 27, 17, 19, 61872);רעה;2;19;אשר יצא לפניהם ואשר יבא לפניהם ואשר יוציאם ואשר יביאם ולא תהיה עדת יהוה כצאן אשר אין להם רעה
(231976, 64, 4);400;ת;234920;(4, 27, 19, 8, 234920);61892;(4, 27, 19, 2, 61892);אתו;2;2;והעמדת אתו לפני אלעזר הכהן ולפני כל העדה וצויתה אתו לעיניהם
(231976, 64, 4);6;ו;234984;(4, 27, 20, 23, 234984);61906;(4, 27, 20, 5, 61906);ישמעו;5;5;ונתתה מהודך עליו למען ישמעו כל עדת בני ישראל
(231976, 64, 4);1;א;235048;(4, 27, 21, 51, 235048);61923;(4, 27, 21, 13, 61923);יצאו;3;13;ולפני אלעזר הכהן יעמד ושאל לו במשפט האורים לפני יהוה על פיו יצאו ועל פיו יבאו הוא וכל בני ישראל אתו וכל העדה
(231976, 64, 4);5;ה;235112;(4, 27, 22, 29, 235112);61942;(4, 27, 22, 9, 61942);יהושע;2;9;ויעש משה כאשר צוה יהוה אתו ויקח את יהושע ויעמדהו לפני אלעזר הכהן ולפני כל העדה
(231976, 64, 4);5;ה;235176;(4, 27, 23, 30, 235176);61957;(4, 27, 23, 8, 61957);יהוה;2;8;ויסמך את ידיו עליו ויצוהו כאשר דבר יהוה ביד משה
(231976, 64, 4);10;י;235240;(4, 28, 2, 38, 235240);61975;(4, 28, 2, 11, 61975);ריח;2;11;צו את בני ישראל ואמרת אלהם את קרבני לחמי לאשי ריח ניחחי תשמרו להקריב לי במועדו
(231976, 64, 4);5;ה;235304;(4, 28, 3, 39, 235304);61990;(4, 28, 3, 10, 61990);שנה;3;10;ואמרת להם זה האשה אשר תקריבו ליהוה כבשים בני שנה תמימם שנים ליום עלה תמיד
(231976, 64, 4);300;ש;235368;(4, 28, 5, 3, 235368);62007;(4, 28, 5, 1, 62007);ועשירית;3;1;ועשירית האיפה סלת למנחה בלולה בשמן כתית רביעת ההין
(231976, 64, 4);10;י;235432;(4, 28, 6, 25, 235432);62022;(4, 28, 6, 7, 62022);ניחח;2;7;עלת תמיד העשיה בהר סיני לריח ניחח אשה ליהוה
(231976, 64, 4);300;ש;235496;(4, 28, 8, 14, 235496);62038;(4, 28, 8, 4, 62038);תעשה;3;4;ואת הכבש השני תעשה בין הערבים כמנחת הבקר וכנסכו תעשה אשה ריח ניחח ליהוה
(231976, 64, 4);10;י;235560;(4, 28, 9, 20, 235560);62053;(4, 28, 9, 5, 62053);בני;3;5;וביום השבת שני כבשים בני שנה תמימם ושני עשרנים סלת מנחה בלולה בשמן ונסכו
(231976, 64, 4);20;כ;235624;(4, 28, 10, 25, 235624);62069;(4, 28, 10, 7, 62069);ונסכה;4;7;עלת שבת בשבתו על עלת התמיד ונסכה
(231976, 64, 4);400;ת;235688;(4, 28, 11, 63, 235688);62085;(4, 28, 11, 16, 62085);תמימם;1;16;ובראשי חדשיכם תקריבו עלה ליהוה פרים בני בקר שנים ואיל אחד כבשים בני שנה שבעה תמימם
(231976, 64, 4);50;ן;235752;(4, 28, 12, 60, 235752);62099;(4, 28, 12, 14, 62099);בשמן;4;14;ושלשה עשרנים סלת מנחה בלולה בשמן לפר האחד ושני עשרנים סלת מנחה בלולה בשמן לאיל האחד
(231976, 64, 4);20;כ;235816;(4, 28, 14, 4, 235816);62115;(4, 28, 14, 1, 62115);ונסכיהם;4;1;ונסכיהם חצי ההין יהיה לפר ושלישת ההין לאיל ורביעת ההין לכבש יין זאת עלת חדש בחדשו לחדשי השנה
(231976, 64, 4);8;ח;235880;(4, 28, 14, 68, 235880);62131;(4, 28, 14, 17, 62131);לחדשי;2;17;ונסכיהם חצי ההין יהיה לפר ושלישת ההין לאיל ורביעת ההין לכבש יין זאת עלת חדש בחדשו לחדשי השנה
(231976, 64, 4);70;ע;235944;(4, 28, 16, 16, 235944);62145;(4, 28, 16, 3, 62145);בארבעה;5;3;ובחדש הראשון בארבעה עשר יום לחדש פסח ליהוה
