(38808, -92, 4);30;ל;149116;(3, 7, 4, 31, 149116);39342;(3, 7, 4, 9, 39342);על;2;9;ואת שתי הכלית ואת החלב אשר עליהן אשר על הכסלים ואת היתרת על הכבד על הכלית יסירנה
(38808, -92, 4);300;ש;149208;(3, 7, 6, 26, 149208);39364;(3, 7, 6, 6, 39364);קדוש;4;6;כל זכר בכהנים יאכלנו במקום קדוש יאכל קדש קדשים הוא
(38808, -92, 4);30;ל;149300;(3, 7, 8, 39, 149300);39390;(3, 7, 8, 11, 39390);לו;1;11;והכהן המקריב את עלת איש עור העלה אשר הקריב לכהן לו יהיה
(38808, -92, 4);5;ה;149392;(3, 7, 10, 29, 149392);39414;(3, 7, 10, 8, 39414);אהרן;2;8;וכל מנחה בלולה בשמן וחרבה לכל בני אהרן תהיה איש כאחיו
(38808, -92, 4);50;ן;149484;(3, 7, 12, 48, 149484);39436;(3, 7, 12, 12, 39436);בשמן;4;12;אם על תודה יקריבנו והקריב על זבח התודה חלות מצות בלולת בשמן ורקיקי מצות משחים בשמן וסלת מרבכת חלת בלולת בשמן
(38808, -92, 4);100;ק;149576;(3, 7, 14, 17, 149576);39460;(3, 7, 14, 5, 39460);קרבן;1;5;והקריב ממנו אחד מכל קרבן תרומה ליהוה לכהן הזרק את דם השלמים לו יהיה
(38808, -92, 4);2;ב;149668;(3, 7, 16, 11, 149668);39485;(3, 7, 16, 4, 39485);נדבה;3;4;ואם נדר או נדבה זבח קרבנו ביום הקריבו את זבחו יאכל וממחרת והנותר ממנו יאכל
(38808, -92, 4);40;מ;149760;(3, 7, 18, 12, 149760);39507;(3, 7, 18, 4, 39507);מבשר;1;4;ואם האכל יאכל מבשר זבח שלמיו ביום השלישי לא ירצה המקריב אתו לא יחשב לו פגול יהיה והנפש האכלת ממנו עונה תשא
(38808, -92, 4);1;א;149852;(3, 7, 19, 19, 149852);39531;(3, 7, 19, 6, 39531);לא;2;6;והבשר אשר יגע בכל טמא לא יאכל באש ישרף והבשר כל טהור יאכל בשר
(38808, -92, 4);6;ו;149944;(3, 7, 21, 1, 149944);39554;(3, 7, 21, 1, 39554);ונפש;1;1;ונפש כי תגע בכל טמא בטמאת אדם או בבהמה טמאה או בכל שקץ טמא ואכל מבשר זבח השלמים אשר ליהוה ונכרתה הנפש ההוא מעמיה
(38808, -92, 4);2;ב;150036;(3, 7, 22, 4, 150036);39578;(3, 7, 22, 1, 39578);וידבר;4;1;וידבר יהוה אל משה לאמר
(38808, -92, 4);5;ה;150128;(3, 7, 24, 39, 150128);39604;(3, 7, 24, 10, 39604);תאכלהו;5;10;וחלב נבלה וחלב טרפה יעשה לכל מלאכה ואכל לא תאכלהו
(38808, -92, 4);20;כ;150220;(3, 7, 27, 1, 150220);39628;(3, 7, 27, 1, 39628);כל;1;1;כל נפש אשר תאכל כל דם ונכרתה הנפש ההוא מעמיה
(38808, -92, 4);2;ב;150312;(3, 7, 29, 40, 150312);39653;(3, 7, 29, 11, 39653);יביא;2;11;דבר אל בני ישראל לאמר המקריב את זבח שלמיו ליהוה יביא את קרבנו ליהוה מזבח שלמיו
(38808, -92, 4);9;ט;150404;(3, 7, 31, 4, 150404);39676;(3, 7, 31, 1, 39676);והקטיר;4;1;והקטיר הכהן את החלב המזבחה והיה החזה לאהרן ולבניו
(38808, -92, 4);5;ה;150496;(3, 7, 33, 20, 150496);39698;(3, 7, 33, 6, 39698);החלב;1;6;המקריב את דם השלמים ואת החלב מבני אהרן לו תהיה שוק הימין למנה
(38808, -92, 4);200;ר;150588;(3, 7, 34, 63, 150588);39721;(3, 7, 34, 16, 39721);לאהרן;4;16;כי את חזה התנופה ואת שוק התרומה לקחתי מאת בני ישראל מזבחי שלמיהם ואתן אתם לאהרן הכהן ולבניו לחק עולם מאת בני ישראל
(38808, -92, 4);30;ל;150680;(3, 7, 36, 14, 150680);39745;(3, 7, 36, 5, 39745);להם;1;5;אשר צוה יהוה לתת להם ביום משחו אתם מאת בני ישראל חקת עולם לדרתם
(38808, -92, 4);6;ו;150772;(3, 7, 38, 9, 150772);39766;(3, 7, 38, 3, 39766);יהוה;3;3;אשר צוה יהוה את משה בהר סיני ביום צותו את בני ישראל להקריב את קרבניהם ליהוה במדבר סיני
(38808, -92, 4);10;י;150864;(3, 8, 2, 14, 150864);39791;(3, 8, 2, 5, 39791);בניו;3;5;קח את אהרן ואת בניו אתו ואת הבגדים ואת שמן המשחה ואת פר החטאת ואת שני האילים ואת סל המצות
(38808, -92, 4);200;ר;150956;(3, 8, 4, 11, 150956);39817;(3, 8, 4, 3, 39817);כאשר;4;3;ויעש משה כאשר צוה יהוה אתו ותקהל העדה אל פתח אהל מועד
(38808, -92, 4);90;ץ;151048;(3, 8, 6, 26, 151048);39843;(3, 8, 6, 7, 39843);וירחץ;5;7;ויקרב משה את אהרן ואת בניו וירחץ אתם במים
(38808, -92, 4);300;ש;151140;(3, 8, 8, 3, 151140);39868;(3, 8, 8, 1, 39868);וישם;3;1;וישם עליו את החשן ויתן אל החשן את האורים ואת התמים
(38808, -92, 4);300;ש;151232;(3, 8, 9, 55, 151232);39894;(3, 8, 9, 16, 39894);הקדש;4;16;וישם את המצנפת על ראשו וישם על המצנפת אל מול פניו את ציץ הזהב נזר הקדש כאשר צוה יהוה את משה
(38808, -92, 4);400;ת;151324;(3, 8, 11, 29, 151324);39921;(3, 8, 11, 8, 39921);את;2;8;ויז ממנו על המזבח שבע פעמים וימשח את המזבח ואת כל כליו ואת הכיר ואת כנו לקדשם
(38808, -92, 4);400;ת;151416;(3, 8, 13, 25, 151416);39946;(3, 8, 13, 7, 39946);כתנת;2;7;ויקרב משה את בני אהרן וילבשם כתנת ויחגר אתם אבנט ויחבש להם מגבעות כאשר צוה יהוה את משה
(38808, -92, 4);10;י;151508;(3, 8, 15, 2, 151508);39971;(3, 8, 15, 1, 39971);וישחט;2;1;וישחט ויקח משה את הדם ויתן על קרנות המזבח סביב באצבעו ויחטא את המזבח ואת הדם יצק אל יסוד המזבח ויקדשהו לכפר עליו
(38808, -92, 4);8;ח;151600;(3, 8, 16, 4, 151600);39994;(3, 8, 16, 1, 39994);ויקח;4;1;ויקח את כל החלב אשר על הקרב ואת יתרת הכבד ואת שתי הכלית ואת חלבהן ויקטר משה המזבחה
(38808, -92, 4);1;א;151692;(3, 8, 17, 31, 151692);40021;(3, 8, 17, 10, 40021);באש;2;10;ואת הפר ואת ערו ואת בשרו ואת פרשו שרף באש מחוץ למחנה כאשר צוה יהוה את משה
(38808, -92, 4);5;ה;151784;(3, 8, 19, 21, 151784);40047;(3, 8, 19, 7, 40047);המזבח;1;7;וישחט ויזרק משה את הדם על המזבח סביב
(38808, -92, 4);10;י;151876;(3, 8, 21, 38, 151876);40071;(3, 8, 21, 11, 40071);האיל;3;11;ואת הקרב ואת הכרעים רחץ במים ויקטר משה את כל האיל המזבחה עלה הוא לריח ניחח אשה הוא ליהוה כאשר צוה יהוה את משה
(38808, -92, 4);10;י;151968;(3, 8, 22, 44, 151968);40095;(3, 8, 22, 11, 40095);ידיהם;3;11;ויקרב את האיל השני איל המלאים ויסמכו אהרן ובניו את ידיהם על ראש האיל
(38808, -92, 4);1;א;152060;(3, 8, 24, 11, 152060);40120;(3, 8, 24, 4, 40120);אהרן;1;4;ויקרב את בני אהרן ויתן משה מן הדם על תנוך אזנם הימנית ועל בהן ידם הימנית ועל בהן רגלם הימנית ויזרק משה את הדם על המזבח סביב
(38808, -92, 4);400;ת;152152;(3, 8, 25, 6, 152152);40145;(3, 8, 25, 2, 40145);את;2;2;ויקח את החלב ואת האליה ואת כל החלב אשר על הקרב ואת יתרת הכבד ואת שתי הכלית ואת חלבהן ואת שוק הימין
(38808, -92, 4);30;ל;152244;(3, 8, 26, 21, 152244);40171;(3, 8, 26, 6, 40171);לקח;1;6;ומסל המצות אשר לפני יהוה לקח חלת מצה אחת וחלת לחם שמן אחת ורקיק אחד וישם על החלבים ועל שוק הימין
(38808, -92, 4);50;נ;152336;(3, 8, 27, 37, 152336);40198;(3, 8, 27, 12, 40198);תנופה;2;12;ויתן את הכל על כפי אהרן ועל כפי בניו וינף אתם תנופה לפני יהוה
(38808, -92, 4);6;ו;152428;(3, 8, 29, 20, 152428);40221;(3, 8, 29, 5, 40221);ויניפהו;7;5;ויקח משה את החזה ויניפהו תנופה לפני יהוה מאיל המלאים למשה היה למנה כאשר צוה יהוה את משה
(38808, -92, 4);70;ע;152520;(3, 8, 30, 42, 152520);40247;(3, 8, 30, 13, 40247);על;1;13;ויקח משה משמן המשחה ומן הדם אשר על המזבח ויז על אהרן על בגדיו ועל בניו ועל בגדי בניו אתו ויקדש את אהרן את בגדיו ואת בניו ואת בגדי בניו אתו
(38808, -92, 4);1;א;152612;(3, 8, 31, 26, 152612);40273;(3, 8, 31, 8, 40273);את;1;8;ויאמר משה אל אהרן ואל בניו בשלו את הבשר פתח אהל מועד ושם תאכלו אתו ואת הלחם אשר בסל המלאים כאשר צויתי לאמר אהרן ובניו יאכלהו
(38808, -92, 4);400;ת;152704;(3, 8, 32, 19, 152704);40296;(3, 8, 32, 5, 40296);תשרפו;1;5;והנותר בבשר ובלחם באש תשרפו
(38808, -92, 4);300;ש;152796;(3, 8, 34, 24, 152796);40321;(3, 8, 34, 7, 40321);לעשת;3;7;כאשר עשה ביום הזה צוה יהוה לעשת לכפר עליכם
(38808, -92, 4);20;כ;152888;(3, 8, 36, 16, 152888);40345;(3, 8, 36, 5, 40345);כל;1;5;ויעש אהרן ובניו את כל הדברים אשר צוה יהוה ביד משה
(38808, -92, 4);1;א;152980;(3, 9, 2, 27, 152980);40369;(3, 9, 2, 9, 40369);לחטאת;4;9;ויאמר אל אהרן קח לך עגל בן בקר לחטאת ואיל לעלה תמימם והקרב לפני יהוה
(38808, -92, 4);10;י;153072;(3, 9, 4, 7, 153072);40392;(3, 9, 4, 2, 40392);ואיל;3;2;ושור ואיל לשלמים לזבח לפני יהוה ומנחה בלולה בשמן כי היום יהוה נראה אליכם
(38808, -92, 4);5;ה;153164;(3, 9, 5, 40, 153164);40416;(3, 9, 5, 12, 40416);העדה;4;12;ויקחו את אשר צוה משה אל פני אהל מועד ויקרבו כל העדה ויעמדו לפני יהוה
(38808, -92, 4);1;א;153256;(3, 9, 7, 33, 153256);40441;(3, 9, 7, 10, 40441);חטאתך;3;10;ויאמר משה אל אהרן קרב אל המזבח ועשה את חטאתך ואת עלתך וכפר בעדך ובעד העם ועשה את קרבן העם וכפר בעדם כאשר צוה יהוה
(38808, -92, 4);6;ו;153348;(3, 9, 8, 36, 153348);40466;(3, 9, 8, 10, 40466);לו;2;10;ויקרב אהרן אל המזבח וישחט את עגל החטאת אשר לו
(38808, -92, 4);400;ת;153440;(3, 9, 10, 21, 153440);40491;(3, 9, 10, 6, 40491);היתרת;3;6;ואת החלב ואת הכלית ואת היתרת מן הכבד מן החטאת הקטיר המזבחה כאשר צוה יהוה את משה
(38808, -92, 4);1;א;153532;(3, 9, 12, 21, 153532);40516;(3, 9, 12, 6, 40516);אהרן;1;6;וישחט את העלה וימצאו בני אהרן אליו את הדם ויזרקהו על המזבח סביב
(38808, -92, 4);40;ם;153624;(3, 9, 14, 20, 153624);40538;(3, 9, 14, 5, 40538);הכרעים;6;5;וירחץ את הקרב ואת הכרעים ויקטר על העלה המזבחה
(38808, -92, 4);80;פ;153716;(3, 9, 16, 20, 153716);40560;(3, 9, 16, 5, 40560);כמשפט;4;5;ויקרב את העלה ויעשה כמשפט
(38808, -92, 4);5;ה;153808;(3, 9, 18, 44, 153808);40584;(3, 9, 18, 12, 40584);אהרן;2;12;וישחט את השור ואת האיל זבח השלמים אשר לעם וימצאו בני אהרן את הדם אליו ויזרקהו על המזבח סביב
(38808, -92, 4);70;ע;153900;(3, 9, 20, 15, 153900);40606;(3, 9, 20, 4, 40606);על;1;4;וישימו את החלבים על החזות ויקטר החלבים המזבחה
(38808, -92, 4);6;ו;153992;(3, 9, 22, 19, 153992);40630;(3, 9, 22, 7, 40630);ויברכם;1;7;וישא אהרן את ידו אל העם ויברכם וירד מעשת החטאת והעלה והשלמים
(38808, -92, 4);300;ש;154084;(3, 9, 24, 6, 154084);40653;(3, 9, 24, 2, 40653);אש;2;2;ותצא אש מלפני יהוה ותאכל על המזבח את העלה ואת החלבים וירא כל העם וירנו ויפלו על פניהם
(38808, -92, 4);6;ו;154176;(3, 10, 1, 30, 154176);40676;(3, 10, 1, 7, 40676);מחתתו;5;7;ויקחו בני אהרן נדב ואביהוא איש מחתתו ויתנו בהן אש וישימו עליה קטרת ויקריבו לפני יהוה אש זרה אשר לא צוה אתם
(38808, -92, 4);5;ה;154268;(3, 10, 2, 37, 154268);40700;(3, 10, 2, 9, 40700);יהוה;4;9;ותצא אש מלפני יהוה ותאכל אותם וימתו לפני יהוה
(38808, -92, 4);10;י;154360;(3, 10, 4, 29, 154360);40726;(3, 10, 4, 8, 40726);עזיאל;3;8;ויקרא משה אל מישאל ואל אלצפן בני עזיאל דד אהרן ויאמר אלהם קרבו שאו את אחיכם מאת פני הקדש אל מחוץ למחנה
(38808, -92, 4);10;י;154452;(3, 10, 6, 2, 154452);40750;(3, 10, 6, 1, 40750);ויאמר;2;1;ויאמר משה אל אהרן ולאלעזר ולאיתמר בניו ראשיכם אל תפרעו ובגדיכם לא תפרמו ולא תמתו ועל כל העדה יקצף ואחיכם כל בית ישראל יבכו את השרפה אשר שרף יהוה
(38808, -92, 4);1;א;154544;(3, 10, 6, 94, 154544);40772;(3, 10, 6, 23, 40772);ישראל;4;23;ויאמר משה אל אהרן ולאלעזר ולאיתמר בניו ראשיכם אל תפרעו ובגדיכם לא תפרמו ולא תמתו ועל כל העדה יקצף ואחיכם כל בית ישראל יבכו את השרפה אשר שרף יהוה
(38808, -92, 4);30;ל;154636;(3, 10, 8, 16, 154636);40798;(3, 10, 8, 5, 40798);לאמר;1;5;וידבר יהוה אל אהרן לאמר
(38808, -92, 4);2;ב;154728;(3, 10, 10, 31, 154728);40822;(3, 10, 10, 8, 40822);ובין;2;8;ולהבדיל בין הקדש ובין החל ובין הטמא ובין הטהור
(38808, -92, 4);200;ר;154820;(3, 10, 12, 39, 154820);40846;(3, 10, 12, 10, 40846);הנותרים;5;10;וידבר משה אל אהרן ואל אלעזר ואל איתמר בניו הנותרים קחו את המנחה הנותרת מאשי יהוה ואכלוה מצות אצל המזבח כי קדש קדשים הוא
(38808, -92, 4);1;א;154912;(3, 10, 13, 35, 154912);40870;(3, 10, 13, 10, 40870);מאשי;2;10;ואכלתם אתה במקום קדוש כי חקך וחק בניך הוא מאשי יהוה כי כן צויתי
(38808, -92, 4);300;ש;155004;(3, 10, 14, 77, 155004);40894;(3, 10, 14, 20, 40894);שלמי;1;20;ואת חזה התנופה ואת שוק התרומה תאכלו במקום טהור אתה ובניך ובנתיך אתך כי חקך וחק בניך נתנו מזבחי שלמי בני ישראל
(38808, -92, 4);6;ו;155096;(3, 10, 15, 81, 155096);40916;(3, 10, 15, 20, 40916);צוה;2;20;שוק התרומה וחזה התנופה על אשי החלבים יביאו להניף תנופה לפני יהוה והיה לך ולבניך אתך לחק עולם כאשר צוה יהוה
(38808, -92, 4);6;ו;155188;(3, 10, 17, 22, 155188);40940;(3, 10, 17, 6, 40940);במקום;4;6;מדוע לא אכלתם את החטאת במקום הקדש כי קדש קדשים הוא ואתה נתן לכם לשאת את עון העדה לכפר עליהם לפני יהוה
(38808, -92, 4);1;א;155280;(3, 10, 18, 34, 155280);40967;(3, 10, 18, 11, 40967);אתה;1;11;הן לא הובא את דמה אל הקדש פנימה אכול תאכלו אתה בקדש כאשר צויתי
(38808, -92, 4);5;ה;155372;(3, 10, 19, 77, 155372);40990;(3, 10, 19, 20, 40990);הייטב;1;20;וידבר אהרן אל משה הן היום הקריבו את חטאתם ואת עלתם לפני יהוה ותקראנה אתי כאלה ואכלתי חטאת היום הייטב בעיני יהוה
(38808, -92, 4);20;כ;155464;(3, 11, 2, 31, 155464);41013;(3, 11, 2, 9, 41013);תאכלו;3;9;דברו אל בני ישראל לאמר זאת החיה אשר תאכלו מכל הבהמה אשר על הארץ
(38808, -92, 4);5;ה;155556;(3, 11, 4, 30, 155556);41038;(3, 11, 4, 9, 41038);הפרסה;1;9;אך את זה לא תאכלו ממעלי הגרה וממפרסי הפרסה את הגמל כי מעלה גרה הוא ופרסה איננו מפריס טמא הוא לכם
(38808, -92, 4);200;ר;155648;(3, 11, 6, 6, 155648);41064;(3, 11, 6, 2, 41064);הארנבת;3;2;ואת הארנבת כי מעלת גרה הוא ופרסה לא הפריסה טמאה הוא לכם
(38808, -92, 4);40;ם;155740;(3, 11, 7, 54, 155740);41090;(3, 11, 7, 16, 41090);לכם;3;16;ואת החזיר כי מפריס פרסה הוא ושסע שסע פרסה והוא גרה לא יגר טמא הוא לכם
(38808, -92, 4);400;ת;155832;(3, 11, 9, 57, 155832);41115;(3, 11, 9, 16, 41115);תאכלו;1;16;את זה תאכלו מכל אשר במים כל אשר לו סנפיר וקשקשת במים בימים ובנחלים אתם תאכלו
(38808, -92, 4);1;א;155924;(3, 11, 11, 18, 155924);41139;(3, 11, 11, 5, 41139);לא;2;5;ושקץ יהיו לכם מבשרם לא תאכלו ואת נבלתם תשקצו
(38808, -92, 4);80;פ;156016;(3, 11, 13, 40, 156016);41166;(3, 11, 13, 13, 41166);הפרס;2;13;ואת אלה תשקצו מן העוף לא יאכלו שקץ הם את הנשר ואת הפרס ואת העזניה
(38808, -92, 4);30;ל;156108;(3, 11, 17, 13, 156108);41191;(3, 11, 17, 4, 41191);השלך;3;4;ואת הכוס ואת השלך ואת הינשוף
(38808, -92, 4);90;ץ;156200;(3, 11, 20, 22, 156200);41214;(3, 11, 20, 7, 41214);שקץ;3;7;כל שרץ העוף ההלך על ארבע שקץ הוא לכם
(38808, -92, 4);40;מ;156292;(3, 11, 22, 22, 156292);41242;(3, 11, 22, 7, 41242);למינו;2;7;את אלה מהם תאכלו את הארבה למינו ואת הסלעם למינהו ואת החרגל למינהו ואת החגב למינהו
(38808, -92, 4);3;ג;156384;(3, 11, 24, 15, 156384);41265;(3, 11, 24, 4, 41265);הנגע;3;4;ולאלה תטמאו כל הנגע בנבלתם יטמא עד הערב
(38808, -92, 4);50;נ;156476;(3, 11, 26, 43, 156476);41288;(3, 11, 26, 11, 41288);איננה;3;11;לכל הבהמה אשר הוא מפרסת פרסה ושסע איננה שסעת וגרה איננה מעלה טמאים הם לכם כל הנגע בהם יטמא
(38808, -92, 4);2;ב;156568;(3, 11, 27, 63, 156568);41314;(3, 11, 27, 18, 41314);הערב;4;18;וכל הולך על כפיו בכל החיה ההלכת על ארבע טמאים הם לכם כל הנגע בנבלתם יטמא עד הערב
(38808, -92, 4);5;ה;156660;(3, 11, 30, 6, 156660);41337;(3, 11, 30, 1, 41337);והאנקה;6;1;והאנקה והכח והלטאה והחמט והתנשמת
(38808, -92, 4);20;כ;156752;(3, 11, 32, 28, 156752);41362;(3, 11, 32, 9, 41362);כלי;1;9;וכל אשר יפל עליו מהם במתם יטמא מכל כלי עץ או בגד או עור או שק כל כלי אשר יעשה מלאכה בהם במים יובא וטמא עד הערב וטהר
(38808, -92, 4);6;ו;156844;(3, 11, 33, 32, 156844);41392;(3, 11, 33, 11, 41392);בתוכו;3;11;וכל כלי חרש אשר יפל מהם אל תוכו כל אשר בתוכו יטמא ואתו תשברו
(38808, -92, 4);9;ט;156936;(3, 11, 35, 21, 156936);41417;(3, 11, 35, 6, 41417);יטמא;2;6;וכל אשר יפל מנבלתם עליו יטמא תנור וכירים יתץ טמאים הם וטמאים יהיו לכם
(38808, -92, 4);200;ר;157028;(3, 11, 37, 18, 157028);41441;(3, 11, 37, 6, 41441);זרע;2;6;וכי יפל מנבלתם על כל זרע זרוע אשר יזרע טהור הוא
(38808, -92, 4);30;ל;157120;(3, 11, 39, 36, 157120);41467;(3, 11, 39, 10, 41467);בנבלתה;4;10;וכי ימות מן הבהמה אשר היא לכם לאכלה הנגע בנבלתה יטמא עד הערב
(38808, -92, 4);100;ק;157212;(3, 11, 41, 19, 157212);41491;(3, 11, 41, 6, 41491);שקץ;2;6;וכל השרץ השרץ על הארץ שקץ הוא לא יאכל
(38808, -92, 4);300;ש;157304;(3, 11, 43, 12, 157304);41520;(3, 11, 43, 4, 41520);נפשתיכם;3;4;אל תשקצו את נפשתיכם בכל השרץ השרץ ולא תטמאו בהם ונטמתם בם
(38808, -92, 4);10;י;157396;(3, 11, 44, 58, 157396);41542;(3, 11, 44, 14, 41542);נפשתיכם;5;14;כי אני יהוה אלהיכם והתקדשתם והייתם קדשים כי קדוש אני ולא תטמאו את נפשתיכם בכל השרץ הרמש על הארץ
(38808, -92, 4);6;ו;157488;(3, 11, 46, 13, 157488);41566;(3, 11, 46, 4, 41566);והעוף;1;4;זאת תורת הבהמה והעוף וכל נפש החיה הרמשת במים ולכל נפש השרצת על הארץ
(38808, -92, 4);20;כ;157580;(3, 11, 47, 51, 157580);41589;(3, 11, 47, 13, 41589);תאכל;3;13;להבדיל בין הטמא ובין הטהר ובין החיה הנאכלת ובין החיה אשר לא תאכל
(38808, -92, 4);50;נ;157672;(3, 12, 3, 10, 157672);41613;(3, 12, 3, 2, 41613);השמיני;5;2;וביום השמיני ימול בשר ערלתו
(38808, -92, 4);40;מ;157764;(3, 12, 5, 13, 157764);41639;(3, 12, 5, 4, 41639);וטמאה;3;4;ואם נקבה תלד וטמאה שבעים כנדתה וששים יום וששת ימים תשב על דמי טהרה
(38808, -92, 4);9;ט;157856;(3, 12, 6, 52, 157856);41665;(3, 12, 6, 16, 41665);לחטאת;3;16;ובמלאת ימי טהרה לבן או לבת תביא כבש בן שנתו לעלה ובן יונה או תר לחטאת אל פתח אהל מועד אל הכהן
(38808, -92, 4);4;ד;157948;(3, 12, 8, 13, 157948);41690;(3, 12, 8, 5, 41690);די;1;5;ואם לא תמצא ידה די שה ולקחה שתי תרים או שני בני יונה אחד לעלה ואחד לחטאת וכפר עליה הכהן וטהרה
(38808, -92, 4);5;ה;158040;(3, 13, 2, 7, 158040);41716;(3, 13, 2, 3, 41716);יהיה;2;3;אדם כי יהיה בעור בשרו שאת או ספחת או בהרת והיה בעור בשרו לנגע צרעת והובא אל אהרן הכהן או אל אחד מבניו הכהנים
(38808, -92, 4);70;ע;158132;(3, 13, 3, 14, 158132);41741;(3, 13, 3, 4, 41741);הנגע;4;4;וראה הכהן את הנגע בעור הבשר ושער בנגע הפך לבן ומראה הנגע עמק מעור בשרו נגע צרעת הוא וראהו הכהן וטמא אתו
(38808, -92, 4);70;ע;158224;(3, 13, 4, 24, 158224);41766;(3, 13, 4, 7, 41766);ועמק;2;7;ואם בהרת לבנה הוא בעור בשרו ועמק אין מראה מן העור ושערה לא הפך לבן והסגיר הכהן את הנגע שבעת ימים
(38808, -92, 4);300;ש;158316;(3, 13, 5, 40, 158316);41790;(3, 13, 5, 10, 41790);פשה;2;10;וראהו הכהן ביום השביעי והנה הנגע עמד בעיניו לא פשה הנגע בעור והסגירו הכהן שבעת ימים שנית
(38808, -92, 4);40;מ;158408;(3, 13, 6, 60, 158408);41813;(3, 13, 6, 16, 41813);מספחת;1;16;וראה הכהן אתו ביום השביעי שנית והנה כהה הנגע ולא פשה הנגע בעור וטהרו הכהן מספחת הוא וכבס בגדיו וטהר
(38808, -92, 4);5;ה;158500;(3, 13, 8, 16, 158500);41835;(3, 13, 8, 4, 41835);פשתה;4;4;וראה הכהן והנה פשתה המספחת בעור וטמאו הכהן צרעת הוא
(38808, -92, 4);6;ו;158592;(3, 13, 10, 38, 158592);41860;(3, 13, 10, 11, 41860);ומחית;1;11;וראה הכהן והנה שאת לבנה בעור והיא הפכה שער לבן ומחית בשר חי בשאת
(38808, -92, 4);30;ל;158684;(3, 13, 12, 34, 158684);41884;(3, 13, 12, 9, 41884);כל;2;9;ואם פרוח תפרח הצרעת בעור וכסתה הצרעת את כל עור הנגע מראשו ועד רגליו לכל מראה עיני הכהן
(38808, -92, 4);2;ב;158776;(3, 13, 14, 2, 158776);41910;(3, 13, 14, 1, 41910);וביום;2;1;וביום הראות בו בשר חי יטמא
(38808, -92, 4);20;כ;158868;(3, 13, 16, 31, 158868);41937;(3, 13, 16, 10, 41937);הכהן;2;10;או כי ישוב הבשר החי ונהפך ללבן ובא אל הכהן
(38808, -92, 4);2;ב;158960;(3, 13, 19, 19, 158960);41961;(3, 13, 19, 5, 41961);לבנה;2;5;והיה במקום השחין שאת לבנה או בהרת לבנה אדמדמת ונראה אל הכהן
(38808, -92, 4);8;ח;159052;(3, 13, 20, 63, 159052);41985;(3, 13, 20, 17, 41985);פרחה;3;17;וראה הכהן והנה מראה שפל מן העור ושערה הפך לבן וטמאו הכהן נגע צרעת הוא בשחין פרחה
(38808, -92, 4);50;ן;159144;(3, 13, 22, 22, 159144);42009;(3, 13, 22, 6, 42009);הכהן;4;6;ואם פשה תפשה בעור וטמא הכהן אתו נגע הוא
(38808, -92, 4);400;ת;159236;(3, 13, 24, 39, 159236);42034;(3, 13, 24, 11, 42034);בהרת;4;11;או בשר כי יהיה בערו מכות אש והיתה מחית המכוה בהרת לבנה אדמדמת או לבנה
(38808, -92, 4);200;ר;159328;(3, 13, 25, 76, 159328);42059;(3, 13, 25, 21, 42059);צרעת;2;21;וראה אתה הכהן והנה נהפך שער לבן בבהרת ומראה עמק מן העור צרעת הוא במכוה פרחה וטמא אתו הכהן נגע צרעת הוא
(38808, -92, 4);300;ש;159420;(3, 13, 27, 15, 159420);42082;(3, 13, 27, 4, 42082);השביעי;2;4;וראהו הכהן ביום השביעי אם פשה תפשה בעור וטמא הכהן אתו נגע צרעת הוא
(38808, -92, 4);50;ן;159512;(3, 13, 28, 54, 159512);42106;(3, 13, 28, 14, 42106);הכהן;4;14;ואם תחתיה תעמד הבהרת לא פשתה בעור והוא כהה שאת המכוה הוא וטהרו הכהן כי צרבת המכוה הוא
