(200012, -79, 4);8;ח;154824;(3, 10, 12, 43, 154824);40847;(3, 10, 12, 11, 40847);קחו;2;11;וידבר משה אל אהרן ואל אלעזר ואל איתמר בניו הנותרים קחו את המנחה הנותרת מאשי יהוה ואכלוה מצות אצל המזבח כי קדש קדשים הוא
(200012, -79, 4);100;ק;154903;(3, 10, 13, 26, 154903);40867;(3, 10, 13, 7, 40867);וחק;3;7;ואכלתם אתה במקום קדוש כי חקך וחק בניך הוא מאשי יהוה כי כן צויתי
(200012, -79, 4);20;ך;154982;(3, 10, 14, 55, 154982);40887;(3, 10, 14, 13, 40887);אתך;3;13;ואת חזה התנופה ואת שוק התרומה תאכלו במקום טהור אתה ובניך ובנתיך אתך כי חקך וחק בניך נתנו מזבחי שלמי בני ישראל
(200012, -79, 4);30;ל;155061;(3, 10, 15, 46, 155061);40907;(3, 10, 15, 11, 40907);לפני;1;11;שוק התרומה וחזה התנופה על אשי החלבים יביאו להניף תנופה לפני יהוה והיה לך ולבניך אתך לחק עולם כאשר צוה יהוה
(200012, -79, 4);7;ז;155140;(3, 10, 16, 39, 155140);40928;(3, 10, 16, 11, 40928);אלעזר;4;11;ואת שעיר החטאת דרש דרש משה והנה שרף ויקצף על אלעזר ועל איתמר בני אהרן הנותרם לאמר
(200012, -79, 4);1;א;155219;(3, 10, 17, 53, 155219);40949;(3, 10, 17, 15, 40949);לשאת;3;15;מדוע לא אכלתם את החטאת במקום הקדש כי קדש קדשים הוא ואתה נתן לכם לשאת את עון העדה לכפר עליהם לפני יהוה
(200012, -79, 4);4;ד;155298;(3, 10, 19, 3, 155298);40971;(3, 10, 19, 1, 40971);וידבר;3;1;וידבר אהרן אל משה הן היום הקריבו את חטאתם ואת עלתם לפני יהוה ותקראנה אתי כאלה ואכלתי חטאת היום הייטב בעיני יהוה
(200012, -79, 4);2;ב;155377;(3, 10, 19, 82, 155377);40991;(3, 10, 19, 21, 40991);בעיני;1;21;וידבר אהרן אל משה הן היום הקריבו את חטאתם ואת עלתם לפני יהוה ותקראנה אתי כאלה ואכלתי חטאת היום הייטב בעיני יהוה
(200012, -79, 4);8;ח;155456;(3, 11, 2, 23, 155456);41011;(3, 11, 2, 7, 41011);החיה;2;7;דברו אל בני ישראל לאמר זאת החיה אשר תאכלו מכל הבהמה אשר על הארץ
(200012, -79, 4);400;ת;155535;(3, 11, 4, 9, 155535);41034;(3, 11, 4, 5, 41034);תאכלו;1;5;אך את זה לא תאכלו ממעלי הגרה וממפרסי הפרסה את הגמל כי מעלה גרה הוא ופרסה איננו מפריס טמא הוא לכם
(200012, -79, 4);30;ל;155614;(3, 11, 5, 12, 155614);41054;(3, 11, 5, 4, 41054);מעלה;3;4;ואת השפן כי מעלה גרה הוא ופרסה לא יפריס טמא הוא לכם
(200012, -79, 4);10;י;155693;(3, 11, 7, 7, 155693);41076;(3, 11, 7, 2, 41076);החזיר;4;2;ואת החזיר כי מפריס פרסה הוא ושסע שסע פרסה והוא גרה לא יגר טמא הוא לכם
(200012, -79, 4);40;ם;155772;(3, 11, 8, 32, 155772);41098;(3, 11, 8, 8, 41098);הם;2;8;מבשרם לא תאכלו ובנבלתם לא תגעו טמאים הם לכם
(200012, -79, 4);10;י;155851;(3, 11, 10, 15, 155851);41120;(3, 11, 10, 5, 41120);סנפיר;4;5;וכל אשר אין לו סנפיר וקשקשת בימים ובנחלים מכל שרץ המים ומכל נפש החיה אשר במים שקץ הם לכם
(200012, -79, 4);6;ו;155930;(3, 11, 11, 24, 155930);41141;(3, 11, 11, 7, 41141);ואת;1;7;ושקץ יהיו לכם מבשרם לא תאכלו ואת נבלתם תשקצו
(200012, -79, 4);50;נ;156009;(3, 11, 13, 33, 156009);41164;(3, 11, 13, 11, 41164);הנשר;2;11;ואת אלה תשקצו מן העוף לא יאכלו שקץ הם את הנשר ואת הפרס ואת העזניה
(200012, -79, 4);50;נ;156088;(3, 11, 16, 30, 156088);41186;(3, 11, 16, 9, 41186);הנץ;2;9;ואת בת היענה ואת התחמס ואת השחף ואת הנץ למינהו
(200012, -79, 4);20;כ;156167;(3, 11, 19, 26, 156167);41205;(3, 11, 19, 6, 41205);הדוכיפת;4;6;ואת החסידה האנפה למינה ואת הדוכיפת ואת העטלף
(200012, -79, 4);10;י;156246;(3, 11, 21, 40, 156246);41229;(3, 11, 21, 13, 41229);כרעים;4;13;אך את זה תאכלו מכל שרץ העוף ההלך על ארבע אשר לא כרעים ממעל לרגליו לנתר בהן על הארץ
(200012, -79, 4);1;א;156325;(3, 11, 22, 55, 156325);41249;(3, 11, 22, 14, 41249);ואת;2;14;את אלה מהם תאכלו את הארבה למינו ואת הסלעם למינהו ואת החרגל למינהו ואת החגב למינהו
(200012, -79, 4);30;ל;156404;(3, 11, 25, 3, 156404);41270;(3, 11, 25, 1, 41270);וכל;3;1;וכל הנשא מנבלתם יכבס בגדיו וטמא עד הערב
(200012, -79, 4);9;ט;156483;(3, 11, 26, 50, 156483);41290;(3, 11, 26, 13, 41290);טמאים;1;13;לכל הבהמה אשר הוא מפרסת פרסה ושסע איננה שסעת וגרה איננה מעלה טמאים הם לכם כל הנגע בהם יטמא
(200012, -79, 4);1;א;156562;(3, 11, 27, 57, 156562);41312;(3, 11, 27, 16, 41312);יטמא;4;16;וכל הולך על כפיו בכל החיה ההלכת על ארבע טמאים הם לכם כל הנגע בנבלתם יטמא עד הערב
(200012, -79, 4);70;ע;156641;(3, 11, 29, 31, 156641);41334;(3, 11, 29, 9, 41334);והעכבר;3;9;וזה לכם הטמא בשרץ השרץ על הארץ החלד והעכבר והצב למינהו
(200012, -79, 4);4;ד;156720;(3, 11, 31, 38, 156720);41352;(3, 11, 31, 11, 41352);עד;2;11;אלה הטמאים לכם בכל השרץ כל הנגע בהם במתם יטמא עד הערב
(200012, -79, 4);6;ו;156799;(3, 11, 32, 75, 156799);41378;(3, 11, 32, 25, 41378);וטמא;1;25;וכל אשר יפל עליו מהם במתם יטמא מכל כלי עץ או בגד או עור או שק כל כלי אשר יעשה מלאכה בהם במים יובא וטמא עד הערב וטהר
(200012, -79, 4);2;ב;156878;(3, 11, 34, 19, 156878);41401;(3, 11, 34, 6, 41401);יבוא;2;6;מכל האכל אשר יאכל אשר יבוא עליו מים יטמא וכל משקה אשר ישתה בכל כלי יטמא
(200012, -79, 4);5;ה;156957;(3, 11, 35, 42, 156957);41422;(3, 11, 35, 11, 41422);הם;1;11;וכל אשר יפל מנבלתם עליו יטמא תנור וכירים יתץ טמאים הם וטמאים יהיו לכם
(200012, -79, 4);200;ר;157036;(3, 11, 37, 26, 157036);41443;(3, 11, 37, 8, 41443);אשר;3;8;וכי יפל מנבלתם על כל זרע זרוע אשר יזרע טהור הוא
(200012, -79, 4);3;ג;157115;(3, 11, 39, 31, 157115);41466;(3, 11, 39, 9, 41466);הנגע;3;9;וכי ימות מן הבהמה אשר היא לכם לאכלה הנגע בנבלתה יטמא עד הערב
(200012, -79, 4);6;ו;157194;(3, 11, 41, 1, 157194);41486;(3, 11, 41, 1, 41486);וכל;1;1;וכל השרץ השרץ על הארץ שקץ הוא לא יאכל
(200012, -79, 4);30;ל;157273;(3, 11, 42, 51, 157273);41510;(3, 11, 42, 16, 41510);על;2;16;כל הולך על גחון וכל הולך על ארבע עד כל מרבה רגלים לכל השרץ השרץ על הארץ לא תאכלום כי שקץ הם
(200012, -79, 4);20;כ;157352;(3, 11, 44, 14, 157352);41532;(3, 11, 44, 4, 41532);אלהיכם;5;4;כי אני יהוה אלהיכם והתקדשתם והייתם קדשים כי קדוש אני ולא תטמאו את נפשתיכם בכל השרץ הרמש על הארץ
(200012, -79, 4);400;ת;157431;(3, 11, 45, 16, 157431);41552;(3, 11, 45, 5, 41552);אתכם;2;5;כי אני יהוה המעלה אתכם מארץ מצרים להית לכם לאלהים והייתם קדשים כי קדוש אני
(200012, -79, 4);10;י;157510;(3, 11, 46, 35, 157510);41571;(3, 11, 46, 9, 41571);במים;3;9;זאת תורת הבהמה והעוף וכל נפש החיה הרמשת במים ולכל נפש השרצת על הארץ
(200012, -79, 4);6;ו;157589;(3, 12, 1, 8, 157589);41591;(3, 12, 1, 2, 41591);יהוה;3;2;וידבר יהוה אל משה לאמר
(200012, -79, 4);5;ה;157668;(3, 12, 3, 6, 157668);41613;(3, 12, 3, 2, 41613);השמיני;1;2;וביום השמיני ימול בשר ערלתו
(200012, -79, 4);10;י;157747;(3, 12, 4, 62, 157747);41634;(3, 12, 4, 18, 41634);ימי;3;18;ושלשים יום ושלשת ימים תשב בדמי טהרה בכל קדש לא תגע ואל המקדש לא תבא עד מלאת ימי טהרה
(200012, -79, 4);400;ת;157826;(3, 12, 6, 22, 157826);41656;(3, 12, 6, 7, 41656);תביא;1;7;ובמלאת ימי טהרה לבן או לבת תביא כבש בן שנתו לעלה ובן יונה או תר לחטאת אל פתח אהל מועד אל הכהן
(200012, -79, 4);40;מ;157905;(3, 12, 7, 29, 157905);41678;(3, 12, 7, 7, 41678);ממקר;1;7;והקריבו לפני יהוה וכפר עליה וטהרה ממקר דמיה זאת תורת הילדת לזכר או לנקבה
(200012, -79, 4);1;א;157984;(3, 12, 8, 49, 157984);41701;(3, 12, 8, 16, 41701);ואחד;2;16;ואם לא תמצא ידה די שה ולקחה שתי תרים או שני בני יונה אחד לעלה ואחד לחטאת וכפר עליה הכהן וטהרה
(200012, -79, 4);5;ה;158063;(3, 13, 2, 30, 158063);41723;(3, 13, 2, 10, 41723);בהרת;2;10;אדם כי יהיה בעור בשרו שאת או ספחת או בהרת והיה בעור בשרו לנגע צרעת והובא אל אהרן הכהן או אל אחד מבניו הכהנים
(200012, -79, 4);300;ש;158142;(3, 13, 3, 24, 158142);41744;(3, 13, 3, 7, 41744);ושער;2;7;וראה הכהן את הנגע בעור הבשר ושער בנגע הפך לבן ומראה הנגע עמק מעור בשרו נגע צרעת הוא וראהו הכהן וטמא אתו
(200012, -79, 4);200;ר;158221;(3, 13, 4, 21, 158221);41765;(3, 13, 4, 6, 41765);בשרו;3;6;ואם בהרת לבנה הוא בעור בשרו ועמק אין מראה מן העור ושערה לא הפך לבן והסגיר הכהן את הנגע שבעת ימים
(200012, -79, 4);5;ה;158300;(3, 13, 5, 24, 158300);41786;(3, 13, 5, 6, 41786);הנגע;1;6;וראהו הכהן ביום השביעי והנה הנגע עמד בעיניו לא פשה הנגע בעור והסגירו הכהן שבעת ימים שנית
(200012, -79, 4);5;ה;158379;(3, 13, 6, 31, 158379);41805;(3, 13, 6, 8, 41805);כהה;2;8;וראה הכהן אתו ביום השביעי שנית והנה כהה הנגע ולא פשה הנגע בעור וטהרו הכהן מספחת הוא וכבס בגדיו וטהר
(200012, -79, 4);1;א;158458;(3, 13, 7, 30, 158458);41825;(3, 13, 7, 8, 41825);אל;1;8;ואם פשה תפשה המספחת בעור אחרי הראתו אל הכהן לטהרתו ונראה שנית אל הכהן
(200012, -79, 4);5;ה;158537;(3, 13, 9, 11, 158537);41845;(3, 13, 9, 4, 41845);תהיה;2;4;נגע צרעת כי תהיה באדם והובא אל הכהן
(200012, -79, 4);6;ו;158616;(3, 13, 11, 11, 158616);41866;(3, 13, 11, 3, 41866);הוא;2;3;צרעת נושנת הוא בעור בשרו וטמאו הכהן לא יסגרנו כי טמא הוא
(200012, -79, 4);300;ש;158695;(3, 13, 12, 45, 158695);41887;(3, 13, 12, 12, 41887);מראשו;4;12;ואם פרוח תפרח הצרעת בעור וכסתה הצרעת את כל עור הנגע מראשו ועד רגליו לכל מראה עיני הכהן
(200012, -79, 4);1;א;158774;(3, 13, 13, 55, 158774);41909;(3, 13, 13, 16, 41909);הוא;3;16;וראה הכהן והנה כסתה הצרעת את כל בשרו וטהר את הנגע כלו הפך לבן טהור הוא
(200012, -79, 4);6;ו;158853;(3, 13, 16, 16, 158853);41933;(3, 13, 16, 6, 41933);ונהפך;1;6;או כי ישוב הבשר החי ונהפך ללבן ובא אל הכהן
(200012, -79, 4);6;ו;158932;(3, 13, 18, 16, 158932);41954;(3, 13, 18, 5, 41954);בערו;4;5;ובשר כי יהיה בו בערו שחין ונרפא
(200012, -79, 4);5;ה;159011;(3, 13, 20, 22, 159011);41975;(3, 13, 20, 7, 41975);העור;1;7;וראה הכהן והנה מראה שפל מן העור ושערה הפך לבן וטמאו הכהן נגע צרעת הוא בשחין פרחה
(200012, -79, 4);5;ה;159090;(3, 13, 21, 37, 159090);41995;(3, 13, 21, 10, 41995);איננה;5;10;ואם יראנה הכהן והנה אין בה שער לבן ושפלה איננה מן העור והיא כהה והסגירו הכהן שבעת ימים
(200012, -79, 4);200;ר;159169;(3, 13, 23, 16, 159169);42016;(3, 13, 23, 4, 42016);הבהרת;4;4;ואם תחתיה תעמד הבהרת לא פשתה צרבת השחין הוא וטהרו הכהן
(200012, -79, 4);6;ו;159248;(3, 13, 24, 51, 159248);42037;(3, 13, 24, 14, 42037);או;2;14;או בשר כי יהיה בערו מכות אש והיתה מחית המכוה בהרת לבנה אדמדמת או לבנה
(200012, -79, 4);90;צ;159327;(3, 13, 25, 75, 159327);42059;(3, 13, 25, 21, 42059);צרעת;1;21;וראה אתה הכהן והנה נהפך שער לבן בבהרת ומראה עמק מן העור צרעת הוא במכוה פרחה וטמא אתו הכהן נגע צרעת הוא
(200012, -79, 4);6;ו;159406;(3, 13, 27, 1, 159406);42079;(3, 13, 27, 1, 42079);וראהו;1;1;וראהו הכהן ביום השביעי אם פשה תפשה בעור וטמא הכהן אתו נגע צרעת הוא
(200012, -79, 4);200;ר;159485;(3, 13, 28, 27, 159485);42099;(3, 13, 28, 7, 42099);בעור;4;7;ואם תחתיה תעמד הבהרת לא פשתה בעור והוא כהה שאת המכוה הוא וטהרו הכהן כי צרבת המכוה הוא
(200012, -79, 4);50;ן;159564;(3, 13, 30, 8, 159564);42122;(3, 13, 30, 2, 42122);הכהן;4;2;וראה הכהן את הנגע והנה מראהו עמק מן העור ובו שער צהב דק וטמא אתו הכהן נתק הוא צרעת הראש או הזקן הוא
(200012, -79, 4);5;ה;159643;(3, 13, 31, 10, 159643);42146;(3, 13, 31, 3, 42146);הכהן;3;3;וכי יראה הכהן את נגע הנתק והנה אין מראהו עמק מן העור ושער שחר אין בו והסגיר הכהן את נגע הנתק שבעת ימים
(200012, -79, 4);1;א;159722;(3, 13, 32, 9, 159722);42169;(3, 13, 32, 3, 42169);את;1;3;וראה הכהן את הנגע ביום השביעי והנה לא פשה הנתק ולא היה בו שער צהב ומראה הנתק אין עמק מן העור
(200012, -79, 4);10;י;159801;(3, 13, 33, 16, 159801);42192;(3, 13, 33, 5, 42192);יגלח;1;5;והתגלח ואת הנתק לא יגלח והסגיר הכהן את הנתק שבעת ימים שנית
(200012, -79, 4);1;א;159880;(3, 13, 34, 48, 159880);42212;(3, 13, 34, 13, 42212);איננו;1;13;וראה הכהן את הנתק ביום השביעי והנה לא פשה הנתק בעור ומראהו איננו עמק מן העור וטהר אתו הכהן וכבס בגדיו וטהר
(200012, -79, 4);300;ש;159959;(3, 13, 36, 15, 159959);42232;(3, 13, 36, 4, 42232);פשה;2;4;וראהו הכהן והנה פשה הנתק בעור לא יבקר הכהן לשער הצהב טמא הוא
(200012, -79, 4);5;ה;160038;(3, 13, 37, 46, 160038);42254;(3, 13, 37, 13, 42254);וטהרו;3;13;ואם בעיניו עמד הנתק ושער שחר צמח בו נרפא הנתק טהור הוא וטהרו הכהן
(200012, -79, 4);1;א;160117;(3, 13, 39, 38, 160117);42275;(3, 13, 39, 10, 42275);הוא;3;10;וראה הכהן והנה בעור בשרם בהרת כהות לבנת בהק הוא פרח בעור טהור הוא
(200012, -79, 4);10;י;160196;(3, 13, 42, 6, 160196);42298;(3, 13, 42, 2, 42298);יהיה;3;2;וכי יהיה בקרחת או בגבחת נגע לבן אדמדם צרעת פרחת הוא בקרחתו או בגבחתו
(200012, -79, 4);4;ד;160275;(3, 13, 43, 30, 160275);42318;(3, 13, 43, 8, 42318);אדמדמת;4;8;וראה אתו הכהן והנה שאת הנגע לבנה אדמדמת בקרחתו או בגבחתו כמראה צרעת עור בשר
(200012, -79, 4);2;ב;160354;(3, 13, 45, 10, 160354);42338;(3, 13, 45, 3, 42338);בו;1;3;והצרוע אשר בו הנגע בגדיו יהיו פרמים וראשו יהיה פרוע ועל שפם יעטה וטמא טמא יקרא
(200012, -79, 4);4;ד;160433;(3, 13, 46, 26, 160433);42360;(3, 13, 46, 9, 42360);בדד;2;9;כל ימי אשר הנגע בו יטמא טמא הוא בדד ישב מחוץ למחנה מושבו
(200012, -79, 4);200;ר;160512;(3, 13, 48, 23, 160512);42381;(3, 13, 48, 6, 42381);ולצמר;5;6;או בשתי או בערב לפשתים ולצמר או בעור או בכל מלאכת עור
(200012, -79, 4);400;ת;160591;(3, 13, 49, 60, 160591);42405;(3, 13, 49, 18, 42405);צרעת;4;18;והיה הנגע ירקרק או אדמדם בבגד או בעור או בשתי או בערב או בכל כלי עור נגע צרעת הוא והראה את הכהן
(200012, -79, 4);2;ב;160670;(3, 13, 51, 31, 160670);42427;(3, 13, 51, 9, 42427);בבגד;2;9;וראה את הנגע ביום השביעי כי פשה הנגע בבגד או בשתי או בערב או בעור לכל אשר יעשה העור למלאכה צרעת ממארת הנגע טמא הוא
(200012, -79, 4);6;ו;160749;(3, 13, 52, 20, 160749);42450;(3, 13, 52, 7, 42450);או;2;7;ושרף את הבגד או את השתי או את הערב בצמר או בפשתים או את כל כלי העור אשר יהיה בו הנגע כי צרעת ממארת הוא באש תשרף
(200012, -79, 4);50;נ;160828;(3, 13, 53, 14, 160828);42474;(3, 13, 53, 4, 42474);והנה;3;4;ואם יראה הכהן והנה לא פשה הנגע בבגד או בשתי או בערב או בכל כלי עור
(200012, -79, 4);10;י;160907;(3, 13, 54, 42, 160907);42497;(3, 13, 54, 11, 42497);שנית;3;11;וצוה הכהן וכבסו את אשר בו הנגע והסגירו שבעת ימים שנית
(200012, -79, 4);400;ת;160986;(3, 13, 55, 78, 160986);42519;(3, 13, 55, 22, 42519);בקרחתו;5;22;וראה הכהן אחרי הכבס את הנגע והנה לא הפך הנגע את עינו והנגע לא פשה טמא הוא באש תשרפנו פחתת הוא בקרחתו או בגבחתו
(200012, -79, 4);6;ו;161065;(3, 13, 57, 1, 161065);42544;(3, 13, 57, 1, 42544);ואם;1;1;ואם תראה עוד בבגד או בשתי או בערב או בכל כלי עור פרחת הוא באש תשרפנו את אשר בו הנגע
(200012, -79, 4);200;ר;161144;(3, 13, 58, 16, 161144);42568;(3, 13, 58, 5, 42568);הערב;3;5;והבגד או השתי או הערב או כל כלי העור אשר תכבס וסר מהם הנגע וכבס שנית וטהר
(200012, -79, 4);5;ה;161223;(3, 13, 59, 38, 161223);42592;(3, 13, 59, 12, 42592);הערב;1;12;זאת תורת נגע צרעת בגד הצמר או הפשתים או השתי או הערב או כל כלי עור לטהרו או לטמאו
(200012, -79, 4);50;ן;161302;(3, 14, 2, 36, 161302);42613;(3, 14, 2, 9, 42613);הכהן;4;9;זאת תהיה תורת המצרע ביום טהרתו והובא אל הכהן
(200012, -79, 4);400;ת;161381;(3, 14, 4, 29, 161381);42633;(3, 14, 4, 7, 42633);חיות;4;7;וצוה הכהן ולקח למטהר שתי צפרים חיות טהרות ועץ ארז ושני תולעת ואזב
(200012, -79, 4);400;ת;161460;(3, 14, 6, 15, 161460);42656;(3, 14, 6, 5, 42656);אתה;2;5;את הצפר החיה יקח אתה ואת עץ הארז ואת שני התולעת ואת האזב וטבל אותם ואת הצפר החיה בדם הצפר השחטה על המים החיים
(200012, -79, 4);40;מ;161539;(3, 14, 7, 8, 161539);42678;(3, 14, 7, 3, 42678);המטהר;2;3;והזה על המטהר מן הצרעת שבע פעמים וטהרו ושלח את הצפר החיה על פני השדה
(200012, -79, 4);2;ב;161618;(3, 14, 8, 33, 161618);42700;(3, 14, 8, 10, 42700);במים;1;10;וכבס המטהר את בגדיו וגלח את כל שערו ורחץ במים וטהר ואחר יבוא אל המחנה וישב מחוץ לאהלו שבעת ימים
(200012, -79, 4);7;ז;161697;(3, 14, 9, 36, 161697);42721;(3, 14, 9, 11, 42721);זקנו;1;11;והיה ביום השביעי יגלח את כל שערו את ראשו ואת זקנו ואת גבת עיניו ואת כל שערו יגלח וכבס את בגדיו ורחץ את בשרו במים וטהר
(200012, -79, 4);400;ת;161776;(3, 14, 10, 23, 161776);42742;(3, 14, 10, 6, 42742);תמימם;1;6;וביום השמיני יקח שני כבשים תמימם וכבשה אחת בת שנתה תמימה ושלשה עשרנים סלת מנחה בלולה בשמן ולג אחד שמן
(200012, -79, 4);10;י;161855;(3, 14, 11, 20, 161855);42761;(3, 14, 11, 5, 42761);האיש;3;5;והעמיד הכהן המטהר את האיש המטהר ואתם לפני יהוה פתח אהל מועד
(200012, -79, 4);6;ו;161934;(3, 14, 12, 51, 161934);42782;(3, 14, 12, 14, 42782);תנופה;3;14;ולקח הכהן את הכבש האחד והקריב אתו לאשם ואת לג השמן והניף אתם תנופה לפני יהוה
(200012, -79, 4);300;ש;162013;(3, 14, 13, 69, 162013);42803;(3, 14, 13, 19, 42803);קדשים;3;19;ושחט את הכבש במקום אשר ישחט את החטאת ואת העלה במקום הקדש כי כחטאת האשם הוא לכהן קדש קדשים הוא
(200012, -79, 4);400;ת;162092;(3, 14, 14, 74, 162092);42823;(3, 14, 14, 19, 42823);הימנית;6;19;ולקח הכהן מדם האשם ונתן הכהן על תנוך אזן המטהר הימנית ועל בהן ידו הימנית ועל בהן רגלו הימנית
(200012, -79, 4);7;ז;162171;(3, 14, 16, 45, 162171);42844;(3, 14, 16, 12, 42844);והזה;3;12;וטבל הכהן את אצבעו הימנית מן השמן אשר על כפו השמאלית והזה מן השמן באצבעו שבע פעמים לפני יהוה
(200012, -79, 4);50;ן;162250;(3, 14, 17, 50, 162250);42865;(3, 14, 17, 14, 42865);בהן;3;14;ומיתר השמן אשר על כפו יתן הכהן על תנוך אזן המטהר הימנית ועל בהן ידו הימנית ועל בהן רגלו הימנית על דם האשם
(200012, -79, 4);50;ן;162329;(3, 14, 18, 46, 162329);42887;(3, 14, 18, 13, 42887);הכהן;4;13;והנותר בשמן אשר על כף הכהן יתן על ראש המטהר וכפר עליו הכהן לפני יהוה
(200012, -79, 4);40;מ;162408;(3, 14, 20, 25, 162408);42908;(3, 14, 20, 7, 42908);המזבחה;2;7;והעלה הכהן את העלה ואת המנחה המזבחה וכפר עליו הכהן וטהר
(200012, -79, 4);2;ב;162487;(3, 14, 21, 59, 162487);42929;(3, 14, 21, 17, 42929);בלול;1;17;ואם דל הוא ואין ידו משגת ולקח כבש אחד אשם לתנופה לכפר עליו ועשרון סלת אחד בלול בשמן למנחה ולג שמן
(200012, -79, 4);40;ם;162566;(3, 14, 23, 12, 162566);42950;(3, 14, 23, 3, 42950);ביום;4;3;והביא אתם ביום השמיני לטהרתו אל הכהן אל פתח אהל מועד לפני יהוה
(200012, -79, 4);6;ו;162645;(3, 14, 24, 41, 162645);42972;(3, 14, 24, 12, 42972);תנופה;3;12;ולקח הכהן את כבש האשם ואת לג השמן והניף אתם הכהן תנופה לפני יהוה
(200012, -79, 4);70;ע;162724;(3, 14, 25, 69, 162724);42993;(3, 14, 25, 19, 42993);ועל;2;19;ושחט את כבש האשם ולקח הכהן מדם האשם ונתן על תנוך אזן המטהר הימנית ועל בהן ידו הימנית ועל בהן רגלו הימנית
(200012, -79, 4);300;ש;162803;(3, 14, 27, 36, 162803);43014;(3, 14, 27, 10, 43014);השמאלית;2;10;והזה הכהן באצבעו הימנית מן השמן אשר על כפו השמאלית שבע פעמים לפני יהוה
(200012, -79, 4);6;ו;162882;(3, 14, 28, 58, 162882);43035;(3, 14, 28, 17, 43035);ועל;1;17;ונתן הכהן מן השמן אשר על כפו על תנוך אזן המטהר הימנית ועל בהן ידו הימנית ועל בהן רגלו הימנית על מקום דם האשם
(200012, -79, 4);5;ה;162961;(3, 14, 29, 52, 162961);43057;(3, 14, 29, 15, 43057);יהוה;4;15;והנותר מן השמן אשר על כף הכהן יתן על ראש המטהר לכפר עליו לפני יהוה
(200012, -79, 4);5;ה;163040;(3, 14, 31, 39, 163040);43081;(3, 14, 31, 12, 43081);המנחה;5;12;את אשר תשיג ידו את האחד חטאת ואת האחד עלה על המנחה וכפר הכהן על המטהר לפני יהוה
(200012, -79, 4);5;ה;163119;(3, 14, 33, 19, 163119);43104;(3, 14, 33, 6, 43104);אהרן;2;6;וידבר יהוה אל משה ואל אהרן לאמר
(200012, -79, 4);10;י;163198;(3, 14, 35, 16, 163198);43126;(3, 14, 35, 5, 43126);והגיד;4;5;ובא אשר לו הבית והגיד לכהן לאמר כנגע נראה לי בבית
(200012, -79, 4);400;ת;163277;(3, 14, 36, 56, 163277);43148;(3, 14, 36, 16, 43148);בבית;4;16;וצוה הכהן ופנו את הבית בטרם יבא הכהן לראות את הנגע ולא יטמא כל אשר בבית ואחר כן יבא הכהן לראות את הבית
(200012, -79, 4);50;ן;163356;(3, 14, 37, 55, 163356);43167;(3, 14, 37, 12, 43167);ומראיהן;7;12;וראה את הנגע והנה הנגע בקירת הבית שקערורת ירקרקת או אדמדמת ומראיהן שפל מן הקיר
(200012, -79, 4);300;ש;163435;(3, 14, 39, 27, 163435);43189;(3, 14, 39, 7, 43189);פשה;2;7;ושב הכהן ביום השביעי וראה והנה פשה הנגע בקירת הבית
(200012, -79, 4);5;ה;163514;(3, 14, 41, 4, 163514);43210;(3, 14, 41, 2, 43210);הבית;1;2;ואת הבית יקצע מבית סביב ושפכו את העפר אשר הקצו אל מחוץ לעיר אל מקום טמא
