(n,d,k);LetterGematriaNumberValue;Letter;LetterPositionIndex;LetterCoordinatesD5K;WordNumber;WordCoordinatesDWTK;Found in Word in Text;LetterPositionIndex In Word;WordNumberInVerse;Found In Verse
(302170, -60, 4);1;א;10;(1, 1, 1, 10, 10);3;(1, 1, 1, 3, 3);אלהים;1;3;בראשית ברא אלהים את השמים ואת הארץ
(302170, -60, 4);80;פ;70;(1, 1, 2, 42, 70);18;(1, 1, 2, 11, 18);מרחפת;4;11;והארץ היתה תהו ובהו וחשך על פני תהום ורוח אלהים מרחפת על פני המים
(302170, -60, 4);30;ל;130;(1, 1, 4, 27, 130);35;(1, 1, 4, 8, 35);אלהים;2;8;וירא אלהים את האור כי טוב ויבדל אלהים בין האור ובין החשך
(302170, -60, 4);100;ק;190;(1, 1, 5, 42, 190);50;(1, 1, 5, 11, 50);בקר;2;11;ויקרא אלהים לאור יום ולחשך קרא לילה ויהי ערב ויהי בקר יום אחד
(302170, -60, 4);40;ם;250;(1, 1, 7, 9, 250);65;(1, 1, 7, 2, 65);אלהים;5;2;ויעש אלהים את הרקיע ויבדל בין המים אשר מתחת לרקיע ובין המים אשר מעל לרקיע ויהי כן
(302170, -60, 4);200;ר;310;(1, 1, 8, 4, 310);81;(1, 1, 8, 1, 81);ויקרא;4;1;ויקרא אלהים לרקיע שמים ויהי ערב ויהי בקר יום שני
(302170, -60, 4);40;מ;370;(1, 1, 9, 25, 370);96;(1, 1, 9, 6, 96);השמים;3;6;ויאמר אלהים יקוו המים מתחת השמים אל מקום אחד ותראה היבשה ויהי כן
(302170, -60, 4);40;מ;430;(1, 1, 10, 33, 430);111;(1, 1, 10, 8, 111);ימים;2;8;ויקרא אלהים ליבשה ארץ ולמקוה המים קרא ימים וירא אלהים כי טוב
(302170, -60, 4);30;ל;490;(1, 1, 11, 44, 490);128;(1, 1, 11, 13, 128);למינו;1;13;ויאמר אלהים תדשא הארץ דשא עשב מזריע זרע עץ פרי עשה פרי למינו אשר זרעו בו על הארץ ויהי כן
(302170, -60, 4);5;ה;550;(1, 1, 12, 35, 550);144;(1, 1, 12, 9, 144);עשה;3;9;ותוצא הארץ דשא עשב מזריע זרע למינהו ועץ עשה פרי אשר זרעו בו למינהו וירא אלהים כי טוב
(302170, -60, 4);1;א;610;(1, 1, 14, 6, 610);161;(1, 1, 14, 2, 161);אלהים;1;2;ויאמר אלהים יהי מארת ברקיע השמים להבדיל בין היום ובין הלילה והיו לאתת ולמועדים ולימים ושנים
(302170, -60, 4);6;ו;670;(1, 1, 14, 66, 670);174;(1, 1, 14, 15, 174);ולימים;1;15;ויאמר אלהים יהי מארת ברקיע השמים להבדיל בין היום ובין הלילה והיו לאתת ולמועדים ולימים ושנים
(302170, -60, 4);50;נ;730;(1, 1, 16, 13, 730);188;(1, 1, 16, 4, 188);שני;2;4;ויעש אלהים את שני המארת הגדלים את המאור הגדל לממשלת היום ואת המאור הקטן לממשלת הלילה ואת הכוכבים
(302170, -60, 4);5;ה;790;(1, 1, 16, 73, 790);202;(1, 1, 16, 18, 202);הכוכבים;1;18;ויעש אלהים את שני המארת הגדלים את המאור הגדל לממשלת היום ואת המאור הקטן לממשלת הלילה ואת הכוכבים
(302170, -60, 4);10;י;850;(1, 1, 18, 21, 850);214;(1, 1, 18, 4, 214);ולהבדיל;6;4;ולמשל ביום ובלילה ולהבדיל בין האור ובין החשך וירא אלהים כי טוב
(302170, -60, 4);5;ה;910;(1, 1, 20, 8, 910);230;(1, 1, 20, 2, 230);אלהים;3;2;ויאמר אלהים ישרצו המים שרץ נפש חיה ועוף יעופף על הארץ על פני רקיע השמים
(302170, -60, 4);1;א;970;(1, 1, 21, 11, 970);246;(1, 1, 21, 3, 246);את;1;3;ויברא אלהים את התנינם הגדלים ואת כל נפש החיה הרמשת אשר שרצו המים למינהם ואת כל עוף כנף למינהו וירא אלהים כי טוב
(302170, -60, 4);40;מ;1030;(1, 1, 21, 71, 1030);262;(1, 1, 21, 19, 262);למינהו;2;19;ויברא אלהים את התנינם הגדלים ואת כל נפש החיה הרמשת אשר שרצו המים למינהם ואת כל עוף כנף למינהו וירא אלהים כי טוב
(302170, -60, 4);5;ה;1090;(1, 1, 22, 42, 1090);277;(1, 1, 22, 11, 277);והעוף;2;11;ויברך אתם אלהים לאמר פרו ורבו ומלאו את המים בימים והעוף ירב בארץ
(302170, -60, 4);50;נ;1150;(1, 1, 24, 28, 1150);292;(1, 1, 24, 7, 292);למינה;4;7;ויאמר אלהים תוצא הארץ נפש חיה למינה בהמה ורמש וחיתו ארץ למינה ויהי כן
(302170, -60, 4);30;ל;1210;(1, 1, 25, 32, 1210);308;(1, 1, 25, 9, 308);למינה;1;9;ויעש אלהים את חית הארץ למינה ואת הבהמה למינה ואת כל רמש האדמה למינהו וירא אלהים כי טוב
(302170, -60, 4);6;ו;1270;(1, 1, 26, 23, 1270);322;(1, 1, 26, 5, 322);בצלמנו;6;5;ויאמר אלהים נעשה אדם בצלמנו כדמותנו וירדו בדגת הים ובעוף השמים ובבהמה ובכל הארץ ובכל הרמש הרמש על הארץ
(302170, -60, 4);200;ר;1330;(1, 1, 26, 83, 1330);336;(1, 1, 26, 19, 336);הארץ;3;19;ויאמר אלהים נעשה אדם בצלמנו כדמותנו וירדו בדגת הים ובעוף השמים ובבהמה ובכל הארץ ובכל הרמש הרמש על הארץ
(302170, -60, 4);1;א;1390;(1, 1, 28, 9, 1390);352;(1, 1, 28, 3, 352);אלהים;1;3;ויברך אתם אלהים ויאמר להם אלהים פרו ורבו ומלאו את הארץ וכבשה ורדו בדגת הים ובעוף השמים ובכל חיה הרמשת על הארץ
(302170, -60, 4);10;י;1450;(1, 1, 28, 69, 1450);366;(1, 1, 28, 17, 366);השמים;4;17;ויברך אתם אלהים ויאמר להם אלהים פרו ורבו ומלאו את הארץ וכבשה ורדו בדגת הים ובעוף השמים ובכל חיה הרמשת על הארץ
(302170, -60, 4);10;י;1510;(1, 1, 29, 41, 1510);384;(1, 1, 29, 13, 384);פני;3;13;ויאמר אלהים הנה נתתי לכם את כל עשב זרע זרע אשר על פני כל הארץ ואת כל העץ אשר בו פרי עץ זרע זרע לכם יהיה לאכלה
(302170, -60, 4);80;ף;1570;(1, 1, 30, 18, 1570);403;(1, 1, 30, 5, 403);עוף;3;5;ולכל חית הארץ ולכל עוף השמים ולכל רומש על הארץ אשר בו נפש חיה את כל ירק עשב לאכלה ויהי כן
(302170, -60, 4);40;ם;1630;(1, 1, 31, 9, 1630);421;(1, 1, 31, 2, 421);אלהים;5;2;וירא אלהים את כל אשר עשה והנה טוב מאד ויהי ערב ויהי בקר יום הששי
(302170, -60, 4);90;צ;1690;(1, 2, 1, 19, 1690);439;(1, 2, 1, 5, 439);צבאם;1;5;ויכלו השמים והארץ וכל צבאם
(302170, -60, 4);300;ש;1750;(1, 2, 2, 57, 1750);452;(1, 2, 2, 13, 452);אשר;2;13;ויכל אלהים ביום השביעי מלאכתו אשר עשה וישבת ביום השביעי מכל מלאכתו אשר עשה
(302170, -60, 4);40;ם;1810;(1, 2, 3, 56, 1810);468;(1, 2, 3, 15, 468);אלהים;5;15;ויברך אלהים את יום השביעי ויקדש אתו כי בו שבת מכל מלאכתו אשר ברא אלהים לעשות
(302170, -60, 4);10;י;1870;(1, 2, 5, 5, 1870);482;(1, 2, 5, 2, 482);שיח;2;2;וכל שיח השדה טרם יהיה בארץ וכל עשב השדה טרם יצמח כי לא המטיר יהוה אלהים על הארץ ואדם אין לעבד את האדמה
(302170, -60, 4);4;ד;1930;(1, 2, 5, 65, 1930);499;(1, 2, 5, 19, 499);ואדם;3;19;וכל שיח השדה טרם יהיה בארץ וכל עשב השדה טרם יצמח כי לא המטיר יהוה אלהים על הארץ ואדם אין לעבד את האדמה
(302170, -60, 4);1;א;1990;(1, 2, 7, 15, 1990);516;(1, 2, 7, 4, 516);את;1;4;וייצר יהוה אלהים את האדם עפר מן האדמה ויפח באפיו נשמת חיים ויהי האדם לנפש חיה
(302170, -60, 4);40;ם;2050;(1, 2, 8, 13, 2050);531;(1, 2, 8, 3, 531);אלהים;5;3;ויטע יהוה אלהים גן בעדן מקדם וישם שם את האדם אשר יצר
(302170, -60, 4);200;ר;2110;(1, 2, 9, 32, 2110);549;(1, 2, 9, 9, 549);למראה;3;9;ויצמח יהוה אלהים מן האדמה כל עץ נחמד למראה וטוב למאכל ועץ החיים בתוך הגן ועץ הדעת טוב ורע
(302170, -60, 4);3;ג;2170;(1, 2, 10, 21, 2170);565;(1, 2, 10, 6, 565);הגן;2;6;ונהר יצא מעדן להשקות את הגן ומשם יפרד והיה לארבעה ראשים
(302170, -60, 4);40;ם;2230;(1, 2, 11, 36, 2230);581;(1, 2, 11, 11, 581);שם;2;11;שם האחד פישון הוא הסבב את כל ארץ החוילה אשר שם הזהב
(302170, -60, 4);400;ת;2290;(1, 2, 13, 26, 2290);597;(1, 2, 13, 7, 597);את;2;7;ושם הנהר השני גיחון הוא הסובב את כל ארץ כוש
(302170, -60, 4);100;ק;2350;(1, 2, 15, 3, 2350);613;(1, 2, 15, 1, 613);ויקח;3;1;ויקח יהוה אלהים את האדם וינחהו בגן עדן לעבדה ולשמרה
(302170, -60, 4);1;א;2410;(1, 2, 16, 21, 2410);628;(1, 2, 16, 6, 628);לאמר;2;6;ויצו יהוה אלהים על האדם לאמר מכל עץ הגן אכל תאכל
(302170, -60, 4);40;מ;2470;(1, 2, 17, 43, 2470);646;(1, 2, 17, 13, 646);תמות;2;13;ומעץ הדעת טוב ורע לא תאכל ממנו כי ביום אכלך ממנו מות תמות
(302170, -60, 4);40;ם;2530;(1, 2, 19, 13, 2530);661;(1, 2, 19, 3, 661);אלהים;5;3;ויצר יהוה אלהים מן האדמה כל חית השדה ואת כל עוף השמים ויבא אל האדם לראות מה יקרא לו וכל אשר יקרא לו האדם נפש חיה הוא שמו
(302170, -60, 4);100;ק;2590;(1, 2, 19, 73, 2590);680;(1, 2, 19, 22, 680);יקרא;2;22;ויצר יהוה אלהים מן האדמה כל חית השדה ואת כל עוף השמים ויבא אל האדם לראות מה יקרא לו וכל אשר יקרא לו האדם נפש חיה הוא שמו
(302170, -60, 4);300;ש;2650;(1, 2, 20, 40, 2650);696;(1, 2, 20, 10, 696);השדה;2;10;ויקרא האדם שמות לכל הבהמה ולעוף השמים ולכל חית השדה ולאדם לא מצא עזר כנגדו
(302170, -60, 4);70;ע;2710;(1, 2, 21, 40, 2710);711;(1, 2, 21, 10, 711);מצלעתיו;4;10;ויפל יהוה אלהים תרדמה על האדם ויישן ויקח אחת מצלעתיו ויסגר בשר תחתנה
(302170, -60, 4);1;א;2770;(1, 2, 22, 44, 2770);727;(1, 2, 22, 13, 727);האדם;2;13;ויבן יהוה אלהים את הצלע אשר לקח מן האדם לאשה ויבאה אל האדם
(302170, -60, 4);70;ע;2830;(1, 2, 24, 1, 2830);743;(1, 2, 24, 1, 743);על;1;1;על כן יעזב איש את אביו ואת אמו ודבק באשתו והיו לבשר אחד
(302170, -60, 4);1;א;2890;(1, 2, 25, 18, 2890);759;(1, 2, 25, 4, 759);האדם;2;4;ויהיו שניהם ערומים האדם ואשתו ולא יתבששו
(302170, -60, 4);30;ל;2950;(1, 3, 1, 44, 2950);774;(1, 3, 1, 12, 774);אל;2;12;והנחש היה ערום מכל חית השדה אשר עשה יהוה אלהים ויאמר אל האשה אף כי אמר אלהים לא תאכלו מכל עץ הגן
(302170, -60, 4);6;ו;3010;(1, 3, 3, 1, 3010);793;(1, 3, 3, 1, 793);ומפרי;1;1;ומפרי העץ אשר בתוך הגן אמר אלהים לא תאכלו ממנו ולא תגעו בו פן תמתון
(302170, -60, 4);8;ח;3070;(1, 3, 4, 8, 3070);809;(1, 3, 4, 2, 809);הנחש;3;2;ויאמר הנחש אל האשה לא מות תמתון
(302170, -60, 4);40;ם;3130;(1, 3, 5, 43, 3130);824;(1, 3, 5, 10, 824);והייתם;6;10;כי ידע אלהים כי ביום אכלכם ממנו ונפקחו עיניכם והייתם כאלהים ידעי טוב ורע
(302170, -60, 4);70;ע;3190;(1, 3, 6, 44, 3190);840;(1, 3, 6, 12, 840);העץ;2;12;ותרא האשה כי טוב העץ למאכל וכי תאוה הוא לעינים ונחמד העץ להשכיל ותקח מפריו ותאכל ותתן גם לאישה עמה ויאכל
(302170, -60, 4);70;ע;3250;(1, 3, 7, 20, 3250);853;(1, 3, 7, 4, 853);וידעו;4;4;ותפקחנה עיני שניהם וידעו כי עירמם הם ויתפרו עלה תאנה ויעשו להם חגרת
(302170, -60, 4);20;ך;3310;(1, 3, 8, 25, 3310);868;(1, 3, 8, 6, 868);מתהלך;5;6;וישמעו את קול יהוה אלהים מתהלך בגן לרוח היום ויתחבא האדם ואשתו מפני יהוה אלהים בתוך עץ הגן
(302170, -60, 4);5;ה;3370;(1, 3, 9, 12, 3370);883;(1, 3, 9, 3, 883);אלהים;3;3;ויקרא יהוה אלהים אל האדם ויאמר לו איכה
(302170, -60, 4);1;א;3430;(1, 3, 11, 3, 3430);899;(1, 3, 11, 1, 899);ויאמר;3;1;ויאמר מי הגיד לך כי עירם אתה המן העץ אשר צויתיך לבלתי אכל ממנו אכלת
(302170, -60, 4);5;ה;3490;(1, 3, 12, 10, 3490);916;(1, 3, 12, 3, 916);האשה;1;3;ויאמר האדם האשה אשר נתתה עמדי הוא נתנה לי מן העץ ואכל
(302170, -60, 4);6;ו;3550;(1, 3, 13, 28, 3550);933;(1, 3, 13, 8, 933);ותאמר;1;8;ויאמר יהוה אלהים לאשה מה זאת עשית ותאמר האשה הנחש השיאני ואכל
(302170, -60, 4);20;כ;3610;(1, 3, 14, 38, 3610);948;(1, 3, 14, 11, 948);מכל;2;11;ויאמר יהוה אלהים אל הנחש כי עשית זאת ארור אתה מכל הבהמה ומכל חית השדה על גחנך תלך ועפר תאכל כל ימי חייך
(302170, -60, 4);50;ן;3670;(1, 3, 15, 17, 3670);964;(1, 3, 15, 4, 964);ובין;4;4;ואיבה אשית בינך ובין האשה ובין זרעך ובין זרעה הוא ישופך ראש ואתה תשופנו עקב
(302170, -60, 4);2;ב;3730;(1, 3, 16, 16, 3730);980;(1, 3, 16, 5, 980);ארבה;3;5;אל האשה אמר הרבה ארבה עצבונך והרנך בעצב תלדי בנים ואל אישך תשוקתך והוא ימשל בך
(302170, -60, 4);70;ע;3790;(1, 3, 17, 13, 3790);995;(1, 3, 17, 4, 995);שמעת;3;4;ולאדם אמר כי שמעת לקול אשתך ותאכל מן העץ אשר צויתיך לאמר לא תאכל ממנו ארורה האדמה בעבורך בעצבון תאכלנה כל ימי חייך
(302170, -60, 4);70;ע;3850;(1, 3, 17, 73, 3850);1010;(1, 3, 17, 19, 1010);בעצבון;2;19;ולאדם אמר כי שמעת לקול אשתך ותאכל מן העץ אשר צויתיך לאמר לא תאכל ממנו ארורה האדמה בעבורך בעצבון תאכלנה כל ימי חייך
(302170, -60, 4);20;כ;3910;(1, 3, 19, 11, 3910);1025;(1, 3, 19, 3, 1025);תאכל;3;3;בזעת אפיך תאכל לחם עד שובך אל האדמה כי ממנה לקחת כי עפר אתה ואל עפר תשוב
(302170, -60, 4);6;ו;3970;(1, 3, 20, 15, 3970);1043;(1, 3, 20, 4, 1043);אשתו;4;4;ויקרא האדם שם אשתו חוה כי הוא היתה אם כל חי
(302170, -60, 4);200;ר;4030;(1, 3, 22, 5, 4030);1059;(1, 3, 22, 1, 1059);ויאמר;5;1;ויאמר יהוה אלהים הן האדם היה כאחד ממנו לדעת טוב ורע ועתה פן ישלח ידו ולקח גם מעץ החיים ואכל וחי לעלם
(302170, -60, 4);8;ח;4090;(1, 3, 22, 65, 4090);1077;(1, 3, 22, 19, 1077);החיים;2;19;ויאמר יהוה אלהים הן האדם היה כאחד ממנו לדעת טוב ורע ועתה פן ישלח ידו ולקח גם מעץ החיים ואכל וחי לעלם
(302170, -60, 4);200;ר;4150;(1, 3, 24, 4, 4150);1092;(1, 3, 24, 1, 1092);ויגרש;4;1;ויגרש את האדם וישכן מקדם לגן עדן את הכרבים ואת להט החרב המתהפכת לשמר את דרך עץ החיים
(302170, -60, 4);8;ח;4210;(1, 3, 24, 64, 4210);1109;(1, 3, 24, 18, 1109);החיים;2;18;ויגרש את האדם וישכן מקדם לגן עדן את הכרבים ואת להט החרב המתהפכת לשמר את דרך עץ החיים
(302170, -60, 4);400;ת;4270;(1, 4, 2, 8, 4270);1125;(1, 4, 2, 2, 1125);ללדת;4;2;ותסף ללדת את אחיו את הבל ויהי הבל רעה צאן וקין היה עבד אדמה
(302170, -60, 4);10;י;4330;(1, 4, 3, 22, 4330);1143;(1, 4, 3, 6, 1143);מפרי;4;6;ויהי מקץ ימים ויבא קין מפרי האדמה מנחה ליהוה
(302170, -60, 4);30;ל;4390;(1, 4, 4, 46, 4390);1158;(1, 4, 4, 12, 1158);ואל;3;12;והבל הביא גם הוא מבכרות צאנו ומחלבהן וישע יהוה אל הבל ואל מנחתו
(302170, -60, 4);40;מ;4450;(1, 4, 6, 16, 4450);1175;(1, 4, 6, 5, 1175);למה;2;5;ויאמר יהוה אל קין למה חרה לך ולמה נפלו פניך
(302170, -60, 4);300;ש;4510;(1, 4, 7, 42, 4510);1192;(1, 4, 7, 12, 1192);תשוקתו;2;12;הלוא אם תיטיב שאת ואם לא תיטיב לפתח חטאת רבץ ואליך תשוקתו ואתה תמשל בו
(302170, -60, 4);10;י;4570;(1, 4, 8, 46, 4570);1208;(1, 4, 8, 13, 1208);אחיו;3;13;ויאמר קין אל הבל אחיו ויהי בהיותם בשדה ויקם קין אל הבל אחיו ויהרגהו
(302170, -60, 4);40;מ;4630;(1, 4, 10, 6, 4630);1224;(1, 4, 10, 2, 1224);מה;1;2;ויאמר מה עשית קול דמי אחיך צעקים אלי מן האדמה
(302170, -60, 4);5;ה;4690;(1, 4, 11, 30, 4690);1241;(1, 4, 11, 9, 1241);פיה;3;9;ועתה ארור אתה מן האדמה אשר פצתה את פיה לקחת את דמי אחיך מידך
(302170, -60, 4);200;ר;4750;(1, 4, 13, 5, 4750);1260;(1, 4, 13, 1, 1260);ויאמר;5;1;ויאמר קין אל יהוה גדול עוני מנשוא
(302170, -60, 4);10;י;4810;(1, 4, 14, 38, 4810);1276;(1, 4, 14, 10, 1276);והייתי;4;10;הן גרשת אתי היום מעל פני האדמה ומפניך אסתר והייתי נע ונד בארץ והיה כל מצאי יהרגני
(302170, -60, 4);10;י;4870;(1, 4, 15, 33, 4870);1293;(1, 4, 15, 10, 1293);וישם;2;10;ויאמר לו יהוה לכן כל הרג קין שבעתים יקם וישם יהוה לקין אות לבלתי הכות אתו כל מצאו
(302170, -60, 4);4;ד;4930;(1, 4, 16, 29, 4930);1309;(1, 4, 16, 8, 1309);קדמת;2;8;ויצא קין מלפני יהוה וישב בארץ נוד קדמת עדן
(302170, -60, 4);8;ח;4990;(1, 4, 17, 55, 4990);1327;(1, 4, 17, 17, 1327);חנוך;1;17;וידע קין את אשתו ותהר ותלד את חנוך ויהי בנה עיר ויקרא שם העיר כשם בנו חנוך
(302170, -60, 4);30;ל;5050;(1, 4, 18, 57, 5050);1340;(1, 4, 18, 13, 1340);ומתושאל;7;13;ויולד לחנוך את עירד ועירד ילד את מחויאל ומחייאל ילד את מתושאל ומתושאל ילד את למך
(302170, -60, 4);5;ה;5110;(1, 4, 20, 16, 5110);1360;(1, 4, 20, 6, 1360);היה;1;6;ותלד עדה את יבל הוא היה אבי ישב אהל ומקנה
(302170, -60, 4);10;י;5170;(1, 4, 22, 10, 5170);1378;(1, 4, 22, 4, 1378);ילדה;1;4;וצלה גם הוא ילדה את תובל קין לטש כל חרש נחשת וברזל ואחות תובל קין נעמה
(302170, -60, 4);4;ד;5230;(1, 4, 23, 15, 5230);1394;(1, 4, 23, 4, 1394);עדה;2;4;ויאמר למך לנשיו עדה וצלה שמען קולי נשי למך האזנה אמרתי כי איש הרגתי לפצעי וילד לחברתי
(302170, -60, 4);400;ת;5290;(1, 4, 24, 6, 5290);1409;(1, 4, 24, 2, 1409);שבעתים;4;2;כי שבעתים יקם קין ולמך שבעים ושבעה
(302170, -60, 4);400;ת;5350;(1, 4, 25, 38, 5350);1427;(1, 4, 25, 13, 1427);שת;2;13;וידע אדם עוד את אשתו ותלד בן ותקרא את שמו שת כי שת לי אלהים זרע אחר תחת הבל כי הרגו קין
(302170, -60, 4);6;ו;5410;(1, 4, 26, 32, 5410);1447;(1, 4, 26, 11, 1447);הוחל;2;11;ולשת גם הוא ילד בן ויקרא את שמו אנוש אז הוחל לקרא בשם יהוה
(302170, -60, 4);200;ר;5470;(1, 5, 2, 3, 5470);1463;(1, 5, 2, 1, 1463);זכר;3;1;זכר ונקבה בראם ויברך אתם ויקרא את שמם אדם ביום הבראם
(302170, -60, 4);10;י;5530;(1, 5, 3, 21, 5530);1479;(1, 5, 3, 6, 1479);ויולד;2;6;ויחי אדם שלשים ומאת שנה ויולד בדמותו כצלמו ויקרא את שמו שת
(302170, -60, 4);50;נ;5590;(1, 5, 4, 34, 5590);1495;(1, 5, 4, 10, 1495);שנה;2;10;ויהיו ימי אדם אחרי הולידו את שת שמנה מאת שנה ויולד בנים ובנות
(302170, -60, 4);10;י;5650;(1, 5, 6, 4, 5650);1511;(1, 5, 6, 1, 1511);ויחי;4;1;ויחי שת חמש שנים ומאת שנה ויולד את אנוש
(302170, -60, 4);50;נ;5710;(1, 5, 7, 33, 5710);1528;(1, 5, 7, 9, 1528);ושמנה;4;9;ויחי שת אחרי הולידו את אנוש שבע שנים ושמנה מאות שנה ויולד בנים ובנות
(302170, -60, 4);400;ת;5770;(1, 5, 8, 38, 5770);1544;(1, 5, 8, 11, 1544);וימת;4;11;ויהיו כל ימי שת שתים עשרה שנה ותשע מאות שנה וימת
(302170, -60, 4);50;נ;5830;(1, 5, 10, 33, 5830);1560;(1, 5, 10, 9, 1560);שנה;2;9;ויחי אנוש אחרי הולידו את קינן חמש עשרה שנה ושמנה מאות שנה ויולד בנים ובנות
(302170, -60, 4);6;ו;5890;(1, 5, 11, 33, 5890);1576;(1, 5, 11, 10, 1576);וימת;1;10;ויהיו כל ימי אנוש חמש שנים ותשע מאות שנה וימת
(302170, -60, 4);200;ר;5950;(1, 5, 13, 28, 5950);1590;(1, 5, 13, 7, 1590);ארבעים;2;7;ויחי קינן אחרי הולידו את מהללאל ארבעים שנה ושמנה מאות שנה ויולד בנים ובנות
(302170, -60, 4);1;א;6010;(1, 5, 14, 27, 6010);1605;(1, 5, 14, 8, 1605);מאות;2;8;ויהיו כל ימי קינן עשר שנים ותשע מאות שנה וימת
(302170, -60, 4);6;ו;6070;(1, 5, 16, 16, 6070);1620;(1, 5, 16, 4, 1620);הולידו;2;4;ויחי מהללאל אחרי הולידו את ירד שלשים שנה ושמנה מאות שנה ויולד בנים ובנות
(302170, -60, 4);8;ח;6130;(1, 5, 17, 17, 6130);1635;(1, 5, 17, 5, 1635);חמש;1;5;ויהיו כל ימי מהללאל חמש ותשעים שנה ושמנה מאות שנה וימת
(302170, -60, 4);400;ת;6190;(1, 5, 18, 33, 6190);1650;(1, 5, 18, 9, 1650);את;2;9;ויחי ירד שתים וששים שנה ומאת שנה ויולד את חנוך
(302170, -60, 4);10;י;6250;(1, 5, 20, 8, 6250);1666;(1, 5, 20, 3, 1666);ימי;1;3;ויהיו כל ימי ירד שתים וששים שנה ותשע מאות שנה וימת
(302170, -60, 4);400;ת;6310;(1, 5, 21, 28, 6310);1682;(1, 5, 21, 8, 1682);מתושלח;2;8;ויחי חנוך חמש וששים שנה ויולד את מתושלח
(302170, -60, 4);6;ו;6370;(1, 5, 22, 56, 6370);1696;(1, 5, 22, 14, 1696);ובנות;1;14;ויתהלך חנוך את האלהים אחרי הולידו את מתושלח שלש מאות שנה ויולד בנים ובנות
(302170, -60, 4);10;י;6430;(1, 5, 24, 21, 6430);1711;(1, 5, 24, 5, 1711);ואיננו;3;5;ויתהלך חנוך את האלהים ואיננו כי לקח אתו אלהים
(302170, -60, 4);40;מ;6490;(1, 5, 26, 5, 6490);1727;(1, 5, 26, 2, 1727);מתושלח;1;2;ויחי מתושלח אחרי הולידו את למך שתים ושמונים שנה ושבע מאות שנה ויולד בנים ובנות
(302170, -60, 4);6;ו;6550;(1, 5, 27, 1, 6550);1741;(1, 5, 27, 1, 1741);ויהיו;1;1;ויהיו כל ימי מתושלח תשע וששים שנה ותשע מאות שנה וימת
(302170, -60, 4);50;נ;6610;(1, 5, 28, 19, 6610);1756;(1, 5, 28, 5, 1756);שנה;2;5;ויחי למך שתים ושמנים שנה ומאת שנה ויולד בן
(302170, -60, 4);5;ה;6670;(1, 5, 29, 45, 6670);1772;(1, 5, 29, 12, 1772);האדמה;1;12;ויקרא את שמו נח לאמר זה ינחמנו ממעשנו ומעצבון ידינו מן האדמה אשר אררה יהוה
(302170, -60, 4);10;י;6730;(1, 5, 30, 45, 6730);1788;(1, 5, 30, 13, 1788);ויולד;2;13;ויחי למך אחרי הולידו את נח חמש ותשעים שנה וחמש מאת שנה ויולד בנים ובנות
(302170, -60, 4);8;ח;6790;(1, 5, 32, 9, 6790);1805;(1, 5, 32, 4, 1805);חמש;1;4;ויהי נח בן חמש מאות שנה ויולד נח את שם את חם ואת יפת
(302170, -60, 4);6;ו;6850;(1, 6, 1, 30, 6850);1824;(1, 6, 1, 9, 1824);ובנות;4;9;ויהי כי החל האדם לרב על פני האדמה ובנות ילדו להם
(302170, -60, 4);8;ח;6910;(1, 6, 2, 52, 6910);1841;(1, 6, 2, 15, 1841);בחרו;2;15;ויראו בני האלהים את בנות האדם כי טבת הנה ויקחו להם נשים מכל אשר בחרו
(302170, -60, 4);5;ה;6970;(1, 6, 4, 1, 6970);1857;(1, 6, 4, 1, 1857);הנפלים;1;1;הנפלים היו בארץ בימים ההם וגם אחרי כן אשר יבאו בני האלהים אל בנות האדם וילדו להם המה הגברים אשר מעולם אנשי השם
(302170, -60, 4);6;ו;7030;(1, 6, 4, 61, 7030);1872;(1, 6, 4, 16, 1872);וילדו;5;16;הנפלים היו בארץ בימים ההם וגם אחרי כן אשר יבאו בני האלהים אל בנות האדם וילדו להם המה הגברים אשר מעולם אנשי השם
(302170, -60, 4);300;ש;7090;(1, 6, 5, 33, 7090);1889;(1, 6, 5, 10, 1889);מחשבת;3;10;וירא יהוה כי רבה רעת האדם בארץ וכל יצר מחשבת לבו רק רע כל היום
(302170, -60, 4);1;א;7150;(1, 6, 7, 10, 7150);1907;(1, 6, 7, 3, 1907);אמחה;1;3;ויאמר יהוה אמחה את האדם אשר בראתי מעל פני האדמה מאדם עד בהמה עד רמש ועד עוף השמים כי נחמתי כי עשיתם
