(130159, 80, 4);50;נ;148159;(3, 6, 7, 11, 148159);39093;(3, 6, 7, 3, 39093);המנחה;3;3;וזאת תורת המנחה הקרב אתה בני אהרן לפני יהוה אל פני המזבח
(130159, 80, 4);40;מ;148239;(3, 6, 8, 46, 148239);39114;(3, 6, 8, 12, 39114);המנחה;2;12;והרים ממנו בקמצו מסלת המנחה ומשמנה ואת כל הלבנה אשר על המנחה והקטיר המזבח ריח ניחח אזכרתה ליהוה
(130159, 80, 4);30;ל;148319;(3, 6, 9, 48, 148319);39131;(3, 6, 9, 11, 39131);אהל;3;11;והנותרת ממנה יאכלו אהרן ובניו מצות תאכל במקום קדש בחצר אהל מועד יאכלוה
(130159, 80, 4);40;ם;148399;(3, 6, 11, 25, 148399);39152;(3, 6, 11, 7, 39152);עולם;4;7;כל זכר בבני אהרן יאכלנה חק עולם לדרתיכם מאשי יהוה כל אשר יגע בהם יקדש
(130159, 80, 4);6;ו;148479;(3, 6, 13, 32, 148479);39173;(3, 6, 13, 8, 39173);ביום;3;8;זה קרבן אהרן ובניו אשר יקריבו ליהוה ביום המשח אתו עשירת האפה סלת מנחה תמיד מחציתה בבקר ומחציתה בערב
(130159, 80, 4);40;מ;148559;(3, 6, 14, 31, 148559);39192;(3, 6, 14, 8, 39192);מנחת;1;8;על מחבת בשמן תעשה מרבכת תביאנה תפיני מנחת פתים תקריב ריח ניחח ליהוה
(130159, 80, 4);50;ן;148639;(3, 6, 16, 10, 148639);39211;(3, 6, 16, 3, 39211);כהן;3;3;וכל מנחת כהן כליל תהיה לא תאכל
(130159, 80, 4);5;ה;148719;(3, 6, 18, 48, 148719);39233;(3, 6, 18, 13, 39233);העלה;4;13;דבר אל אהרן ואל בניו לאמר זאת תורת החטאת במקום אשר תשחט העלה תשחט החטאת לפני יהוה קדש קדשים הוא
(130159, 80, 4);300;ש;148799;(3, 6, 20, 11, 148799);39254;(3, 6, 20, 4, 39254);בבשרה;3;4;כל אשר יגע בבשרה יקדש ואשר יזה מדמה על הבגד אשר יזה עליה תכבס במקום קדש
(130159, 80, 4);5;ה;148879;(3, 6, 21, 35, 148879);39276;(3, 6, 21, 10, 39276);בשלה;4;10;וכלי חרש אשר תבשל בו ישבר ואם בכלי נחשת בשלה ומרק ושטף במים
(130159, 80, 4);1;א;148959;(3, 6, 23, 39, 148959);39299;(3, 6, 23, 12, 39299);תאכל;2;12;וכל חטאת אשר יובא מדמה אל אהל מועד לכפר בקדש לא תאכל באש תשרף
(130159, 80, 4);60;ס;149039;(3, 7, 2, 48, 149039);39321;(3, 7, 2, 14, 39321);סביב;1;14;במקום אשר ישחטו את העלה ישחטו את האשם ואת דמו יזרק על המזבח סביב
(130159, 80, 4);60;ס;149119;(3, 7, 4, 34, 149119);39343;(3, 7, 4, 10, 39343);הכסלים;3;10;ואת שתי הכלית ואת החלב אשר עליהן אשר על הכסלים ואת היתרת על הכבד על הכלית יסירנה
(130159, 80, 4);6;ו;149199;(3, 7, 6, 17, 149199);39362;(3, 7, 6, 4, 39362);יאכלנו;6;4;כל זכר בכהנים יאכלנו במקום קדוש יאכל קדש קדשים הוא
(130159, 80, 4);10;י;149279;(3, 7, 8, 18, 149279);39384;(3, 7, 8, 5, 39384);איש;2;5;והכהן המקריב את עלת איש עור העלה אשר הקריב לכהן לו יהיה
(130159, 80, 4);6;ו;149359;(3, 7, 9, 54, 149359);39405;(3, 7, 9, 14, 39405);לו;2;14;וכל מנחה אשר תאפה בתנור וכל נעשה במרחשת ועל מחבת לכהן המקריב אתה לו תהיה
(130159, 80, 4);70;ע;149439;(3, 7, 12, 3, 149439);39426;(3, 7, 12, 2, 39426);על;1;2;אם על תודה יקריבנו והקריב על זבח התודה חלות מצות בלולת בשמן ורקיקי מצות משחים בשמן וסלת מרבכת חלת בלולת בשמן
(130159, 80, 4);30;ל;149519;(3, 7, 12, 83, 149519);39444;(3, 7, 12, 20, 39444);בלולת;4;20;אם על תודה יקריבנו והקריב על זבח התודה חלות מצות בלולת בשמן ורקיקי מצות משחים בשמן וסלת מרבכת חלת בלולת בשמן
(130159, 80, 4);400;ת;149599;(3, 7, 14, 40, 149599);39465;(3, 7, 14, 10, 39465);את;2;10;והקריב ממנו אחד מכל קרבן תרומה ליהוה לכהן הזרק את דם השלמים לו יהיה
(130159, 80, 4);10;י;149679;(3, 7, 16, 22, 149679);39488;(3, 7, 16, 7, 39488);ביום;2;7;ואם נדר או נדבה זבח קרבנו ביום הקריבו את זבחו יאכל וממחרת והנותר ממנו יאכל
(130159, 80, 4);30;ל;149759;(3, 7, 18, 11, 149759);39506;(3, 7, 18, 3, 39506);יאכל;4;3;ואם האכל יאכל מבשר זבח שלמיו ביום השלישי לא ירצה המקריב אתו לא יחשב לו פגול יהיה והנפש האכלת ממנו עונה תשא
(130159, 80, 4);1;א;149839;(3, 7, 19, 6, 149839);39527;(3, 7, 19, 2, 39527);אשר;1;2;והבשר אשר יגע בכל טמא לא יאכל באש ישרף והבשר כל טהור יאכל בשר
(130159, 80, 4);400;ת;149919;(3, 7, 20, 38, 149919);39548;(3, 7, 20, 9, 39548);וטמאתו;5;9;והנפש אשר תאכל בשר מזבח השלמים אשר ליהוה וטמאתו עליו ונכרתה הנפש ההוא מעמיה
(130159, 80, 4);8;ח;149999;(3, 7, 21, 56, 149999);39570;(3, 7, 21, 17, 39570);זבח;3;17;ונפש כי תגע בכל טמא בטמאת אדם או בבהמה טמאה או בכל שקץ טמא ואכל מבשר זבח השלמים אשר ליהוה ונכרתה הנפש ההוא מעמיה
(130159, 80, 4);2;ב;150079;(3, 7, 23, 29, 150079);39591;(3, 7, 23, 9, 39591);וכשב;4;9;דבר אל בני ישראל לאמר כל חלב שור וכשב ועז לא תאכלו
(130159, 80, 4);1;א;150159;(3, 7, 25, 30, 150159);39614;(3, 7, 25, 10, 39614);אשה;1;10;כי כל אכל חלב מן הבהמה אשר יקריב ממנה אשה ליהוה ונכרתה הנפש האכלת מעמיה
(130159, 80, 4);200;ר;150239;(3, 7, 27, 20, 150239);39634;(3, 7, 27, 7, 39634);ונכרתה;4;7;כל נפש אשר תאכל כל דם ונכרתה הנפש ההוא מעמיה
(130159, 80, 4);2;ב;150319;(3, 7, 29, 47, 150319);39655;(3, 7, 29, 13, 39655);קרבנו;3;13;דבר אל בני ישראל לאמר המקריב את זבח שלמיו ליהוה יביא את קרבנו ליהוה מזבח שלמיו
(130159, 80, 4);6;ו;150399;(3, 7, 30, 64, 150399);39675;(3, 7, 30, 17, 39675);יהוה;3;17;ידיו תביאינה את אשי יהוה את החלב על החזה יביאנו את החזה להניף אתו תנופה לפני יהוה
(130159, 80, 4);100;ק;150479;(3, 7, 33, 3, 150479);39693;(3, 7, 33, 1, 39693);המקריב;3;1;המקריב את דם השלמים ואת החלב מבני אהרן לו תהיה שוק הימין למנה
(130159, 80, 4);2;ב;150559;(3, 7, 34, 34, 150559);39715;(3, 7, 34, 10, 39715);בני;1;10;כי את חזה התנופה ואת שוק התרומה לקחתי מאת בני ישראל מזבחי שלמיהם ואתן אתם לאהרן הכהן ולבניו לחק עולם מאת בני ישראל
(130159, 80, 4);1;א;150639;(3, 7, 35, 22, 150639);39734;(3, 7, 35, 6, 39734);מאשי;2;6;זאת משחת אהרן ומשחת בניו מאשי יהוה ביום הקריב אתם לכהן ליהוה
(130159, 80, 4);400;ת;150719;(3, 7, 37, 3, 150719);39755;(3, 7, 37, 1, 39755);זאת;3;1;זאת התורה לעלה למנחה ולחטאת ולאשם ולמלואים ולזבח השלמים
(130159, 80, 4);10;י;150799;(3, 7, 38, 36, 150799);39775;(3, 7, 38, 12, 39775);ישראל;1;12;אשר צוה יהוה את משה בהר סיני ביום צותו את בני ישראל להקריב את קרבניהם ליהוה במדבר סיני
(130159, 80, 4);1;א;150879;(3, 8, 2, 29, 150879);39795;(3, 8, 2, 9, 39795);ואת;2;9;קח את אהרן ואת בניו אתו ואת הבגדים ואת שמן המשחה ואת פר החטאת ואת שני האילים ואת סל המצות
(130159, 80, 4);5;ה;150959;(3, 8, 4, 14, 150959);39818;(3, 8, 4, 4, 39818);צוה;3;4;ויעש משה כאשר צוה יהוה אתו ותקהל העדה אל פתח אהל מועד
(130159, 80, 4);400;ת;151039;(3, 8, 6, 17, 151039);39841;(3, 8, 6, 5, 39841);ואת;3;5;ויקרב משה את אהרן ואת בניו וירחץ אתם במים
(130159, 80, 4);400;ת;151119;(3, 8, 7, 64, 151119);39862;(3, 8, 7, 17, 39862);אתו;2;17;ויתן עליו את הכתנת ויחגר אתו באבנט וילבש אתו את המעיל ויתן עליו את האפד ויחגר אתו בחשב האפד ויאפד לו בו
(130159, 80, 4);40;ם;151199;(3, 8, 9, 22, 151199);39884;(3, 8, 9, 6, 39884);וישם;4;6;וישם את המצנפת על ראשו וישם על המצנפת אל מול פניו את ציץ הזהב נזר הקדש כאשר צוה יהוה את משה
(130159, 80, 4);1;א;151279;(3, 8, 10, 31, 151279);39908;(3, 8, 10, 9, 39908);ואת;2;9;ויקח משה את שמן המשחה וימשח את המשכן ואת כל אשר בו ויקדש אתם
(130159, 80, 4);90;צ;151359;(3, 8, 12, 3, 151359);39931;(3, 8, 12, 1, 39931);ויצק;3;1;ויצק משמן המשחה על ראש אהרן וימשח אתו לקדשו
(130159, 80, 4);40;מ;151439;(3, 8, 13, 48, 151439);39952;(3, 8, 13, 13, 39952);מגבעות;1;13;ויקרב משה את בני אהרן וילבשם כתנת ויחגר אתם אבנט ויחבש להם מגבעות כאשר צוה יהוה את משה
(130159, 80, 4);1;א;151519;(3, 8, 15, 13, 151519);39974;(3, 8, 15, 4, 39974);את;1;4;וישחט ויקח משה את הדם ויתן על קרנות המזבח סביב באצבעו ויחטא את המזבח ואת הדם יצק אל יסוד המזבח ויקדשהו לכפר עליו
(130159, 80, 4);100;ק;151599;(3, 8, 16, 3, 151599);39994;(3, 8, 16, 1, 39994);ויקח;3;1;ויקח את כל החלב אשר על הקרב ואת יתרת הכבד ואת שתי הכלית ואת חלבהן ויקטר משה המזבחה
(130159, 80, 4);200;ר;151679;(3, 8, 17, 18, 151679);40017;(3, 8, 17, 6, 40017);בשרו;3;6;ואת הפר ואת ערו ואת בשרו ואת פרשו שרף באש מחוץ למחנה כאשר צוה יהוה את משה
(130159, 80, 4);300;ש;151759;(3, 8, 18, 41, 151759);40039;(3, 8, 18, 11, 40039);ראש;3;11;ויקרב את איל העלה ויסמכו אהרן ובניו את ידיהם על ראש האיל
(130159, 80, 4);6;ו;151839;(3, 8, 21, 1, 151839);40061;(3, 8, 21, 1, 40061);ואת;1;1;ואת הקרב ואת הכרעים רחץ במים ויקטר משה את כל האיל המזבחה עלה הוא לריח ניחח אשה הוא ליהוה כאשר צוה יהוה את משה
(130159, 80, 4);5;ה;151919;(3, 8, 21, 81, 151919);40082;(3, 8, 21, 22, 40082);יהוה;4;22;ואת הקרב ואת הכרעים רחץ במים ויקטר משה את כל האיל המזבחה עלה הוא לריח ניחח אשה הוא ליהוה כאשר צוה יהוה את משה
(130159, 80, 4);50;ן;151999;(3, 8, 23, 20, 151999);40103;(3, 8, 23, 5, 40103);ויתן;4;5;וישחט ויקח משה מדמו ויתן על תנוך אזן אהרן הימנית ועל בהן ידו הימנית ועל בהן רגלו הימנית
(130159, 80, 4);50;נ;152079;(3, 8, 24, 30, 152079);40126;(3, 8, 24, 10, 40126);תנוך;2;10;ויקרב את בני אהרן ויתן משה מן הדם על תנוך אזנם הימנית ועל בהן ידם הימנית ועל בהן רגלם הימנית ויזרק משה את הדם על המזבח סביב
(130159, 80, 4);400;ת;152159;(3, 8, 25, 13, 152159);40147;(3, 8, 25, 4, 40147);ואת;3;4;ויקח את החלב ואת האליה ואת כל החלב אשר על הקרב ואת יתרת הכבד ואת שתי הכלית ואת חלבהן ואת שוק הימין
(130159, 80, 4);10;י;152239;(3, 8, 26, 16, 152239);40169;(3, 8, 26, 4, 40169);לפני;4;4;ומסל המצות אשר לפני יהוה לקח חלת מצה אחת וחלת לחם שמן אחת ורקיק אחד וישם על החלבים ועל שוק הימין
(130159, 80, 4);70;ע;152319;(3, 8, 27, 20, 152319);40193;(3, 8, 27, 7, 40193);ועל;2;7;ויתן את הכל על כפי אהרן ועל כפי בניו וינף אתם תנופה לפני יהוה
(130159, 80, 4);300;ש;152399;(3, 8, 28, 52, 152399);40214;(3, 8, 28, 14, 40214);אשה;2;14;ויקח משה אתם מעל כפיהם ויקטר המזבחה על העלה מלאים הם לריח ניחח אשה הוא ליהוה
(130159, 80, 4);6;ו;152479;(3, 8, 30, 1, 152479);40235;(3, 8, 30, 1, 40235);ויקח;1;1;ויקח משה משמן המשחה ומן הדם אשר על המזבח ויז על אהרן על בגדיו ועל בניו ועל בגדי בניו אתו ויקדש את אהרן את בגדיו ואת בניו ואת בגדי בניו אתו
(130159, 80, 4);1;א;152559;(3, 8, 30, 81, 152559);40258;(3, 8, 30, 24, 40258);את;1;24;ויקח משה משמן המשחה ומן הדם אשר על המזבח ויז על אהרן על בגדיו ועל בניו ועל בגדי בניו אתו ויקדש את אהרן את בגדיו ואת בניו ואת בגדי בניו אתו
(130159, 80, 4);6;ו;152639;(3, 8, 31, 53, 152639);40281;(3, 8, 31, 16, 40281);ואת;1;16;ויאמר משה אל אהרן ואל בניו בשלו את הבשר פתח אהל מועד ושם תאכלו אתו ואת הלחם אשר בסל המלאים כאשר צויתי לאמר אהרן ובניו יאכלהו
(130159, 80, 4);70;ע;152719;(3, 8, 33, 11, 152719);40299;(3, 8, 33, 3, 40299);מועד;3;3;ומפתח אהל מועד לא תצאו שבעת ימים עד יום מלאת ימי מלאיכם כי שבעת ימים ימלא את ידכם
(130159, 80, 4);20;כ;152799;(3, 8, 34, 27, 152799);40322;(3, 8, 34, 8, 40322);לכפר;2;8;כאשר עשה ביום הזה צוה יהוה לעשת לכפר עליכם
(130159, 80, 4);200;ר;152879;(3, 8, 36, 7, 152879);40342;(3, 8, 36, 2, 40342);אהרן;3;2;ויעש אהרן ובניו את כל הדברים אשר צוה יהוה ביד משה
(130159, 80, 4);1;א;152959;(3, 9, 2, 6, 152959);40362;(3, 9, 2, 2, 40362);אל;1;2;ויאמר אל אהרן קח לך עגל בן בקר לחטאת ואיל לעלה תמימם והקרב לפני יהוה
(130159, 80, 4);8;ח;153039;(3, 9, 3, 32, 153039);40384;(3, 9, 3, 9, 40384);לחטאת;2;9;ואל בני ישראל תדבר לאמר קחו שעיר עזים לחטאת ועגל וכבש בני שנה תמימם לעלה
(130159, 80, 4);5;ה;153119;(3, 9, 4, 54, 153119);40403;(3, 9, 4, 13, 40403);נראה;4;13;ושור ואיל לשלמים לזבח לפני יהוה ומנחה בלולה בשמן כי היום יהוה נראה אליכם
(130159, 80, 4);10;י;153199;(3, 9, 6, 21, 153199);40426;(3, 9, 6, 7, 40426);יהוה;1;7;ויאמר משה זה הדבר אשר צוה יהוה תעשו וירא אליכם כבוד יהוה
(130159, 80, 4);70;ע;153279;(3, 9, 7, 56, 153279);40447;(3, 9, 7, 16, 40447);העם;2;16;ויאמר משה אל אהרן קרב אל המזבח ועשה את חטאתך ואת עלתך וכפר בעדך ובעד העם ועשה את קרבן העם וכפר בעדם כאשר צוה יהוה
(130159, 80, 4);5;ה;153359;(3, 9, 9, 11, 153359);40469;(3, 9, 9, 3, 40469);אהרן;2;3;ויקרבו בני אהרן את הדם אליו ויטבל אצבעו בדם ויתן על קרנות המזבח ואת הדם יצק אל יסוד המזבח
(130159, 80, 4);10;י;153439;(3, 9, 10, 20, 153439);40491;(3, 9, 10, 6, 40491);היתרת;2;6;ואת החלב ואת הכלית ואת היתרת מן הכבד מן החטאת הקטיר המזבחה כאשר צוה יהוה את משה
(130159, 80, 4);5;ה;153519;(3, 9, 12, 8, 153519);40513;(3, 9, 12, 3, 40513);העלה;1;3;וישחט את העלה וימצאו בני אהרן אליו את הדם ויזרקהו על המזבח סביב
(130159, 80, 4);30;ל;153599;(3, 9, 13, 37, 153599);40532;(3, 9, 13, 9, 40532);על;2;9;ואת העלה המציאו אליו לנתחיה ואת הראש ויקטר על המזבח
(130159, 80, 4);300;ש;153679;(3, 9, 15, 38, 153679);40553;(3, 9, 15, 11, 40553);וישחטהו;3;11;ויקרב את קרבן העם ויקח את שעיר החטאת אשר לעם וישחטהו ויחטאהו כראשון
(130159, 80, 4);30;ל;153759;(3, 9, 17, 42, 153759);40571;(3, 9, 17, 11, 40571);עלת;2;11;ויקרב את המנחה וימלא כפו ממנה ויקטר על המזבח מלבד עלת הבקר
(130159, 80, 4);1;א;153839;(3, 9, 19, 2, 153839);40592;(3, 9, 19, 1, 40592);ואת;2;1;ואת החלבים מן השור ומן האיל האליה והמכסה והכלית ויתרת הכבד
(130159, 80, 4);40;מ;153919;(3, 9, 20, 34, 153919);40610;(3, 9, 20, 8, 40610);המזבחה;2;8;וישימו את החלבים על החזות ויקטר החלבים המזבחה
(130159, 80, 4);10;י;153999;(3, 9, 22, 26, 153999);40631;(3, 9, 22, 8, 40631);וירד;2;8;וישא אהרן את ידו אל העם ויברכם וירד מעשת החטאת והעלה והשלמים
(130159, 80, 4);6;ו;154079;(3, 9, 24, 1, 154079);40652;(3, 9, 24, 1, 40652);ותצא;1;1;ותצא אש מלפני יהוה ותאכל על המזבח את העלה ואת החלבים וירא כל העם וירנו ויפלו על פניהם
(130159, 80, 4);50;נ;154159;(3, 10, 1, 13, 154159);40673;(3, 10, 1, 4, 40673);נדב;1;4;ויקחו בני אהרן נדב ואביהוא איש מחתתו ויתנו בהן אש וישימו עליה קטרת ויקריבו לפני יהוה אש זרה אשר לא צוה אתם
(130159, 80, 4);30;ל;154239;(3, 10, 2, 8, 154239);40694;(3, 10, 2, 3, 40694);מלפני;2;3;ותצא אש מלפני יהוה ותאכל אותם וימתו לפני יהוה
(130159, 80, 4);40;ם;154319;(3, 10, 3, 51, 154319);40715;(3, 10, 3, 15, 40715);העם;3;15;ויאמר משה אל אהרן הוא אשר דבר יהוה לאמר בקרבי אקדש ועל פני כל העם אכבד וידם אהרן
(130159, 80, 4);100;ק;154399;(3, 10, 4, 68, 154399);40737;(3, 10, 4, 19, 40737);הקדש;2;19;ויקרא משה אל מישאל ואל אלצפן בני עזיאל דד אהרן ויאמר אלהם קרבו שאו את אחיכם מאת פני הקדש אל מחוץ למחנה
(130159, 80, 4);2;ב;154479;(3, 10, 6, 29, 154479);40756;(3, 10, 6, 7, 40756);בניו;1;7;ויאמר משה אל אהרן ולאלעזר ולאיתמר בניו ראשיכם אל תפרעו ובגדיכם לא תפרמו ולא תמתו ועל כל העדה יקצף ואחיכם כל בית ישראל יבכו את השרפה אשר שרף יהוה
(130159, 80, 4);200;ר;154559;(3, 10, 6, 109, 154559);40776;(3, 10, 6, 27, 40776);אשר;3;27;ויאמר משה אל אהרן ולאלעזר ולאיתמר בניו ראשיכם אל תפרעו ובגדיכם לא תפרמו ולא תמתו ועל כל העדה יקצף ואחיכם כל בית ישראל יבכו את השרפה אשר שרף יהוה
(130159, 80, 4);200;ר;154639;(3, 10, 8, 19, 154639);40798;(3, 10, 8, 5, 40798);לאמר;4;5;וידבר יהוה אל אהרן לאמר
(130159, 80, 4);6;ו;154719;(3, 10, 10, 22, 154719);40820;(3, 10, 10, 6, 40820);ובין;1;6;ולהבדיל בין הקדש ובין החל ובין הטמא ובין הטהור
(130159, 80, 4);1;א;154799;(3, 10, 12, 18, 154799);40842;(3, 10, 12, 6, 40842);אלעזר;1;6;וידבר משה אל אהרן ואל אלעזר ואל איתמר בניו הנותרים קחו את המנחה הנותרת מאשי יהוה ואכלוה מצות אצל המזבח כי קדש קדשים הוא
(130159, 80, 4);1;א;154879;(3, 10, 13, 2, 154879);40861;(3, 10, 13, 1, 40861);ואכלתם;2;1;ואכלתם אתה במקום קדוש כי חקך וחק בניך הוא מאשי יהוה כי כן צויתי
(130159, 80, 4);100;ק;154959;(3, 10, 14, 32, 154959);40882;(3, 10, 14, 8, 40882);במקום;3;8;ואת חזה התנופה ואת שוק התרומה תאכלו במקום טהור אתה ובניך ובנתיך אתך כי חקך וחק בניך נתנו מזבחי שלמי בני ישראל
(130159, 80, 4);10;י;155039;(3, 10, 15, 24, 155039);40902;(3, 10, 15, 6, 40902);אשי;3;6;שוק התרומה וחזה התנופה על אשי החלבים יביאו להניף תנופה לפני יהוה והיה לך ולבניך אתך לחק עולם כאשר צוה יהוה
(130159, 80, 4);300;ש;155119;(3, 10, 16, 18, 155119);40922;(3, 10, 16, 5, 40922);דרש;3;5;ואת שעיר החטאת דרש דרש משה והנה שרף ויקצף על אלעזר ועל איתמר בני אהרן הנותרם לאמר
(130159, 80, 4);100;ק;155199;(3, 10, 17, 33, 155199);40944;(3, 10, 17, 10, 40944);קדשים;1;10;מדוע לא אכלתם את החטאת במקום הקדש כי קדש קדשים הוא ואתה נתן לכם לשאת את עון העדה לכפר עליהם לפני יהוה
(130159, 80, 4);6;ו;155279;(3, 10, 18, 33, 155279);40966;(3, 10, 18, 10, 40966);תאכלו;5;10;הן לא הובא את דמה אל הקדש פנימה אכול תאכלו אתה בקדש כאשר צויתי
(130159, 80, 4);1;א;155359;(3, 10, 19, 64, 155359);40987;(3, 10, 19, 17, 40987);ואכלתי;2;17;וידבר אהרן אל משה הן היום הקריבו את חטאתם ואת עלתם לפני יהוה ותקראנה אתי כאלה ואכלתי חטאת היום הייטב בעיני יהוה
(130159, 80, 4);30;ל;155439;(3, 11, 2, 6, 155439);41006;(3, 11, 2, 2, 41006);אל;2;2;דברו אל בני ישראל לאמר זאת החיה אשר תאכלו מכל הבהמה אשר על הארץ
(130159, 80, 4);1;א;155519;(3, 11, 3, 36, 155519);41028;(3, 11, 3, 10, 41028);אתה;1;10;כל מפרסת פרסה ושסעת שסע פרסת מעלת גרה בבהמה אתה תאכלו
(130159, 80, 4);1;א;155599;(3, 11, 4, 73, 155599);41049;(3, 11, 4, 20, 41049);הוא;3;20;אך את זה לא תאכלו ממעלי הגרה וממפרסי הפרסה את הגמל כי מעלה גרה הוא ופרסה איננו מפריס טמא הוא לכם
(130159, 80, 4);1;א;155679;(3, 11, 6, 37, 155679);41072;(3, 11, 6, 10, 41072);טמאה;3;10;ואת הארנבת כי מעלת גרה הוא ופרסה לא הפריסה טמאה הוא לכם
(130159, 80, 4);40;ם;155759;(3, 11, 8, 19, 155759);41094;(3, 11, 8, 4, 41094);ובנבלתם;7;4;מבשרם לא תאכלו ובנבלתם לא תגעו טמאים הם לכם
(130159, 80, 4);30;ל;155839;(3, 11, 10, 3, 155839);41116;(3, 11, 10, 1, 41116);וכל;3;1;וכל אשר אין לו סנפיר וקשקשת בימים ובנחלים מכל שרץ המים ומכל נפש החיה אשר במים שקץ הם לכם
(130159, 80, 4);2;ב;155919;(3, 11, 11, 13, 155919);41138;(3, 11, 11, 4, 41138);מבשרם;2;4;ושקץ יהיו לכם מבשרם לא תאכלו ואת נבלתם תשקצו
(130159, 80, 4);30;ל;155999;(3, 11, 13, 23, 155999);41160;(3, 11, 13, 7, 41160);יאכלו;4;7;ואת אלה תשקצו מן העוף לא יאכלו שקץ הם את הנשר ואת הפרס ואת העזניה
(130159, 80, 4);400;ת;156079;(3, 11, 16, 21, 156079);41183;(3, 11, 16, 6, 41183);ואת;3;6;ואת בת היענה ואת התחמס ואת השחף ואת הנץ למינהו
(130159, 80, 4);50;נ;156159;(3, 11, 19, 18, 156159);41203;(3, 11, 19, 4, 41203);למינה;4;4;ואת החסידה האנפה למינה ואת הדוכיפת ואת העטלף
(130159, 80, 4);300;ש;156239;(3, 11, 21, 33, 156239);41227;(3, 11, 21, 11, 41227);אשר;2;11;אך את זה תאכלו מכל שרץ העוף ההלך על ארבע אשר לא כרעים ממעל לרגליו לנתר בהן על הארץ
(130159, 80, 4);40;מ;156319;(3, 11, 22, 49, 156319);41248;(3, 11, 22, 13, 41248);למינהו;2;13;את אלה מהם תאכלו את הארבה למינו ואת הסלעם למינהו ואת החרגל למינהו ואת החגב למינהו
(130159, 80, 4);70;ע;156399;(3, 11, 24, 30, 156399);41269;(3, 11, 24, 8, 41269);הערב;2;8;ולאלה תטמאו כל הנגע בנבלתם יטמא עד הערב
(130159, 80, 4);40;מ;156479;(3, 11, 26, 46, 156479);41289;(3, 11, 26, 12, 41289);מעלה;1;12;לכל הבהמה אשר הוא מפרסת פרסה ושסע איננה שסעת וגרה איננה מעלה טמאים הם לכם כל הנגע בהם יטמא
(130159, 80, 4);10;י;156559;(3, 11, 27, 54, 156559);41312;(3, 11, 27, 16, 41312);יטמא;1;16;וכל הולך על כפיו בכל החיה ההלכת על ארבע טמאים הם לכם כל הנגע בנבלתם יטמא עד הערב
(130159, 80, 4);6;ו;156639;(3, 11, 29, 29, 156639);41334;(3, 11, 29, 9, 41334);והעכבר;1;9;וזה לכם הטמא בשרץ השרץ על הארץ החלד והעכבר והצב למינהו
(130159, 80, 4);70;ע;156719;(3, 11, 31, 37, 156719);41352;(3, 11, 31, 11, 41352);עד;1;11;אלה הטמאים לכם בכל השרץ כל הנגע בהם במתם יטמא עד הערב
(130159, 80, 4);6;ו;156799;(3, 11, 32, 75, 156799);41378;(3, 11, 32, 25, 41378);וטמא;1;25;וכל אשר יפל עליו מהם במתם יטמא מכל כלי עץ או בגד או עור או שק כל כלי אשר יעשה מלאכה בהם במים יובא וטמא עד הערב וטהר
(130159, 80, 4);6;ו;156879;(3, 11, 34, 20, 156879);41401;(3, 11, 34, 6, 41401);יבוא;3;6;מכל האכל אשר יאכל אשר יבוא עליו מים יטמא וכל משקה אשר ישתה בכל כלי יטמא
(130159, 80, 4);6;ו;156959;(3, 11, 35, 44, 156959);41423;(3, 11, 35, 12, 41423);וטמאים;1;12;וכל אשר יפל מנבלתם עליו יטמא תנור וכירים יתץ טמאים הם וטמאים יהיו לכם
(130159, 80, 4);200;ר;157039;(3, 11, 37, 29, 157039);41444;(3, 11, 37, 9, 41444);יזרע;3;9;וכי יפל מנבלתם על כל זרע זרוע אשר יזרע טהור הוא
