(224118, -61, 4);30;ל;230462;(4, 25, 6, 65, 230462);60806;(4, 25, 6, 17, 60806);ישראל;5;17;והנה איש מבני ישראל בא ויקרב אל אחיו את המדינית לעיני משה ולעיני כל עדת בני ישראל והמה בכים פתח אהל מועד
(224118, -61, 4);200;ר;230523;(4, 25, 7, 43, 230523);60823;(4, 25, 7, 12, 60823);רמח;1;12;וירא פינחס בן אלעזר בן אהרן הכהן ויקם מתוך העדה ויקח רמח בידו
(224118, -61, 4);400;ת;230584;(4, 25, 8, 55, 230584);60840;(4, 25, 8, 16, 60840);קבתה;3;16;ויבא אחר איש ישראל אל הקבה וידקר את שניהם את איש ישראל ואת האשה אל קבתה ותעצר המגפה מעל בני ישראל
(224118, -61, 4);1;א;230645;(4, 25, 10, 10, 230645);60854;(4, 25, 10, 3, 60854);אל;1;3;וידבר יהוה אל משה לאמר
(224118, -61, 4);1;א;230706;(4, 25, 11, 53, 230706);60871;(4, 25, 11, 15, 60871);קנאתי;3;15;פינחס בן אלעזר בן אהרן הכהן השיב את חמתי מעל בני ישראל בקנאו את קנאתי בתוכם ולא כליתי את בני ישראל בקנאתי
(224118, -61, 4);400;ת;230767;(4, 25, 13, 4, 230767);60887;(4, 25, 13, 1, 60887);והיתה;4;1;והיתה לו ולזרעו אחריו ברית כהנת עולם תחת אשר קנא לאלהיו ויכפר על בני ישראל
(224118, -61, 4);10;י;230828;(4, 25, 14, 5, 230828);60903;(4, 25, 14, 2, 60903);איש;2;2;ושם איש ישראל המכה אשר הכה את המדינית זמרי בן סלוא נשיא בית אב לשמעני
(224118, -61, 4);5;ה;230889;(4, 25, 15, 11, 230889);60919;(4, 25, 15, 3, 60919);המכה;4;3;ושם האשה המכה המדינית כזבי בת צור ראש אמות בית אב במדין הוא
(224118, -61, 4);5;ה;230950;(4, 25, 17, 7, 230950);60937;(4, 25, 17, 3, 60937);המדינים;1;3;צרור את המדינים והכיתם אותם
(224118, -61, 4);20;כ;231011;(4, 25, 18, 45, 231011);60953;(4, 25, 18, 14, 60953);כזבי;1;14;כי צררים הם לכם בנכליהם אשר נכלו לכם על דבר פעור ועל דבר כזבי בת נשיא מדין אחתם המכה ביום המגפה על דבר פעור
(224118, -61, 4);5;ה;231072;(4, 26, 1, 9, 231072);60968;(4, 26, 1, 2, 60968);יהוה;4;2;ויאמר יהוה אל משה ואל אלעזר בן אהרן הכהן לאמר
(224118, -61, 4);40;מ;231133;(4, 26, 2, 34, 231133);60987;(4, 26, 2, 11, 60987);ומעלה;2;11;שאו את ראש כל עדת בני ישראל מבן עשרים שנה ומעלה לבית אבתם כל יצא צבא בישראל
(224118, -61, 4);50;ן;231194;(4, 26, 3, 36, 231194);61002;(4, 26, 3, 9, 61002);ירדן;4;9;וידבר משה ואלעזר הכהן אתם בערבת מואב על ירדן ירחו לאמר
(224118, -61, 4);90;צ;231255;(4, 26, 4, 53, 231255);61018;(4, 26, 4, 14, 61018);מצרים;2;14;מבן עשרים שנה ומעלה כאשר צוה יהוה את משה ובני ישראל היצאים מארץ מצרים
(224118, -61, 4);300;ש;231316;(4, 26, 6, 7, 231316);61031;(4, 26, 6, 2, 61031);משפחת;2;2;לחצרן משפחת החצרוני לכרמי משפחת הכרמי
(224118, -61, 4);10;י;231377;(4, 26, 7, 36, 231377);61042;(4, 26, 7, 7, 61042);וארבעים;6;7;אלה משפחת הראובני ויהיו פקדיהם שלשה וארבעים אלף ושבע מאות ושלשים
(224118, -61, 4);50;ן;231438;(4, 26, 9, 30, 231438);61056;(4, 26, 9, 7, 61056);דתן;3;7;ובני אליאב נמואל ודתן ואבירם הוא דתן ואבירם קרואי העדה אשר הצו על משה ועל אהרן בעדת קרח בהצתם על יהוה
(224118, -61, 4);1;א;231499;(4, 26, 10, 10, 231499);61073;(4, 26, 10, 3, 61073);את;1;3;ותפתח הארץ את פיה ותבלע אתם ואת קרח במות העדה באכל האש את חמשים ומאתים איש ויהיו לנס
(224118, -61, 4);10;י;231560;(4, 26, 11, 4, 231560);61089;(4, 26, 11, 1, 61089);ובני;4;1;ובני קרח לא מתו
(224118, -61, 4);10;י;231621;(4, 26, 12, 53, 231621);61102;(4, 26, 12, 10, 61102);ליכין;4;10;בני שמעון למשפחתם לנמואל משפחת הנמואלי לימין משפחת הימיני ליכין משפחת היכיני
(224118, -61, 4);6;ו;231682;(4, 26, 14, 19, 231682);61115;(4, 26, 14, 5, 61115);ועשרים;1;5;אלה משפחת השמעני שנים ועשרים אלף ומאתים
(224118, -61, 4);40;מ;231743;(4, 26, 15, 47, 231743);61128;(4, 26, 15, 11, 61128);משפחת;1;11;בני גד למשפחתם לצפון משפחת הצפוני לחגי משפחת החגי לשוני משפחת השוני
(224118, -61, 4);300;ש;231804;(4, 26, 17, 24, 231804);61140;(4, 26, 17, 5, 61140);משפחת;2;5;לארוד משפחת הארודי לאראלי משפחת האראלי
(224118, -61, 4);50;ן;231865;(4, 26, 19, 15, 231865);61154;(4, 26, 19, 4, 61154);ואונן;5;4;בני יהודה ער ואונן וימת ער ואונן בארץ כנען
(224118, -61, 4);8;ח;231926;(4, 26, 20, 42, 231926);61168;(4, 26, 20, 9, 61168);משפחת;4;9;ויהיו בני יהודה למשפחתם לשלה משפחת השלני לפרץ משפחת הפרצי לזרח משפחת הזרחי
(224118, -61, 4);6;ו;231987;(4, 26, 21, 41, 231987);61181;(4, 26, 21, 9, 61181);החמולי;4;9;ויהיו בני פרץ לחצרן משפחת החצרני לחמול משפחת החמולי
(224118, -61, 4);70;ע;232048;(4, 26, 23, 19, 232048);61194;(4, 26, 23, 4, 61194);תולע;4;4;בני יששכר למשפחתם תולע משפחת התולעי לפוה משפחת הפוני
(224118, -61, 4);300;ש;232109;(4, 26, 25, 5, 232109);61207;(4, 26, 25, 2, 61207);משפחת;2;2;אלה משפחת יששכר לפקדיהם ארבעה וששים אלף ושלש מאות
(224118, -61, 4);5;ה;232170;(4, 26, 26, 25, 232170);61220;(4, 26, 26, 6, 61220);הסרדי;1;6;בני זבולן למשפחתם לסרד משפחת הסרדי לאלון משפחת האלני ליחלאל משפחת היחלאלי
(224118, -61, 4);300;ש;232231;(4, 26, 27, 24, 232231);61231;(4, 26, 27, 5, 61231);ששים;2;5;אלה משפחת הזבולני לפקדיהם ששים אלף וחמש מאות
(224118, -61, 4);6;ו;232292;(4, 26, 29, 24, 232292);61245;(4, 26, 29, 6, 61245);ומכיר;1;6;בני מנשה למכיר משפחת המכירי ומכיר הוליד את גלעד לגלעד משפחת הגלעדי
(224118, -61, 4);30;ל;232353;(4, 26, 30, 30, 232353);61258;(4, 26, 30, 7, 61258);לחלק;3;7;אלה בני גלעד איעזר משפחת האיעזרי לחלק משפחת החלקי
(224118, -61, 4);70;ע;232414;(4, 26, 32, 17, 232414);61269;(4, 26, 32, 3, 61269);השמידעי;6;3;ושמידע משפחת השמידעי וחפר משפחת החפרי
(224118, -61, 4);5;ה;232475;(4, 26, 33, 46, 232475);61286;(4, 26, 33, 14, 61286);מחלה;4;14;וצלפחד בן חפר לא היו לו בנים כי אם בנות ושם בנות צלפחד מחלה ונעה חגלה מלכה ותרצה
(224118, -61, 4);2;ב;232536;(4, 26, 35, 4, 232536);61301;(4, 26, 35, 2, 61301);בני;1;2;אלה בני אפרים למשפחתם לשותלח משפחת השתלחי לבכר משפחת הבכרי לתחן משפחת התחני
(224118, -61, 4);1;א;232597;(4, 26, 36, 2, 232597);61313;(4, 26, 36, 1, 61313);ואלה;2;1;ואלה בני שותלח לערן משפחת הערני
(224118, -61, 4);6;ו;232658;(4, 26, 37, 37, 232658);61327;(4, 26, 37, 9, 61327);וחמש;1;9;אלה משפחת בני אפרים לפקדיהם שנים ושלשים אלף וחמש מאות אלה בני יוסף למשפחתם
(224118, -61, 4);80;פ;232719;(4, 26, 38, 37, 232719);61340;(4, 26, 38, 8, 61340);משפחת;3;8;בני בנימן למשפחתם לבלע משפחת הבלעי לאשבל משפחת האשבלי לאחירם משפחת האחירמי
(224118, -61, 4);10;י;232780;(4, 26, 40, 2, 232780);61351;(4, 26, 40, 1, 61351);ויהיו;2;1;ויהיו בני בלע ארד ונעמן משפחת הארדי לנעמן משפחת הנעמי
(224118, -61, 4);6;ו;232841;(4, 26, 41, 19, 232841);61365;(4, 26, 41, 5, 61365);ופקדיהם;1;5;אלה בני בנימן למשפחתם ופקדיהם חמשה וארבעים אלף ושש מאות
(224118, -61, 4);5;ה;232902;(4, 26, 42, 34, 232902);61378;(4, 26, 42, 8, 61378);אלה;3;8;אלה בני דן למשפחתם לשוחם משפחת השוחמי אלה משפחת דן למשפחתם
(224118, -61, 4);300;ש;232963;(4, 26, 44, 5, 232963);61392;(4, 26, 44, 2, 61392);אשר;2;2;בני אשר למשפחתם לימנה משפחת הימנה לישוי משפחת הישוי לבריעה משפחת הבריעי
(224118, -61, 4);200;ר;233024;(4, 26, 45, 6, 233024);61404;(4, 26, 45, 2, 61404);בריעה;2;2;לבני בריעה לחבר משפחת החברי למלכיאל משפחת המלכיאלי
(224118, -61, 4);300;ש;233085;(4, 26, 47, 13, 233085);61418;(4, 26, 47, 4, 61418);אשר;2;4;אלה משפחת בני אשר לפקדיהם שלשה וחמשים אלף וארבע מאות
(224118, -61, 4);1;א;233146;(4, 26, 48, 31, 233146);61430;(4, 26, 48, 6, 61430);היחצאלי;5;6;בני נפתלי למשפחתם ליחצאל משפחת היחצאלי לגוני משפחת הגוני
(224118, -61, 4);300;ש;233207;(4, 26, 50, 16, 233207);61443;(4, 26, 50, 4, 61443);למשפחתם;3;4;אלה משפחת נפתלי למשפחתם ופקדיהם חמשה וארבעים אלף וארבע מאות
(224118, -61, 4);1;א;233268;(4, 26, 51, 27, 233268);61457;(4, 26, 51, 8, 61457);ואלף;2;8;אלה פקודי בני ישראל שש מאות אלף ואלף שבע מאות ושלשים
(224118, -61, 4);200;ר;233329;(4, 26, 54, 2, 233329);61472;(4, 26, 54, 1, 61472);לרב;2;1;לרב תרבה נחלתו ולמעט תמעיט נחלתו איש לפי פקדיו יתן נחלתו
(224118, -61, 4);90;ץ;233390;(4, 26, 55, 17, 233390);61487;(4, 26, 55, 5, 61487);הארץ;4;5;אך בגורל יחלק את הארץ לשמות מטות אבתם ינחלו
(224118, -61, 4);300;ש;233451;(4, 26, 57, 16, 233451);61503;(4, 26, 57, 4, 61503);למשפחתם;3;4;ואלה פקודי הלוי למשפחתם לגרשון משפחת הגרשני לקהת משפחת הקהתי למררי משפחת המררי
(224118, -61, 4);10;י;233512;(4, 26, 58, 11, 233512);61515;(4, 26, 58, 3, 61515);לוי;3;3;אלה משפחת לוי משפחת הלבני משפחת החברני משפחת המחלי משפחת המושי משפחת הקרחי וקהת הולד את עמרם
(224118, -61, 4);400;ת;233573;(4, 26, 58, 72, 233573);61528;(4, 26, 58, 16, 61528);את;2;16;אלה משפחת לוי משפחת הלבני משפחת החברני משפחת המחלי משפחת המושי משפחת הקרחי וקהת הולד את עמרם
(224118, -61, 4);1;א;233634;(4, 26, 59, 57, 233634);61545;(4, 26, 59, 16, 61545);ואת;2;16;ושם אשת עמרם יוכבד בת לוי אשר ילדה אתה ללוי במצרים ותלד לעמרם את אהרן ואת משה ואת מרים אחתם
(224118, -61, 4);2;ב;233695;(4, 26, 61, 7, 233695);61561;(4, 26, 61, 2, 61561);נדב;3;2;וימת נדב ואביהוא בהקריבם אש זרה לפני יהוה
(224118, -61, 4);4;ד;233756;(4, 26, 62, 34, 233756);61576;(4, 26, 62, 9, 61576);חדש;2;9;ויהיו פקדיהם שלשה ועשרים אלף כל זכר מבן חדש ומעלה כי לא התפקדו בתוך בני ישראל כי לא נתן להם נחלה בתוך בני ישראל
(224118, -61, 4);4;ד;233817;(4, 26, 63, 7, 233817);61593;(4, 26, 63, 2, 61593);פקודי;4;2;אלה פקודי משה ואלעזר הכהן אשר פקדו את בני ישראל בערבת מואב על ירדן ירחו
(224118, -61, 4);1;א;233878;(4, 26, 64, 11, 233878);61610;(4, 26, 64, 4, 61610);איש;1;4;ובאלה לא היה איש מפקודי משה ואהרן הכהן אשר פקדו את בני ישראל במדבר סיני
(224118, -61, 4);400;ת;233939;(4, 26, 65, 15, 233939);61626;(4, 26, 65, 5, 61626);מות;3;5;כי אמר יהוה להם מות ימתו במדבר ולא נותר מהם איש כי אם כלב בן יפנה ויהושע בן נון
(224118, -61, 4);8;ח;234000;(4, 27, 1, 15, 234000);61643;(4, 27, 1, 3, 61643);צלפחד;4;3;ותקרבנה בנות צלפחד בן חפר בן גלעד בן מכיר בן מנשה למשפחת מנשה בן יוסף ואלה שמות בנתיו מחלה נעה וחגלה ומלכה ותרצה
(224118, -61, 4);6;ו;234061;(4, 27, 1, 76, 234061);61661;(4, 27, 1, 21, 61661);וחגלה;1;21;ותקרבנה בנות צלפחד בן חפר בן גלעד בן מכיר בן מנשה למשפחת מנשה בן יוסף ואלה שמות בנתיו מחלה נעה וחגלה ומלכה ותרצה
(224118, -61, 4);80;פ;234122;(4, 27, 2, 47, 234122);61674;(4, 27, 2, 11, 61674);פתח;1;11;ותעמדנה לפני משה ולפני אלעזר הכהן ולפני הנשיאם וכל העדה פתח אהל מועד לאמר
(224118, -61, 4);200;ר;234183;(4, 27, 3, 48, 234183);61690;(4, 27, 3, 13, 61690);קרח;2;13;אבינו מת במדבר והוא לא היה בתוך העדה הנועדים על יהוה בעדת קרח כי בחטאו מת ובנים לא היו לו
(224118, -61, 4);6;ו;234244;(4, 27, 4, 39, 234244);61709;(4, 27, 4, 12, 61709);לנו;3;12;למה יגרע שם אבינו מתוך משפחתו כי אין לו בן תנה לנו אחזה בתוך אחי אבינו
(224118, -61, 4);50;נ;234305;(4, 27, 7, 4, 234305);61726;(4, 27, 7, 2, 61726);בנות;2;2;כן בנות צלפחד דברת נתן תתן להם אחזת נחלה בתוך אחי אביהם והעברת את נחלת אביהן להן
(224118, -61, 4);6;ו;234366;(4, 27, 8, 1, 234366);61742;(4, 27, 8, 1, 61742);ואל;1;1;ואל בני ישראל תדבר לאמר איש כי ימות ובן אין לו והעברתם את נחלתו לבתו
(224118, -61, 4);6;ו;234427;(4, 27, 9, 8, 234427);61759;(4, 27, 9, 3, 61759);לו;2;3;ואם אין לו בת ונתתם את נחלתו לאחיו
(224118, -61, 4);40;ם;234488;(4, 27, 11, 10, 234488);61776;(4, 27, 11, 3, 61776);אחים;4;3;ואם אין אחים לאביו ונתתם את נחלתו לשארו הקרב אליו ממשפחתו וירש אתה והיתה לבני ישראל לחקת משפט כאשר צוה יהוה את משה
(224118, -61, 4);100;ק;234549;(4, 27, 11, 71, 234549);61790;(4, 27, 11, 17, 61790);לחקת;3;17;ואם אין אחים לאביו ונתתם את נחלתו לשארו הקרב אליו ממשפחתו וירש אתה והיתה לבני ישראל לחקת משפט כאשר צוה יהוה את משה
(224118, -61, 4);90;ץ;234610;(4, 27, 12, 40, 234610);61808;(4, 27, 12, 12, 61808);הארץ;4;12;ויאמר יהוה אל משה עלה אל הר העברים הזה וראה את הארץ אשר נתתי לבני ישראל
(224118, -61, 4);300;ש;234671;(4, 27, 14, 3, 234671);61824;(4, 27, 14, 1, 61824);כאשר;3;1;כאשר מריתם פי במדבר צן במריבת העדה להקדישני במים לעיניהם הם מי מריבת קדש מדבר צן
(224118, -61, 4);90;צ;234732;(4, 27, 14, 64, 234732);61839;(4, 27, 14, 16, 61839);צן;1;16;כאשר מריתם פי במדבר צן במריבת העדה להקדישני במים לעיניהם הם מי מריבת קדש מדבר צן
(224118, -61, 4);10;י;234793;(4, 27, 17, 10, 234793);61856;(4, 27, 17, 3, 61856);לפניהם;4;3;אשר יצא לפניהם ואשר יבא לפניהם ואשר יוציאם ואשר יביאם ולא תהיה עדת יהוה כצאן אשר אין להם רעה
(224118, -61, 4);40;ם;234854;(4, 27, 17, 71, 234854);61871;(4, 27, 17, 18, 61871);להם;3;18;אשר יצא לפניהם ואשר יבא לפניהם ואשר יוציאם ואשר יביאם ולא תהיה עדת יהוה כצאן אשר אין להם רעה
(224118, -61, 4);70;ע;234915;(4, 27, 19, 3, 234915);61891;(4, 27, 19, 1, 61891);והעמדת;3;1;והעמדת אתו לפני אלעזר הכהן ולפני כל העדה וצויתה אתו לעיניהם
(224118, -61, 4);30;ל;234976;(4, 27, 20, 15, 234976);61905;(4, 27, 20, 4, 61905);למען;1;4;ונתתה מהודך עליו למען ישמעו כל עדת בני ישראל
(224118, -61, 4);10;י;235037;(4, 27, 21, 40, 235037);61920;(4, 27, 21, 10, 61920);יהוה;1;10;ולפני אלעזר הכהן יעמד ושאל לו במשפט האורים לפני יהוה על פיו יצאו ועל פיו יבאו הוא וכל בני ישראל אתו וכל העדה
(224118, -61, 4);10;י;235098;(4, 27, 22, 15, 235098);61938;(4, 27, 22, 5, 61938);יהוה;1;5;ויעש משה כאשר צוה יהוה אתו ויקח את יהושע ויעמדהו לפני אלעזר הכהן ולפני כל העדה
(224118, -61, 4);30;ל;235159;(4, 27, 23, 13, 235159);61953;(4, 27, 23, 4, 61953);עליו;2;4;ויסמך את ידיו עליו ויצוהו כאשר דבר יהוה ביד משה
(224118, -61, 4);1;א;235220;(4, 28, 2, 18, 235220);61970;(4, 28, 2, 6, 61970);אלהם;1;6;צו את בני ישראל ואמרת אלהם את קרבני לחמי לאשי ריח ניחחי תשמרו להקריב לי במועדו
(224118, -61, 4);300;ש;235281;(4, 28, 3, 16, 235281);61985;(4, 28, 3, 5, 61985);אשר;2;5;ואמרת להם זה האשה אשר תקריבו ליהוה כבשים בני שנה תמימם שנים ליום עלה תמיד
(224118, -61, 4);6;ו;235342;(4, 28, 4, 18, 235342);62001;(4, 28, 4, 6, 62001);ואת;1;6;את הכבש אחד תעשה בבקר ואת הכבש השני תעשה בין הערבים
(224118, -61, 4);400;ת;235403;(4, 28, 5, 38, 235403);62014;(4, 28, 5, 8, 62014);רביעת;5;8;ועשירית האיפה סלת למנחה בלולה בשמן כתית רביעת ההין
(224118, -61, 4);4;ד;235464;(4, 28, 7, 22, 235464);62029;(4, 28, 7, 5, 62029);האחד;4;5;ונסכו רביעת ההין לכבש האחד בקדש הסך נסך שכר ליהוה
(224118, -61, 4);5;ה;235525;(4, 28, 8, 43, 235525);62044;(4, 28, 8, 10, 62044);תעשה;4;10;ואת הכבש השני תעשה בין הערבים כמנחת הבקר וכנסכו תעשה אשה ריח ניחח ליהוה
(224118, -61, 4);2;ב;235586;(4, 28, 9, 46, 235586);62060;(4, 28, 9, 12, 62060);בלולה;1;12;וביום השבת שני כבשים בני שנה תמימם ושני עשרנים סלת מנחה בלולה בשמן ונסכו
(224118, -61, 4);30;ל;235647;(4, 28, 11, 22, 235647);62074;(4, 28, 11, 5, 62074);ליהוה;1;5;ובראשי חדשיכם תקריבו עלה ליהוה פרים בני בקר שנים ואיל אחד כבשים בני שנה שבעה תמימם
(224118, -61, 4);50;נ;235708;(4, 28, 12, 16, 235708);62089;(4, 28, 12, 4, 62089);מנחה;2;4;ושלשה עשרנים סלת מנחה בלולה בשמן לפר האחד ושני עשרנים סלת מנחה בלולה בשמן לאיל האחד
(224118, -61, 4);6;ו;235769;(4, 28, 13, 9, 235769);62103;(4, 28, 13, 2, 62103);עשרון;4;2;ועשרן עשרון סלת מנחה בלולה בשמן לכבש האחד עלה ריח ניחח אשה ליהוה
(224118, -61, 4);5;ה;235830;(4, 28, 14, 18, 235830);62118;(4, 28, 14, 4, 62118);יהיה;4;4;ונסכיהם חצי ההין יהיה לפר ושלישת ההין לאיל ורביעת ההין לכבש יין זאת עלת חדש בחדשו לחדשי השנה
(224118, -61, 4);10;י;235891;(4, 28, 15, 4, 235891);62133;(4, 28, 15, 1, 62133);ושעיר;4;1;ושעיר עזים אחד לחטאת ליהוה על עלת התמיד יעשה ונסכו
(224118, -61, 4);30;ל;235952;(4, 28, 16, 24, 235952);62148;(4, 28, 16, 6, 62148);לחדש;1;6;ובחדש הראשון בארבעה עשר יום לחדש פסח ליהוה
(224118, -61, 4);200;ר;236013;(4, 28, 18, 13, 236013);62163;(4, 28, 18, 3, 62163);מקרא;3;3;ביום הראשון מקרא קדש כל מלאכת עבדה לא תעשו
(224118, -61, 4);6;ו;236074;(4, 28, 19, 40, 236074);62180;(4, 28, 19, 11, 62180);ושבעה;1;11;והקרבתם אשה עלה ליהוה פרים בני בקר שנים ואיל אחד ושבעה כבשים בני שנה תמימם יהיו לכם
(224118, -61, 4);50;נ;236135;(4, 28, 20, 34, 236135);62194;(4, 28, 20, 8, 62194);ושני;3;8;ומנחתם סלת בלולה בשמן שלשה עשרנים לפר ושני עשרנים לאיל תעשו
(224118, -61, 4);30;ל;236196;(4, 28, 22, 13, 236196);62208;(4, 28, 22, 4, 62208);לכפר;1;4;ושעיר חטאת אחד לכפר עליכם
(224118, -61, 4);30;ל;236257;(4, 28, 24, 21, 236257);62224;(4, 28, 24, 6, 62224);לחם;1;6;כאלה תעשו ליום שבעת ימים לחם אשה ריח ניחח ליהוה על עולת התמיד יעשה ונסכו
(224118, -61, 4);20;כ;236318;(4, 28, 25, 24, 236318);62239;(4, 28, 25, 6, 62239);לכם;2;6;וביום השביעי מקרא קדש יהיה לכם כל מלאכת עבדה לא תעשו
(224118, -61, 4);100;ק;236379;(4, 28, 26, 43, 236379);62252;(4, 28, 26, 8, 62252);מקרא;2;8;וביום הבכורים בהקריבכם מנחה חדשה ליהוה בשבעתיכם מקרא קדש יהיה לכם כל מלאכת עבדה לא תעשו
(224118, -61, 4);2;ב;236440;(4, 28, 27, 32, 236440);62268;(4, 28, 27, 8, 62268);בקר;1;8;והקרבתם עולה לריח ניחח ליהוה פרים בני בקר שנים איל אחד שבעה כבשים בני שנה
(224118, -61, 4);8;ח;236501;(4, 28, 28, 34, 236501);62283;(4, 28, 28, 8, 62283);האחד;3;8;ומנחתם סלת בלולה בשמן שלשה עשרנים לפר האחד שני עשרנים לאיל האחד
(224118, -61, 4);80;פ;236562;(4, 28, 30, 14, 236562);62297;(4, 28, 30, 4, 62297);לכפר;3;4;שעיר עזים אחד לכפר עליכם
(224118, -61, 4);8;ח;236623;(4, 29, 1, 14, 236623);62310;(4, 29, 1, 3, 62310);באחד;3;3;ובחדש השביעי באחד לחדש מקרא קדש יהיה לכם כל מלאכת עבדה לא תעשו יום תרועה יהיה לכם
(224118, -61, 4);30;ל;236684;(4, 29, 2, 10, 236684);62327;(4, 29, 2, 3, 62327);לריח;1;3;ועשיתם עלה לריח ניחח ליהוה פר בן בקר אחד איל אחד כבשים בני שנה שבעה תמימם
(224118, -61, 4);30;ל;236745;(4, 29, 3, 13, 236745);62343;(4, 29, 3, 3, 62343);בלולה;4;3;ומנחתם סלת בלולה בשמן שלשה עשרנים לפר שני עשרנים לאיל
(224118, -61, 4);300;ש;236806;(4, 29, 5, 2, 236806);62357;(4, 29, 5, 1, 62357);ושעיר;2;1;ושעיר עזים אחד חטאת לכפר עליכם
(224118, -61, 4);5;ה;236867;(4, 29, 6, 38, 236867);62370;(4, 29, 6, 8, 62370);ונסכיהם;6;8;מלבד עלת החדש ומנחתה ועלת התמיד ומנחתה ונסכיהם כמשפטם לריח ניחח אשה ליהוה
(224118, -61, 4);400;ת;236928;(4, 29, 7, 38, 236928);62384;(4, 29, 7, 9, 62384);ועניתם;5;9;ובעשור לחדש השביעי הזה מקרא קדש יהיה לכם ועניתם את נפשתיכם כל מלאכה לא תעשו
(224118, -61, 4);4;ד;236989;(4, 29, 8, 38, 236989);62401;(4, 29, 8, 11, 62401);אחד;3;11;והקרבתם עלה ליהוה ריח ניחח פר בן בקר אחד איל אחד כבשים בני שנה שבעה תמימם יהיו לכם
(224118, -61, 4);10;י;237050;(4, 29, 9, 34, 237050);62416;(4, 29, 9, 8, 62416);שני;3;8;ומנחתם סלת בלולה בשמן שלשה עשרנים לפר שני עשרנים לאיל האחד
(224118, -61, 4);2;ב;237111;(4, 29, 11, 18, 237111);62430;(4, 29, 11, 5, 62430);מלבד;3;5;שעיר עזים אחד חטאת מלבד חטאת הכפרים ועלת התמיד ומנחתה ונסכיהם
(224118, -61, 4);4;ד;237172;(4, 29, 12, 28, 237172);62443;(4, 29, 12, 7, 62443);קדש;2;7;ובחמשה עשר יום לחדש השביעי מקרא קדש יהיה לכם כל מלאכת עבדה לא תעשו וחגתם חג ליהוה שבעת ימים
(224118, -61, 4);8;ח;237233;(4, 29, 13, 16, 237233);62459;(4, 29, 13, 4, 62459);ריח;3;4;והקרבתם עלה אשה ריח ניחח ליהוה פרים בני בקר שלשה עשר אילם שנים כבשים בני שנה ארבעה עשר תמימם יהיו
(224118, -61, 4);10;י;237294;(4, 29, 13, 77, 237294);62475;(4, 29, 13, 20, 62475);יהיו;3;20;והקרבתם עלה אשה ריח ניחח ליהוה פרים בני בקר שלשה עשר אילם שנים כבשים בני שנה ארבעה עשר תמימם יהיו
(224118, -61, 4);30;ל;237355;(4, 29, 14, 60, 237355);62489;(4, 29, 14, 14, 62489);לאיל;4;14;ומנחתם סלת בלולה בשמן שלשה עשרנים לפר האחד לשלשה עשר פרים שני עשרנים לאיל האחד לשני האילם
(224118, -61, 4);1;א;237416;(4, 29, 16, 15, 237416);62503;(4, 29, 16, 4, 62503);חטאת;3;4;ושעיר עזים אחד חטאת מלבד עלת התמיד מנחתה ונסכה
(224118, -61, 4);10;י;237477;(4, 29, 17, 38, 237477);62518;(4, 29, 17, 10, 62518);כבשים;4;10;וביום השני פרים בני בקר שנים עשר אילם שנים כבשים בני שנה ארבעה עשר תמימם
(224118, -61, 4);9;ט;237538;(4, 29, 18, 41, 237538);62530;(4, 29, 18, 7, 62530);כמשפט;5;7;ומנחתם ונסכיהם לפרים לאילם ולכבשים במספרם כמשפט
(224118, -61, 4);70;ע;237599;(4, 29, 20, 20, 237599);62544;(4, 29, 20, 5, 62544);עשר;1;5;וביום השלישי פרים עשתי עשר אילם שנים כבשים בני שנה ארבעה עשר תמימם
(224118, -61, 4);2;ב;237660;(4, 29, 21, 27, 237660);62557;(4, 29, 21, 5, 62557);ולכבשים;4;5;ומנחתם ונסכיהם לפרים לאילם ולכבשים במספרם כמשפט
