(143827, 92, 4);300;ש;233711;(4, 26, 61, 23, 233711);61564;(4, 26, 61, 5, 61564);אש;2;5;וימת נדב ואביהוא בהקריבם אש זרה לפני יהוה
(143827, 92, 4);2;ב;233803;(4, 26, 62, 81, 233803);61590;(4, 26, 62, 23, 61590);בני;1;23;ויהיו פקדיהם שלשה ועשרים אלף כל זכר מבן חדש ומעלה כי לא התפקדו בתוך בני ישראל כי לא נתן להם נחלה בתוך בני ישראל
(143827, 92, 4);5;ה;233895;(4, 26, 64, 28, 233895);61614;(4, 26, 64, 8, 61614);הכהן;1;8;ובאלה לא היה איש מפקודי משה ואהרן הכהן אשר פקדו את בני ישראל במדבר סיני
(143827, 92, 4);400;ת;233987;(4, 27, 1, 2, 233987);61641;(4, 27, 1, 1, 61641);ותקרבנה;2;1;ותקרבנה בנות צלפחד בן חפר בן גלעד בן מכיר בן מנשה למשפחת מנשה בן יוסף ואלה שמות בנתיו מחלה נעה וחגלה ומלכה ותרצה
(143827, 92, 4);40;מ;234079;(4, 27, 2, 4, 234079);61664;(4, 27, 2, 1, 61664);ותעמדנה;4;1;ותעמדנה לפני משה ולפני אלעזר הכהן ולפני הנשיאם וכל העדה פתח אהל מועד לאמר
(143827, 92, 4);40;ם;234171;(4, 27, 3, 36, 234171);61686;(4, 27, 3, 9, 61686);הנועדים;7;9;אבינו מת במדבר והוא לא היה בתוך העדה הנועדים על יהוה בעדת קרח כי בחטאו מת ובנים לא היו לו
(143827, 92, 4);100;ק;234263;(4, 27, 5, 3, 234263);61714;(4, 27, 5, 1, 61714);ויקרב;3;1;ויקרב משה את משפטן לפני יהוה
(143827, 92, 4);8;ח;234355;(4, 27, 7, 54, 234355);61739;(4, 27, 7, 15, 61739);נחלת;2;15;כן בנות צלפחד דברת נתן תתן להם אחזת נחלה בתוך אחי אביהם והעברת את נחלת אביהן להן
(143827, 92, 4);6;ו;234447;(4, 27, 10, 1, 234447);61765;(4, 27, 10, 1, 61765);ואם;1;1;ואם אין לו אחים ונתתם את נחלתו לאחי אביו
(143827, 92, 4);2;ב;234539;(4, 27, 11, 61, 234539);61788;(4, 27, 11, 15, 61788);לבני;2;15;ואם אין אחים לאביו ונתתם את נחלתו לשארו הקרב אליו ממשפחתו וירש אתה והיתה לבני ישראל לחקת משפט כאשר צוה יהוה את משה
(143827, 92, 4);400;ת;234631;(4, 27, 13, 5, 234631);61813;(4, 27, 13, 1, 61813);וראיתה;5;1;וראיתה אתה ונאספת אל עמיך גם אתה כאשר נאסף אהרן אחיך
(143827, 92, 4);2;ב;234723;(4, 27, 14, 55, 234723);61836;(4, 27, 14, 13, 61836);מריבת;4;13;כאשר מריתם פי במדבר צן במריבת העדה להקדישני במים לעיניהם הם מי מריבת קדש מדבר צן
(143827, 92, 4);90;צ;234815;(4, 27, 17, 32, 234815);61861;(4, 27, 17, 8, 61861);יוציאם;3;8;אשר יצא לפניהם ואשר יבא לפניהם ואשר יוציאם ואשר יביאם ולא תהיה עדת יהוה כצאן אשר אין להם רעה
(143827, 92, 4);4;ד;234907;(4, 27, 18, 50, 234907);61889;(4, 27, 18, 17, 61889);ידך;2;17;ויאמר יהוה אל משה קח לך את יהושע בן נון איש אשר רוח בו וסמכת את ידך עליו
(143827, 92, 4);30;ל;234999;(4, 27, 21, 2, 234999);61911;(4, 27, 21, 1, 61911);ולפני;2;1;ולפני אלעזר הכהן יעמד ושאל לו במשפט האורים לפני יהוה על פיו יצאו ועל פיו יבאו הוא וכל בני ישראל אתו וכל העדה
(143827, 92, 4);20;כ;235091;(4, 27, 22, 8, 235091);61936;(4, 27, 22, 3, 61936);כאשר;1;3;ויעש משה כאשר צוה יהוה אתו ויקח את יהושע ויעמדהו לפני אלעזר הכהן ולפני כל העדה
(143827, 92, 4);300;ש;235183;(4, 27, 23, 37, 235183);61959;(4, 27, 23, 10, 61959);משה;2;10;ויסמך את ידיו עליו ויצוהו כאשר דבר יהוה ביד משה
(143827, 92, 4);5;ה;235275;(4, 28, 3, 10, 235275);61983;(4, 28, 3, 3, 61983);זה;2;3;ואמרת להם זה האשה אשר תקריבו ליהוה כבשים בני שנה תמימם שנים ליום עלה תמיד
(143827, 92, 4);70;ע;235367;(4, 28, 5, 2, 235367);62007;(4, 28, 5, 1, 62007);ועשירית;2;1;ועשירית האיפה סלת למנחה בלולה בשמן כתית רביעת ההין
(143827, 92, 4);2;ב;235459;(4, 28, 7, 17, 235459);62028;(4, 28, 7, 4, 62028);לכבש;3;4;ונסכו רביעת ההין לכבש האחד בקדש הסך נסך שכר ליהוה
(143827, 92, 4);50;נ;235551;(4, 28, 9, 11, 235551);62051;(4, 28, 9, 3, 62051);שני;2;3;וביום השבת שני כבשים בני שנה תמימם ושני עשרנים סלת מנחה בלולה בשמן ונסכו
(143827, 92, 4);6;ו;235643;(4, 28, 11, 18, 235643);62072;(4, 28, 11, 3, 62072);תקריבו;6;3;ובראשי חדשיכם תקריבו עלה ליהוה פרים בני בקר שנים ואיל אחד כבשים בני שנה שבעה תמימם
(143827, 92, 4);10;י;235735;(4, 28, 12, 43, 235735);62095;(4, 28, 12, 10, 62095);עשרנים;5;10;ושלשה עשרנים סלת מנחה בלולה בשמן לפר האחד ושני עשרנים סלת מנחה בלולה בשמן לאיל האחד
(143827, 92, 4);10;י;235827;(4, 28, 14, 15, 235827);62118;(4, 28, 14, 4, 62118);יהיה;1;4;ונסכיהם חצי ההין יהיה לפר ושלישת ההין לאיל ורביעת ההין לכבש יין זאת עלת חדש בחדשו לחדשי השנה
(143827, 92, 4);4;ד;235919;(4, 28, 15, 32, 235919);62140;(4, 28, 15, 8, 62140);התמיד;5;8;ושעיר עזים אחד לחטאת ליהוה על עלת התמיד יעשה ונסכו
(143827, 92, 4);40;מ;236011;(4, 28, 18, 11, 236011);62163;(4, 28, 18, 3, 62163);מקרא;1;3;ביום הראשון מקרא קדש כל מלאכת עבדה לא תעשו
(143827, 92, 4);40;מ;236103;(4, 28, 20, 2, 236103);62187;(4, 28, 20, 1, 62187);ומנחתם;2;1;ומנחתם סלת בלולה בשמן שלשה עשרנים לפר ושני עשרנים לאיל תעשו
(143827, 92, 4);4;ד;236195;(4, 28, 22, 12, 236195);62207;(4, 28, 22, 3, 62207);אחד;3;3;ושעיר חטאת אחד לכפר עליכם
(143827, 92, 4);70;ע;236287;(4, 28, 24, 51, 236287);62232;(4, 28, 24, 14, 62232);יעשה;2;14;כאלה תעשו ליום שבעת ימים לחם אשה ריח ניחח ליהוה על עולת התמיד יעשה ונסכו
(143827, 92, 4);100;ק;236379;(4, 28, 26, 43, 236379);62252;(4, 28, 26, 8, 62252);מקרא;2;8;וביום הבכורים בהקריבכם מנחה חדשה ליהוה בשבעתיכם מקרא קדש יהיה לכם כל מלאכת עבדה לא תעשו
(143827, 92, 4);8;ח;236471;(4, 28, 28, 4, 236471);62276;(4, 28, 28, 1, 62276);ומנחתם;4;1;ומנחתם סלת בלולה בשמן שלשה עשרנים לפר האחד שני עשרנים לאיל האחד
(143827, 92, 4);200;ר;236563;(4, 28, 30, 15, 236563);62297;(4, 28, 30, 4, 62297);לכפר;4;4;שעיר עזים אחד לכפר עליכם
(143827, 92, 4);1;א;236655;(4, 29, 1, 46, 236655);62319;(4, 29, 1, 12, 62319);לא;2;12;ובחדש השביעי באחד לחדש מקרא קדש יהיה לכם כל מלאכת עבדה לא תעשו יום תרועה יהיה לכם
(143827, 92, 4);2;ב;236747;(4, 29, 3, 15, 236747);62344;(4, 29, 3, 4, 62344);בשמן;1;4;ומנחתם סלת בלולה בשמן שלשה עשרנים לפר שני עשרנים לאיל
(143827, 92, 4);4;ד;236839;(4, 29, 6, 10, 236839);62365;(4, 29, 6, 3, 62365);החדש;3;3;מלבד עלת החדש ומנחתה ועלת התמיד ומנחתה ונסכיהם כמשפטם לריח ניחח אשה ליהוה
(143827, 92, 4);400;ת;236931;(4, 29, 7, 41, 236931);62385;(4, 29, 7, 10, 62385);את;2;10;ובעשור לחדש השביעי הזה מקרא קדש יהיה לכם ועניתם את נפשתיכם כל מלאכה לא תעשו
(143827, 92, 4);60;ס;237023;(4, 29, 9, 7, 237023);62410;(4, 29, 9, 2, 62410);סלת;1;2;ומנחתם סלת בלולה בשמן שלשה עשרנים לפר שני עשרנים לאיל האחד
(143827, 92, 4);1;א;237115;(4, 29, 11, 22, 237115);62431;(4, 29, 11, 6, 62431);חטאת;3;6;שעיר עזים אחד חטאת מלבד חטאת הכפרים ועלת התמיד ומנחתה ונסכיהם
(143827, 92, 4);5;ה;237207;(4, 29, 12, 63, 237207);62453;(4, 29, 12, 17, 62453);ליהוה;3;17;ובחמשה עשר יום לחדש השביעי מקרא קדש יהיה לכם כל מלאכת עבדה לא תעשו וחגתם חג ליהוה שבעת ימים
(143827, 92, 4);8;ח;237299;(4, 29, 14, 4, 237299);62476;(4, 29, 14, 1, 62476);ומנחתם;4;1;ומנחתם סלת בלולה בשמן שלשה עשרנים לפר האחד לשלשה עשר פרים שני עשרנים לאיל האחד לשני האילם
(143827, 92, 4);2;ב;237391;(4, 29, 15, 23, 237391);62497;(4, 29, 15, 5, 62497);לארבעה;4;5;ועשרון עשרון לכבש האחד לארבעה עשר כבשים
(143827, 92, 4);50;נ;237483;(4, 29, 17, 44, 237483);62520;(4, 29, 17, 12, 62520);שנה;2;12;וביום השני פרים בני בקר שנים עשר אילם שנים כבשים בני שנה ארבעה עשר תמימם
(143827, 92, 4);60;ס;237575;(4, 29, 19, 37, 237575);62539;(4, 29, 19, 9, 62539);ונסכיהם;3;9;ושעיר עזים אחד חטאת מלבד עלת התמיד ומנחתה ונסכיהם
(143827, 92, 4);80;פ;237667;(4, 29, 21, 34, 237667);62558;(4, 29, 21, 6, 62558);במספרם;4;6;ומנחתם ונסכיהם לפרים לאילם ולכבשים במספרם כמשפט
(143827, 92, 4);40;מ;237759;(4, 29, 23, 50, 237759);62579;(4, 29, 23, 12, 62579);תמימם;4;12;וביום הרביעי פרים עשרה אילם שנים כבשים בני שנה ארבעה עשר תמימם
(143827, 92, 4);200;ר;237851;(4, 29, 26, 13, 237851);62598;(4, 29, 26, 3, 62598);פרים;2;3;וביום החמישי פרים תשעה אילם שנים כבשים בני שנה ארבעה עשר תמימם
(143827, 92, 4);40;מ;237943;(4, 29, 28, 13, 237943);62618;(4, 29, 28, 4, 62618);מלבד;1;4;ושעיר חטאת אחד מלבד עלת התמיד ומנחתה ונסכה
(143827, 92, 4);10;י;238035;(4, 29, 30, 21, 238035);62638;(4, 29, 30, 4, 62638);לאילם;3;4;ומנחתם ונסכיהם לפרים לאילם ולכבשים במספרם כמשפט
(143827, 92, 4);50;נ;238127;(4, 29, 32, 37, 238127);62658;(4, 29, 32, 9, 62658);שנה;2;9;וביום השביעי פרים שבעה אילם שנים כבשים בני שנה ארבעה עשר תמימם
(143827, 92, 4);6;ו;238219;(4, 29, 35, 3, 238219);62677;(4, 29, 35, 1, 62677);ביום;3;1;ביום השמיני עצרת תהיה לכם כל מלאכת עבדה לא תעשו
(143827, 92, 4);40;מ;238311;(4, 29, 37, 1, 238311);62702;(4, 29, 37, 1, 62702);מנחתם;1;1;מנחתם ונסכיהם לפר לאיל ולכבשים במספרם כמשפט
(143827, 92, 4);30;ל;238403;(4, 29, 39, 21, 238403);62721;(4, 29, 39, 5, 62721);לבד;1;5;אלה תעשו ליהוה במועדיכם לבד מנדריכם ונדבתיכם לעלתיכם ולמנחתיכם ולנסכיכם ולשלמיכם
(143827, 92, 4);300;ש;238495;(4, 30, 2, 7, 238495);62740;(4, 30, 2, 2, 62740);משה;2;2;וידבר משה אל ראשי המטות לבני ישראל לאמר זה הדבר אשר צוה יהוה
(143827, 92, 4);30;ל;238587;(4, 30, 3, 51, 238587);62767;(4, 30, 3, 16, 62767);ככל;3;16;איש כי ידר נדר ליהוה או השבע שבעה לאסר אסר על נפשו לא יחל דברו ככל היצא מפיו יעשה
(143827, 92, 4);1;א;238679;(4, 30, 5, 41, 238679);62792;(4, 30, 5, 12, 62792);אביה;1;12;ושמע אביה את נדרה ואסרה אשר אסרה על נפשה והחריש לה אביה וקמו כל נדריה וכל אסר אשר אסרה על נפשה יקום
(143827, 92, 4);6;ו;238771;(4, 30, 6, 55, 238771);62818;(4, 30, 6, 16, 62818);ויהוה;1;16;ואם הניא אביה אתה ביום שמעו כל נדריה ואסריה אשר אסרה על נפשה לא יקום ויהוה יסלח לה כי הניא אביה אתה
(143827, 92, 4);10;י;238863;(4, 30, 8, 21, 238863);62842;(4, 30, 8, 5, 62842);והחריש;5;5;ושמע אישה ביום שמעו והחריש לה וקמו נדריה ואסרה אשר אסרה על נפשה יקמו
(143827, 92, 4);5;ה;238955;(4, 30, 9, 58, 238955);62867;(4, 30, 9, 16, 62867);אסרה;4;16;ואם ביום שמע אישה יניא אותה והפר את נדרה אשר עליה ואת מבטא שפתיה אשר אסרה על נפשה ויהוה יסלח לה
(143827, 92, 4);40;מ;239047;(4, 30, 12, 3, 239047);62893;(4, 30, 12, 1, 62893);ושמע;3;1;ושמע אישה והחרש לה לא הניא אתה וקמו כל נדריה וכל אסר אשר אסרה על נפשה יקום
(143827, 92, 4);50;נ;239139;(4, 30, 13, 37, 239139);62920;(4, 30, 13, 11, 62920);לנדריה;2;11;ואם הפר יפר אתם אישה ביום שמעו כל מוצא שפתיה לנדריה ולאסר נפשה לא יקום אישה הפרם ויהוה יסלח לה
(143827, 92, 4);300;ש;239231;(4, 30, 15, 12, 239231);62943;(4, 30, 15, 3, 62943);יחריש;5;3;ואם החרש יחריש לה אישה מיום אל יום והקים את כל נדריה או את כל אסריה אשר עליה הקים אתם כי החרש לה ביום שמעו
(143827, 92, 4);50;נ;239323;(4, 30, 16, 22, 239323);62972;(4, 30, 16, 7, 62972);ונשא;2;7;ואם הפר יפר אתם אחרי שמעו ונשא את עונה
(143827, 92, 4);10;י;239415;(4, 31, 2, 10, 239415);62998;(4, 31, 2, 3, 62998);בני;3;3;נקם נקמת בני ישראל מאת המדינים אחר תאסף אל עמיך
(143827, 92, 4);1;א;239507;(4, 31, 4, 1, 239507);63022;(4, 31, 4, 1, 63022);אלף;1;1;אלף למטה אלף למטה לכל מטות ישראל תשלחו לצבא
(143827, 92, 4);9;ט;239599;(4, 31, 6, 17, 239599);63045;(4, 31, 6, 5, 63045);למטה;3;5;וישלח אתם משה אלף למטה לצבא אתם ואת פינחס בן אלעזר הכהן לצבא וכלי הקדש וחצצרות התרועה בידו
(143827, 92, 4);30;ל;239691;(4, 31, 7, 36, 239691);63068;(4, 31, 7, 10, 63068);כל;2;10;ויצבאו על מדין כאשר צוה יהוה את משה ויהרגו כל זכר
(143827, 92, 4);2;ב;239783;(4, 31, 9, 4, 239783);63095;(4, 31, 9, 1, 63095);וישבו;4;1;וישבו בני ישראל את נשי מדין ואת טפם ואת כל בהמתם ואת כל מקנהם ואת כל חילם בזזו
(143827, 92, 4);6;ו;239875;(4, 31, 11, 1, 239875);63122;(4, 31, 11, 1, 63122);ויקחו;1;1;ויקחו את כל השלל ואת כל המלקוח באדם ובבהמה
(143827, 92, 4);1;א;239967;(4, 31, 12, 59, 239967);63147;(4, 31, 12, 17, 63147);אל;1;17;ויבאו אל משה ואל אלעזר הכהן ואל עדת בני ישראל את השבי ואת המלקוח ואת השלל אל המחנה אל ערבת מואב אשר על ירדן ירחו
(143827, 92, 4);5;ה;240059;(4, 31, 14, 16, 240059);63171;(4, 31, 14, 5, 63171);החיל;1;5;ויקצף משה על פקודי החיל שרי האלפים ושרי המאות הבאים מצבא המלחמה
(143827, 92, 4);70;ע;240151;(4, 31, 16, 31, 240151);63193;(4, 31, 16, 9, 63193);מעל;2;9;הן הנה היו לבני ישראל בדבר בלעם למסר מעל ביהוה על דבר פעור ותהי המגפה בעדת יהוה
(143827, 92, 4);70;ע;240243;(4, 31, 18, 19, 240243);63219;(4, 31, 18, 6, 63219);ידעו;3;6;וכל הטף בנשים אשר לא ידעו משכב זכר החיו לכם
(143827, 92, 4);20;כ;240335;(4, 31, 19, 77, 240335);63242;(4, 31, 19, 19, 63242);ושביכם;5;19;ואתם חנו מחוץ למחנה שבעת ימים כל הרג נפש וכל נגע בחלל תתחטאו ביום השלישי וביום השביעי אתם ושביכם
(143827, 92, 4);6;ו;240427;(4, 31, 21, 51, 240427);63267;(4, 31, 21, 13, 63267);צוה;2;13;ויאמר אלעזר הכהן אל אנשי הצבא הבאים למלחמה זאת חקת התורה אשר צוה יהוה את משה
(143827, 92, 4);8;ח;240519;(4, 31, 23, 38, 240519);63295;(4, 31, 23, 12, 63295);יתחטא;3;12;כל דבר אשר יבא באש תעבירו באש וטהר אך במי נדה יתחטא וכל אשר לא יבא באש תעבירו במים
(143827, 92, 4);200;ר;240611;(4, 31, 26, 5, 240611);63319;(4, 31, 26, 3, 63319);ראש;1;3;שא את ראש מלקוח השבי באדם ובבהמה אתה ואלעזר הכהן וראשי אבות העדה
(143827, 92, 4);4;ד;240703;(4, 31, 27, 45, 240703);63340;(4, 31, 27, 11, 63340);העדה;3;11;וחצית את המלקוח בין תפשי המלחמה היצאים לצבא ובין כל העדה
(143827, 92, 4);6;ו;240795;(4, 31, 29, 11, 240795);63362;(4, 31, 29, 2, 63362);תקחו;4;2;ממחציתם תקחו ונתתה לאלעזר הכהן תרומת יהוה
(143827, 92, 4);50;נ;240887;(4, 31, 30, 68, 240887);63386;(4, 31, 30, 19, 63386);ונתתה;2;19;וממחצת בני ישראל תקח אחד אחז מן החמשים מן האדם מן הבקר מן החמרים ומן הצאן מכל הבהמה ונתתה אתם ללוים שמרי משמרת משכן יהוה
(143827, 92, 4);1;א;240979;(4, 31, 32, 31, 240979);63410;(4, 31, 32, 9, 63410);צאן;2;9;ויהי המלקוח יתר הבז אשר בזזו עם הצבא צאן שש מאות אלף ושבעים אלף וחמשת אלפים
(143827, 92, 4);20;כ;241071;(4, 31, 35, 29, 241071);63434;(4, 31, 35, 9, 63434);זכר;2;9;ונפש אדם מן הנשים אשר לא ידעו משכב זכר כל נפש שנים ושלשים אלף
(143827, 92, 4);40;מ;241163;(4, 31, 37, 6, 241163);63457;(4, 31, 37, 2, 63457);המכס;2;2;ויהי המכס ליהוה מן הצאן שש מאות חמש ושבעים
(143827, 92, 4);40;ם;241255;(4, 31, 39, 27, 241255);63478;(4, 31, 39, 6, 63478);ומכסם;5;6;וחמרים שלשים אלף וחמש מאות ומכסם ליהוה אחד וששים
(143827, 92, 4);5;ה;241347;(4, 31, 41, 40, 241347);63502;(4, 31, 41, 11, 63502);יהוה;2;11;ויתן משה את מכס תרומת יהוה לאלעזר הכהן כאשר צוה יהוה את משה
(143827, 92, 4);6;ו;241439;(4, 31, 43, 47, 241439);63526;(4, 31, 43, 13, 63526);וחמש;1;13;ותהי מחצת העדה מן הצאן שלש מאות אלף ושלשים אלף שבעת אלפים וחמש מאות
(143827, 92, 4);50;ן;241531;(4, 31, 47, 31, 241531);63550;(4, 31, 47, 9, 63550);מן;2;9;ויקח משה ממחצת בני ישראל את האחז אחד מן החמשים מן האדם ומן הבהמה ויתן אתם ללוים שמרי משמרת משכן יהוה כאשר צוה יהוה את משה
(143827, 92, 4);90;צ;241623;(4, 31, 48, 27, 241623);63574;(4, 31, 48, 7, 63574);הצבא;2;7;ויקרבו אל משה הפקדים אשר לאלפי הצבא שרי האלפים ושרי המאות
(143827, 92, 4);5;ה;241715;(4, 31, 50, 15, 241715);63597;(4, 31, 50, 4, 63597);יהוה;4;4;ונקרב את קרבן יהוה איש אשר מצא כלי זהב אצעדה וצמיד טבעת עגיל וכומז לכפר על נפשתינו לפני יהוה
(143827, 92, 4);40;מ;241807;(4, 31, 51, 33, 241807);63622;(4, 31, 51, 10, 63622);מעשה;1;10;ויקח משה ואלעזר הכהן את הזהב מאתם כל כלי מעשה
(143827, 92, 4);6;ו;241899;(4, 31, 53, 12, 241899);63645;(4, 31, 53, 3, 63645);בזזו;4;3;אנשי הצבא בזזו איש לו
(143827, 92, 4);2;ב;241991;(4, 32, 1, 7, 241991);63669;(4, 32, 1, 2, 63669);רב;2;2;ומקנה רב היה לבני ראובן ולבני גד עצום מאד ויראו את ארץ יעזר ואת ארץ גלעד והנה המקום מקום מקנה
(143827, 92, 4);6;ו;242083;(4, 32, 2, 25, 242083);63693;(4, 32, 2, 6, 63693);ויאמרו;6;6;ויבאו בני גד ובני ראובן ויאמרו אל משה ואל אלעזר הכהן ואל נשיאי העדה לאמר
(143827, 92, 4);30;ל;242175;(4, 32, 4, 15, 242175);63716;(4, 32, 4, 5, 63716);לפני;1;5;הארץ אשר הכה יהוה לפני עדת ישראל ארץ מקנה הוא ולעבדיך מקנה
(143827, 92, 4);50;ן;242267;(4, 32, 5, 60, 242267);63738;(4, 32, 5, 15, 63738);הירדן;5;15;ויאמרו אם מצאנו חן בעיניך יתן את הארץ הזאת לעבדיך לאחזה אל תעברנו את הירדן
(143827, 92, 4);10;י;242359;(4, 32, 7, 42, 242359);63763;(4, 32, 7, 13, 63763);יהוה;1;13;ולמה תנואון את לב בני ישראל מעבר אל הארץ אשר נתן להם יהוה
(143827, 92, 4);1;א;242451;(4, 32, 9, 51, 242451);63787;(4, 32, 9, 14, 63787);בא;2;14;ויעלו עד נחל אשכול ויראו את הארץ ויניאו את לב בני ישראל לבלתי בא אל הארץ אשר נתן להם יהוה
(143827, 92, 4);5;ה;242543;(4, 32, 11, 46, 242543);63811;(4, 32, 11, 11, 63811);האדמה;5;11;אם יראו האנשים העלים ממצרים מבן עשרים שנה ומעלה את האדמה אשר נשבעתי לאברהם ליצחק וליעקב כי לא מלאו אחרי
(143827, 92, 4);2;ב;242635;(4, 32, 13, 11, 242635);63836;(4, 32, 13, 4, 63836);בישראל;1;4;ויחר אף יהוה בישראל וינעם במדבר ארבעים שנה עד תם כל הדור העשה הרע בעיני יהוה
(143827, 92, 4);30;ל;242727;(4, 32, 14, 42, 242727);63858;(4, 32, 14, 10, 63858);על;2;10;והנה קמתם תחת אבתיכם תרבות אנשים חטאים לספות עוד על חרון אף יהוה אל ישראל
(143827, 92, 4);50;נ;242819;(4, 32, 16, 30, 242819);63881;(4, 32, 16, 7, 63881);למקננו;4;7;ויגשו אליו ויאמרו גדרת צאן נבנה למקננו פה וערים לטפנו
(143827, 92, 4);50;נ;242911;(4, 32, 18, 3, 242911);63905;(4, 32, 18, 2, 63905);נשוב;1;2;לא נשוב אל בתינו עד התנחל בני ישראל איש נחלתו
(143827, 92, 4);40;מ;243003;(4, 32, 20, 4, 243003);63928;(4, 32, 20, 1, 63928);ויאמר;4;1;ויאמר אליהם משה אם תעשון את הדבר הזה אם תחלצו לפני יהוה למלחמה
(143827, 92, 4);50;נ;243095;(4, 32, 21, 46, 243095);63953;(4, 32, 21, 13, 63953);מפניו;3;13;ועבר לכם כל חלוץ את הירדן לפני יהוה עד הורישו את איביו מפניו
(143827, 92, 4);5;ה;243187;(4, 32, 23, 13, 243187);63975;(4, 32, 23, 5, 63975);הנה;1;5;ואם לא תעשון כן הנה חטאתם ליהוה ודעו חטאתכם אשר תמצא אתכם
(143827, 92, 4);50;ן;243279;(4, 32, 25, 19, 243279);63996;(4, 32, 25, 5, 63996);ראובן;5;5;ויאמר בני גד ובני ראובן אל משה לאמר עבדיך יעשו כאשר אדני מצוה
(143827, 92, 4);10;י;243371;(4, 32, 27, 24, 243371);64019;(4, 32, 27, 6, 64019);לפני;4;6;ועבדיך יעברו כל חלוץ צבא לפני יהוה למלחמה כאשר אדני דבר
(143827, 92, 4);40;ם;243463;(4, 32, 29, 12, 243463);64043;(4, 32, 29, 3, 64043);אלהם;4;3;ויאמר משה אלהם אם יעברו בני גד ובני ראובן אתכם את הירדן כל חלוץ למלחמה לפני יהוה ונכבשה הארץ לפניכם ונתתם להם את ארץ הגלעד לאחזה
(143827, 92, 4);6;ו;243555;(4, 32, 30, 1, 243555);64067;(4, 32, 30, 1, 64067);ואם;1;1;ואם לא יעברו חלוצים אתכם ונאחזו בתככם בארץ כנען
(143827, 92, 4);70;ע;243647;(4, 32, 32, 6, 243647);64091;(4, 32, 32, 2, 64091);נעבר;2;2;נחנו נעבר חלוצים לפני יהוה ארץ כנען ואתנו אחזת נחלתנו מעבר לירדן
(143827, 92, 4);1;א;243739;(4, 32, 33, 45, 243739);64114;(4, 32, 33, 13, 64114);את;1;13;ויתן להם משה לבני גד ולבני ראובן ולחצי שבט מנשה בן יוסף את ממלכת סיחן מלך האמרי ואת ממלכת עוג מלך הבשן הארץ לעריה בגבלת ערי הארץ סביב
(143827, 92, 4);6;ו;243831;(4, 32, 35, 1, 243831);64139;(4, 32, 35, 1, 64139);ואת;1;1;ואת עטרת שופן ואת יעזר ויגבהה
(143827, 92, 4);10;י;243923;(4, 32, 37, 35, 243923);64163;(4, 32, 37, 9, 64163);קריתים;5;9;ובני ראובן בנו את חשבון ואת אלעלא ואת קריתים
(143827, 92, 4);300;ש;244015;(4, 32, 39, 34, 244015);64187;(4, 32, 39, 8, 64187);ויורש;5;8;וילכו בני מכיר בן מנשה גלעדה וילכדה ויורש את האמרי אשר בה
(143827, 92, 4);30;ל;244107;(4, 32, 42, 6, 244107);64213;(4, 32, 42, 2, 64213);הלך;2;2;ונבח הלך וילכד את קנת ואת בנתיה ויקרא לה נבח בשמו
(143827, 92, 4);40;מ;244199;(4, 33, 2, 11, 244199);64238;(4, 33, 2, 4, 64238);מוצאיהם;1;4;ויכתב משה את מוצאיהם למסעיהם על פי יהוה ואלה מסעיהם למוצאיהם
(143827, 92, 4);90;צ;244291;(4, 33, 3, 53, 244291);64257;(4, 33, 3, 12, 64257);יצאו;2;12;ויסעו מרעמסס בחדש הראשון בחמשה עשר יום לחדש הראשון ממחרת הפסח יצאו בני ישראל ביד רמה לעיני כל מצרים
(143827, 92, 4);200;ר;244383;(4, 33, 5, 11, 244383);64280;(4, 33, 5, 3, 64280);ישראל;3;3;ויסעו בני ישראל מרעמסס ויחנו בסכת
(143827, 92, 4);50;נ;244475;(4, 33, 7, 45, 244475);64303;(4, 33, 7, 13, 64303);לפני;3;13;ויסעו מאתם וישב על פי החירת אשר על פני בעל צפון ויחנו לפני מגדל
(143827, 92, 4);2;ב;244567;(4, 33, 9, 21, 244567);64324;(4, 33, 9, 5, 64324);ובאילם;2;5;ויסעו ממרה ויבאו אילמה ובאילם שתים עשרה עינת מים ושבעים תמרים ויחנו שם
