(126970, -93, 4);200;ר;76936;(1, 50, 6, 5, 76936);20314;(1, 50, 6, 1, 20314);ויאמר;5;1;ויאמר פרעה עלה וקבר את אביך כאשר השביעך
(126970, -93, 4);10;י;77029;(1, 50, 8, 7, 77029);20340;(1, 50, 8, 3, 20340);יוסף;1;3;וכל בית יוסף ואחיו ובית אביו רק טפם וצאנם ובקרם עזבו בארץ גשן
(126970, -93, 4);200;ר;77122;(1, 50, 10, 17, 77122);20365;(1, 50, 10, 5, 20365);אשר;3;5;ויבאו עד גרן האטד אשר בעבר הירדן ויספדו שם מספד גדול וכבד מאד ויעש לאביו אבל שבעת ימים
(126970, -93, 4);30;ל;77215;(1, 50, 11, 41, 77215);20388;(1, 50, 11, 10, 20388);אבל;3;10;וירא יושב הארץ הכנעני את האבל בגרן האטד ויאמרו אבל כבד זה למצרים על כן קרא שמה אבל מצרים אשר בעבר הירדן
(126970, -93, 4);70;ע;77308;(1, 50, 13, 32, 77308);20414;(1, 50, 13, 8, 20414);במערת;3;8;וישאו אתו בניו ארצה כנען ויקברו אתו במערת שדה המכפלה אשר קנה אברהם את השדה לאחזת קבר מאת עפרן החתי על פני ממרא
(126970, -93, 4);200;ר;77401;(1, 50, 14, 37, 77401);20438;(1, 50, 14, 9, 20438);לקבר;4;9;וישב יוסף מצרימה הוא ואחיו וכל העלים אתו לקבר את אביו אחרי קברו את אביו
(126970, -93, 4);6;ו;77494;(1, 50, 16, 4, 77494);20464;(1, 50, 16, 1, 20464);ויצוו;4;1;ויצוו אל יוסף לאמר אביך צוה לפני מותו לאמר
(126970, -93, 4);1;א;77587;(1, 50, 17, 63, 77587);20491;(1, 50, 17, 19, 20491);אביך;1;19;כה תאמרו ליוסף אנא שא נא פשע אחיך וחטאתם כי רעה גמלוך ועתה שא נא לפשע עבדי אלהי אביך ויבך יוסף בדברם אליו
(126970, -93, 4);10;י;77680;(1, 50, 19, 34, 77680);20513;(1, 50, 19, 9, 20513);אני;3;9;ויאמר אלהם יוסף אל תיראו כי התחת אלהים אני
(126970, -93, 4);10;י;77773;(1, 50, 21, 42, 77773);20538;(1, 50, 21, 11, 20538);וידבר;2;11;ועתה אל תיראו אנכי אכלכל אתכם ואת טפכם וינחם אותם וידבר על לבם
(126970, -93, 4);6;ו;77866;(1, 50, 23, 41, 77866);20562;(1, 50, 23, 11, 20562);ילדו;4;11;וירא יוסף לאפרים בני שלשים גם בני מכיר בן מנשה ילדו על ברכי יוסף
(126970, -93, 4);30;ל;77959;(1, 50, 24, 83, 77959);20587;(1, 50, 24, 22, 20587);וליעקב;2;22;ויאמר יוסף אל אחיו אנכי מת ואלהים פקד יפקד אתכם והעלה אתכם מן הארץ הזאת אל הארץ אשר נשבע לאברהם ליצחק וליעקב
(126970, -93, 4);300;ש;78052;(1, 50, 26, 34, 78052);20610;(1, 50, 26, 9, 20610);ויישם;4;9;וימת יוסף בן מאה ועשר שנים ויחנטו אתו ויישם בארון במצרים
(126970, -93, 4);50;ן;78145;(2, 1, 4, 2, 78145);20631;(2, 1, 4, 1, 20631);דן;2;1;דן ונפתלי גד ואשר
(126970, -93, 4);6;ו;78238;(2, 1, 7, 13, 78238);20656;(2, 1, 7, 4, 20656);וישרצו;1;4;ובני ישראל פרו וישרצו וירבו ויעצמו במאד מאד ותמלא הארץ אתם
(126970, -93, 4);70;ע;78331;(2, 1, 9, 27, 78331);20682;(2, 1, 9, 9, 20682);ועצום;2;9;ויאמר אל עמו הנה עם בני ישראל רב ועצום ממנו
(126970, -93, 4);10;י;78424;(2, 1, 11, 16, 78424);20706;(2, 1, 11, 4, 20706);מסים;3;4;וישימו עליו שרי מסים למען ענתו בסבלתם ויבן ערי מסכנות לפרעה את פתם ואת רעמסס
(126970, -93, 4);4;ד;78517;(2, 1, 13, 5, 78517);20729;(2, 1, 13, 1, 20729);ויעבדו;5;1;ויעבדו מצרים את בני ישראל בפרך
(126970, -93, 4);40;מ;78610;(2, 1, 15, 6, 78610);20753;(2, 1, 15, 2, 20753);מלך;1;2;ויאמר מלך מצרים למילדת העברית אשר שם האחת שפרה ושם השנית פועה
(126970, -93, 4);6;ו;78703;(2, 1, 16, 49, 78703);20775;(2, 1, 16, 12, 20775);אתו;3;12;ויאמר בילדכן את העבריות וראיתן על האבנים אם בן הוא והמתן אתו ואם בת הוא וחיה
(126970, -93, 4);10;י;78796;(2, 1, 18, 21, 78796);20798;(2, 1, 18, 5, 20798);ויאמר;2;5;ויקרא מלך מצרים למילדת ויאמר להן מדוע עשיתן הדבר הזה ותחיין את הילדים
(126970, -93, 4);1;א;78889;(2, 1, 19, 57, 78889);20821;(2, 1, 19, 15, 20821);אלהן;1;15;ותאמרן המילדת אל פרעה כי לא כנשים המצרית העברית כי חיות הנה בטרם תבוא אלהן המילדת וילדו
(126970, -93, 4);70;ע;78982;(2, 1, 22, 12, 78982);20843;(2, 1, 22, 4, 20843);עמו;1;4;ויצו פרעה לכל עמו לאמר כל הבן הילוד היארה תשליכהו וכל הבת תחיון
(126970, -93, 4);1;א;79075;(2, 2, 2, 29, 79075);20869;(2, 2, 2, 9, 20869);הוא;3;9;ותהר האשה ותלד בן ותרא אתו כי טוב הוא ותצפנהו שלשה ירחים
(126970, -93, 4);2;ב;79168;(2, 2, 4, 5, 79168);20893;(2, 2, 4, 1, 20893);ותתצב;5;1;ותתצב אחתו מרחק לדעה מה יעשה לו
(126970, -93, 4);5;ה;79261;(2, 2, 5, 73, 79261);20919;(2, 2, 5, 20, 20919);ותקחה;5;20;ותרד בת פרעה לרחץ על היאר ונערתיה הלכת על יד היאר ותרא את התבה בתוך הסוף ותשלח את אמתה ותקחה
(126970, -93, 4);50;ן;79354;(2, 2, 7, 39, 79354);20943;(2, 2, 7, 11, 20943);מן;2;11;ותאמר אחתו אל בת פרעה האלך וקראתי לך אשה מינקת מן העברית ותינק לך את הילד
(126970, -93, 4);30;ל;79447;(2, 2, 9, 36, 79447);20969;(2, 2, 9, 10, 20969);לי;1;10;ותאמר לה בת פרעה היליכי את הילד הזה והינקהו לי ואני אתן את שכרך ותקח האשה הילד ותניקהו
(126970, -93, 4);5;ה;79540;(2, 2, 10, 60, 79540);20993;(2, 2, 10, 16, 20993);משיתהו;5;16;ויגדל הילד ותבאהו לבת פרעה ויהי לה לבן ותקרא שמו משה ותאמר כי מן המים משיתהו
(126970, -93, 4);400;ת;79633;(2, 2, 12, 26, 79633);21019;(2, 2, 12, 9, 21019);את;2;9;ויפן כה וכה וירא כי אין איש ויך את המצרי ויטמנהו בחול
(126970, -93, 4);5;ה;79726;(2, 2, 14, 26, 79726);21043;(2, 2, 14, 8, 21043);הלהרגני;1;8;ויאמר מי שמך לאיש שר ושפט עלינו הלהרגני אתה אמר כאשר הרגת את המצרי ויירא משה ויאמר אכן נודע הדבר
(126970, -93, 4);80;פ;79819;(2, 2, 15, 42, 79819);21067;(2, 2, 15, 12, 21067);מפני;2;12;וישמע פרעה את הדבר הזה ויבקש להרג את משה ויברח משה מפני פרעה וישב בארץ מדין וישב על הבאר
(126970, -93, 4);70;ע;79912;(2, 2, 17, 8, 79912);21088;(2, 2, 17, 2, 21088);הרעים;3;2;ויבאו הרעים ויגרשום ויקם משה ויושען וישק את צאנם
(126970, -93, 4);5;ה;80005;(2, 2, 19, 23, 80005);21110;(2, 2, 19, 6, 21110);הרעים;1;6;ותאמרן איש מצרי הצילנו מיד הרעים וגם דלה דלה לנו וישק את הצאן
(126970, -93, 4);400;ת;80098;(2, 2, 21, 21, 80098);21136;(2, 2, 21, 6, 21136);ויתן;3;6;ויואל משה לשבת את האיש ויתן את צפרה בתו למשה
(126970, -93, 4);10;י;80191;(2, 2, 23, 38, 80191);21161;(2, 2, 23, 9, 21161);בני;3;9;ויהי בימים הרבים ההם וימת מלך מצרים ויאנחו בני ישראל מן העבדה ויזעקו ותעל שועתם אל האלהים מן העבדה
(126970, -93, 4);10;י;80284;(2, 2, 24, 51, 80284);21185;(2, 2, 24, 14, 21185);יעקב;1;14;וישמע אלהים את נאקתם ויזכר אלהים את בריתו את אברהם את יצחק ואת יעקב
(126970, -93, 4);10;י;80377;(2, 3, 1, 62, 80377);21210;(2, 3, 1, 18, 21210);האלהים;5;18;ומשה היה רעה את צאן יתרו חתנו כהן מדין וינהג את הצאן אחר המדבר ויבא אל הר האלהים חרבה
(126970, -93, 4);5;ה;80470;(2, 3, 3, 27, 80470);21235;(2, 3, 3, 8, 21235);הגדל;1;8;ויאמר משה אסרה נא ואראה את המראה הגדל הזה מדוע לא יבער הסנה
(126970, -93, 4);40;ם;80563;(2, 3, 5, 14, 80563);21259;(2, 3, 5, 4, 21259);הלם;3;4;ויאמר אל תקרב הלם של נעליך מעל רגליך כי המקום אשר אתה עומד עליו אדמת קדש הוא
(126970, -93, 4);400;ת;80656;(2, 3, 6, 47, 80656);21283;(2, 3, 6, 11, 21283);ויסתר;4;11;ויאמר אנכי אלהי אביך אלהי אברהם אלהי יצחק ואלהי יעקב ויסתר משה פניו כי ירא מהביט אל האלהים
(126970, -93, 4);20;כ;80749;(2, 3, 7, 67, 80749);21308;(2, 3, 7, 18, 21308);מכאביו;2;18;ויאמר יהוה ראה ראיתי את עני עמי אשר במצרים ואת צעקתם שמעתי מפני נגשיו כי ידעתי את מכאביו
(126970, -93, 4);5;ה;80842;(2, 3, 8, 89, 80842);21331;(2, 3, 8, 23, 21331);והפרזי;2;23;וארד להצילו מיד מצרים ולהעלתו מן הארץ ההוא אל ארץ טובה ורחבה אל ארץ זבת חלב ודבש אל מקום הכנעני והחתי והאמרי והפרזי והחוי והיבוסי
(126970, -93, 4);6;ו;80935;(2, 3, 10, 22, 80935);21354;(2, 3, 10, 6, 21354);והוצא;3;6;ועתה לכה ואשלחך אל פרעה והוצא את עמי בני ישראל ממצרים
(126970, -93, 4);6;ו;81028;(2, 3, 12, 15, 81028);21380;(2, 3, 12, 5, 21380);וזה;1;5;ויאמר כי אהיה עמך וזה לך האות כי אנכי שלחתיך בהוציאך את העם ממצרים תעבדון את האלהים על ההר הזה
(126970, -93, 4);200;ר;81121;(2, 3, 13, 33, 81121);21405;(2, 3, 13, 10, 21405);ישראל;3;10;ויאמר משה אל האלהים הנה אנכי בא אל בני ישראל ואמרתי להם אלהי אבותיכם שלחני אליכם ואמרו לי מה שמו מה אמר אלהם
(126970, -93, 4);50;נ;81214;(2, 3, 14, 40, 81214);21429;(2, 3, 14, 11, 21429);לבני;3;11;ויאמר אלהים אל משה אהיה אשר אהיה ויאמר כה תאמר לבני ישראל אהיה שלחני אליכם
(126970, -93, 4);100;ק;81307;(2, 3, 15, 73, 81307);21452;(2, 3, 15, 19, 21452);יעקב;3;19;ויאמר עוד אלהים אל משה כה תאמר אל בני ישראל יהוה אלהי אבתיכם אלהי אברהם אלהי יצחק ואלהי יעקב שלחני אליכם זה שמי לעלם וזה זכרי לדר דר
(126970, -93, 4);100;ק;81400;(2, 3, 16, 61, 81400);21476;(2, 3, 16, 15, 21476);יצחק;4;15;לך ואספת את זקני ישראל ואמרת אלהם יהוה אלהי אבתיכם נראה אלי אלהי אברהם יצחק ויעקב לאמר פקד פקדתי אתכם ואת העשוי לכם במצרים
(126970, -93, 4);6;ו;81493;(2, 3, 17, 55, 81493);21498;(2, 3, 17, 13, 21498);והיבוסי;1;13;ואמר אעלה אתכם מעני מצרים אל ארץ הכנעני והחתי והאמרי והפרזי והחוי והיבוסי אל ארץ זבת חלב ודבש
(126970, -93, 4);70;ע;81586;(2, 3, 18, 72, 81586);21520;(2, 3, 18, 17, 21520);ועתה;2;17;ושמעו לקלך ובאת אתה וזקני ישראל אל מלך מצרים ואמרתם אליו יהוה אלהי העבריים נקרה עלינו ועתה נלכה נא דרך שלשת ימים במדבר ונזבחה ליהוה אלהינו
(126970, -93, 4);4;ד;81679;(2, 3, 20, 10, 81679);21544;(2, 3, 20, 3, 21544);ידי;2;3;ושלחתי את ידי והכיתי את מצרים בכל נפלאתי אשר אעשה בקרבו ואחרי כן ישלח אתכם
(126970, -93, 4);200;ר;81772;(2, 3, 21, 43, 81772);21569;(2, 3, 21, 13, 21569);ריקם;1;13;ונתתי את חן העם הזה בעיני מצרים והיה כי תלכון לא תלכו ריקם
(126970, -93, 4);50;ן;81865;(2, 4, 1, 15, 81865);21591;(2, 4, 1, 4, 21591);והן;3;4;ויען משה ויאמר והן לא יאמינו לי ולא ישמעו בקלי כי יאמרו לא נראה אליך יהוה
(126970, -93, 4);5;ה;81958;(2, 4, 3, 22, 81958);21614;(2, 4, 3, 4, 21614);וישלכהו;6;4;ויאמר השליכהו ארצה וישלכהו ארצה ויהי לנחש וינס משה מפניו
(126970, -93, 4);10;י;82051;(2, 4, 5, 12, 82051);21638;(2, 4, 5, 3, 21638);כי;2;3;למען יאמינו כי נראה אליך יהוה אלהי אבתם אלהי אברהם אלהי יצחק ואלהי יעקב
(126970, -93, 4);5;ה;82144;(2, 4, 6, 47, 82144);21662;(2, 4, 6, 13, 21662);והנה;2;13;ויאמר יהוה לו עוד הבא נא ידך בחיקך ויבא ידו בחיקו ויוצאה והנה ידו מצרעת כשלג
(126970, -93, 4);100;ק;82237;(2, 4, 8, 26, 82237);21687;(2, 4, 8, 8, 21687);לקל;2;8;והיה אם לא יאמינו לך ולא ישמעו לקל האת הראשון והאמינו לקל האת האחרון
(126970, -93, 4);2;ב;82330;(2, 4, 9, 64, 82330);21709;(2, 4, 9, 16, 21709);היבשה;3;16;והיה אם לא יאמינו גם לשני האתות האלה ולא ישמעון לקלך ולקחת ממימי היאר ושפכת היבשה והיו המים אשר תקח מן היאר והיו לדם ביבשת
(126970, -93, 4);30;ל;82423;(2, 4, 10, 59, 82423);21736;(2, 4, 10, 18, 21736);אל;2;18;ויאמר משה אל יהוה בי אדני לא איש דברים אנכי גם מתמול גם משלשם גם מאז דברך אל עבדך כי כבד פה וכבד לשון אנכי
(126970, -93, 4);20;כ;82516;(2, 4, 12, 10, 82516);21766;(2, 4, 12, 3, 21766);ואנכי;4;3;ועתה לך ואנכי אהיה עם פיך והוריתיך אשר תדבר
(126970, -93, 4);10;י;82609;(2, 4, 14, 45, 82609);21792;(2, 4, 14, 13, 21792);ידבר;1;13;ויחר אף יהוה במשה ויאמר הלא אהרן אחיך הלוי ידעתי כי דבר ידבר הוא וגם הנה הוא יצא לקראתך וראך ושמח בלבו
(126970, -93, 4);40;ם;82702;(2, 4, 15, 57, 82702);21815;(2, 4, 15, 14, 21815);אתכם;4;14;ודברת אליו ושמת את הדברים בפיו ואנכי אהיה עם פיך ועם פיהו והוריתי אתכם את אשר תעשון
(126970, -93, 4);40;מ;82795;(2, 4, 18, 5, 82795);21844;(2, 4, 18, 2, 21844);משה;1;2;וילך משה וישב אל יתר חתנו ויאמר לו אלכה נא ואשובה אל אחי אשר במצרים ואראה העודם חיים ויאמר יתרו למשה לך לשלום
(126970, -93, 4);30;ל;82888;(2, 4, 19, 11, 82888);21868;(2, 4, 19, 3, 21868);אל;2;3;ויאמר יהוה אל משה במדין לך שב מצרים כי מתו כל האנשים המבקשים את נפשך
(126970, -93, 4);40;מ;82981;(2, 4, 20, 50, 82981);21894;(2, 4, 20, 14, 21894);משה;1;14;ויקח משה את אשתו ואת בניו וירכבם על החמר וישב ארצה מצרים ויקח משה את מטה האלהים בידו
(126970, -93, 4);30;ל;83074;(2, 4, 21, 76, 83074);21918;(2, 4, 21, 20, 21918);לבו;1;20;ויאמר יהוה אל משה בלכתך לשוב מצרימה ראה כל המפתים אשר שמתי בידך ועשיתם לפני פרעה ואני אחזק את לבו ולא ישלח את העם
(126970, -93, 4);50;נ;83167;(2, 4, 23, 47, 83167);21944;(2, 4, 23, 13, 21944);בנך;2;13;ואמר אליך שלח את בני ויעבדני ותמאן לשלחו הנה אנכי הרג את בנך בכרך
(126970, -93, 4);6;ו;83260;(2, 4, 26, 1, 83260);21968;(2, 4, 26, 1, 21968);וירף;1;1;וירף ממנו אז אמרה חתן דמים למולת
(126970, -93, 4);200;ר;83353;(2, 4, 28, 11, 83353);21991;(2, 4, 28, 3, 21991);לאהרן;4;3;ויגד משה לאהרן את כל דברי יהוה אשר שלחו ואת כל האתת אשר צוהו
(126970, -93, 4);4;ד;83446;(2, 4, 30, 23, 83446);22018;(2, 4, 30, 7, 22018);דבר;1;7;וידבר אהרן את כל הדברים אשר דבר יהוה אל משה ויעש האתת לעיני העם
(126970, -93, 4);300;ש;83539;(2, 5, 1, 9, 83539);22043;(2, 5, 1, 3, 22043);משה;2;3;ואחר באו משה ואהרן ויאמרו אל פרעה כה אמר יהוה אלהי ישראל שלח את עמי ויחגו לי במדבר
(126970, -93, 4);30;ל;83632;(2, 5, 2, 37, 83632);22068;(2, 5, 2, 10, 22068);ישראל;5;10;ויאמר פרעה מי יהוה אשר אשמע בקלו לשלח את ישראל לא ידעתי את יהוה וגם את ישראל לא אשלח
(126970, -93, 4);6;ו;83725;(2, 5, 3, 64, 83725);22091;(2, 5, 3, 14, 22091);אלהינו;6;14;ויאמרו אלהי העברים נקרא עלינו נלכה נא דרך שלשת ימים במדבר ונזבחה ליהוה אלהינו פן יפגענו בדבר או בחרב
(126970, -93, 4);70;ע;83818;(2, 5, 5, 19, 83818);22115;(2, 5, 5, 6, 22115);עם;1;6;ויאמר פרעה הן רבים עתה עם הארץ והשבתם אתם מסבלתם
(126970, -93, 4);30;ל;83911;(2, 5, 7, 34, 83911);22138;(2, 5, 7, 9, 22138);שלשם;2;9;לא תאספון לתת תבן לעם ללבן הלבנים כתמול שלשם הם ילכו וקששו להם תבן
(126970, -93, 4);1;א;84004;(2, 5, 8, 74, 84004);22164;(2, 5, 8, 21, 22164);לאמר;2;21;ואת מתכנת הלבנים אשר הם עשים תמול שלשם תשימו עליהם לא תגרעו ממנו כי נרפים הם על כן הם צעקים לאמר נלכה נזבחה לאלהינו
(126970, -93, 4);1;א;84097;(2, 5, 10, 36, 84097);22187;(2, 5, 10, 10, 22187);אמר;1;10;ויצאו נגשי העם ושטריו ויאמרו אל העם לאמר כה אמר פרעה אינני נתן לכם תבן
(126970, -93, 4);5;ה;84190;(2, 5, 13, 2, 84190);22213;(2, 5, 13, 1, 22213);והנגשים;2;1;והנגשים אצים לאמר כלו מעשיכם דבר יום ביומו כאשר בהיות התבן
(126970, -93, 4);10;י;84283;(2, 5, 14, 47, 84283);22236;(2, 5, 14, 13, 22236);כליתם;3;13;ויכו שטרי בני ישראל אשר שמו עלהם נגשי פרעה לאמר מדוע לא כליתם חקכם ללבן כתמול שלשם גם תמול גם היום
(126970, -93, 4);10;י;84376;(2, 5, 16, 14, 84376);22260;(2, 5, 16, 4, 22260);לעבדיך;5;4;תבן אין נתן לעבדיך ולבנים אמרים לנו עשו והנה עבדיך מכים וחטאת עמך
(126970, -93, 4);4;ד;84469;(2, 5, 18, 10, 84469);22283;(2, 5, 18, 3, 22283);עבדו;3;3;ועתה לכו עבדו ותבן לא ינתן לכם ותכן לבנים תתנו
(126970, -93, 4);400;ת;84562;(2, 5, 20, 14, 84562);22307;(2, 5, 20, 4, 22307);ואת;3;4;ויפגעו את משה ואת אהרן נצבים לקראתם בצאתם מאת פרעה
(126970, -93, 4);400;ת;84655;(2, 5, 21, 66, 84655);22328;(2, 5, 21, 15, 22328);לתת;3;15;ויאמרו אלהם ירא יהוה עליכם וישפט אשר הבאשתם את ריחנו בעיני פרעה ובעיני עבדיו לתת חרב בידם להרגנו
(126970, -93, 4);5;ה;84748;(2, 5, 23, 33, 84748);22354;(2, 5, 23, 10, 22354);והצל;2;10;ומאז באתי אל פרעה לדבר בשמך הרע לעם הזה והצל לא הצלת את עמך
(126970, -93, 4);5;ה;84841;(2, 6, 2, 15, 84841);22379;(2, 6, 2, 4, 22379);משה;3;4;וידבר אלהים אל משה ויאמר אליו אני יהוה
(126970, -93, 4);200;ר;84934;(2, 6, 4, 28, 84934);22406;(2, 6, 4, 9, 22406);ארץ;2;9;וגם הקמתי את בריתי אתם לתת להם את ארץ כנען את ארץ מגריהם אשר גרו בה
(126970, -93, 4);30;ל;85027;(2, 6, 6, 15, 85027);22431;(2, 6, 6, 4, 22431);ישראל;5;4;לכן אמר לבני ישראל אני יהוה והוצאתי אתכם מתחת סבלת מצרים והצלתי אתכם מעבדתם וגאלתי אתכם בזרוע נטויה ובשפטים גדלים
(126970, -93, 4);70;ע;85120;(2, 6, 7, 14, 85120);22451;(2, 6, 7, 4, 22451);לעם;2;4;ולקחתי אתכם לי לעם והייתי לכם לאלהים וידעתם כי אני יהוה אלהיכם המוציא אתכם מתחת סבלות מצרים
(126970, -93, 4);400;ת;85213;(2, 6, 8, 32, 85213);22473;(2, 6, 8, 9, 22473);לתת;3;9;והבאתי אתכם אל הארץ אשר נשאתי את ידי לתת אתה לאברהם ליצחק וליעקב ונתתי אתה לכם מורשה אני יהוה
(126970, -93, 4);10;י;85306;(2, 6, 10, 2, 85306);22498;(2, 6, 10, 1, 22498);וידבר;2;1;וידבר יהוה אל משה לאמר
(126970, -93, 4);30;ל;85399;(2, 6, 12, 38, 85399);22524;(2, 6, 12, 11, 22524);אלי;2;11;וידבר משה לפני יהוה לאמר הן בני ישראל לא שמעו אלי ואיך ישמעני פרעה ואני ערל שפתים
(126970, -93, 4);1;א;85492;(2, 6, 13, 66, 85492);22548;(2, 6, 13, 18, 22548);ישראל;4;18;וידבר יהוה אל משה ואל אהרן ויצום אל בני ישראל ואל פרעה מלך מצרים להוציא את בני ישראל מארץ מצרים
(126970, -93, 4);5;ה;85585;(2, 6, 15, 22, 85585);22570;(2, 6, 15, 5, 22570);ואהד;3;5;ובני שמעון ימואל וימין ואהד ויכין וצחר ושאול בן הכנענית אלה משפחת שמעון
(126970, -93, 4);1;א;85678;(2, 6, 16, 56, 85678);22592;(2, 6, 16, 14, 22592);ומאת;3;14;ואלה שמות בני לוי לתלדתם גרשון וקהת ומררי ושני חיי לוי שבע ושלשים ומאת שנה
(126970, -93, 4);30;ל;85771;(2, 6, 19, 11, 85771);22614;(2, 6, 19, 3, 22614);מחלי;3;3;ובני מררי מחלי ומושי אלה משפחת הלוי לתלדתם
(126970, -93, 4);50;נ;85864;(2, 6, 20, 69, 85864);22639;(2, 6, 20, 20, 22639);שנה;2;20;ויקח עמרם את יוכבד דדתו לו לאשה ותלד לו את אהרן ואת משה ושני חיי עמרם שבע ושלשים ומאת שנה
(126970, -93, 4);400;ת;85957;(2, 6, 23, 47, 85957);22662;(2, 6, 23, 13, 22662);את;2;13;ויקח אהרן את אלישבע בת עמינדב אחות נחשון לו לאשה ותלד לו את נדב ואת אביהוא את אלעזר ואת איתמר
(126970, -93, 4);30;ל;86050;(2, 6, 25, 29, 86050);22685;(2, 6, 25, 8, 22685);לו;1;8;ואלעזר בן אהרן לקח לו מבנות פוטיאל לו לאשה ותלד לו את פינחס אלה ראשי אבות הלוים למשפחתם
(126970, -93, 4);90;צ;86143;(2, 6, 26, 52, 86143);22710;(2, 6, 26, 15, 22710);צבאתם;1;15;הוא אהרן ומשה אשר אמר יהוה להם הוציאו את בני ישראל מארץ מצרים על צבאתם
(126970, -93, 4);2;ב;86236;(2, 6, 29, 4, 86236);22733;(2, 6, 29, 1, 22733);וידבר;4;1;וידבר יהוה אל משה לאמר אני יהוה דבר אל פרעה מלך מצרים את כל אשר אני דבר אליך
(126970, -93, 4);1;א;86329;(2, 6, 30, 38, 86329);22761;(2, 6, 30, 11, 22761);אלי;1;11;ויאמר משה לפני יהוה הן אני ערל שפתים ואיך ישמע אלי פרעה
(126970, -93, 4);5;ה;86422;(2, 7, 2, 37, 86422);22785;(2, 7, 2, 11, 22785);פרעה;4;11;אתה תדבר את כל אשר אצוך ואהרן אחיך ידבר אל פרעה ושלח את בני ישראל מארצו
(126970, -93, 4);90;צ;86515;(2, 7, 4, 28, 86515);22810;(2, 7, 4, 8, 22810);במצרים;3;8;ולא ישמע אלכם פרעה ונתתי את ידי במצרים והוצאתי את צבאתי את עמי בני ישראל מארץ מצרים בשפטים גדלים
(126970, -93, 4);10;י;86608;(2, 7, 5, 43, 86608);22832;(2, 7, 5, 11, 22832);והוצאתי;7;11;וידעו מצרים כי אני יהוה בנטתי את ידי על מצרים והוצאתי את בני ישראל מתוכם
(126970, -93, 4);1;א;86701;(2, 7, 8, 3, 86701);22858;(2, 7, 8, 1, 22858);ויאמר;3;1;ויאמר יהוה אל משה ואל אהרן לאמר
(126970, -93, 4);1;א;86794;(2, 7, 10, 4, 86794);22884;(2, 7, 10, 1, 22884);ויבא;4;1;ויבא משה ואהרן אל פרעה ויעשו כן כאשר צוה יהוה וישלך אהרן את מטהו לפני פרעה ולפני עבדיו ויהי לתנין
(126970, -93, 4);30;ל;86887;(2, 7, 11, 19, 86887);22908;(2, 7, 11, 5, 22908);ולמכשפים;2;5;ויקרא גם פרעה לחכמים ולמכשפים ויעשו גם הם חרטמי מצרים בלהטיהם כן
(126970, -93, 4);40;מ;86980;(2, 7, 13, 16, 86980);22930;(2, 7, 13, 5, 22930);שמע;2;5;ויחזק לב פרעה ולא שמע אלהם כאשר דבר יהוה
(126970, -93, 4);6;ו;87073;(2, 7, 15, 44, 87073);22957;(2, 7, 15, 13, 22957);והמטה;1;13;לך אל פרעה בבקר הנה יצא המימה ונצבת לקראתו על שפת היאר והמטה אשר נהפך לנחש תקח בידך
(126970, -93, 4);20;כ;87166;(2, 7, 17, 1, 87166);22981;(2, 7, 17, 1, 22981);כה;1;1;כה אמר יהוה בזאת תדע כי אני יהוה הנה אנכי מכה במטה אשר בידי על המים אשר ביאר ונהפכו לדם
(126970, -93, 4);50;נ;87259;(2, 7, 18, 26, 87259);23007;(2, 7, 18, 7, 23007);ונלאו;2;7;והדגה אשר ביאר תמות ובאש היאר ונלאו מצרים לשתות מים מן היאר
(126970, -93, 4);6;ו;87352;(2, 7, 19, 71, 87352);23033;(2, 7, 19, 21, 23033);ועל;1;21;ויאמר יהוה אל משה אמר אל אהרן קח מטך ונטה ידך על מימי מצרים על נהרתם על יאריהם ועל אגמיהם ועל כל מקוה מימיהם ויהיו דם והיה דם בכל ארץ מצרים ובעצים ובאבנים
