(256908, -75, 4);90;צ;155133;(3, 10, 16, 32, 155133);40926;(3, 10, 16, 9, 40926);ויקצף;4;9;ואת שעיר החטאת דרש דרש משה והנה שרף ויקצף על אלעזר ועל איתמר בני אהרן הנותרם לאמר
(256908, -75, 4);1;א;155208;(3, 10, 17, 42, 155208);40946;(3, 10, 17, 12, 40946);ואתה;2;12;מדוע לא אכלתם את החטאת במקום הקדש כי קדש קדשים הוא ואתה נתן לכם לשאת את עון העדה לכפר עליהם לפני יהוה
(256908, -75, 4);2;ב;155283;(3, 10, 18, 37, 155283);40968;(3, 10, 18, 12, 40968);בקדש;1;12;הן לא הובא את דמה אל הקדש פנימה אכול תאכלו אתה בקדש כאשר צויתי
(256908, -75, 4);6;ו;155358;(3, 10, 19, 63, 155358);40987;(3, 10, 19, 17, 40987);ואכלתי;1;17;וידבר אהרן אל משה הן היום הקריבו את חטאתם ואת עלתם לפני יהוה ותקראנה אתי כאלה ואכלתי חטאת היום הייטב בעיני יהוה
(256908, -75, 4);40;ם;155433;(3, 11, 1, 29, 155433);41004;(3, 11, 1, 8, 41004);אלהם;4;8;וידבר יהוה אל משה ואל אהרן לאמר אלהם
(256908, -75, 4);70;ע;155508;(3, 11, 3, 25, 155508);41025;(3, 11, 3, 7, 41025);מעלת;2;7;כל מפרסת פרסה ושסעת שסע פרסת מעלת גרה בבהמה אתה תאכלו
(256908, -75, 4);5;ה;155583;(3, 11, 4, 57, 155583);41045;(3, 11, 4, 16, 41045);ופרסה;5;16;אך את זה לא תאכלו ממעלי הגרה וממפרסי הפרסה את הגמל כי מעלה גרה הוא ופרסה איננו מפריס טמא הוא לכם
(256908, -75, 4);3;ג;155658;(3, 11, 6, 16, 155658);41067;(3, 11, 6, 5, 41067);גרה;1;5;ואת הארנבת כי מעלת גרה הוא ופרסה לא הפריסה טמאה הוא לכם
(256908, -75, 4);40;מ;155733;(3, 11, 7, 47, 155733);41088;(3, 11, 7, 14, 41088);טמא;2;14;ואת החזיר כי מפריס פרסה הוא ושסע שסע פרסה והוא גרה לא יגר טמא הוא לכם
(256908, -75, 4);100;ק;155808;(3, 11, 9, 33, 155808);41110;(3, 11, 9, 11, 41110);וקשקשת;2;11;את זה תאכלו מכל אשר במים כל אשר לו סנפיר וקשקשת במים בימים ובנחלים אתם תאכלו
(256908, -75, 4);20;כ;155883;(3, 11, 10, 47, 155883);41127;(3, 11, 10, 12, 41127);ומכל;3;12;וכל אשר אין לו סנפיר וקשקשת בימים ובנחלים מכל שרץ המים ומכל נפש החיה אשר במים שקץ הם לכם
(256908, -75, 4);6;ו;155958;(3, 11, 12, 16, 155958);41149;(3, 11, 12, 6, 41149);וקשקשת;1;6;כל אשר אין לו סנפיר וקשקשת במים שקץ הוא לכם
(256908, -75, 4);1;א;156033;(3, 11, 14, 6, 156033);41170;(3, 11, 14, 2, 41170);הדאה;3;2;ואת הדאה ואת האיה למינה
(256908, -75, 4);30;ל;156108;(3, 11, 17, 13, 156108);41191;(3, 11, 17, 4, 41191);השלך;3;4;ואת הכוס ואת השלך ואת הינשוף
(256908, -75, 4);90;ץ;156183;(3, 11, 20, 5, 156183);41209;(3, 11, 20, 2, 41209);שרץ;3;2;כל שרץ העוף ההלך על ארבע שקץ הוא לכם
(256908, -75, 4);30;ל;156258;(3, 11, 21, 52, 156258);41232;(3, 11, 21, 16, 41232);לנתר;1;16;אך את זה תאכלו מכל שרץ העוף ההלך על ארבע אשר לא כרעים ממעל לרגליו לנתר בהן על הארץ
(256908, -75, 4);10;י;156333;(3, 11, 22, 63, 156333);41251;(3, 11, 22, 16, 41251);למינהו;3;16;את אלה מהם תאכלו את הארבה למינו ואת הסלעם למינהו ואת החרגל למינהו ואת החגב למינהו
(256908, -75, 4);1;א;156408;(3, 11, 25, 7, 156408);41271;(3, 11, 25, 2, 41271);הנשא;4;2;וכל הנשא מנבלתם יכבס בגדיו וטמא עד הערב
(256908, -75, 4);9;ט;156483;(3, 11, 26, 50, 156483);41290;(3, 11, 26, 13, 41290);טמאים;1;13;לכל הבהמה אשר הוא מפרסת פרסה ושסע איננה שסעת וגרה איננה מעלה טמאים הם לכם כל הנגע בהם יטמא
(256908, -75, 4);40;ם;156558;(3, 11, 27, 53, 156558);41311;(3, 11, 27, 15, 41311);בנבלתם;6;15;וכל הולך על כפיו בכל החיה ההלכת על ארבע טמאים הם לכם כל הנגע בנבלתם יטמא עד הערב
(256908, -75, 4);200;ר;156633;(3, 11, 29, 23, 156633);41332;(3, 11, 29, 7, 41332);הארץ;3;7;וזה לכם הטמא בשרץ השרץ על הארץ החלד והעכבר והצב למינהו
(256908, -75, 4);2;ב;156708;(3, 11, 31, 26, 156708);41349;(3, 11, 31, 8, 41349);בהם;1;8;אלה הטמאים לכם בכל השרץ כל הנגע בהם במתם יטמא עד הערב
(256908, -75, 4);40;מ;156783;(3, 11, 32, 59, 156783);41374;(3, 11, 32, 21, 41374);מלאכה;1;21;וכל אשר יפל עליו מהם במתם יטמא מכל כלי עץ או בגד או עור או שק כל כלי אשר יעשה מלאכה בהם במים יובא וטמא עד הערב וטהר
(256908, -75, 4);200;ר;156858;(3, 11, 33, 46, 156858);41395;(3, 11, 33, 14, 41395);תשברו;4;14;וכל כלי חרש אשר יפל מהם אל תוכו כל אשר בתוכו יטמא ואתו תשברו
(256908, -75, 4);10;י;156933;(3, 11, 35, 18, 156933);41416;(3, 11, 35, 5, 41416);עליו;3;5;וכל אשר יפל מנבלתם עליו יטמא תנור וכירים יתץ טמאים הם וטמאים יהיו לכם
(256908, -75, 4);9;ט;157008;(3, 11, 36, 37, 157008);41435;(3, 11, 36, 10, 41435);יטמא;2;10;אך מעין ובור מקוה מים יהיה טהור ונגע בנבלתם יטמא
(256908, -75, 4);20;כ;157083;(3, 11, 38, 36, 157083);41457;(3, 11, 38, 11, 41457);לכם;2;11;וכי יתן מים על זרע ונפל מנבלתם עליו טמא הוא לכם
(256908, -75, 4);4;ד;157158;(3, 11, 40, 26, 157158);41476;(3, 11, 40, 6, 41476);עד;2;6;והאכל מנבלתה יכבס בגדיו וטמא עד הערב והנשא את נבלתה יכבס בגדיו וטמא עד הערב
(256908, -75, 4);6;ו;157233;(3, 11, 42, 11, 157233);41498;(3, 11, 42, 4, 41498);גחון;3;4;כל הולך על גחון וכל הולך על ארבע עד כל מרבה רגלים לכל השרץ השרץ על הארץ לא תאכלום כי שקץ הם
(256908, -75, 4);40;ם;157308;(3, 11, 43, 16, 157308);41520;(3, 11, 43, 4, 41520);נפשתיכם;7;4;אל תשקצו את נפשתיכם בכל השרץ השרץ ולא תטמאו בהם ונטמתם בם
(256908, -75, 4);30;ל;157383;(3, 11, 44, 45, 157383);41539;(3, 11, 44, 11, 41539);ולא;2;11;כי אני יהוה אלהיכם והתקדשתם והייתם קדשים כי קדוש אני ולא תטמאו את נפשתיכם בכל השרץ הרמש על הארץ
(256908, -75, 4);10;י;157458;(3, 11, 45, 43, 157458);41558;(3, 11, 45, 11, 41558);והייתם;3;11;כי אני יהוה המעלה אתכם מארץ מצרים להית לכם לאלהים והייתם קדשים כי קדוש אני
(256908, -75, 4);4;ד;157533;(3, 11, 47, 4, 157533);41577;(3, 11, 47, 1, 41577);להבדיל;4;1;להבדיל בין הטמא ובין הטהר ובין החיה הנאכלת ובין החיה אשר לא תאכל
(256908, -75, 4);10;י;157608;(3, 12, 2, 9, 157608);41598;(3, 12, 2, 4, 41598);ישראל;1;4;דבר אל בני ישראל לאמר אשה כי תזריע וילדה זכר וטמאה שבעת ימים כימי נדת דותה תטמא
(256908, -75, 4);30;ל;157683;(3, 12, 3, 21, 157683);41616;(3, 12, 3, 5, 41616);ערלתו;3;5;וביום השמיני ימול בשר ערלתו
(256908, -75, 4);5;ה;157758;(3, 12, 5, 7, 157758);41637;(3, 12, 5, 2, 41637);נקבה;4;2;ואם נקבה תלד וטמאה שבעים כנדתה וששים יום וששת ימים תשב על דמי טהרה
(256908, -75, 4);2;ב;157833;(3, 12, 6, 29, 157833);41658;(3, 12, 6, 9, 41658);בן;1;9;ובמלאת ימי טהרה לבן או לבת תביא כבש בן שנתו לעלה ובן יונה או תר לחטאת אל פתח אהל מועד אל הכהן
(256908, -75, 4);200;ר;157908;(3, 12, 7, 32, 157908);41678;(3, 12, 7, 7, 41678);ממקר;4;7;והקריבו לפני יהוה וכפר עליה וטהרה ממקר דמיה זאת תורת הילדת לזכר או לנקבה
(256908, -75, 4);6;ו;157983;(3, 12, 8, 48, 157983);41701;(3, 12, 8, 16, 41701);ואחד;1;16;ואם לא תמצא ידה די שה ולקחה שתי תרים או שני בני יונה אחד לעלה ואחד לחטאת וכפר עליה הכהן וטהרה
(256908, -75, 4);8;ח;158058;(3, 13, 2, 25, 158058);41721;(3, 13, 2, 8, 41721);ספחת;3;8;אדם כי יהיה בעור בשרו שאת או ספחת או בהרת והיה בעור בשרו לנגע צרעת והובא אל אהרן הכהן או אל אחד מבניו הכהנים
(256908, -75, 4);2;ב;158133;(3, 13, 3, 15, 158133);41742;(3, 13, 3, 5, 41742);בעור;1;5;וראה הכהן את הנגע בעור הבשר ושער בנגע הפך לבן ומראה הנגע עמק מעור בשרו נגע צרעת הוא וראהו הכהן וטמא אתו
(256908, -75, 4);30;ל;158208;(3, 13, 4, 8, 158208);41762;(3, 13, 4, 3, 41762);לבנה;1;3;ואם בהרת לבנה הוא בעור בשרו ועמק אין מראה מן העור ושערה לא הפך לבן והסגיר הכהן את הנגע שבעת ימים
(256908, -75, 4);20;כ;158283;(3, 13, 5, 7, 158283);41782;(3, 13, 5, 2, 41782);הכהן;2;2;וראהו הכהן ביום השביעי והנה הנגע עמד בעיניו לא פשה הנגע בעור והסגירו הכהן שבעת ימים שנית
(256908, -75, 4);400;ת;158358;(3, 13, 6, 10, 158358);41800;(3, 13, 6, 3, 41800);אתו;2;3;וראה הכהן אתו ביום השביעי שנית והנה כהה הנגע ולא פשה הנגע בעור וטהרו הכהן מספחת הוא וכבס בגדיו וטהר
(256908, -75, 4);300;ש;158433;(3, 13, 7, 5, 158433);41819;(3, 13, 7, 2, 41819);פשה;2;2;ואם פשה תפשה המספחת בעור אחרי הראתו אל הכהן לטהרתו ונראה שנית אל הכהן
(256908, -75, 4);70;ע;158508;(3, 13, 8, 24, 158508);41837;(3, 13, 8, 6, 41837);בעור;2;6;וראה הכהן והנה פשתה המספחת בעור וטמאו הכהן צרעת הוא
(256908, -75, 4);80;פ;158583;(3, 13, 10, 29, 158583);41857;(3, 13, 10, 8, 41857);הפכה;2;8;וראה הכהן והנה שאת לבנה בעור והיא הפכה שער לבן ומחית בשר חי בשאת
(256908, -75, 4);400;ת;158658;(3, 13, 12, 8, 158658);41878;(3, 13, 12, 3, 41878);תפרח;1;3;ואם פרוח תפרח הצרעת בעור וכסתה הצרעת את כל עור הנגע מראשו ועד רגליו לכל מראה עיני הכהן
(256908, -75, 4);60;ס;158733;(3, 13, 13, 14, 158733);41897;(3, 13, 13, 4, 41897);כסתה;2;4;וראה הכהן והנה כסתה הצרעת את כל בשרו וטהר את הנגע כלו הפך לבן טהור הוא
(256908, -75, 4);300;ש;158808;(3, 13, 15, 13, 158808);41919;(3, 13, 15, 4, 41919);הבשר;3;4;וראה הכהן את הבשר החי וטמאו הבשר החי טמא הוא צרעת הוא
(256908, -75, 4);5;ה;158883;(3, 13, 17, 13, 158883);41940;(3, 13, 17, 3, 41940);והנה;4;3;וראהו הכהן והנה נהפך הנגע ללבן וטהר הכהן את הנגע טהור הוא
(256908, -75, 4);400;ת;158958;(3, 13, 19, 17, 158958);41960;(3, 13, 19, 4, 41960);שאת;3;4;והיה במקום השחין שאת לבנה או בהרת לבנה אדמדמת ונראה אל הכהן
(256908, -75, 4);5;ה;159033;(3, 13, 20, 44, 159033);41980;(3, 13, 20, 12, 41980);הכהן;3;12;וראה הכהן והנה מראה שפל מן העור ושערה הפך לבן וטמאו הכהן נגע צרעת הוא בשחין פרחה
(256908, -75, 4);10;י;159108;(3, 13, 21, 55, 159108);42000;(3, 13, 21, 15, 42000);והסגירו;5;15;ואם יראנה הכהן והנה אין בה שער לבן ושפלה איננה מן העור והיא כהה והסגירו הכהן שבעת ימים
(256908, -75, 4);8;ח;159183;(3, 13, 23, 30, 159183);42020;(3, 13, 23, 8, 42020);השחין;3;8;ואם תחתיה תעמד הבהרת לא פשתה צרבת השחין הוא וטהרו הכהן
(256908, -75, 4);400;ת;159258;(3, 13, 25, 6, 159258);42040;(3, 13, 25, 2, 42040);אתה;2;2;וראה אתה הכהן והנה נהפך שער לבן בבהרת ומראה עמק מן העור צרעת הוא במכוה פרחה וטמא אתו הכהן נגע צרעת הוא
(256908, -75, 4);1;א;159333;(3, 13, 25, 81, 159333);42060;(3, 13, 25, 22, 42060);הוא;3;22;וראה אתה הכהן והנה נהפך שער לבן בבהרת ומראה עמק מן העור צרעת הוא במכוה פרחה וטמא אתו הכהן נגע צרעת הוא
(256908, -75, 4);1;א;159408;(3, 13, 27, 3, 159408);42079;(3, 13, 27, 1, 42079);וראהו;3;1;וראהו הכהן ביום השביעי אם פשה תפשה בעור וטמא הכהן אתו נגע צרעת הוא
(256908, -75, 4);70;ע;159483;(3, 13, 28, 25, 159483);42099;(3, 13, 28, 7, 42099);בעור;2;7;ואם תחתיה תעמד הבהרת לא פשתה בעור והוא כהה שאת המכוה הוא וטהרו הכהן כי צרבת המכוה הוא
(256908, -75, 4);200;ר;159558;(3, 13, 30, 2, 159558);42121;(3, 13, 30, 1, 42121);וראה;2;1;וראה הכהן את הנגע והנה מראהו עמק מן העור ובו שער צהב דק וטמא אתו הכהן נתק הוא צרעת הראש או הזקן הוא
(256908, -75, 4);1;א;159633;(3, 13, 30, 77, 159633);42143;(3, 13, 30, 23, 42143);הוא;3;23;וראה הכהן את הנגע והנה מראהו עמק מן העור ובו שער צהב דק וטמא אתו הכהן נתק הוא צרעת הראש או הזקן הוא
(256908, -75, 4);70;ע;159708;(3, 13, 31, 75, 159708);42165;(3, 13, 31, 22, 42165);שבעת;3;22;וכי יראה הכהן את נגע הנתק והנה אין מראהו עמק מן העור ושער שחר אין בו והסגיר הכהן את נגע הנתק שבעת ימים
(256908, -75, 4);70;ע;159783;(3, 13, 32, 70, 159783);42187;(3, 13, 32, 21, 42187);העור;2;21;וראה הכהן את הנגע ביום השביעי והנה לא פשה הנתק ולא היה בו שער צהב ומראה הנתק אין עמק מן העור
(256908, -75, 4);5;ה;159858;(3, 13, 34, 26, 159858);42206;(3, 13, 34, 7, 42206);והנה;2;7;וראה הכהן את הנתק ביום השביעי והנה לא פשה הנתק בעור ומראהו איננו עמק מן העור וטהר אתו הכהן וכבס בגדיו וטהר
(256908, -75, 4);70;ע;159933;(3, 13, 35, 16, 159933);42226;(3, 13, 35, 5, 42226);בעור;2;5;ואם פשה יפשה הנתק בעור אחרי טהרתו
(256908, -75, 4);100;ק;160008;(3, 13, 37, 16, 160008);42245;(3, 13, 37, 4, 42245);הנתק;4;4;ואם בעיניו עמד הנתק ושער שחר צמח בו נרפא הנתק טהור הוא וטהרו הכהן
(256908, -75, 4);5;ה;160083;(3, 13, 39, 4, 160083);42266;(3, 13, 39, 1, 42266);וראה;4;1;וראה הכהן והנה בעור בשרם בהרת כהות לבנת בהק הוא פרח בעור טהור הוא
(256908, -75, 4);1;א;160158;(3, 13, 40, 27, 160158);42287;(3, 13, 40, 8, 42287);הוא;3;8;ואיש כי ימרט ראשו קרח הוא טהור הוא
(256908, -75, 4);100;ק;160233;(3, 13, 42, 43, 160233);42308;(3, 13, 42, 12, 42308);בקרחתו;2;12;וכי יהיה בקרחת או בגבחת נגע לבן אדמדם צרעת פרחת הוא בקרחתו או בגבחתו
(256908, -75, 4);10;י;160308;(3, 13, 44, 2, 160308);42326;(3, 13, 44, 1, 42326);איש;2;1;איש צרוע הוא טמא הוא טמא יטמאנו הכהן בראשו נגעו
(256908, -75, 4);80;פ;160383;(3, 13, 45, 39, 160383);42345;(3, 13, 45, 10, 42345);פרוע;1;10;והצרוע אשר בו הנגע בגדיו יהיו פרמים וראשו יהיה פרוע ועל שפם יעטה וטמא טמא יקרא
(256908, -75, 4);10;י;160458;(3, 13, 47, 7, 160458);42366;(3, 13, 47, 2, 42366);כי;2;2;והבגד כי יהיה בו נגע צרעת בבגד צמר או בבגד פשתים
(256908, -75, 4);5;ה;160533;(3, 13, 49, 2, 160533);42388;(3, 13, 49, 1, 42388);והיה;2;1;והיה הנגע ירקרק או אדמדם בבגד או בעור או בשתי או בערב או בכל כלי עור נגע צרעת הוא והראה את הכהן
(256908, -75, 4);1;א;160608;(3, 13, 50, 3, 160608);42410;(3, 13, 50, 1, 42410);וראה;3;1;וראה הכהן את הנגע והסגיר את הנגע שבעת ימים
(256908, -75, 4);200;ר;160683;(3, 13, 51, 44, 160683);42431;(3, 13, 51, 13, 42431);בערב;3;13;וראה את הנגע ביום השביעי כי פשה הנגע בבגד או בשתי או בערב או בעור לכל אשר יעשה העור למלאכה צרעת ממארת הנגע טמא הוא
(256908, -75, 4);40;מ;160758;(3, 13, 52, 29, 160758);42453;(3, 13, 52, 10, 42453);בצמר;3;10;ושרף את הבגד או את השתי או את הערב בצמר או בפשתים או את כל כלי העור אשר יהיה בו הנגע כי צרעת ממארת הוא באש תשרף
(256908, -75, 4);300;ש;160833;(3, 13, 53, 19, 160833);42476;(3, 13, 53, 6, 42476);פשה;2;6;ואם יראה הכהן והנה לא פשה הנגע בבגד או בשתי או בערב או בכל כלי עור
(256908, -75, 4);400;ת;160908;(3, 13, 54, 43, 160908);42497;(3, 13, 54, 11, 42497);שנית;4;11;וצוה הכהן וכבסו את אשר בו הנגע והסגירו שבעת ימים שנית
(256908, -75, 4);100;ק;160983;(3, 13, 55, 75, 160983);42519;(3, 13, 55, 22, 42519);בקרחתו;2;22;וראה הכהן אחרי הכבס את הנגע והנה לא הפך הנגע את עינו והנגע לא פשה טמא הוא באש תשרפנו פחתת הוא בקרחתו או בגבחתו
(256908, -75, 4);6;ו;161058;(3, 13, 56, 63, 161058);42541;(3, 13, 56, 20, 42541);או;2;20;ואם ראה הכהן והנה כהה הנגע אחרי הכבס אתו וקרע אתו מן הבגד או מן העור או מן השתי או מן הערב
(256908, -75, 4);4;ד;161133;(3, 13, 58, 5, 161133);42564;(3, 13, 58, 1, 42564);והבגד;5;1;והבגד או השתי או הערב או כל כלי העור אשר תכבס וסר מהם הנגע וכבס שנית וטהר
(256908, -75, 4);6;ו;161208;(3, 13, 59, 23, 161208);42587;(3, 13, 59, 7, 42587);או;2;7;זאת תורת נגע צרעת בגד הצמר או הפשתים או השתי או הערב או כל כלי עור לטהרו או לטמאו
(256908, -75, 4);2;ב;161283;(3, 14, 2, 17, 161283);42609;(3, 14, 2, 5, 42609);ביום;1;5;זאת תהיה תורת המצרע ביום טהרתו והובא אל הכהן
(256908, -75, 4);20;כ;161358;(3, 14, 4, 6, 161358);42628;(3, 14, 4, 2, 42628);הכהן;2;2;וצוה הכהן ולקח למטהר שתי צפרים חיות טהרות ועץ ארז ושני תולעת ואזב
(256908, -75, 4);10;י;161433;(3, 14, 5, 28, 161433);42647;(3, 14, 5, 8, 42647);כלי;3;8;וצוה הכהן ושחט את הצפור האחת אל כלי חרש על מים חיים
(256908, -75, 4);5;ה;161508;(3, 14, 6, 63, 161508);42669;(3, 14, 6, 18, 42669);החיה;4;18;את הצפר החיה יקח אתה ואת עץ הארז ואת שני התולעת ואת האזב וטבל אותם ואת הצפר החיה בדם הצפר השחטה על המים החיים
(256908, -75, 4);300;ש;161583;(3, 14, 7, 52, 161583);42690;(3, 14, 7, 15, 42690);השדה;2;15;והזה על המטהר מן הצרעת שבע פעמים וטהרו ושלח את הצפר החיה על פני השדה
(256908, -75, 4);10;י;161658;(3, 14, 8, 73, 161658);42710;(3, 14, 8, 20, 42710);ימים;1;20;וכבס המטהר את בגדיו וגלח את כל שערו ורחץ במים וטהר ואחר יבוא אל המחנה וישב מחוץ לאהלו שבעת ימים
(256908, -75, 4);4;ד;161733;(3, 14, 9, 72, 161733);42731;(3, 14, 9, 21, 42731);בגדיו;3;21;והיה ביום השביעי יגלח את כל שערו את ראשו ואת זקנו ואת גבת עיניו ואת כל שערו יגלח וכבס את בגדיו ורחץ את בשרו במים וטהר
(256908, -75, 4);50;נ;161808;(3, 14, 10, 55, 161808);42749;(3, 14, 10, 13, 42749);עשרנים;4;13;וביום השמיני יקח שני כבשים תמימם וכבשה אחת בת שנתה תמימה ושלשה עשרנים סלת מנחה בלולה בשמן ולג אחד שמן
(256908, -75, 4);4;ד;161883;(3, 14, 11, 48, 161883);42768;(3, 14, 11, 12, 42768);מועד;4;12;והעמיד הכהן המטהר את האיש המטהר ואתם לפני יהוה פתח אהל מועד
(256908, -75, 4);6;ו;161958;(3, 14, 13, 14, 161958);42788;(3, 14, 13, 4, 42788);במקום;4;4;ושחט את הכבש במקום אשר ישחט את החטאת ואת העלה במקום הקדש כי כחטאת האשם הוא לכהן קדש קדשים הוא
(256908, -75, 4);40;ם;162033;(3, 14, 14, 15, 162033);42808;(3, 14, 14, 4, 42808);האשם;4;4;ולקח הכהן מדם האשם ונתן הכהן על תנוך אזן המטהר הימנית ועל בהן ידו הימנית ועל בהן רגלו הימנית
(256908, -75, 4);6;ו;162108;(3, 14, 15, 16, 162108);42828;(3, 14, 15, 5, 42828);ויצק;1;5;ולקח הכהן מלג השמן ויצק על כף הכהן השמאלית
(256908, -75, 4);70;ע;162183;(3, 14, 16, 57, 162183);42847;(3, 14, 16, 15, 42847);באצבעו;5;15;וטבל הכהן את אצבעו הימנית מן השמן אשר על כפו השמאלית והזה מן השמן באצבעו שבע פעמים לפני יהוה
(256908, -75, 4);10;י;162258;(3, 14, 17, 58, 162258);42867;(3, 14, 17, 16, 42867);הימנית;5;16;ומיתר השמן אשר על כפו יתן הכהן על תנוך אזן המטהר הימנית ועל בהן ידו הימנית ועל בהן רגלו הימנית על דם האשם
(256908, -75, 4);10;י;162333;(3, 14, 18, 50, 162333);42888;(3, 14, 18, 14, 42888);לפני;4;14;והנותר בשמן אשר על כף הכהן יתן על ראש המטהר וכפר עליו הכהן לפני יהוה
(256908, -75, 4);40;מ;162408;(3, 14, 20, 25, 162408);42908;(3, 14, 20, 7, 42908);המזבחה;2;7;והעלה הכהן את העלה ואת המנחה המזבחה וכפר עליו הכהן וטהר
(256908, -75, 4);400;ת;162483;(3, 14, 21, 55, 162483);42927;(3, 14, 21, 15, 42927);סלת;3;15;ואם דל הוא ואין ידו משגת ולקח כבש אחד אשם לתנופה לכפר עליו ועשרון סלת אחד בלול בשמן למנחה ולג שמן
(256908, -75, 4);10;י;162558;(3, 14, 23, 4, 162558);42948;(3, 14, 23, 1, 42948);והביא;4;1;והביא אתם ביום השמיני לטהרתו אל הכהן אל פתח אהל מועד לפני יהוה
(256908, -75, 4);50;נ;162633;(3, 14, 24, 29, 162633);42969;(3, 14, 24, 9, 42969);והניף;3;9;ולקח הכהן את כבש האשם ואת לג השמן והניף אתם הכהן תנופה לפני יהוה
(256908, -75, 4);6;ו;162708;(3, 14, 25, 53, 162708);42989;(3, 14, 25, 15, 42989);ועל;1;15;ושחט את כבש האשם ולקח הכהן מדם האשם ונתן על תנוך אזן המטהר הימנית ועל בהן ידו הימנית ועל בהן רגלו הימנית
(256908, -75, 4);10;י;162783;(3, 14, 27, 16, 162783);43008;(3, 14, 27, 4, 43008);הימנית;2;4;והזה הכהן באצבעו הימנית מן השמן אשר על כפו השמאלית שבע פעמים לפני יהוה
(256908, -75, 4);9;ט;162858;(3, 14, 28, 34, 162858);43029;(3, 14, 28, 11, 43029);המטהר;3;11;ונתן הכהן מן השמן אשר על כפו על תנוך אזן המטהר הימנית ועל בהן ידו הימנית ועל בהן רגלו הימנית על מקום דם האשם
(256908, -75, 4);10;י;162933;(3, 14, 29, 24, 162933);43050;(3, 14, 29, 8, 43050);יתן;1;8;והנותר מן השמן אשר על כף הכהן יתן על ראש המטהר לכפר עליו לפני יהוה
(256908, -75, 4);300;ש;163008;(3, 14, 31, 7, 163008);43072;(3, 14, 31, 3, 43072);תשיג;2;3;את אשר תשיג ידו את האחד חטאת ואת האחד עלה על המנחה וכפר הכהן על המטהר לפני יהוה
(256908, -75, 4);1;א;163083;(3, 14, 32, 20, 163083);43094;(3, 14, 32, 7, 43094);אשר;1;7;זאת תורת אשר בו נגע צרעת אשר לא תשיג ידו בטהרתו
(256908, -75, 4);6;ו;163158;(3, 14, 34, 33, 163158);43116;(3, 14, 34, 11, 43116);ונתתי;1;11;כי תבאו אל ארץ כנען אשר אני נתן לכם לאחזה ונתתי נגע צרעת בבית ארץ אחזתכם
(256908, -75, 4);6;ו;163233;(3, 14, 36, 12, 163233);43135;(3, 14, 36, 3, 43135);ופנו;4;3;וצוה הכהן ופנו את הבית בטרם יבא הכהן לראות את הנגע ולא יטמא כל אשר בבית ואחר כן יבא הכהן לראות את הבית
(256908, -75, 4);5;ה;163308;(3, 14, 37, 7, 163308);43158;(3, 14, 37, 3, 43158);הנגע;1;3;וראה את הנגע והנה הנגע בקירת הבית שקערורת ירקרקת או אדמדמת ומראיהן שפל מן הקיר
(256908, -75, 4);400;ת;163383;(3, 14, 38, 18, 163383);43176;(3, 14, 38, 6, 43176);פתח;2;6;ויצא הכהן מן הבית אל פתח הבית והסגיר את הבית שבעת ימים
(256908, -75, 4);6;ו;163458;(3, 14, 40, 9, 163458);43195;(3, 14, 40, 3, 43195);וחלצו;1;3;וצוה הכהן וחלצו את האבנים אשר בהן הנגע והשליכו אתהן אל מחוץ לעיר אל מקום טמא
(256908, -75, 4);20;כ;163533;(3, 14, 41, 23, 163533);43214;(3, 14, 41, 6, 43214);ושפכו;4;6;ואת הבית יקצע מבית סביב ושפכו את העפר אשר הקצו אל מחוץ לעיר אל מקום טמא
