(301653, 56, 4);10;י;225605;(4, 22, 6, 68, 225605);59491;(4, 22, 6, 21, 59491);ידעתי;5;21;ועתה לכה נא ארה לי את העם הזה כי עצום הוא ממני אולי אוכל נכה בו ואגרשנו מן הארץ כי ידעתי את אשר תברך מברך ואשר תאר יואר
(301653, 56, 4);40;ם;225661;(4, 22, 7, 32, 225661);59505;(4, 22, 7, 7, 59505);בידם;4;7;וילכו זקני מואב וזקני מדין וקסמים בידם ויבאו אל בלעם וידברו אליו דברי בלק
(301653, 56, 4);1;א;225717;(4, 22, 8, 28, 225717);59519;(4, 22, 8, 7, 59519);אתכם;1;7;ויאמר אליהם לינו פה הלילה והשבתי אתכם דבר כאשר ידבר יהוה אלי וישבו שרי מואב עם בלעם
(301653, 56, 4);10;י;225773;(4, 22, 9, 17, 225773);59534;(4, 22, 9, 5, 59534);ויאמר;2;5;ויבא אלהים אל בלעם ויאמר מי האנשים האלה עמך
(301653, 56, 4);10;י;225829;(4, 22, 10, 38, 225829);59549;(4, 22, 10, 11, 59549);אלי;3;11;ויאמר בלעם אל האלהים בלק בן צפר מלך מואב שלח אלי
(301653, 56, 4);40;ם;225885;(4, 22, 11, 56, 225885);59565;(4, 22, 11, 16, 59565);להלחם;5;16;הנה העם היצא ממצרים ויכס את עין הארץ עתה לכה קבה לי אתו אולי אוכל להלחם בו וגרשתיו
(301653, 56, 4);100;ק;225941;(4, 22, 13, 3, 225941);59582;(4, 22, 13, 1, 59582);ויקם;3;1;ויקם בלעם בבקר ויאמר אל שרי בלק לכו אל ארצכם כי מאן יהוה לתתי להלך עמכם
(301653, 56, 4);100;ק;225997;(4, 22, 14, 3, 225997);59598;(4, 22, 14, 1, 59598);ויקומו;3;1;ויקומו שרי מואב ויבאו אל בלק ויאמרו מאן בלעם הלך עמנו
(301653, 56, 4);10;י;226053;(4, 22, 15, 16, 226053);59613;(4, 22, 15, 5, 59613);שרים;3;5;ויסף עוד בלק שלח שרים רבים ונכבדים מאלה
(301653, 56, 4);50;נ;226109;(4, 22, 16, 40, 226109);59629;(4, 22, 16, 13, 59629);תמנע;3;13;ויבאו אל בלעם ויאמרו לו כה אמר בלק בן צפור אל נא תמנע מהלך אלי
(301653, 56, 4);7;ז;226165;(4, 22, 17, 48, 226165);59647;(4, 22, 17, 16, 59647);הזה;2;16;כי כבד אכבדך מאד וכל אשר תאמר אלי אעשה ולכה נא קבה לי את העם הזה
(301653, 56, 4);2;ב;226221;(4, 22, 18, 55, 226221);59664;(4, 22, 18, 17, 59664);לעבר;3;17;ויען בלעם ויאמר אל עבדי בלק אם יתן לי בלק מלא ביתו כסף וזהב לא אוכל לעבר את פי יהוה אלהי לעשות קטנה או גדולה
(301653, 56, 4);5;ה;226277;(4, 22, 19, 27, 226277);59680;(4, 22, 19, 8, 59680);ואדעה;5;8;ועתה שבו נא בזה גם אתם הלילה ואדעה מה יסף יהוה דבר עמי
(301653, 56, 4);300;ש;226333;(4, 22, 20, 41, 226333);59697;(4, 22, 20, 12, 59697);האנשים;4;12;ויבא אלהים אל בלעם לילה ויאמר לו אם לקרא לך באו האנשים קום לך אתם ואך את הדבר אשר אדבר אליך אתו תעשה
(301653, 56, 4);400;ת;226389;(4, 22, 21, 19, 226389);59713;(4, 22, 21, 5, 59713);את;2;5;ויקם בלעם בבקר ויחבש את אתנו וילך עם שרי מואב
(301653, 56, 4);30;ל;226445;(4, 22, 22, 39, 226445);59729;(4, 22, 22, 11, 59729);לשטן;1;11;ויחר אף אלהים כי הולך הוא ויתיצב מלאך יהוה בדרך לשטן לו והוא רכב על אתנו ושני נעריו עמו
(301653, 56, 4);20;ך;226501;(4, 22, 23, 26, 226501);59744;(4, 22, 23, 7, 59744);בדרך;4;7;ותרא האתון את מלאך יהוה נצב בדרך וחרבו שלופה בידו ותט האתון מן הדרך ותלך בשדה ויך בלעם את האתון להטתה הדרך
(301653, 56, 4);5;ה;226557;(4, 22, 23, 82, 226557);59759;(4, 22, 23, 22, 59759);הדרך;1;22;ותרא האתון את מלאך יהוה נצב בדרך וחרבו שלופה בידו ותט האתון מן הדרך ותלך בשדה ויך בלעם את האתון להטתה הדרך
(301653, 56, 4);20;ך;226613;(4, 22, 25, 15, 226613);59772;(4, 22, 25, 4, 59772);מלאך;4;4;ותרא האתון את מלאך יהוה ותלחץ אל הקיר ותלחץ את רגל בלעם אל הקיר ויסף להכתה
(301653, 56, 4);6;ו;226669;(4, 22, 26, 12, 226669);59787;(4, 22, 26, 3, 59787);יהוה;3;3;ויוסף מלאך יהוה עבור ויעמד במקום צר אשר אין דרך לנטות ימין ושמאול
(301653, 56, 4);20;ך;226725;(4, 22, 27, 15, 226725);59801;(4, 22, 27, 4, 59801);מלאך;4;4;ותרא האתון את מלאך יהוה ותרבץ תחת בלעם ויחר אף בלעם ויך את האתון במקל
(301653, 56, 4);400;ת;226781;(4, 22, 28, 16, 226781);59817;(4, 22, 28, 5, 59817);האתון;3;5;ויפתח יהוה את פי האתון ותאמר לבלעם מה עשיתי לך כי הכיתני זה שלש רגלים
(301653, 56, 4);5;ה;226837;(4, 22, 29, 17, 226837);59832;(4, 22, 29, 5, 59832);התעללת;1;5;ויאמר בלעם לאתון כי התעללת בי לו יש חרב בידי כי עתה הרגתיך
(301653, 56, 4);50;נ;226893;(4, 22, 30, 27, 226893);59847;(4, 22, 30, 7, 59847);אתנך;3;7;ותאמר האתון אל בלעם הלוא אנכי אתנך אשר רכבת עלי מעודך עד היום הזה ההסכן הסכנתי לעשות לך כה ויאמר לא
(301653, 56, 4);30;ל;226949;(4, 22, 31, 4, 226949);59862;(4, 22, 31, 1, 59862);ויגל;4;1;ויגל יהוה את עיני בלעם וירא את מלאך יהוה נצב בדרך וחרבו שלפה בידו ויקד וישתחו לאפיו
(301653, 56, 4);400;ת;227005;(4, 22, 31, 60, 227005);59877;(4, 22, 31, 16, 59877);וישתחו;4;16;ויגל יהוה את עיני בלעם וירא את מלאך יהוה נצב בדרך וחרבו שלפה בידו ויקד וישתחו לאפיו
(301653, 56, 4);10;י;227061;(4, 22, 32, 49, 227061);59892;(4, 22, 32, 14, 59892);אנכי;4;14;ויאמר אליו מלאך יהוה על מה הכית את אתנך זה שלוש רגלים הנה אנכי יצאתי לשטן כי ירט הדרך לנגדי
(301653, 56, 4);50;נ;227117;(4, 22, 33, 33, 227117);59907;(4, 22, 33, 9, 59907);נטתה;1;9;ותראני האתון ותט לפני זה שלש רגלים אולי נטתה מפני כי עתה גם אתכה הרגתי ואותה החייתי
(301653, 56, 4);1;א;227173;(4, 22, 34, 22, 227173);59921;(4, 22, 34, 6, 59921);חטאתי;3;6;ויאמר בלעם אל מלאך יהוה חטאתי כי לא ידעתי כי אתה נצב לקראתי בדרך ועתה אם רע בעיניך אשובה לי
(301653, 56, 4);40;מ;227229;(4, 22, 35, 6, 227229);59937;(4, 22, 35, 2, 59937);מלאך;1;2;ויאמר מלאך יהוה אל בלעם לך עם האנשים ואפס את הדבר אשר אדבר אליך אתו תדבר וילך בלעם עם שרי בלק
(301653, 56, 4);2;ב;227285;(4, 22, 35, 62, 227285);59953;(4, 22, 35, 18, 59953);בלעם;1;18;ויאמר מלאך יהוה אל בלעם לך עם האנשים ואפס את הדבר אשר אדבר אליך אתו תדבר וילך בלעם עם שרי בלק
(301653, 56, 4);1;א;227341;(4, 22, 36, 45, 227341);59970;(4, 22, 36, 14, 59970);ארנן;1;14;וישמע בלק כי בא בלעם ויצא לקראתו אל עיר מואב אשר על גבול ארנן אשר בקצה הגבול
(301653, 56, 4);5;ה;227397;(4, 22, 37, 41, 227397);59986;(4, 22, 37, 13, 59986);הלכת;1;13;ויאמר בלק אל בלעם הלא שלח שלחתי אליך לקרא לך למה לא הלכת אלי האמנם לא אוכל כבדך
(301653, 56, 4);20;כ;227453;(4, 22, 38, 35, 227453);60001;(4, 22, 38, 10, 60001);אוכל;3;10;ויאמר בלעם אל בלק הנה באתי אליך עתה היכל אוכל דבר מאומה הדבר אשר ישים אלהים בפי אתו אדבר
(301653, 56, 4);10;י;227509;(4, 22, 39, 21, 227509);60016;(4, 22, 39, 6, 60016);קרית;3;6;וילך בלעם עם בלק ויבאו קרית חצות
(301653, 56, 4);30;ל;227565;(4, 22, 41, 14, 227565);60030;(4, 22, 41, 4, 60030);בלק;2;4;ויהי בבקר ויקח בלק את בלעם ויעלהו במות בעל וירא משם קצה העם
(301653, 56, 4);300;ש;227621;(4, 23, 1, 23, 227621);60047;(4, 23, 1, 8, 60047);שבעה;1;8;ויאמר בלעם אל בלק בנה לי בזה שבעה מזבחת והכן לי בזה שבעה פרים ושבעה אילים
(301653, 56, 4);70;ע;227677;(4, 23, 2, 21, 227677);60061;(4, 23, 2, 6, 60061);ויעל;3;6;ויעש בלק כאשר דבר בלעם ויעל בלק ובלעם פר ואיל במזבח
(301653, 56, 4);200;ר;227733;(4, 23, 3, 36, 227733);60075;(4, 23, 3, 9, 60075);יקרה;3;9;ויאמר בלעם לבלק התיצב על עלתך ואלכה אולי יקרה יהוה לקראתי ודבר מה יראני והגדתי לך וילך שפי
(301653, 56, 4);40;מ;227789;(4, 23, 4, 19, 227789);60089;(4, 23, 4, 5, 60089);ויאמר;4;5;ויקר אלהים אל בלעם ויאמר אליו את שבעת המזבחת ערכתי ואעל פר ואיל במזבח
(301653, 56, 4);6;ו;227845;(4, 23, 5, 19, 227845);60104;(4, 23, 5, 6, 60104);ויאמר;1;6;וישם יהוה דבר בפי בלעם ויאמר שוב אל בלק וכה תדבר
(301653, 56, 4);300;ש;227901;(4, 23, 7, 3, 227901);60120;(4, 23, 7, 1, 60120);וישא;3;1;וישא משלו ויאמר מן ארם ינחני בלק מלך מואב מהררי קדם לכה ארה לי יעקב ולכה זעמה ישראל
(301653, 56, 4);70;ע;227957;(4, 23, 7, 59, 227957);60136;(4, 23, 7, 17, 60136);זעמה;2;17;וישא משלו ויאמר מן ארם ינחני בלק מלך מואב מהררי קדם לכה ארה לי יעקב ולכה זעמה ישראל
(301653, 56, 4);6;ו;228013;(4, 23, 9, 21, 228013);60152;(4, 23, 9, 5, 60152);ומגבעות;6;5;כי מראש צרים אראנו ומגבעות אשורנו הן עם לבדד ישכן ובגוים לא יתחשב
(301653, 56, 4);300;ש;228069;(4, 23, 10, 24, 228069);60168;(4, 23, 10, 8, 60168);ישראל;2;8;מי מנה עפר יעקב ומספר את רבע ישראל תמת נפשי מות ישרים ותהי אחריתי כמהו
(301653, 56, 4);100;ק;228125;(4, 23, 11, 24, 228125);60183;(4, 23, 11, 8, 60183);לקב;2;8;ויאמר בלק אל בלעם מה עשית לי לקב איבי לקחתיך והנה ברכת ברך
(301653, 56, 4);40;מ;228181;(4, 23, 12, 34, 228181);60198;(4, 23, 12, 10, 60198);אשמר;3;10;ויען ויאמר הלא את אשר ישים יהוה בפי אתו אשמר לדבר
(301653, 56, 4);6;ו;228237;(4, 23, 13, 51, 228237);60215;(4, 23, 13, 16, 60215);וכלו;1;16;ויאמר אליו בלק לך נא אתי אל מקום אחר אשר תראנו משם אפס קצהו תראה וכלו לא תראה וקבנו לי משם
(301653, 56, 4);6;ו;228293;(4, 23, 14, 37, 228293);60230;(4, 23, 14, 10, 60230);ויעל;1;10;ויקחהו שדה צפים אל ראש הפסגה ויבן שבעה מזבחת ויעל פר ואיל במזבח
(301653, 56, 4);5;ה;228349;(4, 23, 16, 8, 228349);60245;(4, 23, 16, 2, 60245);יהוה;4;2;ויקר יהוה אל בלעם וישם דבר בפיו ויאמר שוב אל בלק וכה תדבר
(301653, 56, 4);30;ל;228405;(4, 23, 17, 19, 228405);60262;(4, 23, 17, 6, 60262);עלתו;2;6;ויבא אליו והנו נצב על עלתו ושרי מואב אתו ויאמר לו בלק מה דבר יהוה
(301653, 56, 4);5;ה;228461;(4, 23, 18, 24, 228461);60278;(4, 23, 18, 7, 60278);האזינה;1;7;וישא משלו ויאמר קום בלק ושמע האזינה עדי בנו צפר
(301653, 56, 4);200;ר;228517;(4, 23, 19, 42, 228517);60293;(4, 23, 19, 12, 60293);ודבר;4;12;לא איש אל ויכזב ובן אדם ויתנחם ההוא אמר ולא יעשה ודבר ולא יקימנה
(301653, 56, 4);30;ל;228573;(4, 23, 21, 23, 228573);60308;(4, 23, 21, 7, 60308);עמל;3;7;לא הביט און ביעקב ולא ראה עמל בישראל יהוה אלהיו עמו ותרועת מלך בו
(301653, 56, 4);10;י;228629;(4, 23, 23, 2, 228629);60322;(4, 23, 23, 1, 60322);כי;2;1;כי לא נחש ביעקב ולא קסם בישראל כעת יאמר ליעקב ולישראל מה פעל אל
(301653, 56, 4);10;י;228685;(4, 23, 24, 8, 228685);60338;(4, 23, 24, 3, 60338);כלביא;4;3;הן עם כלביא יקום וכארי יתנשא לא ישכב עד יאכל טרף ודם חללים ישתה
(301653, 56, 4);40;ם;228741;(4, 23, 25, 14, 228741);60353;(4, 23, 25, 4, 60353);בלעם;4;4;ויאמר בלק אל בלעם גם קב לא תקבנו גם ברך לא תברכנו
(301653, 56, 4);1;א;228797;(4, 23, 26, 32, 228797);60370;(4, 23, 26, 9, 60370);לאמר;2;9;ויען בלעם ויאמר אל בלק הלא דברתי אליך לאמר כל אשר ידבר יהוה אתו אעשה
(301653, 56, 4);6;ו;228853;(4, 23, 27, 34, 228853);60387;(4, 23, 27, 11, 60387);אולי;2;11;ויאמר בלק אל בלעם לכה נא אקחך אל מקום אחר אולי יישר בעיני האלהים וקבתו לי משם
(301653, 56, 4);80;פ;228909;(4, 23, 28, 29, 228909);60402;(4, 23, 28, 9, 60402);פני;1;9;ויקח בלק את בלעם ראש הפעור הנשקף על פני הישימן
(301653, 56, 4);40;ם;228965;(4, 23, 29, 48, 228965);60417;(4, 23, 29, 14, 60417);פרים;4;14;ויאמר בלעם אל בלק בנה לי בזה שבעה מזבחת והכן לי בזה שבעה פרים ושבעה אילם
(301653, 56, 4);2;ב;229021;(4, 24, 1, 14, 229021);60433;(4, 24, 1, 5, 60433);בעיני;1;5;וירא בלעם כי טוב בעיני יהוה לברך את ישראל ולא הלך כפעם בפעם לקראת נחשים וישת אל המדבר פניו
(301653, 56, 4);50;נ;229077;(4, 24, 1, 70, 229077);60447;(4, 24, 1, 19, 60447);פניו;2;19;וירא בלעם כי טוב בעיני יהוה לברך את ישראל ולא הלך כפעם בפעם לקראת נחשים וישת אל המדבר פניו
(301653, 56, 4);300;ש;229133;(4, 24, 3, 3, 229133);60461;(4, 24, 3, 1, 60461);וישא;3;1;וישא משלו ויאמר נאם בלעם בנו בער ונאם הגבר שתם העין
(301653, 56, 4);7;ז;229189;(4, 24, 4, 18, 229189);60477;(4, 24, 4, 6, 60477);מחזה;3;6;נאם שמע אמרי אל אשר מחזה שדי יחזה נפל וגלוי עינים
(301653, 56, 4);10;י;229245;(4, 24, 6, 9, 229245);60490;(4, 24, 6, 2, 60490);נטיו;3;2;כנחלים נטיו כגנת עלי נהר כאהלים נטע יהוה כארזים עלי מים
(301653, 56, 4);40;ם;229301;(4, 24, 7, 20, 229301);60504;(4, 24, 7, 5, 60504);במים;4;5;יזל מים מדליו וזרעו במים רבים וירם מאגג מלכו ותנשא מלכתו
(301653, 56, 4);3;ג;229357;(4, 24, 8, 30, 229357);60518;(4, 24, 8, 8, 60518);גוים;1;8;אל מוציאו ממצרים כתועפת ראם לו יאכל גוים צריו ועצמתיהם יגרם וחציו ימחץ
(301653, 56, 4);20;כ;229413;(4, 24, 9, 28, 229413);60530;(4, 24, 9, 7, 60530);מברכיך;4;7;כרע שכב כארי וכלביא מי יקימנו מברכיך ברוך וארריך ארור
(301653, 56, 4);40;ם;229469;(4, 24, 10, 40, 229469);60545;(4, 24, 10, 12, 60545);בלעם;4;12;ויחר אף בלק אל בלעם ויספק את כפיו ויאמר בלק אל בלעם לקב איבי קראתיך והנה ברכת ברך זה שלש פעמים
(301653, 56, 4);20;כ;229525;(4, 24, 11, 22, 229525);60561;(4, 24, 11, 7, 60561);כבד;1;7;ועתה ברח לך אל מקומך אמרתי כבד אכבדך והנה מנעך יהוה מכבוד
(301653, 56, 4);30;ל;229581;(4, 24, 12, 32, 229581);60576;(4, 24, 12, 10, 60576);שלחת;2;10;ויאמר בלעם אל בלק הלא גם אל מלאכיך אשר שלחת אלי דברתי לאמר
(301653, 56, 4);5;ה;229637;(4, 24, 13, 42, 229637);60593;(4, 24, 13, 14, 60593);יהוה;4;14;אם יתן לי בלק מלא ביתו כסף וזהב לא אוכל לעבר את פי יהוה לעשות טובה או רעה מלבי אשר ידבר יהוה אתו אדבר
(301653, 56, 4);1;א;229693;(4, 24, 14, 20, 229693);60609;(4, 24, 14, 6, 60609);איעצך;1;6;ועתה הנני הולך לעמי לכה איעצך אשר יעשה העם הזה לעמך באחרית הימים
(301653, 56, 4);2;ב;229749;(4, 24, 15, 24, 229749);60623;(4, 24, 15, 7, 60623);בער;1;7;וישא משלו ויאמר נאם בלעם בנו בער ונאם הגבר שתם העין
(301653, 56, 4);6;ו;229805;(4, 24, 16, 39, 229805);60639;(4, 24, 16, 12, 60639);וגלוי;1;12;נאם שמע אמרי אל וידע דעת עליון מחזה שדי יחזה נפל וגלוי עינים
(301653, 56, 4);1;א;229861;(4, 24, 17, 47, 229861);60652;(4, 24, 17, 12, 60652);מישראל;5;12;אראנו ולא עתה אשורנו ולא קרוב דרך כוכב מיעקב וקם שבט מישראל ומחץ פאתי מואב וקרקר כל בני שת
(301653, 56, 4);10;י;229917;(4, 24, 18, 31, 229917);60667;(4, 24, 18, 8, 60667);וישראל;2;8;והיה אדום ירשה והיה ירשה שעיר איביו וישראל עשה חיל
(301653, 56, 4);200;ר;229973;(4, 24, 20, 23, 229973);60680;(4, 24, 20, 6, 60680);ויאמר;5;6;וירא את עמלק וישא משלו ויאמר ראשית גוים עמלק ואחריתו עדי אבד
(301653, 56, 4);6;ו;230029;(4, 24, 21, 30, 230029);60694;(4, 24, 21, 8, 60694);מושבך;2;8;וירא את הקיני וישא משלו ויאמר איתן מושבך ושים בסלע קנך
(301653, 56, 4);6;ו;230085;(4, 24, 23, 15, 230085);60710;(4, 24, 23, 4, 60710);אוי;2;4;וישא משלו ויאמר אוי מי יחיה משמו אל
(301653, 56, 4);2;ב;230141;(4, 24, 25, 5, 230141);60727;(4, 24, 25, 2, 60727);בלעם;1;2;ויקם בלעם וילך וישב למקמו וגם בלק הלך לדרכו
(301653, 56, 4);400;ת;230197;(4, 25, 1, 26, 230197);60740;(4, 25, 1, 6, 60740);לזנות;5;6;וישב ישראל בשטים ויחל העם לזנות אל בנות מואב
(301653, 56, 4);40;מ;230253;(4, 25, 3, 4, 230253);60752;(4, 25, 3, 1, 60752);ויצמד;4;1;ויצמד ישראל לבעל פעור ויחר אף יהוה בישראל
(301653, 56, 4);70;ע;230309;(4, 25, 4, 26, 230309);60768;(4, 25, 4, 9, 60768);העם;2;9;ויאמר יהוה אל משה קח את כל ראשי העם והוקע אותם ליהוה נגד השמש וישב חרון אף יהוה מישראל
(301653, 56, 4);10;י;230365;(4, 25, 5, 14, 230365);60782;(4, 25, 5, 4, 60782);שפטי;4;4;ויאמר משה אל שפטי ישראל הרגו איש אנשיו הנצמדים לבעל פעור
(301653, 56, 4);1;א;230421;(4, 25, 6, 24, 230421);60796;(4, 25, 6, 7, 60796);אל;1;7;והנה איש מבני ישראל בא ויקרב אל אחיו את המדינית לעיני משה ולעיני כל עדת בני ישראל והמה בכים פתח אהל מועד
(301653, 56, 4);40;מ;230477;(4, 25, 6, 80, 230477);60811;(4, 25, 6, 22, 60811);מועד;1;22;והנה איש מבני ישראל בא ויקרב אל אחיו את המדינית לעיני משה ולעיני כל עדת בני ישראל והמה בכים פתח אהל מועד
(301653, 56, 4);1;א;230533;(4, 25, 8, 4, 230533);60825;(4, 25, 8, 1, 60825);ויבא;4;1;ויבא אחר איש ישראל אל הקבה וידקר את שניהם את איש ישראל ואת האשה אל קבתה ותעצר המגפה מעל בני ישראל
(301653, 56, 4);90;צ;230589;(4, 25, 8, 60, 230589);60841;(4, 25, 8, 17, 60841);ותעצר;4;17;ויבא אחר איש ישראל אל הקבה וידקר את שניהם את איש ישראל ואת האשה אל קבתה ותעצר המגפה מעל בני ישראל
(301653, 56, 4);1;א;230645;(4, 25, 10, 10, 230645);60854;(4, 25, 10, 3, 60854);אל;1;3;וידבר יהוה אל משה לאמר
(301653, 56, 4);6;ו;230701;(4, 25, 11, 48, 230701);60869;(4, 25, 11, 13, 60869);בקנאו;5;13;פינחס בן אלעזר בן אהרן הכהן השיב את חמתי מעל בני ישראל בקנאו את קנאתי בתוכם ולא כליתי את בני ישראל בקנאתי
(301653, 56, 4);10;י;230757;(4, 25, 12, 20, 230757);60885;(4, 25, 12, 7, 60885);בריתי;3;7;לכן אמר הנני נתן לו את בריתי שלום
(301653, 56, 4);200;ר;230813;(4, 25, 13, 50, 230813);60898;(4, 25, 13, 12, 60898);ויכפר;5;12;והיתה לו ולזרעו אחריו ברית כהנת עולם תחת אשר קנא לאלהיו ויכפר על בני ישראל
(301653, 56, 4);10;י;230869;(4, 25, 14, 46, 230869);60914;(4, 25, 14, 13, 60914);בית;2;13;ושם איש ישראל המכה אשר הכה את המדינית זמרי בן סלוא נשיא בית אב לשמעני
(301653, 56, 4);1;א;230925;(4, 25, 15, 47, 230925);60929;(4, 25, 15, 13, 60929);הוא;3;13;ושם האשה המכה המדינית כזבי בת צור ראש אמות בית אב במדין הוא
(301653, 56, 4);20;כ;230981;(4, 25, 18, 15, 230981);60944;(4, 25, 18, 5, 60944);בנכליהם;3;5;כי צררים הם לכם בנכליהם אשר נכלו לכם על דבר פעור ועל דבר כזבי בת נשיא מדין אחתם המכה ביום המגפה על דבר פעור
(301653, 56, 4);5;ה;231037;(4, 25, 18, 71, 231037);60960;(4, 25, 18, 21, 60960);המגפה;1;21;כי צררים הם לכם בנכליהם אשר נכלו לכם על דבר פעור ועל דבר כזבי בת נשיא מדין אחתם המכה ביום המגפה על דבר פעור
(301653, 56, 4);20;כ;231093;(4, 26, 1, 30, 231093);60975;(4, 26, 1, 9, 60975);הכהן;2;9;ויאמר יהוה אל משה ואל אלעזר בן אהרן הכהן לאמר
(301653, 56, 4);1;א;231149;(4, 26, 2, 50, 231149);60991;(4, 26, 2, 15, 60991);יצא;3;15;שאו את ראש כל עדת בני ישראל מבן עשרים שנה ומעלה לבית אבתם כל יצא צבא בישראל
(301653, 56, 4);50;ן;231205;(4, 26, 4, 3, 231205);61005;(4, 26, 4, 1, 61005);מבן;3;1;מבן עשרים שנה ומעלה כאשר צוה יהוה את משה ובני ישראל היצאים מארץ מצרים
(301653, 56, 4);6;ו;231261;(4, 26, 5, 3, 231261);61019;(4, 26, 5, 1, 61019);ראובן;3;1;ראובן בכור ישראל בני ראובן חנוך משפחת החנכי לפלוא משפחת הפלאי
(301653, 56, 4);80;פ;231317;(4, 26, 6, 8, 231317);61031;(4, 26, 6, 2, 61031);משפחת;3;2;לחצרן משפחת החצרוני לכרמי משפחת הכרמי
(301653, 56, 4);1;א;231373;(4, 26, 7, 32, 231373);61042;(4, 26, 7, 7, 61042);וארבעים;2;7;אלה משפחת הראובני ויהיו פקדיהם שלשה וארבעים אלף ושבע מאות ושלשים
(301653, 56, 4);2;ב;231429;(4, 26, 9, 21, 231429);61054;(4, 26, 9, 5, 61054);ואבירם;3;5;ובני אליאב נמואל ודתן ואבירם הוא דתן ואבירם קרואי העדה אשר הצו על משה ועל אהרן בעדת קרח בהצתם על יהוה
(301653, 56, 4);30;ל;231485;(4, 26, 9, 77, 231485);61069;(4, 26, 9, 20, 61069);על;2;20;ובני אליאב נמואל ודתן ואבירם הוא דתן ואבירם קרואי העדה אשר הצו על משה ועל אהרן בעדת קרח בהצתם על יהוה
(301653, 56, 4);40;מ;231541;(4, 26, 10, 52, 231541);61085;(4, 26, 10, 15, 61085);ומאתים;2;15;ותפתח הארץ את פיה ותבלע אתם ואת קרח במות העדה באכל האש את חמשים ומאתים איש ויהיו לנס
(301653, 56, 4);40;מ;231597;(4, 26, 12, 29, 231597);61098;(4, 26, 12, 6, 61098);הנמואלי;3;6;בני שמעון למשפחתם לנמואל משפחת הנמואלי לימין משפחת הימיני ליכין משפחת היכיני
(301653, 56, 4);40;מ;231653;(4, 26, 13, 20, 231653);61109;(4, 26, 13, 5, 61109);משפחת;1;5;לזרח משפחת הזרחי לשאול משפחת השאולי
(301653, 56, 4);30;ל;231709;(4, 26, 15, 13, 231709);61121;(4, 26, 15, 4, 61121);לצפון;1;4;בני גד למשפחתם לצפון משפחת הצפוני לחגי משפחת החגי לשוני משפחת השוני
(301653, 56, 4);7;ז;231765;(4, 26, 16, 13, 231765);61132;(4, 26, 16, 3, 61132);האזני;3;3;לאזני משפחת האזני לערי משפחת הערי
(301653, 56, 4);400;ת;231821;(4, 26, 18, 8, 231821);61143;(4, 26, 18, 2, 61143);משפחת;5;2;אלה משפחת בני גד לפקדיהם ארבעים אלף וחמש מאות
(301653, 56, 4);2;ב;231877;(4, 26, 19, 27, 231877);61158;(4, 26, 19, 8, 61158);בארץ;1;8;בני יהודה ער ואונן וימת ער ואונן בארץ כנען
(301653, 56, 4);30;ל;231933;(4, 26, 20, 49, 231933);61170;(4, 26, 20, 11, 61170);לזרח;1;11;ויהיו בני יהודה למשפחתם לשלה משפחת השלני לפרץ משפחת הפרצי לזרח משפחת הזרחי
(301653, 56, 4);10;י;231989;(4, 26, 21, 43, 231989);61181;(4, 26, 21, 9, 61181);החמולי;6;9;ויהיו בני פרץ לחצרן משפחת החצרני לחמול משפחת החמולי
(301653, 56, 4);400;ת;232045;(4, 26, 23, 16, 232045);61194;(4, 26, 23, 4, 61194);תולע;1;4;בני יששכר למשפחתם תולע משפחת התולעי לפוה משפחת הפוני
(301653, 56, 4);40;מ;232101;(4, 26, 24, 28, 232101);61205;(4, 26, 24, 6, 61205);השמרני;3;6;לישוב משפחת הישבי לשמרן משפחת השמרני
(301653, 56, 4);80;פ;232157;(4, 26, 26, 12, 232157);61217;(4, 26, 26, 3, 61217);למשפחתם;4;3;בני זבולן למשפחתם לסרד משפחת הסרדי לאלון משפחת האלני ליחלאל משפחת היחלאלי
