(38808, -92, 4);300;ש;76068;(1, 49, 23, 14, 76068);20086;(1, 49, 23, 3, 20086);וישטמהו;3;3;וימררהו ורבו וישטמהו בעלי חצים
(38808, -92, 4);20;כ;76160;(1, 49, 25, 28, 76160);20108;(1, 49, 25, 7, 20108);ברכת;3;7;מאל אביך ויעזרך ואת שדי ויברכך ברכת שמים מעל ברכת תהום רבצת תחת ברכת שדים ורחם
(38808, -92, 4);7;ז;76252;(1, 49, 26, 57, 76252);20132;(1, 49, 26, 15, 20132);נזיר;2;15;ברכת אביך גברו על ברכת הורי עד תאות גבעת עולם תהיין לראש יוסף ולקדקד נזיר אחיו
(38808, -92, 4);300;ש;76344;(1, 49, 28, 51, 76344);20156;(1, 49, 28, 14, 20156);איש;3;14;כל אלה שבטי ישראל שנים עשר וזאת אשר דבר להם אביהם ויברך אותם איש אשר כברכתו ברך אתם
(38808, -92, 4);5;ה;76436;(1, 49, 30, 12, 76436);20181;(1, 49, 30, 3, 20181);בשדה;4;3;במערה אשר בשדה המכפלה אשר על פני ממרא בארץ כנען אשר קנה אברהם את השדה מאת עפרן החתי לאחזת קבר
(38808, -92, 4);200;ר;76528;(1, 49, 31, 30, 76528);20207;(1, 49, 31, 9, 20207);קברו;3;9;שמה קברו את אברהם ואת שרה אשתו שמה קברו את יצחק ואת רבקה אשתו ושמה קברתי את לאה
(38808, -92, 4);9;ט;76620;(1, 49, 33, 33, 76620);20233;(1, 49, 33, 9, 20233);המטה;3;9;ויכל יעקב לצות את בניו ויאסף רגליו אל המטה ויגוע ויאסף אל עמיו
(38808, -92, 4);10;י;76712;(1, 50, 2, 44, 76712);20257;(1, 50, 2, 11, 20257);הרפאים;5;11;ויצו יוסף את עבדיו את הרפאים לחנט את אביו ויחנטו הרפאים את ישראל
(38808, -92, 4);400;ת;76804;(1, 50, 4, 28, 76804);20280;(1, 50, 4, 7, 20280);בית;3;7;ויעברו ימי בכיתו וידבר יוסף אל בית פרעה לאמר אם נא מצאתי חן בעיניכם דברו נא באזני פרעה לאמר
(38808, -92, 4);300;ש;76896;(1, 50, 5, 47, 76896);20305;(1, 50, 5, 13, 20305);שמה;1;13;אבי השביעני לאמר הנה אנכי מת בקברי אשר כריתי לי בארץ כנען שמה תקברני ועתה אעלה נא ואקברה את אבי ואשובה
(38808, -92, 4);400;ת;76988;(1, 50, 7, 25, 76988);20328;(1, 50, 7, 7, 20328);אתו;2;7;ויעל יוסף לקבר את אביו ויעלו אתו כל עבדי פרעה זקני ביתו וכל זקני ארץ מצרים
(38808, -92, 4);40;ם;77080;(1, 50, 9, 9, 77080);20353;(1, 50, 9, 3, 20353);גם;2;3;ויעל עמו גם רכב גם פרשים ויהי המחנה כבד מאד
(38808, -92, 4);40;מ;77172;(1, 50, 10, 67, 77172);20378;(1, 50, 10, 18, 20378);ימים;2;18;ויבאו עד גרן האטד אשר בעבר הירדן ויספדו שם מספד גדול וכבד מאד ויעש לאביו אבל שבעת ימים
(38808, -92, 4);10;י;77264;(1, 50, 12, 8, 77264);20402;(1, 50, 12, 2, 20402);בניו;3;2;ויעשו בניו לו כן כאשר צום
(38808, -92, 4);70;ע;77356;(1, 50, 13, 80, 77356);20427;(1, 50, 13, 21, 20427);על;1;21;וישאו אתו בניו ארצה כנען ויקברו אתו במערת שדה המכפלה אשר קנה אברהם את השדה לאחזת קבר מאת עפרן החתי על פני ממרא
(38808, -92, 4);6;ו;77448;(1, 50, 15, 27, 77448);20451;(1, 50, 15, 7, 20451);ויאמרו;6;7;ויראו אחי יוסף כי מת אביהם ויאמרו לו ישטמנו יוסף והשב ישיב לנו את כל הרעה אשר גמלנו אתו
(38808, -92, 4);300;ש;77540;(1, 50, 17, 16, 77540);20477;(1, 50, 17, 5, 20477);שא;1;5;כה תאמרו ליוסף אנא שא נא פשע אחיך וחטאתם כי רעה גמלוך ועתה שא נא לפשע עבדי אלהי אביך ויבך יוסף בדברם אליו
(38808, -92, 4);40;מ;77632;(1, 50, 18, 25, 77632);20501;(1, 50, 18, 6, 20501);ויאמרו;4;6;וילכו גם אחיו ויפלו לפניו ויאמרו הננו לך לעבדים
(38808, -92, 4);5;ה;77724;(1, 50, 20, 44, 77724);20525;(1, 50, 20, 12, 20525);להחית;2;12;ואתם חשבתם עלי רעה אלהים חשבה לטבה למען עשה כיום הזה להחית עם רב
(38808, -92, 4);1;א;77816;(1, 50, 22, 35, 77816);20549;(1, 50, 22, 9, 20549);מאה;2;9;וישב יוסף במצרים הוא ובית אביו ויחי יוסף מאה ועשר שנים
(38808, -92, 4);80;פ;77908;(1, 50, 24, 32, 77908);20574;(1, 50, 24, 9, 20574);יפקד;2;9;ויאמר יוסף אל אחיו אנכי מת ואלהים פקד יפקד אתכם והעלה אתכם מן הארץ הזאת אל הארץ אשר נשבע לאברהם ליצחק וליעקב
(38808, -92, 4);400;ת;78000;(1, 50, 25, 37, 78000);20597;(1, 50, 25, 10, 20597);אתכם;2;10;וישבע יוסף את בני ישראל לאמר פקד יפקד אלהים אתכם והעלתם את עצמתי מזה
(38808, -92, 4);1;א;78092;(2, 1, 1, 28, 78092);20619;(2, 1, 1, 7, 20619);את;1;7;ואלה שמות בני ישראל הבאים מצרימה את יעקב איש וביתו באו
(38808, -92, 4);80;פ;78184;(2, 1, 5, 27, 78184);20642;(2, 1, 5, 8, 20642);נפש;2;8;ויהי כל נפש יצאי ירך יעקב שבעים נפש ויוסף היה במצרים
(38808, -92, 4);100;ק;78276;(2, 1, 8, 3, 78276);20664;(2, 1, 8, 1, 20664);ויקם;3;1;ויקם מלך חדש על מצרים אשר לא ידע את יוסף
(38808, -92, 4);40;מ;78368;(2, 1, 10, 30, 78368);20692;(2, 1, 10, 9, 20692);מלחמה;1;9;הבה נתחכמה לו פן ירבה והיה כי תקראנה מלחמה ונוסף גם הוא על שנאינו ונלחם בנו ועלה מן הארץ
(38808, -92, 4);80;פ;78460;(2, 1, 11, 52, 78460);20715;(2, 1, 11, 13, 20715);פתם;1;13;וישימו עליו שרי מסים למען ענתו בסבלתם ויבן ערי מסכנות לפרעה את פתם ואת רעמסס
(38808, -92, 4);70;ע;78552;(2, 1, 14, 15, 78552);20738;(2, 1, 14, 4, 20738);בעבדה;2;4;וימררו את חייהם בעבדה קשה בחמר ובלבנים ובכל עבדה בשדה את כל עבדתם אשר עבדו בהם בפרך
(38808, -92, 4);300;ש;78644;(2, 1, 15, 40, 78644);20761;(2, 1, 15, 10, 20761);ושם;2;10;ויאמר מלך מצרים למילדת העברית אשר שם האחת שפרה ושם השנית פועה
(38808, -92, 4);6;ו;78736;(2, 1, 17, 21, 78736);20784;(2, 1, 17, 5, 20784);ולא;1;5;ותיראן המילדת את האלהים ולא עשו כאשר דבר אליהן מלך מצרים ותחיין את הילדים
(38808, -92, 4);10;י;78828;(2, 1, 18, 53, 78828);20806;(2, 1, 18, 13, 20806);הילדים;2;13;ויקרא מלך מצרים למילדת ויאמר להן מדוע עשיתן הדבר הזה ותחיין את הילדים
(38808, -92, 4);6;ו;78920;(2, 1, 20, 17, 78920);20827;(2, 1, 20, 4, 20827);וירב;1;4;וייטב אלהים למילדת וירב העם ויעצמו מאד
(38808, -92, 4);20;כ;79012;(2, 1, 22, 42, 79012);20850;(2, 1, 22, 11, 20850);וכל;2;11;ויצו פרעה לכל עמו לאמר כל הבן הילוד היארה תשליכהו וכל הבת תחיון
(38808, -92, 4);80;פ;79104;(2, 2, 3, 13, 79104);20876;(2, 2, 3, 4, 20876);הצפינו;3;4;ולא יכלה עוד הצפינו ותקח לו תבת גמא ותחמרה בחמר ובזפת ותשם בה את הילד ותשם בסוף על שפת היאר
(38808, -92, 4);200;ר;79196;(2, 2, 5, 8, 79196);20902;(2, 2, 5, 3, 20902);פרעה;2;3;ותרד בת פרעה לרחץ על היאר ונערתיה הלכת על יד היאר ותרא את התבה בתוך הסוף ותשלח את אמתה ותקחה
(38808, -92, 4);5;ה;79288;(2, 2, 6, 27, 79288);20926;(2, 2, 6, 7, 20926);בכה;3;7;ותפתח ותראהו את הילד והנה נער בכה ותחמל עליו ותאמר מילדי העברים זה
(38808, -92, 4);5;ה;79380;(2, 2, 8, 7, 79380);20950;(2, 2, 8, 2, 20950);לה;2;2;ותאמר לה בת פרעה לכי ותלך העלמה ותקרא את אם הילד
(38808, -92, 4);30;ל;79472;(2, 2, 9, 61, 79472);20976;(2, 2, 9, 17, 20976);הילד;3;17;ותאמר לה בת פרעה היליכי את הילד הזה והינקהו לי ואני אתן את שכרך ותקח האשה הילד ותניקהו
(38808, -92, 4);90;צ;79564;(2, 2, 11, 23, 79564);20999;(2, 2, 11, 6, 20999);ויצא;3;6;ויהי בימים ההם ויגדל משה ויצא אל אחיו וירא בסבלתם וירא איש מצרי מכה איש עברי מאחיו
(38808, -92, 4);6;ו;79656;(2, 2, 13, 7, 79656);21024;(2, 2, 13, 2, 21024);ביום;3;2;ויצא ביום השני והנה שני אנשים עברים נצים ויאמר לרשע למה תכה רעך
(38808, -92, 4);400;ת;79748;(2, 2, 14, 48, 79748);21048;(2, 2, 14, 13, 21048);את;2;13;ויאמר מי שמך לאיש שר ושפט עלינו הלהרגני אתה אמר כאשר הרגת את המצרי ויירא משה ויאמר אכן נודע הדבר
(38808, -92, 4);300;ש;79840;(2, 2, 15, 63, 79840);21072;(2, 2, 15, 17, 21072);וישב;3;17;וישמע פרעה את הדבר הזה ויבקש להרג את משה ויברח משה מפני פרעה וישב בארץ מדין וישב על הבאר
(38808, -92, 4);300;ש;79932;(2, 2, 17, 28, 79932);21092;(2, 2, 17, 6, 21092);ויושען;4;6;ויבאו הרעים ויגרשום ויקם משה ויושען וישק את צאנם
(38808, -92, 4);300;ש;80024;(2, 2, 19, 42, 80024);21115;(2, 2, 19, 11, 21115);וישק;3;11;ותאמרן איש מצרי הצילנו מיד הרעים וגם דלה דלה לנו וישק את הצאן
(38808, -92, 4);4;ד;80116;(2, 2, 22, 4, 80116);21141;(2, 2, 22, 1, 21141);ותלד;4;1;ותלד בן ויקרא את שמו גרשם כי אמר גר הייתי בארץ נכריה
(38808, -92, 4);100;ק;80208;(2, 2, 23, 55, 80208);21165;(2, 2, 23, 13, 21165);ויזעקו;5;13;ויהי בימים הרבים ההם וימת מלך מצרים ויאנחו בני ישראל מן העבדה ויזעקו ותעל שועתם אל האלהים מן העבדה
(38808, -92, 4);50;נ;80300;(2, 2, 25, 13, 80300);21189;(2, 2, 25, 4, 21189);בני;2;4;וירא אלהים את בני ישראל וידע אלהים
(38808, -92, 4);5;ה;80392;(2, 3, 2, 10, 80392);21214;(2, 3, 2, 3, 21214);יהוה;2;3;וירא מלאך יהוה אליו בלבת אש מתוך הסנה וירא והנה הסנה בער באש והסנה איננו אכל
(38808, -92, 4);2;ב;80484;(2, 3, 3, 41, 80484);21239;(2, 3, 3, 12, 21239);יבער;2;12;ויאמר משה אסרה נא ואראה את המראה הגדל הזה מדוע לא יבער הסנה
(38808, -92, 4);30;ל;80576;(2, 3, 5, 27, 80576);21263;(2, 3, 5, 8, 21263);רגליך;3;8;ויאמר אל תקרב הלם של נעליך מעל רגליך כי המקום אשר אתה עומד עליו אדמת קדש הוא
(38808, -92, 4);200;ר;80668;(2, 3, 6, 59, 80668);21287;(2, 3, 6, 15, 21287);ירא;2;15;ויאמר אנכי אלהי אביך אלהי אברהם אלהי יצחק ואלהי יעקב ויסתר משה פניו כי ירא מהביט אל האלהים
(38808, -92, 4);90;צ;80760;(2, 3, 8, 7, 80760);21310;(2, 3, 8, 2, 21310);להצילו;3;2;וארד להצילו מיד מצרים ולהעלתו מן הארץ ההוא אל ארץ טובה ורחבה אל ארץ זבת חלב ודבש אל מקום הכנעני והחתי והאמרי והפרזי והחוי והיבוסי
(38808, -92, 4);6;ו;80852;(2, 3, 8, 99, 80852);21333;(2, 3, 8, 25, 21333);והיבוסי;1;25;וארד להצילו מיד מצרים ולהעלתו מן הארץ ההוא אל ארץ טובה ורחבה אל ארץ זבת חלב ודבש אל מקום הכנעני והחתי והאמרי והפרזי והחוי והיבוסי
(38808, -92, 4);50;נ;80944;(2, 3, 10, 31, 80944);21357;(2, 3, 10, 9, 21357);בני;2;9;ועתה לכה ואשלחך אל פרעה והוצא את עמי בני ישראל ממצרים
(38808, -92, 4);400;ת;81036;(2, 3, 12, 23, 81036);21382;(2, 3, 12, 7, 21382);האות;4;7;ויאמר כי אהיה עמך וזה לך האות כי אנכי שלחתיך בהוציאך את העם ממצרים תעבדון את האלהים על ההר הזה
(38808, -92, 4);400;ת;81128;(2, 3, 13, 40, 81128);21406;(2, 3, 13, 11, 21406);ואמרתי;5;11;ויאמר משה אל האלהים הנה אנכי בא אל בני ישראל ואמרתי להם אלהי אבותיכם שלחני אליכם ואמרו לי מה שמו מה אמר אלהם
(38808, -92, 4);30;ל;81220;(2, 3, 14, 46, 81220);21430;(2, 3, 14, 12, 21430);ישראל;5;12;ויאמר אלהים אל משה אהיה אשר אהיה ויאמר כה תאמר לבני ישראל אהיה שלחני אליכם
(38808, -92, 4);50;נ;81312;(2, 3, 15, 78, 81312);21453;(2, 3, 15, 20, 21453);שלחני;4;20;ויאמר עוד אלהים אל משה כה תאמר אל בני ישראל יהוה אלהי אבתיכם אלהי אברהם אלהי יצחק ואלהי יעקב שלחני אליכם זה שמי לעלם וזה זכרי לדר דר
(38808, -92, 4);100;ק;81404;(2, 3, 16, 65, 81404);21477;(2, 3, 16, 16, 21477);ויעקב;4;16;לך ואספת את זקני ישראל ואמרת אלהם יהוה אלהי אבתיכם נראה אלי אלהי אברהם יצחק ויעקב לאמר פקד פקדתי אתכם ואת העשוי לכם במצרים
(38808, -92, 4);2;ב;81496;(2, 3, 17, 58, 81496);21498;(2, 3, 17, 13, 21498);והיבוסי;4;13;ואמר אעלה אתכם מעני מצרים אל ארץ הכנעני והחתי והאמרי והפרזי והחוי והיבוסי אל ארץ זבת חלב ודבש
(38808, -92, 4);5;ה;81588;(2, 3, 18, 74, 81588);21520;(2, 3, 18, 17, 21520);ועתה;4;17;ושמעו לקלך ובאת אתה וזקני ישראל אל מלך מצרים ואמרתם אליו יהוה אלהי העבריים נקרה עלינו ועתה נלכה נא דרך שלשת ימים במדבר ונזבחה ליהוה אלהינו
(38808, -92, 4);10;י;81680;(2, 3, 20, 11, 81680);21544;(2, 3, 20, 3, 21544);ידי;3;3;ושלחתי את ידי והכיתי את מצרים בכל נפלאתי אשר אעשה בקרבו ואחרי כן ישלח אתכם
(38808, -92, 4);200;ר;81772;(2, 3, 21, 43, 81772);21569;(2, 3, 21, 13, 21569);ריקם;1;13;ונתתי את חן העם הזה בעיני מצרים והיה כי תלכון לא תלכו ריקם
(38808, -92, 4);5;ה;81864;(2, 4, 1, 14, 81864);21591;(2, 4, 1, 4, 21591);והן;2;4;ויען משה ויאמר והן לא יאמינו לי ולא ישמעו בקלי כי יאמרו לא נראה אליך יהוה
(38808, -92, 4);30;ל;81956;(2, 4, 3, 20, 81956);21614;(2, 4, 3, 4, 21614);וישלכהו;4;4;ויאמר השליכהו ארצה וישלכהו ארצה ויהי לנחש וינס משה מפניו
(38808, -92, 4);50;נ;82048;(2, 4, 5, 9, 82048);21637;(2, 4, 5, 2, 21637);יאמינו;5;2;למען יאמינו כי נראה אליך יהוה אלהי אבתם אלהי אברהם אלהי יצחק ואלהי יעקב
(38808, -92, 4);90;צ;82140;(2, 4, 6, 43, 82140);21661;(2, 4, 6, 12, 21661);ויוצאה;4;12;ויאמר יהוה לו עוד הבא נא ידך בחיקך ויבא ידו בחיקו ויוצאה והנה ידו מצרעת כשלג
(38808, -92, 4);300;ש;82232;(2, 4, 8, 21, 82232);21686;(2, 4, 8, 7, 21686);ישמעו;2;7;והיה אם לא יאמינו לך ולא ישמעו לקל האת הראשון והאמינו לקל האת האחרון
(38808, -92, 4);300;ש;82324;(2, 4, 9, 58, 82324);21708;(2, 4, 9, 15, 21708);ושפכת;2;15;והיה אם לא יאמינו גם לשני האתות האלה ולא ישמעון לקלך ולקחת ממימי היאר ושפכת היבשה והיו המים אשר תקח מן היאר והיו לדם ביבשת
(38808, -92, 4);1;א;82416;(2, 4, 10, 52, 82416);21734;(2, 4, 10, 16, 21734);מאז;2;16;ויאמר משה אל יהוה בי אדני לא איש דברים אנכי גם מתמול גם משלשם גם מאז דברך אל עבדך כי כבד פה וכבד לשון אנכי
(38808, -92, 4);70;ע;82508;(2, 4, 12, 2, 82508);21764;(2, 4, 12, 1, 21764);ועתה;2;1;ועתה לך ואנכי אהיה עם פיך והוריתיך אשר תדבר
(38808, -92, 4);4;ד;82600;(2, 4, 14, 36, 82600);21789;(2, 4, 14, 10, 21789);ידעתי;2;10;ויחר אף יהוה במשה ויאמר הלא אהרן אחיך הלוי ידעתי כי דבר ידבר הוא וגם הנה הוא יצא לקראתך וראך ושמח בלבו
(38808, -92, 4);6;ו;82692;(2, 4, 15, 47, 82692);21814;(2, 4, 15, 13, 21814);והוריתי;1;13;ודברת אליו ושמת את הדברים בפיו ואנכי אהיה עם פיך ועם פיהו והוריתי אתכם את אשר תעשון
(38808, -92, 4);6;ו;82784;(2, 4, 17, 26, 82784);21840;(2, 4, 17, 8, 21840);בו;2;8;ואת המטה הזה תקח בידך אשר תעשה בו את האתת
(38808, -92, 4);6;ו;82876;(2, 4, 18, 86, 82876);21865;(2, 4, 18, 23, 21865);לשלום;4;23;וילך משה וישב אל יתר חתנו ויאמר לו אלכה נא ואשובה אל אחי אשר במצרים ואראה העודם חיים ויאמר יתרו למשה לך לשלום
(38808, -92, 4);1;א;82968;(2, 4, 20, 37, 82968);21891;(2, 4, 20, 11, 21891);ארצה;1;11;ויקח משה את אשתו ואת בניו וירכבם על החמר וישב ארצה מצרים ויקח משה את מטה האלהים בידו
(38808, -92, 4);80;פ;83060;(2, 4, 21, 62, 83060);21914;(2, 4, 21, 16, 21914);פרעה;1;16;ויאמר יהוה אל משה בלכתך לשוב מצרימה ראה כל המפתים אשר שמתי בידך ועשיתם לפני פרעה ואני אחזק את לבו ולא ישלח את העם
(38808, -92, 4);8;ח;83152;(2, 4, 23, 32, 83152);21939;(2, 4, 23, 8, 21939);לשלחו;4;8;ואמר אליך שלח את בני ויעבדני ותמאן לשלחו הנה אנכי הרג את בנך בכרך
(38808, -92, 4);40;מ;83244;(2, 4, 25, 38, 83244);21962;(2, 4, 25, 10, 21962);ותאמר;4;10;ותקח צפרה צר ותכרת את ערלת בנה ותגע לרגליו ותאמר כי חתן דמים אתה לי
(38808, -92, 4);40;ם;83336;(2, 4, 27, 51, 83336);21986;(2, 4, 27, 12, 21986);האלהים;6;12;ויאמר יהוה אל אהרן לך לקראת משה המדברה וילך ויפגשהו בהר האלהים וישק לו
(38808, -92, 4);200;ר;83428;(2, 4, 30, 5, 83428);22012;(2, 4, 30, 1, 22012);וידבר;5;1;וידבר אהרן את כל הדברים אשר דבר יהוה אל משה ויעש האתת לעיני העם
(38808, -92, 4);10;י;83520;(2, 4, 31, 47, 83520);22039;(2, 4, 31, 14, 22039);ויקדו;2;14;ויאמן העם וישמעו כי פקד יהוה את בני ישראל וכי ראה את ענים ויקדו וישתחוו
(38808, -92, 4);300;ש;83612;(2, 5, 2, 17, 83612);22063;(2, 5, 2, 5, 22063);אשר;2;5;ויאמר פרעה מי יהוה אשר אשמע בקלו לשלח את ישראל לא ידעתי את יהוה וגם את ישראל לא אשלח
(38808, -92, 4);2;ב;83704;(2, 5, 3, 43, 83704);22088;(2, 5, 3, 11, 22088);במדבר;1;11;ויאמרו אלהי העברים נקרא עלינו נלכה נא דרך שלשת ימים במדבר ונזבחה ליהוה אלהינו פן יפגענו בדבר או בחרב
(38808, -92, 4);400;ת;83796;(2, 5, 4, 53, 83796);22109;(2, 5, 4, 13, 22109);לסבלתיכם;5;13;ויאמר אלהם מלך מצרים למה משה ואהרן תפריעו את העם ממעשיו לכו לסבלתיכם
(38808, -92, 4);400;ת;83888;(2, 5, 7, 11, 83888);22132;(2, 5, 7, 3, 22132);לתת;3;3;לא תאספון לתת תבן לעם ללבן הלבנים כתמול שלשם הם ילכו וקששו להם תבן
(38808, -92, 4);40;מ;83980;(2, 5, 8, 50, 83980);22156;(2, 5, 8, 13, 22156);ממנו;2;13;ואת מתכנת הלבנים אשר הם עשים תמול שלשם תשימו עליהם לא תגרעו ממנו כי נרפים הם על כן הם צעקים לאמר נלכה נזבחה לאלהינו
(38808, -92, 4);70;ע;84072;(2, 5, 10, 11, 84072);22180;(2, 5, 10, 3, 22180);העם;2;3;ויצאו נגשי העם ושטריו ויאמרו אל העם לאמר כה אמר פרעה אינני נתן לכם תבן
(38808, -92, 4);90;ץ;84164;(2, 5, 12, 4, 84164);22205;(2, 5, 12, 1, 22205);ויפץ;4;1;ויפץ העם בכל ארץ מצרים לקשש קש לתבן
(38808, -92, 4);300;ש;84256;(2, 5, 14, 20, 84256);22229;(2, 5, 14, 6, 22229);שמו;1;6;ויכו שטרי בני ישראל אשר שמו עלהם נגשי פרעה לאמר מדוע לא כליתם חקכם ללבן כתמול שלשם גם תמול גם היום
(38808, -92, 4);30;ל;84348;(2, 5, 15, 34, 84348);22253;(2, 5, 15, 9, 22253);למה;1;9;ויבאו שטרי בני ישראל ויצעקו אל פרעה לאמר למה תעשה כה לעבדיך
(38808, -92, 4);40;ם;84440;(2, 5, 17, 25, 84440);22276;(2, 5, 17, 7, 22276);אתם;3;7;ויאמר נרפים אתם נרפים על כן אתם אמרים נלכה נזבחה ליהוה
(38808, -92, 4);30;ל;84532;(2, 5, 19, 36, 84532);22300;(2, 5, 19, 10, 22300);מלבניכם;2;10;ויראו שטרי בני ישראל אתם ברע לאמר לא תגרעו מלבניכם דבר יום ביומו
(38808, -92, 4);400;ת;84624;(2, 5, 21, 35, 84624);22321;(2, 5, 21, 8, 22321);הבאשתם;5;8;ויאמרו אלהם ירא יהוה עליכם וישפט אשר הבאשתם את ריחנו בעיני פרעה ובעיני עבדיו לתת חרב בידם להרגנו
(38808, -92, 4);6;ו;84716;(2, 5, 23, 1, 84716);22345;(2, 5, 23, 1, 22345);ומאז;1;1;ומאז באתי אל פרעה לדבר בשמך הרע לעם הזה והצל לא הצלת את עמך
(38808, -92, 4);40;ם;84808;(2, 6, 1, 47, 84808);22371;(2, 6, 1, 13, 22371);ישלחם;5;13;ויאמר יהוה אל משה עתה תראה אשר אעשה לפרעה כי ביד חזקה ישלחם וביד חזקה יגרשם מארצו
(38808, -92, 4);4;ד;84900;(2, 6, 3, 43, 84900);22396;(2, 6, 3, 13, 22396);נודעתי;3;13;וארא אל אברהם אל יצחק ואל יעקב באל שדי ושמי יהוה לא נודעתי להם
(38808, -92, 4);40;מ;84992;(2, 6, 5, 34, 84992);22423;(2, 6, 5, 10, 22423);מעבדים;1;10;וגם אני שמעתי את נאקת בני ישראל אשר מצרים מעבדים אתם ואזכר את בריתי
(38808, -92, 4);40;ם;85084;(2, 6, 6, 72, 85084);22443;(2, 6, 6, 16, 22443);אתכם;4;16;לכן אמר לבני ישראל אני יהוה והוצאתי אתכם מתחת סבלת מצרים והצלתי אתכם מעבדתם וגאלתי אתכם בזרוע נטויה ובשפטים גדלים
(38808, -92, 4);400;ת;85176;(2, 6, 7, 70, 85176);22463;(2, 6, 7, 16, 22463);סבלות;5;16;ולקחתי אתכם לי לעם והייתי לכם לאלהים וידעתם כי אני יהוה אלהיכם המוציא אתכם מתחת סבלות מצרים
(38808, -92, 4);30;ל;85268;(2, 6, 9, 12, 85268);22487;(2, 6, 9, 4, 22487);אל;2;4;וידבר משה כן אל בני ישראל ולא שמעו אל משה מקצר רוח ומעבדה קשה
(38808, -92, 4);90;צ;85360;(2, 6, 11, 38, 85360);22513;(2, 6, 11, 11, 22513);מארצו;4;11;בא דבר אל פרעה מלך מצרים וישלח את בני ישראל מארצו
(38808, -92, 4);40;ם;85452;(2, 6, 13, 26, 85452);22537;(2, 6, 13, 7, 22537);ויצום;5;7;וידבר יהוה אל משה ואל אהרן ויצום אל בני ישראל ואל פרעה מלך מצרים להוציא את בני ישראל מארץ מצרים
(38808, -92, 4);200;ר;85544;(2, 6, 14, 42, 85544);22561;(2, 6, 14, 11, 22561);חצרן;3;11;אלה ראשי בית אבתם בני ראובן בכר ישראל חנוך ופלוא חצרן וכרמי אלה משפחת ראובן
(38808, -92, 4);10;י;85636;(2, 6, 16, 14, 85636);22582;(2, 6, 16, 4, 22582);לוי;3;4;ואלה שמות בני לוי לתלדתם גרשון וקהת ומררי ושני חיי לוי שבע ושלשים ומאת שנה
(38808, -92, 4);50;ן;85728;(2, 6, 18, 22, 85728);22603;(2, 6, 18, 5, 22603);וחברון;6;5;ובני קהת עמרם ויצהר וחברון ועזיאל ושני חיי קהת שלש ושלשים ומאת שנה
(38808, -92, 4);5;ה;85820;(2, 6, 20, 25, 85820);22626;(2, 6, 20, 7, 22626);לאשה;4;7;ויקח עמרם את יוכבד דדתו לו לאשה ותלד לו את אהרן ואת משה ושני חיי עמרם שבע ושלשים ומאת שנה
(38808, -92, 4);10;י;85912;(2, 6, 23, 2, 85912);22650;(2, 6, 23, 1, 22650);ויקח;2;1;ויקח אהרן את אלישבע בת עמינדב אחות נחשון לו לאשה ותלד לו את נדב ואת אביהוא את אלעזר ואת איתמר
(38808, -92, 4);2;ב;86004;(2, 6, 24, 20, 86004);22674;(2, 6, 24, 5, 22674);ואביאסף;3;5;ובני קרח אסיר ואלקנה ואביאסף אלה משפחת הקרחי
(38808, -92, 4);5;ה;86096;(2, 6, 26, 5, 86096);22697;(2, 6, 26, 2, 22697);אהרן;2;2;הוא אהרן ומשה אשר אמר יהוה להם הוציאו את בני ישראל מארץ מצרים על צבאתם
(38808, -92, 4);40;מ;86188;(2, 6, 27, 41, 86188);22721;(2, 6, 27, 11, 22721);ממצרים;2;11;הם המדברים אל פרעה מלך מצרים להוציא את בני ישראל ממצרים הוא משה ואהרן
(38808, -92, 4);300;ש;86280;(2, 6, 29, 48, 86280);22747;(2, 6, 29, 15, 22747);אשר;2;15;וידבר יהוה אל משה לאמר אני יהוה דבר אל פרעה מלך מצרים את כל אשר אני דבר אליך
(38808, -92, 4);50;ן;86372;(2, 7, 1, 37, 86372);22771;(2, 7, 1, 9, 22771);ואהרן;5;9;ויאמר יהוה אל משה ראה נתתיך אלהים לפרעה ואהרן אחיך יהיה נביאך
