(122220, -67, 4);400;ת;154581;(3, 10, 7, 15, 154581);40783;(3, 10, 7, 5, 40783);תצאו;1;5;ומפתח אהל מועד לא תצאו פן תמתו כי שמן משחת יהוה עליכם ויעשו כדבר משה
(122220, -67, 4);30;ל;154648;(3, 10, 9, 9, 154648);40801;(3, 10, 9, 3, 40801);אל;2;3;יין ושכר אל תשת אתה ובניך אתך בבאכם אל אהל מועד ולא תמתו חקת עולם לדרתיכם
(122220, -67, 4);50;ן;154715;(3, 10, 10, 18, 154715);40818;(3, 10, 10, 4, 40818);ובין;4;4;ולהבדיל בין הקדש ובין החל ובין הטמא ובין הטהור
(122220, -67, 4);6;ו;154782;(3, 10, 12, 1, 154782);40837;(3, 10, 12, 1, 40837);וידבר;1;1;וידבר משה אל אהרן ואל אלעזר ואל איתמר בניו הנותרים קחו את המנחה הנותרת מאשי יהוה ואכלוה מצות אצל המזבח כי קדש קדשים הוא
(122220, -67, 4);20;כ;154849;(3, 10, 12, 68, 154849);40853;(3, 10, 12, 17, 40853);ואכלוה;3;17;וידבר משה אל אהרן ואל אלעזר ואל איתמר בניו הנותרים קחו את המנחה הנותרת מאשי יהוה ואכלוה מצות אצל המזבח כי קדש קדשים הוא
(122220, -67, 4);5;ה;154916;(3, 10, 13, 39, 154916);40871;(3, 10, 13, 11, 40871);יהוה;2;11;ואכלתם אתה במקום קדוש כי חקך וחק בניך הוא מאשי יהוה כי כן צויתי
(122220, -67, 4);20;כ;154983;(3, 10, 14, 56, 154983);40888;(3, 10, 14, 14, 40888);כי;1;14;ואת חזה התנופה ואת שוק התרומה תאכלו במקום טהור אתה ובניך ובנתיך אתך כי חקך וחק בניך נתנו מזבחי שלמי בני ישראל
(122220, -67, 4);6;ו;155050;(3, 10, 15, 35, 155050);40904;(3, 10, 15, 8, 40904);יביאו;5;8;שוק התרומה וחזה התנופה על אשי החלבים יביאו להניף תנופה לפני יהוה והיה לך ולבניך אתך לחק עולם כאשר צוה יהוה
(122220, -67, 4);4;ד;155117;(3, 10, 16, 16, 155117);40922;(3, 10, 16, 5, 40922);דרש;1;5;ואת שעיר החטאת דרש דרש משה והנה שרף ויקצף על אלעזר ועל איתמר בני אהרן הנותרם לאמר
(122220, -67, 4);400;ת;155184;(3, 10, 17, 18, 155184);40939;(3, 10, 17, 5, 40939);החטאת;5;5;מדוע לא אכלתם את החטאת במקום הקדש כי קדש קדשים הוא ואתה נתן לכם לשאת את עון העדה לכפר עליהם לפני יהוה
(122220, -67, 4);5;ה;155251;(3, 10, 18, 5, 155251);40959;(3, 10, 18, 3, 40959);הובא;1;3;הן לא הובא את דמה אל הקדש פנימה אכול תאכלו אתה בקדש כאשר צויתי
(122220, -67, 4);200;ר;155318;(3, 10, 19, 23, 155318);40977;(3, 10, 19, 7, 40977);הקריבו;3;7;וידבר אהרן אל משה הן היום הקריבו את חטאתם ואת עלתם לפני יהוה ותקראנה אתי כאלה ואכלתי חטאת היום הייטב בעיני יהוה
(122220, -67, 4);5;ה;155385;(3, 10, 19, 90, 155385);40992;(3, 10, 19, 22, 40992);יהוה;4;22;וידבר אהרן אל משה הן היום הקריבו את חטאתם ואת עלתם לפני יהוה ותקראנה אתי כאלה ואכלתי חטאת היום הייטב בעיני יהוה
(122220, -67, 4);7;ז;155452;(3, 11, 2, 19, 155452);41010;(3, 11, 2, 6, 41010);זאת;1;6;דברו אל בני ישראל לאמר זאת החיה אשר תאכלו מכל הבהמה אשר על הארץ
(122220, -67, 4);1;א;155519;(3, 11, 3, 36, 155519);41028;(3, 11, 3, 10, 41028);אתה;1;10;כל מפרסת פרסה ושסעת שסע פרסת מעלת גרה בבהמה אתה תאכלו
(122220, -67, 4);50;נ;155586;(3, 11, 4, 60, 155586);41046;(3, 11, 4, 17, 41046);איננו;3;17;אך את זה לא תאכלו ממעלי הגרה וממפרסי הפרסה את הגמל כי מעלה גרה הוא ופרסה איננו מפריס טמא הוא לכם
(122220, -67, 4);10;י;155653;(3, 11, 6, 11, 155653);41065;(3, 11, 6, 3, 41065);כי;2;3;ואת הארנבת כי מעלת גרה הוא ופרסה לא הפריסה טמאה הוא לכם
(122220, -67, 4);6;ו;155720;(3, 11, 7, 34, 155720);41084;(3, 11, 7, 10, 41084);והוא;1;10;ואת החזיר כי מפריס פרסה הוא ושסע שסע פרסה והוא גרה לא יגר טמא הוא לכם
(122220, -67, 4);30;ל;155787;(3, 11, 9, 12, 155787);41103;(3, 11, 9, 4, 41103);מכל;3;4;את זה תאכלו מכל אשר במים כל אשר לו סנפיר וקשקשת במים בימים ובנחלים אתם תאכלו
(122220, -67, 4);100;ק;155854;(3, 11, 10, 18, 155854);41121;(3, 11, 10, 6, 41121);וקשקשת;2;6;וכל אשר אין לו סנפיר וקשקשת בימים ובנחלים מכל שרץ המים ומכל נפש החיה אשר במים שקץ הם לכם
(122220, -67, 4);200;ר;155921;(3, 11, 11, 15, 155921);41138;(3, 11, 11, 4, 41138);מבשרם;4;4;ושקץ יהיו לכם מבשרם לא תאכלו ואת נבלתם תשקצו
(122220, -67, 4);40;מ;155988;(3, 11, 13, 12, 155988);41157;(3, 11, 13, 4, 41157);מן;1;4;ואת אלה תשקצו מן העוף לא יאכלו שקץ הם את הנשר ואת הפרס ואת העזניה
(122220, -67, 4);40;מ;156055;(3, 11, 15, 9, 156055);41177;(3, 11, 15, 4, 41177);למינו;2;4;את כל ערב למינו
(122220, -67, 4);5;ה;156122;(3, 11, 18, 4, 156122);41195;(3, 11, 18, 2, 41195);התנשמת;1;2;ואת התנשמת ואת הקאת ואת הרחם
(122220, -67, 4);5;ה;156189;(3, 11, 20, 11, 156189);41211;(3, 11, 20, 4, 41211);ההלך;2;4;כל שרץ העוף ההלך על ארבע שקץ הוא לכם
(122220, -67, 4);10;י;156256;(3, 11, 21, 50, 156256);41231;(3, 11, 21, 15, 41231);לרגליו;5;15;אך את זה תאכלו מכל שרץ העוף ההלך על ארבע אשר לא כרעים ממעל לרגליו לנתר בהן על הארץ
(122220, -67, 4);6;ו;156323;(3, 11, 22, 53, 156323);41248;(3, 11, 22, 13, 41248);למינהו;6;13;את אלה מהם תאכלו את הארבה למינו ואת הסלעם למינהו ואת החרגל למינהו ואת החגב למינהו
(122220, -67, 4);400;ת;156390;(3, 11, 24, 21, 156390);41266;(3, 11, 24, 5, 41266);בנבלתם;5;5;ולאלה תטמאו כל הנגע בנבלתם יטמא עד הערב
(122220, -67, 4);6;ו;156457;(3, 11, 26, 24, 156457);41284;(3, 11, 26, 7, 41284);ושסע;1;7;לכל הבהמה אשר הוא מפרסת פרסה ושסע איננה שסעת וגרה איננה מעלה טמאים הם לכם כל הנגע בהם יטמא
(122220, -67, 4);10;י;156524;(3, 11, 27, 19, 156524);41302;(3, 11, 27, 6, 41302);החיה;3;6;וכל הולך על כפיו בכל החיה ההלכת על ארבע טמאים הם לכם כל הנגע בנבלתם יטמא עד הערב
(122220, -67, 4);9;ט;156591;(3, 11, 28, 23, 156591);41320;(3, 11, 28, 6, 41320);וטמא;2;6;והנשא את נבלתם יכבס בגדיו וטמא עד הערב טמאים המה לכם
(122220, -67, 4);50;נ;156658;(3, 11, 30, 4, 156658);41337;(3, 11, 30, 1, 41337);והאנקה;4;1;והאנקה והכח והלטאה והחמט והתנשמת
(122220, -67, 4);6;ו;156725;(3, 11, 32, 1, 156725);41354;(3, 11, 32, 1, 41354);וכל;1;1;וכל אשר יפל עליו מהם במתם יטמא מכל כלי עץ או בגד או עור או שק כל כלי אשר יעשה מלאכה בהם במים יובא וטמא עד הערב וטהר
(122220, -67, 4);40;מ;156792;(3, 11, 32, 68, 156792);41376;(3, 11, 32, 23, 41376);במים;2;23;וכל אשר יפל עליו מהם במתם יטמא מכל כלי עץ או בגד או עור או שק כל כלי אשר יעשה מלאכה בהם במים יובא וטמא עד הערב וטהר
(122220, -67, 4);6;ו;156859;(3, 11, 33, 47, 156859);41395;(3, 11, 33, 14, 41395);תשברו;5;14;וכל כלי חרש אשר יפל מהם אל תוכו כל אשר בתוכו יטמא ואתו תשברו
(122220, -67, 4);50;נ;156926;(3, 11, 35, 11, 156926);41415;(3, 11, 35, 4, 41415);מנבלתם;2;4;וכל אשר יפל מנבלתם עליו יטמא תנור וכירים יתץ טמאים הם וטמאים יהיו לכם
(122220, -67, 4);9;ט;156993;(3, 11, 36, 22, 156993);41432;(3, 11, 36, 7, 41432);טהור;1;7;אך מעין ובור מקוה מים יהיה טהור ונגע בנבלתם יטמא
(122220, -67, 4);200;ר;157060;(3, 11, 38, 13, 157060);41451;(3, 11, 38, 5, 41451);זרע;2;5;וכי יתן מים על זרע ונפל מנבלתם עליו טמא הוא לכם
(122220, -67, 4);70;ע;157127;(3, 11, 39, 43, 157127);41469;(3, 11, 39, 12, 41469);עד;1;12;וכי ימות מן הבהמה אשר היא לכם לאכלה הנגע בנבלתה יטמא עד הערב
(122220, -67, 4);6;ו;157194;(3, 11, 41, 1, 157194);41486;(3, 11, 41, 1, 41486);וכל;1;1;וכל השרץ השרץ על הארץ שקץ הוא לא יאכל
(122220, -67, 4);30;ל;157261;(3, 11, 42, 39, 157261);41507;(3, 11, 42, 13, 41507);לכל;1;13;כל הולך על גחון וכל הולך על ארבע עד כל מרבה רגלים לכל השרץ השרץ על הארץ לא תאכלום כי שקץ הם
(122220, -67, 4);2;ב;157328;(3, 11, 43, 36, 157328);41526;(3, 11, 43, 10, 41526);בהם;1;10;אל תשקצו את נפשתיכם בכל השרץ השרץ ולא תטמאו בהם ונטמתם בם
(122220, -67, 4);400;ת;157395;(3, 11, 44, 57, 157395);41542;(3, 11, 44, 14, 41542);נפשתיכם;4;14;כי אני יהוה אלהיכם והתקדשתם והייתם קדשים כי קדוש אני ולא תטמאו את נפשתיכם בכל השרץ הרמש על הארץ
(122220, -67, 4);100;ק;157462;(3, 11, 45, 47, 157462);41559;(3, 11, 45, 12, 41559);קדשים;1;12;כי אני יהוה המעלה אתכם מארץ מצרים להית לכם לאלהים והייתם קדשים כי קדוש אני
(122220, -67, 4);90;ץ;157529;(3, 11, 46, 54, 157529);41576;(3, 11, 46, 14, 41576);הארץ;4;14;זאת תורת הבהמה והעוף וכל נפש החיה הרמשת במים ולכל נפש השרצת על הארץ
(122220, -67, 4);30;ל;157596;(3, 12, 1, 15, 157596);41594;(3, 12, 1, 5, 41594);לאמר;1;5;וידבר יהוה אל משה לאמר
(122220, -67, 4);6;ו;157663;(3, 12, 3, 1, 157663);41612;(3, 12, 3, 1, 41612);וביום;1;1;וביום השמיני ימול בשר ערלתו
(122220, -67, 4);40;מ;157730;(3, 12, 4, 45, 157730);41629;(3, 12, 4, 13, 41629);המקדש;2;13;ושלשים יום ושלשת ימים תשב בדמי טהרה בכל קדש לא תגע ואל המקדש לא תבא עד מלאת ימי טהרה
(122220, -67, 4);30;ל;157797;(3, 12, 5, 46, 157797);41647;(3, 12, 5, 12, 41647);על;2;12;ואם נקבה תלד וטמאה שבעים כנדתה וששים יום וששת ימים תשב על דמי טהרה
(122220, -67, 4);1;א;157864;(3, 12, 6, 60, 157864);41668;(3, 12, 6, 19, 41668);אהל;1;19;ובמלאת ימי טהרה לבן או לבת תביא כבש בן שנתו לעלה ובן יונה או תר לחטאת אל פתח אהל מועד אל הכהן
(122220, -67, 4);30;ל;157931;(3, 12, 7, 55, 157931);41685;(3, 12, 7, 14, 41685);לנקבה;1;14;והקריבו לפני יהוה וכפר עליה וטהרה ממקר דמיה זאת תורת הילדת לזכר או לנקבה
(122220, -67, 4);10;י;157998;(3, 12, 8, 63, 157998);41704;(3, 12, 8, 19, 41704);עליה;3;19;ואם לא תמצא ידה די שה ולקחה שתי תרים או שני בני יונה אחד לעלה ואחד לחטאת וכפר עליה הכהן וטהרה
(122220, -67, 4);400;ת;158065;(3, 13, 2, 32, 158065);41723;(3, 13, 2, 10, 41723);בהרת;4;10;אדם כי יהיה בעור בשרו שאת או ספחת או בהרת והיה בעור בשרו לנגע צרעת והובא אל אהרן הכהן או אל אחד מבניו הכהנים
(122220, -67, 4);70;ע;158132;(3, 13, 3, 14, 158132);41741;(3, 13, 3, 4, 41741);הנגע;4;4;וראה הכהן את הנגע בעור הבשר ושער בנגע הפך לבן ומראה הנגע עמק מעור בשרו נגע צרעת הוא וראהו הכהן וטמא אתו
(122220, -67, 4);400;ת;158199;(3, 13, 3, 81, 158199);41759;(3, 13, 3, 22, 41759);אתו;2;22;וראה הכהן את הנגע בעור הבשר ושער בנגע הפך לבן ומראה הנגע עמק מעור בשרו נגע צרעת הוא וראהו הכהן וטמא אתו
(122220, -67, 4);50;נ;158266;(3, 13, 4, 66, 158266);41778;(3, 13, 4, 19, 41778);הנגע;2;19;ואם בהרת לבנה הוא בעור בשרו ועמק אין מראה מן העור ושערה לא הפך לבן והסגיר הכהן את הנגע שבעת ימים
(122220, -67, 4);5;ה;158333;(3, 13, 5, 57, 158333);41794;(3, 13, 5, 14, 41794);הכהן;1;14;וראהו הכהן ביום השביעי והנה הנגע עמד בעיניו לא פשה הנגע בעור והסגירו הכהן שבעת ימים שנית
(122220, -67, 4);9;ט;158400;(3, 13, 6, 52, 158400);41811;(3, 13, 6, 14, 41811);וטהרו;2;14;וראה הכהן אתו ביום השביעי שנית והנה כהה הנגע ולא פשה הנגע בעור וטהרו הכהן מספחת הוא וכבס בגדיו וטהר
(122220, -67, 4);200;ר;158467;(3, 13, 7, 39, 158467);41827;(3, 13, 7, 10, 41827);לטהרתו;4;10;ואם פשה תפשה המספחת בעור אחרי הראתו אל הכהן לטהרתו ונראה שנית אל הכהן
(122220, -67, 4);20;כ;158534;(3, 13, 9, 8, 158534);41844;(3, 13, 9, 3, 41844);כי;1;3;נגע צרעת כי תהיה באדם והובא אל הכהן
(122220, -67, 4);10;י;158601;(3, 13, 10, 47, 158601);41862;(3, 13, 10, 13, 41862);חי;2;13;וראה הכהן והנה שאת לבנה בעור והיא הפכה שער לבן ומחית בשר חי בשאת
(122220, -67, 4);70;ע;158668;(3, 13, 12, 18, 158668);41880;(3, 13, 12, 5, 41880);בעור;2;5;ואם פרוח תפרח הצרעת בעור וכסתה הצרעת את כל עור הנגע מראשו ועד רגליו לכל מראה עיני הכהן
(122220, -67, 4);5;ה;158735;(3, 13, 13, 16, 158735);41897;(3, 13, 13, 4, 41897);כסתה;4;4;וראה הכהן והנה כסתה הצרעת את כל בשרו וטהר את הנגע כלו הפך לבן טהור הוא
(122220, -67, 4);5;ה;158802;(3, 13, 15, 7, 158802);41917;(3, 13, 15, 2, 41917);הכהן;3;2;וראה הכהן את הבשר החי וטמאו הבשר החי טמא הוא צרעת הוא
(122220, -67, 4);5;ה;158869;(3, 13, 16, 32, 158869);41937;(3, 13, 16, 10, 41937);הכהן;3;10;או כי ישוב הבשר החי ונהפך ללבן ובא אל הכהן
(122220, -67, 4);50;ן;158936;(3, 13, 18, 20, 158936);41955;(3, 13, 18, 6, 41955);שחין;4;6;ובשר כי יהיה בו בערו שחין ונרפא
(122220, -67, 4);200;ר;159003;(3, 13, 20, 14, 159003);41972;(3, 13, 20, 4, 41972);מראה;2;4;וראה הכהן והנה מראה שפל מן העור ושערה הפך לבן וטמאו הכהן נגע צרעת הוא בשחין פרחה
(122220, -67, 4);1;א;159070;(3, 13, 21, 17, 159070);41990;(3, 13, 21, 5, 41990);אין;1;5;ואם יראנה הכהן והנה אין בה שער לבן ושפלה איננה מן העור והיא כהה והסגירו הכהן שבעת ימים
(122220, -67, 4);6;ו;159137;(3, 13, 22, 15, 159137);42008;(3, 13, 22, 5, 42008);וטמא;1;5;ואם פשה תפשה בעור וטמא הכהן אתו נגע הוא
(122220, -67, 4);10;י;159204;(3, 13, 24, 7, 159204);42026;(3, 13, 24, 3, 42026);כי;2;3;או בשר כי יהיה בערו מכות אש והיתה מחית המכוה בהרת לבנה אדמדמת או לבנה
(122220, -67, 4);20;ך;159271;(3, 13, 25, 19, 159271);42043;(3, 13, 25, 5, 42043);נהפך;4;5;וראה אתה הכהן והנה נהפך שער לבן בבהרת ומראה עמק מן העור צרעת הוא במכוה פרחה וטמא אתו הכהן נגע צרעת הוא
(122220, -67, 4);200;ר;159338;(3, 13, 26, 5, 159338);42062;(3, 13, 26, 2, 42062);יראנה;2;2;ואם יראנה הכהן והנה אין בבהרת שער לבן ושפלה איננה מן העור והוא כהה והסגירו הכהן שבעת ימים
(122220, -67, 4);40;ם;159405;(3, 13, 26, 72, 159405);42078;(3, 13, 26, 18, 42078);ימים;4;18;ואם יראנה הכהן והנה אין בבהרת שער לבן ושפלה איננה מן העור והוא כהה והסגירו הכהן שבעת ימים
(122220, -67, 4);2;ב;159472;(3, 13, 28, 14, 159472);42096;(3, 13, 28, 4, 42096);הבהרת;2;4;ואם תחתיה תעמד הבהרת לא פשתה בעור והוא כהה שאת המכוה הוא וטהרו הכהן כי צרבת המכוה הוא
(122220, -67, 4);5;ה;159539;(3, 13, 29, 13, 159539);42115;(3, 13, 29, 5, 42115);יהיה;2;5;ואיש או אשה כי יהיה בו נגע בראש או בזקן
(122220, -67, 4);6;ו;159606;(3, 13, 30, 50, 159606);42135;(3, 13, 30, 15, 42135);אתו;3;15;וראה הכהן את הנגע והנה מראהו עמק מן העור ובו שער צהב דק וטמא אתו הכהן נתק הוא צרעת הראש או הזקן הוא
(122220, -67, 4);6;ו;159673;(3, 13, 31, 40, 159673);42155;(3, 13, 31, 12, 42155);העור;3;12;וכי יראה הכהן את נגע הנתק והנה אין מראהו עמק מן העור ושער שחר אין בו והסגיר הכהן את נגע הנתק שבעת ימים
(122220, -67, 4);50;נ;159740;(3, 13, 32, 27, 159740);42173;(3, 13, 32, 7, 42173);והנה;3;7;וראה הכהן את הנגע ביום השביעי והנה לא פשה הנתק ולא היה בו שער צהב ומראה הנתק אין עמק מן העור
(122220, -67, 4);60;ס;159807;(3, 13, 33, 22, 159807);42193;(3, 13, 33, 6, 42193);והסגיר;3;6;והתגלח ואת הנתק לא יגלח והסגיר הכהן את הנתק שבעת ימים שנית
(122220, -67, 4);6;ו;159874;(3, 13, 34, 42, 159874);42211;(3, 13, 34, 12, 42211);ומראהו;1;12;וראה הכהן את הנתק ביום השביעי והנה לא פשה הנתק בעור ומראהו איננו עמק מן העור וטהר אתו הכהן וכבס בגדיו וטהר
(122220, -67, 4);5;ה;159941;(3, 13, 35, 24, 159941);42228;(3, 13, 35, 7, 42228);טהרתו;2;7;ואם פשה יפשה הנתק בעור אחרי טהרתו
(122220, -67, 4);100;ק;160008;(3, 13, 37, 16, 160008);42245;(3, 13, 37, 4, 42245);הנתק;4;4;ואם בעיניו עמד הנתק ושער שחר צמח בו נרפא הנתק טהור הוא וטהרו הכהן
(122220, -67, 4);400;ת;160075;(3, 13, 38, 31, 160075);42264;(3, 13, 38, 9, 42264);בהרת;4;9;ואיש או אשה כי יהיה בעור בשרם בהרת בהרת לבנת
(122220, -67, 4);200;ר;160142;(3, 13, 40, 11, 160142);42283;(3, 13, 40, 4, 42283);ראשו;1;4;ואיש כי ימרט ראשו קרח הוא טהור הוא
(122220, -67, 4);400;ת;160209;(3, 13, 42, 19, 160209);42301;(3, 13, 42, 5, 42301);בגבחת;5;5;וכי יהיה בקרחת או בגבחת נגע לבן אדמדם צרעת פרחת הוא בקרחתו או בגבחתו
(122220, -67, 4);40;מ;160276;(3, 13, 43, 31, 160276);42318;(3, 13, 43, 8, 42318);אדמדמת;5;8;וראה אתו הכהן והנה שאת הנגע לבנה אדמדמת בקרחתו או בגבחתו כמראה צרעת עור בשר
(122220, -67, 4);70;ע;160343;(3, 13, 44, 37, 160343);42335;(3, 13, 44, 10, 42335);נגעו;3;10;איש צרוע הוא טמא הוא טמא יטמאנו הכהן בראשו נגעו
(122220, -67, 4);10;י;160410;(3, 13, 46, 3, 160410);42353;(3, 13, 46, 2, 42353);ימי;1;2;כל ימי אשר הנגע בו יטמא טמא הוא בדד ישב מחוץ למחנה מושבו
(122220, -67, 4);40;מ;160477;(3, 13, 47, 26, 160477);42372;(3, 13, 47, 8, 42372);צמר;2;8;והבגד כי יהיה בו נגע צרעת בבגד צמר או בבגד פשתים
(122220, -67, 4);100;ק;160544;(3, 13, 49, 13, 160544);42390;(3, 13, 49, 3, 42390);ירקרק;5;3;והיה הנגע ירקרק או אדמדם בבגד או בעור או בשתי או בערב או בכל כלי עור נגע צרעת הוא והראה את הכהן
(122220, -67, 4);20;כ;160611;(3, 13, 50, 6, 160611);42411;(3, 13, 50, 2, 42411);הכהן;2;2;וראה הכהן את הנגע והסגיר את הנגע שבעת ימים
(122220, -67, 4);10;י;160678;(3, 13, 51, 39, 160678);42429;(3, 13, 51, 11, 42429);בשתי;4;11;וראה את הנגע ביום השביעי כי פשה הנגע בבגד או בשתי או בערב או בעור לכל אשר יעשה העור למלאכה צרעת ממארת הנגע טמא הוא
(122220, -67, 4);300;ש;160745;(3, 13, 52, 16, 160745);42449;(3, 13, 52, 6, 42449);השתי;2;6;ושרף את הבגד או את השתי או את הערב בצמר או בפשתים או את כל כלי העור אשר יהיה בו הנגע כי צרעת ממארת הוא באש תשרף
(122220, -67, 4);300;ש;160812;(3, 13, 52, 83, 160812);42470;(3, 13, 52, 27, 42470);תשרף;2;27;ושרף את הבגד או את השתי או את הערב בצמר או בפשתים או את כל כלי העור אשר יהיה בו הנגע כי צרעת ממארת הוא באש תשרף
(122220, -67, 4);1;א;160879;(3, 13, 54, 14, 160879);42490;(3, 13, 54, 4, 42490);את;1;4;וצוה הכהן וכבסו את אשר בו הנגע והסגירו שבעת ימים שנית
(122220, -67, 4);70;ע;160946;(3, 13, 55, 38, 160946);42509;(3, 13, 55, 12, 42509);עינו;1;12;וראה הכהן אחרי הכבס את הנגע והנה לא הפך הנגע את עינו והנגע לא פשה טמא הוא באש תשרפנו פחתת הוא בקרחתו או בגבחתו
(122220, -67, 4);5;ה;161013;(3, 13, 56, 18, 161013);42527;(3, 13, 56, 6, 42527);הנגע;1;6;ואם ראה הכהן והנה כהה הנגע אחרי הכבס אתו וקרע אתו מן הבגד או מן העור או מן השתי או מן הערב
(122220, -67, 4);6;ו;161080;(3, 13, 57, 16, 161080);42548;(3, 13, 57, 5, 42548);או;2;5;ואם תראה עוד בבגד או בשתי או בערב או בכל כלי עור פרחת הוא באש תשרפנו את אשר בו הנגע
(122220, -67, 4);6;ו;161147;(3, 13, 58, 19, 161147);42569;(3, 13, 58, 6, 42569);או;2;6;והבגד או השתי או הערב או כל כלי העור אשר תכבס וסר מהם הנגע וכבס שנית וטהר
(122220, -67, 4);40;ם;161214;(3, 13, 59, 29, 161214);42588;(3, 13, 59, 8, 42588);הפשתים;6;8;זאת תורת נגע צרעת בגד הצמר או הפשתים או השתי או הערב או כל כלי עור לטהרו או לטמאו
(122220, -67, 4);200;ר;161281;(3, 14, 2, 15, 161281);42608;(3, 14, 2, 4, 42608);המצרע;4;4;זאת תהיה תורת המצרע ביום טהרתו והובא אל הכהן
(122220, -67, 4);5;ה;161348;(3, 14, 3, 46, 161348);42626;(3, 14, 3, 13, 42626);הצרוע;1;13;ויצא הכהן אל מחוץ למחנה וראה הכהן והנה נרפא נגע הצרעת מן הצרוע
(122220, -67, 4);300;ש;161415;(3, 14, 5, 10, 161415);42642;(3, 14, 5, 3, 42642);ושחט;2;3;וצוה הכהן ושחט את הצפור האחת אל כלי חרש על מים חיים
(122220, -67, 4);400;ת;161482;(3, 14, 6, 37, 161482);42662;(3, 14, 6, 11, 42662);התולעת;6;11;את הצפר החיה יקח אתה ואת עץ הארז ואת שני התולעת ואת האזב וטבל אותם ואת הצפר החיה בדם הצפר השחטה על המים החיים
(122220, -67, 4);400;ת;161549;(3, 14, 7, 18, 161549);42680;(3, 14, 7, 5, 42680);הצרעת;5;5;והזה על המטהר מן הצרעת שבע פעמים וטהרו ושלח את הצפר החיה על פני השדה
(122220, -67, 4);8;ח;161616;(3, 14, 8, 31, 161616);42699;(3, 14, 8, 9, 42699);ורחץ;3;9;וכבס המטהר את בגדיו וגלח את כל שערו ורחץ במים וטהר ואחר יבוא אל המחנה וישב מחוץ לאהלו שבעת ימים
(122220, -67, 4);30;ל;161683;(3, 14, 9, 22, 161683);42716;(3, 14, 9, 6, 42716);כל;2;6;והיה ביום השביעי יגלח את כל שערו את ראשו ואת זקנו ואת גבת עיניו ואת כל שערו יגלח וכבס את בגדיו ורחץ את בשרו במים וטהר
(122220, -67, 4);6;ו;161750;(3, 14, 9, 89, 161750);42736;(3, 14, 9, 26, 42736);וטהר;1;26;והיה ביום השביעי יגלח את כל שערו את ראשו ואת זקנו ואת גבת עיניו ואת כל שערו יגלח וכבס את בגדיו ורחץ את בשרו במים וטהר
(122220, -67, 4);5;ה;161817;(3, 14, 10, 64, 161817);42751;(3, 14, 10, 15, 42751);מנחה;4;15;וביום השמיני יקח שני כבשים תמימם וכבשה אחת בת שנתה תמימה ושלשה עשרנים סלת מנחה בלולה בשמן ולג אחד שמן
(122220, -67, 4);6;ו;161884;(3, 14, 12, 1, 161884);42769;(3, 14, 12, 1, 42769);ולקח;1;1;ולקח הכהן את הכבש האחד והקריב אתו לאשם ואת לג השמן והניף אתם תנופה לפני יהוה
(122220, -67, 4);5;ה;161951;(3, 14, 13, 7, 161951);42787;(3, 14, 13, 3, 42787);הכבש;1;3;ושחט את הכבש במקום אשר ישחט את החטאת ואת העלה במקום הקדש כי כחטאת האשם הוא לכהן קדש קדשים הוא
(122220, -67, 4);1;א;162018;(3, 14, 13, 74, 162018);42804;(3, 14, 13, 20, 42804);הוא;3;20;ושחט את הכבש במקום אשר ישחט את החטאת ואת העלה במקום הקדש כי כחטאת האשם הוא לכהן קדש קדשים הוא
