(99813, 75, 4);2;ב;80088;(2, 2, 21, 11, 80088);21133;(2, 2, 21, 3, 21133);לשבת;3;3;ויואל משה לשבת את האיש ויתן את צפרה בתו למשה
(99813, 75, 4);5;ה;80163;(2, 2, 23, 10, 80163);21155;(2, 2, 23, 3, 21155);הרבים;1;3;ויהי בימים הרבים ההם וימת מלך מצרים ויאנחו בני ישראל מן העבדה ויזעקו ותעל שועתם אל האלהים מן העבדה
(99813, 75, 4);70;ע;80238;(2, 2, 24, 5, 80238);21172;(2, 2, 24, 1, 21172);וישמע;5;1;וישמע אלהים את נאקתם ויזכר אלהים את בריתו את אברהם את יצחק ואת יעקב
(99813, 75, 4);5;ה;80313;(2, 2, 25, 26, 80313);21192;(2, 2, 25, 7, 21192);אלהים;3;7;וירא אלהים את בני ישראל וידע אלהים
(99813, 75, 4);30;ל;80388;(2, 3, 2, 6, 80388);21213;(2, 3, 2, 2, 21213);מלאך;2;2;וירא מלאך יהוה אליו בלבת אש מתוך הסנה וירא והנה הסנה בער באש והסנה איננו אכל
(99813, 75, 4);1;א;80463;(2, 3, 3, 20, 80463);21233;(2, 3, 3, 6, 21233);את;1;6;ויאמר משה אסרה נא ואראה את המראה הגדל הזה מדוע לא יבער הסנה
(99813, 75, 4);40;מ;80538;(2, 3, 4, 48, 80538);21253;(2, 3, 4, 13, 21253);משה;1;13;וירא יהוה כי סר לראות ויקרא אליו אלהים מתוך הסנה ויאמר משה משה ויאמר הנני
(99813, 75, 4);40;מ;80613;(2, 3, 6, 4, 80613);21273;(2, 3, 6, 1, 21273);ויאמר;4;1;ויאמר אנכי אלהי אביך אלהי אברהם אלהי יצחק ואלהי יעקב ויסתר משה פניו כי ירא מהביט אל האלהים
(99813, 75, 4);10;י;80688;(2, 3, 7, 6, 80688);21292;(2, 3, 7, 2, 21292);יהוה;1;2;ויאמר יהוה ראה ראיתי את עני עמי אשר במצרים ואת צעקתם שמעתי מפני נגשיו כי ידעתי את מכאביו
(99813, 75, 4);6;ו;80763;(2, 3, 8, 10, 80763);21310;(2, 3, 8, 2, 21310);להצילו;6;2;וארד להצילו מיד מצרים ולהעלתו מן הארץ ההוא אל ארץ טובה ורחבה אל ארץ זבת חלב ודבש אל מקום הכנעני והחתי והאמרי והפרזי והחוי והיבוסי
(99813, 75, 4);40;מ;80838;(2, 3, 8, 85, 80838);21330;(2, 3, 8, 22, 21330);והאמרי;4;22;וארד להצילו מיד מצרים ולהעלתו מן הארץ ההוא אל ארץ טובה ורחבה אל ארץ זבת חלב ודבש אל מקום הכנעני והחתי והאמרי והפרזי והחוי והיבוסי
(99813, 75, 4);40;ם;80913;(2, 3, 9, 55, 80913);21348;(2, 3, 9, 15, 21348);אתם;3;15;ועתה הנה צעקת בני ישראל באה אלי וגם ראיתי את הלחץ אשר מצרים לחצים אתם
(99813, 75, 4);70;ע;80988;(2, 3, 11, 32, 80988);21369;(2, 3, 11, 10, 21369);פרעה;3;10;ויאמר משה אל האלהים מי אנכי כי אלך אל פרעה וכי אוציא את בני ישראל ממצרים
(99813, 75, 4);90;צ;81063;(2, 3, 12, 50, 81063);21389;(2, 3, 12, 14, 21389);ממצרים;3;14;ויאמר כי אהיה עמך וזה לך האות כי אנכי שלחתיך בהוציאך את העם ממצרים תעבדון את האלהים על ההר הזה
(99813, 75, 4);2;ב;81138;(2, 3, 13, 50, 81138);21409;(2, 3, 13, 14, 21409);אבותיכם;2;14;ויאמר משה אל האלהים הנה אנכי בא אל בני ישראל ואמרתי להם אלהי אבותיכם שלחני אליכם ואמרו לי מה שמו מה אמר אלהם
(99813, 75, 4);2;ב;81213;(2, 3, 14, 39, 81213);21429;(2, 3, 14, 11, 21429);לבני;2;11;ויאמר אלהים אל משה אהיה אשר אהיה ויאמר כה תאמר לבני ישראל אהיה שלחני אליכם
(99813, 75, 4);2;ב;81288;(2, 3, 15, 54, 81288);21448;(2, 3, 15, 15, 21448);אברהם;2;15;ויאמר עוד אלהים אל משה כה תאמר אל בני ישראל יהוה אלהי אבתיכם אלהי אברהם אלהי יצחק ואלהי יעקב שלחני אליכם זה שמי לעלם וזה זכרי לדר דר
(99813, 75, 4);1;א;81363;(2, 3, 16, 24, 81363);21468;(2, 3, 16, 7, 21468);אלהם;1;7;לך ואספת את זקני ישראל ואמרת אלהם יהוה אלהי אבתיכם נראה אלי אלהי אברהם יצחק ויעקב לאמר פקד פקדתי אתכם ואת העשוי לכם במצרים
(99813, 75, 4);40;ם;81438;(2, 3, 16, 99, 81438);21485;(2, 3, 16, 24, 21485);במצרים;6;24;לך ואספת את זקני ישראל ואמרת אלהם יהוה אלהי אבתיכם נראה אלי אלהי אברהם יצחק ויעקב לאמר פקד פקדתי אתכם ואת העשוי לכם במצרים
(99813, 75, 4);2;ב;81513;(2, 3, 17, 75, 81513);21503;(2, 3, 17, 18, 21503);ודבש;3;18;ואמר אעלה אתכם מעני מצרים אל ארץ הכנעני והחתי והאמרי והפרזי והחוי והיבוסי אל ארץ זבת חלב ודבש
(99813, 75, 4);5;ה;81588;(2, 3, 18, 74, 81588);21520;(2, 3, 18, 17, 21520);ועתה;4;17;ושמעו לקלך ובאת אתה וזקני ישראל אל מלך מצרים ואמרתם אליו יהוה אלהי העבריים נקרה עלינו ועתה נלכה נא דרך שלשת ימים במדבר ונזבחה ליהוה אלהינו
(99813, 75, 4);2;ב;81663;(2, 3, 19, 36, 81663);21540;(2, 3, 19, 11, 21540);ביד;1;11;ואני ידעתי כי לא יתן אתכם מלך מצרים להלך ולא ביד חזקה
(99813, 75, 4);50;ן;81738;(2, 3, 21, 9, 81738);21559;(2, 3, 21, 3, 21559);חן;2;3;ונתתי את חן העם הזה בעיני מצרים והיה כי תלכון לא תלכו ריקם
(99813, 75, 4);300;ש;81813;(2, 3, 22, 38, 81813);21579;(2, 3, 22, 10, 21579);ושמלת;2;10;ושאלה אשה משכנתה ומגרת ביתה כלי כסף וכלי זהב ושמלת ושמתם על בניכם ועל בנתיכם ונצלתם את מצרים
(99813, 75, 4);20;כ;81888;(2, 4, 1, 38, 81888);21598;(2, 4, 1, 11, 21598);כי;1;11;ויען משה ויאמר והן לא יאמינו לי ולא ישמעו בקלי כי יאמרו לא נראה אליך יהוה
(99813, 75, 4);5;ה;81963;(2, 4, 3, 27, 81963);21615;(2, 4, 3, 5, 21615);ארצה;4;5;ויאמר השליכהו ארצה וישלכהו ארצה ויהי לנחש וינס משה מפניו
(99813, 75, 4);80;פ;82038;(2, 4, 4, 55, 82038);21635;(2, 4, 4, 15, 21635);בכפו;3;15;ויאמר יהוה אל משה שלח ידך ואחז בזנבו וישלח ידו ויחזק בו ויהי למטה בכפו
(99813, 75, 4);2;ב;82113;(2, 4, 6, 16, 82113);21654;(2, 4, 6, 5, 21654);הבא;2;5;ויאמר יהוה לו עוד הבא נא ידך בחיקך ויבא ידו בחיקו ויוצאה והנה ידו מצרעת כשלג
(99813, 75, 4);6;ו;82188;(2, 4, 7, 30, 82188);21674;(2, 4, 7, 9, 21674);חיקו;4;9;ויאמר השב ידך אל חיקך וישב ידו אל חיקו ויוצאה מחיקו והנה שבה כבשרו
(99813, 75, 4);8;ח;82263;(2, 4, 8, 52, 82263);21693;(2, 4, 8, 14, 21693);האחרון;3;14;והיה אם לא יאמינו לך ולא ישמעו לקל האת הראשון והאמינו לקל האת האחרון
(99813, 75, 4);40;מ;82338;(2, 4, 9, 72, 82338);21711;(2, 4, 9, 18, 21711);המים;2;18;והיה אם לא יאמינו גם לשני האתות האלה ולא ישמעון לקלך ולקחת ממימי היאר ושפכת היבשה והיו המים אשר תקח מן היאר והיו לדם ביבשת
(99813, 75, 4);3;ג;82413;(2, 4, 10, 49, 82413);21733;(2, 4, 10, 15, 21733);גם;1;15;ויאמר משה אל יהוה בי אדני לא איש דברים אנכי גם מתמול גם משלשם גם מאז דברך אל עבדך כי כבד פה וכבד לשון אנכי
(99813, 75, 4);80;פ;82488;(2, 4, 11, 42, 82488);21758;(2, 4, 11, 15, 21758);פקח;1;15;ויאמר יהוה אליו מי שם פה לאדם או מי ישום אלם או חרש או פקח או עור הלא אנכי יהוה
(99813, 75, 4);30;ל;82563;(2, 4, 13, 22, 82563);21779;(2, 4, 13, 7, 21779);תשלח;3;7;ויאמר בי אדני שלח נא ביד תשלח
(99813, 75, 4);6;ו;82638;(2, 4, 14, 74, 82638);21800;(2, 4, 14, 21, 21800);ושמח;1;21;ויחר אף יהוה במשה ויאמר הלא אהרן אחיך הלוי ידעתי כי דבר ידבר הוא וגם הנה הוא יצא לקראתך וראך ושמח בלבו
(99813, 75, 4);6;ו;82713;(2, 4, 16, 1, 82713);21819;(2, 4, 16, 1, 21819);ודבר;1;1;ודבר הוא לך אל העם והיה הוא יהיה לך לפה ואתה תהיה לו לאלהים
(99813, 75, 4);1;א;82788;(2, 4, 17, 30, 82788);21842;(2, 4, 17, 10, 21842);האתת;2;10;ואת המטה הזה תקח בידך אשר תעשה בו את האתת
(99813, 75, 4);10;י;82863;(2, 4, 18, 73, 82863);21862;(2, 4, 18, 20, 21862);יתרו;1;20;וילך משה וישב אל יתר חתנו ויאמר לו אלכה נא ואשובה אל אחי אשר במצרים ואראה העודם חיים ויאמר יתרו למשה לך לשלום
(99813, 75, 4);5;ה;82938;(2, 4, 20, 7, 82938);21882;(2, 4, 20, 2, 21882);משה;3;2;ויקח משה את אשתו ואת בניו וירכבם על החמר וישב ארצה מצרים ויקח משה את מטה האלהים בידו
(99813, 75, 4);2;ב;83013;(2, 4, 21, 15, 83013);21903;(2, 4, 21, 5, 21903);בלכתך;1;5;ויאמר יהוה אל משה בלכתך לשוב מצרימה ראה כל המפתים אשר שמתי בידך ועשיתם לפני פרעה ואני אחזק את לבו ולא ישלח את העם
(99813, 75, 4);40;ם;83088;(2, 4, 21, 90, 83088);21922;(2, 4, 21, 24, 21922);העם;3;24;ויאמר יהוה אל משה בלכתך לשוב מצרימה ראה כל המפתים אשר שמתי בידך ועשיתם לפני פרעה ואני אחזק את לבו ולא ישלח את העם
(99813, 75, 4);3;ג;83163;(2, 4, 23, 43, 83163);21942;(2, 4, 23, 11, 21942);הרג;3;11;ואמר אליך שלח את בני ויעבדני ותמאן לשלחו הנה אנכי הרג את בנך בכרך
(99813, 75, 4);30;ל;83238;(2, 4, 25, 32, 83238);21961;(2, 4, 25, 9, 21961);לרגליו;4;9;ותקח צפרה צר ותכרת את ערלת בנה ותגע לרגליו ותאמר כי חתן דמים אתה לי
(99813, 75, 4);4;ד;83313;(2, 4, 27, 28, 83313);21982;(2, 4, 27, 8, 21982);המדברה;3;8;ויאמר יהוה אל אהרן לך לקראת משה המדברה וילך ויפגשהו בהר האלהים וישק לו
(99813, 75, 4);5;ה;83388;(2, 4, 28, 46, 83388);22002;(2, 4, 28, 14, 22002);צוהו;3;14;ויגד משה לאהרן את כל דברי יהוה אשר שלחו ואת כל האתת אשר צוהו
(99813, 75, 4);1;א;83463;(2, 4, 30, 40, 83463);22023;(2, 4, 30, 12, 22023);האתת;2;12;וידבר אהרן את כל הדברים אשר דבר יהוה אל משה ויעש האתת לעיני העם
(99813, 75, 4);40;מ;83538;(2, 5, 1, 8, 83538);22043;(2, 5, 1, 3, 22043);משה;1;3;ואחר באו משה ואהרן ויאמרו אל פרעה כה אמר יהוה אלהי ישראל שלח את עמי ויחגו לי במדבר
(99813, 75, 4);200;ר;83613;(2, 5, 2, 18, 83613);22063;(2, 5, 2, 5, 22063);אשר;3;5;ויאמר פרעה מי יהוה אשר אשמע בקלו לשלח את ישראל לא ידעתי את יהוה וגם את ישראל לא אשלח
(99813, 75, 4);30;ל;83688;(2, 5, 3, 27, 83688);22083;(2, 5, 3, 6, 22083);נלכה;2;6;ויאמרו אלהי העברים נקרא עלינו נלכה נא דרך שלשת ימים במדבר ונזבחה ליהוה אלהינו פן יפגענו בדבר או בחרב
(99813, 75, 4);5;ה;83763;(2, 5, 4, 20, 83763);22101;(2, 5, 4, 5, 22101);למה;3;5;ויאמר אלהם מלך מצרים למה משה ואהרן תפריעו את העם ממעשיו לכו לסבלתיכם
(99813, 75, 4);40;ם;83838;(2, 5, 5, 39, 83838);22119;(2, 5, 5, 10, 22119);מסבלתם;6;10;ויאמר פרעה הן רבים עתה עם הארץ והשבתם אתם מסבלתם
(99813, 75, 4);40;ם;83913;(2, 5, 7, 36, 83913);22138;(2, 5, 7, 9, 22138);שלשם;4;9;לא תאספון לתת תבן לעם ללבן הלבנים כתמול שלשם הם ילכו וקששו להם תבן
(99813, 75, 4);10;י;83988;(2, 5, 8, 58, 83988);22158;(2, 5, 8, 15, 22158);נרפים;4;15;ואת מתכנת הלבנים אשר הם עשים תמול שלשם תשימו עליהם לא תגרעו ממנו כי נרפים הם על כן הם צעקים לאמר נלכה נזבחה לאלהינו
(99813, 75, 4);10;י;84063;(2, 5, 10, 2, 84063);22178;(2, 5, 10, 1, 22178);ויצאו;2;1;ויצאו נגשי העם ושטריו ויאמרו אל העם לאמר כה אמר פרעה אינני נתן לכם תבן
(99813, 75, 4);40;מ;84138;(2, 5, 11, 21, 84138);22199;(2, 5, 11, 7, 22199);תמצאו;2;7;אתם לכו קחו לכם תבן מאשר תמצאו כי אין נגרע מעבדתכם דבר
(99813, 75, 4);4;ד;84213;(2, 5, 13, 25, 84213);22218;(2, 5, 13, 6, 22218);דבר;1;6;והנגשים אצים לאמר כלו מעשיכם דבר יום ביומו כאשר בהיות התבן
(99813, 75, 4);20;כ;84288;(2, 5, 14, 52, 84288);22237;(2, 5, 14, 14, 22237);חקכם;3;14;ויכו שטרי בני ישראל אשר שמו עלהם נגשי פרעה לאמר מדוע לא כליתם חקכם ללבן כתמול שלשם גם תמול גם היום
(99813, 75, 4);400;ת;84363;(2, 5, 16, 1, 84363);22257;(2, 5, 16, 1, 22257);תבן;1;1;תבן אין נתן לעבדיך ולבנים אמרים לנו עשו והנה עבדיך מכים וחטאת עמך
(99813, 75, 4);1;א;84438;(2, 5, 17, 23, 84438);22276;(2, 5, 17, 7, 22276);אתם;1;7;ויאמר נרפים אתם נרפים על כן אתם אמרים נלכה נזבחה ליהוה
(99813, 75, 4);30;ל;84513;(2, 5, 19, 17, 84513);22294;(2, 5, 19, 4, 22294);ישראל;5;4;ויראו שטרי בני ישראל אתם ברע לאמר לא תגרעו מלבניכם דבר יום ביומו
(99813, 75, 4);70;ע;84588;(2, 5, 20, 40, 84588);22313;(2, 5, 20, 10, 22313);פרעה;3;10;ויפגעו את משה ואת אהרן נצבים לקראתם בצאתם מאת פרעה
(99813, 75, 4);30;ל;84663;(2, 5, 21, 74, 84663);22331;(2, 5, 21, 18, 22331);להרגנו;1;18;ויאמרו אלהם ירא יהוה עליכם וישפט אשר הבאשתם את ריחנו בעיני פרעה ובעיני עבדיו לתת חרב בידם להרגנו
(99813, 75, 4);5;ה;84738;(2, 5, 23, 23, 84738);22351;(2, 5, 23, 7, 22351);הרע;1;7;ומאז באתי אל פרעה לדבר בשמך הרע לעם הזה והצל לא הצלת את עמך
(99813, 75, 4);8;ח;84813;(2, 6, 1, 52, 84813);22373;(2, 6, 1, 15, 22373);חזקה;1;15;ויאמר יהוה אל משה עתה תראה אשר אעשה לפרעה כי ביד חזקה ישלחם וביד חזקה יגרשם מארצו
(99813, 75, 4);6;ו;84888;(2, 6, 3, 31, 84888);22393;(2, 6, 3, 10, 22393);ושמי;1;10;וארא אל אברהם אל יצחק ואל יעקב באל שדי ושמי יהוה לא נודעתי להם
(99813, 75, 4);50;נ;84963;(2, 6, 5, 5, 84963);22415;(2, 6, 5, 2, 22415);אני;2;2;וגם אני שמעתי את נאקת בני ישראל אשר מצרים מעבדים אתם ואזכר את בריתי
(99813, 75, 4);90;צ;85038;(2, 6, 6, 26, 85038);22434;(2, 6, 6, 7, 22434);והוצאתי;4;7;לכן אמר לבני ישראל אני יהוה והוצאתי אתכם מתחת סבלת מצרים והצלתי אתכם מעבדתם וגאלתי אתכם בזרוע נטויה ובשפטים גדלים
(99813, 75, 4);1;א;85113;(2, 6, 7, 7, 85113);22449;(2, 6, 7, 2, 22449);אתכם;1;2;ולקחתי אתכם לי לעם והייתי לכם לאלהים וידעתם כי אני יהוה אלהיכם המוציא אתכם מתחת סבלות מצרים
(99813, 75, 4);1;א;85188;(2, 6, 8, 7, 85188);22466;(2, 6, 8, 2, 22466);אתכם;1;2;והבאתי אתכם אל הארץ אשר נשאתי את ידי לתת אתה לאברהם ליצחק וליעקב ונתתי אתה לכם מורשה אני יהוה
(99813, 75, 4);300;ש;85263;(2, 6, 9, 7, 85263);22485;(2, 6, 9, 2, 22485);משה;2;2;וידבר משה כן אל בני ישראל ולא שמעו אל משה מקצר רוח ומעבדה קשה
(99813, 75, 4);90;צ;85338;(2, 6, 11, 16, 85338);22508;(2, 6, 11, 6, 22508);מצרים;2;6;בא דבר אל פרעה מלך מצרים וישלח את בני ישראל מארצו
(99813, 75, 4);70;ע;85413;(2, 6, 12, 52, 85413);22527;(2, 6, 12, 14, 22527);פרעה;3;14;וידבר משה לפני יהוה לאמר הן בני ישראל לא שמעו אלי ואיך ישמעני פרעה ואני ערל שפתים
(99813, 75, 4);10;י;85488;(2, 6, 13, 62, 85488);22547;(2, 6, 13, 17, 22547);בני;3;17;וידבר יהוה אל משה ואל אהרן ויצום אל בני ישראל ואל פרעה מלך מצרים להוציא את בני ישראל מארץ מצרים
(99813, 75, 4);50;ן;85563;(2, 6, 14, 61, 85563);22565;(2, 6, 14, 15, 22565);ראובן;5;15;אלה ראשי בית אבתם בני ראובן בכר ישראל חנוך ופלוא חצרן וכרמי אלה משפחת ראובן
(99813, 75, 4);400;ת;85638;(2, 6, 16, 16, 85638);22583;(2, 6, 16, 5, 22583);לתלדתם;2;5;ואלה שמות בני לוי לתלדתם גרשון וקהת ומררי ושני חיי לוי שבע ושלשים ומאת שנה
(99813, 75, 4);400;ת;85713;(2, 6, 18, 7, 85713);22600;(2, 6, 18, 2, 22600);קהת;3;2;ובני קהת עמרם ויצהר וחברון ועזיאל ושני חיי קהת שלש ושלשים ומאת שנה
(99813, 75, 4);6;ו;85788;(2, 6, 19, 28, 85788);22618;(2, 6, 19, 7, 22618);הלוי;3;7;ובני מררי מחלי ומושי אלה משפחת הלוי לתלדתם
(99813, 75, 4);300;ש;85863;(2, 6, 20, 68, 85863);22639;(2, 6, 20, 20, 22639);שנה;1;20;ויקח עמרם את יוכבד דדתו לו לאשה ותלד לו את אהרן ואת משה ושני חיי עמרם שבע ושלשים ומאת שנה
(99813, 75, 4);400;ת;85938;(2, 6, 23, 28, 85938);22656;(2, 6, 23, 7, 22656);אחות;4;7;ויקח אהרן את אלישבע בת עמינדב אחות נחשון לו לאשה ותלד לו את נדב ואת אביהוא את אלעזר ואת איתמר
(99813, 75, 4);300;ש;86013;(2, 6, 24, 29, 86013);22676;(2, 6, 24, 7, 22676);משפחת;2;7;ובני קרח אסיר ואלקנה ואביאסף אלה משפחת הקרחי
(99813, 75, 4);80;פ;86088;(2, 6, 25, 67, 86088);22695;(2, 6, 25, 18, 22695);למשפחתם;4;18;ואלעזר בן אהרן לקח לו מבנות פוטיאל לו לאשה ותלד לו את פינחס אלה ראשי אבות הלוים למשפחתם
(99813, 75, 4);40;מ;86163;(2, 6, 27, 16, 86163);22715;(2, 6, 27, 5, 22715);מלך;1;5;הם המדברים אל פרעה מלך מצרים להוציא את בני ישראל ממצרים הוא משה ואהרן
(99813, 75, 4);10;י;86238;(2, 6, 29, 6, 86238);22734;(2, 6, 29, 2, 22734);יהוה;1;2;וידבר יהוה אל משה לאמר אני יהוה דבר אל פרעה מלך מצרים את כל אשר אני דבר אליך
(99813, 75, 4);70;ע;86313;(2, 6, 30, 22, 86313);22757;(2, 6, 30, 7, 22757);ערל;1;7;ויאמר משה לפני יהוה הן אני ערל שפתים ואיך ישמע אלי פרעה
(99813, 75, 4);5;ה;86388;(2, 7, 2, 3, 86388);22775;(2, 7, 2, 1, 22775);אתה;3;1;אתה תדבר את כל אשר אצוך ואהרן אחיך ידבר אל פרעה ושלח את בני ישראל מארצו
(99813, 75, 4);400;ת;86463;(2, 7, 3, 22, 86463);22796;(2, 7, 3, 6, 22796);והרביתי;6;6;ואני אקשה את לב פרעה והרביתי את אתתי ואת מופתי בארץ מצרים
(99813, 75, 4);2;ב;86538;(2, 7, 4, 51, 86538);22816;(2, 7, 4, 14, 22816);בני;1;14;ולא ישמע אלכם פרעה ונתתי את ידי במצרים והוצאתי את צבאתי את עמי בני ישראל מארץ מצרים בשפטים גדלים
(99813, 75, 4);10;י;86613;(2, 7, 5, 48, 86613);22834;(2, 7, 5, 13, 22834);בני;3;13;וידעו מצרים כי אני יהוה בנטתי את ידי על מצרים והוצאתי את בני ישראל מתוכם
(99813, 75, 4);2;ב;86688;(2, 7, 7, 34, 86688);22855;(2, 7, 7, 10, 22855);בדברם;1;10;ומשה בן שמנים שנה ואהרן בן שלש ושמנים שנה בדברם אל פרעה
(99813, 75, 4);100;ק;86763;(2, 7, 9, 40, 86763);22876;(2, 7, 9, 12, 22876);קח;1;12;כי ידבר אלכם פרעה לאמר תנו לכם מופת ואמרת אל אהרן קח את מטך והשלך לפני פרעה יהי לתנין
(99813, 75, 4);40;מ;86838;(2, 7, 10, 48, 86838);22897;(2, 7, 10, 14, 22897);מטהו;1;14;ויבא משה ואהרן אל פרעה ויעשו כן כאשר צוה יהוה וישלך אהרן את מטהו לפני פרעה ולפני עבדיו ויהי לתנין
(99813, 75, 4);2;ב;86913;(2, 7, 11, 45, 86913);22914;(2, 7, 11, 11, 22914);בלהטיהם;1;11;ויקרא גם פרעה לחכמים ולמכשפים ויעשו גם הם חרטמי מצרים בלהטיהם כן
(99813, 75, 4);300;ש;86988;(2, 7, 13, 24, 86988);22932;(2, 7, 13, 7, 22932);כאשר;3;7;ויחזק לב פרעה ולא שמע אלהם כאשר דבר יהוה
(99813, 75, 4);6;ו;87063;(2, 7, 15, 34, 87063);22953;(2, 7, 15, 9, 22953);לקראתו;6;9;לך אל פרעה בבקר הנה יצא המימה ונצבת לקראתו על שפת היאר והמטה אשר נהפך לנחש תקח בידך
(99813, 75, 4);40;מ;87138;(2, 7, 16, 43, 87138);22973;(2, 7, 16, 11, 22973);עמי;2;11;ואמרת אליו יהוה אלהי העברים שלחני אליך לאמר שלח את עמי ויעבדני במדבר והנה לא שמעת עד כה
(99813, 75, 4);30;ל;87213;(2, 7, 17, 48, 87213);22995;(2, 7, 17, 15, 22995);על;2;15;כה אמר יהוה בזאת תדע כי אני יהוה הנה אנכי מכה במטה אשר בידי על המים אשר ביאר ונהפכו לדם
(99813, 75, 4);5;ה;87288;(2, 7, 19, 7, 87288);23014;(2, 7, 19, 2, 23014);יהוה;2;2;ויאמר יהוה אל משה אמר אל אהרן קח מטך ונטה ידך על מימי מצרים על נהרתם על יאריהם ועל אגמיהם ועל כל מקוה מימיהם ויהיו דם והיה דם בכל ארץ מצרים ובעצים ובאבנים
(99813, 75, 4);40;מ;87363;(2, 7, 19, 82, 87363);23036;(2, 7, 19, 24, 23036);מימיהם;3;24;ויאמר יהוה אל משה אמר אל אהרן קח מטך ונטה ידך על מימי מצרים על נהרתם על יאריהם ועל אגמיהם ועל כל מקוה מימיהם ויהיו דם והיה דם בכל ארץ מצרים ובעצים ובאבנים
(99813, 75, 4);6;ו;87438;(2, 7, 20, 35, 87438);23055;(2, 7, 20, 10, 23055);ויך;1;10;ויעשו כן משה ואהרן כאשר צוה יהוה וירם במטה ויך את המים אשר ביאר לעיני פרעה ולעיני עבדיו ויהפכו כל המים אשר ביאר לדם
(99813, 75, 4);2;ב;87513;(2, 7, 21, 18, 87513);23074;(2, 7, 21, 5, 23074);ויבאש;3;5;והדגה אשר ביאר מתה ויבאש היאר ולא יכלו מצרים לשתות מים מן היאר ויהי הדם בכל ארץ מצרים
(99813, 75, 4);10;י;87588;(2, 7, 22, 25, 87588);23093;(2, 7, 22, 6, 23093);ויחזק;2;6;ויעשו כן חרטמי מצרים בלטיהם ויחזק לב פרעה ולא שמע אלהם כאשר דבר יהוה
(99813, 75, 4);40;ם;87663;(2, 7, 24, 13, 87663);23114;(2, 7, 24, 3, 23114);מצרים;5;3;ויחפרו כל מצרים סביבת היאר מים לשתות כי לא יכלו לשתת ממימי היאר
(99813, 75, 4);10;י;87738;(2, 7, 26, 6, 87738);23134;(2, 7, 26, 2, 23134);יהוה;1;2;ויאמר יהוה אל משה בא אל פרעה ואמרת אליו כה אמר יהוה שלח את עמי ויעבדני
(99813, 75, 4);20;כ;87813;(2, 7, 27, 26, 87813);23157;(2, 7, 27, 9, 23157);כל;1;9;ואם מאן אתה לשלח הנה אנכי נגף את כל גבולך בצפרדעים
(99813, 75, 4);6;ו;87888;(2, 7, 28, 61, 87888);23173;(2, 7, 28, 14, 23173);ובתנוריך;1;14;ושרץ היאר צפרדעים ועלו ובאו בביתך ובחדר משכבך ועל מטתך ובבית עבדיך ובעמך ובתנוריך ובמשארותיך
(99813, 75, 4);400;ת;87963;(2, 8, 1, 28, 87963);23189;(2, 8, 1, 9, 23189);את;2;9;ויאמר יהוה אל משה אמר אל אהרן נטה את ידך במטך על הנהרת על היארים ועל האגמים והעל את הצפרדעים על ארץ מצרים
(99813, 75, 4);90;צ;88038;(2, 8, 2, 20, 88038);23210;(2, 8, 2, 7, 23210);מצרים;2;7;ויט אהרן את ידו על מימי מצרים ותעל הצפרדע ותכס את ארץ מצרים
(99813, 75, 4);100;ק;88113;(2, 8, 4, 3, 88113);23227;(2, 8, 4, 1, 23227);ויקרא;3;1;ויקרא פרעה למשה ולאהרן ויאמר העתירו אל יהוה ויסר הצפרדעים ממני ומעמי ואשלחה את העם ויזבחו ליהוה
(99813, 75, 4);6;ו;88188;(2, 8, 4, 78, 88188);23243;(2, 8, 4, 17, 23243);ליהוה;4;17;ויקרא פרעה למשה ולאהרן ויאמר העתירו אל יהוה ויסר הצפרדעים ממני ומעמי ואשלחה את העם ויזבחו ליהוה
(99813, 75, 4);400;ת;88263;(2, 8, 5, 74, 88263);23260;(2, 8, 5, 17, 23260);תשארנה;1;17;ויאמר משה לפרעה התפאר עלי למתי אעתיר לך ולעבדיך ולעמך להכרית הצפרדעים ממך ומבתיך רק ביאר תשארנה
(99813, 75, 4);20;ך;88338;(2, 8, 7, 28, 88338);23275;(2, 8, 7, 5, 23275);ומעבדיך;7;5;וסרו הצפרדעים ממך ומבתיך ומעבדיך ומעמך רק ביאר תשארנה
