(224118, -61, 4);8;ח;153785;(3, 9, 18, 21, 153785);40578;(3, 9, 18, 6, 40578);זבח;3;6;וישחט את השור ואת האיל זבח השלמים אשר לעם וימצאו בני אהרן את הדם אליו ויזרקהו על המזבח סביב
(224118, -61, 4);40;ם;153846;(3, 9, 19, 9, 153846);40593;(3, 9, 19, 2, 40593);החלבים;6;2;ואת החלבים מן השור ומן האיל האליה והמכסה והכלית ויתרת הכבד
(224118, -61, 4);6;ו;153907;(3, 9, 20, 22, 153907);40608;(3, 9, 20, 6, 40608);ויקטר;1;6;וישימו את החלבים על החזות ויקטר החלבים המזבחה
(224118, -61, 4);90;צ;153968;(3, 9, 21, 45, 153968);40622;(3, 9, 21, 12, 40622);צוה;1;12;ואת החזות ואת שוק הימין הניף אהרן תנופה לפני יהוה כאשר צוה משה
(224118, -61, 4);5;ה;154029;(3, 9, 23, 7, 154029);40637;(3, 9, 23, 2, 40637);משה;3;2;ויבא משה ואהרן אל אהל מועד ויצאו ויברכו את העם וירא כבוד יהוה אל כל העם
(224118, -61, 4);10;י;154090;(3, 9, 24, 12, 154090);40655;(3, 9, 24, 4, 40655);יהוה;1;4;ותצא אש מלפני יהוה ותאכל על המזבח את העלה ואת החלבים וירא כל העם וירנו ויפלו על פניהם
(224118, -61, 4);6;ו;154151;(3, 10, 1, 5, 154151);40670;(3, 10, 1, 1, 40670);ויקחו;5;1;ויקחו בני אהרן נדב ואביהוא איש מחתתו ויתנו בהן אש וישימו עליה קטרת ויקריבו לפני יהוה אש זרה אשר לא צוה אתם
(224118, -61, 4);10;י;154212;(3, 10, 1, 66, 154212);40685;(3, 10, 1, 16, 40685);יהוה;1;16;ויקחו בני אהרן נדב ואביהוא איש מחתתו ויתנו בהן אש וישימו עליה קטרת ויקריבו לפני יהוה אש זרה אשר לא צוה אתם
(224118, -61, 4);200;ר;154273;(3, 10, 3, 5, 154273);40701;(3, 10, 3, 1, 40701);ויאמר;5;1;ויאמר משה אל אהרן הוא אשר דבר יהוה לאמר בקרבי אקדש ועל פני כל העם אכבד וידם אהרן
(224118, -61, 4);100;ק;154334;(3, 10, 4, 3, 154334);40719;(3, 10, 4, 1, 40719);ויקרא;3;1;ויקרא משה אל מישאל ואל אלצפן בני עזיאל דד אהרן ויאמר אלהם קרבו שאו את אחיכם מאת פני הקדש אל מחוץ למחנה
(224118, -61, 4);80;פ;154395;(3, 10, 4, 64, 154395);40736;(3, 10, 4, 18, 40736);פני;1;18;ויקרא משה אל מישאל ואל אלצפן בני עזיאל דד אהרן ויאמר אלהם קרבו שאו את אחיכם מאת פני הקדש אל מחוץ למחנה
(224118, -61, 4);40;מ;154456;(3, 10, 6, 6, 154456);40751;(3, 10, 6, 2, 40751);משה;1;2;ויאמר משה אל אהרן ולאלעזר ולאיתמר בניו ראשיכם אל תפרעו ובגדיכם לא תפרמו ולא תמתו ועל כל העדה יקצף ואחיכם כל בית ישראל יבכו את השרפה אשר שרף יהוה
(224118, -61, 4);6;ו;154517;(3, 10, 6, 67, 154517);40765;(3, 10, 6, 16, 40765);ועל;1;16;ויאמר משה אל אהרן ולאלעזר ולאיתמר בניו ראשיכם אל תפרעו ובגדיכם לא תפרמו ולא תמתו ועל כל העדה יקצף ואחיכם כל בית ישראל יבכו את השרפה אשר שרף יהוה
(224118, -61, 4);4;ד;154578;(3, 10, 7, 12, 154578);40781;(3, 10, 7, 3, 40781);מועד;4;3;ומפתח אהל מועד לא תצאו פן תמתו כי שמן משחת יהוה עליכם ויעשו כדבר משה
(224118, -61, 4);200;ר;154639;(3, 10, 8, 19, 154639);40798;(3, 10, 8, 5, 40798);לאמר;4;5;וידבר יהוה אל אהרן לאמר
(224118, -61, 4);5;ה;154700;(3, 10, 10, 3, 154700);40815;(3, 10, 10, 1, 40815);ולהבדיל;3;1;ולהבדיל בין הקדש ובין החל ובין הטמא ובין הטהור
(224118, -61, 4);1;א;154761;(3, 10, 11, 26, 154761);40831;(3, 10, 11, 8, 40831);אשר;1;8;ולהורת את בני ישראל את כל החקים אשר דבר יהוה אליהם ביד משה
(224118, -61, 4);40;ם;154822;(3, 10, 12, 41, 154822);40846;(3, 10, 12, 10, 40846);הנותרים;7;10;וידבר משה אל אהרן ואל אלעזר ואל איתמר בניו הנותרים קחו את המנחה הנותרת מאשי יהוה ואכלוה מצות אצל המזבח כי קדש קדשים הוא
(224118, -61, 4);40;ם;154883;(3, 10, 13, 6, 154883);40861;(3, 10, 13, 1, 40861);ואכלתם;6;1;ואכלתם אתה במקום קדוש כי חקך וחק בניך הוא מאשי יהוה כי כן צויתי
(224118, -61, 4);6;ו;154944;(3, 10, 14, 17, 154944);40879;(3, 10, 14, 5, 40879);שוק;2;5;ואת חזה התנופה ואת שוק התרומה תאכלו במקום טהור אתה ובניך ובנתיך אתך כי חקך וחק בניך נתנו מזבחי שלמי בני ישראל
(224118, -61, 4);30;ל;155005;(3, 10, 14, 78, 155005);40894;(3, 10, 14, 20, 40894);שלמי;2;20;ואת חזה התנופה ואת שוק התרומה תאכלו במקום טהור אתה ובניך ובנתיך אתך כי חקך וחק בניך נתנו מזבחי שלמי בני ישראל
(224118, -61, 4);5;ה;155066;(3, 10, 15, 51, 155066);40908;(3, 10, 15, 12, 40908);יהוה;2;12;שוק התרומה וחזה התנופה על אשי החלבים יביאו להניף תנופה לפני יהוה והיה לך ולבניך אתך לחק עולם כאשר צוה יהוה
(224118, -61, 4);300;ש;155127;(3, 10, 16, 26, 155127);40925;(3, 10, 16, 8, 40925);שרף;1;8;ואת שעיר החטאת דרש דרש משה והנה שרף ויקצף על אלעזר ועל איתמר בני אהרן הנותרם לאמר
(224118, -61, 4);6;ו;155188;(3, 10, 17, 22, 155188);40940;(3, 10, 17, 6, 40940);במקום;4;6;מדוע לא אכלתם את החטאת במקום הקדש כי קדש קדשים הוא ואתה נתן לכם לשאת את עון העדה לכפר עליהם לפני יהוה
(224118, -61, 4);30;ל;155249;(3, 10, 18, 3, 155249);40958;(3, 10, 18, 2, 40958);לא;1;2;הן לא הובא את דמה אל הקדש פנימה אכול תאכלו אתה בקדש כאשר צויתי
(224118, -61, 4);5;ה;155310;(3, 10, 19, 15, 155310);40975;(3, 10, 19, 5, 40975);הן;1;5;וידבר אהרן אל משה הן היום הקריבו את חטאתם ואת עלתם לפני יהוה ותקראנה אתי כאלה ואכלתי חטאת היום הייטב בעיני יהוה
(224118, -61, 4);40;ם;155371;(3, 10, 19, 76, 155371);40989;(3, 10, 19, 19, 40989);היום;4;19;וידבר אהרן אל משה הן היום הקריבו את חטאתם ואת עלתם לפני יהוה ותקראנה אתי כאלה ואכלתי חטאת היום הייטב בעיני יהוה
(224118, -61, 4);5;ה;155432;(3, 11, 1, 28, 155432);41004;(3, 11, 1, 8, 41004);אלהם;3;8;וידבר יהוה אל משה ואל אהרן לאמר אלהם
(224118, -61, 4);60;ס;155493;(3, 11, 3, 10, 155493);41021;(3, 11, 3, 3, 41021);פרסה;3;3;כל מפרסת פרסה ושסעת שסע פרסת מעלת גרה בבהמה אתה תאכלו
(224118, -61, 4);60;ס;155554;(3, 11, 4, 28, 155554);41037;(3, 11, 4, 8, 41037);וממפרסי;6;8;אך את זה לא תאכלו ממעלי הגרה וממפרסי הפרסה את הגמל כי מעלה גרה הוא ופרסה איננו מפריס טמא הוא לכם
(224118, -61, 4);5;ה;155615;(3, 11, 5, 13, 155615);41054;(3, 11, 5, 4, 41054);מעלה;4;4;ואת השפן כי מעלה גרה הוא ופרסה לא יפריס טמא הוא לכם
(224118, -61, 4);5;ה;155676;(3, 11, 6, 34, 155676);41071;(3, 11, 6, 9, 41071);הפריסה;6;9;ואת הארנבת כי מעלת גרה הוא ופרסה לא הפריסה טמאה הוא לכם
(224118, -61, 4);1;א;155737;(3, 11, 7, 51, 155737);41089;(3, 11, 7, 15, 41089);הוא;3;15;ואת החזיר כי מפריס פרסה הוא ושסע שסע פרסה והוא גרה לא יגר טמא הוא לכם
(224118, -61, 4);300;ש;155798;(3, 11, 9, 23, 155798);41107;(3, 11, 9, 8, 41107);אשר;2;8;את זה תאכלו מכל אשר במים כל אשר לו סנפיר וקשקשת במים בימים ובנחלים אתם תאכלו
(224118, -61, 4);2;ב;155859;(3, 11, 10, 23, 155859);41122;(3, 11, 10, 7, 41122);בימים;1;7;וכל אשר אין לו סנפיר וקשקשת בימים ובנחלים מכל שרץ המים ומכל נפש החיה אשר במים שקץ הם לכם
(224118, -61, 4);300;ש;155920;(3, 11, 11, 14, 155920);41138;(3, 11, 11, 4, 41138);מבשרם;3;4;ושקץ יהיו לכם מבשרם לא תאכלו ואת נבלתם תשקצו
(224118, -61, 4);30;ל;155981;(3, 11, 13, 5, 155981);41155;(3, 11, 13, 2, 41155);אלה;2;2;ואת אלה תשקצו מן העוף לא יאכלו שקץ הם את הנשר ואת הפרס ואת העזניה
(224118, -61, 4);30;ל;156042;(3, 11, 14, 15, 156042);41173;(3, 11, 14, 5, 41173);למינה;1;5;ואת הדאה ואת האיה למינה
(224118, -61, 4);6;ו;156103;(3, 11, 17, 8, 156103);41190;(3, 11, 17, 3, 41190);ואת;1;3;ואת הכוס ואת השלך ואת הינשוף
(224118, -61, 4);5;ה;156164;(3, 11, 19, 23, 156164);41205;(3, 11, 19, 6, 41205);הדוכיפת;1;6;ואת החסידה האנפה למינה ואת הדוכיפת ואת העטלף
(224118, -61, 4);70;ע;156225;(3, 11, 21, 19, 156225);41223;(3, 11, 21, 7, 41223);העוף;2;7;אך את זה תאכלו מכל שרץ העוף ההלך על ארבע אשר לא כרעים ממעל לרגליו לנתר בהן על הארץ
(224118, -61, 4);5;ה;156286;(3, 11, 22, 16, 156286);41241;(3, 11, 22, 6, 41241);הארבה;1;6;את אלה מהם תאכלו את הארבה למינו ואת הסלעם למינהו ואת החרגל למינהו ואת החגב למינהו
(224118, -61, 4);1;א;156347;(3, 11, 23, 11, 156347);41255;(3, 11, 23, 4, 41255);אשר;1;4;וכל שרץ העוף אשר לו ארבע רגלים שקץ הוא לכם
(224118, -61, 4);1;א;156408;(3, 11, 25, 7, 156408);41271;(3, 11, 25, 2, 41271);הנשא;4;2;וכל הנשא מנבלתם יכבס בגדיו וטמא עד הערב
(224118, -61, 4);400;ת;156469;(3, 11, 26, 36, 156469);41286;(3, 11, 26, 9, 41286);שסעת;4;9;לכל הבהמה אשר הוא מפרסת פרסה ושסע איננה שסעת וגרה איננה מעלה טמאים הם לכם כל הנגע בהם יטמא
(224118, -61, 4);400;ת;156530;(3, 11, 27, 25, 156530);41303;(3, 11, 27, 7, 41303);ההלכת;5;7;וכל הולך על כפיו בכל החיה ההלכת על ארבע טמאים הם לכם כל הנגע בנבלתם יטמא עד הערב
(224118, -61, 4);9;ט;156591;(3, 11, 28, 23, 156591);41320;(3, 11, 28, 6, 41320);וטמא;2;6;והנשא את נבלתם יכבס בגדיו וטמא עד הערב טמאים המה לכם
(224118, -61, 4);50;נ;156652;(3, 11, 29, 42, 156652);41336;(3, 11, 29, 11, 41336);למינהו;4;11;וזה לכם הטמא בשרץ השרץ על הארץ החלד והעכבר והצב למינהו
(224118, -61, 4);400;ת;156713;(3, 11, 31, 31, 156713);41350;(3, 11, 31, 9, 41350);במתם;3;9;אלה הטמאים לכם בכל השרץ כל הנגע בהם במתם יטמא עד הערב
(224118, -61, 4);30;ל;156774;(3, 11, 32, 50, 156774);41371;(3, 11, 32, 18, 41371);כלי;2;18;וכל אשר יפל עליו מהם במתם יטמא מכל כלי עץ או בגד או עור או שק כל כלי אשר יעשה מלאכה בהם במים יובא וטמא עד הערב וטהר
(224118, -61, 4);20;כ;156835;(3, 11, 33, 23, 156835);41389;(3, 11, 33, 8, 41389);תוכו;3;8;וכל כלי חרש אשר יפל מהם אל תוכו כל אשר בתוכו יטמא ואתו תשברו
(224118, -61, 4);300;ש;156896;(3, 11, 34, 37, 156896);41406;(3, 11, 34, 11, 41406);משקה;2;11;מכל האכל אשר יאכל אשר יבוא עליו מים יטמא וכל משקה אשר ישתה בכל כלי יטמא
(224118, -61, 4);5;ה;156957;(3, 11, 35, 42, 156957);41422;(3, 11, 35, 11, 41422);הם;1;11;וכל אשר יפל מנבלתם עליו יטמא תנור וכירים יתץ טמאים הם וטמאים יהיו לכם
(224118, -61, 4);50;נ;157018;(3, 11, 37, 8, 157018);41438;(3, 11, 37, 3, 41438);מנבלתם;2;3;וכי יפל מנבלתם על כל זרע זרוע אשר יזרע טהור הוא
(224118, -61, 4);5;ה;157079;(3, 11, 38, 32, 157079);41456;(3, 11, 38, 10, 41456);הוא;1;10;וכי יתן מים על זרע ונפל מנבלתם עליו טמא הוא לכם
(224118, -61, 4);2;ב;157140;(3, 11, 40, 8, 157140);41472;(3, 11, 40, 2, 41472);מנבלתה;3;2;והאכל מנבלתה יכבס בגדיו וטמא עד הערב והנשא את נבלתה יכבס בגדיו וטמא עד הערב
(224118, -61, 4);5;ה;157201;(3, 11, 41, 8, 157201);41488;(3, 11, 41, 3, 41488);השרץ;1;3;וכל השרץ השרץ על הארץ שקץ הוא לא יאכל
(224118, -61, 4);20;כ;157262;(3, 11, 42, 40, 157262);41507;(3, 11, 42, 13, 41507);לכל;2;13;כל הולך על גחון וכל הולך על ארבע עד כל מרבה רגלים לכל השרץ השרץ על הארץ לא תאכלום כי שקץ הם
(224118, -61, 4);400;ת;157323;(3, 11, 43, 31, 157323);41525;(3, 11, 43, 9, 41525);תטמאו;1;9;אל תשקצו את נפשתיכם בכל השרץ השרץ ולא תטמאו בהם ונטמתם בם
(224118, -61, 4);1;א;157384;(3, 11, 44, 46, 157384);41539;(3, 11, 44, 11, 41539);ולא;3;11;כי אני יהוה אלהיכם והתקדשתם והייתם קדשים כי קדוש אני ולא תטמאו את נפשתיכם בכל השרץ הרמש על הארץ
(224118, -61, 4);10;י;157445;(3, 11, 45, 30, 157445);41555;(3, 11, 45, 8, 41555);להית;3;8;כי אני יהוה המעלה אתכם מארץ מצרים להית לכם לאלהים והייתם קדשים כי קדוש אני
(224118, -61, 4);300;ש;157506;(3, 11, 46, 31, 157506);41570;(3, 11, 46, 8, 41570);הרמשת;4;8;זאת תורת הבהמה והעוף וכל נפש החיה הרמשת במים ולכל נפש השרצת על הארץ
(224118, -61, 4);10;י;157567;(3, 11, 47, 38, 157567);41585;(3, 11, 47, 9, 41585);ובין;3;9;להבדיל בין הטמא ובין הטהר ובין החיה הנאכלת ובין החיה אשר לא תאכל
(224118, -61, 4);10;י;157628;(3, 12, 2, 29, 157628);41603;(3, 12, 2, 9, 41603);וילדה;2;9;דבר אל בני ישראל לאמר אשה כי תזריע וילדה זכר וטמאה שבעת ימים כימי נדת דותה תטמא
(224118, -61, 4);300;ש;157689;(3, 12, 4, 4, 157689);41617;(3, 12, 4, 1, 41617);ושלשים;4;1;ושלשים יום ושלשת ימים תשב בדמי טהרה בכל קדש לא תגע ואל המקדש לא תבא עד מלאת ימי טהרה
(224118, -61, 4);200;ר;157750;(3, 12, 4, 65, 157750);41635;(3, 12, 4, 19, 41635);טהרה;3;19;ושלשים יום ושלשת ימים תשב בדמי טהרה בכל קדש לא תגע ואל המקדש לא תבא עד מלאת ימי טהרה
(224118, -61, 4);10;י;157811;(3, 12, 6, 7, 157811);41651;(3, 12, 6, 2, 41651);ימי;1;2;ובמלאת ימי טהרה לבן או לבת תביא כבש בן שנתו לעלה ובן יונה או תר לחטאת אל פתח אהל מועד אל הכהן
(224118, -61, 4);30;ל;157872;(3, 12, 6, 68, 157872);41670;(3, 12, 6, 21, 41670);אל;2;21;ובמלאת ימי טהרה לבן או לבת תביא כבש בן שנתו לעלה ובן יונה או תר לחטאת אל פתח אהל מועד אל הכהן
(224118, -61, 4);100;ק;157933;(3, 12, 7, 57, 157933);41685;(3, 12, 7, 14, 41685);לנקבה;3;14;והקריבו לפני יהוה וכפר עליה וטהרה ממקר דמיה זאת תורת הילדת לזכר או לנקבה
(224118, -61, 4);80;פ;157994;(3, 12, 8, 59, 157994);41703;(3, 12, 8, 18, 41703);וכפר;3;18;ואם לא תמצא ידה די שה ולקחה שתי תרים או שני בני יונה אחד לעלה ואחד לחטאת וכפר עליה הכהן וטהרה
(224118, -61, 4);6;ו;158055;(3, 13, 2, 22, 158055);41720;(3, 13, 2, 7, 41720);או;2;7;אדם כי יהיה בעור בשרו שאת או ספחת או בהרת והיה בעור בשרו לנגע צרעת והובא אל אהרן הכהן או אל אחד מבניו הכהנים
(224118, -61, 4);50;נ;158116;(3, 13, 2, 83, 158116);41737;(3, 13, 2, 24, 41737);הכהנים;4;24;אדם כי יהיה בעור בשרו שאת או ספחת או בהרת והיה בעור בשרו לנגע צרעת והובא אל אהרן הכהן או אל אחד מבניו הכהנים
(224118, -61, 4);70;ע;158177;(3, 13, 3, 59, 158177);41753;(3, 13, 3, 16, 41753);נגע;3;16;וראה הכהן את הנגע בעור הבשר ושער בנגע הפך לבן ומראה הנגע עמק מעור בשרו נגע צרעת הוא וראהו הכהן וטמא אתו
(224118, -61, 4);6;ו;158238;(3, 13, 4, 38, 158238);41770;(3, 13, 4, 11, 41770);העור;3;11;ואם בהרת לבנה הוא בעור בשרו ועמק אין מראה מן העור ושערה לא הפך לבן והסגיר הכהן את הנגע שבעת ימים
(224118, -61, 4);5;ה;158299;(3, 13, 5, 23, 158299);41785;(3, 13, 5, 5, 41785);והנה;4;5;וראהו הכהן ביום השביעי והנה הנגע עמד בעיניו לא פשה הנגע בעור והסגירו הכהן שבעת ימים שנית
(224118, -61, 4);2;ב;158360;(3, 13, 6, 12, 158360);41801;(3, 13, 6, 4, 41801);ביום;1;4;וראה הכהן אתו ביום השביעי שנית והנה כהה הנגע ולא פשה הנגע בעור וטהרו הכהן מספחת הוא וכבס בגדיו וטהר
(224118, -61, 4);3;ג;158421;(3, 13, 6, 73, 158421);41816;(3, 13, 6, 19, 41816);בגדיו;2;19;וראה הכהן אתו ביום השביעי שנית והנה כהה הנגע ולא פשה הנגע בעור וטהרו הכהן מספחת הוא וכבס בגדיו וטהר
(224118, -61, 4);20;כ;158482;(3, 13, 7, 54, 158482);41831;(3, 13, 7, 14, 41831);הכהן;2;14;ואם פשה תפשה המספחת בעור אחרי הראתו אל הכהן לטהרתו ונראה שנית אל הכהן
(224118, -61, 4);40;ם;158543;(3, 13, 9, 17, 158543);41846;(3, 13, 9, 5, 41846);באדם;4;5;נגע צרעת כי תהיה באדם והובא אל הכהן
(224118, -61, 4);1;א;158604;(3, 13, 10, 50, 158604);41863;(3, 13, 10, 14, 41863);בשאת;3;14;וראה הכהן והנה שאת לבנה בעור והיא הפכה שער לבן ומחית בשר חי בשאת
(224118, -61, 4);70;ע;158665;(3, 13, 12, 15, 158665);41879;(3, 13, 12, 4, 41879);הצרעת;4;4;ואם פרוח תפרח הצרעת בעור וכסתה הצרעת את כל עור הנגע מראשו ועד רגליו לכל מראה עיני הכהן
(224118, -61, 4);5;ה;158726;(3, 13, 13, 7, 158726);41895;(3, 13, 13, 2, 41895);הכהן;3;2;וראה הכהן והנה כסתה הצרעת את כל בשרו וטהר את הנגע כלו הפך לבן טהור הוא
(224118, -61, 4);2;ב;158787;(3, 13, 14, 13, 158787);41913;(3, 13, 14, 4, 41913);בשר;1;4;וביום הראות בו בשר חי יטמא
(224118, -61, 4);300;ש;158848;(3, 13, 16, 11, 158848);41931;(3, 13, 16, 4, 41931);הבשר;3;4;או כי ישוב הבשר החי ונהפך ללבן ובא אל הכהן
(224118, -61, 4);70;ע;158909;(3, 13, 17, 39, 158909);41947;(3, 13, 17, 10, 41947);הנגע;4;10;וראהו הכהן והנה נהפך הנגע ללבן וטהר הכהן את הנגע טהור הוא
(224118, -61, 4);2;ב;158970;(3, 13, 19, 29, 158970);41964;(3, 13, 19, 8, 41964);לבנה;2;8;והיה במקום השחין שאת לבנה או בהרת לבנה אדמדמת ונראה אל הכהן
(224118, -61, 4);5;ה;159031;(3, 13, 20, 42, 159031);41980;(3, 13, 20, 12, 41980);הכהן;1;12;וראה הכהן והנה מראה שפל מן העור ושערה הפך לבן וטמאו הכהן נגע צרעת הוא בשחין פרחה
(224118, -61, 4);50;ן;159092;(3, 13, 21, 39, 159092);41996;(3, 13, 21, 11, 41996);מן;2;11;ואם יראנה הכהן והנה אין בה שער לבן ושפלה איננה מן העור והיא כהה והסגירו הכהן שבעת ימים
(224118, -61, 4);1;א;159153;(3, 13, 22, 31, 159153);42012;(3, 13, 22, 9, 42012);הוא;3;9;ואם פשה תפשה בעור וטמא הכהן אתו נגע הוא
(224118, -61, 4);20;כ;159214;(3, 13, 24, 17, 159214);42029;(3, 13, 24, 6, 42029);מכות;2;6;או בשר כי יהיה בערו מכות אש והיתה מחית המכוה בהרת לבנה אדמדמת או לבנה
(224118, -61, 4);30;ל;159275;(3, 13, 25, 23, 159275);42045;(3, 13, 25, 7, 42045);לבן;1;7;וראה אתה הכהן והנה נהפך שער לבן בבהרת ומראה עמק מן העור צרעת הוא במכוה פרחה וטמא אתו הכהן נגע צרעת הוא
(224118, -61, 4);40;ם;159336;(3, 13, 26, 3, 159336);42061;(3, 13, 26, 1, 42061);ואם;3;1;ואם יראנה הכהן והנה אין בבהרת שער לבן ושפלה איננה מן העור והוא כהה והסגירו הכהן שבעת ימים
(224118, -61, 4);50;ן;159397;(3, 13, 26, 64, 159397);42076;(3, 13, 26, 16, 42076);הכהן;4;16;ואם יראנה הכהן והנה אין בבהרת שער לבן ושפלה איננה מן העור והוא כהה והסגירו הכהן שבעת ימים
(224118, -61, 4);1;א;159458;(3, 13, 27, 53, 159458);42092;(3, 13, 27, 14, 42092);הוא;3;14;וראהו הכהן ביום השביעי אם פשה תפשה בעור וטמא הכהן אתו נגע צרעת הוא
(224118, -61, 4);5;ה;159519;(3, 13, 28, 61, 159519);42109;(3, 13, 28, 17, 42109);המכוה;1;17;ואם תחתיה תעמד הבהרת לא פשתה בעור והוא כהה שאת המכוה הוא וטהרו הכהן כי צרבת המכוה הוא
(224118, -61, 4);70;ע;159580;(3, 13, 30, 24, 159580);42127;(3, 13, 30, 7, 42127);עמק;1;7;וראה הכהן את הנגע והנה מראהו עמק מן העור ובו שער צהב דק וטמא אתו הכהן נתק הוא צרעת הראש או הזקן הוא
(224118, -61, 4);5;ה;159641;(3, 13, 31, 8, 159641);42146;(3, 13, 31, 3, 42146);הכהן;1;3;וכי יראה הכהן את נגע הנתק והנה אין מראהו עמק מן העור ושער שחר אין בו והסגיר הכהן את נגע הנתק שבעת ימים
(224118, -61, 4);5;ה;159702;(3, 13, 31, 69, 159702);42164;(3, 13, 31, 21, 42164);הנתק;1;21;וכי יראה הכהן את נגע הנתק והנה אין מראהו עמק מן העור ושער שחר אין בו והסגיר הכהן את נגע הנתק שבעת ימים
(224118, -61, 4);5;ה;159763;(3, 13, 32, 50, 159763);42181;(3, 13, 32, 15, 42181);צהב;2;15;וראה הכהן את הנגע ביום השביעי והנה לא פשה הנתק ולא היה בו שער צהב ומראה הנתק אין עמק מן העור
(224118, -61, 4);400;ת;159824;(3, 13, 33, 39, 159824);42197;(3, 13, 33, 10, 42197);שבעת;4;10;והתגלח ואת הנתק לא יגלח והסגיר הכהן את הנתק שבעת ימים שנית
(224118, -61, 4);70;ע;159885;(3, 13, 34, 53, 159885);42213;(3, 13, 34, 14, 42213);עמק;1;14;וראה הכהן את הנתק ביום השביעי והנה לא פשה הנתק בעור ומראהו איננו עמק מן העור וטהר אתו הכהן וכבס בגדיו וטהר
(224118, -61, 4);200;ר;159946;(3, 13, 36, 2, 159946);42229;(3, 13, 36, 1, 42229);וראהו;2;1;וראהו הכהן והנה פשה הנתק בעור לא יבקר הכהן לשער הצהב טמא הוא
(224118, -61, 4);400;ת;160007;(3, 13, 37, 15, 160007);42245;(3, 13, 37, 4, 42245);הנתק;3;4;ואם בעיניו עמד הנתק ושער שחר צמח בו נרפא הנתק טהור הוא וטהרו הכהן
(224118, -61, 4);2;ב;160068;(3, 13, 38, 24, 160068);42263;(3, 13, 38, 8, 42263);בהרת;1;8;ואיש או אשה כי יהיה בעור בשרם בהרת בהרת לבנת
(224118, -61, 4);5;ה;160129;(3, 13, 39, 50, 160129);42279;(3, 13, 39, 14, 42279);הוא;1;14;וראה הכהן והנה בעור בשרם בהרת כהות לבנת בהק הוא פרח בעור טהור הוא
(224118, -61, 4);1;א;160190;(3, 13, 41, 32, 160190);42296;(3, 13, 41, 9, 42296);הוא;3;9;ואם מפאת פניו ימרט ראשו גבח הוא טהור הוא
(224118, -61, 4);400;ת;160251;(3, 13, 43, 6, 160251);42312;(3, 13, 43, 2, 42312);אתו;2;2;וראה אתו הכהן והנה שאת הנגע לבנה אדמדמת בקרחתו או בגבחתו כמראה צרעת עור בשר
(224118, -61, 4);6;ו;160312;(3, 13, 44, 6, 160312);42327;(3, 13, 44, 2, 42327);צרוע;3;2;איש צרוע הוא טמא הוא טמא יטמאנו הכהן בראשו נגעו
(224118, -61, 4);40;ם;160373;(3, 13, 45, 29, 160373);42342;(3, 13, 45, 7, 42342);פרמים;5;7;והצרוע אשר בו הנגע בגדיו יהיו פרמים וראשו יהיה פרוע ועל שפם יעטה וטמא טמא יקרא
(224118, -61, 4);4;ד;160434;(3, 13, 46, 27, 160434);42360;(3, 13, 46, 9, 42360);בדד;3;9;כל ימי אשר הנגע בו יטמא טמא הוא בדד ישב מחוץ למחנה מושבו
(224118, -61, 4);10;י;160495;(3, 13, 48, 6, 160495);42377;(3, 13, 48, 2, 42377);בשתי;4;2;או בשתי או בערב לפשתים ולצמר או בעור או בכל מלאכת עור
(224118, -61, 4);1;א;160556;(3, 13, 49, 25, 160556);42394;(3, 13, 49, 7, 42394);או;1;7;והיה הנגע ירקרק או אדמדם בבגד או בעור או בשתי או בערב או בכל כלי עור נגע צרעת הוא והראה את הכהן
(224118, -61, 4);50;נ;160617;(3, 13, 50, 12, 160617);42413;(3, 13, 50, 4, 42413);הנגע;2;4;וראה הכהן את הנגע והסגיר את הנגע שבעת ימים
