(231976, 64, 4);1;א;75176;(1, 48, 21, 48, 75176);19854;(1, 48, 21, 13, 19854);אל;1;13;ויאמר ישראל אל יוסף הנה אנכי מת והיה אלהים עמכם והשיב אתכם אל ארץ אבתיכם
(231976, 64, 4);1;א;75240;(1, 49, 1, 5, 75240);19870;(1, 49, 1, 1, 19870);ויקרא;5;1;ויקרא יעקב אל בניו ויאמר האספו ואגידה לכם את אשר יקרא אתכם באחרית הימים
(231976, 64, 4);2;ב;75304;(1, 49, 2, 11, 75304);19886;(1, 49, 2, 3, 19886);בני;1;3;הקבצו ושמעו בני יעקב ושמעו אל ישראל אביכם
(231976, 64, 4);20;כ;75368;(1, 49, 4, 4, 75368);19903;(1, 49, 4, 2, 19903);כמים;1;2;פחז כמים אל תותר כי עלית משכבי אביך אז חללת יצועי עלה
(231976, 64, 4);40;ם;75432;(1, 49, 5, 26, 75432);19919;(1, 49, 5, 6, 19919);מכרתיהם;7;6;שמעון ולוי אחים כלי חמס מכרתיהם
(231976, 64, 4);7;ז;75496;(1, 49, 7, 11, 75496);19938;(1, 49, 7, 4, 19938);עז;2;4;ארור אפם כי עז ועברתם כי קשתה אחלקם ביעקב ואפיצם בישראל
(231976, 64, 4);10;י;75560;(1, 49, 8, 30, 75560);19953;(1, 49, 8, 8, 19953);ישתחוו;1;8;יהודה אתה יודוך אחיך ידך בערף איביך ישתחוו לך בני אביך
(231976, 64, 4);1;א;75624;(1, 49, 10, 2, 75624);19969;(1, 49, 10, 1, 19969);לא;2;1;לא יסור שבט מיהודה ומחקק מבין רגליו עד כי יבא שילה ולו יקהת עמים
(231976, 64, 4);300;ש;75688;(1, 49, 11, 15, 75688);19986;(1, 49, 11, 4, 19986);ולשרקה;3;4;אסרי לגפן עירה ולשרקה בני אתנו כבס ביין לבשו ובדם ענבים סותה
(231976, 64, 4);6;ו;75752;(1, 49, 13, 3, 75752);20001;(1, 49, 13, 1, 20001);זבולן;3;1;זבולן לחוף ימים ישכן והוא לחוף אנית וירכתו על צידן
(231976, 64, 4);10;י;75816;(1, 49, 15, 2, 75816);20017;(1, 49, 15, 1, 20017);וירא;2;1;וירא מנחה כי טוב ואת הארץ כי נעמה ויט שכמו לסבל ויהי למס עבד
(231976, 64, 4);300;ש;75880;(1, 49, 16, 19, 75880);20036;(1, 49, 16, 6, 20036);ישראל;2;6;דן ידין עמו כאחד שבטי ישראל
(231976, 64, 4);10;י;75944;(1, 49, 18, 13, 75944);20053;(1, 49, 18, 3, 20053);יהוה;1;3;לישועתך קויתי יהוה
(231976, 64, 4);8;ח;76008;(1, 49, 21, 12, 76008);20069;(1, 49, 21, 3, 20069);שלחה;3;3;נפתלי אילה שלחה הנתן אמרי שפר
(231976, 64, 4);6;ו;76072;(1, 49, 23, 18, 76072);20086;(1, 49, 23, 3, 20086);וישטמהו;7;3;וימררהו ורבו וישטמהו בעלי חצים
(231976, 64, 4);1;א;76136;(1, 49, 25, 4, 76136);20103;(1, 49, 25, 2, 20103);אביך;1;2;מאל אביך ויעזרך ואת שדי ויברכך ברכת שמים מעל ברכת תהום רבצת תחת ברכת שדים ורחם
(231976, 64, 4);1;א;76200;(1, 49, 26, 5, 76200);20119;(1, 49, 26, 2, 20119);אביך;1;2;ברכת אביך גברו על ברכת הורי עד תאות גבעת עולם תהיין לראש יוסף ולקדקד נזיר אחיו
(231976, 64, 4);50;ן;76264;(1, 49, 27, 6, 76264);20134;(1, 49, 27, 1, 20134);בנימין;6;1;בנימין זאב יטרף בבקר יאכל עד ולערב יחלק שלל
(231976, 64, 4);1;א;76328;(1, 49, 28, 35, 76328);20153;(1, 49, 28, 11, 20153);אביהם;1;11;כל אלה שבטי ישראל שנים עשר וזאת אשר דבר להם אביהם ויברך אותם איש אשר כברכתו ברך אתם
(231976, 64, 4);6;ו;76392;(1, 49, 29, 33, 76392);20169;(1, 49, 29, 9, 20169);קברו;4;9;ויצו אותם ויאמר אלהם אני נאסף אל עמי קברו אתי אל אבתי אל המערה אשר בשדה עפרון החתי
(231976, 64, 4);1;א;76456;(1, 49, 30, 32, 76456);20187;(1, 49, 30, 9, 20187);בארץ;2;9;במערה אשר בשדה המכפלה אשר על פני ממרא בארץ כנען אשר קנה אברהם את השדה מאת עפרן החתי לאחזת קבר
(231976, 64, 4);300;ש;76520;(1, 49, 31, 22, 76520);20205;(1, 49, 31, 7, 20205);אשתו;2;7;שמה קברו את אברהם ואת שרה אשתו שמה קברו את יצחק ואת רבקה אשתו ושמה קברתי את לאה
(231976, 64, 4);50;נ;76584;(1, 49, 32, 24, 76584);20223;(1, 49, 32, 7, 20223);בני;2;7;מקנה השדה והמערה אשר בו מאת בני חת
(231976, 64, 4);80;פ;76648;(1, 50, 1, 11, 76648);20241;(1, 50, 1, 4, 20241);פני;1;4;ויפל יוסף על פני אביו ויבך עליו וישק לו
(231976, 64, 4);10;י;76712;(1, 50, 2, 44, 76712);20257;(1, 50, 2, 11, 20257);הרפאים;5;11;ויצו יוסף את עבדיו את הרפאים לחנט את אביו ויחנטו הרפאים את ישראל
(231976, 64, 4);40;ם;76776;(1, 50, 3, 56, 76776);20273;(1, 50, 3, 14, 20273);יום;3;14;וימלאו לו ארבעים יום כי כן ימלאו ימי החנטים ויבכו אתו מצרים שבעים יום
(231976, 64, 4);50;נ;76840;(1, 50, 4, 64, 76840);20290;(1, 50, 4, 17, 20290);באזני;4;17;ויעברו ימי בכיתו וידבר יוסף אל בית פרעה לאמר אם נא מצאתי חן בעיניכם דברו נא באזני פרעה לאמר
(231976, 64, 4);10;י;76904;(1, 50, 5, 55, 76904);20306;(1, 50, 5, 14, 20306);תקברני;6;14;אבי השביעני לאמר הנה אנכי מת בקברי אשר כריתי לי בארץ כנען שמה תקברני ועתה אעלה נא ואקברה את אבי ואשובה
(231976, 64, 4);10;י;76968;(1, 50, 7, 5, 76968);20323;(1, 50, 7, 2, 20323);יוסף;1;2;ויעל יוסף לקבר את אביו ויעלו אתו כל עבדי פרעה זקני ביתו וכל זקני ארץ מצרים
(231976, 64, 4);80;ף;77032;(1, 50, 8, 10, 77032);20340;(1, 50, 8, 3, 20340);יוסף;4;3;וכל בית יוסף ואחיו ובית אביו רק טפם וצאנם ובקרם עזבו בארץ גשן
(231976, 64, 4);40;מ;77096;(1, 50, 9, 25, 77096);20358;(1, 50, 9, 8, 20358);המחנה;2;8;ויעל עמו גם רכב גם פרשים ויהי המחנה כבד מאד
(231976, 64, 4);1;א;77160;(1, 50, 10, 55, 77160);20375;(1, 50, 10, 15, 20375);לאביו;2;15;ויבאו עד גרן האטד אשר בעבר הירדן ויספדו שם מספד גדול וכבד מאד ויעש לאביו אבל שבעת ימים
(231976, 64, 4);200;ר;77224;(1, 50, 11, 50, 77224);20391;(1, 50, 11, 13, 20391);למצרים;4;13;וירא יושב הארץ הכנעני את האבל בגרן האטד ויאמרו אבל כבד זה למצרים על כן קרא שמה אבל מצרים אשר בעבר הירדן
(231976, 64, 4);6;ו;77288;(1, 50, 13, 12, 77288);20409;(1, 50, 13, 3, 20409);בניו;4;3;וישאו אתו בניו ארצה כנען ויקברו אתו במערת שדה המכפלה אשר קנה אברהם את השדה לאחזת קבר מאת עפרן החתי על פני ממרא
(231976, 64, 4);5;ה;77352;(1, 50, 13, 76, 77352);20426;(1, 50, 13, 20, 20426);החתי;1;20;וישאו אתו בניו ארצה כנען ויקברו אתו במערת שדה המכפלה אשר קנה אברהם את השדה לאחזת קבר מאת עפרן החתי על פני ממרא
(231976, 64, 4);1;א;77416;(1, 50, 14, 52, 77416);20443;(1, 50, 14, 14, 20443);את;1;14;וישב יוסף מצרימה הוא ואחיו וכל העלים אתו לקבר את אביו אחרי קברו את אביו
(231976, 64, 4);1;א;77480;(1, 50, 15, 59, 77480);20461;(1, 50, 15, 17, 20461);אשר;1;17;ויראו אחי יוסף כי מת אביהם ויאמרו לו ישטמנו יוסף והשב ישיב לנו את כל הרעה אשר גמלנו אתו
(231976, 64, 4);80;פ;77544;(1, 50, 17, 20, 77544);20479;(1, 50, 17, 7, 20479);פשע;1;7;כה תאמרו ליוסף אנא שא נא פשע אחיך וחטאתם כי רעה גמלוך ועתה שא נא לפשע עבדי אלהי אביך ויבך יוסף בדברם אליו
(231976, 64, 4);6;ו;77608;(1, 50, 18, 1, 77608);20496;(1, 50, 18, 1, 20496);וילכו;1;1;וילכו גם אחיו ויפלו לפניו ויאמרו הננו לך לעבדים
(231976, 64, 4);400;ת;77672;(1, 50, 19, 26, 77672);20511;(1, 50, 19, 7, 20511);התחת;4;7;ויאמר אלהם יוסף אל תיראו כי התחת אלהים אני
(231976, 64, 4);1;א;77736;(1, 50, 21, 5, 77736);20529;(1, 50, 21, 2, 20529);אל;1;2;ועתה אל תיראו אנכי אכלכל אתכם ואת טפכם וינחם אותם וידבר על לבם
(231976, 64, 4);2;ב;77800;(1, 50, 22, 19, 77800);20545;(1, 50, 22, 5, 20545);ובית;2;5;וישב יוסף במצרים הוא ובית אביו ויחי יוסף מאה ועשר שנים
(231976, 64, 4);30;ל;77864;(1, 50, 23, 39, 77864);20562;(1, 50, 23, 11, 20562);ילדו;2;11;וירא יוסף לאפרים בני שלשים גם בני מכיר בן מנשה ילדו על ברכי יוסף
(231976, 64, 4);200;ר;77928;(1, 50, 24, 52, 77928);20579;(1, 50, 24, 14, 20579);הארץ;3;14;ויאמר יוסף אל אחיו אנכי מת ואלהים פקד יפקד אתכם והעלה אתכם מן הארץ הזאת אל הארץ אשר נשבע לאברהם ליצחק וליעקב
(231976, 64, 4);100;ק;77992;(1, 50, 25, 29, 77992);20595;(1, 50, 25, 8, 20595);יפקד;3;8;וישבע יוסף את בני ישראל לאמר פקד יפקד אלהים אתכם והעלתם את עצמתי מזה
(231976, 64, 4);200;ר;78056;(1, 50, 26, 38, 78056);20611;(1, 50, 26, 10, 20611);בארון;3;10;וימת יוסף בן מאה ועשר שנים ויחנטו אתו ויישם בארון במצרים
(231976, 64, 4);6;ו;78120;(2, 1, 2, 12, 78120);20626;(2, 1, 2, 3, 20626);לוי;2;3;ראובן שמעון לוי ויהודה
(231976, 64, 4);80;פ;78184;(2, 1, 5, 27, 78184);20642;(2, 1, 5, 8, 20642);נפש;2;8;ויהי כל נפש יצאי ירך יעקב שבעים נפש ויוסף היה במצרים
(231976, 64, 4);6;ו;78248;(2, 1, 7, 23, 78248);20657;(2, 1, 7, 5, 20657);וירבו;5;5;ובני ישראל פרו וישרצו וירבו ויעצמו במאד מאד ותמלא הארץ אתם
(231976, 64, 4);70;ע;78312;(2, 1, 9, 8, 78312);20676;(2, 1, 9, 3, 20676);עמו;1;3;ויאמר אל עמו הנה עם בני ישראל רב ועצום ממנו
(231976, 64, 4);60;ס;78376;(2, 1, 10, 38, 78376);20693;(2, 1, 10, 10, 20693);ונוסף;4;10;הבה נתחכמה לו פן ירבה והיה כי תקראנה מלחמה ונוסף גם הוא על שנאינו ונלחם בנו ועלה מן הארץ
(231976, 64, 4);6;ו;78440;(2, 1, 11, 32, 78440);20710;(2, 1, 11, 8, 20710);ויבן;1;8;וישימו עליו שרי מסים למען ענתו בסבלתם ויבן ערי מסכנות לפרעה את פתם ואת רעמסס
(231976, 64, 4);10;י;78504;(2, 1, 12, 34, 78504);20726;(2, 1, 12, 9, 20726);מפני;4;9;וכאשר יענו אתו כן ירבה וכן יפרץ ויקצו מפני בני ישראל
(231976, 64, 4);10;י;78568;(2, 1, 14, 31, 78568);20741;(2, 1, 14, 7, 20741);ובלבנים;6;7;וימררו את חייהם בעבדה קשה בחמר ובלבנים ובכל עבדה בשדה את כל עבדתם אשר עבדו בהם בפרך
(231976, 64, 4);200;ר;78632;(2, 1, 15, 28, 78632);20757;(2, 1, 15, 6, 20757);אשר;3;6;ויאמר מלך מצרים למילדת העברית אשר שם האחת שפרה ושם השנית פועה
(231976, 64, 4);6;ו;78696;(2, 1, 16, 42, 78696);20774;(2, 1, 16, 11, 20774);והמתן;1;11;ויאמר בילדכן את העבריות וראיתן על האבנים אם בן הוא והמתן אתו ואם בת הוא וחיה
(231976, 64, 4);10;י;78760;(2, 1, 17, 45, 78760);20790;(2, 1, 17, 11, 20790);מצרים;4;11;ותיראן המילדת את האלהים ולא עשו כאשר דבר אליהן מלך מצרים ותחיין את הילדים
(231976, 64, 4);50;ן;78824;(2, 1, 18, 49, 78824);20804;(2, 1, 18, 11, 20804);ותחיין;6;11;ויקרא מלך מצרים למילדת ויאמר להן מדוע עשיתן הדבר הזה ותחיין את הילדים
(231976, 64, 4);1;א;78888;(2, 1, 19, 56, 78888);20820;(2, 1, 19, 14, 20820);תבוא;4;14;ותאמרן המילדת אל פרעה כי לא כנשים המצרית העברית כי חיות הנה בטרם תבוא אלהן המילדת וילדו
(231976, 64, 4);1;א;78952;(2, 1, 21, 17, 78952);20835;(2, 1, 21, 5, 20835);את;1;5;ויהי כי יראו המילדת את האלהים ויעש להם בתים
(231976, 64, 4);400;ת;79016;(2, 1, 22, 46, 79016);20851;(2, 1, 22, 12, 20851);הבת;3;12;ויצו פרעה לכל עמו לאמר כל הבן הילוד היארה תשליכהו וכל הבת תחיון
(231976, 64, 4);50;נ;79080;(2, 2, 2, 34, 79080);20870;(2, 2, 2, 10, 20870);ותצפנהו;5;10;ותהר האשה ותלד בן ותרא אתו כי טוב הוא ותצפנהו שלשה ירחים
(231976, 64, 4);10;י;79144;(2, 2, 3, 53, 79144);20887;(2, 2, 3, 15, 20887);הילד;2;15;ולא יכלה עוד הצפינו ותקח לו תבת גמא ותחמרה בחמר ובזפת ותשם בה את הילד ותשם בסוף על שפת היאר
(231976, 64, 4);200;ר;79208;(2, 2, 5, 20, 79208);20905;(2, 2, 5, 6, 20905);היאר;4;6;ותרד בת פרעה לרחץ על היאר ונערתיה הלכת על יד היאר ותרא את התבה בתוך הסוף ותשלח את אמתה ותקחה
(231976, 64, 4);6;ו;79272;(2, 2, 6, 11, 79272);20921;(2, 2, 6, 2, 20921);ותראהו;6;2;ותפתח ותראהו את הילד והנה נער בכה ותחמל עליו ותאמר מילדי העברים זה
(231976, 64, 4);20;ך;79336;(2, 2, 7, 21, 79336);20938;(2, 2, 7, 6, 20938);האלך;4;6;ותאמר אחתו אל בת פרעה האלך וקראתי לך אשה מינקת מן העברית ותינק לך את הילד
(231976, 64, 4);400;ת;79400;(2, 2, 8, 27, 79400);20956;(2, 2, 8, 8, 20956);ותקרא;2;8;ותאמר לה בת פרעה לכי ותלך העלמה ותקרא את אם הילד
(231976, 64, 4);100;ק;79464;(2, 2, 9, 53, 79464);20974;(2, 2, 9, 15, 20974);ותקח;3;15;ותאמר לה בת פרעה היליכי את הילד הזה והינקהו לי ואני אתן את שכרך ותקח האשה הילד ותניקהו
(231976, 64, 4);20;כ;79528;(2, 2, 10, 48, 79528);20990;(2, 2, 10, 13, 20990);כי;1;13;ויגדל הילד ותבאהו לבת פרעה ויהי לה לבן ותקרא שמו משה ותאמר כי מן המים משיתהו
(231976, 64, 4);10;י;79592;(2, 2, 11, 51, 79592);21006;(2, 2, 11, 13, 21006);מצרי;4;13;ויהי בימים ההם ויגדל משה ויצא אל אחיו וירא בסבלתם וירא איש מצרי מכה איש עברי מאחיו
(231976, 64, 4);6;ו;79656;(2, 2, 13, 7, 79656);21024;(2, 2, 13, 2, 21024);ביום;3;2;ויצא ביום השני והנה שני אנשים עברים נצים ויאמר לרשע למה תכה רעך
(231976, 64, 4);9;ט;79720;(2, 2, 14, 20, 79720);21041;(2, 2, 14, 6, 21041);ושפט;4;6;ויאמר מי שמך לאיש שר ושפט עלינו הלהרגני אתה אמר כאשר הרגת את המצרי ויירא משה ויאמר אכן נודע הדבר
(231976, 64, 4);200;ר;79784;(2, 2, 15, 7, 79784);21057;(2, 2, 15, 2, 21057);פרעה;2;2;וישמע פרעה את הדבר הזה ויבקש להרג את משה ויברח משה מפני פרעה וישב בארץ מדין וישב על הבאר
(231976, 64, 4);6;ו;79848;(2, 2, 16, 1, 79848);21075;(2, 2, 16, 1, 21075);ולכהן;1;1;ולכהן מדין שבע בנות ותבאנה ותדלנה ותמלאנה את הרהטים להשקות צאן אביהן
(231976, 64, 4);70;ע;79912;(2, 2, 17, 8, 79912);21088;(2, 2, 17, 2, 21088);הרעים;3;2;ויבאו הרעים ויגרשום ויקם משה ויושען וישק את צאנם
(231976, 64, 4);50;ן;79976;(2, 2, 18, 32, 79976);21102;(2, 2, 18, 7, 21102);מהרתן;5;7;ותבאנה אל רעואל אביהן ויאמר מדוע מהרתן בא היום
(231976, 64, 4);50;נ;80040;(2, 2, 20, 9, 80040);21120;(2, 2, 20, 3, 21120);בנתיו;2;3;ויאמר אל בנתיו ואיו למה זה עזבתן את האיש קראן לו ויאכל לחם
(231976, 64, 4);200;ר;80104;(2, 2, 21, 27, 80104);21138;(2, 2, 21, 8, 21138);צפרה;3;8;ויואל משה לשבת את האיש ויתן את צפרה בתו למשה
(231976, 64, 4);5;ה;80168;(2, 2, 23, 15, 80168);21156;(2, 2, 23, 4, 21156);ההם;1;4;ויהי בימים הרבים ההם וימת מלך מצרים ויאנחו בני ישראל מן העבדה ויזעקו ותעל שועתם אל האלהים מן העבדה
(231976, 64, 4);4;ד;80232;(2, 2, 23, 79, 80232);21171;(2, 2, 23, 19, 21171);העבדה;4;19;ויהי בימים הרבים ההם וימת מלך מצרים ויאנחו בני ישראל מן העבדה ויזעקו ותעל שועתם אל האלהים מן העבדה
(231976, 64, 4);40;ם;80296;(2, 2, 25, 9, 80296);21187;(2, 2, 25, 2, 21187);אלהים;5;2;וירא אלהים את בני ישראל וידע אלהים
(231976, 64, 4);5;ה;80360;(2, 3, 1, 45, 80360);21206;(2, 3, 1, 14, 21206);המדבר;1;14;ומשה היה רעה את צאן יתרו חתנו כהן מדין וינהג את הצאן אחר המדבר ויבא אל הר האלהים חרבה
(231976, 64, 4);5;ה;80424;(2, 3, 2, 42, 80424);21222;(2, 3, 2, 11, 21222);הסנה;4;11;וירא מלאך יהוה אליו בלבת אש מתוך הסנה וירא והנה הסנה בער באש והסנה איננו אכל
(231976, 64, 4);60;ס;80488;(2, 3, 3, 45, 80488);21240;(2, 3, 3, 13, 21240);הסנה;2;13;ויאמר משה אסרה נא ואראה את המראה הגדל הזה מדוע לא יבער הסנה
(231976, 64, 4);1;א;80552;(2, 3, 5, 3, 80552);21256;(2, 3, 5, 1, 21256);ויאמר;3;1;ויאמר אל תקרב הלם של נעליך מעל רגליך כי המקום אשר אתה עומד עליו אדמת קדש הוא
(231976, 64, 4);50;נ;80616;(2, 3, 6, 7, 80616);21274;(2, 3, 6, 2, 21274);אנכי;2;2;ויאמר אנכי אלהי אביך אלהי אברהם אלהי יצחק ואלהי יעקב ויסתר משה פניו כי ירא מהביט אל האלהים
(231976, 64, 4);5;ה;80680;(2, 3, 6, 71, 80680);21290;(2, 3, 6, 18, 21290);האלהים;4;18;ויאמר אנכי אלהי אביך אלהי אברהם אלהי יצחק ואלהי יעקב ויסתר משה פניו כי ירא מהביט אל האלהים
(231976, 64, 4);400;ת;80744;(2, 3, 7, 62, 80744);21306;(2, 3, 7, 16, 21306);ידעתי;4;16;ויאמר יהוה ראה ראיתי את עני עמי אשר במצרים ואת צעקתם שמעתי מפני נגשיו כי ידעתי את מכאביו
(231976, 64, 4);7;ז;80808;(2, 3, 8, 55, 80808);21323;(2, 3, 8, 15, 21323);זבת;1;15;וארד להצילו מיד מצרים ולהעלתו מן הארץ ההוא אל ארץ טובה ורחבה אל ארץ זבת חלב ודבש אל מקום הכנעני והחתי והאמרי והפרזי והחוי והיבוסי
(231976, 64, 4);10;י;80872;(2, 3, 9, 14, 80872);21337;(2, 3, 9, 4, 21337);בני;3;4;ועתה הנה צעקת בני ישראל באה אלי וגם ראיתי את הלחץ אשר מצרים לחצים אתם
(231976, 64, 4);90;צ;80936;(2, 3, 10, 23, 80936);21354;(2, 3, 10, 6, 21354);והוצא;4;6;ועתה לכה ואשלחך אל פרעה והוצא את עמי בני ישראל ממצרים
(231976, 64, 4);2;ב;81000;(2, 3, 11, 44, 81000);21373;(2, 3, 11, 14, 21373);בני;1;14;ויאמר משה אל האלהים מי אנכי כי אלך אל פרעה וכי אוציא את בני ישראל ממצרים
(231976, 64, 4);200;ר;81064;(2, 3, 12, 51, 81064);21389;(2, 3, 12, 14, 21389);ממצרים;4;14;ויאמר כי אהיה עמך וזה לך האות כי אנכי שלחתיך בהוציאך את העם ממצרים תעבדון את האלהים על ההר הזה
(231976, 64, 4);400;ת;81128;(2, 3, 13, 40, 81128);21406;(2, 3, 13, 11, 21406);ואמרתי;5;11;ויאמר משה אל האלהים הנה אנכי בא אל בני ישראל ואמרתי להם אלהי אבותיכם שלחני אליכם ואמרו לי מה שמו מה אמר אלהם
(231976, 64, 4);10;י;81192;(2, 3, 14, 18, 81192);21423;(2, 3, 14, 5, 21423);אהיה;3;5;ויאמר אלהים אל משה אהיה אשר אהיה ויאמר כה תאמר לבני ישראל אהיה שלחני אליכם
(231976, 64, 4);1;א;81256;(2, 3, 15, 22, 81256);21440;(2, 3, 15, 7, 21440);תאמר;2;7;ויאמר עוד אלהים אל משה כה תאמר אל בני ישראל יהוה אלהי אבתיכם אלהי אברהם אלהי יצחק ואלהי יעקב שלחני אליכם זה שמי לעלם וזה זכרי לדר דר
(231976, 64, 4);5;ה;81320;(2, 3, 15, 86, 81320);21455;(2, 3, 15, 22, 21455);זה;2;22;ויאמר עוד אלהים אל משה כה תאמר אל בני ישראל יהוה אלהי אבתיכם אלהי אברהם אלהי יצחק ואלהי יעקב שלחני אליכם זה שמי לעלם וזה זכרי לדר דר
(231976, 64, 4);5;ה;81384;(2, 3, 16, 45, 81384);21472;(2, 3, 16, 11, 21472);נראה;4;11;לך ואספת את זקני ישראל ואמרת אלהם יהוה אלהי אבתיכם נראה אלי אלהי אברהם יצחק ויעקב לאמר פקד פקדתי אתכם ואת העשוי לכם במצרים
(231976, 64, 4);400;ת;81448;(2, 3, 17, 10, 81448);21488;(2, 3, 17, 3, 21488);אתכם;2;3;ואמר אעלה אתכם מעני מצרים אל ארץ הכנעני והחתי והאמרי והפרזי והחוי והיבוסי אל ארץ זבת חלב ודבש
(231976, 64, 4);4;ד;81512;(2, 3, 17, 74, 81512);21503;(2, 3, 17, 18, 21503);ודבש;2;18;ואמר אעלה אתכם מעני מצרים אל ארץ הכנעני והחתי והאמרי והפרזי והחוי והיבוסי אל ארץ זבת חלב ודבש
(231976, 64, 4);50;נ;81576;(2, 3, 18, 62, 81576);21518;(2, 3, 18, 15, 21518);נקרה;1;15;ושמעו לקלך ובאת אתה וזקני ישראל אל מלך מצרים ואמרתם אליו יהוה אלהי העבריים נקרה עלינו ועתה נלכה נא דרך שלשת ימים במדבר ונזבחה ליהוה אלהינו
(231976, 64, 4);1;א;81640;(2, 3, 19, 13, 81640);21533;(2, 3, 19, 4, 21533);לא;2;4;ואני ידעתי כי לא יתן אתכם מלך מצרים להלך ולא ביד חזקה
(231976, 64, 4);300;ש;81704;(2, 3, 20, 35, 81704);21550;(2, 3, 20, 9, 21550);אשר;2;9;ושלחתי את ידי והכיתי את מצרים בכל נפלאתי אשר אעשה בקרבו ואחרי כן ישלח אתכם
(231976, 64, 4);400;ת;81768;(2, 3, 21, 39, 81768);21568;(2, 3, 21, 12, 21568);תלכו;1;12;ונתתי את חן העם הזה בעיני מצרים והיה כי תלכון לא תלכו ריקם
(231976, 64, 4);2;ב;81832;(2, 3, 22, 57, 81832);21584;(2, 3, 22, 15, 21584);בנתיכם;1;15;ושאלה אשה משכנתה ומגרת ביתה כלי כסף וכלי זהב ושמלת ושמתם על בניכם ועל בנתיכם ונצלתם את מצרים
(231976, 64, 4);1;א;81896;(2, 4, 1, 46, 81896);21600;(2, 4, 1, 13, 21600);לא;2;13;ויען משה ויאמר והן לא יאמינו לי ולא ישמעו בקלי כי יאמרו לא נראה אליך יהוה
(231976, 64, 4);1;א;81960;(2, 4, 3, 24, 81960);21615;(2, 4, 3, 5, 21615);ארצה;1;5;ויאמר השליכהו ארצה וישלכהו ארצה ויהי לנחש וינס משה מפניו
(231976, 64, 4);7;ז;82024;(2, 4, 4, 41, 82024);21631;(2, 4, 4, 11, 21631);ויחזק;4;11;ויאמר יהוה אל משה שלח ידך ואחז בזנבו וישלח ידו ויחזק בו ויהי למטה בכפו
(231976, 64, 4);100;ק;82088;(2, 4, 5, 49, 82088);21647;(2, 4, 5, 12, 21647);יצחק;4;12;למען יאמינו כי נראה אליך יהוה אלהי אבתם אלהי אברהם אלהי יצחק ואלהי יעקב
(231976, 64, 4);200;ר;82152;(2, 4, 6, 55, 82152);21664;(2, 4, 6, 15, 21664);מצרעת;3;15;ויאמר יהוה לו עוד הבא נא ידך בחיקך ויבא ידו בחיקו ויוצאה והנה ידו מצרעת כשלג
(231976, 64, 4);1;א;82216;(2, 4, 8, 5, 82216);21681;(2, 4, 8, 2, 21681);אם;1;2;והיה אם לא יאמינו לך ולא ישמעו לקל האת הראשון והאמינו לקל האת האחרון
(231976, 64, 4);6;ו;82280;(2, 4, 9, 14, 82280);21697;(2, 4, 9, 4, 21697);יאמינו;6;4;והיה אם לא יאמינו גם לשני האתות האלה ולא ישמעון לקלך ולקחת ממימי היאר ושפכת היבשה והיו המים אשר תקח מן היאר והיו לדם ביבשת
(231976, 64, 4);400;ת;82344;(2, 4, 9, 78, 82344);21713;(2, 4, 9, 20, 21713);תקח;1;20;והיה אם לא יאמינו גם לשני האתות האלה ולא ישמעון לקלך ולקחת ממימי היאר ושפכת היבשה והיו המים אשר תקח מן היאר והיו לדם ביבשת
(231976, 64, 4);40;מ;82408;(2, 4, 10, 44, 82408);21732;(2, 4, 10, 14, 21732);משלשם;1;14;ויאמר משה אל יהוה בי אדני לא איש דברים אנכי גם מתמול גם משלשם גם מאז דברך אל עבדך כי כבד פה וכבד לשון אנכי
(231976, 64, 4);40;מ;82472;(2, 4, 11, 26, 82472);21752;(2, 4, 11, 9, 21752);מי;1;9;ויאמר יהוה אליו מי שם פה לאדם או מי ישום אלם או חרש או פקח או עור הלא אנכי יהוה
(231976, 64, 4);300;ש;82536;(2, 4, 12, 30, 82536);21771;(2, 4, 12, 8, 21771);אשר;2;8;ועתה לך ואנכי אהיה עם פיך והוריתיך אשר תדבר
