(301653, 56, 4);5;ה;79333;(2, 2, 7, 18, 79333);20938;(2, 2, 7, 6, 20938);האלך;1;6;ותאמר אחתו אל בת פרעה האלך וקראתי לך אשה מינקת מן העברית ותינק לך את הילד
(301653, 56, 4);10;י;79389;(2, 2, 8, 16, 79389);20953;(2, 2, 8, 5, 20953);לכי;3;5;ותאמר לה בת פרעה לכי ותלך העלמה ותקרא את אם הילד
(301653, 56, 4);5;ה;79445;(2, 2, 9, 34, 79445);20968;(2, 2, 9, 9, 20968);והינקהו;6;9;ותאמר לה בת פרעה היליכי את הילד הזה והינקהו לי ואני אתן את שכרך ותקח האשה הילד ותניקהו
(301653, 56, 4);70;ע;79501;(2, 2, 10, 21, 79501);20982;(2, 2, 10, 5, 20982);פרעה;3;5;ויגדל הילד ותבאהו לבת פרעה ויהי לה לבן ותקרא שמו משה ותאמר כי מן המים משיתהו
(301653, 56, 4);4;ד;79557;(2, 2, 11, 16, 79557);20997;(2, 2, 11, 4, 20997);ויגדל;4;4;ויהי בימים ההם ויגדל משה ויצא אל אחיו וירא בסבלתם וירא איש מצרי מכה איש עברי מאחיו
(301653, 56, 4);5;ה;79613;(2, 2, 12, 6, 79613);21012;(2, 2, 12, 2, 21012);כה;2;2;ויפן כה וכה וירא כי אין איש ויך את המצרי ויטמנהו בחול
(301653, 56, 4);1;א;79669;(2, 2, 13, 20, 79669);21028;(2, 2, 13, 6, 21028);אנשים;1;6;ויצא ביום השני והנה שני אנשים עברים נצים ויאמר לרשע למה תכה רעך
(301653, 56, 4);6;ו;79725;(2, 2, 14, 25, 79725);21042;(2, 2, 14, 7, 21042);עלינו;5;7;ויאמר מי שמך לאיש שר ושפט עלינו הלהרגני אתה אמר כאשר הרגת את המצרי ויירא משה ויאמר אכן נודע הדבר
(301653, 56, 4);40;מ;79781;(2, 2, 15, 4, 79781);21056;(2, 2, 15, 1, 21056);וישמע;4;1;וישמע פרעה את הדבר הזה ויבקש להרג את משה ויברח משה מפני פרעה וישב בארץ מדין וישב על הבאר
(301653, 56, 4);50;ן;79837;(2, 2, 15, 60, 79837);21071;(2, 2, 15, 16, 21071);מדין;4;16;וישמע פרעה את הדבר הזה ויבקש להרג את משה ויברח משה מפני פרעה וישב בארץ מדין וישב על הבאר
(301653, 56, 4);300;ש;79893;(2, 2, 16, 46, 79893);21084;(2, 2, 16, 10, 21084);להשקות;3;10;ולכהן מדין שבע בנות ותבאנה ותדלנה ותמלאנה את הרהטים להשקות צאן אביהן
(301653, 56, 4);50;נ;79949;(2, 2, 18, 5, 79949);21096;(2, 2, 18, 1, 21096);ותבאנה;5;1;ותבאנה אל רעואל אביהן ויאמר מדוע מהרתן בא היום
(301653, 56, 4);5;ה;80005;(2, 2, 19, 23, 80005);21110;(2, 2, 19, 6, 21110);הרעים;1;6;ותאמרן איש מצרי הצילנו מיד הרעים וגם דלה דלה לנו וישק את הצאן
(301653, 56, 4);1;א;80061;(2, 2, 20, 30, 80061);21126;(2, 2, 20, 9, 21126);האיש;2;9;ויאמר אל בנתיו ואיו למה זה עזבתן את האיש קראן לו ויאכל לחם
(301653, 56, 4);2;ב;80117;(2, 2, 22, 5, 80117);21142;(2, 2, 22, 2, 21142);בן;1;2;ותלד בן ויקרא את שמו גרשם כי אמר גר הייתי בארץ נכריה
(301653, 56, 4);40;מ;80173;(2, 2, 23, 20, 80173);21157;(2, 2, 23, 5, 21157);וימת;3;5;ויהי בימים הרבים ההם וימת מלך מצרים ויאנחו בני ישראל מן העבדה ויזעקו ותעל שועתם אל האלהים מן העבדה
(301653, 56, 4);5;ה;80229;(2, 2, 23, 76, 80229);21171;(2, 2, 23, 19, 21171);העבדה;1;19;ויהי בימים הרבים ההם וימת מלך מצרים ויאנחו בני ישראל מן העבדה ויזעקו ותעל שועתם אל האלהים מן העבדה
(301653, 56, 4);70;ע;80285;(2, 2, 24, 52, 80285);21185;(2, 2, 24, 14, 21185);יעקב;2;14;וישמע אלהים את נאקתם ויזכר אלהים את בריתו את אברהם את יצחק ואת יעקב
(301653, 56, 4);50;ן;80341;(2, 3, 1, 26, 80341);21200;(2, 3, 1, 8, 21200);כהן;3;8;ומשה היה רעה את צאן יתרו חתנו כהן מדין וינהג את הצאן אחר המדבר ויבא אל הר האלהים חרבה
(301653, 56, 4);10;י;80397;(2, 3, 2, 15, 80397);21215;(2, 3, 2, 4, 21215);אליו;3;4;וירא מלאך יהוה אליו בלבת אש מתוך הסנה וירא והנה הסנה בער באש והסנה איננו אכל
(301653, 56, 4);60;ס;80453;(2, 3, 3, 10, 80453);21230;(2, 3, 3, 3, 21230);אסרה;2;3;ויאמר משה אסרה נא ואראה את המראה הגדל הזה מדוע לא יבער הסנה
(301653, 56, 4);10;י;80509;(2, 3, 4, 19, 80509);21246;(2, 3, 4, 6, 21246);ויקרא;2;6;וירא יהוה כי סר לראות ויקרא אליו אלהים מתוך הסנה ויאמר משה משה ויאמר הנני
(301653, 56, 4);30;ל;80565;(2, 3, 5, 16, 80565);21260;(2, 3, 5, 5, 21260);של;2;5;ויאמר אל תקרב הלם של נעליך מעל רגליך כי המקום אשר אתה עומד עליו אדמת קדש הוא
(301653, 56, 4);5;ה;80621;(2, 3, 6, 12, 80621);21275;(2, 3, 6, 3, 21275);אלהי;3;3;ויאמר אנכי אלהי אביך אלהי אברהם אלהי יצחק ואלהי יעקב ויסתר משה פניו כי ירא מהביט אל האלהים
(301653, 56, 4);5;ה;80677;(2, 3, 6, 68, 80677);21290;(2, 3, 6, 18, 21290);האלהים;1;18;ויאמר אנכי אלהי אביך אלהי אברהם אלהי יצחק ואלהי יעקב ויסתר משה פניו כי ירא מהביט אל האלהים
(301653, 56, 4);10;י;80733;(2, 3, 7, 51, 80733);21303;(2, 3, 7, 13, 21303);מפני;4;13;ויאמר יהוה ראה ראיתי את עני עמי אשר במצרים ואת צעקתם שמעתי מפני נגשיו כי ידעתי את מכאביו
(301653, 56, 4);1;א;80789;(2, 3, 8, 36, 80789);21317;(2, 3, 8, 9, 21317);אל;1;9;וארד להצילו מיד מצרים ולהעלתו מן הארץ ההוא אל ארץ טובה ורחבה אל ארץ זבת חלב ודבש אל מקום הכנעני והחתי והאמרי והפרזי והחוי והיבוסי
(301653, 56, 4);7;ז;80845;(2, 3, 8, 92, 80845);21331;(2, 3, 8, 23, 21331);והפרזי;5;23;וארד להצילו מיד מצרים ולהעלתו מן הארץ ההוא אל ארץ טובה ורחבה אל ארץ זבת חלב ודבש אל מקום הכנעני והחתי והאמרי והפרזי והחוי והיבוסי
(301653, 56, 4);40;מ;80901;(2, 3, 9, 43, 80901);21346;(2, 3, 9, 13, 21346);מצרים;1;13;ועתה הנה צעקת בני ישראל באה אלי וגם ראיתי את הלחץ אשר מצרים לחצים אתם
(301653, 56, 4);6;ו;80957;(2, 3, 11, 1, 80957);21360;(2, 3, 11, 1, 21360);ויאמר;1;1;ויאמר משה אל האלהים מי אנכי כי אלך אל פרעה וכי אוציא את בני ישראל ממצרים
(301653, 56, 4);40;ם;81013;(2, 3, 11, 57, 81013);21375;(2, 3, 11, 16, 21375);ממצרים;6;16;ויאמר משה אל האלהים מי אנכי כי אלך אל פרעה וכי אוציא את בני ישראל ממצרים
(301653, 56, 4);2;ב;81069;(2, 3, 12, 56, 81069);21390;(2, 3, 12, 15, 21390);תעבדון;3;15;ויאמר כי אהיה עמך וזה לך האות כי אנכי שלחתיך בהוציאך את העם ממצרים תעבדון את האלהים על ההר הזה
(301653, 56, 4);1;א;81125;(2, 3, 13, 37, 81125);21406;(2, 3, 13, 11, 21406);ואמרתי;2;11;ויאמר משה אל האלהים הנה אנכי בא אל בני ישראל ואמרתי להם אלהי אבותיכם שלחני אליכם ואמרו לי מה שמו מה אמר אלהם
(301653, 56, 4);30;ל;81181;(2, 3, 14, 7, 81181);21420;(2, 3, 14, 2, 21420);אלהים;2;2;ויאמר אלהים אל משה אהיה אשר אהיה ויאמר כה תאמר לבני ישראל אהיה שלחני אליכם
(301653, 56, 4);1;א;81237;(2, 3, 15, 3, 81237);21434;(2, 3, 15, 1, 21434);ויאמר;3;1;ויאמר עוד אלהים אל משה כה תאמר אל בני ישראל יהוה אלהי אבתיכם אלהי אברהם אלהי יצחק ואלהי יעקב שלחני אליכם זה שמי לעלם וזה זכרי לדר דר
(301653, 56, 4);30;ל;81293;(2, 3, 15, 59, 81293);21449;(2, 3, 15, 16, 21449);אלהי;2;16;ויאמר עוד אלהים אל משה כה תאמר אל בני ישראל יהוה אלהי אבתיכם אלהי אברהם אלהי יצחק ואלהי יעקב שלחני אליכם זה שמי לעלם וזה זכרי לדר דר
(301653, 56, 4);7;ז;81349;(2, 3, 16, 10, 81349);21465;(2, 3, 16, 4, 21465);זקני;1;4;לך ואספת את זקני ישראל ואמרת אלהם יהוה אלהי אבתיכם נראה אלי אלהי אברהם יצחק ויעקב לאמר פקד פקדתי אתכם ואת העשוי לכם במצרים
(301653, 56, 4);2;ב;81405;(2, 3, 16, 66, 81405);21477;(2, 3, 16, 16, 21477);ויעקב;5;16;לך ואספת את זקני ישראל ואמרת אלהם יהוה אלהי אבתיכם נראה אלי אלהי אברהם יצחק ויעקב לאמר פקד פקדתי אתכם ואת העשוי לכם במצרים
(301653, 56, 4);30;ל;81461;(2, 3, 17, 23, 81461);21491;(2, 3, 17, 6, 21491);אל;2;6;ואמר אעלה אתכם מעני מצרים אל ארץ הכנעני והחתי והאמרי והפרזי והחוי והיבוסי אל ארץ זבת חלב ודבש
(301653, 56, 4);40;מ;81517;(2, 3, 18, 3, 81517);21504;(2, 3, 18, 1, 21504);ושמעו;3;1;ושמעו לקלך ובאת אתה וזקני ישראל אל מלך מצרים ואמרתם אליו יהוה אלהי העבריים נקרה עלינו ועתה נלכה נא דרך שלשת ימים במדבר ונזבחה ליהוה אלהינו
(301653, 56, 4);10;י;81573;(2, 3, 18, 59, 81573);21517;(2, 3, 18, 14, 21517);העבריים;5;14;ושמעו לקלך ובאת אתה וזקני ישראל אל מלך מצרים ואמרתם אליו יהוה אלהי העבריים נקרה עלינו ועתה נלכה נא דרך שלשת ימים במדבר ונזבחה ליהוה אלהינו
(301653, 56, 4);1;א;81629;(2, 3, 19, 2, 81629);21530;(2, 3, 19, 1, 21530);ואני;2;1;ואני ידעתי כי לא יתן אתכם מלך מצרים להלך ולא ביד חזקה
(301653, 56, 4);400;ת;81685;(2, 3, 20, 16, 81685);21545;(2, 3, 20, 4, 21545);והכיתי;5;4;ושלחתי את ידי והכיתי את מצרים בכל נפלאתי אשר אעשה בקרבו ואחרי כן ישלח אתכם
(301653, 56, 4);40;ם;81741;(2, 3, 21, 12, 81741);21560;(2, 3, 21, 4, 21560);העם;3;4;ונתתי את חן העם הזה בעיני מצרים והיה כי תלכון לא תלכו ריקם
(301653, 56, 4);400;ת;81797;(2, 3, 22, 22, 81797);21574;(2, 3, 22, 5, 21574);ביתה;3;5;ושאלה אשה משכנתה ומגרת ביתה כלי כסף וכלי זהב ושמלת ושמתם על בניכם ועל בנתיכם ונצלתם את מצרים
(301653, 56, 4);70;ע;81853;(2, 4, 1, 3, 81853);21588;(2, 4, 1, 1, 21588);ויען;3;1;ויען משה ויאמר והן לא יאמינו לי ולא ישמעו בקלי כי יאמרו לא נראה אליך יהוה
(301653, 56, 4);6;ו;81909;(2, 4, 2, 1, 81909);21604;(2, 4, 2, 1, 21604);ויאמר;1;1;ויאמר אליו יהוה מזה בידך ויאמר מטה
(301653, 56, 4);10;י;81965;(2, 4, 3, 29, 81965);21616;(2, 4, 3, 6, 21616);ויהי;2;6;ויאמר השליכהו ארצה וישלכהו ארצה ויהי לנחש וינס משה מפניו
(301653, 56, 4);6;ו;82021;(2, 4, 4, 38, 82021);21631;(2, 4, 4, 11, 21631);ויחזק;1;11;ויאמר יהוה אל משה שלח ידך ואחז בזנבו וישלח ידו ויחזק בו ויהי למטה בכפו
(301653, 56, 4);2;ב;82077;(2, 4, 5, 38, 82077);21645;(2, 4, 5, 10, 21645);אברהם;2;10;למען יאמינו כי נראה אליך יהוה אלהי אבתם אלהי אברהם אלהי יצחק ואלהי יעקב
(301653, 56, 4);8;ח;82133;(2, 4, 6, 36, 82133);21660;(2, 4, 6, 11, 21660);בחיקו;2;11;ויאמר יהוה לו עוד הבא נא ידך בחיקך ויבא ידו בחיקו ויוצאה והנה ידו מצרעת כשלג
(301653, 56, 4);6;ו;82189;(2, 4, 7, 31, 82189);21675;(2, 4, 7, 10, 21675);ויוצאה;1;10;ויאמר השב ידך אל חיקך וישב ידו אל חיקו ויוצאה מחיקו והנה שבה כבשרו
(301653, 56, 4);300;ש;82245;(2, 4, 8, 34, 82245);21689;(2, 4, 8, 10, 21689);הראשון;4;10;והיה אם לא יאמינו לך ולא ישמעו לקל האת הראשון והאמינו לקל האת האחרון
(301653, 56, 4);40;מ;82301;(2, 4, 9, 35, 82301);21703;(2, 4, 9, 10, 21703);ישמעון;3;10;והיה אם לא יאמינו גם לשני האתות האלה ולא ישמעון לקלך ולקחת ממימי היאר ושפכת היבשה והיו המים אשר תקח מן היאר והיו לדם ביבשת
(301653, 56, 4);30;ל;82357;(2, 4, 9, 91, 82357);21717;(2, 4, 9, 24, 21717);לדם;1;24;והיה אם לא יאמינו גם לשני האתות האלה ולא ישמעון לקלך ולקחת ממימי היאר ושפכת היבשה והיו המים אשר תקח מן היאר והיו לדם ביבשת
(301653, 56, 4);3;ג;82413;(2, 4, 10, 49, 82413);21733;(2, 4, 10, 15, 21733);גם;1;15;ויאמר משה אל יהוה בי אדני לא איש דברים אנכי גם מתמול גם משלשם גם מאז דברך אל עבדך כי כבד פה וכבד לשון אנכי
(301653, 56, 4);40;ם;82469;(2, 4, 11, 23, 82469);21750;(2, 4, 11, 7, 21750);לאדם;4;7;ויאמר יהוה אליו מי שם פה לאדם או מי ישום אלם או חרש או פקח או עור הלא אנכי יהוה
(301653, 56, 4);10;י;82525;(2, 4, 12, 19, 82525);21769;(2, 4, 12, 6, 21769);פיך;2;6;ועתה לך ואנכי אהיה עם פיך והוריתיך אשר תדבר
(301653, 56, 4);1;א;82581;(2, 4, 14, 17, 82581);21784;(2, 4, 14, 5, 21784);ויאמר;3;5;ויחר אף יהוה במשה ויאמר הלא אהרן אחיך הלוי ידעתי כי דבר ידבר הוא וגם הנה הוא יצא לקראתך וראך ושמח בלבו
(301653, 56, 4);20;ך;82637;(2, 4, 14, 73, 82637);21799;(2, 4, 14, 20, 21799);וראך;4;20;ויחר אף יהוה במשה ויאמר הלא אהרן אחיך הלוי ידעתי כי דבר ידבר הוא וגם הנה הוא יצא לקראתך וראך ושמח בלבו
(301653, 56, 4);5;ה;82693;(2, 4, 15, 48, 82693);21814;(2, 4, 15, 13, 21814);והוריתי;2;13;ודברת אליו ושמת את הדברים בפיו ואנכי אהיה עם פיך ועם פיהו והוריתי אתכם את אשר תעשון
(301653, 56, 4);10;י;82749;(2, 4, 16, 37, 82749);21830;(2, 4, 16, 12, 21830);תהיה;3;12;ודבר הוא לך אל העם והיה הוא יהיה לך לפה ואתה תהיה לו לאלהים
(301653, 56, 4);400;ת;82805;(2, 4, 18, 15, 82805);21847;(2, 4, 18, 5, 21847);יתר;2;5;וילך משה וישב אל יתר חתנו ויאמר לו אלכה נא ואשובה אל אחי אשר במצרים ואראה העודם חיים ויאמר יתרו למשה לך לשלום
(301653, 56, 4);40;מ;82861;(2, 4, 18, 71, 82861);21861;(2, 4, 18, 19, 21861);ויאמר;4;19;וילך משה וישב אל יתר חתנו ויאמר לו אלכה נא ואשובה אל אחי אשר במצרים ואראה העודם חיים ויאמר יתרו למשה לך לשלום
(301653, 56, 4);10;י;82917;(2, 4, 19, 40, 82917);21877;(2, 4, 19, 12, 21877);האנשים;5;12;ויאמר יהוה אל משה במדין לך שב מצרים כי מתו כל האנשים המבקשים את נפשך
(301653, 56, 4);90;צ;82973;(2, 4, 20, 42, 82973);21892;(2, 4, 20, 12, 21892);מצרים;2;12;ויקח משה את אשתו ואת בניו וירכבם על החמר וישב ארצה מצרים ויקח משה את מטה האלהים בידו
(301653, 56, 4);1;א;83029;(2, 4, 21, 31, 83029);21906;(2, 4, 21, 8, 21906);ראה;2;8;ויאמר יהוה אל משה בלכתך לשוב מצרימה ראה כל המפתים אשר שמתי בידך ועשיתם לפני פרעה ואני אחזק את לבו ולא ישלח את העם
(301653, 56, 4);400;ת;83085;(2, 4, 21, 87, 83085);21921;(2, 4, 21, 23, 21921);את;2;23;ויאמר יהוה אל משה בלכתך לשוב מצרימה ראה כל המפתים אשר שמתי בידך ועשיתם לפני פרעה ואני אחזק את לבו ולא ישלח את העם
(301653, 56, 4);4;ד;83141;(2, 4, 23, 21, 83141);21937;(2, 4, 23, 6, 21937);ויעבדני;5;6;ואמר אליך שלח את בני ויעבדני ותמאן לשלחו הנה אנכי הרג את בנך בכרך
(301653, 56, 4);6;ו;83197;(2, 4, 24, 25, 83197);21951;(2, 4, 24, 6, 21951);ויבקש;1;6;ויהי בדרך במלון ויפגשהו יהוה ויבקש המיתו
(301653, 56, 4);10;י;83253;(2, 4, 25, 47, 83253);21965;(2, 4, 25, 13, 21965);דמים;3;13;ותקח צפרה צר ותכרת את ערלת בנה ותגע לרגליו ותאמר כי חתן דמים אתה לי
(301653, 56, 4);300;ש;83309;(2, 4, 27, 24, 83309);21981;(2, 4, 27, 7, 21981);משה;2;7;ויאמר יהוה אל אהרן לך לקראת משה המדברה וילך ויפגשהו בהר האלהים וישק לו
(301653, 56, 4);6;ו;83365;(2, 4, 28, 23, 83365);21995;(2, 4, 28, 7, 21995);יהוה;3;7;ויגד משה לאהרן את כל דברי יהוה אשר שלחו ואת כל האתת אשר צוהו
(301653, 56, 4);200;ר;83421;(2, 4, 29, 32, 83421);22011;(2, 4, 29, 9, 22011);ישראל;3;9;וילך משה ואהרן ויאספו את כל זקני בני ישראל
(301653, 56, 4);40;מ;83477;(2, 4, 31, 4, 83477);22026;(2, 4, 31, 1, 22026);ויאמן;4;1;ויאמן העם וישמעו כי פקד יהוה את בני ישראל וכי ראה את ענים ויקדו וישתחוו
(301653, 56, 4);8;ח;83533;(2, 5, 1, 3, 83533);22041;(2, 5, 1, 1, 22041);ואחר;3;1;ואחר באו משה ואהרן ויאמרו אל פרעה כה אמר יהוה אלהי ישראל שלח את עמי ויחגו לי במדבר
(301653, 56, 4);30;ל;83589;(2, 5, 1, 59, 83589);22057;(2, 5, 1, 17, 22057);לי;1;17;ואחר באו משה ואהרן ויאמרו אל פרעה כה אמר יהוה אלהי ישראל שלח את עמי ויחגו לי במדבר
(301653, 56, 4);5;ה;83645;(2, 5, 2, 50, 83645);22072;(2, 5, 2, 14, 22072);יהוה;4;14;ויאמר פרעה מי יהוה אשר אשמע בקלו לשלח את ישראל לא ידעתי את יהוה וגם את ישראל לא אשלח
(301653, 56, 4);40;מ;83701;(2, 5, 3, 40, 83701);22087;(2, 5, 3, 10, 22087);ימים;2;10;ויאמרו אלהי העברים נקרא עלינו נלכה נא דרך שלשת ימים במדבר ונזבחה ליהוה אלהינו פן יפגענו בדבר או בחרב
(301653, 56, 4);90;צ;83757;(2, 5, 4, 14, 83757);22100;(2, 5, 4, 4, 22100);מצרים;2;4;ויאמר אלהם מלך מצרים למה משה ואהרן תפריעו את העם ממעשיו לכו לסבלתיכם
(301653, 56, 4);10;י;83813;(2, 5, 5, 14, 83813);22113;(2, 5, 5, 4, 22113);רבים;3;4;ויאמר פרעה הן רבים עתה עם הארץ והשבתם אתם מסבלתם
(301653, 56, 4);300;ש;83869;(2, 5, 6, 31, 83869);22128;(2, 5, 6, 9, 22128);שטריו;1;9;ויצו פרעה ביום ההוא את הנגשים בעם ואת שטריו לאמר
(301653, 56, 4);30;ל;83925;(2, 5, 7, 48, 83925);22142;(2, 5, 7, 13, 22142);להם;1;13;לא תאספון לתת תבן לעם ללבן הלבנים כתמול שלשם הם ילכו וקששו להם תבן
(301653, 56, 4);50;נ;83981;(2, 5, 8, 51, 83981);22156;(2, 5, 8, 13, 22156);ממנו;3;13;ואת מתכנת הלבנים אשר הם עשים תמול שלשם תשימו עליהם לא תגרעו ממנו כי נרפים הם על כן הם צעקים לאמר נלכה נזבחה לאלהינו
(301653, 56, 4);300;ש;84037;(2, 5, 9, 15, 84037);22171;(2, 5, 9, 4, 22171);האנשים;4;4;תכבד העבדה על האנשים ויעשו בה ואל ישעו בדברי שקר
(301653, 56, 4);40;מ;84093;(2, 5, 10, 32, 84093);22185;(2, 5, 10, 8, 22185);לאמר;3;8;ויצאו נגשי העם ושטריו ויאמרו אל העם לאמר כה אמר פרעה אינני נתן לכם תבן
(301653, 56, 4);200;ר;84149;(2, 5, 11, 32, 84149);22202;(2, 5, 11, 10, 22202);נגרע;3;10;אתם לכו קחו לכם תבן מאשר תמצאו כי אין נגרע מעבדתכם דבר
(301653, 56, 4);30;ל;84205;(2, 5, 13, 17, 84205);22216;(2, 5, 13, 4, 22216);כלו;2;4;והנגשים אצים לאמר כלו מעשיכם דבר יום ביומו כאשר בהיות התבן
(301653, 56, 4);5;ה;84261;(2, 5, 14, 25, 84261);22230;(2, 5, 14, 7, 22230);עלהם;3;7;ויכו שטרי בני ישראל אשר שמו עלהם נגשי פרעה לאמר מדוע לא כליתם חקכם ללבן כתמול שלשם גם תמול גם היום
(301653, 56, 4);2;ב;84317;(2, 5, 15, 3, 84317);22245;(2, 5, 15, 1, 22245);ויבאו;3;1;ויבאו שטרי בני ישראל ויצעקו אל פרעה לאמר למה תעשה כה לעבדיך
(301653, 56, 4);70;ע;84373;(2, 5, 16, 11, 84373);22260;(2, 5, 16, 4, 22260);לעבדיך;2;4;תבן אין נתן לעבדיך ולבנים אמרים לנו עשו והנה עבדיך מכים וחטאת עמך
(301653, 56, 4);50;נ;84429;(2, 5, 17, 14, 84429);22273;(2, 5, 17, 4, 22273);נרפים;1;4;ויאמר נרפים אתם נרפים על כן אתם אמרים נלכה נזבחה ליהוה
(301653, 56, 4);400;ת;84485;(2, 5, 18, 26, 84485);22288;(2, 5, 18, 8, 22288);ותכן;2;8;ועתה לכו עבדו ותבן לא ינתן לכם ותכן לבנים תתנו
(301653, 56, 4);10;י;84541;(2, 5, 19, 45, 84541);22302;(2, 5, 19, 12, 22302);יום;1;12;ויראו שטרי בני ישראל אתם ברע לאמר לא תגרעו מלבניכם דבר יום ביומו
(301653, 56, 4);30;ל;84597;(2, 5, 21, 8, 84597);22315;(2, 5, 21, 2, 22315);אלהם;2;2;ויאמרו אלהם ירא יהוה עליכם וישפט אשר הבאשתם את ריחנו בעיני פרעה ובעיני עבדיו לתת חרב בידם להרגנו
(301653, 56, 4);30;ל;84653;(2, 5, 21, 64, 84653);22328;(2, 5, 21, 15, 22328);לתת;1;15;ויאמרו אלהם ירא יהוה עליכם וישפט אשר הבאשתם את ריחנו בעיני פרעה ובעיני עבדיו לתת חרב בידם להרגנו
(301653, 56, 4);5;ה;84709;(2, 5, 22, 41, 84709);22343;(2, 5, 22, 12, 22343);זה;2;12;וישב משה אל יהוה ויאמר אדני למה הרעתה לעם הזה למה זה שלחתני
(301653, 56, 4);40;מ;84765;(2, 6, 1, 4, 84765);22359;(2, 6, 1, 1, 22359);ויאמר;4;1;ויאמר יהוה אל משה עתה תראה אשר אעשה לפרעה כי ביד חזקה ישלחם וביד חזקה יגרשם מארצו
(301653, 56, 4);40;ם;84821;(2, 6, 1, 60, 84821);22374;(2, 6, 1, 16, 22374);יגרשם;5;16;ויאמר יהוה אל משה עתה תראה אשר אעשה לפרעה כי ביד חזקה ישלחם וביד חזקה יגרשם מארצו
(301653, 56, 4);30;ל;84877;(2, 6, 3, 20, 84877);22389;(2, 6, 3, 6, 22389);ואל;3;6;וארא אל אברהם אל יצחק ואל יעקב באל שדי ושמי יהוה לא נודעתי להם
(301653, 56, 4);1;א;84933;(2, 6, 4, 27, 84933);22406;(2, 6, 4, 9, 22406);ארץ;1;9;וגם הקמתי את בריתי אתם לתת להם את ארץ כנען את ארץ מגריהם אשר גרו בה
(301653, 56, 4);200;ר;84989;(2, 6, 5, 31, 84989);22422;(2, 6, 5, 9, 22422);מצרים;3;9;וגם אני שמעתי את נאקת בני ישראל אשר מצרים מעבדים אתם ואזכר את בריתי
(301653, 56, 4);40;ם;85045;(2, 6, 6, 33, 85045);22435;(2, 6, 6, 8, 22435);אתכם;4;8;לכן אמר לבני ישראל אני יהוה והוצאתי אתכם מתחת סבלת מצרים והצלתי אתכם מעבדתם וגאלתי אתכם בזרוע נטויה ובשפטים גדלים
(301653, 56, 4);40;ם;85101;(2, 6, 6, 89, 85101);22446;(2, 6, 6, 19, 22446);ובשפטים;7;19;לכן אמר לבני ישראל אני יהוה והוצאתי אתכם מתחת סבלת מצרים והצלתי אתכם מעבדתם וגאלתי אתכם בזרוע נטויה ובשפטים גדלים
(301653, 56, 4);40;ם;85157;(2, 6, 7, 51, 85157);22459;(2, 6, 7, 12, 22459);אלהיכם;6;12;ולקחתי אתכם לי לעם והייתי לכם לאלהים וידעתם כי אני יהוה אלהיכם המוציא אתכם מתחת סבלות מצרים
(301653, 56, 4);400;ת;85213;(2, 6, 8, 32, 85213);22473;(2, 6, 8, 9, 22473);לתת;3;9;והבאתי אתכם אל הארץ אשר נשאתי את ידי לתת אתה לאברהם ליצחק וליעקב ונתתי אתה לכם מורשה אני יהוה
(301653, 56, 4);2;ב;85269;(2, 6, 9, 13, 85269);22488;(2, 6, 9, 5, 22488);בני;1;5;וידבר משה כן אל בני ישראל ולא שמעו אל משה מקצר רוח ומעבדה קשה
(301653, 56, 4);4;ד;85325;(2, 6, 11, 3, 85325);22504;(2, 6, 11, 2, 22504);דבר;1;2;בא דבר אל פרעה מלך מצרים וישלח את בני ישראל מארצו
(301653, 56, 4);200;ר;85381;(2, 6, 12, 20, 85381);22518;(2, 6, 12, 5, 22518);לאמר;4;5;וידבר משה לפני יהוה לאמר הן בני ישראל לא שמעו אלי ואיך ישמעני פרעה ואני ערל שפתים
(301653, 56, 4);30;ל;85437;(2, 6, 13, 11, 85437);22533;(2, 6, 13, 3, 22533);אל;2;3;וידבר יהוה אל משה ואל אהרן ויצום אל בני ישראל ואל פרעה מלך מצרים להוציא את בני ישראל מארץ מצרים
