(143827, 92, 4);5;ה;149163;(3, 7, 5, 14, 149163);39354;(3, 7, 5, 4, 39354);המזבחה;1;4;והקטיר אתם הכהן המזבחה אשה ליהוה אשם הוא
(143827, 92, 4);6;ו;149255;(3, 7, 7, 32, 149255);39377;(3, 7, 7, 9, 39377);בו;2;9;כחטאת כאשם תורה אחת להם הכהן אשר יכפר בו לו יהיה
(143827, 92, 4);5;ה;149347;(3, 7, 9, 42, 149347);39402;(3, 7, 9, 11, 39402);לכהן;3;11;וכל מנחה אשר תאפה בתנור וכל נעשה במרחשת ועל מחבת לכהן המקריב אתה לו תהיה
(143827, 92, 4);70;ע;149439;(3, 7, 12, 3, 149439);39426;(3, 7, 12, 2, 39426);על;1;2;אם על תודה יקריבנו והקריב על זבח התודה חלות מצות בלולת בשמן ורקיקי מצות משחים בשמן וסלת מרבכת חלת בלולת בשמן
(143827, 92, 4);8;ח;149531;(3, 7, 13, 7, 149531);39448;(3, 7, 13, 3, 39448);לחם;2;3;על חלת לחם חמץ יקריב קרבנו על זבח תודת שלמיו
(143827, 92, 4);4;ד;149623;(3, 7, 15, 10, 149623);39472;(3, 7, 15, 3, 39472);תודת;3;3;ובשר זבח תודת שלמיו ביום קרבנו יאכל לא יניח ממנו עד בקר
(143827, 92, 4);1;א;149715;(3, 7, 16, 58, 149715);39496;(3, 7, 16, 15, 39496);יאכל;2;15;ואם נדר או נדבה זבח קרבנו ביום הקריבו את זבחו יאכל וממחרת והנותר ממנו יאכל
(143827, 92, 4);6;ו;149807;(3, 7, 18, 59, 149807);39519;(3, 7, 18, 16, 39519);פגול;3;16;ואם האכל יאכל מבשר זבח שלמיו ביום השלישי לא ירצה המקריב אתו לא יחשב לו פגול יהיה והנפש האכלת ממנו עונה תשא
(143827, 92, 4);2;ב;149899;(3, 7, 20, 18, 149899);39544;(3, 7, 20, 5, 39544);מזבח;3;5;והנפש אשר תאכל בשר מזבח השלמים אשר ליהוה וטמאתו עליו ונכרתה הנפש ההוא מעמיה
(143827, 92, 4);20;כ;149991;(3, 7, 21, 48, 149991);39568;(3, 7, 21, 15, 39568);ואכל;3;15;ונפש כי תגע בכל טמא בטמאת אדם או בבהמה טמאה או בכל שקץ טמא ואכל מבשר זבח השלמים אשר ליהוה ונכרתה הנפש ההוא מעמיה
(143827, 92, 4);30;ל;150083;(3, 7, 23, 33, 150083);39593;(3, 7, 23, 11, 39593);לא;1;11;דבר אל בני ישראל לאמר כל חלב שור וכשב ועז לא תאכלו
(143827, 92, 4);80;פ;150175;(3, 7, 25, 46, 150175);39617;(3, 7, 25, 13, 39617);הנפש;3;13;כי כל אכל חלב מן הבהמה אשר יקריב ממנה אשה ליהוה ונכרתה הנפש האכלת מעמיה
(143827, 92, 4);300;ש;150267;(3, 7, 28, 13, 150267);39641;(3, 7, 28, 4, 39641);משה;2;4;וידבר יהוה אל משה לאמר
(143827, 92, 4);8;ח;150359;(3, 7, 30, 24, 150359);39665;(3, 7, 30, 7, 39665);החלב;2;7;ידיו תביאינה את אשי יהוה את החלב על החזה יביאנו את החזה להניף אתו תנופה לפני יהוה
(143827, 92, 4);10;י;150451;(3, 7, 32, 10, 150451);39687;(3, 7, 32, 3, 39687);הימין;4;3;ואת שוק הימין תתנו תרומה לכהן מזבחי שלמיכם
(143827, 92, 4);6;ו;150543;(3, 7, 34, 18, 150543);39711;(3, 7, 34, 6, 39711);שוק;2;6;כי את חזה התנופה ואת שוק התרומה לקחתי מאת בני ישראל מזבחי שלמיהם ואתן אתם לאהרן הכהן ולבניו לחק עולם מאת בני ישראל
(143827, 92, 4);50;נ;150635;(3, 7, 35, 18, 150635);39733;(3, 7, 35, 5, 39733);בניו;2;5;זאת משחת אהרן ומשחת בניו מאשי יהוה ביום הקריב אתם לכהן ליהוה
(143827, 92, 4);30;ל;150727;(3, 7, 37, 11, 150727);39757;(3, 7, 37, 3, 39757);לעלה;3;3;זאת התורה לעלה למנחה ולחטאת ולאשם ולמלואים ולזבח השלמים
(143827, 92, 4);30;ל;150819;(3, 7, 38, 56, 150819);39779;(3, 7, 38, 16, 39779);ליהוה;1;16;אשר צוה יהוה את משה בהר סיני ביום צותו את בני ישראל להקריב את קרבניהם ליהוה במדבר סיני
(143827, 92, 4);6;ו;150911;(3, 8, 2, 61, 150911);39804;(3, 8, 2, 18, 39804);ואת;1;18;קח את אהרן ואת בניו אתו ואת הבגדים ואת שמן המשחה ואת פר החטאת ואת שני האילים ואת סל המצות
(143827, 92, 4);5;ה;151003;(3, 8, 5, 16, 151003);39831;(3, 8, 5, 5, 39831);זה;2;5;ויאמר משה אל העדה זה הדבר אשר צוה יהוה לעשות
(143827, 92, 4);40;מ;151095;(3, 8, 7, 40, 151095);39856;(3, 8, 7, 11, 39856);המעיל;2;11;ויתן עליו את הכתנת ויחגר אתו באבנט וילבש אתו את המעיל ויתן עליו את האפד ויחגר אתו בחשב האפד ויאפד לו בו
(143827, 92, 4);50;נ;151187;(3, 8, 9, 10, 151187);39881;(3, 8, 9, 3, 39881);המצנפת;4;3;וישם את המצנפת על ראשו וישם על המצנפת אל מול פניו את ציץ הזהב נזר הקדש כאשר צוה יהוה את משה
(143827, 92, 4);1;א;151279;(3, 8, 10, 31, 151279);39908;(3, 8, 10, 9, 39908);ואת;2;9;ויקח משה את שמן המשחה וימשח את המשכן ואת כל אשר בו ויקדש אתם
(143827, 92, 4);30;ל;151371;(3, 8, 12, 15, 151371);39934;(3, 8, 12, 4, 39934);על;2;4;ויצק משמן המשחה על ראש אהרן וימשח אתו לקדשו
(143827, 92, 4);3;ג;151463;(3, 8, 14, 3, 151463);39958;(3, 8, 14, 1, 39958);ויגש;3;1;ויגש את פר החטאת ויסמך אהרן ובניו את ידיהם על ראש פר החטאת
(143827, 92, 4);1;א;151555;(3, 8, 15, 49, 151555);39983;(3, 8, 15, 13, 39983);את;1;13;וישחט ויקח משה את הדם ויתן על קרנות המזבח סביב באצבעו ויחטא את המזבח ואת הדם יצק אל יסוד המזבח ויקדשהו לכפר עליו
(143827, 92, 4);50;ן;151647;(3, 8, 16, 51, 151647);40008;(3, 8, 16, 15, 40008);חלבהן;5;15;ויקח את כל החלב אשר על הקרב ואת יתרת הכבד ואת שתי הכלית ואת חלבהן ויקטר משה המזבחה
(143827, 92, 4);1;א;151739;(3, 8, 18, 21, 151739);40034;(3, 8, 18, 6, 40034);אהרן;1;6;ויקרב את איל העלה ויסמכו אהרן ובניו את ידיהם על ראש האיל
(143827, 92, 4);40;ם;151831;(3, 8, 20, 39, 151831);40058;(3, 8, 20, 10, 40058);הנתחים;6;10;ואת האיל נתח לנתחיו ויקטר משה את הראש ואת הנתחים ואת הפדר
(143827, 92, 4);300;ש;151923;(3, 8, 21, 85, 151923);40084;(3, 8, 21, 24, 40084);משה;2;24;ואת הקרב ואת הכרעים רחץ במים ויקטר משה את כל האיל המזבחה עלה הוא לריח ניחח אשה הוא ליהוה כאשר צוה יהוה את משה
(143827, 92, 4);40;מ;152015;(3, 8, 23, 36, 152015);40108;(3, 8, 23, 10, 40108);הימנית;3;10;וישחט ויקח משה מדמו ויתן על תנוך אזן אהרן הימנית ועל בהן ידו הימנית ועל בהן רגלו הימנית
(143827, 92, 4);6;ו;152107;(3, 8, 24, 58, 152107);40133;(3, 8, 24, 17, 40133);ועל;1;17;ויקרב את בני אהרן ויתן משה מן הדם על תנוך אזנם הימנית ועל בהן ידם הימנית ועל בהן רגלם הימנית ויזרק משה את הדם על המזבח סביב
(143827, 92, 4);10;י;152199;(3, 8, 25, 53, 152199);40159;(3, 8, 25, 16, 40159);שתי;3;16;ויקח את החלב ואת האליה ואת כל החלב אשר על הקרב ואת יתרת הכבד ואת שתי הכלית ואת חלבהן ואת שוק הימין
(143827, 92, 4);30;ל;152291;(3, 8, 26, 68, 152291);40184;(3, 8, 26, 19, 40184);ועל;3;19;ומסל המצות אשר לפני יהוה לקח חלת מצה אחת וחלת לחם שמן אחת ורקיק אחד וישם על החלבים ועל שוק הימין
(143827, 92, 4);40;מ;152383;(3, 8, 28, 36, 152383);40210;(3, 8, 28, 10, 40210);מלאים;1;10;ויקח משה אתם מעל כפיהם ויקטר המזבחה על העלה מלאים הם לריח ניחח אשה הוא ליהוה
(143827, 92, 4);400;ת;152475;(3, 8, 29, 67, 152475);40233;(3, 8, 29, 17, 40233);את;2;17;ויקח משה את החזה ויניפהו תנופה לפני יהוה מאיל המלאים למשה היה למנה כאשר צוה יהוה את משה
(143827, 92, 4);1;א;152567;(3, 8, 30, 89, 152567);40260;(3, 8, 30, 26, 40260);ואת;2;26;ויקח משה משמן המשחה ומן הדם אשר על המזבח ויז על אהרן על בגדיו ועל בניו ועל בגדי בניו אתו ויקדש את אהרן את בגדיו ואת בניו ואת בגדי בניו אתו
(143827, 92, 4);1;א;152659;(3, 8, 31, 73, 152659);40286;(3, 8, 31, 21, 40286);כאשר;2;21;ויאמר משה אל אהרן ואל בניו בשלו את הבשר פתח אהל מועד ושם תאכלו אתו ואת הלחם אשר בסל המלאים כאשר צויתי לאמר אהרן ובניו יאכלהו
(143827, 92, 4);20;כ;152751;(3, 8, 33, 43, 152751);40308;(3, 8, 33, 12, 40308);מלאיכם;5;12;ומפתח אהל מועד לא תצאו שבעת ימים עד יום מלאת ימי מלאיכם כי שבעת ימים ימלא את ידכם
(143827, 92, 4);400;ת;152843;(3, 8, 35, 37, 152843);40332;(3, 8, 35, 9, 40332);ושמרתם;5;9;ופתח אהל מועד תשבו יומם ולילה שבעת ימים ושמרתם את משמרת יהוה ולא תמותו כי כן צויתי
(143827, 92, 4);200;ר;152935;(3, 9, 1, 24, 152935);40357;(3, 9, 1, 6, 40357);לאהרן;4;6;ויהי ביום השמיני קרא משה לאהרן ולבניו ולזקני ישראל
(143827, 92, 4);100;ק;153027;(3, 9, 3, 20, 153027);40381;(3, 9, 3, 6, 40381);קחו;1;6;ואל בני ישראל תדבר לאמר קחו שעיר עזים לחטאת ועגל וכבש בני שנה תמימם לעלה
(143827, 92, 4);5;ה;153119;(3, 9, 4, 54, 153119);40403;(3, 9, 4, 13, 40403);נראה;4;13;ושור ואיל לשלמים לזבח לפני יהוה ומנחה בלולה בשמן כי היום יהוה נראה אליכם
(143827, 92, 4);1;א;153211;(3, 9, 6, 33, 153211);40429;(3, 9, 6, 10, 40429);אליכם;1;10;ויאמר משה זה הדבר אשר צוה יהוה תעשו וירא אליכם כבוד יהוה
(143827, 92, 4);1;א;153303;(3, 9, 7, 80, 153303);40454;(3, 9, 7, 23, 40454);כאשר;2;23;ויאמר משה אל אהרן קרב אל המזבח ועשה את חטאתך ואת עלתך וכפר בעדך ובעד העם ועשה את קרבן העם וכפר בעדם כאשר צוה יהוה
(143827, 92, 4);5;ה;153395;(3, 9, 9, 47, 153395);40479;(3, 9, 9, 13, 40479);המזבח;1;13;ויקרבו בני אהרן את הדם אליו ויטבל אצבעו בדם ויתן על קרנות המזבח ואת הדם יצק אל יסוד המזבח
(143827, 92, 4);2;ב;153487;(3, 9, 11, 5, 153487);40504;(3, 9, 11, 2, 40504);הבשר;2;2;ואת הבשר ואת העור שרף באש מחוץ למחנה
(143827, 92, 4);6;ו;153579;(3, 9, 13, 17, 153579);40527;(3, 9, 13, 4, 40527);אליו;4;4;ואת העלה המציאו אליו לנתחיה ואת הראש ויקטר על המזבח
(143827, 92, 4);1;א;153671;(3, 9, 15, 30, 153671);40551;(3, 9, 15, 9, 40551);אשר;1;9;ויקרב את קרבן העם ויקח את שעיר החטאת אשר לעם וישחטהו ויחטאהו כראשון
(143827, 92, 4);100;ק;153763;(3, 9, 17, 46, 153763);40572;(3, 9, 17, 12, 40572);הבקר;3;12;ויקרב את המנחה וימלא כפו ממנה ויקטר על המזבח מלבד עלת הבקר
(143827, 92, 4);50;ן;153855;(3, 9, 19, 18, 153855);40596;(3, 9, 19, 5, 40596);ומן;3;5;ואת החלבים מן השור ומן האיל האליה והמכסה והכלית ויתרת הכבד
(143827, 92, 4);1;א;153947;(3, 9, 21, 24, 153947);40617;(3, 9, 21, 7, 40617);אהרן;1;7;ואת החזות ואת שוק הימין הניף אהרן תנופה לפני יהוה כאשר צוה משה
(143827, 92, 4);30;ל;154039;(3, 9, 23, 17, 154039);40640;(3, 9, 23, 5, 40640);אהל;3;5;ויבא משה ואהרן אל אהל מועד ויצאו ויברכו את העם וירא כבוד יהוה אל כל העם
(143827, 92, 4);10;י;154131;(3, 9, 24, 53, 154131);40666;(3, 9, 24, 15, 40666);וירנו;2;15;ותצא אש מלפני יהוה ותאכל על המזבח את העלה ואת החלבים וירא כל העם וירנו ויפלו על פניהם
(143827, 92, 4);200;ר;154223;(3, 10, 1, 77, 154223);40688;(3, 10, 1, 19, 40688);אשר;3;19;ויקחו בני אהרן נדב ואביהוא איש מחתתו ויתנו בהן אש וישימו עליה קטרת ויקריבו לפני יהוה אש זרה אשר לא צוה אתם
(143827, 92, 4);20;כ;154315;(3, 10, 3, 47, 154315);40714;(3, 10, 3, 14, 40714);כל;1;14;ויאמר משה אל אהרן הוא אשר דבר יהוה לאמר בקרבי אקדש ועל פני כל העם אכבד וידם אהרן
(143827, 92, 4);90;ץ;154407;(3, 10, 4, 76, 154407);40739;(3, 10, 4, 21, 40739);מחוץ;4;21;ויקרא משה אל מישאל ואל אלצפן בני עזיאל דד אהרן ויאמר אלהם קרבו שאו את אחיכם מאת פני הקדש אל מחוץ למחנה
(143827, 92, 4);4;ד;154499;(3, 10, 6, 49, 154499);40760;(3, 10, 6, 11, 40760);ובגדיכם;4;11;ויאמר משה אל אהרן ולאלעזר ולאיתמר בניו ראשיכם אל תפרעו ובגדיכם לא תפרמו ולא תמתו ועל כל העדה יקצף ואחיכם כל בית ישראל יבכו את השרפה אשר שרף יהוה
(143827, 92, 4);20;כ;154591;(3, 10, 7, 25, 154591);40786;(3, 10, 7, 8, 40786);כי;1;8;ומפתח אהל מועד לא תצאו פן תמתו כי שמן משחת יהוה עליכם ויעשו כדבר משה
(143827, 92, 4);6;ו;154683;(3, 10, 9, 44, 154683);40811;(3, 10, 9, 13, 40811);תמתו;4;13;יין ושכר אל תשת אתה ובניך אתך בבאכם אל אהל מועד ולא תמתו חקת עולם לדרתיכם
(143827, 92, 4);40;ם;154775;(3, 10, 11, 40, 154775);40834;(3, 10, 11, 11, 40834);אליהם;5;11;ולהורת את בני ישראל את כל החקים אשר דבר יהוה אליהם ביד משה
(143827, 92, 4);100;ק;154867;(3, 10, 12, 86, 154867);40858;(3, 10, 12, 22, 40858);קדש;1;22;וידבר משה אל אהרן ואל אלעזר ואל איתמר בניו הנותרים קחו את המנחה הנותרת מאשי יהוה ואכלוה מצות אצל המזבח כי קדש קדשים הוא
(143827, 92, 4);100;ק;154959;(3, 10, 14, 32, 154959);40882;(3, 10, 14, 8, 40882);במקום;3;8;ואת חזה התנופה ואת שוק התרומה תאכלו במקום טהור אתה ובניך ובנתיך אתך כי חקך וחק בניך נתנו מזבחי שלמי בני ישראל
(143827, 92, 4);30;ל;155051;(3, 10, 15, 36, 155051);40905;(3, 10, 15, 9, 40905);להניף;1;9;שוק התרומה וחזה התנופה על אשי החלבים יביאו להניף תנופה לפני יהוה והיה לך ולבניך אתך לחק עולם כאשר צוה יהוה
(143827, 92, 4);70;ע;155143;(3, 10, 16, 42, 155143);40929;(3, 10, 16, 12, 40929);ועל;2;12;ואת שעיר החטאת דרש דרש משה והנה שרף ויקצף על אלעזר ועל איתמר בני אהרן הנותרם לאמר
(143827, 92, 4);30;ל;155235;(3, 10, 17, 69, 155235);40954;(3, 10, 17, 20, 40954);עליהם;2;20;מדוע לא אכלתם את החטאת במקום הקדש כי קדש קדשים הוא ואתה נתן לכם לשאת את עון העדה לכפר עליהם לפני יהוה
(143827, 92, 4);400;ת;155327;(3, 10, 19, 32, 155327);40979;(3, 10, 19, 9, 40979);חטאתם;4;9;וידבר אהרן אל משה הן היום הקריבו את חטאתם ואת עלתם לפני יהוה ותקראנה אתי כאלה ואכלתי חטאת היום הייטב בעיני יהוה
(143827, 92, 4);6;ו;155419;(3, 11, 1, 15, 155419);41001;(3, 11, 1, 5, 41001);ואל;1;5;וידבר יהוה אל משה ואל אהרן לאמר אלהם
(143827, 92, 4);3;ג;155511;(3, 11, 3, 28, 155511);41026;(3, 11, 3, 8, 41026);גרה;1;8;כל מפרסת פרסה ושסעת שסע פרסת מעלת גרה בבהמה אתה תאכלו
(143827, 92, 4);6;ו;155603;(3, 11, 5, 1, 155603);41051;(3, 11, 5, 1, 41051);ואת;1;1;ואת השפן כי מעלה גרה הוא ופרסה לא יפריס טמא הוא לכם
(143827, 92, 4);20;כ;155695;(3, 11, 7, 9, 155695);41077;(3, 11, 7, 3, 41077);כי;1;3;ואת החזיר כי מפריס פרסה הוא ושסע שסע פרסה והוא גרה לא יגר טמא הוא לכם
(143827, 92, 4);30;ל;155787;(3, 11, 9, 12, 155787);41103;(3, 11, 9, 4, 41103);מכל;3;4;את זה תאכלו מכל אשר במים כל אשר לו סנפיר וקשקשת במים בימים ובנחלים אתם תאכלו
(143827, 92, 4);10;י;155879;(3, 11, 10, 43, 155879);41126;(3, 11, 10, 11, 41126);המים;3;11;וכל אשר אין לו סנפיר וקשקשת בימים ובנחלים מכל שרץ המים ומכל נפש החיה אשר במים שקץ הם לכם
(143827, 92, 4);5;ה;155971;(3, 11, 12, 29, 155971);41152;(3, 11, 12, 9, 41152);הוא;1;9;כל אשר אין לו סנפיר וקשקשת במים שקץ הוא לכם
(143827, 92, 4);400;ת;156063;(3, 11, 16, 5, 156063);41179;(3, 11, 16, 2, 41179);בת;2;2;ואת בת היענה ואת התחמס ואת השחף ואת הנץ למינהו
(143827, 92, 4);5;ה;156155;(3, 11, 19, 14, 156155);41202;(3, 11, 19, 3, 41202);האנפה;5;3;ואת החסידה האנפה למינה ואת הדוכיפת ואת העטלף
(143827, 92, 4);40;ם;156247;(3, 11, 21, 41, 156247);41229;(3, 11, 21, 13, 41229);כרעים;5;13;אך את זה תאכלו מכל שרץ העוף ההלך על ארבע אשר לא כרעים ממעל לרגליו לנתר בהן על הארץ
(143827, 92, 4);30;ל;156339;(3, 11, 23, 3, 156339);41252;(3, 11, 23, 1, 41252);וכל;3;1;וכל שרץ העוף אשר לו ארבע רגלים שקץ הוא לכם
(143827, 92, 4);70;ע;156431;(3, 11, 25, 30, 156431);41277;(3, 11, 25, 8, 41277);הערב;2;8;וכל הנשא מנבלתם יכבס בגדיו וטמא עד הערב
(143827, 92, 4);8;ח;156523;(3, 11, 27, 18, 156523);41302;(3, 11, 27, 6, 41302);החיה;2;6;וכל הולך על כפיו בכל החיה ההלכת על ארבע טמאים הם לכם כל הנגע בנבלתם יטמא עד הערב
(143827, 92, 4);20;כ;156615;(3, 11, 29, 5, 156615);41327;(3, 11, 29, 2, 41327);לכם;2;2;וזה לכם הטמא בשרץ השרץ על הארץ החלד והעכבר והצב למינהו
(143827, 92, 4);70;ע;156707;(3, 11, 31, 25, 156707);41348;(3, 11, 31, 7, 41348);הנגע;4;7;אלה הטמאים לכם בכל השרץ כל הנגע בהם במתם יטמא עד הערב
(143827, 92, 4);6;ו;156799;(3, 11, 32, 75, 156799);41378;(3, 11, 32, 25, 41378);וטמא;1;25;וכל אשר יפל עליו מהם במתם יטמא מכל כלי עץ או בגד או עור או שק כל כלי אשר יעשה מלאכה בהם במים יובא וטמא עד הערב וטהר
(143827, 92, 4);1;א;156891;(3, 11, 34, 32, 156891);41404;(3, 11, 34, 9, 41404);יטמא;4;9;מכל האכל אשר יאכל אשר יבוא עליו מים יטמא וכל משקה אשר ישתה בכל כלי יטמא
(143827, 92, 4);100;ק;156983;(3, 11, 36, 12, 156983);41429;(3, 11, 36, 4, 41429);מקוה;2;4;אך מעין ובור מקוה מים יהיה טהור ונגע בנבלתם יטמא
(143827, 92, 4);6;ו;157075;(3, 11, 38, 28, 157075);41454;(3, 11, 38, 8, 41454);עליו;4;8;וכי יתן מים על זרע ונפל מנבלתם עליו טמא הוא לכם
(143827, 92, 4);1;א;157167;(3, 11, 40, 35, 157167);41478;(3, 11, 40, 8, 41478);והנשא;5;8;והאכל מנבלתה יכבס בגדיו וטמא עד הערב והנשא את נבלתה יכבס בגדיו וטמא עד הערב
(143827, 92, 4);10;י;157259;(3, 11, 42, 37, 157259);41506;(3, 11, 42, 12, 41506);רגלים;4;12;כל הולך על גחון וכל הולך על ארבע עד כל מרבה רגלים לכל השרץ השרץ על הארץ לא תאכלום כי שקץ הם
(143827, 92, 4);10;י;157351;(3, 11, 44, 13, 157351);41532;(3, 11, 44, 4, 41532);אלהיכם;4;4;כי אני יהוה אלהיכם והתקדשתם והייתם קדשים כי קדוש אני ולא תטמאו את נפשתיכם בכל השרץ הרמש על הארץ
(143827, 92, 4);30;ל;157443;(3, 11, 45, 28, 157443);41555;(3, 11, 45, 8, 41555);להית;1;8;כי אני יהוה המעלה אתכם מארץ מצרים להית לכם לאלהים והייתם קדשים כי קדוש אני
(143827, 92, 4);30;ל;157535;(3, 11, 47, 6, 157535);41577;(3, 11, 47, 1, 41577);להבדיל;6;1;להבדיל בין הטמא ובין הטהר ובין החיה הנאכלת ובין החיה אשר לא תאכל
(143827, 92, 4);6;ו;157627;(3, 12, 2, 28, 157627);41603;(3, 12, 2, 9, 41603);וילדה;1;9;דבר אל בני ישראל לאמר אשה כי תזריע וילדה זכר וטמאה שבעת ימים כימי נדת דותה תטמא
(143827, 92, 4);4;ד;157719;(3, 12, 4, 34, 157719);41625;(3, 12, 4, 9, 41625);קדש;2;9;ושלשים יום ושלשת ימים תשב בדמי טהרה בכל קדש לא תגע ואל המקדש לא תבא עד מלאת ימי טהרה
(143827, 92, 4);10;י;157811;(3, 12, 6, 7, 157811);41651;(3, 12, 6, 2, 41651);ימי;1;2;ובמלאת ימי טהרה לבן או לבת תביא כבש בן שנתו לעלה ובן יונה או תר לחטאת אל פתח אהל מועד אל הכהן
(143827, 92, 4);200;ר;157903;(3, 12, 7, 27, 157903);41677;(3, 12, 7, 6, 41677);וטהרה;4;6;והקריבו לפני יהוה וכפר עליה וטהרה ממקר דמיה זאת תורת הילדת לזכר או לנקבה
(143827, 92, 4);200;ר;157995;(3, 12, 8, 60, 157995);41703;(3, 12, 8, 18, 41703);וכפר;4;18;ואם לא תמצא ידה די שה ולקחה שתי תרים או שני בני יונה אחד לעלה ואחד לחטאת וכפר עליה הכהן וטהרה
(143827, 92, 4);5;ה;158087;(3, 13, 2, 54, 158087);41729;(3, 13, 2, 16, 41729);והובא;2;16;אדם כי יהיה בעור בשרו שאת או ספחת או בהרת והיה בעור בשרו לנגע צרעת והובא אל אהרן הכהן או אל אחד מבניו הכהנים
(143827, 92, 4);200;ר;158179;(3, 13, 3, 61, 158179);41754;(3, 13, 3, 17, 41754);צרעת;2;17;וראה הכהן את הנגע בעור הבשר ושער בנגע הפך לבן ומראה הנגע עמק מעור בשרו נגע צרעת הוא וראהו הכהן וטמא אתו
(143827, 92, 4);70;ע;158271;(3, 13, 4, 71, 158271);41779;(3, 13, 4, 20, 41779);שבעת;3;20;ואם בהרת לבנה הוא בעור בשרו ועמק אין מראה מן העור ושערה לא הפך לבן והסגיר הכהן את הנגע שבעת ימים
(143827, 92, 4);40;ם;158363;(3, 13, 6, 15, 158363);41801;(3, 13, 6, 4, 41801);ביום;4;4;וראה הכהן אתו ביום השביעי שנית והנה כהה הנגע ולא פשה הנגע בעור וטהרו הכהן מספחת הוא וכבס בגדיו וטהר
(143827, 92, 4);1;א;158455;(3, 13, 7, 27, 158455);41824;(3, 13, 7, 7, 41824);הראתו;3;7;ואם פשה תפשה המספחת בעור אחרי הראתו אל הכהן לטהרתו ונראה שנית אל הכהן
(143827, 92, 4);2;ב;158547;(3, 13, 9, 21, 158547);41847;(3, 13, 9, 6, 41847);והובא;4;6;נגע צרעת כי תהיה באדם והובא אל הכהן
(143827, 92, 4);3;ג;158639;(3, 13, 11, 34, 158639);41872;(3, 13, 11, 9, 41872);יסגרנו;3;9;צרעת נושנת הוא בעור בשרו וטמאו הכהן לא יסגרנו כי טמא הוא
(143827, 92, 4);5;ה;158731;(3, 13, 13, 12, 158731);41896;(3, 13, 13, 3, 41896);והנה;4;3;וראה הכהן והנה כסתה הצרעת את כל בשרו וטהר את הנגע כלו הפך לבן טהור הוא
(143827, 92, 4);8;ח;158823;(3, 13, 15, 28, 158823);41923;(3, 13, 15, 8, 41923);החי;2;8;וראה הכהן את הבשר החי וטמאו הבשר החי טמא הוא צרעת הוא
(143827, 92, 4);6;ו;158915;(3, 13, 17, 45, 158915);41949;(3, 13, 17, 12, 41949);הוא;2;12;וראהו הכהן והנה נהפך הנגע ללבן וטהר הכהן את הנגע טהור הוא
(143827, 92, 4);80;פ;159007;(3, 13, 20, 18, 159007);41973;(3, 13, 20, 5, 41973);שפל;2;5;וראה הכהן והנה מראה שפל מן העור ושערה הפך לבן וטמאו הכהן נגע צרעת הוא בשחין פרחה
(143827, 92, 4);10;י;159099;(3, 13, 21, 46, 159099);41998;(3, 13, 21, 13, 41998);והיא;3;13;ואם יראנה הכהן והנה אין בה שער לבן ושפלה איננה מן העור והיא כהה והסגירו הכהן שבעת ימים
(143827, 92, 4);5;ה;159191;(3, 13, 23, 38, 159191);42022;(3, 13, 23, 10, 42022);וטהרו;3;10;ואם תחתיה תעמד הבהרת לא פשתה צרבת השחין הוא וטהרו הכהן
(143827, 92, 4);6;ו;159283;(3, 13, 25, 31, 159283);42047;(3, 13, 25, 9, 42047);ומראה;1;9;וראה אתה הכהן והנה נהפך שער לבן בבהרת ומראה עמק מן העור צרעת הוא במכוה פרחה וטמא אתו הכהן נגע צרעת הוא
(143827, 92, 4);50;ן;159375;(3, 13, 26, 42, 159375);42071;(3, 13, 26, 11, 42071);מן;2;11;ואם יראנה הכהן והנה אין בבהרת שער לבן ושפלה איננה מן העור והוא כהה והסגירו הכהן שבעת ימים
