(121849, -83, 4);200;ר;77776;(1, 50, 21, 45, 77776);20538;(1, 50, 21, 11, 20538);וידבר;5;11;ועתה אל תיראו אנכי אכלכל אתכם ואת טפכם וינחם אותם וידבר על לבם
(121849, -83, 4);40;מ;77859;(1, 50, 23, 34, 77859);20561;(1, 50, 23, 10, 20561);מנשה;1;10;וירא יוסף לאפרים בני שלשים גם בני מכיר בן מנשה ילדו על ברכי יוסף
(121849, -83, 4);200;ר;77942;(1, 50, 24, 66, 77942);20583;(1, 50, 24, 18, 20583);אשר;3;18;ויאמר יוסף אל אחיו אנכי מת ואלהים פקד יפקד אתכם והעלה אתכם מן הארץ הזאת אל הארץ אשר נשבע לאברהם ליצחק וליעקב
(121849, -83, 4);60;ס;78025;(1, 50, 26, 7, 78025);20603;(1, 50, 26, 2, 20603);יוסף;3;2;וימת יוסף בן מאה ועשר שנים ויחנטו אתו ויישם בארון במצרים
(121849, -83, 4);6;ו;78108;(2, 1, 1, 44, 78108);20623;(2, 1, 1, 11, 20623);באו;3;11;ואלה שמות בני ישראל הבאים מצרימה את יעקב איש וביתו באו
(121849, -83, 4);5;ה;78191;(2, 1, 5, 34, 78191);20644;(2, 1, 5, 10, 20644);היה;1;10;ויהי כל נפש יצאי ירך יעקב שבעים נפש ויוסף היה במצרים
(121849, -83, 4);6;ו;78274;(2, 1, 8, 1, 78274);20664;(2, 1, 8, 1, 20664);ויקם;1;1;ויקם מלך חדש על מצרים אשר לא ידע את יוסף
(121849, -83, 4);5;ה;78357;(2, 1, 10, 19, 78357);20689;(2, 1, 10, 6, 20689);והיה;2;6;הבה נתחכמה לו פן ירבה והיה כי תקראנה מלחמה ונוסף גם הוא על שנאינו ונלחם בנו ועלה מן הארץ
(121849, -83, 4);6;ו;78440;(2, 1, 11, 32, 78440);20710;(2, 1, 11, 8, 20710);ויבן;1;8;וישימו עליו שרי מסים למען ענתו בסבלתם ויבן ערי מסכנות לפרעה את פתם ואת רעמסס
(121849, -83, 4);40;ם;78523;(2, 1, 13, 11, 78523);20730;(2, 1, 13, 2, 20730);מצרים;5;2;ויעבדו מצרים את בני ישראל בפרך
(121849, -83, 4);10;י;78606;(2, 1, 15, 2, 78606);20752;(2, 1, 15, 1, 20752);ויאמר;2;1;ויאמר מלך מצרים למילדת העברית אשר שם האחת שפרה ושם השנית פועה
(121849, -83, 4);1;א;78689;(2, 1, 16, 35, 78689);20771;(2, 1, 16, 8, 20771);אם;1;8;ויאמר בילדכן את העבריות וראיתן על האבנים אם בן הוא והמתן אתו ואם בת הוא וחיה
(121849, -83, 4);30;ל;78772;(2, 1, 17, 57, 78772);20793;(2, 1, 17, 14, 20793);הילדים;3;14;ותיראן המילדת את האלהים ולא עשו כאשר דבר אליהן מלך מצרים ותחיין את הילדים
(121849, -83, 4);20;כ;78855;(2, 1, 19, 23, 78855);20813;(2, 1, 19, 7, 20813);כנשים;1;7;ותאמרן המילדת אל פרעה כי לא כנשים המצרית העברית כי חיות הנה בטרם תבוא אלהן המילדת וילדו
(121849, -83, 4);5;ה;78938;(2, 1, 21, 3, 78938);20831;(2, 1, 21, 1, 20831);ויהי;3;1;ויהי כי יראו המילדת את האלהים ויעש להם בתים
(121849, -83, 4);50;ן;79021;(2, 1, 22, 51, 79021);20852;(2, 1, 22, 13, 20852);תחיון;5;13;ויצו פרעה לכל עמו לאמר כל הבן הילוד היארה תשליכהו וכל הבת תחיון
(121849, -83, 4);80;פ;79104;(2, 2, 3, 13, 79104);20876;(2, 2, 3, 4, 20876);הצפינו;3;4;ולא יכלה עוד הצפינו ותקח לו תבת גמא ותחמרה בחמר ובזפת ותשם בה את הילד ותשם בסוף על שפת היאר
(121849, -83, 4);30;ל;79187;(2, 2, 4, 24, 79187);20899;(2, 2, 4, 7, 20899);לו;1;7;ותתצב אחתו מרחק לדעה מה יעשה לו
(121849, -83, 4);1;א;79270;(2, 2, 6, 9, 79270);20921;(2, 2, 6, 2, 20921);ותראהו;4;2;ותפתח ותראהו את הילד והנה נער בכה ותחמל עליו ותאמר מילדי העברים זה
(121849, -83, 4);40;מ;79353;(2, 2, 7, 38, 79353);20943;(2, 2, 7, 11, 20943);מן;1;11;ותאמר אחתו אל בת פרעה האלך וקראתי לך אשה מינקת מן העברית ותינק לך את הילד
(121849, -83, 4);4;ד;79436;(2, 2, 9, 25, 79436);20966;(2, 2, 9, 7, 20966);הילד;4;7;ותאמר לה בת פרעה היליכי את הילד הזה והינקהו לי ואני אתן את שכרך ותקח האשה הילד ותניקהו
(121849, -83, 4);6;ו;79519;(2, 2, 10, 39, 79519);20987;(2, 2, 10, 10, 20987);שמו;3;10;ויגדל הילד ותבאהו לבת פרעה ויהי לה לבן ותקרא שמו משה ותאמר כי מן המים משיתהו
(121849, -83, 4);10;י;79602;(2, 2, 11, 61, 79602);21009;(2, 2, 11, 16, 21009);עברי;4;16;ויהי בימים ההם ויגדל משה ויצא אל אחיו וירא בסבלתם וירא איש מצרי מכה איש עברי מאחיו
(121849, -83, 4);1;א;79685;(2, 2, 13, 36, 79685);21031;(2, 2, 13, 9, 21031);ויאמר;3;9;ויצא ביום השני והנה שני אנשים עברים נצים ויאמר לרשע למה תכה רעך
(121849, -83, 4);20;כ;79768;(2, 2, 14, 68, 79768);21053;(2, 2, 14, 18, 21053);אכן;2;18;ויאמר מי שמך לאיש שר ושפט עלינו הלהרגני אתה אמר כאשר הרגת את המצרי ויירא משה ויאמר אכן נודע הדבר
(121849, -83, 4);5;ה;79851;(2, 2, 16, 4, 79851);21075;(2, 2, 16, 1, 21075);ולכהן;4;1;ולכהן מדין שבע בנות ותבאנה ותדלנה ותמלאנה את הרהטים להשקות צאן אביהן
(121849, -83, 4);50;ן;79934;(2, 2, 17, 30, 79934);21092;(2, 2, 17, 6, 21092);ויושען;6;6;ויבאו הרעים ויגרשום ויקם משה ויושען וישק את צאנם
(121849, -83, 4);30;ל;80017;(2, 2, 19, 35, 80017);21113;(2, 2, 19, 9, 21113);דלה;2;9;ותאמרן איש מצרי הצילנו מיד הרעים וגם דלה דלה לנו וישק את הצאן
(121849, -83, 4);1;א;80100;(2, 2, 21, 23, 80100);21137;(2, 2, 21, 7, 21137);את;1;7;ויואל משה לשבת את האיש ויתן את צפרה בתו למשה
(121849, -83, 4);6;ו;80183;(2, 2, 23, 30, 80183);21160;(2, 2, 23, 8, 21160);ויאנחו;1;8;ויהי בימים הרבים ההם וימת מלך מצרים ויאנחו בני ישראל מן העבדה ויזעקו ותעל שועתם אל האלהים מן העבדה
(121849, -83, 4);400;ת;80266;(2, 2, 24, 33, 80266);21179;(2, 2, 24, 8, 21179);בריתו;4;8;וישמע אלהים את נאקתם ויזכר אלהים את בריתו את אברהם את יצחק ואת יעקב
(121849, -83, 4);5;ה;80349;(2, 3, 1, 34, 80349);21202;(2, 3, 1, 10, 21202);וינהג;4;10;ומשה היה רעה את צאן יתרו חתנו כהן מדין וינהג את הצאן אחר המדבר ויבא אל הר האלהים חרבה
(121849, -83, 4);5;ה;80432;(2, 3, 2, 50, 80432);21225;(2, 3, 2, 14, 21225);והסנה;2;14;וירא מלאך יהוה אליו בלבת אש מתוך הסנה וירא והנה הסנה בער באש והסנה איננו אכל
(121849, -83, 4);10;י;80515;(2, 3, 4, 25, 80515);21247;(2, 3, 4, 7, 21247);אליו;3;7;וירא יהוה כי סר לראות ויקרא אליו אלהים מתוך הסנה ויאמר משה משה ויאמר הנני
(121849, -83, 4);10;י;80598;(2, 3, 5, 49, 80598);21269;(2, 3, 5, 14, 21269);עליו;3;14;ויאמר אל תקרב הלם של נעליך מעל רגליך כי המקום אשר אתה עומד עליו אדמת קדש הוא
(121849, -83, 4);10;י;80681;(2, 3, 6, 72, 80681);21290;(2, 3, 6, 18, 21290);האלהים;5;18;ויאמר אנכי אלהי אביך אלהי אברהם אלהי יצחק ואלהי יעקב ויסתר משה פניו כי ירא מהביט אל האלהים
(121849, -83, 4);40;מ;80764;(2, 3, 8, 11, 80764);21311;(2, 3, 8, 3, 21311);מיד;1;3;וארד להצילו מיד מצרים ולהעלתו מן הארץ ההוא אל ארץ טובה ורחבה אל ארץ זבת חלב ודבש אל מקום הכנעני והחתי והאמרי והפרזי והחוי והיבוסי
(121849, -83, 4);6;ו;80847;(2, 3, 8, 94, 80847);21332;(2, 3, 8, 24, 21332);והחוי;1;24;וארד להצילו מיד מצרים ולהעלתו מן הארץ ההוא אל ארץ טובה ורחבה אל ארץ זבת חלב ודבש אל מקום הכנעני והחתי והאמרי והפרזי והחוי והיבוסי
(121849, -83, 4);200;ר;80930;(2, 3, 10, 17, 80930);21353;(2, 3, 10, 5, 21353);פרעה;2;5;ועתה לכה ואשלחך אל פרעה והוצא את עמי בני ישראל ממצרים
(121849, -83, 4);40;ם;81013;(2, 3, 11, 57, 81013);21375;(2, 3, 11, 16, 21375);ממצרים;6;16;ויאמר משה אל האלהים מי אנכי כי אלך אל פרעה וכי אוציא את בני ישראל ממצרים
(121849, -83, 4);5;ה;81096;(2, 3, 13, 8, 81096);21397;(2, 3, 13, 2, 21397);משה;3;2;ויאמר משה אל האלהים הנה אנכי בא אל בני ישראל ואמרתי להם אלהי אבותיכם שלחני אליכם ואמרו לי מה שמו מה אמר אלהם
(121849, -83, 4);200;ר;81179;(2, 3, 14, 5, 81179);21419;(2, 3, 14, 1, 21419);ויאמר;5;1;ויאמר אלהים אל משה אהיה אשר אהיה ויאמר כה תאמר לבני ישראל אהיה שלחני אליכם
(121849, -83, 4);50;נ;81262;(2, 3, 15, 28, 81262);21442;(2, 3, 15, 9, 21442);בני;2;9;ויאמר עוד אלהים אל משה כה תאמר אל בני ישראל יהוה אלהי אבתיכם אלהי אברהם אלהי יצחק ואלהי יעקב שלחני אליכם זה שמי לעלם וזה זכרי לדר דר
(121849, -83, 4);80;פ;81345;(2, 3, 16, 6, 81345);21463;(2, 3, 16, 2, 21463);ואספת;4;2;לך ואספת את זקני ישראל ואמרת אלהם יהוה אלהי אבתיכם נראה אלי אלהי אברהם יצחק ויעקב לאמר פקד פקדתי אתכם ואת העשוי לכם במצרים
(121849, -83, 4);6;ו;81428;(2, 3, 16, 89, 81428);21483;(2, 3, 16, 22, 21483);העשוי;4;22;לך ואספת את זקני ישראל ואמרת אלהם יהוה אלהי אבתיכם נראה אלי אלהי אברהם יצחק ויעקב לאמר פקד פקדתי אתכם ואת העשוי לכם במצרים
(121849, -83, 4);6;ו;81511;(2, 3, 17, 73, 81511);21503;(2, 3, 17, 18, 21503);ודבש;1;18;ואמר אעלה אתכם מעני מצרים אל ארץ הכנעני והחתי והאמרי והפרזי והחוי והיבוסי אל ארץ זבת חלב ודבש
(121849, -83, 4);1;א;81594;(2, 3, 18, 80, 81594);21522;(2, 3, 18, 19, 21522);נא;2;19;ושמעו לקלך ובאת אתה וזקני ישראל אל מלך מצרים ואמרתם אליו יהוה אלהי העבריים נקרה עלינו ועתה נלכה נא דרך שלשת ימים במדבר ונזבחה ליהוה אלהינו
(121849, -83, 4);400;ת;81677;(2, 3, 20, 8, 81677);21543;(2, 3, 20, 2, 21543);את;2;2;ושלחתי את ידי והכיתי את מצרים בכל נפלאתי אשר אעשה בקרבו ואחרי כן ישלח אתכם
(121849, -83, 4);10;י;81760;(2, 3, 21, 31, 81760);21565;(2, 3, 21, 9, 21565);כי;2;9;ונתתי את חן העם הזה בעיני מצרים והיה כי תלכון לא תלכו ריקם
(121849, -83, 4);40;ם;81843;(2, 3, 22, 68, 81843);21585;(2, 3, 22, 16, 21585);ונצלתם;6;16;ושאלה אשה משכנתה ומגרת ביתה כלי כסף וכלי זהב ושמלת ושמתם על בניכם ועל בנתיכם ונצלתם את מצרים
(121849, -83, 4);10;י;81926;(2, 4, 2, 18, 81926);21608;(2, 4, 2, 5, 21608);בידך;2;5;ויאמר אליו יהוה מזה בידך ויאמר מטה
(121849, -83, 4);7;ז;82009;(2, 4, 4, 26, 82009);21628;(2, 4, 4, 8, 21628);בזנבו;2;8;ויאמר יהוה אל משה שלח ידך ואחז בזנבו וישלח ידו ויחזק בו ויהי למטה בכפו
(121849, -83, 4);5;ה;82092;(2, 4, 5, 53, 82092);21648;(2, 4, 5, 13, 21648);ואלהי;4;13;למען יאמינו כי נראה אליך יהוה אלהי אבתם אלהי אברהם אלהי יצחק ואלהי יעקב
(121849, -83, 4);20;ך;82175;(2, 4, 7, 17, 82175);21670;(2, 4, 7, 5, 21670);חיקך;4;5;ויאמר השב ידך אל חיקך וישב ידו אל חיקו ויוצאה מחיקו והנה שבה כבשרו
(121849, -83, 4);5;ה;82258;(2, 4, 8, 47, 82258);21692;(2, 4, 8, 13, 21692);האת;1;13;והיה אם לא יאמינו לך ולא ישמעו לקל האת הראשון והאמינו לקל האת האחרון
(121849, -83, 4);1;א;82341;(2, 4, 9, 75, 82341);21712;(2, 4, 9, 19, 21712);אשר;1;19;והיה אם לא יאמינו גם לשני האתות האלה ולא ישמעון לקלך ולקחת ממימי היאר ושפכת היבשה והיו המים אשר תקח מן היאר והיו לדם ביבשת
(121849, -83, 4);70;ע;82424;(2, 4, 10, 60, 82424);21737;(2, 4, 10, 19, 21737);עבדך;1;19;ויאמר משה אל יהוה בי אדני לא איש דברים אנכי גם מתמול גם משלשם גם מאז דברך אל עבדך כי כבד פה וכבד לשון אנכי
(121849, -83, 4);6;ו;82507;(2, 4, 12, 1, 82507);21764;(2, 4, 12, 1, 21764);ועתה;1;1;ועתה לך ואנכי אהיה עם פיך והוריתיך אשר תדבר
(121849, -83, 4);50;ן;82590;(2, 4, 14, 26, 82590);21786;(2, 4, 14, 7, 21786);אהרן;4;7;ויחר אף יהוה במשה ויאמר הלא אהרן אחיך הלוי ידעתי כי דבר ידבר הוא וגם הנה הוא יצא לקראתך וראך ושמח בלבו
(121849, -83, 4);50;נ;82673;(2, 4, 15, 28, 82673);21808;(2, 4, 15, 7, 21808);ואנכי;3;7;ודברת אליו ושמת את הדברים בפיו ואנכי אהיה עם פיך ועם פיהו והוריתי אתכם את אשר תעשון
(121849, -83, 4);5;ה;82756;(2, 4, 16, 44, 82756);21832;(2, 4, 16, 14, 21832);לאלהים;4;14;ודבר הוא לך אל העם והיה הוא יהיה לך לפה ואתה תהיה לו לאלהים
(121849, -83, 4);40;מ;82839;(2, 4, 18, 49, 82839);21857;(2, 4, 18, 15, 21857);במצרים;2;15;וילך משה וישב אל יתר חתנו ויאמר לו אלכה נא ואשובה אל אחי אשר במצרים ואראה העודם חיים ויאמר יתרו למשה לך לשלום
(121849, -83, 4);100;ק;82922;(2, 4, 19, 45, 82922);21878;(2, 4, 19, 13, 21878);המבקשים;4;13;ויאמר יהוה אל משה במדין לך שב מצרים כי מתו כל האנשים המבקשים את נפשך
(121849, -83, 4);5;ה;83005;(2, 4, 21, 7, 83005);21900;(2, 4, 21, 2, 21900);יהוה;2;2;ויאמר יהוה אל משה בלכתך לשוב מצרימה ראה כל המפתים אשר שמתי בידך ועשיתם לפני פרעה ואני אחזק את לבו ולא ישלח את העם
(121849, -83, 4);40;ם;83088;(2, 4, 21, 90, 83088);21922;(2, 4, 21, 24, 21922);העם;3;24;ויאמר יהוה אל משה בלכתך לשוב מצרימה ראה כל המפתים אשר שמתי בידך ועשיתם לפני פרעה ואני אחזק את לבו ולא ישלח את העם
(121849, -83, 4);200;ר;83171;(2, 4, 23, 51, 83171);21945;(2, 4, 23, 14, 21945);בכרך;3;14;ואמר אליך שלח את בני ויעבדני ותמאן לשלחו הנה אנכי הרג את בנך בכרך
(121849, -83, 4);40;ם;83254;(2, 4, 25, 48, 83254);21965;(2, 4, 25, 13, 21965);דמים;4;13;ותקח צפרה צר ותכרת את ערלת בנה ותגע לרגליו ותאמר כי חתן דמים אתה לי
(121849, -83, 4);6;ו;83337;(2, 4, 27, 52, 83337);21987;(2, 4, 27, 13, 21987);וישק;1;13;ויאמר יהוה אל אהרן לך לקראת משה המדברה וילך ויפגשהו בהר האלהים וישק לו
(121849, -83, 4);300;ש;83420;(2, 4, 29, 31, 83420);22011;(2, 4, 29, 9, 22011);ישראל;2;9;וילך משה ואהרן ויאספו את כל זקני בני ישראל
(121849, -83, 4);300;ש;83503;(2, 4, 31, 30, 83503);22034;(2, 4, 31, 9, 22034);ישראל;2;9;ויאמן העם וישמעו כי פקד יהוה את בני ישראל וכי ראה את ענים ויקדו וישתחוו
(121849, -83, 4);8;ח;83586;(2, 5, 1, 56, 83586);22056;(2, 5, 1, 16, 22056);ויחגו;3;16;ואחר באו משה ואהרן ויאמרו אל פרעה כה אמר יהוה אלהי ישראל שלח את עמי ויחגו לי במדבר
(121849, -83, 4);30;ל;83669;(2, 5, 3, 8, 83669);22079;(2, 5, 3, 2, 22079);אלהי;2;2;ויאמרו אלהי העברים נקרא עלינו נלכה נא דרך שלשת ימים במדבר ונזבחה ליהוה אלהינו פן יפגענו בדבר או בחרב
(121849, -83, 4);40;ם;83752;(2, 5, 4, 9, 83752);22098;(2, 5, 4, 2, 22098);אלהם;4;2;ויאמר אלהם מלך מצרים למה משה ואהרן תפריעו את העם ממעשיו לכו לסבלתיכם
(121849, -83, 4);2;ב;83835;(2, 5, 5, 36, 83835);22119;(2, 5, 5, 10, 22119);מסבלתם;3;10;ויאמר פרעה הן רבים עתה עם הארץ והשבתם אתם מסבלתם
(121849, -83, 4);20;כ;83918;(2, 5, 7, 41, 83918);22140;(2, 5, 7, 11, 22140);ילכו;3;11;לא תאספון לתת תבן לעם ללבן הלבנים כתמול שלשם הם ילכו וקששו להם תבן
(121849, -83, 4);10;י;84001;(2, 5, 8, 71, 84001);22163;(2, 5, 8, 20, 22163);צעקים;4;20;ואת מתכנת הלבנים אשר הם עשים תמול שלשם תשימו עליהם לא תגרעו ממנו כי נרפים הם על כן הם צעקים לאמר נלכה נזבחה לאלהינו
(121849, -83, 4);200;ר;84084;(2, 5, 10, 23, 84084);22182;(2, 5, 10, 5, 22182);ויאמרו;5;5;ויצאו נגשי העם ושטריו ויאמרו אל העם לאמר כה אמר פרעה אינני נתן לכם תבן
(121849, -83, 4);40;ם;84167;(2, 5, 12, 7, 84167);22206;(2, 5, 12, 2, 22206);העם;3;2;ויפץ העם בכל ארץ מצרים לקשש קש לתבן
(121849, -83, 4);200;ר;84250;(2, 5, 14, 14, 84250);22227;(2, 5, 14, 4, 22227);ישראל;3;4;ויכו שטרי בני ישראל אשר שמו עלהם נגשי פרעה לאמר מדוע לא כליתם חקכם ללבן כתמול שלשם גם תמול גם היום
(121849, -83, 4);10;י;84333;(2, 5, 15, 19, 84333);22249;(2, 5, 15, 5, 22249);ויצעקו;2;5;ויבאו שטרי בני ישראל ויצעקו אל פרעה לאמר למה תעשה כה לעבדיך
(121849, -83, 4);6;ו;84416;(2, 5, 17, 1, 84416);22270;(2, 5, 17, 1, 22270);ויאמר;1;1;ויאמר נרפים אתם נרפים על כן אתם אמרים נלכה נזבחה ליהוה
(121849, -83, 4);200;ר;84499;(2, 5, 19, 3, 84499);22291;(2, 5, 19, 1, 22291);ויראו;3;1;ויראו שטרי בני ישראל אתם ברע לאמר לא תגרעו מלבניכם דבר יום ביומו
(121849, -83, 4);40;ם;84582;(2, 5, 20, 34, 84582);22311;(2, 5, 20, 8, 22311);בצאתם;5;8;ויפגעו את משה ואת אהרן נצבים לקראתם בצאתם מאת פרעה
(121849, -83, 4);200;ר;84665;(2, 5, 21, 76, 84665);22331;(2, 5, 21, 18, 22331);להרגנו;3;18;ויאמרו אלהם ירא יהוה עליכם וישפט אשר הבאשתם את ריחנו בעיני פרעה ובעיני עבדיו לתת חרב בידם להרגנו
(121849, -83, 4);5;ה;84748;(2, 5, 23, 33, 84748);22354;(2, 5, 23, 10, 22354);והצל;2;10;ומאז באתי אל פרעה לדבר בשמך הרע לעם הזה והצל לא הצלת את עמך
(121849, -83, 4);200;ר;84831;(2, 6, 2, 5, 84831);22376;(2, 6, 2, 1, 22376);וידבר;5;1;וידבר אלהים אל משה ויאמר אליו אני יהוה
(121849, -83, 4);10;י;84914;(2, 6, 4, 8, 84914);22399;(2, 6, 4, 2, 22399);הקמתי;5;2;וגם הקמתי את בריתי אתם לתת להם את ארץ כנען את ארץ מגריהם אשר גרו בה
(121849, -83, 4);40;ם;84997;(2, 6, 5, 39, 84997);22423;(2, 6, 5, 10, 22423);מעבדים;6;10;וגם אני שמעתי את נאקת בני ישראל אשר מצרים מעבדים אתם ואזכר את בריתי
(121849, -83, 4);10;י;85080;(2, 6, 6, 68, 85080);22442;(2, 6, 6, 15, 22442);וגאלתי;6;15;לכן אמר לבני ישראל אני יהוה והוצאתי אתכם מתחת סבלת מצרים והצלתי אתכם מעבדתם וגאלתי אתכם בזרוע נטויה ובשפטים גדלים
(121849, -83, 4);1;א;85163;(2, 6, 7, 57, 85163);22460;(2, 6, 7, 13, 22460);המוציא;6;13;ולקחתי אתכם לי לעם והייתי לכם לאלהים וידעתם כי אני יהוה אלהיכם המוציא אתכם מתחת סבלות מצרים
(121849, -83, 4);6;ו;85246;(2, 6, 8, 65, 85246);22481;(2, 6, 8, 17, 22481);מורשה;2;17;והבאתי אתכם אל הארץ אשר נשאתי את ידי לתת אתה לאברהם ליצחק וליעקב ונתתי אתה לכם מורשה אני יהוה
(121849, -83, 4);30;ל;85329;(2, 6, 11, 7, 85329);22505;(2, 6, 11, 3, 22505);אל;2;3;בא דבר אל פרעה מלך מצרים וישלח את בני ישראל מארצו
(121849, -83, 4);200;ר;85412;(2, 6, 12, 51, 85412);22527;(2, 6, 12, 14, 22527);פרעה;2;14;וידבר משה לפני יהוה לאמר הן בני ישראל לא שמעו אלי ואיך ישמעני פרעה ואני ערל שפתים
(121849, -83, 4);1;א;85495;(2, 6, 13, 69, 85495);22549;(2, 6, 13, 19, 22549);מארץ;2;19;וידבר יהוה אל משה ואל אהרן ויצום אל בני ישראל ואל פרעה מלך מצרים להוציא את בני ישראל מארץ מצרים
(121849, -83, 4);6;ו;85578;(2, 6, 15, 15, 85578);22569;(2, 6, 15, 4, 22569);וימין;1;4;ובני שמעון ימואל וימין ואהד ויכין וצחר ושאול בן הכנענית אלה משפחת שמעון
(121849, -83, 4);8;ח;85661;(2, 6, 16, 39, 85661);22588;(2, 6, 16, 10, 22588);חיי;1;10;ואלה שמות בני לוי לתלדתם גרשון וקהת ומררי ושני חיי לוי שבע ושלשים ומאת שנה
(121849, -83, 4);400;ת;85744;(2, 6, 18, 38, 85744);22607;(2, 6, 18, 9, 22607);קהת;3;9;ובני קהת עמרם ויצהר וחברון ועזיאל ושני חיי קהת שלש ושלשים ומאת שנה
(121849, -83, 4);1;א;85827;(2, 6, 20, 32, 85827);22629;(2, 6, 20, 10, 22629);את;1;10;ויקח עמרם את יוכבד דדתו לו לאשה ותלד לו את אהרן ואת משה ושני חיי עמרם שבע ושלשים ומאת שנה
(121849, -83, 4);10;י;85910;(2, 6, 22, 25, 85910);22649;(2, 6, 22, 5, 22649);וסתרי;5;5;ובני עזיאל מישאל ואלצפן וסתרי
(121849, -83, 4);60;ס;85993;(2, 6, 24, 9, 85993);22672;(2, 6, 24, 3, 22672);אסיר;2;3;ובני קרח אסיר ואלקנה ואביאסף אלה משפחת הקרחי
(121849, -83, 4);1;א;86076;(2, 6, 25, 55, 86076);22693;(2, 6, 25, 16, 22693);אבות;1;16;ואלעזר בן אהרן לקח לו מבנות פוטיאל לו לאשה ותלד לו את פינחס אלה ראשי אבות הלוים למשפחתם
(121849, -83, 4);80;פ;86159;(2, 6, 27, 12, 86159);22714;(2, 6, 27, 4, 22714);פרעה;1;4;הם המדברים אל פרעה מלך מצרים להוציא את בני ישראל ממצרים הוא משה ואהרן
(121849, -83, 4);1;א;86242;(2, 6, 29, 10, 86242);22735;(2, 6, 29, 3, 22735);אל;1;3;וידבר יהוה אל משה לאמר אני יהוה דבר אל פרעה מלך מצרים את כל אשר אני דבר אליך
(121849, -83, 4);10;י;86325;(2, 6, 30, 34, 86325);22760;(2, 6, 30, 10, 22760);ישמע;1;10;ויאמר משה לפני יהוה הן אני ערל שפתים ואיך ישמע אלי פרעה
(121849, -83, 4);50;ן;86408;(2, 7, 2, 23, 86408);22781;(2, 7, 2, 7, 22781);ואהרן;5;7;אתה תדבר את כל אשר אצוך ואהרן אחיך ידבר אל פרעה ושלח את בני ישראל מארצו
(121849, -83, 4);10;י;86491;(2, 7, 4, 4, 86491);22804;(2, 7, 4, 2, 22804);ישמע;1;2;ולא ישמע אלכם פרעה ונתתי את ידי במצרים והוצאתי את צבאתי את עמי בני ישראל מארץ מצרים בשפטים גדלים
(121849, -83, 4);10;י;86574;(2, 7, 5, 9, 86574);22823;(2, 7, 5, 2, 22823);מצרים;4;2;וידעו מצרים כי אני יהוה בנטתי את ידי על מצרים והוצאתי את בני ישראל מתוכם
(121849, -83, 4);300;ש;86657;(2, 7, 7, 3, 86657);22846;(2, 7, 7, 1, 22846);ומשה;3;1;ומשה בן שמנים שנה ואהרן בן שלש ושמנים שנה בדברם אל פרעה
(121849, -83, 4);40;מ;86740;(2, 7, 9, 17, 86740);22869;(2, 7, 9, 5, 22869);לאמר;3;5;כי ידבר אלכם פרעה לאמר תנו לכם מופת ואמרת אל אהרן קח את מטך והשלך לפני פרעה יהי לתנין
(121849, -83, 4);10;י;86823;(2, 7, 10, 33, 86823);22893;(2, 7, 10, 10, 22893);יהוה;1;10;ויבא משה ואהרן אל פרעה ויעשו כן כאשר צוה יהוה וישלך אהרן את מטהו לפני פרעה ולפני עבדיו ויהי לתנין
(121849, -83, 4);40;מ;86906;(2, 7, 11, 38, 86906);22912;(2, 7, 11, 9, 22912);חרטמי;4;9;ויקרא גם פרעה לחכמים ולמכשפים ויעשו גם הם חרטמי מצרים בלהטיהם כן
(121849, -83, 4);200;ר;86989;(2, 7, 13, 25, 86989);22932;(2, 7, 13, 7, 22932);כאשר;4;7;ויחזק לב פרעה ולא שמע אלהם כאשר דבר יהוה
(121849, -83, 4);200;ר;87072;(2, 7, 15, 43, 87072);22956;(2, 7, 15, 12, 22956);היאר;4;12;לך אל פרעה בבקר הנה יצא המימה ונצבת לקראתו על שפת היאר והמטה אשר נהפך לנחש תקח בידך
