(121849, -83, 4);400;ת;228089;(4, 23, 10, 44, 228089);60173;(4, 23, 10, 13, 60173);ותהי;2;13;מי מנה עפר יעקב ומספר את רבע ישראל תמת נפשי מות ישרים ותהי אחריתי כמהו
(121849, -83, 4);5;ה;228172;(4, 23, 12, 25, 228172);60195;(4, 23, 12, 7, 60195);יהוה;4;7;ויען ויאמר הלא את אשר ישים יהוה בפי אתו אשמר לדבר
(121849, -83, 4);300;ש;228255;(4, 23, 13, 69, 228255);60220;(4, 23, 13, 21, 60220);משם;2;21;ויאמר אליו בלק לך נא אתי אל מקום אחר אשר תראנו משם אפס קצהו תראה וכלו לא תראה וקבנו לי משם
(121849, -83, 4);200;ר;228338;(4, 23, 15, 31, 228338);60242;(4, 23, 15, 9, 60242);אקרה;3;9;ויאמר אל בלק התיצב כה על עלתך ואנכי אקרה כה
(121849, -83, 4);1;א;228421;(4, 23, 17, 35, 228421);60266;(4, 23, 17, 10, 60266);ויאמר;3;10;ויבא אליו והנו נצב על עלתו ושרי מואב אתו ויאמר לו בלק מה דבר יהוה
(121849, -83, 4);1;א;228504;(4, 23, 19, 29, 228504);60290;(4, 23, 19, 9, 60290);אמר;1;9;לא איש אל ויכזב ובן אדם ויתנחם ההוא אמר ולא יעשה ודבר ולא יקימנה
(121849, -83, 4);10;י;228587;(4, 23, 21, 37, 228587);60311;(4, 23, 21, 10, 60311);אלהיו;4;10;לא הביט און ביעקב ולא ראה עמל בישראל יהוה אלהיו עמו ותרועת מלך בו
(121849, -83, 4);30;ל;228670;(4, 23, 23, 43, 228670);60332;(4, 23, 23, 11, 60332);ולישראל;7;11;כי לא נחש ביעקב ולא קסם בישראל כעת יאמר ליעקב ולישראל מה פעל אל
(121849, -83, 4);3;ג;228753;(4, 23, 25, 26, 228753);60358;(4, 23, 25, 9, 60358);גם;1;9;ויאמר בלק אל בלעם גם קב לא תקבנו גם ברך לא תברכנו
(121849, -83, 4);5;ה;228836;(4, 23, 27, 17, 228836);60381;(4, 23, 27, 5, 60381);לכה;3;5;ויאמר בלק אל בלעם לכה נא אקחך אל מקום אחר אולי יישר בעיני האלהים וקבתו לי משם
(121849, -83, 4);10;י;228919;(4, 23, 29, 2, 228919);60404;(4, 23, 29, 1, 60404);ויאמר;2;1;ויאמר בלעם אל בלק בנה לי בזה שבעה מזבחת והכן לי בזה שבעה פרים ושבעה אילם
(121849, -83, 4);30;ל;229002;(4, 23, 30, 28, 229002);60427;(4, 23, 30, 8, 60427);ואיל;4;8;ויעש בלק כאשר אמר בלעם ויעל פר ואיל במזבח
(121849, -83, 4);30;ל;229085;(4, 24, 2, 6, 229085);60449;(4, 24, 2, 2, 60449);בלעם;2;2;וישא בלעם את עיניו וירא את ישראל שכן לשבטיו ותהי עליו רוח אלהים
(121849, -83, 4);5;ה;229168;(4, 24, 3, 38, 229168);60471;(4, 24, 3, 11, 60471);העין;1;11;וישא משלו ויאמר נאם בלעם בנו בער ונאם הגבר שתם העין
(121849, -83, 4);70;ע;229251;(4, 24, 6, 15, 229251);60492;(4, 24, 6, 4, 60492);עלי;1;4;כנחלים נטיו כגנת עלי נהר כאהלים נטע יהוה כארזים עלי מים
(121849, -83, 4);1;א;229334;(4, 24, 8, 7, 229334);60512;(4, 24, 8, 2, 60512);מוציאו;5;2;אל מוציאו ממצרים כתועפת ראם לו יאכל גוים צריו ועצמתיהם יגרם וחציו ימחץ
(121849, -83, 4);200;ר;229417;(4, 24, 9, 32, 229417);60531;(4, 24, 9, 8, 60531);ברוך;2;8;כרע שכב כארי וכלביא מי יקימנו מברכיך ברוך וארריך ארור
(121849, -83, 4);70;ע;229500;(4, 24, 10, 71, 229500);60554;(4, 24, 10, 21, 60554);פעמים;2;21;ויחר אף בלק אל בלעם ויספק את כפיו ויאמר בלק אל בלעם לקב איבי קראתיך והנה ברכת ברך זה שלש פעמים
(121849, -83, 4);400;ת;229583;(4, 24, 12, 34, 229583);60576;(4, 24, 12, 10, 60576);שלחת;4;10;ויאמר בלעם אל בלק הלא גם אל מלאכיך אשר שלחת אלי דברתי לאמר
(121849, -83, 4);5;ה;229666;(4, 24, 13, 71, 229666);60601;(4, 24, 13, 22, 60601);יהוה;4;22;אם יתן לי בלק מלא ביתו כסף וזהב לא אוכל לעבר את פי יהוה לעשות טובה או רעה מלבי אשר ידבר יהוה אתו אדבר
(121849, -83, 4);2;ב;229749;(4, 24, 15, 24, 229749);60623;(4, 24, 15, 7, 60623);בער;1;7;וישא משלו ויאמר נאם בלעם בנו בער ונאם הגבר שתם העין
(121849, -83, 4);6;ו;229832;(4, 24, 17, 18, 229832);60645;(4, 24, 17, 5, 60645);ולא;1;5;אראנו ולא עתה אשורנו ולא קרוב דרך כוכב מיעקב וקם שבט מישראל ומחץ פאתי מואב וקרקר כל בני שת
(121849, -83, 4);6;ו;229915;(4, 24, 18, 29, 229915);60666;(4, 24, 18, 7, 60666);איביו;5;7;והיה אדום ירשה והיה ירשה שעיר איביו וישראל עשה חיל
(121849, -83, 4);2;ב;229998;(4, 24, 20, 48, 229998);60686;(4, 24, 20, 12, 60686);אבד;2;12;וירא את עמלק וישא משלו ויאמר ראשית גוים עמלק ואחריתו עדי אבד
(121849, -83, 4);1;א;230081;(4, 24, 23, 11, 230081);60709;(4, 24, 23, 3, 60709);ויאמר;3;3;וישא משלו ויאמר אוי מי יחיה משמו אל
(121849, -83, 4);5;ה;230164;(4, 24, 25, 28, 230164);60733;(4, 24, 25, 8, 60733);הלך;1;8;ויקם בלעם וילך וישב למקמו וגם בלק הלך לדרכו
(121849, -83, 4);10;י;230247;(4, 25, 2, 40, 230247);60751;(4, 25, 2, 8, 60751);לאלהיהן;5;8;ותקראן לעם לזבחי אלהיהן ויאכל העם וישתחוו לאלהיהן
(121849, -83, 4);40;מ;230330;(4, 25, 4, 47, 230330);60773;(4, 25, 4, 14, 60773);השמש;3;14;ויאמר יהוה אל משה קח את כל ראשי העם והוקע אותם ליהוה נגד השמש וישב חרון אף יהוה מישראל
(121849, -83, 4);30;ל;230413;(4, 25, 6, 16, 230413);60793;(4, 25, 6, 4, 60793);ישראל;5;4;והנה איש מבני ישראל בא ויקרב אל אחיו את המדינית לעיני משה ולעיני כל עדת בני ישראל והמה בכים פתח אהל מועד
(121849, -83, 4);200;ר;230496;(4, 25, 7, 16, 230496);60815;(4, 25, 7, 4, 60815);אלעזר;5;4;וירא פינחס בן אלעזר בן אהרן הכהן ויקם מתוך העדה ויקח רמח בידו
(121849, -83, 4);5;ה;230579;(4, 25, 8, 50, 230579);60838;(4, 25, 8, 14, 60838);האשה;4;14;ויבא אחר איש ישראל אל הקבה וידקר את שניהם את איש ישראל ואת האשה אל קבתה ותעצר המגפה מעל בני ישראל
(121849, -83, 4);30;ל;230662;(4, 25, 11, 9, 230662);60859;(4, 25, 11, 3, 60859);אלעזר;2;3;פינחס בן אלעזר בן אהרן הכהן השיב את חמתי מעל בני ישראל בקנאו את קנאתי בתוכם ולא כליתי את בני ישראל בקנאתי
(121849, -83, 4);50;נ;230745;(4, 25, 12, 8, 230745);60881;(4, 25, 12, 3, 60881);הנני;2;3;לכן אמר הנני נתן לו את בריתי שלום
(121849, -83, 4);10;י;230828;(4, 25, 14, 5, 230828);60903;(4, 25, 14, 2, 60903);איש;2;2;ושם איש ישראל המכה אשר הכה את המדינית זמרי בן סלוא נשיא בית אב לשמעני
(121849, -83, 4);6;ו;230911;(4, 25, 15, 33, 230911);60925;(4, 25, 15, 9, 60925);אמות;3;9;ושם האשה המכה המדינית כזבי בת צור ראש אמות בית אב במדין הוא
(121849, -83, 4);20;כ;230994;(4, 25, 18, 28, 230994);60947;(4, 25, 18, 8, 60947);לכם;2;8;כי צררים הם לכם בנכליהם אשר נכלו לכם על דבר פעור ועל דבר כזבי בת נשיא מדין אחתם המכה ביום המגפה על דבר פעור
(121849, -83, 4);5;ה;231077;(4, 26, 1, 14, 231077);60970;(4, 26, 1, 4, 60970);משה;3;4;ויאמר יהוה אל משה ואל אלעזר בן אהרן הכהן לאמר
(121849, -83, 4);10;י;231160;(4, 26, 3, 2, 231160);60994;(4, 26, 3, 1, 60994);וידבר;2;1;וידבר משה ואלעזר הכהן אתם בערבת מואב על ירדן ירחו לאמר
(121849, -83, 4);30;ל;231243;(4, 26, 4, 41, 231243);61015;(4, 26, 4, 11, 61015);ישראל;5;11;מבן עשרים שנה ומעלה כאשר צוה יהוה את משה ובני ישראל היצאים מארץ מצרים
(121849, -83, 4);10;י;231326;(4, 26, 6, 17, 231326);61032;(4, 26, 6, 3, 61032);החצרוני;7;3;לחצרן משפחת החצרוני לכרמי משפחת הכרמי
(121849, -83, 4);6;ו;231409;(4, 26, 9, 1, 231409);61050;(4, 26, 9, 1, 61050);ובני;1;1;ובני אליאב נמואל ודתן ואבירם הוא דתן ואבירם קרואי העדה אשר הצו על משה ועל אהרן בעדת קרח בהצתם על יהוה
(121849, -83, 4);80;פ;231492;(4, 26, 10, 3, 231492);61071;(4, 26, 10, 1, 61071);ותפתח;3;1;ותפתח הארץ את פיה ותבלע אתם ואת קרח במות העדה באכל האש את חמשים ומאתים איש ויהיו לנס
(121849, -83, 4);6;ו;231575;(4, 26, 12, 7, 231575);61094;(4, 26, 12, 2, 61094);שמעון;4;2;בני שמעון למשפחתם לנמואל משפחת הנמואלי לימין משפחת הימיני ליכין משפחת היכיני
(121849, -83, 4);5;ה;231658;(4, 26, 13, 25, 231658);61110;(4, 26, 13, 6, 61110);השאולי;1;6;לזרח משפחת הזרחי לשאול משפחת השאולי
(121849, -83, 4);50;נ;231741;(4, 26, 15, 45, 231741);61127;(4, 26, 15, 10, 61127);לשוני;4;10;בני גד למשפחתם לצפון משפחת הצפוני לחגי משפחת החגי לשוני משפחת השוני
(121849, -83, 4);10;י;231824;(4, 26, 18, 11, 231824);61144;(4, 26, 18, 3, 61144);בני;3;3;אלה משפחת בני גד לפקדיהם ארבעים אלף וחמש מאות
(121849, -83, 4);30;ל;231907;(4, 26, 20, 23, 231907);61164;(4, 26, 20, 5, 61164);לשלה;3;5;ויהיו בני יהודה למשפחתם לשלה משפחת השלני לפרץ משפחת הפרצי לזרח משפחת הזרחי
(121849, -83, 4);1;א;231990;(4, 26, 22, 1, 231990);61182;(4, 26, 22, 1, 61182);אלה;1;1;אלה משפחת יהודה לפקדיהם ששה ושבעים אלף וחמש מאות
(121849, -83, 4);10;י;232073;(4, 26, 23, 44, 232073);61199;(4, 26, 23, 9, 61199);הפוני;5;9;בני יששכר למשפחתם תולע משפחת התולעי לפוה משפחת הפוני
(121849, -83, 4);300;ש;232156;(4, 26, 26, 11, 232156);61217;(4, 26, 26, 3, 61217);למשפחתם;3;3;בני זבולן למשפחתם לסרד משפחת הסרדי לאלון משפחת האלני ליחלאל משפחת היחלאלי
(121849, -83, 4);40;מ;232239;(4, 26, 27, 32, 232239);61233;(4, 26, 27, 7, 61233);וחמש;3;7;אלה משפחת הזבולני לפקדיהם ששים אלף וחמש מאות
(121849, -83, 4);4;ד;232322;(4, 26, 29, 54, 232322);61251;(4, 26, 29, 12, 61251);הגלעדי;5;12;בני מנשה למכיר משפחת המכירי ומכיר הוליד את גלעד לגלעד משפחת הגלעדי
(121849, -83, 4);300;ש;232405;(4, 26, 32, 8, 232405);61268;(4, 26, 32, 2, 61268);משפחת;2;2;ושמידע משפחת השמידעי וחפר משפחת החפרי
(121849, -83, 4);6;ו;232488;(4, 26, 33, 59, 232488);61290;(4, 26, 33, 18, 61290);ותרצה;1;18;וצלפחד בן חפר לא היו לו בנים כי אם בנות ושם בנות צלפחד מחלה ונעה חגלה מלכה ותרצה
(121849, -83, 4);200;ר;232571;(4, 26, 35, 39, 232571);61307;(4, 26, 35, 8, 61307);לבכר;4;8;אלה בני אפרים למשפחתם לשותלח משפחת השתלחי לבכר משפחת הבכרי לתחן משפחת התחני
(121849, -83, 4);40;ם;232654;(4, 26, 37, 33, 232654);61325;(4, 26, 37, 7, 61325);ושלשים;6;7;אלה משפחת בני אפרים לפקדיהם שנים ושלשים אלף וחמש מאות אלה בני יוסף למשפחתם
(121849, -83, 4);8;ח;232737;(4, 26, 38, 55, 232737);61343;(4, 26, 38, 11, 61343);משפחת;4;11;בני בנימן למשפחתם לבלע משפחת הבלעי לאשבל משפחת האשבלי לאחירם משפחת האחירמי
(121849, -83, 4);70;ע;232820;(4, 26, 40, 42, 232820);61360;(4, 26, 40, 10, 61360);הנעמי;3;10;ויהיו בני בלע ארד ונעמן משפחת הארדי לנעמן משפחת הנעמי
(121849, -83, 4);40;מ;232903;(4, 26, 42, 35, 232903);61379;(4, 26, 42, 9, 61379);משפחת;1;9;אלה בני דן למשפחתם לשוחם משפחת השוחמי אלה משפחת דן למשפחתם
(121849, -83, 4);5;ה;232986;(4, 26, 44, 28, 232986);61396;(4, 26, 44, 6, 61396);הימנה;5;6;בני אשר למשפחתם לימנה משפחת הימנה לישוי משפחת הישוי לבריעה משפחת הבריעי
(121849, -83, 4);200;ר;233069;(4, 26, 46, 8, 233069);61413;(4, 26, 46, 3, 61413);אשר;3;3;ושם בת אשר שרח
(121849, -83, 4);50;נ;233152;(4, 26, 48, 37, 233152);61431;(4, 26, 48, 7, 61431);לגוני;4;7;בני נפתלי למשפחתם ליחצאל משפחת היחצאלי לגוני משפחת הגוני
(121849, -83, 4);200;ר;233235;(4, 26, 50, 44, 233235);61448;(4, 26, 50, 9, 61448);וארבע;3;9;אלה משפחת נפתלי למשפחתם ופקדיהם חמשה וארבעים אלף וארבע מאות
(121849, -83, 4);5;ה;233318;(4, 26, 53, 17, 233318);61469;(4, 26, 53, 4, 61469);בנחלה;5;4;לאלה תחלק הארץ בנחלה במספר שמות
(121849, -83, 4);2;ב;233401;(4, 26, 55, 28, 233401);61490;(4, 26, 55, 8, 61490);אבתם;2;8;אך בגורל יחלק את הארץ לשמות מטות אבתם ינחלו
(121849, -83, 4);5;ה;233484;(4, 26, 57, 49, 233484);61509;(4, 26, 57, 10, 61509);הקהתי;3;10;ואלה פקודי הלוי למשפחתם לגרשון משפחת הגרשני לקהת משפחת הקהתי למררי משפחת המררי
(121849, -83, 4);400;ת;233567;(4, 26, 58, 66, 233567);61526;(4, 26, 58, 14, 61526);וקהת;4;14;אלה משפחת לוי משפחת הלבני משפחת החברני משפחת המחלי משפחת המושי משפחת הקרחי וקהת הולד את עמרם
(121849, -83, 4);6;ו;233650;(4, 26, 60, 1, 233650);61550;(4, 26, 60, 1, 61550);ויולד;1;1;ויולד לאהרן את נדב ואת אביהוא את אלעזר ואת איתמר
(121849, -83, 4);40;ם;233733;(4, 26, 62, 11, 233733);61569;(4, 26, 62, 2, 61569);פקדיהם;6;2;ויהיו פקדיהם שלשה ועשרים אלף כל זכר מבן חדש ומעלה כי לא התפקדו בתוך בני ישראל כי לא נתן להם נחלה בתוך בני ישראל
(121849, -83, 4);6;ו;233816;(4, 26, 63, 6, 233816);61593;(4, 26, 63, 2, 61593);פקודי;3;2;אלה פקודי משה ואלעזר הכהן אשר פקדו את בני ישראל בערבת מואב על ירדן ירחו
(121849, -83, 4);1;א;233899;(4, 26, 64, 32, 233899);61615;(4, 26, 64, 9, 61615);אשר;1;9;ובאלה לא היה איש מפקודי משה ואהרן הכהן אשר פקדו את בני ישראל במדבר סיני
(121849, -83, 4);50;ן;233982;(4, 26, 65, 58, 233982);61639;(4, 26, 65, 18, 61639);בן;2;18;כי אמר יהוה להם מות ימתו במדבר ולא נותר מהם איש כי אם כלב בן יפנה ויהושע בן נון
(121849, -83, 4);5;ה;234065;(4, 27, 1, 80, 234065);61661;(4, 27, 1, 21, 61661);וחגלה;5;21;ותקרבנה בנות צלפחד בן חפר בן גלעד בן מכיר בן מנשה למשפחת מנשה בן יוסף ואלה שמות בנתיו מחלה נעה וחגלה ומלכה ותרצה
(121849, -83, 4);6;ו;234148;(4, 27, 3, 13, 234148);61681;(4, 27, 3, 4, 61681);והוא;1;4;אבינו מת במדבר והוא לא היה בתוך העדה הנועדים על יהוה בעדת קרח כי בחטאו מת ובנים לא היו לו
(121849, -83, 4);10;י;234231;(4, 27, 4, 26, 234231);61704;(4, 27, 4, 7, 61704);כי;2;7;למה יגרע שם אבינו מתוך משפחתו כי אין לו בן תנה לנו אחזה בתוך אחי אבינו
(121849, -83, 4);2;ב;234314;(4, 27, 7, 13, 234314);61728;(4, 27, 7, 4, 61728);דברת;2;4;כן בנות צלפחד דברת נתן תתן להם אחזת נחלה בתוך אחי אביהם והעברת את נחלת אביהן להן
(121849, -83, 4);1;א;234397;(4, 27, 8, 32, 234397);61751;(4, 27, 8, 10, 61751);אין;1;10;ואל בני ישראל תדבר לאמר איש כי ימות ובן אין לו והעברתם את נחלתו לבתו
(121849, -83, 4);1;א;234480;(4, 27, 11, 2, 234480);61774;(4, 27, 11, 1, 61774);ואם;2;1;ואם אין אחים לאביו ונתתם את נחלתו לשארו הקרב אליו ממשפחתו וירש אתה והיתה לבני ישראל לחקת משפט כאשר צוה יהוה את משה
(121849, -83, 4);5;ה;234563;(4, 27, 11, 85, 234563);61794;(4, 27, 11, 21, 61794);יהוה;2;21;ואם אין אחים לאביו ונתתם את נחלתו לשארו הקרב אליו ממשפחתו וירש אתה והיתה לבני ישראל לחקת משפט כאשר צוה יהוה את משה
(121849, -83, 4);10;י;234646;(4, 27, 13, 20, 234646);61817;(4, 27, 13, 5, 61817);עמיך;3;5;וראיתה אתה ונאספת אל עמיך גם אתה כאשר נאסף אהרן אחיך
(121849, -83, 4);4;ד;234729;(4, 27, 14, 61, 234729);61838;(4, 27, 14, 15, 61838);מדבר;2;15;כאשר מריתם פי במדבר צן במריבת העדה להקדישני במים לעיניהם הם מי מריבת קדש מדבר צן
(121849, -83, 4);200;ר;234812;(4, 27, 17, 29, 234812);61860;(4, 27, 17, 7, 61860);ואשר;4;7;אשר יצא לפניהם ואשר יבא לפניהם ואשר יוציאם ואשר יביאם ולא תהיה עדת יהוה כצאן אשר אין להם רעה
(121849, -83, 4);6;ו;234895;(4, 27, 18, 38, 234895);61885;(4, 27, 18, 13, 61885);רוח;2;13;ויאמר יהוה אל משה קח לך את יהושע בן נון איש אשר רוח בו וסמכת את ידך עליו
(121849, -83, 4);70;ע;234978;(4, 27, 20, 17, 234978);61905;(4, 27, 20, 4, 61905);למען;3;4;ונתתה מהודך עליו למען ישמעו כל עדת בני ישראל
(121849, -83, 4);6;ו;235061;(4, 27, 21, 64, 235061);61927;(4, 27, 21, 17, 61927);הוא;2;17;ולפני אלעזר הכהן יעמד ושאל לו במשפט האורים לפני יהוה על פיו יצאו ועל פיו יבאו הוא וכל בני ישראל אתו וכל העדה
(121849, -83, 4);70;ע;235144;(4, 27, 22, 61, 235144);61949;(4, 27, 22, 16, 61949);העדה;2;16;ויעש משה כאשר צוה יהוה אתו ויקח את יהושע ויעמדהו לפני אלעזר הכהן ולפני כל העדה
(121849, -83, 4);200;ר;235227;(4, 28, 2, 25, 235227);61972;(4, 28, 2, 8, 61972);קרבני;2;8;צו את בני ישראל ואמרת אלהם את קרבני לחמי לאשי ריח ניחחי תשמרו להקריב לי במועדו
(121849, -83, 4);300;ש;235310;(4, 28, 3, 45, 235310);61992;(4, 28, 3, 12, 61992);שנים;1;12;ואמרת להם זה האשה אשר תקריבו ליהוה כבשים בני שנה תמימם שנים ליום עלה תמיד
(121849, -83, 4);40;מ;235393;(4, 28, 5, 28, 235393);62012;(4, 28, 5, 6, 62012);בשמן;3;6;ועשירית האיפה סלת למנחה בלולה בשמן כתית רביעת ההין
(121849, -83, 4);20;כ;235476;(4, 28, 7, 34, 235476);62033;(4, 28, 7, 9, 62033);שכר;2;9;ונסכו רביעת ההין לכבש האחד בקדש הסך נסך שכר ליהוה
(121849, -83, 4);50;נ;235559;(4, 28, 9, 19, 235559);62053;(4, 28, 9, 5, 62053);בני;2;5;וביום השבת שני כבשים בני שנה תמימם ושני עשרנים סלת מנחה בלולה בשמן ונסכו
(121849, -83, 4);2;ב;235642;(4, 28, 11, 17, 235642);62072;(4, 28, 11, 3, 62072);תקריבו;5;3;ובראשי חדשיכם תקריבו עלה ליהוה פרים בני בקר שנים ואיל אחד כבשים בני שנה שבעה תמימם
(121849, -83, 4);8;ח;235725;(4, 28, 12, 33, 235725);62093;(4, 28, 12, 8, 62093);האחד;3;8;ושלשה עשרנים סלת מנחה בלולה בשמן לפר האחד ושני עשרנים סלת מנחה בלולה בשמן לאיל האחד
(121849, -83, 4);30;ל;235808;(4, 28, 13, 48, 235808);62114;(4, 28, 13, 13, 62114);ליהוה;1;13;ועשרן עשרון סלת מנחה בלולה בשמן לכבש האחד עלה ריח ניחח אשה ליהוה
(121849, -83, 4);10;י;235891;(4, 28, 15, 4, 235891);62133;(4, 28, 15, 1, 62133);ושעיר;4;1;ושעיר עזים אחד לחטאת ליהוה על עלת התמיד יעשה ונסכו
(121849, -83, 4);6;ו;235974;(4, 28, 17, 11, 235974);62153;(4, 28, 17, 3, 62153);יום;2;3;ובחמשה עשר יום לחדש הזה חג שבעת ימים מצות יאכל
(121849, -83, 4);2;ב;236057;(4, 28, 19, 23, 236057);62175;(4, 28, 19, 6, 62175);בני;1;6;והקרבתם אשה עלה ליהוה פרים בני בקר שנים ואיל אחד ושבעה כבשים בני שנה תמימם יהיו לכם
(121849, -83, 4);50;נ;236140;(4, 28, 20, 39, 236140);62195;(4, 28, 20, 9, 62195);עשרנים;4;9;ומנחתם סלת בלולה בשמן שלשה עשרנים לפר ושני עשרנים לאיל תעשו
(121849, -83, 4);5;ה;236223;(4, 28, 23, 19, 236223);62215;(4, 28, 23, 6, 62215);התמיד;1;6;מלבד עלת הבקר אשר לעלת התמיד תעשו את אלה
(121849, -83, 4);40;מ;236306;(4, 28, 25, 12, 236306);62236;(4, 28, 25, 3, 62236);מקרא;1;3;וביום השביעי מקרא קדש יהיה לכם כל מלאכת עבדה לא תעשו
(121849, -83, 4);30;ל;236389;(4, 28, 26, 53, 236389);62255;(4, 28, 26, 11, 62255);לכם;1;11;וביום הבכורים בהקריבכם מנחה חדשה ליהוה בשבעתיכם מקרא קדש יהיה לכם כל מלאכת עבדה לא תעשו
(121849, -83, 4);400;ת;236472;(4, 28, 28, 5, 236472);62276;(4, 28, 28, 1, 62276);ומנחתם;5;1;ומנחתם סלת בלולה בשמן שלשה עשרנים לפר האחד שני עשרנים לאיל האחד
(121849, -83, 4);10;י;236555;(4, 28, 30, 7, 236555);62295;(4, 28, 30, 2, 62295);עזים;3;2;שעיר עזים אחד לכפר עליכם
(121849, -83, 4);10;י;236638;(4, 29, 1, 29, 236638);62314;(4, 29, 1, 7, 62314);יהיה;3;7;ובחדש השביעי באחד לחדש מקרא קדש יהיה לכם כל מלאכת עבדה לא תעשו יום תרועה יהיה לכם
(121849, -83, 4);300;ש;236721;(4, 29, 2, 47, 236721);62338;(4, 29, 2, 14, 62338);שנה;1;14;ועשיתם עלה לריח ניחח ליהוה פר בן בקר אחד איל אחד כבשים בני שנה שבעה תמימם
(121849, -83, 4);40;ם;236804;(4, 29, 4, 28, 236804);62356;(4, 29, 4, 6, 62356);הכבשים;6;6;ועשרון אחד לכבש האחד לשבעת הכבשים
(121849, -83, 4);10;י;236887;(4, 29, 6, 58, 236887);62375;(4, 29, 6, 13, 62375);ליהוה;2;13;מלבד עלת החדש ומנחתה ועלת התמיד ומנחתה ונסכיהם כמשפטם לריח ניחח אשה ליהוה
(121849, -83, 4);50;נ;236970;(4, 29, 8, 19, 236970);62395;(4, 29, 8, 5, 62395);ניחח;1;5;והקרבתם עלה ליהוה ריח ניחח פר בן בקר אחד איל אחד כבשים בני שנה שבעה תמימם יהיו לכם
(121849, -83, 4);200;ר;237053;(4, 29, 9, 37, 237053);62417;(4, 29, 9, 9, 62417);עשרנים;3;9;ומנחתם סלת בלולה בשמן שלשה עשרנים לפר שני עשרנים לאיל האחד
(121849, -83, 4);400;ת;237136;(4, 29, 11, 43, 237136);62435;(4, 29, 11, 10, 62435);ומנחתה;5;10;שעיר עזים אחד חטאת מלבד חטאת הכפרים ועלת התמיד ומנחתה ונסכיהם
(121849, -83, 4);5;ה;237219;(4, 29, 13, 2, 237219);62456;(4, 29, 13, 1, 62456);והקרבתם;2;1;והקרבתם עלה אשה ריח ניחח ליהוה פרים בני בקר שלשה עשר אילם שנים כבשים בני שנה ארבעה עשר תמימם יהיו
(121849, -83, 4);60;ס;237302;(4, 29, 14, 7, 237302);62477;(4, 29, 14, 2, 62477);סלת;1;2;ומנחתם סלת בלולה בשמן שלשה עשרנים לפר האחד לשלשה עשר פרים שני עשרנים לאיל האחד לשני האילם
(121849, -83, 4);1;א;237385;(4, 29, 15, 17, 237385);62496;(4, 29, 15, 4, 62496);האחד;2;4;ועשרון עשרון לכבש האחד לארבעה עשר כבשים
(121849, -83, 4);30;ל;237468;(4, 29, 17, 29, 237468);62516;(4, 29, 17, 8, 62516);אילם;3;8;וביום השני פרים בני בקר שנים עשר אילם שנים כבשים בני שנה ארבעה עשר תמימם
(121849, -83, 4);8;ח;237551;(4, 29, 19, 13, 237551);62534;(4, 29, 19, 4, 62534);חטאת;1;4;ושעיר עזים אחד חטאת מלבד עלת התמיד ומנחתה ונסכיהם
(121849, -83, 4);6;ו;237634;(4, 29, 21, 1, 237634);62553;(4, 29, 21, 1, 62553);ומנחתם;1;1;ומנחתם ונסכיהם לפרים לאילם ולכבשים במספרם כמשפט
(121849, -83, 4);2;ב;237717;(4, 29, 23, 8, 237717);62569;(4, 29, 23, 2, 62569);הרביעי;3;2;וביום הרביעי פרים עשרה אילם שנים כבשים בני שנה ארבעה עשר תמימם
(121849, -83, 4);9;ט;237800;(4, 29, 24, 40, 237800);62586;(4, 29, 24, 7, 62586);כמשפט;5;7;מנחתם ונסכיהם לפרים לאילם ולכבשים במספרם כמשפט
(121849, -83, 4);300;ש;237883;(4, 29, 26, 45, 237883);62606;(4, 29, 26, 11, 62606);עשר;2;11;וביום החמישי פרים תשעה אילם שנים כבשים בני שנה ארבעה עשר תמימם
(121849, -83, 4);6;ו;237966;(4, 29, 29, 1, 237966);62623;(4, 29, 29, 1, 62623);וביום;1;1;וביום הששי פרים שמנה אילם שנים כבשים בני שנה ארבעה עשר תמימם
