(130159, 80, 4);7;ז;75039;(1, 48, 19, 72, 75039);19821;(1, 48, 19, 19, 19821);וזרעו;2;19;וימאן אביו ויאמר ידעתי בני ידעתי גם הוא יהיה לעם וגם הוא יגדל ואולם אחיו הקטן יגדל ממנו וזרעו יהיה מלא הגוים
(130159, 80, 4);10;י;75119;(1, 48, 20, 65, 75119);19839;(1, 48, 20, 15, 19839);אפרים;4;15;ויברכם ביום ההוא לאמור בך יברך ישראל לאמר ישמך אלהים כאפרים וכמנשה וישם את אפרים לפני מנשה
(130159, 80, 4);40;ם;75199;(1, 48, 22, 13, 75199);19860;(1, 48, 22, 4, 19860);שכם;3;4;ואני נתתי לך שכם אחד על אחיך אשר לקחתי מיד האמרי בחרבי ובקשתי
(130159, 80, 4);1;א;75279;(1, 49, 1, 44, 75279);19881;(1, 49, 1, 12, 19881);אתכם;1;12;ויקרא יעקב אל בניו ויאמר האספו ואגידה לכם את אשר יקרא אתכם באחרית הימים
(130159, 80, 4);6;ו;75359;(1, 49, 3, 32, 75359);19900;(1, 49, 3, 9, 19900);ויתר;1;9;ראובן בכרי אתה כחי וראשית אוני יתר שאת ויתר עז
(130159, 80, 4);400;ת;75439;(1, 49, 6, 7, 75439);19922;(1, 49, 6, 3, 19922);תבא;1;3;בסדם אל תבא נפשי בקהלם אל תחד כבדי כי באפם הרגו איש וברצנם עקרו שור
(130159, 80, 4);6;ו;75519;(1, 49, 7, 34, 75519);19944;(1, 49, 7, 10, 19944);ואפיצם;1;10;ארור אפם כי עז ועברתם כי קשתה אחלקם ביעקב ואפיצם בישראל
(130159, 80, 4);200;ר;75599;(1, 49, 9, 25, 75599);19963;(1, 49, 9, 7, 19963);כרע;2;7;גור אריה יהודה מטרף בני עלית כרע רבץ כאריה וכלביא מי יקימנו
(130159, 80, 4);3;ג;75679;(1, 49, 11, 6, 75679);19984;(1, 49, 11, 2, 19984);לגפן;2;2;אסרי לגפן עירה ולשרקה בני אתנו כבס ביין לבשו ובדם ענבים סותה
(130159, 80, 4);10;י;75759;(1, 49, 13, 10, 75759);20003;(1, 49, 13, 3, 20003);ימים;1;3;זבולן לחוף ימים ישכן והוא לחוף אנית וירכתו על צידן
(130159, 80, 4);40;מ;75839;(1, 49, 15, 25, 75839);20024;(1, 49, 15, 8, 20024);נעמה;3;8;וירא מנחה כי טוב ואת הארץ כי נעמה ויט שכמו לסבל ויהי למס עבד
(130159, 80, 4);60;ס;75919;(1, 49, 17, 36, 75919);20047;(1, 49, 17, 11, 20047);סוס;3;11;יהי דן נחש עלי דרך שפיפן עלי ארח הנשך עקבי סוס ויפל רכבו אחור
(130159, 80, 4);400;ת;75999;(1, 49, 21, 3, 75999);20067;(1, 49, 21, 1, 20067);נפתלי;3;1;נפתלי אילה שלחה הנתן אמרי שפר
(130159, 80, 4);10;י;76079;(1, 49, 23, 25, 76079);20088;(1, 49, 23, 5, 20088);חצים;3;5;וימררהו ורבו וישטמהו בעלי חצים
(130159, 80, 4);200;ר;76159;(1, 49, 25, 27, 76159);20108;(1, 49, 25, 7, 20108);ברכת;2;7;מאל אביך ויעזרך ואת שדי ויברכך ברכת שמים מעל ברכת תהום רבצת תחת ברכת שדים ורחם
(130159, 80, 4);1;א;76239;(1, 49, 26, 44, 76239);20129;(1, 49, 26, 12, 20129);לראש;3;12;ברכת אביך גברו על ברכת הורי עד תאות גבעת עולם תהיין לראש יוסף ולקדקד נזיר אחיו
(130159, 80, 4);1;א;76319;(1, 49, 28, 26, 76319);20150;(1, 49, 28, 8, 20150);אשר;1;8;כל אלה שבטי ישראל שנים עשר וזאת אשר דבר להם אביהם ויברך אותם איש אשר כברכתו ברך אתם
(130159, 80, 4);2;ב;76399;(1, 49, 29, 40, 76399);20172;(1, 49, 29, 12, 20172);אבתי;2;12;ויצו אותם ויאמר אלהם אני נאסף אל עמי קברו אתי אל אבתי אל המערה אשר בשדה עפרון החתי
(130159, 80, 4);5;ה;76479;(1, 49, 30, 55, 76479);20193;(1, 49, 30, 15, 20193);השדה;4;15;במערה אשר בשדה המכפלה אשר על פני ממרא בארץ כנען אשר קנה אברהם את השדה מאת עפרן החתי לאחזת קבר
(130159, 80, 4);1;א;76559;(1, 49, 31, 61, 76559);20216;(1, 49, 31, 18, 20216);לאה;2;18;שמה קברו את אברהם ואת שרה אשתו שמה קברו את יצחק ואת רבקה אשתו ושמה קברתי את לאה
(130159, 80, 4);10;י;76639;(1, 50, 1, 2, 76639);20238;(1, 50, 1, 1, 20238);ויפל;2;1;ויפל יוסף על פני אביו ויבך עליו וישק לו
(130159, 80, 4);1;א;76719;(1, 50, 2, 51, 76719);20259;(1, 50, 2, 13, 20259);ישראל;4;13;ויצו יוסף את עבדיו את הרפאים לחנט את אביו ויחנטו הרפאים את ישראל
(130159, 80, 4);80;ף;76799;(1, 50, 4, 23, 76799);20278;(1, 50, 4, 5, 20278);יוסף;4;5;ויעברו ימי בכיתו וידבר יוסף אל בית פרעה לאמר אם נא מצאתי חן בעיניכם דברו נא באזני פרעה לאמר
(130159, 80, 4);300;ש;76879;(1, 50, 5, 30, 76879);20300;(1, 50, 5, 8, 20300);אשר;2;8;אבי השביעני לאמר הנה אנכי מת בקברי אשר כריתי לי בארץ כנען שמה תקברני ועתה אעלה נא ואקברה את אבי ואשובה
(130159, 80, 4);300;ש;76959;(1, 50, 6, 28, 76959);20321;(1, 50, 6, 8, 20321);השביעך;2;8;ויאמר פרעה עלה וקבר את אביך כאשר השביעך
(130159, 80, 4);2;ב;77039;(1, 50, 8, 17, 77039);20342;(1, 50, 8, 5, 20342);ובית;2;5;וכל בית יוסף ואחיו ובית אביו רק טפם וצאנם ובקרם עזבו בארץ גשן
(130159, 80, 4);4;ד;77119;(1, 50, 10, 14, 77119);20364;(1, 50, 10, 4, 20364);האטד;4;4;ויבאו עד גרן האטד אשר בעבר הירדן ויספדו שם מספד גדול וכבד מאד ויעש לאביו אבל שבעת ימים
(130159, 80, 4);2;ב;77199;(1, 50, 11, 25, 77199);20385;(1, 50, 11, 7, 20385);בגרן;1;7;וירא יושב הארץ הכנעני את האבל בגרן האטד ויאמרו אבל כבד זה למצרים על כן קרא שמה אבל מצרים אשר בעבר הירדן
(130159, 80, 4);300;ש;77279;(1, 50, 13, 3, 77279);20407;(1, 50, 13, 1, 20407);וישאו;3;1;וישאו אתו בניו ארצה כנען ויקברו אתו במערת שדה המכפלה אשר קנה אברהם את השדה לאחזת קבר מאת עפרן החתי על פני ממרא
(130159, 80, 4);50;נ;77359;(1, 50, 13, 83, 77359);20428;(1, 50, 13, 22, 20428);פני;2;22;וישאו אתו בניו ארצה כנען ויקברו אתו במערת שדה המכפלה אשר קנה אברהם את השדה לאחזת קבר מאת עפרן החתי על פני ממרא
(130159, 80, 4);2;ב;77439;(1, 50, 15, 18, 77439);20450;(1, 50, 15, 6, 20450);אביהם;2;6;ויראו אחי יוסף כי מת אביהם ויאמרו לו ישטמנו יוסף והשב ישיב לנו את כל הרעה אשר גמלנו אתו
(130159, 80, 4);400;ת;77519;(1, 50, 16, 29, 77519);20471;(1, 50, 16, 8, 20471);מותו;3;8;ויצוו אל יוסף לאמר אביך צוה לפני מותו לאמר
(130159, 80, 4);2;ב;77599;(1, 50, 17, 75, 77599);20494;(1, 50, 17, 22, 20494);בדברם;1;22;כה תאמרו ליוסף אנא שא נא פשע אחיך וחטאתם כי רעה גמלוך ועתה שא נא לפשע עבדי אלהי אביך ויבך יוסף בדברם אליו
(130159, 80, 4);50;נ;77679;(1, 50, 19, 33, 77679);20513;(1, 50, 19, 9, 20513);אני;2;9;ויאמר אלהם יוסף אל תיראו כי התחת אלהים אני
(130159, 80, 4);9;ט;77759;(1, 50, 21, 28, 77759);20535;(1, 50, 21, 8, 20535);טפכם;1;8;ועתה אל תיראו אנכי אכלכל אתכם ואת טפכם וינחם אותם וידבר על לבם
(130159, 80, 4);40;ם;77839;(1, 50, 23, 14, 77839);20554;(1, 50, 23, 3, 20554);לאפרים;6;3;וירא יוסף לאפרים בני שלשים גם בני מכיר בן מנשה ילדו על ברכי יוסף
(130159, 80, 4);5;ה;77919;(1, 50, 24, 43, 77919);20576;(1, 50, 24, 11, 20576);והעלה;5;11;ויאמר יוסף אל אחיו אנכי מת ואלהים פקד יפקד אתכם והעלה אתכם מן הארץ הזאת אל הארץ אשר נשבע לאברהם ליצחק וליעקב
(130159, 80, 4);1;א;77999;(1, 50, 25, 36, 77999);20597;(1, 50, 25, 10, 20597);אתכם;1;10;וישבע יוסף את בני ישראל לאמר פקד יפקד אלהים אתכם והעלתם את עצמתי מזה
(130159, 80, 4);1;א;78079;(2, 1, 1, 15, 78079);20616;(2, 1, 1, 4, 20616);ישראל;4;4;ואלה שמות בני ישראל הבאים מצרימה את יעקב איש וביתו באו
(130159, 80, 4);10;י;78159;(2, 1, 5, 2, 78159);20635;(2, 1, 5, 1, 20635);ויהי;2;1;ויהי כל נפש יצאי ירך יעקב שבעים נפש ויוסף היה במצרים
(130159, 80, 4);10;י;78239;(2, 1, 7, 14, 78239);20656;(2, 1, 7, 4, 20656);וישרצו;2;4;ובני ישראל פרו וישרצו וירבו ויעצמו במאד מאד ותמלא הארץ אתם
(130159, 80, 4);40;ם;78319;(2, 1, 9, 15, 78319);20678;(2, 1, 9, 5, 20678);עם;2;5;ויאמר אל עמו הנה עם בני ישראל רב ועצום ממנו
(130159, 80, 4);6;ו;78399;(2, 1, 10, 61, 78399);20700;(2, 1, 10, 17, 20700);ועלה;1;17;הבה נתחכמה לו פן ירבה והיה כי תקראנה מלחמה ונוסף גם הוא על שנאינו ונלחם בנו ועלה מן הארץ
(130159, 80, 4);6;ו;78479;(2, 1, 12, 9, 78479);20719;(2, 1, 12, 2, 20719);יענו;4;2;וכאשר יענו אתו כן ירבה וכן יפרץ ויקצו מפני בני ישראל
(130159, 80, 4);2;ב;78559;(2, 1, 14, 22, 78559);20740;(2, 1, 14, 6, 20740);בחמר;1;6;וימררו את חייהם בעבדה קשה בחמר ובלבנים ובכל עבדה בשדה את כל עבדתם אשר עבדו בהם בפרך
(130159, 80, 4);300;ש;78639;(2, 1, 15, 35, 78639);20760;(2, 1, 15, 9, 20760);שפרה;1;9;ויאמר מלך מצרים למילדת העברית אשר שם האחת שפרה ושם השנית פועה
(130159, 80, 4);200;ר;78719;(2, 1, 17, 4, 78719);20780;(2, 1, 17, 1, 20780);ותיראן;4;1;ותיראן המילדת את האלהים ולא עשו כאשר דבר אליהן מלך מצרים ותחיין את הילדים
(130159, 80, 4);200;ר;78799;(2, 1, 18, 24, 78799);20798;(2, 1, 18, 5, 20798);ויאמר;5;5;ויקרא מלך מצרים למילדת ויאמר להן מדוע עשיתן הדבר הזה ותחיין את הילדים
(130159, 80, 4);50;נ;78879;(2, 1, 19, 47, 78879);20818;(2, 1, 19, 12, 20818);הנה;2;12;ותאמרן המילדת אל פרעה כי לא כנשים המצרית העברית כי חיות הנה בטרם תבוא אלהן המילדת וילדו
(130159, 80, 4);40;ם;78959;(2, 1, 21, 24, 78959);20836;(2, 1, 21, 6, 20836);האלהים;6;6;ויהי כי יראו המילדת את האלהים ויעש להם בתים
(130159, 80, 4);8;ח;79039;(2, 2, 1, 18, 79039);20857;(2, 2, 1, 5, 20857);ויקח;4;5;וילך איש מבית לוי ויקח את בת לוי
(130159, 80, 4);1;א;79119;(2, 2, 3, 28, 79119);20880;(2, 2, 3, 8, 20880);גמא;3;8;ולא יכלה עוד הצפינו ותקח לו תבת גמא ותחמרה בחמר ובזפת ותשם בה את הילד ותשם בסוף על שפת היאר
(130159, 80, 4);30;ל;79199;(2, 2, 5, 11, 79199);20903;(2, 2, 5, 4, 20903);לרחץ;1;4;ותרד בת פרעה לרחץ על היאר ונערתיה הלכת על יד היאר ותרא את התבה בתוך הסוף ותשלח את אמתה ותקחה
(130159, 80, 4);6;ו;79279;(2, 2, 6, 18, 79279);20924;(2, 2, 6, 5, 20924);והנה;1;5;ותפתח ותראהו את הילד והנה נער בכה ותחמל עליו ותאמר מילדי העברים זה
(130159, 80, 4);10;י;79359;(2, 2, 7, 44, 79359);20944;(2, 2, 7, 12, 20944);העברית;5;12;ותאמר אחתו אל בת פרעה האלך וקראתי לך אשה מינקת מן העברית ותינק לך את הילד
(130159, 80, 4);5;ה;79439;(2, 2, 9, 28, 79439);20967;(2, 2, 9, 8, 20967);הזה;3;8;ותאמר לה בת פרעה היליכי את הילד הזה והינקהו לי ואני אתן את שכרך ותקח האשה הילד ותניקהו
(130159, 80, 4);6;ו;79519;(2, 2, 10, 39, 79519);20987;(2, 2, 10, 10, 20987);שמו;3;10;ויגדל הילד ותבאהו לבת פרעה ויהי לה לבן ותקרא שמו משה ותאמר כי מן המים משיתהו
(130159, 80, 4);70;ע;79599;(2, 2, 11, 58, 79599);21009;(2, 2, 11, 16, 21009);עברי;1;16;ויהי בימים ההם ויגדל משה ויצא אל אחיו וירא בסבלתם וירא איש מצרי מכה איש עברי מאחיו
(130159, 80, 4);50;נ;79679;(2, 2, 13, 30, 79679);21030;(2, 2, 13, 8, 21030);נצים;1;8;ויצא ביום השני והנה שני אנשים עברים נצים ויאמר לרשע למה תכה רעך
(130159, 80, 4);40;מ;79759;(2, 2, 14, 59, 79759);21051;(2, 2, 14, 16, 21051);משה;1;16;ויאמר מי שמך לאיש שר ושפט עלינו הלהרגני אתה אמר כאשר הרגת את המצרי ויירא משה ויאמר אכן נודע הדבר
(130159, 80, 4);10;י;79839;(2, 2, 15, 62, 79839);21072;(2, 2, 15, 17, 21072);וישב;2;17;וישמע פרעה את הדבר הזה ויבקש להרג את משה ויברח משה מפני פרעה וישב בארץ מדין וישב על הבאר
(130159, 80, 4);300;ש;79919;(2, 2, 17, 15, 79919);21089;(2, 2, 17, 3, 21089);ויגרשום;5;3;ויבאו הרעים ויגרשום ויקם משה ויושען וישק את צאנם
(130159, 80, 4);30;ל;79999;(2, 2, 19, 17, 79999);21108;(2, 2, 19, 4, 21108);הצילנו;4;4;ותאמרן איש מצרי הצילנו מיד הרעים וגם דלה דלה לנו וישק את הצאן
(130159, 80, 4);10;י;80079;(2, 2, 21, 2, 80079);21131;(2, 2, 21, 1, 21131);ויואל;2;1;ויואל משה לשבת את האיש ויתן את צפרה בתו למשה
(130159, 80, 4);10;י;80159;(2, 2, 23, 6, 80159);21154;(2, 2, 23, 2, 21154);בימים;2;2;ויהי בימים הרבים ההם וימת מלך מצרים ויאנחו בני ישראל מן העבדה ויזעקו ותעל שועתם אל האלהים מן העבדה
(130159, 80, 4);1;א;80239;(2, 2, 24, 6, 80239);21173;(2, 2, 24, 2, 21173);אלהים;1;2;וישמע אלהים את נאקתם ויזכר אלהים את בריתו את אברהם את יצחק ואת יעקב
(130159, 80, 4);5;ה;80319;(2, 3, 1, 4, 80319);21193;(2, 3, 1, 1, 21193);ומשה;4;1;ומשה היה רעה את צאן יתרו חתנו כהן מדין וינהג את הצאן אחר המדבר ויבא אל הר האלהים חרבה
(130159, 80, 4);2;ב;80399;(2, 3, 2, 17, 80399);21216;(2, 3, 2, 5, 21216);בלבת;1;5;וירא מלאך יהוה אליו בלבת אש מתוך הסנה וירא והנה הסנה בער באש והסנה איננו אכל
(130159, 80, 4);6;ו;80479;(2, 3, 3, 36, 80479);21237;(2, 3, 3, 10, 21237);מדוע;3;10;ויאמר משה אסרה נא ואראה את המראה הגדל הזה מדוע לא יבער הסנה
(130159, 80, 4);200;ר;80559;(2, 3, 5, 10, 80559);21258;(2, 3, 5, 3, 21258);תקרב;3;3;ויאמר אל תקרב הלם של נעליך מעל רגליך כי המקום אשר אתה עומד עליו אדמת קדש הוא
(130159, 80, 4);10;י;80639;(2, 3, 6, 30, 80639);21279;(2, 3, 6, 7, 21279);אלהי;4;7;ויאמר אנכי אלהי אביך אלהי אברהם אלהי יצחק ואלהי יעקב ויסתר משה פניו כי ירא מהביט אל האלהים
(130159, 80, 4);400;ת;80719;(2, 3, 7, 37, 80719);21300;(2, 3, 7, 10, 21300);ואת;3;10;ויאמר יהוה ראה ראיתי את עני עמי אשר במצרים ואת צעקתם שמעתי מפני נגשיו כי ידעתי את מכאביו
(130159, 80, 4);200;ר;80799;(2, 3, 8, 46, 80799);21320;(2, 3, 8, 12, 21320);ורחבה;2;12;וארד להצילו מיד מצרים ולהעלתו מן הארץ ההוא אל ארץ טובה ורחבה אל ארץ זבת חלב ודבש אל מקום הכנעני והחתי והאמרי והפרזי והחוי והיבוסי
(130159, 80, 4);1;א;80879;(2, 3, 9, 21, 80879);21339;(2, 3, 9, 6, 21339);באה;2;6;ועתה הנה צעקת בני ישראל באה אלי וגם ראיתי את הלחץ אשר מצרים לחצים אתם
(130159, 80, 4);1;א;80959;(2, 3, 11, 3, 80959);21360;(2, 3, 11, 1, 21360);ויאמר;3;1;ויאמר משה אל האלהים מי אנכי כי אלך אל פרעה וכי אוציא את בני ישראל ממצרים
(130159, 80, 4);1;א;81039;(2, 3, 12, 26, 81039);21384;(2, 3, 12, 9, 21384);אנכי;1;9;ויאמר כי אהיה עמך וזה לך האות כי אנכי שלחתיך בהוציאך את העם ממצרים תעבדון את האלהים על ההר הזה
(130159, 80, 4);10;י;81119;(2, 3, 13, 31, 81119);21405;(2, 3, 13, 10, 21405);ישראל;1;10;ויאמר משה אל האלהים הנה אנכי בא אל בני ישראל ואמרתי להם אלהי אבותיכם שלחני אליכם ואמרו לי מה שמו מה אמר אלהם
(130159, 80, 4);10;י;81199;(2, 3, 14, 25, 81199);21425;(2, 3, 14, 7, 21425);אהיה;3;7;ויאמר אלהים אל משה אהיה אשר אהיה ויאמר כה תאמר לבני ישראל אהיה שלחני אליכם
(130159, 80, 4);400;ת;81279;(2, 3, 15, 45, 81279);21446;(2, 3, 15, 13, 21446);אבתיכם;3;13;ויאמר עוד אלהים אל משה כה תאמר אל בני ישראל יהוה אלהי אבתיכם אלהי אברהם אלהי יצחק ואלהי יעקב שלחני אליכם זה שמי לעלם וזה זכרי לדר דר
(130159, 80, 4);1;א;81359;(2, 3, 16, 20, 81359);21467;(2, 3, 16, 6, 21467);ואמרת;2;6;לך ואספת את זקני ישראל ואמרת אלהם יהוה אלהי אבתיכם נראה אלי אלהי אברהם יצחק ויעקב לאמר פקד פקדתי אתכם ואת העשוי לכם במצרים
(130159, 80, 4);6;ו;81439;(2, 3, 17, 1, 81439);21486;(2, 3, 17, 1, 21486);ואמר;1;1;ואמר אעלה אתכם מעני מצרים אל ארץ הכנעני והחתי והאמרי והפרזי והחוי והיבוסי אל ארץ זבת חלב ודבש
(130159, 80, 4);6;ו;81519;(2, 3, 18, 5, 81519);21504;(2, 3, 18, 1, 21504);ושמעו;5;1;ושמעו לקלך ובאת אתה וזקני ישראל אל מלך מצרים ואמרתם אליו יהוה אלהי העבריים נקרה עלינו ועתה נלכה נא דרך שלשת ימים במדבר ונזבחה ליהוה אלהינו
(130159, 80, 4);30;ל;81599;(2, 3, 18, 85, 81599);21524;(2, 3, 18, 21, 21524);שלשת;2;21;ושמעו לקלך ובאת אתה וזקני ישראל אל מלך מצרים ואמרתם אליו יהוה אלהי העבריים נקרה עלינו ועתה נלכה נא דרך שלשת ימים במדבר ונזבחה ליהוה אלהינו
(130159, 80, 4);4;ד;81679;(2, 3, 20, 10, 81679);21544;(2, 3, 20, 3, 21544);ידי;2;3;ושלחתי את ידי והכיתי את מצרים בכל נפלאתי אשר אעשה בקרבו ואחרי כן ישלח אתכם
(130159, 80, 4);20;כ;81759;(2, 3, 21, 30, 81759);21565;(2, 3, 21, 9, 21565);כי;1;9;ונתתי את חן העם הזה בעיני מצרים והיה כי תלכון לא תלכו ריקם
(130159, 80, 4);50;נ;81839;(2, 3, 22, 64, 81839);21585;(2, 3, 22, 16, 21585);ונצלתם;2;16;ושאלה אשה משכנתה ומגרת ביתה כלי כסף וכלי זהב ושמלת ושמתם על בניכם ועל בנתיכם ונצלתם את מצרים
(130159, 80, 4);5;ה;81919;(2, 4, 2, 11, 81919);21606;(2, 4, 2, 3, 21606);יהוה;2;3;ויאמר אליו יהוה מזה בידך ויאמר מטה
(130159, 80, 4);30;ל;81999;(2, 4, 4, 16, 81999);21625;(2, 4, 4, 5, 21625);שלח;2;5;ויאמר יהוה אל משה שלח ידך ואחז בזנבו וישלח ידו ויחזק בו ויהי למטה בכפו
(130159, 80, 4);5;ה;82079;(2, 4, 5, 40, 82079);21645;(2, 4, 5, 10, 21645);אברהם;4;10;למען יאמינו כי נראה אליך יהוה אלהי אבתם אלהי אברהם אלהי יצחק ואלהי יעקב
(130159, 80, 4);6;ו;82159;(2, 4, 7, 1, 82159);21666;(2, 4, 7, 1, 21666);ויאמר;1;1;ויאמר השב ידך אל חיקך וישב ידו אל חיקו ויוצאה מחיקו והנה שבה כבשרו
(130159, 80, 4);5;ה;82239;(2, 4, 8, 28, 82239);21688;(2, 4, 8, 9, 21688);האת;1;9;והיה אם לא יאמינו לך ולא ישמעו לקל האת הראשון והאמינו לקל האת האחרון
(130159, 80, 4);5;ה;82319;(2, 4, 9, 53, 82319);21707;(2, 4, 9, 14, 21707);היאר;1;14;והיה אם לא יאמינו גם לשני האתות האלה ולא ישמעון לקלך ולקחת ממימי היאר ושפכת היבשה והיו המים אשר תקח מן היאר והיו לדם ביבשת
(130159, 80, 4);3;ג;82399;(2, 4, 10, 35, 82399);21729;(2, 4, 10, 11, 21729);גם;1;11;ויאמר משה אל יהוה בי אדני לא איש דברים אנכי גם מתמול גם משלשם גם מאז דברך אל עבדך כי כבד פה וכבד לשון אנכי
(130159, 80, 4);30;ל;82479;(2, 4, 11, 33, 82479);21754;(2, 4, 11, 11, 21754);אלם;2;11;ויאמר יהוה אליו מי שם פה לאדם או מי ישום אלם או חרש או פקח או עור הלא אנכי יהוה
(130159, 80, 4);10;י;82559;(2, 4, 13, 18, 82559);21778;(2, 4, 13, 6, 21778);ביד;2;6;ויאמר בי אדני שלח נא ביד תשלח
(130159, 80, 4);300;ש;82639;(2, 4, 14, 75, 82639);21800;(2, 4, 14, 21, 21800);ושמח;2;21;ויחר אף יהוה במשה ויאמר הלא אהרן אחיך הלוי ידעתי כי דבר ידבר הוא וגם הנה הוא יצא לקראתך וראך ושמח בלבו
(130159, 80, 4);1;א;82719;(2, 4, 16, 7, 82719);21820;(2, 4, 16, 2, 21820);הוא;3;2;ודבר הוא לך אל העם והיה הוא יהיה לך לפה ואתה תהיה לו לאלהים
(130159, 80, 4);10;י;82799;(2, 4, 18, 9, 82799);21845;(2, 4, 18, 3, 21845);וישב;2;3;וילך משה וישב אל יתר חתנו ויאמר לו אלכה נא ואשובה אל אחי אשר במצרים ואראה העודם חיים ויאמר יתרו למשה לך לשלום
(130159, 80, 4);10;י;82879;(2, 4, 19, 2, 82879);21866;(2, 4, 19, 1, 21866);ויאמר;2;1;ויאמר יהוה אל משה במדין לך שב מצרים כי מתו כל האנשים המבקשים את נפשך
(130159, 80, 4);30;ל;82959;(2, 4, 20, 28, 82959);21888;(2, 4, 20, 8, 21888);על;2;8;ויקח משה את אשתו ואת בניו וירכבם על החמר וישב ארצה מצרים ויקח משה את מטה האלהים בידו
(130159, 80, 4);1;א;83039;(2, 4, 21, 41, 83039);21909;(2, 4, 21, 11, 21909);אשר;1;11;ויאמר יהוה אל משה בלכתך לשוב מצרימה ראה כל המפתים אשר שמתי בידך ועשיתם לפני פרעה ואני אחזק את לבו ולא ישלח את העם
(130159, 80, 4);1;א;83119;(2, 4, 22, 31, 83119);21931;(2, 4, 22, 9, 21931);ישראל;4;9;ואמרת אל פרעה כה אמר יהוה בני בכרי ישראל
(130159, 80, 4);2;ב;83199;(2, 4, 24, 27, 83199);21951;(2, 4, 24, 6, 21951);ויבקש;3;6;ויהי בדרך במלון ויפגשהו יהוה ויבקש המיתו
(130159, 80, 4);10;י;83279;(2, 4, 26, 20, 83279);21973;(2, 4, 26, 6, 21973);דמים;3;6;וירף ממנו אז אמרה חתן דמים למולת
(130159, 80, 4);4;ד;83359;(2, 4, 28, 17, 83359);21994;(2, 4, 28, 6, 21994);דברי;1;6;ויגד משה לאהרן את כל דברי יהוה אשר שלחו ואת כל האתת אשר צוהו
(130159, 80, 4);2;ב;83439;(2, 4, 30, 16, 83439);22016;(2, 4, 30, 5, 22016);הדברים;3;5;וידבר אהרן את כל הדברים אשר דבר יהוה אל משה ויעש האתת לעיני העם
(130159, 80, 4);6;ו;83519;(2, 4, 31, 46, 83519);22039;(2, 4, 31, 14, 22039);ויקדו;1;14;ויאמן העם וישמעו כי פקד יהוה את בני ישראל וכי ראה את ענים ויקדו וישתחוו
(130159, 80, 4);40;מ;83599;(2, 5, 2, 4, 83599);22059;(2, 5, 2, 1, 22059);ויאמר;4;1;ויאמר פרעה מי יהוה אשר אשמע בקלו לשלח את ישראל לא ידעתי את יהוה וגם את ישראל לא אשלח
(130159, 80, 4);100;ק;83679;(2, 5, 3, 18, 83679);22081;(2, 5, 3, 4, 22081);נקרא;2;4;ויאמרו אלהי העברים נקרא עלינו נלכה נא דרך שלשת ימים במדבר ונזבחה ליהוה אלהינו פן יפגענו בדבר או בחרב
(130159, 80, 4);10;י;83759;(2, 5, 4, 16, 83759);22100;(2, 5, 4, 4, 22100);מצרים;4;4;ויאמר אלהם מלך מצרים למה משה ואהרן תפריעו את העם ממעשיו לכו לסבלתיכם
(130159, 80, 4);6;ו;83839;(2, 5, 6, 1, 83839);22120;(2, 5, 6, 1, 22120);ויצו;1;1;ויצו פרעה ביום ההוא את הנגשים בעם ואת שטריו לאמר
(130159, 80, 4);6;ו;83919;(2, 5, 7, 42, 83919);22140;(2, 5, 7, 11, 22140);ילכו;4;11;לא תאספון לתת תבן לעם ללבן הלבנים כתמול שלשם הם ילכו וקששו להם תבן
(130159, 80, 4);70;ע;83999;(2, 5, 8, 69, 83999);22163;(2, 5, 8, 20, 22163);צעקים;2;20;ואת מתכנת הלבנים אשר הם עשים תמול שלשם תשימו עליהם לא תגרעו ממנו כי נרפים הם על כן הם צעקים לאמר נלכה נזבחה לאלהינו
(130159, 80, 4);6;ו;84079;(2, 5, 10, 18, 84079);22181;(2, 5, 10, 4, 22181);ושטריו;6;4;ויצאו נגשי העם ושטריו ויאמרו אל העם לאמר כה אמר פרעה אינני נתן לכם תבן
