(200012, -79, 4);200;ר;74323;(1, 48, 8, 7, 74323);19632;(1, 48, 8, 2, 19632);ישראל;3;2;וירא ישראל את בני יוסף ויאמר מי אלה
(200012, -79, 4);10;י;74402;(1, 48, 10, 3, 74402);19655;(1, 48, 10, 1, 19655);ועיני;3;1;ועיני ישראל כבדו מזקן לא יוכל לראות ויגש אתם אליו וישק להם ויחבק להם
(200012, -79, 4);30;ל;74481;(1, 48, 11, 27, 74481);19676;(1, 48, 11, 8, 19676);פללתי;2;8;ויאמר ישראל אל יוסף ראה פניך לא פללתי והנה הראה אתי אלהים גם את זרעך
(200012, -79, 4);400;ת;74560;(1, 48, 13, 17, 74560);19696;(1, 48, 13, 5, 19696);את;2;5;ויקח יוסף את שניהם את אפרים בימינו משמאל ישראל ואת מנשה בשמאלו מימין ישראל ויגש אליו
(200012, -79, 4);1;א;74639;(1, 48, 14, 27, 74639);19715;(1, 48, 14, 8, 19715);אפרים;1;8;וישלח ישראל את ימינו וישת על ראש אפרים והוא הצעיר ואת שמאלו על ראש מנשה שכל את ידיו כי מנשה הבכור
(200012, -79, 4);30;ל;74718;(1, 48, 15, 29, 74718);19735;(1, 48, 15, 7, 19735);התהלכו;4;7;ויברך את יוסף ויאמר האלהים אשר התהלכו אבתי לפניו אברהם ויצחק האלהים הרעה אתי מעודי עד היום הזה
(200012, -79, 4);10;י;74797;(1, 48, 16, 31, 74797);19755;(1, 48, 16, 9, 19755);ויקרא;2;9;המלאך הגאל אתי מכל רע יברך את הנערים ויקרא בהם שמי ושם אבתי אברהם ויצחק וידגו לרב בקרב הארץ
(200012, -79, 4);10;י;74876;(1, 48, 17, 37, 74876);19776;(1, 48, 17, 11, 19776);וירע;2;11;וירא יוסף כי ישית אביו יד ימינו על ראש אפרים וירע בעיניו ויתמך יד אביו להסיר אתה מעל ראש אפרים על ראש מנשה
(200012, -79, 4);10;י;74955;(1, 48, 18, 32, 74955);19799;(1, 48, 18, 11, 19799);שים;2;11;ויאמר יוסף אל אביו לא כן אבי כי זה הבכר שים ימינך על ראשו
(200012, -79, 4);40;מ;75034;(1, 48, 19, 67, 75034);19820;(1, 48, 19, 18, 19820);ממנו;1;18;וימאן אביו ויאמר ידעתי בני ידעתי גם הוא יהיה לעם וגם הוא יגדל ואולם אחיו הקטן יגדל ממנו וזרעו יהיה מלא הגוים
(200012, -79, 4);40;ם;75113;(1, 48, 20, 59, 75113);19837;(1, 48, 20, 13, 19837);וישם;4;13;ויברכם ביום ההוא לאמור בך יברך ישראל לאמר ישמך אלהים כאפרים וכמנשה וישם את אפרים לפני מנשה
(200012, -79, 4);400;ת;75192;(1, 48, 22, 6, 75192);19858;(1, 48, 22, 2, 19858);נתתי;2;2;ואני נתתי לך שכם אחד על אחיך אשר לקחתי מיד האמרי בחרבי ובקשתי
(200012, -79, 4);400;ת;75271;(1, 49, 1, 36, 75271);19878;(1, 49, 1, 9, 19878);את;2;9;ויקרא יעקב אל בניו ויאמר האספו ואגידה לכם את אשר יקרא אתכם באחרית הימים
(200012, -79, 4);6;ו;75350;(1, 49, 3, 23, 75350);19897;(1, 49, 3, 6, 19897);אוני;2;6;ראובן בכרי אתה כחי וראשית אוני יתר שאת ויתר עז
(200012, -79, 4);400;ת;75429;(1, 49, 5, 23, 75429);19919;(1, 49, 5, 6, 19919);מכרתיהם;4;6;שמעון ולוי אחים כלי חמס מכרתיהם
(200012, -79, 4);5;ה;75508;(1, 49, 7, 23, 75508);19941;(1, 49, 7, 7, 19941);קשתה;4;7;ארור אפם כי עז ועברתם כי קשתה אחלקם ביעקב ואפיצם בישראל
(200012, -79, 4);40;מ;75587;(1, 49, 9, 13, 75587);19960;(1, 49, 9, 4, 19960);מטרף;1;4;גור אריה יהודה מטרף בני עלית כרע רבץ כאריה וכלביא מי יקימנו
(200012, -79, 4);10;י;75666;(1, 49, 10, 44, 75666);19981;(1, 49, 10, 13, 19981);יקהת;1;13;לא יסור שבט מיהודה ומחקק מבין רגליו עד כי יבא שילה ולו יקהת עמים
(200012, -79, 4);40;ם;75745;(1, 49, 12, 23, 75745);19999;(1, 49, 12, 5, 19999);שנים;4;5;חכלילי עינים מיין ולבן שנים מחלב
(200012, -79, 4);10;י;75824;(1, 49, 15, 10, 75824);20019;(1, 49, 15, 3, 20019);כי;2;3;וירא מנחה כי טוב ואת הארץ כי נעמה ויט שכמו לסבל ויהי למס עבד
(200012, -79, 4);70;ע;75903;(1, 49, 17, 20, 75903);20043;(1, 49, 17, 7, 20043);עלי;1;7;יהי דן נחש עלי דרך שפיפן עלי ארח הנשך עקבי סוס ויפל רכבו אחור
(200012, -79, 4);6;ו;75982;(1, 49, 20, 13, 75982);20063;(1, 49, 20, 4, 20063);והוא;1;4;מאשר שמנה לחמו והוא יתן מעדני מלך
(200012, -79, 4);6;ו;76061;(1, 49, 23, 7, 76061);20084;(1, 49, 23, 1, 20084);וימררהו;7;1;וימררהו ורבו וישטמהו בעלי חצים
(200012, -79, 4);6;ו;76140;(1, 49, 25, 8, 76140);20104;(1, 49, 25, 3, 20104);ויעזרך;1;3;מאל אביך ויעזרך ואת שדי ויברכך ברכת שמים מעל ברכת תהום רבצת תחת ברכת שדים ורחם
(200012, -79, 4);4;ד;76219;(1, 49, 26, 24, 76219);20124;(1, 49, 26, 7, 20124);עד;2;7;ברכת אביך גברו על ברכת הורי עד תאות גבעת עולם תהיין לראש יוסף ולקדקד נזיר אחיו
(200012, -79, 4);5;ה;76298;(1, 49, 28, 5, 76298);20144;(1, 49, 28, 2, 20144);אלה;3;2;כל אלה שבטי ישראל שנים עשר וזאת אשר דבר להם אביהם ויברך אותם איש אשר כברכתו ברך אתם
(200012, -79, 4);1;א;76377;(1, 49, 29, 18, 76377);20165;(1, 49, 29, 5, 20165);אני;1;5;ויצו אותם ויאמר אלהם אני נאסף אל עמי קברו אתי אל אבתי אל המערה אשר בשדה עפרון החתי
(200012, -79, 4);1;א;76456;(1, 49, 30, 32, 76456);20187;(1, 49, 30, 9, 20187);בארץ;2;9;במערה אשר בשדה המכפלה אשר על פני ממרא בארץ כנען אשר קנה אברהם את השדה מאת עפרן החתי לאחזת קבר
(200012, -79, 4);100;ק;76535;(1, 49, 31, 37, 76535);20209;(1, 49, 31, 11, 20209);יצחק;4;11;שמה קברו את אברהם ואת שרה אשתו שמה קברו את יצחק ואת רבקה אשתו ושמה קברתי את לאה
(200012, -79, 4);10;י;76614;(1, 49, 33, 27, 76614);20231;(1, 49, 33, 7, 20231);רגליו;4;7;ויכל יעקב לצות את בניו ויאסף רגליו אל המטה ויגוע ויאסף אל עמיו
(200012, -79, 4);8;ח;76693;(1, 50, 2, 25, 76693);20253;(1, 50, 2, 7, 20253);לחנט;2;7;ויצו יוסף את עבדיו את הרפאים לחנט את אביו ויחנטו הרפאים את ישראל
(200012, -79, 4);10;י;76772;(1, 50, 3, 52, 76772);20272;(1, 50, 3, 13, 20272);שבעים;4;13;וימלאו לו ארבעים יום כי כן ימלאו ימי החנטים ויבכו אתו מצרים שבעים יום
(200012, -79, 4);2;ב;76851;(1, 50, 5, 2, 76851);20293;(1, 50, 5, 1, 20293);אבי;2;1;אבי השביעני לאמר הנה אנכי מת בקברי אשר כריתי לי בארץ כנען שמה תקברני ועתה אעלה נא ואקברה את אבי ואשובה
(200012, -79, 4);2;ב;76930;(1, 50, 5, 81, 76930);20313;(1, 50, 5, 21, 20313);ואשובה;5;21;אבי השביעני לאמר הנה אנכי מת בקברי אשר כריתי לי בארץ כנען שמה תקברני ועתה אעלה נא ואקברה את אבי ואשובה
(200012, -79, 4);20;כ;77009;(1, 50, 7, 46, 77009);20334;(1, 50, 7, 13, 20334);וכל;2;13;ויעל יוסף לקבר את אביו ויעלו אתו כל עבדי פרעה זקני ביתו וכל זקני ארץ מצרים
(200012, -79, 4);300;ש;77088;(1, 50, 9, 17, 77088);20356;(1, 50, 9, 6, 20356);פרשים;3;6;ויעל עמו גם רכב גם פרשים ויהי המחנה כבד מאד
(200012, -79, 4);300;ש;77167;(1, 50, 10, 62, 77167);20377;(1, 50, 10, 17, 20377);שבעת;1;17;ויבאו עד גרן האטד אשר בעבר הירדן ויספדו שם מספד גדול וכבד מאד ויעש לאביו אבל שבעת ימים
(200012, -79, 4);300;ש;77246;(1, 50, 11, 72, 77246);20398;(1, 50, 11, 20, 20398);אשר;2;20;וירא יושב הארץ הכנעני את האבל בגרן האטד ויאמרו אבל כבד זה למצרים על כן קרא שמה אבל מצרים אשר בעבר הירדן
(200012, -79, 4);5;ה;77325;(1, 50, 13, 49, 77325);20418;(1, 50, 13, 12, 20418);קנה;3;12;וישאו אתו בניו ארצה כנען ויקברו אתו במערת שדה המכפלה אשר קנה אברהם את השדה לאחזת קבר מאת עפרן החתי על פני ממרא
(200012, -79, 4);1;א;77404;(1, 50, 14, 40, 77404);20440;(1, 50, 14, 11, 20440);אביו;1;11;וישב יוסף מצרימה הוא ואחיו וכל העלים אתו לקבר את אביו אחרי קברו את אביו
(200012, -79, 4);3;ג;77483;(1, 50, 15, 62, 77483);20462;(1, 50, 15, 18, 20462);גמלנו;1;18;ויראו אחי יוסף כי מת אביהם ויאמרו לו ישטמנו יוסף והשב ישיב לנו את כל הרעה אשר גמלנו אתו
(200012, -79, 4);3;ג;77562;(1, 50, 17, 38, 77562);20484;(1, 50, 17, 12, 20484);גמלוך;1;12;כה תאמרו ליוסף אנא שא נא פשע אחיך וחטאתם כי רעה גמלוך ועתה שא נא לפשע עבדי אלהי אביך ויבך יוסף בדברם אליו
(200012, -79, 4);30;ל;77641;(1, 50, 18, 34, 77641);20504;(1, 50, 18, 9, 20504);לעבדים;1;9;וילכו גם אחיו ויפלו לפניו ויאמרו הננו לך לעבדים
(200012, -79, 4);5;ה;77720;(1, 50, 20, 40, 77720);20524;(1, 50, 20, 11, 20524);הזה;1;11;ואתם חשבתם עלי רעה אלהים חשבה לטבה למען עשה כיום הזה להחית עם רב
(200012, -79, 4);6;ו;77799;(1, 50, 22, 18, 77799);20545;(1, 50, 22, 5, 20545);ובית;1;5;וישב יוסף במצרים הוא ובית אביו ויחי יוסף מאה ועשר שנים
(200012, -79, 4);10;י;77878;(1, 50, 24, 2, 77878);20566;(1, 50, 24, 1, 20566);ויאמר;2;1;ויאמר יוסף אל אחיו אנכי מת ואלהים פקד יפקד אתכם והעלה אתכם מן הארץ הזאת אל הארץ אשר נשבע לאברהם ליצחק וליעקב
(200012, -79, 4);100;ק;77957;(1, 50, 24, 81, 77957);20586;(1, 50, 24, 21, 20586);ליצחק;5;21;ויאמר יוסף אל אחיו אנכי מת ואלהים פקד יפקד אתכם והעלה אתכם מן הארץ הזאת אל הארץ אשר נשבע לאברהם ליצחק וליעקב
(200012, -79, 4);300;ש;78036;(1, 50, 26, 18, 78036);20607;(1, 50, 26, 6, 20607);שנים;1;6;וימת יוסף בן מאה ועשר שנים ויחנטו אתו ויישם בארון במצרים
(200012, -79, 4);40;מ;78115;(2, 1, 2, 7, 78115);20625;(2, 1, 2, 2, 20625);שמעון;2;2;ראובן שמעון לוי ויהודה
(200012, -79, 4);2;ב;78194;(2, 1, 5, 37, 78194);20645;(2, 1, 5, 11, 20645);במצרים;1;11;ויהי כל נפש יצאי ירך יעקב שבעים נפש ויוסף היה במצרים
(200012, -79, 4);40;ם;78273;(2, 1, 7, 48, 78273);20663;(2, 1, 7, 11, 20663);אתם;3;11;ובני ישראל פרו וישרצו וירבו ויעצמו במאד מאד ותמלא הארץ אתם
(200012, -79, 4);10;י;78352;(2, 1, 10, 14, 78352);20688;(2, 1, 10, 5, 20688);ירבה;1;5;הבה נתחכמה לו פן ירבה והיה כי תקראנה מלחמה ונוסף גם הוא על שנאינו ונלחם בנו ועלה מן הארץ
(200012, -79, 4);50;נ;78431;(2, 1, 11, 23, 78431);20708;(2, 1, 11, 6, 20708);ענתו;2;6;וישימו עליו שרי מסים למען ענתו בסבלתם ויבן ערי מסכנות לפרעה את פתם ואת רעמסס
(200012, -79, 4);200;ר;78510;(2, 1, 12, 40, 78510);20728;(2, 1, 12, 11, 20728);ישראל;3;11;וכאשר יענו אתו כן ירבה וכן יפרץ ויקצו מפני בני ישראל
(200012, -79, 4);400;ת;78589;(2, 1, 14, 52, 78589);20747;(2, 1, 14, 13, 20747);עבדתם;4;13;וימררו את חייהם בעבדה קשה בחמר ובלבנים ובכל עבדה בשדה את כל עבדתם אשר עבדו בהם בפרך
(200012, -79, 4);5;ה;78668;(2, 1, 16, 14, 78668);20767;(2, 1, 16, 4, 20767);העבריות;1;4;ויאמר בילדכן את העבריות וראיתן על האבנים אם בן הוא והמתן אתו ואם בת הוא וחיה
(200012, -79, 4);2;ב;78747;(2, 1, 17, 32, 78747);20787;(2, 1, 17, 8, 20787);דבר;2;8;ותיראן המילדת את האלהים ולא עשו כאשר דבר אליהן מלך מצרים ותחיין את הילדים
(200012, -79, 4);400;ת;78826;(2, 1, 18, 51, 78826);20805;(2, 1, 18, 12, 20805);את;2;12;ויקרא מלך מצרים למילדת ויאמר להן מדוע עשיתן הדבר הזה ותחיין את הילדים
(200012, -79, 4);10;י;78905;(2, 1, 20, 2, 78905);20824;(2, 1, 20, 1, 20824);וייטב;2;1;וייטב אלהים למילדת וירב העם ויעצמו מאד
(200012, -79, 4);6;ו;78984;(2, 1, 22, 14, 78984);20843;(2, 1, 22, 4, 20843);עמו;3;4;ויצו פרעה לכל עמו לאמר כל הבן הילוד היארה תשליכהו וכל הבת תחיון
(200012, -79, 4);200;ר;79063;(2, 2, 2, 17, 79063);20865;(2, 2, 2, 5, 20865);ותרא;3;5;ותהר האשה ותלד בן ותרא אתו כי טוב הוא ותצפנהו שלשה ירחים
(200012, -79, 4);400;ת;79142;(2, 2, 3, 51, 79142);20886;(2, 2, 3, 14, 20886);את;2;14;ולא יכלה עוד הצפינו ותקח לו תבת גמא ותחמרה בחמר ובזפת ותשם בה את הילד ותשם בסוף על שפת היאר
(200012, -79, 4);30;ל;79221;(2, 2, 5, 33, 79221);20908;(2, 2, 5, 9, 20908);על;2;9;ותרד בת פרעה לרחץ על היאר ונערתיה הלכת על יד היאר ותרא את התבה בתוך הסוף ותשלח את אמתה ותקחה
(200012, -79, 4);1;א;79300;(2, 2, 6, 39, 79300);20929;(2, 2, 6, 10, 20929);ותאמר;3;10;ותפתח ותראהו את הילד והנה נער בכה ותחמל עליו ותאמר מילדי העברים זה
(200012, -79, 4);30;ל;79379;(2, 2, 8, 6, 79379);20950;(2, 2, 8, 2, 20950);לה;1;2;ותאמר לה בת פרעה לכי ותלך העלמה ותקרא את אם הילד
(200012, -79, 4);300;ש;79458;(2, 2, 9, 47, 79458);20973;(2, 2, 9, 14, 20973);שכרך;1;14;ותאמר לה בת פרעה היליכי את הילד הזה והינקהו לי ואני אתן את שכרך ותקח האשה הילד ותניקהו
(200012, -79, 4);300;ש;79537;(2, 2, 10, 57, 79537);20993;(2, 2, 10, 16, 20993);משיתהו;2;16;ויגדל הילד ותבאהו לבת פרעה ויהי לה לבן ותקרא שמו משה ותאמר כי מן המים משיתהו
(200012, -79, 4);5;ה;79616;(2, 2, 12, 9, 79616);21013;(2, 2, 12, 3, 21013);וכה;3;3;ויפן כה וכה וירא כי אין איש ויך את המצרי ויטמנהו בחול
(200012, -79, 4);400;ת;79695;(2, 2, 13, 46, 79695);21034;(2, 2, 13, 12, 21034);תכה;1;12;ויצא ביום השני והנה שני אנשים עברים נצים ויאמר לרשע למה תכה רעך
(200012, -79, 4);5;ה;79774;(2, 2, 14, 74, 79774);21055;(2, 2, 14, 20, 21055);הדבר;1;20;ויאמר מי שמך לאיש שר ושפט עלינו הלהרגני אתה אמר כאשר הרגת את המצרי ויירא משה ויאמר אכן נודע הדבר
(200012, -79, 4);40;מ;79853;(2, 2, 16, 6, 79853);21076;(2, 2, 16, 2, 21076);מדין;1;2;ולכהן מדין שבע בנות ותבאנה ותדלנה ותמלאנה את הרהטים להשקות צאן אביהן
(200012, -79, 4);300;ש;79932;(2, 2, 17, 28, 79932);21092;(2, 2, 17, 6, 21092);ויושען;4;6;ויבאו הרעים ויגרשום ויקם משה ויושען וישק את צאנם
(200012, -79, 4);3;ג;80011;(2, 2, 19, 29, 80011);21111;(2, 2, 19, 7, 21111);וגם;2;7;ותאמרן איש מצרי הצילנו מיד הרעים וגם דלה דלה לנו וישק את הצאן
(200012, -79, 4);1;א;80090;(2, 2, 21, 13, 80090);21134;(2, 2, 21, 4, 21134);את;1;4;ויואל משה לשבת את האיש ויתן את צפרה בתו למשה
(200012, -79, 4);5;ה;80169;(2, 2, 23, 16, 80169);21156;(2, 2, 23, 4, 21156);ההם;2;4;ויהי בימים הרבים ההם וימת מלך מצרים ויאנחו בני ישראל מן העבדה ויזעקו ותעל שועתם אל האלהים מן העבדה
(200012, -79, 4);100;ק;80248;(2, 2, 24, 15, 80248);21175;(2, 2, 24, 4, 21175);נאקתם;3;4;וישמע אלהים את נאקתם ויזכר אלהים את בריתו את אברהם את יצחק ואת יעקב
(200012, -79, 4);400;ת;80327;(2, 3, 1, 12, 80327);21196;(2, 3, 1, 4, 21196);את;2;4;ומשה היה רעה את צאן יתרו חתנו כהן מדין וינהג את הצאן אחר המדבר ויבא אל הר האלהים חרבה
(200012, -79, 4);400;ת;80406;(2, 3, 2, 24, 80406);21218;(2, 3, 2, 7, 21218);מתוך;2;7;וירא מלאך יהוה אליו בלבת אש מתוך הסנה וירא והנה הסנה בער באש והסנה איננו אכל
(200012, -79, 4);70;ע;80485;(2, 3, 3, 42, 80485);21239;(2, 3, 3, 12, 21239);יבער;3;12;ויאמר משה אסרה נא ואראה את המראה הגדל הזה מדוע לא יבער הסנה
(200012, -79, 4);300;ש;80564;(2, 3, 5, 15, 80564);21260;(2, 3, 5, 5, 21260);של;1;5;ויאמר אל תקרב הלם של נעליך מעל רגליך כי המקום אשר אתה עומד עליו אדמת קדש הוא
(200012, -79, 4);100;ק;80643;(2, 3, 6, 34, 80643);21280;(2, 3, 6, 8, 21280);יצחק;4;8;ויאמר אנכי אלהי אביך אלהי אברהם אלהי יצחק ואלהי יעקב ויסתר משה פניו כי ירא מהביט אל האלהים
(200012, -79, 4);100;ק;80722;(2, 3, 7, 40, 80722);21301;(2, 3, 7, 11, 21301);צעקתם;3;11;ויאמר יהוה ראה ראיתי את עני עמי אשר במצרים ואת צעקתם שמעתי מפני נגשיו כי ידעתי את מכאביו
(200012, -79, 4);2;ב;80801;(2, 3, 8, 48, 80801);21320;(2, 3, 8, 12, 21320);ורחבה;4;12;וארד להצילו מיד מצרים ולהעלתו מן הארץ ההוא אל ארץ טובה ורחבה אל ארץ זבת חלב ודבש אל מקום הכנעני והחתי והאמרי והפרזי והחוי והיבוסי
(200012, -79, 4);5;ה;80880;(2, 3, 9, 22, 80880);21339;(2, 3, 9, 6, 21339);באה;3;6;ועתה הנה צעקת בני ישראל באה אלי וגם ראיתי את הלחץ אשר מצרים לחצים אתם
(200012, -79, 4);1;א;80959;(2, 3, 11, 3, 80959);21360;(2, 3, 11, 1, 21360);ויאמר;3;1;ויאמר משה אל האלהים מי אנכי כי אלך אל פרעה וכי אוציא את בני ישראל ממצרים
(200012, -79, 4);10;י;81038;(2, 3, 12, 25, 81038);21383;(2, 3, 12, 8, 21383);כי;2;8;ויאמר כי אהיה עמך וזה לך האות כי אנכי שלחתיך בהוציאך את העם ממצרים תעבדון את האלהים על ההר הזה
(200012, -79, 4);50;נ;81117;(2, 3, 13, 29, 81117);21404;(2, 3, 13, 9, 21404);בני;2;9;ויאמר משה אל האלהים הנה אנכי בא אל בני ישראל ואמרתי להם אלהי אבותיכם שלחני אליכם ואמרו לי מה שמו מה אמר אלהם
(200012, -79, 4);200;ר;81196;(2, 3, 14, 22, 81196);21424;(2, 3, 14, 6, 21424);אשר;3;6;ויאמר אלהים אל משה אהיה אשר אהיה ויאמר כה תאמר לבני ישראל אהיה שלחני אליכם
(200012, -79, 4);5;ה;81275;(2, 3, 15, 41, 81275);21445;(2, 3, 15, 12, 21445);אלהי;3;12;ויאמר עוד אלהים אל משה כה תאמר אל בני ישראל יהוה אלהי אבתיכם אלהי אברהם אלהי יצחק ואלהי יעקב שלחני אליכם זה שמי לעלם וזה זכרי לדר דר
(200012, -79, 4);300;ש;81354;(2, 3, 16, 15, 81354);21466;(2, 3, 16, 5, 21466);ישראל;2;5;לך ואספת את זקני ישראל ואמרת אלהם יהוה אלהי אבתיכם נראה אלי אלהי אברהם יצחק ויעקב לאמר פקד פקדתי אתכם ואת העשוי לכם במצרים
(200012, -79, 4);2;ב;81433;(2, 3, 16, 94, 81433);21485;(2, 3, 16, 24, 21485);במצרים;1;24;לך ואספת את זקני ישראל ואמרת אלהם יהוה אלהי אבתיכם נראה אלי אלהי אברהם יצחק ויעקב לאמר פקד פקדתי אתכם ואת העשוי לכם במצרים
(200012, -79, 4);4;ד;81512;(2, 3, 17, 74, 81512);21503;(2, 3, 17, 18, 21503);ודבש;2;18;ואמר אעלה אתכם מעני מצרים אל ארץ הכנעני והחתי והאמרי והפרזי והחוי והיבוסי אל ארץ זבת חלב ודבש
(200012, -79, 4);20;כ;81591;(2, 3, 18, 77, 81591);21521;(2, 3, 18, 18, 21521);נלכה;3;18;ושמעו לקלך ובאת אתה וזקני ישראל אל מלך מצרים ואמרתם אליו יהוה אלהי העבריים נקרה עלינו ועתה נלכה נא דרך שלשת ימים במדבר ונזבחה ליהוה אלהינו
(200012, -79, 4);6;ו;81670;(2, 3, 20, 1, 81670);21542;(2, 3, 20, 1, 21542);ושלחתי;1;1;ושלחתי את ידי והכיתי את מצרים בכל נפלאתי אשר אעשה בקרבו ואחרי כן ישלח אתכם
(200012, -79, 4);10;י;81749;(2, 3, 21, 20, 81749);21562;(2, 3, 21, 6, 21562);בעיני;5;6;ונתתי את חן העם הזה בעיני מצרים והיה כי תלכון לא תלכו ריקם
(200012, -79, 4);40;ם;81828;(2, 3, 22, 53, 81828);21582;(2, 3, 22, 13, 21582);בניכם;5;13;ושאלה אשה משכנתה ומגרת ביתה כלי כסף וכלי זהב ושמלת ושמתם על בניכם ועל בנתיכם ונצלתם את מצרים
(200012, -79, 4);6;ו;81907;(2, 4, 1, 57, 81907);21603;(2, 4, 1, 16, 21603);יהוה;3;16;ויען משה ויאמר והן לא יאמינו לי ולא ישמעו בקלי כי יאמרו לא נראה אליך יהוה
(200012, -79, 4);1;א;81986;(2, 4, 4, 3, 81986);21621;(2, 4, 4, 1, 21621);ויאמר;3;1;ויאמר יהוה אל משה שלח ידך ואחז בזנבו וישלח ידו ויחזק בו ויהי למטה בכפו
(200012, -79, 4);30;ל;82065;(2, 4, 5, 26, 82065);21642;(2, 4, 5, 7, 21642);אלהי;2;7;למען יאמינו כי נראה אליך יהוה אלהי אבתם אלהי אברהם אלהי יצחק ואלהי יעקב
(200012, -79, 4);5;ה;82144;(2, 4, 6, 47, 82144);21662;(2, 4, 6, 13, 21662);והנה;2;13;ויאמר יהוה לו עוד הבא נא ידך בחיקך ויבא ידו בחיקו ויוצאה והנה ידו מצרעת כשלג
(200012, -79, 4);10;י;82223;(2, 4, 8, 12, 82223);21683;(2, 4, 8, 4, 21683);יאמינו;4;4;והיה אם לא יאמינו לך ולא ישמעו לקל האת הראשון והאמינו לקל האת האחרון
(200012, -79, 4);70;ע;82302;(2, 4, 9, 36, 82302);21703;(2, 4, 9, 10, 21703);ישמעון;4;10;והיה אם לא יאמינו גם לשני האתות האלה ולא ישמעון לקלך ולקחת ממימי היאר ושפכת היבשה והיו המים אשר תקח מן היאר והיו לדם ביבשת
(200012, -79, 4);1;א;82381;(2, 4, 10, 17, 82381);21724;(2, 4, 10, 6, 21724);אדני;1;6;ויאמר משה אל יהוה בי אדני לא איש דברים אנכי גם מתמול גם משלשם גם מאז דברך אל עבדך כי כבד פה וכבד לשון אנכי
(200012, -79, 4);40;מ;82460;(2, 4, 11, 14, 82460);21747;(2, 4, 11, 4, 21747);מי;1;4;ויאמר יהוה אליו מי שם פה לאדם או מי ישום אלם או חרש או פקח או עור הלא אנכי יהוה
(200012, -79, 4);4;ד;82539;(2, 4, 12, 33, 82539);21772;(2, 4, 12, 9, 21772);תדבר;2;9;ועתה לך ואנכי אהיה עם פיך והוריתיך אשר תדבר
(200012, -79, 4);40;ם;82618;(2, 4, 14, 54, 82618);21794;(2, 4, 14, 15, 21794);וגם;3;15;ויחר אף יהוה במשה ויאמר הלא אהרן אחיך הלוי ידעתי כי דבר ידבר הוא וגם הנה הוא יצא לקראתך וראך ושמח בלבו
(200012, -79, 4);400;ת;82697;(2, 4, 15, 52, 82697);21814;(2, 4, 15, 13, 21814);והוריתי;6;13;ודברת אליו ושמת את הדברים בפיו ואנכי אהיה עם פיך ועם פיהו והוריתי אתכם את אשר תעשון
(200012, -79, 4);1;א;82776;(2, 4, 17, 18, 82776);21838;(2, 4, 17, 6, 21838);אשר;1;6;ואת המטה הזה תקח בידך אשר תעשה בו את האתת
(200012, -79, 4);10;י;82855;(2, 4, 18, 65, 82855);21860;(2, 4, 18, 18, 21860);חיים;2;18;וילך משה וישב אל יתר חתנו ויאמר לו אלכה נא ואשובה אל אחי אשר במצרים ואראה העודם חיים ויאמר יתרו למשה לך לשלום
(200012, -79, 4);100;ק;82934;(2, 4, 20, 3, 82934);21881;(2, 4, 20, 1, 21881);ויקח;3;1;ויקח משה את אשתו ואת בניו וירכבם על החמר וישב ארצה מצרים ויקח משה את מטה האלהים בידו
(200012, -79, 4);2;ב;83013;(2, 4, 21, 15, 83013);21903;(2, 4, 21, 5, 21903);בלכתך;1;5;ויאמר יהוה אל משה בלכתך לשוב מצרימה ראה כל המפתים אשר שמתי בידך ועשיתם לפני פרעה ואני אחזק את לבו ולא ישלח את העם
(200012, -79, 4);200;ר;83092;(2, 4, 22, 4, 83092);21923;(2, 4, 22, 1, 21923);ואמרת;4;1;ואמרת אל פרעה כה אמר יהוה בני בכרי ישראל
(200012, -79, 4);200;ר;83171;(2, 4, 23, 51, 83171);21945;(2, 4, 23, 14, 21945);בכרך;3;14;ואמר אליך שלח את בני ויעבדני ותמאן לשלחו הנה אנכי הרג את בנך בכרך
