(n,d,k);LetterGematriaNumberValue;Letter;LetterPositionIndex;LetterCoordinatesD5K;WordNumber;WordCoordinatesDWTK;Found in Word in Text;LetterPositionIndex In Word;WordNumberInVerse;Found In Verse
(65545, 81, 4);400;ת;16;(1, 1, 1, 16, 16);4;(1, 1, 1, 4, 4);את;2;4;בראשית ברא אלהים את השמים ואת הארץ
(65545, 81, 4);6;ו;97;(1, 1, 3, 17, 97);26;(1, 1, 3, 5, 26);ויהי;1;5;ויאמר אלהים יהי אור ויהי אור
(65545, 81, 4);6;ו;178;(1, 1, 5, 30, 178);47;(1, 1, 5, 8, 47);ויהי;1;8;ויקרא אלהים לאור יום ולחשך קרא לילה ויהי ערב ויהי בקר יום אחד
(65545, 81, 4);10;י;259;(1, 1, 7, 18, 259);68;(1, 1, 7, 5, 68);ויבדל;2;5;ויעש אלהים את הרקיע ויבדל בין המים אשר מתחת לרקיע ובין המים אשר מעל לרקיע ויהי כן
(65545, 81, 4);10;י;340;(1, 1, 8, 34, 340);89;(1, 1, 8, 9, 89);יום;1;9;ויקרא אלהים לרקיע שמים ויהי ערב ויהי בקר יום שני
(65545, 81, 4);5;ה;421;(1, 1, 10, 24, 421);108;(1, 1, 10, 5, 108);ולמקוה;6;5;ויקרא אלהים ליבשה ארץ ולמקוה המים קרא ימים וירא אלהים כי טוב
(65545, 81, 4);2;ב;502;(1, 1, 11, 56, 502);131;(1, 1, 11, 16, 131);בו;1;16;ויאמר אלהים תדשא הארץ דשא עשב מזריע זרע עץ פרי עשה פרי למינו אשר זרעו בו על הארץ ויהי כן
(65545, 81, 4);6;ו;583;(1, 1, 13, 1, 583);154;(1, 1, 13, 1, 154);ויהי;1;1;ויהי ערב ויהי בקר יום שלישי
(65545, 81, 4);40;מ;664;(1, 1, 14, 60, 664);173;(1, 1, 14, 14, 173);ולמועדים;3;14;ויאמר אלהים יהי מארת ברקיע השמים להבדיל בין היום ובין הלילה והיו לאתת ולמועדים ולימים ושנים
(65545, 81, 4);5;ה;745;(1, 1, 16, 28, 745);192;(1, 1, 16, 8, 192);המאור;1;8;ויעש אלהים את שני המארת הגדלים את המאור הגדל לממשלת היום ואת המאור הקטן לממשלת הלילה ואת הכוכבים
(65545, 81, 4);5;ה;826;(1, 1, 17, 30, 826);210;(1, 1, 17, 8, 210);הארץ;1;8;ויתן אתם אלהים ברקיע השמים להאיר על הארץ
(65545, 81, 4);200;ר;907;(1, 1, 20, 5, 907);229;(1, 1, 20, 1, 229);ויאמר;5;1;ויאמר אלהים ישרצו המים שרץ נפש חיה ועוף יעופף על הארץ על פני רקיע השמים
(65545, 81, 4);30;ל;988;(1, 1, 21, 29, 988);250;(1, 1, 21, 7, 250);כל;2;7;ויברא אלהים את התנינם הגדלים ואת כל נפש החיה הרמשת אשר שרצו המים למינהם ואת כל עוף כנף למינהו וירא אלהים כי טוב
(65545, 81, 4);6;ו;1069;(1, 1, 22, 21, 1069);272;(1, 1, 22, 6, 272);ורבו;1;6;ויברך אתם אלהים לאמר פרו ורבו ומלאו את המים בימים והעוף ירב בארץ
(65545, 81, 4);50;נ;1150;(1, 1, 24, 28, 1150);292;(1, 1, 24, 7, 292);למינה;4;7;ויאמר אלהים תוצא הארץ נפש חיה למינה בהמה ורמש וחיתו ארץ למינה ויהי כן
(65545, 81, 4);50;נ;1231;(1, 1, 25, 53, 1231);313;(1, 1, 25, 14, 313);למינהו;4;14;ויעש אלהים את חית הארץ למינה ואת הבהמה למינה ואת כל רמש האדמה למינהו וירא אלהים כי טוב
(65545, 81, 4);200;ר;1312;(1, 1, 26, 65, 1312);331;(1, 1, 26, 14, 331);הארץ;3;14;ויאמר אלהים נעשה אדם בצלמנו כדמותנו וירדו בדגת הים ובעוף השמים ובבהמה ובכל הארץ ובכל הרמש הרמש על הארץ
(65545, 81, 4);10;י;1393;(1, 1, 28, 12, 1393);352;(1, 1, 28, 3, 352);אלהים;4;3;ויברך אתם אלהים ויאמר להם אלהים פרו ורבו ומלאו את הארץ וכבשה ורדו בדגת הים ובעוף השמים ובכל חיה הרמשת על הארץ
(65545, 81, 4);200;ר;1474;(1, 1, 29, 5, 1474);372;(1, 1, 29, 1, 372);ויאמר;5;1;ויאמר אלהים הנה נתתי לכם את כל עשב זרע זרע אשר על פני כל הארץ ואת כל העץ אשר בו פרי עץ זרע זרע לכם יהיה לאכלה
(65545, 81, 4);20;כ;1555;(1, 1, 30, 3, 1555);399;(1, 1, 30, 1, 399);ולכל;3;1;ולכל חית הארץ ולכל עוף השמים ולכל רומש על הארץ אשר בו נפש חיה את כל ירק עשב לאכלה ויהי כן
(65545, 81, 4);300;ש;1636;(1, 1, 31, 15, 1636);424;(1, 1, 31, 5, 424);אשר;2;5;וירא אלהים את כל אשר עשה והנה טוב מאד ויהי ערב ויהי בקר יום הששי
(65545, 81, 4);400;ת;1717;(1, 2, 2, 24, 1717);444;(1, 2, 2, 5, 444);מלאכתו;5;5;ויכל אלהים ביום השביעי מלאכתו אשר עשה וישבת ביום השביעי מכל מלאכתו אשר עשה
(65545, 81, 4);400;ת;1798;(1, 2, 3, 44, 1798);465;(1, 2, 3, 12, 465);מלאכתו;5;12;ויברך אלהים את יום השביעי ויקדש אתו כי בו שבת מכל מלאכתו אשר ברא אלהים לעשות
(65545, 81, 4);10;י;1879;(1, 2, 5, 14, 1879);485;(1, 2, 5, 5, 485);יהיה;1;5;וכל שיח השדה טרם יהיה בארץ וכל עשב השדה טרם יצמח כי לא המטיר יהוה אלהים על הארץ ואדם אין לעבד את האדמה
(65545, 81, 4);5;ה;1960;(1, 2, 6, 15, 1960);508;(1, 2, 6, 5, 508);והשקה;2;5;ואד יעלה מן הארץ והשקה את כל פני האדמה
(65545, 81, 4);70;ע;2041;(1, 2, 8, 4, 2041);529;(1, 2, 8, 1, 529);ויטע;4;1;ויטע יהוה אלהים גן בעדן מקדם וישם שם את האדם אשר יצר
(65545, 81, 4);6;ו;2122;(1, 2, 9, 44, 2122);552;(1, 2, 9, 12, 552);ועץ;1;12;ויצמח יהוה אלהים מן האדמה כל עץ נחמד למראה וטוב למאכל ועץ החיים בתוך הגן ועץ הדעת טוב ורע
(65545, 81, 4);300;ש;2203;(1, 2, 11, 9, 2203);573;(1, 2, 11, 3, 573);פישון;3;3;שם האחד פישון הוא הסבב את כל ארץ החוילה אשר שם הזהב
(65545, 81, 4);5;ה;2284;(1, 2, 13, 20, 2284);596;(1, 2, 13, 6, 596);הסובב;1;6;ושם הנהר השני גיחון הוא הסובב את כל ארץ כוש
(65545, 81, 4);4;ד;2365;(1, 2, 15, 18, 2365);617;(1, 2, 15, 5, 617);האדם;3;5;ויקח יהוה אלהים את האדם וינחהו בגן עדן לעבדה ולשמרה
(65545, 81, 4);20;כ;2446;(1, 2, 17, 19, 2446);639;(1, 2, 17, 6, 639);תאכל;3;6;ומעץ הדעת טוב ורע לא תאכל ממנו כי ביום אכלך ממנו מות תמות
(65545, 81, 4);30;ל;2527;(1, 2, 19, 10, 2527);661;(1, 2, 19, 3, 661);אלהים;2;3;ויצר יהוה אלהים מן האדמה כל חית השדה ואת כל עוף השמים ויבא אל האדם לראות מה יקרא לו וכל אשר יקרא לו האדם נפש חיה הוא שמו
(65545, 81, 4);300;ש;2608;(1, 2, 19, 91, 2608);686;(1, 2, 19, 28, 686);שמו;1;28;ויצר יהוה אלהים מן האדמה כל חית השדה ואת כל עוף השמים ויבא אל האדם לראות מה יקרא לו וכל אשר יקרא לו האדם נפש חיה הוא שמו
(65545, 81, 4);70;ע;2689;(1, 2, 21, 19, 2689);706;(1, 2, 21, 5, 706);על;1;5;ויפל יהוה אלהים תרדמה על האדם ויישן ויקח אחת מצלעתיו ויסגר בשר תחתנה
(65545, 81, 4);1;א;2770;(1, 2, 22, 44, 2770);727;(1, 2, 22, 13, 727);האדם;2;13;ויבן יהוה אלהים את הצלע אשר לקח מן האדם לאשה ויבאה אל האדם
(65545, 81, 4);40;מ;2851;(1, 2, 24, 22, 2851);750;(1, 2, 24, 8, 750);אמו;2;8;על כן יעזב איש את אביו ואת אמו ודבק באשתו והיו לבשר אחד
(65545, 81, 4);70;ע;2932;(1, 3, 1, 26, 2932);770;(1, 3, 1, 8, 770);עשה;1;8;והנחש היה ערום מכל חית השדה אשר עשה יהוה אלהים ויאמר אל האשה אף כי אמר אלהים לא תאכלו מכל עץ הגן
(65545, 81, 4);200;ר;3013;(1, 3, 3, 4, 3013);793;(1, 3, 3, 1, 793);ומפרי;4;1;ומפרי העץ אשר בתוך הגן אמר אלהים לא תאכלו ממנו ולא תגעו בו פן תמתון
(65545, 81, 4);30;ל;3094;(1, 3, 5, 7, 3094);817;(1, 3, 5, 3, 817);אלהים;2;3;כי ידע אלהים כי ביום אכלכם ממנו ונפקחו עיניכם והייתם כאלהים ידעי טוב ורע
(65545, 81, 4);5;ה;3175;(1, 3, 6, 29, 3175);837;(1, 3, 6, 9, 837);הוא;1;9;ותרא האשה כי טוב העץ למאכל וכי תאוה הוא לעינים ונחמד העץ להשכיל ותקח מפריו ותאכל ותתן גם לאישה עמה ויאכל
(65545, 81, 4);200;ר;3256;(1, 3, 7, 26, 3256);855;(1, 3, 7, 6, 855);עירמם;3;6;ותפקחנה עיני שניהם וידעו כי עירמם הם ויתפרו עלה תאנה ויעשו להם חגרת
(65545, 81, 4);40;מ;3337;(1, 3, 8, 52, 3337);875;(1, 3, 8, 13, 875);מפני;1;13;וישמעו את קול יהוה אלהים מתהלך בגן לרוח היום ויתחבא האדם ואשתו מפני יהוה אלהים בתוך עץ הגן
(65545, 81, 4);40;ם;3418;(1, 3, 10, 29, 3418);896;(1, 3, 10, 8, 896);עירם;4;8;ויאמר את קלך שמעתי בגן ואירא כי עירם אנכי ואחבא
(65545, 81, 4);400;ת;3499;(1, 3, 12, 19, 3499);918;(1, 3, 12, 5, 918);נתתה;3;5;ויאמר האדם האשה אשר נתתה עמדי הוא נתנה לי מן העץ ואכל
(65545, 81, 4);6;ו;3580;(1, 3, 14, 8, 3580);939;(1, 3, 14, 2, 939);יהוה;3;2;ויאמר יהוה אלהים אל הנחש כי עשית זאת ארור אתה מכל הבהמה ומכל חית השדה על גחנך תלך ועפר תאכל כל ימי חייך
(65545, 81, 4);10;י;3661;(1, 3, 15, 8, 3661);962;(1, 3, 15, 2, 962);אשית;3;2;ואיבה אשית בינך ובין האשה ובין זרעך ובין זרעה הוא ישופך ראש ואתה תשופנו עקב
(65545, 81, 4);20;ך;3742;(1, 3, 16, 28, 3742);982;(1, 3, 16, 7, 982);והרנך;5;7;אל האשה אמר הרבה ארבה עצבונך והרנך בעצב תלדי בנים ואל אישך תשוקתך והוא ימשל בך
(65545, 81, 4);30;ל;3823;(1, 3, 17, 46, 3823);1004;(1, 3, 17, 13, 1004);לא;1;13;ולאדם אמר כי שמעת לקול אשתך ותאכל מן העץ אשר צויתיך לאמר לא תאכל ממנו ארורה האדמה בעבורך בעצבון תאכלנה כל ימי חייך
(65545, 81, 4);1;א;3904;(1, 3, 19, 5, 3904);1024;(1, 3, 19, 2, 1024);אפיך;1;2;בזעת אפיך תאכל לחם עד שובך אל האדמה כי ממנה לקחת כי עפר אתה ואל עפר תשוב
(65545, 81, 4);20;כ;3985;(1, 3, 20, 30, 3985);1049;(1, 3, 20, 10, 1049);כל;1;10;ויקרא האדם שם אשתו חוה כי הוא היתה אם כל חי
(65545, 81, 4);70;ע;4066;(1, 3, 22, 41, 4066);1069;(1, 3, 22, 11, 1069);ורע;3;11;ויאמר יהוה אלהים הן האדם היה כאחד ממנו לדעת טוב ורע ועתה פן ישלח ידו ולקח גם מעץ החיים ואכל וחי לעלם
(65545, 81, 4);6;ו;4147;(1, 3, 24, 1, 4147);1092;(1, 3, 24, 1, 1092);ויגרש;1;1;ויגרש את האדם וישכן מקדם לגן עדן את הכרבים ואת להט החרב המתהפכת לשמר את דרך עץ החיים
(65545, 81, 4);300;ש;4228;(1, 4, 1, 15, 4228);1114;(1, 4, 1, 5, 1114);אשתו;2;5;והאדם ידע את חוה אשתו ותהר ותלד את קין ותאמר קניתי איש את יהוה
(65545, 81, 4);6;ו;4309;(1, 4, 3, 1, 4309);1138;(1, 4, 3, 1, 1138);ויהי;1;1;ויהי מקץ ימים ויבא קין מפרי האדמה מנחה ליהוה
(65545, 81, 4);30;ל;4390;(1, 4, 4, 46, 4390);1158;(1, 4, 4, 12, 1158);ואל;3;12;והבל הביא גם הוא מבכרות צאנו ומחלבהן וישע יהוה אל הבל ואל מנחתו
(65545, 81, 4);6;ו;4471;(1, 4, 7, 3, 4471);1181;(1, 4, 7, 1, 1181);הלוא;3;1;הלוא אם תיטיב שאת ואם לא תיטיב לפתח חטאת רבץ ואליך תשוקתו ואתה תמשל בו
(65545, 81, 4);2;ב;4552;(1, 4, 8, 28, 4552);1203;(1, 4, 8, 8, 1203);בשדה;1;8;ויאמר קין אל הבל אחיו ויהי בהיותם בשדה ויקם קין אל הבל אחיו ויהרגהו
(65545, 81, 4);300;ש;4633;(1, 4, 10, 9, 4633);1225;(1, 4, 10, 3, 1225);עשית;2;3;ויאמר מה עשית קול דמי אחיך צעקים אלי מן האדמה
(65545, 81, 4);1;א;4714;(1, 4, 12, 7, 4714);1249;(1, 4, 12, 3, 1249);את;1;3;כי תעבד את האדמה לא תסף תת כחה לך נע ונד תהיה בארץ
(65545, 81, 4);40;מ;4795;(1, 4, 14, 23, 4795);1273;(1, 4, 14, 7, 1273);האדמה;4;7;הן גרשת אתי היום מעל פני האדמה ומפניך אסתר והייתי נע ונד בארץ והיה כל מצאי יהרגני
(65545, 81, 4);5;ה;4876;(1, 4, 15, 39, 4876);1294;(1, 4, 15, 11, 1294);יהוה;4;11;ויאמר לו יהוה לכן כל הרג קין שבעתים יקם וישם יהוה לקין אות לבלתי הכות אתו כל מצאו
(65545, 81, 4);1;א;4957;(1, 4, 17, 22, 4957);1317;(1, 4, 17, 7, 1317);את;1;7;וידע קין את אשתו ותהר ותלד את חנוך ויהי בנה עיר ויקרא שם העיר כשם בנו חנוך
(65545, 81, 4);40;מ;5038;(1, 4, 18, 45, 5038);1339;(1, 4, 18, 12, 1339);מתושאל;1;12;ויולד לחנוך את עירד ועירד ילד את מחויאל ומחייאל ילד את מתושאל ומתושאל ילד את למך
(65545, 81, 4);1;א;5119;(1, 4, 20, 25, 5119);1363;(1, 4, 20, 9, 1363);אהל;1;9;ותלד עדה את יבל הוא היה אבי ישב אהל ומקנה
(65545, 81, 4);6;ו;5200;(1, 4, 22, 40, 5200);1387;(1, 4, 22, 13, 1387);ואחות;1;13;וצלה גם הוא ילדה את תובל קין לטש כל חרש נחשת וברזל ואחות תובל קין נעמה
(65545, 81, 4);2;ב;5281;(1, 4, 23, 66, 5281);1407;(1, 4, 23, 17, 1407);לחברתי;3;17;ויאמר למך לנשיו עדה וצלה שמען קולי נשי למך האזנה אמרתי כי איש הרגתי לפצעי וילד לחברתי
(65545, 81, 4);8;ח;5362;(1, 4, 25, 50, 5362);1431;(1, 4, 25, 17, 1431);אחר;2;17;וידע אדם עוד את אשתו ותלד בן ותקרא את שמו שת כי שת לי אלהים זרע אחר תחת הבל כי הרגו קין
(65545, 81, 4);1;א;5443;(1, 5, 1, 20, 5443);1456;(1, 5, 1, 6, 1456);ברא;3;6;זה ספר תולדת אדם ביום ברא אלהים אדם בדמות אלהים עשה אתו
(65545, 81, 4);1;א;5524;(1, 5, 3, 15, 5524);1477;(1, 5, 3, 4, 1477);ומאת;3;4;ויחי אדם שלשים ומאת שנה ויולד בדמותו כצלמו ויקרא את שמו שת
(65545, 81, 4);400;ת;5605;(1, 5, 4, 49, 5605);1498;(1, 5, 4, 13, 1498);ובנות;5;13;ויהיו ימי אדם אחרי הולידו את שת שמנה מאת שנה ויולד בנים ובנות
(65545, 81, 4);200;ר;5686;(1, 5, 7, 9, 5686);1522;(1, 5, 7, 3, 1522);אחרי;3;3;ויחי שת אחרי הולידו את אנוש שבע שנים ושמנה מאות שנה ויולד בנים ובנות
(65545, 81, 4);6;ו;5767;(1, 5, 8, 35, 5767);1544;(1, 5, 8, 11, 1544);וימת;1;11;ויהיו כל ימי שת שתים עשרה שנה ותשע מאות שנה וימת
(65545, 81, 4);4;ד;5848;(1, 5, 10, 51, 5848);1564;(1, 5, 10, 13, 1564);ויולד;5;13;ויחי אנוש אחרי הולידו את קינן חמש עשרה שנה ושמנה מאות שנה ויולד בנים ובנות
(65545, 81, 4);50;נ;5929;(1, 5, 13, 7, 5929);1585;(1, 5, 13, 2, 1585);קינן;3;2;ויחי קינן אחרי הולידו את מהללאל ארבעים שנה ושמנה מאות שנה ויולד בנים ובנות
(65545, 81, 4);1;א;6010;(1, 5, 14, 27, 6010);1605;(1, 5, 14, 8, 1605);מאות;2;8;ויהיו כל ימי קינן עשר שנים ותשע מאות שנה וימת
(65545, 81, 4);50;נ;6091;(1, 5, 16, 37, 6091);1625;(1, 5, 16, 9, 1625);ושמנה;4;9;ויחי מהללאל אחרי הולידו את ירד שלשים שנה ושמנה מאות שנה ויולד בנים ובנות
(65545, 81, 4);10;י;6172;(1, 5, 18, 15, 6172);1645;(1, 5, 18, 4, 1645);וששים;4;4;ויחי ירד שתים וששים שנה ומאת שנה ויולד את חנוך
(65545, 81, 4);10;י;6253;(1, 5, 20, 11, 6253);1667;(1, 5, 20, 4, 1667);ירד;1;4;ויהיו כל ימי ירד שתים וששים שנה ותשע מאות שנה וימת
(65545, 81, 4);8;ח;6334;(1, 5, 22, 20, 6334);1687;(1, 5, 22, 5, 1687);אחרי;2;5;ויתהלך חנוך את האלהים אחרי הולידו את מתושלח שלש מאות שנה ויולד בנים ובנות
(65545, 81, 4);20;ך;6415;(1, 5, 24, 6, 6415);1707;(1, 5, 24, 1, 1707);ויתהלך;6;1;ויתהלך חנוך את האלהים ואיננו כי לקח אתו אלהים
(65545, 81, 4);1;א;6496;(1, 5, 26, 11, 6496);1728;(1, 5, 26, 3, 1728);אחרי;1;3;ויחי מתושלח אחרי הולידו את למך שתים ושמונים שנה ושבע מאות שנה ויולד בנים ובנות
(65545, 81, 4);6;ו;6577;(1, 5, 27, 28, 6577);1748;(1, 5, 27, 8, 1748);ותשע;1;8;ויהיו כל ימי מתושלח תשע וששים שנה ותשע מאות שנה וימת
(65545, 81, 4);70;ע;6658;(1, 5, 29, 33, 6658);1769;(1, 5, 29, 9, 1769);ומעצבון;3;9;ויקרא את שמו נח לאמר זה ינחמנו ממעשנו ומעצבון ידינו מן האדמה אשר אררה יהוה
(65545, 81, 4);2;ב;6739;(1, 5, 30, 54, 6739);1790;(1, 5, 30, 15, 1790);ובנות;2;15;ויחי למך אחרי הולידו את נח חמש ותשעים שנה וחמש מאת שנה ויולד בנים ובנות
(65545, 81, 4);400;ת;6820;(1, 5, 32, 39, 6820);1815;(1, 5, 32, 14, 1815);יפת;3;14;ויהי נח בן חמש מאות שנה ויולד נח את שם את חם ואת יפת
(65545, 81, 4);10;י;6901;(1, 6, 2, 43, 6901);1838;(1, 6, 2, 12, 1838);נשים;3;12;ויראו בני האלהים את בנות האדם כי טבת הנה ויקחו להם נשים מכל אשר בחרו
(65545, 81, 4);90;ץ;6982;(1, 6, 4, 13, 6982);1859;(1, 6, 4, 3, 1859);בארץ;4;3;הנפלים היו בארץ בימים ההם וגם אחרי כן אשר יבאו בני האלהים אל בנות האדם וילדו להם המה הגברים אשר מעולם אנשי השם
(65545, 81, 4);5;ה;7063;(1, 6, 5, 6, 7063);1881;(1, 6, 5, 2, 1881);יהוה;2;2;וירא יהוה כי רבה רעת האדם בארץ וכל יצר מחשבת לבו רק רע כל היום
(65545, 81, 4);40;מ;7144;(1, 6, 7, 4, 7144);1905;(1, 6, 7, 1, 1905);ויאמר;4;1;ויאמר יהוה אמחה את האדם אשר בראתי מעל פני האדמה מאדם עד בהמה עד רמש ועד עוף השמים כי נחמתי כי עשיתם
(65545, 81, 4);8;ח;7225;(1, 6, 8, 7, 7225);1929;(1, 6, 8, 3, 1929);חן;1;3;ונח מצא חן בעיני יהוה
(65545, 81, 4);6;ו;7306;(1, 6, 10, 24, 7306);1953;(1, 6, 10, 9, 1953);ואת;1;9;ויולד נח שלשה בנים את שם את חם ואת יפת
(65545, 81, 4);5;ה;7387;(1, 6, 12, 45, 7387);1975;(1, 6, 12, 14, 1975);הארץ;1;14;וירא אלהים את הארץ והנה נשחתה כי השחית כל בשר את דרכו על הארץ
(65545, 81, 4);50;נ;7468;(1, 6, 14, 16, 7468);1998;(1, 6, 14, 6, 1998);קנים;2;6;עשה לך תבת עצי גפר קנים תעשה את התבה וכפרת אתה מבית ומחוץ בכפר
(65545, 81, 4);40;ם;7549;(1, 6, 15, 48, 7549);2019;(1, 6, 15, 13, 2019);ושלשים;6;13;וזה אשר תעשה אתה שלש מאות אמה ארך התבה חמשים אמה רחבה ושלשים אמה קומתה
(65545, 81, 4);2;ב;7630;(1, 6, 17, 10, 7630);2039;(1, 6, 17, 3, 2039);מביא;2;3;ואני הנני מביא את המבול מים על הארץ לשחת כל בשר אשר בו רוח חיים מתחת השמים כל אשר בארץ יגוע
(65545, 81, 4);400;ת;7711;(1, 6, 18, 20, 7711);2062;(1, 6, 18, 5, 2062);ובאת;4;5;והקמתי את בריתי אתך ובאת אל התבה אתה ובניך ואשתך ונשי בניך אתך
(65545, 81, 4);40;מ;7792;(1, 6, 20, 1, 7792);2085;(1, 6, 20, 1, 2085);מהעוף;1;1;מהעוף למינהו ומן הבהמה למינה מכל רמש האדמה למינהו שנים מכל יבאו אליך להחיות
(65545, 81, 4);1;א;7873;(1, 6, 21, 20, 7873);2105;(1, 6, 21, 7, 2105);יאכל;2;7;ואתה קח לך מכל מאכל אשר יאכל ואספת אליך והיה לך ולהם לאכלה
(65545, 81, 4);5;ה;7954;(1, 7, 1, 27, 7954);2129;(1, 7, 1, 9, 2129);התבה;1;9;ויאמר יהוה לנח בא אתה וכל ביתך אל התבה כי אתך ראיתי צדיק לפני בדור הזה
(65545, 81, 4);5;ה;8035;(1, 7, 2, 53, 8035);2151;(1, 7, 2, 15, 2151);הוא;1;15;מכל הבהמה הטהורה תקח לך שבעה שבעה איש ואשתו ומן הבהמה אשר לא טהרה הוא שנים איש ואשתו
(65545, 81, 4);9;ט;8116;(1, 7, 4, 21, 8116);2173;(1, 7, 4, 6, 2173);ממטיר;3;6;כי לימים עוד שבעה אנכי ממטיר על הארץ ארבעים יום וארבעים לילה ומחיתי את כל היקום אשר עשיתי מעל פני האדמה
(65545, 81, 4);6;ו;8197;(1, 7, 5, 19, 8197);2194;(1, 7, 5, 6, 2194);יהוה;3;6;ויעש נח ככל אשר צוהו יהוה
(65545, 81, 4);2;ב;8278;(1, 7, 8, 4, 8278);2218;(1, 7, 8, 2, 2218);הבהמה;2;2;מן הבהמה הטהורה ומן הבהמה אשר איננה טהרה ומן העוף וכל אשר רמש על האדמה
(65545, 81, 4);5;ה;8359;(1, 7, 9, 29, 8359);2240;(1, 7, 9, 9, 2240);ונקבה;5;9;שנים שנים באו אל נח אל התבה זכר ונקבה כאשר צוה אלהים את נח
(65545, 81, 4);300;ש;8440;(1, 7, 11, 34, 8440);2263;(1, 7, 11, 10, 2263);עשר;2;10;בשנת שש מאות שנה לחיי נח בחדש השני בשבעה עשר יום לחדש ביום הזה נבקעו כל מעינות תהום רבה וארבת השמים נפתחו
(65545, 81, 4);30;ל;8521;(1, 7, 12, 31, 8521);2283;(1, 7, 12, 8, 2283);לילה;1;8;ויהי הגשם על הארץ ארבעים יום וארבעים לילה
(65545, 81, 4);5;ה;8602;(1, 7, 14, 21, 8602);2307;(1, 7, 14, 6, 2307);הבהמה;3;6;המה וכל החיה למינה וכל הבהמה למינה וכל הרמש הרמש על הארץ למינהו וכל העוף למינהו כל צפור כל כנף
(65545, 81, 4);5;ה;8683;(1, 7, 15, 27, 8683);2330;(1, 7, 15, 9, 2330);הבשר;1;9;ויבאו אל נח אל התבה שנים שנים מכל הבשר אשר בו רוח חיים
(65545, 81, 4);40;ם;8764;(1, 7, 17, 15, 8764);2350;(1, 7, 17, 3, 2350);ארבעים;6;3;ויהי המבול ארבעים יום על הארץ וירבו המים וישאו את התבה ותרם מעל הארץ
(65545, 81, 4);40;ם;8845;(1, 7, 18, 41, 8845);2372;(1, 7, 18, 11, 2372);המים;4;11;ויגברו המים וירבו מאד על הארץ ותלך התבה על פני המים
(65545, 81, 4);6;ו;8926;(1, 7, 20, 29, 8926);2393;(1, 7, 20, 7, 2393);ויכסו;5;7;חמש עשרה אמה מלמעלה גברו המים ויכסו ההרים
(65545, 81, 4);40;ם;9007;(1, 7, 22, 16, 9007);2415;(1, 7, 22, 5, 2415);חיים;4;5;כל אשר נשמת רוח חיים באפיו מכל אשר בחרבה מתו
(65545, 81, 4);200;ר;9088;(1, 7, 23, 62, 9088);2439;(1, 7, 23, 19, 2439);הארץ;3;19;וימח את כל היקום אשר על פני האדמה מאדם עד בהמה עד רמש ועד עוף השמים וימחו מן הארץ וישאר אך נח ואשר אתו בתבה
(65545, 81, 4);40;מ;9169;(1, 8, 1, 32, 9169);2462;(1, 8, 1, 10, 2462);הבהמה;4;10;ויזכר אלהים את נח ואת כל החיה ואת כל הבהמה אשר אתו בתבה ויעבר אלהים רוח על הארץ וישכו המים
(65545, 81, 4);6;ו;9250;(1, 8, 3, 1, 9250);2482;(1, 8, 3, 1, 2482);וישבו;1;1;וישבו המים מעל הארץ הלוך ושוב ויחסרו המים מקצה חמשים ומאת יום
(65545, 81, 4);4;ד;9331;(1, 8, 4, 32, 9331);2501;(1, 8, 4, 8, 2501);לחדש;3;8;ותנח התבה בחדש השביעי בשבעה עשר יום לחדש על הרי אררט
(65545, 81, 4);6;ו;9412;(1, 8, 6, 15, 9412);2521;(1, 8, 6, 4, 2521);יום;2;4;ויהי מקץ ארבעים יום ויפתח נח את חלון התבה אשר עשה
(65545, 81, 4);30;ל;9493;(1, 8, 8, 17, 9493);2544;(1, 8, 8, 5, 2544);לראות;1;5;וישלח את היונה מאתו לראות הקלו המים מעל פני האדמה
(65545, 81, 4);8;ח;9574;(1, 8, 9, 58, 9574);2566;(1, 8, 9, 17, 2566);וישלח;5;17;ולא מצאה היונה מנוח לכף רגלה ותשב אליו אל התבה כי מים על פני כל הארץ וישלח ידו ויקחה ויבא אתה אליו אל התבה
(65545, 81, 4);400;ת;9655;(1, 8, 11, 16, 9655);2588;(1, 8, 11, 4, 2588);לעת;3;4;ותבא אליו היונה לעת ערב והנה עלה זית טרף בפיה וידע נח כי קלו המים מעל הארץ
(65545, 81, 4);80;פ;9736;(1, 8, 12, 39, 9736);2611;(1, 8, 12, 10, 2611);יספה;3;10;וייחל עוד שבעת ימים אחרים וישלח את היונה ולא יספה שוב אליו עוד
(65545, 81, 4);50;נ;9817;(1, 8, 13, 70, 9817);2633;(1, 8, 13, 19, 2633);והנה;3;19;ויהי באחת ושש מאות שנה בראשון באחד לחדש חרבו המים מעל הארץ ויסר נח את מכסה התבה וירא והנה חרבו פני האדמה
(65545, 81, 4);400;ת;9898;(1, 8, 16, 15, 9898);2654;(1, 8, 16, 5, 2654);ואשתך;4;5;צא מן התבה אתה ואשתך ובניך ונשי בניך אתך
