(130159, 80, 4);40;ם;230319;(4, 25, 4, 36, 230319);60770;(4, 25, 4, 11, 60770);אותם;4;11;ויאמר יהוה אל משה קח את כל ראשי העם והוקע אותם ליהוה נגד השמש וישב חרון אף יהוה מישראל
(130159, 80, 4);5;ה;230399;(4, 25, 6, 2, 230399);60790;(4, 25, 6, 1, 60790);והנה;2;1;והנה איש מבני ישראל בא ויקרב אל אחיו את המדינית לעיני משה ולעיני כל עדת בני ישראל והמה בכים פתח אהל מועד
(130159, 80, 4);70;ע;230479;(4, 25, 6, 82, 230479);60811;(4, 25, 6, 22, 60811);מועד;3;22;והנה איש מבני ישראל בא ויקרב אל אחיו את המדינית לעיני משה ולעיני כל עדת בני ישראל והמה בכים פתח אהל מועד
(130159, 80, 4);50;נ;230559;(4, 25, 8, 30, 230559);60833;(4, 25, 8, 9, 60833);שניהם;2;9;ויבא אחר איש ישראל אל הקבה וידקר את שניהם את איש ישראל ואת האשה אל קבתה ותעצר המגפה מעל בני ישראל
(130159, 80, 4);2;ב;230639;(4, 25, 10, 4, 230639);60852;(4, 25, 10, 1, 60852);וידבר;4;1;וידבר יהוה אל משה לאמר
(130159, 80, 4);10;י;230719;(4, 25, 11, 66, 230719);60874;(4, 25, 11, 18, 60874);כליתי;3;18;פינחס בן אלעזר בן אהרן הכהן השיב את חמתי מעל בני ישראל בקנאו את קנאתי בתוכם ולא כליתי את בני ישראל בקנאתי
(130159, 80, 4);200;ר;230799;(4, 25, 13, 36, 230799);60895;(4, 25, 13, 9, 60895);אשר;3;9;והיתה לו ולזרעו אחריו ברית כהנת עולם תחת אשר קנא לאלהיו ויכפר על בני ישראל
(130159, 80, 4);6;ו;230879;(4, 25, 15, 1, 230879);60917;(4, 25, 15, 1, 60917);ושם;1;1;ושם האשה המכה המדינית כזבי בת צור ראש אמות בית אב במדין הוא
(130159, 80, 4);20;כ;230959;(4, 25, 17, 16, 230959);60938;(4, 25, 17, 4, 60938);והכיתם;3;4;צרור את המדינים והכיתם אותם
(130159, 80, 4);3;ג;231039;(4, 25, 18, 73, 231039);60960;(4, 25, 18, 21, 60960);המגפה;3;21;כי צררים הם לכם בנכליהם אשר נכלו לכם על דבר פעור ועל דבר כזבי בת נשיא מדין אחתם המכה ביום המגפה על דבר פעור
(130159, 80, 4);1;א;231119;(4, 26, 2, 20, 231119);60983;(4, 26, 2, 7, 60983);ישראל;4;7;שאו את ראש כל עדת בני ישראל מבן עשרים שנה ומעלה לבית אבתם כל יצא צבא בישראל
(130159, 80, 4);30;ל;231199;(4, 26, 3, 41, 231199);61004;(4, 26, 3, 11, 61004);לאמר;1;11;וידבר משה ואלעזר הכהן אתם בערבת מואב על ירדן ירחו לאמר
(130159, 80, 4);2;ב;231279;(4, 26, 5, 21, 231279);61023;(4, 26, 5, 5, 61023);ראובן;4;5;ראובן בכור ישראל בני ראובן חנוך משפחת החנכי לפלוא משפחת הפלאי
(130159, 80, 4);5;ה;231359;(4, 26, 7, 18, 231359);61039;(4, 26, 7, 4, 61039);ויהיו;3;4;אלה משפחת הראובני ויהיו פקדיהם שלשה וארבעים אלף ושבע מאות ושלשים
(130159, 80, 4);6;ו;231439;(4, 26, 9, 31, 231439);61057;(4, 26, 9, 8, 61057);ואבירם;1;8;ובני אליאב נמואל ודתן ואבירם הוא דתן ואבירם קרואי העדה אשר הצו על משה ועל אהרן בעדת קרח בהצתם על יהוה
(130159, 80, 4);40;מ;231519;(4, 26, 10, 30, 231519);61079;(4, 26, 10, 9, 61079);במות;2;9;ותפתח הארץ את פיה ותבלע אתם ואת קרח במות העדה באכל האש את חמשים ומאתים איש ויהיו לנס
(130159, 80, 4);1;א;231599;(4, 26, 12, 31, 231599);61098;(4, 26, 12, 6, 61098);הנמואלי;5;6;בני שמעון למשפחתם לנמואל משפחת הנמואלי לימין משפחת הימיני ליכין משפחת היכיני
(130159, 80, 4);50;נ;231679;(4, 26, 14, 16, 231679);61114;(4, 26, 14, 4, 61114);שנים;2;4;אלה משפחת השמעני שנים ועשרים אלף ומאתים
(130159, 80, 4);300;ש;231759;(4, 26, 16, 7, 231759);61131;(4, 26, 16, 2, 61131);משפחת;2;2;לאזני משפחת האזני לערי משפחת הערי
(130159, 80, 4);40;ם;231839;(4, 26, 18, 26, 231839);61147;(4, 26, 18, 6, 61147);ארבעים;6;6;אלה משפחת בני גד לפקדיהם ארבעים אלף וחמש מאות
(130159, 80, 4);30;ל;231919;(4, 26, 20, 35, 231919);61167;(4, 26, 20, 8, 61167);לפרץ;1;8;ויהיו בני יהודה למשפחתם לשלה משפחת השלני לפרץ משפחת הפרצי לזרח משפחת הזרחי
(130159, 80, 4);5;ה;231999;(4, 26, 22, 10, 231999);61184;(4, 26, 22, 3, 61184);יהודה;2;3;אלה משפחת יהודה לפקדיהם ששה ושבעים אלף וחמש מאות
(130159, 80, 4);40;מ;232079;(4, 26, 24, 6, 232079);61201;(4, 26, 24, 2, 61201);משפחת;1;2;לישוב משפחת הישבי לשמרן משפחת השמרני
(130159, 80, 4);400;ת;232159;(4, 26, 26, 14, 232159);61217;(4, 26, 26, 3, 61217);למשפחתם;6;3;בני זבולן למשפחתם לסרד משפחת הסרדי לאלון משפחת האלני ליחלאל משפחת היחלאלי
(130159, 80, 4);40;מ;232239;(4, 26, 27, 32, 232239);61233;(4, 26, 27, 7, 61233);וחמש;3;7;אלה משפחת הזבולני לפקדיהם ששים אלף וחמש מאות
(130159, 80, 4);3;ג;232319;(4, 26, 29, 51, 232319);61251;(4, 26, 29, 12, 61251);הגלעדי;2;12;בני מנשה למכיר משפחת המכירי ומכיר הוליד את גלעד לגלעד משפחת הגלעדי
(130159, 80, 4);300;ש;232399;(4, 26, 32, 2, 232399);61267;(4, 26, 32, 1, 61267);ושמידע;2;1;ושמידע משפחת השמידעי וחפר משפחת החפרי
(130159, 80, 4);5;ה;232479;(4, 26, 33, 50, 232479);61287;(4, 26, 33, 15, 61287);ונעה;4;15;וצלפחד בן חפר לא היו לו בנים כי אם בנות ושם בנות צלפחד מחלה ונעה חגלה מלכה ותרצה
(130159, 80, 4);80;פ;232559;(4, 26, 35, 27, 232559);61305;(4, 26, 35, 6, 61305);משפחת;3;6;אלה בני אפרים למשפחתם לשותלח משפחת השתלחי לבכר משפחת הבכרי לתחן משפחת התחני
(130159, 80, 4);80;פ;232639;(4, 26, 37, 18, 232639);61323;(4, 26, 37, 5, 61323);לפקדיהם;2;5;אלה משפחת בני אפרים לפקדיהם שנים ושלשים אלף וחמש מאות אלה בני יוסף למשפחתם
(130159, 80, 4);80;פ;232719;(4, 26, 38, 37, 232719);61340;(4, 26, 38, 8, 61340);משפחת;3;8;בני בנימן למשפחתם לבלע משפחת הבלעי לאשבל משפחת האשבלי לאחירם משפחת האחירמי
(130159, 80, 4);300;ש;232799;(4, 26, 40, 21, 232799);61356;(4, 26, 40, 6, 61356);משפחת;2;6;ויהיו בני בלע ארד ונעמן משפחת הארדי לנעמן משפחת הנעמי
(130159, 80, 4);300;ש;232879;(4, 26, 42, 11, 232879);61374;(4, 26, 42, 4, 61374);למשפחתם;3;4;אלה בני דן למשפחתם לשוחם משפחת השוחמי אלה משפחת דן למשפחתם
(130159, 80, 4);2;ב;232959;(4, 26, 44, 1, 232959);61391;(4, 26, 44, 1, 61391);בני;1;1;בני אשר למשפחתם לימנה משפחת הימנה לישוי משפחת הישוי לבריעה משפחת הבריעי
(130159, 80, 4);2;ב;233039;(4, 26, 45, 21, 233039);61407;(4, 26, 45, 5, 61407);החברי;3;5;לבני בריעה לחבר משפחת החברי למלכיאל משפחת המלכיאלי
(130159, 80, 4);50;נ;233119;(4, 26, 48, 4, 233119);61426;(4, 26, 48, 2, 61426);נפתלי;1;2;בני נפתלי למשפחתם ליחצאל משפחת היחצאלי לגוני משפחת הגוני
(130159, 80, 4);400;ת;233199;(4, 26, 50, 8, 233199);61441;(4, 26, 50, 2, 61441);משפחת;5;2;אלה משפחת נפתלי למשפחתם ופקדיהם חמשה וארבעים אלף וארבע מאות
(130159, 80, 4);300;ש;233279;(4, 26, 51, 38, 233279);61460;(4, 26, 51, 11, 61460);ושלשים;2;11;אלה פקודי בני ישראל שש מאות אלף ואלף שבע מאות ושלשים
(130159, 80, 4);80;פ;233359;(4, 26, 54, 32, 233359);61479;(4, 26, 54, 8, 61479);לפי;2;8;לרב תרבה נחלתו ולמעט תמעיט נחלתו איש לפי פקדיו יתן נחלתו
(130159, 80, 4);5;ה;233439;(4, 26, 57, 4, 233439);61500;(4, 26, 57, 1, 61500);ואלה;4;1;ואלה פקודי הלוי למשפחתם לגרשון משפחת הגרשני לקהת משפחת הקהתי למררי משפחת המררי
(130159, 80, 4);30;ל;233519;(4, 26, 58, 18, 233519);61517;(4, 26, 58, 5, 61517);הלבני;2;5;אלה משפחת לוי משפחת הלבני משפחת החברני משפחת המחלי משפחת המושי משפחת הקרחי וקהת הולד את עמרם
(130159, 80, 4);300;ש;233599;(4, 26, 59, 22, 233599);61536;(4, 26, 59, 7, 61536);אשר;2;7;ושם אשת עמרם יוכבד בת לוי אשר ילדה אתה ללוי במצרים ותלד לעמרם את אהרן ואת משה ואת מרים אחתם
(130159, 80, 4);7;ז;233679;(4, 26, 60, 30, 233679);61557;(4, 26, 60, 8, 61557);אלעזר;4;8;ויולד לאהרן את נדב ואת אביהוא את אלעזר ואת איתמר
(130159, 80, 4);40;מ;233759;(4, 26, 62, 37, 233759);61577;(4, 26, 62, 10, 61577);ומעלה;2;10;ויהיו פקדיהם שלשה ועשרים אלף כל זכר מבן חדש ומעלה כי לא התפקדו בתוך בני ישראל כי לא נתן להם נחלה בתוך בני ישראל
(130159, 80, 4);1;א;233839;(4, 26, 63, 29, 233839);61599;(4, 26, 63, 8, 61599);את;1;8;אלה פקודי משה ואלעזר הכהן אשר פקדו את בני ישראל בערבת מואב על ירדן ירחו
(130159, 80, 4);2;ב;233919;(4, 26, 64, 52, 233919);61620;(4, 26, 64, 14, 61620);במדבר;4;14;ובאלה לא היה איש מפקודי משה ואהרן הכהן אשר פקדו את בני ישראל במדבר סיני
(130159, 80, 4);80;פ;233999;(4, 27, 1, 14, 233999);61643;(4, 27, 1, 3, 61643);צלפחד;3;3;ותקרבנה בנות צלפחד בן חפר בן גלעד בן מכיר בן מנשה למשפחת מנשה בן יוסף ואלה שמות בנתיו מחלה נעה וחגלה ומלכה ותרצה
(130159, 80, 4);40;מ;234079;(4, 27, 2, 4, 234079);61664;(4, 27, 2, 1, 61664);ותעמדנה;4;1;ותעמדנה לפני משה ולפני אלעזר הכהן ולפני הנשיאם וכל העדה פתח אהל מועד לאמר
(130159, 80, 4);6;ו;234159;(4, 27, 3, 24, 234159);61684;(4, 27, 3, 7, 61684);בתוך;3;7;אבינו מת במדבר והוא לא היה בתוך העדה הנועדים על יהוה בעדת קרח כי בחטאו מת ובנים לא היו לו
(130159, 80, 4);400;ת;234239;(4, 27, 4, 34, 234239);61708;(4, 27, 4, 11, 61708);תנה;1;11;למה יגרע שם אבינו מתוך משפחתו כי אין לו בן תנה לנו אחזה בתוך אחי אבינו
(130159, 80, 4);50;ן;234319;(4, 27, 7, 18, 234319);61729;(4, 27, 7, 5, 61729);נתן;3;5;כן בנות צלפחד דברת נתן תתן להם אחזת נחלה בתוך אחי אביהם והעברת את נחלת אביהן להן
(130159, 80, 4);50;ן;234399;(4, 27, 8, 34, 234399);61751;(4, 27, 8, 10, 61751);אין;3;10;ואל בני ישראל תדבר לאמר איש כי ימות ובן אין לו והעברתם את נחלתו לבתו
(130159, 80, 4);6;ו;234479;(4, 27, 11, 1, 234479);61774;(4, 27, 11, 1, 61774);ואם;1;1;ואם אין אחים לאביו ונתתם את נחלתו לשארו הקרב אליו ממשפחתו וירש אתה והיתה לבני ישראל לחקת משפט כאשר צוה יהוה את משה
(130159, 80, 4);90;צ;234559;(4, 27, 11, 81, 234559);61793;(4, 27, 11, 20, 61793);צוה;1;20;ואם אין אחים לאביו ונתתם את נחלתו לשארו הקרב אליו ממשפחתו וירש אתה והיתה לבני ישראל לחקת משפט כאשר צוה יהוה את משה
(130159, 80, 4);60;ס;234639;(4, 27, 13, 13, 234639);61815;(4, 27, 13, 3, 61815);ונאספת;4;3;וראיתה אתה ונאספת אל עמיך גם אתה כאשר נאסף אהרן אחיך
(130159, 80, 4);10;י;234719;(4, 27, 14, 51, 234719);61835;(4, 27, 14, 12, 61835);מי;2;12;כאשר מריתם פי במדבר צן במריבת העדה להקדישני במים לעיניהם הם מי מריבת קדש מדבר צן
(130159, 80, 4);200;ר;234799;(4, 27, 17, 16, 234799);61857;(4, 27, 17, 4, 61857);ואשר;4;4;אשר יצא לפניהם ואשר יבא לפניהם ואשר יוציאם ואשר יביאם ולא תהיה עדת יהוה כצאן אשר אין להם רעה
(130159, 80, 4);5;ה;234879;(4, 27, 18, 22, 234879);61880;(4, 27, 18, 8, 61880);יהושע;2;8;ויאמר יהוה אל משה קח לך את יהושע בן נון איש אשר רוח בו וסמכת את ידך עליו
(130159, 80, 4);10;י;234959;(4, 27, 19, 47, 234959);61901;(4, 27, 19, 11, 61901);לעיניהם;5;11;והעמדת אתו לפני אלעזר הכהן ולפני כל העדה וצויתה אתו לעיניהם
(130159, 80, 4);6;ו;235039;(4, 27, 21, 42, 235039);61920;(4, 27, 21, 10, 61920);יהוה;3;10;ולפני אלעזר הכהן יעמד ושאל לו במשפט האורים לפני יהוה על פיו יצאו ועל פיו יבאו הוא וכל בני ישראל אתו וכל העדה
(130159, 80, 4);40;מ;235119;(4, 27, 22, 36, 235119);61943;(4, 27, 22, 10, 61943);ויעמדהו;4;10;ויעש משה כאשר צוה יהוה אתו ויקח את יהושע ויעמדהו לפני אלעזר הכהן ולפני כל העדה
(130159, 80, 4);30;ל;235199;(4, 28, 1, 15, 235199);61964;(4, 28, 1, 5, 61964);לאמר;1;5;וידבר יהוה אל משה לאמר
(130159, 80, 4);5;ה;235279;(4, 28, 3, 14, 235279);61984;(4, 28, 3, 4, 61984);האשה;4;4;ואמרת להם זה האשה אשר תקריבו ליהוה כבשים בני שנה תמימם שנים ליום עלה תמיד
(130159, 80, 4);50;ן;235359;(4, 28, 4, 35, 235359);62005;(4, 28, 4, 10, 62005);בין;3;10;את הכבש אחד תעשה בבקר ואת הכבש השני תעשה בין הערבים
(130159, 80, 4);10;י;235439;(4, 28, 6, 32, 235439);62024;(4, 28, 6, 9, 62024);ליהוה;2;9;עלת תמיד העשיה בהר סיני לריח ניחח אשה ליהוה
(130159, 80, 4);60;ס;235519;(4, 28, 8, 37, 235519);62043;(4, 28, 8, 9, 62043);וכנסכו;4;9;ואת הכבש השני תעשה בין הערבים כמנחת הבקר וכנסכו תעשה אשה ריח ניחח ליהוה
(130159, 80, 4);6;ו;235599;(4, 28, 9, 59, 235599);62062;(4, 28, 9, 14, 62062);ונסכו;5;14;וביום השבת שני כבשים בני שנה תמימם ושני עשרנים סלת מנחה בלולה בשמן ונסכו
(130159, 80, 4);50;נ;235679;(4, 28, 11, 54, 235679);62082;(4, 28, 11, 13, 62082);בני;2;13;ובראשי חדשיכם תקריבו עלה ליהוה פרים בני בקר שנים ואיל אחד כבשים בני שנה שבעה תמימם
(130159, 80, 4);8;ח;235759;(4, 28, 12, 67, 235759);62101;(4, 28, 12, 16, 62101);האחד;3;16;ושלשה עשרנים סלת מנחה בלולה בשמן לפר האחד ושני עשרנים סלת מנחה בלולה בשמן לאיל האחד
(130159, 80, 4);400;ת;235839;(4, 28, 14, 27, 235839);62120;(4, 28, 14, 6, 62120);ושלישת;6;6;ונסכיהם חצי ההין יהיה לפר ושלישת ההין לאיל ורביעת ההין לכבש יין זאת עלת חדש בחדשו לחדשי השנה
(130159, 80, 4);4;ד;235919;(4, 28, 15, 32, 235919);62140;(4, 28, 15, 8, 62140);התמיד;5;8;ושעיר עזים אחד לחטאת ליהוה על עלת התמיד יעשה ונסכו
(130159, 80, 4);20;כ;235999;(4, 28, 17, 36, 235999);62160;(4, 28, 17, 10, 62160);יאכל;3;10;ובחמשה עשר יום לחדש הזה חג שבעת ימים מצות יאכל
(130159, 80, 4);20;כ;236079;(4, 28, 19, 45, 236079);62181;(4, 28, 19, 12, 62181);כבשים;1;12;והקרבתם אשה עלה ליהוה פרים בני בקר שנים ואיל אחד ושבעה כבשים בני שנה תמימם יהיו לכם
(130159, 80, 4);6;ו;236159;(4, 28, 21, 9, 236159);62199;(4, 28, 21, 2, 62199);עשרון;4;2;עשרון עשרון תעשה לכבש האחד לשבעת הכבשים
(130159, 80, 4);30;ל;236239;(4, 28, 24, 3, 236239);62219;(4, 28, 24, 1, 62219);כאלה;3;1;כאלה תעשו ליום שבעת ימים לחם אשה ריח ניחח ליהוה על עולת התמיד יעשה ונסכו
(130159, 80, 4);40;ם;236319;(4, 28, 25, 25, 236319);62239;(4, 28, 25, 6, 62239);לכם;3;6;וביום השביעי מקרא קדש יהיה לכם כל מלאכת עבדה לא תעשו
(130159, 80, 4);70;ע;236399;(4, 28, 26, 63, 236399);62258;(4, 28, 26, 14, 62258);עבדה;1;14;וביום הבכורים בהקריבכם מנחה חדשה ליהוה בשבעתיכם מקרא קדש יהיה לכם כל מלאכת עבדה לא תעשו
(130159, 80, 4);6;ו;236479;(4, 28, 28, 12, 236479);62278;(4, 28, 28, 3, 62278);בלולה;3;3;ומנחתם סלת בלולה בשמן שלשה עשרנים לפר האחד שני עשרנים לאיל האחד
(130159, 80, 4);4;ד;236559;(4, 28, 30, 11, 236559);62296;(4, 28, 30, 3, 62296);אחד;3;3;שעיר עזים אחד לכפר עליכם
(130159, 80, 4);5;ה;236639;(4, 29, 1, 30, 236639);62314;(4, 29, 1, 7, 62314);יהיה;4;7;ובחדש השביעי באחד לחדש מקרא קדש יהיה לכם כל מלאכת עבדה לא תעשו יום תרועה יהיה לכם
(130159, 80, 4);50;נ;236719;(4, 29, 2, 45, 236719);62337;(4, 29, 2, 13, 62337);בני;2;13;ועשיתם עלה לריח ניחח ליהוה פר בן בקר אחד איל אחד כבשים בני שנה שבעה תמימם
(130159, 80, 4);5;ה;236799;(4, 29, 4, 23, 236799);62356;(4, 29, 4, 6, 62356);הכבשים;1;6;ועשרון אחד לכבש האחד לשבעת הכבשים
(130159, 80, 4);50;נ;236879;(4, 29, 6, 50, 236879);62373;(4, 29, 6, 11, 62373);ניחח;1;11;מלבד עלת החדש ומנחתה ועלת התמיד ומנחתה ונסכיהם כמשפטם לריח ניחח אשה ליהוה
(130159, 80, 4);70;ע;236959;(4, 29, 8, 8, 236959);62392;(4, 29, 8, 2, 62392);עלה;1;2;והקרבתם עלה ליהוה ריח ניחח פר בן בקר אחד איל אחד כבשים בני שנה שבעה תמימם יהיו לכם
(130159, 80, 4);70;ע;237039;(4, 29, 9, 23, 237039);62414;(4, 29, 9, 6, 62414);עשרנים;1;6;ומנחתם סלת בלולה בשמן שלשה עשרנים לפר שני עשרנים לאיל האחד
(130159, 80, 4);80;פ;237119;(4, 29, 11, 26, 237119);62432;(4, 29, 11, 7, 62432);הכפרים;3;7;שעיר עזים אחד חטאת מלבד חטאת הכפרים ועלת התמיד ומנחתה ונסכיהם
(130159, 80, 4);8;ח;237199;(4, 29, 12, 55, 237199);62451;(4, 29, 12, 15, 62451);וחגתם;2;15;ובחמשה עשר יום לחדש השביעי מקרא קדש יהיה לכם כל מלאכת עבדה לא תעשו וחגתם חג ליהוה שבעת ימים
(130159, 80, 4);1;א;237279;(4, 29, 13, 62, 237279);62472;(4, 29, 13, 17, 62472);ארבעה;1;17;והקרבתם עלה אשה ריח ניחח ליהוה פרים בני בקר שלשה עשר אילם שנים כבשים בני שנה ארבעה עשר תמימם יהיו
(130159, 80, 4);4;ד;237359;(4, 29, 14, 64, 237359);62490;(4, 29, 14, 15, 62490);האחד;4;15;ומנחתם סלת בלולה בשמן שלשה עשרנים לפר האחד לשלשה עשר פרים שני עשרנים לאיל האחד לשני האילם
(130159, 80, 4);5;ה;237439;(4, 29, 16, 38, 237439);62508;(4, 29, 16, 9, 62508);ונסכה;5;9;ושעיר עזים אחד חטאת מלבד עלת התמיד מנחתה ונסכה
(130159, 80, 4);30;ל;237519;(4, 29, 18, 22, 237519);62527;(4, 29, 18, 4, 62527);לאילם;4;4;ומנחתם ונסכיהם לפרים לאילם ולכבשים במספרם כמשפט
(130159, 80, 4);70;ע;237599;(4, 29, 20, 20, 237599);62544;(4, 29, 20, 5, 62544);עשר;1;5;וביום השלישי פרים עשתי עשר אילם שנים כבשים בני שנה ארבעה עשר תמימם
(130159, 80, 4);200;ר;237679;(4, 29, 22, 5, 237679);62560;(4, 29, 22, 1, 62560);ושעיר;5;1;ושעיר חטאת אחד מלבד עלת התמיד ומנחתה ונסכה
(130159, 80, 4);40;מ;237759;(4, 29, 23, 50, 237759);62579;(4, 29, 23, 12, 62579);תמימם;4;12;וביום הרביעי פרים עשרה אילם שנים כבשים בני שנה ארבעה עשר תמימם
(130159, 80, 4);6;ו;237839;(4, 29, 26, 1, 237839);62596;(4, 29, 26, 1, 62596);וביום;1;1;וביום החמישי פרים תשעה אילם שנים כבשים בני שנה ארבעה עשר תמימם
(130159, 80, 4);40;ם;237919;(4, 29, 27, 30, 237919);62612;(4, 29, 27, 5, 62612);ולכבשים;7;5;ומנחתם ונסכיהם לפרים לאילם ולכבשים במספרם כמשפט
(130159, 80, 4);300;ש;237999;(4, 29, 29, 34, 237999);62631;(4, 29, 29, 9, 62631);שנה;1;9;וביום הששי פרים שמנה אילם שנים כבשים בני שנה ארבעה עשר תמימם
(130159, 80, 4);4;ד;238079;(4, 29, 31, 24, 238079);62647;(4, 29, 31, 6, 62647);התמיד;5;6;ושעיר חטאת אחד מלבד עלת התמיד מנחתה ונסכיה
(130159, 80, 4);30;ל;238159;(4, 29, 33, 18, 238159);62665;(4, 29, 33, 4, 62665);לאילם;1;4;ומנחתם ונסכהם לפרים לאילם ולכבשים במספרם כמשפטם
(130159, 80, 4);30;ל;238239;(4, 29, 35, 23, 238239);62682;(4, 29, 35, 6, 62682);כל;2;6;ביום השמיני עצרת תהיה לכם כל מלאכת עבדה לא תעשו
(130159, 80, 4);20;כ;238319;(4, 29, 37, 9, 238319);62703;(4, 29, 37, 2, 62703);ונסכיהם;4;2;מנחתם ונסכיהם לפר לאיל ולכבשים במספרם כמשפט
(130159, 80, 4);4;ד;238399;(4, 29, 39, 17, 238399);62720;(4, 29, 39, 4, 62720);במועדיכם;5;4;אלה תעשו ליהוה במועדיכם לבד מנדריכם ונדבתיכם לעלתיכם ולמנחתיכם ולנסכיכם ולשלמיכם
(130159, 80, 4);5;ה;238479;(4, 30, 1, 27, 238479);62735;(4, 30, 1, 8, 62735);צוה;3;8;ויאמר משה אל בני ישראל ככל אשר צוה יהוה את משה
(130159, 80, 4);300;ש;238559;(4, 30, 3, 23, 238559);62759;(4, 30, 3, 8, 62759);שבעה;1;8;איש כי ידר נדר ליהוה או השבע שבעה לאסר אסר על נפשו לא יחל דברו ככל היצא מפיו יעשה
(130159, 80, 4);6;ו;238639;(4, 30, 5, 1, 238639);62781;(4, 30, 5, 1, 62781);ושמע;1;1;ושמע אביה את נדרה ואסרה אשר אסרה על נפשה והחריש לה אביה וקמו כל נדריה וכל אסר אשר אסרה על נפשה יקום
(130159, 80, 4);40;ם;238719;(4, 30, 6, 3, 238719);62803;(4, 30, 6, 1, 62803);ואם;3;1;ואם הניא אביה אתה ביום שמעו כל נדריה ואסריה אשר אסרה על נפשה לא יקום ויהוה יסלח לה כי הניא אביה אתה
(130159, 80, 4);10;י;238799;(4, 30, 7, 5, 238799);62826;(4, 30, 7, 2, 62826);היו;2;2;ואם היו תהיה לאיש ונדריה עליה או מבטא שפתיה אשר אסרה על נפשה
(130159, 80, 4);200;ר;238879;(4, 30, 8, 37, 238879);62846;(4, 30, 8, 9, 62846);ואסרה;4;9;ושמע אישה ביום שמעו והחריש לה וקמו נדריה ואסרה אשר אסרה על נפשה יקמו
(130159, 80, 4);80;פ;238959;(4, 30, 9, 62, 238959);62869;(4, 30, 9, 18, 62869);נפשה;2;18;ואם ביום שמע אישה יניא אותה והפר את נדרה אשר עליה ואת מבטא שפתיה אשר אסרה על נפשה ויהוה יסלח לה
(130159, 80, 4);5;ה;239039;(4, 30, 11, 29, 239039);62891;(4, 30, 11, 9, 62891);נפשה;4;9;ואם בית אישה נדרה או אסרה אסר על נפשה בשבעה
(130159, 80, 4);2;ב;239119;(4, 30, 13, 17, 239119);62915;(4, 30, 13, 6, 62915);ביום;1;6;ואם הפר יפר אתם אישה ביום שמעו כל מוצא שפתיה לנדריה ולאסר נפשה לא יקום אישה הפרם ויהוה יסלח לה
(130159, 80, 4);300;ש;239199;(4, 30, 14, 22, 239199);62936;(4, 30, 14, 7, 62936);נפש;3;7;כל נדר וכל שבעת אסר לענת נפש אישה יקימנו ואישה יפרנו
(130159, 80, 4);5;ה;239279;(4, 30, 15, 60, 239279);62959;(4, 30, 15, 19, 62959);הקים;1;19;ואם החרש יחריש לה אישה מיום אל יום והקים את כל נדריה או את כל אסריה אשר עליה הקים אתם כי החרש לה ביום שמעו
(130159, 80, 4);10;י;239359;(4, 30, 17, 28, 239359);62983;(4, 30, 17, 9, 62983);איש;2;9;אלה החקים אשר צוה יהוה את משה בין איש לאשתו בין אב לבתו בנעריה בית אביה
(130159, 80, 4);30;ל;239439;(4, 31, 2, 34, 239439);63004;(4, 31, 2, 9, 63004);אל;2;9;נקם נקמת בני ישראל מאת המדינים אחר תאסף אל עמיך
(130159, 80, 4);9;ט;239519;(4, 31, 4, 13, 239519);63025;(4, 31, 4, 4, 63025);למטה;3;4;אלף למטה אלף למטה לכל מטות ישראל תשלחו לצבא
(130159, 80, 4);9;ט;239599;(4, 31, 6, 17, 239599);63045;(4, 31, 6, 5, 63045);למטה;3;5;וישלח אתם משה אלף למטה לצבא אתם ואת פינחס בן אלעזר הכהן לצבא וכלי הקדש וחצצרות התרועה בידו
(130159, 80, 4);1;א;239679;(4, 31, 7, 24, 239679);63065;(4, 31, 7, 7, 63065);את;1;7;ויצבאו על מדין כאשר צוה יהוה את משה ויהרגו כל זכר
