(126970, -93, 4);400;ת;150871;(3, 8, 2, 21, 150871);39793;(3, 8, 2, 7, 39793);ואת;3;7;קח את אהרן ואת בניו אתו ואת הבגדים ואת שמן המשחה ואת פר החטאת ואת שני האילים ואת סל המצות
(126970, -93, 4);1;א;150964;(3, 8, 4, 19, 150964);39820;(3, 8, 4, 6, 39820);אתו;1;6;ויעש משה כאשר צוה יהוה אתו ותקהל העדה אל פתח אהל מועד
(126970, -93, 4);10;י;151057;(3, 8, 7, 2, 151057);39846;(3, 8, 7, 1, 39846);ויתן;2;1;ויתן עליו את הכתנת ויחגר אתו באבנט וילבש אתו את המעיל ויתן עליו את האפד ויחגר אתו בחשב האפד ויאפד לו בו
(126970, -93, 4);300;ש;151150;(3, 8, 8, 13, 151150);39871;(3, 8, 8, 4, 39871);החשן;3;4;וישם עליו את החשן ויתן אל החשן את האורים ואת התמים
(126970, -93, 4);5;ה;151243;(3, 8, 9, 66, 151243);39897;(3, 8, 9, 19, 39897);יהוה;4;19;וישם את המצנפת על ראשו וישם על המצנפת אל מול פניו את ציץ הזהב נזר הקדש כאשר צוה יהוה את משה
(126970, -93, 4);30;ל;151336;(3, 8, 11, 41, 151336);39925;(3, 8, 11, 12, 39925);כליו;2;12;ויז ממנו על המזבח שבע פעמים וימשח את המזבח ואת כל כליו ואת הכיר ואת כנו לקדשם
(126970, -93, 4);50;נ;151429;(3, 8, 13, 38, 151429);39949;(3, 8, 13, 10, 39949);אבנט;3;10;ויקרב משה את בני אהרן וילבשם כתנת ויחגר אתם אבנט ויחבש להם מגבעות כאשר צוה יהוה את משה
(126970, -93, 4);4;ד;151522;(3, 8, 15, 16, 151522);39975;(3, 8, 15, 5, 39975);הדם;2;5;וישחט ויקח משה את הדם ויתן על קרנות המזבח סביב באצבעו ויחטא את המזבח ואת הדם יצק אל יסוד המזבח ויקדשהו לכפר עליו
(126970, -93, 4);100;ק;151615;(3, 8, 16, 19, 151615);40000;(3, 8, 16, 7, 40000);הקרב;2;7;ויקח את כל החלב אשר על הקרב ואת יתרת הכבד ואת שתי הכלית ואת חלבהן ויקטר משה המזבחה
(126970, -93, 4);6;ו;151708;(3, 8, 17, 47, 151708);40025;(3, 8, 17, 14, 40025);צוה;2;14;ואת הפר ואת ערו ואת בשרו ואת פרשו שרף באש מחוץ למחנה כאשר צוה יהוה את משה
(126970, -93, 4);400;ת;151801;(3, 8, 20, 9, 151801);40051;(3, 8, 20, 3, 40051);נתח;2;3;ואת האיל נתח לנתחיו ויקטר משה את הראש ואת הנתחים ואת הפדר
(126970, -93, 4);50;נ;151894;(3, 8, 21, 56, 151894);40076;(3, 8, 21, 16, 40076);ניחח;1;16;ואת הקרב ואת הכרעים רחץ במים ויקטר משה את כל האיל המזבחה עלה הוא לריח ניחח אשה הוא ליהוה כאשר צוה יהוה את משה
(126970, -93, 4);100;ק;151987;(3, 8, 23, 8, 151987);40100;(3, 8, 23, 2, 40100);ויקח;3;2;וישחט ויקח משה מדמו ויתן על תנוך אזן אהרן הימנית ועל בהן ידו הימנית ועל בהן רגלו הימנית
(126970, -93, 4);6;ו;152080;(3, 8, 24, 31, 152080);40126;(3, 8, 24, 10, 40126);תנוך;3;10;ויקרב את בני אהרן ויתן משה מן הדם על תנוך אזנם הימנית ועל בהן ידם הימנית ועל בהן רגלם הימנית ויזרק משה את הדם על המזבח סביב
(126970, -93, 4);2;ב;152173;(3, 8, 25, 27, 152173);40151;(3, 8, 25, 8, 40151);החלב;4;8;ויקח את החלב ואת האליה ואת כל החלב אשר על הקרב ואת יתרת הכבד ואת שתי הכלית ואת חלבהן ואת שוק הימין
(126970, -93, 4);1;א;152266;(3, 8, 26, 43, 152266);40178;(3, 8, 26, 13, 40178);אחת;1;13;ומסל המצות אשר לפני יהוה לקח חלת מצה אחת וחלת לחם שמן אחת ורקיק אחד וישם על החלבים ועל שוק הימין
(126970, -93, 4);70;ע;152359;(3, 8, 28, 12, 152359);40204;(3, 8, 28, 4, 40204);מעל;2;4;ויקח משה אתם מעל כפיהם ויקטר המזבחה על העלה מלאים הם לריח ניחח אשה הוא ליהוה
(126970, -93, 4);30;ל;152452;(3, 8, 29, 44, 152452);40227;(3, 8, 29, 11, 40227);למשה;1;11;ויקח משה את החזה ויניפהו תנופה לפני יהוה מאיל המלאים למשה היה למנה כאשר צוה יהוה את משה
(126970, -93, 4);1;א;152545;(3, 8, 30, 67, 152545);40254;(3, 8, 30, 20, 40254);אתו;1;20;ויקח משה משמן המשחה ומן הדם אשר על המזבח ויז על אהרן על בגדיו ועל בניו ועל בגדי בניו אתו ויקדש את אהרן את בגדיו ואת בניו ואת בגדי בניו אתו
(126970, -93, 4);6;ו;152638;(3, 8, 31, 52, 152638);40280;(3, 8, 31, 15, 40280);אתו;3;15;ויאמר משה אל אהרן ואל בניו בשלו את הבשר פתח אהל מועד ושם תאכלו אתו ואת הלחם אשר בסל המלאים כאשר צויתי לאמר אהרן ובניו יאכלהו
(126970, -93, 4);10;י;152731;(3, 8, 33, 23, 152731);40303;(3, 8, 33, 7, 40303);ימים;1;7;ומפתח אהל מועד לא תצאו שבעת ימים עד יום מלאת ימי מלאיכם כי שבעת ימים ימלא את ידכם
(126970, -93, 4);40;מ;152824;(3, 8, 35, 18, 152824);40328;(3, 8, 35, 5, 40328);יומם;3;5;ופתח אהל מועד תשבו יומם ולילה שבעת ימים ושמרתם את משמרת יהוה ולא תמותו כי כן צויתי
(126970, -93, 4);10;י;152917;(3, 9, 1, 6, 152917);40353;(3, 9, 1, 2, 40353);ביום;2;2;ויהי ביום השמיני קרא משה לאהרן ולבניו ולזקני ישראל
(126970, -93, 4);30;ל;153010;(3, 9, 3, 3, 153010);40376;(3, 9, 3, 1, 40376);ואל;3;1;ואל בני ישראל תדבר לאמר קחו שעיר עזים לחטאת ועגל וכבש בני שנה תמימם לעלה
(126970, -93, 4);300;ש;153103;(3, 9, 4, 38, 153103);40399;(3, 9, 4, 9, 40399);בשמן;2;9;ושור ואיל לשלמים לזבח לפני יהוה ומנחה בלולה בשמן כי היום יהוה נראה אליכם
(126970, -93, 4);90;צ;153196;(3, 9, 6, 18, 153196);40425;(3, 9, 6, 6, 40425);צוה;1;6;ויאמר משה זה הדבר אשר צוה יהוה תעשו וירא אליכם כבוד יהוה
(126970, -93, 4);2;ב;153289;(3, 9, 7, 66, 153289);40450;(3, 9, 7, 19, 40450);קרבן;3;19;ויאמר משה אל אהרן קרב אל המזבח ועשה את חטאתך ואת עלתך וכפר בעדך ובעד העם ועשה את קרבן העם וכפר בעדם כאשר צוה יהוה
(126970, -93, 4);4;ד;153382;(3, 9, 9, 34, 153382);40475;(3, 9, 9, 9, 40475);בדם;2;9;ויקרבו בני אהרן את הדם אליו ויטבל אצבעו בדם ויתן על קרנות המזבח ואת הדם יצק אל יסוד המזבח
(126970, -93, 4);5;ה;153475;(3, 9, 10, 56, 153475);40500;(3, 9, 10, 15, 40500);יהוה;2;15;ואת החלב ואת הכלית ואת היתרת מן הכבד מן החטאת הקטיר המזבחה כאשר צוה יהוה את משה
(126970, -93, 4);30;ל;153568;(3, 9, 13, 6, 153568);40525;(3, 9, 13, 2, 40525);העלה;3;2;ואת העלה המציאו אליו לנתחיה ואת הראש ויקטר על המזבח
(126970, -93, 4);400;ת;153661;(3, 9, 15, 20, 153661);40548;(3, 9, 15, 6, 40548);את;2;6;ויקרב את קרבן העם ויקח את שעיר החטאת אשר לעם וישחטהו ויחטאהו כראשון
(126970, -93, 4);40;מ;153754;(3, 9, 17, 37, 153754);40570;(3, 9, 17, 10, 40570);מלבד;1;10;ויקרב את המנחה וימלא כפו ממנה ויקטר על המזבח מלבד עלת הבקר
(126970, -93, 4);40;מ;153847;(3, 9, 19, 10, 153847);40594;(3, 9, 19, 3, 40594);מן;1;3;ואת החלבים מן השור ומן האיל האליה והמכסה והכלית ויתרת הכבד
(126970, -93, 4);40;מ;153940;(3, 9, 21, 17, 153940);40615;(3, 9, 21, 5, 40615);הימין;3;5;ואת החזות ואת שוק הימין הניף אהרן תנופה לפני יהוה כאשר צוה משה
(126970, -93, 4);200;ר;154033;(3, 9, 23, 11, 154033);40638;(3, 9, 23, 3, 40638);ואהרן;4;3;ויבא משה ואהרן אל אהל מועד ויצאו ויברכו את העם וירא כבוד יהוה אל כל העם
(126970, -93, 4);30;ל;154126;(3, 9, 24, 48, 154126);40664;(3, 9, 24, 13, 40664);כל;2;13;ותצא אש מלפני יהוה ותאכל על המזבח את העלה ואת החלבים וירא כל העם וירנו ויפלו על פניהם
(126970, -93, 4);200;ר;154219;(3, 10, 1, 73, 154219);40687;(3, 10, 1, 18, 40687);זרה;2;18;ויקחו בני אהרן נדב ואביהוא איש מחתתו ויתנו בהן אש וישימו עליה קטרת ויקריבו לפני יהוה אש זרה אשר לא צוה אתם
(126970, -93, 4);80;פ;154312;(3, 10, 3, 44, 154312);40713;(3, 10, 3, 13, 40713);פני;1;13;ויאמר משה אל אהרן הוא אשר דבר יהוה לאמר בקרבי אקדש ועל פני כל העם אכבד וידם אהרן
(126970, -93, 4);8;ח;154405;(3, 10, 4, 74, 154405);40739;(3, 10, 4, 21, 40739);מחוץ;2;21;ויקרא משה אל מישאל ואל אלצפן בני עזיאל דד אהרן ויאמר אלהם קרבו שאו את אחיכם מאת פני הקדש אל מחוץ למחנה
(126970, -93, 4);3;ג;154498;(3, 10, 6, 48, 154498);40760;(3, 10, 6, 11, 40760);ובגדיכם;3;11;ויאמר משה אל אהרן ולאלעזר ולאיתמר בניו ראשיכם אל תפרעו ובגדיכם לא תפרמו ולא תמתו ועל כל העדה יקצף ואחיכם כל בית ישראל יבכו את השרפה אשר שרף יהוה
(126970, -93, 4);20;כ;154591;(3, 10, 7, 25, 154591);40786;(3, 10, 7, 8, 40786);כי;1;8;ומפתח אהל מועד לא תצאו פן תמתו כי שמן משחת יהוה עליכם ויעשו כדבר משה
(126970, -93, 4);8;ח;154684;(3, 10, 9, 45, 154684);40812;(3, 10, 9, 14, 40812);חקת;1;14;יין ושכר אל תשת אתה ובניך אתך בבאכם אל אהל מועד ולא תמתו חקת עולם לדרתיכם
(126970, -93, 4);10;י;154777;(3, 10, 11, 42, 154777);40835;(3, 10, 11, 12, 40835);ביד;2;12;ולהורת את בני ישראל את כל החקים אשר דבר יהוה אליהם ביד משה
(126970, -93, 4);100;ק;154870;(3, 10, 12, 89, 154870);40859;(3, 10, 12, 23, 40859);קדשים;1;23;וידבר משה אל אהרן ואל אלעזר ואל איתמר בניו הנותרים קחו את המנחה הנותרת מאשי יהוה ואכלוה מצות אצל המזבח כי קדש קדשים הוא
(126970, -93, 4);5;ה;154963;(3, 10, 14, 36, 154963);40883;(3, 10, 14, 9, 40883);טהור;2;9;ואת חזה התנופה ואת שוק התרומה תאכלו במקום טהור אתה ובניך ובנתיך אתך כי חקך וחק בניך נתנו מזבחי שלמי בני ישראל
(126970, -93, 4);400;ת;155056;(3, 10, 15, 41, 155056);40906;(3, 10, 15, 10, 40906);תנופה;1;10;שוק התרומה וחזה התנופה על אשי החלבים יביאו להניף תנופה לפני יהוה והיה לך ולבניך אתך לחק עולם כאשר צוה יהוה
(126970, -93, 4);200;ר;155149;(3, 10, 16, 48, 155149);40930;(3, 10, 16, 13, 40930);איתמר;5;13;ואת שעיר החטאת דרש דרש משה והנה שרף ויקצף על אלעזר ועל איתמר בני אהרן הנותרם לאמר
(126970, -93, 4);10;י;155242;(3, 10, 17, 76, 155242);40955;(3, 10, 17, 21, 40955);לפני;4;21;מדוע לא אכלתם את החטאת במקום הקדש כי קדש קדשים הוא ואתה נתן לכם לשאת את עון העדה לכפר עליהם לפני יהוה
(126970, -93, 4);40;ם;155335;(3, 10, 19, 40, 155335);40981;(3, 10, 19, 11, 40981);עלתם;4;11;וידבר אהרן אל משה הן היום הקריבו את חטאתם ואת עלתם לפני יהוה ותקראנה אתי כאלה ואכלתי חטאת היום הייטב בעיני יהוה
(126970, -93, 4);40;מ;155428;(3, 11, 1, 24, 155428);41003;(3, 11, 1, 7, 41003);לאמר;3;7;וידבר יהוה אל משה ואל אהרן לאמר אלהם
(126970, -93, 4);5;ה;155521;(3, 11, 3, 38, 155521);41028;(3, 11, 3, 10, 41028);אתה;3;10;כל מפרסת פרסה ושסעת שסע פרסת מעלת גרה בבהמה אתה תאכלו
(126970, -93, 4);30;ל;155614;(3, 11, 5, 12, 155614);41054;(3, 11, 5, 4, 41054);מעלה;3;4;ואת השפן כי מעלה גרה הוא ופרסה לא יפריס טמא הוא לכם
(126970, -93, 4);6;ו;155707;(3, 11, 7, 21, 155707);41080;(3, 11, 7, 6, 41080);הוא;2;6;ואת החזיר כי מפריס פרסה הוא ושסע שסע פרסה והוא גרה לא יגר טמא הוא לכם
(126970, -93, 4);30;ל;155800;(3, 11, 9, 25, 155800);41108;(3, 11, 9, 9, 41108);לו;1;9;את זה תאכלו מכל אשר במים כל אשר לו סנפיר וקשקשת במים בימים ובנחלים אתם תאכלו
(126970, -93, 4);300;ש;155893;(3, 11, 10, 57, 155893);41130;(3, 11, 10, 15, 41130);אשר;2;15;וכל אשר אין לו סנפיר וקשקשת בימים ובנחלים מכל שרץ המים ומכל נפש החיה אשר במים שקץ הם לכם
(126970, -93, 4);90;צ;155986;(3, 11, 13, 10, 155986);41156;(3, 11, 13, 3, 41156);תשקצו;4;3;ואת אלה תשקצו מן העוף לא יאכלו שקץ הם את הנשר ואת הפרס ואת העזניה
(126970, -93, 4);400;ת;156079;(3, 11, 16, 21, 156079);41183;(3, 11, 16, 6, 41183);ואת;3;6;ואת בת היענה ואת התחמס ואת השחף ואת הנץ למינהו
(126970, -93, 4);1;א;156172;(3, 11, 19, 31, 156172);41206;(3, 11, 19, 7, 41206);ואת;2;7;ואת החסידה האנפה למינה ואת הדוכיפת ואת העטלף
(126970, -93, 4);70;ע;156265;(3, 11, 21, 59, 156265);41234;(3, 11, 21, 18, 41234);על;1;18;אך את זה תאכלו מכל שרץ העוף ההלך על ארבע אשר לא כרעים ממעל לרגליו לנתר בהן על הארץ
(126970, -93, 4);30;ל;156358;(3, 11, 23, 22, 156358);41258;(3, 11, 23, 7, 41258);רגלים;3;7;וכל שרץ העוף אשר לו ארבע רגלים שקץ הוא לכם
(126970, -93, 4);60;ס;156451;(3, 11, 26, 18, 156451);41282;(3, 11, 26, 5, 41282);מפרסת;4;5;לכל הבהמה אשר הוא מפרסת פרסה ושסע איננה שסעת וגרה איננה מעלה טמאים הם לכם כל הנגע בהם יטמא
(126970, -93, 4);30;ל;156544;(3, 11, 27, 39, 156544);41308;(3, 11, 27, 12, 41308);לכם;1;12;וכל הולך על כפיו בכל החיה ההלכת על ארבע טמאים הם לכם כל הנגע בנבלתם יטמא עד הערב
(126970, -93, 4);30;ל;156637;(3, 11, 29, 27, 156637);41333;(3, 11, 29, 8, 41333);החלד;3;8;וזה לכם הטמא בשרץ השרץ על הארץ החלד והעכבר והצב למינהו
(126970, -93, 4);200;ר;156730;(3, 11, 32, 6, 156730);41355;(3, 11, 32, 2, 41355);אשר;3;2;וכל אשר יפל עליו מהם במתם יטמא מכל כלי עץ או בגד או עור או שק כל כלי אשר יעשה מלאכה בהם במים יובא וטמא עד הערב וטהר
(126970, -93, 4);300;ש;156823;(3, 11, 33, 11, 156823);41385;(3, 11, 33, 4, 41385);אשר;2;4;וכל כלי חרש אשר יפל מהם אל תוכו כל אשר בתוכו יטמא ואתו תשברו
(126970, -93, 4);6;ו;156916;(3, 11, 35, 1, 156916);41412;(3, 11, 35, 1, 41412);וכל;1;1;וכל אשר יפל מנבלתם עליו יטמא תנור וכירים יתץ טמאים הם וטמאים יהיו לכם
(126970, -93, 4);40;מ;157009;(3, 11, 36, 38, 157009);41435;(3, 11, 36, 10, 41435);יטמא;3;10;אך מעין ובור מקוה מים יהיה טהור ונגע בנבלתם יטמא
(126970, -93, 4);5;ה;157102;(3, 11, 39, 18, 157102);41463;(3, 11, 39, 6, 41463);היא;1;6;וכי ימות מן הבהמה אשר היא לכם לאכלה הנגע בנבלתה יטמא עד הערב
(126970, -93, 4);20;כ;157195;(3, 11, 41, 2, 157195);41486;(3, 11, 41, 1, 41486);וכל;2;1;וכל השרץ השרץ על הארץ שקץ הוא לא יאכל
(126970, -93, 4);300;ש;157288;(3, 11, 42, 66, 157288);41515;(3, 11, 42, 21, 41515);שקץ;1;21;כל הולך על גחון וכל הולך על ארבע עד כל מרבה רגלים לכל השרץ השרץ על הארץ לא תאכלום כי שקץ הם
(126970, -93, 4);10;י;157381;(3, 11, 44, 43, 157381);41538;(3, 11, 44, 10, 41538);אני;3;10;כי אני יהוה אלהיכם והתקדשתם והייתם קדשים כי קדוש אני ולא תטמאו את נפשתיכם בכל השרץ הרמש על הארץ
(126970, -93, 4);50;נ;157474;(3, 11, 45, 59, 157474);41562;(3, 11, 45, 15, 41562);אני;2;15;כי אני יהוה המעלה אתכם מארץ מצרים להית לכם לאלהים והייתם קדשים כי קדוש אני
(126970, -93, 4);10;י;157567;(3, 11, 47, 38, 157567);41585;(3, 11, 47, 9, 41585);ובין;3;9;להבדיל בין הטמא ובין הטהר ובין החיה הנאכלת ובין החיה אשר לא תאכל
(126970, -93, 4);9;ט;157660;(3, 12, 2, 61, 157660);41611;(3, 12, 2, 17, 41611);תטמא;2;17;דבר אל בני ישראל לאמר אשה כי תזריע וילדה זכר וטמאה שבעת ימים כימי נדת דותה תטמא
(126970, -93, 4);1;א;157753;(3, 12, 5, 2, 157753);41636;(3, 12, 5, 1, 41636);ואם;2;1;ואם נקבה תלד וטמאה שבעים כנדתה וששים יום וששת ימים תשב על דמי טהרה
(126970, -93, 4);10;י;157846;(3, 12, 6, 42, 157846);41662;(3, 12, 6, 13, 41662);יונה;1;13;ובמלאת ימי טהרה לבן או לבת תביא כבש בן שנתו לעלה ובן יונה או תר לחטאת אל פתח אהל מועד אל הכהן
(126970, -93, 4);30;ל;157939;(3, 12, 8, 4, 157939);41687;(3, 12, 8, 2, 41687);לא;1;2;ואם לא תמצא ידה די שה ולקחה שתי תרים או שני בני יונה אחד לעלה ואחד לחטאת וכפר עליה הכהן וטהרה
(126970, -93, 4);40;מ;158032;(3, 13, 1, 24, 158032);41713;(3, 13, 1, 7, 41713);לאמר;3;7;וידבר יהוה אל משה ואל אהרן לאמר
(126970, -93, 4);5;ה;158125;(3, 13, 3, 7, 158125);41739;(3, 13, 3, 2, 41739);הכהן;3;2;וראה הכהן את הנגע בעור הבשר ושער בנגע הפך לבן ומראה הנגע עמק מעור בשרו נגע צרעת הוא וראהו הכהן וטמא אתו
(126970, -93, 4);200;ר;158218;(3, 13, 4, 18, 158218);41764;(3, 13, 4, 5, 41764);בעור;4;5;ואם בהרת לבנה הוא בעור בשרו ועמק אין מראה מן העור ושערה לא הפך לבן והסגיר הכהן את הנגע שבעת ימים
(126970, -93, 4);10;י;158311;(3, 13, 5, 35, 158311);41788;(3, 13, 5, 8, 41788);בעיניו;5;8;וראהו הכהן ביום השביעי והנה הנגע עמד בעיניו לא פשה הנגע בעור והסגירו הכהן שבעת ימים שנית
(126970, -93, 4);5;ה;158404;(3, 13, 6, 56, 158404);41812;(3, 13, 6, 15, 41812);הכהן;1;15;וראה הכהן אתו ביום השביעי שנית והנה כהה הנגע ולא פשה הנגע בעור וטהרו הכהן מספחת הוא וכבס בגדיו וטהר
(126970, -93, 4);80;פ;158497;(3, 13, 8, 13, 158497);41835;(3, 13, 8, 4, 41835);פשתה;1;4;וראה הכהן והנה פשתה המספחת בעור וטמאו הכהן צרעת הוא
(126970, -93, 4);2;ב;158590;(3, 13, 10, 36, 158590);41859;(3, 13, 10, 10, 41859);לבן;2;10;וראה הכהן והנה שאת לבנה בעור והיא הפכה שער לבן ומחית בשר חי בשאת
(126970, -93, 4);20;כ;158683;(3, 13, 12, 33, 158683);41884;(3, 13, 12, 9, 41884);כל;1;9;ואם פרוח תפרח הצרעת בעור וכסתה הצרעת את כל עור הנגע מראשו ועד רגליו לכל מראה עיני הכהן
(126970, -93, 4);2;ב;158776;(3, 13, 14, 2, 158776);41910;(3, 13, 14, 1, 41910);וביום;2;1;וביום הראות בו בשר חי יטמא
(126970, -93, 4);5;ה;158869;(3, 13, 16, 32, 158869);41937;(3, 13, 16, 10, 41937);הכהן;3;10;או כי ישוב הבשר החי ונהפך ללבן ובא אל הכהן
(126970, -93, 4);5;ה;158962;(3, 13, 19, 21, 158962);41961;(3, 13, 19, 5, 41961);לבנה;4;5;והיה במקום השחין שאת לבנה או בהרת לבנה אדמדמת ונראה אל הכהן
(126970, -93, 4);1;א;159055;(3, 13, 21, 2, 159055);41986;(3, 13, 21, 1, 41986);ואם;2;1;ואם יראנה הכהן והנה אין בה שער לבן ושפלה איננה מן העור והיא כהה והסגירו הכהן שבעת ימים
(126970, -93, 4);50;נ;159148;(3, 13, 22, 26, 159148);42011;(3, 13, 22, 8, 42011);נגע;1;8;ואם פשה תפשה בעור וטמא הכהן אתו נגע הוא
(126970, -93, 4);1;א;159241;(3, 13, 24, 44, 159241);42036;(3, 13, 24, 13, 42036);אדמדמת;1;13;או בשר כי יהיה בערו מכות אש והיתה מחית המכוה בהרת לבנה אדמדמת או לבנה
(126970, -93, 4);6;ו;159334;(3, 13, 26, 1, 159334);42061;(3, 13, 26, 1, 42061);ואם;1;1;ואם יראנה הכהן והנה אין בבהרת שער לבן ושפלה איננה מן העור והוא כהה והסגירו הכהן שבעת ימים
(126970, -93, 4);80;פ;159427;(3, 13, 27, 22, 159427);42084;(3, 13, 27, 6, 42084);פשה;1;6;וראהו הכהן ביום השביעי אם פשה תפשה בעור וטמא הכהן אתו נגע צרעת הוא
(126970, -93, 4);40;מ;159520;(3, 13, 28, 62, 159520);42109;(3, 13, 28, 17, 42109);המכוה;2;17;ואם תחתיה תעמד הבהרת לא פשתה בעור והוא כהה שאת המכוה הוא וטהרו הכהן כי צרבת המכוה הוא
(126970, -93, 4);100;ק;159613;(3, 13, 30, 57, 159613);42137;(3, 13, 30, 17, 42137);נתק;3;17;וראה הכהן את הנגע והנה מראהו עמק מן העור ובו שער צהב דק וטמא אתו הכהן נתק הוא צרעת הראש או הזקן הוא
(126970, -93, 4);300;ש;159706;(3, 13, 31, 73, 159706);42165;(3, 13, 31, 22, 42165);שבעת;1;22;וכי יראה הכהן את נגע הנתק והנה אין מראהו עמק מן העור ושער שחר אין בו והסגיר הכהן את נגע הנתק שבעת ימים
(126970, -93, 4);30;ל;159799;(3, 13, 33, 14, 159799);42191;(3, 13, 33, 4, 42191);לא;1;4;והתגלח ואת הנתק לא יגלח והסגיר הכהן את הנתק שבעת ימים שנית
(126970, -93, 4);6;ו;159892;(3, 13, 34, 60, 159892);42215;(3, 13, 34, 16, 42215);העור;3;16;וראה הכהן את הנתק ביום השביעי והנה לא פשה הנתק בעור ומראהו איננו עמק מן העור וטהר אתו הכהן וכבס בגדיו וטהר
(126970, -93, 4);5;ה;159985;(3, 13, 36, 41, 159985);42239;(3, 13, 36, 11, 42239);הצהב;3;11;וראהו הכהן והנה פשה הנתק בעור לא יבקר הכהן לשער הצהב טמא הוא
(126970, -93, 4);50;נ;160078;(3, 13, 38, 34, 160078);42265;(3, 13, 38, 10, 42265);לבנת;3;10;ואיש או אשה כי יהיה בעור בשרם בהרת בהרת לבנת
(126970, -93, 4);40;מ;160171;(3, 13, 41, 13, 160171);42291;(3, 13, 41, 4, 42291);ימרט;2;4;ואם מפאת פניו ימרט ראשו גבח הוא טהור הוא
(126970, -93, 4);5;ה;160264;(3, 13, 43, 19, 160264);42316;(3, 13, 43, 6, 42316);הנגע;1;6;וראה אתו הכהן והנה שאת הנגע לבנה אדמדמת בקרחתו או בגבחתו כמראה צרעת עור בשר
(126970, -93, 4);50;נ;160357;(3, 13, 45, 13, 160357);42339;(3, 13, 45, 4, 42339);הנגע;2;4;והצרוע אשר בו הנגע בגדיו יהיו פרמים וראשו יהיה פרוע ועל שפם יעטה וטמא טמא יקרא
(126970, -93, 4);2;ב;160450;(3, 13, 46, 43, 160450);42364;(3, 13, 46, 13, 42364);מושבו;4;13;כל ימי אשר הנגע בו יטמא טמא הוא בדד ישב מחוץ למחנה מושבו
(126970, -93, 4);200;ר;160543;(3, 13, 49, 12, 160543);42390;(3, 13, 49, 3, 42390);ירקרק;4;3;והיה הנגע ירקרק או אדמדם בבגד או בעור או בשתי או בערב או בכל כלי עור נגע צרעת הוא והראה את הכהן
(126970, -93, 4);10;י;160636;(3, 13, 50, 31, 160636);42418;(3, 13, 50, 9, 42418);ימים;1;9;וראה הכהן את הנגע והסגיר את הנגע שבעת ימים
(126970, -93, 4);1;א;160729;(3, 13, 51, 90, 160729);42443;(3, 13, 51, 25, 42443);הוא;3;25;וראה את הנגע ביום השביעי כי פשה הנגע בבגד או בשתי או בערב או בעור לכל אשר יעשה העור למלאכה צרעת ממארת הנגע טמא הוא
(126970, -93, 4);5;ה;160822;(3, 13, 53, 8, 160822);42473;(3, 13, 53, 3, 42473);הכהן;1;3;ואם יראה הכהן והנה לא פשה הנגע בבגד או בשתי או בערב או בכל כלי עור
(126970, -93, 4);5;ה;160915;(3, 13, 55, 7, 160915);42499;(3, 13, 55, 2, 42499);הכהן;3;2;וראה הכהן אחרי הכבס את הנגע והנה לא הפך הנגע את עינו והנגע לא פשה טמא הוא באש תשרפנו פחתת הוא בקרחתו או בגבחתו
(126970, -93, 4);50;נ;161008;(3, 13, 56, 13, 161008);42525;(3, 13, 56, 4, 42525);והנה;3;4;ואם ראה הכהן והנה כהה הנגע אחרי הכבס אתו וקרע אתו מן הבגד או מן העור או מן השתי או מן הערב
