(164051, -94, 4);5;ה;151455;(3, 8, 13, 64, 151455);39955;(3, 8, 13, 16, 39955);יהוה;4;16;ויקרב משה את בני אהרן וילבשם כתנת ויחגר אתם אבנט ויחבש להם מגבעות כאשר צוה יהוה את משה
(164051, -94, 4);6;ו;151549;(3, 8, 15, 43, 151549);39981;(3, 8, 15, 11, 39981);באצבעו;6;11;וישחט ויקח משה את הדם ויתן על קרנות המזבח סביב באצבעו ויחטא את המזבח ואת הדם יצק אל יסוד המזבח ויקדשהו לכפר עליו
(164051, -94, 4);8;ח;151643;(3, 8, 16, 47, 151643);40008;(3, 8, 16, 15, 40008);חלבהן;1;15;ויקח את כל החלב אשר על הקרב ואת יתרת הכבד ואת שתי הכלית ואת חלבהן ויקטר משה המזבחה
(164051, -94, 4);20;כ;151737;(3, 8, 18, 19, 151737);40033;(3, 8, 18, 5, 40033);ויסמכו;5;5;ויקרב את איל העלה ויסמכו אהרן ובניו את ידיהם על ראש האיל
(164051, -94, 4);40;ם;151831;(3, 8, 20, 39, 151831);40058;(3, 8, 20, 10, 40058);הנתחים;6;10;ואת האיל נתח לנתחיו ויקטר משה את הראש ואת הנתחים ואת הפדר
(164051, -94, 4);6;ו;151925;(3, 8, 22, 1, 151925);40085;(3, 8, 22, 1, 40085);ויקרב;1;1;ויקרב את האיל השני איל המלאים ויסמכו אהרן ובניו את ידיהם על ראש האיל
(164051, -94, 4);6;ו;152019;(3, 8, 23, 40, 152019);40109;(3, 8, 23, 11, 40109);ועל;1;11;וישחט ויקח משה מדמו ויתן על תנוך אזן אהרן הימנית ועל בהן ידו הימנית ועל בהן רגלו הימנית
(164051, -94, 4);200;ר;152113;(3, 8, 24, 64, 152113);40135;(3, 8, 24, 19, 40135);רגלם;1;19;ויקרב את בני אהרן ויתן משה מן הדם על תנוך אזנם הימנית ועל בהן ידם הימנית ועל בהן רגלם הימנית ויזרק משה את הדם על המזבח סביב
(164051, -94, 4);400;ת;152207;(3, 8, 25, 61, 152207);40161;(3, 8, 25, 18, 40161);ואת;3;18;ויקח את החלב ואת האליה ואת כל החלב אשר על הקרב ואת יתרת הכבד ואת שתי הכלית ואת חלבהן ואת שוק הימין
(164051, -94, 4);10;י;152301;(3, 8, 27, 2, 152301);40187;(3, 8, 27, 1, 40187);ויתן;2;1;ויתן את הכל על כפי אהרן ועל כפי בניו וינף אתם תנופה לפני יהוה
(164051, -94, 4);10;י;152395;(3, 8, 28, 48, 152395);40213;(3, 8, 28, 13, 40213);ניחח;2;13;ויקח משה אתם מעל כפיהם ויקטר המזבחה על העלה מלאים הם לריח ניחח אשה הוא ליהוה
(164051, -94, 4);50;ן;152489;(3, 8, 30, 11, 152489);40237;(3, 8, 30, 3, 40237);משמן;4;3;ויקח משה משמן המשחה ומן הדם אשר על המזבח ויז על אהרן על בגדיו ועל בניו ועל בגדי בניו אתו ויקדש את אהרן את בגדיו ואת בניו ואת בגדי בניו אתו
(164051, -94, 4);6;ו;152583;(3, 8, 30, 105, 152583);40264;(3, 8, 30, 30, 40264);בניו;4;30;ויקח משה משמן המשחה ומן הדם אשר על המזבח ויז על אהרן על בגדיו ועל בניו ועל בגדי בניו אתו ויקדש את אהרן את בגדיו ואת בניו ואת בגדי בניו אתו
(164051, -94, 4);50;נ;152677;(3, 8, 31, 91, 152677);40290;(3, 8, 31, 25, 40290);ובניו;3;25;ויאמר משה אל אהרן ואל בניו בשלו את הבשר פתח אהל מועד ושם תאכלו אתו ואת הלחם אשר בסל המלאים כאשר צויתי לאמר אהרן ובניו יאכלהו
(164051, -94, 4);20;כ;152771;(3, 8, 33, 63, 152771);40314;(3, 8, 33, 18, 40314);ידכם;3;18;ומפתח אהל מועד לא תצאו שבעת ימים עד יום מלאת ימי מלאיכם כי שבעת ימים ימלא את ידכם
(164051, -94, 4);10;י;152865;(3, 8, 35, 59, 152865);40338;(3, 8, 35, 15, 40338);כי;2;15;ופתח אהל מועד תשבו יומם ולילה שבעת ימים ושמרתם את משמרת יהוה ולא תמותו כי כן צויתי
(164051, -94, 4);1;א;152959;(3, 9, 2, 6, 152959);40362;(3, 9, 2, 2, 40362);אל;1;2;ויאמר אל אהרן קח לך עגל בן בקר לחטאת ואיל לעלה תמימם והקרב לפני יהוה
(164051, -94, 4);10;י;153053;(3, 9, 3, 46, 153053);40387;(3, 9, 3, 12, 40387);בני;3;12;ואל בני ישראל תדבר לאמר קחו שעיר עזים לחטאת ועגל וכבש בני שנה תמימם לעלה
(164051, -94, 4);5;ה;153147;(3, 9, 5, 23, 153147);40412;(3, 9, 5, 8, 40412);אהל;2;8;ויקחו את אשר צוה משה אל פני אהל מועד ויקרבו כל העדה ויעמדו לפני יהוה
(164051, -94, 4);1;א;153241;(3, 9, 7, 18, 153241);40437;(3, 9, 7, 6, 40437);אל;1;6;ויאמר משה אל אהרן קרב אל המזבח ועשה את חטאתך ואת עלתך וכפר בעדך ובעד העם ועשה את קרבן העם וכפר בעדם כאשר צוה יהוה
(164051, -94, 4);400;ת;153335;(3, 9, 8, 23, 153335);40462;(3, 9, 8, 6, 40462);את;2;6;ויקרב אהרן אל המזבח וישחט את עגל החטאת אשר לו
(164051, -94, 4);400;ת;153429;(3, 9, 10, 10, 153429);40488;(3, 9, 10, 3, 40488);ואת;3;3;ואת החלב ואת הכלית ואת היתרת מן הכבד מן החטאת הקטיר המזבחה כאשר צוה יהוה את משה
(164051, -94, 4);6;ו;153523;(3, 9, 12, 12, 153523);40514;(3, 9, 12, 4, 40514);וימצאו;1;4;וישחט את העלה וימצאו בני אהרן אליו את הדם ויזרקהו על המזבח סביב
(164051, -94, 4);1;א;153617;(3, 9, 14, 13, 153617);40537;(3, 9, 14, 4, 40537);ואת;2;4;וירחץ את הקרב ואת הכרעים ויקטר על העלה המזבחה
(164051, -94, 4);300;ש;153711;(3, 9, 16, 15, 153711);40559;(3, 9, 16, 4, 40559);ויעשה;4;4;ויקרב את העלה ויעשה כמשפט
(164051, -94, 4);50;נ;153805;(3, 9, 18, 41, 153805);40583;(3, 9, 18, 11, 40583);בני;2;11;וישחט את השור ואת האיל זבח השלמים אשר לעם וימצאו בני אהרן את הדם אליו ויזרקהו על המזבח סביב
(164051, -94, 4);40;ם;153899;(3, 9, 20, 14, 153899);40605;(3, 9, 20, 3, 40605);החלבים;6;3;וישימו את החלבים על החזות ויקטר החלבים המזבחה
(164051, -94, 4);10;י;153993;(3, 9, 22, 20, 153993);40630;(3, 9, 22, 7, 40630);ויברכם;2;7;וישא אהרן את ידו אל העם ויברכם וירד מעשת החטאת והעלה והשלמים
(164051, -94, 4);80;פ;154087;(3, 9, 24, 9, 154087);40654;(3, 9, 24, 3, 40654);מלפני;3;3;ותצא אש מלפני יהוה ותאכל על המזבח את העלה ואת החלבים וירא כל העם וירנו ויפלו על פניהם
(164051, -94, 4);6;ו;154181;(3, 10, 1, 35, 154181);40677;(3, 10, 1, 8, 40677);ויתנו;5;8;ויקחו בני אהרן נדב ואביהוא איש מחתתו ויתנו בהן אש וישימו עליה קטרת ויקריבו לפני יהוה אש זרה אשר לא צוה אתם
(164051, -94, 4);300;ש;154275;(3, 10, 3, 7, 154275);40702;(3, 10, 3, 2, 40702);משה;2;2;ויאמר משה אל אהרן הוא אשר דבר יהוה לאמר בקרבי אקדש ועל פני כל העם אכבד וידם אהרן
(164051, -94, 4);6;ו;154369;(3, 10, 4, 38, 154369);40729;(3, 10, 4, 11, 40729);ויאמר;1;11;ויקרא משה אל מישאל ואל אלצפן בני עזיאל דד אהרן ויאמר אלהם קרבו שאו את אחיכם מאת פני הקדש אל מחוץ למחנה
(164051, -94, 4);200;ר;154463;(3, 10, 6, 13, 154463);40753;(3, 10, 6, 4, 40753);אהרן;3;4;ויאמר משה אל אהרן ולאלעזר ולאיתמר בניו ראשיכם אל תפרעו ובגדיכם לא תפרמו ולא תמתו ועל כל העדה יקצף ואחיכם כל בית ישראל יבכו את השרפה אשר שרף יהוה
(164051, -94, 4);1;א;154557;(3, 10, 6, 107, 154557);40776;(3, 10, 6, 27, 40776);אשר;1;27;ויאמר משה אל אהרן ולאלעזר ולאיתמר בניו ראשיכם אל תפרעו ובגדיכם לא תפרמו ולא תמתו ועל כל העדה יקצף ואחיכם כל בית ישראל יבכו את השרפה אשר שרף יהוה
(164051, -94, 4);400;ת;154651;(3, 10, 9, 12, 154651);40802;(3, 10, 9, 4, 40802);תשת;3;4;יין ושכר אל תשת אתה ובניך אתך בבאכם אל אהל מועד ולא תמתו חקת עולם לדרתיכם
(164051, -94, 4);50;נ;154745;(3, 10, 11, 10, 154745);40826;(3, 10, 11, 3, 40826);בני;2;3;ולהורת את בני ישראל את כל החקים אשר דבר יהוה אליהם ביד משה
(164051, -94, 4);40;מ;154839;(3, 10, 12, 58, 154839);40851;(3, 10, 12, 15, 40851);מאשי;1;15;וידבר משה אל אהרן ואל אלעזר ואל איתמר בניו הנותרים קחו את המנחה הנותרת מאשי יהוה ואכלוה מצות אצל המזבח כי קדש קדשים הוא
(164051, -94, 4);5;ה;154933;(3, 10, 14, 6, 154933);40876;(3, 10, 14, 2, 40876);חזה;3;2;ואת חזה התנופה ואת שוק התרומה תאכלו במקום טהור אתה ובניך ובנתיך אתך כי חקך וחק בניך נתנו מזבחי שלמי בני ישראל
(164051, -94, 4);7;ז;155027;(3, 10, 15, 12, 155027);40899;(3, 10, 15, 3, 40899);וחזה;3;3;שוק התרומה וחזה התנופה על אשי החלבים יביאו להניף תנופה לפני יהוה והיה לך ולבניך אתך לחק עולם כאשר צוה יהוה
(164051, -94, 4);300;ש;155121;(3, 10, 16, 20, 155121);40923;(3, 10, 16, 6, 40923);משה;2;6;ואת שעיר החטאת דרש דרש משה והנה שרף ויקצף על אלעזר ועל איתמר בני אהרן הנותרם לאמר
(164051, -94, 4);20;כ;155215;(3, 10, 17, 49, 155215);40948;(3, 10, 17, 14, 40948);לכם;2;14;מדוע לא אכלתם את החטאת במקום הקדש כי קדש קדשים הוא ואתה נתן לכם לשאת את עון העדה לכפר עליהם לפני יהוה
(164051, -94, 4);5;ה;155309;(3, 10, 19, 14, 155309);40974;(3, 10, 19, 4, 40974);משה;3;4;וידבר אהרן אל משה הן היום הקריבו את חטאתם ואת עלתם לפני יהוה ותקראנה אתי כאלה ואכלתי חטאת היום הייטב בעיני יהוה
(164051, -94, 4);10;י;155403;(3, 10, 20, 18, 155403);40996;(3, 10, 20, 4, 40996);בעיניו;5;4;וישמע משה וייטב בעיניו
(164051, -94, 4);60;ס;155497;(3, 11, 3, 14, 155497);41022;(3, 11, 3, 4, 41022);ושסעת;3;4;כל מפרסת פרסה ושסעת שסע פרסת מעלת גרה בבהמה אתה תאכלו
(164051, -94, 4);200;ר;155591;(3, 11, 4, 65, 155591);41047;(3, 11, 4, 18, 41047);מפריס;3;18;אך את זה לא תאכלו ממעלי הגרה וממפרסי הפרסה את הגמל כי מעלה גרה הוא ופרסה איננו מפריס טמא הוא לכם
(164051, -94, 4);20;כ;155685;(3, 11, 6, 43, 155685);41074;(3, 11, 6, 12, 41074);לכם;2;12;ואת הארנבת כי מעלת גרה הוא ופרסה לא הפריסה טמאה הוא לכם
(164051, -94, 4);5;ה;155779;(3, 11, 9, 4, 155779);41101;(3, 11, 9, 2, 41101);זה;2;2;את זה תאכלו מכל אשר במים כל אשר לו סנפיר וקשקשת במים בימים ובנחלים אתם תאכלו
(164051, -94, 4);30;ל;155873;(3, 11, 10, 37, 155873);41124;(3, 11, 10, 9, 41124);מכל;3;9;וכל אשר אין לו סנפיר וקשקשת בימים ובנחלים מכל שרץ המים ומכל נפש החיה אשר במים שקץ הם לכם
(164051, -94, 4);40;ם;155967;(3, 11, 12, 25, 155967);41150;(3, 11, 12, 7, 41150);במים;4;7;כל אשר אין לו סנפיר וקשקשת במים שקץ הוא לכם
(164051, -94, 4);400;ת;156061;(3, 11, 16, 3, 156061);41178;(3, 11, 16, 1, 41178);ואת;3;1;ואת בת היענה ואת התחמס ואת השחף ואת הנץ למינהו
(164051, -94, 4);5;ה;156155;(3, 11, 19, 14, 156155);41202;(3, 11, 19, 3, 41202);האנפה;5;3;ואת החסידה האנפה למינה ואת הדוכיפת ואת העטלף
(164051, -94, 4);40;מ;156249;(3, 11, 21, 43, 156249);41230;(3, 11, 21, 14, 41230);ממעל;2;14;אך את זה תאכלו מכל שרץ העוף ההלך על ארבע אשר לא כרעים ממעל לרגליו לנתר בהן על הארץ
(164051, -94, 4);5;ה;156343;(3, 11, 23, 7, 156343);41254;(3, 11, 23, 3, 41254);העוף;1;3;וכל שרץ העוף אשר לו ארבע רגלים שקץ הוא לכם
(164051, -94, 4);5;ה;156437;(3, 11, 26, 4, 156437);41279;(3, 11, 26, 2, 41279);הבהמה;1;2;לכל הבהמה אשר הוא מפרסת פרסה ושסע איננה שסעת וגרה איננה מעלה טמאים הם לכם כל הנגע בהם יטמא
(164051, -94, 4);70;ע;156531;(3, 11, 27, 26, 156531);41304;(3, 11, 27, 8, 41304);על;1;8;וכל הולך על כפיו בכל החיה ההלכת על ארבע טמאים הם לכם כל הנגע בנבלתם יטמא עד הערב
(164051, -94, 4);5;ה;156625;(3, 11, 29, 15, 156625);41330;(3, 11, 29, 5, 41330);השרץ;1;5;וזה לכם הטמא בשרץ השרץ על הארץ החלד והעכבר והצב למינהו
(164051, -94, 4);70;ע;156719;(3, 11, 31, 37, 156719);41352;(3, 11, 31, 11, 41352);עד;1;11;אלה הטמאים לכם בכל השרץ כל הנגע בהם במתם יטמא עד הערב
(164051, -94, 4);6;ו;156813;(3, 11, 33, 1, 156813);41382;(3, 11, 33, 1, 41382);וכל;1;1;וכל כלי חרש אשר יפל מהם אל תוכו כל אשר בתוכו יטמא ואתו תשברו
(164051, -94, 4);20;כ;156907;(3, 11, 34, 48, 156907);41409;(3, 11, 34, 14, 41409);בכל;2;14;מכל האכל אשר יאכל אשר יבוא עליו מים יטמא וכל משקה אשר ישתה בכל כלי יטמא
(164051, -94, 4);2;ב;157001;(3, 11, 36, 30, 157001);41434;(3, 11, 36, 9, 41434);בנבלתם;1;9;אך מעין ובור מקוה מים יהיה טהור ונגע בנבלתם יטמא
(164051, -94, 4);2;ב;157095;(3, 11, 39, 11, 157095);41461;(3, 11, 39, 4, 41461);הבהמה;2;4;וכי ימות מן הבהמה אשר היא לכם לאכלה הנגע בנבלתה יטמא עד הערב
(164051, -94, 4);4;ד;157189;(3, 11, 40, 57, 157189);41484;(3, 11, 40, 14, 41484);עד;2;14;והאכל מנבלתה יכבס בגדיו וטמא עד הערב והנשא את נבלתה יכבס בגדיו וטמא עד הערב
(164051, -94, 4);30;ל;157283;(3, 11, 42, 61, 157283);41513;(3, 11, 42, 19, 41513);תאכלום;4;19;כל הולך על גחון וכל הולך על ארבע עד כל מרבה רגלים לכל השרץ השרץ על הארץ לא תאכלום כי שקץ הם
(164051, -94, 4);6;ו;157377;(3, 11, 44, 39, 157377);41537;(3, 11, 44, 9, 41537);קדוש;3;9;כי אני יהוה אלהיכם והתקדשתם והייתם קדשים כי קדוש אני ולא תטמאו את נפשתיכם בכל השרץ הרמש על הארץ
(164051, -94, 4);6;ו;157471;(3, 11, 45, 56, 157471);41561;(3, 11, 45, 14, 41561);קדוש;3;14;כי אני יהוה המעלה אתכם מארץ מצרים להית לכם לאלהים והייתם קדשים כי קדוש אני
(164051, -94, 4);6;ו;157565;(3, 11, 47, 36, 157565);41585;(3, 11, 47, 9, 41585);ובין;1;9;להבדיל בין הטמא ובין הטהר ובין החיה הנאכלת ובין החיה אשר לא תאכל
(164051, -94, 4);400;ת;157659;(3, 12, 2, 60, 157659);41611;(3, 12, 2, 17, 41611);תטמא;1;17;דבר אל בני ישראל לאמר אשה כי תזריע וילדה זכר וטמאה שבעת ימים כימי נדת דותה תטמא
(164051, -94, 4);1;א;157753;(3, 12, 5, 2, 157753);41636;(3, 12, 5, 1, 41636);ואם;2;1;ואם נקבה תלד וטמאה שבעים כנדתה וששים יום וששת ימים תשב על דמי טהרה
(164051, -94, 4);6;ו;157847;(3, 12, 6, 43, 157847);41662;(3, 12, 6, 13, 41662);יונה;2;13;ובמלאת ימי טהרה לבן או לבת תביא כבש בן שנתו לעלה ובן יונה או תר לחטאת אל פתח אהל מועד אל הכהן
(164051, -94, 4);400;ת;157941;(3, 12, 8, 6, 157941);41688;(3, 12, 8, 3, 41688);תמצא;1;3;ואם לא תמצא ידה די שה ולקחה שתי תרים או שני בני יונה אחד לעלה ואחד לחטאת וכפר עליה הכהן וטהרה
(164051, -94, 4);4;ד;158035;(3, 13, 2, 2, 158035);41714;(3, 13, 2, 1, 41714);אדם;2;1;אדם כי יהיה בעור בשרו שאת או ספחת או בהרת והיה בעור בשרו לנגע צרעת והובא אל אהרן הכהן או אל אחד מבניו הכהנים
(164051, -94, 4);5;ה;158129;(3, 13, 3, 11, 158129);41741;(3, 13, 3, 4, 41741);הנגע;1;4;וראה הכהן את הנגע בעור הבשר ושער בנגע הפך לבן ומראה הנגע עמק מעור בשרו נגע צרעת הוא וראהו הכהן וטמא אתו
(164051, -94, 4);6;ו;158223;(3, 13, 4, 23, 158223);41766;(3, 13, 4, 7, 41766);ועמק;1;7;ואם בהרת לבנה הוא בעור בשרו ועמק אין מראה מן העור ושערה לא הפך לבן והסגיר הכהן את הנגע שבעת ימים
(164051, -94, 4);5;ה;158317;(3, 13, 5, 41, 158317);41790;(3, 13, 5, 10, 41790);פשה;3;10;וראהו הכהן ביום השביעי והנה הנגע עמד בעיניו לא פשה הנגע בעור והסגירו הכהן שבעת ימים שנית
(164051, -94, 4);8;ח;158411;(3, 13, 6, 63, 158411);41813;(3, 13, 6, 16, 41813);מספחת;4;16;וראה הכהן אתו ביום השביעי שנית והנה כהה הנגע ולא פשה הנגע בעור וטהרו הכהן מספחת הוא וכבס בגדיו וטהר
(164051, -94, 4);8;ח;158505;(3, 13, 8, 21, 158505);41836;(3, 13, 8, 5, 41836);המספחת;5;5;וראה הכהן והנה פשתה המספחת בעור וטמאו הכהן צרעת הוא
(164051, -94, 4);200;ר;158599;(3, 13, 10, 45, 158599);41861;(3, 13, 10, 12, 41861);בשר;3;12;וראה הכהן והנה שאת לבנה בעור והיא הפכה שער לבן ומחית בשר חי בשאת
(164051, -94, 4);200;ר;158693;(3, 13, 12, 43, 158693);41887;(3, 13, 12, 12, 41887);מראשו;2;12;ואם פרוח תפרח הצרעת בעור וכסתה הצרעת את כל עור הנגע מראשו ועד רגליו לכל מראה עיני הכהן
(164051, -94, 4);2;ב;158787;(3, 13, 14, 13, 158787);41913;(3, 13, 14, 4, 41913);בשר;1;4;וביום הראות בו בשר חי יטמא
(164051, -94, 4);5;ה;158881;(3, 13, 17, 11, 158881);41940;(3, 13, 17, 3, 41940);והנה;2;3;וראהו הכהן והנה נהפך הנגע ללבן וטהר הכהן את הנגע טהור הוא
(164051, -94, 4);40;מ;158975;(3, 13, 19, 34, 158975);41965;(3, 13, 19, 9, 41965);אדמדמת;3;9;והיה במקום השחין שאת לבנה או בהרת לבנה אדמדמת ונראה אל הכהן
(164051, -94, 4);5;ה;159069;(3, 13, 21, 16, 159069);41989;(3, 13, 21, 4, 41989);והנה;4;4;ואם יראנה הכהן והנה אין בה שער לבן ושפלה איננה מן העור והיא כהה והסגירו הכהן שבעת ימים
(164051, -94, 4);70;ע;159163;(3, 13, 23, 10, 159163);42015;(3, 13, 23, 3, 42015);תעמד;2;3;ואם תחתיה תעמד הבהרת לא פשתה צרבת השחין הוא וטהרו הכהן
(164051, -94, 4);1;א;159257;(3, 13, 25, 5, 159257);42040;(3, 13, 25, 2, 42040);אתה;1;2;וראה אתה הכהן והנה נהפך שער לבן בבהרת ומראה עמק מן העור צרעת הוא במכוה פרחה וטמא אתו הכהן נגע צרעת הוא
(164051, -94, 4);10;י;159351;(3, 13, 26, 18, 159351);42065;(3, 13, 26, 5, 42065);אין;2;5;ואם יראנה הכהן והנה אין בבהרת שער לבן ושפלה איננה מן העור והוא כהה והסגירו הכהן שבעת ימים
(164051, -94, 4);50;ן;159445;(3, 13, 27, 40, 159445);42088;(3, 13, 27, 10, 42088);הכהן;4;10;וראהו הכהן ביום השביעי אם פשה תפשה בעור וטמא הכהן אתו נגע צרעת הוא
(164051, -94, 4);5;ה;159539;(3, 13, 29, 13, 159539);42115;(3, 13, 29, 5, 42115);יהיה;2;5;ואיש או אשה כי יהיה בו נגע בראש או בזקן
(164051, -94, 4);1;א;159633;(3, 13, 30, 77, 159633);42143;(3, 13, 30, 23, 42143);הוא;3;23;וראה הכהן את הנגע והנה מראהו עמק מן העור ובו שער צהב דק וטמא אתו הכהן נתק הוא צרעת הראש או הזקן הוא
(164051, -94, 4);70;ע;159727;(3, 13, 32, 14, 159727);42170;(3, 13, 32, 4, 42170);הנגע;4;4;וראה הכהן את הנגע ביום השביעי והנה לא פשה הנתק ולא היה בו שער צהב ומראה הנתק אין עמק מן העור
(164051, -94, 4);300;ש;159821;(3, 13, 33, 36, 159821);42197;(3, 13, 33, 10, 42197);שבעת;1;10;והתגלח ואת הנתק לא יגלח והסגיר הכהן את הנתק שבעת ימים שנית
(164051, -94, 4);9;ט;159915;(3, 13, 34, 83, 159915);42221;(3, 13, 34, 22, 42221);וטהר;2;22;וראה הכהן את הנתק ביום השביעי והנה לא פשה הנתק בעור ומראהו איננו עמק מן העור וטהר אתו הכהן וכבס בגדיו וטהר
(164051, -94, 4);6;ו;160009;(3, 13, 37, 17, 160009);42246;(3, 13, 37, 5, 42246);ושער;1;5;ואם בעיניו עמד הנתק ושער שחר צמח בו נרפא הנתק טהור הוא וטהרו הכהן
(164051, -94, 4);400;ת;160103;(3, 13, 39, 24, 160103);42271;(3, 13, 39, 6, 42271);בהרת;4;6;וראה הכהן והנה בעור בשרם בהרת כהות לבנת בהק הוא פרח בעור טהור הוא
(164051, -94, 4);5;ה;160197;(3, 13, 42, 7, 160197);42298;(3, 13, 42, 2, 42298);יהיה;4;2;וכי יהיה בקרחת או בגבחת נגע לבן אדמדם צרעת פרחת הוא בקרחתו או בגבחתו
(164051, -94, 4);6;ו;160291;(3, 13, 43, 46, 160291);42321;(3, 13, 43, 11, 42321);בגבחתו;6;11;וראה אתו הכהן והנה שאת הנגע לבנה אדמדמת בקרחתו או בגבחתו כמראה צרעת עור בשר
(164051, -94, 4);6;ו;160385;(3, 13, 45, 41, 160385);42345;(3, 13, 45, 10, 42345);פרוע;3;10;והצרוע אשר בו הנגע בגדיו יהיו פרמים וראשו יהיה פרוע ועל שפם יעטה וטמא טמא יקרא
(164051, -94, 4);1;א;160479;(3, 13, 47, 28, 160479);42373;(3, 13, 47, 9, 42373);או;1;9;והבגד כי יהיה בו נגע צרעת בבגד צמר או בבגד פשתים
(164051, -94, 4);2;ב;160573;(3, 13, 49, 42, 160573);42399;(3, 13, 49, 12, 42399);בערב;4;12;והיה הנגע ירקרק או אדמדם בבגד או בעור או בשתי או בערב או בכל כלי עור נגע צרעת הוא והראה את הכהן
(164051, -94, 4);3;ג;160667;(3, 13, 51, 28, 160667);42426;(3, 13, 51, 8, 42426);הנגע;3;8;וראה את הנגע ביום השביעי כי פשה הנגע בבגד או בשתי או בערב או בעור לכל אשר יעשה העור למלאכה צרעת ממארת הנגע טמא הוא
(164051, -94, 4);6;ו;160761;(3, 13, 52, 32, 160761);42454;(3, 13, 52, 11, 42454);או;2;11;ושרף את הבגד או את השתי או את הערב בצמר או בפשתים או את כל כלי העור אשר יהיה בו הנגע כי צרעת ממארת הוא באש תשרף
(164051, -94, 4);1;א;160855;(3, 13, 53, 41, 160855);42483;(3, 13, 53, 13, 42483);או;1;13;ואם יראה הכהן והנה לא פשה הנגע בבגד או בשתי או בערב או בכל כלי עור
(164051, -94, 4);6;ו;160949;(3, 13, 55, 41, 160949);42509;(3, 13, 55, 12, 42509);עינו;4;12;וראה הכהן אחרי הכבס את הנגע והנה לא הפך הנגע את עינו והנגע לא פשה טמא הוא באש תשרפנו פחתת הוא בקרחתו או בגבחתו
(164051, -94, 4);40;מ;161043;(3, 13, 56, 48, 161043);42536;(3, 13, 56, 15, 42536);מן;1;15;ואם ראה הכהן והנה כהה הנגע אחרי הכבס אתו וקרע אתו מן הבגד או מן העור או מן השתי או מן הערב
(164051, -94, 4);300;ש;161137;(3, 13, 58, 9, 161137);42566;(3, 13, 58, 3, 42566);השתי;2;3;והבגד או השתי או הערב או כל כלי העור אשר תכבס וסר מהם הנגע וכבס שנית וטהר
(164051, -94, 4);20;כ;161231;(3, 13, 59, 46, 161231);42595;(3, 13, 59, 15, 42595);כלי;1;15;זאת תורת נגע צרעת בגד הצמר או הפשתים או השתי או הערב או כל כלי עור לטהרו או לטמאו
(164051, -94, 4);5;ה;161325;(3, 14, 3, 23, 161325);42619;(3, 14, 3, 6, 42619);וראה;4;6;ויצא הכהן אל מחוץ למחנה וראה הכהן והנה נרפא נגע הצרעת מן הצרוע
(164051, -94, 4);400;ת;161419;(3, 14, 5, 14, 161419);42643;(3, 14, 5, 4, 42643);את;2;4;וצוה הכהן ושחט את הצפור האחת אל כלי חרש על מים חיים
(164051, -94, 4);90;צ;161513;(3, 14, 6, 68, 161513);42671;(3, 14, 6, 20, 42671);הצפר;2;20;את הצפר החיה יקח אתה ואת עץ הארז ואת שני התולעת ואת האזב וטבל אותם ואת הצפר החיה בדם הצפר השחטה על המים החיים
(164051, -94, 4);400;ת;161607;(3, 14, 8, 22, 161607);42696;(3, 14, 8, 6, 42696);את;2;6;וכבס המטהר את בגדיו וגלח את כל שערו ורחץ במים וטהר ואחר יבוא אל המחנה וישב מחוץ לאהלו שבעת ימים
