(6634, 92, 4);6;ו;224766;(4, 21, 26, 46, 224766);59261;(4, 21, 26, 12, 59261);הראשון;5;12;כי חשבון עיר סיחן מלך האמרי הוא והוא נלחם במלך מואב הראשון ויקח את כל ארצו מידו עד ארנן
(6634, 92, 4);1;א;224858;(4, 21, 28, 28, 224858);59286;(4, 21, 28, 8, 59286);אכלה;1;8;כי אש יצאה מחשבון להבה מקרית סיחן אכלה ער מואב בעלי במות ארנן
(6634, 92, 4);4;ד;224950;(4, 21, 30, 16, 224950);59310;(4, 21, 30, 5, 59310);דיבן;1;5;ונירם אבד חשבון עד דיבן ונשים עד נפח אשר עד מידבא
(6634, 92, 4);6;ו;225042;(4, 21, 33, 5, 225042);59333;(4, 21, 33, 1, 59333);ויפנו;5;1;ויפנו ויעלו דרך הבשן ויצא עוג מלך הבשן לקראתם הוא וכל עמו למלחמה אדרעי
(6634, 92, 4);20;כ;225134;(4, 21, 34, 40, 225134);59359;(4, 21, 34, 13, 59359);כל;1;13;ויאמר יהוה אל משה אל תירא אתו כי בידך נתתי אתו ואת כל עמו ואת ארצו ועשית לו כאשר עשית לסיחן מלך האמרי אשר יושב בחשבון
(6634, 92, 4);6;ו;225226;(4, 21, 35, 40, 225226);59385;(4, 21, 35, 13, 59385);ויירשו;1;13;ויכו אתו ואת בניו ואת כל עמו עד בלתי השאיר לו שריד ויירשו את ארצו
(6634, 92, 4);1;א;225318;(4, 22, 3, 7, 225318);59408;(4, 22, 3, 2, 59408);מואב;3;2;ויגר מואב מפני העם מאד כי רב הוא ויקץ מואב מפני בני ישראל
(6634, 92, 4);10;י;225410;(4, 22, 4, 54, 225410);59434;(4, 22, 4, 15, 59434);ירק;1;15;ויאמר מואב אל זקני מדין עתה ילחכו הקהל את כל סביבתינו כלחך השור את ירק השדה ובלק בן צפור מלך למואב בעת ההוא
(6634, 92, 4);40;ם;225502;(4, 22, 5, 61, 225502);59460;(4, 22, 5, 18, 59460);עם;2;18;וישלח מלאכים אל בלעם בן בעור פתורה אשר על הנהר ארץ בני עמו לקרא לו לאמר הנה עם יצא ממצרים הנה כסה את עין הארץ והוא ישב ממלי
(6634, 92, 4);50;ן;225594;(4, 22, 6, 57, 225594);59488;(4, 22, 6, 18, 59488);מן;2;18;ועתה לכה נא ארה לי את העם הזה כי עצום הוא ממני אולי אוכל נכה בו ואגרשנו מן הארץ כי ידעתי את אשר תברך מברך ואשר תאר יואר
(6634, 92, 4);10;י;225686;(4, 22, 7, 57, 225686);59511;(4, 22, 7, 13, 59511);דברי;4;13;וילכו זקני מואב וזקני מדין וקסמים בידם ויבאו אל בלעם וידברו אליו דברי בלק
(6634, 92, 4);10;י;225778;(4, 22, 9, 22, 225778);59535;(4, 22, 9, 6, 59535);מי;2;6;ויבא אלהים אל בלעם ויאמר מי האנשים האלה עמך
(6634, 92, 4);1;א;225870;(4, 22, 11, 41, 225870);59562;(4, 22, 11, 13, 59562);אתו;1;13;הנה העם היצא ממצרים ויכס את עין הארץ עתה לכה קבה לי אתו אולי אוכל להלחם בו וגרשתיו
(6634, 92, 4);30;ל;225962;(4, 22, 13, 24, 225962);59588;(4, 22, 13, 7, 59588);בלק;2;7;ויקם בלעם בבקר ויאמר אל שרי בלק לכו אל ארצכם כי מאן יהוה לתתי להלך עמכם
(6634, 92, 4);40;ם;226054;(4, 22, 15, 17, 226054);59613;(4, 22, 15, 5, 59613);שרים;4;5;ויסף עוד בלק שלח שרים רבים ונכבדים מאלה
(6634, 92, 4);300;ש;226146;(4, 22, 17, 29, 226146);59640;(4, 22, 17, 9, 59640);אעשה;3;9;כי כבד אכבדך מאד וכל אשר תאמר אלי אעשה ולכה נא קבה לי את העם הזה
(6634, 92, 4);6;ו;226238;(4, 22, 18, 72, 226238);59669;(4, 22, 18, 22, 59669);לעשות;4;22;ויען בלעם ויאמר אל עבדי בלק אם יתן לי בלק מלא ביתו כסף וזהב לא אוכל לעבר את פי יהוה אלהי לעשות קטנה או גדולה
(6634, 92, 4);5;ה;226330;(4, 22, 20, 38, 226330);59697;(4, 22, 20, 12, 59697);האנשים;1;12;ויבא אלהים אל בלעם לילה ויאמר לו אם לקרא לך באו האנשים קום לך אתם ואך את הדבר אשר אדבר אליך אתו תעשה
(6634, 92, 4);30;ל;226422;(4, 22, 22, 16, 226422);59723;(4, 22, 22, 5, 59723);הולך;3;5;ויחר אף אלהים כי הולך הוא ויתיצב מלאך יהוה בדרך לשטן לו והוא רכב על אתנו ושני נעריו עמו
(6634, 92, 4);4;ד;226514;(4, 22, 23, 39, 226514);59747;(4, 22, 23, 10, 59747);בידו;3;10;ותרא האתון את מלאך יהוה נצב בדרך וחרבו שלופה בידו ותט האתון מן הדרך ותלך בשדה ויך בלעם את האתון להטתה הדרך
(6634, 92, 4);6;ו;226606;(4, 22, 25, 8, 226606);59770;(4, 22, 25, 2, 59770);האתון;4;2;ותרא האתון את מלאך יהוה ותלחץ אל הקיר ותלחץ את רגל בלעם אל הקיר ויסף להכתה
(6634, 92, 4);9;ט;226698;(4, 22, 26, 41, 226698);59795;(4, 22, 26, 11, 59795);לנטות;3;11;ויוסף מלאך יהוה עבור ויעמד במקום צר אשר אין דרך לנטות ימין ושמאול
(6634, 92, 4);2;ב;226790;(4, 22, 28, 25, 226790);59819;(4, 22, 28, 7, 59819);לבלעם;2;7;ויפתח יהוה את פי האתון ותאמר לבלעם מה עשיתי לך כי הכיתני זה שלש רגלים
(6634, 92, 4);40;ם;226882;(4, 22, 30, 16, 226882);59844;(4, 22, 30, 4, 59844);בלעם;4;4;ותאמר האתון אל בלעם הלוא אנכי אתנך אשר רכבת עלי מעודך עד היום הזה ההסכן הסכנתי לעשות לך כה ויאמר לא
(6634, 92, 4);10;י;226974;(4, 22, 31, 29, 226974);59870;(4, 22, 31, 9, 59870);יהוה;1;9;ויגל יהוה את עיני בלעם וירא את מלאך יהוה נצב בדרך וחרבו שלפה בידו ויקד וישתחו לאפיו
(6634, 92, 4);10;י;227066;(4, 22, 32, 54, 227066);59893;(4, 22, 32, 15, 59893);יצאתי;5;15;ויאמר אליו מלאך יהוה על מה הכית את אתנך זה שלוש רגלים הנה אנכי יצאתי לשטן כי ירט הדרך לנגדי
(6634, 92, 4);30;ל;227158;(4, 22, 34, 7, 227158);59917;(4, 22, 34, 2, 59917);בלעם;2;2;ויאמר בלעם אל מלאך יהוה חטאתי כי לא ידעתי כי אתה נצב לקראתי בדרך ועתה אם רע בעיניך אשובה לי
(6634, 92, 4);300;ש;227250;(4, 22, 35, 27, 227250);59943;(4, 22, 35, 8, 59943);האנשים;4;8;ויאמר מלאך יהוה אל בלעם לך עם האנשים ואפס את הדבר אשר אדבר אליך אתו תדבר וילך בלעם עם שרי בלק
(6634, 92, 4);200;ר;227342;(4, 22, 36, 46, 227342);59970;(4, 22, 36, 14, 59970);ארנן;2;14;וישמע בלק כי בא בלעם ויצא לקראתו אל עיר מואב אשר על גבול ארנן אשר בקצה הגבול
(6634, 92, 4);50;נ;227434;(4, 22, 38, 16, 227434);59996;(4, 22, 38, 5, 59996);הנה;2;5;ויאמר בלעם אל בלק הנה באתי אליך עתה היכל אוכל דבר מאומה הדבר אשר ישים אלהים בפי אתו אדבר
(6634, 92, 4);6;ו;227526;(4, 22, 40, 12, 227526);60021;(4, 22, 40, 4, 60021);וצאן;1;4;ויזבח בלק בקר וצאן וישלח לבלעם ולשרים אשר אתו
(6634, 92, 4);2;ב;227618;(4, 23, 1, 20, 227618);60046;(4, 23, 1, 7, 60046);בזה;1;7;ויאמר בלעם אל בלק בנה לי בזה שבעה מזבחת והכן לי בזה שבעה פרים ושבעה אילים
(6634, 92, 4);100;ק;227710;(4, 23, 3, 13, 227710);60069;(4, 23, 3, 3, 60069);לבלק;4;3;ויאמר בלעם לבלק התיצב על עלתך ואלכה אולי יקרה יהוה לקראתי ודבר מה יראני והגדתי לך וילך שפי
(6634, 92, 4);40;מ;227802;(4, 23, 4, 32, 227802);60093;(4, 23, 4, 9, 60093);המזבחת;2;9;ויקר אלהים אל בלעם ויאמר אליו את שבעת המזבחת ערכתי ואעל פר ואיל במזבח
(6634, 92, 4);10;י;227894;(4, 23, 6, 30, 227894);60118;(4, 23, 6, 9, 60118);שרי;3;9;וישב אליו והנה נצב על עלתו הוא וכל שרי מואב
(6634, 92, 4);7;ז;227986;(4, 23, 8, 22, 227986);60146;(4, 23, 8, 9, 60146);זעם;1;9;מה אקב לא קבה אל ומה אזעם לא זעם יהוה
(6634, 92, 4);300;ש;228078;(4, 23, 10, 33, 228078);60170;(4, 23, 10, 10, 60170);נפשי;3;10;מי מנה עפר יעקב ומספר את רבע ישראל תמת נפשי מות ישרים ותהי אחריתי כמהו
(6634, 92, 4);5;ה;228170;(4, 23, 12, 23, 228170);60195;(4, 23, 12, 7, 60195);יהוה;2;7;ויען ויאמר הלא את אשר ישים יהוה בפי אתו אשמר לדבר
(6634, 92, 4);6;ו;228262;(4, 23, 14, 6, 228262);60221;(4, 23, 14, 1, 60221);ויקחהו;6;1;ויקחהו שדה צפים אל ראש הפסגה ויבן שבעה מזבחת ויעל פר ואיל במזבח
(6634, 92, 4);70;ע;228354;(4, 23, 16, 13, 228354);60247;(4, 23, 16, 4, 60247);בלעם;3;4;ויקר יהוה אל בלעם וישם דבר בפיו ויאמר שוב אל בלק וכה תדבר
(6634, 92, 4);6;ו;228446;(4, 23, 18, 9, 228446);60274;(4, 23, 18, 3, 60274);ויאמר;1;3;וישא משלו ויאמר קום בלק ושמע האזינה עדי בנו צפר
(6634, 92, 4);6;ו;228538;(4, 23, 20, 12, 228538);60299;(4, 23, 20, 4, 60299);וברך;1;4;הנה ברך לקחתי וברך ולא אשיבנה
(6634, 92, 4);30;ל;228630;(4, 23, 23, 3, 228630);60323;(4, 23, 23, 2, 60323);לא;1;2;כי לא נחש ביעקב ולא קסם בישראל כעת יאמר ליעקב ולישראל מה פעל אל
(6634, 92, 4);10;י;228722;(4, 23, 24, 45, 228722);60348;(4, 23, 24, 13, 60348);חללים;4;13;הן עם כלביא יקום וכארי יתנשא לא ישכב עד יאכל טרף ודם חללים ישתה
(6634, 92, 4);400;ת;228814;(4, 23, 26, 49, 228814);60375;(4, 23, 26, 14, 60375);אתו;2;14;ויען בלעם ויאמר אל בלק הלא דברתי אליך לאמר כל אשר ידבר יהוה אתו אעשה
(6634, 92, 4);80;ף;228906;(4, 23, 28, 26, 228906);60400;(4, 23, 28, 7, 60400);הנשקף;5;7;ויקח בלק את בלעם ראש הפעור הנשקף על פני הישימן
(6634, 92, 4);200;ר;228998;(4, 23, 30, 24, 228998);60426;(4, 23, 30, 7, 60426);פר;2;7;ויעש בלק כאשר אמר בלעם ויעל פר ואיל במזבח
(6634, 92, 4);70;ע;229090;(4, 24, 2, 11, 229090);60451;(4, 24, 2, 4, 60451);עיניו;1;4;וישא בלעם את עיניו וירא את ישראל שכן לשבטיו ותהי עליו רוח אלהים
(6634, 92, 4);1;א;229182;(4, 24, 4, 11, 229182);60475;(4, 24, 4, 4, 60475);אל;1;4;נאם שמע אמרי אל אשר מחזה שדי יחזה נפל וגלוי עינים
(6634, 92, 4);10;י;229274;(4, 24, 6, 38, 229274);60497;(4, 24, 6, 9, 60497);כארזים;5;9;כנחלים נטיו כגנת עלי נהר כאהלים נטע יהוה כארזים עלי מים
(6634, 92, 4);70;ע;229366;(4, 24, 8, 39, 229366);60520;(4, 24, 8, 10, 60520);ועצמתיהם;2;10;אל מוציאו ממצרים כתועפת ראם לו יאכל גוים צריו ועצמתיהם יגרם וחציו ימחץ
(6634, 92, 4);1;א;229458;(4, 24, 10, 29, 229458);60542;(4, 24, 10, 9, 60542);ויאמר;3;9;ויחר אף בלק אל בלעם ויספק את כפיו ויאמר בלק אל בלעם לקב איבי קראתיך והנה ברכת ברך זה שלש פעמים
(6634, 92, 4);6;ו;229550;(4, 24, 12, 1, 229550);60567;(4, 24, 12, 1, 60567);ויאמר;1;1;ויאמר בלעם אל בלק הלא גם אל מלאכיך אשר שלחת אלי דברתי לאמר
(6634, 92, 4);400;ת;229642;(4, 24, 13, 47, 229642);60594;(4, 24, 13, 15, 60594);לעשות;5;15;אם יתן לי בלק מלא ביתו כסף וזהב לא אוכל לעבר את פי יהוה לעשות טובה או רעה מלבי אשר ידבר יהוה אתו אדבר
(6634, 92, 4);6;ו;229734;(4, 24, 15, 9, 229734);60619;(4, 24, 15, 3, 60619);ויאמר;1;3;וישא משלו ויאמר נאם בלעם בנו בער ונאם הגבר שתם העין
(6634, 92, 4);1;א;229826;(4, 24, 17, 12, 229826);60644;(4, 24, 17, 4, 60644);אשורנו;1;4;אראנו ולא עתה אשורנו ולא קרוב דרך כוכב מיעקב וקם שבט מישראל ומחץ פאתי מואב וקרקר כל בני שת
(6634, 92, 4);300;ש;229918;(4, 24, 18, 32, 229918);60667;(4, 24, 18, 8, 60667);וישראל;3;8;והיה אדום ירשה והיה ירשה שעיר איביו וישראל עשה חיל
(6634, 92, 4);10;י;230010;(4, 24, 21, 11, 230010);60689;(4, 24, 21, 3, 60689);הקיני;5;3;וירא את הקיני וישא משלו ויאמר איתן מושבך ושים בסלע קנך
(6634, 92, 4);40;ם;230102;(4, 24, 24, 4, 230102);60715;(4, 24, 24, 1, 60715);וצים;4;1;וצים מיד כתים וענו אשור וענו עבר וגם הוא עדי אבד
(6634, 92, 4);7;ז;230194;(4, 25, 1, 23, 230194);60740;(4, 25, 1, 6, 60740);לזנות;2;6;וישב ישראל בשטים ויחל העם לזנות אל בנות מואב
(6634, 92, 4);1;א;230286;(4, 25, 4, 3, 230286);60760;(4, 25, 4, 1, 60760);ויאמר;3;1;ויאמר יהוה אל משה קח את כל ראשי העם והוקע אותם ליהוה נגד השמש וישב חרון אף יהוה מישראל
(6634, 92, 4);1;א;230378;(4, 25, 5, 27, 230378);60786;(4, 25, 5, 8, 60786);אנשיו;1;8;ויאמר משה אל שפטי ישראל הרגו איש אנשיו הנצמדים לבעל פעור
(6634, 92, 4);40;ם;230470;(4, 25, 6, 73, 230470);60808;(4, 25, 6, 19, 60808);בכים;4;19;והנה איש מבני ישראל בא ויקרב אל אחיו את המדינית לעיני משה ולעיני כל עדת בני ישראל והמה בכים פתח אהל מועד
(6634, 92, 4);40;ם;230562;(4, 25, 8, 33, 230562);60833;(4, 25, 8, 9, 60833);שניהם;5;9;ויבא אחר איש ישראל אל הקבה וידקר את שניהם את איש ישראל ואת האשה אל קבתה ותעצר המגפה מעל בני ישראל
(6634, 92, 4);80;פ;230654;(4, 25, 11, 1, 230654);60857;(4, 25, 11, 1, 60857);פינחס;1;1;פינחס בן אלעזר בן אהרן הכהן השיב את חמתי מעל בני ישראל בקנאו את קנאתי בתוכם ולא כליתי את בני ישראל בקנאתי
(6634, 92, 4);50;נ;230746;(4, 25, 12, 9, 230746);60881;(4, 25, 12, 3, 60881);הנני;3;3;לכן אמר הנני נתן לו את בריתי שלום
(6634, 92, 4);5;ה;230838;(4, 25, 14, 15, 230838);60905;(4, 25, 14, 4, 60905);המכה;4;4;ושם איש ישראל המכה אשר הכה את המדינית זמרי בן סלוא נשיא בית אב לשמעני
(6634, 92, 4);200;ר;230930;(4, 25, 16, 5, 230930);60930;(4, 25, 16, 1, 60930);וידבר;5;1;וידבר יהוה אל משה לאמר
(6634, 92, 4);4;ד;231022;(4, 25, 18, 56, 231022);60956;(4, 25, 18, 17, 60956);מדין;2;17;כי צררים הם לכם בנכליהם אשר נכלו לכם על דבר פעור ועל דבר כזבי בת נשיא מדין אחתם המכה ביום המגפה על דבר פעור
(6634, 92, 4);50;נ;231114;(4, 26, 2, 15, 231114);60982;(4, 26, 2, 6, 60982);בני;2;6;שאו את ראש כל עדת בני ישראל מבן עשרים שנה ומעלה לבית אבתם כל יצא צבא בישראל
(6634, 92, 4);70;ע;231206;(4, 26, 4, 4, 231206);61006;(4, 26, 4, 2, 61006);עשרים;1;2;מבן עשרים שנה ומעלה כאשר צוה יהוה את משה ובני ישראל היצאים מארץ מצרים
(6634, 92, 4);6;ו;231298;(4, 26, 5, 40, 231298);61027;(4, 26, 5, 9, 61027);לפלוא;4;9;ראובן בכור ישראל בני ראובן חנוך משפחת החנכי לפלוא משפחת הפלאי
(6634, 92, 4);6;ו;231390;(4, 26, 7, 49, 231390);61046;(4, 26, 7, 11, 61046);ושלשים;1;11;אלה משפחת הראובני ויהיו פקדיהם שלשה וארבעים אלף ושבע מאות ושלשים
(6634, 92, 4);400;ת;231482;(4, 26, 9, 74, 231482);61068;(4, 26, 9, 19, 61068);בהצתם;4;19;ובני אליאב נמואל ודתן ואבירם הוא דתן ואבירם קרואי העדה אשר הצו על משה ועל אהרן בעדת קרח בהצתם על יהוה
(6634, 92, 4);70;ע;231574;(4, 26, 12, 6, 231574);61094;(4, 26, 12, 2, 61094);שמעון;3;2;בני שמעון למשפחתם לנמואל משפחת הנמואלי לימין משפחת הימיני ליכין משפחת היכיני
(6634, 92, 4);5;ה;231666;(4, 26, 14, 3, 231666);61111;(4, 26, 14, 1, 61111);אלה;3;1;אלה משפחת השמעני שנים ועשרים אלף ומאתים
(6634, 92, 4);40;מ;231758;(4, 26, 16, 6, 231758);61131;(4, 26, 16, 2, 61131);משפחת;1;2;לאזני משפחת האזני לערי משפחת הערי
(6634, 92, 4);400;ת;231850;(4, 26, 18, 37, 231850);61150;(4, 26, 18, 9, 61150);מאות;4;9;אלה משפחת בני גד לפקדיהם ארבעים אלף וחמש מאות
(6634, 92, 4);5;ה;231942;(4, 26, 20, 58, 231942);61172;(4, 26, 20, 13, 61172);הזרחי;1;13;ויהיו בני יהודה למשפחתם לשלה משפחת השלני לפרץ משפחת הפרצי לזרח משפחת הזרחי
(6634, 92, 4);300;ש;232034;(4, 26, 23, 5, 232034);61192;(4, 26, 23, 2, 61192);יששכר;2;2;בני יששכר למשפחתם תולע משפחת התולעי לפוה משפחת הפוני
(6634, 92, 4);200;ר;232126;(4, 26, 25, 22, 232126);61210;(4, 26, 25, 5, 61210);ארבעה;2;5;אלה משפחת יששכר לפקדיהם ארבעה וששים אלף ושלש מאות
(6634, 92, 4);2;ב;232218;(4, 26, 27, 11, 232218);61229;(4, 26, 27, 3, 61229);הזבולני;3;3;אלה משפחת הזבולני לפקדיהם ששים אלף וחמש מאות
(6634, 92, 4);30;ל;232310;(4, 26, 29, 42, 232310);61249;(4, 26, 29, 10, 61249);לגלעד;3;10;בני מנשה למכיר משפחת המכירי ומכיר הוליד את גלעד לגלעד משפחת הגלעדי
(6634, 92, 4);4;ד;232402;(4, 26, 32, 5, 232402);61267;(4, 26, 32, 1, 61267);ושמידע;5;1;ושמידע משפחת השמידעי וחפר משפחת החפרי
(6634, 92, 4);30;ל;232494;(4, 26, 34, 2, 232494);61291;(4, 26, 34, 1, 61291);אלה;2;1;אלה משפחת מנשה ופקדיהם שנים וחמשים אלף ושבע מאות
(6634, 92, 4);40;מ;232586;(4, 26, 35, 54, 232586);61311;(4, 26, 35, 12, 61311);משפחת;1;12;אלה בני אפרים למשפחתם לשותלח משפחת השתלחי לבכר משפחת הבכרי לתחן משפחת התחני
(6634, 92, 4);300;ש;232678;(4, 26, 37, 57, 232678);61332;(4, 26, 37, 14, 61332);למשפחתם;3;14;אלה משפחת בני אפרים לפקדיהם שנים ושלשים אלף וחמש מאות אלה בני יוסף למשפחתם
(6634, 92, 4);80;פ;232770;(4, 26, 39, 25, 232770);61349;(4, 26, 39, 5, 61349);משפחת;3;5;לשפופם משפחת השופמי לחופם משפחת החופמי
(6634, 92, 4);6;ו;232862;(4, 26, 41, 40, 232862);61369;(4, 26, 41, 9, 61369);ושש;1;9;אלה בני בנימן למשפחתם ופקדיהם חמשה וארבעים אלף ושש מאות
(6634, 92, 4);70;ע;232954;(4, 26, 43, 38, 232954);61389;(4, 26, 43, 8, 61389);וארבע;5;8;כל משפחת השוחמי לפקדיהם ארבעה וששים אלף וארבע מאות
(6634, 92, 4);10;י;233046;(4, 26, 45, 28, 233046);61408;(4, 26, 45, 6, 61408);למלכיאל;5;6;לבני בריעה לחבר משפחת החברי למלכיאל משפחת המלכיאלי
(6634, 92, 4);300;ש;233138;(4, 26, 48, 23, 233138);61429;(4, 26, 48, 5, 61429);משפחת;2;5;בני נפתלי למשפחתם ליחצאל משפחת היחצאלי לגוני משפחת הגוני
(6634, 92, 4);1;א;233230;(4, 26, 50, 39, 233230);61447;(4, 26, 50, 8, 61447);אלף;1;8;אלה משפחת נפתלי למשפחתם ופקדיהם חמשה וארבעים אלף וארבע מאות
(6634, 92, 4);80;פ;233322;(4, 26, 53, 21, 233322);61470;(4, 26, 53, 5, 61470);במספר;4;5;לאלה תחלק הארץ בנחלה במספר שמות
(6634, 92, 4);3;ג;233414;(4, 26, 56, 6, 233414);61494;(4, 26, 56, 3, 61494);הגורל;2;3;על פי הגורל תחלק נחלתו בין רב למעט
(6634, 92, 4);300;ש;233506;(4, 26, 58, 5, 233506);61514;(4, 26, 58, 2, 61514);משפחת;2;2;אלה משפחת לוי משפחת הלבני משפחת החברני משפחת המחלי משפחת המושי משפחת הקרחי וקהת הולד את עמרם
(6634, 92, 4);1;א;233598;(4, 26, 59, 21, 233598);61536;(4, 26, 59, 7, 61536);אשר;1;7;ושם אשת עמרם יוכבד בת לוי אשר ילדה אתה ללוי במצרים ותלד לעמרם את אהרן ואת משה ואת מרים אחתם
(6634, 92, 4);10;י;233690;(4, 26, 61, 2, 233690);61560;(4, 26, 61, 1, 61560);וימת;2;1;וימת נדב ואביהוא בהקריבם אש זרה לפני יהוה
(6634, 92, 4);200;ר;233782;(4, 26, 62, 60, 233782);61583;(4, 26, 62, 16, 61583);ישראל;3;16;ויהיו פקדיהם שלשה ועשרים אלף כל זכר מבן חדש ומעלה כי לא התפקדו בתוך בני ישראל כי לא נתן להם נחלה בתוך בני ישראל
(6634, 92, 4);1;א;233874;(4, 26, 64, 7, 233874);61608;(4, 26, 64, 2, 61608);לא;2;2;ובאלה לא היה איש מפקודי משה ואהרן הכהן אשר פקדו את בני ישראל במדבר סיני
(6634, 92, 4);20;כ;233966;(4, 26, 65, 42, 233966);61635;(4, 26, 65, 14, 61635);כלב;1;14;כי אמר יהוה להם מות ימתו במדבר ולא נותר מהם איש כי אם כלב בן יפנה ויהושע בן נון
(6634, 92, 4);50;נ;234058;(4, 27, 1, 73, 234058);61660;(4, 27, 1, 20, 61660);נעה;1;20;ותקרבנה בנות צלפחד בן חפר בן גלעד בן מכיר בן מנשה למשפחת מנשה בן יוסף ואלה שמות בנתיו מחלה נעה וחגלה ומלכה ותרצה
(6634, 92, 4);6;ו;234150;(4, 27, 3, 15, 234150);61681;(4, 27, 3, 4, 61681);והוא;3;4;אבינו מת במדבר והוא לא היה בתוך העדה הנועדים על יהוה בעדת קרח כי בחטאו מת ובנים לא היו לו
(6634, 92, 4);30;ל;234242;(4, 27, 4, 37, 234242);61709;(4, 27, 4, 12, 61709);לנו;1;12;למה יגרע שם אבינו מתוך משפחתו כי אין לו בן תנה לנו אחזה בתוך אחי אבינו
(6634, 92, 4);2;ב;234334;(4, 27, 7, 33, 234334);61734;(4, 27, 7, 10, 61734);בתוך;1;10;כן בנות צלפחד דברת נתן תתן להם אחזת נחלה בתוך אחי אביהם והעברת את נחלת אביהן להן
(6634, 92, 4);30;ל;234426;(4, 27, 9, 7, 234426);61759;(4, 27, 9, 3, 61759);לו;1;3;ואם אין לו בת ונתתם את נחלתו לאחיו
(6634, 92, 4);6;ו;234518;(4, 27, 11, 40, 234518);61783;(4, 27, 11, 10, 61783);אליו;4;10;ואם אין אחים לאביו ונתתם את נחלתו לשארו הקרב אליו ממשפחתו וירש אתה והיתה לבני ישראל לחקת משפט כאשר צוה יהוה את משה
(6634, 92, 4);90;ץ;234610;(4, 27, 12, 40, 234610);61808;(4, 27, 12, 12, 61808);הארץ;4;12;ויאמר יהוה אל משה עלה אל הר העברים הזה וראה את הארץ אשר נתתי לבני ישראל
(6634, 92, 4);300;ש;234702;(4, 27, 14, 34, 234702);61831;(4, 27, 14, 8, 61831);להקדישני;6;8;כאשר מריתם פי במדבר צן במריבת העדה להקדישני במים לעיניהם הם מי מריבת קדש מדבר צן
(6634, 92, 4);5;ה;234794;(4, 27, 17, 11, 234794);61856;(4, 27, 17, 3, 61856);לפניהם;5;3;אשר יצא לפניהם ואשר יבא לפניהם ואשר יוציאם ואשר יביאם ולא תהיה עדת יהוה כצאן אשר אין להם רעה
(6634, 92, 4);6;ו;234886;(4, 27, 18, 29, 234886);61882;(4, 27, 18, 10, 61882);נון;2;10;ויאמר יהוה אל משה קח לך את יהושע בן נון איש אשר רוח בו וסמכת את ידך עליו
(6634, 92, 4);70;ע;234978;(4, 27, 20, 17, 234978);61905;(4, 27, 20, 4, 61905);למען;3;4;ונתתה מהודך עליו למען ישמעו כל עדת בני ישראל
(6634, 92, 4);300;ש;235070;(4, 27, 21, 73, 235070);61930;(4, 27, 21, 20, 61930);ישראל;2;20;ולפני אלעזר הכהן יעמד ושאל לו במשפט האורים לפני יהוה על פיו יצאו ועל פיו יבאו הוא וכל בני ישראל אתו וכל העדה
(6634, 92, 4);6;ו;235162;(4, 27, 23, 16, 235162);61954;(4, 27, 23, 5, 61954);ויצוהו;1;5;ויסמך את ידיו עליו ויצוהו כאשר דבר יהוה ביד משה
(6634, 92, 4);100;ק;235254;(4, 28, 2, 52, 235254);61978;(4, 28, 2, 14, 61978);להקריב;3;14;צו את בני ישראל ואמרת אלהם את קרבני לחמי לאשי ריח ניחחי תשמרו להקריב לי במועדו
(6634, 92, 4);20;כ;235346;(4, 28, 4, 22, 235346);62002;(4, 28, 4, 7, 62002);הכבש;2;7;את הכבש אחד תעשה בבקר ואת הכבש השני תעשה בין הערבים
(6634, 92, 4);30;ל;235438;(4, 28, 6, 31, 235438);62024;(4, 28, 6, 9, 62024);ליהוה;1;9;עלת תמיד העשיה בהר סיני לריח ניחח אשה ליהוה
(6634, 92, 4);10;י;235530;(4, 28, 8, 48, 235530);62046;(4, 28, 8, 12, 62046);ריח;2;12;ואת הכבש השני תעשה בין הערבים כמנחת הבקר וכנסכו תעשה אשה ריח ניחח ליהוה
(6634, 92, 4);50;נ;235622;(4, 28, 10, 23, 235622);62069;(4, 28, 10, 7, 62069);ונסכה;2;7;עלת שבת בשבתו על עלת התמיד ונסכה
