(n,d,k);LetterGematriaNumberValue;Letter;LetterPositionIndex;LetterCoordinatesD5K;WordNumber;WordCoordinatesDWTK;Found in Word in Text;LetterPositionIndex In Word;WordNumberInVerse;Found In Verse
(7025, 93, 4);30;ל;50;(1, 1, 2, 22, 50);13;(1, 1, 2, 6, 13);על;2;6;והארץ היתה תהו ובהו וחשך על פני תהום ורוח אלהים מרחפת על פני המים
(7025, 93, 4);10;י;143;(1, 1, 4, 40, 143);38;(1, 1, 4, 11, 38);ובין;3;11;וירא אלהים את האור כי טוב ויבדל אלהים בין האור ובין החשך
(7025, 93, 4);10;י;236;(1, 1, 6, 39, 236);62;(1, 1, 6, 10, 62);מים;2;10;ויאמר אלהים יהי רקיע בתוך המים ויהי מבדיל בין מים למים
(7025, 93, 4);10;י;329;(1, 1, 8, 23, 329);85;(1, 1, 8, 5, 85);ויהי;4;5;ויקרא אלהים לרקיע שמים ויהי ערב ויהי בקר יום שני
(7025, 93, 4);5;ה;422;(1, 1, 10, 25, 422);109;(1, 1, 10, 6, 109);המים;1;6;ויקרא אלהים ליבשה ארץ ולמקוה המים קרא ימים וירא אלהים כי טוב
(7025, 93, 4);50;ן;515;(1, 1, 11, 69, 515);135;(1, 1, 11, 20, 135);כן;2;20;ויאמר אלהים תדשא הארץ דשא עשב מזריע זרע עץ פרי עשה פרי למינו אשר זרעו בו על הארץ ויהי כן
(7025, 93, 4);40;מ;608;(1, 1, 14, 4, 608);160;(1, 1, 14, 1, 160);ויאמר;4;1;ויאמר אלהים יהי מארת ברקיע השמים להבדיל בין היום ובין הלילה והיו לאתת ולמועדים ולימים ושנים
(7025, 93, 4);30;ל;701;(1, 1, 15, 21, 701);180;(1, 1, 15, 5, 180);להאיר;1;5;והיו למאורת ברקיע השמים להאיר על הארץ ויהי כן
(7025, 93, 4);2;ב;794;(1, 1, 16, 77, 794);202;(1, 1, 16, 18, 202);הכוכבים;5;18;ויעש אלהים את שני המארת הגדלים את המאור הגדל לממשלת היום ואת המאור הקטן לממשלת הלילה ואת הכוכבים
(7025, 93, 4);2;ב;887;(1, 1, 19, 7, 887);224;(1, 1, 19, 2, 224);ערב;3;2;ויהי ערב ויהי בקר יום רביעי
(7025, 93, 4);4;ד;980;(1, 1, 21, 21, 980);248;(1, 1, 21, 5, 248);הגדלים;3;5;ויברא אלהים את התנינם הגדלים ואת כל נפש החיה הרמשת אשר שרצו המים למינהם ואת כל עוף כנף למינהו וירא אלהים כי טוב
(7025, 93, 4);6;ו;1073;(1, 1, 22, 25, 1073);273;(1, 1, 22, 7, 273);ומלאו;1;7;ויברך אתם אלהים לאמר פרו ורבו ומלאו את המים בימים והעוף ירב בארץ
(7025, 93, 4);200;ר;1166;(1, 1, 24, 44, 1166);296;(1, 1, 24, 11, 296);ארץ;2;11;ויאמר אלהים תוצא הארץ נפש חיה למינה בהמה ורמש וחיתו ארץ למינה ויהי כן
(7025, 93, 4);70;ע;1259;(1, 1, 26, 12, 1259);320;(1, 1, 26, 3, 320);נעשה;2;3;ויאמר אלהים נעשה אדם בצלמנו כדמותנו וירדו בדגת הים ובעוף השמים ובבהמה ובכל הארץ ובכל הרמש הרמש על הארץ
(7025, 93, 4);6;ו;1352;(1, 1, 27, 21, 1352);341;(1, 1, 27, 5, 341);בצלמו;5;5;ויברא אלהים את האדם בצלמו בצלם אלהים ברא אתו זכר ונקבה ברא אתם
(7025, 93, 4);6;ו;1445;(1, 1, 28, 64, 1445);365;(1, 1, 28, 16, 365);ובעוף;4;16;ויברך אתם אלהים ויאמר להם אלהים פרו ורבו ומלאו את הארץ וכבשה ורדו בדגת הים ובעוף השמים ובכל חיה הרמשת על הארץ
(7025, 93, 4);7;ז;1538;(1, 1, 29, 69, 1538);395;(1, 1, 29, 24, 395);זרע;1;24;ויאמר אלהים הנה נתתי לכם את כל עשב זרע זרע אשר על פני כל הארץ ואת כל העץ אשר בו פרי עץ זרע זרע לכם יהיה לאכלה
(7025, 93, 4);1;א;1631;(1, 1, 31, 10, 1631);422;(1, 1, 31, 3, 422);את;1;3;וירא אלהים את כל אשר עשה והנה טוב מאד ויהי ערב ויהי בקר יום הששי
(7025, 93, 4);5;ה;1724;(1, 2, 2, 31, 1724);446;(1, 2, 2, 7, 446);עשה;3;7;ויכל אלהים ביום השביעי מלאכתו אשר עשה וישבת ביום השביעי מכל מלאכתו אשר עשה
(7025, 93, 4);30;ל;1817;(1, 2, 4, 2, 1817);470;(1, 2, 4, 1, 470);אלה;2;1;אלה תולדות השמים והארץ בהבראם ביום עשות יהוה אלהים ארץ ושמים
(7025, 93, 4);9;ט;1910;(1, 2, 5, 45, 1910);494;(1, 2, 5, 14, 494);המטיר;3;14;וכל שיח השדה טרם יהיה בארץ וכל עשב השדה טרם יצמח כי לא המטיר יהוה אלהים על הארץ ואדם אין לעבד את האדמה
(7025, 93, 4);4;ד;2003;(1, 2, 7, 28, 2003);520;(1, 2, 7, 8, 520);האדמה;3;8;וייצר יהוה אלהים את האדם עפר מן האדמה ויפח באפיו נשמת חיים ויהי האדם לנפש חיה
(7025, 93, 4);1;א;2096;(1, 2, 9, 18, 2096);545;(1, 2, 9, 5, 545);האדמה;2;5;ויצמח יהוה אלהים מן האדמה כל עץ נחמד למראה וטוב למאכל ועץ החיים בתוך הגן ועץ הדעת טוב ורע
(7025, 93, 4);5;ה;2189;(1, 2, 10, 40, 2189);569;(1, 2, 10, 10, 569);לארבעה;6;10;ונהר יצא מעדן להשקות את הגן ומשם יפרד והיה לארבעה ראשים
(7025, 93, 4);6;ו;2282;(1, 2, 13, 18, 2282);595;(1, 2, 13, 5, 595);הוא;2;5;ושם הנהר השני גיחון הוא הסובב את כל ארץ כוש
(7025, 93, 4);50;ן;2375;(1, 2, 15, 28, 2375);619;(1, 2, 15, 7, 619);בגן;3;7;ויקח יהוה אלהים את האדם וינחהו בגן עדן לעבדה ולשמרה
(7025, 93, 4);400;ת;2468;(1, 2, 17, 41, 2468);645;(1, 2, 17, 12, 645);מות;3;12;ומעץ הדעת טוב ורע לא תאכל ממנו כי ביום אכלך ממנו מות תמות
(7025, 93, 4);10;י;2561;(1, 2, 19, 44, 2561);671;(1, 2, 19, 13, 671);ויבא;2;13;ויצר יהוה אלהים מן האדמה כל חית השדה ואת כל עוף השמים ויבא אל האדם לראות מה יקרא לו וכל אשר יקרא לו האדם נפש חיה הוא שמו
(7025, 93, 4);30;ל;2654;(1, 2, 20, 44, 2654);697;(1, 2, 20, 11, 697);ולאדם;2;11;ויקרא האדם שמות לכל הבהמה ולעוף השמים ולכל חית השדה ולאדם לא מצא עזר כנגדו
(7025, 93, 4);300;ש;2747;(1, 2, 22, 21, 2747);720;(1, 2, 22, 6, 720);אשר;2;6;ויבן יהוה אלהים את הצלע אשר לקח מן האדם לאשה ויבאה אל האדם
(7025, 93, 4);300;ש;2840;(1, 2, 24, 11, 2840);746;(1, 2, 24, 4, 746);איש;3;4;על כן יעזב איש את אביו ואת אמו ודבק באשתו והיו לבשר אחד
(7025, 93, 4);300;ש;2933;(1, 3, 1, 27, 2933);770;(1, 3, 1, 8, 770);עשה;2;8;והנחש היה ערום מכל חית השדה אשר עשה יהוה אלהים ויאמר אל האשה אף כי אמר אלהים לא תאכלו מכל עץ הגן
(7025, 93, 4);3;ג;3026;(1, 3, 3, 17, 3026);797;(1, 3, 3, 5, 797);הגן;2;5;ומפרי העץ אשר בתוך הגן אמר אלהים לא תאכלו ממנו ולא תגעו בו פן תמתון
(7025, 93, 4);70;ע;3119;(1, 3, 5, 32, 3119);823;(1, 3, 5, 9, 823);עיניכם;1;9;כי ידע אלהים כי ביום אכלכם ממנו ונפקחו עיניכם והייתם כאלהים ידעי טוב ורע
(7025, 93, 4);6;ו;3212;(1, 3, 6, 66, 3212);845;(1, 3, 6, 17, 845);ותתן;1;17;ותרא האשה כי טוב העץ למאכל וכי תאוה הוא לעינים ונחמד העץ להשכיל ותקח מפריו ותאכל ותתן גם לאישה עמה ויאכל
(7025, 93, 4);40;ם;3305;(1, 3, 8, 20, 3305);867;(1, 3, 8, 5, 867);אלהים;5;5;וישמעו את קול יהוה אלהים מתהלך בגן לרוח היום ויתחבא האדם ואשתו מפני יהוה אלהים בתוך עץ הגן
(7025, 93, 4);30;ל;3398;(1, 3, 10, 9, 3398);891;(1, 3, 10, 3, 891);קלך;2;3;ויאמר את קלך שמעתי בגן ואירא כי עירם אנכי ואחבא
(7025, 93, 4);1;א;3491;(1, 3, 12, 11, 3491);916;(1, 3, 12, 3, 916);האשה;2;3;ויאמר האדם האשה אשר נתתה עמדי הוא נתנה לי מן העץ ואכל
(7025, 93, 4);5;ה;3584;(1, 3, 14, 12, 3584);940;(1, 3, 14, 3, 940);אלהים;3;3;ויאמר יהוה אלהים אל הנחש כי עשית זאת ארור אתה מכל הבהמה ומכל חית השדה על גחנך תלך ועפר תאכל כל ימי חייך
(7025, 93, 4);10;י;3677;(1, 3, 15, 24, 3677);966;(1, 3, 15, 6, 966);ובין;3;6;ואיבה אשית בינך ובין האשה ובין זרעך ובין זרעה הוא ישופך ראש ואתה תשופנו עקב
(7025, 93, 4);6;ו;3770;(1, 3, 16, 56, 3770);989;(1, 3, 16, 14, 989);והוא;3;14;אל האשה אמר הרבה ארבה עצבונך והרנך בעצב תלדי בנים ואל אישך תשוקתך והוא ימשל בך
(7025, 93, 4);10;י;3863;(1, 3, 17, 86, 3863);1013;(1, 3, 17, 22, 1013);ימי;1;22;ולאדם אמר כי שמעת לקול אשתך ותאכל מן העץ אשר צויתיך לאמר לא תאכל ממנו ארורה האדמה בעבורך בעצבון תאכלנה כל ימי חייך
(7025, 93, 4);6;ו;3956;(1, 3, 20, 1, 3956);1040;(1, 3, 20, 1, 1040);ויקרא;1;1;ויקרא האדם שם אשתו חוה כי הוא היתה אם כל חי
(7025, 93, 4);20;כ;4049;(1, 3, 22, 24, 4049);1065;(1, 3, 22, 7, 1065);כאחד;1;7;ויאמר יהוה אלהים הן האדם היה כאחד ממנו לדעת טוב ורע ועתה פן ישלח ידו ולקח גם מעץ החיים ואכל וחי לעלם
(7025, 93, 4);100;ק;4142;(1, 3, 23, 38, 4142);1090;(1, 3, 23, 10, 1090);לקח;2;10;וישלחהו יהוה אלהים מגן עדן לעבד את האדמה אשר לקח משם
(7025, 93, 4);6;ו;4235;(1, 4, 1, 22, 4235);1116;(1, 4, 1, 7, 1116);ותלד;1;7;והאדם ידע את חוה אשתו ותהר ותלד את קין ותאמר קניתי איש את יהוה
(7025, 93, 4);80;פ;4328;(1, 4, 3, 20, 4328);1143;(1, 4, 3, 6, 1143);מפרי;2;6;ויהי מקץ ימים ויבא קין מפרי האדמה מנחה ליהוה
(7025, 93, 4);10;י;4421;(1, 4, 5, 26, 4421);1167;(1, 4, 5, 8, 1167);לקין;3;8;ואל קין ואל מנחתו לא שעה ויחר לקין מאד ויפלו פניו
(7025, 93, 4);6;ו;4514;(1, 4, 7, 46, 4514);1192;(1, 4, 7, 12, 1192);תשוקתו;6;12;הלוא אם תיטיב שאת ואם לא תיטיב לפתח חטאת רבץ ואליך תשוקתו ואתה תמשל בו
(7025, 93, 4);30;ל;4607;(1, 4, 9, 29, 4607);1218;(1, 4, 9, 9, 1218);לא;1;9;ויאמר יהוה אל קין אי הבל אחיך ויאמר לא ידעתי השמר אחי אנכי
(7025, 93, 4);1;א;4700;(1, 4, 11, 40, 4700);1245;(1, 4, 11, 13, 1245);אחיך;1;13;ועתה ארור אתה מן האדמה אשר פצתה את פיה לקחת את דמי אחיך מידך
(7025, 93, 4);1;א;4793;(1, 4, 14, 21, 4793);1273;(1, 4, 14, 7, 1273);האדמה;2;7;הן גרשת אתי היום מעל פני האדמה ומפניך אסתר והייתי נע ונד בארץ והיה כל מצאי יהרגני
(7025, 93, 4);30;ל;4886;(1, 4, 15, 49, 4886);1297;(1, 4, 15, 14, 1297);לבלתי;3;14;ויאמר לו יהוה לכן כל הרג קין שבעתים יקם וישם יהוה לקין אות לבלתי הכות אתו כל מצאו
(7025, 93, 4);40;ם;4979;(1, 4, 17, 44, 4979);1323;(1, 4, 17, 13, 1323);שם;2;13;וידע קין את אשתו ותהר ותלד את חנוך ויהי בנה עיר ויקרא שם העיר כשם בנו חנוך
(7025, 93, 4);300;ש;5072;(1, 4, 19, 14, 5072);1348;(1, 4, 19, 5, 1348);נשים;2;5;ויקח לו למך שתי נשים שם האחת עדה ושם השנית צלה
(7025, 93, 4);3;ג;5165;(1, 4, 22, 5, 5165);1376;(1, 4, 22, 2, 1376);גם;1;2;וצלה גם הוא ילדה את תובל קין לטש כל חרש נחשת וברזל ואחות תובל קין נעמה
(7025, 93, 4);400;ת;5258;(1, 4, 23, 43, 5258);1401;(1, 4, 23, 11, 1401);אמרתי;4;11;ויאמר למך לנשיו עדה וצלה שמען קולי נשי למך האזנה אמרתי כי איש הרגתי לפצעי וילד לחברתי
(7025, 93, 4);30;ל;5351;(1, 4, 25, 39, 5351);1428;(1, 4, 25, 14, 1428);לי;1;14;וידע אדם עוד את אשתו ותלד בן ותקרא את שמו שת כי שת לי אלהים זרע אחר תחת הבל כי הרגו קין
(7025, 93, 4);1;א;5444;(1, 5, 1, 21, 5444);1457;(1, 5, 1, 7, 1457);אלהים;1;7;זה ספר תולדת אדם ביום ברא אלהים אדם בדמות אלהים עשה אתו
(7025, 93, 4);6;ו;5537;(1, 5, 3, 28, 5537);1480;(1, 5, 3, 7, 1480);בדמותו;4;7;ויחי אדם שלשים ומאת שנה ויולד בדמותו כצלמו ויקרא את שמו שת
(7025, 93, 4);400;ת;5630;(1, 5, 5, 25, 5630);1506;(1, 5, 5, 8, 1506);מאות;4;8;ויהיו כל ימי אדם אשר חי תשע מאות שנה ושלשים שנה וימת
(7025, 93, 4);4;ד;5723;(1, 5, 7, 46, 5723);1531;(1, 5, 7, 12, 1531);ויולד;5;12;ויחי שת אחרי הולידו את אנוש שבע שנים ושמנה מאות שנה ויולד בנים ובנות
(7025, 93, 4);1;א;5816;(1, 5, 10, 19, 5816);1556;(1, 5, 10, 5, 1556);את;1;5;ויחי אנוש אחרי הולידו את קינן חמש עשרה שנה ושמנה מאות שנה ויולד בנים ובנות
(7025, 93, 4);5;ה;5909;(1, 5, 12, 16, 5909);1580;(1, 5, 12, 4, 1580);שנה;3;4;ויחי קינן שבעים שנה ויולד את מהללאל
(7025, 93, 4);50;נ;6002;(1, 5, 14, 19, 6002);1603;(1, 5, 14, 6, 1603);שנים;2;6;ויהיו כל ימי קינן עשר שנים ותשע מאות שנה וימת
(7025, 93, 4);6;ו;6095;(1, 5, 16, 41, 6095);1626;(1, 5, 16, 10, 1626);מאות;3;10;ויחי מהללאל אחרי הולידו את ירד שלשים שנה ושמנה מאות שנה ויולד בנים ובנות
(7025, 93, 4);4;ד;6188;(1, 5, 18, 31, 6188);1649;(1, 5, 18, 8, 1649);ויולד;5;8;ויחי ירד שתים וששים שנה ומאת שנה ויולד את חנוך
(7025, 93, 4);40;מ;6281;(1, 5, 20, 39, 6281);1674;(1, 5, 20, 11, 1674);וימת;3;11;ויהיו כל ימי ירד שתים וששים שנה ותשע מאות שנה וימת
(7025, 93, 4);400;ת;6374;(1, 5, 22, 60, 6374);1696;(1, 5, 22, 14, 1696);ובנות;5;14;ויתהלך חנוך את האלהים אחרי הולידו את מתושלח שלש מאות שנה ויולד בנים ובנות
(7025, 93, 4);50;נ;6467;(1, 5, 25, 21, 6467);1720;(1, 5, 25, 5, 1720);שנה;2;5;ויחי מתושלח שבע ושמנים שנה ומאת שנה ויולד את למך
(7025, 93, 4);40;מ;6560;(1, 5, 27, 11, 6560);1744;(1, 5, 27, 4, 1744);מתושלח;1;4;ויהיו כל ימי מתושלח תשע וששים שנה ותשע מאות שנה וימת
(7025, 93, 4);300;ש;6653;(1, 5, 29, 28, 6653);1768;(1, 5, 29, 8, 1768);ממעשנו;4;8;ויקרא את שמו נח לאמר זה ינחמנו ממעשנו ומעצבון ידינו מן האדמה אשר אררה יהוה
(7025, 93, 4);10;י;6746;(1, 5, 31, 4, 6746);1791;(1, 5, 31, 1, 1791);ויהי;4;1;ויהי כל ימי למך שבע ושבעים שנה ושבע מאות שנה וימת
(7025, 93, 4);80;פ;6839;(1, 6, 1, 19, 6839);1822;(1, 6, 1, 7, 1822);פני;1;7;ויהי כי החל האדם לרב על פני האדמה ובנות ילדו להם
(7025, 93, 4);2;ב;6932;(1, 6, 3, 20, 6932);1847;(1, 6, 3, 6, 1847);באדם;1;6;ויאמר יהוה לא ידון רוחי באדם לעלם בשגם הוא בשר והיו ימיו מאה ועשרים שנה
(7025, 93, 4);40;ם;7025;(1, 6, 4, 56, 7025);1871;(1, 6, 4, 15, 1871);האדם;4;15;הנפלים היו בארץ בימים ההם וגם אחרי כן אשר יבאו בני האלהים אל בנות האדם וילדו להם המה הגברים אשר מעולם אנשי השם
(7025, 93, 4);300;ש;7118;(1, 6, 6, 13, 7118);1898;(1, 6, 6, 4, 1898);עשה;2;4;וינחם יהוה כי עשה את האדם בארץ ויתעצב אל לבו
(7025, 93, 4);10;י;7211;(1, 6, 7, 71, 7211);1924;(1, 6, 7, 20, 1924);נחמתי;5;20;ויאמר יהוה אמחה את האדם אשר בראתי מעל פני האדמה מאדם עד בהמה עד רמש ועד עוף השמים כי נחמתי כי עשיתם
(7025, 93, 4);8;ח;7304;(1, 6, 10, 22, 7304);1952;(1, 6, 10, 8, 1952);חם;1;8;ויולד נח שלשה בנים את שם את חם ואת יפת
(7025, 93, 4);30;ל;7397;(1, 6, 13, 7, 7397);1977;(1, 6, 13, 2, 1977);אלהים;2;2;ויאמר אלהים לנח קץ כל בשר בא לפני כי מלאה הארץ חמס מפניהם והנני משחיתם את הארץ
(7025, 93, 4);2;ב;7490;(1, 6, 14, 38, 7490);2004;(1, 6, 14, 12, 2004);מבית;2;12;עשה לך תבת עצי גפר קנים תעשה את התבה וכפרת אתה מבית ומחוץ בכפר
(7025, 93, 4);70;ע;7583;(1, 6, 16, 26, 7583);2028;(1, 6, 16, 7, 2028);מלמעלה;4;7;צהר תעשה לתבה ואל אמה תכלנה מלמעלה ופתח התבה בצדה תשים תחתים שנים ושלשים תעשה
(7025, 93, 4);40;מ;7676;(1, 6, 17, 56, 7676);2053;(1, 6, 17, 17, 2053);השמים;3;17;ואני הנני מביא את המבול מים על הארץ לשחת כל בשר אשר בו רוח חיים מתחת השמים כל אשר בארץ יגוע
(7025, 93, 4);400;ת;7769;(1, 6, 19, 28, 7769);2079;(1, 6, 19, 9, 2079);התבה;2;9;ומכל החי מכל בשר שנים מכל תביא אל התבה להחית אתך זכר ונקבה יהיו
(7025, 93, 4);40;מ;7862;(1, 6, 21, 9, 7862);2102;(1, 6, 21, 4, 2102);מכל;1;4;ואתה קח לך מכל מאכל אשר יאכל ואספת אליך והיה לך ולהם לאכלה
(7025, 93, 4);400;ת;7955;(1, 7, 1, 28, 7955);2129;(1, 7, 1, 9, 2129);התבה;2;9;ויאמר יהוה לנח בא אתה וכל ביתך אל התבה כי אתך ראיתי צדיק לפני בדור הזה
(7025, 93, 4);400;ת;8048;(1, 7, 2, 66, 8048);2154;(1, 7, 2, 18, 2154);ואשתו;4;18;מכל הבהמה הטהורה תקח לך שבעה שבעה איש ואשתו ומן הבהמה אשר לא טהרה הוא שנים איש ואשתו
(7025, 93, 4);30;ל;8141;(1, 7, 4, 46, 8141);2179;(1, 7, 4, 12, 2179);לילה;1;12;כי לימים עוד שבעה אנכי ממטיר על הארץ ארבעים יום וארבעים לילה ומחיתי את כל היקום אשר עשיתי מעל פני האדמה
(7025, 93, 4);1;א;8234;(1, 7, 7, 4, 8234);2205;(1, 7, 7, 1, 2205);ויבא;4;1;ויבא נח ובניו ואשתו ונשי בניו אתו אל התבה מפני מי המבול
(7025, 93, 4);1;א;8327;(1, 7, 8, 53, 8327);2231;(1, 7, 8, 15, 2231);האדמה;2;15;מן הבהמה הטהורה ומן הבהמה אשר איננה טהרה ומן העוף וכל אשר רמש על האדמה
(7025, 93, 4);30;ל;8420;(1, 7, 11, 14, 8420);2258;(1, 7, 11, 5, 2258);לחיי;1;5;בשנת שש מאות שנה לחיי נח בחדש השני בשבעה עשר יום לחדש ביום הזה נבקעו כל מעינות תהום רבה וארבת השמים נפתחו
(7025, 93, 4);40;ם;8513;(1, 7, 12, 23, 8513);2281;(1, 7, 12, 6, 2281);יום;3;6;ויהי הגשם על הארץ ארבעים יום וארבעים לילה
(7025, 93, 4);40;מ;8606;(1, 7, 14, 25, 8606);2308;(1, 7, 14, 7, 2308);למינה;2;7;המה וכל החיה למינה וכל הבהמה למינה וכל הרמש הרמש על הארץ למינהו וכל העוף למינהו כל צפור כל כנף
(7025, 93, 4);6;ו;8699;(1, 7, 16, 1, 8699);2335;(1, 7, 16, 1, 2335);והבאים;1;1;והבאים זכר ונקבה מכל בשר באו כאשר צוה אתו אלהים ויסגר יהוה בעדו
(7025, 93, 4);2;ב;8792;(1, 7, 17, 43, 8792);2358;(1, 7, 17, 11, 2358);התבה;3;11;ויהי המבול ארבעים יום על הארץ וירבו המים וישאו את התבה ותרם מעל הארץ
(7025, 93, 4);1;א;8885;(1, 7, 19, 40, 8885);2383;(1, 7, 19, 11, 2383);אשר;1;11;והמים גברו מאד מאד על הארץ ויכסו כל ההרים הגבהים אשר תחת כל השמים
(7025, 93, 4);90;ץ;8978;(1, 7, 21, 47, 8978);2406;(1, 7, 21, 12, 2406);השרץ;4;12;ויגוע כל בשר הרמש על הארץ בעוף ובבהמה ובחיה ובכל השרץ השרץ על הארץ וכל האדם
(7025, 93, 4);70;ע;9071;(1, 7, 23, 45, 9071);2435;(1, 7, 23, 15, 2435);עוף;1;15;וימח את כל היקום אשר על פני האדמה מאדם עד בהמה עד רמש ועד עוף השמים וימחו מן הארץ וישאר אך נח ואשר אתו בתבה
(7025, 93, 4);20;כ;9164;(1, 8, 1, 27, 9164);2461;(1, 8, 1, 9, 2461);כל;1;9;ויזכר אלהים את נח ואת כל החיה ואת כל הבהמה אשר אתו בתבה ויעבר אלהים רוח על הארץ וישכו המים
(7025, 93, 4);10;י;9257;(1, 8, 3, 8, 9257);2483;(1, 8, 3, 2, 2483);המים;3;2;וישבו המים מעל הארץ הלוך ושוב ויחסרו המים מקצה חמשים ומאת יום
(7025, 93, 4);5;ה;9350;(1, 8, 5, 9, 9350);2507;(1, 8, 5, 3, 2507);הלוך;1;3;והמים היו הלוך וחסור עד החדש העשירי בעשירי באחד לחדש נראו ראשי ההרים
(7025, 93, 4);400;ת;9443;(1, 8, 7, 7, 9443);2530;(1, 8, 7, 2, 2530);את;2;2;וישלח את הערב ויצא יצוא ושוב עד יבשת המים מעל הארץ
(7025, 93, 4);200;ר;9536;(1, 8, 9, 20, 9536);2555;(1, 8, 9, 6, 2555);רגלה;1;6;ולא מצאה היונה מנוח לכף רגלה ותשב אליו אל התבה כי מים על פני כל הארץ וישלח ידו ויקחה ויבא אתה אליו אל התבה
(7025, 93, 4);5;ה;9629;(1, 8, 10, 30, 9629);2582;(1, 8, 10, 9, 2582);היונה;1;9;ויחל עוד שבעת ימים אחרים ויסף שלח את היונה מן התבה
(7025, 93, 4);30;ל;9722;(1, 8, 12, 25, 9722);2607;(1, 8, 12, 6, 2607);וישלח;4;6;וייחל עוד שבעת ימים אחרים וישלח את היונה ולא יספה שוב אליו עוד
(7025, 93, 4);6;ו;9815;(1, 8, 13, 68, 9815);2633;(1, 8, 13, 19, 2633);והנה;1;19;ויהי באחת ושש מאות שנה בראשון באחד לחדש חרבו המים מעל הארץ ויסר נח את מכסה התבה וירא והנה חרבו פני האדמה
(7025, 93, 4);10;י;9908;(1, 8, 16, 25, 9908);2656;(1, 8, 16, 7, 2656);ונשי;4;7;צא מן התבה אתה ואשתך ובניך ונשי בניך אתך
(7025, 93, 4);10;י;10001;(1, 8, 18, 10, 10001);2682;(1, 8, 18, 3, 2682);ובניו;4;3;ויצא נח ובניו ואשתו ונשי בניו אתו
(7025, 93, 4);40;מ;10094;(1, 8, 20, 26, 10094);2707;(1, 8, 20, 7, 2707);הבהמה;4;7;ויבן נח מזבח ליהוה ויקח מכל הבהמה הטהרה ומכל העוף הטהור ויעל עלת במזבח
(7025, 93, 4);10;י;10187;(1, 8, 21, 62, 10187);2732;(1, 8, 21, 18, 2732);כי;2;18;וירח יהוה את ריח הניחח ויאמר יהוה אל לבו לא אסף לקלל עוד את האדמה בעבור האדם כי יצר לב האדם רע מנעריו ולא אסף עוד להכות את כל חי כאשר עשיתי
(7025, 93, 4);2;ב;10280;(1, 8, 22, 47, 10280);2760;(1, 8, 22, 14, 2760);ישבתו;3;14;עד כל ימי הארץ זרע וקציר וקר וחם וקיץ וחרף ויום ולילה לא ישבתו
(7025, 93, 4);1;א;10373;(1, 9, 2, 44, 10373);2786;(1, 9, 2, 13, 2786);אשר;1;13;ומוראכם וחתכם יהיה על כל חית הארץ ועל כל עוף השמים בכל אשר תרמש האדמה ובכל דגי הים בידכם נתנו
(7025, 93, 4);6;ו;10466;(1, 9, 4, 20, 10466);2813;(1, 9, 4, 6, 2813);תאכלו;5;6;אך בשר בנפשו דמו לא תאכלו
(7025, 93, 4);1;א;10559;(1, 9, 6, 27, 10559);2840;(1, 9, 6, 9, 2840);אלהים;1;9;שפך דם האדם באדם דמו ישפך כי בצלם אלהים עשה את האדם
(7025, 93, 4);7;ז;10652;(1, 9, 9, 27, 10652);2866;(1, 9, 9, 8, 2866);זרעכם;1;8;ואני הנני מקים את בריתי אתכם ואת זרעכם אחריכם
(7025, 93, 4);30;ל;10745;(1, 9, 11, 19, 10745);2890;(1, 9, 11, 5, 2890);ולא;2;5;והקמתי את בריתי אתכם ולא יכרת כל בשר עוד ממי המבול ולא יהיה עוד מבול לשחת הארץ
(7025, 93, 4);300;ש;10838;(1, 9, 12, 50, 10838);2915;(1, 9, 12, 13, 2915);נפש;3;13;ויאמר אלהים זאת אות הברית אשר אני נתן ביני וביניכם ובין כל נפש חיה אשר אתכם לדרת עולם
(7025, 93, 4);200;ר;10931;(1, 9, 15, 4, 10931);2939;(1, 9, 15, 1, 2939);וזכרתי;4;1;וזכרתי את בריתי אשר ביני וביניכם ובין כל נפש חיה בכל בשר ולא יהיה עוד המים למבול לשחת כל בשר
(7025, 93, 4);200;ר;11024;(1, 9, 16, 24, 11024);2963;(1, 9, 16, 5, 2963);לזכר;4;5;והיתה הקשת בענן וראיתיה לזכר ברית עולם בין אלהים ובין כל נפש חיה בכל בשר אשר על הארץ
(7025, 93, 4);70;ע;11117;(1, 9, 17, 50, 11117);2991;(1, 9, 17, 15, 2991);על;1;15;ויאמר אלהים אל נח זאת אות הברית אשר הקמתי ביני ובין כל בשר אשר על הארץ
(7025, 93, 4);9;ט;11210;(1, 9, 20, 17, 11210);3018;(1, 9, 20, 5, 3018);ויטע;3;5;ויחל נח איש האדמה ויטע כרם
(7025, 93, 4);40;מ;11303;(1, 9, 23, 22, 11303);3043;(1, 9, 23, 6, 3043);וישימו;5;6;ויקח שם ויפת את השמלה וישימו על שכם שניהם וילכו אחרנית ויכסו את ערות אביהם ופניהם אחרנית וערות אביהם לא ראו
