(113310, -65, 4);40;מ;231285;(4, 26, 5, 27, 231285);61025;(4, 26, 5, 7, 61025);משפחת;1;7;ראובן בכור ישראל בני ראובן חנוך משפחת החנכי לפלוא משפחת הפלאי
(113310, -65, 4);5;ה;231350;(4, 26, 7, 9, 231350);61038;(4, 26, 7, 3, 61038);הראובני;1;3;אלה משפחת הראובני ויהיו פקדיהם שלשה וארבעים אלף ושבע מאות ושלשים
(113310, -65, 4);10;י;231415;(4, 26, 9, 7, 231415);61051;(4, 26, 9, 2, 61051);אליאב;3;2;ובני אליאב נמואל ודתן ואבירם הוא דתן ואבירם קרואי העדה אשר הצו על משה ועל אהרן בעדת קרח בהצתם על יהוה
(113310, -65, 4);5;ה;231480;(4, 26, 9, 72, 231480);61068;(4, 26, 9, 19, 61068);בהצתם;2;19;ובני אליאב נמואל ודתן ואבירם הוא דתן ואבירם קרואי העדה אשר הצו על משה ועל אהרן בעדת קרח בהצתם על יהוה
(113310, -65, 4);40;ם;231545;(4, 26, 10, 56, 231545);61085;(4, 26, 10, 15, 61085);ומאתים;6;15;ותפתח הארץ את פיה ותבלע אתם ואת קרח במות העדה באכל האש את חמשים ומאתים איש ויהיו לנס
(113310, -65, 4);8;ח;231610;(4, 26, 12, 42, 231610);61100;(4, 26, 12, 8, 61100);משפחת;4;8;בני שמעון למשפחתם לנמואל משפחת הנמואלי לימין משפחת הימיני ליכין משפחת היכיני
(113310, -65, 4);70;ע;231675;(4, 26, 14, 12, 231675);61113;(4, 26, 14, 3, 61113);השמעני;4;3;אלה משפחת השמעני שנים ועשרים אלף ומאתים
(113310, -65, 4);6;ו;231740;(4, 26, 15, 44, 231740);61127;(4, 26, 15, 10, 61127);לשוני;3;10;בני גד למשפחתם לצפון משפחת הצפוני לחגי משפחת החגי לשוני משפחת השוני
(113310, -65, 4);80;פ;231805;(4, 26, 17, 25, 231805);61140;(4, 26, 17, 5, 61140);משפחת;3;5;לארוד משפחת הארודי לאראלי משפחת האראלי
(113310, -65, 4);70;ע;231870;(4, 26, 19, 20, 231870);61156;(4, 26, 19, 6, 61156);ער;1;6;בני יהודה ער ואונן וימת ער ואונן בארץ כנען
(113310, -65, 4);200;ר;231935;(4, 26, 20, 51, 231935);61170;(4, 26, 20, 11, 61170);לזרח;3;11;ויהיו בני יהודה למשפחתם לשלה משפחת השלני לפרץ משפחת הפרצי לזרח משפחת הזרחי
(113310, -65, 4);6;ו;232000;(4, 26, 22, 11, 232000);61184;(4, 26, 22, 3, 61184);יהודה;3;3;אלה משפחת יהודה לפקדיהם ששה ושבעים אלף וחמש מאות
(113310, -65, 4);300;ש;232065;(4, 26, 23, 36, 232065);61198;(4, 26, 23, 8, 61198);משפחת;2;8;בני יששכר למשפחתם תולע משפחת התולעי לפוה משפחת הפוני
(113310, -65, 4);6;ו;232130;(4, 26, 25, 26, 232130);61211;(4, 26, 25, 6, 61211);וששים;1;6;אלה משפחת יששכר לפקדיהם ארבעה וששים אלף ושלש מאות
(113310, -65, 4);30;ל;232195;(4, 26, 26, 50, 232195);61224;(4, 26, 26, 10, 61224);ליחלאל;6;10;בני זבולן למשפחתם לסרד משפחת הסרדי לאלון משפחת האלני ליחלאל משפחת היחלאלי
(113310, -65, 4);50;נ;232260;(4, 26, 28, 16, 232260);61238;(4, 26, 28, 4, 61238);מנשה;2;4;בני יוסף למשפחתם מנשה ואפרים
(113310, -65, 4);30;ל;232325;(4, 26, 30, 2, 232325);61252;(4, 26, 30, 1, 61252);אלה;2;1;אלה בני גלעד איעזר משפחת האיעזרי לחלק משפחת החלקי
(113310, -65, 4);80;פ;232390;(4, 26, 31, 26, 232390);61265;(4, 26, 31, 5, 61265);משפחת;3;5;ואשריאל משפחת האשראלי ושכם משפחת השכמי
(113310, -65, 4);40;ם;232455;(4, 26, 33, 26, 232455);61281;(4, 26, 33, 9, 61281);אם;2;9;וצלפחד בן חפר לא היו לו בנים כי אם בנות ושם בנות צלפחד מחלה ונעה חגלה מלכה ותרצה
(113310, -65, 4);10;י;232520;(4, 26, 34, 28, 232520);61296;(4, 26, 34, 6, 61296);וחמשים;5;6;אלה משפחת מנשה ופקדיהם שנים וחמשים אלף ושבע מאות
(113310, -65, 4);50;ן;232585;(4, 26, 35, 53, 232585);61310;(4, 26, 35, 11, 61310);לתחן;4;11;אלה בני אפרים למשפחתם לשותלח משפחת השתלחי לבכר משפחת הבכרי לתחן משפחת התחני
(113310, -65, 4);300;ש;232650;(4, 26, 37, 29, 232650);61325;(4, 26, 37, 7, 61325);ושלשים;2;7;אלה משפחת בני אפרים לפקדיהם שנים ושלשים אלף וחמש מאות אלה בני יוסף למשפחתם
(113310, -65, 4);2;ב;232715;(4, 26, 38, 33, 232715);61339;(4, 26, 38, 7, 61339);לאשבל;4;7;בני בנימן למשפחתם לבלע משפחת הבלעי לאשבל משפחת האשבלי לאחירם משפחת האחירמי
(113310, -65, 4);10;י;232780;(4, 26, 40, 2, 232780);61351;(4, 26, 40, 1, 61351);ויהיו;2;1;ויהיו בני בלע ארד ונעמן משפחת הארדי לנעמן משפחת הנעמי
(113310, -65, 4);10;י;232845;(4, 26, 41, 23, 232845);61365;(4, 26, 41, 5, 61365);ופקדיהם;5;5;אלה בני בנימן למשפחתם ופקדיהם חמשה וארבעים אלף ושש מאות
(113310, -65, 4);30;ל;232910;(4, 26, 42, 42, 232910);61381;(4, 26, 42, 11, 61381);למשפחתם;1;11;אלה בני דן למשפחתם לשוחם משפחת השוחמי אלה משפחת דן למשפחתם
(113310, -65, 4);50;נ;232975;(4, 26, 44, 17, 232975);61394;(4, 26, 44, 4, 61394);לימנה;4;4;בני אשר למשפחתם לימנה משפחת הימנה לישוי משפחת הישוי לבריעה משפחת הבריעי
(113310, -65, 4);200;ר;233040;(4, 26, 45, 22, 233040);61407;(4, 26, 45, 5, 61407);החברי;4;5;לבני בריעה לחבר משפחת החברי למלכיאל משפחת המלכיאלי
(113310, -65, 4);30;ל;233105;(4, 26, 47, 33, 233105);61422;(4, 26, 47, 8, 61422);אלף;2;8;אלה משפחת בני אשר לפקדיהם שלשה וחמשים אלף וארבע מאות
(113310, -65, 4);80;פ;233170;(4, 26, 49, 7, 233170);61435;(4, 26, 49, 2, 61435);משפחת;3;2;ליצר משפחת היצרי לשלם משפחת השלמי
(113310, -65, 4);200;ר;233235;(4, 26, 50, 44, 233235);61448;(4, 26, 50, 9, 61448);וארבע;3;9;אלה משפחת נפתלי למשפחתם ופקדיהם חמשה וארבעים אלף וארבע מאות
(113310, -65, 4);40;מ;233300;(4, 26, 52, 17, 233300);61465;(4, 26, 52, 5, 61465);לאמר;3;5;וידבר יהוה אל משה לאמר
(113310, -65, 4);6;ו;233365;(4, 26, 54, 38, 233365);61480;(4, 26, 54, 9, 61480);פקדיו;5;9;לרב תרבה נחלתו ולמעט תמעיט נחלתו איש לפי פקדיו יתן נחלתו
(113310, -65, 4);200;ר;233430;(4, 26, 56, 22, 233430);61498;(4, 26, 56, 7, 61498);רב;1;7;על פי הגורל תחלק נחלתו בין רב למעט
(113310, -65, 4);8;ח;233495;(4, 26, 57, 60, 233495);61511;(4, 26, 57, 12, 61511);משפחת;4;12;ואלה פקודי הלוי למשפחתם לגרשון משפחת הגרשני לקהת משפחת הקהתי למררי משפחת המררי
(113310, -65, 4);100;ק;233560;(4, 26, 58, 59, 233560);61525;(4, 26, 58, 13, 61525);הקרחי;2;13;אלה משפחת לוי משפחת הלבני משפחת החברני משפחת המחלי משפחת המושי משפחת הקרחי וקהת הולד את עמרם
(113310, -65, 4);200;ר;233625;(4, 26, 59, 48, 233625);61542;(4, 26, 59, 13, 61542);לעמרם;4;13;ושם אשת עמרם יוכבד בת לוי אשר ילדה אתה ללוי במצרים ותלד לעמרם את אהרן ואת משה ואת מרים אחתם
(113310, -65, 4);10;י;233690;(4, 26, 61, 2, 233690);61560;(4, 26, 61, 1, 61560);וימת;2;1;וימת נדב ואביהוא בהקריבם אש זרה לפני יהוה
(113310, -65, 4);8;ח;233755;(4, 26, 62, 33, 233755);61576;(4, 26, 62, 9, 61576);חדש;1;9;ויהיו פקדיהם שלשה ועשרים אלף כל זכר מבן חדש ומעלה כי לא התפקדו בתוך בני ישראל כי לא נתן להם נחלה בתוך בני ישראל
(113310, -65, 4);300;ש;233820;(4, 26, 63, 10, 233820);61594;(4, 26, 63, 3, 61594);משה;2;3;אלה פקודי משה ואלעזר הכהן אשר פקדו את בני ישראל בערבת מואב על ירדן ירחו
(113310, -65, 4);4;ד;233885;(4, 26, 64, 18, 233885);61611;(4, 26, 64, 5, 61611);מפקודי;5;5;ובאלה לא היה איש מפקודי משה ואהרן הכהן אשר פקדו את בני ישראל במדבר סיני
(113310, -65, 4);30;ל;233950;(4, 26, 65, 26, 233950);61629;(4, 26, 65, 8, 61629);ולא;2;8;כי אמר יהוה להם מות ימתו במדבר ולא נותר מהם איש כי אם כלב בן יפנה ויהושע בן נון
(113310, -65, 4);40;מ;234015;(4, 27, 1, 30, 234015);61649;(4, 27, 1, 9, 61649);מכיר;1;9;ותקרבנה בנות צלפחד בן חפר בן גלעד בן מכיר בן מנשה למשפחת מנשה בן יוסף ואלה שמות בנתיו מחלה נעה וחגלה ומלכה ותרצה
(113310, -65, 4);4;ד;234080;(4, 27, 2, 5, 234080);61664;(4, 27, 2, 1, 61664);ותעמדנה;5;1;ותעמדנה לפני משה ולפני אלעזר הכהן ולפני הנשיאם וכל העדה פתח אהל מועד לאמר
(113310, -65, 4);4;ד;234145;(4, 27, 3, 10, 234145);61680;(4, 27, 3, 3, 61680);במדבר;3;3;אבינו מת במדבר והוא לא היה בתוך העדה הנועדים על יהוה בעדת קרח כי בחטאו מת ובנים לא היו לו
(113310, -65, 4);3;ג;234210;(4, 27, 4, 5, 234210);61699;(4, 27, 4, 2, 61699);יגרע;2;2;למה יגרע שם אבינו מתוך משפחתו כי אין לו בן תנה לנו אחזה בתוך אחי אבינו
(113310, -65, 4);50;ן;234275;(4, 27, 5, 15, 234275);61717;(4, 27, 5, 4, 61717);משפטן;5;4;ויקרב משה את משפטן לפני יהוה
(113310, -65, 4);10;י;234340;(4, 27, 7, 39, 234340);61735;(4, 27, 7, 11, 61735);אחי;3;11;כן בנות צלפחד דברת נתן תתן להם אחזת נחלה בתוך אחי אביהם והעברת את נחלת אביהן להן
(113310, -65, 4);2;ב;234405;(4, 27, 8, 40, 234405);61753;(4, 27, 8, 12, 61753);והעברתם;4;12;ואל בני ישראל תדבר לאמר איש כי ימות ובן אין לו והעברתם את נחלתו לבתו
(113310, -65, 4);6;ו;234470;(4, 27, 10, 24, 234470);61771;(4, 27, 10, 7, 61771);נחלתו;5;7;ואם אין לו אחים ונתתם את נחלתו לאחי אביו
(113310, -65, 4);10;י;234535;(4, 27, 11, 57, 234535);61787;(4, 27, 11, 14, 61787);והיתה;3;14;ואם אין אחים לאביו ונתתם את נחלתו לשארו הקרב אליו ממשפחתו וירש אתה והיתה לבני ישראל לחקת משפט כאשר צוה יהוה את משה
(113310, -65, 4);5;ה;234600;(4, 27, 12, 30, 234600);61805;(4, 27, 12, 9, 61805);הזה;3;9;ויאמר יהוה אל משה עלה אל הר העברים הזה וראה את הארץ אשר נתתי לבני ישראל
(113310, -65, 4);1;א;234665;(4, 27, 13, 39, 234665);61823;(4, 27, 13, 11, 61823);אחיך;1;11;וראיתה אתה ונאספת אל עמיך גם אתה כאשר נאסף אהרן אחיך
(113310, -65, 4);2;ב;234730;(4, 27, 14, 62, 234730);61838;(4, 27, 14, 15, 61838);מדבר;3;15;כאשר מריתם פי במדבר צן במריבת העדה להקדישני במים לעיניהם הם מי מריבת קדש מדבר צן
(113310, -65, 4);40;ם;234795;(4, 27, 17, 12, 234795);61856;(4, 27, 17, 3, 61856);לפניהם;6;3;אשר יצא לפניהם ואשר יבא לפניהם ואשר יוציאם ואשר יביאם ולא תהיה עדת יהוה כצאן אשר אין להם רעה
(113310, -65, 4);1;א;234860;(4, 27, 18, 3, 234860);61873;(4, 27, 18, 1, 61873);ויאמר;3;1;ויאמר יהוה אל משה קח לך את יהושע בן נון איש אשר רוח בו וסמכת את ידך עליו
(113310, -65, 4);10;י;234925;(4, 27, 19, 13, 234925);61893;(4, 27, 19, 3, 61893);לפני;4;3;והעמדת אתו לפני אלעזר הכהן ולפני כל העדה וצויתה אתו לעיניהם
(113310, -65, 4);2;ב;234990;(4, 27, 20, 29, 234990);61909;(4, 27, 20, 8, 61909);בני;1;8;ונתתה מהודך עליו למען ישמעו כל עדת בני ישראל
(113310, -65, 4);6;ו;235055;(4, 27, 21, 58, 235055);61925;(4, 27, 21, 15, 61925);פיו;3;15;ולפני אלעזר הכהן יעמד ושאל לו במשפט האורים לפני יהוה על פיו יצאו ועל פיו יבאו הוא וכל בני ישראל אתו וכל העדה
(113310, -65, 4);4;ד;235120;(4, 27, 22, 37, 235120);61943;(4, 27, 22, 10, 61943);ויעמדהו;5;10;ויעש משה כאשר צוה יהוה אתו ויקח את יהושע ויעמדהו לפני אלעזר הכהן ולפני כל העדה
(113310, -65, 4);6;ו;235185;(4, 28, 1, 1, 235185);61960;(4, 28, 1, 1, 61960);וידבר;1;1;וידבר יהוה אל משה לאמר
(113310, -65, 4);200;ר;235250;(4, 28, 2, 48, 235250);61977;(4, 28, 2, 13, 61977);תשמרו;4;13;צו את בני ישראל ואמרת אלהם את קרבני לחמי לאשי ריח ניחחי תשמרו להקריב לי במועדו
(113310, -65, 4);10;י;235315;(4, 28, 3, 50, 235315);61993;(4, 28, 3, 13, 61993);ליום;2;13;ואמרת להם זה האשה אשר תקריבו ליהוה כבשים בני שנה תמימם שנים ליום עלה תמיד
(113310, -65, 4);400;ת;235380;(4, 28, 5, 15, 235380);62009;(4, 28, 5, 3, 62009);סלת;3;3;ועשירית האיפה סלת למנחה בלולה בשמן כתית רביעת ההין
(113310, -65, 4);60;ס;235445;(4, 28, 7, 3, 235445);62025;(4, 28, 7, 1, 62025);ונסכו;3;1;ונסכו רביעת ההין לכבש האחד בקדש הסך נסך שכר ליהוה
(113310, -65, 4);8;ח;235510;(4, 28, 8, 28, 235510);62041;(4, 28, 8, 7, 62041);כמנחת;4;7;ואת הכבש השני תעשה בין הערבים כמנחת הבקר וכנסכו תעשה אשה ריח ניחח ליהוה
(113310, -65, 4);200;ר;235575;(4, 28, 9, 35, 235575);62057;(4, 28, 9, 9, 62057);עשרנים;3;9;וביום השבת שני כבשים בני שנה תמימם ושני עשרנים סלת מנחה בלולה בשמן ונסכו
(113310, -65, 4);200;ר;235640;(4, 28, 11, 15, 235640);62072;(4, 28, 11, 3, 62072);תקריבו;3;3;ובראשי חדשיכם תקריבו עלה ליהוה פרים בני בקר שנים ואיל אחד כבשים בני שנה שבעה תמימם
(113310, -65, 4);30;ל;235705;(4, 28, 12, 13, 235705);62088;(4, 28, 12, 3, 62088);סלת;2;3;ושלשה עשרנים סלת מנחה בלולה בשמן לפר האחד ושני עשרנים סלת מנחה בלולה בשמן לאיל האחד
(113310, -65, 4);50;ן;235770;(4, 28, 13, 10, 235770);62103;(4, 28, 13, 2, 62103);עשרון;5;2;ועשרן עשרון סלת מנחה בלולה בשמן לכבש האחד עלה ריח ניחח אשה ליהוה
(113310, -65, 4);300;ש;235835;(4, 28, 14, 23, 235835);62120;(4, 28, 14, 6, 62120);ושלישת;2;6;ונסכיהם חצי ההין יהיה לפר ושלישת ההין לאיל ורביעת ההין לכבש יין זאת עלת חדש בחדשו לחדשי השנה
(113310, -65, 4);30;ל;235900;(4, 28, 15, 13, 235900);62136;(4, 28, 15, 4, 62136);לחטאת;1;4;ושעיר עזים אחד לחטאת ליהוה על עלת התמיד יעשה ונסכו
(113310, -65, 4);2;ב;235965;(4, 28, 17, 2, 235965);62151;(4, 28, 17, 1, 62151);ובחמשה;2;1;ובחמשה עשר יום לחדש הזה חג שבעת ימים מצות יאכל
(113310, -65, 4);1;א;236030;(4, 28, 18, 30, 236030);62168;(4, 28, 18, 8, 62168);לא;2;8;ביום הראשון מקרא קדש כל מלאכת עבדה לא תעשו
(113310, -65, 4);10;י;236095;(4, 28, 19, 61, 236095);62185;(4, 28, 19, 16, 62185);יהיו;1;16;והקרבתם אשה עלה ליהוה פרים בני בקר שנים ואיל אחד ושבעה כבשים בני שנה תמימם יהיו לכם
(113310, -65, 4);50;ן;236160;(4, 28, 21, 10, 236160);62199;(4, 28, 21, 2, 62199);עשרון;5;2;עשרון עשרון תעשה לכבש האחד לשבעת הכבשים
(113310, -65, 4);40;מ;236225;(4, 28, 23, 21, 236225);62215;(4, 28, 23, 6, 62215);התמיד;3;6;מלבד עלת הבקר אשר לעלת התמיד תעשו את אלה
(113310, -65, 4);6;ו;236290;(4, 28, 24, 54, 236290);62233;(4, 28, 24, 15, 62233);ונסכו;1;15;כאלה תעשו ליום שבעת ימים לחם אשה ריח ניחח ליהוה על עולת התמיד יעשה ונסכו
(113310, -65, 4);20;כ;236355;(4, 28, 26, 19, 236355);62247;(4, 28, 26, 3, 62247);בהקריבכם;7;3;וביום הבכורים בהקריבכם מנחה חדשה ליהוה בשבעתיכם מקרא קדש יהיה לכם כל מלאכת עבדה לא תעשו
(113310, -65, 4);30;ל;236420;(4, 28, 27, 12, 236420);62263;(4, 28, 27, 3, 62263);לריח;1;3;והקרבתם עולה לריח ניחח ליהוה פרים בני בקר שנים איל אחד שבעה כבשים בני שנה
(113310, -65, 4);50;ן;236485;(4, 28, 28, 18, 236485);62279;(4, 28, 28, 4, 62279);בשמן;4;4;ומנחתם סלת בלולה בשמן שלשה עשרנים לפר האחד שני עשרנים לאיל האחד
(113310, -65, 4);70;ע;236550;(4, 28, 30, 2, 236550);62294;(4, 28, 30, 1, 62294);שעיר;2;1;שעיר עזים אחד לכפר עליכם
(113310, -65, 4);5;ה;236615;(4, 29, 1, 6, 236615);62309;(4, 29, 1, 2, 62309);השביעי;1;2;ובחדש השביעי באחד לחדש מקרא קדש יהיה לכם כל מלאכת עבדה לא תעשו יום תרועה יהיה לכם
(113310, -65, 4);40;ם;236680;(4, 29, 2, 6, 236680);62325;(4, 29, 2, 1, 62325);ועשיתם;6;1;ועשיתם עלה לריח ניחח ליהוה פר בן בקר אחד איל אחד כבשים בני שנה שבעה תמימם
(113310, -65, 4);30;ל;236745;(4, 29, 3, 13, 236745);62343;(4, 29, 3, 3, 62343);בלולה;4;3;ומנחתם סלת בלולה בשמן שלשה עשרנים לפר שני עשרנים לאיל
(113310, -65, 4);70;ע;236810;(4, 29, 5, 6, 236810);62358;(4, 29, 5, 2, 62358);עזים;1;2;ושעיר עזים אחד חטאת לכפר עליכם
(113310, -65, 4);30;ל;236875;(4, 29, 6, 46, 236875);62372;(4, 29, 6, 10, 62372);לריח;1;10;מלבד עלת החדש ומנחתה ועלת התמיד ומנחתה ונסכיהם כמשפטם לריח ניחח אשה ליהוה
(113310, -65, 4);30;ל;236940;(4, 29, 7, 50, 236940);62387;(4, 29, 7, 12, 62387);כל;2;12;ובעשור לחדש השביעי הזה מקרא קדש יהיה לכם ועניתם את נפשתיכם כל מלאכה לא תעשו
(113310, -65, 4);400;ת;237005;(4, 29, 8, 54, 237005);62406;(4, 29, 8, 16, 62406);תמימם;1;16;והקרבתם עלה ליהוה ריח ניחח פר בן בקר אחד איל אחד כבשים בני שנה שבעה תמימם יהיו לכם
(113310, -65, 4);70;ע;237070;(4, 29, 10, 6, 237070);62421;(4, 29, 10, 2, 62421);עשרון;1;2;עשרון עשרון לכבש האחד לשבעת הכבשים
(113310, -65, 4);8;ח;237135;(4, 29, 11, 42, 237135);62435;(4, 29, 11, 10, 62435);ומנחתה;4;10;שעיר עזים אחד חטאת מלבד חטאת הכפרים ועלת התמיד ומנחתה ונסכיהם
(113310, -65, 4);3;ג;237200;(4, 29, 12, 56, 237200);62451;(4, 29, 12, 15, 62451);וחגתם;3;15;ובחמשה עשר יום לחדש השביעי מקרא קדש יהיה לכם כל מלאכת עבדה לא תעשו וחגתם חג ליהוה שבעת ימים
(113310, -65, 4);50;נ;237265;(4, 29, 13, 48, 237265);62468;(4, 29, 13, 13, 62468);שנים;2;13;והקרבתם עלה אשה ריח ניחח ליהוה פרים בני בקר שלשה עשר אילם שנים כבשים בני שנה ארבעה עשר תמימם יהיו
(113310, -65, 4);4;ד;237330;(4, 29, 14, 35, 237330);62483;(4, 29, 14, 8, 62483);האחד;4;8;ומנחתם סלת בלולה בשמן שלשה עשרנים לפר האחד לשלשה עשר פרים שני עשרנים לאיל האחד לשני האילם
(113310, -65, 4);300;ש;237395;(4, 29, 15, 27, 237395);62498;(4, 29, 15, 6, 62498);עשר;2;6;ועשרון עשרון לכבש האחד לארבעה עשר כבשים
(113310, -65, 4);50;נ;237460;(4, 29, 17, 21, 237460);62514;(4, 29, 17, 6, 62514);שנים;2;6;וביום השני פרים בני בקר שנים עשר אילם שנים כבשים בני שנה ארבעה עשר תמימם
(113310, -65, 4);300;ש;237525;(4, 29, 18, 28, 237525);62528;(4, 29, 18, 5, 62528);ולכבשים;5;5;ומנחתם ונסכיהם לפרים לאילם ולכבשים במספרם כמשפט
(113310, -65, 4);10;י;237590;(4, 29, 20, 11, 237590);62541;(4, 29, 20, 2, 62541);השלישי;6;2;וביום השלישי פרים עשתי עשר אילם שנים כבשים בני שנה ארבעה עשר תמימם
(113310, -65, 4);30;ל;237655;(4, 29, 21, 22, 237655);62556;(4, 29, 21, 4, 62556);לאילם;4;4;ומנחתם ונסכיהם לפרים לאילם ולכבשים במספרם כמשפט
(113310, -65, 4);10;י;237720;(4, 29, 23, 11, 237720);62569;(4, 29, 23, 2, 62569);הרביעי;6;2;וביום הרביעי פרים עשרה אילם שנים כבשים בני שנה ארבעה עשר תמימם
(113310, -65, 4);20;כ;237785;(4, 29, 24, 25, 237785);62584;(4, 29, 24, 5, 62584);ולכבשים;3;5;מנחתם ונסכיהם לפרים לאילם ולכבשים במספרם כמשפט
(113310, -65, 4);80;פ;237850;(4, 29, 26, 12, 237850);62598;(4, 29, 26, 3, 62598);פרים;1;3;וביום החמישי פרים תשעה אילם שנים כבשים בני שנה ארבעה עשר תמימם
(113310, -65, 4);20;כ;237915;(4, 29, 27, 26, 237915);62612;(4, 29, 27, 5, 62612);ולכבשים;3;5;ומנחתם ונסכיהם לפרים לאילם ולכבשים במספרם כמשפט
(113310, -65, 4);40;מ;237980;(4, 29, 29, 15, 237980);62626;(4, 29, 29, 4, 62626);שמנה;2;4;וביום הששי פרים שמנה אילם שנים כבשים בני שנה ארבעה עשר תמימם
(113310, -65, 4);2;ב;238045;(4, 29, 30, 31, 238045);62640;(4, 29, 30, 6, 62640);במספרם;1;6;ומנחתם ונסכיהם לפרים לאילם ולכבשים במספרם כמשפט
(113310, -65, 4);1;א;238110;(4, 29, 32, 20, 238110);62654;(4, 29, 32, 5, 62654);אילם;1;5;וביום השביעי פרים שבעה אילם שנים כבשים בני שנה ארבעה עשר תמימם
(113310, -65, 4);200;ר;238175;(4, 29, 33, 34, 238175);62667;(4, 29, 33, 6, 62667);במספרם;5;6;ומנחתם ונסכהם לפרים לאילם ולכבשים במספרם כמשפטם
(113310, -65, 4);40;מ;238240;(4, 29, 35, 24, 238240);62683;(4, 29, 35, 7, 62683);מלאכת;1;7;ביום השמיני עצרת תהיה לכם כל מלאכת עבדה לא תעשו
(113310, -65, 4);5;ה;238305;(4, 29, 36, 51, 238305);62700;(4, 29, 36, 14, 62700);שבעה;4;14;והקרבתם עלה אשה ריח ניחח ליהוה פר אחד איל אחד כבשים בני שנה שבעה תמימם
(113310, -65, 4);10;י;238370;(4, 29, 38, 23, 238370);62714;(4, 29, 38, 6, 62714);התמיד;4;6;ושעיר חטאת אחד מלבד עלת התמיד ומנחתה ונסכה
(113310, -65, 4);20;כ;238435;(4, 29, 39, 53, 238435);62725;(4, 29, 39, 9, 62725);ולמנחתיכם;8;9;אלה תעשו ליהוה במועדיכם לבד מנדריכם ונדבתיכם לעלתיכם ולמנחתיכם ולנסכיכם ולשלמיכם
(113310, -65, 4);1;א;238500;(4, 30, 2, 12, 238500);62742;(4, 30, 2, 4, 62742);ראשי;2;4;וידבר משה אל ראשי המטות לבני ישראל לאמר זה הדבר אשר צוה יהוה
(113310, -65, 4);60;ס;238565;(4, 30, 3, 29, 238565);62760;(4, 30, 3, 9, 62760);לאסר;3;9;איש כי ידר נדר ליהוה או השבע שבעה לאסר אסר על נפשו לא יחל דברו ככל היצא מפיו יעשה
(113310, -65, 4);2;ב;238630;(4, 30, 4, 31, 238630);62779;(4, 30, 4, 9, 62779);אביה;2;9;ואשה כי תדר נדר ליהוה ואסרה אסר בבית אביה בנעריה
(113310, -65, 4);20;כ;238695;(4, 30, 5, 57, 238695);62796;(4, 30, 5, 16, 62796);וכל;2;16;ושמע אביה את נדרה ואסרה אשר אסרה על נפשה והחריש לה אביה וקמו כל נדריה וכל אסר אשר אסרה על נפשה יקום
(113310, -65, 4);30;ל;238760;(4, 30, 6, 44, 238760);62814;(4, 30, 6, 12, 62814);על;2;12;ואם הניא אביה אתה ביום שמעו כל נדריה ואסריה אשר אסרה על נפשה לא יקום ויהוה יסלח לה כי הניא אביה אתה
(113310, -65, 4);300;ש;238825;(4, 30, 7, 31, 238825);62833;(4, 30, 7, 9, 62833);שפתיה;1;9;ואם היו תהיה לאיש ונדריה עליה או מבטא שפתיה אשר אסרה על נפשה
(113310, -65, 4);50;נ;238890;(4, 30, 8, 48, 238890);62850;(4, 30, 8, 13, 62850);נפשה;1;13;ושמע אישה ביום שמעו והחריש לה וקמו נדריה ואסרה אשר אסרה על נפשה יקמו
(113310, -65, 4);5;ה;238955;(4, 30, 9, 58, 238955);62867;(4, 30, 9, 16, 62867);אסרה;4;16;ואם ביום שמע אישה יניא אותה והפר את נדרה אשר עליה ואת מבטא שפתיה אשר אסרה על נפשה ויהוה יסלח לה
(113310, -65, 4);5;ה;239020;(4, 30, 11, 10, 239020);62885;(4, 30, 11, 3, 62885);אישה;4;3;ואם בית אישה נדרה או אסרה אסר על נפשה בשבעה
(113310, -65, 4);200;ר;239085;(4, 30, 12, 41, 239085);62904;(4, 30, 12, 12, 62904);אסר;3;12;ושמע אישה והחרש לה לא הניא אתה וקמו כל נדריה וכל אסר אשר אסרה על נפשה יקום
