(n,d,k);LetterGematriaNumberValue;Letter;LetterPositionIndex;LetterCoordinatesD5K;WordNumber;WordCoordinatesDWTK;Found in Word in Text;LetterPositionIndex In Word;WordNumberInVerse;Found In Verse
(301653, 56, 4);5;ה;37;(1, 1, 2, 9, 37);9;(1, 1, 2, 2, 9);היתה;4;2;והארץ היתה תהו ובהו וחשך על פני תהום ורוח אלהים מרחפת על פני המים
(301653, 56, 4);10;י;93;(1, 1, 3, 13, 93);24;(1, 1, 3, 3, 24);יהי;3;3;ויאמר אלהים יהי אור ויהי אור
(301653, 56, 4);6;ו;149;(1, 1, 5, 1, 149);40;(1, 1, 5, 1, 40);ויקרא;1;1;ויקרא אלהים לאור יום ולחשך קרא לילה ויהי ערב ויהי בקר יום אחד
(301653, 56, 4);5;ה;205;(1, 1, 6, 8, 205);54;(1, 1, 6, 2, 54);אלהים;3;2;ויאמר אלהים יהי רקיע בתוך המים ויהי מבדיל בין מים למים
(301653, 56, 4);4;ד;261;(1, 1, 7, 20, 261);68;(1, 1, 7, 5, 68);ויבדל;4;5;ויעש אלהים את הרקיע ויבדל בין המים אשר מתחת לרקיע ובין המים אשר מעל לרקיע ויהי כן
(301653, 56, 4);30;ל;317;(1, 1, 8, 11, 317);83;(1, 1, 8, 3, 83);לרקיע;1;3;ויקרא אלהים לרקיע שמים ויהי ערב ויהי בקר יום שני
(301653, 56, 4);1;א;373;(1, 1, 9, 28, 373);97;(1, 1, 9, 7, 97);אל;1;7;ויאמר אלהים יקוו המים מתחת השמים אל מקום אחד ותראה היבשה ויהי כן
(301653, 56, 4);10;י;429;(1, 1, 10, 32, 429);111;(1, 1, 10, 8, 111);ימים;1;8;ויקרא אלהים ליבשה ארץ ולמקוה המים קרא ימים וירא אלהים כי טוב
(301653, 56, 4);300;ש;485;(1, 1, 11, 39, 485);126;(1, 1, 11, 11, 126);עשה;2;11;ויאמר אלהים תדשא הארץ דשא עשב מזריע זרע עץ פרי עשה פרי למינו אשר זרעו בו על הארץ ויהי כן
(301653, 56, 4);10;י;541;(1, 1, 12, 26, 541);142;(1, 1, 12, 7, 142);למינהו;3;7;ותוצא הארץ דשא עשב מזריע זרע למינהו ועץ עשה פרי אשר זרעו בו למינהו וירא אלהים כי טוב
(301653, 56, 4);10;י;597;(1, 1, 13, 15, 597);158;(1, 1, 13, 5, 158);יום;1;5;ויהי ערב ויהי בקר יום שלישי
(301653, 56, 4);5;ה;653;(1, 1, 14, 49, 653);170;(1, 1, 14, 11, 170);הלילה;5;11;ויאמר אלהים יהי מארת ברקיע השמים להבדיל בין היום ובין הלילה והיו לאתת ולמועדים ולימים ושנים
(301653, 56, 4);1;א;709;(1, 1, 15, 29, 709);182;(1, 1, 15, 7, 182);הארץ;2;7;והיו למאורת ברקיע השמים להאיר על הארץ ויהי כן
(301653, 56, 4);1;א;765;(1, 1, 16, 48, 765);196;(1, 1, 16, 12, 196);ואת;2;12;ויעש אלהים את שני המארת הגדלים את המאור הגדל לממשלת היום ואת המאור הקטן לממשלת הלילה ואת הכוכבים
(301653, 56, 4);1;א;821;(1, 1, 17, 25, 821);208;(1, 1, 17, 6, 208);להאיר;3;6;ויתן אתם אלהים ברקיע השמים להאיר על הארץ
(301653, 56, 4);10;י;877;(1, 1, 18, 48, 877);221;(1, 1, 18, 11, 221);כי;2;11;ולמשל ביום ובלילה ולהבדיל בין האור ובין החשך וירא אלהים כי טוב
(301653, 56, 4);6;ו;933;(1, 1, 20, 31, 933);236;(1, 1, 20, 8, 236);ועוף;3;8;ויאמר אלהים ישרצו המים שרץ נפש חיה ועוף יעופף על הארץ על פני רקיע השמים
(301653, 56, 4);50;נ;989;(1, 1, 21, 30, 989);251;(1, 1, 21, 8, 251);נפש;1;8;ויברא אלהים את התנינם הגדלים ואת כל נפש החיה הרמשת אשר שרצו המים למינהם ואת כל עוף כנף למינהו וירא אלהים כי טוב
(301653, 56, 4);10;י;1045;(1, 1, 21, 86, 1045);265;(1, 1, 21, 22, 265);כי;2;22;ויברא אלהים את התנינם הגדלים ואת כל נפש החיה הרמשת אשר שרצו המים למינהם ואת כל עוף כנף למינהו וירא אלהים כי טוב
(301653, 56, 4);6;ו;1101;(1, 1, 23, 1, 1101);280;(1, 1, 23, 1, 280);ויהי;1;1;ויהי ערב ויהי בקר יום חמישי
(301653, 56, 4);200;ר;1157;(1, 1, 24, 35, 1157);294;(1, 1, 24, 9, 294);ורמש;2;9;ויאמר אלהים תוצא הארץ נפש חיה למינה בהמה ורמש וחיתו ארץ למינה ויהי כן
(301653, 56, 4);50;נ;1213;(1, 1, 25, 35, 1213);308;(1, 1, 25, 9, 308);למינה;4;9;ויעש אלהים את חית הארץ למינה ואת הבהמה למינה ואת כל רמש האדמה למינהו וירא אלהים כי טוב
(301653, 56, 4);50;נ;1269;(1, 1, 26, 22, 1269);322;(1, 1, 26, 5, 322);בצלמנו;5;5;ויאמר אלהים נעשה אדם בצלמנו כדמותנו וירדו בדגת הים ובעוף השמים ובבהמה ובכל הארץ ובכל הרמש הרמש על הארץ
(301653, 56, 4);300;ש;1325;(1, 1, 26, 78, 1325);334;(1, 1, 26, 17, 334);הרמש;4;17;ויאמר אלהים נעשה אדם בצלמנו כדמותנו וירדו בדגת הים ובעוף השמים ובבהמה ובכל הארץ ובכל הרמש הרמש על הארץ
(301653, 56, 4);40;ם;1381;(1, 1, 27, 50, 1381);349;(1, 1, 27, 13, 349);אתם;3;13;ויברא אלהים את האדם בצלמו בצלם אלהים ברא אתו זכר ונקבה ברא אתם
(301653, 56, 4);3;ג;1437;(1, 1, 28, 56, 1437);363;(1, 1, 28, 14, 363);בדגת;3;14;ויברך אתם אלהים ויאמר להם אלהים פרו ורבו ומלאו את הארץ וכבשה ורדו בדגת הים ובעוף השמים ובכל חיה הרמשת על הארץ
(301653, 56, 4);30;ל;1493;(1, 1, 29, 24, 1493);378;(1, 1, 29, 7, 378);כל;2;7;ויאמר אלהים הנה נתתי לכם את כל עשב זרע זרע אשר על פני כל הארץ ואת כל העץ אשר בו פרי עץ זרע זרע לכם יהיה לאכלה
(301653, 56, 4);1;א;1549;(1, 1, 29, 80, 1549);398;(1, 1, 29, 27, 398);לאכלה;2;27;ויאמר אלהים הנה נתתי לכם את כל עשב זרע זרע אשר על פני כל הארץ ואת כל העץ אשר בו פרי עץ זרע זרע לכם יהיה לאכלה
(301653, 56, 4);10;י;1605;(1, 1, 30, 53, 1605);415;(1, 1, 30, 17, 415);ירק;1;17;ולכל חית הארץ ולכל עוף השמים ולכל רומש על הארץ אשר בו נפש חיה את כל ירק עשב לאכלה ויהי כן
(301653, 56, 4);10;י;1661;(1, 1, 31, 40, 1661);431;(1, 1, 31, 12, 431);ויהי;4;12;וירא אלהים את כל אשר עשה והנה טוב מאד ויהי ערב ויהי בקר יום הששי
(301653, 56, 4);400;ת;1717;(1, 2, 2, 24, 1717);444;(1, 2, 2, 5, 444);מלאכתו;5;5;ויכל אלהים ביום השביעי מלאכתו אשר עשה וישבת ביום השביעי מכל מלאכתו אשר עשה
(301653, 56, 4);10;י;1773;(1, 2, 3, 19, 1773);458;(1, 2, 3, 5, 458);השביעי;4;5;ויברך אלהים את יום השביעי ויקדש אתו כי בו שבת מכל מלאכתו אשר ברא אלהים לעשות
(301653, 56, 4);40;ם;1829;(1, 2, 4, 14, 1829);472;(1, 2, 4, 3, 472);השמים;5;3;אלה תולדות השמים והארץ בהבראם ביום עשות יהוה אלהים ארץ ושמים
(301653, 56, 4);200;ר;1885;(1, 2, 5, 20, 1885);486;(1, 2, 5, 6, 486);בארץ;3;6;וכל שיח השדה טרם יהיה בארץ וכל עשב השדה טרם יצמח כי לא המטיר יהוה אלהים על הארץ ואדם אין לעבד את האדמה
(301653, 56, 4);5;ה;1941;(1, 2, 5, 76, 1941);503;(1, 2, 5, 23, 503);האדמה;1;23;וכל שיח השדה טרם יהיה בארץ וכל עשב השדה טרם יצמח כי לא המטיר יהוה אלהים על הארץ ואדם אין לעבד את האדמה
(301653, 56, 4);80;פ;1997;(1, 2, 7, 22, 1997);518;(1, 2, 7, 6, 518);עפר;2;6;וייצר יהוה אלהים את האדם עפר מן האדמה ויפח באפיו נשמת חיים ויהי האדם לנפש חיה
(301653, 56, 4);2;ב;2053;(1, 2, 8, 16, 2053);533;(1, 2, 8, 5, 533);בעדן;1;5;ויטע יהוה אלהים גן בעדן מקדם וישם שם את האדם אשר יצר
(301653, 56, 4);40;מ;2109;(1, 2, 9, 31, 2109);549;(1, 2, 9, 9, 549);למראה;2;9;ויצמח יהוה אלהים מן האדמה כל עץ נחמד למראה וטוב למאכל ועץ החיים בתוך הגן ועץ הדעת טוב ורע
(301653, 56, 4);6;ו;2165;(1, 2, 10, 16, 2165);563;(1, 2, 10, 4, 563);להשקות;5;4;ונהר יצא מעדן להשקות את הגן ומשם יפרד והיה לארבעה ראשים
(301653, 56, 4);8;ח;2221;(1, 2, 11, 27, 2221);579;(1, 2, 11, 9, 579);החוילה;2;9;שם האחד פישון הוא הסבב את כל ארץ החוילה אשר שם הזהב
(301653, 56, 4);10;י;2277;(1, 2, 13, 13, 2277);594;(1, 2, 13, 4, 594);גיחון;2;4;ושם הנהר השני גיחון הוא הסובב את כל ארץ כוש
(301653, 56, 4);50;נ;2333;(1, 2, 14, 35, 2333);609;(1, 2, 14, 9, 609);והנהר;3;9;ושם הנהר השלישי חדקל הוא ההלך קדמת אשור והנהר הרביעי הוא פרת
(301653, 56, 4);5;ה;2389;(1, 2, 15, 42, 2389);622;(1, 2, 15, 10, 622);ולשמרה;6;10;ויקח יהוה אלהים את האדם וינחהו בגן עדן לעבדה ולשמרה
(301653, 56, 4);1;א;2445;(1, 2, 17, 18, 2445);639;(1, 2, 17, 6, 639);תאכל;2;6;ומעץ הדעת טוב ורע לא תאכל ממנו כי ביום אכלך ממנו מות תמות
(301653, 56, 4);2;ב;2501;(1, 2, 18, 29, 2501);654;(1, 2, 18, 8, 654);לבדו;2;8;ויאמר יהוה אלהים לא טוב היות האדם לבדו אעשה לו עזר כנגדו
(301653, 56, 4);40;מ;2557;(1, 2, 19, 40, 2557);670;(1, 2, 19, 12, 670);השמים;3;12;ויצר יהוה אלהים מן האדמה כל חית השדה ואת כל עוף השמים ויבא אל האדם לראות מה יקרא לו וכל אשר יקרא לו האדם נפש חיה הוא שמו
(301653, 56, 4);100;ק;2613;(1, 2, 20, 3, 2613);687;(1, 2, 20, 1, 687);ויקרא;3;1;ויקרא האדם שמות לכל הבהמה ולעוף השמים ולכל חית השדה ולאדם לא מצא עזר כנגדו
(301653, 56, 4);4;ד;2669;(1, 2, 20, 59, 2669);701;(1, 2, 20, 15, 701);כנגדו;4;15;ויקרא האדם שמות לכל הבהמה ולעוף השמים ולכל חית השדה ולאדם לא מצא עזר כנגדו
(301653, 56, 4);50;נ;2725;(1, 2, 21, 55, 2725);714;(1, 2, 21, 13, 714);תחתנה;4;13;ויפל יהוה אלהים תרדמה על האדם ויישן ויקח אחת מצלעתיו ויסגר בשר תחתנה
(301653, 56, 4);40;ם;2781;(1, 2, 23, 9, 2781);729;(1, 2, 23, 2, 729);האדם;4;2;ויאמר האדם זאת הפעם עצם מעצמי ובשר מבשרי לזאת יקרא אשה כי מאיש לקחה זאת
(301653, 56, 4);2;ב;2837;(1, 2, 24, 8, 2837);745;(1, 2, 24, 3, 745);יעזב;4;3;על כן יעזב איש את אביו ואת אמו ודבק באשתו והיו לבשר אחד
(301653, 56, 4);6;ו;2893;(1, 2, 25, 21, 2893);760;(1, 2, 25, 5, 760);ואשתו;1;5;ויהיו שניהם ערומים האדם ואשתו ולא יתבששו
(301653, 56, 4);1;א;2949;(1, 3, 1, 43, 2949);774;(1, 3, 1, 12, 774);אל;1;12;והנחש היה ערום מכל חית השדה אשר עשה יהוה אלהים ויאמר אל האשה אף כי אמר אלהים לא תאכלו מכל עץ הגן
(301653, 56, 4);50;ן;3005;(1, 3, 2, 24, 3005);791;(1, 3, 2, 7, 791);הגן;3;7;ותאמר האשה אל הנחש מפרי עץ הגן נאכל
(301653, 56, 4);6;ו;3061;(1, 3, 3, 52, 3061);807;(1, 3, 3, 15, 807);תמתון;4;15;ומפרי העץ אשר בתוך הגן אמר אלהים לא תאכלו ממנו ולא תגעו בו פן תמתון
(301653, 56, 4);8;ח;3117;(1, 3, 5, 30, 3117);822;(1, 3, 5, 8, 822);ונפקחו;5;8;כי ידע אלהים כי ביום אכלכם ממנו ונפקחו עיניכם והייתם כאלהים ידעי טוב ורע
(301653, 56, 4);6;ו;3173;(1, 3, 6, 27, 3173);836;(1, 3, 6, 8, 836);תאוה;3;8;ותרא האשה כי טוב העץ למאכל וכי תאוה הוא לעינים ונחמד העץ להשכיל ותקח מפריו ותאכל ותתן גם לאישה עמה ויאכל
(301653, 56, 4);20;כ;3229;(1, 3, 6, 83, 3229);849;(1, 3, 6, 21, 849);ויאכל;4;21;ותרא האשה כי טוב העץ למאכל וכי תאוה הוא לעינים ונחמד העץ להשכיל ותקח מפריו ותאכל ותתן גם לאישה עמה ויאכל
(301653, 56, 4);400;ת;3285;(1, 3, 7, 55, 3285);862;(1, 3, 7, 13, 862);חגרת;4;13;ותפקחנה עיני שניהם וידעו כי עירמם הם ויתפרו עלה תאנה ויעשו להם חגרת
(301653, 56, 4);10;י;3341;(1, 3, 8, 56, 3341);876;(1, 3, 8, 14, 876);יהוה;1;14;וישמעו את קול יהוה אלהים מתהלך בגן לרוח היום ויתחבא האדם ואשתו מפני יהוה אלהים בתוך עץ הגן
(301653, 56, 4);100;ק;3397;(1, 3, 10, 8, 3397);891;(1, 3, 10, 3, 891);קלך;1;3;ויאמר את קלך שמעתי בגן ואירא כי עירם אנכי ואחבא
(301653, 56, 4);5;ה;3453;(1, 3, 11, 26, 3453);907;(1, 3, 11, 9, 907);העץ;1;9;ויאמר מי הגיד לך כי עירם אתה המן העץ אשר צויתיך לבלתי אכל ממנו אכלת
(301653, 56, 4);400;ת;3509;(1, 3, 12, 29, 3509);921;(1, 3, 12, 8, 921);נתנה;2;8;ויאמר האדם האשה אשר נתתה עמדי הוא נתנה לי מן העץ ואכל
(301653, 56, 4);10;י;3565;(1, 3, 13, 43, 3565);936;(1, 3, 13, 11, 936);השיאני;3;11;ויאמר יהוה אלהים לאשה מה זאת עשית ותאמר האשה הנחש השיאני ואכל
(301653, 56, 4);8;ח;3621;(1, 3, 14, 49, 3621);951;(1, 3, 14, 14, 951);חית;1;14;ויאמר יהוה אלהים אל הנחש כי עשית זאת ארור אתה מכל הבהמה ומכל חית השדה על גחנך תלך ועפר תאכל כל ימי חייך
(301653, 56, 4);10;י;3677;(1, 3, 15, 24, 3677);966;(1, 3, 15, 6, 966);ובין;3;6;ואיבה אשית בינך ובין האשה ובין זרעך ובין זרעה הוא ישופך ראש ואתה תשופנו עקב
(301653, 56, 4);90;צ;3733;(1, 3, 16, 19, 3733);981;(1, 3, 16, 6, 981);עצבונך;2;6;אל האשה אמר הרבה ארבה עצבונך והרנך בעצב תלדי בנים ואל אישך תשוקתך והוא ימשל בך
(301653, 56, 4);40;מ;3789;(1, 3, 17, 12, 3789);995;(1, 3, 17, 4, 995);שמעת;2;4;ולאדם אמר כי שמעת לקול אשתך ותאכל מן העץ אשר צויתיך לאמר לא תאכל ממנו ארורה האדמה בעבורך בעצבון תאכלנה כל ימי חייך
(301653, 56, 4);2;ב;3845;(1, 3, 17, 68, 3845);1009;(1, 3, 17, 18, 1009);בעבורך;3;18;ולאדם אמר כי שמעת לקול אשתך ותאכל מן העץ אשר צויתיך לאמר לא תאכל ממנו ארורה האדמה בעבורך בעצבון תאכלנה כל ימי חייך
(301653, 56, 4);7;ז;3901;(1, 3, 19, 2, 3901);1023;(1, 3, 19, 1, 1023);בזעת;2;1;בזעת אפיך תאכל לחם עד שובך אל האדמה כי ממנה לקחת כי עפר אתה ואל עפר תשוב
(301653, 56, 4);10;י;3957;(1, 3, 20, 2, 3957);1040;(1, 3, 20, 1, 1040);ויקרא;2;1;ויקרא האדם שם אשתו חוה כי הוא היתה אם כל חי
(301653, 56, 4);400;ת;4013;(1, 3, 21, 25, 4013);1056;(1, 3, 21, 6, 1056);כתנות;2;6;ויעש יהוה אלהים לאדם ולאשתו כתנות עור וילבשם
(301653, 56, 4);400;ת;4069;(1, 3, 22, 44, 4069);1070;(1, 3, 22, 12, 1070);ועתה;3;12;ויאמר יהוה אלהים הן האדם היה כאחד ממנו לדעת טוב ורע ועתה פן ישלח ידו ולקח גם מעץ החיים ואכל וחי לעלם
(301653, 56, 4);4;ד;4125;(1, 3, 23, 21, 4125);1085;(1, 3, 23, 5, 1085);עדן;2;5;וישלחהו יהוה אלהים מגן עדן לעבד את האדמה אשר לקח משם
(301653, 56, 4);6;ו;4181;(1, 3, 24, 35, 4181);1101;(1, 3, 24, 10, 1101);ואת;1;10;ויגרש את האדם וישכן מקדם לגן עדן את הכרבים ואת להט החרב המתהפכת לשמר את דרך עץ החיים
(301653, 56, 4);30;ל;4237;(1, 4, 1, 24, 4237);1116;(1, 4, 1, 7, 1116);ותלד;3;7;והאדם ידע את חוה אשתו ותהר ותלד את קין ותאמר קניתי איש את יהוה
(301653, 56, 4);1;א;4293;(1, 4, 2, 31, 4293);1133;(1, 4, 2, 10, 1133);צאן;2;10;ותסף ללדת את אחיו את הבל ויהי הבל רעה צאן וקין היה עבד אדמה
(301653, 56, 4);5;ה;4349;(1, 4, 4, 5, 4349);1148;(1, 4, 4, 2, 1148);הביא;1;2;והבל הביא גם הוא מבכרות צאנו ומחלבהן וישע יהוה אל הבל ואל מנחתו
(301653, 56, 4);40;מ;4405;(1, 4, 5, 10, 4405);1163;(1, 4, 5, 4, 1163);מנחתו;1;4;ואל קין ואל מנחתו לא שעה ויחר לקין מאד ויפלו פניו
(301653, 56, 4);50;נ;4461;(1, 4, 6, 27, 4461);1179;(1, 4, 6, 9, 1179);נפלו;1;9;ויאמר יהוה אל קין למה חרה לך ולמה נפלו פניך
(301653, 56, 4);400;ת;4517;(1, 4, 7, 49, 4517);1193;(1, 4, 7, 13, 1193);ואתה;3;13;הלוא אם תיטיב שאת ואם לא תיטיב לפתח חטאת רבץ ואליך תשוקתו ואתה תמשל בו
(301653, 56, 4);10;י;4573;(1, 4, 8, 49, 4573);1209;(1, 4, 8, 14, 1209);ויהרגהו;2;14;ויאמר קין אל הבל אחיו ויהי בהיותם בשדה ויקם קין אל הבל אחיו ויהרגהו
(301653, 56, 4);200;ר;4629;(1, 4, 10, 5, 4629);1223;(1, 4, 10, 1, 1223);ויאמר;5;1;ויאמר מה עשית קול דמי אחיך צעקים אלי מן האדמה
(301653, 56, 4);5;ה;4685;(1, 4, 11, 25, 4685);1239;(1, 4, 11, 7, 1239);פצתה;4;7;ועתה ארור אתה מן האדמה אשר פצתה את פיה לקחת את דמי אחיך מידך
(301653, 56, 4);5;ה;4741;(1, 4, 12, 34, 4741);1258;(1, 4, 12, 12, 1258);תהיה;4;12;כי תעבד את האדמה לא תסף תת כחה לך נע ונד תהיה בארץ
(301653, 56, 4);6;ו;4797;(1, 4, 14, 25, 4797);1274;(1, 4, 14, 8, 1274);ומפניך;1;8;הן גרשת אתי היום מעל פני האדמה ומפניך אסתר והייתי נע ונד בארץ והיה כל מצאי יהרגני
(301653, 56, 4);30;ל;4853;(1, 4, 15, 16, 4853);1288;(1, 4, 15, 5, 1288);כל;2;5;ויאמר לו יהוה לכן כל הרג קין שבעתים יקם וישם יהוה לקין אות לבלתי הכות אתו כל מצאו
(301653, 56, 4);40;מ;4909;(1, 4, 16, 8, 4909);1304;(1, 4, 16, 3, 1304);מלפני;1;3;ויצא קין מלפני יהוה וישב בארץ נוד קדמת עדן
(301653, 56, 4);5;ה;4965;(1, 4, 17, 30, 4965);1319;(1, 4, 17, 9, 1319);ויהי;3;9;וידע קין את אשתו ותהר ותלד את חנוך ויהי בנה עיר ויקרא שם העיר כשם בנו חנוך
(301653, 56, 4);8;ח;5021;(1, 4, 18, 28, 5021);1335;(1, 4, 18, 8, 1335);מחויאל;2;8;ויולד לחנוך את עירד ועירד ילד את מחויאל ומחייאל ילד את מתושאל ומתושאל ילד את למך
(301653, 56, 4);5;ה;5077;(1, 4, 19, 19, 5077);1350;(1, 4, 19, 7, 1350);האחת;1;7;ויקח לו למך שתי נשים שם האחת עדה ושם השנית צלה
(301653, 56, 4);6;ו;5133;(1, 4, 21, 7, 5133);1366;(1, 4, 21, 2, 1366);אחיו;4;2;ושם אחיו יובל הוא היה אבי כל תפש כנור ועוגב
(301653, 56, 4);200;ר;5189;(1, 4, 22, 29, 5189);1384;(1, 4, 22, 10, 1384);חרש;2;10;וצלה גם הוא ילדה את תובל קין לטש כל חרש נחשת וברזל ואחות תובל קין נעמה
(301653, 56, 4);300;ש;5245;(1, 4, 23, 30, 5245);1398;(1, 4, 23, 8, 1398);נשי;2;8;ויאמר למך לנשיו עדה וצלה שמען קולי נשי למך האזנה אמרתי כי איש הרגתי לפצעי וילד לחברתי
(301653, 56, 4);40;מ;5301;(1, 4, 24, 17, 5301);1412;(1, 4, 24, 5, 1412);ולמך;3;5;כי שבעתים יקם קין ולמך שבעים ושבעה
(301653, 56, 4);40;ם;5357;(1, 4, 25, 45, 5357);1429;(1, 4, 25, 15, 1429);אלהים;5;15;וידע אדם עוד את אשתו ותלד בן ותקרא את שמו שת כי שת לי אלהים זרע אחר תחת הבל כי הרגו קין
(301653, 56, 4);30;ל;5413;(1, 4, 26, 35, 5413);1448;(1, 4, 26, 12, 1448);לקרא;1;12;ולשת גם הוא ילד בן ויקרא את שמו אנוש אז הוחל לקרא בשם יהוה
(301653, 56, 4);20;כ;5469;(1, 5, 2, 2, 5469);1463;(1, 5, 2, 1, 1463);זכר;2;1;זכר ונקבה בראם ויברך אתם ויקרא את שמם אדם ביום הבראם
(301653, 56, 4);400;ת;5525;(1, 5, 3, 16, 5525);1477;(1, 5, 3, 4, 1477);ומאת;4;4;ויחי אדם שלשים ומאת שנה ויולד בדמותו כצלמו ויקרא את שמו שת
(301653, 56, 4);400;ת;5581;(1, 5, 4, 25, 5581);1492;(1, 5, 4, 7, 1492);שת;2;7;ויהיו ימי אדם אחרי הולידו את שת שמנה מאת שנה ויולד בנים ובנות
(301653, 56, 4);300;ש;5637;(1, 5, 5, 32, 5637);1508;(1, 5, 5, 10, 1508);ושלשים;4;10;ויהיו כל ימי אדם אשר חי תשע מאות שנה ושלשים שנה וימת
(301653, 56, 4);6;ו;5693;(1, 5, 7, 16, 5693);1523;(1, 5, 7, 4, 1523);הולידו;6;4;ויחי שת אחרי הולידו את אנוש שבע שנים ושמנה מאות שנה ויולד בנים ובנות
(301653, 56, 4);70;ע;5749;(1, 5, 8, 17, 5749);1539;(1, 5, 8, 6, 1539);עשרה;1;6;ויהיו כל ימי שת שתים עשרה שנה ותשע מאות שנה וימת
(301653, 56, 4);300;ש;5805;(1, 5, 10, 8, 5805);1553;(1, 5, 10, 2, 1553);אנוש;4;2;ויחי אנוש אחרי הולידו את קינן חמש עשרה שנה ושמנה מאות שנה ויולד בנים ובנות
(301653, 56, 4);10;י;5861;(1, 5, 11, 4, 5861);1567;(1, 5, 11, 1, 1567);ויהיו;4;1;ויהיו כל ימי אנוש חמש שנים ותשע מאות שנה וימת
(301653, 56, 4);40;מ;5917;(1, 5, 12, 24, 5917);1583;(1, 5, 12, 7, 1583);מהללאל;1;7;ויחי קינן שבעים שנה ויולד את מהללאל
(301653, 56, 4);30;ל;5973;(1, 5, 13, 51, 5973);1595;(1, 5, 13, 12, 1595);ויולד;4;12;ויחי קינן אחרי הולידו את מהללאל ארבעים שנה ושמנה מאות שנה ויולד בנים ובנות
(301653, 56, 4);30;ל;6029;(1, 5, 15, 10, 6029);1609;(1, 5, 15, 2, 1609);מהללאל;6;2;ויחי מהללאל חמש שנים וששים שנה ויולד את ירד
(301653, 56, 4);300;ש;6085;(1, 5, 16, 31, 6085);1624;(1, 5, 16, 8, 1624);שנה;1;8;ויחי מהללאל אחרי הולידו את ירד שלשים שנה ושמנה מאות שנה ויולד בנים ובנות
(301653, 56, 4);5;ה;6141;(1, 5, 17, 28, 6141);1637;(1, 5, 17, 7, 1637);שנה;3;7;ויהיו כל ימי מהללאל חמש ותשעים שנה ושמנה מאות שנה וימת
(301653, 56, 4);8;ח;6197;(1, 5, 19, 3, 6197);1652;(1, 5, 19, 1, 1652);ויחי;3;1;ויחי ירד אחרי הולידו את חנוך שמנה מאות שנה ויולד בנים ובנות
(301653, 56, 4);10;י;6253;(1, 5, 20, 11, 6253);1667;(1, 5, 20, 4, 1667);ירד;1;4;ויהיו כל ימי ירד שתים וששים שנה ותשע מאות שנה וימת
(301653, 56, 4);40;מ;6309;(1, 5, 21, 27, 6309);1682;(1, 5, 21, 8, 1682);מתושלח;1;8;ויחי חנוך חמש וששים שנה ויולד את מתושלח
(301653, 56, 4);4;ד;6365;(1, 5, 22, 51, 6365);1694;(1, 5, 22, 12, 1694);ויולד;5;12;ויתהלך חנוך את האלהים אחרי הולידו את מתושלח שלש מאות שנה ויולד בנים ובנות
(301653, 56, 4);400;ת;6421;(1, 5, 24, 12, 6421);1709;(1, 5, 24, 3, 1709);את;2;3;ויתהלך חנוך את האלהים ואיננו כי לקח אתו אלהים
(301653, 56, 4);10;י;6477;(1, 5, 25, 31, 6477);1723;(1, 5, 25, 8, 1723);ויולד;2;8;ויחי מתושלח שבע ושמנים שנה ומאת שנה ויולד את למך
(301653, 56, 4);300;ש;6533;(1, 5, 26, 48, 6533);1737;(1, 5, 26, 12, 1737);שנה;1;12;ויחי מתושלח אחרי הולידו את למך שתים ושמונים שנה ושבע מאות שנה ויולד בנים ובנות
(301653, 56, 4);10;י;6589;(1, 5, 27, 40, 6589);1751;(1, 5, 27, 11, 1751);וימת;2;11;ויהיו כל ימי מתושלח תשע וששים שנה ותשע מאות שנה וימת
(301653, 56, 4);50;נ;6645;(1, 5, 29, 20, 6645);1767;(1, 5, 29, 7, 1767);ינחמנו;2;7;ויקרא את שמו נח לאמר זה ינחמנו ממעשנו ומעצבון ידינו מן האדמה אשר אררה יהוה
(301653, 56, 4);4;ד;6701;(1, 5, 30, 16, 6701);1779;(1, 5, 30, 4, 1779);הולידו;5;4;ויחי למך אחרי הולידו את נח חמש ותשעים שנה וחמש מאת שנה ויולד בנים ובנות
(301653, 56, 4);70;ע;6757;(1, 5, 31, 15, 6757);1795;(1, 5, 31, 5, 1795);שבע;3;5;ויהי כל ימי למך שבע ושבעים שנה ושבע מאות שנה וימת
(301653, 56, 4);8;ח;6813;(1, 5, 32, 32, 6813);1813;(1, 5, 32, 12, 1813);חם;1;12;ויהי נח בן חמש מאות שנה ויולד נח את שם את חם ואת יפת
(301653, 56, 4);30;ל;6869;(1, 6, 2, 11, 6869);1829;(1, 6, 2, 3, 1829);האלהים;3;3;ויראו בני האלהים את בנות האדם כי טבת הנה ויקחו להם נשים מכל אשר בחרו
(301653, 56, 4);4;ד;6925;(1, 6, 3, 13, 6925);1845;(1, 6, 3, 4, 1845);ידון;2;4;ויאמר יהוה לא ידון רוחי באדם לעלם בשגם הוא בשר והיו ימיו מאה ועשרים שנה
