(n,d,k);LetterGematriaNumberValue;Letter;LetterPositionIndex;LetterCoordinatesD5K;WordNumber;WordCoordinatesDWTK;Found in Word in Text;LetterPositionIndex In Word;WordNumberInVerse;Found In Verse
(224277, -63, 4);6;ו;60;(1, 1, 2, 32, 60);16;(1, 1, 2, 9, 16);ורוח;3;9;והארץ היתה תהו ובהו וחשך על פני תהום ורוח אלהים מרחפת על פני המים
(224277, -63, 4);2;ב;123;(1, 1, 4, 20, 123);33;(1, 1, 4, 6, 33);טוב;3;6;וירא אלהים את האור כי טוב ויבדל אלהים בין האור ובין החשך
(224277, -63, 4);10;י;186;(1, 1, 5, 38, 186);49;(1, 1, 5, 10, 49);ויהי;2;10;ויקרא אלהים לאור יום ולחשך קרא לילה ויהי ערב ויהי בקר יום אחד
(224277, -63, 4);10;י;249;(1, 1, 7, 8, 249);65;(1, 1, 7, 2, 65);אלהים;4;2;ויעש אלהים את הרקיע ויבדל בין המים אשר מתחת לרקיע ובין המים אשר מעל לרקיע ויהי כן
(224277, -63, 4);1;א;312;(1, 1, 8, 6, 312);82;(1, 1, 8, 2, 82);אלהים;1;2;ויקרא אלהים לרקיע שמים ויהי ערב ויהי בקר יום שני
(224277, -63, 4);40;מ;375;(1, 1, 9, 30, 375);98;(1, 1, 9, 8, 98);מקום;1;8;ויאמר אלהים יקוו המים מתחת השמים אל מקום אחד ותראה היבשה ויהי כן
(224277, -63, 4);30;ל;438;(1, 1, 10, 41, 438);113;(1, 1, 10, 10, 113);אלהים;2;10;ויקרא אלהים ליבשה ארץ ולמקוה המים קרא ימים וירא אלהים כי טוב
(224277, -63, 4);6;ו;501;(1, 1, 11, 55, 501);130;(1, 1, 11, 15, 130);זרעו;4;15;ויאמר אלהים תדשא הארץ דשא עשב מזריע זרע עץ פרי עשה פרי למינו אשר זרעו בו על הארץ ויהי כן
(224277, -63, 4);40;מ;564;(1, 1, 12, 49, 564);149;(1, 1, 12, 14, 149);למינהו;2;14;ותוצא הארץ דשא עשב מזריע זרע למינהו ועץ עשה פרי אשר זרעו בו למינהו וירא אלהים כי טוב
(224277, -63, 4);5;ה;627;(1, 1, 14, 23, 627);165;(1, 1, 14, 6, 165);השמים;1;6;ויאמר אלהים יהי מארת ברקיע השמים להבדיל בין היום ובין הלילה והיו לאתת ולמועדים ולימים ושנים
(224277, -63, 4);400;ת;690;(1, 1, 15, 10, 690);177;(1, 1, 15, 2, 177);למאורת;6;2;והיו למאורת ברקיע השמים להאיר על הארץ ויהי כן
(224277, -63, 4);30;ל;753;(1, 1, 16, 36, 753);193;(1, 1, 16, 9, 193);הגדל;4;9;ויעש אלהים את שני המארת הגדלים את המאור הגדל לממשלת היום ואת המאור הקטן לממשלת הלילה ואת הכוכבים
(224277, -63, 4);40;מ;816;(1, 1, 17, 20, 816);207;(1, 1, 17, 5, 207);השמים;3;5;ויתן אתם אלהים ברקיע השמים להאיר על הארץ
(224277, -63, 4);6;ו;879;(1, 1, 18, 50, 879);222;(1, 1, 18, 12, 222);טוב;2;12;ולמשל ביום ובלילה ולהבדיל בין האור ובין החשך וירא אלהים כי טוב
(224277, -63, 4);5;ה;942;(1, 1, 20, 40, 942);239;(1, 1, 20, 11, 239);הארץ;1;11;ויאמר אלהים ישרצו המים שרץ נפש חיה ועוף יעופף על הארץ על פני רקיע השמים
(224277, -63, 4);200;ר;1005;(1, 1, 21, 46, 1005);255;(1, 1, 21, 12, 255);שרצו;2;12;ויברא אלהים את התנינם הגדלים ואת כל נפש החיה הרמשת אשר שרצו המים למינהם ואת כל עוף כנף למינהו וירא אלהים כי טוב
(224277, -63, 4);6;ו;1068;(1, 1, 22, 20, 1068);271;(1, 1, 22, 5, 271);פרו;3;5;ויברך אתם אלהים לאמר פרו ורבו ומלאו את המים בימים והעוף ירב בארץ
(224277, -63, 4);10;י;1131;(1, 1, 24, 9, 1131);287;(1, 1, 24, 2, 287);אלהים;4;2;ויאמר אלהים תוצא הארץ נפש חיה למינה בהמה ורמש וחיתו ארץ למינה ויהי כן
(224277, -63, 4);1;א;1194;(1, 1, 25, 16, 1194);304;(1, 1, 25, 5, 304);הארץ;2;5;ויעש אלהים את חית הארץ למינה ואת הבהמה למינה ואת כל רמש האדמה למינהו וירא אלהים כי טוב
(224277, -63, 4);40;ם;1257;(1, 1, 26, 10, 1257);319;(1, 1, 26, 2, 319);אלהים;5;2;ויאמר אלהים נעשה אדם בצלמנו כדמותנו וירדו בדגת הים ובעוף השמים ובבהמה ובכל הארץ ובכל הרמש הרמש על הארץ
(224277, -63, 4);40;מ;1320;(1, 1, 26, 73, 1320);333;(1, 1, 26, 16, 333);הרמש;3;16;ויאמר אלהים נעשה אדם בצלמנו כדמותנו וירדו בדגת הים ובעוף השמים ובבהמה ובכל הארץ ובכל הרמש הרמש על הארץ
(224277, -63, 4);10;י;1383;(1, 1, 28, 2, 1383);350;(1, 1, 28, 1, 350);ויברך;2;1;ויברך אתם אלהים ויאמר להם אלהים פרו ורבו ומלאו את הארץ וכבשה ורדו בדגת הים ובעוף השמים ובכל חיה הרמשת על הארץ
(224277, -63, 4);80;ף;1446;(1, 1, 28, 65, 1446);365;(1, 1, 28, 16, 365);ובעוף;5;16;ויברך אתם אלהים ויאמר להם אלהים פרו ורבו ומלאו את הארץ וכבשה ורדו בדגת הים ובעוף השמים ובכל חיה הרמשת על הארץ
(224277, -63, 4);50;נ;1509;(1, 1, 29, 40, 1509);384;(1, 1, 29, 13, 384);פני;2;13;ויאמר אלהים הנה נתתי לכם את כל עשב זרע זרע אשר על פני כל הארץ ואת כל העץ אשר בו פרי עץ זרע זרע לכם יהיה לאכלה
(224277, -63, 4);300;ש;1572;(1, 1, 30, 20, 1572);404;(1, 1, 30, 6, 404);השמים;2;6;ולכל חית הארץ ולכל עוף השמים ולכל רומש על הארץ אשר בו נפש חיה את כל ירק עשב לאכלה ויהי כן
(224277, -63, 4);1;א;1635;(1, 1, 31, 14, 1635);424;(1, 1, 31, 5, 424);אשר;1;5;וירא אלהים את כל אשר עשה והנה טוב מאד ויהי ערב ויהי בקר יום הששי
(224277, -63, 4);1;א;1698;(1, 2, 2, 5, 1698);441;(1, 2, 2, 2, 441);אלהים;1;2;ויכל אלהים ביום השביעי מלאכתו אשר עשה וישבת ביום השביעי מכל מלאכתו אשר עשה
(224277, -63, 4);30;ל;1761;(1, 2, 3, 7, 1761);455;(1, 2, 3, 2, 455);אלהים;2;2;ויברך אלהים את יום השביעי ויקדש אתו כי בו שבת מכל מלאכתו אשר ברא אלהים לעשות
(224277, -63, 4);400;ת;1824;(1, 2, 4, 9, 1824);471;(1, 2, 4, 2, 471);תולדות;6;2;אלה תולדות השמים והארץ בהבראם ביום עשות יהוה אלהים ארץ ושמים
(224277, -63, 4);6;ו;1887;(1, 2, 5, 22, 1887);487;(1, 2, 5, 7, 487);וכל;1;7;וכל שיח השדה טרם יהיה בארץ וכל עשב השדה טרם יצמח כי לא המטיר יהוה אלהים על הארץ ואדם אין לעבד את האדמה
(224277, -63, 4);70;ע;1950;(1, 2, 6, 5, 1950);505;(1, 2, 6, 2, 505);יעלה;2;2;ואד יעלה מן הארץ והשקה את כל פני האדמה
(224277, -63, 4);10;י;2013;(1, 2, 7, 38, 2013);522;(1, 2, 7, 10, 522);באפיו;4;10;וייצר יהוה אלהים את האדם עפר מן האדמה ויפח באפיו נשמת חיים ויהי האדם לנפש חיה
(224277, -63, 4);10;י;2076;(1, 2, 8, 39, 2076);540;(1, 2, 8, 12, 540);יצר;1;12;ויטע יהוה אלהים גן בעדן מקדם וישם שם את האדם אשר יצר
(224277, -63, 4);90;ץ;2139;(1, 2, 9, 61, 2139);556;(1, 2, 9, 16, 556);ועץ;3;16;ויצמח יהוה אלהים מן האדמה כל עץ נחמד למראה וטוב למאכל ועץ החיים בתוך הגן ועץ הדעת טוב ורע
(224277, -63, 4);10;י;2202;(1, 2, 11, 8, 2202);573;(1, 2, 11, 3, 573);פישון;2;3;שם האחד פישון הוא הסבב את כל ארץ החוילה אשר שם הזהב
(224277, -63, 4);6;ו;2265;(1, 2, 13, 1, 2265);591;(1, 2, 13, 1, 591);ושם;1;1;ושם הנהר השני גיחון הוא הסובב את כל ארץ כוש
(224277, -63, 4);300;ש;2328;(1, 2, 14, 30, 2328);608;(1, 2, 14, 8, 608);אשור;2;8;ושם הנהר השלישי חדקל הוא ההלך קדמת אשור והנהר הרביעי הוא פרת
(224277, -63, 4);10;י;2391;(1, 2, 16, 2, 2391);623;(1, 2, 16, 1, 623);ויצו;2;1;ויצו יהוה אלהים על האדם לאמר מכל עץ הגן אכל תאכל
(224277, -63, 4);2;ב;2454;(1, 2, 17, 27, 2454);642;(1, 2, 17, 9, 642);ביום;1;9;ומעץ הדעת טוב ורע לא תאכל ממנו כי ביום אכלך ממנו מות תמות
(224277, -63, 4);6;ו;2517;(1, 2, 18, 45, 2517);658;(1, 2, 18, 12, 658);כנגדו;5;12;ויאמר יהוה אלהים לא טוב היות האדם לבדו אעשה לו עזר כנגדו
(224277, -63, 4);1;א;2580;(1, 2, 19, 63, 2580);676;(1, 2, 19, 18, 676);יקרא;4;18;ויצר יהוה אלהים מן האדמה כל חית השדה ואת כל עוף השמים ויבא אל האדם לראות מה יקרא לו וכל אשר יקרא לו האדם נפש חיה הוא שמו
(224277, -63, 4);30;ל;2643;(1, 2, 20, 33, 2643);694;(1, 2, 20, 8, 694);ולכל;2;8;ויקרא האדם שמות לכל הבהמה ולעוף השמים ולכל חית השדה ולאדם לא מצא עזר כנגדו
(224277, -63, 4);400;ת;2706;(1, 2, 21, 36, 2706);710;(1, 2, 21, 9, 710);אחת;3;9;ויפל יהוה אלהים תרדמה על האדם ויישן ויקח אחת מצלעתיו ויסגר בשר תחתנה
(224277, -63, 4);5;ה;2769;(1, 2, 22, 43, 2769);727;(1, 2, 22, 13, 727);האדם;1;13;ויבן יהוה אלהים את הצלע אשר לקח מן האדם לאשה ויבאה אל האדם
(224277, -63, 4);20;כ;2832;(1, 2, 24, 3, 2832);744;(1, 2, 24, 2, 744);כן;1;2;על כן יעזב איש את אביו ואת אמו ודבק באשתו והיו לבשר אחד
(224277, -63, 4);300;ש;2895;(1, 2, 25, 23, 2895);760;(1, 2, 25, 5, 760);ואשתו;3;5;ויהיו שניהם ערומים האדם ואשתו ולא יתבששו
(224277, -63, 4);10;י;2958;(1, 3, 1, 52, 2958);777;(1, 3, 1, 15, 777);כי;2;15;והנחש היה ערום מכל חית השדה אשר עשה יהוה אלהים ויאמר אל האשה אף כי אמר אלהים לא תאכלו מכל עץ הגן
(224277, -63, 4);2;ב;3021;(1, 3, 3, 12, 3021);796;(1, 3, 3, 4, 796);בתוך;1;4;ומפרי העץ אשר בתוך הגן אמר אלהים לא תאכלו ממנו ולא תגעו בו פן תמתון
(224277, -63, 4);40;מ;3084;(1, 3, 4, 22, 3084);814;(1, 3, 4, 7, 814);תמתון;2;7;ויאמר הנחש אל האשה לא מות תמתון
(224277, -63, 4);6;ו;3147;(1, 3, 6, 1, 3147);829;(1, 3, 6, 1, 829);ותרא;1;1;ותרא האשה כי טוב העץ למאכל וכי תאוה הוא לעינים ונחמד העץ להשכיל ותקח מפריו ותאכל ותתן גם לאישה עמה ויאכל
(224277, -63, 4);20;כ;3210;(1, 3, 6, 64, 3210);844;(1, 3, 6, 16, 844);ותאכל;4;16;ותרא האשה כי טוב העץ למאכל וכי תאוה הוא לעינים ונחמד העץ להשכיל ותקח מפריו ותאכל ותתן גם לאישה עמה ויאכל
(224277, -63, 4);5;ה;3273;(1, 3, 7, 43, 3273);859;(1, 3, 7, 10, 859);תאנה;4;10;ותפקחנה עיני שניהם וידעו כי עירמם הם ויתפרו עלה תאנה ויעשו להם חגרת
(224277, -63, 4);6;ו;3336;(1, 3, 8, 51, 3336);874;(1, 3, 8, 12, 874);ואשתו;5;12;וישמעו את קול יהוה אלהים מתהלך בגן לרוח היום ויתחבא האדם ואשתו מפני יהוה אלהים בתוך עץ הגן
(224277, -63, 4);20;ך;3399;(1, 3, 10, 10, 3399);891;(1, 3, 10, 3, 891);קלך;3;3;ויאמר את קלך שמעתי בגן ואירא כי עירם אנכי ואחבא
(224277, -63, 4);400;ת;3462;(1, 3, 11, 35, 3462);909;(1, 3, 11, 11, 909);צויתיך;4;11;ויאמר מי הגיד לך כי עירם אתה המן העץ אשר צויתיך לבלתי אכל ממנו אכלת
(224277, -63, 4);1;א;3525;(1, 3, 13, 3, 3525);926;(1, 3, 13, 1, 926);ויאמר;3;1;ויאמר יהוה אלהים לאשה מה זאת עשית ותאמר האשה הנחש השיאני ואכל
(224277, -63, 4);30;ל;3588;(1, 3, 14, 16, 3588);941;(1, 3, 14, 4, 941);אל;2;4;ויאמר יהוה אלהים אל הנחש כי עשית זאת ארור אתה מכל הבהמה ומכל חית השדה על גחנך תלך ועפר תאכל כל ימי חייך
(224277, -63, 4);10;י;3651;(1, 3, 14, 79, 3651);960;(1, 3, 14, 23, 960);חייך;2;23;ויאמר יהוה אלהים אל הנחש כי עשית זאת ארור אתה מכל הבהמה ומכל חית השדה על גחנך תלך ועפר תאכל כל ימי חייך
(224277, -63, 4);2;ב;3714;(1, 3, 15, 61, 3714);975;(1, 3, 15, 15, 975);עקב;3;15;ואיבה אשית בינך ובין האשה ובין זרעך ובין זרעה הוא ישופך ראש ואתה תשופנו עקב
(224277, -63, 4);20;ך;3777;(1, 3, 16, 63, 3777);991;(1, 3, 16, 16, 991);בך;2;16;אל האשה אמר הרבה ארבה עצבונך והרנך בעצב תלדי בנים ואל אישך תשוקתך והוא ימשל בך
(224277, -63, 4);4;ד;3840;(1, 3, 17, 63, 3840);1008;(1, 3, 17, 17, 1008);האדמה;3;17;ולאדם אמר כי שמעת לקול אשתך ותאכל מן העץ אשר צויתיך לאמר לא תאכל ממנו ארורה האדמה בעבורך בעצבון תאכלנה כל ימי חייך
(224277, -63, 4);400;ת;3903;(1, 3, 19, 4, 3903);1023;(1, 3, 19, 1, 1023);בזעת;4;1;בזעת אפיך תאכל לחם עד שובך אל האדמה כי ממנה לקחת כי עפר אתה ואל עפר תשוב
(224277, -63, 4);40;ם;3966;(1, 3, 20, 11, 3966);1042;(1, 3, 20, 3, 1042);שם;2;3;ויקרא האדם שם אשתו חוה כי הוא היתה אם כל חי
(224277, -63, 4);40;מ;4029;(1, 3, 22, 4, 4029);1059;(1, 3, 22, 1, 1059);ויאמר;4;1;ויאמר יהוה אלהים הן האדם היה כאחד ממנו לדעת טוב ורע ועתה פן ישלח ידו ולקח גם מעץ החיים ואכל וחי לעלם
(224277, -63, 4);10;י;4092;(1, 3, 22, 67, 4092);1077;(1, 3, 22, 19, 1077);החיים;4;19;ויאמר יהוה אלהים הן האדם היה כאחד ממנו לדעת טוב ורע ועתה פן ישלח ידו ולקח גם מעץ החיים ואכל וחי לעלם
(224277, -63, 4);1;א;4155;(1, 3, 24, 9, 4155);1094;(1, 3, 24, 3, 1094);האדם;2;3;ויגרש את האדם וישכן מקדם לגן עדן את הכרבים ואת להט החרב המתהפכת לשמר את דרך עץ החיים
(224277, -63, 4);40;ם;4218;(1, 4, 1, 5, 4218);1110;(1, 4, 1, 1, 1110);והאדם;5;1;והאדם ידע את חוה אשתו ותהר ותלד את קין ותאמר קניתי איש את יהוה
(224277, -63, 4);30;ל;4281;(1, 4, 2, 19, 4281);1129;(1, 4, 2, 6, 1129);הבל;3;6;ותסף ללדת את אחיו את הבל ויהי הבל רעה צאן וקין היה עבד אדמה
(224277, -63, 4);5;ה;4344;(1, 4, 3, 36, 4344);1146;(1, 4, 3, 9, 1146);ליהוה;5;9;ויהי מקץ ימים ויבא קין מפרי האדמה מנחה ליהוה
(224277, -63, 4);8;ח;4407;(1, 4, 5, 12, 4407);1163;(1, 4, 5, 4, 1163);מנחתו;3;4;ואל קין ואל מנחתו לא שעה ויחר לקין מאד ויפלו פניו
(224277, -63, 4);30;ל;4470;(1, 4, 7, 2, 4470);1181;(1, 4, 7, 1, 1181);הלוא;2;1;הלוא אם תיטיב שאת ואם לא תיטיב לפתח חטאת רבץ ואליך תשוקתו ואתה תמשל בו
(224277, -63, 4);1;א;4533;(1, 4, 8, 9, 4533);1198;(1, 4, 8, 3, 1198);אל;1;3;ויאמר קין אל הבל אחיו ויהי בהיותם בשדה ויקם קין אל הבל אחיו ויהרגהו
(224277, -63, 4);2;ב;4596;(1, 4, 9, 18, 4596);1215;(1, 4, 9, 6, 1215);הבל;2;6;ויאמר יהוה אל קין אי הבל אחיך ויאמר לא ידעתי השמר אחי אנכי
(224277, -63, 4);40;מ;4659;(1, 4, 10, 35, 4659);1232;(1, 4, 10, 10, 1232);האדמה;4;10;ויאמר מה עשית קול דמי אחיך צעקים אלי מן האדמה
(224277, -63, 4);1;א;4722;(1, 4, 12, 15, 4722);1251;(1, 4, 12, 5, 1251);לא;2;5;כי תעבד את האדמה לא תסף תת כחה לך נע ונד תהיה בארץ
(224277, -63, 4);40;ם;4785;(1, 4, 14, 13, 4785);1270;(1, 4, 14, 4, 1270);היום;4;4;הן גרשת אתי היום מעל פני האדמה ומפניך אסתר והייתי נע ונד בארץ והיה כל מצאי יהרגני
(224277, -63, 4);5;ה;4848;(1, 4, 15, 11, 4848);1286;(1, 4, 15, 3, 1286);יהוה;4;3;ויאמר לו יהוה לכן כל הרג קין שבעתים יקם וישם יהוה לקין אות לבלתי הכות אתו כל מצאו
(224277, -63, 4);80;פ;4911;(1, 4, 16, 10, 4911);1304;(1, 4, 16, 3, 1304);מלפני;3;3;ויצא קין מלפני יהוה וישב בארץ נוד קדמת עדן
(224277, -63, 4);10;י;4974;(1, 4, 17, 39, 4974);1322;(1, 4, 17, 12, 1322);ויקרא;2;12;וידע קין את אשתו ותהר ותלד את חנוך ויהי בנה עיר ויקרא שם העיר כשם בנו חנוך
(224277, -63, 4);400;ת;5037;(1, 4, 18, 44, 5037);1338;(1, 4, 18, 11, 1338);את;2;11;ויולד לחנוך את עירד ועירד ילד את מחויאל ומחייאל ילד את מתושאל ומתושאל ילד את למך
(224277, -63, 4);4;ד;5100;(1, 4, 20, 6, 5100);1356;(1, 4, 20, 2, 1356);עדה;2;2;ותלד עדה את יבל הוא היה אבי ישב אהל ומקנה
(224277, -63, 4);30;ל;5163;(1, 4, 22, 3, 5163);1375;(1, 4, 22, 1, 1375);וצלה;3;1;וצלה גם הוא ילדה את תובל קין לטש כל חרש נחשת וברזל ואחות תובל קין נעמה
(224277, -63, 4);300;ש;5226;(1, 4, 23, 11, 5226);1393;(1, 4, 23, 3, 1393);לנשיו;3;3;ויאמר למך לנשיו עדה וצלה שמען קולי נשי למך האזנה אמרתי כי איש הרגתי לפצעי וילד לחברתי
(224277, -63, 4);70;ע;5289;(1, 4, 24, 5, 5289);1409;(1, 4, 24, 2, 1409);שבעתים;3;2;כי שבעתים יקם קין ולמך שבעים ושבעה
(224277, -63, 4);10;י;5352;(1, 4, 25, 40, 5352);1428;(1, 4, 25, 14, 1428);לי;2;14;וידע אדם עוד את אשתו ותלד בן ותקרא את שמו שת כי שת לי אלהים זרע אחר תחת הבל כי הרגו קין
(224277, -63, 4);200;ר;5415;(1, 4, 26, 37, 5415);1448;(1, 4, 26, 12, 1448);לקרא;3;12;ולשת גם הוא ילד בן ויקרא את שמו אנוש אז הוחל לקרא בשם יהוה
(224277, -63, 4);1;א;5478;(1, 5, 2, 11, 5478);1465;(1, 5, 2, 3, 1465);בראם;3;3;זכר ונקבה בראם ויברך אתם ויקרא את שמם אדם ביום הבראם
(224277, -63, 4);90;צ;5541;(1, 5, 3, 32, 5541);1481;(1, 5, 3, 8, 1481);כצלמו;2;8;ויחי אדם שלשים ומאת שנה ויולד בדמותו כצלמו ויקרא את שמו שת
(224277, -63, 4);6;ו;5604;(1, 5, 4, 48, 5604);1498;(1, 5, 4, 13, 1498);ובנות;4;13;ויהיו ימי אדם אחרי הולידו את שת שמנה מאת שנה ויולד בנים ובנות
(224277, -63, 4);6;ו;5667;(1, 5, 6, 21, 5667);1517;(1, 5, 6, 7, 1517);ויולד;1;7;ויחי שת חמש שנים ומאת שנה ויולד את אנוש
(224277, -63, 4);50;נ;5730;(1, 5, 7, 53, 5730);1533;(1, 5, 7, 14, 1533);ובנות;3;14;ויחי שת אחרי הולידו את אנוש שבע שנים ושמנה מאות שנה ויולד בנים ובנות
(224277, -63, 4);400;ת;5793;(1, 5, 9, 23, 5793);1550;(1, 5, 9, 6, 1550);את;2;6;ויחי אנוש תשעים שנה ויולד את קינן
(224277, -63, 4);6;ו;5856;(1, 5, 10, 59, 5856);1566;(1, 5, 10, 15, 1566);ובנות;4;15;ויחי אנוש אחרי הולידו את קינן חמש עשרה שנה ושמנה מאות שנה ויולד בנים ובנות
(224277, -63, 4);30;ל;5919;(1, 5, 12, 26, 5919);1583;(1, 5, 12, 7, 1583);מהללאל;3;7;ויחי קינן שבעים שנה ויולד את מהללאל
(224277, -63, 4);6;ו;5982;(1, 5, 13, 60, 5982);1597;(1, 5, 13, 14, 1597);ובנות;4;14;ויחי קינן אחרי הולידו את מהללאל ארבעים שנה ושמנה מאות שנה ויולד בנים ובנות
(224277, -63, 4);6;ו;6045;(1, 5, 15, 26, 6045);1614;(1, 5, 15, 7, 1614);ויולד;1;7;ויחי מהללאל חמש שנים וששים שנה ויולד את ירד
(224277, -63, 4);40;ם;6108;(1, 5, 16, 54, 6108);1629;(1, 5, 16, 13, 1629);בנים;4;13;ויחי מהללאל אחרי הולידו את ירד שלשים שנה ושמנה מאות שנה ויולד בנים ובנות
(224277, -63, 4);300;ש;6171;(1, 5, 18, 14, 6171);1645;(1, 5, 18, 4, 1645);וששים;3;4;ויחי ירד שתים וששים שנה ומאת שנה ויולד את חנוך
(224277, -63, 4);2;ב;6234;(1, 5, 19, 40, 6234);1662;(1, 5, 19, 11, 1662);בנים;1;11;ויחי ירד אחרי הולידו את חנוך שמנה מאות שנה ויולד בנים ובנות
(224277, -63, 4);10;י;6297;(1, 5, 21, 15, 6297);1678;(1, 5, 21, 4, 1678);וששים;4;4;ויחי חנוך חמש וששים שנה ויולד את מתושלח
(224277, -63, 4);5;ה;6360;(1, 5, 22, 46, 6360);1693;(1, 5, 22, 11, 1693);שנה;3;11;ויתהלך חנוך את האלהים אחרי הולידו את מתושלח שלש מאות שנה ויולד בנים ובנות
(224277, -63, 4);1;א;6423;(1, 5, 24, 14, 6423);1710;(1, 5, 24, 4, 1710);האלהים;2;4;ויתהלך חנוך את האלהים ואיננו כי לקח אתו אלהים
(224277, -63, 4);6;ו;6486;(1, 5, 26, 1, 6486);1726;(1, 5, 26, 1, 1726);ויחי;1;1;ויחי מתושלח אחרי הולידו את למך שתים ושמונים שנה ושבע מאות שנה ויולד בנים ובנות
(224277, -63, 4);400;ת;6549;(1, 5, 26, 64, 6549);1740;(1, 5, 26, 15, 1740);ובנות;5;15;ויחי מתושלח אחרי הולידו את למך שתים ושמונים שנה ושבע מאות שנה ויולד בנים ובנות
(224277, -63, 4);6;ו;6612;(1, 5, 28, 21, 6612);1757;(1, 5, 28, 6, 1757);ומאת;1;6;ויחי למך שתים ושמנים שנה ומאת שנה ויולד בן
(224277, -63, 4);1;א;6675;(1, 5, 29, 50, 6675);1773;(1, 5, 29, 13, 1773);אשר;1;13;ויקרא את שמו נח לאמר זה ינחמנו ממעשנו ומעצבון ידינו מן האדמה אשר אררה יהוה
(224277, -63, 4);6;ו;6738;(1, 5, 30, 53, 6738);1790;(1, 5, 30, 15, 1790);ובנות;1;15;ויחי למך אחרי הולידו את נח חמש ותשעים שנה וחמש מאת שנה ויולד בנים ובנות
(224277, -63, 4);10;י;6801;(1, 5, 32, 20, 6801);1808;(1, 5, 32, 7, 1808);ויולד;2;7;ויהי נח בן חמש מאות שנה ויולד נח את שם את חם ואת יפת
(224277, -63, 4);2;ב;6864;(1, 6, 2, 6, 6864);1828;(1, 6, 2, 2, 1828);בני;1;2;ויראו בני האלהים את בנות האדם כי טבת הנה ויקחו להם נשים מכל אשר בחרו
(224277, -63, 4);50;ן;6927;(1, 6, 3, 15, 6927);1845;(1, 6, 3, 4, 1845);ידון;4;4;ויאמר יהוה לא ידון רוחי באדם לעלם בשגם הוא בשר והיו ימיו מאה ועשרים שנה
(224277, -63, 4);40;ם;6990;(1, 6, 4, 21, 6990);1861;(1, 6, 4, 5, 1861);ההם;3;5;הנפלים היו בארץ בימים ההם וגם אחרי כן אשר יבאו בני האלהים אל בנות האדם וילדו להם המה הגברים אשר מעולם אנשי השם
(224277, -63, 4);300;ש;7053;(1, 6, 4, 84, 7053);1878;(1, 6, 4, 22, 1878);אנשי;3;22;הנפלים היו בארץ בימים ההם וגם אחרי כן אשר יבאו בני האלהים אל בנות האדם וילדו להם המה הגברים אשר מעולם אנשי השם
(224277, -63, 4);10;י;7116;(1, 6, 6, 11, 7116);1897;(1, 6, 6, 3, 1897);כי;2;3;וינחם יהוה כי עשה את האדם בארץ ויתעצב אל לבו
(224277, -63, 4);40;מ;7179;(1, 6, 7, 39, 7179);1915;(1, 6, 7, 11, 1915);מאדם;1;11;ויאמר יהוה אמחה את האדם אשר בראתי מעל פני האדמה מאדם עד בהמה עד רמש ועד עוף השמים כי נחמתי כי עשיתם
(224277, -63, 4);4;ד;7242;(1, 6, 9, 7, 7242);1933;(1, 6, 9, 2, 1933);תולדת;4;2;אלה תולדת נח נח איש צדיק תמים היה בדרתיו את האלהים התהלך נח
(224277, -63, 4);40;ם;7305;(1, 6, 10, 23, 7305);1952;(1, 6, 10, 8, 1952);חם;2;8;ויולד נח שלשה בנים את שם את חם ואת יפת
(224277, -63, 4);10;י;7368;(1, 6, 12, 26, 7368);1968;(1, 6, 12, 7, 1968);כי;2;7;וירא אלהים את הארץ והנה נשחתה כי השחית כל בשר את דרכו על הארץ
(224277, -63, 4);80;פ;7431;(1, 6, 13, 41, 7431);1988;(1, 6, 13, 13, 1988);מפניהם;2;13;ויאמר אלהים לנח קץ כל בשר בא לפני כי מלאה הארץ חמס מפניהם והנני משחיתם את הארץ
(224277, -63, 4);40;מ;7494;(1, 6, 14, 42, 7494);2005;(1, 6, 14, 13, 2005);ומחוץ;2;13;עשה לך תבת עצי גפר קנים תעשה את התבה וכפרת אתה מבית ומחוץ בכפר
(224277, -63, 4);5;ה;7557;(1, 6, 15, 56, 7557);2021;(1, 6, 15, 15, 2021);קומתה;5;15;וזה אשר תעשה אתה שלש מאות אמה ארך התבה חמשים אמה רחבה ושלשים אמה קומתה
(224277, -63, 4);5;ה;7620;(1, 6, 16, 63, 7620);2036;(1, 6, 16, 15, 2036);תעשה;4;15;צהר תעשה לתבה ואל אמה תכלנה מלמעלה ופתח התבה בצדה תשים תחתים שנים ושלשים תעשה
