(302170, -60, 4);8;ח;151510;(3, 8, 15, 4, 151510);39971;(3, 8, 15, 1, 39971);וישחט;4;1;וישחט ויקח משה את הדם ויתן על קרנות המזבח סביב באצבעו ויחטא את המזבח ואת הדם יצק אל יסוד המזבח ויקדשהו לכפר עליו
(302170, -60, 4);100;ק;151570;(3, 8, 15, 64, 151570);39987;(3, 8, 15, 17, 39987);יצק;3;17;וישחט ויקח משה את הדם ויתן על קרנות המזבח סביב באצבעו ויחטא את המזבח ואת הדם יצק אל יסוד המזבח ויקדשהו לכפר עליו
(302170, -60, 4);1;א;151630;(3, 8, 16, 34, 151630);40004;(3, 8, 16, 11, 40004);ואת;2;11;ויקח את כל החלב אשר על הקרב ואת יתרת הכבד ואת שתי הכלית ואת חלבהן ויקטר משה המזבחה
(302170, -60, 4);80;ף;151690;(3, 8, 17, 29, 151690);40020;(3, 8, 17, 9, 40020);שרף;3;9;ואת הפר ואת ערו ואת בשרו ואת פרשו שרף באש מחוץ למחנה כאשר צוה יהוה את משה
(302170, -60, 4);10;י;151750;(3, 8, 18, 32, 151750);40037;(3, 8, 18, 9, 40037);ידיהם;1;9;ויקרב את איל העלה ויסמכו אהרן ובניו את ידיהם על ראש האיל
(302170, -60, 4);10;י;151810;(3, 8, 20, 18, 151810);40053;(3, 8, 20, 5, 40053);ויקטר;2;5;ואת האיל נתח לנתחיו ויקטר משה את הראש ואת הנתחים ואת הפדר
(302170, -60, 4);1;א;151870;(3, 8, 21, 32, 151870);40069;(3, 8, 21, 9, 40069);את;1;9;ואת הקרב ואת הכרעים רחץ במים ויקטר משה את כל האיל המזבחה עלה הוא לריח ניחח אשה הוא ליהוה כאשר צוה יהוה את משה
(302170, -60, 4);1;א;151930;(3, 8, 22, 6, 151930);40086;(3, 8, 22, 2, 40086);את;1;2;ויקרב את האיל השני איל המלאים ויסמכו אהרן ובניו את ידיהם על ראש האיל
(302170, -60, 4);300;ש;151990;(3, 8, 23, 11, 151990);40101;(3, 8, 23, 3, 40101);משה;2;3;וישחט ויקח משה מדמו ויתן על תנוך אזן אהרן הימנית ועל בהן ידו הימנית ועל בהן רגלו הימנית
(302170, -60, 4);6;ו;152050;(3, 8, 24, 1, 152050);40117;(3, 8, 24, 1, 40117);ויקרב;1;1;ויקרב את בני אהרן ויתן משה מן הדם על תנוך אזנם הימנית ועל בהן ידם הימנית ועל בהן רגלם הימנית ויזרק משה את הדם על המזבח סביב
(302170, -60, 4);2;ב;152110;(3, 8, 24, 61, 152110);40134;(3, 8, 24, 18, 40134);בהן;1;18;ויקרב את בני אהרן ויתן משה מן הדם על תנוך אזנם הימנית ועל בהן ידם הימנית ועל בהן רגלם הימנית ויזרק משה את הדם על המזבח סביב
(302170, -60, 4);5;ה;152170;(3, 8, 25, 24, 152170);40151;(3, 8, 25, 8, 40151);החלב;1;8;ויקח את החלב ואת האליה ואת כל החלב אשר על הקרב ואת יתרת הכבד ואת שתי הכלית ואת חלבהן ואת שוק הימין
(302170, -60, 4);90;צ;152230;(3, 8, 26, 7, 152230);40167;(3, 8, 26, 2, 40167);המצות;3;2;ומסל המצות אשר לפני יהוה לקח חלת מצה אחת וחלת לחם שמן אחת ורקיק אחד וישם על החלבים ועל שוק הימין
(302170, -60, 4);70;ע;152290;(3, 8, 26, 67, 152290);40184;(3, 8, 26, 19, 40184);ועל;2;19;ומסל המצות אשר לפני יהוה לקח חלת מצה אחת וחלת לחם שמן אחת ורקיק אחד וישם על החלבים ועל שוק הימין
(302170, -60, 4);100;ק;152350;(3, 8, 28, 3, 152350);40201;(3, 8, 28, 1, 40201);ויקח;3;1;ויקח משה אתם מעל כפיהם ויקטר המזבחה על העלה מלאים הם לריח ניחח אשה הוא ליהוה
(302170, -60, 4);10;י;152410;(3, 8, 29, 2, 152410);40217;(3, 8, 29, 1, 40217);ויקח;2;1;ויקח משה את החזה ויניפהו תנופה לפני יהוה מאיל המלאים למשה היה למנה כאשר צוה יהוה את משה
(302170, -60, 4);10;י;152470;(3, 8, 29, 62, 152470);40232;(3, 8, 29, 16, 40232);יהוה;1;16;ויקח משה את החזה ויניפהו תנופה לפני יהוה מאיל המלאים למשה היה למנה כאשר צוה יהוה את משה
(302170, -60, 4);2;ב;152530;(3, 8, 30, 52, 152530);40250;(3, 8, 30, 16, 40250);בניו;1;16;ויקח משה משמן המשחה ומן הדם אשר על המזבח ויז על אהרן על בגדיו ועל בניו ועל בגדי בניו אתו ויקדש את אהרן את בגדיו ואת בניו ואת בגדי בניו אתו
(302170, -60, 4);40;מ;152590;(3, 8, 31, 4, 152590);40266;(3, 8, 31, 1, 40266);ויאמר;4;1;ויאמר משה אל אהרן ואל בניו בשלו את הבשר פתח אהל מועד ושם תאכלו אתו ואת הלחם אשר בסל המלאים כאשר צויתי לאמר אהרן ובניו יאכלהו
(302170, -60, 4);60;ס;152650;(3, 8, 31, 64, 152650);40284;(3, 8, 31, 19, 40284);בסל;2;19;ויאמר משה אל אהרן ואל בניו בשלו את הבשר פתח אהל מועד ושם תאכלו אתו ואת הלחם אשר בסל המלאים כאשר צויתי לאמר אהרן ובניו יאכלהו
(302170, -60, 4);40;מ;152710;(3, 8, 33, 2, 152710);40297;(3, 8, 33, 1, 40297);ומפתח;2;1;ומפתח אהל מועד לא תצאו שבעת ימים עד יום מלאת ימי מלאיכם כי שבעת ימים ימלא את ידכם
(302170, -60, 4);4;ד;152770;(3, 8, 33, 62, 152770);40314;(3, 8, 33, 18, 40314);ידכם;2;18;ומפתח אהל מועד לא תצאו שבעת ימים עד יום מלאת ימי מלאיכם כי שבעת ימים ימלא את ידכם
(302170, -60, 4);5;ה;152830;(3, 8, 35, 24, 152830);40329;(3, 8, 35, 6, 40329);ולילה;5;6;ופתח אהל מועד תשבו יומם ולילה שבעת ימים ושמרתם את משמרת יהוה ולא תמותו כי כן צויתי
(302170, -60, 4);5;ה;152890;(3, 8, 36, 18, 152890);40346;(3, 8, 36, 6, 40346);הדברים;1;6;ויעש אהרן ובניו את כל הדברים אשר צוה יהוה ביד משה
(302170, -60, 4);300;ש;152950;(3, 9, 1, 39, 152950);40360;(3, 9, 1, 9, 40360);ישראל;2;9;ויהי ביום השמיני קרא משה לאהרן ולבניו ולזקני ישראל
(302170, -60, 4);30;ל;153010;(3, 9, 3, 3, 153010);40376;(3, 9, 3, 1, 40376);ואל;3;1;ואל בני ישראל תדבר לאמר קחו שעיר עזים לחטאת ועגל וכבש בני שנה תמימם לעלה
(302170, -60, 4);6;ו;153070;(3, 9, 4, 5, 153070);40392;(3, 9, 4, 2, 40392);ואיל;1;2;ושור ואיל לשלמים לזבח לפני יהוה ומנחה בלולה בשמן כי היום יהוה נראה אליכם
(302170, -60, 4);1;א;153130;(3, 9, 5, 6, 153130);40406;(3, 9, 5, 2, 40406);את;1;2;ויקחו את אשר צוה משה אל פני אהל מועד ויקרבו כל העדה ויעמדו לפני יהוה
(302170, -60, 4);4;ד;153190;(3, 9, 6, 12, 153190);40423;(3, 9, 6, 4, 40423);הדבר;2;4;ויאמר משה זה הדבר אשר צוה יהוה תעשו וירא אליכם כבוד יהוה
(302170, -60, 4);300;ש;153250;(3, 9, 7, 27, 153250);40439;(3, 9, 7, 8, 40439);ועשה;3;8;ויאמר משה אל אהרן קרב אל המזבח ועשה את חטאתך ואת עלתך וכפר בעדך ובעד העם ועשה את קרבן העם וכפר בעדם כאשר צוה יהוה
(302170, -60, 4);5;ה;153310;(3, 9, 7, 87, 153310);40456;(3, 9, 7, 25, 40456);יהוה;2;25;ויאמר משה אל אהרן קרב אל המזבח ועשה את חטאתך ואת עלתך וכפר בעדך ובעד העם ועשה את קרבן העם וכפר בעדם כאשר צוה יהוה
(302170, -60, 4);6;ו;153370;(3, 9, 9, 22, 153370);40472;(3, 9, 9, 6, 40472);אליו;4;6;ויקרבו בני אהרן את הדם אליו ויטבל אצבעו בדם ויתן על קרנות המזבח ואת הדם יצק אל יסוד המזבח
(302170, -60, 4);5;ה;153430;(3, 9, 10, 11, 153430);40489;(3, 9, 10, 4, 40489);הכלית;1;4;ואת החלב ואת הכלית ואת היתרת מן הכבד מן החטאת הקטיר המזבחה כאשר צוה יהוה את משה
(302170, -60, 4);6;ו;153490;(3, 9, 11, 8, 153490);40505;(3, 9, 11, 3, 40505);ואת;1;3;ואת הבשר ואת העור שרף באש מחוץ למחנה
(302170, -60, 4);5;ה;153550;(3, 9, 12, 39, 153550);40520;(3, 9, 12, 10, 40520);ויזרקהו;6;10;וישחט את העלה וימצאו בני אהרן אליו את הדם ויזרקהו על המזבח סביב
(302170, -60, 4);1;א;153610;(3, 9, 14, 6, 153610);40535;(3, 9, 14, 2, 40535);את;1;2;וירחץ את הקרב ואת הכרעים ויקטר על העלה המזבחה
(302170, -60, 4);400;ת;153670;(3, 9, 15, 29, 153670);40550;(3, 9, 15, 8, 40550);החטאת;5;8;ויקרב את קרבן העם ויקח את שעיר החטאת אשר לעם וישחטהו ויחטאהו כראשון
(302170, -60, 4);6;ו;153730;(3, 9, 17, 13, 153730);40564;(3, 9, 17, 4, 40564);וימלא;1;4;ויקרב את המנחה וימלא כפו ממנה ויקטר על המזבח מלבד עלת הבקר
(302170, -60, 4);10;י;153790;(3, 9, 18, 26, 153790);40579;(3, 9, 18, 7, 40579);השלמים;5;7;וישחט את השור ואת האיל זבח השלמים אשר לעם וימצאו בני אהרן את הדם אליו ויזרקהו על המזבח סביב
(302170, -60, 4);300;ש;153850;(3, 9, 19, 13, 153850);40595;(3, 9, 19, 4, 40595);השור;2;4;ואת החלבים מן השור ומן האיל האליה והמכסה והכלית ויתרת הכבד
(302170, -60, 4);9;ט;153910;(3, 9, 20, 25, 153910);40608;(3, 9, 20, 6, 40608);ויקטר;4;6;וישימו את החלבים על החזות ויקטר החלבים המזבחה
(302170, -60, 4);5;ה;153970;(3, 9, 21, 47, 153970);40622;(3, 9, 21, 12, 40622);צוה;3;12;ואת החזות ואת שוק הימין הניף אהרן תנופה לפני יהוה כאשר צוה משה
(302170, -60, 4);6;ו;154030;(3, 9, 23, 8, 154030);40638;(3, 9, 23, 3, 40638);ואהרן;1;3;ויבא משה ואהרן אל אהל מועד ויצאו ויברכו את העם וירא כבוד יהוה אל כל העם
(302170, -60, 4);10;י;154090;(3, 9, 24, 12, 154090);40655;(3, 9, 24, 4, 40655);יהוה;1;4;ותצא אש מלפני יהוה ותאכל על המזבח את העלה ואת החלבים וירא כל העם וירנו ויפלו על פניהם
(302170, -60, 4);8;ח;154150;(3, 10, 1, 4, 154150);40670;(3, 10, 1, 1, 40670);ויקחו;4;1;ויקחו בני אהרן נדב ואביהוא איש מחתתו ויתנו בהן אש וישימו עליה קטרת ויקריבו לפני יהוה אש זרה אשר לא צוה אתם
(302170, -60, 4);50;נ;154210;(3, 10, 1, 64, 154210);40684;(3, 10, 1, 15, 40684);לפני;3;15;ויקחו בני אהרן נדב ואביהוא איש מחתתו ויתנו בהן אש וישימו עליה קטרת ויקריבו לפני יהוה אש זרה אשר לא צוה אתם
(302170, -60, 4);10;י;154270;(3, 10, 3, 2, 154270);40701;(3, 10, 3, 1, 40701);ויאמר;2;1;ויאמר משה אל אהרן הוא אשר דבר יהוה לאמר בקרבי אקדש ועל פני כל העם אכבד וידם אהרן
(302170, -60, 4);200;ר;154330;(3, 10, 3, 62, 154330);40718;(3, 10, 3, 18, 40718);אהרן;3;18;ויאמר משה אל אהרן הוא אשר דבר יהוה לאמר בקרבי אקדש ועל פני כל העם אכבד וידם אהרן
(302170, -60, 4);20;כ;154390;(3, 10, 4, 59, 154390);40734;(3, 10, 4, 16, 40734);אחיכם;4;16;ויקרא משה אל מישאל ואל אלצפן בני עזיאל דד אהרן ויאמר אלהם קרבו שאו את אחיכם מאת פני הקדש אל מחוץ למחנה
(302170, -60, 4);5;ה;154450;(3, 10, 5, 38, 154450);40749;(3, 10, 5, 9, 40749);משה;3;9;ויקרבו וישאם בכתנתם אל מחוץ למחנה כאשר דבר משה
(302170, -60, 4);6;ו;154510;(3, 10, 6, 60, 154510);40763;(3, 10, 6, 14, 40763);ולא;1;14;ויאמר משה אל אהרן ולאלעזר ולאיתמר בניו ראשיכם אל תפרעו ובגדיכם לא תפרמו ולא תמתו ועל כל העדה יקצף ואחיכם כל בית ישראל יבכו את השרפה אשר שרף יהוה
(302170, -60, 4);400;ת;154570;(3, 10, 7, 4, 154570);40779;(3, 10, 7, 1, 40779);ומפתח;4;1;ומפתח אהל מועד לא תצאו פן תמתו כי שמן משחת יהוה עליכם ויעשו כדבר משה
(302170, -60, 4);1;א;154630;(3, 10, 8, 10, 154630);40796;(3, 10, 8, 3, 40796);אל;1;3;וידבר יהוה אל אהרן לאמר
(302170, -60, 4);40;ם;154690;(3, 10, 9, 51, 154690);40813;(3, 10, 9, 15, 40813);עולם;4;15;יין ושכר אל תשת אתה ובניך אתך בבאכם אל אהל מועד ולא תמתו חקת עולם לדרתיכם
(302170, -60, 4);1;א;154750;(3, 10, 11, 15, 154750);40827;(3, 10, 11, 4, 40827);ישראל;4;4;ולהורת את בני ישראל את כל החקים אשר דבר יהוה אליהם ביד משה
(302170, -60, 4);40;מ;154810;(3, 10, 12, 29, 154810);40844;(3, 10, 12, 8, 40844);איתמר;4;8;וידבר משה אל אהרן ואל אלעזר ואל איתמר בניו הנותרים קחו את המנחה הנותרת מאשי יהוה ואכלוה מצות אצל המזבח כי קדש קדשים הוא
(302170, -60, 4);100;ק;154870;(3, 10, 12, 89, 154870);40859;(3, 10, 12, 23, 40859);קדשים;1;23;וידבר משה אל אהרן ואל אלעזר ואל איתמר בניו הנותרים קחו את המנחה הנותרת מאשי יהוה ואכלוה מצות אצל המזבח כי קדש קדשים הוא
(302170, -60, 4);400;ת;154930;(3, 10, 14, 3, 154930);40875;(3, 10, 14, 1, 40875);ואת;3;1;ואת חזה התנופה ואת שוק התרומה תאכלו במקום טהור אתה ובניך ובנתיך אתך כי חקך וחק בניך נתנו מזבחי שלמי בני ישראל
(302170, -60, 4);100;ק;154990;(3, 10, 14, 63, 154990);40890;(3, 10, 14, 16, 40890);וחק;3;16;ואת חזה התנופה ואת שוק התרומה תאכלו במקום טהור אתה ובניך ובנתיך אתך כי חקך וחק בניך נתנו מזבחי שלמי בני ישראל
(302170, -60, 4);6;ו;155050;(3, 10, 15, 35, 155050);40904;(3, 10, 15, 8, 40904);יביאו;5;8;שוק התרומה וחזה התנופה על אשי החלבים יביאו להניף תנופה לפני יהוה והיה לך ולבניך אתך לחק עולם כאשר צוה יהוה
(302170, -60, 4);8;ח;155110;(3, 10, 16, 9, 155110);40920;(3, 10, 16, 3, 40920);החטאת;2;3;ואת שעיר החטאת דרש דרש משה והנה שרף ויקצף על אלעזר ועל איתמר בני אהרן הנותרם לאמר
(302170, -60, 4);70;ע;155170;(3, 10, 17, 4, 155170);40935;(3, 10, 17, 1, 40935);מדוע;4;1;מדוע לא אכלתם את החטאת במקום הקדש כי קדש קדשים הוא ואתה נתן לכם לשאת את עון העדה לכפר עליהם לפני יהוה
(302170, -60, 4);30;ל;155230;(3, 10, 17, 64, 155230);40953;(3, 10, 17, 19, 40953);לכפר;1;19;מדוע לא אכלתם את החטאת במקום הקדש כי קדש קדשים הוא ואתה נתן לכם לשאת את עון העדה לכפר עליהם לפני יהוה
(302170, -60, 4);200;ר;155290;(3, 10, 18, 44, 155290);40969;(3, 10, 18, 13, 40969);כאשר;4;13;הן לא הובא את דמה אל הקדש פנימה אכול תאכלו אתה בקדש כאשר צויתי
(302170, -60, 4);5;ה;155350;(3, 10, 19, 55, 155350);40984;(3, 10, 19, 14, 40984);ותקראנה;7;14;וידבר אהרן אל משה הן היום הקריבו את חטאתם ואת עלתם לפני יהוה ותקראנה אתי כאלה ואכלתי חטאת היום הייטב בעיני יהוה
(302170, -60, 4);10;י;155410;(3, 11, 1, 6, 155410);40998;(3, 11, 1, 2, 40998);יהוה;1;2;וידבר יהוה אל משה ואל אהרן לאמר אלהם
(302170, -60, 4);5;ה;155470;(3, 11, 2, 37, 155470);41015;(3, 11, 2, 11, 41015);הבהמה;1;11;דברו אל בני ישראל לאמר זאת החיה אשר תאכלו מכל הבהמה אשר על הארץ
(302170, -60, 4);400;ת;155530;(3, 11, 4, 4, 155530);41031;(3, 11, 4, 2, 41031);את;2;2;אך את זה לא תאכלו ממעלי הגרה וממפרסי הפרסה את הגמל כי מעלה גרה הוא ופרסה איננו מפריס טמא הוא לכם
(302170, -60, 4);80;פ;155590;(3, 11, 4, 64, 155590);41047;(3, 11, 4, 18, 41047);מפריס;2;18;אך את זה לא תאכלו ממעלי הגרה וממפרסי הפרסה את הגמל כי מעלה גרה הוא ופרסה איננו מפריס טמא הוא לכם
(302170, -60, 4);2;ב;155650;(3, 11, 6, 8, 155650);41064;(3, 11, 6, 2, 41064);הארנבת;5;2;ואת הארנבת כי מעלת גרה הוא ופרסה לא הפריסה טמאה הוא לכם
(302170, -60, 4);300;ש;155710;(3, 11, 7, 24, 155710);41081;(3, 11, 7, 7, 41081);ושסע;2;7;ואת החזיר כי מפריס פרסה הוא ושסע שסע פרסה והוא גרה לא יגר טמא הוא לכם
(302170, -60, 4);40;ם;155770;(3, 11, 8, 30, 155770);41097;(3, 11, 8, 7, 41097);טמאים;5;7;מבשרם לא תאכלו ובנבלתם לא תגעו טמאים הם לכם
(302170, -60, 4);400;ת;155830;(3, 11, 9, 55, 155830);41114;(3, 11, 9, 15, 41114);אתם;2;15;את זה תאכלו מכל אשר במים כל אשר לו סנפיר וקשקשת במים בימים ובנחלים אתם תאכלו
(302170, -60, 4);10;י;155890;(3, 11, 10, 54, 155890);41129;(3, 11, 10, 14, 41129);החיה;3;14;וכל אשר אין לו סנפיר וקשקשת בימים ובנחלים מכל שרץ המים ומכל נפש החיה אשר במים שקץ הם לכם
(302170, -60, 4);50;ן;155950;(3, 11, 12, 8, 155950);41146;(3, 11, 12, 3, 41146);אין;3;3;כל אשר אין לו סנפיר וקשקשת במים שקץ הוא לכם
(302170, -60, 4);300;ש;156010;(3, 11, 13, 34, 156010);41164;(3, 11, 13, 11, 41164);הנשר;3;11;ואת אלה תשקצו מן העוף לא יאכלו שקץ הם את הנשר ואת הפרס ואת העזניה
(302170, -60, 4);1;א;156070;(3, 11, 16, 12, 156070);41181;(3, 11, 16, 4, 41181);ואת;2;4;ואת בת היענה ואת התחמס ואת השחף ואת הנץ למינהו
(302170, -60, 4);400;ת;156130;(3, 11, 18, 12, 156130);41196;(3, 11, 18, 3, 41196);ואת;3;3;ואת התנשמת ואת הקאת ואת הרחם
(302170, -60, 4);30;ל;156190;(3, 11, 20, 12, 156190);41211;(3, 11, 20, 4, 41211);ההלך;3;4;כל שרץ העוף ההלך על ארבע שקץ הוא לכם
(302170, -60, 4);70;ע;156250;(3, 11, 21, 44, 156250);41230;(3, 11, 21, 14, 41230);ממעל;3;14;אך את זה תאכלו מכל שרץ העוף ההלך על ארבע אשר לא כרעים ממעל לרגליו לנתר בהן על הארץ
(302170, -60, 4);6;ו;156310;(3, 11, 22, 40, 156310);41246;(3, 11, 22, 11, 41246);ואת;1;11;את אלה מהם תאכלו את הארבה למינו ואת הסלעם למינהו ואת החרגל למינהו ואת החגב למינהו
(302170, -60, 4);6;ו;156370;(3, 11, 24, 1, 156370);41262;(3, 11, 24, 1, 41262);ולאלה;1;1;ולאלה תטמאו כל הנגע בנבלתם יטמא עד הערב
(302170, -60, 4);5;ה;156430;(3, 11, 25, 29, 156430);41277;(3, 11, 25, 8, 41277);הערב;1;8;וכל הנשא מנבלתם יכבס בגדיו וטמא עד הערב
(302170, -60, 4);30;ל;156490;(3, 11, 26, 57, 156490);41292;(3, 11, 26, 15, 41292);לכם;1;15;לכל הבהמה אשר הוא מפרסת פרסה ושסע איננה שסעת וגרה איננה מעלה טמאים הם לכם כל הנגע בהם יטמא
(302170, -60, 4);50;נ;156550;(3, 11, 27, 45, 156550);41310;(3, 11, 27, 14, 41310);הנגע;2;14;וכל הולך על כפיו בכל החיה ההלכת על ארבע טמאים הם לכם כל הנגע בנבלתם יטמא עד הערב
(302170, -60, 4);40;ם;156610;(3, 11, 28, 42, 156610);41325;(3, 11, 28, 11, 41325);לכם;3;11;והנשא את נבלתם יכבס בגדיו וטמא עד הערב טמאים המה לכם
(302170, -60, 4);5;ה;156670;(3, 11, 30, 16, 156670);41339;(3, 11, 30, 3, 41339);והלטאה;6;3;והאנקה והכח והלטאה והחמט והתנשמת
(302170, -60, 4);200;ר;156730;(3, 11, 32, 6, 156730);41355;(3, 11, 32, 2, 41355);אשר;3;2;וכל אשר יפל עליו מהם במתם יטמא מכל כלי עץ או בגד או עור או שק כל כלי אשר יעשה מלאכה בהם במים יובא וטמא עד הערב וטהר
(302170, -60, 4);40;ם;156790;(3, 11, 32, 66, 156790);41375;(3, 11, 32, 22, 41375);בהם;3;22;וכל אשר יפל עליו מהם במתם יטמא מכל כלי עץ או בגד או עור או שק כל כלי אשר יעשה מלאכה בהם במים יובא וטמא עד הערב וטהר
(302170, -60, 4);1;א;156850;(3, 11, 33, 38, 156850);41393;(3, 11, 33, 12, 41393);יטמא;4;12;וכל כלי חרש אשר יפל מהם אל תוכו כל אשר בתוכו יטמא ואתו תשברו
(302170, -60, 4);30;ל;156910;(3, 11, 34, 51, 156910);41410;(3, 11, 34, 15, 41410);כלי;2;15;מכל האכל אשר יאכל אשר יבוא עליו מים יטמא וכל משקה אשר ישתה בכל כלי יטמא
(302170, -60, 4);20;כ;156970;(3, 11, 35, 55, 156970);41425;(3, 11, 35, 14, 41425);לכם;2;14;וכל אשר יפל מנבלתם עליו יטמא תנור וכירים יתץ טמאים הם וטמאים יהיו לכם
(302170, -60, 4);7;ז;157030;(3, 11, 37, 20, 157030);41442;(3, 11, 37, 7, 41442);זרוע;1;7;וכי יפל מנבלתם על כל זרע זרוע אשר יזרע טהור הוא
(302170, -60, 4);6;ו;157090;(3, 11, 39, 6, 157090);41459;(3, 11, 39, 2, 41459);ימות;3;2;וכי ימות מן הבהמה אשר היא לכם לאכלה הנגע בנבלתה יטמא עד הערב
(302170, -60, 4);4;ד;157150;(3, 11, 40, 18, 157150);41474;(3, 11, 40, 4, 41474);בגדיו;3;4;והאכל מנבלתה יכבס בגדיו וטמא עד הערב והנשא את נבלתה יכבס בגדיו וטמא עד הערב
(302170, -60, 4);90;ץ;157210;(3, 11, 41, 17, 157210);41490;(3, 11, 41, 5, 41490);הארץ;4;5;וכל השרץ השרץ על הארץ שקץ הוא לא יאכל
(302170, -60, 4);200;ר;157270;(3, 11, 42, 48, 157270);41509;(3, 11, 42, 15, 41509);השרץ;3;15;כל הולך על גחון וכל הולך על ארבע עד כל מרבה רגלים לכל השרץ השרץ על הארץ לא תאכלום כי שקץ הם
(302170, -60, 4);40;ם;157330;(3, 11, 43, 38, 157330);41526;(3, 11, 43, 10, 41526);בהם;3;10;אל תשקצו את נפשתיכם בכל השרץ השרץ ולא תטמאו בהם ונטמתם בם
(302170, -60, 4);1;א;157390;(3, 11, 44, 52, 157390);41541;(3, 11, 44, 13, 41541);את;1;13;כי אני יהוה אלהיכם והתקדשתם והייתם קדשים כי קדוש אני ולא תטמאו את נפשתיכם בכל השרץ הרמש על הארץ
(302170, -60, 4);30;ל;157450;(3, 11, 45, 35, 157450);41557;(3, 11, 45, 10, 41557);לאלהים;1;10;כי אני יהוה המעלה אתכם מארץ מצרים להית לכם לאלהים והייתם קדשים כי קדוש אני
(302170, -60, 4);10;י;157510;(3, 11, 46, 35, 157510);41571;(3, 11, 46, 9, 41571);במים;3;9;זאת תורת הבהמה והעוף וכל נפש החיה הרמשת במים ולכל נפש השרצת על הארץ
(302170, -60, 4);8;ח;157570;(3, 11, 47, 41, 157570);41586;(3, 11, 47, 10, 41586);החיה;2;10;להבדיל בין הטמא ובין הטהר ובין החיה הנאכלת ובין החיה אשר לא תאכל
(302170, -60, 4);4;ד;157630;(3, 12, 2, 31, 157630);41603;(3, 12, 2, 9, 41603);וילדה;4;9;דבר אל בני ישראל לאמר אשה כי תזריע וילדה זכר וטמאה שבעת ימים כימי נדת דותה תטמא
(302170, -60, 4);10;י;157690;(3, 12, 4, 5, 157690);41617;(3, 12, 4, 1, 41617);ושלשים;5;1;ושלשים יום ושלשת ימים תשב בדמי טהרה בכל קדש לא תגע ואל המקדש לא תבא עד מלאת ימי טהרה
(302170, -60, 4);200;ר;157750;(3, 12, 4, 65, 157750);41635;(3, 12, 4, 19, 41635);טהרה;3;19;ושלשים יום ושלשת ימים תשב בדמי טהרה בכל קדש לא תגע ואל המקדש לא תבא עד מלאת ימי טהרה
(302170, -60, 4);400;ת;157810;(3, 12, 6, 6, 157810);41650;(3, 12, 6, 1, 41650);ובמלאת;6;1;ובמלאת ימי טהרה לבן או לבת תביא כבש בן שנתו לעלה ובן יונה או תר לחטאת אל פתח אהל מועד אל הכהן
(302170, -60, 4);4;ד;157870;(3, 12, 6, 66, 157870);41669;(3, 12, 6, 20, 41669);מועד;4;20;ובמלאת ימי טהרה לבן או לבת תביא כבש בן שנתו לעלה ובן יונה או תר לחטאת אל פתח אהל מועד אל הכהן
(302170, -60, 4);6;ו;157930;(3, 12, 7, 54, 157930);41684;(3, 12, 7, 13, 41684);או;2;13;והקריבו לפני יהוה וכפר עליה וטהרה ממקר דמיה זאת תורת הילדת לזכר או לנקבה
(302170, -60, 4);1;א;157990;(3, 12, 8, 55, 157990);41702;(3, 12, 8, 17, 41702);לחטאת;4;17;ואם לא תמצא ידה די שה ולקחה שתי תרים או שני בני יונה אחד לעלה ואחד לחטאת וכפר עליה הכהן וטהרה
