(224277, -63, 4);10;י;73959;(1, 48, 2, 11, 73959);19540;(1, 48, 2, 3, 19540);ויאמר;2;3;ויגד ליעקב ויאמר הנה בנך יוסף בא אליך ויתחזק ישראל וישב על המטה
(224277, -63, 4);1;א;74022;(1, 48, 3, 23, 74022);19557;(1, 48, 3, 7, 19557);נראה;3;7;ויאמר יעקב אל יוסף אל שדי נראה אלי בלוז בארץ כנען ויברך אתי
(224277, -63, 4);50;נ;74085;(1, 48, 4, 39, 74085);19572;(1, 48, 4, 9, 19572);ונתתי;2;9;ויאמר אלי הנני מפרך והרביתך ונתתיך לקהל עמים ונתתי את הארץ הזאת לזרעך אחריך אחזת עולם
(224277, -63, 4);2;ב;74148;(1, 48, 5, 32, 74148);19588;(1, 48, 5, 9, 19588);באי;1;9;ועתה שני בניך הנולדים לך בארץ מצרים עד באי אליך מצרימה לי הם אפרים ומנשה כראובן ושמעון יהיו לי
(224277, -63, 4);10;י;74211;(1, 48, 6, 19, 74211);19602;(1, 48, 6, 4, 19602);אחריהם;4;4;ומולדתך אשר הולדת אחריהם לך יהיו על שם אחיהם יקראו בנחלתם
(224277, -63, 4);70;ע;74274;(1, 48, 7, 35, 74274);19619;(1, 48, 7, 10, 19619);בעוד;2;10;ואני בבאי מפדן מתה עלי רחל בארץ כנען בדרך בעוד כברת ארץ לבא אפרתה ואקברה שם בדרך אפרת הוא בית לחם
(224277, -63, 4);1;א;74337;(1, 48, 8, 21, 74337);19636;(1, 48, 8, 6, 19636);ויאמר;3;6;וירא ישראל את בני יוסף ויאמר מי אלה
(224277, -63, 4);6;ו;74400;(1, 48, 10, 1, 74400);19655;(1, 48, 10, 1, 19655);ועיני;1;1;ועיני ישראל כבדו מזקן לא יוכל לראות ויגש אתם אליו וישק להם ויחבק להם
(224277, -63, 4);1;א;74463;(1, 48, 11, 9, 74463);19670;(1, 48, 11, 2, 19670);ישראל;4;2;ויאמר ישראל אל יוסף ראה פניך לא פללתי והנה הראה אתי אלהים גם את זרעך
(224277, -63, 4);20;כ;74526;(1, 48, 12, 18, 74526);19688;(1, 48, 12, 5, 19688);ברכיו;3;5;ויוצא יוסף אתם מעם ברכיו וישתחו לאפיו ארצה
(224277, -63, 4);2;ב;74589;(1, 48, 13, 46, 74589);19703;(1, 48, 13, 12, 19703);בשמאלו;1;12;ויקח יוסף את שניהם את אפרים בימינו משמאל ישראל ואת מנשה בשמאלו מימין ישראל ויגש אליו
(224277, -63, 4);200;ר;74652;(1, 48, 14, 40, 74652);19717;(1, 48, 14, 10, 19717);הצעיר;5;10;וישלח ישראל את ימינו וישת על ראש אפרים והוא הצעיר ואת שמאלו על ראש מנשה שכל את ידיו כי מנשה הבכור
(224277, -63, 4);5;ה;74715;(1, 48, 15, 26, 74715);19735;(1, 48, 15, 7, 19735);התהלכו;1;7;ויברך את יוסף ויאמר האלהים אשר התהלכו אבתי לפניו אברהם ויצחק האלהים הרעה אתי מעודי עד היום הזה
(224277, -63, 4);10;י;74778;(1, 48, 16, 12, 74778);19749;(1, 48, 16, 3, 19749);אתי;3;3;המלאך הגאל אתי מכל רע יברך את הנערים ויקרא בהם שמי ושם אבתי אברהם ויצחק וידגו לרב בקרב הארץ
(224277, -63, 4);10;י;74841;(1, 48, 17, 2, 74841);19766;(1, 48, 17, 1, 19766);וירא;2;1;וירא יוסף כי ישית אביו יד ימינו על ראש אפרים וירע בעיניו ויתמך יד אביו להסיר אתה מעל ראש אפרים על ראש מנשה
(224277, -63, 4);40;מ;74904;(1, 48, 17, 65, 74904);19783;(1, 48, 17, 18, 19783);מעל;1;18;וירא יוסף כי ישית אביו יד ימינו על ראש אפרים וירע בעיניו ויתמך יד אביו להסיר אתה מעל ראש אפרים על ראש מנשה
(224277, -63, 4);6;ו;74967;(1, 48, 18, 44, 74967);19802;(1, 48, 18, 14, 19802);ראשו;4;14;ויאמר יוסף אל אביו לא כן אבי כי זה הבכר שים ימינך על ראשו
(224277, -63, 4);10;י;75030;(1, 48, 19, 63, 75030);19819;(1, 48, 19, 17, 19819);יגדל;1;17;וימאן אביו ויאמר ידעתי בני ידעתי גם הוא יהיה לעם וגם הוא יגדל ואולם אחיו הקטן יגדל ממנו וזרעו יהיה מלא הגוים
(224277, -63, 4);1;א;75093;(1, 48, 20, 39, 75093);19834;(1, 48, 20, 10, 19834);אלהים;1;10;ויברכם ביום ההוא לאמור בך יברך ישראל לאמר ישמך אלהים כאפרים וכמנשה וישם את אפרים לפני מנשה
(224277, -63, 4);10;י;75156;(1, 48, 21, 28, 75156);19849;(1, 48, 21, 8, 19849);והיה;3;8;ויאמר ישראל אל יוסף הנה אנכי מת והיה אלהים עמכם והשיב אתכם אל ארץ אבתיכם
(224277, -63, 4);4;ד;75219;(1, 48, 22, 33, 75219);19866;(1, 48, 22, 10, 19866);מיד;3;10;ואני נתתי לך שכם אחד על אחיך אשר לקחתי מיד האמרי בחרבי ובקשתי
(224277, -63, 4);40;ם;75282;(1, 49, 1, 47, 75282);19881;(1, 49, 1, 12, 19881);אתכם;4;12;ויקרא יעקב אל בניו ויאמר האספו ואגידה לכם את אשר יקרא אתכם באחרית הימים
(224277, -63, 4);1;א;75345;(1, 49, 3, 18, 75345);19896;(1, 49, 3, 5, 19896);וראשית;3;5;ראובן בכרי אתה כחי וראשית אוני יתר שאת ויתר עז
(224277, -63, 4);40;מ;75408;(1, 49, 5, 2, 75408);19914;(1, 49, 5, 1, 19914);שמעון;2;1;שמעון ולוי אחים כלי חמס מכרתיהם
(224277, -63, 4);10;י;75471;(1, 49, 6, 39, 75471);19931;(1, 49, 6, 12, 19931);איש;2;12;בסדם אל תבא נפשי בקהלם אל תחד כבדי כי באפם הרגו איש וברצנם עקרו שור
(224277, -63, 4);4;ד;75534;(1, 49, 8, 4, 75534);19946;(1, 49, 8, 1, 19946);יהודה;4;1;יהודה אתה יודוך אחיך ידך בערף איביך ישתחוו לך בני אביך
(224277, -63, 4);400;ת;75597;(1, 49, 9, 23, 75597);19962;(1, 49, 9, 6, 19962);עלית;4;6;גור אריה יהודה מטרף בני עלית כרע רבץ כאריה וכלביא מי יקימנו
(224277, -63, 4);10;י;75660;(1, 49, 10, 38, 75660);19979;(1, 49, 10, 11, 19979);שילה;2;11;לא יסור שבט מיהודה ומחקק מבין רגליו עד כי יבא שילה ולו יקהת עמים
(224277, -63, 4);8;ח;75723;(1, 49, 12, 1, 75723);19995;(1, 49, 12, 1, 19995);חכלילי;1;1;חכלילי עינים מיין ולבן שנים מחלב
(224277, -63, 4);30;ל;75786;(1, 49, 13, 37, 75786);20009;(1, 49, 13, 9, 20009);על;2;9;זבולן לחוף ימים ישכן והוא לחוף אנית וירכתו על צידן
(224277, -63, 4);60;ס;75849;(1, 49, 15, 35, 75849);20027;(1, 49, 15, 11, 20027);לסבל;2;11;וירא מנחה כי טוב ואת הארץ כי נעמה ויט שכמו לסבל ויהי למס עבד
(224277, -63, 4);20;ך;75912;(1, 49, 17, 29, 75912);20045;(1, 49, 17, 9, 20045);הנשך;4;9;יהי דן נחש עלי דרך שפיפן עלי ארח הנשך עקבי סוס ויפל רכבו אחור
(224277, -63, 4);40;מ;75975;(1, 49, 20, 6, 75975);20061;(1, 49, 20, 2, 20061);שמנה;2;2;מאשר שמנה לחמו והוא יתן מעדני מלך
(224277, -63, 4);70;ע;76038;(1, 49, 22, 18, 76038);20079;(1, 49, 22, 7, 20079);עין;1;7;בן פרת יוסף בן פרת עלי עין בנות צעדה עלי שור
(224277, -63, 4);70;ע;76101;(1, 49, 24, 21, 76101);20093;(1, 49, 24, 5, 20093);זרעי;3;5;ותשב באיתן קשתו ויפזו זרעי ידיו מידי אביר יעקב משם רעה אבן ישראל
(224277, -63, 4);10;י;76164;(1, 49, 25, 32, 76164);20109;(1, 49, 25, 8, 20109);שמים;3;8;מאל אביך ויעזרך ואת שדי ויברכך ברכת שמים מעל ברכת תהום רבצת תחת ברכת שדים ורחם
(224277, -63, 4);400;ת;76227;(1, 49, 26, 32, 76227);20126;(1, 49, 26, 9, 20126);גבעת;4;9;ברכת אביך גברו על ברכת הורי עד תאות גבעת עולם תהיין לראש יוסף ולקדקד נזיר אחיו
(224277, -63, 4);100;ק;76290;(1, 49, 27, 32, 76290);20141;(1, 49, 27, 8, 20141);יחלק;4;8;בנימין זאב יטרף בבקר יאכל עד ולערב יחלק שלל
(224277, -63, 4);6;ו;76353;(1, 49, 28, 60, 76353);20158;(1, 49, 28, 16, 20158);כברכתו;6;16;כל אלה שבטי ישראל שנים עשר וזאת אשר דבר להם אביהם ויברך אותם איש אשר כברכתו ברך אתם
(224277, -63, 4);70;ע;76416;(1, 49, 29, 57, 76416);20177;(1, 49, 29, 17, 20177);עפרון;1;17;ויצו אותם ויאמר אלהם אני נאסף אל עמי קברו אתי אל אבתי אל המערה אשר בשדה עפרון החתי
(224277, -63, 4);5;ה;76479;(1, 49, 30, 55, 76479);20193;(1, 49, 30, 15, 20193);השדה;4;15;במערה אשר בשדה המכפלה אשר על פני ממרא בארץ כנען אשר קנה אברהם את השדה מאת עפרן החתי לאחזת קבר
(224277, -63, 4);5;ה;76542;(1, 49, 31, 44, 76542);20211;(1, 49, 31, 13, 20211);רבקה;4;13;שמה קברו את אברהם ואת שרה אשתו שמה קברו את יצחק ואת רבקה אשתו ושמה קברתי את לאה
(224277, -63, 4);6;ו;76605;(1, 49, 33, 18, 76605);20229;(1, 49, 33, 5, 20229);בניו;4;5;ויכל יעקב לצות את בניו ויאסף רגליו אל המטה ויגוע ויאסף אל עמיו
(224277, -63, 4);6;ו;76668;(1, 50, 1, 31, 76668);20246;(1, 50, 1, 9, 20246);לו;2;9;ויפל יוסף על פני אביו ויבך עליו וישק לו
(224277, -63, 4);2;ב;76731;(1, 50, 3, 11, 76731);20262;(1, 50, 3, 3, 20262);ארבעים;3;3;וימלאו לו ארבעים יום כי כן ימלאו ימי החנטים ויבכו אתו מצרים שבעים יום
(224277, -63, 4);2;ב;76794;(1, 50, 4, 18, 76794);20277;(1, 50, 4, 4, 20277);וידבר;4;4;ויעברו ימי בכיתו וידבר יוסף אל בית פרעה לאמר אם נא מצאתי חן בעיניכם דברו נא באזני פרעה לאמר
(224277, -63, 4);70;ע;76857;(1, 50, 5, 8, 76857);20294;(1, 50, 5, 2, 20294);השביעני;5;2;אבי השביעני לאמר הנה אנכי מת בקברי אשר כריתי לי בארץ כנען שמה תקברני ועתה אעלה נא ואקברה את אבי ואשובה
(224277, -63, 4);5;ה;76920;(1, 50, 5, 71, 76920);20310;(1, 50, 5, 18, 20310);ואקברה;6;18;אבי השביעני לאמר הנה אנכי מת בקברי אשר כריתי לי בארץ כנען שמה תקברני ועתה אעלה נא ואקברה את אבי ואשובה
(224277, -63, 4);10;י;76983;(1, 50, 7, 20, 76983);20327;(1, 50, 7, 6, 20327);ויעלו;2;6;ויעל יוסף לקבר את אביו ויעלו אתו כל עבדי פרעה זקני ביתו וכל זקני ארץ מצרים
(224277, -63, 4);200;ר;77046;(1, 50, 8, 24, 77046);20344;(1, 50, 8, 7, 20344);רק;1;7;וכל בית יוסף ואחיו ובית אביו רק טפם וצאנם ובקרם עזבו בארץ גשן
(224277, -63, 4);1;א;77109;(1, 50, 10, 4, 77109);20361;(1, 50, 10, 1, 20361);ויבאו;4;1;ויבאו עד גרן האטד אשר בעבר הירדן ויספדו שם מספד גדול וכבד מאד ויעש לאביו אבל שבעת ימים
(224277, -63, 4);40;מ;77172;(1, 50, 10, 67, 77172);20378;(1, 50, 10, 18, 20378);ימים;2;18;ויבאו עד גרן האטד אשר בעבר הירדן ויספדו שם מספד גדול וכבד מאד ויעש לאביו אבל שבעת ימים
(224277, -63, 4);40;מ;77235;(1, 50, 11, 61, 77235);20395;(1, 50, 11, 17, 20395);שמה;2;17;וירא יושב הארץ הכנעני את האבל בגרן האטד ויאמרו אבל כבד זה למצרים על כן קרא שמה אבל מצרים אשר בעבר הירדן
(224277, -63, 4);10;י;77298;(1, 50, 13, 22, 77298);20412;(1, 50, 13, 6, 20412);ויקברו;2;6;וישאו אתו בניו ארצה כנען ויקברו אתו במערת שדה המכפלה אשר קנה אברהם את השדה לאחזת קבר מאת עפרן החתי על פני ממרא
(224277, -63, 4);40;מ;77361;(1, 50, 13, 85, 77361);20429;(1, 50, 13, 23, 20429);ממרא;1;23;וישאו אתו בניו ארצה כנען ויקברו אתו במערת שדה המכפלה אשר קנה אברהם את השדה לאחזת קבר מאת עפרן החתי על פני ממרא
(224277, -63, 4);200;ר;77424;(1, 50, 15, 3, 77424);20445;(1, 50, 15, 1, 20445);ויראו;3;1;ויראו אחי יוסף כי מת אביהם ויאמרו לו ישטמנו יוסף והשב ישיב לנו את כל הרעה אשר גמלנו אתו
(224277, -63, 4);6;ו;77487;(1, 50, 15, 66, 77487);20462;(1, 50, 15, 18, 20462);גמלנו;5;18;ויראו אחי יוסף כי מת אביהם ויאמרו לו ישטמנו יוסף והשב ישיב לנו את כל הרעה אשר גמלנו אתו
(224277, -63, 4);20;ך;77550;(1, 50, 17, 26, 77550);20480;(1, 50, 17, 8, 20480);אחיך;4;8;כה תאמרו ליוסף אנא שא נא פשע אחיך וחטאתם כי רעה גמלוך ועתה שא נא לפשע עבדי אלהי אביך ויבך יוסף בדברם אליו
(224277, -63, 4);3;ג;77613;(1, 50, 18, 6, 77613);20497;(1, 50, 18, 2, 20497);גם;1;2;וילכו גם אחיו ויפלו לפניו ויאמרו הננו לך לעבדים
(224277, -63, 4);10;י;77676;(1, 50, 19, 30, 77676);20512;(1, 50, 19, 8, 20512);אלהים;4;8;ויאמר אלהם יוסף אל תיראו כי התחת אלהים אני
(224277, -63, 4);10;י;77739;(1, 50, 21, 8, 77739);20530;(1, 50, 21, 3, 20530);תיראו;2;3;ועתה אל תיראו אנכי אכלכל אתכם ואת טפכם וינחם אותם וידבר על לבם
(224277, -63, 4);400;ת;77802;(1, 50, 22, 21, 77802);20545;(1, 50, 22, 5, 20545);ובית;4;5;וישב יוסף במצרים הוא ובית אביו ויחי יוסף מאה ועשר שנים
(224277, -63, 4);4;ד;77865;(1, 50, 23, 40, 77865);20562;(1, 50, 23, 11, 20562);ילדו;3;11;וירא יוסף לאפרים בני שלשים גם בני מכיר בן מנשה ילדו על ברכי יוסף
(224277, -63, 4);200;ר;77928;(1, 50, 24, 52, 77928);20579;(1, 50, 24, 14, 20579);הארץ;3;14;ויאמר יוסף אל אחיו אנכי מת ואלהים פקד יפקד אתכם והעלה אתכם מן הארץ הזאת אל הארץ אשר נשבע לאברהם ליצחק וליעקב
(224277, -63, 4);80;פ;77991;(1, 50, 25, 28, 77991);20595;(1, 50, 25, 8, 20595);יפקד;2;8;וישבע יוסף את בני ישראל לאמר פקד יפקד אלהים אתכם והעלתם את עצמתי מזה
(224277, -63, 4);2;ב;78054;(1, 50, 26, 36, 78054);20611;(1, 50, 26, 10, 20611);בארון;1;10;וימת יוסף בן מאה ועשר שנים ויחנטו אתו ויישם בארון במצרים
(224277, -63, 4);6;ו;78117;(2, 1, 2, 9, 78117);20625;(2, 1, 2, 2, 20625);שמעון;4;2;ראובן שמעון לוי ויהודה
(224277, -63, 4);70;ע;78180;(2, 1, 5, 23, 78180);20641;(2, 1, 5, 7, 20641);שבעים;3;7;ויהי כל נפש יצאי ירך יעקב שבעים נפש ויוסף היה במצרים
(224277, -63, 4);6;ו;78243;(2, 1, 7, 18, 78243);20656;(2, 1, 7, 4, 20656);וישרצו;6;4;ובני ישראל פרו וישרצו וירבו ויעצמו במאד מאד ותמלא הארץ אתם
(224277, -63, 4);10;י;78306;(2, 1, 9, 2, 78306);20674;(2, 1, 9, 1, 20674);ויאמר;2;1;ויאמר אל עמו הנה עם בני ישראל רב ועצום ממנו
(224277, -63, 4);30;ל;78369;(2, 1, 10, 31, 78369);20692;(2, 1, 10, 9, 20692);מלחמה;2;9;הבה נתחכמה לו פן ירבה והיה כי תקראנה מלחמה ונוסף גם הוא על שנאינו ונלחם בנו ועלה מן הארץ
(224277, -63, 4);400;ת;78432;(2, 1, 11, 24, 78432);20708;(2, 1, 11, 6, 20708);ענתו;3;6;וישימו עליו שרי מסים למען ענתו בסבלתם ויבן ערי מסכנות לפרעה את פתם ואת רעמסס
(224277, -63, 4);90;ץ;78495;(2, 1, 12, 25, 78495);20724;(2, 1, 12, 7, 20724);יפרץ;4;7;וכאשר יענו אתו כן ירבה וכן יפרץ ויקצו מפני בני ישראל
(224277, -63, 4);5;ה;78558;(2, 1, 14, 21, 78558);20739;(2, 1, 14, 5, 20739);קשה;3;5;וימררו את חייהם בעבדה קשה בחמר ובלבנים ובכל עבדה בשדה את כל עבדתם אשר עבדו בהם בפרך
(224277, -63, 4);30;ל;78621;(2, 1, 15, 17, 78621);20755;(2, 1, 15, 4, 20755);למילדת;4;4;ויאמר מלך מצרים למילדת העברית אשר שם האחת שפרה ושם השנית פועה
(224277, -63, 4);1;א;78684;(2, 1, 16, 30, 78684);20770;(2, 1, 16, 7, 20770);האבנים;2;7;ויאמר בילדכן את העבריות וראיתן על האבנים אם בן הוא והמתן אתו ואם בת הוא וחיה
(224277, -63, 4);2;ב;78747;(2, 1, 17, 32, 78747);20787;(2, 1, 17, 8, 20787);דבר;2;8;ותיראן המילדת את האלהים ולא עשו כאשר דבר אליהן מלך מצרים ותחיין את הילדים
(224277, -63, 4);400;ת;78810;(2, 1, 18, 35, 78810);20801;(2, 1, 18, 8, 20801);עשיתן;4;8;ויקרא מלך מצרים למילדת ויאמר להן מדוע עשיתן הדבר הזה ותחיין את הילדים
(224277, -63, 4);10;י;78873;(2, 1, 19, 41, 78873);20816;(2, 1, 19, 10, 20816);כי;2;10;ותאמרן המילדת אל פרעה כי לא כנשים המצרית העברית כי חיות הנה בטרם תבוא אלהן המילדת וילדו
(224277, -63, 4);6;ו;78936;(2, 1, 21, 1, 78936);20831;(2, 1, 21, 1, 20831);ויהי;1;1;ויהי כי יראו המילדת את האלהים ויעש להם בתים
(224277, -63, 4);5;ה;78999;(2, 1, 22, 29, 78999);20848;(2, 1, 22, 9, 20848);היארה;1;9;ויצו פרעה לכל עמו לאמר כל הבן הילוד היארה תשליכהו וכל הבת תחיון
(224277, -63, 4);400;ת;79062;(2, 2, 2, 16, 79062);20865;(2, 2, 2, 5, 20865);ותרא;2;5;ותהר האשה ותלד בן ותרא אתו כי טוב הוא ותצפנהו שלשה ירחים
(224277, -63, 4);5;ה;79125;(2, 2, 3, 34, 79125);20881;(2, 2, 3, 9, 20881);ותחמרה;6;9;ולא יכלה עוד הצפינו ותקח לו תבת גמא ותחמרה בחמר ובזפת ותשם בה את הילד ותשם בסוף על שפת היאר
(224277, -63, 4);6;ו;79188;(2, 2, 4, 25, 79188);20899;(2, 2, 4, 7, 20899);לו;2;7;ותתצב אחתו מרחק לדעה מה יעשה לו
(224277, -63, 4);1;א;79251;(2, 2, 5, 63, 79251);20917;(2, 2, 5, 18, 20917);את;1;18;ותרד בת פרעה לרחץ על היאר ונערתיה הלכת על יד היאר ותרא את התבה בתוך הסוף ותשלח את אמתה ותקחה
(224277, -63, 4);7;ז;79314;(2, 2, 6, 53, 79314);20932;(2, 2, 6, 13, 20932);זה;1;13;ותפתח ותראהו את הילד והנה נער בכה ותחמל עליו ותאמר מילדי העברים זה
(224277, -63, 4);40;מ;79377;(2, 2, 8, 4, 79377);20949;(2, 2, 8, 1, 20949);ותאמר;4;1;ותאמר לה בת פרעה לכי ותלך העלמה ותקרא את אם הילד
(224277, -63, 4);6;ו;79440;(2, 2, 9, 29, 79440);20968;(2, 2, 9, 9, 20968);והינקהו;1;9;ותאמר לה בת פרעה היליכי את הילד הזה והינקהו לי ואני אתן את שכרך ותקח האשה הילד ותניקהו
(224277, -63, 4);6;ו;79503;(2, 2, 10, 23, 79503);20983;(2, 2, 10, 6, 20983);ויהי;1;6;ויגדל הילד ותבאהו לבת פרעה ויהי לה לבן ותקרא שמו משה ותאמר כי מן המים משיתהו
(224277, -63, 4);1;א;79566;(2, 2, 11, 25, 79566);21000;(2, 2, 11, 7, 21000);אל;1;7;ויהי בימים ההם ויגדל משה ויצא אל אחיו וירא בסבלתם וירא איש מצרי מכה איש עברי מאחיו
(224277, -63, 4);6;ו;79629;(2, 2, 12, 22, 79629);21018;(2, 2, 12, 8, 21018);ויך;1;8;ויפן כה וכה וירא כי אין איש ויך את המצרי ויטמנהו בחול
(224277, -63, 4);30;ל;79692;(2, 2, 13, 43, 79692);21033;(2, 2, 13, 11, 21033);למה;1;11;ויצא ביום השני והנה שני אנשים עברים נצים ויאמר לרשע למה תכה רעך
(224277, -63, 4);10;י;79755;(2, 2, 14, 55, 79755);21050;(2, 2, 14, 15, 21050);ויירא;2;15;ויאמר מי שמך לאיש שר ושפט עלינו הלהרגני אתה אמר כאשר הרגת את המצרי ויירא משה ויאמר אכן נודע הדבר
(224277, -63, 4);40;מ;79818;(2, 2, 15, 41, 79818);21067;(2, 2, 15, 12, 21067);מפני;1;12;וישמע פרעה את הדבר הזה ויבקש להרג את משה ויברח משה מפני פרעה וישב בארץ מדין וישב על הבאר
(224277, -63, 4);50;נ;79881;(2, 2, 16, 34, 79881);21081;(2, 2, 16, 7, 21081);ותמלאנה;6;7;ולכהן מדין שבע בנות ותבאנה ותדלנה ותמלאנה את הרהטים להשקות צאן אביהן
(224277, -63, 4);40;ם;79944;(2, 2, 17, 40, 79944);21095;(2, 2, 17, 9, 21095);צאנם;4;9;ויבאו הרעים ויגרשום ויקם משה ויושען וישק את צאנם
(224277, -63, 4);70;ע;80007;(2, 2, 19, 25, 80007);21110;(2, 2, 19, 6, 21110);הרעים;3;6;ותאמרן איש מצרי הצילנו מיד הרעים וגם דלה דלה לנו וישק את הצאן
(224277, -63, 4);6;ו;80070;(2, 2, 20, 39, 80070);21129;(2, 2, 20, 12, 21129);ויאכל;1;12;ויאמר אל בנתיו ואיו למה זה עזבתן את האיש קראן לו ויאכל לחם
(224277, -63, 4);20;כ;80133;(2, 2, 22, 21, 80133);21147;(2, 2, 22, 7, 21147);כי;1;7;ותלד בן ויקרא את שמו גרשם כי אמר גר הייתי בארץ נכריה
(224277, -63, 4);30;ל;80196;(2, 2, 23, 43, 80196);21162;(2, 2, 23, 10, 21162);ישראל;5;10;ויהי בימים הרבים ההם וימת מלך מצרים ויאנחו בני ישראל מן העבדה ויזעקו ותעל שועתם אל האלהים מן העבדה
(224277, -63, 4);10;י;80259;(2, 2, 24, 26, 80259);21177;(2, 2, 24, 6, 21177);אלהים;4;6;וישמע אלהים את נאקתם ויזכר אלהים את בריתו את אברהם את יצחק ואת יעקב
(224277, -63, 4);5;ה;80322;(2, 3, 1, 7, 80322);21194;(2, 3, 1, 2, 21194);היה;3;2;ומשה היה רעה את צאן יתרו חתנו כהן מדין וינהג את הצאן אחר המדבר ויבא אל הר האלהים חרבה
(224277, -63, 4);200;ר;80385;(2, 3, 2, 3, 80385);21212;(2, 3, 2, 1, 21212);וירא;3;1;וירא מלאך יהוה אליו בלבת אש מתוך הסנה וירא והנה הסנה בער באש והסנה איננו אכל
(224277, -63, 4);200;ר;80448;(2, 3, 3, 5, 80448);21228;(2, 3, 3, 1, 21228);ויאמר;5;1;ויאמר משה אסרה נא ואראה את המראה הגדל הזה מדוע לא יבער הסנה
(224277, -63, 4);200;ר;80511;(2, 3, 4, 21, 80511);21246;(2, 3, 4, 6, 21246);ויקרא;4;6;וירא יהוה כי סר לראות ויקרא אליו אלהים מתוך הסנה ויאמר משה משה ויאמר הנני
(224277, -63, 4);200;ר;80574;(2, 3, 5, 25, 80574);21263;(2, 3, 5, 8, 21263);רגליך;1;8;ויאמר אל תקרב הלם של נעליך מעל רגליך כי המקום אשר אתה עומד עליו אדמת קדש הוא
(224277, -63, 4);30;ל;80637;(2, 3, 6, 28, 80637);21279;(2, 3, 6, 7, 21279);אלהי;2;7;ויאמר אנכי אלהי אביך אלהי אברהם אלהי יצחק ואלהי יעקב ויסתר משה פניו כי ירא מהביט אל האלהים
(224277, -63, 4);1;א;80700;(2, 3, 7, 18, 80700);21295;(2, 3, 7, 5, 21295);את;1;5;ויאמר יהוה ראה ראיתי את עני עמי אשר במצרים ואת צעקתם שמעתי מפני נגשיו כי ידעתי את מכאביו
(224277, -63, 4);6;ו;80763;(2, 3, 8, 10, 80763);21310;(2, 3, 8, 2, 21310);להצילו;6;2;וארד להצילו מיד מצרים ולהעלתו מן הארץ ההוא אל ארץ טובה ורחבה אל ארץ זבת חלב ודבש אל מקום הכנעני והחתי והאמרי והפרזי והחוי והיבוסי
(224277, -63, 4);50;נ;80826;(2, 3, 8, 73, 80826);21328;(2, 3, 8, 20, 21328);הכנעני;3;20;וארד להצילו מיד מצרים ולהעלתו מן הארץ ההוא אל ארץ טובה ורחבה אל ארץ זבת חלב ודבש אל מקום הכנעני והחתי והאמרי והפרזי והחוי והיבוסי
(224277, -63, 4);10;י;80889;(2, 3, 9, 31, 80889);21342;(2, 3, 9, 9, 21342);ראיתי;3;9;ועתה הנה צעקת בני ישראל באה אלי וגם ראיתי את הלחץ אשר מצרים לחצים אתם
(224277, -63, 4);40;מ;80952;(2, 3, 10, 39, 80952);21359;(2, 3, 10, 11, 21359);ממצרים;2;11;ועתה לכה ואשלחך אל פרעה והוצא את עמי בני ישראל ממצרים
(224277, -63, 4);10;י;81015;(2, 3, 12, 2, 81015);21376;(2, 3, 12, 1, 21376);ויאמר;2;1;ויאמר כי אהיה עמך וזה לך האות כי אנכי שלחתיך בהוציאך את העם ממצרים תעבדון את האלהים על ההר הזה
(224277, -63, 4);5;ה;81078;(2, 3, 12, 65, 81078);21392;(2, 3, 12, 17, 21392);האלהים;4;17;ויאמר כי אהיה עמך וזה לך האות כי אנכי שלחתיך בהוציאך את העם ממצרים תעבדון את האלהים על ההר הזה
(224277, -63, 4);10;י;81141;(2, 3, 13, 53, 81141);21409;(2, 3, 13, 14, 21409);אבותיכם;5;14;ויאמר משה אל האלהים הנה אנכי בא אל בני ישראל ואמרתי להם אלהי אבותיכם שלחני אליכם ואמרו לי מה שמו מה אמר אלהם
