(270810, 52, 4);5;ה;79658;(2, 2, 13, 9, 79658);21025;(2, 2, 13, 3, 21025);השני;1;3;ויצא ביום השני והנה שני אנשים עברים נצים ויאמר לרשע למה תכה רעך
(270810, 52, 4);20;ך;79710;(2, 2, 14, 10, 79710);21038;(2, 2, 14, 3, 21038);שמך;3;3;ויאמר מי שמך לאיש שר ושפט עלינו הלהרגני אתה אמר כאשר הרגת את המצרי ויירא משה ויאמר אכן נודע הדבר
(270810, 52, 4);6;ו;79762;(2, 2, 14, 62, 79762);21052;(2, 2, 14, 17, 21052);ויאמר;1;17;ויאמר מי שמך לאיש שר ושפט עלינו הלהרגני אתה אמר כאשר הרגת את המצרי ויירא משה ויאמר אכן נודע הדבר
(270810, 52, 4);8;ח;79814;(2, 2, 15, 37, 79814);21065;(2, 2, 15, 10, 21065);ויברח;5;10;וישמע פרעה את הדבר הזה ויבקש להרג את משה ויברח משה מפני פרעה וישב בארץ מדין וישב על הבאר
(270810, 52, 4);2;ב;79866;(2, 2, 16, 19, 79866);21079;(2, 2, 16, 5, 21079);ותבאנה;3;5;ולכהן מדין שבע בנות ותבאנה ותדלנה ותמלאנה את הרהטים להשקות צאן אביהן
(270810, 52, 4);200;ר;79918;(2, 2, 17, 14, 79918);21089;(2, 2, 17, 3, 21089);ויגרשום;4;3;ויבאו הרעים ויגרשום ויקם משה ויושען וישק את צאנם
(270810, 52, 4);6;ו;79970;(2, 2, 18, 26, 79970);21101;(2, 2, 18, 6, 21101);מדוע;3;6;ותבאנה אל רעואל אביהן ויאמר מדוע מהרתן בא היום
(270810, 52, 4);6;ו;80022;(2, 2, 19, 40, 80022);21115;(2, 2, 19, 11, 21115);וישק;1;11;ותאמרן איש מצרי הצילנו מיד הרעים וגם דלה דלה לנו וישק את הצאן
(270810, 52, 4);30;ל;80074;(2, 2, 20, 43, 80074);21129;(2, 2, 20, 12, 21129);ויאכל;5;12;ויאמר אל בנתיו ואיו למה זה עזבתן את האיש קראן לו ויאכל לחם
(270810, 52, 4);300;ש;80126;(2, 2, 22, 14, 80126);21145;(2, 2, 22, 5, 21145);שמו;1;5;ותלד בן ויקרא את שמו גרשם כי אמר גר הייתי בארץ נכריה
(270810, 52, 4);40;מ;80178;(2, 2, 23, 25, 80178);21159;(2, 2, 23, 7, 21159);מצרים;1;7;ויהי בימים הרבים ההם וימת מלך מצרים ויאנחו בני ישראל מן העבדה ויזעקו ותעל שועתם אל האלהים מן העבדה
(270810, 52, 4);70;ע;80230;(2, 2, 23, 77, 80230);21171;(2, 2, 23, 19, 21171);העבדה;2;19;ויהי בימים הרבים ההם וימת מלך מצרים ויאנחו בני ישראל מן העבדה ויזעקו ותעל שועתם אל האלהים מן העבדה
(270810, 52, 4);1;א;80282;(2, 2, 24, 49, 80282);21184;(2, 2, 24, 13, 21184);ואת;2;13;וישמע אלהים את נאקתם ויזכר אלהים את בריתו את אברהם את יצחק ואת יעקב
(270810, 52, 4);6;ו;80334;(2, 3, 1, 19, 80334);21198;(2, 3, 1, 6, 21198);יתרו;4;6;ומשה היה רעה את צאן יתרו חתנו כהן מדין וינהג את הצאן אחר המדבר ויבא אל הר האלהים חרבה
(270810, 52, 4);1;א;80386;(2, 3, 2, 4, 80386);21212;(2, 3, 2, 1, 21212);וירא;4;1;וירא מלאך יהוה אליו בלבת אש מתוך הסנה וירא והנה הסנה בער באש והסנה איננו אכל
(270810, 52, 4);50;נ;80438;(2, 3, 2, 56, 80438);21226;(2, 3, 2, 15, 21226);איננו;3;15;וירא מלאך יהוה אליו בלבת אש מתוך הסנה וירא והנה הסנה בער באש והסנה איננו אכל
(270810, 52, 4);5;ה;80490;(2, 3, 3, 47, 80490);21240;(2, 3, 3, 13, 21240);הסנה;4;13;ויאמר משה אסרה נא ואראה את המראה הגדל הזה מדוע לא יבער הסנה
(270810, 52, 4);10;י;80542;(2, 3, 4, 52, 80542);21254;(2, 3, 4, 14, 21254);ויאמר;2;14;וירא יהוה כי סר לראות ויקרא אליו אלהים מתוך הסנה ויאמר משה משה ויאמר הנני
(270810, 52, 4);40;מ;80594;(2, 3, 5, 45, 80594);21268;(2, 3, 5, 13, 21268);עומד;3;13;ויאמר אל תקרב הלם של נעליך מעל רגליך כי המקום אשר אתה עומד עליו אדמת קדש הוא
(270810, 52, 4);30;ל;80646;(2, 3, 6, 37, 80646);21281;(2, 3, 6, 9, 21281);ואלהי;3;9;ויאמר אנכי אלהי אביך אלהי אברהם אלהי יצחק ואלהי יעקב ויסתר משה פניו כי ירא מהביט אל האלהים
(270810, 52, 4);400;ת;80698;(2, 3, 7, 16, 80698);21294;(2, 3, 7, 4, 21294);ראיתי;4;4;ויאמר יהוה ראה ראיתי את עני עמי אשר במצרים ואת צעקתם שמעתי מפני נגשיו כי ידעתי את מכאביו
(270810, 52, 4);1;א;80750;(2, 3, 7, 68, 80750);21308;(2, 3, 7, 18, 21308);מכאביו;3;18;ויאמר יהוה ראה ראיתי את עני עמי אשר במצרים ואת צעקתם שמעתי מפני נגשיו כי ידעתי את מכאביו
(270810, 52, 4);5;ה;80802;(2, 3, 8, 49, 80802);21320;(2, 3, 8, 12, 21320);ורחבה;5;12;וארד להצילו מיד מצרים ולהעלתו מן הארץ ההוא אל ארץ טובה ורחבה אל ארץ זבת חלב ודבש אל מקום הכנעני והחתי והאמרי והפרזי והחוי והיבוסי
(270810, 52, 4);10;י;80854;(2, 3, 8, 101, 80854);21333;(2, 3, 8, 25, 21333);והיבוסי;3;25;וארד להצילו מיד מצרים ולהעלתו מן הארץ ההוא אל ארץ טובה ורחבה אל ארץ זבת חלב ודבש אל מקום הכנעני והחתי והאמרי והפרזי והחוי והיבוסי
(270810, 52, 4);30;ל;80906;(2, 3, 9, 48, 80906);21347;(2, 3, 9, 14, 21347);לחצים;1;14;ועתה הנה צעקת בני ישראל באה אלי וגם ראיתי את הלחץ אשר מצרים לחצים אתם
(270810, 52, 4);10;י;80958;(2, 3, 11, 2, 80958);21360;(2, 3, 11, 1, 21360);ויאמר;2;1;ויאמר משה אל האלהים מי אנכי כי אלך אל פרעה וכי אוציא את בני ישראל ממצרים
(270810, 52, 4);90;צ;81010;(2, 3, 11, 54, 81010);21375;(2, 3, 11, 16, 21375);ממצרים;3;16;ויאמר משה אל האלהים מי אנכי כי אלך אל פרעה וכי אוציא את בני ישראל ממצרים
(270810, 52, 4);40;מ;81062;(2, 3, 12, 49, 81062);21389;(2, 3, 12, 14, 21389);ממצרים;2;14;ויאמר כי אהיה עמך וזה לך האות כי אנכי שלחתיך בהוציאך את העם ממצרים תעבדון את האלהים על ההר הזה
(270810, 52, 4);1;א;81114;(2, 3, 13, 26, 81114);21403;(2, 3, 13, 8, 21403);אל;1;8;ויאמר משה אל האלהים הנה אנכי בא אל בני ישראל ואמרתי להם אלהי אבותיכם שלחני אליכם ואמרו לי מה שמו מה אמר אלהם
(270810, 52, 4);40;מ;81166;(2, 3, 13, 78, 81166);21416;(2, 3, 13, 21, 21416);מה;1;21;ויאמר משה אל האלהים הנה אנכי בא אל בני ישראל ואמרתי להם אלהי אבותיכם שלחני אליכם ואמרו לי מה שמו מה אמר אלהם
(270810, 52, 4);200;ר;81218;(2, 3, 14, 44, 81218);21430;(2, 3, 14, 12, 21430);ישראל;3;12;ויאמר אלהים אל משה אהיה אשר אהיה ויאמר כה תאמר לבני ישראל אהיה שלחני אליכם
(270810, 52, 4);5;ה;81270;(2, 3, 15, 36, 81270);21444;(2, 3, 15, 11, 21444);יהוה;2;11;ויאמר עוד אלהים אל משה כה תאמר אל בני ישראל יהוה אלהי אבתיכם אלהי אברהם אלהי יצחק ואלהי יעקב שלחני אליכם זה שמי לעלם וזה זכרי לדר דר
(270810, 52, 4);40;מ;81322;(2, 3, 15, 88, 81322);21456;(2, 3, 15, 23, 21456);שמי;2;23;ויאמר עוד אלהים אל משה כה תאמר אל בני ישראל יהוה אלהי אבתיכם אלהי אברהם אלהי יצחק ואלהי יעקב שלחני אליכם זה שמי לעלם וזה זכרי לדר דר
(270810, 52, 4);10;י;81374;(2, 3, 16, 35, 81374);21470;(2, 3, 16, 9, 21470);אלהי;4;9;לך ואספת את זקני ישראל ואמרת אלהם יהוה אלהי אבתיכם נראה אלי אלהי אברהם יצחק ויעקב לאמר פקד פקדתי אתכם ואת העשוי לכם במצרים
(270810, 52, 4);70;ע;81426;(2, 3, 16, 87, 81426);21483;(2, 3, 16, 22, 21483);העשוי;2;22;לך ואספת את זקני ישראל ואמרת אלהם יהוה אלהי אבתיכם נראה אלי אלהי אברהם יצחק ויעקב לאמר פקד פקדתי אתכם ואת העשוי לכם במצרים
(270810, 52, 4);1;א;81478;(2, 3, 17, 40, 81478);21495;(2, 3, 17, 10, 21495);והאמרי;3;10;ואמר אעלה אתכם מעני מצרים אל ארץ הכנעני והחתי והאמרי והפרזי והחוי והיבוסי אל ארץ זבת חלב ודבש
(270810, 52, 4);5;ה;81530;(2, 3, 18, 16, 81530);21507;(2, 3, 18, 4, 21507);אתה;3;4;ושמעו לקלך ובאת אתה וזקני ישראל אל מלך מצרים ואמרתם אליו יהוה אלהי העבריים נקרה עלינו ועתה נלכה נא דרך שלשת ימים במדבר ונזבחה ליהוה אלהינו
(270810, 52, 4);10;י;81582;(2, 3, 18, 68, 81582);21519;(2, 3, 18, 16, 21519);עלינו;3;16;ושמעו לקלך ובאת אתה וזקני ישראל אל מלך מצרים ואמרתם אליו יהוה אלהי העבריים נקרה עלינו ועתה נלכה נא דרך שלשת ימים במדבר ונזבחה ליהוה אלהינו
(270810, 52, 4);70;ע;81634;(2, 3, 19, 7, 81634);21531;(2, 3, 19, 2, 21531);ידעתי;3;2;ואני ידעתי כי לא יתן אתכם מלך מצרים להלך ולא ביד חזקה
(270810, 52, 4);10;י;81686;(2, 3, 20, 17, 81686);21545;(2, 3, 20, 4, 21545);והכיתי;6;4;ושלחתי את ידי והכיתי את מצרים בכל נפלאתי אשר אעשה בקרבו ואחרי כן ישלח אתכם
(270810, 52, 4);50;ן;81738;(2, 3, 21, 9, 81738);21559;(2, 3, 21, 3, 21559);חן;2;3;ונתתי את חן העם הזה בעיני מצרים והיה כי תלכון לא תלכו ריקם
(270810, 52, 4);6;ו;81790;(2, 3, 22, 15, 81790);21573;(2, 3, 22, 4, 21573);ומגרת;1;4;ושאלה אשה משכנתה ומגרת ביתה כלי כסף וכלי זהב ושמלת ושמתם על בניכם ועל בנתיכם ונצלתם את מצרים
(270810, 52, 4);400;ת;81842;(2, 3, 22, 67, 81842);21585;(2, 3, 22, 16, 21585);ונצלתם;5;16;ושאלה אשה משכנתה ומגרת ביתה כלי כסף וכלי זהב ושמלת ושמתם על בניכם ועל בנתיכם ונצלתם את מצרים
(270810, 52, 4);6;ו;81894;(2, 4, 1, 44, 81894);21599;(2, 4, 1, 12, 21599);יאמרו;5;12;ויען משה ויאמר והן לא יאמינו לי ולא ישמעו בקלי כי יאמרו לא נראה אליך יהוה
(270810, 52, 4);20;כ;81946;(2, 4, 3, 10, 81946);21612;(2, 4, 3, 2, 21612);השליכהו;5;2;ויאמר השליכהו ארצה וישלכהו ארצה ויהי לנחש וינס משה מפניו
(270810, 52, 4);300;ש;81998;(2, 4, 4, 15, 81998);21625;(2, 4, 4, 5, 21625);שלח;1;5;ויאמר יהוה אל משה שלח ידך ואחז בזנבו וישלח ידו ויחזק בו ויהי למטה בכפו
(270810, 52, 4);20;כ;82050;(2, 4, 5, 11, 82050);21638;(2, 4, 5, 3, 21638);כי;1;3;למען יאמינו כי נראה אליך יהוה אלהי אבתם אלהי אברהם אלהי יצחק ואלהי יעקב
(270810, 52, 4);200;ר;82102;(2, 4, 6, 5, 82102);21650;(2, 4, 6, 1, 21650);ויאמר;5;1;ויאמר יהוה לו עוד הבא נא ידך בחיקך ויבא ידו בחיקו ויוצאה והנה ידו מצרעת כשלג
(270810, 52, 4);400;ת;82154;(2, 4, 6, 57, 82154);21664;(2, 4, 6, 15, 21664);מצרעת;5;15;ויאמר יהוה לו עוד הבא נא ידך בחיקך ויבא ידו בחיקו ויוצאה והנה ידו מצרעת כשלג
(270810, 52, 4);5;ה;82206;(2, 4, 7, 48, 82206);21678;(2, 4, 7, 13, 21678);שבה;3;13;ויאמר השב ידך אל חיקך וישב ידו אל חיקו ויוצאה מחיקו והנה שבה כבשרו
(270810, 52, 4);5;ה;82258;(2, 4, 8, 47, 82258);21692;(2, 4, 8, 13, 21692);האת;1;13;והיה אם לא יאמינו לך ולא ישמעו לקל האת הראשון והאמינו לקל האת האחרון
(270810, 52, 4);30;ל;82310;(2, 4, 9, 44, 82310);21705;(2, 4, 9, 12, 21705);ולקחת;2;12;והיה אם לא יאמינו גם לשני האתות האלה ולא ישמעון לקלך ולקחת ממימי היאר ושפכת היבשה והיו המים אשר תקח מן היאר והיו לדם ביבשת
(270810, 52, 4);2;ב;82362;(2, 4, 9, 96, 82362);21718;(2, 4, 9, 25, 21718);ביבשת;3;25;והיה אם לא יאמינו גם לשני האתות האלה ולא ישמעון לקלך ולקחת ממימי היאר ושפכת היבשה והיו המים אשר תקח מן היאר והיו לדם ביבשת
(270810, 52, 4);40;ם;82414;(2, 4, 10, 50, 82414);21733;(2, 4, 10, 15, 21733);גם;2;15;ויאמר משה אל יהוה בי אדני לא איש דברים אנכי גם מתמול גם משלשם גם מאז דברך אל עבדך כי כבד פה וכבד לשון אנכי
(270810, 52, 4);30;ל;82466;(2, 4, 11, 20, 82466);21750;(2, 4, 11, 7, 21750);לאדם;1;7;ויאמר יהוה אליו מי שם פה לאדם או מי ישום אלם או חרש או פקח או עור הלא אנכי יהוה
(270810, 52, 4);1;א;82518;(2, 4, 12, 12, 82518);21767;(2, 4, 12, 4, 21767);אהיה;1;4;ועתה לך ואנכי אהיה עם פיך והוריתיך אשר תדבר
(270810, 52, 4);80;ף;82570;(2, 4, 14, 6, 82570);21781;(2, 4, 14, 2, 21781);אף;2;2;ויחר אף יהוה במשה ויאמר הלא אהרן אחיך הלוי ידעתי כי דבר ידבר הוא וגם הנה הוא יצא לקראתך וראך ושמח בלבו
(270810, 52, 4);5;ה;82622;(2, 4, 14, 58, 82622);21796;(2, 4, 14, 17, 21796);הוא;1;17;ויחר אף יהוה במשה ויאמר הלא אהרן אחיך הלוי ידעתי כי דבר ידבר הוא וגם הנה הוא יצא לקראתך וראך ושמח בלבו
(270810, 52, 4);20;כ;82674;(2, 4, 15, 29, 82674);21808;(2, 4, 15, 7, 21808);ואנכי;4;7;ודברת אליו ושמת את הדברים בפיו ואנכי אהיה עם פיך ועם פיהו והוריתי אתכם את אשר תעשון
(270810, 52, 4);40;ם;82726;(2, 4, 16, 14, 82726);21823;(2, 4, 16, 5, 21823);העם;3;5;ודבר הוא לך אל העם והיה הוא יהיה לך לפה ואתה תהיה לו לאלהים
(270810, 52, 4);200;ר;82778;(2, 4, 17, 20, 82778);21838;(2, 4, 17, 6, 21838);אשר;3;6;ואת המטה הזה תקח בידך אשר תעשה בו את האתת
(270810, 52, 4);1;א;82830;(2, 4, 18, 40, 82830);21854;(2, 4, 18, 12, 21854);אל;1;12;וילך משה וישב אל יתר חתנו ויאמר לו אלכה נא ואשובה אל אחי אשר במצרים ואראה העודם חיים ויאמר יתרו למשה לך לשלום
(270810, 52, 4);200;ר;82882;(2, 4, 19, 5, 82882);21866;(2, 4, 19, 1, 21866);ויאמר;5;1;ויאמר יהוה אל משה במדין לך שב מצרים כי מתו כל האנשים המבקשים את נפשך
(270810, 52, 4);100;ק;82934;(2, 4, 20, 3, 82934);21881;(2, 4, 20, 1, 21881);ויקח;3;1;ויקח משה את אשתו ואת בניו וירכבם על החמר וישב ארצה מצרים ויקח משה את מטה האלהים בידו
(270810, 52, 4);40;מ;82986;(2, 4, 20, 55, 82986);21896;(2, 4, 20, 16, 21896);מטה;1;16;ויקח משה את אשתו ואת בניו וירכבם על החמר וישב ארצה מצרים ויקח משה את מטה האלהים בידו
(270810, 52, 4);40;ם;83038;(2, 4, 21, 40, 83038);21908;(2, 4, 21, 10, 21908);המפתים;6;10;ויאמר יהוה אל משה בלכתך לשוב מצרימה ראה כל המפתים אשר שמתי בידך ועשיתם לפני פרעה ואני אחזק את לבו ולא ישלח את העם
(270810, 52, 4);1;א;83090;(2, 4, 22, 2, 83090);21923;(2, 4, 22, 1, 21923);ואמרת;2;1;ואמרת אל פרעה כה אמר יהוה בני בכרי ישראל
(270810, 52, 4);50;נ;83142;(2, 4, 23, 22, 83142);21937;(2, 4, 23, 6, 21937);ויעבדני;6;6;ואמר אליך שלח את בני ויעבדני ותמאן לשלחו הנה אנכי הרג את בנך בכרך
(270810, 52, 4);5;ה;83194;(2, 4, 24, 22, 83194);21950;(2, 4, 24, 5, 21950);יהוה;2;5;ויהי בדרך במלון ויפגשהו יהוה ויבקש המיתו
(270810, 52, 4);20;כ;83246;(2, 4, 25, 40, 83246);21963;(2, 4, 25, 11, 21963);כי;1;11;ותקח צפרה צר ותכרת את ערלת בנה ותגע לרגליו ותאמר כי חתן דמים אתה לי
(270810, 52, 4);5;ה;83298;(2, 4, 27, 13, 83298);21978;(2, 4, 27, 4, 21978);אהרן;2;4;ויאמר יהוה אל אהרן לך לקראת משה המדברה וילך ויפגשהו בהר האלהים וישק לו
(270810, 52, 4);30;ל;83350;(2, 4, 28, 8, 83350);21991;(2, 4, 28, 3, 21991);לאהרן;1;3;ויגד משה לאהרן את כל דברי יהוה אשר שלחו ואת כל האתת אשר צוהו
(270810, 52, 4);6;ו;83402;(2, 4, 29, 13, 83402);22006;(2, 4, 29, 4, 22006);ויאספו;1;4;וילך משה ואהרן ויאספו את כל זקני בני ישראל
(270810, 52, 4);30;ל;83454;(2, 4, 30, 31, 83454);22020;(2, 4, 30, 9, 22020);אל;2;9;וידבר אהרן את כל הדברים אשר דבר יהוה אל משה ויעש האתת לעיני העם
(270810, 52, 4);30;ל;83506;(2, 4, 31, 33, 83506);22034;(2, 4, 31, 9, 22034);ישראל;5;9;ויאמן העם וישמעו כי פקד יהוה את בני ישראל וכי ראה את ענים ויקדו וישתחוו
(270810, 52, 4);20;כ;83558;(2, 5, 1, 28, 83558);22048;(2, 5, 1, 8, 22048);כה;1;8;ואחר באו משה ואהרן ויאמרו אל פרעה כה אמר יהוה אלהי ישראל שלח את עמי ויחגו לי במדבר
(270810, 52, 4);5;ה;83610;(2, 5, 2, 15, 83610);22062;(2, 5, 2, 4, 22062);יהוה;4;4;ויאמר פרעה מי יהוה אשר אשמע בקלו לשלח את ישראל לא ידעתי את יהוה וגם את ישראל לא אשלח
(270810, 52, 4);6;ו;83662;(2, 5, 3, 1, 83662);22078;(2, 5, 3, 1, 22078);ויאמרו;1;1;ויאמרו אלהי העברים נקרא עלינו נלכה נא דרך שלשת ימים במדבר ונזבחה ליהוה אלהינו פן יפגענו בדבר או בחרב
(270810, 52, 4);5;ה;83714;(2, 5, 3, 53, 83714);22089;(2, 5, 3, 12, 22089);ונזבחה;6;12;ויאמרו אלהי העברים נקרא עלינו נלכה נא דרך שלשת ימים במדבר ונזבחה ליהוה אלהינו פן יפגענו בדבר או בחרב
(270810, 52, 4);5;ה;83766;(2, 5, 4, 23, 83766);22102;(2, 5, 4, 6, 22102);משה;3;6;ויאמר אלהם מלך מצרים למה משה ואהרן תפריעו את העם ממעשיו לכו לסבלתיכם
(270810, 52, 4);70;ע;83818;(2, 5, 5, 19, 83818);22115;(2, 5, 5, 6, 22115);עם;1;6;ויאמר פרעה הן רבים עתה עם הארץ והשבתם אתם מסבלתם
(270810, 52, 4);9;ט;83870;(2, 5, 6, 32, 83870);22128;(2, 5, 6, 9, 22128);שטריו;2;9;ויצו פרעה ביום ההוא את הנגשים בעם ואת שטריו לאמר
(270810, 52, 4);300;ש;83922;(2, 5, 7, 45, 83922);22141;(2, 5, 7, 12, 22141);וקששו;3;12;לא תאספון לתת תבן לעם ללבן הלבנים כתמול שלשם הם ילכו וקששו להם תבן
(270810, 52, 4);400;ת;83974;(2, 5, 8, 44, 83974);22155;(2, 5, 8, 12, 22155);תגרעו;1;12;ואת מתכנת הלבנים אשר הם עשים תמול שלשם תשימו עליהם לא תגרעו ממנו כי נרפים הם על כן הם צעקים לאמר נלכה נזבחה לאלהינו
(270810, 52, 4);4;ד;84026;(2, 5, 9, 4, 84026);22168;(2, 5, 9, 1, 22168);תכבד;4;1;תכבד העבדה על האנשים ויעשו בה ואל ישעו בדברי שקר
(270810, 52, 4);10;י;84078;(2, 5, 10, 17, 84078);22181;(2, 5, 10, 4, 22181);ושטריו;5;4;ויצאו נגשי העם ושטריו ויאמרו אל העם לאמר כה אמר פרעה אינני נתן לכם תבן
(270810, 52, 4);400;ת;84130;(2, 5, 11, 13, 84130);22197;(2, 5, 11, 5, 22197);תבן;1;5;אתם לכו קחו לכם תבן מאשר תמצאו כי אין נגרע מעבדתכם דבר
(270810, 52, 4);300;ש;84182;(2, 5, 12, 22, 84182);22210;(2, 5, 12, 6, 22210);לקשש;4;6;ויפץ העם בכל ארץ מצרים לקשש קש לתבן
(270810, 52, 4);400;ת;84234;(2, 5, 13, 46, 84234);22223;(2, 5, 13, 11, 22223);התבן;2;11;והנגשים אצים לאמר כלו מעשיכם דבר יום ביומו כאשר בהיות התבן
(270810, 52, 4);8;ח;84286;(2, 5, 14, 50, 84286);22237;(2, 5, 14, 14, 22237);חקכם;1;14;ויכו שטרי בני ישראל אשר שמו עלהם נגשי פרעה לאמר מדוע לא כליתם חקכם ללבן כתמול שלשם גם תמול גם היום
(270810, 52, 4);1;א;84338;(2, 5, 15, 24, 84338);22250;(2, 5, 15, 6, 22250);אל;1;6;ויבאו שטרי בני ישראל ויצעקו אל פרעה לאמר למה תעשה כה לעבדיך
(270810, 52, 4);50;נ;84390;(2, 5, 16, 28, 84390);22263;(2, 5, 16, 7, 22263);לנו;2;7;תבן אין נתן לעבדיך ולבנים אמרים לנו עשו והנה עבדיך מכים וחטאת עמך
(270810, 52, 4);40;מ;84442;(2, 5, 17, 27, 84442);22277;(2, 5, 17, 8, 22277);אמרים;2;8;ויאמר נרפים אתם נרפים על כן אתם אמרים נלכה נזבחה ליהוה
(270810, 52, 4);400;ת;84494;(2, 5, 18, 35, 84494);22290;(2, 5, 18, 10, 22290);תתנו;2;10;ועתה לכו עבדו ותבן לא ינתן לכם ותכן לבנים תתנו
(270810, 52, 4);6;ו;84546;(2, 5, 19, 50, 84546);22303;(2, 5, 19, 13, 22303);ביומו;3;13;ויראו שטרי בני ישראל אתם ברע לאמר לא תגרעו מלבניכם דבר יום ביומו
(270810, 52, 4);5;ה;84598;(2, 5, 21, 9, 84598);22315;(2, 5, 21, 2, 22315);אלהם;3;2;ויאמרו אלהם ירא יהוה עליכם וישפט אשר הבאשתם את ריחנו בעיני פרעה ובעיני עבדיו לתת חרב בידם להרגנו
(270810, 52, 4);4;ד;84650;(2, 5, 21, 61, 84650);22327;(2, 5, 21, 14, 22327);עבדיו;3;14;ויאמרו אלהם ירא יהוה עליכם וישפט אשר הבאשתם את ריחנו בעיני פרעה ובעיני עבדיו לתת חרב בידם להרגנו
(270810, 52, 4);5;ה;84702;(2, 5, 22, 34, 84702);22341;(2, 5, 22, 10, 22341);הזה;1;10;וישב משה אל יהוה ויאמר אדני למה הרעתה לעם הזה למה זה שלחתני
(270810, 52, 4);90;צ;84754;(2, 5, 23, 39, 84754);22356;(2, 5, 23, 12, 22356);הצלת;2;12;ומאז באתי אל פרעה לדבר בשמך הרע לעם הזה והצל לא הצלת את עמך
(270810, 52, 4);30;ל;84806;(2, 6, 1, 45, 84806);22371;(2, 6, 1, 13, 22371);ישלחם;3;13;ויאמר יהוה אל משה עתה תראה אשר אעשה לפרעה כי ביד חזקה ישלחם וביד חזקה יגרשם מארצו
(270810, 52, 4);6;ו;84858;(2, 6, 3, 1, 84858);22384;(2, 6, 3, 1, 22384);וארא;1;1;וארא אל אברהם אל יצחק ואל יעקב באל שדי ושמי יהוה לא נודעתי להם
(270810, 52, 4);5;ה;84910;(2, 6, 4, 4, 84910);22399;(2, 6, 4, 2, 22399);הקמתי;1;2;וגם הקמתי את בריתי אתם לתת להם את ארץ כנען את ארץ מגריהם אשר גרו בה
(270810, 52, 4);1;א;84962;(2, 6, 5, 4, 84962);22415;(2, 6, 5, 2, 22415);אני;1;2;וגם אני שמעתי את נאקת בני ישראל אשר מצרים מעבדים אתם ואזכר את בריתי
(270810, 52, 4);20;כ;85014;(2, 6, 6, 2, 85014);22428;(2, 6, 6, 1, 22428);לכן;2;1;לכן אמר לבני ישראל אני יהוה והוצאתי אתכם מתחת סבלת מצרים והצלתי אתכם מעבדתם וגאלתי אתכם בזרוע נטויה ובשפטים גדלים
(270810, 52, 4);400;ת;85066;(2, 6, 6, 54, 85066);22440;(2, 6, 6, 13, 22440);אתכם;2;13;לכן אמר לבני ישראל אני יהוה והוצאתי אתכם מתחת סבלת מצרים והצלתי אתכם מעבדתם וגאלתי אתכם בזרוע נטויה ובשפטים גדלים
(270810, 52, 4);10;י;85118;(2, 6, 7, 12, 85118);22450;(2, 6, 7, 3, 22450);לי;2;3;ולקחתי אתכם לי לעם והייתי לכם לאלהים וידעתם כי אני יהוה אלהיכם המוציא אתכם מתחת סבלות מצרים
(270810, 52, 4);8;ח;85170;(2, 6, 7, 64, 85170);22462;(2, 6, 7, 15, 22462);מתחת;3;15;ולקחתי אתכם לי לעם והייתי לכם לאלהים וידעתם כי אני יהוה אלהיכם המוציא אתכם מתחת סבלות מצרים
(270810, 52, 4);40;ם;85222;(2, 6, 8, 41, 85222);22475;(2, 6, 8, 11, 22475);לאברהם;6;11;והבאתי אתכם אל הארץ אשר נשאתי את ידי לתת אתה לאברהם ליצחק וליעקב ונתתי אתה לכם מורשה אני יהוה
(270810, 52, 4);200;ר;85274;(2, 6, 9, 18, 85274);22489;(2, 6, 9, 6, 22489);ישראל;3;6;וידבר משה כן אל בני ישראל ולא שמעו אל משה מקצר רוח ומעבדה קשה
(270810, 52, 4);2;ב;85326;(2, 6, 11, 4, 85326);22504;(2, 6, 11, 2, 22504);דבר;2;2;בא דבר אל פרעה מלך מצרים וישלח את בני ישראל מארצו
(270810, 52, 4);30;ל;85378;(2, 6, 12, 17, 85378);22518;(2, 6, 12, 5, 22518);לאמר;1;5;וידבר משה לפני יהוה לאמר הן בני ישראל לא שמעו אלי ואיך ישמעני פרעה ואני ערל שפתים
