(200012, -79, 4);5;ה;236036;(4, 28, 19, 2, 236036);62170;(4, 28, 19, 1, 62170);והקרבתם;2;1;והקרבתם אשה עלה ליהוה פרים בני בקר שנים ואיל אחד ושבעה כבשים בני שנה תמימם יהיו לכם
(200012, -79, 4);5;ה;236115;(4, 28, 20, 14, 236115);62189;(4, 28, 20, 3, 62189);בלולה;5;3;ומנחתם סלת בלולה בשמן שלשה עשרנים לפר ושני עשרנים לאיל תעשו
(200012, -79, 4);8;ח;236194;(4, 28, 22, 11, 236194);62207;(4, 28, 22, 3, 62207);אחד;2;3;ושעיר חטאת אחד לכפר עליכם
(200012, -79, 4);6;ו;236273;(4, 28, 24, 37, 236273);62228;(4, 28, 24, 10, 62228);ליהוה;4;10;כאלה תעשו ליום שבעת ימים לחם אשה ריח ניחח ליהוה על עולת התמיד יעשה ונסכו
(200012, -79, 4);200;ר;236352;(4, 28, 26, 16, 236352);62247;(4, 28, 26, 3, 62247);בהקריבכם;4;3;וביום הבכורים בהקריבכם מנחה חדשה ליהוה בשבעתיכם מקרא קדש יהיה לכם כל מלאכת עבדה לא תעשו
(200012, -79, 4);6;ו;236431;(4, 28, 27, 23, 236431);62265;(4, 28, 27, 5, 62265);ליהוה;4;5;והקרבתם עולה לריח ניחח ליהוה פרים בני בקר שנים איל אחד שבעה כבשים בני שנה
(200012, -79, 4);10;י;236510;(4, 28, 28, 43, 236510);62285;(4, 28, 28, 10, 62285);עשרנים;5;10;ומנחתם סלת בלולה בשמן שלשה עשרנים לפר האחד שני עשרנים לאיל האחד
(200012, -79, 4);300;ש;236589;(4, 28, 31, 21, 236589);62303;(4, 28, 31, 5, 62303);תעשו;3;5;מלבד עלת התמיד ומנחתו תעשו תמימם יהיו לכם ונסכיהם
(200012, -79, 4);10;י;236668;(4, 29, 1, 59, 236668);62323;(4, 29, 1, 16, 62323);יהיה;1;16;ובחדש השביעי באחד לחדש מקרא קדש יהיה לכם כל מלאכת עבדה לא תעשו יום תרועה יהיה לכם
(200012, -79, 4);2;ב;236747;(4, 29, 3, 15, 236747);62344;(4, 29, 3, 4, 62344);בשמן;1;4;ומנחתם סלת בלולה בשמן שלשה עשרנים לפר שני עשרנים לאיל
(200012, -79, 4);30;ל;236826;(4, 29, 5, 22, 236826);62362;(4, 29, 5, 6, 62362);עליכם;2;6;ושעיר עזים אחד חטאת לכפר עליכם
(200012, -79, 4);70;ע;236905;(4, 29, 7, 15, 236905);62378;(4, 29, 7, 3, 62378);השביעי;5;3;ובעשור לחדש השביעי הזה מקרא קדש יהיה לכם ועניתם את נפשתיכם כל מלאכה לא תעשו
(200012, -79, 4);1;א;236984;(4, 29, 8, 33, 236984);62400;(4, 29, 8, 10, 62400);איל;1;10;והקרבתם עלה ליהוה ריח ניחח פר בן בקר אחד איל אחד כבשים בני שנה שבעה תמימם יהיו לכם
(200012, -79, 4);8;ח;237063;(4, 29, 9, 47, 237063);62419;(4, 29, 9, 11, 62419);האחד;3;11;ומנחתם סלת בלולה בשמן שלשה עשרנים לפר שני עשרנים לאיל האחד
(200012, -79, 4);10;י;237142;(4, 29, 11, 49, 237142);62436;(4, 29, 11, 11, 62436);ונסכיהם;5;11;שעיר עזים אחד חטאת מלבד חטאת הכפרים ועלת התמיד ומנחתה ונסכיהם
(200012, -79, 4);200;ר;237221;(4, 29, 13, 4, 237221);62456;(4, 29, 13, 1, 62456);והקרבתם;4;1;והקרבתם עלה אשה ריח ניחח ליהוה פרים בני בקר שלשה עשר אילם שנים כבשים בני שנה ארבעה עשר תמימם יהיו
(200012, -79, 4);400;ת;237300;(4, 29, 14, 5, 237300);62476;(4, 29, 14, 1, 62476);ומנחתם;5;1;ומנחתם סלת בלולה בשמן שלשה עשרנים לפר האחד לשלשה עשר פרים שני עשרנים לאיל האחד לשני האילם
(200012, -79, 4);50;ן;237379;(4, 29, 15, 11, 237379);62494;(4, 29, 15, 2, 62494);עשרון;5;2;ועשרון עשרון לכבש האחד לארבעה עשר כבשים
(200012, -79, 4);200;ר;237458;(4, 29, 17, 19, 237458);62513;(4, 29, 17, 5, 62513);בקר;3;5;וביום השני פרים בני בקר שנים עשר אילם שנים כבשים בני שנה ארבעה עשר תמימם
(200012, -79, 4);80;פ;237537;(4, 29, 18, 40, 237537);62530;(4, 29, 18, 7, 62530);כמשפט;4;7;ומנחתם ונסכיהם לפרים לאילם ולכבשים במספרם כמשפט
(200012, -79, 4);50;נ;237616;(4, 29, 20, 37, 237616);62548;(4, 29, 20, 9, 62548);בני;2;9;וביום השלישי פרים עשתי עשר אילם שנים כבשים בני שנה ארבעה עשר תמימם
(200012, -79, 4);400;ת;237695;(4, 29, 22, 21, 237695);62565;(4, 29, 22, 6, 62565);התמיד;2;6;ושעיר חטאת אחד מלבד עלת התמיד ומנחתה ונסכה
(200012, -79, 4);80;פ;237774;(4, 29, 24, 14, 237774);62582;(4, 29, 24, 3, 62582);לפרים;2;3;מנחתם ונסכיהם לפרים לאילם ולכבשים במספרם כמשפט
(200012, -79, 4);40;ם;237853;(4, 29, 26, 15, 237853);62598;(4, 29, 26, 3, 62598);פרים;4;3;וביום החמישי פרים תשעה אילם שנים כבשים בני שנה ארבעה עשר תמימם
(200012, -79, 4);300;ש;237932;(4, 29, 28, 2, 237932);62615;(4, 29, 28, 1, 62615);ושעיר;2;1;ושעיר חטאת אחד מלבד עלת התמיד ומנחתה ונסכה
(200012, -79, 4);40;מ;238011;(4, 29, 29, 46, 238011);62634;(4, 29, 29, 12, 62634);תמימם;2;12;וביום הששי פרים שמנה אילם שנים כבשים בני שנה ארבעה עשר תמימם
(200012, -79, 4);5;ה;238090;(4, 29, 31, 35, 238090);62649;(4, 29, 31, 8, 62649);ונסכיה;6;8;ושעיר חטאת אחד מלבד עלת התמיד מנחתה ונסכיה
(200012, -79, 4);10;י;238169;(4, 29, 33, 28, 238169);62666;(4, 29, 33, 5, 62666);ולכבשים;6;5;ומנחתם ונסכהם לפרים לאילם ולכבשים במספרם כמשפטם
(200012, -79, 4);5;ה;238248;(4, 29, 35, 32, 238248);62684;(4, 29, 35, 8, 62684);עבדה;4;8;ביום השמיני עצרת תהיה לכם כל מלאכת עבדה לא תעשו
(200012, -79, 4);1;א;238327;(4, 29, 37, 17, 238327);62705;(4, 29, 37, 4, 62705);לאיל;2;4;מנחתם ונסכיהם לפר לאיל ולכבשים במספרם כמשפט
(200012, -79, 4);40;מ;238406;(4, 29, 39, 24, 238406);62722;(4, 29, 39, 6, 62722);מנדריכם;1;6;אלה תעשו ליהוה במועדיכם לבד מנדריכם ונדבתיכם לעלתיכם ולמנחתיכם ולנסכיכם ולשלמיכם
(200012, -79, 4);400;ת;238485;(4, 30, 1, 33, 238485);62737;(4, 30, 1, 10, 62737);את;2;10;ויאמר משה אל בני ישראל ככל אשר צוה יהוה את משה
(200012, -79, 4);1;א;238564;(4, 30, 3, 28, 238564);62760;(4, 30, 3, 9, 62760);לאסר;2;9;איש כי ידר נדר ליהוה או השבע שבעה לאסר אסר על נפשו לא יחל דברו ככל היצא מפיו יעשה
(200012, -79, 4);1;א;238643;(4, 30, 5, 5, 238643);62782;(4, 30, 5, 2, 62782);אביה;1;2;ושמע אביה את נדרה ואסרה אשר אסרה על נפשה והחריש לה אביה וקמו כל נדריה וכל אסר אשר אסרה על נפשה יקום
(200012, -79, 4);10;י;238722;(4, 30, 6, 6, 238722);62804;(4, 30, 6, 2, 62804);הניא;3;2;ואם הניא אביה אתה ביום שמעו כל נדריה ואסריה אשר אסרה על נפשה לא יקום ויהוה יסלח לה כי הניא אביה אתה
(200012, -79, 4);400;ת;238801;(4, 30, 7, 7, 238801);62827;(4, 30, 7, 3, 62827);תהיה;1;3;ואם היו תהיה לאיש ונדריה עליה או מבטא שפתיה אשר אסרה על נפשה
(200012, -79, 4);5;ה;238880;(4, 30, 8, 38, 238880);62846;(4, 30, 8, 9, 62846);ואסרה;5;9;ושמע אישה ביום שמעו והחריש לה וקמו נדריה ואסרה אשר אסרה על נפשה יקמו
(200012, -79, 4);80;פ;238959;(4, 30, 9, 62, 238959);62869;(4, 30, 9, 18, 62869);נפשה;2;18;ואם ביום שמע אישה יניא אותה והפר את נדרה אשר עליה ואת מבטא שפתיה אשר אסרה על נפשה ויהוה יסלח לה
(200012, -79, 4);300;ש;239038;(4, 30, 11, 28, 239038);62891;(4, 30, 11, 9, 62891);נפשה;3;9;ואם בית אישה נדרה או אסרה אסר על נפשה בשבעה
(200012, -79, 4);300;ש;239117;(4, 30, 13, 15, 239117);62914;(4, 30, 13, 5, 62914);אישה;3;5;ואם הפר יפר אתם אישה ביום שמעו כל מוצא שפתיה לנדריה ולאסר נפשה לא יקום אישה הפרם ויהוה יסלח לה
(200012, -79, 4);400;ת;239196;(4, 30, 14, 19, 239196);62935;(4, 30, 14, 6, 62935);לענת;4;6;כל נדר וכל שבעת אסר לענת נפש אישה יקימנו ואישה יפרנו
(200012, -79, 4);70;ע;239275;(4, 30, 15, 56, 239275);62958;(4, 30, 15, 18, 62958);עליה;1;18;ואם החרש יחריש לה אישה מיום אל יום והקים את כל נדריה או את כל אסריה אשר עליה הקים אתם כי החרש לה ביום שמעו
(200012, -79, 4);5;ה;239354;(4, 30, 17, 23, 239354);62981;(4, 30, 17, 7, 62981);משה;3;7;אלה החקים אשר צוה יהוה את משה בין איש לאשתו בין אב לבתו בנעריה בית אביה
(200012, -79, 4);200;ר;239433;(4, 31, 2, 28, 239433);63002;(4, 31, 2, 7, 63002);אחר;3;7;נקם נקמת בני ישראל מאת המדינים אחר תאסף אל עמיך
(200012, -79, 4);9;ט;239512;(4, 31, 4, 6, 239512);63023;(4, 31, 4, 2, 63023);למטה;3;2;אלף למטה אלף למטה לכל מטות ישראל תשלחו לצבא
(200012, -79, 4);40;מ;239591;(4, 31, 6, 9, 239591);63043;(4, 31, 6, 3, 63043);משה;1;3;וישלח אתם משה אלף למטה לצבא אתם ואת פינחס בן אלעזר הכהן לצבא וכלי הקדש וחצצרות התרועה בידו
(200012, -79, 4);300;ש;239670;(4, 31, 7, 15, 239670);63062;(4, 31, 7, 4, 63062);כאשר;3;4;ויצבאו על מדין כאשר צוה יהוה את משה ויהרגו כל זכר
(200012, -79, 4);300;ש;239749;(4, 31, 8, 55, 239749);63086;(4, 31, 8, 17, 63086);חמשת;3;17;ואת מלכי מדין הרגו על חלליהם את אוי ואת רקם ואת צור ואת חור ואת רבע חמשת מלכי מדין ואת בלעם בן בעור הרגו בחרב
(200012, -79, 4);6;ו;239828;(4, 31, 9, 49, 239828);63109;(4, 31, 9, 15, 63109);ואת;1;15;וישבו בני ישראל את נשי מדין ואת טפם ואת כל בהמתם ואת כל מקנהם ואת כל חילם בזזו
(200012, -79, 4);40;מ;239907;(4, 31, 11, 33, 239907);63130;(4, 31, 11, 9, 63130);ובבהמה;5;9;ויקחו את כל השלל ואת כל המלקוח באדם ובבהמה
(200012, -79, 4);200;ר;239986;(4, 31, 12, 78, 239986);63152;(4, 31, 12, 22, 63152);אשר;3;22;ויבאו אל משה ואל אלעזר הכהן ואל עדת בני ישראל את השבי ואת המלקוח ואת השלל אל המחנה אל ערבת מואב אשר על ירדן ירחו
(200012, -79, 4);10;י;240065;(4, 31, 14, 22, 240065);63172;(4, 31, 14, 6, 63172);שרי;3;6;ויקצף משה על פקודי החיל שרי האלפים ושרי המאות הבאים מצבא המלחמה
(200012, -79, 4);70;ע;240144;(4, 31, 16, 24, 240144);63191;(4, 31, 16, 7, 63191);בלעם;3;7;הן הנה היו לבני ישראל בדבר בלעם למסר מעל ביהוה על דבר פעור ותהי המגפה בעדת יהוה
(200012, -79, 4);3;ג;240223;(4, 31, 17, 40, 240223);63213;(4, 31, 17, 12, 63213);הרגו;3;12;ועתה הרגו כל זכר בטף וכל אשה ידעת איש למשכב זכר הרגו
(200012, -79, 4);400;ת;240302;(4, 31, 19, 44, 240302);63236;(4, 31, 19, 13, 63236);תתחטאו;2;13;ואתם חנו מחוץ למחנה שבעת ימים כל הרג נפש וכל נגע בחלל תתחטאו ביום השלישי וביום השביעי אתם ושביכם
(200012, -79, 4);200;ר;240381;(4, 31, 21, 5, 240381);63255;(4, 31, 21, 1, 63255);ויאמר;5;1;ויאמר אלעזר הכהן אל אנשי הצבא הבאים למלחמה זאת חקת התורה אשר צוה יהוה את משה
(200012, -79, 4);1;א;240460;(4, 31, 22, 23, 240460);63278;(4, 31, 22, 8, 63278);את;1;8;אך את הזהב ואת הכסף את הנחשת את הברזל את הבדיל ואת העפרת
(200012, -79, 4);10;י;240539;(4, 31, 23, 58, 240539);63301;(4, 31, 23, 18, 63301);תעבירו;4;18;כל דבר אשר יבא באש תעבירו באש וטהר אך במי נדה יתחטא וכל אשר לא יבא באש תעבירו במים
(200012, -79, 4);8;ח;240618;(4, 31, 26, 12, 240618);63320;(4, 31, 26, 4, 63320);מלקוח;5;4;שא את ראש מלקוח השבי באדם ובבהמה אתה ואלעזר הכהן וראשי אבות העדה
(200012, -79, 4);10;י;240697;(4, 31, 27, 39, 240697);63338;(4, 31, 27, 9, 63338);ובין;3;9;וחצית את המלקוח בין תפשי המלחמה היצאים לצבא ובין כל העדה
(200012, -79, 4);10;י;240776;(4, 31, 28, 72, 240776);63358;(4, 31, 28, 18, 63358);החמרים;5;18;והרמת מכס ליהוה מאת אנשי המלחמה היצאים לצבא אחד נפש מחמש המאות מן האדם ומן הבקר ומן החמרים ומן הצאן
(200012, -79, 4);4;ד;240855;(4, 31, 30, 36, 240855);63377;(4, 31, 30, 10, 63377);האדם;3;10;וממחצת בני ישראל תקח אחד אחז מן החמשים מן האדם מן הבקר מן החמרים ומן הצאן מכל הבהמה ונתתה אתם ללוים שמרי משמרת משכן יהוה
(200012, -79, 4);1;א;240934;(4, 31, 31, 19, 240934);63397;(4, 31, 31, 5, 63397);כאשר;2;5;ויעש משה ואלעזר הכהן כאשר צוה יהוה את משה
(200012, -79, 4);300;ש;241013;(4, 31, 33, 5, 241013);63419;(4, 31, 33, 2, 63419);שנים;1;2;ובקר שנים ושבעים אלף
(200012, -79, 4);400;ת;241092;(4, 31, 36, 2, 241092);63440;(4, 31, 36, 1, 63440);ותהי;2;1;ותהי המחצה חלק היצאים בצבא מספר הצאן שלש מאות אלף ושלשים אלף ושבעת אלפים וחמש מאות
(200012, -79, 4);40;מ;241171;(4, 31, 37, 14, 241171);63459;(4, 31, 37, 4, 63459);מן;1;4;ויהי המכס ליהוה מן הצאן שש מאות חמש ושבעים
(200012, -79, 4);400;ת;241250;(4, 31, 39, 22, 241250);63477;(4, 31, 39, 5, 63477);מאות;4;5;וחמרים שלשים אלף וחמש מאות ומכסם ליהוה אחד וששים
(200012, -79, 4);30;ל;241329;(4, 31, 41, 22, 241329);63498;(4, 31, 41, 7, 63498);לאלעזר;1;7;ויתן משה את מכס תרומת יהוה לאלעזר הכהן כאשר צוה יהוה את משה
(200012, -79, 4);90;צ;241408;(4, 31, 43, 16, 241408);63518;(4, 31, 43, 5, 63518);הצאן;2;5;ותהי מחצת העדה מן הצאן שלש מאות אלף ושלשים אלף שבעת אלפים וחמש מאות
(200012, -79, 4);80;פ;241487;(4, 31, 46, 3, 241487);63537;(4, 31, 46, 1, 63537);ונפש;3;1;ונפש אדם ששה עשר אלף
(200012, -79, 4);200;ר;241566;(4, 31, 47, 66, 241566);63559;(4, 31, 47, 18, 63559);שמרי;3;18;ויקח משה ממחצת בני ישראל את האחז אחד מן החמשים מן האדם ומן הבהמה ויתן אתם ללוים שמרי משמרת משכן יהוה כאשר צוה יהוה את משה
(200012, -79, 4);10;י;241645;(4, 31, 49, 2, 241645);63579;(4, 31, 49, 1, 63579);ויאמרו;2;1;ויאמרו אל משה עבדיך נשאו את ראש אנשי המלחמה אשר בידנו ולא נפקד ממנו איש
(200012, -79, 4);1;א;241724;(4, 31, 50, 24, 241724);63600;(4, 31, 50, 7, 63600);מצא;3;7;ונקרב את קרבן יהוה איש אשר מצא כלי זהב אצעדה וצמיד טבעת עגיל וכומז לכפר על נפשתינו לפני יהוה
(200012, -79, 4);30;ל;241803;(4, 31, 51, 29, 241803);63620;(4, 31, 51, 8, 63620);כל;2;8;ויקח משה ואלעזר הכהן את הזהב מאתם כל כלי מעשה
(200012, -79, 4);10;י;241882;(4, 31, 52, 72, 241882);63641;(4, 31, 52, 19, 63641);שרי;3;19;ויהי כל זהב התרומה אשר הרימו ליהוה ששה עשר אלף שבע מאות וחמשים שקל מאת שרי האלפים ומאת שרי המאות
(200012, -79, 4);70;ע;241961;(4, 31, 54, 57, 241961);63662;(4, 31, 54, 15, 63662);מועד;3;15;ויקח משה ואלעזר הכהן את הזהב מאת שרי האלפים והמאות ויבאו אתו אל אהל מועד זכרון לבני ישראל לפני יהוה
(200012, -79, 4);70;ע;242040;(4, 32, 1, 56, 242040);63683;(4, 32, 1, 16, 63683);גלעד;3;16;ומקנה רב היה לבני ראובן ולבני גד עצום מאד ויראו את ארץ יעזר ואת ארץ גלעד והנה המקום מקום מקנה
(200012, -79, 4);200;ר;242119;(4, 32, 3, 3, 242119);63703;(4, 32, 3, 1, 63703);עטרות;3;1;עטרות ודיבן ויעזר ונמרה וחשבון ואלעלה ושבם ונבו ובען
(200012, -79, 4);30;ל;242198;(4, 32, 4, 38, 242198);63722;(4, 32, 4, 11, 63722);ולעבדיך;2;11;הארץ אשר הכה יהוה לפני עדת ישראל ארץ מקנה הוא ולעבדיך מקנה
(200012, -79, 4);2;ב;242277;(4, 32, 6, 10, 242277);63741;(4, 32, 6, 3, 63741);לבני;2;3;ויאמר משה לבני גד ולבני ראובן האחיכם יבאו למלחמה ואתם תשבו פה
(200012, -79, 4);30;ל;242356;(4, 32, 7, 39, 242356);63762;(4, 32, 7, 12, 63762);להם;1;12;ולמה תנואון את לב בני ישראל מעבר אל הארץ אשר נתן להם יהוה
(200012, -79, 4);30;ל;242435;(4, 32, 9, 35, 242435);63783;(4, 32, 9, 10, 63783);לב;1;10;ויעלו עד נחל אשכול ויראו את הארץ ויניאו את לב בני ישראל לבלתי בא אל הארץ אשר נתן להם יהוה
(200012, -79, 4);40;ם;242514;(4, 32, 11, 17, 242514);63804;(4, 32, 11, 4, 63804);העלים;5;4;אם יראו האנשים העלים ממצרים מבן עשרים שנה ומעלה את האדמה אשר נשבעתי לאברהם ליצחק וליעקב כי לא מלאו אחרי
(200012, -79, 4);50;נ;242593;(4, 32, 12, 12, 242593);63824;(4, 32, 12, 4, 63824);יפנה;3;4;בלתי כלב בן יפנה הקנזי ויהושע בן נון כי מלאו אחרי יהוה
(200012, -79, 4);300;ש;242672;(4, 32, 13, 48, 242672);63845;(4, 32, 13, 13, 63845);העשה;3;13;ויחר אף יהוה בישראל וינעם במדבר ארבעים שנה עד תם כל הדור העשה הרע בעיני יהוה
(200012, -79, 4);50;ן;242751;(4, 32, 15, 7, 242751);63865;(4, 32, 15, 2, 63865);תשובן;5;2;כי תשובן מאחריו ויסף עוד להניחו במדבר ושחתם לכל העם הזה
(200012, -79, 4);9;ט;242830;(4, 32, 16, 41, 242830);63884;(4, 32, 16, 10, 63884);לטפנו;2;10;ויגשו אליו ויאמרו גדרת צאן נבנה למקננו פה וערים לטפנו
(200012, -79, 4);30;ל;242909;(4, 32, 18, 1, 242909);63904;(4, 32, 18, 1, 63904);לא;1;1;לא נשוב אל בתינו עד התנחל בני ישראל איש נחלתו
(200012, -79, 4);2;ב;242988;(4, 32, 19, 44, 242988);63925;(4, 32, 19, 12, 63925);מעבר;3;12;כי לא ננחל אתם מעבר לירדן והלאה כי באה נחלתנו אלינו מעבר הירדן מזרחה
(200012, -79, 4);200;ר;243067;(4, 32, 21, 18, 243067);63946;(4, 32, 21, 6, 63946);הירדן;3;6;ועבר לכם כל חלוץ את הירדן לפני יהוה עד הורישו את איביו מפניו
(200012, -79, 4);6;ו;243146;(4, 32, 22, 49, 243146);63964;(4, 32, 22, 11, 63964);והיתה;1;11;ונכבשה הארץ לפני יהוה ואחר תשבו והייתם נקים מיהוה ומישראל והיתה הארץ הזאת לכם לאחזה לפני יהוה
(200012, -79, 4);20;כ;243225;(4, 32, 24, 5, 243225);63984;(4, 32, 24, 2, 63984);לכם;2;2;בנו לכם ערים לטפכם וגדרת לצנאכם והיצא מפיכם תעשו
(200012, -79, 4);50;נ;243304;(4, 32, 25, 44, 243304);64003;(4, 32, 25, 12, 64003);אדני;3;12;ויאמר בני גד ובני ראובן אל משה לאמר עבדיך יעשו כאשר אדני מצוה
(200012, -79, 4);1;א;243383;(4, 32, 27, 36, 243383);64022;(4, 32, 27, 9, 64022);כאשר;2;9;ועבדיך יעברו כל חלוץ צבא לפני יהוה למלחמה כאשר אדני דבר
(200012, -79, 4);5;ה;243462;(4, 32, 29, 11, 243462);64043;(4, 32, 29, 3, 64043);אלהם;3;3;ויאמר משה אלהם אם יעברו בני גד ובני ראובן אתכם את הירדן כל חלוץ למלחמה לפני יהוה ונכבשה הארץ לפניכם ונתתם להם את ארץ הגלעד לאחזה
(200012, -79, 4);400;ת;243541;(4, 32, 29, 90, 243541);64063;(4, 32, 29, 23, 64063);את;2;23;ויאמר משה אלהם אם יעברו בני גד ובני ראובן אתכם את הירדן כל חלוץ למלחמה לפני יהוה ונכבשה הארץ לפניכם ונתתם להם את ארץ הגלעד לאחזה
(200012, -79, 4);300;ש;243620;(4, 32, 31, 27, 243620);64083;(4, 32, 31, 8, 64083);אשר;2;8;ויענו בני גד ובני ראובן לאמר את אשר דבר יהוה אל עבדיך כן נעשה
(200012, -79, 4);30;ל;243699;(4, 32, 33, 5, 243699);64103;(4, 32, 33, 2, 64103);להם;1;2;ויתן להם משה לבני גד ולבני ראובן ולחצי שבט מנשה בן יוסף את ממלכת סיחן מלך האמרי ואת ממלכת עוג מלך הבשן הארץ לעריה בגבלת ערי הארץ סביב
(200012, -79, 4);200;ר;243778;(4, 32, 33, 84, 243778);64124;(4, 32, 33, 23, 64124);הארץ;3;23;ויתן להם משה לבני גד ולבני ראובן ולחצי שבט מנשה בן יוסף את ממלכת סיחן מלך האמרי ואת ממלכת עוג מלך הבשן הארץ לעריה בגבלת ערי הארץ סביב
(200012, -79, 4);400;ת;243857;(4, 32, 36, 3, 243857);64145;(4, 32, 36, 1, 64145);ואת;3;1;ואת בית נמרה ואת בית הרן ערי מבצר וגדרת צאן
(200012, -79, 4);30;ל;243936;(4, 32, 38, 12, 243936);64167;(4, 32, 38, 4, 64167);בעל;3;4;ואת נבו ואת בעל מעון מוסבת שם ואת שבמה ויקראו בשמת את שמות הערים אשר בנו
(200012, -79, 4);300;ש;244015;(4, 32, 39, 34, 244015);64187;(4, 32, 39, 8, 64187);ויורש;5;8;וילכו בני מכיר בן מנשה גלעדה וילכדה ויורש את האמרי אשר בה
(200012, -79, 4);50;ן;244094;(4, 32, 41, 36, 244094);64209;(4, 32, 41, 9, 64209);אתהן;4;9;ויאיר בן מנשה הלך וילכד את חותיהם ויקרא אתהן חות יאיר
(200012, -79, 4);90;צ;244173;(4, 33, 1, 33, 244173);64231;(4, 33, 1, 9, 64231);לצבאתם;2;9;אלה מסעי בני ישראל אשר יצאו מארץ מצרים לצבאתם ביד משה ואהרן
(200012, -79, 4);4;ד;244252;(4, 33, 3, 14, 244252);64248;(4, 33, 3, 3, 64248);בחדש;3;3;ויסעו מרעמסס בחדש הראשון בחמשה עשר יום לחדש הראשון ממחרת הפסח יצאו בני ישראל ביד רמה לעיני כל מצרים
(200012, -79, 4);40;ם;244331;(4, 33, 4, 12, 244331);64266;(4, 33, 4, 2, 64266);מקברים;6;2;ומצרים מקברים את אשר הכה יהוה בהם כל בכור ובאלהיהם עשה יהוה שפטים
(200012, -79, 4);6;ו;244410;(4, 33, 6, 10, 244410);64286;(4, 33, 6, 3, 64286);ויחנו;1;3;ויסעו מסכת ויחנו באתם אשר בקצה המדבר
(200012, -79, 4);10;י;244489;(4, 33, 8, 9, 244489);64306;(4, 33, 8, 2, 64306);מפני;4;2;ויסעו מפני החירת ויעברו בתוך הים המדברה וילכו דרך שלשת ימים במדבר אתם ויחנו במרה
(200012, -79, 4);1;א;244568;(4, 33, 9, 22, 244568);64324;(4, 33, 9, 5, 64324);ובאילם;3;5;ויסעו ממרה ויבאו אילמה ובאילם שתים עשרה עינת מים ושבעים תמרים ויחנו שם
(200012, -79, 4);200;ר;244647;(4, 33, 11, 21, 244647);64343;(4, 33, 11, 5, 64343);במדבר;5;5;ויסעו מים סוף ויחנו במדבר סין
(200012, -79, 4);30;ל;244726;(4, 33, 14, 33, 244726);64362;(4, 33, 14, 9, 64362);לעם;1;9;ויסעו מאלוש ויחנו ברפידם ולא היה שם מים לעם לשתות
(200012, -79, 4);8;ח;244805;(4, 33, 17, 18, 244805);64378;(4, 33, 17, 4, 64378);ויחנו;3;4;ויסעו מקברת התאוה ויחנו בחצרת
(200012, -79, 4);2;ב;244884;(4, 33, 21, 8, 244884);64395;(4, 33, 21, 2, 64395);מלבנה;3;2;ויסעו מלבנה ויחנו ברסה
(200012, -79, 4);6;ו;244963;(4, 33, 25, 5, 244963);64412;(4, 33, 25, 1, 64412);ויסעו;5;1;ויסעו מחרדה ויחנו במקהלת
(200012, -79, 4);40;מ;245042;(4, 33, 29, 6, 245042);64429;(4, 33, 29, 2, 64429);ממתקה;1;2;ויסעו ממתקה ויחנו בחשמנה
(200012, -79, 4);6;ו;245121;(4, 33, 32, 18, 245121);64444;(4, 33, 32, 4, 64444);ויחנו;5;4;ויסעו מבני יעקן ויחנו בחר הגדגד
(200012, -79, 4);6;ו;245200;(4, 33, 36, 1, 245200);64461;(4, 33, 36, 1, 64461);ויסעו;1;1;ויסעו מעצין גבר ויחנו במדבר צן הוא קדש
(200012, -79, 4);5;ה;245279;(4, 33, 38, 18, 245279);64482;(4, 33, 38, 6, 64482);ההר;2;6;ויעל אהרן הכהן אל הר ההר על פי יהוה וימת שם בשנת הארבעים לצאת בני ישראל מארץ מצרים בחדש החמישי באחד לחדש
(200012, -79, 4);200;ר;245358;(4, 33, 39, 14, 245358);64502;(4, 33, 39, 4, 64502);ועשרים;4;4;ואהרן בן שלש ועשרים ומאת שנה במתו בהר ההר
(200012, -79, 4);10;י;245437;(4, 33, 41, 13, 245437);64523;(4, 33, 41, 4, 64523);ויחנו;2;4;ויסעו מהר ההר ויחנו בצלמנה
