(285910, 96, 4);2;ב;79126;(2, 2, 3, 35, 79126);20882;(2, 2, 3, 10, 20882);בחמר;1;10;ולא יכלה עוד הצפינו ותקח לו תבת גמא ותחמרה בחמר ובזפת ותשם בה את הילד ותשם בסוף על שפת היאר
(285910, 96, 4);10;י;79222;(2, 2, 5, 34, 79222);20909;(2, 2, 5, 10, 20909);יד;1;10;ותרד בת פרעה לרחץ על היאר ונערתיה הלכת על יד היאר ותרא את התבה בתוך הסוף ותשלח את אמתה ותקחה
(285910, 96, 4);1;א;79318;(2, 2, 7, 3, 79318);20933;(2, 2, 7, 1, 20933);ותאמר;3;1;ותאמר אחתו אל בת פרעה האלך וקראתי לך אשה מינקת מן העברית ותינק לך את הילד
(285910, 96, 4);1;א;79414;(2, 2, 9, 3, 79414);20960;(2, 2, 9, 1, 20960);ותאמר;3;1;ותאמר לה בת פרעה היליכי את הילד הזה והינקהו לי ואני אתן את שכרך ותקח האשה הילד ותניקהו
(285910, 96, 4);2;ב;79510;(2, 2, 10, 30, 79510);20985;(2, 2, 10, 8, 20985);לבן;2;8;ויגדל הילד ותבאהו לבת פרעה ויהי לה לבן ותקרא שמו משה ותאמר כי מן המים משיתהו
(285910, 96, 4);10;י;79606;(2, 2, 11, 65, 79606);21010;(2, 2, 11, 17, 21010);מאחיו;4;17;ויהי בימים ההם ויגדל משה ויצא אל אחיו וירא בסבלתם וירא איש מצרי מכה איש עברי מאחיו
(285910, 96, 4);10;י;79702;(2, 2, 14, 2, 79702);21036;(2, 2, 14, 1, 21036);ויאמר;2;1;ויאמר מי שמך לאיש שר ושפט עלינו הלהרגני אתה אמר כאשר הרגת את המצרי ויירא משה ויאמר אכן נודע הדבר
(285910, 96, 4);2;ב;79798;(2, 2, 15, 21, 79798);21061;(2, 2, 15, 6, 21061);ויבקש;3;6;וישמע פרעה את הדבר הזה ויבקש להרג את משה ויברח משה מפני פרעה וישב בארץ מדין וישב על הבאר
(285910, 96, 4);100;ק;79894;(2, 2, 16, 47, 79894);21084;(2, 2, 16, 10, 21084);להשקות;4;10;ולכהן מדין שבע בנות ותבאנה ותדלנה ותמלאנה את הרהטים להשקות צאן אביהן
(285910, 96, 4);10;י;79990;(2, 2, 19, 8, 79990);21106;(2, 2, 19, 2, 21106);איש;2;2;ותאמרן איש מצרי הצילנו מיד הרעים וגם דלה דלה לנו וישק את הצאן
(285910, 96, 4);30;ל;80086;(2, 2, 21, 9, 80086);21133;(2, 2, 21, 3, 21133);לשבת;1;3;ויואל משה לשבת את האיש ויתן את צפרה בתו למשה
(285910, 96, 4);40;ם;80182;(2, 2, 23, 29, 80182);21159;(2, 2, 23, 7, 21159);מצרים;5;7;ויהי בימים הרבים ההם וימת מלך מצרים ויאנחו בני ישראל מן העבדה ויזעקו ותעל שועתם אל האלהים מן העבדה
(285910, 96, 4);90;צ;80278;(2, 2, 24, 45, 80278);21183;(2, 2, 24, 12, 21183);יצחק;2;12;וישמע אלהים את נאקתם ויזכר אלהים את בריתו את אברהם את יצחק ואת יעקב
(285910, 96, 4);1;א;80374;(2, 3, 1, 59, 80374);21210;(2, 3, 1, 18, 21210);האלהים;2;18;ומשה היה רעה את צאן יתרו חתנו כהן מדין וינהג את הצאן אחר המדבר ויבא אל הר האלהים חרבה
(285910, 96, 4);5;ה;80470;(2, 3, 3, 27, 80470);21235;(2, 3, 3, 8, 21235);הגדל;1;8;ויאמר משה אסרה נא ואראה את המראה הגדל הזה מדוע לא יבער הסנה
(285910, 96, 4);50;נ;80566;(2, 3, 5, 17, 80566);21261;(2, 3, 5, 6, 21261);נעליך;1;6;ויאמר אל תקרב הלם של נעליך מעל רגליך כי המקום אשר אתה עומד עליו אדמת קדש הוא
(285910, 96, 4);50;נ;80662;(2, 3, 6, 53, 80662);21285;(2, 3, 6, 13, 21285);פניו;2;13;ויאמר אנכי אלהי אביך אלהי אברהם אלהי יצחק ואלהי יעקב ויסתר משה פניו כי ירא מהביט אל האלהים
(285910, 96, 4);30;ל;80758;(2, 3, 8, 5, 80758);21310;(2, 3, 8, 2, 21310);להצילו;1;2;וארד להצילו מיד מצרים ולהעלתו מן הארץ ההוא אל ארץ טובה ורחבה אל ארץ זבת חלב ודבש אל מקום הכנעני והחתי והאמרי והפרזי והחוי והיבוסי
(285910, 96, 4);10;י;80854;(2, 3, 8, 101, 80854);21333;(2, 3, 8, 25, 21333);והיבוסי;3;25;וארד להצילו מיד מצרים ולהעלתו מן הארץ ההוא אל ארץ טובה ורחבה אל ארץ זבת חלב ודבש אל מקום הכנעני והחתי והאמרי והפרזי והחוי והיבוסי
(285910, 96, 4);30;ל;80950;(2, 3, 10, 37, 80950);21358;(2, 3, 10, 10, 21358);ישראל;5;10;ועתה לכה ואשלחך אל פרעה והוצא את עמי בני ישראל ממצרים
(285910, 96, 4);400;ת;81046;(2, 3, 12, 33, 81046);21385;(2, 3, 12, 10, 21385);שלחתיך;4;10;ויאמר כי אהיה עמך וזה לך האות כי אנכי שלחתיך בהוציאך את העם ממצרים תעבדון את האלהים על ההר הזה
(285910, 96, 4);20;כ;81142;(2, 3, 13, 54, 81142);21409;(2, 3, 13, 14, 21409);אבותיכם;6;14;ויאמר משה אל האלהים הנה אנכי בא אל בני ישראל ואמרתי להם אלהי אבותיכם שלחני אליכם ואמרו לי מה שמו מה אמר אלהם
(285910, 96, 4);40;מ;81238;(2, 3, 15, 4, 81238);21434;(2, 3, 15, 1, 21434);ויאמר;4;1;ויאמר עוד אלהים אל משה כה תאמר אל בני ישראל יהוה אלהי אבתיכם אלהי אברהם אלהי יצחק ואלהי יעקב שלחני אליכם זה שמי לעלם וזה זכרי לדר דר
(285910, 96, 4);10;י;81334;(2, 3, 15, 100, 81334);21459;(2, 3, 15, 26, 21459);זכרי;4;26;ויאמר עוד אלהים אל משה כה תאמר אל בני ישראל יהוה אלהי אבתיכם אלהי אברהם אלהי יצחק ואלהי יעקב שלחני אליכם זה שמי לעלם וזה זכרי לדר דר
(285910, 96, 4);30;ל;81430;(2, 3, 16, 91, 81430);21484;(2, 3, 16, 23, 21484);לכם;1;23;לך ואספת את זקני ישראל ואמרת אלהם יהוה אלהי אבתיכם נראה אלי אלהי אברהם יצחק ויעקב לאמר פקד פקדתי אתכם ואת העשוי לכם במצרים
(285910, 96, 4);1;א;81526;(2, 3, 18, 12, 81526);21506;(2, 3, 18, 3, 21506);ובאת;3;3;ושמעו לקלך ובאת אתה וזקני ישראל אל מלך מצרים ואמרתם אליו יהוה אלהי העבריים נקרה עלינו ועתה נלכה נא דרך שלשת ימים במדבר ונזבחה ליהוה אלהינו
(285910, 96, 4);1;א;81622;(2, 3, 18, 108, 81622);21529;(2, 3, 18, 26, 21529);אלהינו;1;26;ושמעו לקלך ובאת אתה וזקני ישראל אל מלך מצרים ואמרתם אליו יהוה אלהי העבריים נקרה עלינו ועתה נלכה נא דרך שלשת ימים במדבר ונזבחה ליהוה אלהינו
(285910, 96, 4);200;ר;81718;(2, 3, 20, 49, 81718);21553;(2, 3, 20, 12, 21553);ואחרי;4;12;ושלחתי את ידי והכיתי את מצרים בכל נפלאתי אשר אעשה בקרבו ואחרי כן ישלח אתכם
(285910, 96, 4);40;מ;81814;(2, 3, 22, 39, 81814);21579;(2, 3, 22, 10, 21579);ושמלת;3;10;ושאלה אשה משכנתה ומגרת ביתה כלי כסף וכלי זהב ושמלת ושמתם על בניכם ועל בנתיכם ונצלתם את מצרים
(285910, 96, 4);10;י;81910;(2, 4, 2, 2, 81910);21604;(2, 4, 2, 1, 21604);ויאמר;2;1;ויאמר אליו יהוה מזה בידך ויאמר מטה
(285910, 96, 4);8;ח;82006;(2, 4, 4, 23, 82006);21627;(2, 4, 4, 7, 21627);ואחז;3;7;ויאמר יהוה אל משה שלח ידך ואחז בזנבו וישלח ידו ויחזק בו ויהי למטה בכפו
(285910, 96, 4);200;ר;82102;(2, 4, 6, 5, 82102);21650;(2, 4, 6, 1, 21650);ויאמר;5;1;ויאמר יהוה לו עוד הבא נא ידך בחיקך ויבא ידו בחיקו ויוצאה והנה ידו מצרעת כשלג
(285910, 96, 4);100;ק;82198;(2, 4, 7, 40, 82198);21676;(2, 4, 7, 11, 21676);מחיקו;4;11;ויאמר השב ידך אל חיקך וישב ידו אל חיקו ויוצאה מחיקו והנה שבה כבשרו
(285910, 96, 4);30;ל;82294;(2, 4, 9, 28, 82294);21701;(2, 4, 9, 8, 21701);האלה;3;8;והיה אם לא יאמינו גם לשני האתות האלה ולא ישמעון לקלך ולקחת ממימי היאר ושפכת היבשה והיו המים אשר תקח מן היאר והיו לדם ביבשת
(285910, 96, 4);4;ד;82390;(2, 4, 10, 26, 82390);21727;(2, 4, 10, 9, 21727);דברים;1;9;ויאמר משה אל יהוה בי אדני לא איש דברים אנכי גם מתמול גם משלשם גם מאז דברך אל עבדך כי כבד פה וכבד לשון אנכי
(285910, 96, 4);1;א;82486;(2, 4, 11, 40, 82486);21757;(2, 4, 11, 14, 21757);או;1;14;ויאמר יהוה אליו מי שם פה לאדם או מי ישום אלם או חרש או פקח או עור הלא אנכי יהוה
(285910, 96, 4);40;מ;82582;(2, 4, 14, 18, 82582);21784;(2, 4, 14, 5, 21784);ויאמר;4;5;ויחר אף יהוה במשה ויאמר הלא אהרן אחיך הלוי ידעתי כי דבר ידבר הוא וגם הנה הוא יצא לקראתך וראך ושמח בלבו
(285910, 96, 4);10;י;82678;(2, 4, 15, 33, 82678);21809;(2, 4, 15, 8, 21809);אהיה;3;8;ודברת אליו ושמת את הדברים בפיו ואנכי אהיה עם פיך ועם פיהו והוריתי אתכם את אשר תעשון
(285910, 96, 4);4;ד;82774;(2, 4, 17, 16, 82774);21837;(2, 4, 17, 5, 21837);בידך;3;5;ואת המטה הזה תקח בידך אשר תעשה בו את האתת
(285910, 96, 4);5;ה;82870;(2, 4, 18, 80, 82870);21863;(2, 4, 18, 21, 21863);למשה;4;21;וילך משה וישב אל יתר חתנו ויאמר לו אלכה נא ואשובה אל אחי אשר במצרים ואראה העודם חיים ויאמר יתרו למשה לך לשלום
(285910, 96, 4);300;ש;82966;(2, 4, 20, 35, 82966);21890;(2, 4, 20, 10, 21890);וישב;3;10;ויקח משה את אשתו ואת בניו וירכבם על החמר וישב ארצה מצרים ויקח משה את מטה האלהים בידו
(285910, 96, 4);70;ע;83062;(2, 4, 21, 64, 83062);21914;(2, 4, 21, 16, 21914);פרעה;3;16;ויאמר יהוה אל משה בלכתך לשוב מצרימה ראה כל המפתים אשר שמתי בידך ועשיתם לפני פרעה ואני אחזק את לבו ולא ישלח את העם
(285910, 96, 4);50;נ;83158;(2, 4, 23, 38, 83158);21941;(2, 4, 23, 10, 21941);אנכי;2;10;ואמר אליך שלח את בני ויעבדני ותמאן לשלחו הנה אנכי הרג את בנך בכרך
(285910, 96, 4);40;ם;83254;(2, 4, 25, 48, 83254);21965;(2, 4, 25, 13, 21965);דמים;4;13;ותקח צפרה צר ותכרת את ערלת בנה ותגע לרגליו ותאמר כי חתן דמים אתה לי
(285910, 96, 4);30;ל;83350;(2, 4, 28, 8, 83350);21991;(2, 4, 28, 3, 21991);לאהרן;1;3;ויגד משה לאהרן את כל דברי יהוה אשר שלחו ואת כל האתת אשר צוהו
(285910, 96, 4);4;ד;83446;(2, 4, 30, 23, 83446);22018;(2, 4, 30, 7, 22018);דבר;1;7;וידבר אהרן את כל הדברים אשר דבר יהוה אל משה ויעש האתת לעיני העם
(285910, 96, 4);1;א;83542;(2, 5, 1, 12, 83542);22044;(2, 5, 1, 4, 22044);ואהרן;2;4;ואחר באו משה ואהרן ויאמרו אל פרעה כה אמר יהוה אלהי ישראל שלח את עמי ויחגו לי במדבר
(285910, 96, 4);400;ת;83638;(2, 5, 2, 43, 83638);22070;(2, 5, 2, 12, 22070);ידעתי;4;12;ויאמר פרעה מי יהוה אשר אשמע בקלו לשלח את ישראל לא ידעתי את יהוה וגם את ישראל לא אשלח
(285910, 96, 4);2;ב;83734;(2, 5, 3, 73, 83734);22094;(2, 5, 3, 17, 22094);בדבר;1;17;ויאמרו אלהי העברים נקרא עלינו נלכה נא דרך שלשת ימים במדבר ונזבחה ליהוה אלהינו פן יפגענו בדבר או בחרב
(285910, 96, 4);1;א;83830;(2, 5, 5, 31, 83830);22118;(2, 5, 5, 9, 22118);אתם;1;9;ויאמר פרעה הן רבים עתה עם הארץ והשבתם אתם מסבלתם
(285910, 96, 4);5;ה;83926;(2, 5, 7, 49, 83926);22142;(2, 5, 7, 13, 22142);להם;2;13;לא תאספון לתת תבן לעם ללבן הלבנים כתמול שלשם הם ילכו וקששו להם תבן
(285910, 96, 4);6;ו;84022;(2, 5, 8, 92, 84022);22167;(2, 5, 8, 24, 22167);לאלהינו;7;24;ואת מתכנת הלבנים אשר הם עשים תמול שלשם תשימו עליהם לא תגרעו ממנו כי נרפים הם על כן הם צעקים לאמר נלכה נזבחה לאלהינו
(285910, 96, 4);1;א;84118;(2, 5, 11, 1, 84118);22193;(2, 5, 11, 1, 22193);אתם;1;1;אתם לכו קחו לכם תבן מאשר תמצאו כי אין נגרע מעבדתכם דבר
(285910, 96, 4);2;ב;84214;(2, 5, 13, 26, 84214);22218;(2, 5, 13, 6, 22218);דבר;2;6;והנגשים אצים לאמר כלו מעשיכם דבר יום ביומו כאשר בהיות התבן
(285910, 96, 4);40;ם;84310;(2, 5, 14, 74, 84310);22243;(2, 5, 14, 20, 22243);גם;2;20;ויכו שטרי בני ישראל אשר שמו עלהם נגשי פרעה לאמר מדוע לא כליתם חקכם ללבן כתמול שלשם גם תמול גם היום
(285910, 96, 4);10;י;84406;(2, 5, 16, 44, 84406);22267;(2, 5, 16, 11, 22267);מכים;3;11;תבן אין נתן לעבדיך ולבנים אמרים לנו עשו והנה עבדיך מכים וחטאת עמך
(285910, 96, 4);300;ש;84502;(2, 5, 19, 6, 84502);22292;(2, 5, 19, 2, 22292);שטרי;1;2;ויראו שטרי בני ישראל אתם ברע לאמר לא תגרעו מלבניכם דבר יום ביומו
(285910, 96, 4);5;ה;84598;(2, 5, 21, 9, 84598);22315;(2, 5, 21, 2, 22315);אלהם;3;2;ויאמרו אלהם ירא יהוה עליכם וישפט אשר הבאשתם את ריחנו בעיני פרעה ובעיני עבדיו לתת חרב בידם להרגנו
(285910, 96, 4);5;ה;84694;(2, 5, 22, 26, 84694);22339;(2, 5, 22, 8, 22339);הרעתה;1;8;וישב משה אל יהוה ויאמר אדני למה הרעתה לעם הזה למה זה שלחתני
(285910, 96, 4);30;ל;84790;(2, 6, 1, 29, 84790);22367;(2, 6, 1, 9, 22367);לפרעה;1;9;ויאמר יהוה אל משה עתה תראה אשר אעשה לפרעה כי ביד חזקה ישלחם וביד חזקה יגרשם מארצו
(285910, 96, 4);4;ד;84886;(2, 6, 3, 29, 84886);22392;(2, 6, 3, 9, 22392);שדי;2;9;וארא אל אברהם אל יצחק ואל יעקב באל שדי ושמי יהוה לא נודעתי להם
(285910, 96, 4);1;א;84982;(2, 6, 5, 24, 84982);22420;(2, 6, 5, 7, 22420);ישראל;4;7;וגם אני שמעתי את נאקת בני ישראל אשר מצרים מעבדים אתם ואזכר את בריתי
(285910, 96, 4);30;ל;85078;(2, 6, 6, 66, 85078);22442;(2, 6, 6, 15, 22442);וגאלתי;4;15;לכן אמר לבני ישראל אני יהוה והוצאתי אתכם מתחת סבלת מצרים והצלתי אתכם מעבדתם וגאלתי אתכם בזרוע נטויה ובשפטים גדלים
(285910, 96, 4);30;ל;85174;(2, 6, 7, 68, 85174);22463;(2, 6, 7, 16, 22463);סבלות;3;16;ולקחתי אתכם לי לעם והייתי לכם לאלהים וידעתם כי אני יהוה אלהיכם המוציא אתכם מתחת סבלות מצרים
(285910, 96, 4);50;נ;85270;(2, 6, 9, 14, 85270);22488;(2, 6, 9, 5, 22488);בני;2;5;וידבר משה כן אל בני ישראל ולא שמעו אל משה מקצר רוח ומעבדה קשה
(285910, 96, 4);200;ר;85366;(2, 6, 12, 5, 85366);22514;(2, 6, 12, 1, 22514);וידבר;5;1;וידבר משה לפני יהוה לאמר הן בני ישראל לא שמעו אלי ואיך ישמעני פרעה ואני ערל שפתים
(285910, 96, 4);30;ל;85462;(2, 6, 13, 36, 85462);22540;(2, 6, 13, 10, 22540);ישראל;5;10;וידבר יהוה אל משה ואל אהרן ויצום אל בני ישראל ואל פרעה מלך מצרים להוציא את בני ישראל מארץ מצרים
(285910, 96, 4);400;ת;85558;(2, 6, 14, 56, 85558);22564;(2, 6, 14, 14, 22564);משפחת;5;14;אלה ראשי בית אבתם בני ראובן בכר ישראל חנוך ופלוא חצרן וכרמי אלה משפחת ראובן
(285910, 96, 4);200;ר;85654;(2, 6, 16, 32, 85654);22586;(2, 6, 16, 8, 22586);ומררי;3;8;ואלה שמות בני לוי לתלדתם גרשון וקהת ומררי ושני חיי לוי שבע ושלשים ומאת שנה
(285910, 96, 4);30;ל;85750;(2, 6, 18, 44, 85750);22609;(2, 6, 18, 11, 22609);ושלשים;3;11;ובני קהת עמרם ויצהר וחברון ועזיאל ושני חיי קהת שלש ושלשים ומאת שנה
(285910, 96, 4);70;ע;85846;(2, 6, 20, 51, 85846);22635;(2, 6, 20, 16, 22635);עמרם;1;16;ויקח עמרם את יוכבד דדתו לו לאשה ותלד לו את אהרן ואת משה ושני חיי עמרם שבע ושלשים ומאת שנה
(285910, 96, 4);6;ו;85942;(2, 6, 23, 32, 85942);22657;(2, 6, 23, 8, 22657);נחשון;4;8;ויקח אהרן את אלישבע בת עמינדב אחות נחשון לו לאשה ותלד לו את נדב ואת אביהוא את אלעזר ואת איתמר
(285910, 96, 4);6;ו;86038;(2, 6, 25, 17, 86038);22682;(2, 6, 25, 5, 22682);לו;2;5;ואלעזר בן אהרן לקח לו מבנות פוטיאל לו לאשה ותלד לו את פינחס אלה ראשי אבות הלוים למשפחתם
(285910, 96, 4);200;ר;86134;(2, 6, 26, 43, 86134);22707;(2, 6, 26, 12, 22707);מארץ;3;12;הוא אהרן ומשה אשר אמר יהוה להם הוציאו את בני ישראל מארץ מצרים על צבאתם
(285910, 96, 4);200;ר;86230;(2, 6, 28, 27, 86230);22732;(2, 6, 28, 8, 22732);מצרים;3;8;ויהי ביום דבר יהוה אל משה בארץ מצרים
(285910, 96, 4);300;ש;86326;(2, 6, 30, 35, 86326);22760;(2, 6, 30, 10, 22760);ישמע;2;10;ויאמר משה לפני יהוה הן אני ערל שפתים ואיך ישמע אלי פרעה
(285910, 96, 4);5;ה;86422;(2, 7, 2, 37, 86422);22785;(2, 7, 2, 11, 22785);פרעה;4;11;אתה תדבר את כל אשר אצוך ואהרן אחיך ידבר אל פרעה ושלח את בני ישראל מארצו
(285910, 96, 4);40;ם;86518;(2, 7, 4, 31, 86518);22810;(2, 7, 4, 8, 22810);במצרים;6;8;ולא ישמע אלכם פרעה ונתתי את ידי במצרים והוצאתי את צבאתי את עמי בני ישראל מארץ מצרים בשפטים גדלים
(285910, 96, 4);10;י;86614;(2, 7, 5, 49, 86614);22835;(2, 7, 5, 14, 22835);ישראל;1;14;וידעו מצרים כי אני יהוה בנטתי את ידי על מצרים והוצאתי את בני ישראל מתוכם
(285910, 96, 4);40;מ;86710;(2, 7, 8, 12, 86710);22861;(2, 7, 8, 4, 22861);משה;1;4;ויאמר יהוה אל משה ואל אהרן לאמר
(285910, 96, 4);200;ר;86806;(2, 7, 10, 16, 86806);22888;(2, 7, 10, 5, 22888);פרעה;2;5;ויבא משה ואהרן אל פרעה ויעשו כן כאשר צוה יהוה וישלך אהרן את מטהו לפני פרעה ולפני עבדיו ויהי לתנין
(285910, 96, 4);40;ם;86902;(2, 7, 11, 34, 86902);22911;(2, 7, 11, 8, 22911);הם;2;8;ויקרא גם פרעה לחכמים ולמכשפים ויעשו גם הם חרטמי מצרים בלהטיהם כן
(285910, 96, 4);10;י;86998;(2, 7, 14, 2, 86998);22935;(2, 7, 14, 1, 22935);ויאמר;2;1;ויאמר יהוה אל משה כבד לב פרעה מאן לשלח העם
(285910, 96, 4);4;ד;87094;(2, 7, 15, 65, 87094);22962;(2, 7, 15, 18, 22962);בידך;3;18;לך אל פרעה בבקר הנה יצא המימה ונצבת לקראתו על שפת היאר והמטה אשר נהפך לנחש תקח בידך
(285910, 96, 4);5;ה;87190;(2, 7, 17, 25, 87190);22988;(2, 7, 17, 8, 22988);יהוה;4;8;כה אמר יהוה בזאת תדע כי אני יהוה הנה אנכי מכה במטה אשר בידי על המים אשר ביאר ונהפכו לדם
(285910, 96, 4);200;ר;87286;(2, 7, 19, 5, 87286);23013;(2, 7, 19, 1, 23013);ויאמר;5;1;ויאמר יהוה אל משה אמר אל אהרן קח מטך ונטה ידך על מימי מצרים על נהרתם על יאריהם ועל אגמיהם ועל כל מקוה מימיהם ויהיו דם והיה דם בכל ארץ מצרים ובעצים ובאבנים
(285910, 96, 4);30;ל;87382;(2, 7, 19, 101, 87382);23041;(2, 7, 19, 29, 23041);בכל;3;29;ויאמר יהוה אל משה אמר אל אהרן קח מטך ונטה ידך על מימי מצרים על נהרתם על יאריהם ועל אגמיהם ועל כל מקוה מימיהם ויהיו דם והיה דם בכל ארץ מצרים ובעצים ובאבנים
(285910, 96, 4);20;כ;87478;(2, 7, 20, 75, 87478);23064;(2, 7, 20, 19, 23064);ויהפכו;5;19;ויעשו כן משה ואהרן כאשר צוה יהוה וירם במטה ויך את המים אשר ביאר לעיני פרעה ולעיני עבדיו ויהפכו כל המים אשר ביאר לדם
(285910, 96, 4);40;מ;87574;(2, 7, 22, 11, 87574);23090;(2, 7, 22, 3, 23090);חרטמי;4;3;ויעשו כן חרטמי מצרים בלטיהם ויחזק לב פרעה ולא שמע אלהם כאשר דבר יהוה
(285910, 96, 4);10;י;87670;(2, 7, 24, 20, 87670);23116;(2, 7, 24, 5, 23116);היאר;2;5;ויחפרו כל מצרים סביבת היאר מים לשתות כי לא יכלו לשתת ממימי היאר
(285910, 96, 4);1;א;87766;(2, 7, 26, 34, 87766);23143;(2, 7, 26, 11, 23143);אמר;1;11;ויאמר יהוה אל משה בא אל פרעה ואמרת אליו כה אמר יהוה שלח את עמי ויעבדני
(285910, 96, 4);300;ש;87862;(2, 7, 28, 35, 87862);23167;(2, 7, 28, 8, 23167);משכבך;2;8;ושרץ היאר צפרדעים ועלו ובאו בביתך ובחדר משכבך ועל מטתך ובבית עבדיך ובעמך ובתנוריך ובמשארותיך
(285910, 96, 4);50;ן;87958;(2, 8, 1, 23, 87958);23187;(2, 8, 1, 7, 23187);אהרן;4;7;ויאמר יהוה אל משה אמר אל אהרן נטה את ידך במטך על הנהרת על היארים ועל האגמים והעל את הצפרדעים על ארץ מצרים
(285910, 96, 4);20;כ;88054;(2, 8, 2, 36, 88054);23213;(2, 8, 2, 10, 23213);ותכס;3;10;ויט אהרן את ידו על מימי מצרים ותעל הצפרדע ותכס את ארץ מצרים
(285910, 96, 4);200;ר;88150;(2, 8, 4, 40, 88150);23235;(2, 8, 4, 9, 23235);ויסר;4;9;ויקרא פרעה למשה ולאהרן ויאמר העתירו אל יהוה ויסר הצפרדעים ממני ומעמי ואשלחה את העם ויזבחו ליהוה
(285910, 96, 4);10;י;88246;(2, 8, 5, 57, 88246);23255;(2, 8, 5, 12, 23255);הצפרדעים;7;12;ויאמר משה לפרעה התפאר עלי למתי אעתיר לך ולעבדיך ולעמך להכרית הצפרדעים ממך ומבתיך רק ביאר תשארנה
(285910, 96, 4);40;מ;88342;(2, 8, 7, 32, 88342);23276;(2, 8, 7, 6, 23276);ומעמך;4;6;וסרו הצפרדעים ממך ומבתיך ומעבדיך ומעמך רק ביאר תשארנה
(285910, 96, 4);10;י;88438;(2, 8, 9, 27, 88438);23300;(2, 8, 9, 6, 23300);הצפרדעים;7;6;ויעש יהוה כדבר משה וימתו הצפרדעים מן הבתים מן החצרת ומן השדת
(285910, 96, 4);5;ה;88534;(2, 8, 11, 48, 88534);23326;(2, 8, 11, 14, 23326);יהוה;2;14;וירא פרעה כי היתה הרוחה והכבד את לבו ולא שמע אלהם כאשר דבר יהוה
(285910, 96, 4);200;ר;88630;(2, 8, 13, 32, 88630);23355;(2, 8, 13, 10, 23355);עפר;3;10;ויעשו כן ויט אהרן את ידו במטהו ויך את עפר הארץ ותהי הכנם באדם ובבהמה כל עפר הארץ היה כנים בכל ארץ מצרים
(285910, 96, 4);50;נ;88726;(2, 8, 14, 47, 88726);23379;(2, 8, 14, 11, 23379);הכנם;3;11;ויעשו כן החרטמים בלטיהם להוציא את הכנים ולא יכלו ותהי הכנם באדם ובבהמה
(285910, 96, 4);6;ו;88822;(2, 8, 16, 23, 88822);23404;(2, 8, 16, 7, 23404);והתיצב;1;7;ויאמר יהוה אל משה השכם בבקר והתיצב לפני פרעה הנה יוצא המימה ואמרת אליו כה אמר יהוה שלח עמי ויעבדני
(285910, 96, 4);20;ך;88918;(2, 8, 17, 40, 88918);23428;(2, 8, 17, 11, 23428);ובעמך;5;11;כי אם אינך משלח את עמי הנני משליח בך ובעבדיך ובעמך ובבתיך את הערב ומלאו בתי מצרים את הערב וגם האדמה אשר הם עליה
(285910, 96, 4);70;ע;89014;(2, 8, 18, 48, 89014);23455;(2, 8, 18, 14, 23455);ערב;1;14;והפליתי ביום ההוא את ארץ גשן אשר עמי עמד עליה לבלתי היות שם ערב למען תדע כי אני יהוה בקרב הארץ
(285910, 96, 4);4;ד;89110;(2, 8, 20, 35, 89110);23482;(2, 8, 20, 10, 23482);עבדיו;3;10;ויעש יהוה כן ויבא ערב כבד ביתה פרעה ובית עבדיו ובכל ארץ מצרים תשחת הארץ מפני הערב
(285910, 96, 4);10;י;89206;(2, 8, 22, 23, 89206);23506;(2, 8, 22, 7, 23506);כי;2;7;ויאמר משה לא נכון לעשות כן כי תועבת מצרים נזבח ליהוה אלהינו הן נזבח את תועבת מצרים לעיניהם ולא יסקלנו
(285910, 96, 4);20;כ;89302;(2, 8, 23, 37, 89302);23528;(2, 8, 23, 9, 23528);כאשר;1;9;דרך שלשת ימים נלך במדבר וזבחנו ליהוה אלהינו כאשר יאמר אלינו
