(231976, 64, 4);200;ר;148264;(3, 6, 8, 71, 148264);39119;(3, 6, 8, 17, 39119);אזכרתה;4;17;והרים ממנו בקמצו מסלת המנחה ומשמנה ואת כל הלבנה אשר על המנחה והקטיר המזבח ריח ניחח אזכרתה ליהוה
(231976, 64, 4);6;ו;148328;(3, 6, 9, 57, 148328);39133;(3, 6, 9, 13, 39133);יאכלוה;5;13;והנותרת ממנה יאכלו אהרן ובניו מצות תאכל במקום קדש בחצר אהל מועד יאכלוה
(231976, 64, 4);50;נ;148392;(3, 6, 11, 18, 148392);39150;(3, 6, 11, 5, 39150);יאכלנה;5;5;כל זכר בבני אהרן יאכלנה חק עולם לדרתיכם מאשי יהוה כל אשר יגע בהם יקדש
(231976, 64, 4);200;ר;148456;(3, 6, 13, 9, 148456);39168;(3, 6, 13, 3, 39168);אהרן;3;3;זה קרבן אהרן ובניו אשר יקריבו ליהוה ביום המשח אתו עשירת האפה סלת מנחה תמיד מחציתה בבקר ומחציתה בערב
(231976, 64, 4);8;ח;148520;(3, 6, 13, 73, 148520);39183;(3, 6, 13, 18, 39183);ומחציתה;3;18;זה קרבן אהרן ובניו אשר יקריבו ליהוה ביום המשח אתו עשירת האפה סלת מנחה תמיד מחציתה בבקר ומחציתה בערב
(231976, 64, 4);6;ו;148584;(3, 6, 15, 1, 148584);39198;(3, 6, 15, 1, 39198);והכהן;1;1;והכהן המשיח תחתיו מבניו יעשה אתה חק עולם ליהוה כליל תקטר
(231976, 64, 4);30;ל;148648;(3, 6, 16, 19, 148648);39214;(3, 6, 16, 6, 39214);לא;1;6;וכל מנחת כהן כליל תהיה לא תאכל
(231976, 64, 4);400;ת;148712;(3, 6, 18, 41, 148712);39232;(3, 6, 18, 12, 39232);תשחט;1;12;דבר אל אהרן ואל בניו לאמר זאת תורת החטאת במקום אשר תשחט העלה תשחט החטאת לפני יהוה קדש קדשים הוא
(231976, 64, 4);20;כ;148776;(3, 6, 19, 29, 148776);39247;(3, 6, 19, 7, 39247);תאכל;3;7;הכהן המחטא אתה יאכלנה במקום קדש תאכל בחצר אהל מועד
(231976, 64, 4);6;ו;148840;(3, 6, 20, 52, 148840);39265;(3, 6, 20, 15, 39265);במקום;4;15;כל אשר יגע בבשרה יקדש ואשר יזה מדמה על הבגד אשר יזה עליה תכבס במקום קדש
(231976, 64, 4);1;א;148904;(3, 6, 22, 13, 148904);39283;(3, 6, 22, 4, 39283);יאכל;2;4;כל זכר בכהנים יאכל אתה קדש קדשים הוא
(231976, 64, 4);80;ף;148968;(3, 6, 23, 48, 148968);39301;(3, 6, 23, 14, 39301);תשרף;4;14;וכל חטאת אשר יובא מדמה אל אהל מועד לכפר בקדש לא תאכל באש תשרף
(231976, 64, 4);70;ע;149032;(3, 7, 2, 41, 149032);39319;(3, 7, 2, 12, 39319);על;1;12;במקום אשר ישחטו את העלה ישחטו את האשם ואת דמו יזרק על המזבח סביב
(231976, 64, 4);400;ת;149096;(3, 7, 4, 11, 149096);39336;(3, 7, 4, 3, 39336);הכלית;5;3;ואת שתי הכלית ואת החלב אשר עליהן אשר על הכסלים ואת היתרת על הכבד על הכלית יסירנה
(231976, 64, 4);20;כ;149160;(3, 7, 5, 11, 149160);39353;(3, 7, 5, 3, 39353);הכהן;2;3;והקטיר אתם הכהן המזבחה אשה ליהוה אשם הוא
(231976, 64, 4);20;כ;149224;(3, 7, 7, 1, 149224);39369;(3, 7, 7, 1, 39369);כחטאת;1;1;כחטאת כאשם תורה אחת להם הכהן אשר יכפר בו לו יהיה
(231976, 64, 4);1;א;149288;(3, 7, 8, 27, 149288);39387;(3, 7, 8, 8, 39387);אשר;1;8;והכהן המקריב את עלת איש עור העלה אשר הקריב לכהן לו יהיה
(231976, 64, 4);200;ר;149352;(3, 7, 9, 47, 149352);39403;(3, 7, 9, 12, 39403);המקריב;4;12;וכל מנחה אשר תאפה בתנור וכל נעשה במרחשת ועל מחבת לכהן המקריב אתה לו תהיה
(231976, 64, 4);2;ב;149416;(3, 7, 11, 10, 149416);39420;(3, 7, 11, 3, 39420);זבח;2;3;וזאת תורת זבח השלמים אשר יקריב ליהוה
(231976, 64, 4);400;ת;149480;(3, 7, 12, 44, 149480);39435;(3, 7, 12, 11, 39435);בלולת;5;11;אם על תודה יקריבנו והקריב על זבח התודה חלות מצות בלולת בשמן ורקיקי מצות משחים בשמן וסלת מרבכת חלת בלולת בשמן
(231976, 64, 4);50;נ;149544;(3, 7, 13, 20, 149544);39451;(3, 7, 13, 6, 39451);קרבנו;4;6;על חלת לחם חמץ יקריב קרבנו על זבח תודת שלמיו
(231976, 64, 4);30;ל;149608;(3, 7, 14, 49, 149608);39468;(3, 7, 14, 13, 39468);לו;1;13;והקריב ממנו אחד מכל קרבן תרומה ליהוה לכהן הזרק את דם השלמים לו יהיה
(231976, 64, 4);8;ח;149672;(3, 7, 16, 15, 149672);39486;(3, 7, 16, 5, 39486);זבח;3;5;ואם נדר או נדבה זבח קרבנו ביום הקריבו את זבחו יאכל וממחרת והנותר ממנו יאכל
(231976, 64, 4);5;ה;149736;(3, 7, 17, 19, 149736);39501;(3, 7, 17, 5, 39501);השלישי;1;5;והנותר מבשר הזבח ביום השלישי באש ישרף
(231976, 64, 4);8;ח;149800;(3, 7, 18, 52, 149800);39517;(3, 7, 18, 14, 39517);יחשב;2;14;ואם האכל יאכל מבשר זבח שלמיו ביום השלישי לא ירצה המקריב אתו לא יחשב לו פגול יהיה והנפש האכלת ממנו עונה תשא
(231976, 64, 4);6;ו;149864;(3, 7, 19, 31, 149864);39535;(3, 7, 19, 10, 39535);והבשר;1;10;והבשר אשר יגע בכל טמא לא יאכל באש ישרף והבשר כל טהור יאכל בשר
(231976, 64, 4);200;ר;149928;(3, 7, 20, 47, 149928);39550;(3, 7, 20, 11, 39550);ונכרתה;4;11;והנפש אשר תאכל בשר מזבח השלמים אשר ליהוה וטמאתו עליו ונכרתה הנפש ההוא מעמיה
(231976, 64, 4);30;ל;149992;(3, 7, 21, 49, 149992);39568;(3, 7, 21, 15, 39568);ואכל;4;15;ונפש כי תגע בכל טמא בטמאת אדם או בבהמה טמאה או בכל שקץ טמא ואכל מבשר זבח השלמים אשר ליהוה ונכרתה הנפש ההוא מעמיה
(231976, 64, 4);2;ב;150056;(3, 7, 23, 6, 150056);39585;(3, 7, 23, 3, 39585);בני;1;3;דבר אל בני ישראל לאמר כל חלב שור וכשב ועז לא תאכלו
(231976, 64, 4);20;כ;150120;(3, 7, 24, 31, 150120);39602;(3, 7, 24, 8, 39602);ואכל;3;8;וחלב נבלה וחלב טרפה יעשה לכל מלאכה ואכל לא תאכלהו
(231976, 64, 4);40;מ;150184;(3, 7, 25, 55, 150184);39619;(3, 7, 25, 15, 39619);מעמיה;3;15;כי כל אכל חלב מן הבהמה אשר יקריב ממנה אשה ליהוה ונכרתה הנפש האכלת מעמיה
(231976, 64, 4);6;ו;150248;(3, 7, 27, 29, 150248);39636;(3, 7, 27, 9, 39636);ההוא;3;9;כל נפש אשר תאכל כל דם ונכרתה הנפש ההוא מעמיה
(231976, 64, 4);2;ב;150312;(3, 7, 29, 40, 150312);39653;(3, 7, 29, 11, 39653);יביא;2;11;דבר אל בני ישראל לאמר המקריב את זבח שלמיו ליהוה יביא את קרבנו ליהוה מזבח שלמיו
(231976, 64, 4);5;ה;150376;(3, 7, 30, 41, 150376);39670;(3, 7, 30, 12, 39670);החזה;1;12;ידיו תביאינה את אשי יהוה את החלב על החזה יביאנו את החזה להניף אתו תנופה לפני יהוה
(231976, 64, 4);10;י;150440;(3, 7, 31, 40, 150440);39684;(3, 7, 31, 9, 39684);ולבניו;5;9;והקטיר הכהן את החלב המזבחה והיה החזה לאהרן ולבניו
(231976, 64, 4);1;א;150504;(3, 7, 33, 28, 150504);39700;(3, 7, 33, 8, 39700);אהרן;1;8;המקריב את דם השלמים ואת החלב מבני אהרן לו תהיה שוק הימין למנה
(231976, 64, 4);7;ז;150568;(3, 7, 34, 43, 150568);39717;(3, 7, 34, 12, 39717);מזבחי;2;12;כי את חזה התנופה ואת שוק התרומה לקחתי מאת בני ישראל מזבחי שלמיהם ואתן אתם לאהרן הכהן ולבניו לחק עולם מאת בני ישראל
(231976, 64, 4);8;ח;150632;(3, 7, 35, 15, 150632);39732;(3, 7, 35, 4, 39732);ומשחת;4;4;זאת משחת אהרן ומשחת בניו מאשי יהוה ביום הקריב אתם לכהן ליהוה
(231976, 64, 4);400;ת;150696;(3, 7, 36, 30, 150696);39749;(3, 7, 36, 9, 39749);מאת;3;9;אשר צוה יהוה לתת להם ביום משחו אתם מאת בני ישראל חקת עולם לדרתם
(231976, 64, 4);30;ל;150760;(3, 7, 37, 44, 150760);39763;(3, 7, 37, 9, 39763);השלמים;3;9;זאת התורה לעלה למנחה ולחטאת ולאשם ולמלואים ולזבח השלמים
(231976, 64, 4);2;ב;150824;(3, 7, 38, 61, 150824);39780;(3, 7, 38, 17, 39780);במדבר;1;17;אשר צוה יהוה את משה בהר סיני ביום צותו את בני ישראל להקריב את קרבניהם ליהוה במדבר סיני
(231976, 64, 4);5;ה;150888;(3, 8, 2, 38, 150888);39797;(3, 8, 2, 11, 39797);המשחה;5;11;קח את אהרן ואת בניו אתו ואת הבגדים ואת שמן המשחה ואת פר החטאת ואת שני האילים ואת סל המצות
(231976, 64, 4);5;ה;150952;(3, 8, 4, 7, 150952);39816;(3, 8, 4, 2, 39816);משה;3;2;ויעש משה כאשר צוה יהוה אתו ותקהל העדה אל פתח אהל מועד
(231976, 64, 4);6;ו;151016;(3, 8, 5, 29, 151016);39835;(3, 8, 5, 9, 39835);יהוה;3;9;ויאמר משה אל העדה זה הדבר אשר צוה יהוה לעשות
(231976, 64, 4);1;א;151080;(3, 8, 7, 25, 151080);39852;(3, 8, 7, 7, 39852);באבנט;2;7;ויתן עליו את הכתנת ויחגר אתו באבנט וילבש אתו את המעיל ויתן עליו את האפד ויחגר אתו בחשב האפד ויאפד לו בו
(231976, 64, 4);10;י;151144;(3, 8, 8, 7, 151144);39869;(3, 8, 8, 2, 39869);עליו;3;2;וישם עליו את החשן ויתן אל החשן את האורים ואת התמים
(231976, 64, 4);1;א;151208;(3, 8, 9, 31, 151208);39887;(3, 8, 9, 9, 39887);אל;1;9;וישם את המצנפת על ראשו וישם על המצנפת אל מול פניו את ציץ הזהב נזר הקדש כאשר צוה יהוה את משה
(231976, 64, 4);400;ת;151272;(3, 8, 10, 24, 151272);39906;(3, 8, 10, 7, 39906);את;2;7;ויקח משה את שמן המשחה וימשח את המשכן ואת כל אשר בו ויקדש אתם
(231976, 64, 4);30;ל;151336;(3, 8, 11, 41, 151336);39925;(3, 8, 11, 12, 39925);כליו;2;12;ויז ממנו על המזבח שבע פעמים וימשח את המזבח ואת כל כליו ואת הכיר ואת כנו לקדשם
(231976, 64, 4);1;א;151400;(3, 8, 13, 9, 151400);39942;(3, 8, 13, 3, 39942);את;1;3;ויקרב משה את בני אהרן וילבשם כתנת ויחגר אתם אבנט ויחבש להם מגבעות כאשר צוה יהוה את משה
(231976, 64, 4);300;ש;151464;(3, 8, 14, 4, 151464);39958;(3, 8, 14, 1, 39958);ויגש;4;1;ויגש את פר החטאת ויסמך אהרן ובניו את ידיהם על ראש פר החטאת
(231976, 64, 4);70;ע;151528;(3, 8, 15, 22, 151528);39977;(3, 8, 15, 7, 39977);על;1;7;וישחט ויקח משה את הדם ויתן על קרנות המזבח סביב באצבעו ויחטא את המזבח ואת הדם יצק אל יסוד המזבח ויקדשהו לכפר עליו
(231976, 64, 4);200;ר;151592;(3, 8, 15, 86, 151592);39992;(3, 8, 15, 22, 39992);לכפר;4;22;וישחט ויקח משה את הדם ויתן על קרנות המזבח סביב באצבעו ויחטא את המזבח ואת הדם יצק אל יסוד המזבח ויקדשהו לכפר עליו
(231976, 64, 4);5;ה;151656;(3, 8, 16, 60, 151656);40011;(3, 8, 16, 18, 40011);המזבחה;1;18;ויקח את כל החלב אשר על הקרב ואת יתרת הכבד ואת שתי הכלית ואת חלבהן ויקטר משה המזבחה
(231976, 64, 4);10;י;151720;(3, 8, 18, 2, 151720);40029;(3, 8, 18, 1, 40029);ויקרב;2;1;ויקרב את איל העלה ויסמכו אהרן ובניו את ידיהם על ראש האיל
(231976, 64, 4);5;ה;151784;(3, 8, 19, 21, 151784);40047;(3, 8, 19, 7, 40047);המזבח;1;7;וישחט ויזרק משה את הדם על המזבח סביב
(231976, 64, 4);400;ת;151848;(3, 8, 21, 10, 151848);40063;(3, 8, 21, 3, 40063);ואת;3;3;ואת הקרב ואת הכרעים רחץ במים ויקטר משה את כל האיל המזבחה עלה הוא לריח ניחח אשה הוא ליהוה כאשר צוה יהוה את משה
(231976, 64, 4);200;ר;151912;(3, 8, 21, 74, 151912);40080;(3, 8, 21, 20, 40080);כאשר;4;20;ואת הקרב ואת הכרעים רחץ במים ויקטר משה את כל האיל המזבחה עלה הוא לריח ניחח אשה הוא ליהוה כאשר צוה יהוה את משה
(231976, 64, 4);5;ה;151976;(3, 8, 22, 52, 151976);40098;(3, 8, 22, 14, 40098);האיל;1;14;ויקרב את האיל השני איל המלאים ויסמכו אהרן ובניו את ידיהם על ראש האיל
(231976, 64, 4);200;ר;152040;(3, 8, 23, 61, 152040);40115;(3, 8, 23, 17, 40115);רגלו;1;17;וישחט ויקח משה מדמו ויתן על תנוך אזן אהרן הימנית ועל בהן ידו הימנית ועל בהן רגלו הימנית
(231976, 64, 4);50;נ;152104;(3, 8, 24, 55, 152104);40132;(3, 8, 24, 16, 40132);הימנית;4;16;ויקרב את בני אהרן ויתן משה מן הדם על תנוך אזנם הימנית ועל בהן ידם הימנית ועל בהן רגלם הימנית ויזרק משה את הדם על המזבח סביב
(231976, 64, 4);20;כ;152168;(3, 8, 25, 22, 152168);40150;(3, 8, 25, 7, 40150);כל;1;7;ויקח את החלב ואת האליה ואת כל החלב אשר על הקרב ואת יתרת הכבד ואת שתי הכלית ואת חלבהן ואת שוק הימין
(231976, 64, 4);400;ת;152232;(3, 8, 26, 9, 152232);40167;(3, 8, 26, 2, 40167);המצות;5;2;ומסל המצות אשר לפני יהוה לקח חלת מצה אחת וחלת לחם שמן אחת ורקיק אחד וישם על החלבים ועל שוק הימין
(231976, 64, 4);10;י;152296;(3, 8, 26, 73, 152296);40186;(3, 8, 26, 21, 40186);הימין;2;21;ומסל המצות אשר לפני יהוה לקח חלת מצה אחת וחלת לחם שמן אחת ורקיק אחד וישם על החלבים ועל שוק הימין
(231976, 64, 4);30;ל;152360;(3, 8, 28, 13, 152360);40204;(3, 8, 28, 4, 40204);מעל;3;4;ויקח משה אתם מעל כפיהם ויקטר המזבחה על העלה מלאים הם לריח ניחח אשה הוא ליהוה
(231976, 64, 4);50;נ;152424;(3, 8, 29, 16, 152424);40221;(3, 8, 29, 5, 40221);ויניפהו;3;5;ויקח משה את החזה ויניפהו תנופה לפני יהוה מאיל המלאים למשה היה למנה כאשר צוה יהוה את משה
(231976, 64, 4);40;מ;152488;(3, 8, 30, 10, 152488);40237;(3, 8, 30, 3, 40237);משמן;3;3;ויקח משה משמן המשחה ומן הדם אשר על המזבח ויז על אהרן על בגדיו ועל בניו ועל בגדי בניו אתו ויקדש את אהרן את בגדיו ואת בניו ואת בגדי בניו אתו
(231976, 64, 4);300;ש;152552;(3, 8, 30, 74, 152552);40255;(3, 8, 30, 21, 40255);ויקדש;5;21;ויקח משה משמן המשחה ומן הדם אשר על המזבח ויז על אהרן על בגדיו ועל בניו ועל בגדי בניו אתו ויקדש את אהרן את בגדיו ואת בניו ואת בגדי בניו אתו
(231976, 64, 4);300;ש;152616;(3, 8, 31, 30, 152616);40274;(3, 8, 31, 9, 40274);הבשר;3;9;ויאמר משה אל אהרן ואל בניו בשלו את הבשר פתח אהל מועד ושם תאכלו אתו ואת הלחם אשר בסל המלאים כאשר צויתי לאמר אהרן ובניו יאכלהו
(231976, 64, 4);10;י;152680;(3, 8, 31, 94, 152680);40291;(3, 8, 31, 26, 40291);יאכלהו;1;26;ויאמר משה אל אהרן ואל בניו בשלו את הבשר פתח אהל מועד ושם תאכלו אתו ואת הלחם אשר בסל המלאים כאשר צויתי לאמר אהרן ובניו יאכלהו
(231976, 64, 4);10;י;152744;(3, 8, 33, 36, 152744);40307;(3, 8, 33, 11, 40307);ימי;1;11;ומפתח אהל מועד לא תצאו שבעת ימים עד יום מלאת ימי מלאיכם כי שבעת ימים ימלא את ידכם
(231976, 64, 4);80;פ;152808;(3, 8, 35, 2, 152808);40324;(3, 8, 35, 1, 40324);ופתח;2;1;ופתח אהל מועד תשבו יומם ולילה שבעת ימים ושמרתם את משמרת יהוה ולא תמותו כי כן צויתי
(231976, 64, 4);10;י;152872;(3, 8, 35, 66, 152872);40340;(3, 8, 35, 17, 40340);צויתי;5;17;ופתח אהל מועד תשבו יומם ולילה שבעת ימים ושמרתם את משמרת יהוה ולא תמותו כי כן צויתי
(231976, 64, 4);50;ן;152936;(3, 9, 1, 25, 152936);40357;(3, 9, 1, 6, 40357);לאהרן;5;6;ויהי ביום השמיני קרא משה לאהרן ולבניו ולזקני ישראל
(231976, 64, 4);30;ל;153000;(3, 9, 2, 47, 153000);40374;(3, 9, 2, 14, 40374);לפני;1;14;ויאמר אל אהרן קח לך עגל בן בקר לחטאת ואיל לעלה תמימם והקרב לפני יהוה
(231976, 64, 4);30;ל;153064;(3, 9, 3, 57, 153064);40390;(3, 9, 3, 15, 40390);לעלה;3;15;ואל בני ישראל תדבר לאמר קחו שעיר עזים לחטאת ועגל וכבש בני שנה תמימם לעלה
(231976, 64, 4);8;ח;153128;(3, 9, 5, 4, 153128);40405;(3, 9, 5, 1, 40405);ויקחו;4;1;ויקחו את אשר צוה משה אל פני אהל מועד ויקרבו כל העדה ויעמדו לפני יהוה
(231976, 64, 4);200;ר;153192;(3, 9, 6, 14, 153192);40423;(3, 9, 6, 4, 40423);הדבר;4;4;ויאמר משה זה הדבר אשר צוה יהוה תעשו וירא אליכם כבוד יהוה
(231976, 64, 4);1;א;153256;(3, 9, 7, 33, 153256);40441;(3, 9, 7, 10, 40441);חטאתך;3;10;ויאמר משה אל אהרן קרב אל המזבח ועשה את חטאתך ואת עלתך וכפר בעדך ובעד העם ועשה את קרבן העם וכפר בעדם כאשר צוה יהוה
(231976, 64, 4);200;ר;153320;(3, 9, 8, 8, 153320);40458;(3, 9, 8, 2, 40458);אהרן;3;2;ויקרב אהרן אל המזבח וישחט את עגל החטאת אשר לו
(231976, 64, 4);6;ו;153384;(3, 9, 9, 36, 153384);40476;(3, 9, 9, 10, 40476);ויתן;1;10;ויקרבו בני אהרן את הדם אליו ויטבל אצבעו בדם ויתן על קרנות המזבח ואת הדם יצק אל יסוד המזבח
(231976, 64, 4);4;ד;153448;(3, 9, 10, 29, 153448);40493;(3, 9, 10, 8, 40493);הכבד;4;8;ואת החלב ואת הכלית ואת היתרת מן הכבד מן החטאת הקטיר המזבחה כאשר צוה יהוה את משה
(231976, 64, 4);6;ו;153512;(3, 9, 12, 1, 153512);40511;(3, 9, 12, 1, 40511);וישחט;1;1;וישחט את העלה וימצאו בני אהרן אליו את הדם ויזרקהו על המזבח סביב
(231976, 64, 4);1;א;153576;(3, 9, 13, 14, 153576);40527;(3, 9, 13, 4, 40527);אליו;1;4;ואת העלה המציאו אליו לנתחיה ואת הראש ויקטר על המזבח
(231976, 64, 4);8;ח;153640;(3, 9, 14, 36, 153640);40542;(3, 9, 14, 9, 40542);המזבחה;5;9;וירחץ את הקרב ואת הכרעים ויקטר על העלה המזבחה
(231976, 64, 4);5;ה;153704;(3, 9, 16, 8, 153704);40558;(3, 9, 16, 3, 40558);העלה;1;3;ויקרב את העלה ויעשה כמשפט
(231976, 64, 4);8;ח;153768;(3, 9, 18, 4, 153768);40573;(3, 9, 18, 1, 40573);וישחט;4;1;וישחט את השור ואת האיל זבח השלמים אשר לעם וימצאו בני אהרן את הדם אליו ויזרקהו על המזבח סביב
(231976, 64, 4);2;ב;153832;(3, 9, 18, 68, 153832);40590;(3, 9, 18, 18, 40590);המזבח;4;18;וישחט את השור ואת האיל זבח השלמים אשר לעם וימצאו בני אהרן את הדם אליו ויזרקהו על המזבח סביב
(231976, 64, 4);30;ל;153896;(3, 9, 20, 11, 153896);40605;(3, 9, 20, 3, 40605);החלבים;3;3;וישימו את החלבים על החזות ויקטר החלבים המזבחה
(231976, 64, 4);10;י;153960;(3, 9, 21, 37, 153960);40620;(3, 9, 21, 10, 40620);יהוה;1;10;ואת החזות ואת שוק הימין הניף אהרן תנופה לפני יהוה כאשר צוה משה
(231976, 64, 4);10;י;154024;(3, 9, 23, 2, 154024);40636;(3, 9, 23, 1, 40636);ויבא;2;1;ויבא משה ואהרן אל אהל מועד ויצאו ויברכו את העם וירא כבוד יהוה אל כל העם
(231976, 64, 4);50;נ;154088;(3, 9, 24, 10, 154088);40654;(3, 9, 24, 3, 40654);מלפני;4;3;ותצא אש מלפני יהוה ותאכל על המזבח את העלה ואת החלבים וירא כל העם וירנו ויפלו על פניהם
(231976, 64, 4);2;ב;154152;(3, 10, 1, 6, 154152);40671;(3, 10, 1, 2, 40671);בני;1;2;ויקחו בני אהרן נדב ואביהוא איש מחתתו ויתנו בהן אש וישימו עליה קטרת ויקריבו לפני יהוה אש זרה אשר לא צוה אתם
(231976, 64, 4);1;א;154216;(3, 10, 1, 70, 154216);40686;(3, 10, 1, 17, 40686);אש;1;17;ויקחו בני אהרן נדב ואביהוא איש מחתתו ויתנו בהן אש וישימו עליה קטרת ויקריבו לפני יהוה אש זרה אשר לא צוה אתם
(231976, 64, 4);5;ה;154280;(3, 10, 3, 12, 154280);40704;(3, 10, 3, 4, 40704);אהרן;2;4;ויאמר משה אל אהרן הוא אשר דבר יהוה לאמר בקרבי אקדש ועל פני כל העם אכבד וידם אהרן
(231976, 64, 4);300;ש;154344;(3, 10, 4, 13, 154344);40722;(3, 10, 4, 4, 40722);מישאל;3;4;ויקרא משה אל מישאל ואל אלצפן בני עזיאל דד אהרן ויאמר אלהם קרבו שאו את אחיכם מאת פני הקדש אל מחוץ למחנה
(231976, 64, 4);30;ל;154408;(3, 10, 4, 77, 154408);40740;(3, 10, 4, 22, 40740);למחנה;1;22;ויקרא משה אל מישאל ואל אלצפן בני עזיאל דד אהרן ויאמר אלהם קרבו שאו את אחיכם מאת פני הקדש אל מחוץ למחנה
(231976, 64, 4);6;ו;154472;(3, 10, 6, 22, 154472);40755;(3, 10, 6, 6, 40755);ולאיתמר;1;6;ויאמר משה אל אהרן ולאלעזר ולאיתמר בניו ראשיכם אל תפרעו ובגדיכם לא תפרמו ולא תמתו ועל כל העדה יקצף ואחיכם כל בית ישראל יבכו את השרפה אשר שרף יהוה
(231976, 64, 4);20;כ;154536;(3, 10, 6, 86, 154536);40770;(3, 10, 6, 21, 40770);כל;1;21;ויאמר משה אל אהרן ולאלעזר ולאיתמר בניו ראשיכם אל תפרעו ובגדיכם לא תפרמו ולא תמתו ועל כל העדה יקצף ואחיכם כל בית ישראל יבכו את השרפה אשר שרף יהוה
(231976, 64, 4);10;י;154600;(3, 10, 7, 34, 154600);40789;(3, 10, 7, 11, 40789);יהוה;1;11;ומפתח אהל מועד לא תצאו פן תמתו כי שמן משחת יהוה עליכם ויעשו כדבר משה
(231976, 64, 4);2;ב;154664;(3, 10, 9, 25, 154664);40806;(3, 10, 9, 8, 40806);בבאכם;2;8;יין ושכר אל תשת אתה ובניך אתך בבאכם אל אהל מועד ולא תמתו חקת עולם לדרתיכם
(231976, 64, 4);2;ב;154728;(3, 10, 10, 31, 154728);40822;(3, 10, 10, 8, 40822);ובין;2;8;ולהבדיל בין הקדש ובין החל ובין הטמא ובין הטהור
(231976, 64, 4);1;א;154792;(3, 10, 12, 11, 154792);40840;(3, 10, 12, 4, 40840);אהרן;1;4;וידבר משה אל אהרן ואל אלעזר ואל איתמר בניו הנותרים קחו את המנחה הנותרת מאשי יהוה ואכלוה מצות אצל המזבח כי קדש קדשים הוא
(231976, 64, 4);400;ת;154856;(3, 10, 12, 75, 154856);40854;(3, 10, 12, 18, 40854);מצות;4;18;וידבר משה אל אהרן ואל אלעזר ואל איתמר בניו הנותרים קחו את המנחה הנותרת מאשי יהוה ואכלוה מצות אצל המזבח כי קדש קדשים הוא
(231976, 64, 4);10;י;154920;(3, 10, 13, 43, 154920);40872;(3, 10, 13, 12, 40872);כי;2;12;ואכלתם אתה במקום קדוש כי חקך וחק בניך הוא מאשי יהוה כי כן צויתי
(231976, 64, 4);10;י;154984;(3, 10, 14, 57, 154984);40888;(3, 10, 14, 14, 40888);כי;2;14;ואת חזה התנופה ואת שוק התרומה תאכלו במקום טהור אתה ובניך ובנתיך אתך כי חקך וחק בניך נתנו מזבחי שלמי בני ישראל
(231976, 64, 4);10;י;155048;(3, 10, 15, 33, 155048);40904;(3, 10, 15, 8, 40904);יביאו;3;8;שוק התרומה וחזה התנופה על אשי החלבים יביאו להניף תנופה לפני יהוה והיה לך ולבניך אתך לחק עולם כאשר צוה יהוה
(231976, 64, 4);1;א;155112;(3, 10, 16, 11, 155112);40920;(3, 10, 16, 3, 40920);החטאת;4;3;ואת שעיר החטאת דרש דרש משה והנה שרף ויקצף על אלעזר ועל איתמר בני אהרן הנותרם לאמר
(231976, 64, 4);400;ת;155176;(3, 10, 17, 10, 155176);40937;(3, 10, 17, 3, 40937);אכלתם;4;3;מדוע לא אכלתם את החטאת במקום הקדש כי קדש קדשים הוא ואתה נתן לכם לשאת את עון העדה לכפר עליהם לפני יהוה
(231976, 64, 4);80;פ;155240;(3, 10, 17, 74, 155240);40955;(3, 10, 17, 21, 40955);לפני;2;21;מדוע לא אכלתם את החטאת במקום הקדש כי קדש קדשים הוא ואתה נתן לכם לשאת את עון העדה לכפר עליהם לפני יהוה
