(45349, 61, 4);40;ם;156247;(3, 11, 21, 41, 156247);41229;(3, 11, 21, 13, 41229);כרעים;5;13;אך את זה תאכלו מכל שרץ העוף ההלך על ארבע אשר לא כרעים ממעל לרגליו לנתר בהן על הארץ
(45349, 61, 4);5;ה;156308;(3, 11, 22, 38, 156308);41245;(3, 11, 22, 10, 41245);למינהו;5;10;את אלה מהם תאכלו את הארבה למינו ואת הסלעם למינהו ואת החרגל למינהו ואת החגב למינהו
(45349, 61, 4);40;ם;156369;(3, 11, 23, 33, 156369);41261;(3, 11, 23, 10, 41261);לכם;3;10;וכל שרץ העוף אשר לו ארבע רגלים שקץ הוא לכם
(45349, 61, 4);5;ה;156430;(3, 11, 25, 29, 156430);41277;(3, 11, 25, 8, 41277);הערב;1;8;וכל הנשא מנבלתם יכבס בגדיו וטמא עד הערב
(45349, 61, 4);20;כ;156491;(3, 11, 26, 58, 156491);41292;(3, 11, 26, 15, 41292);לכם;2;15;לכל הבהמה אשר הוא מפרסת פרסה ושסע איננה שסעת וגרה איננה מעלה טמאים הם לכם כל הנגע בהם יטמא
(45349, 61, 4);70;ע;156552;(3, 11, 27, 47, 156552);41310;(3, 11, 27, 14, 41310);הנגע;4;14;וכל הולך על כפיו בכל החיה ההלכת על ארבע טמאים הם לכם כל הנגע בנבלתם יטמא עד הערב
(45349, 61, 4);5;ה;156613;(3, 11, 29, 3, 156613);41326;(3, 11, 29, 1, 41326);וזה;3;1;וזה לכם הטמא בשרץ השרץ על הארץ החלד והעכבר והצב למינהו
(45349, 61, 4);40;מ;156674;(3, 11, 30, 20, 156674);41340;(3, 11, 30, 4, 41340);והחמט;4;4;והאנקה והכח והלטאה והחמט והתנשמת
(45349, 61, 4);30;ל;156735;(3, 11, 32, 11, 156735);41357;(3, 11, 32, 4, 41357);עליו;2;4;וכל אשר יפל עליו מהם במתם יטמא מכל כלי עץ או בגד או עור או שק כל כלי אשר יעשה מלאכה בהם במים יובא וטמא עד הערב וטהר
(45349, 61, 4);6;ו;156796;(3, 11, 32, 72, 156796);41377;(3, 11, 32, 24, 41377);יובא;2;24;וכל אשר יפל עליו מהם במתם יטמא מכל כלי עץ או בגד או עור או שק כל כלי אשר יעשה מלאכה בהם במים יובא וטמא עד הערב וטהר
(45349, 61, 4);2;ב;156857;(3, 11, 33, 45, 156857);41395;(3, 11, 33, 14, 41395);תשברו;3;14;וכל כלי חרש אשר יפל מהם אל תוכו כל אשר בתוכו יטמא ואתו תשברו
(45349, 61, 4);30;ל;156918;(3, 11, 35, 3, 156918);41412;(3, 11, 35, 1, 41412);וכל;3;1;וכל אשר יפל מנבלתם עליו יטמא תנור וכירים יתץ טמאים הם וטמאים יהיו לכם
(45349, 61, 4);2;ב;156979;(3, 11, 36, 8, 156979);41428;(3, 11, 36, 3, 41428);ובור;2;3;אך מעין ובור מקוה מים יהיה טהור ונגע בנבלתם יטמא
(45349, 61, 4);70;ע;157040;(3, 11, 37, 30, 157040);41444;(3, 11, 37, 9, 41444);יזרע;4;9;וכי יפל מנבלתם על כל זרע זרוע אשר יזרע טהור הוא
(45349, 61, 4);200;ר;157101;(3, 11, 39, 17, 157101);41462;(3, 11, 39, 5, 41462);אשר;3;5;וכי ימות מן הבהמה אשר היא לכם לאכלה הנגע בנבלתה יטמא עד הערב
(45349, 61, 4);2;ב;157162;(3, 11, 40, 30, 157162);41477;(3, 11, 40, 7, 41477);הערב;4;7;והאכל מנבלתה יכבס בגדיו וטמא עד הערב והנשא את נבלתה יכבס בגדיו וטמא עד הערב
(45349, 61, 4);20;כ;157223;(3, 11, 42, 1, 157223);41495;(3, 11, 42, 1, 41495);כל;1;1;כל הולך על גחון וכל הולך על ארבע עד כל מרבה רגלים לכל השרץ השרץ על הארץ לא תאכלום כי שקץ הם
(45349, 61, 4);6;ו;157284;(3, 11, 42, 62, 157284);41513;(3, 11, 42, 19, 41513);תאכלום;5;19;כל הולך על גחון וכל הולך על ארבע עד כל מרבה רגלים לכל השרץ השרץ על הארץ לא תאכלום כי שקץ הם
(45349, 61, 4);5;ה;157345;(3, 11, 44, 7, 157345);41531;(3, 11, 44, 3, 41531);יהוה;2;3;כי אני יהוה אלהיכם והתקדשתם והייתם קדשים כי קדוש אני ולא תטמאו את נפשתיכם בכל השרץ הרמש על הארץ
(45349, 61, 4);5;ה;157406;(3, 11, 44, 68, 157406);41545;(3, 11, 44, 17, 41545);הרמש;1;17;כי אני יהוה אלהיכם והתקדשתם והייתם קדשים כי קדוש אני ולא תטמאו את נפשתיכם בכל השרץ הרמש על הארץ
(45349, 61, 4);20;כ;157467;(3, 11, 45, 52, 157467);41560;(3, 11, 45, 13, 41560);כי;1;13;כי אני יהוה המעלה אתכם מארץ מצרים להית לכם לאלהים והייתם קדשים כי קדוש אני
(45349, 61, 4);200;ר;157528;(3, 11, 46, 53, 157528);41576;(3, 11, 46, 14, 41576);הארץ;3;14;זאת תורת הבהמה והעוף וכל נפש החיה הרמשת במים ולכל נפש השרצת על הארץ
(45349, 61, 4);6;ו;157589;(3, 12, 1, 8, 157589);41591;(3, 12, 1, 2, 41591);יהוה;3;2;וידבר יהוה אל משה לאמר
(45349, 61, 4);40;מ;157650;(3, 12, 2, 51, 157650);41608;(3, 12, 2, 14, 41608);כימי;3;14;דבר אל בני ישראל לאמר אשה כי תזריע וילדה זכר וטמאה שבעת ימים כימי נדת דותה תטמא
(45349, 61, 4);9;ט;157711;(3, 12, 4, 26, 157711);41623;(3, 12, 4, 7, 41623);טהרה;1;7;ושלשים יום ושלשת ימים תשב בדמי טהרה בכל קדש לא תגע ואל המקדש לא תבא עד מלאת ימי טהרה
(45349, 61, 4);20;כ;157772;(3, 12, 5, 21, 157772);41641;(3, 12, 5, 6, 41641);כנדתה;1;6;ואם נקבה תלד וטמאה שבעים כנדתה וששים יום וששת ימים תשב על דמי טהרה
(45349, 61, 4);2;ב;157833;(3, 12, 6, 29, 157833);41658;(3, 12, 6, 9, 41658);בן;1;9;ובמלאת ימי טהרה לבן או לבת תביא כבש בן שנתו לעלה ובן יונה או תר לחטאת אל פתח אהל מועד אל הכהן
(45349, 61, 4);80;פ;157894;(3, 12, 7, 18, 157894);41675;(3, 12, 7, 4, 41675);וכפר;3;4;והקריבו לפני יהוה וכפר עליה וטהרה ממקר דמיה זאת תורת הילדת לזכר או לנקבה
(45349, 61, 4);8;ח;157955;(3, 12, 8, 20, 157955);41692;(3, 12, 8, 7, 41692);ולקחה;4;7;ואם לא תמצא ידה די שה ולקחה שתי תרים או שני בני יונה אחד לעלה ואחד לחטאת וכפר עליה הכהן וטהרה
(45349, 61, 4);6;ו;158016;(3, 13, 1, 8, 158016);41708;(3, 13, 1, 2, 41708);יהוה;3;2;וידבר יהוה אל משה ואל אהרן לאמר
(45349, 61, 4);6;ו;158077;(3, 13, 2, 44, 158077);41726;(3, 13, 2, 13, 41726);בשרו;4;13;אדם כי יהיה בעור בשרו שאת או ספחת או בהרת והיה בעור בשרו לנגע צרעת והובא אל אהרן הכהן או אל אחד מבניו הכהנים
(45349, 61, 4);2;ב;158138;(3, 13, 3, 20, 158138);41743;(3, 13, 3, 6, 41743);הבשר;2;6;וראה הכהן את הנגע בעור הבשר ושער בנגע הפך לבן ומראה הנגע עמק מעור בשרו נגע צרעת הוא וראהו הכהן וטמא אתו
(45349, 61, 4);400;ת;158199;(3, 13, 3, 81, 158199);41759;(3, 13, 3, 22, 41759);אתו;2;22;וראה הכהן את הנגע בעור הבשר ושער בנגע הפך לבן ומראה הנגע עמק מעור בשרו נגע צרעת הוא וראהו הכהן וטמא אתו
(45349, 61, 4);20;כ;158260;(3, 13, 4, 60, 158260);41776;(3, 13, 4, 17, 41776);הכהן;2;17;ואם בהרת לבנה הוא בעור בשרו ועמק אין מראה מן העור ושערה לא הפך לבן והסגיר הכהן את הנגע שבעת ימים
(45349, 61, 4);70;ע;158321;(3, 13, 5, 45, 158321);41791;(3, 13, 5, 11, 41791);הנגע;4;11;וראהו הכהן ביום השביעי והנה הנגע עמד בעיניו לא פשה הנגע בעור והסגירו הכהן שבעת ימים שנית
(45349, 61, 4);50;נ;158382;(3, 13, 6, 34, 158382);41806;(3, 13, 6, 9, 41806);הנגע;2;9;וראה הכהן אתו ביום השביעי שנית והנה כהה הנגע ולא פשה הנגע בעור וטהרו הכהן מספחת הוא וכבס בגדיו וטהר
(45349, 61, 4);8;ח;158443;(3, 13, 7, 15, 158443);41821;(3, 13, 7, 4, 41821);המספחת;5;4;ואם פשה תפשה המספחת בעור אחרי הראתו אל הכהן לטהרתו ונראה שנית אל הכהן
(45349, 61, 4);80;פ;158504;(3, 13, 8, 20, 158504);41836;(3, 13, 8, 5, 41836);המספחת;4;5;וראה הכהן והנה פשתה המספחת בעור וטמאו הכהן צרעת הוא
(45349, 61, 4);50;נ;158565;(3, 13, 10, 11, 158565);41852;(3, 13, 10, 3, 41852);והנה;3;3;וראה הכהן והנה שאת לבנה בעור והיא הפכה שער לבן ומחית בשר חי בשאת
(45349, 61, 4);6;ו;158626;(3, 13, 11, 21, 158626);41869;(3, 13, 11, 6, 41869);וטמאו;1;6;צרעת נושנת הוא בעור בשרו וטמאו הכהן לא יסגרנו כי טמא הוא
(45349, 61, 4);200;ר;158687;(3, 13, 12, 37, 158687);41885;(3, 13, 12, 10, 41885);עור;3;10;ואם פרוח תפרח הצרעת בעור וכסתה הצרעת את כל עור הנגע מראשו ועד רגליו לכל מראה עיני הכהן
(45349, 61, 4);6;ו;158748;(3, 13, 13, 29, 158748);41901;(3, 13, 13, 8, 41901);בשרו;4;8;וראה הכהן והנה כסתה הצרעת את כל בשרו וטהר את הנגע כלו הפך לבן טהור הוא
(45349, 61, 4);200;ר;158809;(3, 13, 15, 14, 158809);41919;(3, 13, 15, 4, 41919);הבשר;4;4;וראה הכהן את הבשר החי וטמאו הבשר החי טמא הוא צרעת הוא
(45349, 61, 4);50;ן;158870;(3, 13, 16, 33, 158870);41937;(3, 13, 16, 10, 41937);הכהן;4;10;או כי ישוב הבשר החי ונהפך ללבן ובא אל הכהן
(45349, 61, 4);200;ר;158931;(3, 13, 18, 15, 158931);41954;(3, 13, 18, 5, 41954);בערו;3;5;ובשר כי יהיה בו בערו שחין ונרפא
(45349, 61, 4);1;א;158992;(3, 13, 20, 3, 158992);41969;(3, 13, 20, 1, 41969);וראה;3;1;וראה הכהן והנה מראה שפל מן העור ושערה הפך לבן וטמאו הכהן נגע צרעת הוא בשחין פרחה
(45349, 61, 4);5;ה;159053;(3, 13, 20, 64, 159053);41985;(3, 13, 20, 17, 41985);פרחה;4;17;וראה הכהן והנה מראה שפל מן העור ושערה הפך לבן וטמאו הכהן נגע צרעת הוא בשחין פרחה
(45349, 61, 4);50;ן;159114;(3, 13, 21, 61, 159114);42001;(3, 13, 21, 16, 42001);הכהן;4;16;ואם יראנה הכהן והנה אין בה שער לבן ושפלה איננה מן העור והיא כהה והסגירו הכהן שבעת ימים
(45349, 61, 4);400;ת;159175;(3, 13, 23, 22, 159175);42018;(3, 13, 23, 6, 42018);פשתה;3;6;ואם תחתיה תעמד הבהרת לא פשתה צרבת השחין הוא וטהרו הכהן
(45349, 61, 4);400;ת;159236;(3, 13, 24, 39, 159236);42034;(3, 13, 24, 11, 42034);בהרת;4;11;או בשר כי יהיה בערו מכות אש והיתה מחית המכוה בהרת לבנה אדמדמת או לבנה
(45349, 61, 4);90;צ;159297;(3, 13, 25, 45, 159297);42051;(3, 13, 25, 13, 42051);צרעת;1;13;וראה אתה הכהן והנה נהפך שער לבן בבהרת ומראה עמק מן העור צרעת הוא במכוה פרחה וטמא אתו הכהן נגע צרעת הוא
(45349, 61, 4);300;ש;159358;(3, 13, 26, 25, 159358);42067;(3, 13, 26, 7, 42067);שער;1;7;ואם יראנה הכהן והנה אין בבהרת שער לבן ושפלה איננה מן העור והוא כהה והסגירו הכהן שבעת ימים
(45349, 61, 4);5;ה;159419;(3, 13, 27, 14, 159419);42082;(3, 13, 27, 4, 42082);השביעי;1;4;וראהו הכהן ביום השביעי אם פשה תפשה בעור וטמא הכהן אתו נגע צרעת הוא
(45349, 61, 4);400;ת;159480;(3, 13, 28, 22, 159480);42098;(3, 13, 28, 6, 42098);פשתה;3;6;ואם תחתיה תעמד הבהרת לא פשתה בעור והוא כהה שאת המכוה הוא וטהרו הכהן כי צרבת המכוה הוא
(45349, 61, 4);5;ה;159541;(3, 13, 29, 15, 159541);42115;(3, 13, 29, 5, 42115);יהיה;4;5;ואיש או אשה כי יהיה בו נגע בראש או בזקן
(45349, 61, 4);40;מ;159602;(3, 13, 30, 46, 159602);42134;(3, 13, 30, 14, 42134);וטמא;3;14;וראה הכהן את הנגע והנה מראהו עמק מן העור ובו שער צהב דק וטמא אתו הכהן נתק הוא צרעת הראש או הזקן הוא
(45349, 61, 4);1;א;159663;(3, 13, 31, 30, 159663);42152;(3, 13, 31, 9, 42152);מראהו;3;9;וכי יראה הכהן את נגע הנתק והנה אין מראהו עמק מן העור ושער שחר אין בו והסגיר הכהן את נגע הנתק שבעת ימים
(45349, 61, 4);5;ה;159724;(3, 13, 32, 11, 159724);42170;(3, 13, 32, 4, 42170);הנגע;1;4;וראה הכהן את הנגע ביום השביעי והנה לא פשה הנתק ולא היה בו שער צהב ומראה הנתק אין עמק מן העור
(45349, 61, 4);200;ר;159785;(3, 13, 32, 72, 159785);42187;(3, 13, 32, 21, 42187);העור;4;21;וראה הכהן את הנגע ביום השביעי והנה לא פשה הנתק ולא היה בו שער צהב ומראה הנתק אין עמק מן העור
(45349, 61, 4);100;ק;159846;(3, 13, 34, 14, 159846);42203;(3, 13, 34, 4, 42203);הנתק;4;4;וראה הכהן את הנתק ביום השביעי והנה לא פשה הנתק בעור ומראהו איננו עמק מן העור וטהר אתו הכהן וכבס בגדיו וטהר
(45349, 61, 4);2;ב;159907;(3, 13, 34, 75, 159907);42219;(3, 13, 34, 20, 42219);וכבס;3;20;וראה הכהן את הנתק ביום השביעי והנה לא פשה הנתק בעור ומראהו איננו עמק מן העור וטהר אתו הכהן וכבס בגדיו וטהר
(45349, 61, 4);200;ר;159968;(3, 13, 36, 24, 159968);42234;(3, 13, 36, 6, 42234);בעור;4;6;וראהו הכהן והנה פשה הנתק בעור לא יבקר הכהן לשער הצהב טמא הוא
(45349, 61, 4);9;ט;160029;(3, 13, 37, 37, 160029);42252;(3, 13, 37, 11, 42252);טהור;1;11;ואם בעיניו עמד הנתק ושער שחר צמח בו נרפא הנתק טהור הוא וטהרו הכהן
(45349, 61, 4);50;נ;160090;(3, 13, 39, 11, 160090);42268;(3, 13, 39, 3, 42268);והנה;3;3;וראה הכהן והנה בעור בשרם בהרת כהות לבנת בהק הוא פרח בעור טהור הוא
(45349, 61, 4);1;א;160151;(3, 13, 40, 20, 160151);42285;(3, 13, 40, 6, 42285);הוא;3;6;ואיש כי ימרט ראשו קרח הוא טהור הוא
(45349, 61, 4);70;ע;160212;(3, 13, 42, 22, 160212);42302;(3, 13, 42, 6, 42302);נגע;3;6;וכי יהיה בקרחת או בגבחת נגע לבן אדמדם צרעת פרחת הוא בקרחתו או בגבחתו
(45349, 61, 4);4;ד;160273;(3, 13, 43, 28, 160273);42318;(3, 13, 43, 8, 42318);אדמדמת;2;8;וראה אתו הכהן והנה שאת הנגע לבנה אדמדמת בקרחתו או בגבחתו כמראה צרעת עור בשר
(45349, 61, 4);5;ה;160334;(3, 13, 44, 28, 160334);42333;(3, 13, 44, 8, 42333);הכהן;3;8;איש צרוע הוא טמא הוא טמא יטמאנו הכהן בראשו נגעו
(45349, 61, 4);9;ט;160395;(3, 13, 45, 51, 160395);42348;(3, 13, 45, 13, 42348);יעטה;3;13;והצרוע אשר בו הנגע בגדיו יהיו פרמים וראשו יהיה פרוע ועל שפם יעטה וטמא טמא יקרא
(45349, 61, 4);4;ד;160456;(3, 13, 47, 5, 160456);42365;(3, 13, 47, 1, 42365);והבגד;5;1;והבגד כי יהיה בו נגע צרעת בבגד צמר או בבגד פשתים
(45349, 61, 4);6;ו;160517;(3, 13, 48, 28, 160517);42383;(3, 13, 48, 8, 42383);בעור;3;8;או בשתי או בערב לפשתים ולצמר או בעור או בכל מלאכת עור
(45349, 61, 4);30;ל;160578;(3, 13, 49, 47, 160578);42401;(3, 13, 49, 14, 42401);בכל;3;14;והיה הנגע ירקרק או אדמדם בבגד או בעור או בשתי או בערב או בכל כלי עור נגע צרעת הוא והראה את הכהן
(45349, 61, 4);40;ם;160639;(3, 13, 50, 34, 160639);42418;(3, 13, 50, 9, 42418);ימים;4;9;וראה הכהן את הנגע והסגיר את הנגע שבעת ימים
(45349, 61, 4);5;ה;160700;(3, 13, 51, 61, 160700);42436;(3, 13, 51, 18, 42436);יעשה;4;18;וראה את הנגע ביום השביעי כי פשה הנגע בבגד או בשתי או בערב או בעור לכל אשר יעשה העור למלאכה צרעת ממארת הנגע טמא הוא
(45349, 61, 4);6;ו;160761;(3, 13, 52, 32, 160761);42454;(3, 13, 52, 11, 42454);או;2;11;ושרף את הבגד או את השתי או את הערב בצמר או בפשתים או את כל כלי העור אשר יהיה בו הנגע כי צרעת ממארת הוא באש תשרף
(45349, 61, 4);5;ה;160822;(3, 13, 53, 8, 160822);42473;(3, 13, 53, 3, 42473);הכהן;1;3;ואם יראה הכהן והנה לא פשה הנגע בבגד או בשתי או בערב או בכל כלי עור
(45349, 61, 4);200;ר;160883;(3, 13, 54, 18, 160883);42491;(3, 13, 54, 5, 42491);אשר;3;5;וצוה הכהן וכבסו את אשר בו הנגע והסגירו שבעת ימים שנית
(45349, 61, 4);1;א;160944;(3, 13, 55, 36, 160944);42508;(3, 13, 55, 11, 42508);את;1;11;וראה הכהן אחרי הכבס את הנגע והנה לא הפך הנגע את עינו והנגע לא פשה טמא הוא באש תשרפנו פחתת הוא בקרחתו או בגבחתו
(45349, 61, 4);50;ן;161005;(3, 13, 56, 10, 161005);42524;(3, 13, 56, 3, 42524);הכהן;4;3;ואם ראה הכהן והנה כהה הנגע אחרי הכבס אתו וקרע אתו מן הבגד או מן העור או מן השתי או מן הערב
(45349, 61, 4);1;א;161066;(3, 13, 57, 2, 161066);42544;(3, 13, 57, 1, 42544);ואם;2;1;ואם תראה עוד בבגד או בשתי או בערב או בכל כלי עור פרחת הוא באש תשרפנו את אשר בו הנגע
(45349, 61, 4);3;ג;161127;(3, 13, 57, 63, 161127);42563;(3, 13, 57, 20, 42563);הנגע;3;20;ואם תראה עוד בבגד או בשתי או בערב או בכל כלי עור פרחת הוא באש תשרפנו את אשר בו הנגע
(45349, 61, 4);400;ת;161188;(3, 13, 59, 3, 161188);42581;(3, 13, 59, 1, 42581);זאת;3;1;זאת תורת נגע צרעת בגד הצמר או הפשתים או השתי או הערב או כל כלי עור לטהרו או לטמאו
(45349, 61, 4);6;ו;161249;(3, 14, 1, 1, 161249);42600;(3, 14, 1, 1, 42600);וידבר;1;1;וידבר יהוה אל משה לאמר
(45349, 61, 4);50;ן;161310;(3, 14, 3, 8, 161310);42615;(3, 14, 3, 2, 42615);הכהן;4;2;ויצא הכהן אל מחוץ למחנה וראה הכהן והנה נרפא נגע הצרעת מן הצרוע
(45349, 61, 4);400;ת;161371;(3, 14, 4, 19, 161371);42631;(3, 14, 4, 5, 42631);שתי;2;5;וצוה הכהן ולקח למטהר שתי צפרים חיות טהרות ועץ ארז ושני תולעת ואזב
(45349, 61, 4);30;ל;161432;(3, 14, 5, 27, 161432);42647;(3, 14, 5, 8, 42647);כלי;2;8;וצוה הכהן ושחט את הצפור האחת אל כלי חרש על מים חיים
(45349, 61, 4);30;ל;161493;(3, 14, 6, 48, 161493);42665;(3, 14, 6, 14, 42665);וטבל;4;14;את הצפר החיה יקח אתה ואת עץ הארז ואת שני התולעת ואת האזב וטבל אותם ואת הצפר החיה בדם הצפר השחטה על המים החיים
(45349, 61, 4);70;ע;161554;(3, 14, 7, 23, 161554);42682;(3, 14, 7, 7, 42682);פעמים;2;7;והזה על המטהר מן הצרעת שבע פעמים וטהרו ושלח את הצפר החיה על פני השדה
(45349, 61, 4);200;ר;161615;(3, 14, 8, 30, 161615);42699;(3, 14, 8, 9, 42699);ורחץ;2;9;וכבס המטהר את בגדיו וגלח את כל שערו ורחץ במים וטהר ואחר יבוא אל המחנה וישב מחוץ לאהלו שבעת ימים
(45349, 61, 4);10;י;161676;(3, 14, 9, 15, 161676);42714;(3, 14, 9, 4, 42714);יגלח;1;4;והיה ביום השביעי יגלח את כל שערו את ראשו ואת זקנו ואת גבת עיניו ואת כל שערו יגלח וכבס את בגדיו ורחץ את בשרו במים וטהר
(45349, 61, 4);200;ר;161737;(3, 14, 9, 76, 161737);42732;(3, 14, 9, 22, 42732);ורחץ;2;22;והיה ביום השביעי יגלח את כל שערו את ראשו ואת זקנו ואת גבת עיניו ואת כל שערו יגלח וכבס את בגדיו ורחץ את בשרו במים וטהר
(45349, 61, 4);40;מ;161798;(3, 14, 10, 45, 161798);42747;(3, 14, 10, 11, 42747);תמימה;4;11;וביום השמיני יקח שני כבשים תמימם וכבשה אחת בת שנתה תמימה ושלשה עשרנים סלת מנחה בלולה בשמן ולג אחד שמן
(45349, 61, 4);9;ט;161859;(3, 14, 11, 24, 161859);42762;(3, 14, 11, 6, 42762);המטהר;3;6;והעמיד הכהן המטהר את האיש המטהר ואתם לפני יהוה פתח אהל מועד
(45349, 61, 4);5;ה;161920;(3, 14, 12, 37, 161920);42779;(3, 14, 12, 11, 42779);השמן;1;11;ולקח הכהן את הכבש האחד והקריב אתו לאשם ואת לג השמן והניף אתם תנופה לפני יהוה
(45349, 61, 4);2;ב;161981;(3, 14, 13, 37, 161981);42795;(3, 14, 13, 11, 42795);במקום;1;11;ושחט את הכבש במקום אשר ישחט את החטאת ואת העלה במקום הקדש כי כחטאת האשם הוא לכהן קדש קדשים הוא
(45349, 61, 4);70;ע;162042;(3, 14, 14, 24, 162042);42811;(3, 14, 14, 7, 42811);על;1;7;ולקח הכהן מדם האשם ונתן הכהן על תנוך אזן המטהר הימנית ועל בהן ידו הימנית ועל בהן רגלו הימנית
(45349, 61, 4);3;ג;162103;(3, 14, 15, 11, 162103);42826;(3, 14, 15, 3, 42826);מלג;3;3;ולקח הכהן מלג השמן ויצק על כף הכהן השמאלית
(45349, 61, 4);40;מ;162164;(3, 14, 16, 38, 162164);42843;(3, 14, 16, 11, 42843);השמאלית;3;11;וטבל הכהן את אצבעו הימנית מן השמן אשר על כפו השמאלית והזה מן השמן באצבעו שבע פעמים לפני יהוה
(45349, 61, 4);70;ע;162225;(3, 14, 17, 25, 162225);42859;(3, 14, 17, 8, 42859);על;1;8;ומיתר השמן אשר על כפו יתן הכהן על תנוך אזן המטהר הימנית ועל בהן ידו הימנית ועל בהן רגלו הימנית על דם האשם
(45349, 61, 4);50;נ;162286;(3, 14, 18, 3, 162286);42875;(3, 14, 18, 1, 42875);והנותר;3;1;והנותר בשמן אשר על כף הכהן יתן על ראש המטהר וכפר עליו הכהן לפני יהוה
(45349, 61, 4);400;ת;162347;(3, 14, 19, 10, 162347);42892;(3, 14, 19, 3, 42892);את;2;3;ועשה הכהן את החטאת וכפר על המטהר מטמאתו ואחר ישחט את העלה
(45349, 61, 4);40;מ;162408;(3, 14, 20, 25, 162408);42908;(3, 14, 20, 7, 42908);המזבחה;2;7;והעלה הכהן את העלה ואת המנחה המזבחה וכפר עליו הכהן וטהר
(45349, 61, 4);80;פ;162469;(3, 14, 21, 41, 162469);42924;(3, 14, 21, 12, 42924);לכפר;3;12;ואם דל הוא ואין ידו משגת ולקח כבש אחד אשם לתנופה לכפר עליו ועשרון סלת אחד בלול בשמן למנחה ולג שמן
(45349, 61, 4);300;ש;162530;(3, 14, 22, 25, 162530);42941;(3, 14, 22, 8, 42941);תשיג;2;8;ושתי תרים או שני בני יונה אשר תשיג ידו והיה אחד חטאת והאחד עלה
(45349, 61, 4);5;ה;162591;(3, 14, 23, 37, 162591);42957;(3, 14, 23, 10, 42957);אהל;2;10;והביא אתם ביום השמיני לטהרתו אל הכהן אל פתח אהל מועד לפני יהוה
(45349, 61, 4);10;י;162652;(3, 14, 24, 48, 162652);42974;(3, 14, 24, 14, 42974);יהוה;1;14;ולקח הכהן את כבש האשם ואת לג השמן והניף אתם הכהן תנופה לפני יהוה
(45349, 61, 4);50;ן;162713;(3, 14, 25, 58, 162713);42990;(3, 14, 25, 16, 42990);בהן;3;16;ושחט את כבש האשם ולקח הכהן מדם האשם ונתן על תנוך אזן המטהר הימנית ועל בהן ידו הימנית ועל בהן רגלו הימנית
(45349, 61, 4);5;ה;162774;(3, 14, 27, 7, 162774);43006;(3, 14, 27, 2, 43006);הכהן;3;2;והזה הכהן באצבעו הימנית מן השמן אשר על כפו השמאלית שבע פעמים לפני יהוה
(45349, 61, 4);5;ה;162835;(3, 14, 28, 11, 162835);43022;(3, 14, 28, 4, 43022);השמן;1;4;ונתן הכהן מן השמן אשר על כפו על תנוך אזן המטהר הימנית ועל בהן ידו הימנית ועל בהן רגלו הימנית על מקום דם האשם
(45349, 61, 4);10;י;162896;(3, 14, 28, 72, 162896);43038;(3, 14, 28, 20, 43038);הימנית;5;20;ונתן הכהן מן השמן אשר על כפו על תנוך אזן המטהר הימנית ועל בהן ידו הימנית ועל בהן רגלו הימנית על מקום דם האשם
(45349, 61, 4);10;י;162957;(3, 14, 29, 48, 162957);43056;(3, 14, 29, 14, 43056);לפני;4;14;והנותר מן השמן אשר על כף הכהן יתן על ראש המטהר לכפר עליו לפני יהוה
(45349, 61, 4);8;ח;163018;(3, 14, 31, 17, 163018);43075;(3, 14, 31, 6, 43075);האחד;3;6;את אשר תשיג ידו את האחד חטאת ואת האחד עלה על המנחה וכפר הכהן על המטהר לפני יהוה
(45349, 61, 4);90;צ;163079;(3, 14, 32, 16, 163079);43093;(3, 14, 32, 6, 43093);צרעת;1;6;זאת תורת אשר בו נגע צרעת אשר לא תשיג ידו בטהרתו
