(224277, -63, 4);8;ח;152142;(3, 8, 24, 93, 152142);40142;(3, 8, 24, 26, 40142);המזבח;5;26;ויקרב את בני אהרן ויתן משה מן הדם על תנוך אזנם הימנית ועל בהן ידם הימנית ועל בהן רגלם הימנית ויזרק משה את הדם על המזבח סביב
(224277, -63, 4);6;ו;152205;(3, 8, 25, 59, 152205);40161;(3, 8, 25, 18, 40161);ואת;1;18;ויקח את החלב ואת האליה ואת כל החלב אשר על הקרב ואת יתרת הכבד ואת שתי הכלית ואת חלבהן ואת שוק הימין
(224277, -63, 4);400;ת;152268;(3, 8, 26, 45, 152268);40178;(3, 8, 26, 13, 40178);אחת;3;13;ומסל המצות אשר לפני יהוה לקח חלת מצה אחת וחלת לחם שמן אחת ורקיק אחד וישם על החלבים ועל שוק הימין
(224277, -63, 4);80;ף;152331;(3, 8, 27, 32, 152331);40196;(3, 8, 27, 10, 40196);וינף;4;10;ויתן את הכל על כפי אהרן ועל כפי בניו וינף אתם תנופה לפני יהוה
(224277, -63, 4);50;נ;152394;(3, 8, 28, 47, 152394);40213;(3, 8, 28, 13, 40213);ניחח;1;13;ויקח משה אתם מעל כפיהם ויקטר המזבחה על העלה מלאים הם לריח ניחח אשה הוא ליהוה
(224277, -63, 4);10;י;152457;(3, 8, 29, 49, 152457);40228;(3, 8, 29, 12, 40228);היה;2;12;ויקח משה את החזה ויניפהו תנופה לפני יהוה מאיל המלאים למשה היה למנה כאשר צוה יהוה את משה
(224277, -63, 4);70;ע;152520;(3, 8, 30, 42, 152520);40247;(3, 8, 30, 13, 40247);על;1;13;ויקח משה משמן המשחה ומן הדם אשר על המזבח ויז על אהרן על בגדיו ועל בניו ועל בגדי בניו אתו ויקדש את אהרן את בגדיו ואת בניו ואת בגדי בניו אתו
(224277, -63, 4);6;ו;152583;(3, 8, 30, 105, 152583);40264;(3, 8, 30, 30, 40264);בניו;4;30;ויקח משה משמן המשחה ומן הדם אשר על המזבח ויז על אהרן על בגדיו ועל בניו ועל בגדי בניו אתו ויקדש את אהרן את בגדיו ואת בניו ואת בגדי בניו אתו
(224277, -63, 4);1;א;152646;(3, 8, 31, 60, 152646);40283;(3, 8, 31, 18, 40283);אשר;1;18;ויאמר משה אל אהרן ואל בניו בשלו את הבשר פתח אהל מועד ושם תאכלו אתו ואת הלחם אשר בסל המלאים כאשר צויתי לאמר אהרן ובניו יאכלהו
(224277, -63, 4);6;ו;152709;(3, 8, 33, 1, 152709);40297;(3, 8, 33, 1, 40297);ומפתח;1;1;ומפתח אהל מועד לא תצאו שבעת ימים עד יום מלאת ימי מלאיכם כי שבעת ימים ימלא את ידכם
(224277, -63, 4);40;ם;152772;(3, 8, 33, 64, 152772);40314;(3, 8, 33, 18, 40314);ידכם;4;18;ומפתח אהל מועד לא תצאו שבעת ימים עד יום מלאת ימי מלאיכם כי שבעת ימים ימלא את ידכם
(224277, -63, 4);10;י;152835;(3, 8, 35, 29, 152835);40331;(3, 8, 35, 8, 40331);ימים;1;8;ופתח אהל מועד תשבו יומם ולילה שבעת ימים ושמרתם את משמרת יהוה ולא תמותו כי כן צויתי
(224277, -63, 4);200;ר;152898;(3, 8, 36, 26, 152898);40347;(3, 8, 36, 7, 40347);אשר;3;7;ויעש אהרן ובניו את כל הדברים אשר צוה יהוה ביד משה
(224277, -63, 4);1;א;152961;(3, 9, 2, 8, 152961);40363;(3, 9, 2, 3, 40363);אהרן;1;3;ויאמר אל אהרן קח לך עגל בן בקר לחטאת ואיל לעלה תמימם והקרב לפני יהוה
(224277, -63, 4);1;א;153024;(3, 9, 3, 17, 153024);40380;(3, 9, 3, 5, 40380);לאמר;2;5;ואל בני ישראל תדבר לאמר קחו שעיר עזים לחטאת ועגל וכבש בני שנה תמימם לעלה
(224277, -63, 4);10;י;153087;(3, 9, 4, 22, 153087);40395;(3, 9, 4, 5, 40395);לפני;4;5;ושור ואיל לשלמים לזבח לפני יהוה ומנחה בלולה בשמן כי היום יהוה נראה אליכם
(224277, -63, 4);6;ו;153150;(3, 9, 5, 26, 153150);40413;(3, 9, 5, 9, 40413);מועד;2;9;ויקחו את אשר צוה משה אל פני אהל מועד ויקרבו כל העדה ויעמדו לפני יהוה
(224277, -63, 4);10;י;153213;(3, 9, 6, 35, 153213);40429;(3, 9, 6, 10, 40429);אליכם;3;10;ויאמר משה זה הדבר אשר צוה יהוה תעשו וירא אליכם כבוד יהוה
(224277, -63, 4);70;ע;153276;(3, 9, 7, 53, 153276);40446;(3, 9, 7, 15, 40446);ובעד;3;15;ויאמר משה אל אהרן קרב אל המזבח ועשה את חטאתך ואת עלתך וכפר בעדך ובעד העם ועשה את קרבן העם וכפר בעדם כאשר צוה יהוה
(224277, -63, 4);5;ה;153339;(3, 9, 8, 27, 153339);40464;(3, 9, 8, 8, 40464);החטאת;1;8;ויקרב אהרן אל המזבח וישחט את עגל החטאת אשר לו
(224277, -63, 4);400;ת;153402;(3, 9, 9, 54, 153402);40480;(3, 9, 9, 14, 40480);ואת;3;14;ויקרבו בני אהרן את הדם אליו ויטבל אצבעו בדם ויתן על קרנות המזבח ואת הדם יצק אל יסוד המזבח
(224277, -63, 4);8;ח;153465;(3, 9, 10, 46, 153465);40497;(3, 9, 10, 12, 40497);המזבחה;5;12;ואת החלב ואת הכלית ואת היתרת מן הכבד מן החטאת הקטיר המזבחה כאשר צוה יהוה את משה
(224277, -63, 4);6;ו;153528;(3, 9, 12, 17, 153528);40514;(3, 9, 12, 4, 40514);וימצאו;6;4;וישחט את העלה וימצאו בני אהרן אליו את הדם ויזרקהו על המזבח סביב
(224277, -63, 4);1;א;153591;(3, 9, 13, 29, 153591);40530;(3, 9, 13, 7, 40530);הראש;3;7;ואת העלה המציאו אליו לנתחיה ואת הראש ויקטר על המזבח
(224277, -63, 4);70;ע;153654;(3, 9, 15, 13, 153654);40546;(3, 9, 15, 4, 40546);העם;2;4;ויקרב את קרבן העם ויקח את שעיר החטאת אשר לעם וישחטהו ויחטאהו כראשון
(224277, -63, 4);9;ט;153717;(3, 9, 16, 21, 153717);40560;(3, 9, 16, 5, 40560);כמשפט;5;5;ויקרב את העלה ויעשה כמשפט
(224277, -63, 4);1;א;153780;(3, 9, 18, 16, 153780);40577;(3, 9, 18, 5, 40577);האיל;2;5;וישחט את השור ואת האיל זבח השלמים אשר לעם וימצאו בני אהרן את הדם אליו ויזרקהו על המזבח סביב
(224277, -63, 4);30;ל;153843;(3, 9, 19, 6, 153843);40593;(3, 9, 19, 2, 40593);החלבים;3;2;ואת החלבים מן השור ומן האיל האליה והמכסה והכלית ויתרת הכבד
(224277, -63, 4);400;ת;153906;(3, 9, 20, 21, 153906);40607;(3, 9, 20, 5, 40607);החזות;5;5;וישימו את החלבים על החזות ויקטר החלבים המזבחה
(224277, -63, 4);6;ו;153969;(3, 9, 21, 46, 153969);40622;(3, 9, 21, 12, 40622);צוה;2;12;ואת החזות ואת שוק הימין הניף אהרן תנופה לפני יהוה כאשר צוה משה
(224277, -63, 4);5;ה;154032;(3, 9, 23, 10, 154032);40638;(3, 9, 23, 3, 40638);ואהרן;3;3;ויבא משה ואהרן אל אהל מועד ויצאו ויברכו את העם וירא כבוד יהוה אל כל העם
(224277, -63, 4);400;ת;154095;(3, 9, 24, 17, 154095);40656;(3, 9, 24, 5, 40656);ותאכל;2;5;ותצא אש מלפני יהוה ותאכל על המזבח את העלה ואת החלבים וירא כל העם וירנו ויפלו על פניהם
(224277, -63, 4);50;ן;154158;(3, 10, 1, 12, 154158);40672;(3, 10, 1, 3, 40672);אהרן;4;3;ויקחו בני אהרן נדב ואביהוא איש מחתתו ויתנו בהן אש וישימו עליה קטרת ויקריבו לפני יהוה אש זרה אשר לא צוה אתם
(224277, -63, 4);1;א;154221;(3, 10, 1, 75, 154221);40688;(3, 10, 1, 19, 40688);אשר;1;19;ויקחו בני אהרן נדב ואביהוא איש מחתתו ויתנו בהן אש וישימו עליה קטרת ויקריבו לפני יהוה אש זרה אשר לא צוה אתם
(224277, -63, 4);6;ו;154284;(3, 10, 3, 16, 154284);40705;(3, 10, 3, 5, 40705);הוא;2;5;ויאמר משה אל אהרן הוא אשר דבר יהוה לאמר בקרבי אקדש ועל פני כל העם אכבד וידם אהרן
(224277, -63, 4);6;ו;154347;(3, 10, 4, 16, 154347);40723;(3, 10, 4, 5, 40723);ואל;1;5;ויקרא משה אל מישאל ואל אלצפן בני עזיאל דד אהרן ויאמר אלהם קרבו שאו את אחיכם מאת פני הקדש אל מחוץ למחנה
(224277, -63, 4);8;ח;154410;(3, 10, 4, 79, 154410);40740;(3, 10, 4, 22, 40740);למחנה;3;22;ויקרא משה אל מישאל ואל אלצפן בני עזיאל דד אהרן ויאמר אלהם קרבו שאו את אחיכם מאת פני הקדש אל מחוץ למחנה
(224277, -63, 4);30;ל;154473;(3, 10, 6, 23, 154473);40755;(3, 10, 6, 6, 40755);ולאיתמר;2;6;ויאמר משה אל אהרן ולאלעזר ולאיתמר בניו ראשיכם אל תפרעו ובגדיכם לא תפרמו ולא תמתו ועל כל העדה יקצף ואחיכם כל בית ישראל יבכו את השרפה אשר שרף יהוה
(224277, -63, 4);20;כ;154536;(3, 10, 6, 86, 154536);40770;(3, 10, 6, 21, 40770);כל;1;21;ויאמר משה אל אהרן ולאלעזר ולאיתמר בניו ראשיכם אל תפרעו ובגדיכם לא תפרמו ולא תמתו ועל כל העדה יקצף ואחיכם כל בית ישראל יבכו את השרפה אשר שרף יהוה
(224277, -63, 4);400;ת;154599;(3, 10, 7, 33, 154599);40788;(3, 10, 7, 10, 40788);משחת;4;10;ומפתח אהל מועד לא תצאו פן תמתו כי שמן משחת יהוה עליכם ויעשו כדבר משה
(224277, -63, 4);20;ך;154662;(3, 10, 9, 23, 154662);40805;(3, 10, 9, 7, 40805);אתך;3;7;יין ושכר אל תשת אתה ובניך אתך בבאכם אל אהל מועד ולא תמתו חקת עולם לדרתיכם
(224277, -63, 4);40;מ;154725;(3, 10, 10, 28, 154725);40821;(3, 10, 10, 7, 40821);הטמא;3;7;ולהבדיל בין הקדש ובין החל ובין הטמא ובין הטהור
(224277, -63, 4);300;ש;154788;(3, 10, 12, 7, 154788);40838;(3, 10, 12, 2, 40838);משה;2;2;וידבר משה אל אהרן ואל אלעזר ואל איתמר בניו הנותרים קחו את המנחה הנותרת מאשי יהוה ואכלוה מצות אצל המזבח כי קדש קדשים הוא
(224277, -63, 4);6;ו;154851;(3, 10, 12, 70, 154851);40853;(3, 10, 12, 17, 40853);ואכלוה;5;17;וידבר משה אל אהרן ואל אלעזר ואל איתמר בניו הנותרים קחו את המנחה הנותרת מאשי יהוה ואכלוה מצות אצל המזבח כי קדש קדשים הוא
(224277, -63, 4);10;י;154914;(3, 10, 13, 37, 154914);40870;(3, 10, 13, 10, 40870);מאשי;4;10;ואכלתם אתה במקום קדוש כי חקך וחק בניך הוא מאשי יהוה כי כן צויתי
(224277, -63, 4);400;ת;154977;(3, 10, 14, 50, 154977);40886;(3, 10, 14, 12, 40886);ובנתיך;4;12;ואת חזה התנופה ואת שוק התרומה תאכלו במקום טהור אתה ובניך ובנתיך אתך כי חקך וחק בניך נתנו מזבחי שלמי בני ישראל
(224277, -63, 4);5;ה;155040;(3, 10, 15, 25, 155040);40903;(3, 10, 15, 7, 40903);החלבים;1;7;שוק התרומה וחזה התנופה על אשי החלבים יביאו להניף תנופה לפני יהוה והיה לך ולבניך אתך לחק עולם כאשר צוה יהוה
(224277, -63, 4);1;א;155103;(3, 10, 16, 2, 155103);40918;(3, 10, 16, 1, 40918);ואת;2;1;ואת שעיר החטאת דרש דרש משה והנה שרף ויקצף על אלעזר ועל איתמר בני אהרן הנותרם לאמר
(224277, -63, 4);200;ר;155166;(3, 10, 16, 65, 155166);40934;(3, 10, 16, 17, 40934);לאמר;4;17;ואת שעיר החטאת דרש דרש משה והנה שרף ויקצף על אלעזר ועל איתמר בני אהרן הנותרם לאמר
(224277, -63, 4);5;ה;155229;(3, 10, 17, 63, 155229);40952;(3, 10, 17, 18, 40952);העדה;4;18;מדוע לא אכלתם את החטאת במקום הקדש כי קדש קדשים הוא ואתה נתן לכם לשאת את עון העדה לכפר עליהם לפני יהוה
(224277, -63, 4);6;ו;155292;(3, 10, 18, 46, 155292);40970;(3, 10, 18, 14, 40970);צויתי;2;14;הן לא הובא את דמה אל הקדש פנימה אכול תאכלו אתה בקדש כאשר צויתי
(224277, -63, 4);1;א;155355;(3, 10, 19, 60, 155355);40986;(3, 10, 19, 16, 40986);כאלה;2;16;וידבר אהרן אל משה הן היום הקריבו את חטאתם ואת עלתם לפני יהוה ותקראנה אתי כאלה ואכלתי חטאת היום הייטב בעיני יהוה
(224277, -63, 4);5;ה;155418;(3, 11, 1, 14, 155418);41000;(3, 11, 1, 4, 41000);משה;3;4;וידבר יהוה אל משה ואל אהרן לאמר אלהם
(224277, -63, 4);1;א;155481;(3, 11, 2, 48, 155481);41018;(3, 11, 2, 14, 41018);הארץ;2;14;דברו אל בני ישראל לאמר זאת החיה אשר תאכלו מכל הבהמה אשר על הארץ
(224277, -63, 4);10;י;155544;(3, 11, 4, 18, 155544);41035;(3, 11, 4, 6, 41035);ממעלי;5;6;אך את זה לא תאכלו ממעלי הגרה וממפרסי הפרסה את הגמל כי מעלה גרה הוא ופרסה איננו מפריס טמא הוא לכם
(224277, -63, 4);300;ש;155607;(3, 11, 5, 5, 155607);41052;(3, 11, 5, 2, 41052);השפן;2;2;ואת השפן כי מעלה גרה הוא ופרסה לא יפריס טמא הוא לכם
(224277, -63, 4);1;א;155670;(3, 11, 6, 28, 155670);41070;(3, 11, 6, 8, 41070);לא;2;8;ואת הארנבת כי מעלת גרה הוא ופרסה לא הפריסה טמאה הוא לכם
(224277, -63, 4);40;מ;155733;(3, 11, 7, 47, 155733);41088;(3, 11, 7, 14, 41088);טמא;2;14;ואת החזיר כי מפריס פרסה הוא ושסע שסע פרסה והוא גרה לא יגר טמא הוא לכם
(224277, -63, 4);30;ל;155796;(3, 11, 9, 21, 155796);41106;(3, 11, 9, 7, 41106);כל;2;7;את זה תאכלו מכל אשר במים כל אשר לו סנפיר וקשקשת במים בימים ובנחלים אתם תאכלו
(224277, -63, 4);2;ב;155859;(3, 11, 10, 23, 155859);41122;(3, 11, 10, 7, 41122);בימים;1;7;וכל אשר אין לו סנפיר וקשקשת בימים ובנחלים מכל שרץ המים ומכל נפש החיה אשר במים שקץ הם לכם
(224277, -63, 4);40;ם;155922;(3, 11, 11, 16, 155922);41138;(3, 11, 11, 4, 41138);מבשרם;5;4;ושקץ יהיו לכם מבשרם לא תאכלו ואת נבלתם תשקצו
(224277, -63, 4);100;ק;155985;(3, 11, 13, 9, 155985);41156;(3, 11, 13, 3, 41156);תשקצו;3;3;ואת אלה תשקצו מן העוף לא יאכלו שקץ הם את הנשר ואת הפרס ואת העזניה
(224277, -63, 4);400;ת;156048;(3, 11, 15, 2, 156048);41174;(3, 11, 15, 1, 41174);את;2;1;את כל ערב למינו
(224277, -63, 4);1;א;156111;(3, 11, 17, 16, 156111);41192;(3, 11, 17, 5, 41192);ואת;2;5;ואת הכוס ואת השלך ואת הינשוף
(224277, -63, 4);5;ה;156174;(3, 11, 19, 33, 156174);41207;(3, 11, 19, 8, 41207);העטלף;1;8;ואת החסידה האנפה למינה ואת הדוכיפת ואת העטלף
(224277, -63, 4);70;ע;156237;(3, 11, 21, 31, 156237);41226;(3, 11, 21, 10, 41226);ארבע;4;10;אך את זה תאכלו מכל שרץ העוף ההלך על ארבע אשר לא כרעים ממעל לרגליו לנתר בהן על הארץ
(224277, -63, 4);60;ס;156300;(3, 11, 22, 30, 156300);41244;(3, 11, 22, 9, 41244);הסלעם;2;9;את אלה מהם תאכלו את הארבה למינו ואת הסלעם למינהו ואת החרגל למינהו ואת החגב למינהו
(224277, -63, 4);90;ץ;156363;(3, 11, 23, 27, 156363);41259;(3, 11, 23, 8, 41259);שקץ;3;8;וכל שרץ העוף אשר לו ארבע רגלים שקץ הוא לכם
(224277, -63, 4);40;מ;156426;(3, 11, 25, 25, 156426);41275;(3, 11, 25, 6, 41275);וטמא;3;6;וכל הנשא מנבלתם יכבס בגדיו וטמא עד הערב
(224277, -63, 4);40;ם;156489;(3, 11, 26, 56, 156489);41291;(3, 11, 26, 14, 41291);הם;2;14;לכל הבהמה אשר הוא מפרסת פרסה ושסע איננה שסעת וגרה איננה מעלה טמאים הם לכם כל הנגע בהם יטמא
(224277, -63, 4);70;ע;156552;(3, 11, 27, 47, 156552);41310;(3, 11, 27, 14, 41310);הנגע;4;14;וכל הולך על כפיו בכל החיה ההלכת על ארבע טמאים הם לכם כל הנגע בנבלתם יטמא עד הערב
(224277, -63, 4);20;כ;156615;(3, 11, 29, 5, 156615);41327;(3, 11, 29, 2, 41327);לכם;2;2;וזה לכם הטמא בשרץ השרץ על הארץ החלד והעכבר והצב למינהו
(224277, -63, 4);400;ת;156678;(3, 11, 30, 24, 156678);41341;(3, 11, 30, 5, 41341);והתנשמת;3;5;והאנקה והכח והלטאה והחמט והתנשמת
(224277, -63, 4);2;ב;156741;(3, 11, 32, 17, 156741);41359;(3, 11, 32, 6, 41359);במתם;1;6;וכל אשר יפל עליו מהם במתם יטמא מכל כלי עץ או בגד או עור או שק כל כלי אשר יעשה מלאכה בהם במים יובא וטמא עד הערב וטהר
(224277, -63, 4);4;ד;156804;(3, 11, 32, 80, 156804);41379;(3, 11, 32, 26, 41379);עד;2;26;וכל אשר יפל עליו מהם במתם יטמא מכל כלי עץ או בגד או עור או שק כל כלי אשר יעשה מלאכה בהם במים יובא וטמא עד הערב וטהר
(224277, -63, 4);1;א;156867;(3, 11, 34, 8, 156867);41398;(3, 11, 34, 3, 41398);אשר;1;3;מכל האכל אשר יאכל אשר יבוא עליו מים יטמא וכל משקה אשר ישתה בכל כלי יטמא
(224277, -63, 4);40;ם;156930;(3, 11, 35, 15, 156930);41415;(3, 11, 35, 4, 41415);מנבלתם;6;4;וכל אשר יפל מנבלתם עליו יטמא תנור וכירים יתץ טמאים הם וטמאים יהיו לכם
(224277, -63, 4);9;ט;156993;(3, 11, 36, 22, 156993);41432;(3, 11, 36, 7, 41432);טהור;1;7;אך מעין ובור מקוה מים יהיה טהור ונגע בנבלתם יטמא
(224277, -63, 4);40;ם;157056;(3, 11, 38, 9, 157056);41449;(3, 11, 38, 3, 41449);מים;3;3;וכי יתן מים על זרע ונפל מנבלתם עליו טמא הוא לכם
(224277, -63, 4);2;ב;157119;(3, 11, 39, 35, 157119);41467;(3, 11, 39, 10, 41467);בנבלתה;3;10;וכי ימות מן הבהמה אשר היא לכם לאכלה הנגע בנבלתה יטמא עד הערב
(224277, -63, 4);10;י;157182;(3, 11, 40, 50, 157182);41482;(3, 11, 40, 12, 41482);בגדיו;4;12;והאכל מנבלתה יכבס בגדיו וטמא עד הערב והנשא את נבלתה יכבס בגדיו וטמא עד הערב
(224277, -63, 4);200;ר;157245;(3, 11, 42, 23, 157245);41502;(3, 11, 42, 8, 41502);ארבע;2;8;כל הולך על גחון וכל הולך על ארבע עד כל מרבה רגלים לכל השרץ השרץ על הארץ לא תאכלום כי שקץ הם
(224277, -63, 4);40;ם;157308;(3, 11, 43, 16, 157308);41520;(3, 11, 43, 4, 41520);נפשתיכם;7;4;אל תשקצו את נפשתיכם בכל השרץ השרץ ולא תטמאו בהם ונטמתם בם
(224277, -63, 4);10;י;157371;(3, 11, 44, 33, 157371);41535;(3, 11, 44, 7, 41535);קדשים;4;7;כי אני יהוה אלהיכם והתקדשתם והייתם קדשים כי קדוש אני ולא תטמאו את נפשתיכם בכל השרץ הרמש על הארץ
(224277, -63, 4);40;מ;157434;(3, 11, 45, 19, 157434);41553;(3, 11, 45, 6, 41553);מארץ;1;6;כי אני יהוה המעלה אתכם מארץ מצרים להית לכם לאלהים והייתם קדשים כי קדוש אני
(224277, -63, 4);80;פ;157497;(3, 11, 46, 22, 157497);41568;(3, 11, 46, 6, 41568);נפש;2;6;זאת תורת הבהמה והעוף וכל נפש החיה הרמשת במים ולכל נפש השרצת על הארץ
(224277, -63, 4);50;נ;157560;(3, 11, 47, 31, 157560);41584;(3, 11, 47, 8, 41584);הנאכלת;2;8;להבדיל בין הטמא ובין הטהר ובין החיה הנאכלת ובין החיה אשר לא תאכל
(224277, -63, 4);7;ז;157623;(3, 12, 2, 24, 157623);41602;(3, 12, 2, 8, 41602);תזריע;2;8;דבר אל בני ישראל לאמר אשה כי תזריע וילדה זכר וטמאה שבעת ימים כימי נדת דותה תטמא
(224277, -63, 4);6;ו;157686;(3, 12, 4, 1, 157686);41617;(3, 12, 4, 1, 41617);ושלשים;1;1;ושלשים יום ושלשת ימים תשב בדמי טהרה בכל קדש לא תגע ואל המקדש לא תבא עד מלאת ימי טהרה
(224277, -63, 4);5;ה;157749;(3, 12, 4, 64, 157749);41635;(3, 12, 4, 19, 41635);טהרה;2;19;ושלשים יום ושלשת ימים תשב בדמי טהרה בכל קדש לא תגע ואל המקדש לא תבא עד מלאת ימי טהרה
(224277, -63, 4);40;מ;157812;(3, 12, 6, 8, 157812);41651;(3, 12, 6, 2, 41651);ימי;2;2;ובמלאת ימי טהרה לבן או לבת תביא כבש בן שנתו לעלה ובן יונה או תר לחטאת אל פתח אהל מועד אל הכהן
(224277, -63, 4);5;ה;157875;(3, 12, 6, 71, 157875);41671;(3, 12, 6, 22, 41671);הכהן;3;22;ובמלאת ימי טהרה לבן או לבת תביא כבש בן שנתו לעלה ובן יונה או תר לחטאת אל פתח אהל מועד אל הכהן
(224277, -63, 4);40;ם;157938;(3, 12, 8, 3, 157938);41686;(3, 12, 8, 1, 41686);ואם;3;1;ואם לא תמצא ידה די שה ולקחה שתי תרים או שני בני יונה אחד לעלה ואחד לחטאת וכפר עליה הכהן וטהרה
(224277, -63, 4);20;כ;158001;(3, 12, 8, 66, 158001);41705;(3, 12, 8, 20, 41705);הכהן;2;20;ואם לא תמצא ידה די שה ולקחה שתי תרים או שני בני יונה אחד לעלה ואחד לחטאת וכפר עליה הכהן וטהרה
(224277, -63, 4);200;ר;158064;(3, 13, 2, 31, 158064);41723;(3, 13, 2, 10, 41723);בהרת;3;10;אדם כי יהיה בעור בשרו שאת או ספחת או בהרת והיה בעור בשרו לנגע צרעת והובא אל אהרן הכהן או אל אחד מבניו הכהנים
(224277, -63, 4);1;א;158127;(3, 13, 3, 9, 158127);41740;(3, 13, 3, 3, 41740);את;1;3;וראה הכהן את הנגע בעור הבשר ושער בנגע הפך לבן ומראה הנגע עמק מעור בשרו נגע צרעת הוא וראהו הכהן וטמא אתו
(224277, -63, 4);5;ה;158190;(3, 13, 3, 72, 158190);41757;(3, 13, 3, 20, 41757);הכהן;1;20;וראה הכהן את הנגע בעור הבשר ושער בנגע הפך לבן ומראה הנגע עמק מעור בשרו נגע צרעת הוא וראהו הכהן וטמא אתו
(224277, -63, 4);6;ו;158253;(3, 13, 4, 53, 158253);41775;(3, 13, 4, 16, 41775);והסגיר;1;16;ואם בהרת לבנה הוא בעור בשרו ועמק אין מראה מן העור ושערה לא הפך לבן והסגיר הכהן את הנגע שבעת ימים
(224277, -63, 4);300;ש;158316;(3, 13, 5, 40, 158316);41790;(3, 13, 5, 10, 41790);פשה;2;10;וראהו הכהן ביום השביעי והנה הנגע עמד בעיניו לא פשה הנגע בעור והסגירו הכהן שבעת ימים שנית
(224277, -63, 4);5;ה;158379;(3, 13, 6, 31, 158379);41805;(3, 13, 6, 8, 41805);כהה;2;8;וראה הכהן אתו ביום השביעי שנית והנה כהה הנגע ולא פשה הנגע בעור וטהרו הכהן מספחת הוא וכבס בגדיו וטהר
(224277, -63, 4);80;פ;158442;(3, 13, 7, 14, 158442);41821;(3, 13, 7, 4, 41821);המספחת;4;4;ואם פשה תפשה המספחת בעור אחרי הראתו אל הכהן לטהרתו ונראה שנית אל הכהן
(224277, -63, 4);8;ח;158505;(3, 13, 8, 21, 158505);41836;(3, 13, 8, 5, 41836);המספחת;5;5;וראה הכהן והנה פשתה המספחת בעור וטמאו הכהן צרעת הוא
(224277, -63, 4);1;א;158568;(3, 13, 10, 14, 158568);41853;(3, 13, 10, 4, 41853);שאת;2;4;וראה הכהן והנה שאת לבנה בעור והיא הפכה שער לבן ומחית בשר חי בשאת
(224277, -63, 4);5;ה;158631;(3, 13, 11, 26, 158631);41870;(3, 13, 11, 7, 41870);הכהן;1;7;צרעת נושנת הוא בעור בשרו וטמאו הכהן לא יסגרנו כי טמא הוא
(224277, -63, 4);1;א;158694;(3, 13, 12, 44, 158694);41887;(3, 13, 12, 12, 41887);מראשו;3;12;ואם פרוח תפרח הצרעת בעור וכסתה הצרעת את כל עור הנגע מראשו ועד רגליו לכל מראה עיני הכהן
(224277, -63, 4);3;ג;158757;(3, 13, 13, 38, 158757);41904;(3, 13, 13, 11, 41904);הנגע;3;11;וראה הכהן והנה כסתה הצרעת את כל בשרו וטהר את הנגע כלו הפך לבן טהור הוא
(224277, -63, 4);300;ש;158820;(3, 13, 15, 25, 158820);41922;(3, 13, 15, 7, 41922);הבשר;3;7;וראה הכהן את הבשר החי וטמאו הבשר החי טמא הוא צרעת הוא
(224277, -63, 4);5;ה;158883;(3, 13, 17, 13, 158883);41940;(3, 13, 17, 3, 41940);והנה;4;3;וראהו הכהן והנה נהפך הנגע ללבן וטהר הכהן את הנגע טהור הוא
(224277, -63, 4);2;ב;158946;(3, 13, 19, 5, 158946);41958;(3, 13, 19, 2, 41958);במקום;1;2;והיה במקום השחין שאת לבנה או בהרת לבנה אדמדמת ונראה אל הכהן
(224277, -63, 4);40;מ;159009;(3, 13, 20, 20, 159009);41974;(3, 13, 20, 6, 41974);מן;1;6;וראה הכהן והנה מראה שפל מן העור ושערה הפך לבן וטמאו הכהן נגע צרעת הוא בשחין פרחה
