(65545, 81, 4);5;ה;150433;(3, 7, 31, 33, 150433);39683;(3, 7, 31, 8, 39683);לאהרן;3;8;והקטיר הכהן את החלב המזבחה והיה החזה לאהרן ולבניו
(65545, 81, 4);300;ש;150514;(3, 7, 33, 38, 150514);39703;(3, 7, 33, 11, 39703);שוק;1;11;המקריב את דם השלמים ואת החלב מבני אהרן לו תהיה שוק הימין למנה
(65545, 81, 4);30;ל;150595;(3, 7, 34, 70, 150595);39723;(3, 7, 34, 18, 39723);ולבניו;2;18;כי את חזה התנופה ואת שוק התרומה לקחתי מאת בני ישראל מזבחי שלמיהם ואתן אתם לאהרן הכהן ולבניו לחק עולם מאת בני ישראל
(65545, 81, 4);5;ה;150676;(3, 7, 36, 10, 150676);39743;(3, 7, 36, 3, 39743);יהוה;4;3;אשר צוה יהוה לתת להם ביום משחו אתם מאת בני ישראל חקת עולם לדרתם
(65545, 81, 4);8;ח;150757;(3, 7, 37, 41, 150757);39762;(3, 7, 37, 8, 39762);ולזבח;5;8;זאת התורה לעלה למנחה ולחטאת ולאשם ולמלואים ולזבח השלמים
(65545, 81, 4);10;י;150838;(3, 8, 1, 6, 150838);39783;(3, 8, 1, 2, 39783);יהוה;1;2;וידבר יהוה אל משה לאמר
(65545, 81, 4);6;ו;150919;(3, 8, 2, 69, 150919);39806;(3, 8, 2, 20, 39806);המצות;4;20;קח את אהרן ואת בניו אתו ואת הבגדים ואת שמן המשחה ואת פר החטאת ואת שני האילים ואת סל המצות
(65545, 81, 4);4;ד;151000;(3, 8, 5, 13, 151000);39830;(3, 8, 5, 4, 39830);העדה;3;4;ויאמר משה אל העדה זה הדבר אשר צוה יהוה לעשות
(65545, 81, 4);2;ב;151081;(3, 8, 7, 26, 151081);39852;(3, 8, 7, 7, 39852);באבנט;3;7;ויתן עליו את הכתנת ויחגר אתו באבנט וילבש אתו את המעיל ויתן עליו את האפד ויחגר אתו בחשב האפד ויאפד לו בו
(65545, 81, 4);1;א;151162;(3, 8, 8, 25, 151162);39875;(3, 8, 8, 8, 39875);את;1;8;וישם עליו את החשן ויתן אל החשן את האורים ואת התמים
(65545, 81, 4);5;ה;151243;(3, 8, 9, 66, 151243);39897;(3, 8, 9, 19, 39897);יהוה;4;19;וישם את המצנפת על ראשו וישם על המצנפת אל מול פניו את ציץ הזהב נזר הקדש כאשר צוה יהוה את משה
(65545, 81, 4);400;ת;151324;(3, 8, 11, 29, 151324);39921;(3, 8, 11, 8, 39921);את;2;8;ויז ממנו על המזבח שבע פעמים וימשח את המזבח ואת כל כליו ואת הכיר ואת כנו לקדשם
(65545, 81, 4);1;א;151405;(3, 8, 13, 14, 151405);39944;(3, 8, 13, 5, 39944);אהרן;1;5;ויקרב משה את בני אהרן וילבשם כתנת ויחגר אתם אבנט ויחבש להם מגבעות כאשר צוה יהוה את משה
(65545, 81, 4);10;י;151486;(3, 8, 14, 26, 151486);39964;(3, 8, 14, 7, 39964);ובניו;4;7;ויגש את פר החטאת ויסמך אהרן ובניו את ידיהם על ראש פר החטאת
(65545, 81, 4);40;ם;151567;(3, 8, 15, 61, 151567);39986;(3, 8, 15, 16, 39986);הדם;3;16;וישחט ויקח משה את הדם ויתן על קרנות המזבח סביב באצבעו ויחטא את המזבח ואת הדם יצק אל יסוד המזבח ויקדשהו לכפר עליו
(65545, 81, 4);6;ו;151648;(3, 8, 16, 52, 151648);40009;(3, 8, 16, 16, 40009);ויקטר;1;16;ויקח את כל החלב אשר על הקרב ואת יתרת הכבד ואת שתי הכלית ואת חלבהן ויקטר משה המזבחה
(65545, 81, 4);5;ה;151729;(3, 8, 18, 11, 151729);40032;(3, 8, 18, 4, 40032);העלה;1;4;ויקרב את איל העלה ויסמכו אהרן ובניו את ידיהם על ראש האיל
(65545, 81, 4);10;י;151810;(3, 8, 20, 18, 151810);40053;(3, 8, 20, 5, 40053);ויקטר;2;5;ואת האיל נתח לנתחיו ויקטר משה את הראש ואת הנתחים ואת הפדר
(65545, 81, 4);200;ר;151891;(3, 8, 21, 53, 151891);40075;(3, 8, 21, 15, 40075);לריח;2;15;ואת הקרב ואת הכרעים רחץ במים ויקטר משה את כל האיל המזבחה עלה הוא לריח ניחח אשה הוא ליהוה כאשר צוה יהוה את משה
(65545, 81, 4);30;ל;151972;(3, 8, 22, 48, 151972);40096;(3, 8, 22, 12, 40096);על;2;12;ויקרב את האיל השני איל המלאים ויסמכו אהרן ובניו את ידיהם על ראש האיל
(65545, 81, 4);200;ר;152053;(3, 8, 24, 4, 152053);40117;(3, 8, 24, 1, 40117);ויקרב;4;1;ויקרב את בני אהרן ויתן משה מן הדם על תנוך אזנם הימנית ועל בהן ידם הימנית ועל בהן רגלם הימנית ויזרק משה את הדם על המזבח סביב
(65545, 81, 4);4;ד;152134;(3, 8, 24, 85, 152134);40140;(3, 8, 24, 24, 40140);הדם;2;24;ויקרב את בני אהרן ויתן משה מן הדם על תנוך אזנם הימנית ועל בהן ידם הימנית ועל בהן רגלם הימנית ויזרק משה את הדם על המזבח סביב
(65545, 81, 4);400;ת;152215;(3, 8, 25, 69, 152215);40163;(3, 8, 25, 20, 40163);ואת;3;20;ויקח את החלב ואת האליה ואת כל החלב אשר על הקרב ואת יתרת הכבד ואת שתי הכלית ואת חלבהן ואת שוק הימין
(65545, 81, 4);10;י;152296;(3, 8, 26, 73, 152296);40186;(3, 8, 26, 21, 40186);הימין;2;21;ומסל המצות אשר לפני יהוה לקח חלת מצה אחת וחלת לחם שמן אחת ורקיק אחד וישם על החלבים ועל שוק הימין
(65545, 81, 4);70;ע;152377;(3, 8, 28, 30, 152377);40208;(3, 8, 28, 8, 40208);על;1;8;ויקח משה אתם מעל כפיהם ויקטר המזבחה על העלה מלאים הם לריח ניחח אשה הוא ליהוה
(65545, 81, 4);5;ה;152458;(3, 8, 29, 50, 152458);40228;(3, 8, 29, 12, 40228);היה;3;12;ויקח משה את החזה ויניפהו תנופה לפני יהוה מאיל המלאים למשה היה למנה כאשר צוה יהוה את משה
(65545, 81, 4);4;ד;152539;(3, 8, 30, 61, 152539);40252;(3, 8, 30, 18, 40252);בגדי;3;18;ויקח משה משמן המשחה ומן הדם אשר על המזבח ויז על אהרן על בגדיו ועל בניו ועל בגדי בניו אתו ויקדש את אהרן את בגדיו ואת בניו ואת בגדי בניו אתו
(65545, 81, 4);8;ח;152620;(3, 8, 31, 34, 152620);40275;(3, 8, 31, 10, 40275);פתח;3;10;ויאמר משה אל אהרן ואל בניו בשלו את הבשר פתח אהל מועד ושם תאכלו אתו ואת הלחם אשר בסל המלאים כאשר צויתי לאמר אהרן ובניו יאכלהו
(65545, 81, 4);2;ב;152701;(3, 8, 32, 16, 152701);40295;(3, 8, 32, 4, 40295);באש;1;4;והנותר בבשר ובלחם באש תשרפו
(65545, 81, 4);6;ו;152782;(3, 8, 34, 10, 152782);40317;(3, 8, 34, 3, 40317);ביום;3;3;כאשר עשה ביום הזה צוה יהוה לעשת לכפר עליכם
(65545, 81, 4);6;ו;152863;(3, 8, 35, 57, 152863);40337;(3, 8, 35, 14, 40337);תמותו;5;14;ופתח אהל מועד תשבו יומם ולילה שבעת ימים ושמרתם את משמרת יהוה ולא תמותו כי כן צויתי
(65545, 81, 4);30;ל;152944;(3, 9, 1, 33, 152944);40359;(3, 9, 1, 8, 40359);ולזקני;2;8;ויהי ביום השמיני קרא משה לאהרן ולבניו ולזקני ישראל
(65545, 81, 4);40;מ;153025;(3, 9, 3, 18, 153025);40380;(3, 9, 3, 5, 40380);לאמר;3;5;ואל בני ישראל תדבר לאמר קחו שעיר עזים לחטאת ועגל וכבש בני שנה תמימם לעלה
(65545, 81, 4);20;כ;153106;(3, 9, 4, 41, 153106);40400;(3, 9, 4, 10, 40400);כי;1;10;ושור ואיל לשלמים לזבח לפני יהוה ומנחה בלולה בשמן כי היום יהוה נראה אליכם
(65545, 81, 4);7;ז;153187;(3, 9, 6, 9, 153187);40422;(3, 9, 6, 3, 40422);זה;1;3;ויאמר משה זה הדבר אשר צוה יהוה תעשו וירא אליכם כבוד יהוה
(65545, 81, 4);80;פ;153268;(3, 9, 7, 45, 153268);40444;(3, 9, 7, 13, 40444);וכפר;3;13;ויאמר משה אל אהרן קרב אל המזבח ועשה את חטאתך ואת עלתך וכפר בעדך ובעד העם ועשה את קרבן העם וכפר בעדם כאשר צוה יהוה
(65545, 81, 4);6;ו;153349;(3, 9, 9, 1, 153349);40467;(3, 9, 9, 1, 40467);ויקרבו;1;1;ויקרבו בני אהרן את הדם אליו ויטבל אצבעו בדם ויתן על קרנות המזבח ואת הדם יצק אל יסוד המזבח
(65545, 81, 4);5;ה;153430;(3, 9, 10, 11, 153430);40489;(3, 9, 10, 4, 40489);הכלית;1;4;ואת החלב ואת הכלית ואת היתרת מן הכבד מן החטאת הקטיר המזבחה כאשר צוה יהוה את משה
(65545, 81, 4);5;ה;153511;(3, 9, 11, 29, 153511);40510;(3, 9, 11, 8, 40510);למחנה;5;8;ואת הבשר ואת העור שרף באש מחוץ למחנה
(65545, 81, 4);300;ש;153592;(3, 9, 13, 30, 153592);40530;(3, 9, 13, 7, 40530);הראש;4;7;ואת העלה המציאו אליו לנתחיה ואת הראש ויקטר על המזבח
(65545, 81, 4);200;ר;153673;(3, 9, 15, 32, 153673);40551;(3, 9, 15, 9, 40551);אשר;3;9;ויקרב את קרבן העם ויקח את שעיר החטאת אשר לעם וישחטהו ויחטאהו כראשון
(65545, 81, 4);40;מ;153754;(3, 9, 17, 37, 153754);40570;(3, 9, 17, 10, 40570);מלבד;1;10;ויקרב את המנחה וימלא כפו ממנה ויקטר על המזבח מלבד עלת הבקר
(65545, 81, 4);2;ב;153835;(3, 9, 18, 71, 153835);40591;(3, 9, 18, 19, 40591);סביב;2;19;וישחט את השור ואת האיל זבח השלמים אשר לעם וימצאו בני אהרן את הדם אליו ויזרקהו על המזבח סביב
(65545, 81, 4);10;י;153916;(3, 9, 20, 31, 153916);40609;(3, 9, 20, 7, 40609);החלבים;5;7;וישימו את החלבים על החזות ויקטר החלבים המזבחה
(65545, 81, 4);40;ם;153997;(3, 9, 22, 24, 153997);40630;(3, 9, 22, 7, 40630);ויברכם;6;7;וישא אהרן את ידו אל העם ויברכם וירד מעשת החטאת והעלה והשלמים
(65545, 81, 4);40;ם;154078;(3, 9, 23, 56, 154078);40651;(3, 9, 23, 16, 40651);העם;3;16;ויבא משה ואהרן אל אהל מועד ויצאו ויברכו את העם וירא כבוד יהוה אל כל העם
(65545, 81, 4);50;נ;154159;(3, 10, 1, 13, 154159);40673;(3, 10, 1, 4, 40673);נדב;1;4;ויקחו בני אהרן נדב ואביהוא איש מחתתו ויתנו בהן אש וישימו עליה קטרת ויקריבו לפני יהוה אש זרה אשר לא צוה אתם
(65545, 81, 4);80;פ;154240;(3, 10, 2, 9, 154240);40694;(3, 10, 2, 3, 40694);מלפני;3;3;ותצא אש מלפני יהוה ותאכל אותם וימתו לפני יהוה
(65545, 81, 4);20;כ;154321;(3, 10, 3, 53, 154321);40716;(3, 10, 3, 16, 40716);אכבד;2;16;ויאמר משה אל אהרן הוא אשר דבר יהוה לאמר בקרבי אקדש ועל פני כל העם אכבד וידם אהרן
(65545, 81, 4);1;א;154402;(3, 10, 4, 71, 154402);40738;(3, 10, 4, 20, 40738);אל;1;20;ויקרא משה אל מישאל ואל אלצפן בני עזיאל דד אהרן ויאמר אלהם קרבו שאו את אחיכם מאת פני הקדש אל מחוץ למחנה
(65545, 81, 4);200;ר;154483;(3, 10, 6, 33, 154483);40757;(3, 10, 6, 8, 40757);ראשיכם;1;8;ויאמר משה אל אהרן ולאלעזר ולאיתמר בניו ראשיכם אל תפרעו ובגדיכם לא תפרמו ולא תמתו ועל כל העדה יקצף ואחיכם כל בית ישראל יבכו את השרפה אשר שרף יהוה
(65545, 81, 4);5;ה;154564;(3, 10, 6, 114, 154564);40778;(3, 10, 6, 29, 40778);יהוה;2;29;ויאמר משה אל אהרן ולאלעזר ולאיתמר בניו ראשיכם אל תפרעו ובגדיכם לא תפרמו ולא תמתו ועל כל העדה יקצף ואחיכם כל בית ישראל יבכו את השרפה אשר שרף יהוה
(65545, 81, 4);20;כ;154645;(3, 10, 9, 6, 154645);40800;(3, 10, 9, 2, 40800);ושכר;3;2;יין ושכר אל תשת אתה ובניך אתך בבאכם אל אהל מועד ולא תמתו חקת עולם לדרתיכם
(65545, 81, 4);1;א;154726;(3, 10, 10, 29, 154726);40821;(3, 10, 10, 7, 40821);הטמא;4;7;ולהבדיל בין הקדש ובין החל ובין הטמא ובין הטהור
(65545, 81, 4);1;א;154807;(3, 10, 12, 26, 154807);40844;(3, 10, 12, 8, 40844);איתמר;1;8;וידבר משה אל אהרן ואל אלעזר ואל איתמר בניו הנותרים קחו את המנחה הנותרת מאשי יהוה ואכלוה מצות אצל המזבח כי קדש קדשים הוא
(65545, 81, 4);40;מ;154888;(3, 10, 13, 11, 154888);40863;(3, 10, 13, 3, 40863);במקום;2;3;ואכלתם אתה במקום קדוש כי חקך וחק בניך הוא מאשי יהוה כי כן צויתי
(65545, 81, 4);6;ו;154969;(3, 10, 14, 42, 154969);40885;(3, 10, 14, 11, 40885);ובניך;1;11;ואת חזה התנופה ואת שוק התרומה תאכלו במקום טהור אתה ובניך ובנתיך אתך כי חקך וחק בניך נתנו מזבחי שלמי בני ישראל
(65545, 81, 4);6;ו;155050;(3, 10, 15, 35, 155050);40904;(3, 10, 15, 8, 40904);יביאו;5;8;שוק התרומה וחזה התנופה על אשי החלבים יביאו להניף תנופה לפני יהוה והיה לך ולבניך אתך לחק עולם כאשר צוה יהוה
(65545, 81, 4);10;י;155131;(3, 10, 16, 30, 155131);40926;(3, 10, 16, 9, 40926);ויקצף;2;9;ואת שעיר החטאת דרש דרש משה והנה שרף ויקצף על אלעזר ועל איתמר בני אהרן הנותרם לאמר
(65545, 81, 4);400;ת;155212;(3, 10, 17, 46, 155212);40947;(3, 10, 17, 13, 40947);נתן;2;13;מדוע לא אכלתם את החטאת במקום הקדש כי קדש קדשים הוא ואתה נתן לכם לשאת את עון העדה לכפר עליהם לפני יהוה
(65545, 81, 4);10;י;155293;(3, 10, 18, 47, 155293);40970;(3, 10, 18, 14, 40970);צויתי;3;14;הן לא הובא את דמה אל הקדש פנימה אכול תאכלו אתה בקדש כאשר צויתי
(65545, 81, 4);10;י;155374;(3, 10, 19, 79, 155374);40990;(3, 10, 19, 20, 40990);הייטב;3;20;וידבר אהרן אל משה הן היום הקריבו את חטאתם ואת עלתם לפני יהוה ותקראנה אתי כאלה ואכלתי חטאת היום הייטב בעיני יהוה
(65545, 81, 4);5;ה;155455;(3, 11, 2, 22, 155455);41011;(3, 11, 2, 7, 41011);החיה;1;7;דברו אל בני ישראל לאמר זאת החיה אשר תאכלו מכל הבהמה אשר על הארץ
(65545, 81, 4);1;א;155536;(3, 11, 4, 10, 155536);41034;(3, 11, 4, 5, 41034);תאכלו;2;5;אך את זה לא תאכלו ממעלי הגרה וממפרסי הפרסה את הגמל כי מעלה גרה הוא ופרסה איננו מפריס טמא הוא לכם
(65545, 81, 4);200;ר;155617;(3, 11, 5, 15, 155617);41055;(3, 11, 5, 5, 41055);גרה;2;5;ואת השפן כי מעלה גרה הוא ופרסה לא יפריס טמא הוא לכם
(65545, 81, 4);80;פ;155698;(3, 11, 7, 12, 155698);41078;(3, 11, 7, 4, 41078);מפריס;2;4;ואת החזיר כי מפריס פרסה הוא ושסע שסע פרסה והוא גרה לא יגר טמא הוא לכם
(65545, 81, 4);5;ה;155779;(3, 11, 9, 4, 155779);41101;(3, 11, 9, 2, 41101);זה;2;2;את זה תאכלו מכל אשר במים כל אשר לו סנפיר וקשקשת במים בימים ובנחלים אתם תאכלו
(65545, 81, 4);10;י;155860;(3, 11, 10, 24, 155860);41122;(3, 11, 10, 7, 41122);בימים;2;7;וכל אשר אין לו סנפיר וקשקשת בימים ובנחלים מכל שרץ המים ומכל נפש החיה אשר במים שקץ הם לכם
(65545, 81, 4);90;צ;155941;(3, 11, 11, 35, 155941);41143;(3, 11, 11, 9, 41143);תשקצו;4;9;ושקץ יהיו לכם מבשרם לא תאכלו ואת נבלתם תשקצו
(65545, 81, 4);5;ה;156022;(3, 11, 13, 46, 156022);41168;(3, 11, 13, 15, 41168);העזניה;1;15;ואת אלה תשקצו מן העוף לא יאכלו שקץ הם את הנשר ואת הפרס ואת העזניה
(65545, 81, 4);6;ו;156103;(3, 11, 17, 8, 156103);41190;(3, 11, 17, 3, 41190);ואת;1;3;ואת הכוס ואת השלך ואת הינשוף
(65545, 81, 4);5;ה;156184;(3, 11, 20, 6, 156184);41210;(3, 11, 20, 3, 41210);העוף;1;3;כל שרץ העוף ההלך על ארבע שקץ הוא לכם
(65545, 81, 4);70;ע;156265;(3, 11, 21, 59, 156265);41234;(3, 11, 21, 18, 41234);על;1;18;אך את זה תאכלו מכל שרץ העוף ההלך על ארבע אשר לא כרעים ממעל לרגליו לנתר בהן על הארץ
(65545, 81, 4);80;ף;156346;(3, 11, 23, 10, 156346);41254;(3, 11, 23, 3, 41254);העוף;4;3;וכל שרץ העוף אשר לו ארבע רגלים שקץ הוא לכם
(65545, 81, 4);1;א;156427;(3, 11, 25, 26, 156427);41275;(3, 11, 25, 6, 41275);וטמא;4;6;וכל הנשא מנבלתם יכבס בגדיו וטמא עד הערב
(65545, 81, 4);30;ל;156508;(3, 11, 27, 3, 156508);41297;(3, 11, 27, 1, 41297);וכל;3;1;וכל הולך על כפיו בכל החיה ההלכת על ארבע טמאים הם לכם כל הנגע בנבלתם יטמא עד הערב
(65545, 81, 4);6;ו;156589;(3, 11, 28, 21, 156589);41319;(3, 11, 28, 5, 41319);בגדיו;5;5;והנשא את נבלתם יכבס בגדיו וטמא עד הערב טמאים המה לכם
(65545, 81, 4);5;ה;156670;(3, 11, 30, 16, 156670);41339;(3, 11, 30, 3, 41339);והלטאה;6;3;והאנקה והכח והלטאה והחמט והתנשמת
(65545, 81, 4);30;ל;156751;(3, 11, 32, 27, 156751);41361;(3, 11, 32, 8, 41361);מכל;3;8;וכל אשר יפל עליו מהם במתם יטמא מכל כלי עץ או בגד או עור או שק כל כלי אשר יעשה מלאכה בהם במים יובא וטמא עד הערב וטהר
(65545, 81, 4);30;ל;156832;(3, 11, 33, 20, 156832);41388;(3, 11, 33, 7, 41388);אל;2;7;וכל כלי חרש אשר יפל מהם אל תוכו כל אשר בתוכו יטמא ואתו תשברו
(65545, 81, 4);9;ט;156913;(3, 11, 34, 54, 156913);41411;(3, 11, 34, 16, 41411);יטמא;2;16;מכל האכל אשר יאכל אשר יבוא עליו מים יטמא וכל משקה אשר ישתה בכל כלי יטמא
(65545, 81, 4);5;ה;156994;(3, 11, 36, 23, 156994);41432;(3, 11, 36, 7, 41432);טהור;2;7;אך מעין ובור מקוה מים יהיה טהור ונגע בנבלתם יטמא
(65545, 81, 4);6;ו;157075;(3, 11, 38, 28, 157075);41454;(3, 11, 38, 8, 41454);עליו;4;8;וכי יתן מים על זרע ונפל מנבלתם עליו טמא הוא לכם
(65545, 81, 4);1;א;157156;(3, 11, 40, 24, 157156);41475;(3, 11, 40, 5, 41475);וטמא;4;5;והאכל מנבלתה יכבס בגדיו וטמא עד הערב והנשא את נבלתה יכבס בגדיו וטמא עד הערב
(65545, 81, 4);30;ל;157237;(3, 11, 42, 15, 157237);41499;(3, 11, 42, 5, 41499);וכל;3;5;כל הולך על גחון וכל הולך על ארבע עד כל מרבה רגלים לכל השרץ השרץ על הארץ לא תאכלום כי שקץ הם
(65545, 81, 4);200;ר;157318;(3, 11, 43, 26, 157318);41523;(3, 11, 43, 7, 41523);השרץ;3;7;אל תשקצו את נפשתיכם בכל השרץ השרץ ולא תטמאו בהם ונטמתם בם
(65545, 81, 4);2;ב;157399;(3, 11, 44, 61, 157399);41543;(3, 11, 44, 15, 41543);בכל;1;15;כי אני יהוה אלהיכם והתקדשתם והייתם קדשים כי קדוש אני ולא תטמאו את נפשתיכם בכל השרץ הרמש על הארץ
(65545, 81, 4);6;ו;157480;(3, 11, 46, 5, 157480);41564;(3, 11, 46, 2, 41564);תורת;2;2;זאת תורת הבהמה והעוף וכל נפש החיה הרמשת במים ולכל נפש השרצת על הארץ
(65545, 81, 4);1;א;157561;(3, 11, 47, 32, 157561);41584;(3, 11, 47, 8, 41584);הנאכלת;3;8;להבדיל בין הטמא ובין הטהר ובין החיה הנאכלת ובין החיה אשר לא תאכל
(65545, 81, 4);70;ע;157642;(3, 12, 2, 43, 157642);41606;(3, 12, 2, 12, 41606);שבעת;3;12;דבר אל בני ישראל לאמר אשה כי תזריע וילדה זכר וטמאה שבעת ימים כימי נדת דותה תטמא
(65545, 81, 4);400;ת;157723;(3, 12, 4, 38, 157723);41627;(3, 12, 4, 11, 41627);תגע;1;11;ושלשים יום ושלשת ימים תשב בדמי טהרה בכל קדש לא תגע ואל המקדש לא תבא עד מלאת ימי טהרה
(65545, 81, 4);5;ה;157804;(3, 12, 5, 53, 157804);41649;(3, 12, 5, 14, 41649);טהרה;4;14;ואם נקבה תלד וטמאה שבעים כנדתה וששים יום וששת ימים תשב על דמי טהרה
(65545, 81, 4);80;פ;157885;(3, 12, 7, 9, 157885);41673;(3, 12, 7, 2, 41673);לפני;2;2;והקריבו לפני יהוה וכפר עליה וטהרה ממקר דמיה זאת תורת הילדת לזכר או לנקבה
(65545, 81, 4);300;ש;157966;(3, 12, 8, 31, 157966);41696;(3, 12, 8, 11, 41696);שני;1;11;ואם לא תמצא ידה די שה ולקחה שתי תרים או שני בני יונה אחד לעלה ואחד לחטאת וכפר עליה הכהן וטהרה
(65545, 81, 4);2;ב;158047;(3, 13, 2, 14, 158047);41718;(3, 13, 2, 5, 41718);בשרו;1;5;אדם כי יהיה בעור בשרו שאת או ספחת או בהרת והיה בעור בשרו לנגע צרעת והובא אל אהרן הכהן או אל אחד מבניו הכהנים
(65545, 81, 4);400;ת;158128;(3, 13, 3, 10, 158128);41740;(3, 13, 3, 3, 41740);את;2;3;וראה הכהן את הנגע בעור הבשר ושער בנגע הפך לבן ומראה הנגע עמק מעור בשרו נגע צרעת הוא וראהו הכהן וטמא אתו
(65545, 81, 4);2;ב;158209;(3, 13, 4, 9, 158209);41762;(3, 13, 4, 3, 41762);לבנה;2;3;ואם בהרת לבנה הוא בעור בשרו ועמק אין מראה מן העור ושערה לא הפך לבן והסגיר הכהן את הנגע שבעת ימים
(65545, 81, 4);5;ה;158290;(3, 13, 5, 14, 158290);41784;(3, 13, 5, 4, 41784);השביעי;1;4;וראהו הכהן ביום השביעי והנה הנגע עמד בעיניו לא פשה הנגע בעור והסגירו הכהן שבעת ימים שנית
(65545, 81, 4);50;נ;158371;(3, 13, 6, 23, 158371);41803;(3, 13, 6, 6, 41803);שנית;2;6;וראה הכהן אתו ביום השביעי שנית והנה כהה הנגע ולא פשה הנגע בעור וטהרו הכהן מספחת הוא וכבס בגדיו וטהר
(65545, 81, 4);10;י;158452;(3, 13, 7, 24, 158452);41823;(3, 13, 7, 6, 41823);אחרי;4;6;ואם פשה תפשה המספחת בעור אחרי הראתו אל הכהן לטהרתו ונראה שנית אל הכהן
(65545, 81, 4);400;ת;158533;(3, 13, 9, 7, 158533);41843;(3, 13, 9, 2, 41843);צרעת;4;2;נגע צרעת כי תהיה באדם והובא אל הכהן
(65545, 81, 4);400;ת;158614;(3, 13, 11, 9, 158614);41865;(3, 13, 11, 2, 41865);נושנת;5;2;צרעת נושנת הוא בעור בשרו וטמאו הכהן לא יסגרנו כי טמא הוא
(65545, 81, 4);300;ש;158695;(3, 13, 12, 45, 158695);41887;(3, 13, 12, 12, 41887);מראשו;4;12;ואם פרוח תפרח הצרעת בעור וכסתה הצרעת את כל עור הנגע מראשו ועד רגליו לכל מראה עיני הכהן
(65545, 81, 4);2;ב;158776;(3, 13, 14, 2, 158776);41910;(3, 13, 14, 1, 41910);וביום;2;1;וביום הראות בו בשר חי יטמא
(65545, 81, 4);20;ך;158857;(3, 13, 16, 20, 158857);41933;(3, 13, 16, 6, 41933);ונהפך;5;6;או כי ישוב הבשר החי ונהפך ללבן ובא אל הכהן
(65545, 81, 4);50;נ;158938;(3, 13, 18, 22, 158938);41956;(3, 13, 18, 7, 41956);ונרפא;2;7;ובשר כי יהיה בו בערו שחין ונרפא
(65545, 81, 4);5;ה;159019;(3, 13, 20, 30, 159019);41976;(3, 13, 20, 8, 41976);ושערה;5;8;וראה הכהן והנה מראה שפל מן העור ושערה הפך לבן וטמאו הכהן נגע צרעת הוא בשחין פרחה
(65545, 81, 4);1;א;159100;(3, 13, 21, 47, 159100);41998;(3, 13, 21, 13, 41998);והיא;4;13;ואם יראנה הכהן והנה אין בה שער לבן ושפלה איננה מן העור והיא כהה והסגירו הכהן שבעת ימים
(65545, 81, 4);5;ה;159181;(3, 13, 23, 28, 159181);42020;(3, 13, 23, 8, 42020);השחין;1;8;ואם תחתיה תעמד הבהרת לא פשתה צרבת השחין הוא וטהרו הכהן
(65545, 81, 4);5;ה;159262;(3, 13, 25, 10, 159262);42041;(3, 13, 25, 3, 42041);הכהן;3;3;וראה אתה הכהן והנה נהפך שער לבן בבהרת ומראה עמק מן העור צרעת הוא במכוה פרחה וטמא אתו הכהן נגע צרעת הוא
(65545, 81, 4);20;כ;159343;(3, 13, 26, 10, 159343);42063;(3, 13, 26, 3, 42063);הכהן;2;3;ואם יראנה הכהן והנה אין בבהרת שער לבן ושפלה איננה מן העור והוא כהה והסגירו הכהן שבעת ימים
(65545, 81, 4);10;י;159424;(3, 13, 27, 19, 159424);42082;(3, 13, 27, 4, 42082);השביעי;6;4;וראהו הכהן ביום השביעי אם פשה תפשה בעור וטמא הכהן אתו נגע צרעת הוא
(65545, 81, 4);9;ט;159505;(3, 13, 28, 47, 159505);42105;(3, 13, 28, 13, 42105);וטהרו;2;13;ואם תחתיה תעמד הבהרת לא פשתה בעור והוא כהה שאת המכוה הוא וטהרו הכהן כי צרבת המכוה הוא
