(121849, -83, 4);5;ה;152642;(3, 8, 31, 56, 152642);40282;(3, 8, 31, 17, 40282);הלחם;1;17;ויאמר משה אל אהרן ואל בניו בשלו את הבשר פתח אהל מועד ושם תאכלו אתו ואת הלחם אשר בסל המלאים כאשר צויתי לאמר אהרן ובניו יאכלהו
(121849, -83, 4);1;א;152725;(3, 8, 33, 17, 152725);40301;(3, 8, 33, 5, 40301);תצאו;3;5;ומפתח אהל מועד לא תצאו שבעת ימים עד יום מלאת ימי מלאיכם כי שבעת ימים ימלא את ידכם
(121849, -83, 4);80;פ;152808;(3, 8, 35, 2, 152808);40324;(3, 8, 35, 1, 40324);ופתח;2;1;ופתח אהל מועד תשבו יומם ולילה שבעת ימים ושמרתם את משמרת יהוה ולא תמותו כי כן צויתי
(121849, -83, 4);4;ד;152891;(3, 8, 36, 19, 152891);40346;(3, 8, 36, 6, 40346);הדברים;2;6;ויעש אהרן ובניו את כל הדברים אשר צוה יהוה ביד משה
(121849, -83, 4);2;ב;152974;(3, 9, 2, 21, 152974);40368;(3, 9, 2, 8, 40368);בקר;1;8;ויאמר אל אהרן קח לך עגל בן בקר לחטאת ואיל לעלה תמימם והקרב לפני יהוה
(121849, -83, 4);400;ת;153057;(3, 9, 3, 50, 153057);40389;(3, 9, 3, 14, 40389);תמימם;1;14;ואל בני ישראל תדבר לאמר קחו שעיר עזים לחטאת ועגל וכבש בני שנה תמימם לעלה
(121849, -83, 4);5;ה;153140;(3, 9, 5, 16, 153140);40409;(3, 9, 5, 5, 40409);משה;3;5;ויקחו את אשר צוה משה אל פני אהל מועד ויקרבו כל העדה ויעמדו לפני יהוה
(121849, -83, 4);5;ה;153223;(3, 9, 6, 45, 153223);40431;(3, 9, 6, 12, 40431);יהוה;4;12;ויאמר משה זה הדבר אשר צוה יהוה תעשו וירא אליכם כבוד יהוה
(121849, -83, 4);90;צ;153306;(3, 9, 7, 83, 153306);40455;(3, 9, 7, 24, 40455);צוה;1;24;ויאמר משה אל אהרן קרב אל המזבח ועשה את חטאתך ואת עלתך וכפר בעדך ובעד העם ועשה את קרבן העם וכפר בעדם כאשר צוה יהוה
(121849, -83, 4);30;ל;153389;(3, 9, 9, 41, 153389);40477;(3, 9, 9, 11, 40477);על;2;11;ויקרבו בני אהרן את הדם אליו ויטבל אצבעו בדם ויתן על קרנות המזבח ואת הדם יצק אל יסוד המזבח
(121849, -83, 4);6;ו;153472;(3, 9, 10, 53, 153472);40499;(3, 9, 10, 14, 40499);צוה;2;14;ואת החלב ואת הכלית ואת היתרת מן הכבד מן החטאת הקטיר המזבחה כאשר צוה יהוה את משה
(121849, -83, 4);40;מ;153555;(3, 9, 12, 44, 153555);40522;(3, 9, 12, 12, 40522);המזבח;2;12;וישחט את העלה וימצאו בני אהרן אליו את הדם ויזרקהו על המזבח סביב
(121849, -83, 4);7;ז;153638;(3, 9, 14, 34, 153638);40542;(3, 9, 14, 9, 40542);המזבחה;3;9;וירחץ את הקרב ואת הכרעים ויקטר על העלה המזבחה
(121849, -83, 4);200;ר;153721;(3, 9, 17, 4, 153721);40561;(3, 9, 17, 1, 40561);ויקרב;4;1;ויקרב את המנחה וימלא כפו ממנה ויקטר על המזבח מלבד עלת הבקר
(121849, -83, 4);2;ב;153804;(3, 9, 18, 40, 153804);40583;(3, 9, 18, 11, 40583);בני;1;11;וישחט את השור ואת האיל זבח השלמים אשר לעם וימצאו בני אהרן את הדם אליו ויזרקהו על המזבח סביב
(121849, -83, 4);10;י;153887;(3, 9, 20, 2, 153887);40603;(3, 9, 20, 1, 40603);וישימו;2;1;וישימו את החלבים על החזות ויקטר החלבים המזבחה
(121849, -83, 4);5;ה;153970;(3, 9, 21, 47, 153970);40622;(3, 9, 21, 12, 40622);צוה;3;12;ואת החזות ואת שוק הימין הניף אהרן תנופה לפני יהוה כאשר צוה משה
(121849, -83, 4);20;כ;154053;(3, 9, 23, 31, 154053);40643;(3, 9, 23, 8, 40643);ויברכו;5;8;ויבא משה ואהרן אל אהל מועד ויצאו ויברכו את העם וירא כבוד יהוה אל כל העם
(121849, -83, 4);10;י;154136;(3, 9, 24, 58, 154136);40667;(3, 9, 24, 16, 40667);ויפלו;2;16;ותצא אש מלפני יהוה ותאכל על המזבח את העלה ואת החלבים וירא כל העם וירנו ויפלו על פניהם
(121849, -83, 4);200;ר;154219;(3, 10, 1, 73, 154219);40687;(3, 10, 1, 18, 40687);זרה;2;18;ויקחו בני אהרן נדב ואביהוא איש מחתתו ויתנו בהן אש וישימו עליה קטרת ויקריבו לפני יהוה אש זרה אשר לא צוה אתם
(121849, -83, 4);200;ר;154302;(3, 10, 3, 34, 154302);40710;(3, 10, 3, 10, 40710);בקרבי;3;10;ויאמר משה אל אהרן הוא אשר דבר יהוה לאמר בקרבי אקדש ועל פני כל העם אכבד וידם אהרן
(121849, -83, 4);1;א;154385;(3, 10, 4, 54, 154385);40733;(3, 10, 4, 15, 40733);את;1;15;ויקרא משה אל מישאל ואל אלצפן בני עזיאל דד אהרן ויאמר אלהם קרבו שאו את אחיכם מאת פני הקדש אל מחוץ למחנה
(121849, -83, 4);30;ל;154468;(3, 10, 6, 18, 154468);40754;(3, 10, 6, 5, 40754);ולאלעזר;4;5;ויאמר משה אל אהרן ולאלעזר ולאיתמר בניו ראשיכם אל תפרעו ובגדיכם לא תפרמו ולא תמתו ועל כל העדה יקצף ואחיכם כל בית ישראל יבכו את השרפה אשר שרף יהוה
(121849, -83, 4);400;ת;154551;(3, 10, 6, 101, 154551);40774;(3, 10, 6, 25, 40774);את;2;25;ויאמר משה אל אהרן ולאלעזר ולאיתמר בניו ראשיכם אל תפרעו ובגדיכם לא תפרמו ולא תמתו ועל כל העדה יקצף ואחיכם כל בית ישראל יבכו את השרפה אשר שרף יהוה
(121849, -83, 4);200;ר;154634;(3, 10, 8, 14, 154634);40797;(3, 10, 8, 4, 40797);אהרן;3;4;וידבר יהוה אל אהרן לאמר
(121849, -83, 4);8;ח;154717;(3, 10, 10, 20, 154717);40819;(3, 10, 10, 5, 40819);החל;2;5;ולהבדיל בין הקדש ובין החל ובין הטמא ובין הטהור
(121849, -83, 4);30;ל;154800;(3, 10, 12, 19, 154800);40842;(3, 10, 12, 6, 40842);אלעזר;2;6;וידבר משה אל אהרן ואל אלעזר ואל איתמר בניו הנותרים קחו את המנחה הנותרת מאשי יהוה ואכלוה מצות אצל המזבח כי קדש קדשים הוא
(121849, -83, 4);40;ם;154883;(3, 10, 13, 6, 154883);40861;(3, 10, 13, 1, 40861);ואכלתם;6;1;ואכלתם אתה במקום קדוש כי חקך וחק בניך הוא מאשי יהוה כי כן צויתי
(121849, -83, 4);1;א;154966;(3, 10, 14, 39, 154966);40884;(3, 10, 14, 10, 40884);אתה;1;10;ואת חזה התנופה ואת שוק התרומה תאכלו במקום טהור אתה ובניך ובנתיך אתך כי חקך וחק בניך נתנו מזבחי שלמי בני ישראל
(121849, -83, 4);1;א;155049;(3, 10, 15, 34, 155049);40904;(3, 10, 15, 8, 40904);יביאו;4;8;שוק התרומה וחזה התנופה על אשי החלבים יביאו להניף תנופה לפני יהוה והיה לך ולבניך אתך לחק עולם כאשר צוה יהוה
(121849, -83, 4);100;ק;155132;(3, 10, 16, 31, 155132);40926;(3, 10, 16, 9, 40926);ויקצף;3;9;ואת שעיר החטאת דרש דרש משה והנה שרף ויקצף על אלעזר ועל איתמר בני אהרן הנותרם לאמר
(121849, -83, 4);20;כ;155215;(3, 10, 17, 49, 155215);40948;(3, 10, 17, 14, 40948);לכם;2;14;מדוע לא אכלתם את החטאת במקום הקדש כי קדש קדשים הוא ואתה נתן לכם לשאת את עון העדה לכפר עליהם לפני יהוה
(121849, -83, 4);4;ד;155298;(3, 10, 19, 3, 155298);40971;(3, 10, 19, 1, 40971);וידבר;3;1;וידבר אהרן אל משה הן היום הקריבו את חטאתם ואת עלתם לפני יהוה ותקראנה אתי כאלה ואכלתי חטאת היום הייטב בעיני יהוה
(121849, -83, 4);10;י;155381;(3, 10, 19, 86, 155381);40991;(3, 10, 19, 21, 40991);בעיני;5;21;וידבר אהרן אל משה הן היום הקריבו את חטאתם ואת עלתם לפני יהוה ותקראנה אתי כאלה ואכלתי חטאת היום הייטב בעיני יהוה
(121849, -83, 4);20;כ;155464;(3, 11, 2, 31, 155464);41013;(3, 11, 2, 9, 41013);תאכלו;3;9;דברו אל בני ישראל לאמר זאת החיה אשר תאכלו מכל הבהמה אשר על הארץ
(121849, -83, 4);200;ר;155547;(3, 11, 4, 21, 155547);41036;(3, 11, 4, 7, 41036);הגרה;3;7;אך את זה לא תאכלו ממעלי הגרה וממפרסי הפרסה את הגמל כי מעלה גרה הוא ופרסה איננו מפריס טמא הוא לכם
(121849, -83, 4);80;פ;155630;(3, 11, 5, 28, 155630);41059;(3, 11, 5, 9, 41059);יפריס;2;9;ואת השפן כי מעלה גרה הוא ופרסה לא יפריס טמא הוא לכם
(121849, -83, 4);300;ש;155713;(3, 11, 7, 27, 155713);41082;(3, 11, 7, 8, 41082);שסע;1;8;ואת החזיר כי מפריס פרסה הוא ושסע שסע פרסה והוא גרה לא יגר טמא הוא לכם
(121849, -83, 4);30;ל;155796;(3, 11, 9, 21, 155796);41106;(3, 11, 9, 7, 41106);כל;2;7;את זה תאכלו מכל אשר במים כל אשר לו סנפיר וקשקשת במים בימים ובנחלים אתם תאכלו
(121849, -83, 4);10;י;155879;(3, 11, 10, 43, 155879);41126;(3, 11, 10, 11, 41126);המים;3;11;וכל אשר אין לו סנפיר וקשקשת בימים ובנחלים מכל שרץ המים ומכל נפש החיה אשר במים שקץ הם לכם
(121849, -83, 4);300;ש;155962;(3, 11, 12, 20, 155962);41149;(3, 11, 12, 6, 41149);וקשקשת;5;6;כל אשר אין לו סנפיר וקשקשת במים שקץ הוא לכם
(121849, -83, 4);50;נ;156045;(3, 11, 14, 18, 156045);41173;(3, 11, 14, 5, 41173);למינה;4;5;ואת הדאה ואת האיה למינה
(121849, -83, 4);6;ו;156128;(3, 11, 18, 10, 156128);41196;(3, 11, 18, 3, 41196);ואת;1;3;ואת התנשמת ואת הקאת ואת הרחם
(121849, -83, 4);7;ז;156211;(3, 11, 21, 5, 156211);41219;(3, 11, 21, 3, 41219);זה;1;3;אך את זה תאכלו מכל שרץ העוף ההלך על ארבע אשר לא כרעים ממעל לרגליו לנתר בהן על הארץ
(121849, -83, 4);50;נ;156294;(3, 11, 22, 24, 156294);41242;(3, 11, 22, 7, 41242);למינו;4;7;את אלה מהם תאכלו את הארבה למינו ואת הסלעם למינהו ואת החרגל למינהו ואת החגב למינהו
(121849, -83, 4);40;מ;156377;(3, 11, 24, 8, 156377);41263;(3, 11, 24, 2, 41263);תטמאו;3;2;ולאלה תטמאו כל הנגע בנבלתם יטמא עד הערב
(121849, -83, 4);70;ע;156460;(3, 11, 26, 27, 156460);41284;(3, 11, 26, 7, 41284);ושסע;4;7;לכל הבהמה אשר הוא מפרסת פרסה ושסע איננה שסעת וגרה איננה מעלה טמאים הם לכם כל הנגע בהם יטמא
(121849, -83, 4);40;ם;156543;(3, 11, 27, 38, 156543);41307;(3, 11, 27, 11, 41307);הם;2;11;וכל הולך על כפיו בכל החיה ההלכת על ארבע טמאים הם לכם כל הנגע בנבלתם יטמא עד הערב
(121849, -83, 4);300;ש;156626;(3, 11, 29, 16, 156626);41330;(3, 11, 29, 5, 41330);השרץ;2;5;וזה לכם הטמא בשרץ השרץ על הארץ החלד והעכבר והצב למינהו
(121849, -83, 4);5;ה;156709;(3, 11, 31, 27, 156709);41349;(3, 11, 31, 8, 41349);בהם;2;8;אלה הטמאים לכם בכל השרץ כל הנגע בהם במתם יטמא עד הערב
(121849, -83, 4);40;מ;156792;(3, 11, 32, 68, 156792);41376;(3, 11, 32, 23, 41376);במים;2;23;וכל אשר יפל עליו מהם במתם יטמא מכל כלי עץ או בגד או עור או שק כל כלי אשר יעשה מלאכה בהם במים יובא וטמא עד הערב וטהר
(121849, -83, 4);300;ש;156875;(3, 11, 34, 16, 156875);41400;(3, 11, 34, 5, 41400);אשר;2;5;מכל האכל אשר יאכל אשר יבוא עליו מים יטמא וכל משקה אשר ישתה בכל כלי יטמא
(121849, -83, 4);40;ם;156958;(3, 11, 35, 43, 156958);41422;(3, 11, 35, 11, 41422);הם;2;11;וכל אשר יפל מנבלתם עליו יטמא תנור וכירים יתץ טמאים הם וטמאים יהיו לכם
(121849, -83, 4);9;ט;157041;(3, 11, 37, 31, 157041);41445;(3, 11, 37, 10, 41445);טהור;1;10;וכי יפל מנבלתם על כל זרע זרוע אשר יזרע טהור הוא
(121849, -83, 4);9;ט;157124;(3, 11, 39, 40, 157124);41468;(3, 11, 39, 11, 41468);יטמא;2;11;וכי ימות מן הבהמה אשר היא לכם לאכלה הנגע בנבלתה יטמא עד הערב
(121849, -83, 4);5;ה;157207;(3, 11, 41, 14, 157207);41490;(3, 11, 41, 5, 41490);הארץ;1;5;וכל השרץ השרץ על הארץ שקץ הוא לא יאכל
(121849, -83, 4);90;ץ;157290;(3, 11, 42, 68, 157290);41515;(3, 11, 42, 21, 41515);שקץ;3;21;כל הולך על גחון וכל הולך על ארבע עד כל מרבה רגלים לכל השרץ השרץ על הארץ לא תאכלום כי שקץ הם
(121849, -83, 4);20;כ;157373;(3, 11, 44, 35, 157373);41536;(3, 11, 44, 8, 41536);כי;1;8;כי אני יהוה אלהיכם והתקדשתם והייתם קדשים כי קדוש אני ולא תטמאו את נפשתיכם בכל השרץ הרמש על הארץ
(121849, -83, 4);6;ו;157456;(3, 11, 45, 41, 157456);41558;(3, 11, 45, 11, 41558);והייתם;1;11;כי אני יהוה המעלה אתכם מארץ מצרים להית לכם לאלהים והייתם קדשים כי קדוש אני
(121849, -83, 4);5;ה;157539;(3, 11, 47, 10, 157539);41579;(3, 11, 47, 3, 41579);הטמא;1;3;להבדיל בין הטמא ובין הטהר ובין החיה הנאכלת ובין החיה אשר לא תאכל
(121849, -83, 4);400;ת;157622;(3, 12, 2, 23, 157622);41602;(3, 12, 2, 8, 41602);תזריע;1;8;דבר אל בני ישראל לאמר אשה כי תזריע וילדה זכר וטמאה שבעת ימים כימי נדת דותה תטמא
(121849, -83, 4);300;ש;157705;(3, 12, 4, 20, 157705);41621;(3, 12, 4, 5, 41621);תשב;2;5;ושלשים יום ושלשת ימים תשב בדמי טהרה בכל קדש לא תגע ואל המקדש לא תבא עד מלאת ימי טהרה
(121849, -83, 4);400;ת;157788;(3, 12, 5, 37, 157788);41644;(3, 12, 5, 9, 41644);וששת;4;9;ואם נקבה תלד וטמאה שבעים כנדתה וששים יום וששת ימים תשב על דמי טהרה
(121849, -83, 4);1;א;157871;(3, 12, 6, 67, 157871);41670;(3, 12, 6, 21, 41670);אל;1;21;ובמלאת ימי טהרה לבן או לבת תביא כבש בן שנתו לעלה ובן יונה או תר לחטאת אל פתח אהל מועד אל הכהן
(121849, -83, 4);100;ק;157954;(3, 12, 8, 19, 157954);41692;(3, 12, 8, 7, 41692);ולקחה;3;7;ואם לא תמצא ידה די שה ולקחה שתי תרים או שני בני יונה אחד לעלה ואחד לחטאת וכפר עליה הכהן וטהרה
(121849, -83, 4);20;כ;158037;(3, 13, 2, 4, 158037);41715;(3, 13, 2, 2, 41715);כי;1;2;אדם כי יהיה בעור בשרו שאת או ספחת או בהרת והיה בעור בשרו לנגע צרעת והובא אל אהרן הכהן או אל אחד מבניו הכהנים
(121849, -83, 4);200;ר;158120;(3, 13, 3, 2, 158120);41738;(3, 13, 3, 1, 41738);וראה;2;1;וראה הכהן את הנגע בעור הבשר ושער בנגע הפך לבן ומראה הנגע עמק מעור בשרו נגע צרעת הוא וראהו הכהן וטמא אתו
(121849, -83, 4);40;ם;158203;(3, 13, 4, 3, 158203);41760;(3, 13, 4, 1, 41760);ואם;3;1;ואם בהרת לבנה הוא בעור בשרו ועמק אין מראה מן העור ושערה לא הפך לבן והסגיר הכהן את הנגע שבעת ימים
(121849, -83, 4);2;ב;158286;(3, 13, 5, 10, 158286);41783;(3, 13, 5, 3, 41783);ביום;1;3;וראהו הכהן ביום השביעי והנה הנגע עמד בעיניו לא פשה הנגע בעור והסגירו הכהן שבעת ימים שנית
(121849, -83, 4);10;י;158369;(3, 13, 6, 21, 158369);41802;(3, 13, 6, 5, 41802);השביעי;6;5;וראה הכהן אתו ביום השביעי שנית והנה כהה הנגע ולא פשה הנגע בעור וטהרו הכהן מספחת הוא וכבס בגדיו וטהר
(121849, -83, 4);10;י;158452;(3, 13, 7, 24, 158452);41823;(3, 13, 7, 6, 41823);אחרי;4;6;ואם פשה תפשה המספחת בעור אחרי הראתו אל הכהן לטהרתו ונראה שנית אל הכהן
(121849, -83, 4);10;י;158535;(3, 13, 9, 9, 158535);41844;(3, 13, 9, 3, 41844);כי;2;3;נגע צרעת כי תהיה באדם והובא אל הכהן
(121849, -83, 4);2;ב;158618;(3, 13, 11, 13, 158618);41867;(3, 13, 11, 4, 41867);בעור;1;4;צרעת נושנת הוא בעור בשרו וטמאו הכהן לא יסגרנו כי טמא הוא
(121849, -83, 4);3;ג;158701;(3, 13, 12, 51, 158701);41889;(3, 13, 12, 14, 41889);רגליו;2;14;ואם פרוח תפרח הצרעת בעור וכסתה הצרעת את כל עור הנגע מראשו ועד רגליו לכל מראה עיני הכהן
(121849, -83, 4);400;ת;158784;(3, 13, 14, 10, 158784);41911;(3, 13, 14, 2, 41911);הראות;5;2;וביום הראות בו בשר חי יטמא
(121849, -83, 4);5;ה;158867;(3, 13, 16, 30, 158867);41937;(3, 13, 16, 10, 41937);הכהן;1;10;או כי ישוב הבשר החי ונהפך ללבן ובא אל הכהן
(121849, -83, 4);40;ם;158950;(3, 13, 19, 9, 158950);41958;(3, 13, 19, 2, 41958);במקום;5;2;והיה במקום השחין שאת לבנה או בהרת לבנה אדמדמת ונראה אל הכהן
(121849, -83, 4);5;ה;159033;(3, 13, 20, 44, 159033);41980;(3, 13, 20, 12, 41980);הכהן;3;12;וראה הכהן והנה מראה שפל מן העור ושערה הפך לבן וטמאו הכהן נגע צרעת הוא בשחין פרחה
(121849, -83, 4);2;ב;159116;(3, 13, 21, 63, 159116);42002;(3, 13, 21, 17, 42002);שבעת;2;17;ואם יראנה הכהן והנה אין בה שער לבן ושפלה איננה מן העור והיא כהה והסגירו הכהן שבעת ימים
(121849, -83, 4);6;ו;159199;(3, 13, 24, 2, 159199);42024;(3, 13, 24, 1, 42024);או;2;1;או בשר כי יהיה בערו מכות אש והיתה מחית המכוה בהרת לבנה אדמדמת או לבנה
(121849, -83, 4);400;ת;159282;(3, 13, 25, 30, 159282);42046;(3, 13, 25, 8, 42046);בבהרת;5;8;וראה אתה הכהן והנה נהפך שער לבן בבהרת ומראה עמק מן העור צרעת הוא במכוה פרחה וטמא אתו הכהן נגע צרעת הוא
(121849, -83, 4);300;ש;159365;(3, 13, 26, 32, 159365);42069;(3, 13, 26, 9, 42069);ושפלה;2;9;ואם יראנה הכהן והנה אין בבהרת שער לבן ושפלה איננה מן העור והוא כהה והסגירו הכהן שבעת ימים
(121849, -83, 4);6;ו;159448;(3, 13, 27, 43, 159448);42089;(3, 13, 27, 11, 42089);אתו;3;11;וראהו הכהן ביום השביעי אם פשה תפשה בעור וטמא הכהן אתו נגע צרעת הוא
(121849, -83, 4);1;א;159531;(3, 13, 29, 5, 159531);42112;(3, 13, 29, 2, 42112);או;1;2;ואיש או אשה כי יהיה בו נגע בראש או בזקן
(121849, -83, 4);5;ה;159614;(3, 13, 30, 58, 159614);42138;(3, 13, 30, 18, 42138);הוא;1;18;וראה הכהן את הנגע והנה מראהו עמק מן העור ובו שער צהב דק וטמא אתו הכהן נתק הוא צרעת הראש או הזקן הוא
(121849, -83, 4);1;א;159697;(3, 13, 31, 64, 159697);42162;(3, 13, 31, 19, 42162);את;1;19;וכי יראה הכהן את נגע הנתק והנה אין מראהו עמק מן העור ושער שחר אין בו והסגיר הכהן את נגע הנתק שבעת ימים
(121849, -83, 4);40;מ;159780;(3, 13, 32, 67, 159780);42186;(3, 13, 32, 20, 42186);מן;1;20;וראה הכהן את הנגע ביום השביעי והנה לא פשה הנתק ולא היה בו שער צהב ומראה הנתק אין עמק מן העור
(121849, -83, 4);80;פ;159863;(3, 13, 34, 31, 159863);42208;(3, 13, 34, 9, 42208);פשה;1;9;וראה הכהן את הנתק ביום השביעי והנה לא פשה הנתק בעור ומראהו איננו עמק מן העור וטהר אתו הכהן וכבס בגדיו וטהר
(121849, -83, 4);200;ר;159946;(3, 13, 36, 2, 159946);42229;(3, 13, 36, 1, 42229);וראהו;2;1;וראהו הכהן והנה פשה הנתק בעור לא יבקר הכהן לשער הצהב טמא הוא
(121849, -83, 4);9;ט;160029;(3, 13, 37, 37, 160029);42252;(3, 13, 37, 11, 42252);טהור;1;11;ואם בעיניו עמד הנתק ושער שחר צמח בו נרפא הנתק טהור הוא וטהרו הכהן
(121849, -83, 4);2;ב;160112;(3, 13, 39, 33, 160112);42274;(3, 13, 39, 9, 42274);בהק;1;9;וראה הכהן והנה בעור בשרם בהרת כהות לבנת בהק הוא פרח בעור טהור הוא
(121849, -83, 4);5;ה;160195;(3, 13, 42, 5, 160195);42298;(3, 13, 42, 2, 42298);יהיה;2;2;וכי יהיה בקרחת או בגבחת נגע לבן אדמדם צרעת פרחת הוא בקרחתו או בגבחתו
(121849, -83, 4);2;ב;160278;(3, 13, 43, 33, 160278);42319;(3, 13, 43, 9, 42319);בקרחתו;1;9;וראה אתו הכהן והנה שאת הנגע לבנה אדמדמת בקרחתו או בגבחתו כמראה צרעת עור בשר
(121849, -83, 4);3;ג;160361;(3, 13, 45, 17, 160361);42340;(3, 13, 45, 5, 42340);בגדיו;2;5;והצרוע אשר בו הנגע בגדיו יהיו פרמים וראשו יהיה פרוע ועל שפם יעטה וטמא טמא יקרא
(121849, -83, 4);8;ח;160444;(3, 13, 46, 37, 160444);42363;(3, 13, 46, 12, 42363);למחנה;3;12;כל ימי אשר הנגע בו יטמא טמא הוא בדד ישב מחוץ למחנה מושבו
(121849, -83, 4);20;כ;160527;(3, 13, 48, 38, 160527);42386;(3, 13, 48, 11, 42386);מלאכת;4;11;או בשתי או בערב לפשתים ולצמר או בעור או בכל מלאכת עור
(121849, -83, 4);5;ה;160610;(3, 13, 50, 5, 160610);42411;(3, 13, 50, 2, 42411);הכהן;1;2;וראה הכהן את הנגע והסגיר את הנגע שבעת ימים
(121849, -83, 4);30;ל;160693;(3, 13, 51, 54, 160693);42434;(3, 13, 51, 16, 42434);לכל;3;16;וראה את הנגע ביום השביעי כי פשה הנגע בבגד או בשתי או בערב או בעור לכל אשר יעשה העור למלאכה צרעת ממארת הנגע טמא הוא
(121849, -83, 4);10;י;160776;(3, 13, 52, 47, 160776);42459;(3, 13, 52, 16, 42459);כלי;3;16;ושרף את הבגד או את השתי או את הערב בצמר או בפשתים או את כל כלי העור אשר יהיה בו הנגע כי צרעת ממארת הוא באש תשרף
(121849, -83, 4);30;ל;160859;(3, 13, 53, 45, 160859);42484;(3, 13, 53, 14, 42484);בכל;3;14;ואם יראה הכהן והנה לא פשה הנגע בבגד או בשתי או בערב או בכל כלי עור
(121849, -83, 4);3;ג;160942;(3, 13, 55, 34, 160942);42507;(3, 13, 55, 10, 42507);הנגע;3;10;וראה הכהן אחרי הכבס את הנגע והנה לא הפך הנגע את עינו והנגע לא פשה טמא הוא באש תשרפנו פחתת הוא בקרחתו או בגבחתו
(121849, -83, 4);1;א;161025;(3, 13, 56, 30, 161025);42530;(3, 13, 56, 9, 42530);אתו;1;9;ואם ראה הכהן והנה כהה הנגע אחרי הכבס אתו וקרע אתו מן הבגד או מן העור או מן השתי או מן הערב
(121849, -83, 4);1;א;161108;(3, 13, 57, 44, 161108);42557;(3, 13, 57, 14, 42557);הוא;3;14;ואם תראה עוד בבגד או בשתי או בערב או בכל כלי עור פרחת הוא באש תשרפנו את אשר בו הנגע
(121849, -83, 4);200;ר;161191;(3, 13, 59, 6, 161191);42582;(3, 13, 59, 2, 42582);תורת;3;2;זאת תורת נגע צרעת בגד הצמר או הפשתים או השתי או הערב או כל כלי עור לטהרו או לטמאו
(121849, -83, 4);400;ת;161274;(3, 14, 2, 8, 161274);42607;(3, 14, 2, 3, 42607);תורת;1;3;זאת תהיה תורת המצרע ביום טהרתו והובא אל הכהן
(121849, -83, 4);5;ה;161357;(3, 14, 4, 5, 161357);42628;(3, 14, 4, 2, 42628);הכהן;1;2;וצוה הכהן ולקח למטהר שתי צפרים חיות טהרות ועץ ארז ושני תולעת ואזב
(121849, -83, 4);10;י;161440;(3, 14, 5, 35, 161440);42650;(3, 14, 5, 11, 42650);מים;2;11;וצוה הכהן ושחט את הצפור האחת אל כלי חרש על מים חיים
(121849, -83, 4);5;ה;161523;(3, 14, 6, 78, 161523);42674;(3, 14, 6, 23, 42674);המים;1;23;את הצפר החיה יקח אתה ואת עץ הארז ואת שני התולעת ואת האזב וטבל אותם ואת הצפר החיה בדם הצפר השחטה על המים החיים
(121849, -83, 4);1;א;161606;(3, 14, 8, 21, 161606);42696;(3, 14, 8, 6, 42696);את;1;6;וכבס המטהר את בגדיו וגלח את כל שערו ורחץ במים וטהר ואחר יבוא אל המחנה וישב מחוץ לאהלו שבעת ימים
(121849, -83, 4);400;ת;161689;(3, 14, 9, 28, 161689);42718;(3, 14, 9, 8, 42718);את;2;8;והיה ביום השביעי יגלח את כל שערו את ראשו ואת זקנו ואת גבת עיניו ואת כל שערו יגלח וכבס את בגדיו ורחץ את בשרו במים וטהר
