(164051, -94, 4);100;ק;225997;(4, 22, 14, 3, 225997);59598;(4, 22, 14, 1, 59598);ויקומו;3;1;ויקומו שרי מואב ויבאו אל בלק ויאמרו מאן בלעם הלך עמנו
(164051, -94, 4);1;א;226091;(4, 22, 16, 22, 226091);59623;(4, 22, 16, 7, 59623);אמר;1;7;ויבאו אל בלעם ויאמרו לו כה אמר בלק בן צפור אל נא תמנע מהלך אלי
(164051, -94, 4);10;י;226185;(4, 22, 18, 19, 226185);59652;(4, 22, 18, 5, 59652);עבדי;4;5;ויען בלעם ויאמר אל עבדי בלק אם יתן לי בלק מלא ביתו כסף וזהב לא אוכל לעבר את פי יהוה אלהי לעשות קטנה או גדולה
(164051, -94, 4);5;ה;226279;(4, 22, 19, 29, 226279);59681;(4, 22, 19, 9, 59681);מה;2;9;ועתה שבו נא בזה גם אתם הלילה ואדעה מה יסף יהוה דבר עמי
(164051, -94, 4);100;ק;226373;(4, 22, 21, 3, 226373);59709;(4, 22, 21, 1, 59709);ויקם;3;1;ויקם בלעם בבקר ויחבש את אתנו וילך עם שרי מואב
(164051, -94, 4);10;י;226467;(4, 22, 22, 61, 226467);59735;(4, 22, 22, 17, 59735);ושני;4;17;ויחר אף אלהים כי הולך הוא ויתיצב מלאך יהוה בדרך לשטן לו והוא רכב על אתנו ושני נעריו עמו
(164051, -94, 4);6;ו;226561;(4, 22, 24, 1, 226561);59760;(4, 22, 24, 1, 59760);ויעמד;1;1;ויעמד מלאך יהוה במשעול הכרמים גדר מזה וגדר מזה
(164051, -94, 4);20;כ;226655;(4, 22, 25, 57, 226655);59784;(4, 22, 25, 16, 59784);להכתה;3;16;ותרא האתון את מלאך יהוה ותלחץ אל הקיר ותלחץ את רגל בלעם אל הקיר ויסף להכתה
(164051, -94, 4);30;ל;226749;(4, 22, 27, 39, 226749);59808;(4, 22, 27, 11, 59808);בלעם;2;11;ותרא האתון את מלאך יהוה ותרבץ תחת בלעם ויחר אף בלעם ויך את האתון במקל
(164051, -94, 4);2;ב;226843;(4, 22, 29, 23, 226843);59833;(4, 22, 29, 6, 59833);בי;1;6;ויאמר בלעם לאתון כי התעללת בי לו יש חרב בידי כי עתה הרגתיך
(164051, -94, 4);20;כ;226937;(4, 22, 30, 71, 226937);59859;(4, 22, 30, 19, 59859);כה;1;19;ותאמר האתון אל בלעם הלוא אנכי אתנך אשר רכבת עלי מעודך עד היום הזה ההסכן הסכנתי לעשות לך כה ויאמר לא
(164051, -94, 4);30;ל;227031;(4, 22, 32, 19, 227031);59883;(4, 22, 32, 5, 59883);על;2;5;ויאמר אליו מלאך יהוה על מה הכית את אתנך זה שלוש רגלים הנה אנכי יצאתי לשטן כי ירט הדרך לנגדי
(164051, -94, 4);20;כ;227125;(4, 22, 33, 41, 227125);59909;(4, 22, 33, 11, 59909);כי;1;11;ותראני האתון ותט לפני זה שלש רגלים אולי נטתה מפני כי עתה גם אתכה הרגתי ואותה החייתי
(164051, -94, 4);6;ו;227219;(4, 22, 34, 68, 227219);59934;(4, 22, 34, 19, 59934);אשובה;3;19;ויאמר בלעם אל מלאך יהוה חטאתי כי לא ידעתי כי אתה נצב לקראתי בדרך ועתה אם רע בעיניך אשובה לי
(164051, -94, 4);6;ו;227313;(4, 22, 36, 17, 227313);59962;(4, 22, 36, 6, 59962);ויצא;1;6;וישמע בלק כי בא בלעם ויצא לקראתו אל עיר מואב אשר על גבול ארנן אשר בקצה הגבול
(164051, -94, 4);50;נ;227407;(4, 22, 37, 51, 227407);59988;(4, 22, 37, 15, 59988);האמנם;4;15;ויאמר בלק אל בלעם הלא שלח שלחתי אליך לקרא לך למה לא הלכת אלי האמנם לא אוכל כבדך
(164051, -94, 4);100;ק;227501;(4, 22, 39, 13, 227501);60014;(4, 22, 39, 4, 60014);בלק;3;4;וילך בלעם עם בלק ויבאו קרית חצות
(164051, -94, 4);5;ה;227595;(4, 22, 41, 44, 227595);60038;(4, 22, 41, 12, 60038);קצה;3;12;ויהי בבקר ויקח בלק את בלעם ויעלהו במות בעל וירא משם קצה העם
(164051, -94, 4);6;ו;227689;(4, 23, 2, 33, 227689);60065;(4, 23, 2, 10, 60065);ואיל;1;10;ויעש בלק כאשר דבר בלעם ויעל בלק ובלעם פר ואיל במזבח
(164051, -94, 4);30;ל;227783;(4, 23, 4, 13, 227783);60088;(4, 23, 4, 4, 60088);בלעם;2;4;ויקר אלהים אל בלעם ויאמר אליו את שבעת המזבחת ערכתי ואעל פר ואיל במזבח
(164051, -94, 4);50;נ;227877;(4, 23, 6, 13, 227877);60113;(4, 23, 6, 4, 60113);נצב;1;4;וישב אליו והנה נצב על עלתו הוא וכל שרי מואב
(164051, -94, 4);1;א;227971;(4, 23, 8, 7, 227971);60140;(4, 23, 8, 3, 60140);לא;2;3;מה אקב לא קבה אל ומה אזעם לא זעם יהוה
(164051, -94, 4);200;ר;228065;(4, 23, 10, 20, 228065);60167;(4, 23, 10, 7, 60167);רבע;1;7;מי מנה עפר יעקב ומספר את רבע ישראל תמת נפשי מות ישרים ותהי אחריתי כמהו
(164051, -94, 4);1;א;228159;(4, 23, 12, 12, 228159);60191;(4, 23, 12, 3, 60191);הלא;3;3;ויען ויאמר הלא את אשר ישים יהוה בפי אתו אשמר לדבר
(164051, -94, 4);10;י;228253;(4, 23, 13, 67, 228253);60219;(4, 23, 13, 20, 60219);לי;2;20;ויאמר אליו בלק לך נא אתי אל מקום אחר אשר תראנו משם אפס קצהו תראה וכלו לא תראה וקבנו לי משם
(164051, -94, 4);5;ה;228347;(4, 23, 16, 6, 228347);60245;(4, 23, 16, 2, 60245);יהוה;2;2;ויקר יהוה אל בלעם וישם דבר בפיו ויאמר שוב אל בלק וכה תדבר
(164051, -94, 4);1;א;228441;(4, 23, 18, 4, 228441);60272;(4, 23, 18, 1, 60272);וישא;4;1;וישא משלו ויאמר קום בלק ושמע האזינה עדי בנו צפר
(164051, -94, 4);8;ח;228535;(4, 23, 20, 9, 228535);60298;(4, 23, 20, 3, 60298);לקחתי;3;3;הנה ברך לקחתי וברך ולא אשיבנה
(164051, -94, 4);10;י;228629;(4, 23, 23, 2, 228629);60322;(4, 23, 23, 1, 60322);כי;2;1;כי לא נחש ביעקב ולא קסם בישראל כעת יאמר ליעקב ולישראל מה פעל אל
(164051, -94, 4);40;ם;228723;(4, 23, 24, 46, 228723);60348;(4, 23, 24, 13, 60348);חללים;5;13;הן עם כלביא יקום וכארי יתנשא לא ישכב עד יאכל טרף ודם חללים ישתה
(164051, -94, 4);70;ע;228817;(4, 23, 26, 52, 228817);60376;(4, 23, 26, 15, 60376);אעשה;2;15;ויען בלעם ויאמר אל בלק הלא דברתי אליך לאמר כל אשר ידבר יהוה אתו אעשה
(164051, -94, 4);10;י;228911;(4, 23, 28, 31, 228911);60402;(4, 23, 28, 9, 60402);פני;3;9;ויקח בלק את בלעם ראש הפעור הנשקף על פני הישימן
(164051, -94, 4);7;ז;229005;(4, 23, 30, 31, 229005);60428;(4, 23, 30, 9, 60428);במזבח;3;9;ויעש בלק כאשר אמר בלעם ויעל פר ואיל במזבח
(164051, -94, 4);1;א;229099;(4, 24, 2, 20, 229099);60453;(4, 24, 2, 6, 60453);את;1;6;וישא בלעם את עיניו וירא את ישראל שכן לשבטיו ותהי עליו רוח אלהים
(164051, -94, 4);10;י;229193;(4, 24, 4, 22, 229193);60478;(4, 24, 4, 7, 60478);שדי;3;7;נאם שמע אמרי אל אשר מחזה שדי יחזה נפל וגלוי עינים
(164051, -94, 4);40;ם;229287;(4, 24, 7, 6, 229287);60501;(4, 24, 7, 2, 60501);מים;3;2;יזל מים מדליו וזרעו במים רבים וירם מאגג מלכו ותנשא מלכתו
(164051, -94, 4);6;ו;229381;(4, 24, 8, 54, 229381);60522;(4, 24, 8, 12, 60522);וחציו;5;12;אל מוציאו ממצרים כתועפת ראם לו יאכל גוים צריו ועצמתיהם יגרם וחציו ימחץ
(164051, -94, 4);2;ב;229475;(4, 24, 10, 46, 229475);60547;(4, 24, 10, 14, 60547);איבי;3;14;ויחר אף בלק אל בלעם ויספק את כפיו ויאמר בלק אל בלעם לקב איבי קראתיך והנה ברכת ברך זה שלש פעמים
(164051, -94, 4);1;א;229569;(4, 24, 12, 20, 229569);60573;(4, 24, 12, 7, 60573);אל;1;7;ויאמר בלעם אל בלק הלא גם אל מלאכיך אשר שלחת אלי דברתי לאמר
(164051, -94, 4);10;י;229663;(4, 24, 13, 68, 229663);60601;(4, 24, 13, 22, 60601);יהוה;1;22;אם יתן לי בלק מלא ביתו כסף וזהב לא אוכל לעבר את פי יהוה לעשות טובה או רעה מלבי אשר ידבר יהוה אתו אדבר
(164051, -94, 4);3;ג;229757;(4, 24, 15, 32, 229757);60625;(4, 24, 15, 9, 60625);הגבר;2;9;וישא משלו ויאמר נאם בלעם בנו בער ונאם הגבר שתם העין
(164051, -94, 4);6;ו;229851;(4, 24, 17, 37, 229851);60650;(4, 24, 17, 10, 60650);וקם;1;10;אראנו ולא עתה אשורנו ולא קרוב דרך כוכב מיעקב וקם שבט מישראל ומחץ פאתי מואב וקרקר כל בני שת
(164051, -94, 4);10;י;229945;(4, 24, 19, 18, 229945);60673;(4, 24, 19, 4, 60673);שריד;3;4;וירד מיעקב והאביד שריד מעיר
(164051, -94, 4);30;ל;230039;(4, 24, 21, 40, 230039);60696;(4, 24, 21, 10, 60696);בסלע;3;10;וירא את הקיני וישא משלו ויאמר איתן מושבך ושים בסלע קנך
(164051, -94, 4);10;י;230133;(4, 24, 24, 35, 230133);60724;(4, 24, 24, 10, 60724);עדי;3;10;וצים מיד כתים וענו אשור וענו עבר וגם הוא עדי אבד
(164051, -94, 4);50;ן;230227;(4, 25, 2, 20, 230227);60747;(4, 25, 2, 4, 60747);אלהיהן;6;4;ותקראן לעם לזבחי אלהיהן ויאכל העם וישתחוו לאלהיהן
(164051, -94, 4);10;י;230321;(4, 25, 4, 38, 230321);60771;(4, 25, 4, 12, 60771);ליהוה;2;12;ויאמר יהוה אל משה קח את כל ראשי העם והוקע אותם ליהוה נגד השמש וישב חרון אף יהוה מישראל
(164051, -94, 4);1;א;230415;(4, 25, 6, 18, 230415);60794;(4, 25, 6, 5, 60794);בא;2;5;והנה איש מבני ישראל בא ויקרב אל אחיו את המדינית לעיני משה ולעיני כל עדת בני ישראל והמה בכים פתח אהל מועד
(164051, -94, 4);100;ק;230509;(4, 25, 7, 29, 230509);60819;(4, 25, 7, 8, 60819);ויקם;3;8;וירא פינחס בן אלעזר בן אהרן הכהן ויקם מתוך העדה ויקח רמח בידו
(164051, -94, 4);300;ש;230603;(4, 25, 8, 74, 230603);60845;(4, 25, 8, 21, 60845);ישראל;2;21;ויבא אחר איש ישראל אל הקבה וידקר את שניהם את איש ישראל ואת האשה אל קבתה ותעצר המגפה מעל בני ישראל
(164051, -94, 4);2;ב;230697;(4, 25, 11, 44, 230697);60869;(4, 25, 11, 13, 60869);בקנאו;1;13;פינחס בן אלעזר בן אהרן הכהן השיב את חמתי מעל בני ישראל בקנאו את קנאתי בתוכם ולא כליתי את בני ישראל בקנאתי
(164051, -94, 4);6;ו;230791;(4, 25, 13, 28, 230791);60893;(4, 25, 13, 7, 60893);עולם;2;7;והיתה לו ולזרעו אחריו ברית כהנת עולם תחת אשר קנא לאלהיו ויכפר על בני ישראל
(164051, -94, 4);5;ה;230885;(4, 25, 15, 7, 230885);60918;(4, 25, 15, 2, 60918);האשה;4;2;ושם האשה המכה המדינית כזבי בת צור ראש אמות בית אב במדין הוא
(164051, -94, 4);2;ב;230979;(4, 25, 18, 13, 230979);60944;(4, 25, 18, 5, 60944);בנכליהם;1;5;כי צררים הם לכם בנכליהם אשר נכלו לכם על דבר פעור ועל דבר כזבי בת נשיא מדין אחתם המכה ביום המגפה על דבר פעור
(164051, -94, 4);1;א;231073;(4, 26, 1, 10, 231073);60969;(4, 26, 1, 3, 60969);אל;1;3;ויאמר יהוה אל משה ואל אלעזר בן אהרן הכהן לאמר
(164051, -94, 4);6;ו;231167;(4, 26, 3, 9, 231167);60996;(4, 26, 3, 3, 60996);ואלעזר;1;3;וידבר משה ואלעזר הכהן אתם בערבת מואב על ירדן ירחו לאמר
(164051, -94, 4);6;ו;231261;(4, 26, 5, 3, 231261);61019;(4, 26, 5, 1, 61019);ראובן;3;1;ראובן בכור ישראל בני ראובן חנוך משפחת החנכי לפלוא משפחת הפלאי
(164051, -94, 4);50;נ;231355;(4, 26, 7, 14, 231355);61038;(4, 26, 7, 3, 61038);הראובני;6;3;אלה משפחת הראובני ויהיו פקדיהם שלשה וארבעים אלף ושבע מאות ושלשים
(164051, -94, 4);10;י;231449;(4, 26, 9, 41, 231449);61058;(4, 26, 9, 9, 61058);קרואי;5;9;ובני אליאב נמואל ודתן ואבירם הוא דתן ואבירם קרואי העדה אשר הצו על משה ועל אהרן בעדת קרח בהצתם על יהוה
(164051, -94, 4);400;ת;231543;(4, 26, 10, 54, 231543);61085;(4, 26, 10, 15, 61085);ומאתים;4;15;ותפתח הארץ את פיה ותבלע אתם ואת קרח במות העדה באכל האש את חמשים ומאתים איש ויהיו לנס
(164051, -94, 4);8;ח;231637;(4, 26, 13, 4, 231637);61105;(4, 26, 13, 1, 61105);לזרח;4;1;לזרח משפחת הזרחי לשאול משפחת השאולי
(164051, -94, 4);80;פ;231731;(4, 26, 15, 35, 231731);61125;(4, 26, 15, 8, 61125);משפחת;3;8;בני גד למשפחתם לצפון משפחת הצפוני לחגי משפחת החגי לשוני משפחת השוני
(164051, -94, 4);3;ג;231825;(4, 26, 18, 12, 231825);61145;(4, 26, 18, 4, 61145);גד;1;4;אלה משפחת בני גד לפקדיהם ארבעים אלף וחמש מאות
(164051, -94, 4);30;ל;231919;(4, 26, 20, 35, 231919);61167;(4, 26, 20, 8, 61167);לפרץ;1;8;ויהיו בני יהודה למשפחתם לשלה משפחת השלני לפרץ משפחת הפרצי לזרח משפחת הזרחי
(164051, -94, 4);6;ו;232013;(4, 26, 22, 24, 232013);61187;(4, 26, 22, 6, 61187);ושבעים;1;6;אלה משפחת יהודה לפקדיהם ששה ושבעים אלף וחמש מאות
(164051, -94, 4);5;ה;232107;(4, 26, 25, 3, 232107);61206;(4, 26, 25, 1, 61206);אלה;3;1;אלה משפחת יששכר לפקדיהם ארבעה וששים אלף ושלש מאות
(164051, -94, 4);5;ה;232201;(4, 26, 26, 56, 232201);61226;(4, 26, 26, 12, 61226);היחלאלי;1;12;בני זבולן למשפחתם לסרד משפחת הסרדי לאלון משפחת האלני ליחלאל משפחת היחלאלי
(164051, -94, 4);10;י;232295;(4, 26, 29, 27, 232295);61245;(4, 26, 29, 6, 61245);ומכיר;4;6;בני מנשה למכיר משפחת המכירי ומכיר הוליד את גלעד לגלעד משפחת הגלעדי
(164051, -94, 4);300;ש;232389;(4, 26, 31, 25, 232389);61265;(4, 26, 31, 5, 61265);משפחת;2;5;ואשריאל משפחת האשראלי ושכם משפחת השכמי
(164051, -94, 4);5;ה;232483;(4, 26, 33, 54, 232483);61288;(4, 26, 33, 16, 61288);חגלה;4;16;וצלפחד בן חפר לא היו לו בנים כי אם בנות ושם בנות צלפחד מחלה ונעה חגלה מלכה ותרצה
(164051, -94, 4);5;ה;232577;(4, 26, 35, 45, 232577);61309;(4, 26, 35, 10, 61309);הבכרי;1;10;אלה בני אפרים למשפחתם לשותלח משפחת השתלחי לבכר משפחת הבכרי לתחן משפחת התחני
(164051, -94, 4);10;י;232671;(4, 26, 37, 50, 232671);61330;(4, 26, 37, 12, 61330);בני;3;12;אלה משפחת בני אפרים לפקדיהם שנים ושלשים אלף וחמש מאות אלה בני יוסף למשפחתם
(164051, -94, 4);6;ו;232765;(4, 26, 39, 20, 232765);61348;(4, 26, 39, 4, 61348);לחופם;3;4;לשפופם משפחת השופמי לחופם משפחת החופמי
(164051, -94, 4);1;א;232859;(4, 26, 41, 37, 232859);61368;(4, 26, 41, 8, 61368);אלף;1;8;אלה בני בנימן למשפחתם ופקדיהם חמשה וארבעים אלף ושש מאות
(164051, -94, 4);2;ב;232953;(4, 26, 43, 37, 232953);61389;(4, 26, 43, 8, 61389);וארבע;4;8;כל משפחת השוחמי לפקדיהם ארבעה וששים אלף וארבע מאות
(164051, -94, 4);1;א;233047;(4, 26, 45, 29, 233047);61408;(4, 26, 45, 6, 61408);למלכיאל;6;6;לבני בריעה לחבר משפחת החברי למלכיאל משפחת המלכיאלי
(164051, -94, 4);400;ת;233141;(4, 26, 48, 26, 233141);61429;(4, 26, 48, 5, 61429);משפחת;5;5;בני נפתלי למשפחתם ליחצאל משפחת היחצאלי לגוני משפחת הגוני
(164051, -94, 4);200;ר;233235;(4, 26, 50, 44, 233235);61448;(4, 26, 50, 9, 61448);וארבע;3;9;אלה משפחת נפתלי למשפחתם ופקדיהם חמשה וארבעים אלף וארבע מאות
(164051, -94, 4);200;ר;233329;(4, 26, 54, 2, 233329);61472;(4, 26, 54, 1, 61472);לרב;2;1;לרב תרבה נחלתו ולמעט תמעיט נחלתו איש לפי פקדיו יתן נחלתו
(164051, -94, 4);8;ח;233423;(4, 26, 56, 15, 233423);61496;(4, 26, 56, 5, 61496);נחלתו;2;5;על פי הגורל תחלק נחלתו בין רב למעט
(164051, -94, 4);400;ת;233517;(4, 26, 58, 16, 233517);61516;(4, 26, 58, 4, 61516);משפחת;5;4;אלה משפחת לוי משפחת הלבני משפחת החברני משפחת המחלי משפחת המושי משפחת הקרחי וקהת הולד את עמרם
(164051, -94, 4);10;י;233611;(4, 26, 59, 34, 233611);61539;(4, 26, 59, 10, 61539);ללוי;4;10;ושם אשת עמרם יוכבד בת לוי אשר ילדה אתה ללוי במצרים ותלד לעמרם את אהרן ואת משה ואת מרים אחתם
(164051, -94, 4);100;ק;233705;(4, 26, 61, 17, 233705);61563;(4, 26, 61, 4, 61563);בהקריבם;3;4;וימת נדב ואביהוא בהקריבם אש זרה לפני יהוה
(164051, -94, 4);2;ב;233799;(4, 26, 62, 77, 233799);61589;(4, 26, 62, 22, 61589);בתוך;1;22;ויהיו פקדיהם שלשה ועשרים אלף כל זכר מבן חדש ומעלה כי לא התפקדו בתוך בני ישראל כי לא נתן להם נחלה בתוך בני ישראל
(164051, -94, 4);200;ר;233893;(4, 26, 64, 26, 233893);61613;(4, 26, 64, 7, 61613);ואהרן;4;7;ובאלה לא היה איש מפקודי משה ואהרן הכהן אשר פקדו את בני ישראל במדבר סיני
(164051, -94, 4);400;ת;233987;(4, 27, 1, 2, 233987);61641;(4, 27, 1, 1, 61641);ותקרבנה;2;1;ותקרבנה בנות צלפחד בן חפר בן גלעד בן מכיר בן מנשה למשפחת מנשה בן יוסף ואלה שמות בנתיו מחלה נעה וחגלה ומלכה ותרצה
(164051, -94, 4);50;נ;234081;(4, 27, 2, 6, 234081);61664;(4, 27, 2, 1, 61664);ותעמדנה;6;1;ותעמדנה לפני משה ולפני אלעזר הכהן ולפני הנשיאם וכל העדה פתח אהל מועד לאמר
(164051, -94, 4);5;ה;234175;(4, 27, 3, 40, 234175);61688;(4, 27, 3, 11, 61688);יהוה;2;11;אבינו מת במדבר והוא לא היה בתוך העדה הנועדים על יהוה בעדת קרח כי בחטאו מת ובנים לא היו לו
(164051, -94, 4);1;א;234269;(4, 27, 5, 9, 234269);61716;(4, 27, 5, 3, 61716);את;1;3;ויקרב משה את משפטן לפני יהוה
(164051, -94, 4);30;ל;234363;(4, 27, 7, 62, 234363);61741;(4, 27, 7, 17, 61741);להן;1;17;כן בנות צלפחד דברת נתן תתן להם אחזת נחלה בתוך אחי אביהם והעברת את נחלת אביהן להן
(164051, -94, 4);10;י;234457;(4, 27, 10, 11, 234457);61768;(4, 27, 10, 4, 61768);אחים;3;4;ואם אין לו אחים ונתתם את נחלתו לאחי אביו
(164051, -94, 4);40;מ;234551;(4, 27, 11, 73, 234551);61791;(4, 27, 11, 18, 61791);משפט;1;18;ואם אין אחים לאביו ונתתם את נחלתו לשארו הקרב אליו ממשפחתו וירש אתה והיתה לבני ישראל לחקת משפט כאשר צוה יהוה את משה
(164051, -94, 4);40;מ;234645;(4, 27, 13, 19, 234645);61817;(4, 27, 13, 5, 61817);עמיך;2;5;וראיתה אתה ונאספת אל עמיך גם אתה כאשר נאסף אהרן אחיך
(164051, -94, 4);40;מ;234739;(4, 27, 15, 6, 234739);61841;(4, 27, 15, 2, 61841);משה;1;2;וידבר משה אל יהוה לאמר
(164051, -94, 4);10;י;234833;(4, 27, 17, 50, 234833);61865;(4, 27, 17, 12, 61865);תהיה;3;12;אשר יצא לפניהם ואשר יבא לפניהם ואשר יוציאם ואשר יביאם ולא תהיה עדת יהוה כצאן אשר אין להם רעה
(164051, -94, 4);30;ל;234927;(4, 27, 19, 15, 234927);61894;(4, 27, 19, 4, 61894);אלעזר;2;4;והעמדת אתו לפני אלעזר הכהן ולפני כל העדה וצויתה אתו לעיניהם
(164051, -94, 4);6;ו;235021;(4, 27, 21, 24, 235021);61916;(4, 27, 21, 6, 61916);לו;2;6;ולפני אלעזר הכהן יעמד ושאל לו במשפט האורים לפני יהוה על פיו יצאו ועל פיו יבאו הוא וכל בני ישראל אתו וכל העדה
(164051, -94, 4);70;ע;235115;(4, 27, 22, 32, 235115);61942;(4, 27, 22, 9, 61942);יהושע;5;9;ויעש משה כאשר צוה יהוה אתו ויקח את יהושע ויעמדהו לפני אלעזר הכהן ולפני כל העדה
(164051, -94, 4);10;י;235209;(4, 28, 2, 7, 235209);61967;(4, 28, 2, 3, 61967);בני;3;3;צו את בני ישראל ואמרת אלהם את קרבני לחמי לאשי ריח ניחחי תשמרו להקריב לי במועדו
(164051, -94, 4);50;נ;235303;(4, 28, 3, 38, 235303);61990;(4, 28, 3, 10, 61990);שנה;2;10;ואמרת להם זה האשה אשר תקריבו ליהוה כבשים בני שנה תמימם שנים ליום עלה תמיד
(164051, -94, 4);10;י;235397;(4, 28, 5, 32, 235397);62013;(4, 28, 5, 7, 62013);כתית;3;7;ועשירית האיפה סלת למנחה בלולה בשמן כתית רביעת ההין
(164051, -94, 4);300;ש;235491;(4, 28, 8, 9, 235491);62037;(4, 28, 8, 3, 62037);השני;2;3;ואת הכבש השני תעשה בין הערבים כמנחת הבקר וכנסכו תעשה אשה ריח ניחח ליהוה
(164051, -94, 4);5;ה;235585;(4, 28, 9, 45, 235585);62059;(4, 28, 9, 11, 62059);מנחה;4;11;וביום השבת שני כבשים בני שנה תמימם ושני עשרנים סלת מנחה בלולה בשמן ונסכו
(164051, -94, 4);50;נ;235679;(4, 28, 11, 54, 235679);62082;(4, 28, 11, 13, 62082);בני;2;13;ובראשי חדשיכם תקריבו עלה ליהוה פרים בני בקר שנים ואיל אחד כבשים בני שנה שבעה תמימם
(164051, -94, 4);400;ת;235773;(4, 28, 13, 13, 235773);62104;(4, 28, 13, 3, 62104);סלת;3;3;ועשרן עשרון סלת מנחה בלולה בשמן לכבש האחד עלה ריח ניחח אשה ליהוה
(164051, -94, 4);400;ת;235867;(4, 28, 14, 55, 235867);62127;(4, 28, 14, 13, 62127);זאת;3;13;ונסכיהם חצי ההין יהיה לפר ושלישת ההין לאיל ורביעת ההין לכבש יין זאת עלת חדש בחדשו לחדשי השנה
(164051, -94, 4);5;ה;235961;(4, 28, 16, 33, 235961);62150;(4, 28, 16, 8, 62150);ליהוה;3;8;ובחדש הראשון בארבעה עשר יום לחדש פסח ליהוה
(164051, -94, 4);10;י;236055;(4, 28, 19, 21, 236055);62174;(4, 28, 19, 5, 62174);פרים;3;5;והקרבתם אשה עלה ליהוה פרים בני בקר שנים ואיל אחד ושבעה כבשים בני שנה תמימם יהיו לכם
(164051, -94, 4);300;ש;236149;(4, 28, 20, 48, 236149);62197;(4, 28, 20, 11, 62197);תעשו;3;11;ומנחתם סלת בלולה בשמן שלשה עשרנים לפר ושני עשרנים לאיל תעשו
(164051, -94, 4);300;ש;236243;(4, 28, 24, 7, 236243);62220;(4, 28, 24, 2, 62220);תעשו;3;2;כאלה תעשו ליום שבעת ימים לחם אשה ריח ניחח ליהוה על עולת התמיד יעשה ונסכו
(164051, -94, 4);6;ו;236337;(4, 28, 26, 1, 236337);62245;(4, 28, 26, 1, 62245);וביום;1;1;וביום הבכורים בהקריבכם מנחה חדשה ליהוה בשבעתיכם מקרא קדש יהיה לכם כל מלאכת עבדה לא תעשו
(164051, -94, 4);6;ו;236431;(4, 28, 27, 23, 236431);62265;(4, 28, 27, 5, 62265);ליהוה;4;5;והקרבתם עולה לריח ניחח ליהוה פרים בני בקר שנים איל אחד שבעה כבשים בני שנה
(164051, -94, 4);70;ע;236525;(4, 28, 29, 6, 236525);62289;(4, 28, 29, 2, 62289);עשרון;1;2;עשרון עשרון לכבש האחד לשבעת הכבשים
(164051, -94, 4);70;ע;236619;(4, 29, 1, 10, 236619);62309;(4, 29, 1, 2, 62309);השביעי;5;2;ובחדש השביעי באחד לחדש מקרא קדש יהיה לכם כל מלאכת עבדה לא תעשו יום תרועה יהיה לכם
(164051, -94, 4);20;כ;236713;(4, 29, 2, 39, 236713);62336;(4, 29, 2, 12, 62336);כבשים;1;12;ועשיתם עלה לריח ניחח ליהוה פר בן בקר אחד איל אחד כבשים בני שנה שבעה תמימם
(164051, -94, 4);70;ע;236807;(4, 29, 5, 3, 236807);62357;(4, 29, 5, 1, 62357);ושעיר;3;1;ושעיר עזים אחד חטאת לכפר עליכם
(164051, -94, 4);5;ה;236901;(4, 29, 7, 11, 236901);62378;(4, 29, 7, 3, 62378);השביעי;1;3;ובעשור לחדש השביעי הזה מקרא קדש יהיה לכם ועניתם את נפשתיכם כל מלאכה לא תעשו
(164051, -94, 4);2;ב;236995;(4, 29, 8, 44, 236995);62403;(4, 29, 8, 13, 62403);בני;1;13;והקרבתם עלה ליהוה ריח ניחח פר בן בקר אחד איל אחד כבשים בני שנה שבעה תמימם יהיו לכם
(164051, -94, 4);20;כ;237089;(4, 29, 10, 25, 237089);62425;(4, 29, 10, 6, 62425);הכבשים;2;6;עשרון עשרון לכבש האחד לשבעת הכבשים
(164051, -94, 4);40;מ;237183;(4, 29, 12, 39, 237183);62447;(4, 29, 12, 11, 62447);מלאכת;1;11;ובחמשה עשר יום לחדש השביעי מקרא קדש יהיה לכם כל מלאכת עבדה לא תעשו וחגתם חג ליהוה שבעת ימים
