(45349, 61, 4);30;ל;79509;(2, 2, 10, 29, 79509);20985;(2, 2, 10, 8, 20985);לבן;1;8;ויגדל הילד ותבאהו לבת פרעה ויהי לה לבן ותקרא שמו משה ותאמר כי מן המים משיתהו
(45349, 61, 4);10;י;79570;(2, 2, 11, 29, 79570);21001;(2, 2, 11, 8, 21001);אחיו;3;8;ויהי בימים ההם ויגדל משה ויצא אל אחיו וירא בסבלתם וירא איש מצרי מכה איש עברי מאחיו
(45349, 61, 4);20;ך;79631;(2, 2, 12, 24, 79631);21018;(2, 2, 12, 8, 21018);ויך;3;8;ויפן כה וכה וירא כי אין איש ויך את המצרי ויטמנהו בחול
(45349, 61, 4);30;ל;79692;(2, 2, 13, 43, 79692);21033;(2, 2, 13, 11, 21033);למה;1;11;ויצא ביום השני והנה שני אנשים עברים נצים ויאמר לרשע למה תכה רעך
(45349, 61, 4);10;י;79753;(2, 2, 14, 53, 79753);21049;(2, 2, 14, 14, 21049);המצרי;5;14;ויאמר מי שמך לאיש שר ושפט עלינו הלהרגני אתה אמר כאשר הרגת את המצרי ויירא משה ויאמר אכן נודע הדבר
(45349, 61, 4);8;ח;79814;(2, 2, 15, 37, 79814);21065;(2, 2, 15, 10, 21065);ויברח;5;10;וישמע פרעה את הדבר הזה ויבקש להרג את משה ויברח משה מפני פרעה וישב בארץ מדין וישב על הבאר
(45349, 61, 4);5;ה;79875;(2, 2, 16, 28, 79875);21080;(2, 2, 16, 6, 21080);ותדלנה;6;6;ולכהן מדין שבע בנות ותבאנה ותדלנה ותמלאנה את הרהטים להשקות צאן אביהן
(45349, 61, 4);10;י;79936;(2, 2, 17, 32, 79936);21093;(2, 2, 17, 7, 21093);וישק;2;7;ויבאו הרעים ויגרשום ויקם משה ויושען וישק את צאנם
(45349, 61, 4);90;צ;79997;(2, 2, 19, 15, 79997);21108;(2, 2, 19, 4, 21108);הצילנו;2;4;ותאמרן איש מצרי הצילנו מיד הרעים וגם דלה דלה לנו וישק את הצאן
(45349, 61, 4);1;א;80058;(2, 2, 20, 27, 80058);21125;(2, 2, 20, 8, 21125);את;1;8;ויאמר אל בנתיו ואיו למה זה עזבתן את האיש קראן לו ויאכל לחם
(45349, 61, 4);6;ו;80119;(2, 2, 22, 7, 80119);21143;(2, 2, 22, 3, 21143);ויקרא;1;3;ותלד בן ויקרא את שמו גרשם כי אמר גר הייתי בארץ נכריה
(45349, 61, 4);200;ר;80180;(2, 2, 23, 27, 80180);21159;(2, 2, 23, 7, 21159);מצרים;3;7;ויהי בימים הרבים ההם וימת מלך מצרים ויאנחו בני ישראל מן העבדה ויזעקו ותעל שועתם אל האלהים מן העבדה
(45349, 61, 4);5;ה;80241;(2, 2, 24, 8, 80241);21173;(2, 2, 24, 2, 21173);אלהים;3;2;וישמע אלהים את נאקתם ויזכר אלהים את בריתו את אברהם את יצחק ואת יעקב
(45349, 61, 4);10;י;80302;(2, 2, 25, 15, 80302);21190;(2, 2, 25, 5, 21190);ישראל;1;5;וירא אלהים את בני ישראל וידע אלהים
(45349, 61, 4);2;ב;80363;(2, 3, 1, 48, 80363);21206;(2, 3, 1, 14, 21206);המדבר;4;14;ומשה היה רעה את צאן יתרו חתנו כהן מדין וינהג את הצאן אחר המדבר ויבא אל הר האלהים חרבה
(45349, 61, 4);5;ה;80424;(2, 3, 2, 42, 80424);21222;(2, 3, 2, 11, 21222);הסנה;4;11;וירא מלאך יהוה אליו בלבת אש מתוך הסנה וירא והנה הסנה בער באש והסנה איננו אכל
(45349, 61, 4);70;ע;80485;(2, 3, 3, 42, 80485);21239;(2, 3, 3, 12, 21239);יבער;3;12;ויאמר משה אסרה נא ואראה את המראה הגדל הזה מדוע לא יבער הסנה
(45349, 61, 4);5;ה;80546;(2, 3, 4, 56, 80546);21255;(2, 3, 4, 15, 21255);הנני;1;15;וירא יהוה כי סר לראות ויקרא אליו אלהים מתוך הסנה ויאמר משה משה ויאמר הנני
(45349, 61, 4);5;ה;80607;(2, 3, 5, 58, 80607);21272;(2, 3, 5, 17, 21272);הוא;1;17;ויאמר אל תקרב הלם של נעליך מעל רגליך כי המקום אשר אתה עומד עליו אדמת קדש הוא
(45349, 61, 4);200;ר;80668;(2, 3, 6, 59, 80668);21287;(2, 3, 6, 15, 21287);ירא;2;15;ויאמר אנכי אלהי אביך אלהי אברהם אלהי יצחק ואלהי יעקב ויסתר משה פניו כי ירא מהביט אל האלהים
(45349, 61, 4);10;י;80729;(2, 3, 7, 47, 80729);21302;(2, 3, 7, 12, 21302);שמעתי;5;12;ויאמר יהוה ראה ראיתי את עני עמי אשר במצרים ואת צעקתם שמעתי מפני נגשיו כי ידעתי את מכאביו
(45349, 61, 4);30;ל;80790;(2, 3, 8, 37, 80790);21317;(2, 3, 8, 9, 21317);אל;2;9;וארד להצילו מיד מצרים ולהעלתו מן הארץ ההוא אל ארץ טובה ורחבה אל ארץ זבת חלב ודבש אל מקום הכנעני והחתי והאמרי והפרזי והחוי והיבוסי
(45349, 61, 4);10;י;80851;(2, 3, 8, 98, 80851);21332;(2, 3, 8, 24, 21332);והחוי;5;24;וארד להצילו מיד מצרים ולהעלתו מן הארץ ההוא אל ארץ טובה ורחבה אל ארץ זבת חלב ודבש אל מקום הכנעני והחתי והאמרי והפרזי והחוי והיבוסי
(45349, 61, 4);400;ת;80912;(2, 3, 9, 54, 80912);21348;(2, 3, 9, 15, 21348);אתם;2;15;ועתה הנה צעקת בני ישראל באה אלי וגם ראיתי את הלחץ אשר מצרים לחצים אתם
(45349, 61, 4);40;מ;80973;(2, 3, 11, 17, 80973);21364;(2, 3, 11, 5, 21364);מי;1;5;ויאמר משה אל האלהים מי אנכי כי אלך אל פרעה וכי אוציא את בני ישראל ממצרים
(45349, 61, 4);1;א;81034;(2, 3, 12, 21, 81034);21382;(2, 3, 12, 7, 21382);האות;2;7;ויאמר כי אהיה עמך וזה לך האות כי אנכי שלחתיך בהוציאך את העם ממצרים תעבדון את האלהים על ההר הזה
(45349, 61, 4);300;ש;81095;(2, 3, 13, 7, 81095);21397;(2, 3, 13, 2, 21397);משה;2;2;ויאמר משה אל האלהים הנה אנכי בא אל בני ישראל ואמרתי להם אלהי אבותיכם שלחני אליכם ואמרו לי מה שמו מה אמר אלהם
(45349, 61, 4);40;מ;81156;(2, 3, 13, 68, 81156);21412;(2, 3, 13, 17, 21412);ואמרו;3;17;ויאמר משה אל האלהים הנה אנכי בא אל בני ישראל ואמרתי להם אלהי אבותיכם שלחני אליכם ואמרו לי מה שמו מה אמר אלהם
(45349, 61, 4);300;ש;81217;(2, 3, 14, 43, 81217);21430;(2, 3, 14, 12, 21430);ישראל;2;12;ויאמר אלהים אל משה אהיה אשר אהיה ויאמר כה תאמר לבני ישראל אהיה שלחני אליכם
(45349, 61, 4);2;ב;81278;(2, 3, 15, 44, 81278);21446;(2, 3, 15, 13, 21446);אבתיכם;2;13;ויאמר עוד אלהים אל משה כה תאמר אל בני ישראל יהוה אלהי אבתיכם אלהי אברהם אלהי יצחק ואלהי יעקב שלחני אליכם זה שמי לעלם וזה זכרי לדר דר
(45349, 61, 4);200;ר;81339;(2, 3, 15, 105, 81339);21461;(2, 3, 15, 28, 21461);דר;2;28;ויאמר עוד אלהים אל משה כה תאמר אל בני ישראל יהוה אלהי אבתיכם אלהי אברהם אלהי יצחק ואלהי יעקב שלחני אליכם זה שמי לעלם וזה זכרי לדר דר
(45349, 61, 4);100;ק;81400;(2, 3, 16, 61, 81400);21476;(2, 3, 16, 15, 21476);יצחק;4;15;לך ואספת את זקני ישראל ואמרת אלהם יהוה אלהי אבתיכם נראה אלי אלהי אברהם יצחק ויעקב לאמר פקד פקדתי אתכם ואת העשוי לכם במצרים
(45349, 61, 4);30;ל;81461;(2, 3, 17, 23, 81461);21491;(2, 3, 17, 6, 21491);אל;2;6;ואמר אעלה אתכם מעני מצרים אל ארץ הכנעני והחתי והאמרי והפרזי והחוי והיבוסי אל ארץ זבת חלב ודבש
(45349, 61, 4);30;ל;81522;(2, 3, 18, 8, 81522);21505;(2, 3, 18, 2, 21505);לקלך;3;2;ושמעו לקלך ובאת אתה וזקני ישראל אל מלך מצרים ואמרתם אליו יהוה אלהי העבריים נקרה עלינו ועתה נלכה נא דרך שלשת ימים במדבר ונזבחה ליהוה אלהינו
(45349, 61, 4);50;נ;81583;(2, 3, 18, 69, 81583);21519;(2, 3, 18, 16, 21519);עלינו;4;16;ושמעו לקלך ובאת אתה וזקני ישראל אל מלך מצרים ואמרתם אליו יהוה אלהי העבריים נקרה עלינו ועתה נלכה נא דרך שלשת ימים במדבר ונזבחה ליהוה אלהינו
(45349, 61, 4);1;א;81644;(2, 3, 19, 17, 81644);21535;(2, 3, 19, 6, 21535);אתכם;1;6;ואני ידעתי כי לא יתן אתכם מלך מצרים להלך ולא ביד חזקה
(45349, 61, 4);200;ר;81705;(2, 3, 20, 36, 81705);21550;(2, 3, 20, 9, 21550);אשר;3;9;ושלחתי את ידי והכיתי את מצרים בכל נפלאתי אשר אעשה בקרבו ואחרי כן ישלח אתכם
(45349, 61, 4);30;ל;81766;(2, 3, 21, 37, 81766);21567;(2, 3, 21, 11, 21567);לא;1;11;ונתתי את חן העם הזה בעיני מצרים והיה כי תלכון לא תלכו ריקם
(45349, 61, 4);20;כ;81827;(2, 3, 22, 52, 81827);21582;(2, 3, 22, 13, 21582);בניכם;4;13;ושאלה אשה משכנתה ומגרת ביתה כלי כסף וכלי זהב ושמלת ושמתם על בניכם ועל בנתיכם ונצלתם את מצרים
(45349, 61, 4);20;כ;81888;(2, 4, 1, 38, 81888);21598;(2, 4, 1, 11, 21598);כי;1;11;ויען משה ויאמר והן לא יאמינו לי ולא ישמעו בקלי כי יאמרו לא נראה אליך יהוה
(45349, 61, 4);1;א;81949;(2, 4, 3, 13, 81949);21613;(2, 4, 3, 3, 21613);ארצה;1;3;ויאמר השליכהו ארצה וישלכהו ארצה ויהי לנחש וינס משה מפניו
(45349, 61, 4);50;נ;82010;(2, 4, 4, 27, 82010);21628;(2, 4, 4, 8, 21628);בזנבו;3;8;ויאמר יהוה אל משה שלח ידך ואחז בזנבו וישלח ידו ויחזק בו ויהי למטה בכפו
(45349, 61, 4);40;ם;82071;(2, 4, 5, 32, 82071);21643;(2, 4, 5, 8, 21643);אבתם;4;8;למען יאמינו כי נראה אליך יהוה אלהי אבתם אלהי אברהם אלהי יצחק ואלהי יעקב
(45349, 61, 4);2;ב;82132;(2, 4, 6, 35, 82132);21660;(2, 4, 6, 11, 21660);בחיקו;1;11;ויאמר יהוה לו עוד הבא נא ידך בחיקך ויבא ידו בחיקו ויוצאה והנה ידו מצרעת כשלג
(45349, 61, 4);1;א;82193;(2, 4, 7, 35, 82193);21675;(2, 4, 7, 10, 21675);ויוצאה;5;10;ויאמר השב ידך אל חיקך וישב ידו אל חיקו ויוצאה מחיקו והנה שבה כבשרו
(45349, 61, 4);6;ו;82254;(2, 4, 8, 43, 82254);21690;(2, 4, 8, 11, 21690);והאמינו;7;11;והיה אם לא יאמינו לך ולא ישמעו לקל האת הראשון והאמינו לקל האת האחרון
(45349, 61, 4);40;מ;82315;(2, 4, 9, 49, 82315);21706;(2, 4, 9, 13, 21706);ממימי;2;13;והיה אם לא יאמינו גם לשני האתות האלה ולא ישמעון לקלך ולקחת ממימי היאר ושפכת היבשה והיו המים אשר תקח מן היאר והיו לדם ביבשת
(45349, 61, 4);5;ה;82376;(2, 4, 10, 12, 82376);21722;(2, 4, 10, 4, 21722);יהוה;2;4;ויאמר משה אל יהוה בי אדני לא איש דברים אנכי גם מתמול גם משלשם גם מאז דברך אל עבדך כי כבד פה וכבד לשון אנכי
(45349, 61, 4);2;ב;82437;(2, 4, 10, 73, 82437);21741;(2, 4, 10, 23, 21741);וכבד;3;23;ויאמר משה אל יהוה בי אדני לא איש דברים אנכי גם מתמול גם משלשם גם מאז דברך אל עבדך כי כבד פה וכבד לשון אנכי
(45349, 61, 4);1;א;82498;(2, 4, 11, 52, 82498);21761;(2, 4, 11, 18, 21761);הלא;3;18;ויאמר יהוה אליו מי שם פה לאדם או מי ישום אלם או חרש או פקח או עור הלא אנכי יהוה
(45349, 61, 4);10;י;82559;(2, 4, 13, 18, 82559);21778;(2, 4, 13, 6, 21778);ביד;2;6;ויאמר בי אדני שלח נא ביד תשלח
(45349, 61, 4);50;נ;82620;(2, 4, 14, 56, 82620);21795;(2, 4, 14, 16, 21795);הנה;2;16;ויחר אף יהוה במשה ויאמר הלא אהרן אחיך הלוי ידעתי כי דבר ידבר הוא וגם הנה הוא יצא לקראתך וראך ושמח בלבו
(45349, 61, 4);40;ם;82681;(2, 4, 15, 36, 82681);21810;(2, 4, 15, 9, 21810);עם;2;9;ודברת אליו ושמת את הדברים בפיו ואנכי אהיה עם פיך ועם פיהו והוריתי אתכם את אשר תעשון
(45349, 61, 4);5;ה;82742;(2, 4, 16, 30, 82742);21828;(2, 4, 16, 10, 21828);לפה;3;10;ודבר הוא לך אל העם והיה הוא יהיה לך לפה ואתה תהיה לו לאלהים
(45349, 61, 4);30;ל;82803;(2, 4, 18, 13, 82803);21846;(2, 4, 18, 4, 21846);אל;2;4;וילך משה וישב אל יתר חתנו ויאמר לו אלכה נא ואשובה אל אחי אשר במצרים ואראה העודם חיים ויאמר יתרו למשה לך לשלום
(45349, 61, 4);400;ת;82864;(2, 4, 18, 74, 82864);21862;(2, 4, 18, 20, 21862);יתרו;2;20;וילך משה וישב אל יתר חתנו ויאמר לו אלכה נא ואשובה אל אחי אשר במצרים ואראה העודם חיים ויאמר יתרו למשה לך לשלום
(45349, 61, 4);40;ם;82925;(2, 4, 19, 48, 82925);21878;(2, 4, 19, 13, 21878);המבקשים;7;13;ויאמר יהוה אל משה במדין לך שב מצרים כי מתו כל האנשים המבקשים את נפשך
(45349, 61, 4);40;מ;82986;(2, 4, 20, 55, 82986);21896;(2, 4, 20, 16, 21896);מטה;1;16;ויקח משה את אשתו ואת בניו וירכבם על החמר וישב ארצה מצרים ויקח משה את מטה האלהים בידו
(45349, 61, 4);10;י;83047;(2, 4, 21, 49, 83047);21911;(2, 4, 21, 13, 21911);בידך;2;13;ויאמר יהוה אל משה בלכתך לשוב מצרימה ראה כל המפתים אשר שמתי בידך ועשיתם לפני פרעה ואני אחזק את לבו ולא ישלח את העם
(45349, 61, 4);5;ה;83108;(2, 4, 22, 20, 83108);21928;(2, 4, 22, 6, 21928);יהוה;4;6;ואמרת אל פרעה כה אמר יהוה בני בכרי ישראל
(45349, 61, 4);2;ב;83169;(2, 4, 23, 49, 83169);21945;(2, 4, 23, 14, 21945);בכרך;1;14;ואמר אליך שלח את בני ויעבדני ותמאן לשלחו הנה אנכי הרג את בנך בכרך
(45349, 61, 4);5;ה;83230;(2, 4, 25, 24, 83230);21959;(2, 4, 25, 7, 21959);בנה;3;7;ותקח צפרה צר ותכרת את ערלת בנה ותגע לרגליו ותאמר כי חתן דמים אתה לי
(45349, 61, 4);10;י;83291;(2, 4, 27, 6, 83291);21976;(2, 4, 27, 2, 21976);יהוה;1;2;ויאמר יהוה אל אהרן לך לקראת משה המדברה וילך ויפגשהו בהר האלהים וישק לו
(45349, 61, 4);5;ה;83352;(2, 4, 28, 10, 83352);21991;(2, 4, 28, 3, 21991);לאהרן;3;3;ויגד משה לאהרן את כל דברי יהוה אשר שלחו ואת כל האתת אשר צוהו
(45349, 61, 4);100;ק;83413;(2, 4, 29, 24, 83413);22009;(2, 4, 29, 7, 22009);זקני;2;7;וילך משה ואהרן ויאספו את כל זקני בני ישראל
(45349, 61, 4);6;ו;83474;(2, 4, 31, 1, 83474);22026;(2, 4, 31, 1, 22026);ויאמן;1;1;ויאמן העם וישמעו כי פקד יהוה את בני ישראל וכי ראה את ענים ויקדו וישתחוו
(45349, 61, 4);2;ב;83535;(2, 5, 1, 5, 83535);22042;(2, 5, 1, 2, 22042);באו;1;2;ואחר באו משה ואהרן ויאמרו אל פרעה כה אמר יהוה אלהי ישראל שלח את עמי ויחגו לי במדבר
(45349, 61, 4);6;ו;83596;(2, 5, 2, 1, 83596);22059;(2, 5, 2, 1, 22059);ויאמר;1;1;ויאמר פרעה מי יהוה אשר אשמע בקלו לשלח את ישראל לא ידעתי את יהוה וגם את ישראל לא אשלח
(45349, 61, 4);1;א;83657;(2, 5, 2, 62, 83657);22076;(2, 5, 2, 18, 22076);לא;2;18;ויאמר פרעה מי יהוה אשר אשמע בקלו לשלח את ישראל לא ידעתי את יהוה וגם את ישראל לא אשלח
(45349, 61, 4);6;ו;83718;(2, 5, 3, 57, 83718);22090;(2, 5, 3, 13, 22090);ליהוה;4;13;ויאמרו אלהי העברים נקרא עלינו נלכה נא דרך שלשת ימים במדבר ונזבחה ליהוה אלהינו פן יפגענו בדבר או בחרב
(45349, 61, 4);400;ת;83779;(2, 5, 4, 36, 83779);22105;(2, 5, 4, 9, 22105);את;2;9;ויאמר אלהם מלך מצרים למה משה ואהרן תפריעו את העם ממעשיו לכו לסבלתיכם
(45349, 61, 4);10;י;83840;(2, 5, 6, 2, 83840);22120;(2, 5, 6, 1, 22120);ויצו;2;1;ויצו פרעה ביום ההוא את הנגשים בעם ואת שטריו לאמר
(45349, 61, 4);2;ב;83901;(2, 5, 7, 24, 83901);22136;(2, 5, 7, 7, 22136);הלבנים;3;7;לא תאספון לתת תבן לעם ללבן הלבנים כתמול שלשם הם ילכו וקששו להם תבן
(45349, 61, 4);400;ת;83962;(2, 5, 8, 32, 83962);22152;(2, 5, 8, 9, 22152);תשימו;1;9;ואת מתכנת הלבנים אשר הם עשים תמול שלשם תשימו עליהם לא תגרעו ממנו כי נרפים הם על כן הם צעקים לאמר נלכה נזבחה לאלהינו
(45349, 61, 4);400;ת;84023;(2, 5, 9, 1, 84023);22168;(2, 5, 9, 1, 22168);תכבד;1;1;תכבד העבדה על האנשים ויעשו בה ואל ישעו בדברי שקר
(45349, 61, 4);200;ר;84084;(2, 5, 10, 23, 84084);22182;(2, 5, 10, 5, 22182);ויאמרו;5;5;ויצאו נגשי העם ושטריו ויאמרו אל העם לאמר כה אמר פרעה אינני נתן לכם תבן
(45349, 61, 4);10;י;84145;(2, 5, 11, 28, 84145);22201;(2, 5, 11, 9, 22201);אין;2;9;אתם לכו קחו לכם תבן מאשר תמצאו כי אין נגרע מעבדתכם דבר
(45349, 61, 4);6;ו;84206;(2, 5, 13, 18, 84206);22216;(2, 5, 13, 4, 22216);כלו;3;4;והנגשים אצים לאמר כלו מעשיכם דבר יום ביומו כאשר בהיות התבן
(45349, 61, 4);80;פ;84267;(2, 5, 14, 31, 84267);22232;(2, 5, 14, 9, 22232);פרעה;1;9;ויכו שטרי בני ישראל אשר שמו עלהם נגשי פרעה לאמר מדוע לא כליתם חקכם ללבן כתמול שלשם גם תמול גם היום
(45349, 61, 4);300;ש;84328;(2, 5, 15, 14, 84328);22248;(2, 5, 15, 4, 22248);ישראל;2;4;ויבאו שטרי בני ישראל ויצעקו אל פרעה לאמר למה תעשה כה לעבדיך
(45349, 61, 4);30;ל;84389;(2, 5, 16, 27, 84389);22263;(2, 5, 16, 7, 22263);לנו;1;7;תבן אין נתן לעבדיך ולבנים אמרים לנו עשו והנה עבדיך מכים וחטאת עמך
(45349, 61, 4);50;נ;84450;(2, 5, 17, 35, 84450);22279;(2, 5, 17, 10, 22279);נזבחה;1;10;ויאמר נרפים אתם נרפים על כן אתם אמרים נלכה נזבחה ליהוה
(45349, 61, 4);200;ר;84511;(2, 5, 19, 15, 84511);22294;(2, 5, 19, 4, 22294);ישראל;3;4;ויראו שטרי בני ישראל אתם ברע לאמר לא תגרעו מלבניכם דבר יום ביומו
(45349, 61, 4);30;ל;84572;(2, 5, 20, 24, 84572);22310;(2, 5, 20, 7, 22310);לקראתם;1;7;ויפגעו את משה ואת אהרן נצבים לקראתם בצאתם מאת פרעה
(45349, 61, 4);2;ב;84633;(2, 5, 21, 44, 84633);22324;(2, 5, 21, 11, 22324);בעיני;1;11;ויאמרו אלהם ירא יהוה עליכם וישפט אשר הבאשתם את ריחנו בעיני פרעה ובעיני עבדיו לתת חרב בידם להרגנו
(45349, 61, 4);5;ה;84694;(2, 5, 22, 26, 84694);22339;(2, 5, 22, 8, 22339);הרעתה;1;8;וישב משה אל יהוה ויאמר אדני למה הרעתה לעם הזה למה זה שלחתני
(45349, 61, 4);30;ל;84755;(2, 5, 23, 40, 84755);22356;(2, 5, 23, 12, 22356);הצלת;3;12;ומאז באתי אל פרעה לדבר בשמך הרע לעם הזה והצל לא הצלת את עמך
(45349, 61, 4);5;ה;84816;(2, 6, 1, 55, 84816);22373;(2, 6, 1, 15, 22373);חזקה;4;15;ויאמר יהוה אל משה עתה תראה אשר אעשה לפרעה כי ביד חזקה ישלחם וביד חזקה יגרשם מארצו
(45349, 61, 4);30;ל;84877;(2, 6, 3, 20, 84877);22389;(2, 6, 3, 6, 22389);ואל;3;6;וארא אל אברהם אל יצחק ואל יעקב באל שדי ושמי יהוה לא נודעתי להם
(45349, 61, 4);70;ע;84938;(2, 6, 4, 32, 84938);22407;(2, 6, 4, 10, 22407);כנען;3;10;וגם הקמתי את בריתי אתם לתת להם את ארץ כנען את ארץ מגריהם אשר גרו בה
(45349, 61, 4);400;ת;84999;(2, 6, 5, 41, 84999);22424;(2, 6, 5, 11, 22424);אתם;2;11;וגם אני שמעתי את נאקת בני ישראל אשר מצרים מעבדים אתם ואזכר את בריתי
(45349, 61, 4);5;ה;85060;(2, 6, 6, 48, 85060);22439;(2, 6, 6, 12, 22439);והצלתי;2;12;לכן אמר לבני ישראל אני יהוה והוצאתי אתכם מתחת סבלת מצרים והצלתי אתכם מעבדתם וגאלתי אתכם בזרוע נטויה ובשפטים גדלים
(45349, 61, 4);40;ם;85121;(2, 6, 7, 15, 85121);22451;(2, 6, 7, 4, 22451);לעם;3;4;ולקחתי אתכם לי לעם והייתי לכם לאלהים וידעתם כי אני יהוה אלהיכם המוציא אתכם מתחת סבלות מצרים
(45349, 61, 4);6;ו;85182;(2, 6, 8, 1, 85182);22465;(2, 6, 8, 1, 22465);והבאתי;1;1;והבאתי אתכם אל הארץ אשר נשאתי את ידי לתת אתה לאברהם ליצחק וליעקב ונתתי אתה לכם מורשה אני יהוה
(45349, 61, 4);20;כ;85243;(2, 6, 8, 62, 85243);22480;(2, 6, 8, 16, 22480);לכם;2;16;והבאתי אתכם אל הארץ אשר נשאתי את ידי לתת אתה לאברהם ליצחק וליעקב ונתתי אתה לכם מורשה אני יהוה
(45349, 61, 4);5;ה;85304;(2, 6, 9, 48, 85304);22497;(2, 6, 9, 14, 22497);קשה;3;14;וידבר משה כן אל בני ישראל ולא שמעו אל משה מקצר רוח ומעבדה קשה
(45349, 61, 4);2;ב;85365;(2, 6, 12, 4, 85365);22514;(2, 6, 12, 1, 22514);וידבר;4;1;וידבר משה לפני יהוה לאמר הן בני ישראל לא שמעו אלי ואיך ישמעני פרעה ואני ערל שפתים
(45349, 61, 4);40;ם;85426;(2, 6, 12, 65, 85426);22530;(2, 6, 12, 17, 22530);שפתים;5;17;וידבר משה לפני יהוה לאמר הן בני ישראל לא שמעו אלי ואיך ישמעני פרעה ואני ערל שפתים
(45349, 61, 4);50;נ;85487;(2, 6, 13, 61, 85487);22547;(2, 6, 13, 17, 22547);בני;2;17;וידבר יהוה אל משה ואל אהרן ויצום אל בני ישראל ואל פרעה מלך מצרים להוציא את בני ישראל מארץ מצרים
(45349, 61, 4);200;ר;85548;(2, 6, 14, 46, 85548);22562;(2, 6, 14, 12, 22562);וכרמי;3;12;אלה ראשי בית אבתם בני ראובן בכר ישראל חנוך ופלוא חצרן וכרמי אלה משפחת ראובן
(45349, 61, 4);400;ת;85609;(2, 6, 15, 46, 85609);22575;(2, 6, 15, 10, 22575);הכנענית;7;10;ובני שמעון ימואל וימין ואהד ויכין וצחר ושאול בן הכנענית אלה משפחת שמעון
(45349, 61, 4);6;ו;85670;(2, 6, 16, 48, 85670);22591;(2, 6, 16, 13, 22591);ושלשים;1;13;ואלה שמות בני לוי לתלדתם גרשון וקהת ומררי ושני חיי לוי שבע ושלשים ומאת שנה
(45349, 61, 4);7;ז;85731;(2, 6, 18, 25, 85731);22604;(2, 6, 18, 6, 22604);ועזיאל;3;6;ובני קהת עמרם ויצהר וחברון ועזיאל ושני חיי קהת שלש ושלשים ומאת שנה
(45349, 61, 4);30;ל;85792;(2, 6, 19, 32, 85792);22619;(2, 6, 19, 8, 22619);לתלדתם;3;8;ובני מררי מחלי ומושי אלה משפחת הלוי לתלדתם
(45349, 61, 4);6;ו;85853;(2, 6, 20, 58, 85853);22637;(2, 6, 20, 18, 22637);ושלשים;1;18;ויקח עמרם את יוכבד דדתו לו לאשה ותלד לו את אהרן ואת משה ושני חיי עמרם שבע ושלשים ומאת שנה
(45349, 61, 4);8;ח;85914;(2, 6, 23, 4, 85914);22650;(2, 6, 23, 1, 22650);ויקח;4;1;ויקח אהרן את אלישבע בת עמינדב אחות נחשון לו לאשה ותלד לו את נדב ואת אביהוא את אלעזר ואת איתמר
(45349, 61, 4);7;ז;85975;(2, 6, 23, 65, 85975);22667;(2, 6, 23, 18, 22667);אלעזר;4;18;ויקח אהרן את אלישבע בת עמינדב אחות נחשון לו לאשה ותלד לו את נדב ואת אביהוא את אלעזר ואת איתמר
(45349, 61, 4);8;ח;86036;(2, 6, 25, 15, 86036);22681;(2, 6, 25, 4, 22681);לקח;3;4;ואלעזר בן אהרן לקח לו מבנות פוטיאל לו לאשה ותלד לו את פינחס אלה ראשי אבות הלוים למשפחתם
(45349, 61, 4);200;ר;86097;(2, 6, 26, 6, 86097);22697;(2, 6, 26, 2, 22697);אהרן;3;2;הוא אהרן ומשה אשר אמר יהוה להם הוציאו את בני ישראל מארץ מצרים על צבאתם
(45349, 61, 4);30;ל;86158;(2, 6, 27, 11, 86158);22713;(2, 6, 27, 3, 22713);אל;2;3;הם המדברים אל פרעה מלך מצרים להוציא את בני ישראל ממצרים הוא משה ואהרן
(45349, 61, 4);1;א;86219;(2, 6, 28, 16, 86219);22729;(2, 6, 28, 5, 22729);אל;1;5;ויהי ביום דבר יהוה אל משה בארץ מצרים
(45349, 61, 4);300;ש;86280;(2, 6, 29, 48, 86280);22747;(2, 6, 29, 15, 22747);אשר;2;15;וידבר יהוה אל משה לאמר אני יהוה דבר אל פרעה מלך מצרים את כל אשר אני דבר אליך
