(120469, 64, 4);1;א;75221;(1, 48, 22, 35, 75221);19867;(1, 48, 22, 11, 19867);האמרי;2;11;ואני נתתי לך שכם אחד על אחיך אשר לקחתי מיד האמרי בחרבי ובקשתי
(120469, 64, 4);8;ח;75285;(1, 49, 1, 50, 75285);19882;(1, 49, 1, 13, 19882);באחרית;3;13;ויקרא יעקב אל בניו ויאמר האספו ואגידה לכם את אשר יקרא אתכם באחרית הימים
(120469, 64, 4);1;א;75349;(1, 49, 3, 22, 75349);19897;(1, 49, 3, 6, 19897);אוני;1;6;ראובן בכרי אתה כחי וראשית אוני יתר שאת ויתר עז
(120469, 64, 4);30;ל;75413;(1, 49, 5, 7, 75413);19915;(1, 49, 5, 2, 19915);ולוי;2;2;שמעון ולוי אחים כלי חמס מכרתיהם
(120469, 64, 4);50;נ;75477;(1, 49, 6, 45, 75477);19932;(1, 49, 6, 13, 19932);וברצנם;5;13;בסדם אל תבא נפשי בקהלם אל תחד כבדי כי באפם הרגו איש וברצנם עקרו שור
(120469, 64, 4);4;ד;75541;(1, 49, 8, 11, 75541);19948;(1, 49, 8, 3, 19948);יודוך;3;3;יהודה אתה יודוך אחיך ידך בערף איביך ישתחוו לך בני אביך
(120469, 64, 4);1;א;75605;(1, 49, 9, 31, 75605);19965;(1, 49, 9, 9, 19965);כאריה;2;9;גור אריה יהודה מטרף בני עלית כרע רבץ כאריה וכלביא מי יקימנו
(120469, 64, 4);400;ת;75669;(1, 49, 10, 47, 75669);19981;(1, 49, 10, 13, 19981);יקהת;4;13;לא יסור שבט מיהודה ומחקק מבין רגליו עד כי יבא שילה ולו יקהת עמים
(120469, 64, 4);40;ם;75733;(1, 49, 12, 11, 75733);19996;(1, 49, 12, 2, 19996);עינים;5;2;חכלילי עינים מיין ולבן שנים מחלב
(120469, 64, 4);40;מ;75797;(1, 49, 14, 7, 75797);20012;(1, 49, 14, 2, 20012);חמר;2;2;יששכר חמר גרם רבץ בין המשפתים
(120469, 64, 4);4;ד;75861;(1, 49, 15, 47, 75861);20030;(1, 49, 15, 14, 20030);עבד;3;14;וירא מנחה כי טוב ואת הארץ כי נעמה ויט שכמו לסבל ויהי למס עבד
(120469, 64, 4);20;כ;75925;(1, 49, 17, 42, 75925);20049;(1, 49, 17, 13, 20049);רכבו;2;13;יהי דן נחש עלי דרך שפיפן עלי ארח הנשך עקבי סוס ויפל רכבו אחור
(120469, 64, 4);40;מ;75989;(1, 49, 20, 20, 75989);20065;(1, 49, 20, 6, 20065);מעדני;1;6;מאשר שמנה לחמו והוא יתן מעדני מלך
(120469, 64, 4);6;ו;76053;(1, 49, 22, 33, 76053);20083;(1, 49, 22, 11, 20083);שור;2;11;בן פרת יוסף בן פרת עלי עין בנות צעדה עלי שור
(120469, 64, 4);100;ק;76117;(1, 49, 24, 37, 76117);20097;(1, 49, 24, 9, 20097);יעקב;3;9;ותשב באיתן קשתו ויפזו זרעי ידיו מידי אביר יעקב משם רעה אבן ישראל
(120469, 64, 4);400;ת;76181;(1, 49, 25, 49, 76181);20114;(1, 49, 25, 13, 20114);תחת;1;13;מאל אביך ויעזרך ואת שדי ויברכך ברכת שמים מעל ברכת תהום רבצת תחת ברכת שדים ורחם
(120469, 64, 4);6;ו;76245;(1, 49, 26, 50, 76245);20131;(1, 49, 26, 14, 20131);ולקדקד;1;14;ברכת אביך גברו על ברכת הורי עד תאות גבעת עולם תהיין לראש יוסף ולקדקד נזיר אחיו
(120469, 64, 4);50;נ;76309;(1, 49, 28, 16, 76309);20147;(1, 49, 28, 5, 20147);שנים;2;5;כל אלה שבטי ישראל שנים עשר וזאת אשר דבר להם אביהם ויברך אותם איש אשר כברכתו ברך אתם
(120469, 64, 4);1;א;76373;(1, 49, 29, 14, 76373);20164;(1, 49, 29, 4, 20164);אלהם;1;4;ויצו אותם ויאמר אלהם אני נאסף אל עמי קברו אתי אל אבתי אל המערה אשר בשדה עפרון החתי
(120469, 64, 4);5;ה;76437;(1, 49, 30, 13, 76437);20182;(1, 49, 30, 4, 20182);המכפלה;1;4;במערה אשר בשדה המכפלה אשר על פני ממרא בארץ כנען אשר קנה אברהם את השדה מאת עפרן החתי לאחזת קבר
(120469, 64, 4);5;ה;76501;(1, 49, 31, 3, 76501);20199;(1, 49, 31, 1, 20199);שמה;3;1;שמה קברו את אברהם ואת שרה אשתו שמה קברו את יצחק ואת רבקה אשתו ושמה קברתי את לאה
(120469, 64, 4);5;ה;76565;(1, 49, 32, 5, 76565);20218;(1, 49, 32, 2, 20218);השדה;1;2;מקנה השדה והמערה אשר בו מאת בני חת
(120469, 64, 4);1;א;76629;(1, 49, 33, 42, 76629);20235;(1, 49, 33, 11, 20235);ויאסף;3;11;ויכל יעקב לצות את בניו ויאסף רגליו אל המטה ויגוע ויאסף אל עמיו
(120469, 64, 4);8;ח;76693;(1, 50, 2, 25, 76693);20253;(1, 50, 2, 7, 20253);לחנט;2;7;ויצו יוסף את עבדיו את הרפאים לחנט את אביו ויחנטו הרפאים את ישראל
(120469, 64, 4);10;י;76757;(1, 50, 3, 37, 76757);20269;(1, 50, 3, 10, 20269);ויבכו;2;10;וימלאו לו ארבעים יום כי כן ימלאו ימי החנטים ויבכו אתו מצרים שבעים יום
(120469, 64, 4);10;י;76821;(1, 50, 4, 45, 76821);20285;(1, 50, 4, 12, 20285);מצאתי;5;12;ויעברו ימי בכיתו וידבר יוסף אל בית פרעה לאמר אם נא מצאתי חן בעיניכם דברו נא באזני פרעה לאמר
(120469, 64, 4);10;י;76885;(1, 50, 5, 36, 76885);20301;(1, 50, 5, 9, 20301);כריתי;5;9;אבי השביעני לאמר הנה אנכי מת בקברי אשר כריתי לי בארץ כנען שמה תקברני ועתה אעלה נא ואקברה את אבי ואשובה
(120469, 64, 4);400;ת;76949;(1, 50, 6, 18, 76949);20318;(1, 50, 6, 5, 20318);את;2;5;ויאמר פרעה עלה וקבר את אביך כאשר השביעך
(120469, 64, 4);50;נ;77013;(1, 50, 7, 50, 77013);20335;(1, 50, 7, 14, 20335);זקני;3;14;ויעל יוסף לקבר את אביו ויעלו אתו כל עבדי פרעה זקני ביתו וכל זקני ארץ מצרים
(120469, 64, 4);40;מ;77077;(1, 50, 9, 6, 77077);20352;(1, 50, 9, 2, 20352);עמו;2;2;ויעל עמו גם רכב גם פרשים ויהי המחנה כבד מאד
(120469, 64, 4);60;ס;77141;(1, 50, 10, 36, 77141);20370;(1, 50, 10, 10, 20370);מספד;2;10;ויבאו עד גרן האטד אשר בעבר הירדן ויספדו שם מספד גדול וכבד מאד ויעש לאביו אבל שבעת ימים
(120469, 64, 4);9;ט;77205;(1, 50, 11, 31, 77205);20386;(1, 50, 11, 8, 20386);האטד;3;8;וירא יושב הארץ הכנעני את האבל בגרן האטד ויאמרו אבל כבד זה למצרים על כן קרא שמה אבל מצרים אשר בעבר הירדן
(120469, 64, 4);50;ן;77269;(1, 50, 12, 13, 77269);20404;(1, 50, 12, 4, 20404);כן;2;4;ויעשו בניו לו כן כאשר צום
(120469, 64, 4);5;ה;77333;(1, 50, 13, 57, 77333);20421;(1, 50, 13, 15, 20421);השדה;1;15;וישאו אתו בניו ארצה כנען ויקברו אתו במערת שדה המכפלה אשר קנה אברהם את השדה לאחזת קבר מאת עפרן החתי על פני ממרא
(120469, 64, 4);6;ו;77397;(1, 50, 14, 33, 77397);20437;(1, 50, 14, 8, 20437);אתו;3;8;וישב יוסף מצרימה הוא ואחיו וכל העלים אתו לקבר את אביו אחרי קברו את אביו
(120469, 64, 4);6;ו;77461;(1, 50, 15, 40, 77461);20455;(1, 50, 15, 11, 20455);והשב;1;11;ויראו אחי יוסף כי מת אביהם ויאמרו לו ישטמנו יוסף והשב ישיב לנו את כל הרעה אשר גמלנו אתו
(120469, 64, 4);20;כ;77525;(1, 50, 17, 1, 77525);20473;(1, 50, 17, 1, 20473);כה;1;1;כה תאמרו ליוסף אנא שא נא פשע אחיך וחטאתם כי רעה גמלוך ועתה שא נא לפשע עבדי אלהי אביך ויבך יוסף בדברם אליו
(120469, 64, 4);10;י;77589;(1, 50, 17, 65, 77589);20491;(1, 50, 17, 19, 20491);אביך;3;19;כה תאמרו ליוסף אנא שא נא פשע אחיך וחטאתם כי רעה גמלוך ועתה שא נא לפשע עבדי אלהי אביך ויבך יוסף בדברם אליו
(120469, 64, 4);30;ל;77653;(1, 50, 19, 7, 77653);20506;(1, 50, 19, 2, 20506);אלהם;2;2;ויאמר אלהם יוסף אל תיראו כי התחת אלהים אני
(120469, 64, 4);10;י;77717;(1, 50, 20, 37, 77717);20523;(1, 50, 20, 10, 20523);כיום;2;10;ואתם חשבתם עלי רעה אלהים חשבה לטבה למען עשה כיום הזה להחית עם רב
(120469, 64, 4);40;ם;77781;(1, 50, 21, 50, 77781);20540;(1, 50, 21, 13, 20540);לבם;3;13;ועתה אל תיראו אנכי אכלכל אתכם ואת טפכם וינחם אותם וידבר על לבם
(120469, 64, 4);300;ש;77845;(1, 50, 23, 20, 77845);20556;(1, 50, 23, 5, 20556);שלשים;3;5;וירא יוסף לאפרים בני שלשים גם בני מכיר בן מנשה ילדו על ברכי יוסף
(120469, 64, 4);100;ק;77909;(1, 50, 24, 33, 77909);20574;(1, 50, 24, 9, 20574);יפקד;3;9;ויאמר יוסף אל אחיו אנכי מת ואלהים פקד יפקד אתכם והעלה אתכם מן הארץ הזאת אל הארץ אשר נשבע לאברהם ליצחק וליעקב
(120469, 64, 4);1;א;77973;(1, 50, 25, 10, 77973);20590;(1, 50, 25, 3, 20590);את;1;3;וישבע יוסף את בני ישראל לאמר פקד יפקד אלהים אתכם והעלתם את עצמתי מזה
(120469, 64, 4);50;נ;78037;(1, 50, 26, 19, 78037);20607;(1, 50, 26, 6, 20607);שנים;2;6;וימת יוסף בן מאה ועשר שנים ויחנטו אתו ויישם בארון במצרים
(120469, 64, 4);6;ו;78101;(2, 1, 1, 37, 78101);20622;(2, 1, 1, 10, 20622);וביתו;1;10;ואלה שמות בני ישראל הבאים מצרימה את יעקב איש וביתו באו
(120469, 64, 4);80;פ;78165;(2, 1, 5, 8, 78165);20637;(2, 1, 5, 3, 20637);נפש;2;3;ויהי כל נפש יצאי ירך יעקב שבעים נפש ויוסף היה במצרים
(120469, 64, 4);10;י;78229;(2, 1, 7, 4, 78229);20653;(2, 1, 7, 1, 20653);ובני;4;1;ובני ישראל פרו וישרצו וירבו ויעצמו במאד מאד ותמלא הארץ אתם
(120469, 64, 4);200;ר;78293;(2, 1, 8, 20, 78293);20669;(2, 1, 8, 6, 20669);אשר;3;6;ויקם מלך חדש על מצרים אשר לא ידע את יוסף
(120469, 64, 4);5;ה;78357;(2, 1, 10, 19, 78357);20689;(2, 1, 10, 6, 20689);והיה;2;6;הבה נתחכמה לו פן ירבה והיה כי תקראנה מלחמה ונוסף גם הוא על שנאינו ונלחם בנו ועלה מן הארץ
(120469, 64, 4);10;י;78421;(2, 1, 11, 13, 78421);20705;(2, 1, 11, 3, 20705);שרי;3;3;וישימו עליו שרי מסים למען ענתו בסבלתם ויבן ערי מסכנות לפרעה את פתם ואת רעמסס
(120469, 64, 4);10;י;78485;(2, 1, 12, 15, 78485);20722;(2, 1, 12, 5, 20722);ירבה;1;5;וכאשר יענו אתו כן ירבה וכן יפרץ ויקצו מפני בני ישראל
(120469, 64, 4);5;ה;78549;(2, 1, 14, 12, 78549);20737;(2, 1, 14, 3, 20737);חייהם;4;3;וימררו את חייהם בעבדה קשה בחמר ובלבנים ובכל עבדה בשדה את כל עבדתם אשר עבדו בהם בפרך
(120469, 64, 4);40;מ;78613;(2, 1, 15, 9, 78613);20754;(2, 1, 15, 3, 20754);מצרים;1;3;ויאמר מלך מצרים למילדת העברית אשר שם האחת שפרה ושם השנית פועה
(120469, 64, 4);1;א;78677;(2, 1, 16, 23, 78677);20768;(2, 1, 16, 5, 20768);וראיתן;3;5;ויאמר בילדכן את העבריות וראיתן על האבנים אם בן הוא והמתן אתו ואם בת הוא וחיה
(120469, 64, 4);6;ו;78741;(2, 1, 17, 26, 78741);20785;(2, 1, 17, 6, 20785);עשו;3;6;ותיראן המילדת את האלהים ולא עשו כאשר דבר אליהן מלך מצרים ותחיין את הילדים
(120469, 64, 4);6;ו;78805;(2, 1, 18, 30, 78805);20800;(2, 1, 18, 7, 20800);מדוע;3;7;ויקרא מלך מצרים למילדת ויאמר להן מדוע עשיתן הדבר הזה ותחיין את הילדים
(120469, 64, 4);200;ר;78869;(2, 1, 19, 37, 78869);20815;(2, 1, 19, 9, 20815);העברית;4;9;ותאמרן המילדת אל פרעה כי לא כנשים המצרית העברית כי חיות הנה בטרם תבוא אלהן המילדת וילדו
(120469, 64, 4);40;מ;78933;(2, 1, 20, 30, 78933);20830;(2, 1, 20, 7, 20830);מאד;1;7;וייטב אלהים למילדת וירב העם ויעצמו מאד
(120469, 64, 4);6;ו;78997;(2, 1, 22, 27, 78997);20847;(2, 1, 22, 8, 20847);הילוד;4;8;ויצו פרעה לכל עמו לאמר כל הבן הילוד היארה תשליכהו וכל הבת תחיון
(120469, 64, 4);6;ו;79061;(2, 2, 2, 15, 79061);20865;(2, 2, 2, 5, 20865);ותרא;1;5;ותהר האשה ותלד בן ותרא אתו כי טוב הוא ותצפנהו שלשה ירחים
(120469, 64, 4);5;ה;79125;(2, 2, 3, 34, 79125);20881;(2, 2, 3, 9, 20881);ותחמרה;6;9;ולא יכלה עוד הצפינו ותקח לו תבת גמא ותחמרה בחמר ובזפת ותשם בה את הילד ותשם בסוף על שפת היאר
(120469, 64, 4);6;ו;79189;(2, 2, 5, 1, 79189);20900;(2, 2, 5, 1, 20900);ותרד;1;1;ותרד בת פרעה לרחץ על היאר ונערתיה הלכת על יד היאר ותרא את התבה בתוך הסוף ותשלח את אמתה ותקחה
(120469, 64, 4);1;א;79253;(2, 2, 5, 65, 79253);20918;(2, 2, 5, 19, 20918);אמתה;1;19;ותרד בת פרעה לרחץ על היאר ונערתיה הלכת על יד היאר ותרא את התבה בתוך הסוף ותשלח את אמתה ותקחה
(120469, 64, 4);400;ת;79317;(2, 2, 7, 2, 79317);20933;(2, 2, 7, 1, 20933);ותאמר;2;1;ותאמר אחתו אל בת פרעה האלך וקראתי לך אשה מינקת מן העברית ותינק לך את הילד
(120469, 64, 4);2;ב;79381;(2, 2, 8, 8, 79381);20951;(2, 2, 8, 3, 20951);בת;1;3;ותאמר לה בת פרעה לכי ותלך העלמה ותקרא את אם הילד
(120469, 64, 4);5;ה;79445;(2, 2, 9, 34, 79445);20968;(2, 2, 9, 9, 20968);והינקהו;6;9;ותאמר לה בת פרעה היליכי את הילד הזה והינקהו לי ואני אתן את שכרך ותקח האשה הילד ותניקהו
(120469, 64, 4);30;ל;79509;(2, 2, 10, 29, 79509);20985;(2, 2, 10, 8, 20985);לבן;1;8;ויגדל הילד ותבאהו לבת פרעה ויהי לה לבן ותקרא שמו משה ותאמר כי מן המים משיתהו
(120469, 64, 4);10;י;79573;(2, 2, 11, 32, 79573);21002;(2, 2, 11, 9, 21002);וירא;2;9;ויהי בימים ההם ויגדל משה ויצא אל אחיו וירא בסבלתם וירא איש מצרי מכה איש עברי מאחיו
(120469, 64, 4);200;ר;79637;(2, 2, 12, 30, 79637);21020;(2, 2, 12, 10, 21020);המצרי;4;10;ויפן כה וכה וירא כי אין איש ויך את המצרי ויטמנהו בחול
(120469, 64, 4);6;ו;79701;(2, 2, 14, 1, 79701);21036;(2, 2, 14, 1, 21036);ויאמר;1;1;ויאמר מי שמך לאיש שר ושפט עלינו הלהרגני אתה אמר כאשר הרגת את המצרי ויירא משה ויאמר אכן נודע הדבר
(120469, 64, 4);40;מ;79765;(2, 2, 14, 65, 79765);21052;(2, 2, 14, 17, 21052);ויאמר;4;17;ויאמר מי שמך לאיש שר ושפט עלינו הלהרגני אתה אמר כאשר הרגת את המצרי ויירא משה ויאמר אכן נודע הדבר
(120469, 64, 4);2;ב;79829;(2, 2, 15, 52, 79829);21069;(2, 2, 15, 14, 21069);וישב;4;14;וישמע פרעה את הדבר הזה ויבקש להרג את משה ויברח משה מפני פרעה וישב בארץ מדין וישב על הבאר
(120469, 64, 4);300;ש;79893;(2, 2, 16, 46, 79893);21084;(2, 2, 16, 10, 21084);להשקות;3;10;ולכהן מדין שבע בנות ותבאנה ותדלנה ותמלאנה את הרהטים להשקות צאן אביהן
(120469, 64, 4);30;ל;79957;(2, 2, 18, 13, 79957);21098;(2, 2, 18, 3, 21098);רעואל;5;3;ותבאנה אל רעואל אביהן ויאמר מדוע מהרתן בא היום
(120469, 64, 4);6;ו;80021;(2, 2, 19, 39, 80021);21114;(2, 2, 19, 10, 21114);לנו;3;10;ותאמרן איש מצרי הצילנו מיד הרעים וגם דלה דלה לנו וישק את הצאן
(120469, 64, 4);5;ה;80085;(2, 2, 21, 8, 80085);21132;(2, 2, 21, 2, 21132);משה;3;2;ויואל משה לשבת את האיש ויתן את צפרה בתו למשה
(120469, 64, 4);50;נ;80149;(2, 2, 22, 37, 80149);21152;(2, 2, 22, 12, 21152);נכריה;1;12;ותלד בן ויקרא את שמו גרשם כי אמר גר הייתי בארץ נכריה
(120469, 64, 4);30;ל;80213;(2, 2, 23, 60, 80213);21166;(2, 2, 23, 14, 21166);ותעל;4;14;ויהי בימים הרבים ההם וימת מלך מצרים ויאנחו בני ישראל מן העבדה ויזעקו ותעל שועתם אל האלהים מן העבדה
(120469, 64, 4);10;י;80277;(2, 2, 24, 44, 80277);21183;(2, 2, 24, 12, 21183);יצחק;1;12;וישמע אלהים את נאקתם ויזכר אלהים את בריתו את אברהם את יצחק ואת יעקב
(120469, 64, 4);50;ן;80341;(2, 3, 1, 26, 80341);21200;(2, 3, 1, 8, 21200);כהן;3;8;ומשה היה רעה את צאן יתרו חתנו כהן מדין וינהג את הצאן אחר המדבר ויבא אל הר האלהים חרבה
(120469, 64, 4);40;מ;80405;(2, 3, 2, 23, 80405);21218;(2, 3, 2, 7, 21218);מתוך;1;7;וירא מלאך יהוה אליו בלבת אש מתוך הסנה וירא והנה הסנה בער באש והסנה איננו אכל
(120469, 64, 4);5;ה;80469;(2, 3, 3, 26, 80469);21234;(2, 3, 3, 7, 21234);המראה;5;7;ויאמר משה אסרה נא ואראה את המראה הגדל הזה מדוע לא יבער הסנה
(120469, 64, 4);40;מ;80533;(2, 3, 4, 43, 80533);21251;(2, 3, 4, 11, 21251);ויאמר;4;11;וירא יהוה כי סר לראות ויקרא אליו אלהים מתוך הסנה ויאמר משה משה ויאמר הנני
(120469, 64, 4);30;ל;80597;(2, 3, 5, 48, 80597);21269;(2, 3, 5, 14, 21269);עליו;2;14;ויאמר אל תקרב הלם של נעליך מעל רגליך כי המקום אשר אתה עומד עליו אדמת קדש הוא
(120469, 64, 4);80;פ;80661;(2, 3, 6, 52, 80661);21285;(2, 3, 6, 13, 21285);פניו;1;13;ויאמר אנכי אלהי אביך אלהי אברהם אלהי יצחק ואלהי יעקב ויסתר משה פניו כי ירא מהביט אל האלהים
(120469, 64, 4);300;ש;80725;(2, 3, 7, 43, 80725);21302;(2, 3, 7, 12, 21302);שמעתי;1;12;ויאמר יהוה ראה ראיתי את עני עמי אשר במצרים ואת צעקתם שמעתי מפני נגשיו כי ידעתי את מכאביו
(120469, 64, 4);1;א;80789;(2, 3, 8, 36, 80789);21317;(2, 3, 8, 9, 21317);אל;1;9;וארד להצילו מיד מצרים ולהעלתו מן הארץ ההוא אל ארץ טובה ורחבה אל ארץ זבת חלב ודבש אל מקום הכנעני והחתי והאמרי והפרזי והחוי והיבוסי
(120469, 64, 4);5;ה;80853;(2, 3, 8, 100, 80853);21333;(2, 3, 8, 25, 21333);והיבוסי;2;25;וארד להצילו מיד מצרים ולהעלתו מן הארץ ההוא אל ארץ טובה ורחבה אל ארץ זבת חלב ודבש אל מקום הכנעני והחתי והאמרי והפרזי והחוי והיבוסי
(120469, 64, 4);5;ה;80917;(2, 3, 10, 4, 80917);21349;(2, 3, 10, 1, 21349);ועתה;4;1;ועתה לכה ואשלחך אל פרעה והוצא את עמי בני ישראל ממצרים
(120469, 64, 4);1;א;80981;(2, 3, 11, 25, 80981);21367;(2, 3, 11, 8, 21367);אלך;1;8;ויאמר משה אל האלהים מי אנכי כי אלך אל פרעה וכי אוציא את בני ישראל ממצרים
(120469, 64, 4);8;ח;81045;(2, 3, 12, 32, 81045);21385;(2, 3, 12, 10, 21385);שלחתיך;3;10;ויאמר כי אהיה עמך וזה לך האות כי אנכי שלחתיך בהוציאך את העם ממצרים תעבדון את האלהים על ההר הזה
(120469, 64, 4);50;נ;81109;(2, 3, 13, 21, 81109);21401;(2, 3, 13, 6, 21401);אנכי;2;6;ויאמר משה אל האלהים הנה אנכי בא אל בני ישראל ואמרתי להם אלהי אבותיכם שלחני אליכם ואמרו לי מה שמו מה אמר אלהם
(120469, 64, 4);5;ה;81173;(2, 3, 13, 85, 81173);21418;(2, 3, 13, 23, 21418);אלהם;3;23;ויאמר משה אל האלהים הנה אנכי בא אל בני ישראל ואמרתי להם אלהי אבותיכם שלחני אליכם ואמרו לי מה שמו מה אמר אלהם
(120469, 64, 4);1;א;81237;(2, 3, 15, 3, 81237);21434;(2, 3, 15, 1, 21434);ויאמר;3;1;ויאמר עוד אלהים אל משה כה תאמר אל בני ישראל יהוה אלהי אבתיכם אלהי אברהם אלהי יצחק ואלהי יעקב שלחני אליכם זה שמי לעלם וזה זכרי לדר דר
(120469, 64, 4);1;א;81301;(2, 3, 15, 67, 81301);21451;(2, 3, 15, 18, 21451);ואלהי;2;18;ויאמר עוד אלהים אל משה כה תאמר אל בני ישראל יהוה אלהי אבתיכם אלהי אברהם אלהי יצחק ואלהי יעקב שלחני אליכם זה שמי לעלם וזה זכרי לדר דר
(120469, 64, 4);5;ה;81365;(2, 3, 16, 26, 81365);21468;(2, 3, 16, 7, 21468);אלהם;3;7;לך ואספת את זקני ישראל ואמרת אלהם יהוה אלהי אבתיכם נראה אלי אלהי אברהם יצחק ויעקב לאמר פקד פקדתי אתכם ואת העשוי לכם במצרים
(120469, 64, 4);10;י;81429;(2, 3, 16, 90, 81429);21483;(2, 3, 16, 22, 21483);העשוי;5;22;לך ואספת את זקני ישראל ואמרת אלהם יהוה אלהי אבתיכם נראה אלי אלהי אברהם יצחק ויעקב לאמר פקד פקדתי אתכם ואת העשוי לכם במצרים
(120469, 64, 4);6;ו;81493;(2, 3, 17, 55, 81493);21498;(2, 3, 17, 13, 21498);והיבוסי;1;13;ואמר אעלה אתכם מעני מצרים אל ארץ הכנעני והחתי והאמרי והפרזי והחוי והיבוסי אל ארץ זבת חלב ודבש
(120469, 64, 4);1;א;81557;(2, 3, 18, 43, 81557);21514;(2, 3, 18, 11, 21514);אליו;1;11;ושמעו לקלך ובאת אתה וזקני ישראל אל מלך מצרים ואמרתם אליו יהוה אלהי העבריים נקרה עלינו ועתה נלכה נא דרך שלשת ימים במדבר ונזבחה ליהוה אלהינו
(120469, 64, 4);5;ה;81621;(2, 3, 18, 107, 81621);21528;(2, 3, 18, 25, 21528);ליהוה;5;25;ושמעו לקלך ובאת אתה וזקני ישראל אל מלך מצרים ואמרתם אליו יהוה אלהי העבריים נקרה עלינו ועתה נלכה נא דרך שלשת ימים במדבר ונזבחה ליהוה אלהינו
(120469, 64, 4);400;ת;81685;(2, 3, 20, 16, 81685);21545;(2, 3, 20, 4, 21545);והכיתי;5;4;ושלחתי את ידי והכיתי את מצרים בכל נפלאתי אשר אעשה בקרבו ואחרי כן ישלח אתכם
(120469, 64, 4);10;י;81749;(2, 3, 21, 20, 81749);21562;(2, 3, 21, 6, 21562);בעיני;5;6;ונתתי את חן העם הזה בעיני מצרים והיה כי תלכון לא תלכו ריקם
(120469, 64, 4);300;ש;81813;(2, 3, 22, 38, 81813);21579;(2, 3, 22, 10, 21579);ושמלת;2;10;ושאלה אשה משכנתה ומגרת ביתה כלי כסף וכלי זהב ושמלת ושמתם על בניכם ועל בנתיכם ונצלתם את מצרים
(120469, 64, 4);30;ל;81877;(2, 4, 1, 27, 81877);21595;(2, 4, 1, 8, 21595);ולא;2;8;ויען משה ויאמר והן לא יאמינו לי ולא ישמעו בקלי כי יאמרו לא נראה אליך יהוה
(120469, 64, 4);200;ר;81941;(2, 4, 3, 5, 81941);21611;(2, 4, 3, 1, 21611);ויאמר;5;1;ויאמר השליכהו ארצה וישלכהו ארצה ויהי לנחש וינס משה מפניו
(120469, 64, 4);1;א;82005;(2, 4, 4, 22, 82005);21627;(2, 4, 4, 7, 21627);ואחז;2;7;ויאמר יהוה אל משה שלח ידך ואחז בזנבו וישלח ידו ויחזק בו ויהי למטה בכפו
(120469, 64, 4);2;ב;82069;(2, 4, 5, 30, 82069);21643;(2, 4, 5, 8, 21643);אבתם;2;8;למען יאמינו כי נראה אליך יהוה אלהי אבתם אלהי אברהם אלהי יצחק ואלהי יעקב
(120469, 64, 4);8;ח;82133;(2, 4, 6, 36, 82133);21660;(2, 4, 6, 11, 21660);בחיקו;2;11;ויאמר יהוה לו עוד הבא נא ידך בחיקך ויבא ידו בחיקו ויוצאה והנה ידו מצרעת כשלג
(120469, 64, 4);10;י;82197;(2, 4, 7, 39, 82197);21676;(2, 4, 7, 11, 21676);מחיקו;3;11;ויאמר השב ידך אל חיקך וישב ידו אל חיקו ויוצאה מחיקו והנה שבה כבשרו
(120469, 64, 4);5;ה;82261;(2, 4, 8, 50, 82261);21693;(2, 4, 8, 14, 21693);האחרון;1;14;והיה אם לא יאמינו לך ולא ישמעו לקל האת הראשון והאמינו לקל האת האחרון
(120469, 64, 4);80;פ;82325;(2, 4, 9, 59, 82325);21708;(2, 4, 9, 15, 21708);ושפכת;3;15;והיה אם לא יאמינו גם לשני האתות האלה ולא ישמעון לקלך ולקחת ממימי היאר ושפכת היבשה והיו המים אשר תקח מן היאר והיו לדם ביבשת
(120469, 64, 4);300;ש;82389;(2, 4, 10, 25, 82389);21726;(2, 4, 10, 8, 21726);איש;3;8;ויאמר משה אל יהוה בי אדני לא איש דברים אנכי גם מתמול גם משלשם גם מאז דברך אל עבדך כי כבד פה וכבד לשון אנכי
(120469, 64, 4);5;ה;82453;(2, 4, 11, 7, 82453);21745;(2, 4, 11, 2, 21745);יהוה;2;2;ויאמר יהוה אליו מי שם פה לאדם או מי ישום אלם או חרש או פקח או עור הלא אנכי יהוה
