(n,d,k);LetterGematriaNumberValue;Letter;LetterPositionIndex;LetterCoordinatesD5K;WordNumber;WordCoordinatesDWTK;Found in Word in Text;LetterPositionIndex In Word;WordNumberInVerse;Found In Verse
(113310, -65, 4);1;א;15;(1, 1, 1, 15, 15);4;(1, 1, 1, 4, 4);את;1;4;בראשית ברא אלהים את השמים ואת הארץ
(113310, -65, 4);40;ם;80;(1, 1, 2, 52, 80);21;(1, 1, 2, 14, 21);המים;4;14;והארץ היתה תהו ובהו וחשך על פני תהום ורוח אלהים מרחפת על פני המים
(113310, -65, 4);5;ה;145;(1, 1, 4, 42, 145);39;(1, 1, 4, 12, 39);החשך;1;12;וירא אלהים את האור כי טוב ויבדל אלהים בין האור ובין החשך
(113310, -65, 4);10;י;210;(1, 1, 6, 13, 210);55;(1, 1, 6, 3, 55);יהי;3;3;ויאמר אלהים יהי רקיע בתוך המים ויהי מבדיל בין מים למים
(113310, -65, 4);8;ח;275;(1, 1, 7, 34, 275);72;(1, 1, 7, 9, 72);מתחת;3;9;ויעש אלהים את הרקיע ויבדל בין המים אשר מתחת לרקיע ובין המים אשר מעל לרקיע ויהי כן
(113310, -65, 4);10;י;340;(1, 1, 8, 34, 340);89;(1, 1, 8, 9, 89);יום;1;9;ויקרא אלהים לרקיע שמים ויהי ערב ויהי בקר יום שני
(113310, -65, 4);5;ה;405;(1, 1, 10, 8, 405);105;(1, 1, 10, 2, 105);אלהים;3;2;ויקרא אלהים ליבשה ארץ ולמקוה המים קרא ימים וירא אלהים כי טוב
(113310, -65, 4);2;ב;470;(1, 1, 11, 24, 470);121;(1, 1, 11, 6, 121);עשב;3;6;ויאמר אלהים תדשא הארץ דשא עשב מזריע זרע עץ פרי עשה פרי למינו אשר זרעו בו על הארץ ויהי כן
(113310, -65, 4);70;ע;535;(1, 1, 12, 20, 535);140;(1, 1, 12, 5, 140);מזריע;5;5;ותוצא הארץ דשא עשב מזריע זרע למינהו ועץ עשה פרי אשר זרעו בו למינהו וירא אלהים כי טוב
(113310, -65, 4);300;ש;600;(1, 1, 13, 18, 600);159;(1, 1, 13, 6, 159);שלישי;1;6;ויהי ערב ויהי בקר יום שלישי
(113310, -65, 4);6;ו;665;(1, 1, 14, 61, 665);173;(1, 1, 14, 14, 173);ולמועדים;4;14;ויאמר אלהים יהי מארת ברקיע השמים להבדיל בין היום ובין הלילה והיו לאתת ולמועדים ולימים ושנים
(113310, -65, 4);50;נ;730;(1, 1, 16, 13, 730);188;(1, 1, 16, 4, 188);שני;2;4;ויעש אלהים את שני המארת הגדלים את המאור הגדל לממשלת היום ואת המאור הקטן לממשלת הלילה ואת הכוכבים
(113310, -65, 4);10;י;795;(1, 1, 16, 78, 795);202;(1, 1, 16, 18, 202);הכוכבים;6;18;ויעש אלהים את שני המארת הגדלים את המאור הגדל לממשלת היום ואת המאור הקטן לממשלת הלילה ואת הכוכבים
(113310, -65, 4);2;ב;860;(1, 1, 18, 31, 860);217;(1, 1, 18, 7, 217);ובין;2;7;ולמשל ביום ובלילה ולהבדיל בין האור ובין החשך וירא אלהים כי טוב
(113310, -65, 4);50;נ;925;(1, 1, 20, 23, 925);234;(1, 1, 20, 6, 234);נפש;1;6;ויאמר אלהים ישרצו המים שרץ נפש חיה ועוף יעופף על הארץ על פני רקיע השמים
(113310, -65, 4);80;פ;990;(1, 1, 21, 31, 990);251;(1, 1, 21, 8, 251);נפש;2;8;ויברא אלהים את התנינם הגדלים ואת כל נפש החיה הרמשת אשר שרצו המים למינהם ואת כל עוף כנף למינהו וירא אלהים כי טוב
(113310, -65, 4);400;ת;1055;(1, 1, 22, 7, 1055);268;(1, 1, 22, 2, 268);אתם;2;2;ויברך אתם אלהים לאמר פרו ורבו ומלאו את המים בימים והעוף ירב בארץ
(113310, -65, 4);10;י;1120;(1, 1, 23, 20, 1120);285;(1, 1, 23, 6, 285);חמישי;3;6;ויהי ערב ויהי בקר יום חמישי
(113310, -65, 4);5;ה;1185;(1, 1, 25, 7, 1185);301;(1, 1, 25, 2, 301);אלהים;3;2;ויעש אלהים את חית הארץ למינה ואת הבהמה למינה ואת כל רמש האדמה למינהו וירא אלהים כי טוב
(113310, -65, 4);1;א;1250;(1, 1, 26, 3, 1250);318;(1, 1, 26, 1, 318);ויאמר;3;1;ויאמר אלהים נעשה אדם בצלמנו כדמותנו וירדו בדגת הים ובעוף השמים ובבהמה ובכל הארץ ובכל הרמש הרמש על הארץ
(113310, -65, 4);2;ב;1315;(1, 1, 26, 68, 1315);332;(1, 1, 26, 15, 332);ובכל;2;15;ויאמר אלהים נעשה אדם בצלמנו כדמותנו וירדו בדגת הים ובעוף השמים ובבהמה ובכל הארץ ובכל הרמש הרמש על הארץ
(113310, -65, 4);400;ת;1380;(1, 1, 27, 49, 1380);349;(1, 1, 27, 13, 349);אתם;2;13;ויברא אלהים את האדם בצלמו בצלם אלהים ברא אתו זכר ונקבה ברא אתם
(113310, -65, 4);6;ו;1445;(1, 1, 28, 64, 1445);365;(1, 1, 28, 16, 365);ובעוף;4;16;ויברך אתם אלהים ויאמר להם אלהים פרו ורבו ומלאו את הארץ וכבשה ורדו בדגת הים ובעוף השמים ובכל חיה הרמשת על הארץ
(113310, -65, 4);10;י;1510;(1, 1, 29, 41, 1510);384;(1, 1, 29, 13, 384);פני;3;13;ויאמר אלהים הנה נתתי לכם את כל עשב זרע זרע אשר על פני כל הארץ ואת כל העץ אשר בו פרי עץ זרע זרע לכם יהיה לאכלה
(113310, -65, 4);40;ם;1575;(1, 1, 30, 23, 1575);404;(1, 1, 30, 6, 404);השמים;5;6;ולכל חית הארץ ולכל עוף השמים ולכל רומש על הארץ אשר בו נפש חיה את כל ירק עשב לאכלה ויהי כן
(113310, -65, 4);5;ה;1640;(1, 1, 31, 19, 1640);425;(1, 1, 31, 6, 425);עשה;3;6;וירא אלהים את כל אשר עשה והנה טוב מאד ויהי ערב ויהי בקר יום הששי
(113310, -65, 4);6;ו;1705;(1, 2, 2, 12, 1705);442;(1, 2, 2, 3, 442);ביום;3;3;ויכל אלהים ביום השביעי מלאכתו אשר עשה וישבת ביום השביעי מכל מלאכתו אשר עשה
(113310, -65, 4);5;ה;1770;(1, 2, 3, 16, 1770);458;(1, 2, 3, 5, 458);השביעי;1;5;ויברך אלהים את יום השביעי ויקדש אתו כי בו שבת מכל מלאכתו אשר ברא אלהים לעשות
(113310, -65, 4);2;ב;1835;(1, 2, 4, 20, 1835);474;(1, 2, 4, 5, 474);בהבראם;1;5;אלה תולדות השמים והארץ בהבראם ביום עשות יהוה אלהים ארץ ושמים
(113310, -65, 4);10;י;1900;(1, 2, 5, 35, 1900);491;(1, 2, 5, 11, 491);יצמח;1;11;וכל שיח השדה טרם יהיה בארץ וכל עשב השדה טרם יצמח כי לא המטיר יהוה אלהים על הארץ ואדם אין לעבד את האדמה
(113310, -65, 4);400;ת;1965;(1, 2, 6, 20, 1965);509;(1, 2, 6, 6, 509);את;2;6;ואד יעלה מן הארץ והשקה את כל פני האדמה
(113310, -65, 4);40;ם;2030;(1, 2, 7, 55, 2030);526;(1, 2, 7, 14, 526);האדם;4;14;וייצר יהוה אלהים את האדם עפר מן האדמה ויפח באפיו נשמת חיים ויהי האדם לנפש חיה
(113310, -65, 4);5;ה;2095;(1, 2, 9, 17, 2095);545;(1, 2, 9, 5, 545);האדמה;1;5;ויצמח יהוה אלהים מן האדמה כל עץ נחמד למראה וטוב למאכל ועץ החיים בתוך הגן ועץ הדעת טוב ורע
(113310, -65, 4);50;ן;2160;(1, 2, 10, 11, 2160);562;(1, 2, 10, 3, 562);מעדן;4;3;ונהר יצא מעדן להשקות את הגן ומשם יפרד והיה לארבעה ראשים
(113310, -65, 4);5;ה;2225;(1, 2, 11, 31, 2225);579;(1, 2, 11, 9, 579);החוילה;6;9;שם האחד פישון הוא הסבב את כל ארץ החוילה אשר שם הזהב
(113310, -65, 4);400;ת;2290;(1, 2, 13, 26, 2290);597;(1, 2, 13, 7, 597);את;2;7;ושם הנהר השני גיחון הוא הסובב את כל ארץ כוש
(113310, -65, 4);5;ה;2355;(1, 2, 15, 8, 2355);614;(1, 2, 15, 2, 614);יהוה;4;2;ויקח יהוה אלהים את האדם וינחהו בגן עדן לעבדה ולשמרה
(113310, -65, 4);50;ן;2420;(1, 2, 16, 31, 2420);631;(1, 2, 16, 9, 631);הגן;3;9;ויצו יהוה אלהים על האדם לאמר מכל עץ הגן אכל תאכל
(113310, -65, 4);10;י;2485;(1, 2, 18, 13, 2485);649;(1, 2, 18, 3, 649);אלהים;4;3;ויאמר יהוה אלהים לא טוב היות האדם לבדו אעשה לו עזר כנגדו
(113310, -65, 4);20;כ;2550;(1, 2, 19, 33, 2550);668;(1, 2, 19, 10, 668);כל;1;10;ויצר יהוה אלהים מן האדמה כל חית השדה ואת כל עוף השמים ויבא אל האדם לראות מה יקרא לו וכל אשר יקרא לו האדם נפש חיה הוא שמו
(113310, -65, 4);1;א;2615;(1, 2, 20, 5, 2615);687;(1, 2, 20, 1, 687);ויקרא;5;1;ויקרא האדם שמות לכל הבהמה ולעוף השמים ולכל חית השדה ולאדם לא מצא עזר כנגדו
(113310, -65, 4);30;ל;2680;(1, 2, 21, 10, 2680);704;(1, 2, 21, 3, 704);אלהים;2;3;ויפל יהוה אלהים תרדמה על האדם ויישן ויקח אחת מצלעתיו ויסגר בשר תחתנה
(113310, -65, 4);70;ע;2745;(1, 2, 22, 19, 2745);719;(1, 2, 22, 5, 719);הצלע;4;5;ויבן יהוה אלהים את הצלע אשר לקח מן האדם לאשה ויבאה אל האדם
(113310, -65, 4);10;י;2810;(1, 2, 23, 38, 2810);737;(1, 2, 23, 10, 737);יקרא;1;10;ויאמר האדם זאת הפעם עצם מעצמי ובשר מבשרי לזאת יקרא אשה כי מאיש לקחה זאת
(113310, -65, 4);5;ה;2875;(1, 2, 25, 3, 2875);756;(1, 2, 25, 1, 756);ויהיו;3;1;ויהיו שניהם ערומים האדם ואשתו ולא יתבששו
(113310, -65, 4);30;ל;2940;(1, 3, 1, 34, 2940);772;(1, 3, 1, 10, 772);אלהים;2;10;והנחש היה ערום מכל חית השדה אשר עשה יהוה אלהים ויאמר אל האשה אף כי אמר אלהים לא תאכלו מכל עץ הגן
(113310, -65, 4);50;ן;3005;(1, 3, 2, 24, 3005);791;(1, 3, 2, 7, 791);הגן;3;7;ותאמר האשה אל הנחש מפרי עץ הגן נאכל
(113310, -65, 4);8;ח;3070;(1, 3, 4, 8, 3070);809;(1, 3, 4, 2, 809);הנחש;3;2;ויאמר הנחש אל האשה לא מות תמתון
(113310, -65, 4);10;י;3135;(1, 3, 5, 48, 3135);825;(1, 3, 5, 11, 825);כאלהים;5;11;כי ידע אלהים כי ביום אכלכם ממנו ונפקחו עיניכם והייתם כאלהים ידעי טוב ורע
(113310, -65, 4);100;ק;3200;(1, 3, 6, 54, 3200);842;(1, 3, 6, 14, 842);ותקח;3;14;ותרא האשה כי טוב העץ למאכל וכי תאוה הוא לעינים ונחמד העץ להשכיל ותקח מפריו ותאכל ותתן גם לאישה עמה ויאכל
(113310, -65, 4);200;ר;3265;(1, 3, 7, 35, 3265);857;(1, 3, 7, 8, 857);ויתפרו;5;8;ותפקחנה עיני שניהם וידעו כי עירמם הם ויתפרו עלה תאנה ויעשו להם חגרת
(113310, -65, 4);4;ד;3330;(1, 3, 8, 45, 3330);873;(1, 3, 8, 11, 873);האדם;3;11;וישמעו את קול יהוה אלהים מתהלך בגן לרוח היום ויתחבא האדם ואשתו מפני יהוה אלהים בתוך עץ הגן
(113310, -65, 4);1;א;3395;(1, 3, 10, 6, 3395);890;(1, 3, 10, 2, 890);את;1;2;ויאמר את קלך שמעתי בגן ואירא כי עירם אנכי ואחבא
(113310, -65, 4);6;ו;3460;(1, 3, 11, 33, 3460);909;(1, 3, 11, 11, 909);צויתיך;2;11;ויאמר מי הגיד לך כי עירם אתה המן העץ אשר צויתיך לבלתי אכל ממנו אכלת
(113310, -65, 4);1;א;3525;(1, 3, 13, 3, 3525);926;(1, 3, 13, 1, 926);ויאמר;3;1;ויאמר יהוה אלהים לאשה מה זאת עשית ותאמר האשה הנחש השיאני ואכל
(113310, -65, 4);50;נ;3590;(1, 3, 14, 18, 3590);942;(1, 3, 14, 5, 942);הנחש;2;5;ויאמר יהוה אלהים אל הנחש כי עשית זאת ארור אתה מכל הבהמה ומכל חית השדה על גחנך תלך ועפר תאכל כל ימי חייך
(113310, -65, 4);1;א;3655;(1, 3, 15, 2, 3655);961;(1, 3, 15, 1, 961);ואיבה;2;1;ואיבה אשית בינך ובין האשה ובין זרעך ובין זרעה הוא ישופך ראש ואתה תשופנו עקב
(113310, -65, 4);5;ה;3720;(1, 3, 16, 6, 3720);977;(1, 3, 16, 2, 977);האשה;4;2;אל האשה אמר הרבה ארבה עצבונך והרנך בעצב תלדי בנים ואל אישך תשוקתך והוא ימשל בך
(113310, -65, 4);200;ר;3785;(1, 3, 17, 8, 3785);993;(1, 3, 17, 2, 993);אמר;3;2;ולאדם אמר כי שמעת לקול אשתך ותאכל מן העץ אשר צויתיך לאמר לא תאכל ממנו ארורה האדמה בעבורך בעצבון תאכלנה כל ימי חייך
(113310, -65, 4);70;ע;3850;(1, 3, 17, 73, 3850);1010;(1, 3, 17, 19, 1010);בעצבון;2;19;ולאדם אמר כי שמעת לקול אשתך ותאכל מן העץ אשר צויתיך לאמר לא תאכל ממנו ארורה האדמה בעבורך בעצבון תאכלנה כל ימי חייך
(113310, -65, 4);70;ע;3915;(1, 3, 19, 16, 3915);1027;(1, 3, 19, 5, 1027);עד;1;5;בזעת אפיך תאכל לחם עד שובך אל האדמה כי ממנה לקחת כי עפר אתה ואל עפר תשוב
(113310, -65, 4);10;י;3980;(1, 3, 20, 25, 3980);1047;(1, 3, 20, 8, 1047);היתה;2;8;ויקרא האדם שם אשתו חוה כי הוא היתה אם כל חי
(113310, -65, 4);40;ם;4045;(1, 3, 22, 20, 4045);1063;(1, 3, 22, 5, 1063);האדם;4;5;ויאמר יהוה אלהים הן האדם היה כאחד ממנו לדעת טוב ורע ועתה פן ישלח ידו ולקח גם מעץ החיים ואכל וחי לעלם
(113310, -65, 4);5;ה;4110;(1, 3, 23, 6, 4110);1081;(1, 3, 23, 1, 1081);וישלחהו;6;1;וישלחהו יהוה אלהים מגן עדן לעבד את האדמה אשר לקח משם
(113310, -65, 4);5;ה;4175;(1, 3, 24, 29, 4175);1100;(1, 3, 24, 9, 1100);הכרבים;1;9;ויגרש את האדם וישכן מקדם לגן עדן את הכרבים ואת להט החרב המתהפכת לשמר את דרך עץ החיים
(113310, -65, 4);400;ת;4240;(1, 4, 1, 27, 4240);1117;(1, 4, 1, 8, 1117);את;2;8;והאדם ידע את חוה אשתו ותהר ותלד את קין ותאמר קניתי איש את יהוה
(113310, -65, 4);1;א;4305;(1, 4, 2, 43, 4305);1137;(1, 4, 2, 14, 1137);אדמה;1;14;ותסף ללדת את אחיו את הבל ויהי הבל רעה צאן וקין היה עבד אדמה
(113310, -65, 4);8;ח;4370;(1, 4, 4, 26, 4370);1153;(1, 4, 4, 7, 1153);ומחלבהן;3;7;והבל הביא גם הוא מבכרות צאנו ומחלבהן וישע יהוה אל הבל ואל מנחתו
(113310, -65, 4);6;ו;4435;(1, 4, 6, 1, 4435);1171;(1, 4, 6, 1, 1171);ויאמר;1;1;ויאמר יהוה אל קין למה חרה לך ולמה נפלו פניך
(113310, -65, 4);400;ת;4500;(1, 4, 7, 32, 4500);1189;(1, 4, 7, 9, 1189);חטאת;4;9;הלוא אם תיטיב שאת ואם לא תיטיב לפתח חטאת רבץ ואליך תשוקתו ואתה תמשל בו
(113310, -65, 4);5;ה;4565;(1, 4, 8, 41, 4565);1207;(1, 4, 8, 12, 1207);הבל;1;12;ויאמר קין אל הבל אחיו ויהי בהיותם בשדה ויקם קין אל הבל אחיו ויהרגהו
(113310, -65, 4);40;מ;4630;(1, 4, 10, 6, 4630);1224;(1, 4, 10, 2, 1224);מה;1;2;ויאמר מה עשית קול דמי אחיך צעקים אלי מן האדמה
(113310, -65, 4);1;א;4695;(1, 4, 11, 35, 4695);1243;(1, 4, 11, 11, 1243);את;1;11;ועתה ארור אתה מן האדמה אשר פצתה את פיה לקחת את דמי אחיך מידך
(113310, -65, 4);3;ג;4760;(1, 4, 13, 15, 4760);1264;(1, 4, 13, 5, 1264);גדול;1;5;ויאמר קין אל יהוה גדול עוני מנשוא
(113310, -65, 4);5;ה;4825;(1, 4, 14, 53, 4825);1280;(1, 4, 14, 14, 1280);והיה;4;14;הן גרשת אתי היום מעל פני האדמה ומפניך אסתר והייתי נע ונד בארץ והיה כל מצאי יהרגני
(113310, -65, 4);20;כ;4890;(1, 4, 15, 53, 4890);1298;(1, 4, 15, 15, 1298);הכות;2;15;ויאמר לו יהוה לכן כל הרג קין שבעתים יקם וישם יהוה לקין אות לבלתי הכות אתו כל מצאו
(113310, -65, 4);30;ל;4955;(1, 4, 17, 20, 4955);1316;(1, 4, 17, 6, 1316);ותלד;3;6;וידע קין את אשתו ותהר ותלד את חנוך ויהי בנה עיר ויקרא שם העיר כשם בנו חנוך
(113310, -65, 4);40;מ;5020;(1, 4, 18, 27, 5020);1335;(1, 4, 18, 8, 1335);מחויאל;1;8;ויולד לחנוך את עירד ועירד ילד את מחויאל ומחייאל ילד את מתושאל ומתושאל ילד את למך
(113310, -65, 4);300;ש;5085;(1, 4, 19, 27, 5085);1352;(1, 4, 19, 9, 1352);ושם;2;9;ויקח לו למך שתי נשים שם האחת עדה ושם השנית צלה
(113310, -65, 4);80;פ;5150;(1, 4, 21, 24, 5150);1372;(1, 4, 21, 8, 1372);תפש;2;8;ושם אחיו יובל הוא היה אבי כל תפש כנור ועוגב
(113310, -65, 4);5;ה;5215;(1, 4, 22, 55, 5215);1390;(1, 4, 22, 16, 1390);נעמה;4;16;וצלה גם הוא ילדה את תובל קין לטש כל חרש נחשת וברזל ואחות תובל קין נעמה
(113310, -65, 4);8;ח;5280;(1, 4, 23, 65, 5280);1407;(1, 4, 23, 17, 1407);לחברתי;2;17;ויאמר למך לנשיו עדה וצלה שמען קולי נשי למך האזנה אמרתי כי איש הרגתי לפצעי וילד לחברתי
(113310, -65, 4);300;ש;5345;(1, 4, 25, 33, 5345);1425;(1, 4, 25, 11, 1425);שת;1;11;וידע אדם עוד את אשתו ותלד בן ותקרא את שמו שת כי שת לי אלהים זרע אחר תחת הבל כי הרגו קין
(113310, -65, 4);6;ו;5410;(1, 4, 26, 32, 5410);1447;(1, 4, 26, 11, 1447);הוחל;2;11;ולשת גם הוא ילד בן ויקרא את שמו אנוש אז הוחל לקרא בשם יהוה
(113310, -65, 4);5;ה;5475;(1, 5, 2, 8, 5475);1464;(1, 5, 2, 2, 1464);ונקבה;5;2;זכר ונקבה בראם ויברך אתם ויקרא את שמם אדם ביום הבראם
(113310, -65, 4);20;כ;5540;(1, 5, 3, 31, 5540);1481;(1, 5, 3, 8, 1481);כצלמו;1;8;ויחי אדם שלשים ומאת שנה ויולד בדמותו כצלמו ויקרא את שמו שת
(113310, -65, 4);400;ת;5605;(1, 5, 4, 49, 5605);1498;(1, 5, 4, 13, 1498);ובנות;5;13;ויהיו ימי אדם אחרי הולידו את שת שמנה מאת שנה ויולד בנים ובנות
(113310, -65, 4);30;ל;5670;(1, 5, 6, 24, 5670);1517;(1, 5, 6, 7, 1517);ויולד;4;7;ויחי שת חמש שנים ומאת שנה ויולד את אנוש
(113310, -65, 4);5;ה;5735;(1, 5, 8, 3, 5735);1534;(1, 5, 8, 1, 1534);ויהיו;3;1;ויהיו כל ימי שת שתים עשרה שנה ותשע מאות שנה וימת
(113310, -65, 4);8;ח;5800;(1, 5, 10, 3, 5800);1552;(1, 5, 10, 1, 1552);ויחי;3;1;ויחי אנוש אחרי הולידו את קינן חמש עשרה שנה ושמנה מאות שנה ויולד בנים ובנות
(113310, -65, 4);10;י;5865;(1, 5, 11, 8, 5865);1569;(1, 5, 11, 3, 1569);ימי;1;3;ויהיו כל ימי אנוש חמש שנים ותשע מאות שנה וימת
(113310, -65, 4);50;ן;5930;(1, 5, 13, 8, 5930);1585;(1, 5, 13, 2, 1585);קינן;4;2;ויחי קינן אחרי הולידו את מהללאל ארבעים שנה ושמנה מאות שנה ויולד בנים ובנות
(113310, -65, 4);10;י;5995;(1, 5, 14, 12, 5995);1601;(1, 5, 14, 4, 1601);קינן;2;4;ויהיו כל ימי קינן עשר שנים ותשע מאות שנה וימת
(113310, -65, 4);5;ה;6060;(1, 5, 16, 6, 6060);1618;(1, 5, 16, 2, 1618);מהללאל;2;2;ויחי מהללאל אחרי הולידו את ירד שלשים שנה ושמנה מאות שנה ויולד בנים ובנות
(113310, -65, 4);5;ה;6125;(1, 5, 17, 12, 6125);1634;(1, 5, 17, 4, 1634);מהללאל;2;4;ויהיו כל ימי מהללאל חמש ותשעים שנה ושמנה מאות שנה וימת
(113310, -65, 4);400;ת;6190;(1, 5, 18, 33, 6190);1650;(1, 5, 18, 9, 1650);את;2;9;ויחי ירד שתים וששים שנה ומאת שנה ויולד את חנוך
(113310, -65, 4);4;ד;6255;(1, 5, 20, 13, 6255);1667;(1, 5, 20, 4, 1667);ירד;3;4;ויהיו כל ימי ירד שתים וששים שנה ותשע מאות שנה וימת
(113310, -65, 4);20;ך;6320;(1, 5, 22, 6, 6320);1683;(1, 5, 22, 1, 1683);ויתהלך;6;1;ויתהלך חנוך את האלהים אחרי הולידו את מתושלח שלש מאות שנה ויולד בנים ובנות
(113310, -65, 4);50;נ;6385;(1, 5, 23, 11, 6385);1700;(1, 5, 23, 4, 1700);חנוך;2;4;ויהי כל ימי חנוך חמש וששים שנה ושלש מאות שנה
(113310, -65, 4);10;י;6450;(1, 5, 25, 4, 6450);1716;(1, 5, 25, 1, 1716);ויחי;4;1;ויחי מתושלח שבע ושמנים שנה ומאת שנה ויולד את למך
(113310, -65, 4);6;ו;6515;(1, 5, 26, 30, 6515);1733;(1, 5, 26, 8, 1733);ושמונים;1;8;ויחי מתושלח אחרי הולידו את למך שתים ושמונים שנה ושבע מאות שנה ויולד בנים ובנות
(113310, -65, 4);70;ע;6580;(1, 5, 27, 31, 6580);1748;(1, 5, 27, 8, 1748);ותשע;4;8;ויהיו כל ימי מתושלח תשע וששים שנה ותשע מאות שנה וימת
(113310, -65, 4);50;נ;6645;(1, 5, 29, 20, 6645);1767;(1, 5, 29, 7, 1767);ינחמנו;2;7;ויקרא את שמו נח לאמר זה ינחמנו ממעשנו ומעצבון ידינו מן האדמה אשר אררה יהוה
(113310, -65, 4);6;ו;6710;(1, 5, 30, 25, 6710);1783;(1, 5, 30, 8, 1783);ותשעים;1;8;ויחי למך אחרי הולידו את נח חמש ותשעים שנה וחמש מאת שנה ויולד בנים ובנות
(113310, -65, 4);300;ש;6775;(1, 5, 31, 33, 6775);1800;(1, 5, 31, 10, 1800);שנה;1;10;ויהי כל ימי למך שבע ושבעים שנה ושבע מאות שנה וימת
(113310, -65, 4);50;נ;6840;(1, 6, 1, 20, 6840);1822;(1, 6, 1, 7, 1822);פני;2;7;ויהי כי החל האדם לרב על פני האדמה ובנות ילדו להם
(113310, -65, 4);30;ל;6905;(1, 6, 2, 47, 6905);1839;(1, 6, 2, 13, 1839);מכל;3;13;ויראו בני האלהים את בנות האדם כי טבת הנה ויקחו להם נשים מכל אשר בחרו
(113310, -65, 4);5;ה;6970;(1, 6, 4, 1, 6970);1857;(1, 6, 4, 1, 1857);הנפלים;1;1;הנפלים היו בארץ בימים ההם וגם אחרי כן אשר יבאו בני האלהים אל בנות האדם וילדו להם המה הגברים אשר מעולם אנשי השם
(113310, -65, 4);40;מ;7035;(1, 6, 4, 66, 7035);1874;(1, 6, 4, 18, 1874);המה;2;18;הנפלים היו בארץ בימים ההם וגם אחרי כן אשר יבאו בני האלהים אל בנות האדם וילדו להם המה הגברים אשר מעולם אנשי השם
(113310, -65, 4);20;כ;7100;(1, 6, 5, 43, 7100);1893;(1, 6, 5, 14, 1893);כל;1;14;וירא יהוה כי רבה רעת האדם בארץ וכל יצר מחשבת לבו רק רע כל היום
(113310, -65, 4);1;א;7165;(1, 6, 7, 25, 7165);1911;(1, 6, 7, 7, 1911);בראתי;3;7;ויאמר יהוה אמחה את האדם אשר בראתי מעל פני האדמה מאדם עד בהמה עד רמש ועד עוף השמים כי נחמתי כי עשיתם
(113310, -65, 4);50;נ;7230;(1, 6, 8, 12, 7230);1930;(1, 6, 8, 4, 1930);בעיני;4;4;ונח מצא חן בעיני יהוה
(113310, -65, 4);50;נ;7295;(1, 6, 10, 13, 7295);1948;(1, 6, 10, 4, 1948);בנים;2;4;ויולד נח שלשה בנים את שם את חם ואת יפת
(113310, -65, 4);50;נ;7360;(1, 6, 12, 18, 7360);1966;(1, 6, 12, 5, 1966);והנה;3;5;וירא אלהים את הארץ והנה נשחתה כי השחית כל בשר את דרכו על הארץ
(113310, -65, 4);200;ר;7425;(1, 6, 13, 35, 7425);1986;(1, 6, 13, 11, 1986);הארץ;3;11;ויאמר אלהים לנח קץ כל בשר בא לפני כי מלאה הארץ חמס מפניהם והנני משחיתם את הארץ
(113310, -65, 4);2;ב;7490;(1, 6, 14, 38, 7490);2004;(1, 6, 14, 12, 2004);מבית;2;12;עשה לך תבת עצי גפר קנים תעשה את התבה וכפרת אתה מבית ומחוץ בכפר
(113310, -65, 4);40;מ;7555;(1, 6, 15, 54, 7555);2021;(1, 6, 15, 15, 2021);קומתה;3;15;וזה אשר תעשה אתה שלש מאות אמה ארך התבה חמשים אמה רחבה ושלשים אמה קומתה
(113310, -65, 4);5;ה;7620;(1, 6, 16, 63, 7620);2036;(1, 6, 16, 15, 2036);תעשה;4;15;צהר תעשה לתבה ואל אמה תכלנה מלמעלה ופתח התבה בצדה תשים תחתים שנים ושלשים תעשה
(113310, -65, 4);1;א;7685;(1, 6, 17, 65, 7685);2056;(1, 6, 17, 20, 2056);בארץ;2;20;ואני הנני מביא את המבול מים על הארץ לשחת כל בשר אשר בו רוח חיים מתחת השמים כל אשר בארץ יגוע
(113310, -65, 4);20;כ;7750;(1, 6, 19, 9, 7750);2073;(1, 6, 19, 3, 2073);מכל;2;3;ומכל החי מכל בשר שנים מכל תביא אל התבה להחית אתך זכר ונקבה יהיו
(113310, -65, 4);5;ה;7815;(1, 6, 20, 24, 7815);2089;(1, 6, 20, 5, 2089);למינה;5;5;מהעוף למינהו ומן הבהמה למינה מכל רמש האדמה למינהו שנים מכל יבאו אליך להחיות
(113310, -65, 4);400;ת;7880;(1, 6, 21, 27, 7880);2106;(1, 6, 21, 8, 2106);ואספת;5;8;ואתה קח לך מכל מאכל אשר יאכל ואספת אליך והיה לך ולהם לאכלה
(113310, -65, 4);6;ו;7945;(1, 7, 1, 18, 7945);2126;(1, 7, 1, 6, 2126);וכל;1;6;ויאמר יהוה לנח בא אתה וכל ביתך אל התבה כי אתך ראיתי צדיק לפני בדור הזה
