(201382, -86, 4);5;ה;80638;(2, 3, 6, 29, 80638);21279;(2, 3, 6, 7, 21279);אלהי;3;7;ויאמר אנכי אלהי אביך אלהי אברהם אלהי יצחק ואלהי יעקב ויסתר משה פניו כי ירא מהביט אל האלהים
(201382, -86, 4);40;ם;80724;(2, 3, 7, 42, 80724);21301;(2, 3, 7, 11, 21301);צעקתם;5;11;ויאמר יהוה ראה ראיתי את עני עמי אשר במצרים ואת צעקתם שמעתי מפני נגשיו כי ידעתי את מכאביו
(201382, -86, 4);400;ת;80810;(2, 3, 8, 57, 80810);21323;(2, 3, 8, 15, 21323);זבת;3;15;וארד להצילו מיד מצרים ולהעלתו מן הארץ ההוא אל ארץ טובה ורחבה אל ארץ זבת חלב ודבש אל מקום הכנעני והחתי והאמרי והפרזי והחוי והיבוסי
(201382, -86, 4);8;ח;80896;(2, 3, 9, 38, 80896);21344;(2, 3, 9, 11, 21344);הלחץ;3;11;ועתה הנה צעקת בני ישראל באה אלי וגם ראיתי את הלחץ אשר מצרים לחצים אתם
(201382, -86, 4);30;ל;80982;(2, 3, 11, 26, 80982);21367;(2, 3, 11, 8, 21367);אלך;2;8;ויאמר משה אל האלהים מי אנכי כי אלך אל פרעה וכי אוציא את בני ישראל ממצרים
(201382, -86, 4);70;ע;81068;(2, 3, 12, 55, 81068);21390;(2, 3, 12, 15, 21390);תעבדון;2;15;ויאמר כי אהיה עמך וזה לך האות כי אנכי שלחתיך בהוציאך את העם ממצרים תעבדון את האלהים על ההר הזה
(201382, -86, 4);6;ו;81154;(2, 3, 13, 66, 81154);21412;(2, 3, 13, 17, 21412);ואמרו;1;17;ויאמר משה אל האלהים הנה אנכי בא אל בני ישראל ואמרתי להם אלהי אבותיכם שלחני אליכם ואמרו לי מה שמו מה אמר אלהם
(201382, -86, 4);70;ע;81240;(2, 3, 15, 6, 81240);21435;(2, 3, 15, 2, 21435);עוד;1;2;ויאמר עוד אלהים אל משה כה תאמר אל בני ישראל יהוה אלהי אבתיכם אלהי אברהם אלהי יצחק ואלהי יעקב שלחני אליכם זה שמי לעלם וזה זכרי לדר דר
(201382, -86, 4);30;ל;81326;(2, 3, 15, 92, 81326);21457;(2, 3, 15, 24, 21457);לעלם;3;24;ויאמר עוד אלהים אל משה כה תאמר אל בני ישראל יהוה אלהי אבתיכם אלהי אברהם אלהי יצחק ואלהי יעקב שלחני אליכם זה שמי לעלם וזה זכרי לדר דר
(201382, -86, 4);4;ד;81412;(2, 3, 16, 73, 81412);21479;(2, 3, 16, 18, 21479);פקד;3;18;לך ואספת את זקני ישראל ואמרת אלהם יהוה אלהי אבתיכם נראה אלי אלהי אברהם יצחק ויעקב לאמר פקד פקדתי אתכם ואת העשוי לכם במצרים
(201382, -86, 4);60;ס;81498;(2, 3, 17, 60, 81498);21498;(2, 3, 17, 13, 21498);והיבוסי;6;13;ואמר אעלה אתכם מעני מצרים אל ארץ הכנעני והחתי והאמרי והפרזי והחוי והיבוסי אל ארץ זבת חלב ודבש
(201382, -86, 4);6;ו;81584;(2, 3, 18, 70, 81584);21519;(2, 3, 18, 16, 21519);עלינו;5;16;ושמעו לקלך ובאת אתה וזקני ישראל אל מלך מצרים ואמרתם אליו יהוה אלהי העבריים נקרה עלינו ועתה נלכה נא דרך שלשת ימים במדבר ונזבחה ליהוה אלהינו
(201382, -86, 4);6;ו;81670;(2, 3, 20, 1, 81670);21542;(2, 3, 20, 1, 21542);ושלחתי;1;1;ושלחתי את ידי והכיתי את מצרים בכל נפלאתי אשר אעשה בקרבו ואחרי כן ישלח אתכם
(201382, -86, 4);5;ה;81756;(2, 3, 21, 27, 81756);21564;(2, 3, 21, 8, 21564);והיה;2;8;ונתתי את חן העם הזה בעיני מצרים והיה כי תלכון לא תלכו ריקם
(201382, -86, 4);400;ת;81842;(2, 3, 22, 67, 81842);21585;(2, 3, 22, 16, 21585);ונצלתם;5;16;ושאלה אשה משכנתה ומגרת ביתה כלי כסף וכלי זהב ושמלת ושמתם על בניכם ועל בנתיכם ונצלתם את מצרים
(201382, -86, 4);20;ך;81928;(2, 4, 2, 20, 81928);21608;(2, 4, 2, 5, 21608);בידך;4;5;ויאמר אליו יהוה מזה בידך ויאמר מטה
(201382, -86, 4);10;י;82014;(2, 4, 4, 31, 82014);21629;(2, 4, 4, 9, 21629);וישלח;2;9;ויאמר יהוה אל משה שלח ידך ואחז בזנבו וישלח ידו ויחזק בו ויהי למטה בכפו
(201382, -86, 4);1;א;82100;(2, 4, 6, 3, 82100);21650;(2, 4, 6, 1, 21650);ויאמר;3;1;ויאמר יהוה לו עוד הבא נא ידך בחיקך ויבא ידו בחיקו ויוצאה והנה ידו מצרעת כשלג
(201382, -86, 4);10;י;82186;(2, 4, 7, 28, 82186);21674;(2, 4, 7, 9, 21674);חיקו;2;9;ויאמר השב ידך אל חיקך וישב ידו אל חיקו ויוצאה מחיקו והנה שבה כבשרו
(201382, -86, 4);40;ם;82272;(2, 4, 9, 6, 82272);21695;(2, 4, 9, 2, 21695);אם;2;2;והיה אם לא יאמינו גם לשני האתות האלה ולא ישמעון לקלך ולקחת ממימי היאר ושפכת היבשה והיו המים אשר תקח מן היאר והיו לדם ביבשת
(201382, -86, 4);4;ד;82358;(2, 4, 9, 92, 82358);21717;(2, 4, 9, 24, 21717);לדם;2;24;והיה אם לא יאמינו גם לשני האתות האלה ולא ישמעון לקלך ולקחת ממימי היאר ושפכת היבשה והיו המים אשר תקח מן היאר והיו לדם ביבשת
(201382, -86, 4);50;נ;82444;(2, 4, 10, 80, 82444);21743;(2, 4, 10, 25, 21743);אנכי;2;25;ויאמר משה אל יהוה בי אדני לא איש דברים אנכי גם מתמול גם משלשם גם מאז דברך אל עבדך כי כבד פה וכבד לשון אנכי
(201382, -86, 4);200;ר;82530;(2, 4, 12, 24, 82530);21770;(2, 4, 12, 7, 21770);והוריתיך;4;7;ועתה לך ואנכי אהיה עם פיך והוריתיך אשר תדבר
(201382, -86, 4);6;ו;82616;(2, 4, 14, 52, 82616);21794;(2, 4, 14, 15, 21794);וגם;1;15;ויחר אף יהוה במשה ויאמר הלא אהרן אחיך הלוי ידעתי כי דבר ידבר הוא וגם הנה הוא יצא לקראתך וראך ושמח בלבו
(201382, -86, 4);40;ם;82702;(2, 4, 15, 57, 82702);21815;(2, 4, 15, 14, 21815);אתכם;4;14;ודברת אליו ושמת את הדברים בפיו ואנכי אהיה עם פיך ועם פיהו והוריתי אתכם את אשר תעשון
(201382, -86, 4);1;א;82788;(2, 4, 17, 30, 82788);21842;(2, 4, 17, 10, 21842);האתת;2;10;ואת המטה הזה תקח בידך אשר תעשה בו את האתת
(201382, -86, 4);300;ש;82874;(2, 4, 18, 84, 82874);21865;(2, 4, 18, 23, 21865);לשלום;2;23;וילך משה וישב אל יתר חתנו ויאמר לו אלכה נא ואשובה אל אחי אשר במצרים ואראה העודם חיים ויאמר יתרו למשה לך לשלום
(201382, -86, 4);5;ה;82960;(2, 4, 20, 29, 82960);21889;(2, 4, 20, 9, 21889);החמר;1;9;ויקח משה את אשתו ואת בניו וירכבם על החמר וישב ארצה מצרים ויקח משה את מטה האלהים בידו
(201382, -86, 4);2;ב;83046;(2, 4, 21, 48, 83046);21911;(2, 4, 21, 13, 21911);בידך;1;13;ויאמר יהוה אל משה בלכתך לשוב מצרימה ראה כל המפתים אשר שמתי בידך ועשיתם לפני פרעה ואני אחזק את לבו ולא ישלח את העם
(201382, -86, 4);1;א;83132;(2, 4, 23, 12, 83132);21935;(2, 4, 23, 4, 21935);את;1;4;ואמר אליך שלח את בני ויעבדני ותמאן לשלחו הנה אנכי הרג את בנך בכרך
(201382, -86, 4);400;ת;83218;(2, 4, 25, 12, 83218);21956;(2, 4, 25, 4, 21956);ותכרת;2;4;ותקח צפרה צר ותכרת את ערלת בנה ותגע לרגליו ותאמר כי חתן דמים אתה לי
(201382, -86, 4);100;ק;83304;(2, 4, 27, 19, 83304);21980;(2, 4, 27, 6, 21980);לקראת;2;6;ויאמר יהוה אל אהרן לך לקראת משה המדברה וילך ויפגשהו בהר האלהים וישק לו
(201382, -86, 4);6;ו;83390;(2, 4, 29, 1, 83390);22003;(2, 4, 29, 1, 22003);וילך;1;1;וילך משה ואהרן ויאספו את כל זקני בני ישראל
(201382, -86, 4);1;א;83476;(2, 4, 31, 3, 83476);22026;(2, 4, 31, 1, 22026);ויאמן;3;1;ויאמן העם וישמעו כי פקד יהוה את בני ישראל וכי ראה את ענים ויקדו וישתחוו
(201382, -86, 4);200;ר;83562;(2, 5, 1, 32, 83562);22049;(2, 5, 1, 9, 22049);אמר;3;9;ואחר באו משה ואהרן ויאמרו אל פרעה כה אמר יהוה אלהי ישראל שלח את עמי ויחגו לי במדבר
(201382, -86, 4);40;ם;83648;(2, 5, 2, 53, 83648);22073;(2, 5, 2, 15, 22073);וגם;3;15;ויאמר פרעה מי יהוה אשר אשמע בקלו לשלח את ישראל לא ידעתי את יהוה וגם את ישראל לא אשלח
(201382, -86, 4);2;ב;83734;(2, 5, 3, 73, 83734);22094;(2, 5, 3, 17, 22094);בדבר;1;17;ויאמרו אלהי העברים נקרא עלינו נלכה נא דרך שלשת ימים במדבר ונזבחה ליהוה אלהינו פן יפגענו בדבר או בחרב
(201382, -86, 4);5;ה;83820;(2, 5, 5, 21, 83820);22116;(2, 5, 5, 7, 22116);הארץ;1;7;ויאמר פרעה הן רבים עתה עם הארץ והשבתם אתם מסבלתם
(201382, -86, 4);400;ת;83906;(2, 5, 7, 29, 83906);22137;(2, 5, 7, 8, 22137);כתמול;2;8;לא תאספון לתת תבן לעם ללבן הלבנים כתמול שלשם הם ילכו וקששו להם תבן
(201382, -86, 4);70;ע;83992;(2, 5, 8, 62, 83992);22160;(2, 5, 8, 17, 22160);על;1;17;ואת מתכנת הלבנים אשר הם עשים תמול שלשם תשימו עליהם לא תגרעו ממנו כי נרפים הם על כן הם צעקים לאמר נלכה נזבחה לאלהינו
(201382, -86, 4);10;י;84078;(2, 5, 10, 17, 84078);22181;(2, 5, 10, 4, 22181);ושטריו;5;4;ויצאו נגשי העם ושטריו ויאמרו אל העם לאמר כה אמר פרעה אינני נתן לכם תבן
(201382, -86, 4);90;ץ;84164;(2, 5, 12, 4, 84164);22205;(2, 5, 12, 1, 22205);ויפץ;4;1;ויפץ העם בכל ארץ מצרים לקשש קש לתבן
(201382, -86, 4);200;ר;84250;(2, 5, 14, 14, 84250);22227;(2, 5, 14, 4, 22227);ישראל;3;4;ויכו שטרי בני ישראל אשר שמו עלהם נגשי פרעה לאמר מדוע לא כליתם חקכם ללבן כתמול שלשם גם תמול גם היום
(201382, -86, 4);100;ק;84336;(2, 5, 15, 22, 84336);22249;(2, 5, 15, 5, 22249);ויצעקו;5;5;ויבאו שטרי בני ישראל ויצעקו אל פרעה לאמר למה תעשה כה לעבדיך
(201382, -86, 4);200;ר;84422;(2, 5, 17, 7, 84422);22271;(2, 5, 17, 2, 22271);נרפים;2;2;ויאמר נרפים אתם נרפים על כן אתם אמרים נלכה נזבחה ליהוה
(201382, -86, 4);10;י;84508;(2, 5, 19, 12, 84508);22293;(2, 5, 19, 3, 22293);בני;3;3;ויראו שטרי בני ישראל אתם ברע לאמר לא תגרעו מלבניכם דבר יום ביומו
(201382, -86, 4);200;ר;84594;(2, 5, 21, 5, 84594);22314;(2, 5, 21, 1, 22314);ויאמרו;5;1;ויאמרו אלהם ירא יהוה עליכם וישפט אשר הבאשתם את ריחנו בעיני פרעה ובעיני עבדיו לתת חרב בידם להרגנו
(201382, -86, 4);6;ו;84680;(2, 5, 22, 12, 84680);22335;(2, 5, 22, 4, 22335);יהוה;3;4;וישב משה אל יהוה ויאמר אדני למה הרעתה לעם הזה למה זה שלחתני
(201382, -86, 4);200;ר;84766;(2, 6, 1, 5, 84766);22359;(2, 6, 1, 1, 22359);ויאמר;5;1;ויאמר יהוה אל משה עתה תראה אשר אעשה לפרעה כי ביד חזקה ישלחם וביד חזקה יגרשם מארצו
(201382, -86, 4);50;נ;84852;(2, 6, 2, 26, 84852);22382;(2, 6, 2, 7, 22382);אני;2;7;וידבר אלהים אל משה ויאמר אליו אני יהוה
(201382, -86, 4);70;ע;84938;(2, 6, 4, 32, 84938);22407;(2, 6, 4, 10, 22407);כנען;3;10;וגם הקמתי את בריתי אתם לתת להם את ארץ כנען את ארץ מגריהם אשר גרו בה
(201382, -86, 4);300;ש;85024;(2, 6, 6, 12, 85024);22431;(2, 6, 6, 4, 22431);ישראל;2;4;לכן אמר לבני ישראל אני יהוה והוצאתי אתכם מתחת סבלת מצרים והצלתי אתכם מעבדתם וגאלתי אתכם בזרוע נטויה ובשפטים גדלים
(201382, -86, 4);8;ח;85110;(2, 6, 7, 4, 85110);22448;(2, 6, 7, 1, 22448);ולקחתי;4;1;ולקחתי אתכם לי לעם והייתי לכם לאלהים וידעתם כי אני יהוה אלהיכם המוציא אתכם מתחת סבלות מצרים
(201382, -86, 4);200;ר;85196;(2, 6, 8, 15, 85196);22468;(2, 6, 8, 4, 22468);הארץ;3;4;והבאתי אתכם אל הארץ אשר נשאתי את ידי לתת אתה לאברהם ליצחק וליעקב ונתתי אתה לכם מורשה אני יהוה
(201382, -86, 4);70;ע;85282;(2, 6, 9, 26, 85282);22491;(2, 6, 9, 8, 22491);שמעו;3;8;וידבר משה כן אל בני ישראל ולא שמעו אל משה מקצר רוח ומעבדה קשה
(201382, -86, 4);300;ש;85368;(2, 6, 12, 7, 85368);22515;(2, 6, 12, 2, 22515);משה;2;2;וידבר משה לפני יהוה לאמר הן בני ישראל לא שמעו אלי ואיך ישמעני פרעה ואני ערל שפתים
(201382, -86, 4);30;ל;85454;(2, 6, 13, 28, 85454);22538;(2, 6, 13, 8, 22538);אל;2;8;וידבר יהוה אל משה ואל אהרן ויצום אל בני ישראל ואל פרעה מלך מצרים להוציא את בני ישראל מארץ מצרים
(201382, -86, 4);6;ו;85540;(2, 6, 14, 38, 85540);22560;(2, 6, 14, 10, 22560);ופלוא;4;10;אלה ראשי בית אבתם בני ראובן בכר ישראל חנוך ופלוא חצרן וכרמי אלה משפחת ראובן
(201382, -86, 4);5;ה;85626;(2, 6, 16, 4, 85626);22579;(2, 6, 16, 1, 22579);ואלה;4;1;ואלה שמות בני לוי לתלדתם גרשון וקהת ומררי ושני חיי לוי שבע ושלשים ומאת שנה
(201382, -86, 4);5;ה;85712;(2, 6, 18, 6, 85712);22600;(2, 6, 18, 2, 22600);קהת;2;2;ובני קהת עמרם ויצהר וחברון ועזיאל ושני חיי קהת שלש ושלשים ומאת שנה
(201382, -86, 4);100;ק;85798;(2, 6, 20, 3, 85798);22620;(2, 6, 20, 1, 22620);ויקח;3;1;ויקח עמרם את יוכבד דדתו לו לאשה ותלד לו את אהרן ואת משה ושני חיי עמרם שבע ושלשים ומאת שנה
(201382, -86, 4);200;ר;85884;(2, 6, 21, 19, 85884);22644;(2, 6, 21, 5, 22644);וזכרי;4;5;ובני יצהר קרח ונפג וזכרי
(201382, -86, 4);1;א;85970;(2, 6, 23, 60, 85970);22666;(2, 6, 23, 17, 22666);את;1;17;ויקח אהרן את אלישבע בת עמינדב אחות נחשון לו לאשה ותלד לו את נדב ואת אביהוא את אלעזר ואת איתמר
(201382, -86, 4);6;ו;86056;(2, 6, 25, 35, 86056);22687;(2, 6, 25, 10, 22687);ותלד;1;10;ואלעזר בן אהרן לקח לו מבנות פוטיאל לו לאשה ותלד לו את פינחס אלה ראשי אבות הלוים למשפחתם
(201382, -86, 4);30;ל;86142;(2, 6, 26, 51, 86142);22709;(2, 6, 26, 14, 22709);על;2;14;הוא אהרן ומשה אשר אמר יהוה להם הוציאו את בני ישראל מארץ מצרים על צבאתם
(201382, -86, 4);40;מ;86228;(2, 6, 28, 25, 86228);22732;(2, 6, 28, 8, 22732);מצרים;1;8;ויהי ביום דבר יהוה אל משה בארץ מצרים
(201382, -86, 4);200;ר;86314;(2, 6, 30, 23, 86314);22757;(2, 6, 30, 7, 22757);ערל;2;7;ויאמר משה לפני יהוה הן אני ערל שפתים ואיך ישמע אלי פרעה
(201382, -86, 4);1;א;86400;(2, 7, 2, 15, 86400);22780;(2, 7, 2, 6, 22780);אצוך;1;6;אתה תדבר את כל אשר אצוך ואהרן אחיך ידבר אל פרעה ושלח את בני ישראל מארצו
(201382, -86, 4);10;י;86486;(2, 7, 3, 45, 86486);22802;(2, 7, 3, 12, 22802);מצרים;4;12;ואני אקשה את לב פרעה והרביתי את אתתי ואת מופתי בארץ מצרים
(201382, -86, 4);90;צ;86572;(2, 7, 5, 7, 86572);22823;(2, 7, 5, 2, 22823);מצרים;2;2;וידעו מצרים כי אני יהוה בנטתי את ידי על מצרים והוצאתי את בני ישראל מתוכם
(201382, -86, 4);5;ה;86658;(2, 7, 7, 4, 86658);22846;(2, 7, 7, 1, 22846);ומשה;4;1;ומשה בן שמנים שנה ואהרן בן שלש ושמנים שנה בדברם אל פרעה
(201382, -86, 4);6;ו;86744;(2, 7, 9, 21, 86744);22870;(2, 7, 9, 6, 22870);תנו;3;6;כי ידבר אלכם פרעה לאמר תנו לכם מופת ואמרת אל אהרן קח את מטך והשלך לפני פרעה יהי לתנין
(201382, -86, 4);30;ל;86830;(2, 7, 10, 40, 86830);22894;(2, 7, 10, 11, 22894);וישלך;4;11;ויבא משה ואהרן אל פרעה ויעשו כן כאשר צוה יהוה וישלך אהרן את מטהו לפני פרעה ולפני עבדיו ויהי לתנין
(201382, -86, 4);9;ט;86916;(2, 7, 11, 48, 86916);22914;(2, 7, 11, 11, 22914);בלהטיהם;4;11;ויקרא גם פרעה לחכמים ולמכשפים ויעשו גם הם חרטמי מצרים בלהטיהם כן
(201382, -86, 4);10;י;87002;(2, 7, 14, 6, 87002);22936;(2, 7, 14, 2, 22936);יהוה;1;2;ויאמר יהוה אל משה כבד לב פרעה מאן לשלח העם
(201382, -86, 4);300;ש;87088;(2, 7, 15, 59, 87088);22960;(2, 7, 15, 16, 22960);לנחש;4;16;לך אל פרעה בבקר הנה יצא המימה ונצבת לקראתו על שפת היאר והמטה אשר נהפך לנחש תקח בידך
(201382, -86, 4);5;ה;87174;(2, 7, 17, 9, 87174);22983;(2, 7, 17, 3, 22983);יהוה;4;3;כה אמר יהוה בזאת תדע כי אני יהוה הנה אנכי מכה במטה אשר בידי על המים אשר ביאר ונהפכו לדם
(201382, -86, 4);30;ל;87260;(2, 7, 18, 27, 87260);23007;(2, 7, 18, 7, 23007);ונלאו;3;7;והדגה אשר ביאר תמות ובאש היאר ונלאו מצרים לשתות מים מן היאר
(201382, -86, 4);1;א;87346;(2, 7, 19, 65, 87346);23032;(2, 7, 19, 20, 23032);אגמיהם;1;20;ויאמר יהוה אל משה אמר אל אהרן קח מטך ונטה ידך על מימי מצרים על נהרתם על יאריהם ועל אגמיהם ועל כל מקוה מימיהם ויהיו דם והיה דם בכל ארץ מצרים ובעצים ובאבנים
(201382, -86, 4);200;ר;87432;(2, 7, 20, 29, 87432);23053;(2, 7, 20, 8, 23053);וירם;3;8;ויעשו כן משה ואהרן כאשר צוה יהוה וירם במטה ויך את המים אשר ביאר לעיני פרעה ולעיני עבדיו ויהפכו כל המים אשר ביאר לדם
(201382, -86, 4);1;א;87518;(2, 7, 21, 23, 87518);23075;(2, 7, 21, 6, 23075);היאר;3;6;והדגה אשר ביאר מתה ויבאש היאר ולא יכלו מצרים לשתות מים מן היאר ויהי הדם בכל ארץ מצרים
(201382, -86, 4);1;א;87604;(2, 7, 22, 41, 87604);23098;(2, 7, 22, 11, 23098);אלהם;1;11;ויעשו כן חרטמי מצרים בלטיהם ויחזק לב פרעה ולא שמע אלהם כאשר דבר יהוה
(201382, -86, 4);300;ש;87690;(2, 7, 24, 40, 87690);23122;(2, 7, 24, 11, 23122);לשתת;2;11;ויחפרו כל מצרים סביבת היאר מים לשתות כי לא יכלו לשתת ממימי היאר
(201382, -86, 4);1;א;87776;(2, 7, 26, 44, 87776);23146;(2, 7, 26, 14, 23146);את;1;14;ויאמר יהוה אל משה בא אל פרעה ואמרת אליו כה אמר יהוה שלח את עמי ויעבדני
(201382, -86, 4);300;ש;87862;(2, 7, 28, 35, 87862);23167;(2, 7, 28, 8, 23167);משכבך;2;8;ושרץ היאר צפרדעים ועלו ובאו בביתך ובחדר משכבך ועל מטתך ובבית עבדיך ובעמך ובתנוריך ובמשארותיך
(201382, -86, 4);300;ש;87948;(2, 8, 1, 13, 87948);23184;(2, 8, 1, 4, 23184);משה;2;4;ויאמר יהוה אל משה אמר אל אהרן נטה את ידך במטך על הנהרת על היארים ועל האגמים והעל את הצפרדעים על ארץ מצרים
(201382, -86, 4);10;י;88034;(2, 8, 2, 16, 88034);23209;(2, 8, 2, 6, 23209);מימי;2;6;ויט אהרן את ידו על מימי מצרים ותעל הצפרדע ותכס את ארץ מצרים
(201382, -86, 4);30;ל;88120;(2, 8, 4, 10, 88120);23229;(2, 8, 4, 3, 23229);למשה;1;3;ויקרא פרעה למשה ולאהרן ויאמר העתירו אל יהוה ויסר הצפרדעים ממני ומעמי ואשלחה את העם ויזבחו ליהוה
(201382, -86, 4);1;א;88206;(2, 8, 5, 17, 88206);23247;(2, 8, 5, 4, 23247);התפאר;4;4;ויאמר משה לפרעה התפאר עלי למתי אעתיר לך ולעבדיך ולעמך להכרית הצפרדעים ממך ומבתיך רק ביאר תשארנה
(201382, -86, 4);400;ת;88292;(2, 8, 6, 24, 88292);23266;(2, 8, 6, 6, 23266);תדע;1;6;ויאמר למחר ויאמר כדברך למען תדע כי אין כיהוה אלהינו
(201382, -86, 4);70;ע;88378;(2, 8, 8, 23, 88378);23285;(2, 8, 8, 6, 23285);ויצעק;4;6;ויצא משה ואהרן מעם פרעה ויצעק משה אל יהוה על דבר הצפרדעים אשר שם לפרעה
(201382, -86, 4);2;ב;88464;(2, 8, 10, 4, 88464);23307;(2, 8, 10, 1, 23307);ויצברו;4;1;ויצברו אתם חמרם חמרם ותבאש הארץ
(201382, -86, 4);5;ה;88550;(2, 8, 12, 14, 88550);23330;(2, 8, 12, 4, 23330);משה;3;4;ויאמר יהוה אל משה אמר אל אהרן נטה את מטך והך את עפר הארץ והיה לכנם בכל ארץ מצרים
(201382, -86, 4);400;ת;88636;(2, 8, 13, 38, 88636);23357;(2, 8, 13, 12, 23357);ותהי;2;12;ויעשו כן ויט אהרן את ידו במטהו ויך את עפר הארץ ותהי הכנם באדם ובבהמה כל עפר הארץ היה כנים בכל ארץ מצרים
(201382, -86, 4);5;ה;88722;(2, 8, 14, 43, 88722);23378;(2, 8, 14, 10, 23378);ותהי;3;10;ויעשו כן החרטמים בלטיהם להוציא את הכנים ולא יכלו ותהי הכנם באדם ובבהמה
(201382, -86, 4);5;ה;88808;(2, 8, 16, 9, 88808);23399;(2, 8, 16, 2, 23399);יהוה;4;2;ויאמר יהוה אל משה השכם בבקר והתיצב לפני פרעה הנה יוצא המימה ואמרת אליו כה אמר יהוה שלח עמי ויעבדני
(201382, -86, 4);40;מ;88894;(2, 8, 17, 16, 88894);23423;(2, 8, 17, 6, 23423);עמי;2;6;כי אם אינך משלח את עמי הנני משליח בך ובעבדיך ובעמך ובבתיך את הערב ומלאו בתי מצרים את הערב וגם האדמה אשר הם עליה
(201382, -86, 4);6;ו;88980;(2, 8, 18, 14, 88980);23444;(2, 8, 18, 3, 23444);ההוא;3;3;והפליתי ביום ההוא את ארץ גשן אשר עמי עמד עליה לבלתי היות שם ערב למען תדע כי אני יהוה בקרב הארץ
(201382, -86, 4);10;י;89066;(2, 8, 19, 26, 89066);23470;(2, 8, 19, 8, 23470);יהיה;1;8;ושמתי פדת בין עמי ובין עמך למחר יהיה האת הזה
(201382, -86, 4);40;מ;89152;(2, 8, 21, 12, 89152);23493;(2, 8, 21, 4, 23493);משה;1;4;ויקרא פרעה אל משה ולאהרן ויאמר לכו זבחו לאלהיכם בארץ
(201382, -86, 4);1;א;89238;(2, 8, 22, 55, 89238);23514;(2, 8, 22, 15, 23514);את;1;15;ויאמר משה לא נכון לעשות כן כי תועבת מצרים נזבח ליהוה אלהינו הן נזבח את תועבת מצרים לעיניהם ולא יסקלנו
(201382, -86, 4);1;א;89324;(2, 8, 24, 10, 89324);23533;(2, 8, 24, 3, 23533);אנכי;1;3;ויאמר פרעה אנכי אשלח אתכם וזבחתם ליהוה אלהיכם במדבר רק הרחק לא תרחיקו ללכת העתירו בעדי
(201382, -86, 4);5;ה;89410;(2, 8, 25, 25, 89410);23553;(2, 8, 25, 7, 23553);והעתרתי;2;7;ויאמר משה הנה אנכי יוצא מעמך והעתרתי אל יהוה וסר הערב מפרעה מעבדיו ומעמו מחר רק אל יסף פרעה התל לבלתי שלח את העם לזבח ליהוה
(201382, -86, 4);70;ע;89496;(2, 8, 26, 13, 89496);23576;(2, 8, 26, 4, 23576);פרעה;3;4;ויצא משה מעם פרעה ויעתר אל יהוה
(201382, -86, 4);30;ל;89582;(2, 8, 28, 26, 89582);23599;(2, 8, 28, 8, 23599);ולא;2;8;ויכבד פרעה את לבו גם בפעם הזאת ולא שלח את העם
(201382, -86, 4);300;ש;89668;(2, 9, 2, 12, 89668);23625;(2, 9, 2, 5, 23625);לשלח;2;5;כי אם מאן אתה לשלח ועודך מחזיק בם
(201382, -86, 4);10;י;89754;(2, 9, 4, 11, 89754);23646;(2, 9, 4, 3, 23646);בין;2;3;והפלה יהוה בין מקנה ישראל ובין מקנה מצרים ולא ימות מכל לבני ישראל דבר
(201382, -86, 4);70;ע;89840;(2, 9, 6, 3, 89840);23668;(2, 9, 6, 1, 23668);ויעש;3;1;ויעש יהוה את הדבר הזה ממחרת וימת כל מקנה מצרים וממקנה בני ישראל לא מת אחד
(201382, -86, 4);8;ח;89926;(2, 9, 7, 31, 89926);23692;(2, 9, 7, 9, 23692);אחד;2;9;וישלח פרעה והנה לא מת ממקנה ישראל עד אחד ויכבד לב פרעה ולא שלח את העם
(201382, -86, 4);80;פ;90012;(2, 9, 8, 63, 90012);23716;(2, 9, 8, 17, 23716);פרעה;1;17;ויאמר יהוה אל משה ואל אהרן קחו לכם מלא חפניכם פיח כבשן וזרקו משה השמימה לעיני פרעה
