(285910, 96, 4);90;צ;154582;(3, 10, 7, 16, 154582);40783;(3, 10, 7, 5, 40783);תצאו;2;5;ומפתח אהל מועד לא תצאו פן תמתו כי שמן משחת יהוה עליכם ויעשו כדבר משה
(285910, 96, 4);30;ל;154678;(3, 10, 9, 39, 154678);40810;(3, 10, 9, 12, 40810);ולא;2;12;יין ושכר אל תשת אתה ובניך אתך בבאכם אל אהל מועד ולא תמתו חקת עולם לדרתיכם
(285910, 96, 4);5;ה;154774;(3, 10, 11, 39, 154774);40834;(3, 10, 11, 11, 40834);אליהם;4;11;ולהורת את בני ישראל את כל החקים אשר דבר יהוה אליהם ביד משה
(285910, 96, 4);100;ק;154870;(3, 10, 12, 89, 154870);40859;(3, 10, 12, 23, 40859);קדשים;1;23;וידבר משה אל אהרן ואל אלעזר ואל איתמר בניו הנותרים קחו את המנחה הנותרת מאשי יהוה ואכלוה מצות אצל המזבח כי קדש קדשים הוא
(285910, 96, 4);1;א;154966;(3, 10, 14, 39, 154966);40884;(3, 10, 14, 10, 40884);אתה;1;10;ואת חזה התנופה ואת שוק התרומה תאכלו במקום טהור אתה ובניך ובנתיך אתך כי חקך וחק בניך נתנו מזבחי שלמי בני ישראל
(285910, 96, 4);80;פ;155062;(3, 10, 15, 47, 155062);40907;(3, 10, 15, 11, 40907);לפני;2;11;שוק התרומה וחזה התנופה על אשי החלבים יביאו להניף תנופה לפני יהוה והיה לך ולבניך אתך לחק עולם כאשר צוה יהוה
(285910, 96, 4);50;נ;155158;(3, 10, 16, 57, 155158);40933;(3, 10, 16, 16, 40933);הנותרם;2;16;ואת שעיר החטאת דרש דרש משה והנה שרף ויקצף על אלעזר ועל איתמר בני אהרן הנותרם לאמר
(285910, 96, 4);1;א;155254;(3, 10, 18, 8, 155254);40959;(3, 10, 18, 3, 40959);הובא;4;3;הן לא הובא את דמה אל הקדש פנימה אכול תאכלו אתה בקדש כאשר צויתי
(285910, 96, 4);5;ה;155350;(3, 10, 19, 55, 155350);40984;(3, 10, 19, 14, 40984);ותקראנה;7;14;וידבר אהרן אל משה הן היום הקריבו את חטאתם ואת עלתם לפני יהוה ותקראנה אתי כאלה ואכלתי חטאת היום הייטב בעיני יהוה
(285910, 96, 4);1;א;155446;(3, 11, 2, 13, 155446);41008;(3, 11, 2, 4, 41008);ישראל;4;4;דברו אל בני ישראל לאמר זאת החיה אשר תאכלו מכל הבהמה אשר על הארץ
(285910, 96, 4);70;ע;155542;(3, 11, 4, 16, 155542);41035;(3, 11, 4, 6, 41035);ממעלי;3;6;אך את זה לא תאכלו ממעלי הגרה וממפרסי הפרסה את הגמל כי מעלה גרה הוא ופרסה איננו מפריס טמא הוא לכם
(285910, 96, 4);6;ו;155638;(3, 11, 5, 36, 155638);41061;(3, 11, 5, 11, 41061);הוא;2;11;ואת השפן כי מעלה גרה הוא ופרסה לא יפריס טמא הוא לכם
(285910, 96, 4);1;א;155734;(3, 11, 7, 48, 155734);41088;(3, 11, 7, 14, 41088);טמא;3;14;ואת החזיר כי מפריס פרסה הוא ושסע שסע פרסה והוא גרה לא יגר טמא הוא לכם
(285910, 96, 4);400;ת;155830;(3, 11, 9, 55, 155830);41114;(3, 11, 9, 15, 41114);אתם;2;15;את זה תאכלו מכל אשר במים כל אשר לו סנפיר וקשקשת במים בימים ובנחלים אתם תאכלו
(285910, 96, 4);1;א;155926;(3, 11, 11, 20, 155926);41140;(3, 11, 11, 6, 41140);תאכלו;2;6;ושקץ יהיו לכם מבשרם לא תאכלו ואת נבלתם תשקצו
(285910, 96, 4);5;ה;156022;(3, 11, 13, 46, 156022);41168;(3, 11, 13, 15, 41168);העזניה;1;15;ואת אלה תשקצו מן העוף לא יאכלו שקץ הם את הנשר ואת הפרס ואת העזניה
(285910, 96, 4);80;ף;156118;(3, 11, 17, 23, 156118);41193;(3, 11, 17, 6, 41193);הינשוף;6;6;ואת הכוס ואת השלך ואת הינשוף
(285910, 96, 4);1;א;156214;(3, 11, 21, 8, 156214);41220;(3, 11, 21, 4, 41220);תאכלו;2;4;אך את זה תאכלו מכל שרץ העוף ההלך על ארבע אשר לא כרעים ממעל לרגליו לנתר בהן על הארץ
(285910, 96, 4);6;ו;156310;(3, 11, 22, 40, 156310);41246;(3, 11, 22, 11, 41246);ואת;1;11;את אלה מהם תאכלו את הארבה למינו ואת הסלעם למינהו ואת החרגל למינהו ואת החגב למינהו
(285910, 96, 4);50;נ;156406;(3, 11, 25, 5, 156406);41271;(3, 11, 25, 2, 41271);הנשא;2;2;וכל הנשא מנבלתם יכבס בגדיו וטמא עד הערב
(285910, 96, 4);10;י;156502;(3, 11, 26, 69, 156502);41296;(3, 11, 26, 19, 41296);יטמא;1;19;לכל הבהמה אשר הוא מפרסת פרסה ושסע איננה שסעת וגרה איננה מעלה טמאים הם לכם כל הנגע בהם יטמא
(285910, 96, 4);200;ר;156598;(3, 11, 28, 30, 156598);41322;(3, 11, 28, 8, 41322);הערב;3;8;והנשא את נבלתם יכבס בגדיו וטמא עד הערב טמאים המה לכם
(285910, 96, 4);40;ם;156694;(3, 11, 31, 12, 156694);41344;(3, 11, 31, 3, 41344);לכם;3;3;אלה הטמאים לכם בכל השרץ כל הנגע בהם במתם יטמא עד הערב
(285910, 96, 4);40;ם;156790;(3, 11, 32, 66, 156790);41375;(3, 11, 32, 22, 41375);בהם;3;22;וכל אשר יפל עליו מהם במתם יטמא מכל כלי עץ או בגד או עור או שק כל כלי אשר יעשה מלאכה בהם במים יובא וטמא עד הערב וטהר
(285910, 96, 4);10;י;156886;(3, 11, 34, 27, 156886);41403;(3, 11, 34, 8, 41403);מים;2;8;מכל האכל אשר יאכל אשר יבוא עליו מים יטמא וכל משקה אשר ישתה בכל כלי יטמא
(285910, 96, 4);40;מ;156982;(3, 11, 36, 11, 156982);41429;(3, 11, 36, 4, 41429);מקוה;1;4;אך מעין ובור מקוה מים יהיה טהור ונגע בנבלתם יטמא
(285910, 96, 4);1;א;157078;(3, 11, 38, 31, 157078);41455;(3, 11, 38, 9, 41455);טמא;3;9;וכי יתן מים על זרע ונפל מנבלתם עליו טמא הוא לכם
(285910, 96, 4);5;ה;157174;(3, 11, 40, 42, 157174);41480;(3, 11, 40, 10, 41480);נבלתה;5;10;והאכל מנבלתה יכבס בגדיו וטמא עד הערב והנשא את נבלתה יכבס בגדיו וטמא עד הערב
(285910, 96, 4);200;ר;157270;(3, 11, 42, 48, 157270);41509;(3, 11, 42, 15, 41509);השרץ;3;15;כל הולך על גחון וכל הולך על ארבע עד כל מרבה רגלים לכל השרץ השרץ על הארץ לא תאכלום כי שקץ הם
(285910, 96, 4);400;ת;157366;(3, 11, 44, 28, 157366);41534;(3, 11, 44, 6, 41534);והייתם;5;6;כי אני יהוה אלהיכם והתקדשתם והייתם קדשים כי קדוש אני ולא תטמאו את נפשתיכם בכל השרץ הרמש על הארץ
(285910, 96, 4);100;ק;157462;(3, 11, 45, 47, 157462);41559;(3, 11, 45, 12, 41559);קדשים;1;12;כי אני יהוה המעלה אתכם מארץ מצרים להית לכם לאלהים והייתם קדשים כי קדוש אני
(285910, 96, 4);5;ה;157558;(3, 11, 47, 29, 157558);41583;(3, 11, 47, 7, 41583);החיה;4;7;להבדיל בין הטמא ובין הטהר ובין החיה הנאכלת ובין החיה אשר לא תאכל
(285910, 96, 4);400;ת;157654;(3, 12, 2, 55, 157654);41609;(3, 12, 2, 15, 41609);נדת;3;15;דבר אל בני ישראל לאמר אשה כי תזריע וילדה זכר וטמאה שבעת ימים כימי נדת דותה תטמא
(285910, 96, 4);200;ר;157750;(3, 12, 4, 65, 157750);41635;(3, 12, 4, 19, 41635);טהרה;3;19;ושלשים יום ושלשת ימים תשב בדמי טהרה בכל קדש לא תגע ואל המקדש לא תבא עד מלאת ימי טהרה
(285910, 96, 4);10;י;157846;(3, 12, 6, 42, 157846);41662;(3, 12, 6, 13, 41662);יונה;1;13;ובמלאת ימי טהרה לבן או לבת תביא כבש בן שנתו לעלה ובן יונה או תר לחטאת אל פתח אהל מועד אל הכהן
(285910, 96, 4);40;מ;157942;(3, 12, 8, 7, 157942);41688;(3, 12, 8, 3, 41688);תמצא;2;3;ואם לא תמצא ידה די שה ולקחה שתי תרים או שני בני יונה אחד לעלה ואחד לחטאת וכפר עליה הכהן וטהרה
(285910, 96, 4);10;י;158038;(3, 13, 2, 5, 158038);41715;(3, 13, 2, 2, 41715);כי;2;2;אדם כי יהיה בעור בשרו שאת או ספחת או בהרת והיה בעור בשרו לנגע צרעת והובא אל אהרן הכהן או אל אחד מבניו הכהנים
(285910, 96, 4);70;ע;158134;(3, 13, 3, 16, 158134);41742;(3, 13, 3, 5, 41742);בעור;2;5;וראה הכהן את הנגע בעור הבשר ושער בנגע הפך לבן ומראה הנגע עמק מעור בשרו נגע צרעת הוא וראהו הכהן וטמא אתו
(285910, 96, 4);40;מ;158230;(3, 13, 4, 30, 158230);41768;(3, 13, 4, 9, 41768);מראה;1;9;ואם בהרת לבנה הוא בעור בשרו ועמק אין מראה מן העור ושערה לא הפך לבן והסגיר הכהן את הנגע שבעת ימים
(285910, 96, 4);6;ו;158326;(3, 13, 5, 50, 158326);41793;(3, 13, 5, 13, 41793);והסגירו;1;13;וראהו הכהן ביום השביעי והנה הנגע עמד בעיניו לא פשה הנגע בעור והסגירו הכהן שבעת ימים שנית
(285910, 96, 4);4;ד;158422;(3, 13, 6, 74, 158422);41816;(3, 13, 6, 19, 41816);בגדיו;3;19;וראה הכהן אתו ביום השביעי שנית והנה כהה הנגע ולא פשה הנגע בעור וטהרו הכהן מספחת הוא וכבס בגדיו וטהר
(285910, 96, 4);5;ה;158518;(3, 13, 8, 34, 158518);41839;(3, 13, 8, 8, 41839);הכהן;3;8;וראה הכהן והנה פשתה המספחת בעור וטמאו הכהן צרעת הוא
(285910, 96, 4);400;ת;158614;(3, 13, 11, 9, 158614);41865;(3, 13, 11, 2, 41865);נושנת;5;2;צרעת נושנת הוא בעור בשרו וטמאו הכהן לא יסגרנו כי טמא הוא
(285910, 96, 4);1;א;158710;(3, 13, 12, 60, 158710);41891;(3, 13, 12, 16, 41891);מראה;3;16;ואם פרוח תפרח הצרעת בעור וכסתה הצרעת את כל עור הנגע מראשו ועד רגליו לכל מראה עיני הכהן
(285910, 96, 4);5;ה;158806;(3, 13, 15, 11, 158806);41919;(3, 13, 15, 4, 41919);הבשר;1;4;וראה הכהן את הבשר החי וטמאו הבשר החי טמא הוא צרעת הוא
(285910, 96, 4);5;ה;158902;(3, 13, 17, 32, 158902);41945;(3, 13, 17, 8, 41945);הכהן;3;8;וראהו הכהן והנה נהפך הנגע ללבן וטהר הכהן את הנגע טהור הוא
(285910, 96, 4);6;ו;158998;(3, 13, 20, 9, 158998);41971;(3, 13, 20, 3, 41971);והנה;1;3;וראה הכהן והנה מראה שפל מן העור ושערה הפך לבן וטמאו הכהן נגע צרעת הוא בשחין פרחה
(285910, 96, 4);70;ע;159094;(3, 13, 21, 41, 159094);41997;(3, 13, 21, 12, 41997);העור;2;12;ואם יראנה הכהן והנה אין בה שער לבן ושפלה איננה מן העור והיא כהה והסגירו הכהן שבעת ימים
(285910, 96, 4);9;ט;159190;(3, 13, 23, 37, 159190);42022;(3, 13, 23, 10, 42022);וטהרו;2;10;ואם תחתיה תעמד הבהרת לא פשתה צרבת השחין הוא וטהרו הכהן
(285910, 96, 4);1;א;159286;(3, 13, 25, 34, 159286);42047;(3, 13, 25, 9, 42047);ומראה;4;9;וראה אתה הכהן והנה נהפך שער לבן בבהרת ומראה עמק מן העור צרעת הוא במכוה פרחה וטמא אתו הכהן נגע צרעת הוא
(285910, 96, 4);6;ו;159382;(3, 13, 26, 49, 159382);42073;(3, 13, 26, 13, 42073);והוא;3;13;ואם יראנה הכהן והנה אין בבהרת שער לבן ושפלה איננה מן העור והוא כהה והסגירו הכהן שבעת ימים
(285910, 96, 4);80;פ;159478;(3, 13, 28, 20, 159478);42098;(3, 13, 28, 6, 42098);פשתה;1;6;ואם תחתיה תעמד הבהרת לא פשתה בעור והוא כהה שאת המכוה הוא וטהרו הכהן כי צרבת המכוה הוא
(285910, 96, 4);5;ה;159574;(3, 13, 30, 18, 159574);42125;(3, 13, 30, 5, 42125);והנה;4;5;וראה הכהן את הנגע והנה מראהו עמק מן העור ובו שער צהב דק וטמא אתו הכהן נתק הוא צרעת הראש או הזקן הוא
(285910, 96, 4);50;ן;159670;(3, 13, 31, 37, 159670);42154;(3, 13, 31, 11, 42154);מן;2;11;וכי יראה הכהן את נגע הנתק והנה אין מראהו עמק מן העור ושער שחר אין בו והסגיר הכהן את נגע הנתק שבעת ימים
(285910, 96, 4);40;מ;159766;(3, 13, 32, 53, 159766);42182;(3, 13, 32, 16, 42182);ומראה;2;16;וראה הכהן את הנגע ביום השביעי והנה לא פשה הנתק ולא היה בו שער צהב ומראה הנתק אין עמק מן העור
(285910, 96, 4);1;א;159862;(3, 13, 34, 30, 159862);42207;(3, 13, 34, 8, 42207);לא;2;8;וראה הכהן את הנתק ביום השביעי והנה לא פשה הנתק בעור ומראהו איננו עמק מן העור וטהר אתו הכהן וכבס בגדיו וטהר
(285910, 96, 4);80;פ;159958;(3, 13, 36, 14, 159958);42232;(3, 13, 36, 4, 42232);פשה;1;4;וראהו הכהן והנה פשה הנתק בעור לא יבקר הכהן לשער הצהב טמא הוא
(285910, 96, 4);20;כ;160054;(3, 13, 38, 10, 160054);42259;(3, 13, 38, 4, 42259);כי;1;4;ואיש או אשה כי יהיה בעור בשרם בהרת בהרת לבנת
(285910, 96, 4);6;ו;160150;(3, 13, 40, 19, 160150);42285;(3, 13, 40, 6, 42285);הוא;2;6;ואיש כי ימרט ראשו קרח הוא טהור הוא
(285910, 96, 4);6;ו;160246;(3, 13, 43, 1, 160246);42311;(3, 13, 43, 1, 42311);וראה;1;1;וראה אתו הכהן והנה שאת הנגע לבנה אדמדמת בקרחתו או בגבחתו כמראה צרעת עור בשר
(285910, 96, 4);3;ג;160342;(3, 13, 44, 36, 160342);42335;(3, 13, 44, 10, 42335);נגעו;2;10;איש צרוע הוא טמא הוא טמא יטמאנו הכהן בראשו נגעו
(285910, 96, 4);40;מ;160438;(3, 13, 46, 31, 160438);42362;(3, 13, 46, 11, 42362);מחוץ;1;11;כל ימי אשר הנגע בו יטמא טמא הוא בדד ישב מחוץ למחנה מושבו
(285910, 96, 4);10;י;160534;(3, 13, 49, 3, 160534);42388;(3, 13, 49, 1, 42388);והיה;3;1;והיה הנגע ירקרק או אדמדם בבגד או בעור או בשתי או בערב או בכל כלי עור נגע צרעת הוא והראה את הכהן
(285910, 96, 4);3;ג;160630;(3, 13, 50, 25, 160630);42416;(3, 13, 50, 7, 42416);הנגע;3;7;וראה הכהן את הנגע והסגיר את הנגע שבעת ימים
(285910, 96, 4);1;א;160726;(3, 13, 51, 87, 160726);42442;(3, 13, 51, 24, 42442);טמא;3;24;וראה את הנגע ביום השביעי כי פשה הנגע בבגד או בשתי או בערב או בעור לכל אשר יעשה העור למלאכה צרעת ממארת הנגע טמא הוא
(285910, 96, 4);5;ה;160822;(3, 13, 53, 8, 160822);42473;(3, 13, 53, 3, 42473);הכהן;1;3;ואם יראה הכהן והנה לא פשה הנגע בבגד או בשתי או בערב או בכל כלי עור
(285910, 96, 4);8;ח;160918;(3, 13, 55, 10, 160918);42500;(3, 13, 55, 3, 42500);אחרי;2;3;וראה הכהן אחרי הכבס את הנגע והנה לא הפך הנגע את עינו והנגע לא פשה טמא הוא באש תשרפנו פחתת הוא בקרחתו או בגבחתו
(285910, 96, 4);50;נ;161014;(3, 13, 56, 19, 161014);42527;(3, 13, 56, 6, 42527);הנגע;2;6;ואם ראה הכהן והנה כהה הנגע אחרי הכבס אתו וקרע אתו מן הבגד או מן העור או מן השתי או מן הערב
(285910, 96, 4);1;א;161110;(3, 13, 57, 46, 161110);42558;(3, 13, 57, 15, 42558);באש;2;15;ואם תראה עוד בבגד או בשתי או בערב או בכל כלי עור פרחת הוא באש תשרפנו את אשר בו הנגע
(285910, 96, 4);200;ר;161206;(3, 13, 59, 21, 161206);42586;(3, 13, 59, 6, 42586);הצמר;4;6;זאת תורת נגע צרעת בגד הצמר או הפשתים או השתי או הערב או כל כלי עור לטהרו או לטמאו
(285910, 96, 4);50;ן;161302;(3, 14, 2, 36, 161302);42613;(3, 14, 2, 9, 42613);הכהן;4;9;זאת תהיה תורת המצרע ביום טהרתו והובא אל הכהן
(285910, 96, 4);6;ו;161398;(3, 14, 4, 46, 161398);42638;(3, 14, 4, 12, 42638);תולעת;2;12;וצוה הכהן ולקח למטהר שתי צפרים חיות טהרות ועץ ארז ושני תולעת ואזב
(285910, 96, 4);1;א;161494;(3, 14, 6, 49, 161494);42666;(3, 14, 6, 15, 42666);אותם;1;15;את הצפר החיה יקח אתה ואת עץ הארז ואת שני התולעת ואת האזב וטבל אותם ואת הצפר החיה בדם הצפר השחטה על המים החיים
(285910, 96, 4);5;ה;161590;(3, 14, 8, 5, 161590);42692;(3, 14, 8, 2, 42692);המטהר;1;2;וכבס המטהר את בגדיו וגלח את כל שערו ורחץ במים וטהר ואחר יבוא אל המחנה וישב מחוץ לאהלו שבעת ימים
(285910, 96, 4);200;ר;161686;(3, 14, 9, 25, 161686);42717;(3, 14, 9, 7, 42717);שערו;3;7;והיה ביום השביעי יגלח את כל שערו את ראשו ואת זקנו ואת גבת עיניו ואת כל שערו יגלח וכבס את בגדיו ורחץ את בשרו במים וטהר
(285910, 96, 4);20;כ;161782;(3, 14, 10, 29, 161782);42743;(3, 14, 10, 7, 42743);וכבשה;2;7;וביום השמיני יקח שני כבשים תמימם וכבשה אחת בת שנתה תמימה ושלשה עשרנים סלת מנחה בלולה בשמן ולג אחד שמן
(285910, 96, 4);5;ה;161878;(3, 14, 11, 43, 161878);42767;(3, 14, 11, 11, 42767);אהל;2;11;והעמיד הכהן המטהר את האיש המטהר ואתם לפני יהוה פתח אהל מועד
(285910, 96, 4);6;ו;161974;(3, 14, 13, 30, 161974);42793;(3, 14, 13, 9, 42793);ואת;1;9;ושחט את הכבש במקום אשר ישחט את החטאת ואת העלה במקום הקדש כי כחטאת האשם הוא לכהן קדש קדשים הוא
(285910, 96, 4);6;ו;162070;(3, 14, 14, 52, 162070);42818;(3, 14, 14, 14, 42818);ידו;3;14;ולקח הכהן מדם האשם ונתן הכהן על תנוך אזן המטהר הימנית ועל בהן ידו הימנית ועל בהן רגלו הימנית
(285910, 96, 4);30;ל;162166;(3, 14, 16, 40, 162166);42843;(3, 14, 16, 11, 42843);השמאלית;5;11;וטבל הכהן את אצבעו הימנית מן השמן אשר על כפו השמאלית והזה מן השמן באצבעו שבע פעמים לפני יהוה
(285910, 96, 4);30;ל;162262;(3, 14, 17, 62, 162262);42868;(3, 14, 17, 17, 42868);ועל;3;17;ומיתר השמן אשר על כפו יתן הכהן על תנוך אזן המטהר הימנית ועל בהן ידו הימנית ועל בהן רגלו הימנית על דם האשם
(285910, 96, 4);30;ל;162358;(3, 14, 19, 21, 162358);42895;(3, 14, 19, 6, 42895);על;2;6;ועשה הכהן את החטאת וכפר על המטהר מטמאתו ואחר ישחט את העלה
(285910, 96, 4);300;ש;162454;(3, 14, 21, 26, 162454);42920;(3, 14, 21, 8, 42920);כבש;3;8;ואם דל הוא ואין ידו משגת ולקח כבש אחד אשם לתנופה לכפר עליו ועשרון סלת אחד בלול בשמן למנחה ולג שמן
(285910, 96, 4);8;ח;162550;(3, 14, 22, 45, 162550);42946;(3, 14, 22, 13, 42946);והאחד;4;13;ושתי תרים או שני בני יונה אשר תשיג ידו והיה אחד חטאת והאחד עלה
(285910, 96, 4);80;פ;162646;(3, 14, 24, 42, 162646);42972;(3, 14, 24, 12, 42972);תנופה;4;12;ולקח הכהן את כבש האשם ואת לג השמן והניף אתם הכהן תנופה לפני יהוה
(285910, 96, 4);5;ה;162742;(3, 14, 26, 4, 162742);42998;(3, 14, 26, 2, 42998);השמן;1;2;ומן השמן יצק הכהן על כף הכהן השמאלית
(285910, 96, 4);50;ן;162838;(3, 14, 28, 14, 162838);43022;(3, 14, 28, 4, 43022);השמן;4;4;ונתן הכהן מן השמן אשר על כפו על תנוך אזן המטהר הימנית ועל בהן ידו הימנית ועל בהן רגלו הימנית על מקום דם האשם
(285910, 96, 4);400;ת;162934;(3, 14, 29, 25, 162934);43050;(3, 14, 29, 8, 43050);יתן;2;8;והנותר מן השמן אשר על כף הכהן יתן על ראש המטהר לכפר עליו לפני יהוה
(285910, 96, 4);4;ד;163030;(3, 14, 31, 29, 163030);43078;(3, 14, 31, 9, 43078);האחד;4;9;את אשר תשיג ידו את האחד חטאת ואת האחד עלה על המנחה וכפר הכהן על המטהר לפני יהוה
(285910, 96, 4);20;כ;163126;(3, 14, 34, 1, 163126);43106;(3, 14, 34, 1, 43106);כי;1;1;כי תבאו אל ארץ כנען אשר אני נתן לכם לאחזה ונתתי נגע צרעת בבית ארץ אחזתכם
(285910, 96, 4);6;ו;163222;(3, 14, 36, 1, 163222);43133;(3, 14, 36, 1, 43133);וצוה;1;1;וצוה הכהן ופנו את הבית בטרם יבא הכהן לראות את הנגע ולא יטמא כל אשר בבית ואחר כן יבא הכהן לראות את הבית
(285910, 96, 4);3;ג;163318;(3, 14, 37, 17, 163318);43160;(3, 14, 37, 5, 43160);הנגע;3;5;וראה את הנגע והנה הנגע בקירת הבית שקערורת ירקרקת או אדמדמת ומראיהן שפל מן הקיר
(285910, 96, 4);5;ה;163414;(3, 14, 39, 6, 163414);43184;(3, 14, 39, 2, 43184);הכהן;3;2;ושב הכהן ביום השביעי וראה והנה פשה הנגע בקירת הבית
(285910, 96, 4);1;א;163510;(3, 14, 40, 61, 163510);43208;(3, 14, 40, 16, 43208);טמא;3;16;וצוה הכהן וחלצו את האבנים אשר בהן הנגע והשליכו אתהן אל מחוץ לעיר אל מקום טמא
(285910, 96, 4);10;י;163606;(3, 14, 42, 40, 163606);43234;(3, 14, 42, 10, 43234);יקח;1;10;ולקחו אבנים אחרות והביאו אל תחת האבנים ועפר אחר יקח וטח את הבית
(285910, 96, 4);90;צ;163702;(3, 14, 44, 27, 163702);43260;(3, 14, 44, 8, 43260);צרעת;1;8;ובא הכהן וראה והנה פשה הנגע בבית צרעת ממארת הוא בבית טמא הוא
(285910, 96, 4);40;מ;163798;(3, 14, 46, 14, 163798);43288;(3, 14, 46, 5, 43288);ימי;2;5;והבא אל הבית כל ימי הסגיר אתו יטמא עד הערב
(285910, 96, 4);10;י;163894;(3, 14, 48, 37, 163894);43314;(3, 14, 48, 11, 43314);אחרי;4;11;ואם בא יבא הכהן וראה והנה לא פשה הנגע בבית אחרי הטח את הבית וטהר הכהן את הבית כי נרפא הנגע
(285910, 96, 4);300;ש;163990;(3, 14, 50, 22, 163990);43342;(3, 14, 50, 7, 43342);חרש;3;7;ושחט את הצפר האחת אל כלי חרש על מים חיים
(285910, 96, 4);70;ע;164086;(3, 14, 51, 87, 164086);43369;(3, 14, 51, 24, 43369);פעמים;2;24;ולקח את עץ הארז ואת האזב ואת שני התולעת ואת הצפר החיה וטבל אתם בדם הצפר השחוטה ובמים החיים והזה אל הבית שבע פעמים
(285910, 96, 4);4;ד;164182;(3, 14, 53, 32, 164182);43393;(3, 14, 53, 10, 43393);השדה;3;10;ושלח את הצפר החיה אל מחוץ לעיר אל פני השדה וכפר על הבית וטהר
(285910, 96, 4);400;ת;164278;(3, 14, 57, 25, 164278);43415;(3, 14, 57, 6, 43415);זאת;3;6;להורת ביום הטמא וביום הטהר זאת תורת הצרעת
(285910, 96, 4);9;ט;164374;(3, 15, 3, 9, 164374);43442;(3, 15, 3, 3, 43442);טמאתו;1;3;וזאת תהיה טמאתו בזובו רר בשרו את זובו או החתים בשרו מזובו טמאתו הוא
(285910, 96, 4);1;א;164470;(3, 15, 5, 5, 164470);43468;(3, 15, 5, 2, 43468);אשר;1;2;ואיש אשר יגע במשכבו יכבס בגדיו ורחץ במים וטמא עד הערב
(285910, 96, 4);2;ב;164566;(3, 15, 7, 7, 164566);43493;(3, 15, 7, 2, 43493);בבשר;2;2;והנגע בבשר הזב יכבס בגדיו ורחץ במים וטמא עד הערב
(285910, 96, 4);10;י;164662;(3, 15, 9, 23, 164662);43519;(3, 15, 9, 7, 43519);יטמא;1;7;וכל המרכב אשר ירכב עליו הזב יטמא
(285910, 96, 4);80;ף;164758;(3, 15, 11, 24, 164758);43545;(3, 15, 11, 8, 43545);שטף;3;8;וכל אשר יגע בו הזב וידיו לא שטף במים וכבס בגדיו ורחץ במים וטמא עד הערב
(285910, 96, 4);40;מ;164854;(3, 15, 13, 27, 164854);43573;(3, 15, 13, 8, 43573);ימים;2;8;וכי יטהר הזב מזובו וספר לו שבעת ימים לטהרתו וכבס בגדיו ורחץ בשרו במים חיים וטהר
(285910, 96, 4);6;ו;164950;(3, 15, 14, 59, 164950);43599;(3, 15, 14, 18, 43599);ונתנם;1;18;וביום השמיני יקח לו שתי תרים או שני בני יונה ובא לפני יהוה אל פתח אהל מועד ונתנם אל הכהן
(285910, 96, 4);200;ר;165046;(3, 15, 16, 35, 165046);43625;(3, 15, 16, 11, 43625);בשרו;3;11;ואיש כי תצא ממנו שכבת זרע ורחץ במים את כל בשרו וטמא עד הערב
(285910, 96, 4);1;א;165142;(3, 15, 18, 37, 165142);43652;(3, 15, 18, 10, 43652);וטמאו;4;10;ואשה אשר ישכב איש אתה שכבת זרע ורחצו במים וטמאו עד הערב
(285910, 96, 4);30;ל;165238;(3, 15, 20, 26, 165238);43679;(3, 15, 20, 7, 43679);וכל;3;7;וכל אשר תשכב עליו בנדתה יטמא וכל אשר תשב עליו יטמא
(285910, 96, 4);9;ט;165334;(3, 15, 22, 42, 165334);43705;(3, 15, 22, 12, 43705);וטמא;2;12;וכל הנגע בכל כלי אשר תשב עליו יכבס בגדיו ורחץ במים וטמא עד הערב
