(133663, 76, 4);6;ו;227219;(4, 22, 34, 68, 227219);59934;(4, 22, 34, 19, 59934);אשובה;3;19;ויאמר בלעם אל מלאך יהוה חטאתי כי לא ידעתי כי אתה נצב לקראתי בדרך ועתה אם רע בעיניך אשובה לי
(133663, 76, 4);30;ל;227295;(4, 22, 35, 72, 227295);59956;(4, 22, 35, 21, 59956);בלק;2;21;ויאמר מלאך יהוה אל בלעם לך עם האנשים ואפס את הדבר אשר אדבר אליך אתו תדבר וילך בלעם עם שרי בלק
(133663, 76, 4);5;ה;227371;(4, 22, 37, 15, 227371);59978;(4, 22, 37, 5, 59978);הלא;1;5;ויאמר בלק אל בלעם הלא שלח שלחתי אליך לקרא לך למה לא הלכת אלי האמנם לא אוכל כבדך
(133663, 76, 4);5;ה;227447;(4, 22, 38, 29, 227447);60000;(4, 22, 38, 9, 60000);היכל;1;9;ויאמר בלעם אל בלק הנה באתי אליך עתה היכל אוכל דבר מאומה הדבר אשר ישים אלהים בפי אתו אדבר
(133663, 76, 4);2;ב;227523;(4, 22, 40, 9, 227523);60020;(4, 22, 40, 3, 60020);בקר;1;3;ויזבח בלק בקר וצאן וישלח לבלעם ולשרים אשר אתו
(133663, 76, 4);6;ו;227599;(4, 23, 1, 1, 227599);60040;(4, 23, 1, 1, 60040);ויאמר;1;1;ויאמר בלעם אל בלק בנה לי בזה שבעה מזבחת והכן לי בזה שבעה פרים ושבעה אילים
(133663, 76, 4);6;ו;227675;(4, 23, 2, 19, 227675);60061;(4, 23, 2, 6, 60061);ויעל;1;6;ויעש בלק כאשר דבר בלעם ויעל בלק ובלעם פר ואיל במזבח
(133663, 76, 4);10;י;227751;(4, 23, 3, 54, 227751);60080;(4, 23, 3, 14, 60080);יראני;1;14;ויאמר בלעם לבלק התיצב על עלתך ואלכה אולי יקרה יהוה לקראתי ודבר מה יראני והגדתי לך וילך שפי
(133663, 76, 4);6;ו;227827;(4, 23, 5, 1, 227827);60099;(4, 23, 5, 1, 60099);וישם;1;1;וישם יהוה דבר בפי בלעם ויאמר שוב אל בלק וכה תדבר
(133663, 76, 4);40;מ;227903;(4, 23, 7, 5, 227903);60121;(4, 23, 7, 2, 60121);משלו;1;2;וישא משלו ויאמר מן ארם ינחני בלק מלך מואב מהררי קדם לכה ארה לי יעקב ולכה זעמה ישראל
(133663, 76, 4);5;ה;227979;(4, 23, 8, 15, 227979);60143;(4, 23, 8, 6, 60143);ומה;3;6;מה אקב לא קבה אל ומה אזעם לא זעם יהוה
(133663, 76, 4);70;ע;228055;(4, 23, 10, 10, 228055);60164;(4, 23, 10, 4, 60164);יעקב;2;4;מי מנה עפר יעקב ומספר את רבע ישראל תמת נפשי מות ישרים ותהי אחריתי כמהו
(133663, 76, 4);30;ל;228131;(4, 23, 11, 30, 228131);60185;(4, 23, 11, 10, 60185);לקחתיך;1;10;ויאמר בלק אל בלעם מה עשית לי לקב איבי לקחתיך והנה ברכת ברך
(133663, 76, 4);30;ל;228207;(4, 23, 13, 21, 228207);60206;(4, 23, 13, 7, 60206);אל;2;7;ויאמר אליו בלק לך נא אתי אל מקום אחר אשר תראנו משם אפס קצהו תראה וכלו לא תראה וקבנו לי משם
(133663, 76, 4);50;ן;228283;(4, 23, 14, 27, 228283);60227;(4, 23, 14, 7, 60227);ויבן;4;7;ויקחהו שדה צפים אל ראש הפסגה ויבן שבעה מזבחת ויעל פר ואיל במזבח
(133663, 76, 4);40;ם;228359;(4, 23, 16, 18, 228359);60248;(4, 23, 16, 5, 60248);וישם;4;5;ויקר יהוה אל בלעם וישם דבר בפיו ויאמר שוב אל בלק וכה תדבר
(133663, 76, 4);5;ה;228435;(4, 23, 17, 49, 228435);60271;(4, 23, 17, 15, 60271);יהוה;2;15;ויבא אליו והנו נצב על עלתו ושרי מואב אתו ויאמר לו בלק מה דבר יהוה
(133663, 76, 4);70;ע;228511;(4, 23, 19, 36, 228511);60292;(4, 23, 19, 11, 60292);יעשה;2;11;לא איש אל ויכזב ובן אדם ויתנחם ההוא אמר ולא יעשה ודבר ולא יקימנה
(133663, 76, 4);10;י;228587;(4, 23, 21, 37, 228587);60311;(4, 23, 21, 10, 60311);אלהיו;4;10;לא הביט און ביעקב ולא ראה עמל בישראל יהוה אלהיו עמו ותרועת מלך בו
(133663, 76, 4);2;ב;228663;(4, 23, 23, 36, 228663);60331;(4, 23, 23, 10, 60331);ליעקב;5;10;כי לא נחש ביעקב ולא קסם בישראל כעת יאמר ליעקב ולישראל מה פעל אל
(133663, 76, 4);30;ל;228739;(4, 23, 25, 12, 228739);60353;(4, 23, 25, 4, 60353);בלעם;2;4;ויאמר בלק אל בלעם גם קב לא תקבנו גם ברך לא תברכנו
(133663, 76, 4);6;ו;228815;(4, 23, 26, 50, 228815);60375;(4, 23, 26, 14, 60375);אתו;3;14;ויען בלעם ויאמר אל בלק הלא דברתי אליך לאמר כל אשר ידבר יהוה אתו אעשה
(133663, 76, 4);30;ל;228891;(4, 23, 28, 11, 228891);60397;(4, 23, 28, 4, 60397);בלעם;2;4;ויקח בלק את בלעם ראש הפעור הנשקף על פני הישימן
(133663, 76, 4);300;ש;228967;(4, 23, 29, 50, 228967);60418;(4, 23, 29, 15, 60418);ושבעה;2;15;ויאמר בלעם אל בלק בנה לי בזה שבעה מזבחת והכן לי בזה שבעה פרים ושבעה אילם
(133663, 76, 4);1;א;229043;(4, 24, 1, 36, 229043);60438;(4, 24, 1, 10, 60438);ולא;3;10;וירא בלעם כי טוב בעיני יהוה לברך את ישראל ולא הלך כפעם בפעם לקראת נחשים וישת אל המדבר פניו
(133663, 76, 4);70;ע;229119;(4, 24, 2, 40, 229119);60458;(4, 24, 2, 11, 60458);עליו;1;11;וישא בלעם את עיניו וירא את ישראל שכן לשבטיו ותהי עליו רוח אלהים
(133663, 76, 4);8;ח;229195;(4, 24, 4, 24, 229195);60479;(4, 24, 4, 8, 60479);יחזה;2;8;נאם שמע אמרי אל אשר מחזה שדי יחזה נפל וגלוי עינים
(133663, 76, 4);1;א;229271;(4, 24, 6, 35, 229271);60497;(4, 24, 6, 9, 60497);כארזים;2;9;כנחלים נטיו כגנת עלי נהר כאהלים נטע יהוה כארזים עלי מים
(133663, 76, 4);400;ת;229347;(4, 24, 8, 20, 229347);60514;(4, 24, 8, 4, 60514);כתועפת;6;4;אל מוציאו ממצרים כתועפת ראם לו יאכל גוים צריו ועצמתיהם יגרם וחציו ימחץ
(133663, 76, 4);200;ר;229423;(4, 24, 9, 38, 229423);60532;(4, 24, 9, 9, 60532);וארריך;4;9;כרע שכב כארי וכלביא מי יקימנו מברכיך ברוך וארריך ארור
(133663, 76, 4);80;פ;229499;(4, 24, 10, 70, 229499);60554;(4, 24, 10, 21, 60554);פעמים;1;21;ויחר אף בלק אל בלעם ויספק את כפיו ויאמר בלק אל בלעם לקב איבי קראתיך והנה ברכת ברך זה שלש פעמים
(133663, 76, 4);10;י;229575;(4, 24, 12, 26, 229575);60574;(4, 24, 12, 8, 60574);מלאכיך;5;8;ויאמר בלעם אל בלק הלא גם אל מלאכיך אשר שלחת אלי דברתי לאמר
(133663, 76, 4);5;ה;229651;(4, 24, 13, 56, 229651);60597;(4, 24, 13, 18, 60597);רעה;3;18;אם יתן לי בלק מלא ביתו כסף וזהב לא אוכל לעבר את פי יהוה לעשות טובה או רעה מלבי אשר ידבר יהוה אתו אדבר
(133663, 76, 4);10;י;229727;(4, 24, 15, 2, 229727);60617;(4, 24, 15, 1, 60617);וישא;2;1;וישא משלו ויאמר נאם בלעם בנו בער ונאם הגבר שתם העין
(133663, 76, 4);80;פ;229803;(4, 24, 16, 37, 229803);60638;(4, 24, 16, 11, 60638);נפל;2;11;נאם שמע אמרי אל וידע דעת עליון מחזה שדי יחזה נפל וגלוי עינים
(133663, 76, 4);200;ר;229879;(4, 24, 17, 65, 229879);60656;(4, 24, 17, 16, 60656);וקרקר;5;16;אראנו ולא עתה אשורנו ולא קרוב דרך כוכב מיעקב וקם שבט מישראל ומחץ פאתי מואב וקרקר כל בני שת
(133663, 76, 4);1;א;229955;(4, 24, 20, 5, 229955);60676;(4, 24, 20, 2, 60676);את;1;2;וירא את עמלק וישא משלו ויאמר ראשית גוים עמלק ואחריתו עדי אבד
(133663, 76, 4);2;ב;230031;(4, 24, 21, 32, 230031);60694;(4, 24, 21, 8, 60694);מושבך;4;8;וירא את הקיני וישא משלו ויאמר איתן מושבך ושים בסלע קנך
(133663, 76, 4);400;ת;230107;(4, 24, 24, 9, 230107);60717;(4, 24, 24, 3, 60717);כתים;2;3;וצים מיד כתים וענו אשור וענו עבר וגם הוא עדי אבד
(133663, 76, 4);9;ט;230183;(4, 25, 1, 12, 230183);60737;(4, 25, 1, 3, 60737);בשטים;3;3;וישב ישראל בשטים ויחל העם לזנות אל בנות מואב
(133663, 76, 4);30;ל;230259;(4, 25, 3, 10, 230259);60753;(4, 25, 3, 2, 60753);ישראל;5;2;ויצמד ישראל לבעל פעור ויחר אף יהוה בישראל
(133663, 76, 4);2;ב;230335;(4, 25, 4, 52, 230335);60774;(4, 25, 4, 15, 60774);וישב;4;15;ויאמר יהוה אל משה קח את כל ראשי העם והוקע אותם ליהוה נגד השמש וישב חרון אף יהוה מישראל
(133663, 76, 4);200;ר;230411;(4, 25, 6, 14, 230411);60793;(4, 25, 6, 4, 60793);ישראל;3;4;והנה איש מבני ישראל בא ויקרב אל אחיו את המדינית לעיני משה ולעיני כל עדת בני ישראל והמה בכים פתח אהל מועד
(133663, 76, 4);50;נ;230487;(4, 25, 7, 7, 230487);60813;(4, 25, 7, 2, 60813);פינחס;3;2;וירא פינחס בן אלעזר בן אהרן הכהן ויקם מתוך העדה ויקח רמח בידו
(133663, 76, 4);1;א;230563;(4, 25, 8, 34, 230563);60834;(4, 25, 8, 10, 60834);את;1;10;ויבא אחר איש ישראל אל הקבה וידקר את שניהם את איש ישראל ואת האשה אל קבתה ותעצר המגפה מעל בני ישראל
(133663, 76, 4);2;ב;230639;(4, 25, 10, 4, 230639);60852;(4, 25, 10, 1, 60852);וידבר;4;1;וידבר יהוה אל משה לאמר
(133663, 76, 4);30;ל;230715;(4, 25, 11, 62, 230715);60873;(4, 25, 11, 17, 60873);ולא;2;17;פינחס בן אלעזר בן אהרן הכהן השיב את חמתי מעל בני ישראל בקנאו את קנאתי בתוכם ולא כליתי את בני ישראל בקנאתי
(133663, 76, 4);6;ו;230791;(4, 25, 13, 28, 230791);60893;(4, 25, 13, 7, 60893);עולם;2;7;והיתה לו ולזרעו אחריו ברית כהנת עולם תחת אשר קנא לאלהיו ויכפר על בני ישראל
(133663, 76, 4);1;א;230867;(4, 25, 14, 44, 230867);60913;(4, 25, 14, 12, 60913);נשיא;4;12;ושם איש ישראל המכה אשר הכה את המדינית זמרי בן סלוא נשיא בית אב לשמעני
(133663, 76, 4);200;ר;230943;(4, 25, 16, 18, 230943);60934;(4, 25, 16, 5, 60934);לאמר;4;5;וידבר יהוה אל משה לאמר
(133663, 76, 4);10;י;231019;(4, 25, 18, 53, 231019);60955;(4, 25, 18, 16, 60955);נשיא;3;16;כי צררים הם לכם בנכליהם אשר נכלו לכם על דבר פעור ועל דבר כזבי בת נשיא מדין אחתם המכה ביום המגפה על דבר פעור
(133663, 76, 4);50;ן;231095;(4, 26, 1, 32, 231095);60975;(4, 26, 1, 9, 60975);הכהן;4;9;ויאמר יהוה אל משה ואל אלעזר בן אהרן הכהן לאמר
(133663, 76, 4);7;ז;231171;(4, 26, 3, 13, 231171);60996;(4, 26, 3, 3, 60996);ואלעזר;5;3;וידבר משה ואלעזר הכהן אתם בערבת מואב על ירדן ירחו לאמר
(133663, 76, 4);1;א;231247;(4, 26, 4, 45, 231247);61016;(4, 26, 4, 12, 61016);היצאים;4;12;מבן עשרים שנה ומעלה כאשר צוה יהוה את משה ובני ישראל היצאים מארץ מצרים
(133663, 76, 4);200;ר;231323;(4, 26, 6, 14, 231323);61032;(4, 26, 6, 3, 61032);החצרוני;4;3;לחצרן משפחת החצרוני לכרמי משפחת הכרמי
(133663, 76, 4);10;י;231399;(4, 26, 8, 4, 231399);61047;(4, 26, 8, 1, 61047);ובני;4;1;ובני פלוא אליאב
(133663, 76, 4);400;ת;231475;(4, 26, 9, 67, 231475);61066;(4, 26, 9, 17, 61066);בעדת;4;17;ובני אליאב נמואל ודתן ואבירם הוא דתן ואבירם קרואי העדה אשר הצו על משה ועל אהרן בעדת קרח בהצתם על יהוה
(133663, 76, 4);5;ה;231551;(4, 26, 10, 62, 231551);61087;(4, 26, 10, 17, 61087);ויהיו;3;17;ותפתח הארץ את פיה ותבלע אתם ואת קרח במות העדה באכל האש את חמשים ומאתים איש ויהיו לנס
(133663, 76, 4);400;ת;231627;(4, 26, 12, 59, 231627);61103;(4, 26, 12, 11, 61103);משפחת;5;11;בני שמעון למשפחתם לנמואל משפחת הנמואלי לימין משפחת הימיני ליכין משפחת היכיני
(133663, 76, 4);40;מ;231703;(4, 26, 15, 7, 231703);61120;(4, 26, 15, 3, 61120);למשפחתם;2;3;בני גד למשפחתם לצפון משפחת הצפוני לחגי משפחת החגי לשוני משפחת השוני
(133663, 76, 4);200;ר;231779;(4, 26, 16, 27, 231779);61135;(4, 26, 16, 6, 61135);הערי;3;6;לאזני משפחת האזני לערי משפחת הערי
(133663, 76, 4);5;ה;231855;(4, 26, 19, 5, 231855);61152;(4, 26, 19, 2, 61152);יהודה;2;2;בני יהודה ער ואונן וימת ער ואונן בארץ כנען
(133663, 76, 4);90;צ;231931;(4, 26, 20, 47, 231931);61169;(4, 26, 20, 10, 61169);הפרצי;4;10;ויהיו בני יהודה למשפחתם לשלה משפחת השלני לפרץ משפחת הפרצי לזרח משפחת הזרחי
(133663, 76, 4);10;י;232007;(4, 26, 22, 18, 232007);61185;(4, 26, 22, 4, 61185);לפקדיהם;5;4;אלה משפחת יהודה לפקדיהם ששה ושבעים אלף וחמש מאות
(133663, 76, 4);400;ת;232083;(4, 26, 24, 10, 232083);61201;(4, 26, 24, 2, 61201);משפחת;5;2;לישוב משפחת הישבי לשמרן משפחת השמרני
(133663, 76, 4);400;ת;232159;(4, 26, 26, 14, 232159);61217;(4, 26, 26, 3, 61217);למשפחתם;6;3;בני זבולן למשפחתם לסרד משפחת הסרדי לאלון משפחת האלני ליחלאל משפחת היחלאלי
(133663, 76, 4);30;ל;232235;(4, 26, 27, 28, 232235);61232;(4, 26, 27, 6, 61232);אלף;2;6;אלה משפחת הזבולני לפקדיהם ששים אלף וחמש מאות
(133663, 76, 4);70;ע;232311;(4, 26, 29, 43, 232311);61249;(4, 26, 29, 10, 61249);לגלעד;4;10;בני מנשה למכיר משפחת המכירי ומכיר הוליד את גלעד לגלעד משפחת הגלעדי
(133663, 76, 4);40;ם;232387;(4, 26, 31, 23, 232387);61264;(4, 26, 31, 4, 61264);ושכם;4;4;ואשריאל משפחת האשראלי ושכם משפחת השכמי
(133663, 76, 4);2;ב;232463;(4, 26, 33, 34, 232463);61284;(4, 26, 33, 12, 61284);בנות;1;12;וצלפחד בן חפר לא היו לו בנים כי אם בנות ושם בנות צלפחד מחלה ונעה חגלה מלכה ותרצה
(133663, 76, 4);1;א;232539;(4, 26, 35, 7, 232539);61302;(4, 26, 35, 3, 61302);אפרים;1;3;אלה בני אפרים למשפחתם לשותלח משפחת השתלחי לבכר משפחת הבכרי לתחן משפחת התחני
(133663, 76, 4);8;ח;232615;(4, 26, 36, 20, 232615);61317;(4, 26, 36, 5, 61317);משפחת;4;5;ואלה בני שותלח לערן משפחת הערני
(133663, 76, 4);30;ל;232691;(4, 26, 38, 9, 232691);61335;(4, 26, 38, 3, 61335);למשפחתם;1;3;בני בנימן למשפחתם לבלע משפחת הבלעי לאשבל משפחת האשבלי לאחירם משפחת האחירמי
(133663, 76, 4);40;ם;232767;(4, 26, 39, 22, 232767);61348;(4, 26, 39, 4, 61348);לחופם;5;4;לשפופם משפחת השופמי לחופם משפחת החופמי
(133663, 76, 4);100;ק;232843;(4, 26, 41, 21, 232843);61365;(4, 26, 41, 5, 61365);ופקדיהם;3;5;אלה בני בנימן למשפחתם ופקדיהם חמשה וארבעים אלף ושש מאות
(133663, 76, 4);40;מ;232919;(4, 26, 43, 3, 232919);61383;(4, 26, 43, 2, 61383);משפחת;1;2;כל משפחת השוחמי לפקדיהם ארבעה וששים אלף וארבע מאות
(133663, 76, 4);8;ח;232995;(4, 26, 44, 37, 232995);61398;(4, 26, 44, 8, 61398);משפחת;4;8;בני אשר למשפחתם לימנה משפחת הימנה לישוי משפחת הישוי לבריעה משפחת הבריעי
(133663, 76, 4);200;ר;233071;(4, 26, 46, 10, 233071);61414;(4, 26, 46, 4, 61414);שרח;2;4;ושם בת אשר שרח
(133663, 76, 4);30;ל;233147;(4, 26, 48, 32, 233147);61430;(4, 26, 48, 6, 61430);היחצאלי;6;6;בני נפתלי למשפחתם ליחצאל משפחת היחצאלי לגוני משפחת הגוני
(133663, 76, 4);6;ו;233223;(4, 26, 50, 32, 233223);61446;(4, 26, 50, 7, 61446);וארבעים;1;7;אלה משפחת נפתלי למשפחתם ופקדיהם חמשה וארבעים אלף וארבע מאות
(133663, 76, 4);1;א;233299;(4, 26, 52, 16, 233299);61465;(4, 26, 52, 5, 61465);לאמר;2;5;וידבר יהוה אל משה לאמר
(133663, 76, 4);20;ך;233375;(4, 26, 55, 2, 233375);61483;(4, 26, 55, 1, 61483);אך;2;1;אך בגורל יחלק את הארץ לשמות מטות אבתם ינחלו
(133663, 76, 4);300;ש;233451;(4, 26, 57, 16, 233451);61503;(4, 26, 57, 4, 61503);למשפחתם;3;4;ואלה פקודי הלוי למשפחתם לגרשון משפחת הגרשני לקהת משפחת הקהתי למררי משפחת המררי
(133663, 76, 4);400;ת;233527;(4, 26, 58, 26, 233527);61518;(4, 26, 58, 6, 61518);משפחת;5;6;אלה משפחת לוי משפחת הלבני משפחת החברני משפחת המחלי משפחת המושי משפחת הקרחי וקהת הולד את עמרם
(133663, 76, 4);4;ד;233603;(4, 26, 59, 26, 233603);61537;(4, 26, 59, 8, 61537);ילדה;3;8;ושם אשת עמרם יוכבד בת לוי אשר ילדה אתה ללוי במצרים ותלד לעמרם את אהרן ואת משה ואת מרים אחתם
(133663, 76, 4);7;ז;233679;(4, 26, 60, 30, 233679);61557;(4, 26, 60, 8, 61557);אלעזר;4;8;ויולד לאהרן את נדב ואת אביהוא את אלעזר ואת איתמר
(133663, 76, 4);8;ח;233755;(4, 26, 62, 33, 233755);61576;(4, 26, 62, 9, 61576);חדש;1;9;ויהיו פקדיהם שלשה ועשרים אלף כל זכר מבן חדש ומעלה כי לא התפקדו בתוך בני ישראל כי לא נתן להם נחלה בתוך בני ישראל
(133663, 76, 4);50;ן;233831;(4, 26, 63, 21, 233831);61596;(4, 26, 63, 5, 61596);הכהן;4;5;אלה פקודי משה ואלעזר הכהן אשר פקדו את בני ישראל בערבת מואב על ירדן ירחו
(133663, 76, 4);400;ת;233907;(4, 26, 64, 40, 233907);61617;(4, 26, 64, 11, 61617);את;2;11;ובאלה לא היה איש מפקודי משה ואהרן הכהן אשר פקדו את בני ישראל במדבר סיני
(133663, 76, 4);50;נ;233983;(4, 26, 65, 59, 233983);61640;(4, 26, 65, 19, 61640);נון;1;19;כי אמר יהוה להם מות ימתו במדבר ולא נותר מהם איש כי אם כלב בן יפנה ויהושע בן נון
(133663, 76, 4);70;ע;234059;(4, 27, 1, 74, 234059);61660;(4, 27, 1, 20, 61660);נעה;2;20;ותקרבנה בנות צלפחד בן חפר בן גלעד בן מכיר בן מנשה למשפחת מנשה בן יוסף ואלה שמות בנתיו מחלה נעה וחגלה ומלכה ותרצה
(133663, 76, 4);200;ר;234135;(4, 27, 2, 60, 234135);61677;(4, 27, 2, 14, 61677);לאמר;4;14;ותעמדנה לפני משה ולפני אלעזר הכהן ולפני הנשיאם וכל העדה פתח אהל מועד לאמר
(133663, 76, 4);200;ר;234211;(4, 27, 4, 6, 234211);61699;(4, 27, 4, 2, 61699);יגרע;3;2;למה יגרע שם אבינו מתוך משפחתו כי אין לו בן תנה לנו אחזה בתוך אחי אבינו
(133663, 76, 4);40;מ;234287;(4, 27, 6, 4, 234287);61720;(4, 27, 6, 1, 61720);ויאמר;4;1;ויאמר יהוה אל משה לאמר
(133663, 76, 4);30;ל;234363;(4, 27, 7, 62, 234363);61741;(4, 27, 7, 17, 61741);להן;1;17;כן בנות צלפחד דברת נתן תתן להם אחזת נחלה בתוך אחי אביהם והעברת את נחלת אביהן להן
(133663, 76, 4);30;ל;234439;(4, 27, 9, 20, 234439);61763;(4, 27, 9, 7, 61763);נחלתו;3;7;ואם אין לו בת ונתתם את נחלתו לאחיו
(133663, 76, 4);1;א;234515;(4, 27, 11, 37, 234515);61783;(4, 27, 11, 10, 61783);אליו;1;10;ואם אין אחים לאביו ונתתם את נחלתו לשארו הקרב אליו ממשפחתו וירש אתה והיתה לבני ישראל לחקת משפט כאשר צוה יהוה את משה
(133663, 76, 4);200;ר;234591;(4, 27, 12, 21, 234591);61803;(4, 27, 12, 7, 61803);הר;2;7;ויאמר יהוה אל משה עלה אל הר העברים הזה וראה את הארץ אשר נתתי לבני ישראל
(133663, 76, 4);10;י;234667;(4, 27, 13, 41, 234667);61823;(4, 27, 13, 11, 61823);אחיך;3;11;וראיתה אתה ונאספת אל עמיך גם אתה כאשר נאסף אהרן אחיך
(133663, 76, 4);30;ל;234743;(4, 27, 15, 10, 234743);61842;(4, 27, 15, 3, 61842);אל;2;3;וידבר משה אל יהוה לאמר
(133663, 76, 4);6;ו;234819;(4, 27, 17, 36, 234819);61862;(4, 27, 17, 9, 61862);ואשר;1;9;אשר יצא לפניהם ואשר יבא לפניהם ואשר יוציאם ואשר יביאם ולא תהיה עדת יהוה כצאן אשר אין להם רעה
(133663, 76, 4);6;ו;234895;(4, 27, 18, 38, 234895);61885;(4, 27, 18, 13, 61885);רוח;2;13;ויאמר יהוה אל משה קח לך את יהושע בן נון איש אשר רוח בו וסמכת את ידך עליו
(133663, 76, 4);20;ך;234971;(4, 27, 20, 10, 234971);61903;(4, 27, 20, 2, 61903);מהודך;5;2;ונתתה מהודך עליו למען ישמעו כל עדת בני ישראל
(133663, 76, 4);90;צ;235047;(4, 27, 21, 50, 235047);61923;(4, 27, 21, 13, 61923);יצאו;2;13;ולפני אלעזר הכהן יעמד ושאל לו במשפט האורים לפני יהוה על פיו יצאו ועל פיו יבאו הוא וכל בני ישראל אתו וכל העדה
(133663, 76, 4);30;ל;235123;(4, 27, 22, 40, 235123);61944;(4, 27, 22, 11, 61944);לפני;1;11;ויעש משה כאשר צוה יהוה אתו ויקח את יהושע ויעמדהו לפני אלעזר הכהן ולפני כל העדה
(133663, 76, 4);30;ל;235199;(4, 28, 1, 15, 235199);61964;(4, 28, 1, 5, 61964);לאמר;1;5;וידבר יהוה אל משה לאמר
(133663, 76, 4);5;ה;235275;(4, 28, 3, 10, 235275);61983;(4, 28, 3, 3, 61983);זה;2;3;ואמרת להם זה האשה אשר תקריבו ליהוה כבשים בני שנה תמימם שנים ליום עלה תמיד
(133663, 76, 4);50;נ;235351;(4, 28, 4, 27, 235351);62003;(4, 28, 4, 8, 62003);השני;3;8;את הכבש אחד תעשה בבקר ואת הכבש השני תעשה בין הערבים
(133663, 76, 4);30;ל;235427;(4, 28, 6, 20, 235427);62021;(4, 28, 6, 6, 62021);לריח;1;6;עלת תמיד העשיה בהר סיני לריח ניחח אשה ליהוה
(133663, 76, 4);200;ר;235503;(4, 28, 8, 21, 235503);62040;(4, 28, 8, 6, 62040);הערבים;3;6;ואת הכבש השני תעשה בין הערבים כמנחת הבקר וכנסכו תעשה אשה ריח ניחח ליהוה
(133663, 76, 4);60;ס;235579;(4, 28, 9, 39, 235579);62058;(4, 28, 9, 10, 62058);סלת;1;10;וביום השבת שני כבשים בני שנה תמימם ושני עשרנים סלת מנחה בלולה בשמן ונסכו
(133663, 76, 4);40;ם;235655;(4, 28, 11, 30, 235655);62075;(4, 28, 11, 6, 62075);פרים;4;6;ובראשי חדשיכם תקריבו עלה ליהוה פרים בני בקר שנים ואיל אחד כבשים בני שנה שבעה תמימם
(133663, 76, 4);70;ע;235731;(4, 28, 12, 39, 235731);62095;(4, 28, 12, 10, 62095);עשרנים;1;10;ושלשה עשרנים סלת מנחה בלולה בשמן לפר האחד ושני עשרנים סלת מנחה בלולה בשמן לאיל האחד
(133663, 76, 4);5;ה;235807;(4, 28, 13, 47, 235807);62113;(4, 28, 13, 12, 62113);אשה;3;12;ועשרן עשרון סלת מנחה בלולה בשמן לכבש האחד עלה ריח ניחח אשה ליהוה
(133663, 76, 4);10;י;235883;(4, 28, 14, 71, 235883);62131;(4, 28, 14, 17, 62131);לחדשי;5;17;ונסכיהם חצי ההין יהיה לפר ושלישת ההין לאיל ורביעת ההין לכבש יין זאת עלת חדש בחדשו לחדשי השנה
(133663, 76, 4);30;ל;235959;(4, 28, 16, 31, 235959);62150;(4, 28, 16, 8, 62150);ליהוה;1;8;ובחדש הראשון בארבעה עשר יום לחדש פסח ליהוה
(133663, 76, 4);6;ו;236035;(4, 28, 19, 1, 236035);62170;(4, 28, 19, 1, 62170);והקרבתם;1;1;והקרבתם אשה עלה ליהוה פרים בני בקר שנים ואיל אחד ושבעה כבשים בני שנה תמימם יהיו לכם
(133663, 76, 4);2;ב;236111;(4, 28, 20, 10, 236111);62189;(4, 28, 20, 3, 62189);בלולה;1;3;ומנחתם סלת בלולה בשמן שלשה עשרנים לפר ושני עשרנים לאיל תעשו
(133663, 76, 4);10;י;236187;(4, 28, 22, 4, 236187);62205;(4, 28, 22, 1, 62205);ושעיר;4;1;ושעיר חטאת אחד לכפר עליכם
(133663, 76, 4);200;ר;236263;(4, 28, 24, 27, 236263);62226;(4, 28, 24, 8, 62226);ריח;1;8;כאלה תעשו ליום שבעת ימים לחם אשה ריח ניחח ליהוה על עולת התמיד יעשה ונסכו
(133663, 76, 4);10;י;236339;(4, 28, 26, 3, 236339);62245;(4, 28, 26, 1, 62245);וביום;3;1;וביום הבכורים בהקריבכם מנחה חדשה ליהוה בשבעתיכם מקרא קדש יהיה לכם כל מלאכת עבדה לא תעשו
(133663, 76, 4);40;ם;236415;(4, 28, 27, 7, 236415);62261;(4, 28, 27, 1, 62261);והקרבתם;7;1;והקרבתם עולה לריח ניחח ליהוה פרים בני בקר שנים איל אחד שבעה כבשים בני שנה
