(n,d,k);LetterGematriaNumberValue;Letter;LetterPositionIndex;LetterCoordinatesD5K;WordNumber;WordCoordinatesDWTK;Found in Word in Text;LetterPositionIndex In Word;WordNumberInVerse;Found In Verse
(231976, 64, 4);6;ו;40;(1, 1, 2, 12, 40);10;(1, 1, 2, 3, 10);תהו;3;3;והארץ היתה תהו ובהו וחשך על פני תהום ורוח אלהים מרחפת על פני המים
(231976, 64, 4);6;ו;104;(1, 1, 4, 1, 104);28;(1, 1, 4, 1, 28);וירא;1;1;וירא אלהים את האור כי טוב ויבדל אלהים בין האור ובין החשך
(231976, 64, 4);8;ח;168;(1, 1, 5, 20, 168);44;(1, 1, 5, 5, 44);ולחשך;3;5;ויקרא אלהים לאור יום ולחשך קרא לילה ויהי ערב ויהי בקר יום אחד
(231976, 64, 4);2;ב;232;(1, 1, 6, 35, 232);61;(1, 1, 6, 9, 61);בין;1;9;ויאמר אלהים יהי רקיע בתוך המים ויהי מבדיל בין מים למים
(231976, 64, 4);30;ל;296;(1, 1, 7, 55, 296);78;(1, 1, 7, 15, 78);לרקיע;1;15;ויעש אלהים את הרקיע ויבדל בין המים אשר מתחת לרקיע ובין המים אשר מעל לרקיע ויהי כן
(231976, 64, 4);5;ה;360;(1, 1, 9, 15, 360);94;(1, 1, 9, 4, 94);המים;1;4;ויאמר אלהים יקוו המים מתחת השמים אל מקום אחד ותראה היבשה ויהי כן
(231976, 64, 4);10;י;424;(1, 1, 10, 27, 424);109;(1, 1, 10, 6, 109);המים;3;6;ויקרא אלהים ליבשה ארץ ולמקוה המים קרא ימים וירא אלהים כי טוב
(231976, 64, 4);200;ר;488;(1, 1, 11, 42, 488);127;(1, 1, 11, 12, 127);פרי;2;12;ויאמר אלהים תדשא הארץ דשא עשב מזריע זרע עץ פרי עשה פרי למינו אשר זרעו בו על הארץ ויהי כן
(231976, 64, 4);200;ר;552;(1, 1, 12, 37, 552);145;(1, 1, 12, 10, 145);פרי;2;10;ותוצא הארץ דשא עשב מזריע זרע למינהו ועץ עשה פרי אשר זרעו בו למינהו וירא אלהים כי טוב
(231976, 64, 4);5;ה;616;(1, 1, 14, 12, 616);162;(1, 1, 14, 3, 162);יהי;2;3;ויאמר אלהים יהי מארת ברקיע השמים להבדיל בין היום ובין הלילה והיו לאתת ולמועדים ולימים ושנים
(231976, 64, 4);40;ם;680;(1, 1, 14, 76, 680);175;(1, 1, 14, 16, 175);ושנים;5;16;ויאמר אלהים יהי מארת ברקיע השמים להבדיל בין היום ובין הלילה והיו לאתת ולמועדים ולימים ושנים
(231976, 64, 4);400;ת;744;(1, 1, 16, 27, 744);191;(1, 1, 16, 7, 191);את;2;7;ויעש אלהים את שני המארת הגדלים את המאור הגדל לממשלת היום ואת המאור הקטן לממשלת הלילה ואת הכוכבים
(231976, 64, 4);40;ם;808;(1, 1, 17, 12, 808);205;(1, 1, 17, 3, 205);אלהים;5;3;ויתן אתם אלהים ברקיע השמים להאיר על הארץ
(231976, 64, 4);30;ל;872;(1, 1, 18, 43, 872);220;(1, 1, 18, 10, 220);אלהים;2;10;ולמשל ביום ובלילה ולהבדיל בין האור ובין החשך וירא אלהים כי טוב
(231976, 64, 4);70;ע;936;(1, 1, 20, 34, 936);237;(1, 1, 20, 9, 237);יעופף;2;9;ויאמר אלהים ישרצו המים שרץ נפש חיה ועוף יעופף על הארץ על פני רקיע השמים
(231976, 64, 4);400;ת;1000;(1, 1, 21, 41, 1000);253;(1, 1, 21, 10, 253);הרמשת;5;10;ויברא אלהים את התנינם הגדלים ואת כל נפש החיה הרמשת אשר שרצו המים למינהם ואת כל עוף כנף למינהו וירא אלהים כי טוב
(231976, 64, 4);40;מ;1064;(1, 1, 22, 16, 1064);270;(1, 1, 22, 4, 270);לאמר;3;4;ויברך אתם אלהים לאמר פרו ורבו ומלאו את המים בימים והעוף ירב בארץ
(231976, 64, 4);1;א;1128;(1, 1, 24, 6, 1128);287;(1, 1, 24, 2, 287);אלהים;1;2;ויאמר אלהים תוצא הארץ נפש חיה למינה בהמה ורמש וחיתו ארץ למינה ויהי כן
(231976, 64, 4);400;ת;1192;(1, 1, 25, 14, 1192);303;(1, 1, 25, 4, 303);חית;3;4;ויעש אלהים את חית הארץ למינה ואת הבהמה למינה ואת כל רמש האדמה למינהו וירא אלהים כי טוב
(231976, 64, 4);10;י;1256;(1, 1, 26, 9, 1256);319;(1, 1, 26, 2, 319);אלהים;4;2;ויאמר אלהים נעשה אדם בצלמנו כדמותנו וירדו בדגת הים ובעוף השמים ובבהמה ובכל הארץ ובכל הרמש הרמש על הארץ
(231976, 64, 4);40;מ;1320;(1, 1, 26, 73, 1320);333;(1, 1, 26, 16, 333);הרמש;3;16;ויאמר אלהים נעשה אדם בצלמנו כדמותנו וירדו בדגת הים ובעוף השמים ובבהמה ובכל הארץ ובכל הרמש הרמש על הארץ
(231976, 64, 4);2;ב;1384;(1, 1, 28, 3, 1384);350;(1, 1, 28, 1, 350);ויברך;3;1;ויברך אתם אלהים ויאמר להם אלהים פרו ורבו ומלאו את הארץ וכבשה ורדו בדגת הים ובעוף השמים ובכל חיה הרמשת על הארץ
(231976, 64, 4);300;ש;1448;(1, 1, 28, 67, 1448);366;(1, 1, 28, 17, 366);השמים;2;17;ויברך אתם אלהים ויאמר להם אלהים פרו ורבו ומלאו את הארץ וכבשה ורדו בדגת הים ובעוף השמים ובכל חיה הרמשת על הארץ
(231976, 64, 4);30;ל;1512;(1, 1, 29, 43, 1512);385;(1, 1, 29, 14, 385);כל;2;14;ויאמר אלהים הנה נתתי לכם את כל עשב זרע זרע אשר על פני כל הארץ ואת כל העץ אשר בו פרי עץ זרע זרע לכם יהיה לאכלה
(231976, 64, 4);6;ו;1576;(1, 1, 30, 24, 1576);405;(1, 1, 30, 7, 405);ולכל;1;7;ולכל חית הארץ ולכל עוף השמים ולכל רומש על הארץ אשר בו נפש חיה את כל ירק עשב לאכלה ויהי כן
(231976, 64, 4);5;ה;1640;(1, 1, 31, 19, 1640);425;(1, 1, 31, 6, 425);עשה;3;6;וירא אלהים את כל אשר עשה והנה טוב מאד ויהי ערב ויהי בקר יום הששי
(231976, 64, 4);10;י;1704;(1, 2, 2, 11, 1704);442;(1, 2, 2, 3, 442);ביום;2;3;ויכל אלהים ביום השביעי מלאכתו אשר עשה וישבת ביום השביעי מכל מלאכתו אשר עשה
(231976, 64, 4);6;ו;1768;(1, 2, 3, 14, 1768);457;(1, 2, 3, 4, 457);יום;2;4;ויברך אלהים את יום השביעי ויקדש אתו כי בו שבת מכל מלאכתו אשר ברא אלהים לעשות
(231976, 64, 4);1;א;1832;(1, 2, 4, 17, 1832);473;(1, 2, 4, 4, 473);והארץ;3;4;אלה תולדות השמים והארץ בהבראם ביום עשות יהוה אלהים ארץ ושמים
(231976, 64, 4);5;ה;1896;(1, 2, 5, 31, 1896);489;(1, 2, 5, 9, 489);השדה;4;9;וכל שיח השדה טרם יהיה בארץ וכל עשב השדה טרם יצמח כי לא המטיר יהוה אלהים על הארץ ואדם אין לעבד את האדמה
(231976, 64, 4);5;ה;1960;(1, 2, 6, 15, 1960);508;(1, 2, 6, 5, 508);והשקה;2;5;ואד יעלה מן הארץ והשקה את כל פני האדמה
(231976, 64, 4);10;י;2024;(1, 2, 7, 49, 2024);525;(1, 2, 7, 13, 525);ויהי;2;13;וייצר יהוה אלהים את האדם עפר מן האדמה ויפח באפיו נשמת חיים ויהי האדם לנפש חיה
(231976, 64, 4);1;א;2088;(1, 2, 9, 10, 2088);543;(1, 2, 9, 3, 543);אלהים;1;3;ויצמח יהוה אלהים מן האדמה כל עץ נחמד למראה וטוב למאכל ועץ החיים בתוך הגן ועץ הדעת טוב ורע
(231976, 64, 4);5;ה;2152;(1, 2, 10, 3, 2152);560;(1, 2, 10, 1, 560);ונהר;3;1;ונהר יצא מעדן להשקות את הגן ומשם יפרד והיה לארבעה ראשים
(231976, 64, 4);30;ל;2216;(1, 2, 11, 22, 2216);577;(1, 2, 11, 7, 577);כל;2;7;שם האחד פישון הוא הסבב את כל ארץ החוילה אשר שם הזהב
(231976, 64, 4);50;ן;2280;(1, 2, 13, 16, 2280);594;(1, 2, 13, 4, 594);גיחון;5;4;ושם הנהר השני גיחון הוא הסובב את כל ארץ כוש
(231976, 64, 4);1;א;2344;(1, 2, 14, 46, 2344);611;(1, 2, 14, 11, 611);הוא;3;11;ושם הנהר השלישי חדקל הוא ההלך קדמת אשור והנהר הרביעי הוא פרת
(231976, 64, 4);40;ם;2408;(1, 2, 16, 19, 2408);627;(1, 2, 16, 5, 627);האדם;4;5;ויצו יהוה אלהים על האדם לאמר מכל עץ הגן אכל תאכל
(231976, 64, 4);400;ת;2472;(1, 2, 17, 45, 2472);646;(1, 2, 17, 13, 646);תמות;4;13;ומעץ הדעת טוב ורע לא תאכל ממנו כי ביום אכלך ממנו מות תמות
(231976, 64, 4);40;מ;2536;(1, 2, 19, 19, 2536);663;(1, 2, 19, 5, 663);האדמה;4;5;ויצר יהוה אלהים מן האדמה כל חית השדה ואת כל עוף השמים ויבא אל האדם לראות מה יקרא לו וכל אשר יקרא לו האדם נפש חיה הוא שמו
(231976, 64, 4);80;פ;2600;(1, 2, 19, 83, 2600);683;(1, 2, 19, 25, 683);נפש;2;25;ויצר יהוה אלהים מן האדמה כל חית השדה ואת כל עוף השמים ויבא אל האדם לראות מה יקרא לו וכל אשר יקרא לו האדם נפש חיה הוא שמו
(231976, 64, 4);7;ז;2664;(1, 2, 20, 54, 2664);700;(1, 2, 20, 14, 700);עזר;2;14;ויקרא האדם שמות לכל הבהמה ולעוף השמים ולכל חית השדה ולאדם לא מצא עזר כנגדו
(231976, 64, 4);10;י;2728;(1, 2, 22, 2, 2728);715;(1, 2, 22, 1, 715);ויבן;2;1;ויבן יהוה אלהים את הצלע אשר לקח מן האדם לאשה ויבאה אל האדם
(231976, 64, 4);40;מ;2792;(1, 2, 23, 20, 2792);733;(1, 2, 23, 6, 733);מעצמי;1;6;ויאמר האדם זאת הפעם עצם מעצמי ובשר מבשרי לזאת יקרא אשה כי מאיש לקחה זאת
(231976, 64, 4);100;ק;2856;(1, 2, 24, 27, 2856);751;(1, 2, 24, 9, 751);ודבק;4;9;על כן יעזב איש את אביו ואת אמו ודבק באשתו והיו לבשר אחד
(231976, 64, 4);20;כ;2920;(1, 3, 1, 14, 2920);766;(1, 3, 1, 4, 766);מכל;2;4;והנחש היה ערום מכל חית השדה אשר עשה יהוה אלהים ויאמר אל האשה אף כי אמר אלהים לא תאכלו מכל עץ הגן
(231976, 64, 4);1;א;2984;(1, 3, 2, 3, 2984);785;(1, 3, 2, 1, 785);ותאמר;3;1;ותאמר האשה אל הנחש מפרי עץ הגן נאכל
(231976, 64, 4);30;ל;3048;(1, 3, 3, 39, 3048);803;(1, 3, 3, 11, 803);ולא;2;11;ומפרי העץ אשר בתוך הגן אמר אלהים לא תאכלו ממנו ולא תגעו בו פן תמתון
(231976, 64, 4);6;ו;3112;(1, 3, 5, 25, 3112);821;(1, 3, 5, 7, 821);ממנו;4;7;כי ידע אלהים כי ביום אכלכם ממנו ונפקחו עיניכם והייתם כאלהים ידעי טוב ורע
(231976, 64, 4);6;ו;3176;(1, 3, 6, 30, 3176);837;(1, 3, 6, 9, 837);הוא;2;9;ותרא האשה כי טוב העץ למאכל וכי תאוה הוא לעינים ונחמד העץ להשכיל ותקח מפריו ותאכל ותתן גם לאישה עמה ויאכל
(231976, 64, 4);50;נ;3240;(1, 3, 7, 10, 3240);851;(1, 3, 7, 2, 851);עיני;3;2;ותפקחנה עיני שניהם וידעו כי עירמם הם ויתפרו עלה תאנה ויעשו להם חגרת
(231976, 64, 4);10;י;3304;(1, 3, 8, 19, 3304);867;(1, 3, 8, 5, 867);אלהים;4;5;וישמעו את קול יהוה אלהים מתהלך בגן לרוח היום ויתחבא האדם ואשתו מפני יהוה אלהים בתוך עץ הגן
(231976, 64, 4);1;א;3368;(1, 3, 9, 10, 3368);883;(1, 3, 9, 3, 883);אלהים;1;3;ויקרא יהוה אלהים אל האדם ויאמר לו איכה
(231976, 64, 4);200;ר;3432;(1, 3, 11, 5, 3432);899;(1, 3, 11, 1, 899);ויאמר;5;1;ויאמר מי הגיד לך כי עירם אתה המן העץ אשר צויתיך לבלתי אכל ממנו אכלת
(231976, 64, 4);200;ר;3496;(1, 3, 12, 16, 3496);917;(1, 3, 12, 4, 917);אשר;3;4;ויאמר האדם האשה אשר נתתה עמדי הוא נתנה לי מן העץ ואכל
(231976, 64, 4);50;נ;3560;(1, 3, 13, 38, 3560);935;(1, 3, 13, 10, 935);הנחש;2;10;ויאמר יהוה אלהים לאשה מה זאת עשית ותאמר האשה הנחש השיאני ואכל
(231976, 64, 4);5;ה;3624;(1, 3, 14, 52, 3624);952;(1, 3, 14, 15, 952);השדה;1;15;ויאמר יהוה אלהים אל הנחש כי עשית זאת ארור אתה מכל הבהמה ומכל חית השדה על גחנך תלך ועפר תאכל כל ימי חייך
(231976, 64, 4);200;ר;3688;(1, 3, 15, 35, 3688);969;(1, 3, 15, 9, 969);זרעה;2;9;ואיבה אשית בינך ובין האשה ובין זרעך ובין זרעה הוא ישופך ראש ואתה תשופנו עקב
(231976, 64, 4);50;נ;3752;(1, 3, 16, 38, 3752);985;(1, 3, 16, 10, 985);בנים;2;10;אל האשה אמר הרבה ארבה עצבונך והרנך בעצב תלדי בנים ואל אישך תשוקתך והוא ימשל בך
(231976, 64, 4);400;ת;3816;(1, 3, 17, 39, 3816);1002;(1, 3, 17, 11, 1002);צויתיך;4;11;ולאדם אמר כי שמעת לקול אשתך ותאכל מן העץ אשר צויתיך לאמר לא תאכל ממנו ארורה האדמה בעבורך בעצבון תאכלנה כל ימי חייך
(231976, 64, 4);90;צ;3880;(1, 3, 18, 11, 3880);1017;(1, 3, 18, 3, 1017);תצמיח;2;3;וקוץ ודרדר תצמיח לך ואכלת את עשב השדה
(231976, 64, 4);400;ת;3944;(1, 3, 19, 45, 3944);1036;(1, 3, 19, 14, 1036);אתה;2;14;בזעת אפיך תאכל לחם עד שובך אל האדמה כי ממנה לקחת כי עפר אתה ואל עפר תשוב
(231976, 64, 4);1;א;4008;(1, 3, 21, 20, 4008);1055;(1, 3, 21, 5, 1055);ולאשתו;3;5;ויעש יהוה אלהים לאדם ולאשתו כתנות עור וילבשם
(231976, 64, 4);50;ן;4072;(1, 3, 22, 47, 4072);1071;(1, 3, 22, 13, 1071);פן;2;13;ויאמר יהוה אלהים הן האדם היה כאחד ממנו לדעת טוב ורע ועתה פן ישלח ידו ולקח גם מעץ החיים ואכל וחי לעלם
(231976, 64, 4);40;מ;4136;(1, 3, 23, 32, 4136);1088;(1, 3, 23, 8, 1088);האדמה;4;8;וישלחהו יהוה אלהים מגן עדן לעבד את האדמה אשר לקח משם
(231976, 64, 4);40;מ;4200;(1, 3, 24, 54, 4200);1105;(1, 3, 24, 14, 1105);לשמר;3;14;ויגרש את האדם וישכן מקדם לגן עדן את הכרבים ואת להט החרב המתהפכת לשמר את דרך עץ החיים
(231976, 64, 4);400;ת;4264;(1, 4, 2, 2, 4264);1124;(1, 4, 2, 1, 1124);ותסף;2;1;ותסף ללדת את אחיו את הבל ויהי הבל רעה צאן וקין היה עבד אדמה
(231976, 64, 4);80;פ;4328;(1, 4, 3, 20, 4328);1143;(1, 4, 3, 6, 1143);מפרי;2;6;ויהי מקץ ימים ויבא קין מפרי האדמה מנחה ליהוה
(231976, 64, 4);50;נ;4392;(1, 4, 4, 48, 4392);1159;(1, 4, 4, 13, 1159);מנחתו;2;13;והבל הביא גם הוא מבכרות צאנו ומחלבהן וישע יהוה אל הבל ואל מנחתו
(231976, 64, 4);20;ך;4456;(1, 4, 6, 22, 4456);1177;(1, 4, 6, 7, 1177);לך;2;7;ויאמר יהוה אל קין למה חרה לך ולמה נפלו פניך
(231976, 64, 4);40;מ;4520;(1, 4, 7, 52, 4520);1194;(1, 4, 7, 14, 1194);תמשל;2;14;הלוא אם תיטיב שאת ואם לא תיטיב לפתח חטאת רבץ ואליך תשוקתו ואתה תמשל בו
(231976, 64, 4);10;י;4584;(1, 4, 9, 6, 4584);1211;(1, 4, 9, 2, 1211);יהוה;1;2;ויאמר יהוה אל קין אי הבל אחיך ויאמר לא ידעתי השמר אחי אנכי
(231976, 64, 4);100;ק;4648;(1, 4, 10, 24, 4648);1229;(1, 4, 10, 7, 1229);צעקים;3;7;ויאמר מה עשית קול דמי אחיך צעקים אלי מן האדמה
(231976, 64, 4);2;ב;4712;(1, 4, 12, 5, 4712);1248;(1, 4, 12, 2, 1248);תעבד;3;2;כי תעבד את האדמה לא תסף תת כחה לך נע ונד תהיה בארץ
(231976, 64, 4);200;ר;4776;(1, 4, 14, 4, 4776);1268;(1, 4, 14, 2, 1268);גרשת;2;2;הן גרשת אתי היום מעל פני האדמה ומפניך אסתר והייתי נע ונד בארץ והיה כל מצאי יהרגני
(231976, 64, 4);1;א;4840;(1, 4, 15, 3, 4840);1284;(1, 4, 15, 1, 1284);ויאמר;3;1;ויאמר לו יהוה לכן כל הרג קין שבעתים יקם וישם יהוה לקין אות לבלתי הכות אתו כל מצאו
(231976, 64, 4);90;צ;4904;(1, 4, 16, 3, 4904);1302;(1, 4, 16, 1, 1302);ויצא;3;1;ויצא קין מלפני יהוה וישב בארץ נוד קדמת עדן
(231976, 64, 4);50;נ;4968;(1, 4, 17, 33, 4968);1320;(1, 4, 17, 10, 1320);בנה;2;10;וידע קין את אשתו ותהר ותלד את חנוך ויהי בנה עיר ויקרא שם העיר כשם בנו חנוך
(231976, 64, 4);30;ל;5032;(1, 4, 18, 39, 5032);1336;(1, 4, 18, 9, 1336);ומחייאל;7;9;ויולד לחנוך את עירד ועירד ילד את מחויאל ומחייאל ילד את מתושאל ומתושאל ילד את למך
(231976, 64, 4);400;ת;5096;(1, 4, 20, 2, 5096);1355;(1, 4, 20, 1, 1355);ותלד;2;1;ותלד עדה את יבל הוא היה אבי ישב אהל ומקנה
(231976, 64, 4);2;ב;5160;(1, 4, 21, 34, 5160);1374;(1, 4, 21, 10, 1374);ועוגב;5;10;ושם אחיו יובל הוא היה אבי כל תפש כנור ועוגב
(231976, 64, 4);30;ל;5224;(1, 4, 23, 9, 5224);1393;(1, 4, 23, 3, 1393);לנשיו;1;3;ויאמר למך לנשיו עדה וצלה שמען קולי נשי למך האזנה אמרתי כי איש הרגתי לפצעי וילד לחברתי
(231976, 64, 4);2;ב;5288;(1, 4, 24, 4, 5288);1409;(1, 4, 24, 2, 1409);שבעתים;2;2;כי שבעתים יקם קין ולמך שבעים ושבעה
(231976, 64, 4);10;י;5352;(1, 4, 25, 40, 5352);1428;(1, 4, 25, 14, 1428);לי;2;14;וידע אדם עוד את אשתו ותלד בן ותקרא את שמו שת כי שת לי אלהים זרע אחר תחת הבל כי הרגו קין
(231976, 64, 4);1;א;5416;(1, 4, 26, 38, 5416);1448;(1, 4, 26, 12, 1448);לקרא;4;12;ולשת גם הוא ילד בן ויקרא את שמו אנוש אז הוחל לקרא בשם יהוה
(231976, 64, 4);6;ו;5480;(1, 5, 2, 13, 5480);1466;(1, 5, 2, 4, 1466);ויברך;1;4;זכר ונקבה בראם ויברך אתם ויקרא את שמם אדם ביום הבראם
(231976, 64, 4);6;ו;5544;(1, 5, 3, 35, 5544);1481;(1, 5, 3, 8, 1481);כצלמו;5;8;ויחי אדם שלשים ומאת שנה ויולד בדמותו כצלמו ויקרא את שמו שת
(231976, 64, 4);5;ה;5608;(1, 5, 5, 3, 5608);1499;(1, 5, 5, 1, 1499);ויהיו;3;1;ויהיו כל ימי אדם אשר חי תשע מאות שנה ושלשים שנה וימת
(231976, 64, 4);1;א;5672;(1, 5, 6, 26, 5672);1518;(1, 5, 6, 8, 1518);את;1;8;ויחי שת חמש שנים ומאת שנה ויולד את אנוש
(231976, 64, 4);10;י;5736;(1, 5, 8, 4, 5736);1534;(1, 5, 8, 1, 1534);ויהיו;4;1;ויהיו כל ימי שת שתים עשרה שנה ותשע מאות שנה וימת
(231976, 64, 4);8;ח;5800;(1, 5, 10, 3, 5800);1552;(1, 5, 10, 1, 1552);ויחי;3;1;ויחי אנוש אחרי הולידו את קינן חמש עשרה שנה ושמנה מאות שנה ויולד בנים ובנות
(231976, 64, 4);30;ל;5864;(1, 5, 11, 7, 5864);1568;(1, 5, 11, 2, 1568);כל;2;2;ויהיו כל ימי אנוש חמש שנים ותשע מאות שנה וימת
(231976, 64, 4);10;י;5928;(1, 5, 13, 6, 5928);1585;(1, 5, 13, 2, 1585);קינן;2;2;ויחי קינן אחרי הולידו את מהללאל ארבעים שנה ושמנה מאות שנה ויולד בנים ובנות
(231976, 64, 4);40;מ;5992;(1, 5, 14, 9, 5992);1600;(1, 5, 14, 3, 1600);ימי;2;3;ויהיו כל ימי קינן עשר שנים ותשע מאות שנה וימת
(231976, 64, 4);10;י;6056;(1, 5, 16, 2, 6056);1617;(1, 5, 16, 1, 1617);ויחי;2;1;ויחי מהללאל אחרי הולידו את ירד שלשים שנה ושמנה מאות שנה ויולד בנים ובנות
(231976, 64, 4);30;ל;6120;(1, 5, 17, 7, 6120);1632;(1, 5, 17, 2, 1632);כל;2;2;ויהיו כל ימי מהללאל חמש ותשעים שנה ושמנה מאות שנה וימת
(231976, 64, 4);6;ו;6184;(1, 5, 18, 27, 6184);1649;(1, 5, 18, 8, 1649);ויולד;1;8;ויחי ירד שתים וששים שנה ומאת שנה ויולד את חנוך
(231976, 64, 4);20;כ;6248;(1, 5, 20, 6, 6248);1665;(1, 5, 20, 2, 1665);כל;1;2;ויהיו כל ימי ירד שתים וששים שנה ותשע מאות שנה וימת
(231976, 64, 4);300;ש;6312;(1, 5, 21, 30, 6312);1682;(1, 5, 21, 8, 1682);מתושלח;4;8;ויחי חנוך חמש וששים שנה ויולד את מתושלח
(231976, 64, 4);10;י;6376;(1, 5, 23, 2, 6376);1697;(1, 5, 23, 1, 1697);ויהי;2;1;ויהי כל ימי חנוך חמש וששים שנה ושלש מאות שנה
(231976, 64, 4);400;ת;6440;(1, 5, 24, 31, 6440);1714;(1, 5, 24, 8, 1714);אתו;2;8;ויתהלך חנוך את האלהים ואיננו כי לקח אתו אלהים
(231976, 64, 4);4;ד;6504;(1, 5, 26, 19, 6504);1729;(1, 5, 26, 4, 1729);הולידו;5;4;ויחי מתושלח אחרי הולידו את למך שתים ושמונים שנה ושבע מאות שנה ויולד בנים ובנות
(231976, 64, 4);70;ע;6568;(1, 5, 27, 19, 6568);1745;(1, 5, 27, 5, 1745);תשע;3;5;ויהיו כל ימי מתושלח תשע וששים שנה ותשע מאות שנה וימת
(231976, 64, 4);400;ת;6632;(1, 5, 29, 7, 6632);1762;(1, 5, 29, 2, 1762);את;2;2;ויקרא את שמו נח לאמר זה ינחמנו ממעשנו ומעצבון ידינו מן האדמה אשר אררה יהוה
(231976, 64, 4);10;י;6696;(1, 5, 30, 11, 6696);1778;(1, 5, 30, 3, 1778);אחרי;4;3;ויחי למך אחרי הולידו את נח חמש ותשעים שנה וחמש מאת שנה ויולד בנים ובנות
(231976, 64, 4);2;ב;6760;(1, 5, 31, 18, 6760);1796;(1, 5, 31, 6, 1796);ושבעים;3;6;ויהי כל ימי למך שבע ושבעים שנה ושבע מאות שנה וימת
(231976, 64, 4);10;י;6824;(1, 6, 1, 4, 6824);1816;(1, 6, 1, 1, 1816);ויהי;4;1;ויהי כי החל האדם לרב על פני האדמה ובנות ילדו להם
(231976, 64, 4);5;ה;6888;(1, 6, 2, 30, 6888);1835;(1, 6, 2, 9, 1835);הנה;1;9;ויראו בני האלהים את בנות האדם כי טבת הנה ויקחו להם נשים מכל אשר בחרו
(231976, 64, 4);10;י;6952;(1, 6, 3, 40, 6952);1852;(1, 6, 3, 11, 1852);והיו;3;11;ויאמר יהוה לא ידון רוחי באדם לעלם בשגם הוא בשר והיו ימיו מאה ועשרים שנה
(231976, 64, 4);1;א;7016;(1, 6, 4, 47, 7016);1869;(1, 6, 4, 13, 1869);אל;1;13;הנפלים היו בארץ בימים ההם וגם אחרי כן אשר יבאו בני האלהים אל בנות האדם וילדו להם המה הגברים אשר מעולם אנשי השם
(231976, 64, 4);200;ר;7080;(1, 6, 5, 23, 7080);1886;(1, 6, 5, 7, 1886);בארץ;3;7;וירא יהוה כי רבה רעת האדם בארץ וכל יצר מחשבת לבו רק רע כל היום
(231976, 64, 4);40;מ;7144;(1, 6, 7, 4, 7144);1905;(1, 6, 7, 1, 1905);ויאמר;4;1;ויאמר יהוה אמחה את האדם אשר בראתי מעל פני האדמה מאדם עד בהמה עד רמש ועד עוף השמים כי נחמתי כי עשיתם
(231976, 64, 4);8;ח;7208;(1, 6, 7, 68, 7208);1924;(1, 6, 7, 20, 1924);נחמתי;2;20;ויאמר יהוה אמחה את האדם אשר בראתי מעל פני האדמה מאדם עד בהמה עד רמש ועד עוף השמים כי נחמתי כי עשיתם
(231976, 64, 4);30;ל;7272;(1, 6, 9, 37, 7272);1942;(1, 6, 9, 11, 1942);האלהים;3;11;אלה תולדת נח נח איש צדיק תמים היה בדרתיו את האלהים התהלך נח
(231976, 64, 4);5;ה;7336;(1, 6, 11, 25, 7336);1960;(1, 6, 11, 6, 1960);הארץ;1;6;ותשחת הארץ לפני האלהים ותמלא הארץ חמס
(231976, 64, 4);40;ם;7400;(1, 6, 13, 10, 7400);1977;(1, 6, 13, 2, 1977);אלהים;5;2;ויאמר אלהים לנח קץ כל בשר בא לפני כי מלאה הארץ חמס מפניהם והנני משחיתם את הארץ
(231976, 64, 4);3;ג;7464;(1, 6, 14, 12, 7464);1997;(1, 6, 14, 5, 1997);גפר;1;5;עשה לך תבת עצי גפר קנים תעשה את התבה וכפרת אתה מבית ומחוץ בכפר
(231976, 64, 4);5;ה;7528;(1, 6, 15, 27, 7528);2015;(1, 6, 15, 9, 2015);התבה;1;9;וזה אשר תעשה אתה שלש מאות אמה ארך התבה חמשים אמה רחבה ושלשים אמה קומתה
(231976, 64, 4);2;ב;7592;(1, 6, 16, 35, 7592);2030;(1, 6, 16, 9, 2030);התבה;3;9;צהר תעשה לתבה ואל אמה תכלנה מלמעלה ופתח התבה בצדה תשים תחתים שנים ושלשים תעשה
(231976, 64, 4);300;ש;7656;(1, 6, 17, 36, 7656);2047;(1, 6, 17, 11, 2047);בשר;2;11;ואני הנני מביא את המבול מים על הארץ לשחת כל בשר אשר בו רוח חיים מתחת השמים כל אשר בארץ יגוע
(231976, 64, 4);5;ה;7720;(1, 6, 18, 29, 7720);2065;(1, 6, 18, 8, 2065);אתה;3;8;והקמתי את בריתי אתך ובאת אל התבה אתה ובניך ואשתך ונשי בניך אתך
(231976, 64, 4);50;נ;7784;(1, 6, 19, 43, 7784);2083;(1, 6, 19, 13, 2083);ונקבה;2;13;ומכל החי מכל בשר שנים מכל תביא אל התבה להחית אתך זכר ונקבה יהיו
(231976, 64, 4);30;ל;7848;(1, 6, 20, 57, 7848);2098;(1, 6, 20, 14, 2098);להחיות;1;14;מהעוף למינהו ומן הבהמה למינה מכל רמש האדמה למינהו שנים מכל יבאו אליך להחיות
