(n,d,k);LetterGematriaNumberValue;Letter;LetterPositionIndex;LetterCoordinatesD5K;WordNumber;WordCoordinatesDWTK;Found in Word in Text;LetterPositionIndex In Word;WordNumberInVerse;Found In Verse
(201382, -86, 4);6;ו;56;(1, 1, 2, 28, 56);15;(1, 1, 2, 8, 15);תהום;3;8;והארץ היתה תהו ובהו וחשך על פני תהום ורוח אלהים מרחפת על פני המים
(201382, -86, 4);2;ב;142;(1, 1, 4, 39, 142);38;(1, 1, 4, 11, 38);ובין;2;11;וירא אלהים את האור כי טוב ויבדל אלהים בין האור ובין החשך
(201382, -86, 4);2;ב;228;(1, 1, 6, 31, 228);60;(1, 1, 6, 8, 60);מבדיל;2;8;ויאמר אלהים יהי רקיע בתוך המים ויהי מבדיל בין מים למים
(201382, -86, 4);5;ה;314;(1, 1, 8, 8, 314);82;(1, 1, 8, 2, 82);אלהים;3;2;ויקרא אלהים לרקיע שמים ויהי ערב ויהי בקר יום שני
(201382, -86, 4);100;ק;400;(1, 1, 10, 3, 400);104;(1, 1, 10, 1, 104);ויקרא;3;1;ויקרא אלהים ליבשה ארץ ולמקוה המים קרא ימים וירא אלהים כי טוב
(201382, -86, 4);5;ה;486;(1, 1, 11, 40, 486);126;(1, 1, 11, 11, 126);עשה;3;11;ויאמר אלהים תדשא הארץ דשא עשב מזריע זרע עץ פרי עשה פרי למינו אשר זרעו בו על הארץ ויהי כן
(201382, -86, 4);1;א;572;(1, 1, 12, 57, 572);150;(1, 1, 12, 15, 150);וירא;4;15;ותוצא הארץ דשא עשב מזריע זרע למינהו ועץ עשה פרי אשר זרעו בו למינהו וירא אלהים כי טוב
(201382, -86, 4);30;ל;658;(1, 1, 14, 54, 658);172;(1, 1, 14, 13, 172);לאתת;1;13;ויאמר אלהים יהי מארת ברקיע השמים להבדיל בין היום ובין הלילה והיו לאתת ולמועדים ולימים ושנים
(201382, -86, 4);400;ת;744;(1, 1, 16, 27, 744);191;(1, 1, 16, 7, 191);את;2;7;ויעש אלהים את שני המארת הגדלים את המאור הגדל לממשלת היום ואת המאור הקטן לממשלת הלילה ואת הכוכבים
(201382, -86, 4);6;ו;830;(1, 1, 18, 1, 830);211;(1, 1, 18, 1, 211);ולמשל;1;1;ולמשל ביום ובלילה ולהבדיל בין האור ובין החשך וירא אלהים כי טוב
(201382, -86, 4);90;צ;916;(1, 1, 20, 14, 916);231;(1, 1, 20, 3, 231);ישרצו;4;3;ויאמר אלהים ישרצו המים שרץ נפש חיה ועוף יעופף על הארץ על פני רקיע השמים
(201382, -86, 4);300;ש;1002;(1, 1, 21, 43, 1002);254;(1, 1, 21, 11, 254);אשר;2;11;ויברא אלהים את התנינם הגדלים ואת כל נפש החיה הרמשת אשר שרצו המים למינהם ואת כל עוף כנף למינהו וירא אלהים כי טוב
(201382, -86, 4);40;ם;1088;(1, 1, 22, 40, 1088);276;(1, 1, 22, 10, 276);בימים;5;10;ויברך אתם אלהים לאמר פרו ורבו ומלאו את המים בימים והעוף ירב בארץ
(201382, -86, 4);10;י;1174;(1, 1, 24, 52, 1174);298;(1, 1, 24, 13, 298);ויהי;2;13;ויאמר אלהים תוצא הארץ נפש חיה למינה בהמה ורמש וחיתו ארץ למינה ויהי כן
(201382, -86, 4);300;ש;1260;(1, 1, 26, 13, 1260);320;(1, 1, 26, 3, 320);נעשה;3;3;ויאמר אלהים נעשה אדם בצלמנו כדמותנו וירדו בדגת הים ובעוף השמים ובבהמה ובכל הארץ ובכל הרמש הרמש על הארץ
(201382, -86, 4);4;ד;1346;(1, 1, 27, 15, 1346);340;(1, 1, 27, 4, 340);האדם;3;4;ויברא אלהים את האדם בצלמו בצלם אלהים ברא אתו זכר ונקבה ברא אתם
(201382, -86, 4);200;ר;1432;(1, 1, 28, 51, 1432);362;(1, 1, 28, 13, 362);ורדו;2;13;ויברך אתם אלהים ויאמר להם אלהים פרו ורבו ומלאו את הארץ וכבשה ורדו בדגת הים ובעוף השמים ובכל חיה הרמשת על הארץ
(201382, -86, 4);1;א;1518;(1, 1, 29, 49, 1518);387;(1, 1, 29, 16, 387);ואת;2;16;ויאמר אלהים הנה נתתי לכם את כל עשב זרע זרע אשר על פני כל הארץ ואת כל העץ אשר בו פרי עץ זרע זרע לכם יהיה לאכלה
(201382, -86, 4);30;ל;1604;(1, 1, 30, 52, 1604);414;(1, 1, 30, 16, 414);כל;2;16;ולכל חית הארץ ולכל עוף השמים ולכל רומש על הארץ אשר בו נפש חיה את כל ירק עשב לאכלה ויהי כן
(201382, -86, 4);90;צ;1690;(1, 2, 1, 19, 1690);439;(1, 2, 1, 5, 439);צבאם;1;5;ויכלו השמים והארץ וכל צבאם
(201382, -86, 4);6;ו;1776;(1, 2, 3, 22, 1776);459;(1, 2, 3, 6, 459);ויקדש;1;6;ויברך אלהים את יום השביעי ויקדש אתו כי בו שבת מכל מלאכתו אשר ברא אלהים לעשות
(201382, -86, 4);300;ש;1862;(1, 2, 4, 47, 1862);480;(1, 2, 4, 11, 480);ושמים;2;11;אלה תולדות השמים והארץ בהבראם ביום עשות יהוה אלהים ארץ ושמים
(201382, -86, 4);4;ד;1948;(1, 2, 6, 3, 1948);504;(1, 2, 6, 1, 504);ואד;3;1;ואד יעלה מן הארץ והשקה את כל פני האדמה
(201382, -86, 4);300;ש;2034;(1, 2, 7, 59, 2034);527;(1, 2, 7, 15, 527);לנפש;4;15;וייצר יהוה אלהים את האדם עפר מן האדמה ויפח באפיו נשמת חיים ויהי האדם לנפש חיה
(201382, -86, 4);20;כ;2120;(1, 2, 9, 42, 2120);551;(1, 2, 9, 11, 551);למאכל;4;11;ויצמח יהוה אלהים מן האדמה כל עץ נחמד למראה וטוב למאכל ועץ החיים בתוך הגן ועץ הדעת טוב ורע
(201382, -86, 4);5;ה;2206;(1, 2, 11, 12, 2206);574;(1, 2, 11, 4, 574);הוא;1;4;שם האחד פישון הוא הסבב את כל ארץ החוילה אשר שם הזהב
(201382, -86, 4);30;ל;2292;(1, 2, 13, 28, 2292);598;(1, 2, 13, 8, 598);כל;2;8;ושם הנהר השני גיחון הוא הסובב את כל ארץ כוש
(201382, -86, 4);50;ן;2378;(1, 2, 15, 31, 2378);620;(1, 2, 15, 8, 620);עדן;3;8;ויקח יהוה אלהים את האדם וינחהו בגן עדן לעבדה ולשמרה
(201382, -86, 4);50;נ;2464;(1, 2, 17, 37, 2464);644;(1, 2, 17, 11, 644);ממנו;3;11;ומעץ הדעת טוב ורע לא תאכל ממנו כי ביום אכלך ממנו מות תמות
(201382, -86, 4);20;כ;2550;(1, 2, 19, 33, 2550);668;(1, 2, 19, 10, 668);כל;1;10;ויצר יהוה אלהים מן האדמה כל חית השדה ואת כל עוף השמים ויבא אל האדם לראות מה יקרא לו וכל אשר יקרא לו האדם נפש חיה הוא שמו
(201382, -86, 4);80;ף;2636;(1, 2, 20, 26, 2636);692;(1, 2, 20, 6, 692);ולעוף;5;6;ויקרא האדם שמות לכל הבהמה ולעוף השמים ולכל חית השדה ולאדם לא מצא עזר כנגדו
(201382, -86, 4);400;ת;2722;(1, 2, 21, 52, 2722);714;(1, 2, 21, 13, 714);תחתנה;1;13;ויפל יהוה אלהים תרדמה על האדם ויישן ויקח אחת מצלעתיו ויסגר בשר תחתנה
(201382, -86, 4);1;א;2808;(1, 2, 23, 36, 2808);736;(1, 2, 23, 9, 736);לזאת;3;9;ויאמר האדם זאת הפעם עצם מעצמי ובשר מבשרי לזאת יקרא אשה כי מאיש לקחה זאת
(201382, -86, 4);1;א;2894;(1, 2, 25, 22, 2894);760;(1, 2, 25, 5, 760);ואשתו;2;5;ויהיו שניהם ערומים האדם ואשתו ולא יתבששו
(201382, -86, 4);3;ג;2980;(1, 3, 1, 74, 2980);784;(1, 3, 1, 22, 784);הגן;2;22;והנחש היה ערום מכל חית השדה אשר עשה יהוה אלהים ויאמר אל האשה אף כי אמר אלהים לא תאכלו מכל עץ הגן
(201382, -86, 4);40;מ;3066;(1, 3, 4, 4, 3066);808;(1, 3, 4, 1, 808);ויאמר;4;1;ויאמר הנחש אל האשה לא מות תמתון
(201382, -86, 4);1;א;3152;(1, 3, 6, 6, 3152);830;(1, 3, 6, 2, 830);האשה;2;2;ותרא האשה כי טוב העץ למאכל וכי תאוה הוא לעינים ונחמד העץ להשכיל ותקח מפריו ותאכל ותתן גם לאישה עמה ויאכל
(201382, -86, 4);70;ע;3238;(1, 3, 7, 8, 3238);851;(1, 3, 7, 2, 851);עיני;1;2;ותפקחנה עיני שניהם וידעו כי עירמם הם ויתפרו עלה תאנה ויעשו להם חגרת
(201382, -86, 4);400;ת;3324;(1, 3, 8, 39, 3324);872;(1, 3, 8, 10, 872);ויתחבא;3;10;וישמעו את קול יהוה אלהים מתהלך בגן לרוח היום ויתחבא האדם ואשתו מפני יהוה אלהים בתוך עץ הגן
(201382, -86, 4);10;י;3410;(1, 3, 10, 21, 3410);894;(1, 3, 10, 6, 894);ואירא;3;6;ויאמר את קלך שמעתי בגן ואירא כי עירם אנכי ואחבא
(201382, -86, 4);200;ר;3496;(1, 3, 12, 16, 3496);917;(1, 3, 12, 4, 917);אשר;3;4;ויאמר האדם האשה אשר נתתה עמדי הוא נתנה לי מן העץ ואכל
(201382, -86, 4);1;א;3582;(1, 3, 14, 10, 3582);940;(1, 3, 14, 3, 940);אלהים;1;3;ויאמר יהוה אלהים אל הנחש כי עשית זאת ארור אתה מכל הבהמה ומכל חית השדה על גחנך תלך ועפר תאכל כל ימי חייך
(201382, -86, 4);2;ב;3668;(1, 3, 15, 15, 3668);964;(1, 3, 15, 4, 964);ובין;2;4;ואיבה אשית בינך ובין האשה ובין זרעך ובין זרעה הוא ישופך ראש ואתה תשופנו עקב
(201382, -86, 4);40;ם;3754;(1, 3, 16, 40, 3754);985;(1, 3, 16, 10, 985);בנים;4;10;אל האשה אמר הרבה ארבה עצבונך והרנך בעצב תלדי בנים ואל אישך תשוקתך והוא ימשל בך
(201382, -86, 4);4;ד;3840;(1, 3, 17, 63, 3840);1008;(1, 3, 17, 17, 1008);האדמה;3;17;ולאדם אמר כי שמעת לקול אשתך ותאכל מן העץ אשר צויתיך לאמר לא תאכל ממנו ארורה האדמה בעבורך בעצבון תאכלנה כל ימי חייך
(201382, -86, 4);40;מ;3926;(1, 3, 19, 27, 3926);1030;(1, 3, 19, 8, 1030);האדמה;4;8;בזעת אפיך תאכל לחם עד שובך אל האדמה כי ממנה לקחת כי עפר אתה ואל עפר תשוב
(201382, -86, 4);20;כ;4012;(1, 3, 21, 24, 4012);1056;(1, 3, 21, 6, 1056);כתנות;1;6;ויעש יהוה אלהים לאדם ולאשתו כתנות עור וילבשם
(201382, -86, 4);6;ו;4098;(1, 3, 22, 73, 4098);1079;(1, 3, 22, 21, 1079);וחי;1;21;ויאמר יהוה אלהים הן האדם היה כאחד ממנו לדעת טוב ורע ועתה פן ישלח ידו ולקח גם מעץ החיים ואכל וחי לעלם
(201382, -86, 4);30;ל;4184;(1, 3, 24, 38, 4184);1102;(1, 3, 24, 11, 1102);להט;1;11;ויגרש את האדם וישכן מקדם לגן עדן את הכרבים ואת להט החרב המתהפכת לשמר את דרך עץ החיים
(201382, -86, 4);400;ת;4270;(1, 4, 2, 8, 4270);1125;(1, 4, 2, 2, 1125);ללדת;4;2;ותסף ללדת את אחיו את הבל ויהי הבל רעה צאן וקין היה עבד אדמה
(201382, -86, 4);6;ו;4356;(1, 4, 4, 12, 4356);1150;(1, 4, 4, 4, 1150);הוא;2;4;והבל הביא גם הוא מבכרות צאנו ומחלבהן וישע יהוה אל הבל ואל מנחתו
(201382, -86, 4);6;ו;4442;(1, 4, 6, 8, 4442);1172;(1, 4, 6, 2, 1172);יהוה;3;2;ויאמר יהוה אל קין למה חרה לך ולמה נפלו פניך
(201382, -86, 4);40;מ;4528;(1, 4, 8, 4, 4528);1196;(1, 4, 8, 1, 1196);ויאמר;4;1;ויאמר קין אל הבל אחיו ויהי בהיותם בשדה ויקם קין אל הבל אחיו ויהרגהו
(201382, -86, 4);5;ה;4614;(1, 4, 9, 36, 4614);1220;(1, 4, 9, 11, 1220);השמר;1;11;ויאמר יהוה אל קין אי הבל אחיך ויאמר לא ידעתי השמר אחי אנכי
(201382, -86, 4);1;א;4700;(1, 4, 11, 40, 4700);1245;(1, 4, 11, 13, 1245);אחיך;1;13;ועתה ארור אתה מן האדמה אשר פצתה את פיה לקחת את דמי אחיך מידך
(201382, -86, 4);40;מ;4786;(1, 4, 14, 14, 4786);1271;(1, 4, 14, 5, 1271);מעל;1;5;הן גרשת אתי היום מעל פני האדמה ומפניך אסתר והייתי נע ונד בארץ והיה כל מצאי יהרגני
(201382, -86, 4);40;ם;4872;(1, 4, 15, 35, 4872);1293;(1, 4, 15, 10, 1293);וישם;4;10;ויאמר לו יהוה לכן כל הרג קין שבעתים יקם וישם יהוה לקין אות לבלתי הכות אתו כל מצאו
(201382, -86, 4);400;ת;4958;(1, 4, 17, 23, 4958);1317;(1, 4, 17, 7, 1317);את;2;7;וידע קין את אשתו ותהר ותלד את חנוך ויהי בנה עיר ויקרא שם העיר כשם בנו חנוך
(201382, -86, 4);6;ו;5044;(1, 4, 18, 51, 5044);1340;(1, 4, 18, 13, 1340);ומתושאל;1;13;ויולד לחנוך את עירד ועירד ילד את מחויאל ומחייאל ילד את מתושאל ומתושאל ילד את למך
(201382, -86, 4);1;א;5130;(1, 4, 21, 4, 5130);1366;(1, 4, 21, 2, 1366);אחיו;1;2;ושם אחיו יובל הוא היה אבי כל תפש כנור ועוגב
(201382, -86, 4);6;ו;5216;(1, 4, 23, 1, 5216);1391;(1, 4, 23, 1, 1391);ויאמר;1;1;ויאמר למך לנשיו עדה וצלה שמען קולי נשי למך האזנה אמרתי כי איש הרגתי לפצעי וילד לחברתי
(201382, -86, 4);20;ך;5302;(1, 4, 24, 18, 5302);1412;(1, 4, 24, 5, 1412);ולמך;4;5;כי שבעתים יקם קין ולמך שבעים ושבעה
(201382, -86, 4);10;י;5388;(1, 4, 26, 10, 5388);1440;(1, 4, 26, 4, 1440);ילד;1;4;ולשת גם הוא ילד בן ויקרא את שמו אנוש אז הוחל לקרא בשם יהוה
(201382, -86, 4);2;ב;5474;(1, 5, 2, 7, 5474);1464;(1, 5, 2, 2, 1464);ונקבה;4;2;זכר ונקבה בראם ויברך אתם ויקרא את שמם אדם ביום הבראם
(201382, -86, 4);10;י;5560;(1, 5, 4, 4, 5560);1486;(1, 5, 4, 1, 1486);ויהיו;4;1;ויהיו ימי אדם אחרי הולידו את שת שמנה מאת שנה ויולד בנים ובנות
(201382, -86, 4);400;ת;5646;(1, 5, 5, 41, 5646);1510;(1, 5, 5, 12, 1510);וימת;4;12;ויהיו כל ימי אדם אשר חי תשע מאות שנה ושלשים שנה וימת
(201382, -86, 4);400;ת;5732;(1, 5, 7, 55, 5732);1533;(1, 5, 7, 14, 1533);ובנות;5;14;ויחי שת אחרי הולידו את אנוש שבע שנים ושמנה מאות שנה ויולד בנים ובנות
(201382, -86, 4);100;ק;5818;(1, 5, 10, 21, 5818);1557;(1, 5, 10, 6, 1557);קינן;1;6;ויחי אנוש אחרי הולידו את קינן חמש עשרה שנה ושמנה מאות שנה ויולד בנים ובנות
(201382, -86, 4);70;ע;5904;(1, 5, 12, 11, 5904);1579;(1, 5, 12, 3, 1579);שבעים;3;3;ויחי קינן שבעים שנה ויולד את מהללאל
(201382, -86, 4);30;ל;5990;(1, 5, 14, 7, 5990);1599;(1, 5, 14, 2, 1599);כל;2;2;ויהיו כל ימי קינן עשר שנים ותשע מאות שנה וימת
(201382, -86, 4);400;ת;6076;(1, 5, 16, 22, 6076);1621;(1, 5, 16, 5, 1621);את;2;5;ויחי מהללאל אחרי הולידו את ירד שלשים שנה ושמנה מאות שנה ויולד בנים ובנות
(201382, -86, 4);10;י;6162;(1, 5, 18, 5, 6162);1643;(1, 5, 18, 2, 1643);ירד;1;2;ויחי ירד שתים וששים שנה ומאת שנה ויולד את חנוך
(201382, -86, 4);20;כ;6248;(1, 5, 20, 6, 6248);1665;(1, 5, 20, 2, 1665);כל;1;2;ויהיו כל ימי ירד שתים וששים שנה ותשע מאות שנה וימת
(201382, -86, 4);8;ח;6334;(1, 5, 22, 20, 6334);1687;(1, 5, 22, 5, 1687);אחרי;2;5;ויתהלך חנוך את האלהים אחרי הולידו את מתושלח שלש מאות שנה ויולד בנים ובנות
(201382, -86, 4);1;א;6420;(1, 5, 24, 11, 6420);1709;(1, 5, 24, 3, 1709);את;1;3;ויתהלך חנוך את האלהים ואיננו כי לקח אתו אלהים
(201382, -86, 4);1;א;6506;(1, 5, 26, 21, 6506);1730;(1, 5, 26, 5, 1730);את;1;5;ויחי מתושלח אחרי הולידו את למך שתים ושמונים שנה ושבע מאות שנה ויולד בנים ובנות
(201382, -86, 4);6;ו;6592;(1, 5, 28, 1, 6592);1752;(1, 5, 28, 1, 1752);ויחי;1;1;ויחי למך שתים ושמנים שנה ומאת שנה ויולד בן
(201382, -86, 4);1;א;6678;(1, 5, 29, 53, 6678);1774;(1, 5, 29, 14, 1774);אררה;1;14;ויקרא את שמו נח לאמר זה ינחמנו ממעשנו ומעצבון ידינו מן האדמה אשר אררה יהוה
(201382, -86, 4);300;ש;6764;(1, 5, 31, 22, 6764);1797;(1, 5, 31, 7, 1797);שנה;1;7;ויהי כל ימי למך שבע ושבעים שנה ושבע מאות שנה וימת
(201382, -86, 4);6;ו;6850;(1, 6, 1, 30, 6850);1824;(1, 6, 1, 9, 1824);ובנות;4;9;ויהי כי החל האדם לרב על פני האדמה ובנות ילדו להם
(201382, -86, 4);30;ל;6936;(1, 6, 3, 24, 6936);1848;(1, 6, 3, 7, 1848);לעלם;1;7;ויאמר יהוה לא ידון רוחי באדם לעלם בשגם הוא בשר והיו ימיו מאה ועשרים שנה
(201382, -86, 4);5;ה;7022;(1, 6, 4, 53, 7022);1871;(1, 6, 4, 15, 1871);האדם;1;15;הנפלים היו בארץ בימים ההם וגם אחרי כן אשר יבאו בני האלהים אל בנות האדם וילדו להם המה הגברים אשר מעולם אנשי השם
(201382, -86, 4);50;נ;7108;(1, 6, 6, 3, 7108);1895;(1, 6, 6, 1, 1895);וינחם;3;1;וינחם יהוה כי עשה את האדם בארץ ויתעצב אל לבו
(201382, -86, 4);6;ו;7194;(1, 6, 7, 54, 7194);1920;(1, 6, 7, 16, 1920);ועד;1;16;ויאמר יהוה אמחה את האדם אשר בראתי מעל פני האדמה מאדם עד בהמה עד רמש ועד עוף השמים כי נחמתי כי עשיתם
(201382, -86, 4);20;ך;7280;(1, 6, 9, 45, 7280);1943;(1, 6, 9, 12, 1943);התהלך;5;12;אלה תולדת נח נח איש צדיק תמים היה בדרתיו את האלהים התהלך נח
(201382, -86, 4);5;ה;7366;(1, 6, 12, 24, 7366);1967;(1, 6, 12, 6, 1967);נשחתה;5;6;וירא אלהים את הארץ והנה נשחתה כי השחית כל בשר את דרכו על הארץ
(201382, -86, 4);90;ץ;7452;(1, 6, 13, 62, 7452);1992;(1, 6, 13, 17, 1992);הארץ;4;17;ויאמר אלהים לנח קץ כל בשר בא לפני כי מלאה הארץ חמס מפניהם והנני משחיתם את הארץ
(201382, -86, 4);40;מ;7538;(1, 6, 15, 37, 7538);2017;(1, 6, 15, 11, 2017);אמה;2;11;וזה אשר תעשה אתה שלש מאות אמה ארך התבה חמשים אמה רחבה ושלשים אמה קומתה
(201382, -86, 4);10;י;7624;(1, 6, 17, 4, 7624);2037;(1, 6, 17, 1, 2037);ואני;4;1;ואני הנני מביא את המבול מים על הארץ לשחת כל בשר אשר בו רוח חיים מתחת השמים כל אשר בארץ יגוע
(201382, -86, 4);1;א;7710;(1, 6, 18, 19, 7710);2062;(1, 6, 18, 5, 2062);ובאת;3;5;והקמתי את בריתי אתך ובאת אל התבה אתה ובניך ואשתך ונשי בניך אתך
(201382, -86, 4);80;ף;7796;(1, 6, 20, 5, 7796);2085;(1, 6, 20, 1, 2085);מהעוף;5;1;מהעוף למינהו ומן הבהמה למינה מכל רמש האדמה למינהו שנים מכל יבאו אליך להחיות
(201382, -86, 4);30;ל;7882;(1, 6, 21, 29, 7882);2107;(1, 6, 21, 9, 2107);אליך;2;9;ואתה קח לך מכל מאכל אשר יאכל ואספת אליך והיה לך ולהם לאכלה
(201382, -86, 4);90;צ;7968;(1, 7, 1, 41, 7968);2133;(1, 7, 1, 13, 2133);צדיק;1;13;ויאמר יהוה לנח בא אתה וכל ביתך אל התבה כי אתך ראיתי צדיק לפני בדור הזה
(201382, -86, 4);6;ו;8054;(1, 7, 3, 5, 8054);2156;(1, 7, 3, 2, 2156);מעוף;3;2;גם מעוף השמים שבעה שבעה זכר ונקבה לחיות זרע על פני כל הארץ
(201382, -86, 4);40;ם;8140;(1, 7, 4, 45, 8140);2178;(1, 7, 4, 11, 2178);וארבעים;7;11;כי לימים עוד שבעה אנכי ממטיר על הארץ ארבעים יום וארבעים לילה ומחיתי את כל היקום אשר עשיתי מעל פני האדמה
(201382, -86, 4);30;ל;8226;(1, 7, 6, 28, 8226);2203;(1, 7, 6, 9, 2203);על;2;9;ונח בן שש מאות שנה והמבול היה מים על הארץ
(201382, -86, 4);70;ע;8312;(1, 7, 8, 38, 8312);2226;(1, 7, 8, 10, 2226);העוף;2;10;מן הבהמה הטהורה ומן הבהמה אשר איננה טהרה ומן העוף וכל אשר רמש על האדמה
(201382, -86, 4);5;ה;8398;(1, 7, 10, 23, 8398);2251;(1, 7, 10, 6, 2251);היו;1;6;ויהי לשבעת הימים ומי המבול היו על הארץ
(201382, -86, 4);10;י;8484;(1, 7, 11, 78, 8484);2274;(1, 7, 11, 21, 2274);השמים;4;21;בשנת שש מאות שנה לחיי נח בחדש השני בשבעה עשר יום לחדש ביום הזה נבקעו כל מעינות תהום רבה וארבת השמים נפתחו
(201382, -86, 4);50;נ;8570;(1, 7, 13, 46, 8570);2298;(1, 7, 13, 15, 2298);בניו;2;15;בעצם היום הזה בא נח ושם וחם ויפת בני נח ואשת נח ושלשת נשי בניו אתם אל התבה
(201382, -86, 4);80;ף;8656;(1, 7, 14, 75, 8656);2321;(1, 7, 14, 20, 2321);כנף;3;20;המה וכל החיה למינה וכל הבהמה למינה וכל הרמש הרמש על הארץ למינהו וכל העוף למינהו כל צפור כל כנף
(201382, -86, 4);10;י;8742;(1, 7, 16, 44, 8742);2346;(1, 7, 16, 12, 2346);יהוה;1;12;והבאים זכר ונקבה מכל בשר באו כאשר צוה אתו אלהים ויסגר יהוה בעדו
(201382, -86, 4);90;ץ;8828;(1, 7, 18, 24, 8828);2367;(1, 7, 18, 6, 2367);הארץ;4;6;ויגברו המים וירבו מאד על הארץ ותלך התבה על פני המים
(201382, -86, 4);3;ג;8914;(1, 7, 20, 17, 8914);2391;(1, 7, 20, 5, 2391);גברו;1;5;חמש עשרה אמה מלמעלה גברו המים ויכסו ההרים
(201382, -86, 4);400;ת;9000;(1, 7, 22, 9, 9000);2413;(1, 7, 22, 3, 2413);נשמת;4;3;כל אשר נשמת רוח חיים באפיו מכל אשר בחרבה מתו
(201382, -86, 4);5;ה;9086;(1, 7, 23, 60, 9086);2439;(1, 7, 23, 19, 2439);הארץ;1;19;וימח את כל היקום אשר על פני האדמה מאדם עד בהמה עד רמש ועד עוף השמים וימחו מן הארץ וישאר אך נח ואשר אתו בתבה
(201382, -86, 4);300;ש;9172;(1, 8, 1, 35, 9172);2463;(1, 8, 1, 11, 2463);אשר;2;11;ויזכר אלהים את נח ואת כל החיה ואת כל הבהמה אשר אתו בתבה ויעבר אלהים רוח על הארץ וישכו המים
(201382, -86, 4);40;ם;9258;(1, 8, 3, 9, 9258);2483;(1, 8, 3, 2, 2483);המים;4;2;וישבו המים מעל הארץ הלוך ושוב ויחסרו המים מקצה חמשים ומאת יום
(201382, -86, 4);40;מ;9344;(1, 8, 5, 3, 9344);2505;(1, 8, 5, 1, 2505);והמים;3;1;והמים היו הלוך וחסור עד החדש העשירי בעשירי באחד לחדש נראו ראשי ההרים
(201382, -86, 4);5;ה;9430;(1, 8, 6, 33, 9430);2526;(1, 8, 6, 9, 2526);התבה;4;9;ויהי מקץ ארבעים יום ויפתח נח את חלון התבה אשר עשה
(201382, -86, 4);5;ה;9516;(1, 8, 8, 40, 9516);2549;(1, 8, 8, 10, 2549);האדמה;5;10;וישלח את היונה מאתו לראות הקלו המים מעל פני האדמה
(201382, -86, 4);8;ח;9602;(1, 8, 10, 3, 9602);2574;(1, 8, 10, 1, 2574);ויחל;3;1;ויחל עוד שבעת ימים אחרים ויסף שלח את היונה מן התבה
(201382, -86, 4);40;מ;9688;(1, 8, 11, 49, 9688);2599;(1, 8, 11, 15, 2599);המים;2;15;ותבא אליו היונה לעת ערב והנה עלה זית טרף בפיה וידע נח כי קלו המים מעל הארץ
(201382, -86, 4);8;ח;9774;(1, 8, 13, 27, 9774);2621;(1, 8, 13, 7, 2621);באחד;3;7;ויהי באחת ושש מאות שנה בראשון באחד לחדש חרבו המים מעל הארץ ויסר נח את מכסה התבה וירא והנה חרבו פני האדמה
(201382, -86, 4);300;ש;9860;(1, 8, 14, 30, 9860);2643;(1, 8, 14, 7, 2643);יבשה;3;7;ובחדש השני בשבעה ועשרים יום לחדש יבשה הארץ
(201382, -86, 4);20;כ;9946;(1, 8, 17, 31, 9946);2667;(1, 8, 17, 9, 2667);ובכל;3;9;כל החיה אשר אתך מכל בשר בעוף ובבהמה ובכל הרמש הרמש על הארץ הוצא אתך ושרצו בארץ ופרו ורבו על הארץ
(201382, -86, 4);20;כ;10032;(1, 8, 19, 14, 10032);2691;(1, 8, 19, 5, 2691);וכל;2;5;כל החיה כל הרמש וכל העוף כל רומש על הארץ למשפחתיהם יצאו מן התבה
(201382, -86, 4);70;ע;10118;(1, 8, 20, 50, 10118);2713;(1, 8, 20, 13, 2713);עלת;1;13;ויבן נח מזבח ליהוה ויקח מכל הבהמה הטהרה ומכל העוף הטהור ויעל עלת במזבח
(201382, -86, 4);6;ו;10204;(1, 8, 21, 79, 10204);2737;(1, 8, 21, 23, 2737);מנעריו;6;23;וירח יהוה את ריח הניחח ויאמר יהוה אל לבו לא אסף לקלל עוד את האדמה בעבור האדם כי יצר לב האדם רע מנעריו ולא אסף עוד להכות את כל חי כאשר עשיתי
(201382, -86, 4);5;ה;10290;(1, 9, 1, 8, 10290);2762;(1, 9, 1, 2, 2762);אלהים;3;2;ויברך אלהים את נח ואת בניו ויאמר להם פרו ורבו ומלאו את הארץ
(201382, -86, 4);400;ת;10376;(1, 9, 2, 47, 10376);2787;(1, 9, 2, 14, 2787);תרמש;1;14;ומוראכם וחתכם יהיה על כל חית הארץ ועל כל עוף השמים בכל אשר תרמש האדמה ובכל דגי הים בידכם נתנו
(201382, -86, 4);400;ת;10462;(1, 9, 4, 16, 10462);2813;(1, 9, 4, 6, 2813);תאכלו;1;6;אך בשר בנפשו דמו לא תאכלו
