(38808, -92, 4);4;ד;233756;(4, 26, 62, 34, 233756);61576;(4, 26, 62, 9, 61576);חדש;2;9;ויהיו פקדיהם שלשה ועשרים אלף כל זכר מבן חדש ומעלה כי לא התפקדו בתוך בני ישראל כי לא נתן להם נחלה בתוך בני ישראל
(38808, -92, 4);30;ל;233848;(4, 26, 63, 38, 233848);61601;(4, 26, 63, 10, 61601);ישראל;5;10;אלה פקודי משה ואלעזר הכהן אשר פקדו את בני ישראל בערבת מואב על ירדן ירחו
(38808, -92, 4);10;י;233940;(4, 26, 65, 16, 233940);61627;(4, 26, 65, 6, 61627);ימתו;1;6;כי אמר יהוה להם מות ימתו במדבר ולא נותר מהם איש כי אם כלב בן יפנה ויהושע בן נון
(38808, -92, 4);50;נ;234032;(4, 27, 1, 47, 234032);61653;(4, 27, 1, 13, 61653);מנשה;2;13;ותקרבנה בנות צלפחד בן חפר בן גלעד בן מכיר בן מנשה למשפחת מנשה בן יוסף ואלה שמות בנתיו מחלה נעה וחגלה ומלכה ותרצה
(38808, -92, 4);8;ח;234124;(4, 27, 2, 49, 234124);61674;(4, 27, 2, 11, 61674);פתח;3;11;ותעמדנה לפני משה ולפני אלעזר הכהן ולפני הנשיאם וכל העדה פתח אהל מועד לאמר
(38808, -92, 4);2;ב;234216;(4, 27, 4, 11, 234216);61701;(4, 27, 4, 4, 61701);אבינו;2;4;למה יגרע שם אבינו מתוך משפחתו כי אין לו בן תנה לנו אחזה בתוך אחי אבינו
(38808, -92, 4);90;צ;234308;(4, 27, 7, 7, 234308);61727;(4, 27, 7, 3, 61727);צלפחד;1;3;כן בנות צלפחד דברת נתן תתן להם אחזת נחלה בתוך אחי אביהם והעברת את נחלת אביהן להן
(38808, -92, 4);30;ל;234400;(4, 27, 8, 35, 234400);61752;(4, 27, 8, 11, 61752);לו;1;11;ואל בני ישראל תדבר לאמר איש כי ימות ובן אין לו והעברתם את נחלתו לבתו
(38808, -92, 4);10;י;234492;(4, 27, 11, 14, 234492);61777;(4, 27, 11, 4, 61777);לאביו;4;4;ואם אין אחים לאביו ונתתם את נחלתו לשארו הקרב אליו ממשפחתו וירש אתה והיתה לבני ישראל לחקת משפט כאשר צוה יהוה את משה
(38808, -92, 4);5;ה;234584;(4, 27, 12, 14, 234584);61800;(4, 27, 12, 4, 61800);משה;3;4;ויאמר יהוה אל משה עלה אל הר העברים הזה וראה את הארץ אשר נתתי לבני ישראל
(38808, -92, 4);400;ת;234676;(4, 27, 14, 8, 234676);61825;(4, 27, 14, 2, 61825);מריתם;4;2;כאשר מריתם פי במדבר צן במריבת העדה להקדישני במים לעיניהם הם מי מריבת קדש מדבר צן
(38808, -92, 4);400;ת;234768;(4, 27, 16, 17, 234768);61848;(4, 27, 16, 4, 61848);הרוחת;5;4;יפקד יהוה אלהי הרוחת לכל בשר איש על העדה
(38808, -92, 4);1;א;234860;(4, 27, 18, 3, 234860);61873;(4, 27, 18, 1, 61873);ויאמר;3;1;ויאמר יהוה אל משה קח לך את יהושע בן נון איש אשר רוח בו וסמכת את ידך עליו
(38808, -92, 4);1;א;234952;(4, 27, 19, 40, 234952);61900;(4, 27, 19, 10, 61900);אתו;1;10;והעמדת אתו לפני אלעזר הכהן ולפני כל העדה וצויתה אתו לעיניהם
(38808, -92, 4);10;י;235044;(4, 27, 21, 47, 235044);61922;(4, 27, 21, 12, 61922);פיו;2;12;ולפני אלעזר הכהן יעמד ושאל לו במשפט האורים לפני יהוה על פיו יצאו ועל פיו יבאו הוא וכל בני ישראל אתו וכל העדה
(38808, -92, 4);6;ו;235136;(4, 27, 22, 53, 235136);61947;(4, 27, 22, 14, 61947);ולפני;1;14;ויעש משה כאשר צוה יהוה אתו ויקח את יהושע ויעמדהו לפני אלעזר הכהן ולפני כל העדה
(38808, -92, 4);2;ב;235228;(4, 28, 2, 26, 235228);61972;(4, 28, 2, 8, 61972);קרבני;3;8;צו את בני ישראל ואמרת אלהם את קרבני לחמי לאשי ריח ניחחי תשמרו להקריב לי במועדו
(38808, -92, 4);5;ה;235320;(4, 28, 3, 55, 235320);61994;(4, 28, 3, 14, 61994);עלה;3;14;ואמרת להם זה האשה אשר תקריבו ליהוה כבשים בני שנה תמימם שנים ליום עלה תמיד
(38808, -92, 4);40;מ;235412;(4, 28, 6, 5, 235412);62017;(4, 28, 6, 2, 62017);תמיד;2;2;עלת תמיד העשיה בהר סיני לריח ניחח אשה ליהוה
(38808, -92, 4);2;ב;235504;(4, 28, 8, 22, 235504);62040;(4, 28, 8, 6, 62040);הערבים;4;6;ואת הכבש השני תעשה בין הערבים כמנחת הבקר וכנסכו תעשה אשה ריח ניחח ליהוה
(38808, -92, 4);50;נ;235596;(4, 28, 9, 56, 235596);62062;(4, 28, 9, 14, 62062);ונסכו;2;14;וביום השבת שני כבשים בני שנה תמימם ושני עשרנים סלת מנחה בלולה בשמן ונסכו
(38808, -92, 4);400;ת;235688;(4, 28, 11, 63, 235688);62085;(4, 28, 11, 16, 62085);תמימם;1;16;ובראשי חדשיכם תקריבו עלה ליהוה פרים בני בקר שנים ואיל אחד כבשים בני שנה שבעה תמימם
(38808, -92, 4);6;ו;235780;(4, 28, 13, 20, 235780);62106;(4, 28, 13, 5, 62106);בלולה;3;5;ועשרן עשרון סלת מנחה בלולה בשמן לכבש האחד עלה ריח ניחח אשה ליהוה
(38808, -92, 4);4;ד;235872;(4, 28, 14, 60, 235872);62129;(4, 28, 14, 15, 62129);חדש;2;15;ונסכיהם חצי ההין יהיה לפר ושלישת ההין לאיל ורביעת ההין לכבש יין זאת עלת חדש בחדשו לחדשי השנה
(38808, -92, 4);6;ו;235964;(4, 28, 17, 1, 235964);62151;(4, 28, 17, 1, 62151);ובחמשה;1;1;ובחמשה עשר יום לחדש הזה חג שבעת ימים מצות יאכל
(38808, -92, 4);40;ם;236056;(4, 28, 19, 22, 236056);62174;(4, 28, 19, 5, 62174);פרים;4;5;והקרבתם אשה עלה ליהוה פרים בני בקר שנים ואיל אחד ושבעה כבשים בני שנה תמימם יהיו לכם
(38808, -92, 4);70;ע;236148;(4, 28, 20, 47, 236148);62197;(4, 28, 20, 11, 62197);תעשו;2;11;ומנחתם סלת בלולה בשמן שלשה עשרנים לפר ושני עשרנים לאיל תעשו
(38808, -92, 4);5;ה;236240;(4, 28, 24, 4, 236240);62219;(4, 28, 24, 1, 62219);כאלה;4;1;כאלה תעשו ליום שבעת ימים לחם אשה ריח ניחח ליהוה על עולת התמיד יעשה ונסכו
(38808, -92, 4);1;א;236332;(4, 28, 25, 38, 236332);62243;(4, 28, 25, 10, 62243);לא;2;10;וביום השביעי מקרא קדש יהיה לכם כל מלאכת עבדה לא תעשו
(38808, -92, 4);50;נ;236424;(4, 28, 27, 16, 236424);62264;(4, 28, 27, 4, 62264);ניחח;1;4;והקרבתם עולה לריח ניחח ליהוה פרים בני בקר שנים איל אחד שבעה כבשים בני שנה
(38808, -92, 4);5;ה;236516;(4, 28, 28, 49, 236516);62287;(4, 28, 28, 12, 62287);האחד;1;12;ומנחתם סלת בלולה בשמן שלשה עשרנים לפר האחד שני עשרנים לאיל האחד
(38808, -92, 4);5;ה;236608;(4, 28, 31, 40, 236608);62307;(4, 28, 31, 9, 62307);ונסכיהם;6;9;מלבד עלת התמיד ומנחתו תעשו תמימם יהיו לכם ונסכיהם
(38808, -92, 4);50;ן;236700;(4, 29, 2, 26, 236700);62331;(4, 29, 2, 7, 62331);בן;2;7;ועשיתם עלה לריח ניחח ליהוה פר בן בקר אחד איל אחד כבשים בני שנה שבעה תמימם
(38808, -92, 4);8;ח;236792;(4, 29, 4, 16, 236792);62354;(4, 29, 4, 4, 62354);האחד;3;4;ועשרון אחד לכבש האחד לשבעת הכבשים
(38808, -92, 4);300;ש;236884;(4, 29, 6, 55, 236884);62374;(4, 29, 6, 12, 62374);אשה;2;12;מלבד עלת החדש ומנחתה ועלת התמיד ומנחתה ונסכיהם כמשפטם לריח ניחח אשה ליהוה
(38808, -92, 4);2;ב;236976;(4, 29, 8, 25, 236976);62397;(4, 29, 8, 7, 62397);בן;1;7;והקרבתם עלה ליהוה ריח ניחח פר בן בקר אחד איל אחד כבשים בני שנה שבעה תמימם יהיו לכם
(38808, -92, 4);6;ו;237068;(4, 29, 10, 4, 237068);62420;(4, 29, 10, 1, 62420);עשרון;4;1;עשרון עשרון לכבש האחד לשבעת הכבשים
(38808, -92, 4);300;ש;237160;(4, 29, 12, 16, 237160);62440;(4, 29, 12, 4, 62440);לחדש;4;4;ובחמשה עשר יום לחדש השביעי מקרא קדש יהיה לכם כל מלאכת עבדה לא תעשו וחגתם חג ליהוה שבעת ימים
(38808, -92, 4);200;ר;237252;(4, 29, 13, 35, 237252);62464;(4, 29, 13, 9, 62464);בקר;3;9;והקרבתם עלה אשה ריח ניחח ליהוה פרים בני בקר שלשה עשר אילם שנים כבשים בני שנה ארבעה עשר תמימם יהיו
(38808, -92, 4);50;נ;237344;(4, 29, 14, 49, 237344);62487;(4, 29, 14, 12, 62487);שני;2;12;ומנחתם סלת בלולה בשמן שלשה עשרנים לפר האחד לשלשה עשר פרים שני עשרנים לאיל האחד לשני האילם
(38808, -92, 4);50;נ;237436;(4, 29, 16, 35, 237436);62508;(4, 29, 16, 9, 62508);ונסכה;2;9;ושעיר עזים אחד חטאת מלבד עלת התמיד מנחתה ונסכה
(38808, -92, 4);2;ב;237528;(4, 29, 18, 31, 237528);62529;(4, 29, 18, 6, 62529);במספרם;1;6;ומנחתם ונסכיהם לפרים לאילם ולכבשים במספרם כמשפט
(38808, -92, 4);5;ה;237620;(4, 29, 20, 41, 237620);62549;(4, 29, 20, 10, 62549);שנה;3;10;וביום השלישי פרים עשתי עשר אילם שנים כבשים בני שנה ארבעה עשר תמימם
(38808, -92, 4);10;י;237712;(4, 29, 23, 3, 237712);62568;(4, 29, 23, 1, 62568);וביום;3;1;וביום הרביעי פרים עשרה אילם שנים כבשים בני שנה ארבעה עשר תמימם
(38808, -92, 4);10;י;237804;(4, 29, 25, 4, 237804);62587;(4, 29, 25, 1, 62587);ושעיר;4;1;ושעיר עזים אחד חטאת מלבד עלת התמיד מנחתה ונסכה
(38808, -92, 4);6;ו;237896;(4, 29, 27, 7, 237896);62609;(4, 29, 27, 2, 62609);ונסכיהם;1;2;ומנחתם ונסכיהם לפרים לאילם ולכבשים במספרם כמשפט
(38808, -92, 4);50;נ;237988;(4, 29, 29, 23, 237988);62628;(4, 29, 29, 6, 62628);שנים;2;6;וביום הששי פרים שמנה אילם שנים כבשים בני שנה ארבעה עשר תמימם
(38808, -92, 4);40;מ;238080;(4, 29, 31, 25, 238080);62648;(4, 29, 31, 7, 62648);מנחתה;1;7;ושעיר חטאת אחד מלבד עלת התמיד מנחתה ונסכיה
(38808, -92, 4);40;מ;238172;(4, 29, 33, 31, 238172);62667;(4, 29, 33, 6, 62667);במספרם;2;6;ומנחתם ונסכהם לפרים לאילם ולכבשים במספרם כמשפטם
(38808, -92, 4);5;ה;238264;(4, 29, 36, 10, 238264);62688;(4, 29, 36, 2, 62688);עלה;3;2;והקרבתם עלה אשה ריח ניחח ליהוה פר אחד איל אחד כבשים בני שנה שבעה תמימם
(38808, -92, 4);400;ת;238356;(4, 29, 38, 9, 238356);62710;(4, 29, 38, 2, 62710);חטאת;4;2;ושעיר חטאת אחד מלבד עלת התמיד ומנחתה ונסכה
(38808, -92, 4);30;ל;238448;(4, 29, 39, 66, 238448);62727;(4, 29, 39, 11, 62727);ולשלמיכם;4;11;אלה תעשו ליהוה במועדיכם לבד מנדריכם ונדבתיכם לעלתיכם ולמנחתיכם ולנסכיכם ולשלמיכם
(38808, -92, 4);20;כ;238540;(4, 30, 3, 4, 238540);62753;(4, 30, 3, 2, 62753);כי;1;2;איש כי ידר נדר ליהוה או השבע שבעה לאסר אסר על נפשו לא יחל דברו ככל היצא מפיו יעשה
(38808, -92, 4);5;ה;238632;(4, 30, 4, 33, 238632);62779;(4, 30, 4, 9, 62779);אביה;4;9;ואשה כי תדר נדר ליהוה ואסרה אסר בבית אביה בנעריה
(38808, -92, 4);1;א;238724;(4, 30, 6, 8, 238724);62805;(4, 30, 6, 3, 62805);אביה;1;3;ואם הניא אביה אתה ביום שמעו כל נדריה ואסריה אשר אסרה על נפשה לא יקום ויהוה יסלח לה כי הניא אביה אתה
(38808, -92, 4);30;ל;238816;(4, 30, 7, 22, 238816);62830;(4, 30, 7, 6, 62830);עליה;2;6;ואם היו תהיה לאיש ונדריה עליה או מבטא שפתיה אשר אסרה על נפשה
(38808, -92, 4);1;א;238908;(4, 30, 9, 11, 238908);62855;(4, 30, 9, 4, 62855);אישה;1;4;ואם ביום שמע אישה יניא אותה והפר את נדרה אשר עליה ואת מבטא שפתיה אשר אסרה על נפשה ויהוה יסלח לה
(38808, -92, 4);80;פ;239000;(4, 30, 10, 28, 239000);62880;(4, 30, 10, 8, 62880);נפשה;2;8;ונדר אלמנה וגרושה כל אשר אסרה על נפשה יקום עליה
(38808, -92, 4);5;ה;239092;(4, 30, 12, 48, 239092);62906;(4, 30, 12, 14, 62906);אסרה;4;14;ושמע אישה והחרש לה לא הניא אתה וקמו כל נדריה וכל אסר אשר אסרה על נפשה יקום
(38808, -92, 4);20;כ;239184;(4, 30, 14, 7, 239184);62932;(4, 30, 14, 3, 62932);וכל;2;3;כל נדר וכל שבעת אסר לענת נפש אישה יקימנו ואישה יפרנו
(38808, -92, 4);30;ל;239276;(4, 30, 15, 57, 239276);62958;(4, 30, 15, 18, 62958);עליה;2;18;ואם החרש יחריש לה אישה מיום אל יום והקים את כל נדריה או את כל אסריה אשר עליה הקים אתם כי החרש לה ביום שמעו
(38808, -92, 4);50;ן;239368;(4, 30, 17, 37, 239368);62985;(4, 30, 17, 11, 62985);בין;3;11;אלה החקים אשר צוה יהוה את משה בין איש לאשתו בין אב לבתו בנעריה בית אביה
(38808, -92, 4);200;ר;239460;(4, 31, 3, 17, 239460);63010;(4, 31, 3, 5, 63010);לאמר;4;5;וידבר משה אל העם לאמר החלצו מאתכם אנשים לצבא ויהיו על מדין לתת נקמת יהוה במדין
(38808, -92, 4);10;י;239552;(4, 31, 5, 11, 239552);63032;(4, 31, 5, 2, 63032);מאלפי;5;2;וימסרו מאלפי ישראל אלף למטה שנים עשר אלף חלוצי צבא
(38808, -92, 4);6;ו;239644;(4, 31, 6, 62, 239644);63056;(4, 31, 6, 16, 63056);וחצצרות;6;16;וישלח אתם משה אלף למטה לצבא אתם ואת פינחס בן אלעזר הכהן לצבא וכלי הקדש וחצצרות התרועה בידו
(38808, -92, 4);1;א;239736;(4, 31, 8, 42, 239736);63082;(4, 31, 8, 13, 63082);ואת;2;13;ואת מלכי מדין הרגו על חלליהם את אוי ואת רקם ואת צור ואת חור ואת רבע חמשת מלכי מדין ואת בלעם בן בעור הרגו בחרב
(38808, -92, 4);6;ו;239828;(4, 31, 9, 49, 239828);63109;(4, 31, 9, 15, 63109);ואת;1;15;וישבו בני ישראל את נשי מדין ואת טפם ואת כל בהמתם ואת כל מקנהם ואת כל חילם בזזו
(38808, -92, 4);1;א;239920;(4, 31, 12, 12, 239920);63134;(4, 31, 12, 4, 63134);ואל;2;4;ויבאו אל משה ואל אלעזר הכהן ואל עדת בני ישראל את השבי ואת המלקוח ואת השלל אל המחנה אל ערבת מואב אשר על ירדן ירחו
(38808, -92, 4);20;כ;240012;(4, 31, 13, 16, 240012);63159;(4, 31, 13, 4, 63159);הכהן;2;4;ויצאו משה ואלעזר הכהן וכל נשיאי העדה לקראתם אל מחוץ למחנה
(38808, -92, 4);5;ה;240104;(4, 31, 15, 9, 240104);63180;(4, 31, 15, 2, 63180);אליהם;4;2;ויאמר אליהם משה החייתם כל נקבה
(38808, -92, 4);200;ר;240196;(4, 31, 17, 13, 240196);63205;(4, 31, 17, 4, 63205);זכר;3;4;ועתה הרגו כל זכר בטף וכל אשה ידעת איש למשכב זכר הרגו
(38808, -92, 4);50;נ;240288;(4, 31, 19, 30, 240288);63232;(4, 31, 19, 9, 63232);נפש;1;9;ואתם חנו מחוץ למחנה שבעת ימים כל הרג נפש וכל נגע בחלל תתחטאו ביום השלישי וביום השביעי אתם ושביכם
(38808, -92, 4);40;מ;240380;(4, 31, 21, 4, 240380);63255;(4, 31, 21, 1, 63255);ויאמר;4;1;ויאמר אלעזר הכהן אל אנשי הצבא הבאים למלחמה זאת חקת התורה אשר צוה יהוה את משה
(38808, -92, 4);10;י;240472;(4, 31, 22, 35, 240472);63281;(4, 31, 22, 11, 63281);הבדיל;4;11;אך את הזהב ואת הכסף את הנחשת את הברזל את הבדיל ואת העפרת
(38808, -92, 4);2;ב;240564;(4, 31, 24, 19, 240564);63306;(4, 31, 24, 4, 63306);השביעי;3;4;וכבסתם בגדיכם ביום השביעי וטהרתם ואחר תבאו אל המחנה
(38808, -92, 4);70;ע;240656;(4, 31, 26, 50, 240656);63329;(4, 31, 26, 13, 63329);העדה;2;13;שא את ראש מלקוח השבי באדם ובבהמה אתה ואלעזר הכהן וראשי אבות העדה
(38808, -92, 4);8;ח;240748;(4, 31, 28, 44, 240748);63351;(4, 31, 28, 11, 63351);מחמש;2;11;והרמת מכס ליהוה מאת אנשי המלחמה היצאים לצבא אחד נפש מחמש המאות מן האדם ומן הבקר ומן החמרים ומן הצאן
(38808, -92, 4);1;א;240840;(4, 31, 30, 21, 240840);63373;(4, 31, 30, 6, 63373);אחז;1;6;וממחצת בני ישראל תקח אחד אחז מן החמשים מן האדם מן הבקר מן החמרים ומן הצאן מכל הבהמה ונתתה אתם ללוים שמרי משמרת משכן יהוה
(38808, -92, 4);50;ן;240932;(4, 31, 31, 17, 240932);63396;(4, 31, 31, 4, 63396);הכהן;4;4;ויעש משה ואלעזר הכהן כאשר צוה יהוה את משה
(38808, -92, 4);30;ל;241024;(4, 31, 33, 16, 241024);63421;(4, 31, 33, 4, 63421);אלף;2;4;ובקר שנים ושבעים אלף
(38808, -92, 4);200;ר;241116;(4, 31, 36, 26, 241116);63445;(4, 31, 36, 6, 63445);מספר;4;6;ותהי המחצה חלק היצאים בצבא מספר הצאן שלש מאות אלף ושלשים אלף ושבעת אלפים וחמש מאות
(38808, -92, 4);80;ף;241208;(4, 31, 38, 17, 241208);63468;(4, 31, 38, 4, 63468);אלף;3;4;והבקר ששה ושלשים אלף ומכסם ליהוה שנים ושבעים
(38808, -92, 4);300;ש;241300;(4, 31, 40, 32, 241300);63490;(4, 31, 40, 9, 63490);ושלשים;2;9;ונפש אדם ששה עשר אלף ומכסם ליהוה שנים ושלשים נפש
(38808, -92, 4);40;ם;241392;(4, 31, 42, 38, 241392);63513;(4, 31, 42, 9, 63513);הצבאים;6;9;וממחצית בני ישראל אשר חצה משה מן האנשים הצבאים
(38808, -92, 4);400;ת;241484;(4, 31, 45, 22, 241484);63536;(4, 31, 45, 5, 63536);מאות;4;5;וחמרים שלשים אלף וחמש מאות
(38808, -92, 4);50;ן;241576;(4, 31, 47, 76, 241576);63561;(4, 31, 47, 20, 63561);משכן;4;20;ויקח משה ממחצת בני ישראל את האחז אחד מן החמשים מן האדם ומן הבהמה ויתן אתם ללוים שמרי משמרת משכן יהוה כאשר צוה יהוה את משה
(38808, -92, 4);300;ש;241668;(4, 31, 49, 25, 241668);63585;(4, 31, 49, 7, 63585);ראש;3;7;ויאמרו אל משה עבדיך נשאו את ראש אנשי המלחמה אשר בידנו ולא נפקד ממנו איש
(38808, -92, 4);50;נ;241760;(4, 31, 50, 60, 241760);63610;(4, 31, 50, 17, 63610);נפשתינו;1;17;ונקרב את קרבן יהוה איש אשר מצא כלי זהב אצעדה וצמיד טבעת עגיל וכומז לכפר על נפשתינו לפני יהוה
(38808, -92, 4);1;א;241852;(4, 31, 52, 42, 241852);63634;(4, 31, 52, 12, 63634);מאות;2;12;ויהי כל זהב התרומה אשר הרימו ליהוה ששה עשר אלף שבע מאות וחמשים שקל מאת שרי האלפים ומאת שרי המאות
(38808, -92, 4);6;ו;241944;(4, 31, 54, 40, 241944);63657;(4, 31, 54, 10, 63657);והמאות;5;10;ויקח משה ואלעזר הכהן את הזהב מאת שרי האלפים והמאות ויבאו אתו אל אהל מועד זכרון לבני ישראל לפני יהוה
(38808, -92, 4);200;ר;242036;(4, 32, 1, 52, 242036);63682;(4, 32, 1, 15, 63682);ארץ;2;15;ומקנה רב היה לבני ראובן ולבני גד עצום מאד ויראו את ארץ יעזר ואת ארץ גלעד והנה המקום מקום מקנה
(38808, -92, 4);10;י;242128;(4, 32, 3, 12, 242128);63705;(4, 32, 3, 3, 63705);ויעזר;2;3;עטרות ודיבן ויעזר ונמרה וחשבון ואלעלה ושבם ונבו ובען
(38808, -92, 4);6;ו;242220;(4, 32, 5, 13, 242220);63726;(4, 32, 5, 3, 63726);מצאנו;5;3;ויאמרו אם מצאנו חן בעיניך יתן את הארץ הזאת לעבדיך לאחזה אל תעברנו את הירדן
(38808, -92, 4);400;ת;242312;(4, 32, 6, 45, 242312);63749;(4, 32, 6, 11, 63749);תשבו;1;11;ויאמר משה לבני גד ולבני ראובן האחיכם יבאו למלחמה ואתם תשבו פה
(38808, -92, 4);30;ל;242404;(4, 32, 9, 4, 242404);63774;(4, 32, 9, 1, 63774);ויעלו;4;1;ויעלו עד נחל אשכול ויראו את הארץ ויניאו את לב בני ישראל לבלתי בא אל הארץ אשר נתן להם יהוה
(38808, -92, 4);40;מ;242496;(4, 32, 10, 26, 242496);63800;(4, 32, 10, 7, 63800);לאמר;3;7;ויחר אף יהוה ביום ההוא וישבע לאמר
(38808, -92, 4);2;ב;242588;(4, 32, 12, 7, 242588);63822;(4, 32, 12, 2, 63822);כלב;3;2;בלתי כלב בן יפנה הקנזי ויהושע בן נון כי מלאו אחרי יהוה
(38808, -92, 4);50;נ;242680;(4, 32, 13, 56, 242680);63847;(4, 32, 13, 15, 63847);בעיני;4;15;ויחר אף יהוה בישראל וינעם במדבר ארבעים שנה עד תם כל הדור העשה הרע בעיני יהוה
(38808, -92, 4);40;מ;242772;(4, 32, 15, 28, 242772);63870;(4, 32, 15, 7, 63870);במדבר;2;7;כי תשובן מאחריו ויסף עוד להניחו במדבר ושחתם לכל העם הזה
(38808, -92, 4);200;ר;242864;(4, 32, 17, 31, 242864);63892;(4, 32, 17, 8, 63892);אשר;3;8;ואנחנו נחלץ חשים לפני בני ישראל עד אשר אם הביאנם אל מקומם וישב טפנו בערי המבצר מפני ישבי הארץ
(38808, -92, 4);40;מ;242956;(4, 32, 19, 12, 242956);63918;(4, 32, 19, 5, 63918);מעבר;1;5;כי לא ננחל אתם מעבר לירדן והלאה כי באה נחלתנו אלינו מעבר הירדן מזרחה
(38808, -92, 4);40;מ;243048;(4, 32, 20, 49, 243048);63940;(4, 32, 20, 13, 63940);למלחמה;5;13;ויאמר אליהם משה אם תעשון את הדבר הזה אם תחלצו לפני יהוה למלחמה
(38808, -92, 4);40;מ;243140;(4, 32, 22, 43, 243140);63963;(4, 32, 22, 10, 63963);ומישראל;2;10;ונכבשה הארץ לפני יהוה ואחר תשבו והייתם נקים מיהוה ומישראל והיתה הארץ הזאת לכם לאחזה לפני יהוה
(38808, -92, 4);9;ט;243232;(4, 32, 24, 12, 243232);63986;(4, 32, 24, 4, 63986);לטפכם;2;4;בנו לכם ערים לטפכם וגדרת לצנאכם והיצא מפיכם תעשו
(38808, -92, 4);6;ו;243324;(4, 32, 26, 15, 243324);64008;(4, 32, 26, 4, 64008);וכל;1;4;טפנו נשינו מקננו וכל בהמתנו יהיו שם בערי הגלעד
(38808, -92, 4);400;ת;243416;(4, 32, 28, 24, 243416);64031;(4, 32, 28, 7, 64031);ואת;3;7;ויצו להם משה את אלעזר הכהן ואת יהושע בן נון ואת ראשי אבות המטות לבני ישראל
(38808, -92, 4);30;ל;243508;(4, 32, 29, 57, 243508);64056;(4, 32, 29, 16, 64056);לפני;1;16;ויאמר משה אלהם אם יעברו בני גד ובני ראובן אתכם את הירדן כל חלוץ למלחמה לפני יהוה ונכבשה הארץ לפניכם ונתתם להם את ארץ הגלעד לאחזה
(38808, -92, 4);50;נ;243600;(4, 32, 31, 7, 243600);64077;(4, 32, 31, 2, 64077);בני;2;2;ויענו בני גד ובני ראובן לאמר את אשר דבר יהוה אל עבדיך כן נעשה
(38808, -92, 4);200;ר;243692;(4, 32, 32, 51, 243692);64101;(4, 32, 32, 12, 64101);לירדן;3;12;נחנו נעבר חלוצים לפני יהוה ארץ כנען ואתנו אחזת נחלתנו מעבר לירדן
(38808, -92, 4);5;ה;243784;(4, 32, 33, 90, 243784);64125;(4, 32, 33, 24, 64125);לעריה;5;24;ויתן להם משה לבני גד ולבני ראובן ולחצי שבט מנשה בן יוסף את ממלכת סיחן מלך האמרי ואת ממלכת עוג מלך הבשן הארץ לעריה בגבלת ערי הארץ סביב
(38808, -92, 4);10;י;243876;(4, 32, 36, 22, 243876);64151;(4, 32, 36, 7, 64151);ערי;3;7;ואת בית נמרה ואת בית הרן ערי מבצר וגדרת צאן
(38808, -92, 4);40;מ;243968;(4, 32, 38, 44, 243968);64176;(4, 32, 38, 13, 64176);שמות;2;13;ואת נבו ואת בעל מעון מוסבת שם ואת שבמה ויקראו בשמת את שמות הערים אשר בנו
(38808, -92, 4);10;י;244060;(4, 32, 41, 2, 244060);64201;(4, 32, 41, 1, 64201);ויאיר;2;1;ויאיר בן מנשה הלך וילכד את חותיהם ויקרא אתהן חות יאיר
(38808, -92, 4);300;ש;244152;(4, 33, 1, 12, 244152);64226;(4, 33, 1, 4, 64226);ישראל;2;4;אלה מסעי בני ישראל אשר יצאו מארץ מצרים לצבאתם ביד משה ואהרן
(38808, -92, 4);40;מ;244244;(4, 33, 3, 6, 244244);64247;(4, 33, 3, 2, 64247);מרעמסס;1;2;ויסעו מרעמסס בחדש הראשון בחמשה עשר יום לחדש הראשון ממחרת הפסח יצאו בני ישראל ביד רמה לעיני כל מצרים
(38808, -92, 4);200;ר;244336;(4, 33, 4, 17, 244336);64268;(4, 33, 4, 4, 64268);אשר;3;4;ומצרים מקברים את אשר הכה יהוה בהם כל בכור ובאלהיהם עשה יהוה שפטים
(38808, -92, 4);4;ד;244428;(4, 33, 6, 28, 244428);64290;(4, 33, 6, 7, 64290);המדבר;3;7;ויסעו מסכת ויחנו באתם אשר בקצה המדבר
