(45349, 61, 4);200;ר;225970;(4, 22, 13, 32, 225970);59591;(4, 22, 13, 10, 59591);ארצכם;2;10;ויקם בלעם בבקר ויאמר אל שרי בלק לכו אל ארצכם כי מאן יהוה לתתי להלך עמכם
(45349, 61, 4);5;ה;226031;(4, 22, 14, 37, 226031);59607;(4, 22, 14, 10, 59607);הלך;1;10;ויקומו שרי מואב ויבאו אל בלק ויאמרו מאן בלעם הלך עמנו
(45349, 61, 4);40;מ;226092;(4, 22, 16, 23, 226092);59623;(4, 22, 16, 7, 59623);אמר;2;7;ויבאו אל בלעם ויאמרו לו כה אמר בלק בן צפור אל נא תמנע מהלך אלי
(45349, 61, 4);1;א;226153;(4, 22, 17, 36, 226153);59642;(4, 22, 17, 11, 59642);נא;2;11;כי כבד אכבדך מאד וכל אשר תאמר אלי אעשה ולכה נא קבה לי את העם הזה
(45349, 61, 4);1;א;226214;(4, 22, 18, 48, 226214);59662;(4, 22, 18, 15, 59662);לא;2;15;ויען בלעם ויאמר אל עבדי בלק אם יתן לי בלק מלא ביתו כסף וזהב לא אוכל לעבר את פי יהוה אלהי לעשות קטנה או גדולה
(45349, 61, 4);4;ד;226275;(4, 22, 19, 25, 226275);59680;(4, 22, 19, 8, 59680);ואדעה;3;8;ועתה שבו נא בזה גם אתם הלילה ואדעה מה יסף יהוה דבר עמי
(45349, 61, 4);100;ק;226336;(4, 22, 20, 44, 226336);59698;(4, 22, 20, 13, 59698);קום;1;13;ויבא אלהים אל בלעם לילה ויאמר לו אם לקרא לך באו האנשים קום לך אתם ואך את הדבר אשר אדבר אליך אתו תעשה
(45349, 61, 4);20;ך;226397;(4, 22, 21, 27, 226397);59715;(4, 22, 21, 7, 59715);וילך;4;7;ויקם בלעם בבקר ויחבש את אתנו וילך עם שרי מואב
(45349, 61, 4);70;ע;226458;(4, 22, 22, 52, 226458);59733;(4, 22, 22, 15, 59733);על;1;15;ויחר אף אלהים כי הולך הוא ויתיצב מלאך יהוה בדרך לשטן לו והוא רכב על אתנו ושני נעריו עמו
(45349, 61, 4);5;ה;226519;(4, 22, 23, 44, 226519);59749;(4, 22, 23, 12, 59749);האתון;1;12;ותרא האתון את מלאך יהוה נצב בדרך וחרבו שלופה בידו ותט האתון מן הדרך ותלך בשדה ויך בלעם את האתון להטתה הדרך
(45349, 61, 4);5;ה;226580;(4, 22, 24, 20, 226580);59764;(4, 22, 24, 5, 59764);הכרמים;1;5;ויעמד מלאך יהוה במשעול הכרמים גדר מזה וגדר מזה
(45349, 61, 4);70;ע;226641;(4, 22, 25, 43, 226641);59780;(4, 22, 25, 12, 59780);בלעם;3;12;ותרא האתון את מלאך יהוה ותלחץ אל הקיר ותלחץ את רגל בלעם אל הקיר ויסף להכתה
(45349, 61, 4);40;מ;226702;(4, 22, 26, 45, 226702);59796;(4, 22, 26, 12, 59796);ימין;2;12;ויוסף מלאך יהוה עבור ויעמד במקום צר אשר אין דרך לנטות ימין ושמאול
(45349, 61, 4);40;מ;226763;(4, 22, 27, 53, 226763);59812;(4, 22, 27, 15, 59812);במקל;2;15;ותרא האתון את מלאך יהוה ותרבץ תחת בלעם ויחר אף בלעם ויך את האתון במקל
(45349, 61, 4);40;מ;226824;(4, 22, 29, 4, 226824);59828;(4, 22, 29, 1, 59828);ויאמר;4;1;ויאמר בלעם לאתון כי התעללת בי לו יש חרב בידי כי עתה הרגתיך
(45349, 61, 4);6;ו;226885;(4, 22, 30, 19, 226885);59845;(4, 22, 30, 5, 59845);הלוא;3;5;ותאמר האתון אל בלעם הלוא אנכי אתנך אשר רכבת עלי מעודך עד היום הזה ההסכן הסכנתי לעשות לך כה ויאמר לא
(45349, 61, 4);6;ו;226946;(4, 22, 31, 1, 226946);59862;(4, 22, 31, 1, 59862);ויגל;1;1;ויגל יהוה את עיני בלעם וירא את מלאך יהוה נצב בדרך וחרבו שלפה בידו ויקד וישתחו לאפיו
(45349, 61, 4);6;ו;227007;(4, 22, 31, 62, 227007);59877;(4, 22, 31, 16, 59877);וישתחו;6;16;ויגל יהוה את עיני בלעם וירא את מלאך יהוה נצב בדרך וחרבו שלפה בידו ויקד וישתחו לאפיו
(45349, 61, 4);300;ש;227068;(4, 22, 32, 56, 227068);59894;(4, 22, 32, 16, 59894);לשטן;2;16;ויאמר אליו מלאך יהוה על מה הכית את אתנך זה שלוש רגלים הנה אנכי יצאתי לשטן כי ירט הדרך לנגדי
(45349, 61, 4);5;ה;227129;(4, 22, 33, 45, 227129);59910;(4, 22, 33, 12, 59910);עתה;3;12;ותראני האתון ותט לפני זה שלש רגלים אולי נטתה מפני כי עתה גם אתכה הרגתי ואותה החייתי
(45349, 61, 4);50;נ;227190;(4, 22, 34, 39, 227190);59927;(4, 22, 34, 12, 59927);נצב;1;12;ויאמר בלעם אל מלאך יהוה חטאתי כי לא ידעתי כי אתה נצב לקראתי בדרך ועתה אם רע בעיניך אשובה לי
(45349, 61, 4);10;י;227251;(4, 22, 35, 28, 227251);59943;(4, 22, 35, 8, 59943);האנשים;5;8;ויאמר מלאך יהוה אל בלעם לך עם האנשים ואפס את הדבר אשר אדבר אליך אתו תדבר וילך בלעם עם שרי בלק
(45349, 61, 4);40;ם;227312;(4, 22, 36, 16, 227312);59961;(4, 22, 36, 5, 59961);בלעם;4;5;וישמע בלק כי בא בלעם ויצא לקראתו אל עיר מואב אשר על גבול ארנן אשר בקצה הגבול
(45349, 61, 4);1;א;227373;(4, 22, 37, 17, 227373);59978;(4, 22, 37, 5, 59978);הלא;3;5;ויאמר בלק אל בלעם הלא שלח שלחתי אליך לקרא לך למה לא הלכת אלי האמנם לא אוכל כבדך
(45349, 61, 4);50;נ;227434;(4, 22, 38, 16, 227434);59996;(4, 22, 38, 5, 59996);הנה;2;5;ויאמר בלעם אל בלק הנה באתי אליך עתה היכל אוכל דבר מאומה הדבר אשר ישים אלהים בפי אתו אדבר
(45349, 61, 4);70;ע;227495;(4, 22, 39, 7, 227495);60012;(4, 22, 39, 2, 60012);בלעם;3;2;וילך בלעם עם בלק ויבאו קרית חצות
(45349, 61, 4);2;ב;227556;(4, 22, 41, 5, 227556);60028;(4, 22, 41, 2, 60028);בבקר;1;2;ויהי בבקר ויקח בלק את בלעם ויעלהו במות בעל וירא משם קצה העם
(45349, 61, 4);10;י;227617;(4, 23, 1, 19, 227617);60045;(4, 23, 1, 6, 60045);לי;2;6;ויאמר בלעם אל בלק בנה לי בזה שבעה מזבחת והכן לי בזה שבעה פרים ושבעה אילים
(45349, 61, 4);30;ל;227678;(4, 23, 2, 22, 227678);60061;(4, 23, 2, 6, 60061);ויעל;4;6;ויעש בלק כאשר דבר בלעם ויעל בלק ובלעם פר ואיל במזבח
(45349, 61, 4);30;ל;227739;(4, 23, 3, 42, 227739);60077;(4, 23, 3, 11, 60077);לקראתי;1;11;ויאמר בלעם לבלק התיצב על עלתך ואלכה אולי יקרה יהוה לקראתי ודבר מה יראני והגדתי לך וילך שפי
(45349, 61, 4);400;ת;227800;(4, 23, 4, 30, 227800);60092;(4, 23, 4, 8, 60092);שבעת;4;8;ויקר אלהים אל בלעם ויאמר אליו את שבעת המזבחת ערכתי ואעל פר ואיל במזבח
(45349, 61, 4);400;ת;227861;(4, 23, 5, 35, 227861);60109;(4, 23, 5, 11, 60109);תדבר;1;11;וישם יהוה דבר בפי בלעם ויאמר שוב אל בלק וכה תדבר
(45349, 61, 4);2;ב;227922;(4, 23, 7, 24, 227922);60126;(4, 23, 7, 7, 60126);בלק;1;7;וישא משלו ויאמר מן ארם ינחני בלק מלך מואב מהררי קדם לכה ארה לי יעקב ולכה זעמה ישראל
(45349, 61, 4);40;ם;227983;(4, 23, 8, 19, 227983);60144;(4, 23, 8, 7, 60144);אזעם;4;7;מה אקב לא קבה אל ומה אזעם לא זעם יהוה
(45349, 61, 4);300;ש;228044;(4, 23, 9, 52, 228044);60160;(4, 23, 9, 13, 60160);יתחשב;4;13;כי מראש צרים אראנו ומגבעות אשורנו הן עם לבדד ישכן ובגוים לא יתחשב
(45349, 61, 4);40;מ;228105;(4, 23, 11, 4, 228105);60176;(4, 23, 11, 1, 60176);ויאמר;4;1;ויאמר בלק אל בלעם מה עשית לי לקב איבי לקחתיך והנה ברכת ברך
(45349, 61, 4);300;ש;228166;(4, 23, 12, 19, 228166);60194;(4, 23, 12, 6, 60194);ישים;2;6;ויען ויאמר הלא את אשר ישים יהוה בפי אתו אשמר לדבר
(45349, 61, 4);80;פ;228227;(4, 23, 13, 41, 228227);60212;(4, 23, 13, 13, 60212);אפס;2;13;ויאמר אליו בלק לך נא אתי אל מקום אחר אשר תראנו משם אפס קצהו תראה וכלו לא תראה וקבנו לי משם
(45349, 61, 4);40;מ;228288;(4, 23, 14, 32, 228288);60229;(4, 23, 14, 9, 60229);מזבחת;1;9;ויקחהו שדה צפים אל ראש הפסגה ויבן שבעה מזבחת ויעל פר ואיל במזבח
(45349, 61, 4);5;ה;228349;(4, 23, 16, 8, 228349);60245;(4, 23, 16, 2, 60245);יהוה;4;2;ויקר יהוה אל בלעם וישם דבר בפיו ויאמר שוב אל בלק וכה תדבר
(45349, 61, 4);200;ר;228410;(4, 23, 17, 24, 228410);60263;(4, 23, 17, 7, 60263);ושרי;3;7;ויבא אליו והנו נצב על עלתו ושרי מואב אתו ויאמר לו בלק מה דבר יהוה
(45349, 61, 4);50;נ;228471;(4, 23, 18, 34, 228471);60280;(4, 23, 18, 9, 60280);בנו;2;9;וישא משלו ויאמר קום בלק ושמע האזינה עדי בנו צפר
(45349, 61, 4);20;ך;228532;(4, 23, 20, 6, 228532);60297;(4, 23, 20, 2, 60297);ברך;3;2;הנה ברך לקחתי וברך ולא אשיבנה
(45349, 61, 4);400;ת;228593;(4, 23, 21, 43, 228593);60313;(4, 23, 21, 12, 60313);ותרועת;2;12;לא הביט און ביעקב ולא ראה עמל בישראל יהוה אלהיו עמו ותרועת מלך בו
(45349, 61, 4);400;ת;228654;(4, 23, 23, 27, 228654);60329;(4, 23, 23, 8, 60329);כעת;3;8;כי לא נחש ביעקב ולא קסם בישראל כעת יאמר ליעקב ולישראל מה פעל אל
(45349, 61, 4);80;ף;228715;(4, 23, 24, 38, 228715);60346;(4, 23, 24, 11, 60346);טרף;3;11;הן עם כלביא יקום וכארי יתנשא לא ישכב עד יאכל טרף ודם חללים ישתה
(45349, 61, 4);1;א;228776;(4, 23, 26, 11, 228776);60364;(4, 23, 26, 3, 60364);ויאמר;3;3;ויען בלעם ויאמר אל בלק הלא דברתי אליך לאמר כל אשר ידבר יהוה אתו אעשה
(45349, 61, 4);50;נ;228837;(4, 23, 27, 18, 228837);60382;(4, 23, 27, 6, 60382);נא;1;6;ויאמר בלק אל בלעם לכה נא אקחך אל מקום אחר אולי יישר בעיני האלהים וקבתו לי משם
(45349, 61, 4);80;פ;228898;(4, 23, 28, 18, 228898);60399;(4, 23, 28, 6, 60399);הפעור;2;6;ויקח בלק את בלעם ראש הפעור הנשקף על פני הישימן
(45349, 61, 4);2;ב;228959;(4, 23, 29, 42, 228959);60416;(4, 23, 29, 13, 60416);שבעה;2;13;ויאמר בלעם אל בלק בנה לי בזה שבעה מזבחת והכן לי בזה שבעה פרים ושבעה אילם
(45349, 61, 4);2;ב;229020;(4, 24, 1, 13, 229020);60432;(4, 24, 1, 4, 60432);טוב;3;4;וירא בלעם כי טוב בעיני יהוה לברך את ישראל ולא הלך כפעם בפעם לקראת נחשים וישת אל המדבר פניו
(45349, 61, 4);10;י;229081;(4, 24, 2, 2, 229081);60448;(4, 24, 2, 1, 60448);וישא;2;1;וישא בלעם את עיניו וירא את ישראל שכן לשבטיו ותהי עליו רוח אלהים
(45349, 61, 4);40;מ;229142;(4, 24, 3, 12, 229142);60463;(4, 24, 3, 3, 60463);ויאמר;4;3;וישא משלו ויאמר נאם בלעם בנו בער ונאם הגבר שתם העין
(45349, 61, 4);30;ל;229203;(4, 24, 4, 32, 229203);60481;(4, 24, 4, 10, 60481);וגלוי;3;10;נאם שמע אמרי אל אשר מחזה שדי יחזה נפל וגלוי עינים
(45349, 61, 4);9;ט;229264;(4, 24, 6, 28, 229264);60495;(4, 24, 6, 7, 60495);נטע;2;7;כנחלים נטיו כגנת עלי נהר כאהלים נטע יהוה כארזים עלי מים
(45349, 61, 4);20;כ;229325;(4, 24, 7, 44, 229325);60510;(4, 24, 7, 11, 60510);מלכתו;3;11;יזל מים מדליו וזרעו במים רבים וירם מאגג מלכו ותנשא מלכתו
(45349, 61, 4);20;כ;229386;(4, 24, 9, 1, 229386);60524;(4, 24, 9, 1, 60524);כרע;1;1;כרע שכב כארי וכלביא מי יקימנו מברכיך ברוך וארריך ארור
(45349, 61, 4);60;ס;229447;(4, 24, 10, 18, 229447);60539;(4, 24, 10, 6, 60539);ויספק;3;6;ויחר אף בלק אל בלעם ויספק את כפיו ויאמר בלק אל בלעם לקב איבי קראתיך והנה ברכת ברך זה שלש פעמים
(45349, 61, 4);2;ב;229508;(4, 24, 11, 5, 229508);60556;(4, 24, 11, 2, 60556);ברח;1;2;ועתה ברח לך אל מקומך אמרתי כבד אכבדך והנה מנעך יהוה מכבוד
(45349, 61, 4);1;א;229569;(4, 24, 12, 20, 229569);60573;(4, 24, 12, 7, 60573);אל;1;7;ויאמר בלעם אל בלק הלא גם אל מלאכיך אשר שלחת אלי דברתי לאמר
(45349, 61, 4);1;א;229630;(4, 24, 13, 35, 229630);60591;(4, 24, 13, 12, 60591);את;1;12;אם יתן לי בלק מלא ביתו כסף וזהב לא אוכל לעבר את פי יהוה לעשות טובה או רעה מלבי אשר ידבר יהוה אתו אדבר
(45349, 61, 4);20;כ;229691;(4, 24, 14, 18, 229691);60608;(4, 24, 14, 5, 60608);לכה;2;5;ועתה הנני הולך לעמי לכה איעצך אשר יעשה העם הזה לעמך באחרית הימים
(45349, 61, 4);6;ו;229752;(4, 24, 15, 27, 229752);60624;(4, 24, 15, 8, 60624);ונאם;1;8;וישא משלו ויאמר נאם בלעם בנו בער ונאם הגבר שתם העין
(45349, 61, 4);10;י;229813;(4, 24, 16, 47, 229813);60640;(4, 24, 16, 13, 60640);עינים;4;13;נאם שמע אמרי אל וידע דעת עליון מחזה שדי יחזה נפל וגלוי עינים
(45349, 61, 4);2;ב;229874;(4, 24, 17, 60, 229874);60655;(4, 24, 17, 15, 60655);מואב;4;15;אראנו ולא עתה אשורנו ולא קרוב דרך כוכב מיעקב וקם שבט מישראל ומחץ פאתי מואב וקרקר כל בני שת
(45349, 61, 4);100;ק;229935;(4, 24, 19, 8, 229935);60671;(4, 24, 19, 2, 60671);מיעקב;4;2;וירד מיעקב והאביד שריד מעיר
(45349, 61, 4);10;י;229996;(4, 24, 20, 46, 229996);60685;(4, 24, 20, 11, 60685);עדי;3;11;וירא את עמלק וישא משלו ויאמר ראשית גוים עמלק ואחריתו עדי אבד
(45349, 61, 4);10;י;230057;(4, 24, 22, 14, 230057);60702;(4, 24, 22, 5, 60702);קין;2;5;כי אם יהיה לבער קין עד מה אשור תשבך
(45349, 61, 4);6;ו;230118;(4, 24, 24, 20, 230118);60720;(4, 24, 24, 6, 60720);וענו;1;6;וצים מיד כתים וענו אשור וענו עבר וגם הוא עדי אבד
(45349, 61, 4);1;א;230179;(4, 25, 1, 8, 230179);60736;(4, 25, 1, 2, 60736);ישראל;4;2;וישב ישראל בשטים ויחל העם לזנות אל בנות מואב
(45349, 61, 4);8;ח;230240;(4, 25, 2, 33, 230240);60750;(4, 25, 2, 7, 60750);וישתחוו;5;7;ותקראן לעם לזבחי אלהיהן ויאכל העם וישתחוו לאלהיהן
(45349, 61, 4);400;ת;230301;(4, 25, 4, 18, 230301);60765;(4, 25, 4, 6, 60765);את;2;6;ויאמר יהוה אל משה קח את כל ראשי העם והוקע אותם ליהוה נגד השמש וישב חרון אף יהוה מישראל
(45349, 61, 4);300;ש;230362;(4, 25, 5, 11, 230362);60782;(4, 25, 5, 4, 60782);שפטי;1;4;ויאמר משה אל שפטי ישראל הרגו איש אנשיו הנצמדים לבעל פעור
(45349, 61, 4);1;א;230423;(4, 25, 6, 26, 230423);60797;(4, 25, 6, 8, 60797);אחיו;1;8;והנה איש מבני ישראל בא ויקרב אל אחיו את המדינית לעיני משה ולעיני כל עדת בני ישראל והמה בכים פתח אהל מועד
(45349, 61, 4);1;א;230484;(4, 25, 7, 4, 230484);60812;(4, 25, 7, 1, 60812);וירא;4;1;וירא פינחס בן אלעזר בן אהרן הכהן ויקם מתוך העדה ויקח רמח בידו
(45349, 61, 4);1;א;230545;(4, 25, 8, 16, 230545);60829;(4, 25, 8, 5, 60829);אל;1;5;ויבא אחר איש ישראל אל הקבה וידקר את שניהם את איש ישראל ואת האשה אל קבתה ותעצר המגפה מעל בני ישראל
(45349, 61, 4);30;ל;230606;(4, 25, 8, 77, 230606);60845;(4, 25, 8, 21, 60845);ישראל;5;21;ויבא אחר איש ישראל אל הקבה וידקר את שניהם את איש ישראל ואת האשה אל קבתה ותעצר המגפה מעל בני ישראל
(45349, 61, 4);50;ן;230667;(4, 25, 11, 14, 230667);60860;(4, 25, 11, 4, 60860);בן;2;4;פינחס בן אלעזר בן אהרן הכהן השיב את חמתי מעל בני ישראל בקנאו את קנאתי בתוכם ולא כליתי את בני ישראל בקנאתי
(45349, 61, 4);300;ש;230728;(4, 25, 11, 75, 230728);60877;(4, 25, 11, 21, 60877);ישראל;2;21;פינחס בן אלעזר בן אהרן הכהן השיב את חמתי מעל בני ישראל בקנאו את קנאתי בתוכם ולא כליתי את בני ישראל בקנאתי
(45349, 61, 4);400;ת;230789;(4, 25, 13, 26, 230789);60892;(4, 25, 13, 6, 60892);כהנת;4;6;והיתה לו ולזרעו אחריו ברית כהנת עולם תחת אשר קנא לאלהיו ויכפר על בני ישראל
(45349, 61, 4);10;י;230850;(4, 25, 14, 27, 230850);60909;(4, 25, 14, 8, 60909);המדינית;4;8;ושם איש ישראל המכה אשר הכה את המדינית זמרי בן סלוא נשיא בית אב לשמעני
(45349, 61, 4);6;ו;230911;(4, 25, 15, 33, 230911);60925;(4, 25, 15, 9, 60925);אמות;3;9;ושם האשה המכה המדינית כזבי בת צור ראש אמות בית אב במדין הוא
(45349, 61, 4);10;י;230972;(4, 25, 18, 6, 230972);60941;(4, 25, 18, 2, 60941);צררים;4;2;כי צררים הם לכם בנכליהם אשר נכלו לכם על דבר פעור ועל דבר כזבי בת נשיא מדין אחתם המכה ביום המגפה על דבר פעור
(45349, 61, 4);2;ב;231033;(4, 25, 18, 67, 231033);60959;(4, 25, 18, 20, 60959);ביום;1;20;כי צררים הם לכם בנכליהם אשר נכלו לכם על דבר פעור ועל דבר כזבי בת נשיא מדין אחתם המכה ביום המגפה על דבר פעור
(45349, 61, 4);5;ה;231094;(4, 26, 1, 31, 231094);60975;(4, 26, 1, 9, 60975);הכהן;3;9;ויאמר יהוה אל משה ואל אלעזר בן אהרן הכהן לאמר
(45349, 61, 4);300;ש;231155;(4, 26, 2, 56, 231155);60993;(4, 26, 2, 17, 60993);בישראל;3;17;שאו את ראש כל עדת בני ישראל מבן עשרים שנה ומעלה לבית אבתם כל יצא צבא בישראל
(45349, 61, 4);70;ע;231216;(4, 26, 4, 14, 231216);61008;(4, 26, 4, 4, 61008);ומעלה;3;4;מבן עשרים שנה ומעלה כאשר צוה יהוה את משה ובני ישראל היצאים מארץ מצרים
(45349, 61, 4);1;א;231277;(4, 26, 5, 19, 231277);61023;(4, 26, 5, 5, 61023);ראובן;2;5;ראובן בכור ישראל בני ראובן חנוך משפחת החנכי לפלוא משפחת הפלאי
(45349, 61, 4);20;כ;231338;(4, 26, 6, 29, 231338);61035;(4, 26, 6, 6, 61035);הכרמי;2;6;לחצרן משפחת החצרוני לכרמי משפחת הכרמי
(45349, 61, 4);10;י;231399;(4, 26, 8, 4, 231399);61047;(4, 26, 8, 1, 61047);ובני;4;1;ובני פלוא אליאב
(45349, 61, 4);70;ע;231460;(4, 26, 9, 52, 231460);61062;(4, 26, 9, 13, 61062);על;1;13;ובני אליאב נמואל ודתן ואבירם הוא דתן ואבירם קרואי העדה אשר הצו על משה ועל אהרן בעדת קרח בהצתם על יהוה
(45349, 61, 4);400;ת;231521;(4, 26, 10, 32, 231521);61079;(4, 26, 10, 9, 61079);במות;4;9;ותפתח הארץ את פיה ותבלע אתם ואת קרח במות העדה באכל האש את חמשים ומאתים איש ויהיו לנס
(45349, 61, 4);400;ת;231582;(4, 26, 12, 14, 231582);61095;(4, 26, 12, 3, 61095);למשפחתם;6;3;בני שמעון למשפחתם לנמואל משפחת הנמואלי לימין משפחת הימיני ליכין משפחת היכיני
(45349, 61, 4);5;ה;231643;(4, 26, 13, 10, 231643);61107;(4, 26, 13, 3, 61107);הזרחי;1;3;לזרח משפחת הזרחי לשאול משפחת השאולי
(45349, 61, 4);300;ש;231704;(4, 26, 15, 8, 231704);61120;(4, 26, 15, 3, 61120);למשפחתם;3;3;בני גד למשפחתם לצפון משפחת הצפוני לחגי משפחת החגי לשוני משפחת השוני
(45349, 61, 4);7;ז;231765;(4, 26, 16, 13, 231765);61132;(4, 26, 16, 3, 61132);האזני;3;3;לאזני משפחת האזני לערי משפחת הערי
(45349, 61, 4);4;ד;231826;(4, 26, 18, 13, 231826);61145;(4, 26, 18, 4, 61145);גד;2;4;אלה משפחת בני גד לפקדיהם ארבעים אלף וחמש מאות
(45349, 61, 4);5;ה;231887;(4, 26, 20, 3, 231887);61160;(4, 26, 20, 1, 61160);ויהיו;3;1;ויהיו בני יהודה למשפחתם לשלה משפחת השלני לפרץ משפחת הפרצי לזרח משפחת הזרחי
(45349, 61, 4);10;י;231948;(4, 26, 21, 2, 231948);61173;(4, 26, 21, 1, 61173);ויהיו;2;1;ויהיו בני פרץ לחצרן משפחת החצרני לחמול משפחת החמולי
(45349, 61, 4);40;ם;232009;(4, 26, 22, 20, 232009);61185;(4, 26, 22, 4, 61185);לפקדיהם;7;4;אלה משפחת יהודה לפקדיהם ששה ושבעים אלף וחמש מאות
(45349, 61, 4);80;פ;232070;(4, 26, 23, 41, 232070);61199;(4, 26, 23, 9, 61199);הפוני;2;9;בני יששכר למשפחתם תולע משפחת התולעי לפוה משפחת הפוני
(45349, 61, 4);300;ש;232131;(4, 26, 25, 27, 232131);61211;(4, 26, 25, 6, 61211);וששים;2;6;אלה משפחת יששכר לפקדיהם ארבעה וששים אלף ושלש מאות
(45349, 61, 4);8;ח;232192;(4, 26, 26, 47, 232192);61224;(4, 26, 26, 10, 61224);ליחלאל;3;10;בני זבולן למשפחתם לסרד משפחת הסרדי לאלון משפחת האלני ליחלאל משפחת היחלאלי
(45349, 61, 4);40;מ;232253;(4, 26, 28, 9, 232253);61237;(4, 26, 28, 3, 61237);למשפחתם;2;3;בני יוסף למשפחתם מנשה ואפרים
(45349, 61, 4);300;ש;232314;(4, 26, 29, 46, 232314);61250;(4, 26, 29, 11, 61250);משפחת;2;11;בני מנשה למכיר משפחת המכירי ומכיר הוליד את גלעד לגלעד משפחת הגלעדי
(45349, 61, 4);8;ח;232375;(4, 26, 31, 11, 232375);61262;(4, 26, 31, 2, 61262);משפחת;4;2;ואשריאל משפחת האשראלי ושכם משפחת השכמי
(45349, 61, 4);2;ב;232436;(4, 26, 33, 7, 232436);61274;(4, 26, 33, 2, 61274);בן;1;2;וצלפחד בן חפר לא היו לו בנים כי אם בנות ושם בנות צלפחד מחלה ונעה חגלה מלכה ותרצה
(45349, 61, 4);300;ש;232497;(4, 26, 34, 5, 232497);61292;(4, 26, 34, 2, 61292);משפחת;2;2;אלה משפחת מנשה ופקדיהם שנים וחמשים אלף ושבע מאות
(45349, 61, 4);300;ש;232558;(4, 26, 35, 26, 232558);61305;(4, 26, 35, 6, 61305);משפחת;2;6;אלה בני אפרים למשפחתם לשותלח משפחת השתלחי לבכר משפחת הבכרי לתחן משפחת התחני
(45349, 61, 4);200;ר;232619;(4, 26, 36, 24, 232619);61318;(4, 26, 36, 6, 61318);הערני;3;6;ואלה בני שותלח לערן משפחת הערני
(45349, 61, 4);8;ח;232680;(4, 26, 37, 59, 232680);61332;(4, 26, 37, 14, 61332);למשפחתם;5;14;אלה משפחת בני אפרים לפקדיהם שנים ושלשים אלף וחמש מאות אלה בני יוסף למשפחתם
(45349, 61, 4);8;ח;232741;(4, 26, 38, 59, 232741);61344;(4, 26, 38, 12, 61344);האחירמי;3;12;בני בנימן למשפחתם לבלע משפחת הבלעי לאשבל משפחת האשבלי לאחירם משפחת האחירמי
(45349, 61, 4);400;ת;232802;(4, 26, 40, 24, 232802);61356;(4, 26, 40, 6, 61356);משפחת;5;6;ויהיו בני בלע ארד ונעמן משפחת הארדי לנעמן משפחת הנעמי
(45349, 61, 4);300;ש;232863;(4, 26, 41, 41, 232863);61369;(4, 26, 41, 9, 61369);ושש;2;9;אלה בני בנימן למשפחתם ופקדיהם חמשה וארבעים אלף ושש מאות
(45349, 61, 4);5;ה;232924;(4, 26, 43, 8, 232924);61384;(4, 26, 43, 3, 61384);השוחמי;1;3;כל משפחת השוחמי לפקדיהם ארבעה וששים אלף וארבע מאות
(45349, 61, 4);50;נ;232985;(4, 26, 44, 27, 232985);61396;(4, 26, 44, 6, 61396);הימנה;4;6;בני אשר למשפחתם לימנה משפחת הימנה לישוי משפחת הישוי לבריעה משפחת הבריעי
(45349, 61, 4);10;י;233046;(4, 26, 45, 28, 233046);61408;(4, 26, 45, 6, 61408);למלכיאל;5;6;לבני בריעה לחבר משפחת החברי למלכיאל משפחת המלכיאלי
(45349, 61, 4);6;ו;233107;(4, 26, 47, 35, 233107);61423;(4, 26, 47, 9, 61423);וארבע;1;9;אלה משפחת בני אשר לפקדיהם שלשה וחמשים אלף וארבע מאות
(45349, 61, 4);40;מ;233168;(4, 26, 49, 5, 233168);61435;(4, 26, 49, 2, 61435);משפחת;1;2;ליצר משפחת היצרי לשלם משפחת השלמי
(45349, 61, 4);40;ם;233229;(4, 26, 50, 38, 233229);61446;(4, 26, 50, 7, 61446);וארבעים;7;7;אלה משפחת נפתלי למשפחתם ופקדיהם חמשה וארבעים אלף וארבע מאות
(45349, 61, 4);5;ה;233290;(4, 26, 52, 7, 233290);61462;(4, 26, 52, 2, 61462);יהוה;2;2;וידבר יהוה אל משה לאמר
(45349, 61, 4);8;ח;233351;(4, 26, 54, 24, 233351);61477;(4, 26, 54, 6, 61477);נחלתו;2;6;לרב תרבה נחלתו ולמעט תמעיט נחלתו איש לפי פקדיו יתן נחלתו
(45349, 61, 4);10;י;233412;(4, 26, 56, 4, 233412);61493;(4, 26, 56, 2, 61493);פי;2;2;על פי הגורל תחלק נחלתו בין רב למעט
