(133663, 76, 4);1;א;80463;(2, 3, 3, 20, 80463);21233;(2, 3, 3, 6, 21233);את;1;6;ויאמר משה אסרה נא ואראה את המראה הגדל הזה מדוע לא יבער הסנה
(133663, 76, 4);300;ש;80539;(2, 3, 4, 49, 80539);21253;(2, 3, 4, 13, 21253);משה;2;13;וירא יהוה כי סר לראות ויקרא אליו אלהים מתוך הסנה ויאמר משה משה ויאמר הנני
(133663, 76, 4);1;א;80615;(2, 3, 6, 6, 80615);21274;(2, 3, 6, 2, 21274);אנכי;1;2;ויאמר אנכי אלהי אביך אלהי אברהם אלהי יצחק ואלהי יעקב ויסתר משה פניו כי ירא מהביט אל האלהים
(133663, 76, 4);5;ה;80691;(2, 3, 7, 9, 80691);21292;(2, 3, 7, 2, 21292);יהוה;4;2;ויאמר יהוה ראה ראיתי את עני עמי אשר במצרים ואת צעקתם שמעתי מפני נגשיו כי ידעתי את מכאביו
(133663, 76, 4);40;מ;80767;(2, 3, 8, 14, 80767);21312;(2, 3, 8, 4, 21312);מצרים;1;4;וארד להצילו מיד מצרים ולהעלתו מן הארץ ההוא אל ארץ טובה ורחבה אל ארץ זבת חלב ודבש אל מקום הכנעני והחתי והאמרי והפרזי והחוי והיבוסי
(133663, 76, 4);80;פ;80843;(2, 3, 8, 90, 80843);21331;(2, 3, 8, 23, 21331);והפרזי;3;23;וארד להצילו מיד מצרים ולהעלתו מן הארץ ההוא אל ארץ טובה ורחבה אל ארץ זבת חלב ודבש אל מקום הכנעני והחתי והאמרי והפרזי והחוי והיבוסי
(133663, 76, 4);20;כ;80919;(2, 3, 10, 6, 80919);21350;(2, 3, 10, 2, 21350);לכה;2;2;ועתה לכה ואשלחך אל פרעה והוצא את עמי בני ישראל ממצרים
(133663, 76, 4);90;צ;80995;(2, 3, 11, 39, 80995);21371;(2, 3, 11, 12, 21371);אוציא;3;12;ויאמר משה אל האלהים מי אנכי כי אלך אל פרעה וכי אוציא את בני ישראל ממצרים
(133663, 76, 4);6;ו;81071;(2, 3, 12, 58, 81071);21390;(2, 3, 12, 15, 21390);תעבדון;5;15;ויאמר כי אהיה עמך וזה לך האות כי אנכי שלחתיך בהוציאך את העם ממצרים תעבדון את האלהים על ההר הזה
(133663, 76, 4);50;נ;81147;(2, 3, 13, 59, 81147);21410;(2, 3, 13, 15, 21410);שלחני;4;15;ויאמר משה אל האלהים הנה אנכי בא אל בני ישראל ואמרתי להם אלהי אבותיכם שלחני אליכם ואמרו לי מה שמו מה אמר אלהם
(133663, 76, 4);10;י;81223;(2, 3, 14, 49, 81223);21431;(2, 3, 14, 13, 21431);אהיה;3;13;ויאמר אלהים אל משה אהיה אשר אהיה ויאמר כה תאמר לבני ישראל אהיה שלחני אליכם
(133663, 76, 4);100;ק;81299;(2, 3, 15, 65, 81299);21450;(2, 3, 15, 17, 21450);יצחק;4;17;ויאמר עוד אלהים אל משה כה תאמר אל בני ישראל יהוה אלהי אבתיכם אלהי אברהם אלהי יצחק ואלהי יעקב שלחני אליכם זה שמי לעלם וזה זכרי לדר דר
(133663, 76, 4);1;א;81375;(2, 3, 16, 36, 81375);21471;(2, 3, 16, 10, 21471);אבתיכם;1;10;לך ואספת את זקני ישראל ואמרת אלהם יהוה אלהי אבתיכם נראה אלי אלהי אברהם יצחק ויעקב לאמר פקד פקדתי אתכם ואת העשוי לכם במצרים
(133663, 76, 4);40;מ;81451;(2, 3, 17, 13, 81451);21489;(2, 3, 17, 4, 21489);מעני;1;4;ואמר אעלה אתכם מעני מצרים אל ארץ הכנעני והחתי והאמרי והפרזי והחוי והיבוסי אל ארץ זבת חלב ודבש
(133663, 76, 4);400;ת;81527;(2, 3, 18, 13, 81527);21506;(2, 3, 18, 3, 21506);ובאת;4;3;ושמעו לקלך ובאת אתה וזקני ישראל אל מלך מצרים ואמרתם אליו יהוה אלהי העבריים נקרה עלינו ועתה נלכה נא דרך שלשת ימים במדבר ונזבחה ליהוה אלהינו
(133663, 76, 4);40;מ;81603;(2, 3, 18, 89, 81603);21525;(2, 3, 18, 22, 21525);ימים;2;22;ושמעו לקלך ובאת אתה וזקני ישראל אל מלך מצרים ואמרתם אליו יהוה אלהי העבריים נקרה עלינו ועתה נלכה נא דרך שלשת ימים במדבר ונזבחה ליהוה אלהינו
(133663, 76, 4);4;ד;81679;(2, 3, 20, 10, 81679);21544;(2, 3, 20, 3, 21544);ידי;2;3;ושלחתי את ידי והכיתי את מצרים בכל נפלאתי אשר אעשה בקרבו ואחרי כן ישלח אתכם
(133663, 76, 4);6;ו;81755;(2, 3, 21, 26, 81755);21564;(2, 3, 21, 8, 21564);והיה;1;8;ונתתי את חן העם הזה בעיני מצרים והיה כי תלכון לא תלכו ריקם
(133663, 76, 4);30;ל;81831;(2, 3, 22, 56, 81831);21583;(2, 3, 22, 14, 21583);ועל;3;14;ושאלה אשה משכנתה ומגרת ביתה כלי כסף וכלי זהב ושמלת ושמתם על בניכם ועל בנתיכם ונצלתם את מצרים
(133663, 76, 4);6;ו;81907;(2, 4, 1, 57, 81907);21603;(2, 4, 1, 16, 21603);יהוה;3;16;ויען משה ויאמר והן לא יאמינו לי ולא ישמעו בקלי כי יאמרו לא נראה אליך יהוה
(133663, 76, 4);6;ו;81983;(2, 4, 3, 47, 81983);21620;(2, 4, 3, 10, 21620);מפניו;5;10;ויאמר השליכהו ארצה וישלכהו ארצה ויהי לנחש וינס משה מפניו
(133663, 76, 4);20;ך;82059;(2, 4, 5, 20, 82059);21640;(2, 4, 5, 5, 21640);אליך;4;5;למען יאמינו כי נראה אליך יהוה אלהי אבתם אלהי אברהם אלהי יצחק ואלהי יעקב
(133663, 76, 4);100;ק;82135;(2, 4, 6, 38, 82135);21660;(2, 4, 6, 11, 21660);בחיקו;4;11;ויאמר יהוה לו עוד הבא נא ידך בחיקך ויבא ידו בחיקו ויוצאה והנה ידו מצרעת כשלג
(133663, 76, 4);6;ו;82211;(2, 4, 7, 53, 82211);21679;(2, 4, 7, 14, 21679);כבשרו;5;14;ויאמר השב ידך אל חיקך וישב ידו אל חיקו ויוצאה מחיקו והנה שבה כבשרו
(133663, 76, 4);5;ה;82287;(2, 4, 9, 21, 82287);21700;(2, 4, 9, 7, 21700);האתות;1;7;והיה אם לא יאמינו גם לשני האתות האלה ולא ישמעון לקלך ולקחת ממימי היאר ושפכת היבשה והיו המים אשר תקח מן היאר והיו לדם ביבשת
(133663, 76, 4);300;ש;82363;(2, 4, 9, 97, 82363);21718;(2, 4, 9, 25, 21718);ביבשת;4;25;והיה אם לא יאמינו גם לשני האתות האלה ולא ישמעון לקלך ולקחת ממימי היאר ושפכת היבשה והיו המים אשר תקח מן היאר והיו לדם ביבשת
(133663, 76, 4);30;ל;82439;(2, 4, 10, 75, 82439);21742;(2, 4, 10, 24, 21742);לשון;1;24;ויאמר משה אל יהוה בי אדני לא איש דברים אנכי גם מתמול גם משלשם גם מאז דברך אל עבדך כי כבד פה וכבד לשון אנכי
(133663, 76, 4);50;נ;82515;(2, 4, 12, 9, 82515);21766;(2, 4, 12, 3, 21766);ואנכי;3;3;ועתה לך ואנכי אהיה עם פיך והוריתיך אשר תדבר
(133663, 76, 4);1;א;82591;(2, 4, 14, 27, 82591);21787;(2, 4, 14, 8, 21787);אחיך;1;8;ויחר אף יהוה במשה ויאמר הלא אהרן אחיך הלוי ידעתי כי דבר ידבר הוא וגם הנה הוא יצא לקראתך וראך ושמח בלבו
(133663, 76, 4);2;ב;82667;(2, 4, 15, 22, 82667);21807;(2, 4, 15, 6, 21807);בפיו;1;6;ודברת אליו ושמת את הדברים בפיו ואנכי אהיה עם פיך ועם פיהו והוריתי אתכם את אשר תעשון
(133663, 76, 4);6;ו;82743;(2, 4, 16, 31, 82743);21829;(2, 4, 16, 11, 21829);ואתה;1;11;ודבר הוא לך אל העם והיה הוא יהיה לך לפה ואתה תהיה לו לאלהים
(133663, 76, 4);30;ל;82819;(2, 4, 18, 29, 82819);21851;(2, 4, 18, 9, 21851);אלכה;2;9;וילך משה וישב אל יתר חתנו ויאמר לו אלכה נא ואשובה אל אחי אשר במצרים ואראה העודם חיים ויאמר יתרו למשה לך לשלום
(133663, 76, 4);10;י;82895;(2, 4, 19, 18, 82895);21870;(2, 4, 19, 5, 21870);במדין;4;5;ויאמר יהוה אל משה במדין לך שב מצרים כי מתו כל האנשים המבקשים את נפשך
(133663, 76, 4);5;ה;82971;(2, 4, 20, 40, 82971);21891;(2, 4, 20, 11, 21891);ארצה;4;11;ויקח משה את אשתו ואת בניו וירכבם על החמר וישב ארצה מצרים ויקח משה את מטה האלהים בידו
(133663, 76, 4);10;י;83047;(2, 4, 21, 49, 83047);21911;(2, 4, 21, 13, 21911);בידך;2;13;ויאמר יהוה אל משה בלכתך לשוב מצרימה ראה כל המפתים אשר שמתי בידך ועשיתם לפני פרעה ואני אחזק את לבו ולא ישלח את העם
(133663, 76, 4);40;מ;83123;(2, 4, 23, 3, 83123);21932;(2, 4, 23, 1, 21932);ואמר;3;1;ואמר אליך שלח את בני ויעבדני ותמאן לשלחו הנה אנכי הרג את בנך בכרך
(133663, 76, 4);2;ב;83199;(2, 4, 24, 27, 83199);21951;(2, 4, 24, 6, 21951);ויבקש;3;6;ויהי בדרך במלון ויפגשהו יהוה ויבקש המיתו
(133663, 76, 4);400;ת;83275;(2, 4, 26, 16, 83275);21972;(2, 4, 26, 5, 21972);חתן;2;5;וירף ממנו אז אמרה חתן דמים למולת
(133663, 76, 4);1;א;83351;(2, 4, 28, 9, 83351);21991;(2, 4, 28, 3, 21991);לאהרן;2;3;ויגד משה לאהרן את כל דברי יהוה אשר שלחו ואת כל האתת אשר צוהו
(133663, 76, 4);2;ב;83427;(2, 4, 30, 4, 83427);22012;(2, 4, 30, 1, 22012);וידבר;4;1;וידבר אהרן את כל הדברים אשר דבר יהוה אל משה ויעש האתת לעיני העם
(133663, 76, 4);300;ש;83503;(2, 4, 31, 30, 83503);22034;(2, 4, 31, 9, 22034);ישראל;2;9;ויאמן העם וישמעו כי פקד יהוה את בני ישראל וכי ראה את ענים ויקדו וישתחוו
(133663, 76, 4);1;א;83579;(2, 5, 1, 49, 83579);22054;(2, 5, 1, 14, 22054);את;1;14;ואחר באו משה ואהרן ויאמרו אל פרעה כה אמר יהוה אלהי ישראל שלח את עמי ויחגו לי במדבר
(133663, 76, 4);30;ל;83655;(2, 5, 2, 60, 83655);22075;(2, 5, 2, 17, 22075);ישראל;5;17;ויאמר פרעה מי יהוה אשר אשמע בקלו לשלח את ישראל לא ידעתי את יהוה וגם את ישראל לא אשלח
(133663, 76, 4);70;ע;83731;(2, 5, 3, 70, 83731);22093;(2, 5, 3, 16, 22093);יפגענו;4;16;ויאמרו אלהי העברים נקרא עלינו נלכה נא דרך שלשת ימים במדבר ונזבחה ליהוה אלהינו פן יפגענו בדבר או בחרב
(133663, 76, 4);70;ע;83807;(2, 5, 5, 8, 83807);22111;(2, 5, 5, 2, 22111);פרעה;3;2;ויאמר פרעה הן רבים עתה עם הארץ והשבתם אתם מסבלתם
(133663, 76, 4);80;פ;83883;(2, 5, 7, 6, 83883);22131;(2, 5, 7, 2, 22131);תאספון;4;2;לא תאספון לתת תבן לעם ללבן הלבנים כתמול שלשם הם ילכו וקששו להם תבן
(133663, 76, 4);30;ל;83959;(2, 5, 8, 29, 83959);22151;(2, 5, 8, 8, 22151);שלשם;2;8;ואת מתכנת הלבנים אשר הם עשים תמול שלשם תשימו עליהם לא תגרעו ממנו כי נרפים הם על כן הם צעקים לאמר נלכה נזבחה לאלהינו
(133663, 76, 4);1;א;84035;(2, 5, 9, 13, 84035);22171;(2, 5, 9, 4, 22171);האנשים;2;4;תכבד העבדה על האנשים ויעשו בה ואל ישעו בדברי שקר
(133663, 76, 4);50;ן;84111;(2, 5, 10, 50, 84111);22190;(2, 5, 10, 13, 22190);נתן;3;13;ויצאו נגשי העם ושטריו ויאמרו אל העם לאמר כה אמר פרעה אינני נתן לכם תבן
(133663, 76, 4);2;ב;84187;(2, 5, 12, 27, 84187);22212;(2, 5, 12, 8, 22212);לתבן;3;8;ויפץ העם בכל ארץ מצרים לקשש קש לתבן
(133663, 76, 4);50;נ;84263;(2, 5, 14, 27, 84263);22231;(2, 5, 14, 8, 22231);נגשי;1;8;ויכו שטרי בני ישראל אשר שמו עלהם נגשי פרעה לאמר מדוע לא כליתם חקכם ללבן כתמול שלשם גם תמול גם היום
(133663, 76, 4);30;ל;84339;(2, 5, 15, 25, 84339);22250;(2, 5, 15, 6, 22250);אל;2;6;ויבאו שטרי בני ישראל ויצעקו אל פרעה לאמר למה תעשה כה לעבדיך
(133663, 76, 4);20;ך;84415;(2, 5, 16, 53, 84415);22269;(2, 5, 16, 13, 22269);עמך;3;13;תבן אין נתן לעבדיך ולבנים אמרים לנו עשו והנה עבדיך מכים וחטאת עמך
(133663, 76, 4);10;י;84491;(2, 5, 18, 32, 84491);22289;(2, 5, 18, 9, 22289);לבנים;4;9;ועתה לכו עבדו ותבן לא ינתן לכם ותכן לבנים תתנו
(133663, 76, 4);50;נ;84567;(2, 5, 20, 19, 84567);22309;(2, 5, 20, 6, 22309);נצבים;1;6;ויפגעו את משה ואת אהרן נצבים לקראתם בצאתם מאת פרעה
(133663, 76, 4);2;ב;84643;(2, 5, 21, 54, 84643);22326;(2, 5, 21, 13, 22326);ובעיני;2;13;ויאמרו אלהם ירא יהוה עליכם וישפט אשר הבאשתם את ריחנו בעיני פרעה ובעיני עבדיו לתת חרב בידם להרגנו
(133663, 76, 4);7;ז;84719;(2, 5, 23, 4, 84719);22345;(2, 5, 23, 1, 22345);ומאז;4;1;ומאז באתי אל פרעה לדבר בשמך הרע לעם הזה והצל לא הצלת את עמך
(133663, 76, 4);20;כ;84795;(2, 6, 1, 34, 84795);22368;(2, 6, 1, 10, 22368);כי;1;10;ויאמר יהוה אל משה עתה תראה אשר אעשה לפרעה כי ביד חזקה ישלחם וביד חזקה יגרשם מארצו
(133663, 76, 4);10;י;84871;(2, 6, 3, 14, 84871);22388;(2, 6, 3, 5, 22388);יצחק;1;5;וארא אל אברהם אל יצחק ואל יעקב באל שדי ושמי יהוה לא נודעתי להם
(133663, 76, 4);200;ר;84947;(2, 6, 4, 41, 84947);22410;(2, 6, 4, 13, 22410);מגריהם;3;13;וגם הקמתי את בריתי אתם לתת להם את ארץ כנען את ארץ מגריהם אשר גרו בה
(133663, 76, 4);10;י;85023;(2, 6, 6, 11, 85023);22431;(2, 6, 6, 4, 22431);ישראל;1;4;לכן אמר לבני ישראל אני יהוה והוצאתי אתכם מתחת סבלת מצרים והצלתי אתכם מעבדתם וגאלתי אתכם בזרוע נטויה ובשפטים גדלים
(133663, 76, 4);9;ט;85099;(2, 6, 6, 87, 85099);22446;(2, 6, 6, 19, 22446);ובשפטים;5;19;לכן אמר לבני ישראל אני יהוה והוצאתי אתכם מתחת סבלת מצרים והצלתי אתכם מעבדתם וגאלתי אתכם בזרוע נטויה ובשפטים גדלים
(133663, 76, 4);6;ו;85175;(2, 6, 7, 69, 85175);22463;(2, 6, 7, 16, 22463);סבלות;4;16;ולקחתי אתכם לי לעם והייתי לכם לאלהים וידעתם כי אני יהוה אלהיכם המוציא אתכם מתחת סבלות מצרים
(133663, 76, 4);50;נ;85251;(2, 6, 8, 70, 85251);22482;(2, 6, 8, 18, 22482);אני;2;18;והבאתי אתכם אל הארץ אשר נשאתי את ידי לתת אתה לאברהם ליצחק וליעקב ונתתי אתה לכם מורשה אני יהוה
(133663, 76, 4);200;ר;85327;(2, 6, 11, 5, 85327);22504;(2, 6, 11, 2, 22504);דבר;3;2;בא דבר אל פרעה מלך מצרים וישלח את בני ישראל מארצו
(133663, 76, 4);10;י;85403;(2, 6, 12, 42, 85403);22525;(2, 6, 12, 12, 22525);ואיך;3;12;וידבר משה לפני יהוה לאמר הן בני ישראל לא שמעו אלי ואיך ישמעני פרעה ואני ערל שפתים
(133663, 76, 4);5;ה;85479;(2, 6, 13, 53, 85479);22545;(2, 6, 13, 15, 22545);להוציא;2;15;וידבר יהוה אל משה ואל אהרן ויצום אל בני ישראל ואל פרעה מלך מצרים להוציא את בני ישראל מארץ מצרים
(133663, 76, 4);300;ש;85555;(2, 6, 14, 53, 85555);22564;(2, 6, 14, 14, 22564);משפחת;2;14;אלה ראשי בית אבתם בני ראובן בכר ישראל חנוך ופלוא חצרן וכרמי אלה משפחת ראובן
(133663, 76, 4);2;ב;85631;(2, 6, 16, 9, 85631);22581;(2, 6, 16, 3, 22581);בני;1;3;ואלה שמות בני לוי לתלדתם גרשון וקהת ומררי ושני חיי לוי שבע ושלשים ומאת שנה
(133663, 76, 4);6;ו;85707;(2, 6, 18, 1, 85707);22599;(2, 6, 18, 1, 22599);ובני;1;1;ובני קהת עמרם ויצהר וחברון ועזיאל ושני חיי קהת שלש ושלשים ומאת שנה
(133663, 76, 4);80;פ;85783;(2, 6, 19, 23, 85783);22617;(2, 6, 19, 6, 22617);משפחת;3;6;ובני מררי מחלי ומושי אלה משפחת הלוי לתלדתם
(133663, 76, 4);6;ו;85859;(2, 6, 20, 64, 85859);22638;(2, 6, 20, 19, 22638);ומאת;1;19;ויקח עמרם את יוכבד דדתו לו לאשה ותלד לו את אהרן ואת משה ושני חיי עמרם שבע ושלשים ומאת שנה
(133663, 76, 4);1;א;85935;(2, 6, 23, 25, 85935);22656;(2, 6, 23, 7, 22656);אחות;1;7;ויקח אהרן את אלישבע בת עמינדב אחות נחשון לו לאשה ותלד לו את נדב ואת אביהוא את אלעזר ואת איתמר
(133663, 76, 4);5;ה;86011;(2, 6, 24, 27, 86011);22675;(2, 6, 24, 6, 22675);אלה;3;6;ובני קרח אסיר ואלקנה ואביאסף אלה משפחת הקרחי
(133663, 76, 4);300;ש;86087;(2, 6, 25, 66, 86087);22695;(2, 6, 25, 18, 22695);למשפחתם;3;18;ואלעזר בן אהרן לקח לו מבנות פוטיאל לו לאשה ותלד לו את פינחס אלה ראשי אבות הלוים למשפחתם
(133663, 76, 4);40;מ;86163;(2, 6, 27, 16, 86163);22715;(2, 6, 27, 5, 22715);מלך;1;5;הם המדברים אל פרעה מלך מצרים להוציא את בני ישראל ממצרים הוא משה ואהרן
(133663, 76, 4);5;ה;86239;(2, 6, 29, 7, 86239);22734;(2, 6, 29, 2, 22734);יהוה;2;2;וידבר יהוה אל משה לאמר אני יהוה דבר אל פרעה מלך מצרים את כל אשר אני דבר אליך
(133663, 76, 4);30;ל;86315;(2, 6, 30, 24, 86315);22757;(2, 6, 30, 7, 22757);ערל;3;7;ויאמר משה לפני יהוה הן אני ערל שפתים ואיך ישמע אלי פרעה
(133663, 76, 4);2;ב;86391;(2, 7, 2, 6, 86391);22776;(2, 7, 2, 2, 22776);תדבר;3;2;אתה תדבר את כל אשר אצוך ואהרן אחיך ידבר אל פרעה ושלח את בני ישראל מארצו
(133663, 76, 4);1;א;86467;(2, 7, 3, 26, 86467);22798;(2, 7, 3, 8, 22798);אתתי;1;8;ואני אקשה את לב פרעה והרביתי את אתתי ואת מופתי בארץ מצרים
(133663, 76, 4);200;ר;86543;(2, 7, 4, 56, 86543);22817;(2, 7, 4, 15, 22817);ישראל;3;15;ולא ישמע אלכם פרעה ונתתי את ידי במצרים והוצאתי את צבאתי את עמי בני ישראל מארץ מצרים בשפטים גדלים
(133663, 76, 4);40;מ;86619;(2, 7, 5, 54, 86619);22836;(2, 7, 5, 15, 22836);מתוכם;1;15;וידעו מצרים כי אני יהוה בנטתי את ידי על מצרים והוצאתי את בני ישראל מתוכם
(133663, 76, 4);80;פ;86695;(2, 7, 7, 41, 86695);22857;(2, 7, 7, 12, 22857);פרעה;1;12;ומשה בן שמנים שנה ואהרן בן שלש ושמנים שנה בדברם אל פרעה
(133663, 76, 4);5;ה;86771;(2, 7, 9, 48, 86771);22879;(2, 7, 9, 15, 22879);והשלך;2;15;כי ידבר אלכם פרעה לאמר תנו לכם מופת ואמרת אל אהרן קח את מטך והשלך לפני פרעה יהי לתנין
(133663, 76, 4);200;ר;86847;(2, 7, 10, 57, 86847);22899;(2, 7, 10, 16, 22899);פרעה;2;16;ויבא משה ואהרן אל פרעה ויעשו כן כאשר צוה יהוה וישלך אהרן את מטהו לפני פרעה ולפני עבדיו ויהי לתנין
(133663, 76, 4);10;י;86923;(2, 7, 12, 2, 86923);22916;(2, 7, 12, 1, 22916);וישליכו;2;1;וישליכו איש מטהו ויהיו לתנינם ויבלע מטה אהרן את מטתם
(133663, 76, 4);1;א;86999;(2, 7, 14, 3, 86999);22935;(2, 7, 14, 1, 22935);ויאמר;3;1;ויאמר יהוה אל משה כבד לב פרעה מאן לשלח העם
(133663, 76, 4);40;מ;87075;(2, 7, 15, 46, 87075);22957;(2, 7, 15, 13, 22957);והמטה;3;13;לך אל פרעה בבקר הנה יצא המימה ונצבת לקראתו על שפת היאר והמטה אשר נהפך לנחש תקח בידך
(133663, 76, 4);200;ר;87151;(2, 7, 16, 56, 87151);22975;(2, 7, 16, 13, 22975);במדבר;5;13;ואמרת אליו יהוה אלהי העברים שלחני אליך לאמר שלח את עמי ויעבדני במדבר והנה לא שמעת עד כה
(133663, 76, 4);5;ה;87227;(2, 7, 17, 62, 87227);22999;(2, 7, 17, 19, 22999);ונהפכו;3;19;כה אמר יהוה בזאת תדע כי אני יהוה הנה אנכי מכה במטה אשר בידי על המים אשר ביאר ונהפכו לדם
(133663, 76, 4);200;ר;87303;(2, 7, 19, 22, 87303);23019;(2, 7, 19, 7, 23019);אהרן;3;7;ויאמר יהוה אל משה אמר אל אהרן קח מטך ונטה ידך על מימי מצרים על נהרתם על יאריהם ועל אגמיהם ועל כל מקוה מימיהם ויהיו דם והיה דם בכל ארץ מצרים ובעצים ובאבנים
(133663, 76, 4);40;ם;87379;(2, 7, 19, 98, 87379);23040;(2, 7, 19, 28, 23040);דם;2;28;ויאמר יהוה אל משה אמר אל אהרן קח מטך ונטה ידך על מימי מצרים על נהרתם על יאריהם ועל אגמיהם ועל כל מקוה מימיהם ויהיו דם והיה דם בכל ארץ מצרים ובעצים ובאבנים
(133663, 76, 4);70;ע;87455;(2, 7, 20, 52, 87455);23060;(2, 7, 20, 15, 23060);לעיני;2;15;ויעשו כן משה ואהרן כאשר צוה יהוה וירם במטה ויך את המים אשר ביאר לעיני פרעה ולעיני עבדיו ויהפכו כל המים אשר ביאר לדם
(133663, 76, 4);40;ם;87531;(2, 7, 21, 36, 87531);23078;(2, 7, 21, 9, 23078);מצרים;5;9;והדגה אשר ביאר מתה ויבאש היאר ולא יכלו מצרים לשתות מים מן היאר ויהי הדם בכל ארץ מצרים
(133663, 76, 4);40;ם;87607;(2, 7, 22, 44, 87607);23098;(2, 7, 22, 11, 23098);אלהם;4;11;ויעשו כן חרטמי מצרים בלטיהם ויחזק לב פרעה ולא שמע אלהם כאשר דבר יהוה
(133663, 76, 4);30;ל;87683;(2, 7, 24, 33, 87683);23120;(2, 7, 24, 9, 23120);לא;1;9;ויחפרו כל מצרים סביבת היאר מים לשתות כי לא יכלו לשתת ממימי היאר
(133663, 76, 4);400;ת;87759;(2, 7, 26, 27, 87759);23140;(2, 7, 26, 8, 23140);ואמרת;5;8;ויאמר יהוה אל משה בא אל פרעה ואמרת אליו כה אמר יהוה שלח את עמי ויעבדני
(133663, 76, 4);200;ר;87835;(2, 7, 28, 8, 87835);23161;(2, 7, 28, 2, 23161);היאר;4;2;ושרץ היאר צפרדעים ועלו ובאו בביתך ובחדר משכבך ועל מטתך ובבית עבדיך ובעמך ובתנוריך ובמשארותיך
(133663, 76, 4);2;ב;87911;(2, 7, 29, 6, 87911);23176;(2, 7, 29, 2, 23176);ובעמך;2;2;ובכה ובעמך ובכל עבדיך יעלו הצפרדעים
(133663, 76, 4);70;ע;87987;(2, 8, 1, 52, 87987);23196;(2, 8, 1, 16, 23196);ועל;2;16;ויאמר יהוה אל משה אמר אל אהרן נטה את ידך במטך על הנהרת על היארים ועל האגמים והעל את הצפרדעים על ארץ מצרים
(133663, 76, 4);200;ר;88063;(2, 8, 2, 45, 88063);23216;(2, 8, 2, 13, 23216);מצרים;3;13;ויט אהרן את ידו על מימי מצרים ותעל הצפרדע ותכס את ארץ מצרים
(133663, 76, 4);200;ר;88139;(2, 8, 4, 29, 88139);23232;(2, 8, 4, 6, 23232);העתירו;5;6;ויקרא פרעה למשה ולאהרן ויאמר העתירו אל יהוה ויסר הצפרדעים ממני ומעמי ואשלחה את העם ויזבחו ליהוה
(133663, 76, 4);1;א;88215;(2, 8, 5, 26, 88215);23250;(2, 8, 5, 7, 23250);אעתיר;1;7;ויאמר משה לפרעה התפאר עלי למתי אעתיר לך ולעבדיך ולעמך להכרית הצפרדעים ממך ומבתיך רק ביאר תשארנה
(133663, 76, 4);50;ן;88291;(2, 8, 6, 23, 88291);23265;(2, 8, 6, 5, 23265);למען;4;5;ויאמר למחר ויאמר כדברך למען תדע כי אין כיהוה אלהינו
(133663, 76, 4);50;ן;88367;(2, 8, 8, 12, 88367);23282;(2, 8, 8, 3, 23282);ואהרן;5;3;ויצא משה ואהרן מעם פרעה ויצעק משה אל יהוה על דבר הצפרדעים אשר שם לפרעה
(133663, 76, 4);2;ב;88443;(2, 8, 9, 32, 88443);23302;(2, 8, 9, 8, 23302);הבתים;2;8;ויעש יהוה כדבר משה וימתו הצפרדעים מן הבתים מן החצרת ומן השדת
(133663, 76, 4);300;ש;88519;(2, 8, 11, 33, 88519);23322;(2, 8, 11, 10, 23322);שמע;1;10;וירא פרעה כי היתה הרוחה והכבד את לבו ולא שמע אלהם כאשר דבר יהוה
(133663, 76, 4);90;צ;88595;(2, 8, 12, 59, 88595);23345;(2, 8, 12, 19, 23345);מצרים;2;19;ויאמר יהוה אל משה אמר אל אהרן נטה את מטך והך את עפר הארץ והיה לכנם בכל ארץ מצרים
(133663, 76, 4);30;ל;88671;(2, 8, 13, 73, 88671);23366;(2, 8, 13, 21, 23366);בכל;3;21;ויעשו כן ויט אהרן את ידו במטהו ויך את עפר הארץ ותהי הכנם באדם ובבהמה כל עפר הארץ היה כנים בכל ארץ מצרים
(133663, 76, 4);9;ט;88747;(2, 8, 15, 10, 88747);23383;(2, 8, 15, 2, 23383);החרטמם;4;2;ויאמרו החרטמם אל פרעה אצבע אלהים הוא ויחזק לב פרעה ולא שמע אלהם כאשר דבר יהוה
