(224277, -63, 4);10;י;230766;(4, 25, 13, 3, 230766);60887;(4, 25, 13, 1, 60887);והיתה;3;1;והיתה לו ולזרעו אחריו ברית כהנת עולם תחת אשר קנא לאלהיו ויכפר על בני ישראל
(224277, -63, 4);300;ש;230829;(4, 25, 14, 6, 230829);60903;(4, 25, 14, 2, 60903);איש;3;2;ושם איש ישראל המכה אשר הכה את המדינית זמרי בן סלוא נשיא בית אב לשמעני
(224277, -63, 4);4;ד;230892;(4, 25, 15, 14, 230892);60920;(4, 25, 15, 4, 60920);המדינית;3;4;ושם האשה המכה המדינית כזבי בת צור ראש אמות בית אב במדין הוא
(224277, -63, 4);10;י;230955;(4, 25, 17, 12, 230955);60937;(4, 25, 17, 3, 60937);המדינים;6;3;צרור את המדינים והכיתם אותם
(224277, -63, 4);300;ש;231018;(4, 25, 18, 52, 231018);60955;(4, 25, 18, 16, 60955);נשיא;2;16;כי צררים הם לכם בנכליהם אשר נכלו לכם על דבר פעור ועל דבר כזבי בת נשיא מדין אחתם המכה ביום המגפה על דבר פעור
(224277, -63, 4);1;א;231081;(4, 26, 1, 18, 231081);60972;(4, 26, 1, 6, 60972);אלעזר;1;6;ויאמר יהוה אל משה ואל אלעזר בן אהרן הכהן לאמר
(224277, -63, 4);40;ם;231144;(4, 26, 2, 45, 231144);60989;(4, 26, 2, 13, 60989);אבתם;4;13;שאו את ראש כל עדת בני ישראל מבן עשרים שנה ומעלה לבית אבתם כל יצא צבא בישראל
(224277, -63, 4);300;ש;231207;(4, 26, 4, 5, 231207);61006;(4, 26, 4, 2, 61006);עשרים;2;2;מבן עשרים שנה ומעלה כאשר צוה יהוה את משה ובני ישראל היצאים מארץ מצרים
(224277, -63, 4);200;ר;231270;(4, 26, 5, 12, 231270);61021;(4, 26, 5, 3, 61021);ישראל;3;3;ראובן בכור ישראל בני ראובן חנוך משפחת החנכי לפלוא משפחת הפלאי
(224277, -63, 4);300;ש;231333;(4, 26, 6, 24, 231333);61034;(4, 26, 6, 5, 61034);משפחת;2;5;לחצרן משפחת החצרוני לכרמי משפחת הכרמי
(224277, -63, 4);6;ו;231396;(4, 26, 8, 1, 231396);61047;(4, 26, 8, 1, 61047);ובני;1;1;ובני פלוא אליאב
(224277, -63, 4);6;ו;231459;(4, 26, 9, 51, 231459);61061;(4, 26, 9, 12, 61061);הצו;3;12;ובני אליאב נמואל ודתן ואבירם הוא דתן ואבירם קרואי העדה אשר הצו על משה ועל אהרן בעדת קרח בהצתם על יהוה
(224277, -63, 4);5;ה;231522;(4, 26, 10, 33, 231522);61080;(4, 26, 10, 10, 61080);העדה;1;10;ותפתח הארץ את פיה ותבלע אתם ואת קרח במות העדה באכל האש את חמשים ומאתים איש ויהיו לנס
(224277, -63, 4);50;נ;231585;(4, 26, 12, 17, 231585);61096;(4, 26, 12, 4, 61096);לנמואל;2;4;בני שמעון למשפחתם לנמואל משפחת הנמואלי לימין משפחת הימיני ליכין משפחת היכיני
(224277, -63, 4);30;ל;231648;(4, 26, 13, 15, 231648);61108;(4, 26, 13, 4, 61108);לשאול;1;4;לזרח משפחת הזרחי לשאול משפחת השאולי
(224277, -63, 4);80;פ;231711;(4, 26, 15, 15, 231711);61121;(4, 26, 15, 4, 61121);לצפון;3;4;בני גד למשפחתם לצפון משפחת הצפוני לחגי משפחת החגי לשוני משפחת השוני
(224277, -63, 4);80;פ;231774;(4, 26, 16, 22, 231774);61134;(4, 26, 16, 5, 61134);משפחת;3;5;לאזני משפחת האזני לערי משפחת הערי
(224277, -63, 4);70;ע;231837;(4, 26, 18, 24, 231837);61147;(4, 26, 18, 6, 61147);ארבעים;4;6;אלה משפחת בני גד לפקדיהם ארבעים אלף וחמש מאות
(224277, -63, 4);300;ש;231900;(4, 26, 20, 16, 231900);61163;(4, 26, 20, 4, 61163);למשפחתם;3;4;ויהיו בני יהודה למשפחתם לשלה משפחת השלני לפרץ משפחת הפרצי לזרח משפחת הזרחי
(224277, -63, 4);40;מ;231963;(4, 26, 21, 17, 231963);61177;(4, 26, 21, 5, 61177);משפחת;1;5;ויהיו בני פרץ לחצרן משפחת החצרני לחמול משפחת החמולי
(224277, -63, 4);40;מ;232026;(4, 26, 22, 37, 232026);61190;(4, 26, 22, 9, 61190);מאות;1;9;אלה משפחת יהודה לפקדיהם ששה ושבעים אלף וחמש מאות
(224277, -63, 4);30;ל;232089;(4, 26, 24, 16, 232089);61203;(4, 26, 24, 4, 61203);לשמרן;1;4;לישוב משפחת הישבי לשמרן משפחת השמרני
(224277, -63, 4);30;ל;232152;(4, 26, 26, 7, 232152);61216;(4, 26, 26, 2, 61216);זבולן;4;2;בני זבולן למשפחתם לסרד משפחת הסרדי לאלון משפחת האלני ליחלאל משפחת היחלאלי
(224277, -63, 4);400;ת;232215;(4, 26, 27, 8, 232215);61228;(4, 26, 27, 2, 61228);משפחת;5;2;אלה משפחת הזבולני לפקדיהם ששים אלף וחמש מאות
(224277, -63, 4);20;כ;232278;(4, 26, 29, 10, 232278);61242;(4, 26, 29, 3, 61242);למכיר;3;3;בני מנשה למכיר משפחת המכירי ומכיר הוליד את גלעד לגלעד משפחת הגלעדי
(224277, -63, 4);80;פ;232341;(4, 26, 30, 18, 232341);61256;(4, 26, 30, 5, 61256);משפחת;3;5;אלה בני גלעד איעזר משפחת האיעזרי לחלק משפחת החלקי
(224277, -63, 4);40;מ;232404;(4, 26, 32, 7, 232404);61268;(4, 26, 32, 2, 61268);משפחת;1;2;ושמידע משפחת השמידעי וחפר משפחת החפרי
(224277, -63, 4);90;צ;232467;(4, 26, 33, 38, 232467);61285;(4, 26, 33, 13, 61285);צלפחד;1;13;וצלפחד בן חפר לא היו לו בנים כי אם בנות ושם בנות צלפחד מחלה ונעה חגלה מלכה ותרצה
(224277, -63, 4);1;א;232530;(4, 26, 34, 38, 232530);61299;(4, 26, 34, 9, 61299);מאות;2;9;אלה משפחת מנשה ופקדיהם שנים וחמשים אלף ושבע מאות
(224277, -63, 4);8;ח;232593;(4, 26, 35, 61, 232593);61312;(4, 26, 35, 13, 61312);התחני;3;13;אלה בני אפרים למשפחתם לשותלח משפחת השתלחי לבכר משפחת הבכרי לתחן משפחת התחני
(224277, -63, 4);30;ל;232656;(4, 26, 37, 35, 232656);61326;(4, 26, 37, 8, 61326);אלף;2;8;אלה משפחת בני אפרים לפקדיהם שנים ושלשים אלף וחמש מאות אלה בני יוסף למשפחתם
(224277, -63, 4);80;פ;232719;(4, 26, 38, 37, 232719);61340;(4, 26, 38, 8, 61340);משפחת;3;8;בני בנימן למשפחתם לבלע משפחת הבלעי לאשבל משפחת האשבלי לאחירם משפחת האחירמי
(224277, -63, 4);10;י;232782;(4, 26, 40, 4, 232782);61351;(4, 26, 40, 1, 61351);ויהיו;4;1;ויהיו בני בלע ארד ונעמן משפחת הארדי לנעמן משפחת הנעמי
(224277, -63, 4);10;י;232845;(4, 26, 41, 23, 232845);61365;(4, 26, 41, 5, 61365);ופקדיהם;5;5;אלה בני בנימן למשפחתם ופקדיהם חמשה וארבעים אלף ושש מאות
(224277, -63, 4);4;ד;232908;(4, 26, 42, 40, 232908);61380;(4, 26, 42, 10, 61380);דן;1;10;אלה בני דן למשפחתם לשוחם משפחת השוחמי אלה משפחת דן למשפחתם
(224277, -63, 4);40;ם;232971;(4, 26, 44, 13, 232971);61393;(4, 26, 44, 3, 61393);למשפחתם;7;3;בני אשר למשפחתם לימנה משפחת הימנה לישוי משפחת הישוי לבריעה משפחת הבריעי
(224277, -63, 4);80;פ;233034;(4, 26, 45, 16, 233034);61406;(4, 26, 45, 4, 61406);משפחת;3;4;לבני בריעה לחבר משפחת החברי למלכיאל משפחת המלכיאלי
(224277, -63, 4);5;ה;233097;(4, 26, 47, 25, 233097);61420;(4, 26, 47, 6, 61420);שלשה;4;6;אלה משפחת בני אשר לפקדיהם שלשה וחמשים אלף וארבע מאות
(224277, -63, 4);3;ג;233160;(4, 26, 48, 45, 233160);61433;(4, 26, 48, 9, 61433);הגוני;2;9;בני נפתלי למשפחתם ליחצאל משפחת היחצאלי לגוני משפחת הגוני
(224277, -63, 4);6;ו;233223;(4, 26, 50, 32, 233223);61446;(4, 26, 50, 7, 61446);וארבעים;1;7;אלה משפחת נפתלי למשפחתם ופקדיהם חמשה וארבעים אלף וארבע מאות
(224277, -63, 4);4;ד;233286;(4, 26, 52, 3, 233286);61461;(4, 26, 52, 1, 61461);וידבר;3;1;וידבר יהוה אל משה לאמר
(224277, -63, 4);9;ט;233349;(4, 26, 54, 22, 233349);61476;(4, 26, 54, 5, 61476);תמעיט;5;5;לרב תרבה נחלתו ולמעט תמעיט נחלתו איש לפי פקדיו יתן נחלתו
(224277, -63, 4);10;י;233412;(4, 26, 56, 4, 233412);61493;(4, 26, 56, 2, 61493);פי;2;2;על פי הגורל תחלק נחלתו בין רב למעט
(224277, -63, 4);5;ה;233475;(4, 26, 57, 40, 233475);61507;(4, 26, 57, 8, 61507);לקהת;3;8;ואלה פקודי הלוי למשפחתם לגרשון משפחת הגרשני לקהת משפחת הקהתי למררי משפחת המררי
(224277, -63, 4);400;ת;233538;(4, 26, 58, 37, 233538);61520;(4, 26, 58, 8, 61520);משפחת;5;8;אלה משפחת לוי משפחת הלבני משפחת החברני משפחת המחלי משפחת המושי משפחת הקרחי וקהת הולד את עמרם
(224277, -63, 4);10;י;233601;(4, 26, 59, 24, 233601);61537;(4, 26, 59, 8, 61537);ילדה;1;8;ושם אשת עמרם יוכבד בת לוי אשר ילדה אתה ללוי במצרים ותלד לעמרם את אהרן ואת משה ואת מרים אחתם
(224277, -63, 4);2;ב;233664;(4, 26, 60, 15, 233664);61553;(4, 26, 60, 4, 61553);נדב;3;4;ויולד לאהרן את נדב ואת אביהוא את אלעזר ואת איתמר
(224277, -63, 4);6;ו;233727;(4, 26, 62, 5, 233727);61568;(4, 26, 62, 1, 61568);ויהיו;5;1;ויהיו פקדיהם שלשה ועשרים אלף כל זכר מבן חדש ומעלה כי לא התפקדו בתוך בני ישראל כי לא נתן להם נחלה בתוך בני ישראל
(224277, -63, 4);400;ת;233790;(4, 26, 62, 68, 233790);61586;(4, 26, 62, 19, 61586);נתן;2;19;ויהיו פקדיהם שלשה ועשרים אלף כל זכר מבן חדש ומעלה כי לא התפקדו בתוך בני ישראל כי לא נתן להם נחלה בתוך בני ישראל
(224277, -63, 4);400;ת;233853;(4, 26, 63, 43, 233853);61602;(4, 26, 63, 11, 61602);בערבת;5;11;אלה פקודי משה ואלעזר הכהן אשר פקדו את בני ישראל בערבת מואב על ירדן ירחו
(224277, -63, 4);2;ב;233916;(4, 26, 64, 49, 233916);61620;(4, 26, 64, 14, 61620);במדבר;1;14;ובאלה לא היה איש מפקודי משה ואהרן הכהן אשר פקדו את בני ישראל במדבר סיני
(224277, -63, 4);300;ש;233979;(4, 26, 65, 55, 233979);61638;(4, 26, 65, 17, 61638);ויהושע;5;17;כי אמר יהוה להם מות ימתו במדבר ולא נותר מהם איש כי אם כלב בן יפנה ויהושע בן נון
(224277, -63, 4);1;א;234042;(4, 27, 1, 57, 234042);61656;(4, 27, 1, 16, 61656);ואלה;2;16;ותקרבנה בנות צלפחד בן חפר בן גלעד בן מכיר בן מנשה למשפחת מנשה בן יוסף ואלה שמות בנתיו מחלה נעה וחגלה ומלכה ותרצה
(224277, -63, 4);30;ל;234105;(4, 27, 2, 30, 234105);61670;(4, 27, 2, 7, 61670);ולפני;2;7;ותעמדנה לפני משה ולפני אלעזר הכהן ולפני הנשיאם וכל העדה פתח אהל מועד לאמר
(224277, -63, 4);70;ע;234168;(4, 27, 3, 33, 234168);61686;(4, 27, 3, 9, 61686);הנועדים;4;9;אבינו מת במדבר והוא לא היה בתוך העדה הנועדים על יהוה בעדת קרח כי בחטאו מת ובנים לא היו לו
(224277, -63, 4);10;י;234231;(4, 27, 4, 26, 234231);61704;(4, 27, 4, 7, 61704);כי;2;7;למה יגרע שם אבינו מתוך משפחתו כי אין לו בן תנה לנו אחזה בתוך אחי אבינו
(224277, -63, 4);30;ל;234294;(4, 27, 6, 11, 234294);61722;(4, 27, 6, 3, 61722);אל;2;3;ויאמר יהוה אל משה לאמר
(224277, -63, 4);400;ת;234357;(4, 27, 7, 56, 234357);61739;(4, 27, 7, 15, 61739);נחלת;4;15;כן בנות צלפחד דברת נתן תתן להם אחזת נחלה בתוך אחי אביהם והעברת את נחלת אביהן להן
(224277, -63, 4);6;ו;234420;(4, 27, 9, 1, 234420);61757;(4, 27, 9, 1, 61757);ואם;1;1;ואם אין לו בת ונתתם את נחלתו לאחיו
(224277, -63, 4);10;י;234483;(4, 27, 11, 5, 234483);61775;(4, 27, 11, 2, 61775);אין;2;2;ואם אין אחים לאביו ונתתם את נחלתו לשארו הקרב אליו ממשפחתו וירש אתה והיתה לבני ישראל לחקת משפט כאשר צוה יהוה את משה
(224277, -63, 4);30;ל;234546;(4, 27, 11, 68, 234546);61789;(4, 27, 11, 16, 61789);ישראל;5;16;ואם אין אחים לאביו ונתתם את נחלתו לשארו הקרב אליו ממשפחתו וירש אתה והיתה לבני ישראל לחקת משפט כאשר צוה יהוה את משה
(224277, -63, 4);200;ר;234609;(4, 27, 12, 39, 234609);61808;(4, 27, 12, 12, 61808);הארץ;3;12;ויאמר יהוה אל משה עלה אל הר העברים הזה וראה את הארץ אשר נתתי לבני ישראל
(224277, -63, 4);200;ר;234672;(4, 27, 14, 4, 234672);61824;(4, 27, 14, 1, 61824);כאשר;4;1;כאשר מריתם פי במדבר צן במריבת העדה להקדישני במים לעיניהם הם מי מריבת קדש מדבר צן
(224277, -63, 4);10;י;234735;(4, 27, 15, 2, 234735);61840;(4, 27, 15, 1, 61840);וידבר;2;1;וידבר משה אל יהוה לאמר
(224277, -63, 4);300;ש;234798;(4, 27, 17, 15, 234798);61857;(4, 27, 17, 4, 61857);ואשר;3;4;אשר יצא לפניהם ואשר יבא לפניהם ואשר יוציאם ואשר יביאם ולא תהיה עדת יהוה כצאן אשר אין להם רעה
(224277, -63, 4);40;מ;234861;(4, 27, 18, 4, 234861);61873;(4, 27, 18, 1, 61873);ויאמר;4;1;ויאמר יהוה אל משה קח לך את יהושע בן נון איש אשר רוח בו וסמכת את ידך עליו
(224277, -63, 4);50;נ;234924;(4, 27, 19, 12, 234924);61893;(4, 27, 19, 3, 61893);לפני;3;3;והעמדת אתו לפני אלעזר הכהן ולפני כל העדה וצויתה אתו לעיניהם
(224277, -63, 4);70;ע;234987;(4, 27, 20, 26, 234987);61908;(4, 27, 20, 7, 61908);עדת;1;7;ונתתה מהודך עליו למען ישמעו כל עדת בני ישראל
(224277, -63, 4);6;ו;235050;(4, 27, 21, 53, 235050);61924;(4, 27, 21, 14, 61924);ועל;1;14;ולפני אלעזר הכהן יעמד ושאל לו במשפט האורים לפני יהוה על פיו יצאו ועל פיו יבאו הוא וכל בני ישראל אתו וכל העדה
(224277, -63, 4);6;ו;235113;(4, 27, 22, 30, 235113);61942;(4, 27, 22, 9, 61942);יהושע;3;9;ויעש משה כאשר צוה יהוה אתו ויקח את יהושע ויעמדהו לפני אלעזר הכהן ולפני כל העדה
(224277, -63, 4);5;ה;235176;(4, 27, 23, 30, 235176);61957;(4, 27, 23, 8, 61957);יהוה;2;8;ויסמך את ידיו עליו ויצוהו כאשר דבר יהוה ביד משה
(224277, -63, 4);200;ר;235239;(4, 28, 2, 37, 235239);61975;(4, 28, 2, 11, 61975);ריח;1;11;צו את בני ישראל ואמרת אלהם את קרבני לחמי לאשי ריח ניחחי תשמרו להקריב לי במועדו
(224277, -63, 4);300;ש;235302;(4, 28, 3, 37, 235302);61990;(4, 28, 3, 10, 61990);שנה;1;10;ואמרת להם זה האשה אשר תקריבו ליהוה כבשים בני שנה תמימם שנים ליום עלה תמיד
(224277, -63, 4);40;ם;235365;(4, 28, 4, 41, 235365);62006;(4, 28, 4, 11, 62006);הערבים;6;11;את הכבש אחד תעשה בבקר ואת הכבש השני תעשה בין הערבים
(224277, -63, 4);200;ר;235428;(4, 28, 6, 21, 235428);62021;(4, 28, 6, 6, 62021);לריח;2;6;עלת תמיד העשיה בהר סיני לריח ניחח אשה ליהוה
(224277, -63, 4);300;ש;235491;(4, 28, 8, 9, 235491);62037;(4, 28, 8, 3, 62037);השני;2;3;ואת הכבש השני תעשה בין הערבים כמנחת הבקר וכנסכו תעשה אשה ריח ניחח ליהוה
(224277, -63, 4);2;ב;235554;(4, 28, 9, 14, 235554);62052;(4, 28, 9, 4, 62052);כבשים;2;4;וביום השבת שני כבשים בני שנה תמימם ושני עשרנים סלת מנחה בלולה בשמן ונסכו
(224277, -63, 4);400;ת;235617;(4, 28, 10, 18, 235617);62068;(4, 28, 10, 6, 62068);התמיד;2;6;עלת שבת בשבתו על עלת התמיד ונסכה
(224277, -63, 4);10;י;235680;(4, 28, 11, 55, 235680);62082;(4, 28, 11, 13, 62082);בני;3;13;ובראשי חדשיכם תקריבו עלה ליהוה פרים בני בקר שנים ואיל אחד כבשים בני שנה שבעה תמימם
(224277, -63, 4);5;ה;235743;(4, 28, 12, 51, 235743);62097;(4, 28, 12, 12, 62097);מנחה;4;12;ושלשה עשרנים סלת מנחה בלולה בשמן לפר האחד ושני עשרנים סלת מנחה בלולה בשמן לאיל האחד
(224277, -63, 4);300;ש;235806;(4, 28, 13, 46, 235806);62113;(4, 28, 13, 12, 62113);אשה;2;12;ועשרן עשרון סלת מנחה בלולה בשמן לכבש האחד עלה ריח ניחח אשה ליהוה
(224277, -63, 4);30;ל;235869;(4, 28, 14, 57, 235869);62128;(4, 28, 14, 14, 62128);עלת;2;14;ונסכיהם חצי ההין יהיה לפר ושלישת ההין לאיל ורביעת ההין לכבש יין זאת עלת חדש בחדשו לחדשי השנה
(224277, -63, 4);4;ד;235932;(4, 28, 16, 4, 235932);62143;(4, 28, 16, 1, 62143);ובחדש;4;1;ובחדש הראשון בארבעה עשר יום לחדש פסח ליהוה
(224277, -63, 4);6;ו;235995;(4, 28, 17, 32, 235995);62159;(4, 28, 17, 9, 62159);מצות;3;9;ובחמשה עשר יום לחדש הזה חג שבעת ימים מצות יאכל
(224277, -63, 4);50;נ;236058;(4, 28, 19, 24, 236058);62175;(4, 28, 19, 6, 62175);בני;2;6;והקרבתם אשה עלה ליהוה פרים בני בקר שנים ואיל אחד ושבעה כבשים בני שנה תמימם יהיו לכם
(224277, -63, 4);30;ל;236121;(4, 28, 20, 20, 236121);62191;(4, 28, 20, 5, 62191);שלשה;2;5;ומנחתם סלת בלולה בשמן שלשה עשרנים לפר ושני עשרנים לאיל תעשו
(224277, -63, 4);6;ו;236184;(4, 28, 22, 1, 236184);62205;(4, 28, 22, 1, 62205);ושעיר;1;1;ושעיר חטאת אחד לכפר עליכם
(224277, -63, 4);6;ו;236247;(4, 28, 24, 11, 236247);62221;(4, 28, 24, 3, 62221);ליום;3;3;כאלה תעשו ליום שבעת ימים לחם אשה ריח ניחח ליהוה על עולת התמיד יעשה ונסכו
(224277, -63, 4);100;ק;236310;(4, 28, 25, 16, 236310);62237;(4, 28, 25, 4, 62237);קדש;1;4;וביום השביעי מקרא קדש יהיה לכם כל מלאכת עבדה לא תעשו
(224277, -63, 4);70;ע;236373;(4, 28, 26, 37, 236373);62251;(4, 28, 26, 7, 62251);בשבעתיכם;4;7;וביום הבכורים בהקריבכם מנחה חדשה ליהוה בשבעתיכם מקרא קדש יהיה לכם כל מלאכת עבדה לא תעשו
(224277, -63, 4);40;ם;236436;(4, 28, 27, 28, 236436);62266;(4, 28, 27, 6, 62266);פרים;4;6;והקרבתם עולה לריח ניחח ליהוה פרים בני בקר שנים איל אחד שבעה כבשים בני שנה
(224277, -63, 4);5;ה;236499;(4, 28, 28, 32, 236499);62283;(4, 28, 28, 8, 62283);האחד;1;8;ומנחתם סלת בלולה בשמן שלשה עשרנים לפר האחד שני עשרנים לאיל האחד
(224277, -63, 4);80;פ;236562;(4, 28, 30, 14, 236562);62297;(4, 28, 30, 4, 62297);לכפר;3;4;שעיר עזים אחד לכפר עליכם
(224277, -63, 4);30;ל;236625;(4, 29, 1, 16, 236625);62311;(4, 29, 1, 4, 62311);לחדש;1;4;ובחדש השביעי באחד לחדש מקרא קדש יהיה לכם כל מלאכת עבדה לא תעשו יום תרועה יהיה לכם
(224277, -63, 4);50;נ;236688;(4, 29, 2, 14, 236688);62328;(4, 29, 2, 4, 62328);ניחח;1;4;ועשיתם עלה לריח ניחח ליהוה פר בן בקר אחד איל אחד כבשים בני שנה שבעה תמימם
(224277, -63, 4);300;ש;236751;(4, 29, 3, 19, 236751);62345;(4, 29, 3, 5, 62345);שלשה;1;5;ומנחתם סלת בלולה בשמן שלשה עשרנים לפר שני עשרנים לאיל
(224277, -63, 4);1;א;236814;(4, 29, 5, 10, 236814);62359;(4, 29, 5, 3, 62359);אחד;1;3;ושעיר עזים אחד חטאת לכפר עליכם
(224277, -63, 4);10;י;236877;(4, 29, 6, 48, 236877);62372;(4, 29, 6, 10, 62372);לריח;3;10;מלבד עלת החדש ומנחתה ועלת התמיד ומנחתה ונסכיהם כמשפטם לריח ניחח אשה ליהוה
(224277, -63, 4);30;ל;236940;(4, 29, 7, 50, 236940);62387;(4, 29, 7, 12, 62387);כל;2;12;ובעשור לחדש השביעי הזה מקרא קדש יהיה לכם ועניתם את נפשתיכם כל מלאכה לא תעשו
(224277, -63, 4);70;ע;237003;(4, 29, 8, 52, 237003);62405;(4, 29, 8, 15, 62405);שבעה;3;15;והקרבתם עלה ליהוה ריח ניחח פר בן בקר אחד איל אחד כבשים בני שנה שבעה תמימם יהיו לכם
(224277, -63, 4);300;ש;237066;(4, 29, 10, 2, 237066);62420;(4, 29, 10, 1, 62420);עשרון;2;1;עשרון עשרון לכבש האחד לשבעת הכבשים
(224277, -63, 4);40;מ;237129;(4, 29, 11, 36, 237129);62434;(4, 29, 11, 9, 62434);התמיד;3;9;שעיר עזים אחד חטאת מלבד חטאת הכפרים ועלת התמיד ומנחתה ונסכיהם
(224277, -63, 4);30;ל;237192;(4, 29, 12, 48, 237192);62449;(4, 29, 12, 13, 62449);לא;1;13;ובחמשה עשר יום לחדש השביעי מקרא קדש יהיה לכם כל מלאכת עבדה לא תעשו וחגתם חג ליהוה שבעת ימים
(224277, -63, 4);300;ש;237255;(4, 29, 13, 38, 237255);62465;(4, 29, 13, 10, 62465);שלשה;3;10;והקרבתם עלה אשה ריח ניחח ליהוה פרים בני בקר שלשה עשר אילם שנים כבשים בני שנה ארבעה עשר תמימם יהיו
(224277, -63, 4);70;ע;237318;(4, 29, 14, 23, 237318);62481;(4, 29, 14, 6, 62481);עשרנים;1;6;ומנחתם סלת בלולה בשמן שלשה עשרנים לפר האחד לשלשה עשר פרים שני עשרנים לאיל האחד לשני האילם
(224277, -63, 4);20;כ;237381;(4, 29, 15, 13, 237381);62495;(4, 29, 15, 3, 62495);לכבש;2;3;ועשרון עשרון לכבש האחד לארבעה עשר כבשים
(224277, -63, 4);40;ם;237444;(4, 29, 17, 5, 237444);62509;(4, 29, 17, 1, 62509);וביום;5;1;וביום השני פרים בני בקר שנים עשר אילם שנים כבשים בני שנה ארבעה עשר תמימם
(224277, -63, 4);20;כ;237507;(4, 29, 18, 10, 237507);62525;(4, 29, 18, 2, 62525);ונסכיהם;4;2;ומנחתם ונסכיהם לפרים לאילם ולכבשים במספרם כמשפט
(224277, -63, 4);8;ח;237570;(4, 29, 19, 32, 237570);62538;(4, 29, 19, 8, 62538);ומנחתה;4;8;ושעיר עזים אחד חטאת מלבד עלת התמיד ומנחתה ונסכיהם
(224277, -63, 4);40;ם;237633;(4, 29, 20, 54, 237633);62552;(4, 29, 20, 13, 62552);תמימם;5;13;וביום השלישי פרים עשתי עשר אילם שנים כבשים בני שנה ארבעה עשר תמימם
(224277, -63, 4);40;מ;237696;(4, 29, 22, 22, 237696);62565;(4, 29, 22, 6, 62565);התמיד;3;6;ושעיר חטאת אחד מלבד עלת התמיד ומנחתה ונסכה
(224277, -63, 4);40;מ;237759;(4, 29, 23, 50, 237759);62579;(4, 29, 23, 12, 62579);תמימם;4;12;וביום הרביעי פרים עשרה אילם שנים כבשים בני שנה ארבעה עשר תמימם
(224277, -63, 4);30;ל;237822;(4, 29, 25, 22, 237822);62592;(4, 29, 25, 6, 62592);עלת;2;6;ושעיר עזים אחד חטאת מלבד עלת התמיד מנחתה ונסכה
(224277, -63, 4);400;ת;237885;(4, 29, 26, 47, 237885);62607;(4, 29, 26, 12, 62607);תמימם;1;12;וביום החמישי פרים תשעה אילם שנים כבשים בני שנה ארבעה עשר תמימם
(224277, -63, 4);30;ל;237948;(4, 29, 28, 18, 237948);62619;(4, 29, 28, 5, 62619);עלת;2;5;ושעיר חטאת אחד מלבד עלת התמיד ומנחתה ונסכה
(224277, -63, 4);40;מ;238011;(4, 29, 29, 46, 238011);62634;(4, 29, 29, 12, 62634);תמימם;2;12;וביום הששי פרים שמנה אילם שנים כבשים בני שנה ארבעה עשר תמימם
(224277, -63, 4);400;ת;238074;(4, 29, 31, 19, 238074);62646;(4, 29, 31, 5, 62646);עלת;3;5;ושעיר חטאת אחד מלבד עלת התמיד מנחתה ונסכיה
(224277, -63, 4);400;ת;238137;(4, 29, 32, 47, 238137);62661;(4, 29, 32, 12, 62661);תמימם;1;12;וביום השביעי פרים שבעה אילם שנים כבשים בני שנה ארבעה עשר תמימם
(224277, -63, 4);30;ל;238200;(4, 29, 34, 18, 238200);62673;(4, 29, 34, 5, 62673);עלת;2;5;ושעיר חטאת אחד מלבד עלת התמיד מנחתה ונסכה
(224277, -63, 4);30;ל;238263;(4, 29, 36, 9, 238263);62688;(4, 29, 36, 2, 62688);עלה;2;2;והקרבתם עלה אשה ריח ניחח ליהוה פר אחד איל אחד כבשים בני שנה שבעה תמימם
(224277, -63, 4);30;ל;238326;(4, 29, 37, 16, 238326);62705;(4, 29, 37, 4, 62705);לאיל;1;4;מנחתם ונסכיהם לפר לאיל ולכבשים במספרם כמשפט
(224277, -63, 4);6;ו;238389;(4, 29, 39, 7, 238389);62718;(4, 29, 39, 2, 62718);תעשו;4;2;אלה תעשו ליהוה במועדיכם לבד מנדריכם ונדבתיכם לעלתיכם ולמנחתיכם ולנסכיכם ולשלמיכם
