(224118, -61, 4);10;י;78084;(2, 1, 1, 20, 78084);20617;(2, 1, 1, 5, 20617);הבאים;4;5;ואלה שמות בני ישראל הבאים מצרימה את יעקב איש וביתו באו
(224118, -61, 4);50;ן;78145;(2, 1, 4, 2, 78145);20631;(2, 1, 4, 1, 20631);דן;2;1;דן ונפתלי גד ואשר
(224118, -61, 4);60;ס;78206;(2, 1, 6, 7, 78206);20647;(2, 1, 6, 2, 20647);יוסף;3;2;וימת יוסף וכל אחיו וכל הדור ההוא
(224118, -61, 4);5;ה;78267;(2, 1, 7, 42, 78267);20662;(2, 1, 7, 10, 20662);הארץ;1;10;ובני ישראל פרו וישרצו וירבו ויעצמו במאד מאד ותמלא הארץ אתם
(224118, -61, 4);200;ר;78328;(2, 1, 9, 24, 78328);20681;(2, 1, 9, 8, 20681);רב;1;8;ויאמר אל עמו הנה עם בני ישראל רב ועצום ממנו
(224118, -61, 4);50;נ;78389;(2, 1, 10, 51, 78389);20697;(2, 1, 10, 14, 20697);שנאינו;5;14;הבה נתחכמה לו פן ירבה והיה כי תקראנה מלחמה ונוסף גם הוא על שנאינו ונלחם בנו ועלה מן הארץ
(224118, -61, 4);50;נ;78450;(2, 1, 11, 42, 78450);20712;(2, 1, 11, 10, 20712);מסכנות;4;10;וישימו עליו שרי מסים למען ענתו בסבלתם ויבן ערי מסכנות לפרעה את פתם ואת רעמסס
(224118, -61, 4);1;א;78511;(2, 1, 12, 41, 78511);20728;(2, 1, 12, 11, 20728);ישראל;4;11;וכאשר יענו אתו כן ירבה וכן יפרץ ויקצו מפני בני ישראל
(224118, -61, 4);20;כ;78572;(2, 1, 14, 35, 78572);20742;(2, 1, 14, 8, 20742);ובכל;3;8;וימררו את חייהם בעבדה קשה בחמר ובלבנים ובכל עבדה בשדה את כל עבדתם אשר עבדו בהם בפרך
(224118, -61, 4);300;ש;78633;(2, 1, 15, 29, 78633);20758;(2, 1, 15, 7, 20758);שם;1;7;ויאמר מלך מצרים למילדת העברית אשר שם האחת שפרה ושם השנית פועה
(224118, -61, 4);6;ו;78694;(2, 1, 16, 40, 78694);20773;(2, 1, 16, 10, 20773);הוא;2;10;ויאמר בילדכן את העבריות וראיתן על האבנים אם בן הוא והמתן אתו ואם בת הוא וחיה
(224118, -61, 4);30;ל;78755;(2, 1, 17, 40, 78755);20789;(2, 1, 17, 10, 20789);מלך;2;10;ותיראן המילדת את האלהים ולא עשו כאשר דבר אליהן מלך מצרים ותחיין את הילדים
(224118, -61, 4);5;ה;78816;(2, 1, 18, 41, 78816);20803;(2, 1, 18, 10, 20803);הזה;1;10;ויקרא מלך מצרים למילדת ויאמר להן מדוע עשיתן הדבר הזה ותחיין את הילדים
(224118, -61, 4);400;ת;78877;(2, 1, 19, 45, 78877);20817;(2, 1, 19, 11, 20817);חיות;4;11;ותאמרן המילדת אל פרעה כי לא כנשים המצרית העברית כי חיות הנה בטרם תבוא אלהן המילדת וילדו
(224118, -61, 4);5;ה;78938;(2, 1, 21, 3, 78938);20831;(2, 1, 21, 1, 20831);ויהי;3;1;ויהי כי יראו המילדת את האלהים ויעש להם בתים
(224118, -61, 4);5;ה;78999;(2, 1, 22, 29, 78999);20848;(2, 1, 22, 9, 20848);היארה;1;9;ויצו פרעה לכל עמו לאמר כל הבן הילוד היארה תשליכהו וכל הבת תחיון
(224118, -61, 4);50;ן;79060;(2, 2, 2, 14, 79060);20864;(2, 2, 2, 4, 20864);בן;2;4;ותהר האשה ותלד בן ותרא אתו כי טוב הוא ותצפנהו שלשה ירחים
(224118, -61, 4);400;ת;79121;(2, 2, 3, 30, 79121);20881;(2, 2, 3, 9, 20881);ותחמרה;2;9;ולא יכלה עוד הצפינו ותקח לו תבת גמא ותחמרה בחמר ובזפת ותשם בה את הילד ותשם בסוף על שפת היאר
(224118, -61, 4);5;ה;79182;(2, 2, 4, 19, 79182);20897;(2, 2, 4, 5, 20897);מה;2;5;ותתצב אחתו מרחק לדעה מה יעשה לו
(224118, -61, 4);60;ס;79243;(2, 2, 5, 55, 79243);20915;(2, 2, 5, 16, 20915);הסוף;2;16;ותרד בת פרעה לרחץ על היאר ונערתיה הלכת על יד היאר ותרא את התבה בתוך הסוף ותשלח את אמתה ותקחה
(224118, -61, 4);10;י;79304;(2, 2, 6, 43, 79304);20930;(2, 2, 6, 11, 20930);מילדי;2;11;ותפתח ותראהו את הילד והנה נער בכה ותחמל עליו ותאמר מילדי העברים זה
(224118, -61, 4);100;ק;79365;(2, 2, 7, 50, 79365);20945;(2, 2, 7, 13, 20945);ותינק;5;13;ותאמר אחתו אל בת פרעה האלך וקראתי לך אשה מינקת מן העברית ותינק לך את הילד
(224118, -61, 4);10;י;79426;(2, 2, 9, 15, 79426);20964;(2, 2, 9, 5, 20964);היליכי;2;5;ותאמר לה בת פרעה היליכי את הילד הזה והינקהו לי ואני אתן את שכרך ותקח האשה הילד ותניקהו
(224118, -61, 4);10;י;79487;(2, 2, 10, 7, 79487);20979;(2, 2, 10, 2, 20979);הילד;2;2;ויגדל הילד ותבאהו לבת פרעה ויהי לה לבן ותקרא שמו משה ותאמר כי מן המים משיתהו
(224118, -61, 4);40;מ;79548;(2, 2, 11, 7, 79548);20995;(2, 2, 11, 2, 20995);בימים;3;2;ויהי בימים ההם ויגדל משה ויצא אל אחיו וירא בסבלתם וירא איש מצרי מכה איש עברי מאחיו
(224118, -61, 4);10;י;79609;(2, 2, 12, 2, 79609);21011;(2, 2, 12, 1, 21011);ויפן;2;1;ויפן כה וכה וירא כי אין איש ויך את המצרי ויטמנהו בחול
(224118, -61, 4);50;נ;79670;(2, 2, 13, 21, 79670);21028;(2, 2, 13, 6, 21028);אנשים;2;6;ויצא ביום השני והנה שני אנשים עברים נצים ויאמר לרשע למה תכה רעך
(224118, -61, 4);50;נ;79731;(2, 2, 14, 31, 79731);21043;(2, 2, 14, 8, 21043);הלהרגני;6;8;ויאמר מי שמך לאיש שר ושפט עלינו הלהרגני אתה אמר כאשר הרגת את המצרי ויירא משה ויאמר אכן נודע הדבר
(224118, -61, 4);200;ר;79792;(2, 2, 15, 15, 79792);21059;(2, 2, 15, 4, 21059);הדבר;4;4;וישמע פרעה את הדבר הזה ויבקש להרג את משה ויברח משה מפני פרעה וישב בארץ מדין וישב על הבאר
(224118, -61, 4);40;מ;79853;(2, 2, 16, 6, 79853);21076;(2, 2, 16, 2, 21076);מדין;1;2;ולכהן מדין שבע בנות ותבאנה ותדלנה ותמלאנה את הרהטים להשקות צאן אביהן
(224118, -61, 4);40;ם;79914;(2, 2, 17, 10, 79914);21088;(2, 2, 17, 2, 21088);הרעים;5;2;ויבאו הרעים ויגרשום ויקם משה ויושען וישק את צאנם
(224118, -61, 4);400;ת;79975;(2, 2, 18, 31, 79975);21102;(2, 2, 18, 7, 21102);מהרתן;4;7;ותבאנה אל רעואל אביהן ויאמר מדוע מהרתן בא היום
(224118, -61, 4);200;ר;80036;(2, 2, 20, 5, 80036);21118;(2, 2, 20, 1, 21118);ויאמר;5;1;ויאמר אל בנתיו ואיו למה זה עזבתן את האיש קראן לו ויאכל לחם
(224118, -61, 4);10;י;80097;(2, 2, 21, 20, 80097);21136;(2, 2, 21, 6, 21136);ויתן;2;6;ויואל משה לשבת את האיש ויתן את צפרה בתו למשה
(224118, -61, 4);2;ב;80158;(2, 2, 23, 5, 80158);21154;(2, 2, 23, 2, 21154);בימים;1;2;ויהי בימים הרבים ההם וימת מלך מצרים ויאנחו בני ישראל מן העבדה ויזעקו ותעל שועתם אל האלהים מן העבדה
(224118, -61, 4);1;א;80219;(2, 2, 23, 66, 80219);21168;(2, 2, 23, 16, 21168);אל;1;16;ויהי בימים הרבים ההם וימת מלך מצרים ויאנחו בני ישראל מן העבדה ויזעקו ותעל שועתם אל האלהים מן העבדה
(224118, -61, 4);100;ק;80280;(2, 2, 24, 47, 80280);21183;(2, 2, 24, 12, 21183);יצחק;4;12;וישמע אלהים את נאקתם ויזכר אלהים את בריתו את אברהם את יצחק ואת יעקב
(224118, -61, 4);50;ן;80341;(2, 3, 1, 26, 80341);21200;(2, 3, 1, 8, 21200);כהן;3;8;ומשה היה רעה את צאן יתרו חתנו כהן מדין וינהג את הצאן אחר המדבר ויבא אל הר האלהים חרבה
(224118, -61, 4);400;ת;80402;(2, 3, 2, 20, 80402);21216;(2, 3, 2, 5, 21216);בלבת;4;5;וירא מלאך יהוה אליו בלבת אש מתוך הסנה וירא והנה הסנה בער באש והסנה איננו אכל
(224118, -61, 4);1;א;80463;(2, 3, 3, 20, 80463);21233;(2, 3, 3, 6, 21233);את;1;6;ויאמר משה אסרה נא ואראה את המראה הגדל הזה מדוע לא יבער הסנה
(224118, -61, 4);6;ו;80524;(2, 3, 4, 34, 80524);21249;(2, 3, 4, 9, 21249);מתוך;3;9;וירא יהוה כי סר לראות ויקרא אליו אלהים מתוך הסנה ויאמר משה משה ויאמר הנני
(224118, -61, 4);40;ם;80585;(2, 3, 5, 36, 80585);21265;(2, 3, 5, 10, 21265);המקום;5;10;ויאמר אל תקרב הלם של נעליך מעל רגליך כי המקום אשר אתה עומד עליו אדמת קדש הוא
(224118, -61, 4);30;ל;80646;(2, 3, 6, 37, 80646);21281;(2, 3, 6, 9, 21281);ואלהי;3;9;ויאמר אנכי אלהי אביך אלהי אברהם אלהי יצחק ואלהי יעקב ויסתר משה פניו כי ירא מהביט אל האלהים
(224118, -61, 4);10;י;80707;(2, 3, 7, 25, 80707);21297;(2, 3, 7, 7, 21297);עמי;3;7;ויאמר יהוה ראה ראיתי את עני עמי אשר במצרים ואת צעקתם שמעתי מפני נגשיו כי ידעתי את מכאביו
(224118, -61, 4);90;צ;80768;(2, 3, 8, 15, 80768);21312;(2, 3, 8, 4, 21312);מצרים;2;4;וארד להצילו מיד מצרים ולהעלתו מן הארץ ההוא אל ארץ טובה ורחבה אל ארץ זבת חלב ודבש אל מקום הכנעני והחתי והאמרי והפרזי והחוי והיבוסי
(224118, -61, 4);10;י;80829;(2, 3, 8, 76, 80829);21328;(2, 3, 8, 20, 21328);הכנעני;6;20;וארד להצילו מיד מצרים ולהעלתו מן הארץ ההוא אל ארץ טובה ורחבה אל ארץ זבת חלב ודבש אל מקום הכנעני והחתי והאמרי והפרזי והחוי והיבוסי
(224118, -61, 4);400;ת;80890;(2, 3, 9, 32, 80890);21342;(2, 3, 9, 9, 21342);ראיתי;4;9;ועתה הנה צעקת בני ישראל באה אלי וגם ראיתי את הלחץ אשר מצרים לחצים אתם
(224118, -61, 4);40;מ;80951;(2, 3, 10, 38, 80951);21359;(2, 3, 10, 11, 21359);ממצרים;1;11;ועתה לכה ואשלחך אל פרעה והוצא את עמי בני ישראל ממצרים
(224118, -61, 4);10;י;81012;(2, 3, 11, 56, 81012);21375;(2, 3, 11, 16, 21375);ממצרים;5;16;ויאמר משה אל האלהים מי אנכי כי אלך אל פרעה וכי אוציא את בני ישראל ממצרים
(224118, -61, 4);1;א;81073;(2, 3, 12, 60, 81073);21391;(2, 3, 12, 16, 21391);את;1;16;ויאמר כי אהיה עמך וזה לך האות כי אנכי שלחתיך בהוציאך את העם ממצרים תעבדון את האלהים על ההר הזה
(224118, -61, 4);30;ל;81134;(2, 3, 13, 46, 81134);21408;(2, 3, 13, 13, 21408);אלהי;2;13;ויאמר משה אל האלהים הנה אנכי בא אל בני ישראל ואמרתי להם אלהי אבותיכם שלחני אליכם ואמרו לי מה שמו מה אמר אלהם
(224118, -61, 4);300;ש;81195;(2, 3, 14, 21, 81195);21424;(2, 3, 14, 6, 21424);אשר;2;6;ויאמר אלהים אל משה אהיה אשר אהיה ויאמר כה תאמר לבני ישראל אהיה שלחני אליכם
(224118, -61, 4);1;א;81256;(2, 3, 15, 22, 81256);21440;(2, 3, 15, 7, 21440);תאמר;2;7;ויאמר עוד אלהים אל משה כה תאמר אל בני ישראל יהוה אלהי אבתיכם אלהי אברהם אלהי יצחק ואלהי יעקב שלחני אליכם זה שמי לעלם וזה זכרי לדר דר
(224118, -61, 4);20;כ;81317;(2, 3, 15, 83, 81317);21454;(2, 3, 15, 21, 21454);אליכם;4;21;ויאמר עוד אלהים אל משה כה תאמר אל בני ישראל יהוה אלהי אבתיכם אלהי אברהם אלהי יצחק ואלהי יעקב שלחני אליכם זה שמי לעלם וזה זכרי לדר דר
(224118, -61, 4);10;י;81378;(2, 3, 16, 39, 81378);21471;(2, 3, 16, 10, 21471);אבתיכם;4;10;לך ואספת את זקני ישראל ואמרת אלהם יהוה אלהי אבתיכם נראה אלי אלהי אברהם יצחק ויעקב לאמר פקד פקדתי אתכם ואת העשוי לכם במצרים
(224118, -61, 4);6;ו;81439;(2, 3, 17, 1, 81439);21486;(2, 3, 17, 1, 21486);ואמר;1;1;ואמר אעלה אתכם מעני מצרים אל ארץ הכנעני והחתי והאמרי והפרזי והחוי והיבוסי אל ארץ זבת חלב ודבש
(224118, -61, 4);1;א;81500;(2, 3, 17, 62, 81500);21499;(2, 3, 17, 14, 21499);אל;1;14;ואמר אעלה אתכם מעני מצרים אל ארץ הכנעני והחתי והאמרי והפרזי והחוי והיבוסי אל ארץ זבת חלב ודבש
(224118, -61, 4);10;י;81561;(2, 3, 18, 47, 81561);21515;(2, 3, 18, 12, 21515);יהוה;1;12;ושמעו לקלך ובאת אתה וזקני ישראל אל מלך מצרים ואמרתם אליו יהוה אלהי העבריים נקרה עלינו ועתה נלכה נא דרך שלשת ימים במדבר ונזבחה ליהוה אלהינו
(224118, -61, 4);1;א;81622;(2, 3, 18, 108, 81622);21529;(2, 3, 18, 26, 21529);אלהינו;1;26;ושמעו לקלך ובאת אתה וזקני ישראל אל מלך מצרים ואמרתם אליו יהוה אלהי העבריים נקרה עלינו ועתה נלכה נא דרך שלשת ימים במדבר ונזבחה ליהוה אלהינו
(224118, -61, 4);20;כ;81683;(2, 3, 20, 14, 81683);21545;(2, 3, 20, 4, 21545);והכיתי;3;4;ושלחתי את ידי והכיתי את מצרים בכל נפלאתי אשר אעשה בקרבו ואחרי כן ישלח אתכם
(224118, -61, 4);5;ה;81744;(2, 3, 21, 15, 81744);21561;(2, 3, 21, 5, 21561);הזה;3;5;ונתתי את חן העם הזה בעיני מצרים והיה כי תלכון לא תלכו ריקם
(224118, -61, 4);6;ו;81805;(2, 3, 22, 30, 81805);21577;(2, 3, 22, 8, 21577);וכלי;1;8;ושאלה אשה משכנתה ומגרת ביתה כלי כסף וכלי זהב ושמלת ושמתם על בניכם ועל בנתיכם ונצלתם את מצרים
(224118, -61, 4);30;ל;81866;(2, 4, 1, 16, 81866);21592;(2, 4, 1, 5, 21592);לא;1;5;ויען משה ויאמר והן לא יאמינו לי ולא ישמעו בקלי כי יאמרו לא נראה אליך יהוה
(224118, -61, 4);4;ד;81927;(2, 4, 2, 19, 81927);21608;(2, 4, 2, 5, 21608);בידך;3;5;ויאמר אליו יהוה מזה בידך ויאמר מטה
(224118, -61, 4);200;ר;81988;(2, 4, 4, 5, 81988);21621;(2, 4, 4, 1, 21621);ויאמר;5;1;ויאמר יהוה אל משה שלח ידך ואחז בזנבו וישלח ידו ויחזק בו ויהי למטה בכפו
(224118, -61, 4);6;ו;82049;(2, 4, 5, 10, 82049);21637;(2, 4, 5, 2, 21637);יאמינו;6;2;למען יאמינו כי נראה אליך יהוה אלהי אבתם אלהי אברהם אלהי יצחק ואלהי יעקב
(224118, -61, 4);6;ו;82110;(2, 4, 6, 13, 82110);21653;(2, 4, 6, 4, 21653);עוד;2;4;ויאמר יהוה לו עוד הבא נא ידך בחיקך ויבא ידו בחיקו ויוצאה והנה ידו מצרעת כשלג
(224118, -61, 4);30;ל;82171;(2, 4, 7, 13, 82171);21669;(2, 4, 7, 4, 21669);אל;2;4;ויאמר השב ידך אל חיקך וישב ידו אל חיקו ויוצאה מחיקו והנה שבה כבשרו
(224118, -61, 4);300;ש;82232;(2, 4, 8, 21, 82232);21686;(2, 4, 8, 7, 21686);ישמעו;2;7;והיה אם לא יאמינו לך ולא ישמעו לקל האת הראשון והאמינו לקל האת האחרון
(224118, -61, 4);1;א;82293;(2, 4, 9, 27, 82293);21701;(2, 4, 9, 8, 21701);האלה;2;8;והיה אם לא יאמינו גם לשני האתות האלה ולא ישמעון לקלך ולקחת ממימי היאר ושפכת היבשה והיו המים אשר תקח מן היאר והיו לדם ביבשת
(224118, -61, 4);5;ה;82354;(2, 4, 9, 88, 82354);21716;(2, 4, 9, 23, 21716);והיו;2;23;והיה אם לא יאמינו גם לשני האתות האלה ולא ישמעון לקלך ולקחת ממימי היאר ושפכת היבשה והיו המים אשר תקח מן היאר והיו לדם ביבשת
(224118, -61, 4);40;מ;82415;(2, 4, 10, 51, 82415);21734;(2, 4, 10, 16, 21734);מאז;1;16;ויאמר משה אל יהוה בי אדני לא איש דברים אנכי גם מתמול גם משלשם גם מאז דברך אל עבדך כי כבד פה וכבד לשון אנכי
(224118, -61, 4);6;ו;82476;(2, 4, 11, 30, 82476);21753;(2, 4, 11, 10, 21753);ישום;3;10;ויאמר יהוה אליו מי שם פה לאדם או מי ישום אלם או חרש או פקח או עור הלא אנכי יהוה
(224118, -61, 4);200;ר;82537;(2, 4, 12, 31, 82537);21771;(2, 4, 12, 8, 21771);אשר;3;8;ועתה לך ואנכי אהיה עם פיך והוריתיך אשר תדבר
(224118, -61, 4);10;י;82598;(2, 4, 14, 34, 82598);21788;(2, 4, 14, 9, 21788);הלוי;4;9;ויחר אף יהוה במשה ויאמר הלא אהרן אחיך הלוי ידעתי כי דבר ידבר הוא וגם הנה הוא יצא לקראתך וראך ושמח בלבו
(224118, -61, 4);1;א;82659;(2, 4, 15, 14, 82659);21805;(2, 4, 15, 4, 21805);את;1;4;ודברת אליו ושמת את הדברים בפיו ואנכי אהיה עם פיך ועם פיהו והוריתי אתכם את אשר תעשון
(224118, -61, 4);30;ל;82720;(2, 4, 16, 8, 82720);21821;(2, 4, 16, 3, 21821);לך;1;3;ודבר הוא לך אל העם והיה הוא יהיה לך לפה ואתה תהיה לו לאלהים
(224118, -61, 4);300;ש;82781;(2, 4, 17, 23, 82781);21839;(2, 4, 17, 7, 21839);תעשה;3;7;ואת המטה הזה תקח בידך אשר תעשה בו את האתת
(224118, -61, 4);10;י;82842;(2, 4, 18, 52, 82842);21857;(2, 4, 18, 15, 21857);במצרים;5;15;וילך משה וישב אל יתר חתנו ויאמר לו אלכה נא ואשובה אל אחי אשר במצרים ואראה העודם חיים ויאמר יתרו למשה לך לשלום
(224118, -61, 4);200;ר;82903;(2, 4, 19, 26, 82903);21873;(2, 4, 19, 8, 21873);מצרים;3;8;ויאמר יהוה אל משה במדין לך שב מצרים כי מתו כל האנשים המבקשים את נפשך
(224118, -61, 4);6;ו;82964;(2, 4, 20, 33, 82964);21890;(2, 4, 20, 10, 21890);וישב;1;10;ויקח משה את אשתו ואת בניו וירכבם על החמר וישב ארצה מצרים ויקח משה את מטה האלהים בידו
(224118, -61, 4);10;י;83025;(2, 4, 21, 27, 83025);21905;(2, 4, 21, 7, 21905);מצרימה;4;7;ויאמר יהוה אל משה בלכתך לשוב מצרימה ראה כל המפתים אשר שמתי בידך ועשיתם לפני פרעה ואני אחזק את לבו ולא ישלח את העם
(224118, -61, 4);5;ה;83086;(2, 4, 21, 88, 83086);21922;(2, 4, 21, 24, 21922);העם;1;24;ויאמר יהוה אל משה בלכתך לשוב מצרימה ראה כל המפתים אשר שמתי בידך ועשיתם לפני פרעה ואני אחזק את לבו ולא ישלח את העם
(224118, -61, 4);1;א;83147;(2, 4, 23, 27, 83147);21938;(2, 4, 23, 7, 21938);ותמאן;4;7;ואמר אליך שלח את בני ויעבדני ותמאן לשלחו הנה אנכי הרג את בנך בכרך
(224118, -61, 4);400;ת;83208;(2, 4, 25, 2, 83208);21953;(2, 4, 25, 1, 21953);ותקח;2;1;ותקח צפרה צר ותכרת את ערלת בנה ותגע לרגליו ותאמר כי חתן דמים אתה לי
(224118, -61, 4);7;ז;83269;(2, 4, 26, 10, 83269);21970;(2, 4, 26, 3, 21970);אז;2;3;וירף ממנו אז אמרה חתן דמים למולת
(224118, -61, 4);200;ר;83330;(2, 4, 27, 45, 83330);21985;(2, 4, 27, 11, 21985);בהר;3;11;ויאמר יהוה אל אהרן לך לקראת משה המדברה וילך ויפגשהו בהר האלהים וישק לו
(224118, -61, 4);10;י;83391;(2, 4, 29, 2, 83391);22003;(2, 4, 29, 1, 22003);וילך;2;1;וילך משה ואהרן ויאספו את כל זקני בני ישראל
(224118, -61, 4);5;ה;83452;(2, 4, 30, 29, 83452);22019;(2, 4, 30, 8, 22019);יהוה;4;8;וידבר אהרן את כל הדברים אשר דבר יהוה אל משה ויעש האתת לעיני העם
(224118, -61, 4);1;א;83513;(2, 4, 31, 40, 83513);22037;(2, 4, 31, 12, 22037);את;1;12;ויאמן העם וישמעו כי פקד יהוה את בני ישראל וכי ראה את ענים ויקדו וישתחוו
(224118, -61, 4);1;א;83574;(2, 5, 1, 44, 83574);22052;(2, 5, 1, 12, 22052);ישראל;4;12;ואחר באו משה ואהרן ויאמרו אל פרעה כה אמר יהוה אלהי ישראל שלח את עמי ויחגו לי במדבר
(224118, -61, 4);10;י;83635;(2, 5, 2, 40, 83635);22070;(2, 5, 2, 12, 22070);ידעתי;1;12;ויאמר פרעה מי יהוה אשר אשמע בקלו לשלח את ישראל לא ידעתי את יהוה וגם את ישראל לא אשלח
(224118, -61, 4);300;ש;83696;(2, 5, 3, 35, 83696);22086;(2, 5, 3, 9, 22086);שלשת;1;9;ויאמרו אלהי העברים נקרא עלינו נלכה נא דרך שלשת ימים במדבר ונזבחה ליהוה אלהינו פן יפגענו בדבר או בחרב
(224118, -61, 4);90;צ;83757;(2, 5, 4, 14, 83757);22100;(2, 5, 4, 4, 22100);מצרים;2;4;ויאמר אלהם מלך מצרים למה משה ואהרן תפריעו את העם ממעשיו לכו לסבלתיכם
(224118, -61, 4);70;ע;83818;(2, 5, 5, 19, 83818);22115;(2, 5, 5, 6, 22115);עם;1;6;ויאמר פרעה הן רבים עתה עם הארץ והשבתם אתם מסבלתם
(224118, -61, 4);1;א;83879;(2, 5, 7, 2, 83879);22130;(2, 5, 7, 1, 22130);לא;2;1;לא תאספון לתת תבן לעם ללבן הלבנים כתמול שלשם הם ילכו וקששו להם תבן
(224118, -61, 4);30;ל;83940;(2, 5, 8, 10, 83940);22146;(2, 5, 8, 3, 22146);הלבנים;2;3;ואת מתכנת הלבנים אשר הם עשים תמול שלשם תשימו עליהם לא תגרעו ממנו כי נרפים הם על כן הם צעקים לאמר נלכה נזבחה לאלהינו
(224118, -61, 4);10;י;84001;(2, 5, 8, 71, 84001);22163;(2, 5, 8, 20, 22163);צעקים;4;20;ואת מתכנת הלבנים אשר הם עשים תמול שלשם תשימו עליהם לא תגרעו ממנו כי נרפים הם על כן הם צעקים לאמר נלכה נזבחה לאלהינו
(224118, -61, 4);6;ו;84062;(2, 5, 10, 1, 84062);22178;(2, 5, 10, 1, 22178);ויצאו;1;1;ויצאו נגשי העם ושטריו ויאמרו אל העם לאמר כה אמר פרעה אינני נתן לכם תבן
(224118, -61, 4);6;ו;84123;(2, 5, 11, 6, 84123);22194;(2, 5, 11, 2, 22194);לכו;3;2;אתם לכו קחו לכם תבן מאשר תמצאו כי אין נגרע מעבדתכם דבר
(224118, -61, 4);300;ש;84184;(2, 5, 12, 24, 84184);22211;(2, 5, 12, 7, 22211);קש;2;7;ויפץ העם בכל ארץ מצרים לקשש קש לתבן
(224118, -61, 4);2;ב;84245;(2, 5, 14, 9, 84245);22226;(2, 5, 14, 3, 22226);בני;1;3;ויכו שטרי בני ישראל אשר שמו עלהם נגשי פרעה לאמר מדוע לא כליתם חקכם ללבן כתמול שלשם גם תמול גם היום
(224118, -61, 4);40;מ;84306;(2, 5, 14, 70, 84306);22242;(2, 5, 14, 19, 22242);תמול;2;19;ויכו שטרי בני ישראל אשר שמו עלהם נגשי פרעה לאמר מדוע לא כליתם חקכם ללבן כתמול שלשם גם תמול גם היום
(224118, -61, 4);10;י;84367;(2, 5, 16, 5, 84367);22258;(2, 5, 16, 2, 22258);אין;2;2;תבן אין נתן לעבדיך ולבנים אמרים לנו עשו והנה עבדיך מכים וחטאת עמך
(224118, -61, 4);40;ם;84428;(2, 5, 17, 13, 84428);22272;(2, 5, 17, 3, 22272);אתם;3;3;ויאמר נרפים אתם נרפים על כן אתם אמרים נלכה נזבחה ליהוה
(224118, -61, 4);2;ב;84489;(2, 5, 18, 30, 84489);22289;(2, 5, 18, 9, 22289);לבנים;2;9;ועתה לכו עבדו ותבן לא ינתן לכם ותכן לבנים תתנו
(224118, -61, 4);10;י;84550;(2, 5, 20, 2, 84550);22304;(2, 5, 20, 1, 22304);ויפגעו;2;1;ויפגעו את משה ואת אהרן נצבים לקראתם בצאתם מאת פרעה
(224118, -61, 4);40;ם;84611;(2, 5, 21, 22, 84611);22318;(2, 5, 21, 5, 22318);עליכם;5;5;ויאמרו אלהם ירא יהוה עליכם וישפט אשר הבאשתם את ריחנו בעיני פרעה ובעיני עבדיו לתת חרב בידם להרגנו
(224118, -61, 4);2;ב;84672;(2, 5, 22, 4, 84672);22332;(2, 5, 22, 1, 22332);וישב;4;1;וישב משה אל יהוה ויאמר אדני למה הרעתה לעם הזה למה זה שלחתני
(224118, -61, 4);200;ר;84733;(2, 5, 23, 18, 84733);22349;(2, 5, 23, 5, 22349);לדבר;4;5;ומאז באתי אל פרעה לדבר בשמך הרע לעם הזה והצל לא הצלת את עמך
(224118, -61, 4);5;ה;84794;(2, 6, 1, 33, 84794);22367;(2, 6, 1, 9, 22367);לפרעה;5;9;ויאמר יהוה אל משה עתה תראה אשר אעשה לפרעה כי ביד חזקה ישלחם וביד חזקה יגרשם מארצו
(224118, -61, 4);5;ה;84855;(2, 6, 2, 29, 84855);22383;(2, 6, 2, 8, 22383);יהוה;2;8;וידבר אלהים אל משה ויאמר אליו אני יהוה
(224118, -61, 4);400;ת;84916;(2, 6, 4, 10, 84916);22400;(2, 6, 4, 3, 22400);את;2;3;וגם הקמתי את בריתי אתם לתת להם את ארץ כנען את ארץ מגריהם אשר גרו בה
