(126970, -93, 4);1;א;224248;(4, 21, 16, 16, 224248);59128;(4, 21, 16, 5, 59128);אשר;1;5;ומשם בארה הוא הבאר אשר אמר יהוה למשה אסף את העם ואתנה להם מים
(126970, -93, 4);100;ק;224341;(4, 21, 18, 28, 224341);59154;(4, 21, 18, 7, 59154);במחקק;4;7;באר חפרוה שרים כרוה נדיבי העם במחקק במשענתם וממדבר מתנה
(126970, -93, 4);8;ח;224434;(4, 21, 21, 5, 224434);59173;(4, 21, 21, 1, 59173);וישלח;5;1;וישלח ישראל מלאכים אל סיחן מלך האמרי לאמר
(126970, -93, 4);400;ת;224527;(4, 21, 23, 5, 224527);59199;(4, 21, 23, 2, 59199);נתן;2;2;ולא נתן סיחן את ישראל עבר בגבלו ויאסף סיחן את כל עמו ויצא לקראת ישראל המדברה ויבא יהצה וילחם בישראל
(126970, -93, 4);10;י;224620;(4, 21, 24, 18, 224620);59222;(4, 21, 24, 5, 59222);ויירש;2;5;ויכהו ישראל לפי חרב ויירש את ארצו מארנן עד יבק עד בני עמון כי עז גבול בני עמון
(126970, -93, 4);2;ב;224713;(4, 21, 25, 50, 224713);59248;(4, 21, 25, 13, 59248);ובכל;2;13;ויקח ישראל את כל הערים האלה וישב ישראל בכל ערי האמרי בחשבון ובכל בנתיה
(126970, -93, 4);1;א;224806;(4, 21, 27, 17, 224806);59273;(4, 21, 27, 5, 59273);באו;2;5;על כן יאמרו המשלים באו חשבון תבנה ותכונן עיר סיחון
(126970, -93, 4);50;נ;224899;(4, 21, 29, 20, 224899);59298;(4, 21, 29, 7, 59298);נתן;1;7;אוי לך מואב אבדת עם כמוש נתן בניו פליטם ובנתיו בשבית למלך אמרי סיחון
(126970, -93, 4);6;ו;224992;(4, 21, 32, 1, 224992);59321;(4, 21, 32, 1, 59321);וישלח;1;1;וישלח משה לרגל את יעזר וילכדו בנתיה ויירש את האמרי אשר שם
(126970, -93, 4);40;מ;225085;(4, 21, 33, 48, 225085);59345;(4, 21, 33, 13, 59345);למלחמה;2;13;ויפנו ויעלו דרך הבשן ויצא עוג מלך הבשן לקראתם הוא וכל עמו למלחמה אדרעי
(126970, -93, 4);6;ו;225178;(4, 21, 34, 84, 225178);59371;(4, 21, 34, 25, 59371);יושב;2;25;ויאמר יהוה אל משה אל תירא אתו כי בידך נתתי אתו ואת כל עמו ואת ארצו ועשית לו כאשר עשית לסיחן מלך האמרי אשר יושב בחשבון
(126970, -93, 4);10;י;225271;(4, 22, 1, 34, 225271);59395;(4, 22, 1, 8, 59395);לירדן;2;8;ויסעו בני ישראל ויחנו בערבות מואב מעבר לירדן ירחו
(126970, -93, 4);1;א;225364;(4, 22, 4, 8, 225364);59421;(4, 22, 4, 2, 59421);מואב;3;2;ויאמר מואב אל זקני מדין עתה ילחכו הקהל את כל סביבתינו כלחך השור את ירק השדה ובלק בן צפור מלך למואב בעת ההוא
(126970, -93, 4);70;ע;225457;(4, 22, 5, 16, 225457);59446;(4, 22, 5, 4, 59446);בלעם;3;4;וישלח מלאכים אל בלעם בן בעור פתורה אשר על הנהר ארץ בני עמו לקרא לו לאמר הנה עם יצא ממצרים הנה כסה את עין הארץ והוא ישב ממלי
(126970, -93, 4);30;ל;225550;(4, 22, 6, 13, 225550);59475;(4, 22, 6, 5, 59475);לי;1;5;ועתה לכה נא ארה לי את העם הזה כי עצום הוא ממני אולי אוכל נכה בו ואגרשנו מן הארץ כי ידעתי את אשר תברך מברך ואשר תאר יואר
(126970, -93, 4);6;ו;225643;(4, 22, 7, 14, 225643);59502;(4, 22, 7, 4, 59502);וזקני;1;4;וילכו זקני מואב וזקני מדין וקסמים בידם ויבאו אל בלעם וידברו אליו דברי בלק
(126970, -93, 4);1;א;225736;(4, 22, 8, 47, 225736);59524;(4, 22, 8, 12, 59524);אלי;1;12;ויאמר אליהם לינו פה הלילה והשבתי אתכם דבר כאשר ידבר יהוה אלי וישבו שרי מואב עם בלעם
(126970, -93, 4);10;י;225829;(4, 22, 10, 38, 225829);59549;(4, 22, 10, 11, 59549);אלי;3;11;ויאמר בלעם אל האלהים בלק בן צפר מלך מואב שלח אלי
(126970, -93, 4);400;ת;225922;(4, 22, 12, 28, 225922);59576;(4, 22, 12, 9, 59576);תאר;1;9;ויאמר אלהים אל בלעם לא תלך עמהם לא תאר את העם כי ברוך הוא
(126970, -93, 4);2;ב;226015;(4, 22, 14, 21, 226015);59603;(4, 22, 14, 6, 59603);בלק;1;6;ויקומו שרי מואב ויבאו אל בלק ויאמרו מאן בלעם הלך עמנו
(126970, -93, 4);40;מ;226108;(4, 22, 16, 39, 226108);59629;(4, 22, 16, 13, 59629);תמנע;2;13;ויבאו אל בלעם ויאמרו לו כה אמר בלק בן צפור אל נא תמנע מהלך אלי
(126970, -93, 4);1;א;226201;(4, 22, 18, 35, 226201);59658;(4, 22, 18, 11, 59658);מלא;3;11;ויען בלעם ויאמר אל עבדי בלק אם יתן לי בלק מלא ביתו כסף וזהב לא אוכל לעבר את פי יהוה אלהי לעשות קטנה או גדולה
(126970, -93, 4);10;י;226294;(4, 22, 20, 2, 226294);59686;(4, 22, 20, 1, 59686);ויבא;2;1;ויבא אלהים אל בלעם לילה ויאמר לו אם לקרא לך באו האנשים קום לך אתם ואך את הדבר אשר אדבר אליך אתו תעשה
(126970, -93, 4);300;ש;226387;(4, 22, 21, 17, 226387);59712;(4, 22, 21, 4, 59712);ויחבש;5;4;ויקם בלעם בבקר ויחבש את אתנו וילך עם שרי מואב
(126970, -93, 4);5;ה;226480;(4, 22, 23, 5, 226480);59739;(4, 22, 23, 2, 59739);האתון;1;2;ותרא האתון את מלאך יהוה נצב בדרך וחרבו שלופה בידו ותט האתון מן הדרך ותלך בשדה ויך בלעם את האתון להטתה הדרך
(126970, -93, 4);5;ה;226573;(4, 22, 24, 13, 226573);59762;(4, 22, 24, 3, 59762);יהוה;4;3;ויעמד מלאך יהוה במשעול הכרמים גדר מזה וגדר מזה
(126970, -93, 4);20;ך;226666;(4, 22, 26, 9, 226666);59786;(4, 22, 26, 2, 59786);מלאך;4;2;ויוסף מלאך יהוה עבור ויעמד במקום צר אשר אין דרך לנטות ימין ושמאול
(126970, -93, 4);400;ת;226759;(4, 22, 27, 49, 226759);59811;(4, 22, 27, 14, 59811);האתון;3;14;ותרא האתון את מלאך יהוה ותרבץ תחת בלעם ויחר אף בלעם ויך את האתון במקל
(126970, -93, 4);2;ב;226852;(4, 22, 29, 32, 226852);59837;(4, 22, 29, 10, 59837);בידי;1;10;ויאמר בלעם לאתון כי התעללת בי לו יש חרב בידי כי עתה הרגתיך
(126970, -93, 4);1;א;226945;(4, 22, 30, 79, 226945);59861;(4, 22, 30, 21, 59861);לא;2;21;ותאמר האתון אל בלעם הלוא אנכי אתנך אשר רכבת עלי מעודך עד היום הזה ההסכן הסכנתי לעשות לך כה ויאמר לא
(126970, -93, 4);1;א;227038;(4, 22, 32, 26, 227038);59886;(4, 22, 32, 8, 59886);את;1;8;ויאמר אליו מלאך יהוה על מה הכית את אתנך זה שלוש רגלים הנה אנכי יצאתי לשטן כי ירט הדרך לנגדי
(126970, -93, 4);40;ם;227131;(4, 22, 33, 47, 227131);59911;(4, 22, 33, 13, 59911);גם;2;13;ותראני האתון ותט לפני זה שלש רגלים אולי נטתה מפני כי עתה גם אתכה הרגתי ואותה החייתי
(126970, -93, 4);6;ו;227224;(4, 22, 35, 1, 227224);59936;(4, 22, 35, 1, 59936);ויאמר;1;1;ויאמר מלאך יהוה אל בלעם לך עם האנשים ואפס את הדבר אשר אדבר אליך אתו תדבר וילך בלעם עם שרי בלק
(126970, -93, 4);30;ל;227317;(4, 22, 36, 21, 227317);59963;(4, 22, 36, 7, 59963);לקראתו;1;7;וישמע בלק כי בא בלעם ויצא לקראתו אל עיר מואב אשר על גבול ארנן אשר בקצה הגבול
(126970, -93, 4);1;א;227410;(4, 22, 37, 54, 227410);59989;(4, 22, 37, 16, 59989);לא;2;16;ויאמר בלק אל בלעם הלא שלח שלחתי אליך לקרא לך למה לא הלכת אלי האמנם לא אוכל כבדך
(126970, -93, 4);10;י;227503;(4, 22, 39, 15, 227503);60015;(4, 22, 39, 5, 60015);ויבאו;2;5;וילך בלעם עם בלק ויבאו קרית חצות
(126970, -93, 4);5;ה;227596;(4, 22, 41, 45, 227596);60039;(4, 22, 41, 13, 60039);העם;1;13;ויהי בבקר ויקח בלק את בלעם ויעלהו במות בעל וירא משם קצה העם
(126970, -93, 4);6;ו;227689;(4, 23, 2, 33, 227689);60065;(4, 23, 2, 10, 60065);ואיל;1;10;ויעש בלק כאשר דבר בלעם ויעל בלק ובלעם פר ואיל במזבח
(126970, -93, 4);2;ב;227782;(4, 23, 4, 12, 227782);60088;(4, 23, 4, 4, 60088);בלעם;1;4;ויקר אלהים אל בלעם ויאמר אליו את שבעת המזבחת ערכתי ואעל פר ואיל במזבח
(126970, -93, 4);50;נ;227875;(4, 23, 6, 11, 227875);60112;(4, 23, 6, 3, 60112);והנה;3;3;וישב אליו והנה נצב על עלתו הוא וכל שרי מואב
(126970, -93, 4);100;ק;227968;(4, 23, 8, 4, 227968);60139;(4, 23, 8, 2, 60139);אקב;2;2;מה אקב לא קבה אל ומה אזעם לא זעם יהוה
(126970, -93, 4);80;פ;228061;(4, 23, 10, 16, 228061);60165;(4, 23, 10, 5, 60165);ומספר;4;5;מי מנה עפר יעקב ומספר את רבע ישראל תמת נפשי מות ישרים ותהי אחריתי כמהו
(126970, -93, 4);1;א;228154;(4, 23, 12, 7, 228154);60190;(4, 23, 12, 2, 60190);ויאמר;3;2;ויען ויאמר הלא את אשר ישים יהוה בפי אתו אשמר לדבר
(126970, -93, 4);6;ו;228247;(4, 23, 13, 61, 228247);60218;(4, 23, 13, 19, 60218);וקבנו;1;19;ויאמר אליו בלק לך נא אתי אל מקום אחר אשר תראנו משם אפס קצהו תראה וכלו לא תראה וקבנו לי משם
(126970, -93, 4);20;כ;228340;(4, 23, 15, 33, 228340);60243;(4, 23, 15, 10, 60243);כה;1;10;ויאמר אל בלק התיצב כה על עלתך ואנכי אקרה כה
(126970, -93, 4);200;ר;228433;(4, 23, 17, 47, 228433);60270;(4, 23, 17, 14, 60270);דבר;3;14;ויבא אליו והנו נצב על עלתו ושרי מואב אתו ויאמר לו בלק מה דבר יהוה
(126970, -93, 4);5;ה;228526;(4, 23, 19, 51, 228526);60295;(4, 23, 19, 14, 60295);יקימנה;6;14;לא איש אל ויכזב ובן אדם ויתנחם ההוא אמר ולא יעשה ודבר ולא יקימנה
(126970, -93, 4);6;ו;228619;(4, 23, 22, 17, 228619);60319;(4, 23, 22, 4, 60319);כתועפת;3;4;אל מוציאם ממצרים כתועפת ראם לו
(126970, -93, 4);30;ל;228712;(4, 23, 24, 35, 228712);60345;(4, 23, 24, 10, 60345);יאכל;4;10;הן עם כלביא יקום וכארי יתנשא לא ישכב עד יאכל טרף ודם חללים ישתה
(126970, -93, 4);10;י;228805;(4, 23, 26, 40, 228805);60373;(4, 23, 26, 12, 60373);ידבר;1;12;ויען בלעם ויאמר אל בלק הלא דברתי אליך לאמר כל אשר ידבר יהוה אתו אעשה
(126970, -93, 4);80;פ;228898;(4, 23, 28, 18, 228898);60399;(4, 23, 28, 6, 60399);הפעור;2;6;ויקח בלק את בלעם ראש הפעור הנשקף על פני הישימן
(126970, -93, 4);70;ע;228991;(4, 23, 30, 17, 228991);60424;(4, 23, 30, 5, 60424);בלעם;3;5;ויעש בלק כאשר אמר בלעם ויעל פר ואיל במזבח
(126970, -93, 4);2;ב;229084;(4, 24, 2, 5, 229084);60449;(4, 24, 2, 2, 60449);בלעם;1;2;וישא בלעם את עיניו וירא את ישראל שכן לשבטיו ותהי עליו רוח אלהים
(126970, -93, 4);70;ע;229177;(4, 24, 4, 6, 229177);60473;(4, 24, 4, 2, 60473);שמע;3;2;נאם שמע אמרי אל אשר מחזה שדי יחזה נפל וגלוי עינים
(126970, -93, 4);20;כ;229270;(4, 24, 6, 34, 229270);60497;(4, 24, 6, 9, 60497);כארזים;1;9;כנחלים נטיו כגנת עלי נהר כאהלים נטע יהוה כארזים עלי מים
(126970, -93, 4);10;י;229363;(4, 24, 8, 36, 229363);60519;(4, 24, 8, 9, 60519);צריו;3;9;אל מוציאו ממצרים כתועפת ראם לו יאכל גוים צריו ועצמתיהם יגרם וחציו ימחץ
(126970, -93, 4);6;ו;229456;(4, 24, 10, 27, 229456);60542;(4, 24, 10, 9, 60542);ויאמר;1;9;ויחר אף בלק אל בלעם ויספק את כפיו ויאמר בלק אל בלעם לקב איבי קראתיך והנה ברכת ברך זה שלש פעמים
(126970, -93, 4);4;ד;229549;(4, 24, 11, 46, 229549);60566;(4, 24, 11, 12, 60566);מכבוד;5;12;ועתה ברח לך אל מקומך אמרתי כבד אכבדך והנה מנעך יהוה מכבוד
(126970, -93, 4);400;ת;229642;(4, 24, 13, 47, 229642);60594;(4, 24, 13, 15, 60594);לעשות;5;15;אם יתן לי בלק מלא ביתו כסף וזהב לא אוכל לעבר את פי יהוה לעשות טובה או רעה מלבי אשר ידבר יהוה אתו אדבר
(126970, -93, 4);10;י;229735;(4, 24, 15, 10, 229735);60619;(4, 24, 15, 3, 60619);ויאמר;2;3;וישא משלו ויאמר נאם בלעם בנו בער ונאם הגבר שתם העין
(126970, -93, 4);6;ו;229828;(4, 24, 17, 14, 229828);60644;(4, 24, 17, 4, 60644);אשורנו;3;4;אראנו ולא עתה אשורנו ולא קרוב דרך כוכב מיעקב וקם שבט מישראל ומחץ פאתי מואב וקרקר כל בני שת
(126970, -93, 4);30;ל;229921;(4, 24, 18, 35, 229921);60667;(4, 24, 18, 8, 60667);וישראל;6;8;והיה אדום ירשה והיה ירשה שעיר איביו וישראל עשה חיל
(126970, -93, 4);1;א;230014;(4, 24, 21, 15, 230014);60690;(4, 24, 21, 4, 60690);וישא;4;4;וירא את הקיני וישא משלו ויאמר איתן מושבך ושים בסלע קנך
(126970, -93, 4);400;ת;230107;(4, 24, 24, 9, 230107);60717;(4, 24, 24, 3, 60717);כתים;2;3;וצים מיד כתים וענו אשור וענו עבר וגם הוא עדי אבד
(126970, -93, 4);2;ב;230200;(4, 25, 1, 29, 230200);60742;(4, 25, 1, 8, 60742);בנות;1;8;וישב ישראל בשטים ויחל העם לזנות אל בנות מואב
(126970, -93, 4);1;א;230293;(4, 25, 4, 10, 230293);60762;(4, 25, 4, 3, 60762);אל;1;3;ויאמר יהוה אל משה קח את כל ראשי העם והוקע אותם ליהוה נגד השמש וישב חרון אף יהוה מישראל
(126970, -93, 4);40;מ;230386;(4, 25, 5, 35, 230386);60787;(4, 25, 5, 9, 60787);הנצמדים;4;9;ויאמר משה אל שפטי ישראל הרגו איש אנשיו הנצמדים לבעל פעור
(126970, -93, 4);70;ע;230479;(4, 25, 6, 82, 230479);60811;(4, 25, 6, 22, 60811);מועד;3;22;והנה איש מבני ישראל בא ויקרב אל אחיו את המדינית לעיני משה ולעיני כל עדת בני ישראל והמה בכים פתח אהל מועד
(126970, -93, 4);30;ל;230572;(4, 25, 8, 43, 230572);60836;(4, 25, 8, 12, 60836);ישראל;5;12;ויבא אחר איש ישראל אל הקבה וידקר את שניהם את איש ישראל ואת האשה אל קבתה ותעצר המגפה מעל בני ישראל
(126970, -93, 4);200;ר;230665;(4, 25, 11, 12, 230665);60859;(4, 25, 11, 3, 60859);אלעזר;5;3;פינחס בן אלעזר בן אהרן הכהן השיב את חמתי מעל בני ישראל בקנאו את קנאתי בתוכם ולא כליתי את בני ישראל בקנאתי
(126970, -93, 4);400;ת;230758;(4, 25, 12, 21, 230758);60885;(4, 25, 12, 7, 60885);בריתי;4;7;לכן אמר הנני נתן לו את בריתי שלום
(126970, -93, 4);50;נ;230851;(4, 25, 14, 28, 230851);60909;(4, 25, 14, 8, 60909);המדינית;5;8;ושם איש ישראל המכה אשר הכה את המדינית זמרי בן סלוא נשיא בית אב לשמעני
(126970, -93, 4);90;צ;230944;(4, 25, 17, 1, 230944);60935;(4, 25, 17, 1, 60935);צרור;1;1;צרור את המדינים והכיתם אותם
(126970, -93, 4);5;ה;231037;(4, 25, 18, 71, 231037);60960;(4, 25, 18, 21, 60960);המגפה;1;21;כי צררים הם לכם בנכליהם אשר נכלו לכם על דבר פעור ועל דבר כזבי בת נשיא מדין אחתם המכה ביום המגפה על דבר פעור
(126970, -93, 4);50;נ;231130;(4, 26, 2, 31, 231130);60986;(4, 26, 2, 10, 60986);שנה;2;10;שאו את ראש כל עדת בני ישראל מבן עשרים שנה ומעלה לבית אבתם כל יצא צבא בישראל
(126970, -93, 4);90;צ;231223;(4, 26, 4, 21, 231223);61010;(4, 26, 4, 6, 61010);צוה;1;6;מבן עשרים שנה ומעלה כאשר צוה יהוה את משה ובני ישראל היצאים מארץ מצרים
(126970, -93, 4);300;ש;231316;(4, 26, 6, 7, 231316);61031;(4, 26, 6, 2, 61031);משפחת;2;2;לחצרן משפחת החצרוני לכרמי משפחת הכרמי
(126970, -93, 4);6;ו;231409;(4, 26, 9, 1, 231409);61050;(4, 26, 9, 1, 61050);ובני;1;1;ובני אליאב נמואל ודתן ואבירם הוא דתן ואבירם קרואי העדה אשר הצו על משה ועל אהרן בעדת קרח בהצתם על יהוה
(126970, -93, 4);10;י;231502;(4, 26, 10, 13, 231502);61074;(4, 26, 10, 4, 61074);פיה;2;4;ותפתח הארץ את פיה ותבלע אתם ואת קרח במות העדה באכל האש את חמשים ומאתים איש ויהיו לנס
(126970, -93, 4);5;ה;231595;(4, 26, 12, 27, 231595);61098;(4, 26, 12, 6, 61098);הנמואלי;1;6;בני שמעון למשפחתם לנמואל משפחת הנמואלי לימין משפחת הימיני ליכין משפחת היכיני
(126970, -93, 4);1;א;231688;(4, 26, 14, 25, 231688);61116;(4, 26, 14, 6, 61116);אלף;1;6;אלה משפחת השמעני שנים ועשרים אלף ומאתים
(126970, -93, 4);30;ל;231781;(4, 26, 17, 1, 231781);61136;(4, 26, 17, 1, 61136);לארוד;1;1;לארוד משפחת הארודי לאראלי משפחת האראלי
(126970, -93, 4);6;ו;231874;(4, 26, 19, 24, 231874);61157;(4, 26, 19, 7, 61157);ואונן;3;7;בני יהודה ער ואונן וימת ער ואונן בארץ כנען
(126970, -93, 4);400;ת;231967;(4, 26, 21, 21, 231967);61177;(4, 26, 21, 5, 61177);משפחת;5;5;ויהיו בני פרץ לחצרן משפחת החצרני לחמול משפחת החמולי
(126970, -93, 4);30;ל;232060;(4, 26, 23, 31, 232060);61197;(4, 26, 23, 7, 61197);לפוה;1;7;בני יששכר למשפחתם תולע משפחת התולעי לפוה משפחת הפוני
(126970, -93, 4);50;ן;232153;(4, 26, 26, 8, 232153);61216;(4, 26, 26, 2, 61216);זבולן;5;2;בני זבולן למשפחתם לסרד משפחת הסרדי לאלון משפחת האלני ליחלאל משפחת היחלאלי
(126970, -93, 4);50;נ;232246;(4, 26, 28, 2, 232246);61235;(4, 26, 28, 1, 61235);בני;2;1;בני יוסף למשפחתם מנשה ואפרים
(126970, -93, 4);40;מ;232339;(4, 26, 30, 16, 232339);61256;(4, 26, 30, 5, 61256);משפחת;1;5;אלה בני גלעד איעזר משפחת האיעזרי לחלק משפחת החלקי
(126970, -93, 4);30;ל;232432;(4, 26, 33, 3, 232432);61273;(4, 26, 33, 1, 61273);וצלפחד;3;1;וצלפחד בן חפר לא היו לו בנים כי אם בנות ושם בנות צלפחד מחלה ונעה חגלה מלכה ותרצה
(126970, -93, 4);6;ו;232525;(4, 26, 34, 33, 232525);61298;(4, 26, 34, 8, 61298);ושבע;1;8;אלה משפחת מנשה ופקדיהם שנים וחמשים אלף ושבע מאות
(126970, -93, 4);70;ע;232618;(4, 26, 36, 23, 232618);61318;(4, 26, 36, 6, 61318);הערני;2;6;ואלה בני שותלח לערן משפחת הערני
(126970, -93, 4);10;י;232711;(4, 26, 38, 29, 232711);61338;(4, 26, 38, 6, 61338);הבלעי;5;6;בני בנימן למשפחתם לבלע משפחת הבלעי לאשבל משפחת האשבלי לאחירם משפחת האחירמי
(126970, -93, 4);1;א;232804;(4, 26, 40, 26, 232804);61357;(4, 26, 40, 7, 61357);הארדי;2;7;ויהיו בני בלע ארד ונעמן משפחת הארדי לנעמן משפחת הנעמי
(126970, -93, 4);8;ח;232897;(4, 26, 42, 29, 232897);61377;(4, 26, 42, 7, 61377);השוחמי;4;7;אלה בני דן למשפחתם לשוחם משפחת השוחמי אלה משפחת דן למשפחתם
(126970, -93, 4);6;ו;232990;(4, 26, 44, 32, 232990);61397;(4, 26, 44, 7, 61397);לישוי;4;7;בני אשר למשפחתם לימנה משפחת הימנה לישוי משפחת הישוי לבריעה משפחת הבריעי
(126970, -93, 4);10;י;233083;(4, 26, 47, 11, 233083);61417;(4, 26, 47, 3, 61417);בני;3;3;אלה משפחת בני אשר לפקדיהם שלשה וחמשים אלף וארבע מאות
(126970, -93, 4);200;ר;233176;(4, 26, 49, 13, 233176);61436;(4, 26, 49, 3, 61436);היצרי;4;3;ליצר משפחת היצרי לשלם משפחת השלמי
(126970, -93, 4);30;ל;233269;(4, 26, 51, 28, 233269);61457;(4, 26, 51, 8, 61457);ואלף;3;8;אלה פקודי בני ישראל שש מאות אלף ואלף שבע מאות ושלשים
(126970, -93, 4);100;ק;233362;(4, 26, 54, 35, 233362);61480;(4, 26, 54, 9, 61480);פקדיו;2;9;לרב תרבה נחלתו ולמעט תמעיט נחלתו איש לפי פקדיו יתן נחלתו
(126970, -93, 4);40;ם;233455;(4, 26, 57, 20, 233455);61503;(4, 26, 57, 4, 61503);למשפחתם;7;4;ואלה פקודי הלוי למשפחתם לגרשון משפחת הגרשני לקהת משפחת הקהתי למררי משפחת המררי
(126970, -93, 4);400;ת;233548;(4, 26, 58, 47, 233548);61522;(4, 26, 58, 10, 61522);משפחת;5;10;אלה משפחת לוי משפחת הלבני משפחת החברני משפחת המחלי משפחת המושי משפחת הקרחי וקהת הולד את עמרם
(126970, -93, 4);400;ת;233641;(4, 26, 59, 64, 233641);61547;(4, 26, 59, 18, 61547);ואת;3;18;ושם אשת עמרם יוכבד בת לוי אשר ילדה אתה ללוי במצרים ותלד לעמרם את אהרן ואת משה ואת מרים אחתם
(126970, -93, 4);300;ש;233734;(4, 26, 62, 12, 233734);61570;(4, 26, 62, 3, 61570);שלשה;1;3;ויהיו פקדיהם שלשה ועשרים אלף כל זכר מבן חדש ומעלה כי לא התפקדו בתוך בני ישראל כי לא נתן להם נחלה בתוך בני ישראל
(126970, -93, 4);200;ר;233827;(4, 26, 63, 17, 233827);61595;(4, 26, 63, 4, 61595);ואלעזר;6;4;אלה פקודי משה ואלעזר הכהן אשר פקדו את בני ישראל בערבת מואב על ירדן ירחו
(126970, -93, 4);200;ר;233920;(4, 26, 64, 53, 233920);61620;(4, 26, 64, 14, 61620);במדבר;5;14;ובאלה לא היה איש מפקודי משה ואהרן הכהן אשר פקדו את בני ישראל במדבר סיני
(126970, -93, 4);2;ב;234013;(4, 27, 1, 28, 234013);61648;(4, 27, 1, 8, 61648);בן;1;8;ותקרבנה בנות צלפחד בן חפר בן גלעד בן מכיר בן מנשה למשפחת מנשה בן יוסף ואלה שמות בנתיו מחלה נעה וחגלה ומלכה ותרצה
(126970, -93, 4);80;פ;234106;(4, 27, 2, 31, 234106);61670;(4, 27, 2, 7, 61670);ולפני;3;7;ותעמדנה לפני משה ולפני אלעזר הכהן ולפני הנשיאם וכל העדה פתח אהל מועד לאמר
(126970, -93, 4);30;ל;234199;(4, 27, 3, 64, 234199);61695;(4, 27, 3, 18, 61695);לא;1;18;אבינו מת במדבר והוא לא היה בתוך העדה הנועדים על יהוה בעדת קרח כי בחטאו מת ובנים לא היו לו
(126970, -93, 4);5;ה;234292;(4, 27, 6, 9, 234292);61721;(4, 27, 6, 2, 61721);יהוה;4;2;ויאמר יהוה אל משה לאמר
(126970, -93, 4);1;א;234385;(4, 27, 8, 20, 234385);61747;(4, 27, 8, 6, 61747);איש;1;6;ואל בני ישראל תדבר לאמר איש כי ימות ובן אין לו והעברתם את נחלתו לבתו
(126970, -93, 4);6;ו;234478;(4, 27, 10, 32, 234478);61773;(4, 27, 10, 9, 61773);אביו;4;9;ואם אין לו אחים ונתתם את נחלתו לאחי אביו
(126970, -93, 4);6;ו;234571;(4, 27, 12, 1, 234571);61797;(4, 27, 12, 1, 61797);ויאמר;1;1;ויאמר יהוה אל משה עלה אל הר העברים הזה וראה את הארץ אשר נתתי לבני ישראל
(126970, -93, 4);50;ן;234664;(4, 27, 13, 38, 234664);61822;(4, 27, 13, 10, 61822);אהרן;4;10;וראיתה אתה ונאספת אל עמיך גם אתה כאשר נאסף אהרן אחיך
(126970, -93, 4);5;ה;234757;(4, 27, 16, 6, 234757);61846;(4, 27, 16, 2, 61846);יהוה;2;2;יפקד יהוה אלהי הרוחת לכל בשר איש על העדה
(126970, -93, 4);10;י;234850;(4, 27, 17, 67, 234850);61870;(4, 27, 17, 17, 61870);אין;2;17;אשר יצא לפניהם ואשר יבא לפניהם ואשר יוציאם ואשר יביאם ולא תהיה עדת יהוה כצאן אשר אין להם רעה
(126970, -93, 4);70;ע;234943;(4, 27, 19, 31, 234943);61898;(4, 27, 19, 8, 61898);העדה;2;8;והעמדת אתו לפני אלעזר הכהן ולפני כל העדה וצויתה אתו לעיניהם
(126970, -93, 4);10;י;235036;(4, 27, 21, 39, 235036);61919;(4, 27, 21, 9, 61919);לפני;4;9;ולפני אלעזר הכהן יעמד ושאל לו במשפט האורים לפני יהוה על פיו יצאו ועל פיו יבאו הוא וכל בני ישראל אתו וכל העדה
(126970, -93, 4);70;ע;235129;(4, 27, 22, 46, 235129);61945;(4, 27, 22, 12, 61945);אלעזר;3;12;ויעש משה כאשר צוה יהוה אתו ויקח את יהושע ויעמדהו לפני אלעזר הכהן ולפני כל העדה
(126970, -93, 4);5;ה;235222;(4, 28, 2, 20, 235222);61970;(4, 28, 2, 6, 61970);אלהם;3;6;צו את בני ישראל ואמרת אלהם את קרבני לחמי לאשי ריח ניחחי תשמרו להקריב לי במועדו
