(n,d,k);LetterGematriaNumberValue;Letter;LetterPositionIndex;LetterCoordinatesD5K;WordNumber;WordCoordinatesDWTK;Found in Word in Text;LetterPositionIndex In Word;WordNumberInVerse;Found In Verse
(126970, -93, 4);5;ה;25;(1, 1, 1, 25, 25);7;(1, 1, 1, 7, 7);הארץ;1;7;בראשית ברא אלהים את השמים ואת הארץ
(126970, -93, 4);200;ר;118;(1, 1, 4, 15, 118);31;(1, 1, 4, 4, 31);האור;4;4;וירא אלהים את האור כי טוב ויבדל אלהים בין האור ובין החשך
(126970, -93, 4);200;ר;211;(1, 1, 6, 14, 211);56;(1, 1, 6, 4, 56);רקיע;1;4;ויאמר אלהים יהי רקיע בתוך המים ויהי מבדיל בין מים למים
(126970, -93, 4);10;י;304;(1, 1, 7, 63, 304);79;(1, 1, 7, 16, 79);ויהי;4;16;ויעש אלהים את הרקיע ויבדל בין המים אשר מתחת לרקיע ובין המים אשר מעל לרקיע ויהי כן
(126970, -93, 4);50;ן;397;(1, 1, 9, 52, 397);103;(1, 1, 9, 13, 103);כן;2;13;ויאמר אלהים יקוו המים מתחת השמים אל מקום אחד ותראה היבשה ויהי כן
(126970, -93, 4);30;ל;490;(1, 1, 11, 44, 490);128;(1, 1, 11, 13, 128);למינו;1;13;ויאמר אלהים תדשא הארץ דשא עשב מזריע זרע עץ פרי עשה פרי למינו אשר זרעו בו על הארץ ויהי כן
(126970, -93, 4);6;ו;583;(1, 1, 13, 1, 583);154;(1, 1, 13, 1, 154);ויהי;1;1;ויהי ערב ויהי בקר יום שלישי
(126970, -93, 4);6;ו;676;(1, 1, 14, 72, 676);175;(1, 1, 14, 16, 175);ושנים;1;16;ויאמר אלהים יהי מארת ברקיע השמים להבדיל בין היום ובין הלילה והיו לאתת ולמועדים ולימים ושנים
(126970, -93, 4);1;א;769;(1, 1, 16, 52, 769);197;(1, 1, 16, 13, 197);המאור;3;13;ויעש אלהים את שני המארת הגדלים את המאור הגדל לממשלת היום ואת המאור הקטן לממשלת הלילה ואת הכוכבים
(126970, -93, 4);50;ן;862;(1, 1, 18, 33, 862);217;(1, 1, 18, 7, 217);ובין;4;7;ולמשל ביום ובלילה ולהבדיל בין האור ובין החשך וירא אלהים כי טוב
(126970, -93, 4);5;ה;955;(1, 1, 20, 53, 955);243;(1, 1, 20, 15, 243);השמים;1;15;ויאמר אלהים ישרצו המים שרץ נפש חיה ועוף יעופף על הארץ על פני רקיע השמים
(126970, -93, 4);2;ב;1048;(1, 1, 21, 89, 1048);266;(1, 1, 21, 23, 266);טוב;3;23;ויברא אלהים את התנינם הגדלים ואת כל נפש החיה הרמשת אשר שרצו המים למינהם ואת כל עוף כנף למינהו וירא אלהים כי טוב
(126970, -93, 4);50;נ;1141;(1, 1, 24, 19, 1141);290;(1, 1, 24, 5, 290);נפש;1;5;ויאמר אלהים תוצא הארץ נפש חיה למינה בהמה ורמש וחיתו ארץ למינה ויהי כן
(126970, -93, 4);6;ו;1234;(1, 1, 25, 56, 1234);314;(1, 1, 25, 15, 314);וירא;1;15;ויעש אלהים את חית הארץ למינה ואת הבהמה למינה ואת כל רמש האדמה למינהו וירא אלהים כי טוב
(126970, -93, 4);30;ל;1327;(1, 1, 26, 80, 1327);335;(1, 1, 26, 18, 335);על;2;18;ויאמר אלהים נעשה אדם בצלמנו כדמותנו וירדו בדגת הים ובעוף השמים ובבהמה ובכל הארץ ובכל הרמש הרמש על הארץ
(126970, -93, 4);1;א;1420;(1, 1, 28, 39, 1420);359;(1, 1, 28, 10, 359);את;1;10;ויברך אתם אלהים ויאמר להם אלהים פרו ורבו ומלאו את הארץ וכבשה ורדו בדגת הים ובעוף השמים ובכל חיה הרמשת על הארץ
(126970, -93, 4);5;ה;1513;(1, 1, 29, 44, 1513);386;(1, 1, 29, 15, 386);הארץ;1;15;ויאמר אלהים הנה נתתי לכם את כל עשב זרע זרע אשר על פני כל הארץ ואת כל העץ אשר בו פרי עץ זרע זרע לכם יהיה לאכלה
(126970, -93, 4);200;ר;1606;(1, 1, 30, 54, 1606);415;(1, 1, 30, 17, 415);ירק;2;17;ולכל חית הארץ ולכל עוף השמים ולכל רומש על הארץ אשר בו נפש חיה את כל ירק עשב לאכלה ויהי כן
(126970, -93, 4);30;ל;1699;(1, 2, 2, 6, 1699);441;(1, 2, 2, 2, 441);אלהים;2;2;ויכל אלהים ביום השביעי מלאכתו אשר עשה וישבת ביום השביעי מכל מלאכתו אשר עשה
(126970, -93, 4);20;כ;1792;(1, 2, 3, 38, 1792);464;(1, 2, 3, 11, 464);מכל;2;11;ויברך אלהים את יום השביעי ויקדש אתו כי בו שבת מכל מלאכתו אשר ברא אלהים לעשות
(126970, -93, 4);200;ר;1885;(1, 2, 5, 20, 1885);486;(1, 2, 5, 6, 486);בארץ;3;6;וכל שיח השדה טרם יהיה בארץ וכל עשב השדה טרם יצמח כי לא המטיר יהוה אלהים על הארץ ואדם אין לעבד את האדמה
(126970, -93, 4);10;י;1978;(1, 2, 7, 3, 1978);513;(1, 2, 7, 1, 513);וייצר;3;1;וייצר יהוה אלהים את האדם עפר מן האדמה ויפח באפיו נשמת חיים ויהי האדם לנפש חיה
(126970, -93, 4);4;ד;2071;(1, 2, 8, 34, 2071);538;(1, 2, 8, 10, 538);האדם;3;10;ויטע יהוה אלהים גן בעדן מקדם וישם שם את האדם אשר יצר
(126970, -93, 4);100;ק;2164;(1, 2, 10, 15, 2164);563;(1, 2, 10, 4, 563);להשקות;4;4;ונהר יצא מעדן להשקות את הגן ומשם יפרד והיה לארבעה ראשים
(126970, -93, 4);6;ו;2257;(1, 2, 12, 23, 2257);589;(1, 2, 12, 7, 589);ואבן;1;7;וזהב הארץ ההוא טוב שם הבדלח ואבן השהם
(126970, -93, 4);100;ק;2350;(1, 2, 15, 3, 2350);613;(1, 2, 15, 1, 613);ויקח;3;1;ויקח יהוה אלהים את האדם וינחהו בגן עדן לעבדה ולשמרה
(126970, -93, 4);1;א;2443;(1, 2, 17, 16, 2443);638;(1, 2, 17, 5, 638);לא;2;5;ומעץ הדעת טוב ורע לא תאכל ממנו כי ביום אכלך ממנו מות תמות
(126970, -93, 4);40;מ;2536;(1, 2, 19, 19, 2536);663;(1, 2, 19, 5, 663);האדמה;4;5;ויצר יהוה אלהים מן האדמה כל חית השדה ואת כל עוף השמים ויבא אל האדם לראות מה יקרא לו וכל אשר יקרא לו האדם נפש חיה הוא שמו
(126970, -93, 4);5;ה;2629;(1, 2, 20, 19, 2629);691;(1, 2, 20, 5, 691);הבהמה;3;5;ויקרא האדם שמות לכל הבהמה ולעוף השמים ולכל חית השדה ולאדם לא מצא עזר כנגדו
(126970, -93, 4);400;ת;2722;(1, 2, 21, 52, 2722);714;(1, 2, 21, 13, 714);תחתנה;1;13;ויפל יהוה אלהים תרדמה על האדם ויישן ויקח אחת מצלעתיו ויסגר בשר תחתנה
(126970, -93, 4);300;ש;2815;(1, 2, 23, 43, 2815);738;(1, 2, 23, 11, 738);אשה;2;11;ויאמר האדם זאת הפעם עצם מעצמי ובשר מבשרי לזאת יקרא אשה כי מאיש לקחה זאת
(126970, -93, 4);5;ה;2908;(1, 3, 1, 2, 2908);763;(1, 3, 1, 1, 763);והנחש;2;1;והנחש היה ערום מכל חית השדה אשר עשה יהוה אלהים ויאמר אל האשה אף כי אמר אלהים לא תאכלו מכל עץ הגן
(126970, -93, 4);70;ע;3001;(1, 3, 2, 20, 3001);790;(1, 3, 2, 6, 790);עץ;1;6;ותאמר האשה אל הנחש מפרי עץ הגן נאכל
(126970, -93, 4);30;ל;3094;(1, 3, 5, 7, 3094);817;(1, 3, 5, 3, 817);אלהים;2;3;כי ידע אלהים כי ביום אכלכם ממנו ונפקחו עיניכם והייתם כאלהים ידעי טוב ורע
(126970, -93, 4);40;מ;3187;(1, 3, 6, 41, 3187);839;(1, 3, 6, 11, 839);ונחמד;4;11;ותרא האשה כי טוב העץ למאכל וכי תאוה הוא לעינים ונחמד העץ להשכיל ותקח מפריו ותאכל ותתן גם לאישה עמה ויאכל
(126970, -93, 4);5;ה;3280;(1, 3, 7, 50, 3280);861;(1, 3, 7, 12, 861);להם;2;12;ותפקחנה עיני שניהם וידעו כי עירמם הם ויתפרו עלה תאנה ויעשו להם חגרת
(126970, -93, 4);1;א;3373;(1, 3, 9, 15, 3373);884;(1, 3, 9, 4, 884);אל;1;4;ויקרא יהוה אלהים אל האדם ויאמר לו איכה
(126970, -93, 4);2;ב;3466;(1, 3, 11, 39, 3466);910;(1, 3, 11, 12, 910);לבלתי;2;12;ויאמר מי הגיד לך כי עירם אתה המן העץ אשר צויתיך לבלתי אכל ממנו אכלת
(126970, -93, 4);5;ה;3559;(1, 3, 13, 37, 3559);935;(1, 3, 13, 10, 935);הנחש;1;10;ויאמר יהוה אלהים לאשה מה זאת עשית ותאמר האשה הנחש השיאני ואכל
(126970, -93, 4);10;י;3652;(1, 3, 14, 80, 3652);960;(1, 3, 14, 23, 960);חייך;3;23;ויאמר יהוה אלהים אל הנחש כי עשית זאת ארור אתה מכל הבהמה ומכל חית השדה על גחנך תלך ועפר תאכל כל ימי חייך
(126970, -93, 4);90;צ;3745;(1, 3, 16, 31, 3745);983;(1, 3, 16, 8, 983);בעצב;3;8;אל האשה אמר הרבה ארבה עצבונך והרנך בעצב תלדי בנים ואל אישך תשוקתך והוא ימשל בך
(126970, -93, 4);5;ה;3838;(1, 3, 17, 61, 3838);1008;(1, 3, 17, 17, 1008);האדמה;1;17;ולאדם אמר כי שמעת לקול אשתך ותאכל מן העץ אשר צויתיך לאמר לא תאכל ממנו ארורה האדמה בעבורך בעצבון תאכלנה כל ימי חייך
(126970, -93, 4);40;מ;3931;(1, 3, 19, 32, 3931);1032;(1, 3, 19, 10, 1032);ממנה;2;10;בזעת אפיך תאכל לחם עד שובך אל האדמה כי ממנה לקחת כי עפר אתה ואל עפר תשוב
(126970, -93, 4);300;ש;4024;(1, 3, 21, 36, 4024);1058;(1, 3, 21, 8, 1058);וילבשם;5;8;ויעש יהוה אלהים לאדם ולאשתו כתנות עור וילבשם
(126970, -93, 4);30;ל;4117;(1, 3, 23, 13, 4117);1083;(1, 3, 23, 3, 1083);אלהים;2;3;וישלחהו יהוה אלהים מגן עדן לעבד את האדמה אשר לקח משם
(126970, -93, 4);8;ח;4210;(1, 3, 24, 64, 4210);1109;(1, 3, 24, 18, 1109);החיים;2;18;ויגרש את האדם וישכן מקדם לגן עדן את הכרבים ואת להט החרב המתהפכת לשמר את דרך עץ החיים
(126970, -93, 4);2;ב;4303;(1, 4, 2, 41, 4303);1136;(1, 4, 2, 13, 1136);עבד;2;13;ותסף ללדת את אחיו את הבל ויהי הבל רעה צאן וקין היה עבד אדמה
(126970, -93, 4);6;ו;4396;(1, 4, 5, 1, 4396);1160;(1, 4, 5, 1, 1160);ואל;1;1;ואל קין ואל מנחתו לא שעה ויחר לקין מאד ויפלו פניו
(126970, -93, 4);10;י;4489;(1, 4, 7, 21, 4489);1187;(1, 4, 7, 7, 1187);תיטיב;2;7;הלוא אם תיטיב שאת ואם לא תיטיב לפתח חטאת רבץ ואליך תשוקתו ואתה תמשל בו
(126970, -93, 4);40;מ;4582;(1, 4, 9, 4, 4582);1210;(1, 4, 9, 1, 1210);ויאמר;4;1;ויאמר יהוה אל קין אי הבל אחיך ויאמר לא ידעתי השמר אחי אנכי
(126970, -93, 4);1;א;4675;(1, 4, 11, 15, 4675);1237;(1, 4, 11, 5, 1237);האדמה;2;5;ועתה ארור אתה מן האדמה אשר פצתה את פיה לקחת את דמי אחיך מידך
(126970, -93, 4);40;מ;4768;(1, 4, 13, 23, 4768);1266;(1, 4, 13, 7, 1266);מנשוא;1;7;ויאמר קין אל יהוה גדול עוני מנשוא
(126970, -93, 4);2;ב;4861;(1, 4, 15, 24, 4861);1291;(1, 4, 15, 8, 1291);שבעתים;2;8;ויאמר לו יהוה לכן כל הרג קין שבעתים יקם וישם יהוה לקין אות לבלתי הכות אתו כל מצאו
(126970, -93, 4);400;ת;4954;(1, 4, 17, 19, 4954);1316;(1, 4, 17, 6, 1316);ותלד;2;6;וידע קין את אשתו ותהר ותלד את חנוך ויהי בנה עיר ויקרא שם העיר כשם בנו חנוך
(126970, -93, 4);6;ו;5047;(1, 4, 18, 54, 5047);1340;(1, 4, 18, 13, 1340);ומתושאל;4;13;ויולד לחנוך את עירד ועירד ילד את מחויאל ומחייאל ילד את מתושאל ומתושאל ילד את למך
(126970, -93, 4);1;א;5140;(1, 4, 21, 14, 5140);1368;(1, 4, 21, 4, 1368);הוא;3;4;ושם אחיו יובל הוא היה אבי כל תפש כנור ועוגב
(126970, -93, 4);90;צ;5233;(1, 4, 23, 18, 5233);1395;(1, 4, 23, 5, 1395);וצלה;2;5;ויאמר למך לנשיו עדה וצלה שמען קולי נשי למך האזנה אמרתי כי איש הרגתי לפצעי וילד לחברתי
(126970, -93, 4);300;ש;5326;(1, 4, 25, 14, 5326);1419;(1, 4, 25, 5, 1419);אשתו;2;5;וידע אדם עוד את אשתו ותלד בן ותקרא את שמו שת כי שת לי אלהים זרע אחר תחת הבל כי הרגו קין
(126970, -93, 4);40;ם;5419;(1, 4, 26, 41, 5419);1449;(1, 4, 26, 13, 1449);בשם;3;13;ולשת גם הוא ילד בן ויקרא את שמו אנוש אז הוחל לקרא בשם יהוה
(126970, -93, 4);8;ח;5512;(1, 5, 3, 3, 5512);1474;(1, 5, 3, 1, 1474);ויחי;3;1;ויחי אדם שלשים ומאת שנה ויולד בדמותו כצלמו ויקרא את שמו שת
(126970, -93, 4);400;ת;5605;(1, 5, 4, 49, 5605);1498;(1, 5, 4, 13, 1498);ובנות;5;13;ויהיו ימי אדם אחרי הולידו את שת שמנה מאת שנה ויולד בנים ובנות
(126970, -93, 4);6;ו;5698;(1, 5, 7, 21, 5698);1525;(1, 5, 7, 6, 1525);אנוש;3;6;ויחי שת אחרי הולידו את אנוש שבע שנים ושמנה מאות שנה ויולד בנים ובנות
(126970, -93, 4);4;ד;5791;(1, 5, 9, 21, 5791);1549;(1, 5, 9, 5, 1549);ויולד;5;5;ויחי אנוש תשעים שנה ויולד את קינן
(126970, -93, 4);1;א;5884;(1, 5, 11, 27, 5884);1574;(1, 5, 11, 8, 1574);מאות;2;8;ויהיו כל ימי אנוש חמש שנים ותשע מאות שנה וימת
(126970, -93, 4);10;י;5977;(1, 5, 13, 55, 5977);1596;(1, 5, 13, 13, 1596);בנים;3;13;ויחי קינן אחרי הולידו את מהללאל ארבעים שנה ושמנה מאות שנה ויולד בנים ובנות
(126970, -93, 4);6;ו;6070;(1, 5, 16, 16, 6070);1620;(1, 5, 16, 4, 1620);הולידו;2;4;ויחי מהללאל אחרי הולידו את ירד שלשים שנה ושמנה מאות שנה ויולד בנים ובנות
(126970, -93, 4);200;ר;6163;(1, 5, 18, 6, 6163);1643;(1, 5, 18, 2, 1643);ירד;2;2;ויחי ירד שתים וששים שנה ומאת שנה ויולד את חנוך
(126970, -93, 4);300;ש;6256;(1, 5, 20, 14, 6256);1668;(1, 5, 20, 5, 1668);שתים;1;5;ויהיו כל ימי ירד שתים וששים שנה ותשע מאות שנה וימת
(126970, -93, 4);30;ל;6349;(1, 5, 22, 35, 6349);1690;(1, 5, 22, 8, 1690);מתושלח;5;8;ויתהלך חנוך את האלהים אחרי הולידו את מתושלח שלש מאות שנה ויולד בנים ובנות
(126970, -93, 4);1;א;6442;(1, 5, 24, 33, 6442);1715;(1, 5, 24, 9, 1715);אלהים;1;9;ויתהלך חנוך את האלהים ואיננו כי לקח אתו אלהים
(126970, -93, 4);5;ה;6535;(1, 5, 26, 50, 6535);1737;(1, 5, 26, 12, 1737);שנה;3;12;ויחי מתושלח אחרי הולידו את למך שתים ושמונים שנה ושבע מאות שנה ויולד בנים ובנות
(126970, -93, 4);100;ק;6628;(1, 5, 29, 3, 6628);1761;(1, 5, 29, 1, 1761);ויקרא;3;1;ויקרא את שמו נח לאמר זה ינחמנו ממעשנו ומעצבון ידינו מן האדמה אשר אררה יהוה
(126970, -93, 4);40;מ;6721;(1, 5, 30, 36, 6721);1785;(1, 5, 30, 10, 1785);וחמש;3;10;ויחי למך אחרי הולידו את נח חמש ותשעים שנה וחמש מאת שנה ויולד בנים ובנות
(126970, -93, 4);40;ם;6814;(1, 5, 32, 33, 6814);1813;(1, 5, 32, 12, 1813);חם;2;12;ויהי נח בן חמש מאות שנה ויולד נח את שם את חם ואת יפת
(126970, -93, 4);300;ש;6907;(1, 6, 2, 49, 6907);1840;(1, 6, 2, 14, 1840);אשר;2;14;ויראו בני האלהים את בנות האדם כי טבת הנה ויקחו להם נשים מכל אשר בחרו
(126970, -93, 4);1;א;7000;(1, 6, 4, 31, 7000);1865;(1, 6, 4, 9, 1865);אשר;1;9;הנפלים היו בארץ בימים ההם וגם אחרי כן אשר יבאו בני האלהים אל בנות האדם וילדו להם המה הגברים אשר מעולם אנשי השם
(126970, -93, 4);30;ל;7093;(1, 6, 5, 36, 7093);1890;(1, 6, 5, 11, 1890);לבו;1;11;וירא יהוה כי רבה רעת האדם בארץ וכל יצר מחשבת לבו רק רע כל היום
(126970, -93, 4);5;ה;7186;(1, 6, 7, 46, 7186);1917;(1, 6, 7, 13, 1917);בהמה;2;13;ויאמר יהוה אמחה את האדם אשר בראתי מעל פני האדמה מאדם עד בהמה עד רמש ועד עוף השמים כי נחמתי כי עשיתם
(126970, -93, 4);30;ל;7279;(1, 6, 9, 44, 7279);1943;(1, 6, 9, 12, 1943);התהלך;4;12;אלה תולדת נח נח איש צדיק תמים היה בדרתיו את האלהים התהלך נח
(126970, -93, 4);10;י;7372;(1, 6, 12, 30, 7372);1969;(1, 6, 12, 8, 1969);השחית;4;8;וירא אלהים את הארץ והנה נשחתה כי השחית כל בשר את דרכו על הארץ
(126970, -93, 4);80;פ;7465;(1, 6, 14, 13, 7465);1997;(1, 6, 14, 5, 1997);גפר;2;5;עשה לך תבת עצי גפר קנים תעשה את התבה וכפרת אתה מבית ומחוץ בכפר
(126970, -93, 4);90;צ;7558;(1, 6, 16, 1, 7558);2022;(1, 6, 16, 1, 2022);צהר;1;1;צהר תעשה לתבה ואל אמה תכלנה מלמעלה ופתח התבה בצדה תשים תחתים שנים ושלשים תעשה
(126970, -93, 4);8;ח;7651;(1, 6, 17, 31, 7651);2045;(1, 6, 17, 9, 2045);לשחת;3;9;ואני הנני מביא את המבול מים על הארץ לשחת כל בשר אשר בו רוח חיים מתחת השמים כל אשר בארץ יגוע
(126970, -93, 4);20;כ;7744;(1, 6, 19, 3, 7744);2071;(1, 6, 19, 1, 2071);ומכל;3;1;ומכל החי מכל בשר שנים מכל תביא אל התבה להחית אתך זכר ונקבה יהיו
(126970, -93, 4);40;מ;7837;(1, 6, 20, 46, 7837);2095;(1, 6, 20, 11, 2095);מכל;1;11;מהעוף למינהו ומן הבהמה למינה מכל רמש האדמה למינהו שנים מכל יבאו אליך להחיות
(126970, -93, 4);1;א;7930;(1, 7, 1, 3, 7930);2121;(1, 7, 1, 1, 2121);ויאמר;3;1;ויאמר יהוה לנח בא אתה וכל ביתך אל התבה כי אתך ראיתי צדיק לפני בדור הזה
(126970, -93, 4);5;ה;8023;(1, 7, 2, 41, 8023);2147;(1, 7, 2, 11, 2147);הבהמה;3;11;מכל הבהמה הטהורה תקח לך שבעה שבעה איש ואשתו ומן הבהמה אשר לא טהרה הוא שנים איש ואשתו
(126970, -93, 4);9;ט;8116;(1, 7, 4, 21, 8116);2173;(1, 7, 4, 6, 2173);ממטיר;3;6;כי לימים עוד שבעה אנכי ממטיר על הארץ ארבעים יום וארבעים לילה ומחיתי את כל היקום אשר עשיתי מעל פני האדמה
(126970, -93, 4);400;ת;8209;(1, 7, 6, 11, 8209);2198;(1, 7, 6, 4, 2198);מאות;4;4;ונח בן שש מאות שנה והמבול היה מים על הארץ
(126970, -93, 4);50;נ;8302;(1, 7, 8, 28, 8302);2223;(1, 7, 8, 7, 2223);איננה;4;7;מן הבהמה הטהורה ומן הבהמה אשר איננה טהרה ומן העוף וכל אשר רמש על האדמה
(126970, -93, 4);2;ב;8395;(1, 7, 10, 20, 8395);2250;(1, 7, 10, 5, 2250);המבול;3;5;ויהי לשבעת הימים ומי המבול היו על הארץ
(126970, -93, 4);400;ת;8488;(1, 7, 11, 82, 8488);2275;(1, 7, 11, 22, 2275);נפתחו;3;22;בשנת שש מאות שנה לחיי נח בחדש השני בשבעה עשר יום לחדש ביום הזה נבקעו כל מעינות תהום רבה וארבת השמים נפתחו
(126970, -93, 4);5;ה;8581;(1, 7, 13, 57, 8581);2301;(1, 7, 13, 18, 2301);התבה;4;18;בעצם היום הזה בא נח ושם וחם ויפת בני נח ואשת נח ושלשת נשי בניו אתם אל התבה
(126970, -93, 4);10;י;8674;(1, 7, 15, 18, 8674);2327;(1, 7, 15, 6, 2327);שנים;3;6;ויבאו אל נח אל התבה שנים שנים מכל הבשר אשר בו רוח חיים
(126970, -93, 4);40;ם;8767;(1, 7, 17, 18, 8767);2351;(1, 7, 17, 4, 2351);יום;3;4;ויהי המבול ארבעים יום על הארץ וירבו המים וישאו את התבה ותרם מעל הארץ
(126970, -93, 4);4;ד;8860;(1, 7, 19, 15, 8860);2376;(1, 7, 19, 4, 2376);מאד;3;4;והמים גברו מאד מאד על הארץ ויכסו כל ההרים הגבהים אשר תחת כל השמים
(126970, -93, 4);70;ע;8953;(1, 7, 21, 22, 8953);2401;(1, 7, 21, 7, 2401);בעוף;2;7;ויגוע כל בשר הרמש על הארץ בעוף ובבהמה ובחיה ובכל השרץ השרץ על הארץ וכל האדם
(126970, -93, 4);50;נ;9046;(1, 7, 23, 20, 9046);2427;(1, 7, 23, 7, 2427);פני;2;7;וימח את כל היקום אשר על פני האדמה מאדם עד בהמה עד רמש ועד עוף השמים וימחו מן הארץ וישאר אך נח ואשר אתו בתבה
(126970, -93, 4);10;י;9139;(1, 8, 1, 2, 9139);2453;(1, 8, 1, 1, 2453);ויזכר;2;1;ויזכר אלהים את נח ואת כל החיה ואת כל הבהמה אשר אתו בתבה ויעבר אלהים רוח על הארץ וישכו המים
(126970, -93, 4);10;י;9232;(1, 8, 2, 24, 9232);2477;(1, 8, 2, 5, 2477);השמים;4;5;ויסכרו מעינת תהום וארבת השמים ויכלא הגשם מן השמים
(126970, -93, 4);200;ר;9325;(1, 8, 4, 26, 9325);2499;(1, 8, 4, 6, 2499);עשר;3;6;ותנח התבה בחדש השביעי בשבעה עשר יום לחדש על הרי אררט
(126970, -93, 4);8;ח;9418;(1, 8, 6, 21, 9418);2522;(1, 8, 6, 5, 2522);ויפתח;5;5;ויהי מקץ ארבעים יום ויפתח נח את חלון התבה אשר עשה
(126970, -93, 4);10;י;9511;(1, 8, 8, 35, 9511);2548;(1, 8, 8, 9, 2548);פני;3;9;וישלח את היונה מאתו לראות הקלו המים מעל פני האדמה
(126970, -93, 4);70;ע;9604;(1, 8, 10, 5, 9604);2575;(1, 8, 10, 2, 2575);עוד;1;2;ויחל עוד שבעת ימים אחרים ויסף שלח את היונה מן התבה
(126970, -93, 4);90;ץ;9697;(1, 8, 11, 58, 9697);2601;(1, 8, 11, 17, 2601);הארץ;4;17;ותבא אליו היונה לעת ערב והנה עלה זית טרף בפיה וידע נח כי קלו המים מעל הארץ
(126970, -93, 4);30;ל;9790;(1, 8, 13, 43, 9790);2625;(1, 8, 13, 11, 2625);מעל;3;11;ויהי באחת ושש מאות שנה בראשון באחד לחדש חרבו המים מעל הארץ ויסר נח את מכסה התבה וירא והנה חרבו פני האדמה
(126970, -93, 4);200;ר;9883;(1, 8, 15, 18, 9883);2649;(1, 8, 15, 5, 2649);לאמר;4;5;וידבר אלהים אל נח לאמר
(126970, -93, 4);200;ר;9976;(1, 8, 17, 61, 9976);2675;(1, 8, 17, 17, 2675);בארץ;3;17;כל החיה אשר אתך מכל בשר בעוף ובבהמה ובכל הרמש הרמש על הארץ הוצא אתך ושרצו בארץ ופרו ורבו על הארץ
(126970, -93, 4);6;ו;10069;(1, 8, 20, 1, 10069);2701;(1, 8, 20, 1, 2701);ויבן;1;1;ויבן נח מזבח ליהוה ויקח מכל הבהמה הטהרה ומכל העוף הטהור ויעל עלת במזבח
(126970, -93, 4);80;ף;10162;(1, 8, 21, 37, 10162);2725;(1, 8, 21, 11, 2725);אסף;3;11;וירח יהוה את ריח הניחח ויאמר יהוה אל לבו לא אסף לקלל עוד את האדמה בעבור האדם כי יצר לב האדם רע מנעריו ולא אסף עוד להכות את כל חי כאשר עשיתי
(126970, -93, 4);200;ר;10255;(1, 8, 22, 22, 10255);2753;(1, 8, 22, 7, 2753);וקר;3;7;עד כל ימי הארץ זרע וקציר וקר וחם וקיץ וחרף ויום ולילה לא ישבתו
(126970, -93, 4);20;כ;10348;(1, 9, 2, 19, 10348);2778;(1, 9, 2, 5, 2778);כל;1;5;ומוראכם וחתכם יהיה על כל חית הארץ ועל כל עוף השמים בכל אשר תרמש האדמה ובכל דגי הים בידכם נתנו
(126970, -93, 4);20;כ;10441;(1, 9, 3, 38, 10441);2805;(1, 9, 3, 12, 2805);לכם;2;12;כל רמש אשר הוא חי לכם יהיה לאכלה כירק עשב נתתי לכם את כל
(126970, -93, 4);80;פ;10534;(1, 9, 6, 2, 10534);2832;(1, 9, 6, 1, 2832);שפך;2;1;שפך דם האדם באדם דמו ישפך כי בצלם אלהים עשה את האדם
(126970, -93, 4);1;א;10627;(1, 9, 9, 2, 10627);2859;(1, 9, 9, 1, 2859);ואני;2;1;ואני הנני מקים את בריתי אתכם ואת זרעכם אחריכם
(126970, -93, 4);8;ח;10720;(1, 9, 10, 58, 10720);2884;(1, 9, 10, 17, 2884);חית;1;17;ואת כל נפש החיה אשר אתכם בעוף בבהמה ובכל חית הארץ אתכם מכל יצאי התבה לכל חית הארץ
(126970, -93, 4);1;א;10813;(1, 9, 12, 25, 10813);2909;(1, 9, 12, 7, 2909);אני;1;7;ויאמר אלהים זאת אות הברית אשר אני נתן ביני וביניכם ובין כל נפש חיה אשר אתכם לדרת עולם
(126970, -93, 4);50;נ;10906;(1, 9, 14, 11, 10906);2933;(1, 9, 14, 3, 2933);ענן;2;3;והיה בענני ענן על הארץ ונראתה הקשת בענן
(126970, -93, 4);300;ש;10999;(1, 9, 15, 72, 10999);2958;(1, 9, 15, 20, 2958);בשר;2;20;וזכרתי את בריתי אשר ביני וביניכם ובין כל נפש חיה בכל בשר ולא יהיה עוד המים למבול לשחת כל בשר
(126970, -93, 4);400;ת;11092;(1, 9, 17, 25, 11092);2983;(1, 9, 17, 7, 2983);הברית;5;7;ויאמר אלהים אל נח זאת אות הברית אשר הקמתי ביני ובין כל בשר אשר על הארץ
(126970, -93, 4);80;פ;11185;(1, 9, 19, 19, 11185);3011;(1, 9, 19, 6, 3011);נפצה;2;6;שלשה אלה בני נח ומאלה נפצה כל הארץ
