(122220, -67, 4);2;ב;231162;(4, 26, 3, 4, 231162);60994;(4, 26, 3, 1, 60994);וידבר;4;1;וידבר משה ואלעזר הכהן אתם בערבת מואב על ירדן ירחו לאמר
(122220, -67, 4);5;ה;231229;(4, 26, 4, 27, 231229);61011;(4, 26, 4, 7, 61011);יהוה;4;7;מבן עשרים שנה ומעלה כאשר צוה יהוה את משה ובני ישראל היצאים מארץ מצרים
(122220, -67, 4);80;פ;231296;(4, 26, 5, 38, 231296);61027;(4, 26, 5, 9, 61027);לפלוא;2;9;ראובן בכור ישראל בני ראובן חנוך משפחת החנכי לפלוא משפחת הפלאי
(122220, -67, 4);100;ק;231363;(4, 26, 7, 22, 231363);61040;(4, 26, 7, 5, 61040);פקדיהם;2;5;אלה משפחת הראובני ויהיו פקדיהם שלשה וארבעים אלף ושבע מאות ושלשים
(122220, -67, 4);10;י;231430;(4, 26, 9, 22, 231430);61054;(4, 26, 9, 5, 61054);ואבירם;4;5;ובני אליאב נמואל ודתן ואבירם הוא דתן ואבירם קרואי העדה אשר הצו על משה ועל אהרן בעדת קרח בהצתם על יהוה
(122220, -67, 4);200;ר;231497;(4, 26, 10, 8, 231497);61072;(4, 26, 10, 2, 61072);הארץ;3;2;ותפתח הארץ את פיה ותבלע אתם ואת קרח במות העדה באכל האש את חמשים ומאתים איש ויהיו לנס
(122220, -67, 4);30;ל;231564;(4, 26, 11, 8, 231564);61091;(4, 26, 11, 3, 61091);לא;1;3;ובני קרח לא מתו
(122220, -67, 4);10;י;231631;(4, 26, 12, 63, 231631);61104;(4, 26, 12, 12, 61104);היכיני;4;12;בני שמעון למשפחתם לנמואל משפחת הנמואלי לימין משפחת הימיני ליכין משפחת היכיני
(122220, -67, 4);50;נ;231698;(4, 26, 15, 2, 231698);61118;(4, 26, 15, 1, 61118);בני;2;1;בני גד למשפחתם לצפון משפחת הצפוני לחגי משפחת החגי לשוני משפחת השוני
(122220, -67, 4);7;ז;231765;(4, 26, 16, 13, 231765);61132;(4, 26, 16, 3, 61132);האזני;3;3;לאזני משפחת האזני לערי משפחת הערי
(122220, -67, 4);5;ה;231832;(4, 26, 18, 19, 231832);61146;(4, 26, 18, 5, 61146);לפקדיהם;6;5;אלה משפחת בני גד לפקדיהם ארבעים אלף וחמש מאות
(122220, -67, 4);40;מ;231899;(4, 26, 20, 15, 231899);61163;(4, 26, 20, 4, 61163);למשפחתם;2;4;ויהיו בני יהודה למשפחתם לשלה משפחת השלני לפרץ משפחת הפרצי לזרח משפחת הזרחי
(122220, -67, 4);8;ח;231966;(4, 26, 21, 20, 231966);61177;(4, 26, 21, 5, 61177);משפחת;4;5;ויהיו בני פרץ לחצרן משפחת החצרני לחמול משפחת החמולי
(122220, -67, 4);10;י;232033;(4, 26, 23, 4, 232033);61192;(4, 26, 23, 2, 61192);יששכר;1;2;בני יששכר למשפחתם תולע משפחת התולעי לפוה משפחת הפוני
(122220, -67, 4);300;ש;232100;(4, 26, 24, 27, 232100);61205;(4, 26, 24, 6, 61205);השמרני;2;6;לישוב משפחת הישבי לשמרן משפחת השמרני
(122220, -67, 4);80;פ;232167;(4, 26, 26, 22, 232167);61219;(4, 26, 26, 5, 61219);משפחת;3;5;בני זבולן למשפחתם לסרד משפחת הסרדי לאלון משפחת האלני ליחלאל משפחת היחלאלי
(122220, -67, 4);1;א;232234;(4, 26, 27, 27, 232234);61232;(4, 26, 27, 6, 61232);אלף;1;6;אלה משפחת הזבולני לפקדיהם ששים אלף וחמש מאות
(122220, -67, 4);4;ד;232301;(4, 26, 29, 33, 232301);61246;(4, 26, 29, 7, 61246);הוליד;5;7;בני מנשה למכיר משפחת המכירי ומכיר הוליד את גלעד לגלעד משפחת הגלעדי
(122220, -67, 4);200;ר;232368;(4, 26, 31, 4, 232368);61261;(4, 26, 31, 1, 61261);ואשריאל;4;1;ואשריאל משפחת האשראלי ושכם משפחת השכמי
(122220, -67, 4);4;ד;232435;(4, 26, 33, 6, 232435);61273;(4, 26, 33, 1, 61273);וצלפחד;6;1;וצלפחד בן חפר לא היו לו בנים כי אם בנות ושם בנות צלפחד מחלה ונעה חגלה מלכה ותרצה
(122220, -67, 4);50;נ;232502;(4, 26, 34, 10, 232502);61293;(4, 26, 34, 3, 61293);מנשה;2;3;אלה משפחת מנשה ופקדיהם שנים וחמשים אלף ושבע מאות
(122220, -67, 4);2;ב;232569;(4, 26, 35, 37, 232569);61307;(4, 26, 35, 8, 61307);לבכר;2;8;אלה בני אפרים למשפחתם לשותלח משפחת השתלחי לבכר משפחת הבכרי לתחן משפחת התחני
(122220, -67, 4);10;י;232636;(4, 26, 37, 15, 232636);61322;(4, 26, 37, 4, 61322);אפרים;4;4;אלה משפחת בני אפרים לפקדיהם שנים ושלשים אלף וחמש מאות אלה בני יוסף למשפחתם
(122220, -67, 4);300;ש;232703;(4, 26, 38, 21, 232703);61337;(4, 26, 38, 5, 61337);משפחת;2;5;בני בנימן למשפחתם לבלע משפחת הבלעי לאשבל משפחת האשבלי לאחירם משפחת האחירמי
(122220, -67, 4);80;פ;232770;(4, 26, 39, 25, 232770);61349;(4, 26, 39, 5, 61349);משפחת;3;5;לשפופם משפחת השופמי לחופם משפחת החופמי
(122220, -67, 4);80;פ;232837;(4, 26, 41, 15, 232837);61364;(4, 26, 41, 4, 61364);למשפחתם;4;4;אלה בני בנימן למשפחתם ופקדיהם חמשה וארבעים אלף ושש מאות
(122220, -67, 4);300;ש;232904;(4, 26, 42, 36, 232904);61379;(4, 26, 42, 9, 61379);משפחת;2;9;אלה בני דן למשפחתם לשוחם משפחת השוחמי אלה משפחת דן למשפחתם
(122220, -67, 4);40;ם;232971;(4, 26, 44, 13, 232971);61393;(4, 26, 44, 3, 61393);למשפחתם;7;3;בני אשר למשפחתם לימנה משפחת הימנה לישוי משפחת הישוי לבריעה משפחת הבריעי
(122220, -67, 4);8;ח;233038;(4, 26, 45, 20, 233038);61407;(4, 26, 45, 5, 61407);החברי;2;5;לבני בריעה לחבר משפחת החברי למלכיאל משפחת המלכיאלי
(122220, -67, 4);30;ל;233105;(4, 26, 47, 33, 233105);61422;(4, 26, 47, 8, 61422);אלף;2;8;אלה משפחת בני אשר לפקדיהם שלשה וחמשים אלף וארבע מאות
(122220, -67, 4);400;ת;233172;(4, 26, 49, 9, 233172);61435;(4, 26, 49, 2, 61435);משפחת;5;2;ליצר משפחת היצרי לשלם משפחת השלמי
(122220, -67, 4);1;א;233239;(4, 26, 50, 48, 233239);61449;(4, 26, 50, 10, 61449);מאות;2;10;אלה משפחת נפתלי למשפחתם ופקדיהם חמשה וארבעים אלף וארבע מאות
(122220, -67, 4);400;ת;233306;(4, 26, 53, 5, 233306);61467;(4, 26, 53, 2, 61467);תחלק;1;2;לאלה תחלק הארץ בנחלה במספר שמות
(122220, -67, 4);6;ו;233373;(4, 26, 54, 46, 233373);61482;(4, 26, 54, 11, 61482);נחלתו;5;11;לרב תרבה נחלתו ולמעט תמעיט נחלתו איש לפי פקדיו יתן נחלתו
(122220, -67, 4);80;פ;233440;(4, 26, 57, 5, 233440);61501;(4, 26, 57, 2, 61501);פקודי;1;2;ואלה פקודי הלוי למשפחתם לגרשון משפחת הגרשני לקהת משפחת הקהתי למררי משפחת המררי
(122220, -67, 4);80;פ;233507;(4, 26, 58, 6, 233507);61514;(4, 26, 58, 2, 61514);משפחת;3;2;אלה משפחת לוי משפחת הלבני משפחת החברני משפחת המחלי משפחת המושי משפחת הקרחי וקהת הולד את עמרם
(122220, -67, 4);70;ע;233574;(4, 26, 58, 73, 233574);61529;(4, 26, 58, 17, 61529);עמרם;1;17;אלה משפחת לוי משפחת הלבני משפחת החברני משפחת המחלי משפחת המושי משפחת הקרחי וקהת הולד את עמרם
(122220, -67, 4);400;ת;233641;(4, 26, 59, 64, 233641);61547;(4, 26, 59, 18, 61547);ואת;3;18;ושם אשת עמרם יוכבד בת לוי אשר ילדה אתה ללוי במצרים ותלד לעמרם את אהרן ואת משה ואת מרים אחתם
(122220, -67, 4);2;ב;233708;(4, 26, 61, 20, 233708);61563;(4, 26, 61, 4, 61563);בהקריבם;6;4;וימת נדב ואביהוא בהקריבם אש זרה לפני יהוה
(122220, -67, 4);6;ו;233775;(4, 26, 62, 53, 233775);61581;(4, 26, 62, 14, 61581);בתוך;3;14;ויהיו פקדיהם שלשה ועשרים אלף כל זכר מבן חדש ומעלה כי לא התפקדו בתוך בני ישראל כי לא נתן להם נחלה בתוך בני ישראל
(122220, -67, 4);50;נ;233842;(4, 26, 63, 32, 233842);61600;(4, 26, 63, 9, 61600);בני;2;9;אלה פקודי משה ואלעזר הכהן אשר פקדו את בני ישראל בערבת מואב על ירדן ירחו
(122220, -67, 4);50;נ;233909;(4, 26, 64, 42, 233909);61618;(4, 26, 64, 12, 61618);בני;2;12;ובאלה לא היה איש מפקודי משה ואהרן הכהן אשר פקדו את בני ישראל במדבר סיני
(122220, -67, 4);10;י;233976;(4, 26, 65, 52, 233976);61638;(4, 26, 65, 17, 61638);ויהושע;2;17;כי אמר יהוה להם מות ימתו במדבר ולא נותר מהם איש כי אם כלב בן יפנה ויהושע בן נון
(122220, -67, 4);30;ל;234043;(4, 27, 1, 58, 234043);61656;(4, 27, 1, 16, 61656);ואלה;3;16;ותקרבנה בנות צלפחד בן חפר בן גלעד בן מכיר בן מנשה למשפחת מנשה בן יוסף ואלה שמות בנתיו מחלה נעה וחגלה ומלכה ותרצה
(122220, -67, 4);50;נ;234110;(4, 27, 2, 35, 234110);61671;(4, 27, 2, 8, 61671);הנשיאם;2;8;ותעמדנה לפני משה ולפני אלעזר הכהן ולפני הנשיאם וכל העדה פתח אהל מועד לאמר
(122220, -67, 4);5;ה;234177;(4, 27, 3, 42, 234177);61688;(4, 27, 3, 11, 61688);יהוה;4;11;אבינו מת במדבר והוא לא היה בתוך העדה הנועדים על יהוה בעדת קרח כי בחטאו מת ובנים לא היו לו
(122220, -67, 4);6;ו;234244;(4, 27, 4, 39, 234244);61709;(4, 27, 4, 12, 61709);לנו;3;12;למה יגרע שם אבינו מתוך משפחתו כי אין לו בן תנה לנו אחזה בתוך אחי אבינו
(122220, -67, 4);8;ח;234311;(4, 27, 7, 10, 234311);61727;(4, 27, 7, 3, 61727);צלפחד;4;3;כן בנות צלפחד דברת נתן תתן להם אחזת נחלה בתוך אחי אביהם והעברת את נחלת אביהן להן
(122220, -67, 4);4;ד;234378;(4, 27, 8, 13, 234378);61745;(4, 27, 8, 4, 61745);תדבר;2;4;ואל בני ישראל תדבר לאמר איש כי ימות ובן אין לו והעברתם את נחלתו לבתו
(122220, -67, 4);10;י;234445;(4, 27, 9, 26, 234445);61764;(4, 27, 9, 8, 61764);לאחיו;4;8;ואם אין לו בת ונתתם את נחלתו לאחיו
(122220, -67, 4);100;ק;234512;(4, 27, 11, 34, 234512);61782;(4, 27, 11, 9, 61782);הקרב;2;9;ואם אין אחים לאביו ונתתם את נחלתו לשארו הקרב אליו ממשפחתו וירש אתה והיתה לבני ישראל לחקת משפט כאשר צוה יהוה את משה
(122220, -67, 4);5;ה;234579;(4, 27, 12, 9, 234579);61798;(4, 27, 12, 2, 61798);יהוה;4;2;ויאמר יהוה אל משה עלה אל הר העברים הזה וראה את הארץ אשר נתתי לבני ישראל
(122220, -67, 4);10;י;234646;(4, 27, 13, 20, 234646);61817;(4, 27, 13, 5, 61817);עמיך;3;5;וראיתה אתה ונאספת אל עמיך גם אתה כאשר נאסף אהרן אחיך
(122220, -67, 4);10;י;234713;(4, 27, 14, 45, 234713);61833;(4, 27, 14, 10, 61833);לעיניהם;5;10;כאשר מריתם פי במדבר צן במריבת העדה להקדישני במים לעיניהם הם מי מריבת קדש מדבר צן
(122220, -67, 4);5;ה;234780;(4, 27, 16, 29, 234780);61853;(4, 27, 16, 9, 61853);העדה;1;9;יפקד יהוה אלהי הרוחת לכל בשר איש על העדה
(122220, -67, 4);300;ש;234847;(4, 27, 17, 64, 234847);61869;(4, 27, 17, 16, 61869);אשר;2;16;אשר יצא לפניהם ואשר יבא לפניהם ואשר יוציאם ואשר יביאם ולא תהיה עדת יהוה כצאן אשר אין להם רעה
(122220, -67, 4);5;ה;234914;(4, 27, 19, 2, 234914);61891;(4, 27, 19, 1, 61891);והעמדת;2;1;והעמדת אתו לפני אלעזר הכהן ולפני כל העדה וצויתה אתו לעיניהם
(122220, -67, 4);300;ש;234981;(4, 27, 20, 20, 234981);61906;(4, 27, 20, 5, 61906);ישמעו;2;5;ונתתה מהודך עליו למען ישמעו כל עדת בני ישראל
(122220, -67, 4);1;א;235048;(4, 27, 21, 51, 235048);61923;(4, 27, 21, 13, 61923);יצאו;3;13;ולפני אלעזר הכהן יעמד ושאל לו במשפט האורים לפני יהוה על פיו יצאו ועל פיו יבאו הוא וכל בני ישראל אתו וכל העדה
(122220, -67, 4);70;ע;235115;(4, 27, 22, 32, 235115);61942;(4, 27, 22, 9, 61942);יהושע;5;9;ויעש משה כאשר צוה יהוה אתו ויקח את יהושע ויעמדהו לפני אלעזר הכהן ולפני כל העדה
(122220, -67, 4);40;מ;235182;(4, 27, 23, 36, 235182);61959;(4, 27, 23, 10, 61959);משה;1;10;ויסמך את ידיו עליו ויצוהו כאשר דבר יהוה ביד משה
(122220, -67, 4);40;מ;235249;(4, 28, 2, 47, 235249);61977;(4, 28, 2, 13, 61977);תשמרו;3;13;צו את בני ישראל ואמרת אלהם את קרבני לחמי לאשי ריח ניחחי תשמרו להקריב לי במועדו
(122220, -67, 4);6;ו;235316;(4, 28, 3, 51, 235316);61993;(4, 28, 3, 13, 61993);ליום;3;13;ואמרת להם זה האשה אשר תקריבו ליהוה כבשים בני שנה תמימם שנים ליום עלה תמיד
(122220, -67, 4);50;נ;235383;(4, 28, 5, 18, 235383);62010;(4, 28, 5, 4, 62010);למנחה;3;4;ועשירית האיפה סלת למנחה בלולה בשמן כתית רביעת ההין
(122220, -67, 4);10;י;235450;(4, 28, 7, 8, 235450);62026;(4, 28, 7, 2, 62026);רביעת;3;2;ונסכו רביעת ההין לכבש האחד בקדש הסך נסך שכר ליהוה
(122220, -67, 4);20;כ;235517;(4, 28, 8, 35, 235517);62043;(4, 28, 8, 9, 62043);וכנסכו;2;9;ואת הכבש השני תעשה בין הערבים כמנחת הבקר וכנסכו תעשה אשה ריח ניחח ליהוה
(122220, -67, 4);8;ח;235584;(4, 28, 9, 44, 235584);62059;(4, 28, 9, 11, 62059);מנחה;3;11;וביום השבת שני כבשים בני שנה תמימם ושני עשרנים סלת מנחה בלולה בשמן ונסכו
(122220, -67, 4);5;ה;235651;(4, 28, 11, 26, 235651);62074;(4, 28, 11, 5, 62074);ליהוה;5;5;ובראשי חדשיכם תקריבו עלה ליהוה פרים בני בקר שנים ואיל אחד כבשים בני שנה שבעה תמימם
(122220, -67, 4);40;מ;235718;(4, 28, 12, 26, 235718);62091;(4, 28, 12, 6, 62091);בשמן;3;6;ושלשה עשרנים סלת מנחה בלולה בשמן לפר האחד ושני עשרנים סלת מנחה בלולה בשמן לאיל האחד
(122220, -67, 4);40;מ;235785;(4, 28, 13, 25, 235785);62107;(4, 28, 13, 6, 62107);בשמן;3;6;ועשרן עשרון סלת מנחה בלולה בשמן לכבש האחד עלה ריח ניחח אשה ליהוה
(122220, -67, 4);70;ע;235852;(4, 28, 14, 40, 235852);62123;(4, 28, 14, 9, 62123);ורביעת;5;9;ונסכיהם חצי ההין יהיה לפר ושלישת ההין לאיל ורביעת ההין לכבש יין זאת עלת חדש בחדשו לחדשי השנה
(122220, -67, 4);4;ד;235919;(4, 28, 15, 32, 235919);62140;(4, 28, 15, 8, 62140);התמיד;5;8;ושעיר עזים אחד לחטאת ליהוה על עלת התמיד יעשה ונסכו
(122220, -67, 4);2;ב;235986;(4, 28, 17, 23, 235986);62157;(4, 28, 17, 7, 62157);שבעת;2;7;ובחמשה עשר יום לחדש הזה חג שבעת ימים מצות יאכל
(122220, -67, 4);80;פ;236053;(4, 28, 19, 19, 236053);62174;(4, 28, 19, 5, 62174);פרים;1;5;והקרבתם אשה עלה ליהוה פרים בני בקר שנים ואיל אחד ושבעה כבשים בני שנה תמימם יהיו לכם
(122220, -67, 4);300;ש;236120;(4, 28, 20, 19, 236120);62191;(4, 28, 20, 5, 62191);שלשה;1;5;ומנחתם סלת בלולה בשמן שלשה עשרנים לפר ושני עשרנים לאיל תעשו
(122220, -67, 4);10;י;236187;(4, 28, 22, 4, 236187);62205;(4, 28, 22, 1, 62205);ושעיר;4;1;ושעיר חטאת אחד לכפר עליכם
(122220, -67, 4);40;מ;236254;(4, 28, 24, 18, 236254);62223;(4, 28, 24, 5, 62223);ימים;2;5;כאלה תעשו ליום שבעת ימים לחם אשה ריח ניחח ליהוה על עולת התמיד יעשה ונסכו
(122220, -67, 4);30;ל;236321;(4, 28, 25, 27, 236321);62240;(4, 28, 25, 7, 62240);כל;2;7;וביום השביעי מקרא קדש יהיה לכם כל מלאכת עבדה לא תעשו
(122220, -67, 4);5;ה;236388;(4, 28, 26, 52, 236388);62254;(4, 28, 26, 10, 62254);יהיה;4;10;וביום הבכורים בהקריבכם מנחה חדשה ליהוה בשבעתיכם מקרא קדש יהיה לכם כל מלאכת עבדה לא תעשו
(122220, -67, 4);70;ע;236455;(4, 28, 27, 47, 236455);62272;(4, 28, 27, 12, 62272);שבעה;3;12;והקרבתם עולה לריח ניחח ליהוה פרים בני בקר שנים איל אחד שבעה כבשים בני שנה
(122220, -67, 4);200;ר;236522;(4, 28, 29, 3, 236522);62288;(4, 28, 29, 1, 62288);עשרון;3;1;עשרון עשרון לכבש האחד לשבעת הכבשים
(122220, -67, 4);300;ש;236589;(4, 28, 31, 21, 236589);62303;(4, 28, 31, 5, 62303);תעשו;3;5;מלבד עלת התמיד ומנחתו תעשו תמימם יהיו לכם ונסכיהם
(122220, -67, 4);400;ת;236656;(4, 29, 1, 47, 236656);62320;(4, 29, 1, 13, 62320);תעשו;1;13;ובחדש השביעי באחד לחדש מקרא קדש יהיה לכם כל מלאכת עבדה לא תעשו יום תרועה יהיה לכם
(122220, -67, 4);5;ה;236723;(4, 29, 2, 49, 236723);62338;(4, 29, 2, 14, 62338);שנה;3;14;ועשיתם עלה לריח ניחח ליהוה פר בן בקר אחד איל אחד כבשים בני שנה שבעה תמימם
(122220, -67, 4);5;ה;236790;(4, 29, 4, 14, 236790);62354;(4, 29, 4, 4, 62354);האחד;1;4;ועשרון אחד לכבש האחד לשבעת הכבשים
(122220, -67, 4);40;מ;236857;(4, 29, 6, 28, 236857);62369;(4, 29, 6, 7, 62369);ומנחתה;2;7;מלבד עלת החדש ומנחתה ועלת התמיד ומנחתה ונסכיהם כמשפטם לריח ניחח אשה ליהוה
(122220, -67, 4);6;ו;236924;(4, 29, 7, 34, 236924);62384;(4, 29, 7, 9, 62384);ועניתם;1;9;ובעשור לחדש השביעי הזה מקרא קדש יהיה לכם ועניתם את נפשתיכם כל מלאכה לא תעשו
(122220, -67, 4);2;ב;236991;(4, 29, 8, 40, 236991);62402;(4, 29, 8, 12, 62402);כבשים;2;12;והקרבתם עלה ליהוה ריח ניחח פר בן בקר אחד איל אחד כבשים בני שנה שבעה תמימם יהיו לכם
(122220, -67, 4);1;א;237058;(4, 29, 9, 42, 237058);62418;(4, 29, 9, 10, 62418);לאיל;2;10;ומנחתם סלת בלולה בשמן שלשה עשרנים לפר שני עשרנים לאיל האחד
(122220, -67, 4);30;ל;237125;(4, 29, 11, 32, 237125);62433;(4, 29, 11, 8, 62433);ועלת;3;8;שעיר עזים אחד חטאת מלבד חטאת הכפרים ועלת התמיד ומנחתה ונסכיהם
(122220, -67, 4);30;ל;237192;(4, 29, 12, 48, 237192);62449;(4, 29, 12, 13, 62449);לא;1;13;ובחמשה עשר יום לחדש השביעי מקרא קדש יהיה לכם כל מלאכת עבדה לא תעשו וחגתם חג ליהוה שבעת ימים
(122220, -67, 4);200;ר;237259;(4, 29, 13, 42, 237259);62466;(4, 29, 13, 11, 62466);עשר;3;11;והקרבתם עלה אשה ריח ניחח ליהוה פרים בני בקר שלשה עשר אילם שנים כבשים בני שנה ארבעה עשר תמימם יהיו
(122220, -67, 4);200;ר;237326;(4, 29, 14, 31, 237326);62482;(4, 29, 14, 7, 62482);לפר;3;7;ומנחתם סלת בלולה בשמן שלשה עשרנים לפר האחד לשלשה עשר פרים שני עשרנים לאיל האחד לשני האילם
(122220, -67, 4);5;ה;237393;(4, 29, 15, 25, 237393);62497;(4, 29, 15, 5, 62497);לארבעה;6;5;ועשרון עשרון לכבש האחד לארבעה עשר כבשים
(122220, -67, 4);50;נ;237460;(4, 29, 17, 21, 237460);62514;(4, 29, 17, 6, 62514);שנים;2;6;וביום השני פרים בני בקר שנים עשר אילם שנים כבשים בני שנה ארבעה עשר תמימם
(122220, -67, 4);40;ם;237527;(4, 29, 18, 30, 237527);62528;(4, 29, 18, 5, 62528);ולכבשים;7;5;ומנחתם ונסכיהם לפרים לאילם ולכבשים במספרם כמשפט
(122220, -67, 4);40;ם;237594;(4, 29, 20, 15, 237594);62542;(4, 29, 20, 3, 62542);פרים;4;3;וביום השלישי פרים עשתי עשר אילם שנים כבשים בני שנה ארבעה עשר תמימם
(122220, -67, 4);300;ש;237661;(4, 29, 21, 28, 237661);62557;(4, 29, 21, 5, 62557);ולכבשים;5;5;ומנחתם ונסכיהם לפרים לאילם ולכבשים במספרם כמשפט
(122220, -67, 4);5;ה;237728;(4, 29, 23, 19, 237728);62571;(4, 29, 23, 4, 62571);עשרה;4;4;וביום הרביעי פרים עשרה אילם שנים כבשים בני שנה ארבעה עשר תמימם
(122220, -67, 4);40;ם;237795;(4, 29, 24, 35, 237795);62585;(4, 29, 24, 6, 62585);במספרם;6;6;מנחתם ונסכיהם לפרים לאילם ולכבשים במספרם כמשפט
(122220, -67, 4);300;ש;237862;(4, 29, 26, 24, 237862);62601;(4, 29, 26, 6, 62601);שנים;1;6;וביום החמישי פרים תשעה אילם שנים כבשים בני שנה ארבעה עשר תמימם
(122220, -67, 4);80;פ;237929;(4, 29, 27, 40, 237929);62614;(4, 29, 27, 7, 62614);כמשפט;4;7;ומנחתם ונסכיהם לפרים לאילם ולכבשים במספרם כמשפט
(122220, -67, 4);2;ב;237996;(4, 29, 29, 31, 237996);62630;(4, 29, 29, 8, 62630);בני;1;8;וביום הששי פרים שמנה אילם שנים כבשים בני שנה ארבעה עשר תמימם
(122220, -67, 4);1;א;238063;(4, 29, 31, 8, 238063);62643;(4, 29, 31, 2, 62643);חטאת;3;2;ושעיר חטאת אחד מלבד עלת התמיד מנחתה ונסכיה
(122220, -67, 4);200;ר;238130;(4, 29, 32, 40, 238130);62659;(4, 29, 32, 10, 62659);ארבעה;2;10;וביום השביעי פרים שבעה אילם שנים כבשים בני שנה ארבעה עשר תמימם
(122220, -67, 4);2;ב;238197;(4, 29, 34, 15, 238197);62672;(4, 29, 34, 4, 62672);מלבד;3;4;ושעיר חטאת אחד מלבד עלת התמיד מנחתה ונסכה
(122220, -67, 4);5;ה;238264;(4, 29, 36, 10, 238264);62688;(4, 29, 36, 2, 62688);עלה;3;2;והקרבתם עלה אשה ריח ניחח ליהוה פר אחד איל אחד כבשים בני שנה שבעה תמימם
(122220, -67, 4);30;ל;238331;(4, 29, 37, 21, 238331);62706;(4, 29, 37, 5, 62706);ולכבשים;2;5;מנחתם ונסכיהם לפר לאיל ולכבשים במספרם כמשפט
(122220, -67, 4);70;ע;238398;(4, 29, 39, 16, 238398);62720;(4, 29, 39, 4, 62720);במועדיכם;4;4;אלה תעשו ליהוה במועדיכם לבד מנדריכם ונדבתיכם לעלתיכם ולמנחתיכם ולנסכיכם ולשלמיכם
(122220, -67, 4);10;י;238465;(4, 30, 1, 13, 238465);62731;(4, 30, 1, 4, 62731);בני;3;4;ויאמר משה אל בני ישראל ככל אשר צוה יהוה את משה
(122220, -67, 4);5;ה;238532;(4, 30, 2, 44, 238532);62750;(4, 30, 2, 12, 62750);צוה;3;12;וידבר משה אל ראשי המטות לבני ישראל לאמר זה הדבר אשר צוה יהוה
(122220, -67, 4);5;ה;238599;(4, 30, 3, 63, 238599);62770;(4, 30, 3, 19, 62770);יעשה;4;19;איש כי ידר נדר ליהוה או השבע שבעה לאסר אסר על נפשו לא יחל דברו ככל היצא מפיו יעשה
(122220, -67, 4);30;ל;238666;(4, 30, 5, 28, 238666);62788;(4, 30, 5, 8, 62788);על;2;8;ושמע אביה את נדרה ואסרה אשר אסרה על נפשה והחריש לה אביה וקמו כל נדריה וכל אסר אשר אסרה על נפשה יקום
(122220, -67, 4);6;ו;238733;(4, 30, 6, 17, 238733);62807;(4, 30, 6, 5, 62807);ביום;3;5;ואם הניא אביה אתה ביום שמעו כל נדריה ואסריה אשר אסרה על נפשה לא יקום ויהוה יסלח לה כי הניא אביה אתה
(122220, -67, 4);6;ו;238800;(4, 30, 7, 6, 238800);62826;(4, 30, 7, 2, 62826);היו;3;2;ואם היו תהיה לאיש ונדריה עליה או מבטא שפתיה אשר אסרה על נפשה
(122220, -67, 4);6;ו;238867;(4, 30, 8, 25, 238867);62844;(4, 30, 8, 7, 62844);וקמו;1;7;ושמע אישה ביום שמעו והחריש לה וקמו נדריה ואסרה אשר אסרה על נפשה יקמו
(122220, -67, 4);30;ל;238934;(4, 30, 9, 37, 238934);62862;(4, 30, 9, 11, 62862);עליה;2;11;ואם ביום שמע אישה יניא אותה והפר את נדרה אשר עליה ואת מבטא שפתיה אשר אסרה על נפשה ויהוה יסלח לה
(122220, -67, 4);300;ש;239001;(4, 30, 10, 29, 239001);62880;(4, 30, 10, 8, 62880);נפשה;3;8;ונדר אלמנה וגרושה כל אשר אסרה על נפשה יקום עליה
(122220, -67, 4);5;ה;239068;(4, 30, 12, 24, 239068);62899;(4, 30, 12, 7, 62899);אתה;3;7;ושמע אישה והחרש לה לא הניא אתה וקמו כל נדריה וכל אסר אשר אסרה על נפשה יקום
(122220, -67, 4);400;ת;239135;(4, 30, 13, 33, 239135);62919;(4, 30, 13, 10, 62919);שפתיה;3;10;ואם הפר יפר אתם אישה ביום שמעו כל מוצא שפתיה לנדריה ולאסר נפשה לא יקום אישה הפרם ויהוה יסלח לה
