(270810, 52, 4);5;ה;227234;(4, 22, 35, 11, 227234);59938;(4, 22, 35, 3, 59938);יהוה;2;3;ויאמר מלאך יהוה אל בלעם לך עם האנשים ואפס את הדבר אשר אדבר אליך אתו תדבר וילך בלעם עם שרי בלק
(270810, 52, 4);30;ל;227286;(4, 22, 35, 63, 227286);59953;(4, 22, 35, 18, 59953);בלעם;2;18;ויאמר מלאך יהוה אל בלעם לך עם האנשים ואפס את הדבר אשר אדבר אליך אתו תדבר וילך בלעם עם שרי בלק
(270810, 52, 4);2;ב;227338;(4, 22, 36, 42, 227338);59969;(4, 22, 36, 13, 59969);גבול;2;13;וישמע בלק כי בא בלעם ויצא לקראתו אל עיר מואב אשר על גבול ארנן אשר בקצה הגבול
(270810, 52, 4);30;ל;227390;(4, 22, 37, 34, 227390);59983;(4, 22, 37, 10, 59983);לך;1;10;ויאמר בלק אל בלעם הלא שלח שלחתי אליך לקרא לך למה לא הלכת אלי האמנם לא אוכל כבדך
(270810, 52, 4);10;י;227442;(4, 22, 38, 24, 227442);59998;(4, 22, 38, 7, 59998);אליך;3;7;ויאמר בלעם אל בלק הנה באתי אליך עתה היכל אוכל דבר מאומה הדבר אשר ישים אלהים בפי אתו אדבר
(270810, 52, 4);30;ל;227494;(4, 22, 39, 6, 227494);60012;(4, 22, 39, 2, 60012);בלעם;2;2;וילך בלעם עם בלק ויבאו קרית חצות
(270810, 52, 4);1;א;227546;(4, 22, 40, 32, 227546);60025;(4, 22, 40, 8, 60025);אשר;1;8;ויזבח בלק בקר וצאן וישלח לבלעם ולשרים אשר אתו
(270810, 52, 4);40;ם;227598;(4, 22, 41, 47, 227598);60039;(4, 22, 41, 13, 60039);העם;3;13;ויהי בבקר ויקח בלק את בלעם ויעלהו במות בעל וירא משם קצה העם
(270810, 52, 4);70;ע;227650;(4, 23, 1, 52, 227650);60054;(4, 23, 1, 15, 60054);ושבעה;4;15;ויאמר בלעם אל בלק בנה לי בזה שבעה מזבחת והכן לי בזה שבעה פרים ושבעה אילים
(270810, 52, 4);200;ר;227702;(4, 23, 3, 5, 227702);60067;(4, 23, 3, 1, 60067);ויאמר;5;1;ויאמר בלעם לבלק התיצב על עלתך ואלכה אולי יקרה יהוה לקראתי ודבר מה יראני והגדתי לך וילך שפי
(270810, 52, 4);50;נ;227754;(4, 23, 3, 57, 227754);60080;(4, 23, 3, 14, 60080);יראני;4;14;ויאמר בלעם לבלק התיצב על עלתך ואלכה אולי יקרה יהוה לקראתי ודבר מה יראני והגדתי לך וילך שפי
(270810, 52, 4);400;ת;227806;(4, 23, 4, 36, 227806);60093;(4, 23, 4, 9, 60093);המזבחת;6;9;ויקר אלהים אל בלעם ויאמר אליו את שבעת המזבחת ערכתי ואעל פר ואיל במזבח
(270810, 52, 4);6;ו;227858;(4, 23, 5, 32, 227858);60108;(4, 23, 5, 10, 60108);וכה;1;10;וישם יהוה דבר בפי בלעם ויאמר שוב אל בלק וכה תדבר
(270810, 52, 4);40;מ;227910;(4, 23, 7, 12, 227910);60122;(4, 23, 7, 3, 60122);ויאמר;4;3;וישא משלו ויאמר מן ארם ינחני בלק מלך מואב מהררי קדם לכה ארה לי יעקב ולכה זעמה ישראל
(270810, 52, 4);200;ר;227962;(4, 23, 7, 64, 227962);60137;(4, 23, 7, 18, 60137);ישראל;3;18;וישא משלו ויאמר מן ארם ינחני בלק מלך מואב מהררי קדם לכה ארה לי יעקב ולכה זעמה ישראל
(270810, 52, 4);400;ת;228014;(4, 23, 9, 22, 228014);60152;(4, 23, 9, 5, 60152);ומגבעות;7;5;כי מראש צרים אראנו ומגבעות אשורנו הן עם לבדד ישכן ובגוים לא יתחשב
(270810, 52, 4);2;ב;228066;(4, 23, 10, 21, 228066);60167;(4, 23, 10, 7, 60167);רבע;2;7;מי מנה עפר יעקב ומספר את רבע ישראל תמת נפשי מות ישרים ותהי אחריתי כמהו
(270810, 52, 4);70;ע;228118;(4, 23, 11, 17, 228118);60181;(4, 23, 11, 6, 60181);עשית;1;6;ויאמר בלק אל בלעם מה עשית לי לקב איבי לקחתיך והנה ברכת ברך
(270810, 52, 4);5;ה;228170;(4, 23, 12, 23, 228170);60195;(4, 23, 12, 7, 60195);יהוה;2;7;ויען ויאמר הלא את אשר ישים יהוה בפי אתו אשמר לדבר
(270810, 52, 4);6;ו;228222;(4, 23, 13, 36, 228222);60210;(4, 23, 13, 11, 60210);תראנו;5;11;ויאמר אליו בלק לך נא אתי אל מקום אחר אשר תראנו משם אפס קצהו תראה וכלו לא תראה וקבנו לי משם
(270810, 52, 4);300;ש;228274;(4, 23, 14, 18, 228274);60225;(4, 23, 14, 5, 60225);ראש;3;5;ויקחהו שדה צפים אל ראש הפסגה ויבן שבעה מזבחת ויעל פר ואיל במזבח
(270810, 52, 4);30;ל;228326;(4, 23, 15, 19, 228326);60239;(4, 23, 15, 6, 60239);על;2;6;ויאמר אל בלק התיצב כה על עלתך ואנכי אקרה כה
(270810, 52, 4);30;ל;228378;(4, 23, 16, 37, 228378);60254;(4, 23, 16, 11, 60254);בלק;2;11;ויקר יהוה אל בלעם וישם דבר בפיו ויאמר שוב אל בלק וכה תדבר
(270810, 52, 4);5;ה;228430;(4, 23, 17, 44, 228430);60269;(4, 23, 17, 13, 60269);מה;2;13;ויבא אליו והנו נצב על עלתו ושרי מואב אתו ויאמר לו בלק מה דבר יהוה
(270810, 52, 4);30;ל;228482;(4, 23, 19, 7, 228482);60284;(4, 23, 19, 3, 60284);אל;2;3;לא איש אל ויכזב ובן אדם ויתנחם ההוא אמר ולא יעשה ודבר ולא יקימנה
(270810, 52, 4);100;ק;228534;(4, 23, 20, 8, 228534);60298;(4, 23, 20, 3, 60298);לקחתי;2;3;הנה ברך לקחתי וברך ולא אשיבנה
(270810, 52, 4);5;ה;228586;(4, 23, 21, 36, 228586);60311;(4, 23, 21, 10, 60311);אלהיו;3;10;לא הביט און ביעקב ולא ראה עמל בישראל יהוה אלהיו עמו ותרועת מלך בו
(270810, 52, 4);100;ק;228638;(4, 23, 23, 11, 228638);60325;(4, 23, 23, 4, 60325);ביעקב;4;4;כי לא נחש ביעקב ולא קסם בישראל כעת יאמר ליעקב ולישראל מה פעל אל
(270810, 52, 4);40;ם;228690;(4, 23, 24, 13, 228690);60339;(4, 23, 24, 4, 60339);יקום;4;4;הן עם כלביא יקום וכארי יתנשא לא ישכב עד יאכל טרף ודם חללים ישתה
(270810, 52, 4);3;ג;228742;(4, 23, 25, 15, 228742);60354;(4, 23, 25, 5, 60354);גם;1;5;ויאמר בלק אל בלעם גם קב לא תקבנו גם ברך לא תברכנו
(270810, 52, 4);10;י;228794;(4, 23, 26, 29, 228794);60369;(4, 23, 26, 8, 60369);אליך;3;8;ויען בלעם ויאמר אל בלק הלא דברתי אליך לאמר כל אשר ידבר יהוה אתו אעשה
(270810, 52, 4);100;ק;228846;(4, 23, 27, 27, 228846);60385;(4, 23, 27, 9, 60385);מקום;2;9;ויאמר בלק אל בלעם לכה נא אקחך אל מקום אחר אולי יישר בעיני האלהים וקבתו לי משם
(270810, 52, 4);80;פ;228898;(4, 23, 28, 18, 228898);60399;(4, 23, 28, 6, 60399);הפעור;2;6;ויקח בלק את בלעם ראש הפעור הנשקף על פני הישימן
(270810, 52, 4);5;ה;228950;(4, 23, 29, 33, 228950);60413;(4, 23, 29, 10, 60413);והכן;2;10;ויאמר בלעם אל בלק בנה לי בזה שבעה מזבחת והכן לי בזה שבעה פרים ושבעה אילם
(270810, 52, 4);30;ל;229002;(4, 23, 30, 28, 229002);60427;(4, 23, 30, 8, 60427);ואיל;4;8;ויעש בלק כאשר אמר בלעם ויעל פר ואיל במזבח
(270810, 52, 4);40;ם;229054;(4, 24, 1, 47, 229054);60441;(4, 24, 1, 13, 60441);בפעם;4;13;וירא בלעם כי טוב בעיני יהוה לברך את ישראל ולא הלך כפעם בפעם לקראת נחשים וישת אל המדבר פניו
(270810, 52, 4);300;ש;229106;(4, 24, 2, 27, 229106);60455;(4, 24, 2, 8, 60455);שכן;1;8;וישא בלעם את עיניו וירא את ישראל שכן לשבטיו ותהי עליו רוח אלהים
(270810, 52, 4);50;נ;229158;(4, 24, 3, 28, 229158);60468;(4, 24, 3, 8, 60468);ונאם;2;8;וישא משלו ויאמר נאם בלעם בנו בער ונאם הגבר שתם העין
(270810, 52, 4);40;ם;229210;(4, 24, 4, 39, 229210);60482;(4, 24, 4, 11, 60482);עינים;5;11;נאם שמע אמרי אל אשר מחזה שדי יחזה נפל וגלוי עינים
(270810, 52, 4);40;ם;229262;(4, 24, 6, 26, 229262);60494;(4, 24, 6, 6, 60494);כאהלים;6;6;כנחלים נטיו כגנת עלי נהר כאהלים נטע יהוה כארזים עלי מים
(270810, 52, 4);40;מ;229314;(4, 24, 7, 33, 229314);60508;(4, 24, 7, 9, 60508);מלכו;1;9;יזל מים מדליו וזרעו במים רבים וירם מאגג מלכו ותנשא מלכתו
(270810, 52, 4);70;ע;229366;(4, 24, 8, 39, 229366);60520;(4, 24, 8, 10, 60520);ועצמתיהם;2;10;אל מוציאו ממצרים כתועפת ראם לו יאכל גוים צריו ועצמתיהם יגרם וחציו ימחץ
(270810, 52, 4);6;ו;229418;(4, 24, 9, 33, 229418);60531;(4, 24, 9, 8, 60531);ברוך;3;8;כרע שכב כארי וכלביא מי יקימנו מברכיך ברוך וארריך ארור
(270810, 52, 4);30;ל;229470;(4, 24, 10, 41, 229470);60546;(4, 24, 10, 13, 60546);לקב;1;13;ויחר אף בלק אל בלעם ויספק את כפיו ויאמר בלק אל בלעם לקב איבי קראתיך והנה ברכת ברך זה שלש פעמים
(270810, 52, 4);200;ר;229522;(4, 24, 11, 19, 229522);60560;(4, 24, 11, 6, 60560);אמרתי;3;6;ועתה ברח לך אל מקומך אמרתי כבד אכבדך והנה מנעך יהוה מכבוד
(270810, 52, 4);20;כ;229574;(4, 24, 12, 25, 229574);60574;(4, 24, 12, 8, 60574);מלאכיך;4;8;ויאמר בלעם אל בלק הלא גם אל מלאכיך אשר שלחת אלי דברתי לאמר
(270810, 52, 4);30;ל;229626;(4, 24, 13, 31, 229626);60590;(4, 24, 13, 11, 60590);לעבר;1;11;אם יתן לי בלק מלא ביתו כסף וזהב לא אוכל לעבר את פי יהוה לעשות טובה או רעה מלבי אשר ידבר יהוה אתו אדבר
(270810, 52, 4);5;ה;229678;(4, 24, 14, 5, 229678);60605;(4, 24, 14, 2, 60605);הנני;1;2;ועתה הנני הולך לעמי לכה איעצך אשר יעשה העם הזה לעמך באחרית הימים
(270810, 52, 4);40;מ;229730;(4, 24, 15, 5, 229730);60618;(4, 24, 15, 2, 60618);משלו;1;2;וישא משלו ויאמר נאם בלעם בנו בער ונאם הגבר שתם העין
(270810, 52, 4);70;ע;229782;(4, 24, 16, 16, 229782);60632;(4, 24, 16, 5, 60632);וידע;4;5;נאם שמע אמרי אל וידע דעת עליון מחזה שדי יחזה נפל וגלוי עינים
(270810, 52, 4);1;א;229834;(4, 24, 17, 20, 229834);60645;(4, 24, 17, 5, 60645);ולא;3;5;אראנו ולא עתה אשורנו ולא קרוב דרך כוכב מיעקב וקם שבט מישראל ומחץ פאתי מואב וקרקר כל בני שת
(270810, 52, 4);400;ת;229886;(4, 24, 17, 72, 229886);60659;(4, 24, 17, 19, 60659);שת;2;19;אראנו ולא עתה אשורנו ולא קרוב דרך כוכב מיעקב וקם שבט מישראל ומחץ פאתי מואב וקרקר כל בני שת
(270810, 52, 4);5;ה;229938;(4, 24, 19, 11, 229938);60672;(4, 24, 19, 3, 60672);והאביד;2;3;וירד מיעקב והאביד שריד מעיר
(270810, 52, 4);200;ר;229990;(4, 24, 20, 40, 229990);60684;(4, 24, 20, 10, 60684);ואחריתו;4;10;וירא את עמלק וישא משלו ויאמר ראשית גוים עמלק ואחריתו עדי אבד
(270810, 52, 4);50;נ;230042;(4, 24, 21, 43, 230042);60697;(4, 24, 21, 11, 60697);קנך;2;11;וירא את הקיני וישא משלו ויאמר איתן מושבך ושים בסלע קנך
(270810, 52, 4);300;ש;230094;(4, 24, 23, 24, 230094);60713;(4, 24, 23, 7, 60713);משמו;2;7;וישא משלו ויאמר אוי מי יחיה משמו אל
(270810, 52, 4);10;י;230146;(4, 24, 25, 10, 230146);60728;(4, 24, 25, 3, 60728);וילך;2;3;ויקם בלעם וילך וישב למקמו וגם בלק הלך לדרכו
(270810, 52, 4);1;א;230198;(4, 25, 1, 27, 230198);60741;(4, 25, 1, 7, 60741);אל;1;7;וישב ישראל בשטים ויחל העם לזנות אל בנות מואב
(270810, 52, 4);6;ו;230250;(4, 25, 3, 1, 230250);60752;(4, 25, 3, 1, 60752);ויצמד;1;1;ויצמד ישראל לבעל פעור ויחר אף יהוה בישראל
(270810, 52, 4);20;כ;230302;(4, 25, 4, 19, 230302);60766;(4, 25, 4, 7, 60766);כל;1;7;ויאמר יהוה אל משה קח את כל ראשי העם והוקע אותם ליהוה נגד השמש וישב חרון אף יהוה מישראל
(270810, 52, 4);1;א;230354;(4, 25, 5, 3, 230354);60779;(4, 25, 5, 1, 60779);ויאמר;3;1;ויאמר משה אל שפטי ישראל הרגו איש אנשיו הנצמדים לבעל פעור
(270810, 52, 4);2;ב;230406;(4, 25, 6, 9, 230406);60792;(4, 25, 6, 3, 60792);מבני;2;3;והנה איש מבני ישראל בא ויקרב אל אחיו את המדינית לעיני משה ולעיני כל עדת בני ישראל והמה בכים פתח אהל מועד
(270810, 52, 4);10;י;230458;(4, 25, 6, 61, 230458);60806;(4, 25, 6, 17, 60806);ישראל;1;17;והנה איש מבני ישראל בא ויקרב אל אחיו את המדינית לעיני משה ולעיני כל עדת בני ישראל והמה בכים פתח אהל מועד
(270810, 52, 4);40;ם;230510;(4, 25, 7, 30, 230510);60819;(4, 25, 7, 8, 60819);ויקם;4;8;וירא פינחס בן אלעזר בן אהרן הכהן ויקם מתוך העדה ויקח רמח בידו
(270810, 52, 4);40;ם;230562;(4, 25, 8, 33, 230562);60833;(4, 25, 8, 9, 60833);שניהם;5;9;ויבא אחר איש ישראל אל הקבה וידקר את שניהם את איש ישראל ואת האשה אל קבתה ותעצר המגפה מעל בני ישראל
(270810, 52, 4);400;ת;230614;(4, 25, 9, 8, 230614);60847;(4, 25, 9, 2, 60847);המתים;3;2;ויהיו המתים במגפה ארבעה ועשרים אלף
(270810, 52, 4);2;ב;230666;(4, 25, 11, 13, 230666);60860;(4, 25, 11, 4, 60860);בן;1;4;פינחס בן אלעזר בן אהרן הכהן השיב את חמתי מעל בני ישראל בקנאו את קנאתי בתוכם ולא כליתי את בני ישראל בקנאתי
(270810, 52, 4);30;ל;230718;(4, 25, 11, 65, 230718);60874;(4, 25, 11, 18, 60874);כליתי;2;18;פינחס בן אלעזר בן אהרן הכהן השיב את חמתי מעל בני ישראל בקנאו את קנאתי בתוכם ולא כליתי את בני ישראל בקנאתי
(270810, 52, 4);6;ו;230770;(4, 25, 13, 7, 230770);60888;(4, 25, 13, 2, 60888);לו;2;2;והיתה לו ולזרעו אחריו ברית כהנת עולם תחת אשר קנא לאלהיו ויכפר על בני ישראל
(270810, 52, 4);1;א;230822;(4, 25, 13, 59, 230822);60901;(4, 25, 13, 15, 60901);ישראל;4;15;והיתה לו ולזרעו אחריו ברית כהנת עולם תחת אשר קנא לאלהיו ויכפר על בני ישראל
(270810, 52, 4);300;ש;230874;(4, 25, 14, 51, 230874);60916;(4, 25, 14, 15, 60916);לשמעני;2;15;ושם איש ישראל המכה אשר הכה את המדינית זמרי בן סלוא נשיא בית אב לשמעני
(270810, 52, 4);6;ו;230926;(4, 25, 16, 1, 230926);60930;(4, 25, 16, 1, 60930);וידבר;1;1;וידבר יהוה אל משה לאמר
(270810, 52, 4);40;ם;230978;(4, 25, 18, 12, 230978);60943;(4, 25, 18, 4, 60943);לכם;3;4;כי צררים הם לכם בנכליהם אשר נכלו לכם על דבר פעור ועל דבר כזבי בת נשיא מדין אחתם המכה ביום המגפה על דבר פעור
(270810, 52, 4);40;מ;231030;(4, 25, 18, 64, 231030);60958;(4, 25, 18, 19, 60958);המכה;2;19;כי צררים הם לכם בנכליהם אשר נכלו לכם על דבר פעור ועל דבר כזבי בת נשיא מדין אחתם המכה ביום המגפה על דבר פעור
(270810, 52, 4);30;ל;231082;(4, 26, 1, 19, 231082);60972;(4, 26, 1, 6, 60972);אלעזר;2;6;ויאמר יהוה אל משה ואל אלעזר בן אהרן הכהן לאמר
(270810, 52, 4);70;ע;231134;(4, 26, 2, 35, 231134);60987;(4, 26, 2, 11, 60987);ומעלה;3;11;שאו את ראש כל עדת בני ישראל מבן עשרים שנה ומעלה לבית אבתם כל יצא צבא בישראל
(270810, 52, 4);6;ו;231186;(4, 26, 3, 28, 231186);61000;(4, 26, 3, 7, 61000);מואב;2;7;וידבר משה ואלעזר הכהן אתם בערבת מואב על ירדן ירחו לאמר
(270810, 52, 4);10;י;231238;(4, 26, 4, 36, 231238);61014;(4, 26, 4, 10, 61014);ובני;4;10;מבן עשרים שנה ומעלה כאשר צוה יהוה את משה ובני ישראל היצאים מארץ מצרים
(270810, 52, 4);5;ה;231290;(4, 26, 5, 32, 231290);61026;(4, 26, 5, 8, 61026);החנכי;1;8;ראובן בכור ישראל בני ראובן חנוך משפחת החנכי לפלוא משפחת הפלאי
(270810, 52, 4);1;א;231342;(4, 26, 7, 1, 231342);61036;(4, 26, 7, 1, 61036);אלה;1;1;אלה משפחת הראובני ויהיו פקדיהם שלשה וארבעים אלף ושבע מאות ושלשים
(270810, 52, 4);10;י;231394;(4, 26, 7, 53, 231394);61046;(4, 26, 7, 11, 61046);ושלשים;5;11;אלה משפחת הראובני ויהיו פקדיהם שלשה וארבעים אלף ושבע מאות ושלשים
(270810, 52, 4);200;ר;231446;(4, 26, 9, 38, 231446);61058;(4, 26, 9, 9, 61058);קרואי;2;9;ובני אליאב נמואל ודתן ואבירם הוא דתן ואבירם קרואי העדה אשר הצו על משה ועל אהרן בעדת קרח בהצתם על יהוה
(270810, 52, 4);90;ץ;231498;(4, 26, 10, 9, 231498);61072;(4, 26, 10, 2, 61072);הארץ;4;2;ותפתח הארץ את פיה ותבלע אתם ואת קרח במות העדה באכל האש את חמשים ומאתים איש ויהיו לנס
(270810, 52, 4);10;י;231550;(4, 26, 10, 61, 231550);61087;(4, 26, 10, 17, 61087);ויהיו;2;17;ותפתח הארץ את פיה ותבלע אתם ואת קרח במות העדה באכל האש את חמשים ומאתים איש ויהיו לנס
(270810, 52, 4);30;ל;231602;(4, 26, 12, 34, 231602);61099;(4, 26, 12, 7, 61099);לימין;1;7;בני שמעון למשפחתם לנמואל משפחת הנמואלי לימין משפחת הימיני ליכין משפחת היכיני
(270810, 52, 4);300;ש;231654;(4, 26, 13, 21, 231654);61109;(4, 26, 13, 5, 61109);משפחת;2;5;לזרח משפחת הזרחי לשאול משפחת השאולי
(270810, 52, 4);8;ח;231706;(4, 26, 15, 10, 231706);61120;(4, 26, 15, 3, 61120);למשפחתם;5;3;בני גד למשפחתם לצפון משפחת הצפוני לחגי משפחת החגי לשוני משפחת השוני
(270810, 52, 4);40;מ;231758;(4, 26, 16, 6, 231758);61131;(4, 26, 16, 2, 61131);משפחת;1;2;לאזני משפחת האזני לערי משפחת הערי
(270810, 52, 4);200;ר;231810;(4, 26, 17, 30, 231810);61141;(4, 26, 17, 6, 61141);האראלי;3;6;לארוד משפחת הארודי לאראלי משפחת האראלי
(270810, 52, 4);1;א;231862;(4, 26, 19, 12, 231862);61154;(4, 26, 19, 4, 61154);ואונן;2;4;בני יהודה ער ואונן וימת ער ואונן בארץ כנען
(270810, 52, 4);5;ה;231914;(4, 26, 20, 30, 231914);61166;(4, 26, 20, 7, 61166);השלני;1;7;ויהיו בני יהודה למשפחתם לשלה משפחת השלני לפרץ משפחת הפרצי לזרח משפחת הזרחי
(270810, 52, 4);8;ח;231966;(4, 26, 21, 20, 231966);61177;(4, 26, 21, 5, 61177);משפחת;4;5;ויהיו בני פרץ לחצרן משפחת החצרני לחמול משפחת החמולי
(270810, 52, 4);40;ם;232018;(4, 26, 22, 29, 232018);61187;(4, 26, 22, 6, 61187);ושבעים;6;6;אלה משפחת יהודה לפקדיהם ששה ושבעים אלף וחמש מאות
(270810, 52, 4);80;פ;232070;(4, 26, 23, 41, 232070);61199;(4, 26, 23, 9, 61199);הפוני;2;9;בני יששכר למשפחתם תולע משפחת התולעי לפוה משפחת הפוני
(270810, 52, 4);10;י;232122;(4, 26, 25, 18, 232122);61209;(4, 26, 25, 4, 61209);לפקדיהם;5;4;אלה משפחת יששכר לפקדיהם ארבעה וששים אלף ושלש מאות
(270810, 52, 4);10;י;232174;(4, 26, 26, 29, 232174);61220;(4, 26, 26, 6, 61220);הסרדי;5;6;בני זבולן למשפחתם לסרד משפחת הסרדי לאלון משפחת האלני ליחלאל משפחת היחלאלי
(270810, 52, 4);4;ד;232226;(4, 26, 27, 19, 232226);61230;(4, 26, 27, 4, 61230);לפקדיהם;4;4;אלה משפחת הזבולני לפקדיהם ששים אלף וחמש מאות
(270810, 52, 4);20;כ;232278;(4, 26, 29, 10, 232278);61242;(4, 26, 29, 3, 61242);למכיר;3;3;בני מנשה למכיר משפחת המכירי ומכיר הוליד את גלעד לגלעד משפחת הגלעדי
(270810, 52, 4);3;ג;232330;(4, 26, 30, 7, 232330);61254;(4, 26, 30, 3, 61254);גלעד;1;3;אלה בני גלעד איעזר משפחת האיעזרי לחלק משפחת החלקי
(270810, 52, 4);30;ל;232382;(4, 26, 31, 18, 232382);61263;(4, 26, 31, 3, 61263);האשראלי;6;3;ואשריאל משפחת האשראלי ושכם משפחת השכמי
(270810, 52, 4);8;ח;232434;(4, 26, 33, 5, 232434);61273;(4, 26, 33, 1, 61273);וצלפחד;5;1;וצלפחד בן חפר לא היו לו בנים כי אם בנות ושם בנות צלפחד מחלה ונעה חגלה מלכה ותרצה
(270810, 52, 4);20;כ;232486;(4, 26, 33, 57, 232486);61289;(4, 26, 33, 17, 61289);מלכה;3;17;וצלפחד בן חפר לא היו לו בנים כי אם בנות ושם בנות צלפחד מחלה ונעה חגלה מלכה ותרצה
(270810, 52, 4);10;י;232538;(4, 26, 35, 6, 232538);61301;(4, 26, 35, 2, 61301);בני;3;2;אלה בני אפרים למשפחתם לשותלח משפחת השתלחי לבכר משפחת הבכרי לתחן משפחת התחני
(270810, 52, 4);400;ת;232590;(4, 26, 35, 58, 232590);61311;(4, 26, 35, 12, 61311);משפחת;5;12;אלה בני אפרים למשפחתם לשותלח משפחת השתלחי לבכר משפחת הבכרי לתחן משפחת התחני
(270810, 52, 4);10;י;232642;(4, 26, 37, 21, 232642);61323;(4, 26, 37, 5, 61323);לפקדיהם;5;5;אלה משפחת בני אפרים לפקדיהם שנים ושלשים אלף וחמש מאות אלה בני יוסף למשפחתם
(270810, 52, 4);80;פ;232694;(4, 26, 38, 12, 232694);61335;(4, 26, 38, 3, 61335);למשפחתם;4;3;בני בנימן למשפחתם לבלע משפחת הבלעי לאשבל משפחת האשבלי לאחירם משפחת האחירמי
(270810, 52, 4);30;ל;232746;(4, 26, 39, 1, 232746);61345;(4, 26, 39, 1, 61345);לשפופם;1;1;לשפופם משפחת השופמי לחופם משפחת החופמי
(270810, 52, 4);40;מ;232798;(4, 26, 40, 20, 232798);61356;(4, 26, 40, 6, 61356);משפחת;1;6;ויהיו בני בלע ארד ונעמן משפחת הארדי לנעמן משפחת הנעמי
(270810, 52, 4);300;ש;232850;(4, 26, 41, 28, 232850);61366;(4, 26, 41, 6, 61366);חמשה;3;6;אלה בני בנימן למשפחתם ופקדיהם חמשה וארבעים אלף ושש מאות
(270810, 52, 4);5;ה;232902;(4, 26, 42, 34, 232902);61378;(4, 26, 42, 8, 61378);אלה;3;8;אלה בני דן למשפחתם לשוחם משפחת השוחמי אלה משפחת דן למשפחתם
(270810, 52, 4);70;ע;232954;(4, 26, 43, 38, 232954);61389;(4, 26, 43, 8, 61389);וארבע;5;8;כל משפחת השוחמי לפקדיהם ארבעה וששים אלף וארבע מאות
(270810, 52, 4);70;ע;233006;(4, 26, 44, 48, 233006);61400;(4, 26, 44, 10, 61400);לבריעה;5;10;בני אשר למשפחתם לימנה משפחת הימנה לישוי משפחת הישוי לבריעה משפחת הבריעי
(270810, 52, 4);10;י;233058;(4, 26, 45, 40, 233058);61410;(4, 26, 45, 8, 61410);המלכיאלי;5;8;לבני בריעה לחבר משפחת החברי למלכיאל משפחת המלכיאלי
(270810, 52, 4);2;ב;233110;(4, 26, 47, 38, 233110);61423;(4, 26, 47, 9, 61423);וארבע;4;9;אלה משפחת בני אשר לפקדיהם שלשה וחמשים אלף וארבע מאות
(270810, 52, 4);50;נ;233162;(4, 26, 48, 47, 233162);61433;(4, 26, 48, 9, 61433);הגוני;4;9;בני נפתלי למשפחתם ליחצאל משפחת היחצאלי לגוני משפחת הגוני
(270810, 52, 4);100;ק;233214;(4, 26, 50, 23, 233214);61444;(4, 26, 50, 5, 61444);ופקדיהם;3;5;אלה משפחת נפתלי למשפחתם ופקדיהם חמשה וארבעים אלף וארבע מאות
(270810, 52, 4);80;ף;233266;(4, 26, 51, 25, 233266);61456;(4, 26, 51, 7, 61456);אלף;3;7;אלה פקודי בני ישראל שש מאות אלף ואלף שבע מאות ושלשים
(270810, 52, 4);5;ה;233318;(4, 26, 53, 17, 233318);61469;(4, 26, 53, 4, 61469);בנחלה;5;4;לאלה תחלק הארץ בנחלה במספר שמות
(270810, 52, 4);8;ח;233370;(4, 26, 54, 43, 233370);61482;(4, 26, 54, 11, 61482);נחלתו;2;11;לרב תרבה נחלתו ולמעט תמעיט נחלתו איש לפי פקדיו יתן נחלתו
(270810, 52, 4);50;נ;233422;(4, 26, 56, 14, 233422);61496;(4, 26, 56, 5, 61496);נחלתו;1;5;על פי הגורל תחלק נחלתו בין רב למעט
(270810, 52, 4);100;ק;233474;(4, 26, 57, 39, 233474);61507;(4, 26, 57, 8, 61507);לקהת;2;8;ואלה פקודי הלוי למשפחתם לגרשון משפחת הגרשני לקהת משפחת הקהתי למררי משפחת המררי
(270810, 52, 4);8;ח;233526;(4, 26, 58, 25, 233526);61518;(4, 26, 58, 6, 61518);משפחת;4;6;אלה משפחת לוי משפחת הלבני משפחת החברני משפחת המחלי משפחת המושי משפחת הקרחי וקהת הולד את עמרם
