(143827, 92, 4);10;י;75655;(1, 49, 10, 33, 75655);19977;(1, 49, 10, 9, 19977);כי;2;9;לא יסור שבט מיהודה ומחקק מבין רגליו עד כי יבא שילה ולו יקהת עמים
(143827, 92, 4);8;ח;75747;(1, 49, 12, 25, 75747);20000;(1, 49, 12, 6, 20000);מחלב;2;6;חכלילי עינים מיין ולבן שנים מחלב
(143827, 92, 4);40;מ;75839;(1, 49, 15, 25, 75839);20024;(1, 49, 15, 8, 20024);נעמה;3;8;וירא מנחה כי טוב ואת הארץ כי נעמה ויט שכמו לסבל ויהי למס עבד
(143827, 92, 4);200;ר;75931;(1, 49, 17, 48, 75931);20050;(1, 49, 17, 14, 20050);אחור;4;14;יהי דן נחש עלי דרך שפיפן עלי ארח הנשך עקבי סוס ויפל רכבו אחור
(143827, 92, 4);80;פ;76023;(1, 49, 22, 3, 76023);20074;(1, 49, 22, 2, 20074);פרת;1;2;בן פרת יוסף בן פרת עלי עין בנות צעדה עלי שור
(143827, 92, 4);10;י;76115;(1, 49, 24, 35, 76115);20097;(1, 49, 24, 9, 20097);יעקב;1;9;ותשב באיתן קשתו ויפזו זרעי ידיו מידי אביר יעקב משם רעה אבן ישראל
(143827, 92, 4);6;ו;76207;(1, 49, 26, 12, 76207);20120;(1, 49, 26, 3, 20120);גברו;4;3;ברכת אביך גברו על ברכת הורי עד תאות גבעת עולם תהיין לראש יוסף ולקדקד נזיר אחיו
(143827, 92, 4);300;ש;76299;(1, 49, 28, 6, 76299);20145;(1, 49, 28, 3, 20145);שבטי;1;3;כל אלה שבטי ישראל שנים עשר וזאת אשר דבר להם אביהם ויברך אותם איש אשר כברכתו ברך אתם
(143827, 92, 4);200;ר;76391;(1, 49, 29, 32, 76391);20169;(1, 49, 29, 9, 20169);קברו;3;9;ויצו אותם ויאמר אלהם אני נאסף אל עמי קברו אתי אל אבתי אל המערה אשר בשדה עפרון החתי
(143827, 92, 4);70;ע;76483;(1, 49, 30, 59, 76483);20195;(1, 49, 30, 17, 20195);עפרן;1;17;במערה אשר בשדה המכפלה אשר על פני ממרא בארץ כנען אשר קנה אברהם את השדה מאת עפרן החתי לאחזת קבר
(143827, 92, 4);1;א;76575;(1, 49, 32, 15, 76575);20220;(1, 49, 32, 4, 20220);אשר;1;4;מקנה השדה והמערה אשר בו מאת בני חת
(143827, 92, 4);30;ל;76667;(1, 50, 1, 30, 76667);20246;(1, 50, 1, 9, 20246);לו;1;9;ויפל יוסף על פני אביו ויבך עליו וישק לו
(143827, 92, 4);20;כ;76759;(1, 50, 3, 39, 76759);20269;(1, 50, 3, 10, 20269);ויבכו;4;10;וימלאו לו ארבעים יום כי כן ימלאו ימי החנטים ויבכו אתו מצרים שבעים יום
(143827, 92, 4);2;ב;76851;(1, 50, 5, 2, 76851);20293;(1, 50, 5, 1, 20293);אבי;2;1;אבי השביעני לאמר הנה אנכי מת בקברי אשר כריתי לי בארץ כנען שמה תקברני ועתה אעלה נא ואקברה את אבי ואשובה
(143827, 92, 4);5;ה;76943;(1, 50, 6, 12, 76943);20316;(1, 50, 6, 3, 20316);עלה;3;3;ויאמר פרעה עלה וקבר את אביך כאשר השביעך
(143827, 92, 4);8;ח;77035;(1, 50, 8, 13, 77035);20341;(1, 50, 8, 4, 20341);ואחיו;3;4;וכל בית יוסף ואחיו ובית אביו רק טפם וצאנם ובקרם עזבו בארץ גשן
(143827, 92, 4);5;ה;77127;(1, 50, 10, 22, 77127);20367;(1, 50, 10, 7, 20367);הירדן;1;7;ויבאו עד גרן האטד אשר בעבר הירדן ויספדו שם מספד גדול וכבד מאד ויעש לאביו אבל שבעת ימים
(143827, 92, 4);7;ז;77219;(1, 50, 11, 45, 77219);20390;(1, 50, 11, 12, 20390);זה;1;12;וירא יושב הארץ הכנעני את האבל בגרן האטד ויאמרו אבל כבד זה למצרים על כן קרא שמה אבל מצרים אשר בעבר הירדן
(143827, 92, 4);300;ש;77311;(1, 50, 13, 35, 77311);20415;(1, 50, 13, 9, 20415);שדה;1;9;וישאו אתו בניו ארצה כנען ויקברו אתו במערת שדה המכפלה אשר קנה אברהם את השדה לאחזת קבר מאת עפרן החתי על פני ממרא
(143827, 92, 4);400;ת;77403;(1, 50, 14, 39, 77403);20439;(1, 50, 14, 10, 20439);את;2;10;וישב יוסף מצרימה הוא ואחיו וכל העלים אתו לקבר את אביו אחרי קברו את אביו
(143827, 92, 4);6;ו;77495;(1, 50, 16, 5, 77495);20464;(1, 50, 16, 1, 20464);ויצוו;5;1;ויצוו אל יוסף לאמר אביך צוה לפני מותו לאמר
(143827, 92, 4);1;א;77587;(1, 50, 17, 63, 77587);20491;(1, 50, 17, 19, 20491);אביך;1;19;כה תאמרו ליוסף אנא שא נא פשע אחיך וחטאתם כי רעה גמלוך ועתה שא נא לפשע עבדי אלהי אביך ויבך יוסף בדברם אליו
(143827, 92, 4);50;נ;77679;(1, 50, 19, 33, 77679);20513;(1, 50, 19, 9, 20513);אני;2;9;ויאמר אלהם יוסף אל תיראו כי התחת אלהים אני
(143827, 92, 4);40;ם;77771;(1, 50, 21, 40, 77771);20537;(1, 50, 21, 10, 20537);אותם;4;10;ועתה אל תיראו אנכי אכלכל אתכם ואת טפכם וינחם אותם וידבר על לבם
(143827, 92, 4);10;י;77863;(1, 50, 23, 38, 77863);20562;(1, 50, 23, 11, 20562);ילדו;1;11;וירא יוסף לאפרים בני שלשים גם בני מכיר בן מנשה ילדו על ברכי יוסף
(143827, 92, 4);90;צ;77955;(1, 50, 24, 79, 77955);20586;(1, 50, 24, 21, 20586);ליצחק;3;21;ויאמר יוסף אל אחיו אנכי מת ואלהים פקד יפקד אתכם והעלה אתכם מן הארץ הזאת אל הארץ אשר נשבע לאברהם ליצחק וליעקב
(143827, 92, 4);400;ת;78047;(1, 50, 26, 29, 78047);20609;(1, 50, 26, 8, 20609);אתו;2;8;וימת יוסף בן מאה ועשר שנים ויחנטו אתו ויישם בארון במצרים
(143827, 92, 4);2;ב;78139;(2, 1, 3, 12, 78139);20630;(2, 1, 3, 3, 20630);ובנימן;2;3;יששכר זבולן ובנימן
(143827, 92, 4);300;ש;78231;(2, 1, 7, 6, 78231);20654;(2, 1, 7, 2, 20654);ישראל;2;2;ובני ישראל פרו וישרצו וירבו ויעצמו במאד מאד ותמלא הארץ אתם
(143827, 92, 4);10;י;78323;(2, 1, 9, 19, 78323);20680;(2, 1, 9, 7, 20680);ישראל;1;7;ויאמר אל עמו הנה עם בני ישראל רב ועצום ממנו
(143827, 92, 4);70;ע;78415;(2, 1, 11, 7, 78415);20704;(2, 1, 11, 2, 20704);עליו;1;2;וישימו עליו שרי מסים למען ענתו בסבלתם ויבן ערי מסכנות לפרעה את פתם ואת רעמסס
(143827, 92, 4);10;י;78507;(2, 1, 12, 37, 78507);20727;(2, 1, 12, 10, 20727);בני;3;10;וכאשר יענו אתו כן ירבה וכן יפרץ ויקצו מפני בני ישראל
(143827, 92, 4);5;ה;78599;(2, 1, 14, 62, 78599);20750;(2, 1, 14, 16, 20750);בהם;2;16;וימררו את חייהם בעבדה קשה בחמר ובלבנים ובכל עבדה בשדה את כל עבדתם אשר עבדו בהם בפרך
(143827, 92, 4);2;ב;78691;(2, 1, 16, 37, 78691);20772;(2, 1, 16, 9, 20772);בן;1;9;ויאמר בילדכן את העבריות וראיתן על האבנים אם בן הוא והמתן אתו ואם בת הוא וחיה
(143827, 92, 4);20;ך;78783;(2, 1, 18, 8, 78783);20795;(2, 1, 18, 2, 20795);מלך;3;2;ויקרא מלך מצרים למילדת ויאמר להן מדוע עשיתן הדבר הזה ותחיין את הילדים
(143827, 92, 4);10;י;78875;(2, 1, 19, 43, 78875);20817;(2, 1, 19, 11, 20817);חיות;2;11;ותאמרן המילדת אל פרעה כי לא כנשים המצרית העברית כי חיות הנה בטרם תבוא אלהן המילדת וילדו
(143827, 92, 4);2;ב;78967;(2, 1, 21, 32, 78967);20839;(2, 1, 21, 9, 20839);בתים;1;9;ויהי כי יראו המילדת את האלהים ויעש להם בתים
(143827, 92, 4);2;ב;79059;(2, 2, 2, 13, 79059);20864;(2, 2, 2, 4, 20864);בן;1;4;ותהר האשה ותלד בן ותרא אתו כי טוב הוא ותצפנהו שלשה ירחים
(143827, 92, 4);2;ב;79151;(2, 2, 3, 60, 79151);20889;(2, 2, 3, 17, 20889);בסוף;1;17;ולא יכלה עוד הצפינו ותקח לו תבת גמא ותחמרה בחמר ובזפת ותשם בה את הילד ותשם בסוף על שפת היאר
(143827, 92, 4);60;ס;79243;(2, 2, 5, 55, 79243);20915;(2, 2, 5, 16, 20915);הסוף;2;16;ותרד בת פרעה לרחץ על היאר ונערתיה הלכת על יד היאר ותרא את התבה בתוך הסוף ותשלח את אמתה ותקחה
(143827, 92, 4);30;ל;79335;(2, 2, 7, 20, 79335);20938;(2, 2, 7, 6, 20938);האלך;3;6;ותאמר אחתו אל בת פרעה האלך וקראתי לך אשה מינקת מן העברית ותינק לך את הילד
(143827, 92, 4);30;ל;79427;(2, 2, 9, 16, 79427);20964;(2, 2, 9, 5, 20964);היליכי;3;5;ותאמר לה בת פרעה היליכי את הילד הזה והינקהו לי ואני אתן את שכרך ותקח האשה הילד ותניקהו
(143827, 92, 4);6;ו;79519;(2, 2, 10, 39, 79519);20987;(2, 2, 10, 10, 20987);שמו;3;10;ויגדל הילד ותבאהו לבת פרעה ויהי לה לבן ותקרא שמו משה ותאמר כי מן המים משיתהו
(143827, 92, 4);50;ן;79611;(2, 2, 12, 4, 79611);21011;(2, 2, 12, 1, 21011);ויפן;4;1;ויפן כה וכה וירא כי אין איש ויך את המצרי ויטמנהו בחול
(143827, 92, 4);1;א;79703;(2, 2, 14, 3, 79703);21036;(2, 2, 14, 1, 21036);ויאמר;3;1;ויאמר מי שמך לאיש שר ושפט עלינו הלהרגני אתה אמר כאשר הרגת את המצרי ויירא משה ויאמר אכן נודע הדבר
(143827, 92, 4);5;ה;79795;(2, 2, 15, 18, 79795);21060;(2, 2, 15, 5, 21060);הזה;3;5;וישמע פרעה את הדבר הזה ויבקש להרג את משה ויברח משה מפני פרעה וישב בארץ מדין וישב על הבאר
(143827, 92, 4);5;ה;79887;(2, 2, 16, 40, 79887);21083;(2, 2, 16, 9, 21083);הרהטים;3;9;ולכהן מדין שבע בנות ותבאנה ותדלנה ותמלאנה את הרהטים להשקות צאן אביהן
(143827, 92, 4);5;ה;79979;(2, 2, 18, 35, 79979);21104;(2, 2, 18, 9, 21104);היום;1;9;ותבאנה אל רעואל אביהן ויאמר מדוע מהרתן בא היום
(143827, 92, 4);10;י;80071;(2, 2, 20, 40, 80071);21129;(2, 2, 20, 12, 21129);ויאכל;2;12;ויאמר אל בנתיו ואיו למה זה עזבתן את האיש קראן לו ויאכל לחם
(143827, 92, 4);5;ה;80163;(2, 2, 23, 10, 80163);21155;(2, 2, 23, 3, 21155);הרבים;1;3;ויהי בימים הרבים ההם וימת מלך מצרים ויאנחו בני ישראל מן העבדה ויזעקו ותעל שועתם אל האלהים מן העבדה
(143827, 92, 4);200;ר;80255;(2, 2, 24, 22, 80255);21176;(2, 2, 24, 5, 21176);ויזכר;5;5;וישמע אלהים את נאקתם ויזכר אלהים את בריתו את אברהם את יצחק ואת יעקב
(143827, 92, 4);10;י;80347;(2, 3, 1, 32, 80347);21202;(2, 3, 1, 10, 21202);וינהג;2;10;ומשה היה רעה את צאן יתרו חתנו כהן מדין וינהג את הצאן אחר המדבר ויבא אל הר האלהים חרבה
(143827, 92, 4);50;נ;80439;(2, 3, 2, 57, 80439);21226;(2, 3, 2, 15, 21226);איננו;4;15;וירא מלאך יהוה אליו בלבת אש מתוך הסנה וירא והנה הסנה בער באש והסנה איננו אכל
(143827, 92, 4);10;י;80531;(2, 3, 4, 41, 80531);21251;(2, 3, 4, 11, 21251);ויאמר;2;11;וירא יהוה כי סר לראות ויקרא אליו אלהים מתוך הסנה ויאמר משה משה ויאמר הנני
(143827, 92, 4);1;א;80623;(2, 3, 6, 14, 80623);21276;(2, 3, 6, 4, 21276);אביך;1;4;ויאמר אנכי אלהי אביך אלהי אברהם אלהי יצחק ואלהי יעקב ויסתר משה פניו כי ירא מהביט אל האלהים
(143827, 92, 4);10;י;80715;(2, 3, 7, 33, 80715);21299;(2, 3, 7, 9, 21299);במצרים;5;9;ויאמר יהוה ראה ראיתי את עני עמי אשר במצרים ואת צעקתם שמעתי מפני נגשיו כי ידעתי את מכאביו
(143827, 92, 4);90;ץ;80807;(2, 3, 8, 54, 80807);21322;(2, 3, 8, 14, 21322);ארץ;3;14;וארד להצילו מיד מצרים ולהעלתו מן הארץ ההוא אל ארץ טובה ורחבה אל ארץ זבת חלב ודבש אל מקום הכנעני והחתי והאמרי והפרזי והחוי והיבוסי
(143827, 92, 4);300;ש;80899;(2, 3, 9, 41, 80899);21345;(2, 3, 9, 12, 21345);אשר;2;12;ועתה הנה צעקת בני ישראל באה אלי וגם ראיתי את הלחץ אשר מצרים לחצים אתם
(143827, 92, 4);20;כ;80991;(2, 3, 11, 35, 80991);21370;(2, 3, 11, 11, 21370);וכי;2;11;ויאמר משה אל האלהים מי אנכי כי אלך אל פרעה וכי אוציא את בני ישראל ממצרים
(143827, 92, 4);5;ה;81083;(2, 3, 12, 70, 81083);21394;(2, 3, 12, 19, 21394);ההר;1;19;ויאמר כי אהיה עמך וזה לך האות כי אנכי שלחתיך בהוציאך את העם ממצרים תעבדון את האלהים על ההר הזה
(143827, 92, 4);6;ו;81175;(2, 3, 14, 1, 81175);21419;(2, 3, 14, 1, 21419);ויאמר;1;1;ויאמר אלהים אל משה אהיה אשר אהיה ויאמר כה תאמר לבני ישראל אהיה שלחני אליכם
(143827, 92, 4);1;א;81267;(2, 3, 15, 33, 81267);21443;(2, 3, 15, 10, 21443);ישראל;4;10;ויאמר עוד אלהים אל משה כה תאמר אל בני ישראל יהוה אלהי אבתיכם אלהי אברהם אלהי יצחק ואלהי יעקב שלחני אליכם זה שמי לעלם וזה זכרי לדר דר
(143827, 92, 4);1;א;81359;(2, 3, 16, 20, 81359);21467;(2, 3, 16, 6, 21467);ואמרת;2;6;לך ואספת את זקני ישראל ואמרת אלהם יהוה אלהי אבתיכם נראה אלי אלהי אברהם יצחק ויעקב לאמר פקד פקדתי אתכם ואת העשוי לכם במצרים
(143827, 92, 4);40;מ;81451;(2, 3, 17, 13, 81451);21489;(2, 3, 17, 4, 21489);מעני;1;4;ואמר אעלה אתכם מעני מצרים אל ארץ הכנעני והחתי והאמרי והפרזי והחוי והיבוסי אל ארץ זבת חלב ודבש
(143827, 92, 4);40;מ;81543;(2, 3, 18, 29, 81543);21511;(2, 3, 18, 8, 21511);מלך;1;8;ושמעו לקלך ובאת אתה וזקני ישראל אל מלך מצרים ואמרתם אליו יהוה אלהי העבריים נקרה עלינו ועתה נלכה נא דרך שלשת ימים במדבר ונזבחה ליהוה אלהינו
(143827, 92, 4);400;ת;81635;(2, 3, 19, 8, 81635);21531;(2, 3, 19, 2, 21531);ידעתי;4;2;ואני ידעתי כי לא יתן אתכם מלך מצרים להלך ולא ביד חזקה
(143827, 92, 4);400;ת;81727;(2, 3, 20, 58, 81727);21556;(2, 3, 20, 15, 21556);אתכם;2;15;ושלחתי את ידי והכיתי את מצרים בכל נפלאתי אשר אעשה בקרבו ואחרי כן ישלח אתכם
(143827, 92, 4);40;מ;81819;(2, 3, 22, 44, 81819);21580;(2, 3, 22, 11, 21580);ושמתם;3;11;ושאלה אשה משכנתה ומגרת ביתה כלי כסף וכלי זהב ושמלת ושמתם על בניכם ועל בנתיכם ונצלתם את מצרים
(143827, 92, 4);1;א;81911;(2, 4, 2, 3, 81911);21604;(2, 4, 2, 1, 21604);ויאמר;3;1;ויאמר אליו יהוה מזה בידך ויאמר מטה
(143827, 92, 4);20;ך;82003;(2, 4, 4, 20, 82003);21626;(2, 4, 4, 6, 21626);ידך;3;6;ויאמר יהוה אל משה שלח ידך ואחז בזנבו וישלח ידו ויחזק בו ויהי למטה בכפו
(143827, 92, 4);70;ע;82095;(2, 4, 5, 56, 82095);21649;(2, 4, 5, 14, 21649);יעקב;2;14;למען יאמינו כי נראה אליך יהוה אלהי אבתם אלהי אברהם אלהי יצחק ואלהי יעקב
(143827, 92, 4);100;ק;82187;(2, 4, 7, 29, 82187);21674;(2, 4, 7, 9, 21674);חיקו;3;9;ויאמר השב ידך אל חיקך וישב ידו אל חיקו ויוצאה מחיקו והנה שבה כבשרו
(143827, 92, 4);50;נ;82279;(2, 4, 9, 13, 82279);21697;(2, 4, 9, 4, 21697);יאמינו;5;4;והיה אם לא יאמינו גם לשני האתות האלה ולא ישמעון לקלך ולקחת ממימי היאר ושפכת היבשה והיו המים אשר תקח מן היאר והיו לדם ביבשת
(143827, 92, 4);300;ש;82371;(2, 4, 10, 7, 82371);21720;(2, 4, 10, 2, 21720);משה;2;2;ויאמר משה אל יהוה בי אדני לא איש דברים אנכי גם מתמול גם משלשם גם מאז דברך אל עבדך כי כבד פה וכבד לשון אנכי
(143827, 92, 4);40;ם;82463;(2, 4, 11, 17, 82463);21748;(2, 4, 11, 5, 21748);שם;2;5;ויאמר יהוה אליו מי שם פה לאדם או מי ישום אלם או חרש או פקח או עור הלא אנכי יהוה
(143827, 92, 4);8;ח;82555;(2, 4, 13, 14, 82555);21776;(2, 4, 13, 4, 21776);שלח;3;4;ויאמר בי אדני שלח נא ביד תשלח
(143827, 92, 4);4;ד;82647;(2, 4, 15, 2, 82647);21802;(2, 4, 15, 1, 21802);ודברת;2;1;ודברת אליו ושמת את הדברים בפיו ואנכי אהיה עם פיך ועם פיהו והוריתי אתכם את אשר תעשון
(143827, 92, 4);20;ך;82739;(2, 4, 16, 27, 82739);21827;(2, 4, 16, 9, 21827);לך;2;9;ודבר הוא לך אל העם והיה הוא יהיה לך לפה ואתה תהיה לו לאלהים
(143827, 92, 4);30;ל;82831;(2, 4, 18, 41, 82831);21854;(2, 4, 18, 12, 21854);אל;2;12;וילך משה וישב אל יתר חתנו ויאמר לו אלכה נא ואשובה אל אחי אשר במצרים ואראה העודם חיים ויאמר יתרו למשה לך לשלום
(143827, 92, 4);300;ש;82923;(2, 4, 19, 46, 82923);21878;(2, 4, 19, 13, 21878);המבקשים;5;13;ויאמר יהוה אל משה במדין לך שב מצרים כי מתו כל האנשים המבקשים את נפשך
(143827, 92, 4);20;כ;83015;(2, 4, 21, 17, 83015);21903;(2, 4, 21, 5, 21903);בלכתך;3;5;ויאמר יהוה אל משה בלכתך לשוב מצרימה ראה כל המפתים אשר שמתי בידך ועשיתם לפני פרעה ואני אחזק את לבו ולא ישלח את העם
(143827, 92, 4);6;ו;83107;(2, 4, 22, 19, 83107);21928;(2, 4, 22, 6, 21928);יהוה;3;6;ואמרת אל פרעה כה אמר יהוה בני בכרי ישראל
(143827, 92, 4);2;ב;83199;(2, 4, 24, 27, 83199);21951;(2, 4, 24, 6, 21951);ויבקש;3;6;ויהי בדרך במלון ויפגשהו יהוה ויבקש המיתו
(143827, 92, 4);10;י;83291;(2, 4, 27, 6, 83291);21976;(2, 4, 27, 2, 21976);יהוה;1;2;ויאמר יהוה אל אהרן לך לקראת משה המדברה וילך ויפגשהו בהר האלהים וישק לו
(143827, 92, 4);1;א;83383;(2, 4, 28, 41, 83383);22001;(2, 4, 28, 13, 22001);אשר;1;13;ויגד משה לאהרן את כל דברי יהוה אשר שלחו ואת כל האתת אשר צוהו
(143827, 92, 4);10;י;83475;(2, 4, 31, 2, 83475);22026;(2, 4, 31, 1, 22026);ויאמן;2;1;ויאמן העם וישמעו כי פקד יהוה את בני ישראל וכי ראה את ענים ויקדו וישתחוו
(143827, 92, 4);1;א;83567;(2, 5, 1, 37, 83567);22051;(2, 5, 1, 11, 22051);אלהי;1;11;ואחר באו משה ואהרן ויאמרו אל פרעה כה אמר יהוה אלהי ישראל שלח את עמי ויחגו לי במדבר
(143827, 92, 4);300;ש;83659;(2, 5, 2, 64, 83659);22077;(2, 5, 2, 19, 22077);אשלח;2;19;ויאמר פרעה מי יהוה אשר אשמע בקלו לשלח את ישראל לא ידעתי את יהוה וגם את ישראל לא אשלח
(143827, 92, 4);5;ה;83751;(2, 5, 4, 8, 83751);22098;(2, 5, 4, 2, 22098);אלהם;3;2;ויאמר אלהם מלך מצרים למה משה ואהרן תפריעו את העם ממעשיו לכו לסבלתיכם
(143827, 92, 4);80;פ;83843;(2, 5, 6, 5, 83843);22121;(2, 5, 6, 2, 22121);פרעה;1;2;ויצו פרעה ביום ההוא את הנגשים בעם ואת שטריו לאמר
(143827, 92, 4);400;ת;83935;(2, 5, 8, 5, 83935);22145;(2, 5, 8, 2, 22145);מתכנת;2;2;ואת מתכנת הלבנים אשר הם עשים תמול שלשם תשימו עליהם לא תגרעו ממנו כי נרפים הם על כן הם צעקים לאמר נלכה נזבחה לאלהינו
(143827, 92, 4);5;ה;84027;(2, 5, 9, 5, 84027);22169;(2, 5, 9, 2, 22169);העבדה;1;2;תכבד העבדה על האנשים ויעשו בה ואל ישעו בדברי שקר
(143827, 92, 4);400;ת;84119;(2, 5, 11, 2, 84119);22193;(2, 5, 11, 1, 22193);אתם;2;1;אתם לכו קחו לכם תבן מאשר תמצאו כי אין נגרע מעבדתכם דבר
(143827, 92, 4);20;כ;84211;(2, 5, 13, 23, 84211);22217;(2, 5, 13, 5, 22217);מעשיכם;5;5;והנגשים אצים לאמר כלו מעשיכם דבר יום ביומו כאשר בהיות התבן
(143827, 92, 4);3;ג;84303;(2, 5, 14, 67, 84303);22241;(2, 5, 14, 18, 22241);גם;1;18;ויכו שטרי בני ישראל אשר שמו עלהם נגשי פרעה לאמר מדוע לא כליתם חקכם ללבן כתמול שלשם גם תמול גם היום
(143827, 92, 4);6;ו;84395;(2, 5, 16, 33, 84395);22265;(2, 5, 16, 9, 22265);והנה;1;9;תבן אין נתן לעבדיך ולבנים אמרים לנו עשו והנה עבדיך מכים וחטאת עמך
(143827, 92, 4);50;ן;84487;(2, 5, 18, 28, 84487);22288;(2, 5, 18, 8, 22288);ותכן;4;8;ועתה לכו עבדו ותבן לא ינתן לכם ותכן לבנים תתנו
(143827, 92, 4);90;צ;84579;(2, 5, 20, 31, 84579);22311;(2, 5, 20, 8, 22311);בצאתם;2;8;ויפגעו את משה ואת אהרן נצבים לקראתם בצאתם מאת פרעה
(143827, 92, 4);300;ש;84671;(2, 5, 22, 3, 84671);22332;(2, 5, 22, 1, 22332);וישב;3;1;וישב משה אל יהוה ויאמר אדני למה הרעתה לעם הזה למה זה שלחתני
(143827, 92, 4);10;י;84763;(2, 6, 1, 2, 84763);22359;(2, 6, 1, 1, 22359);ויאמר;2;1;ויאמר יהוה אל משה עתה תראה אשר אעשה לפרעה כי ביד חזקה ישלחם וביד חזקה יגרשם מארצו
(143827, 92, 4);5;ה;84855;(2, 6, 2, 29, 84855);22383;(2, 6, 2, 8, 22383);יהוה;2;8;וידבר אלהים אל משה ויאמר אליו אני יהוה
(143827, 92, 4);200;ר;84947;(2, 6, 4, 41, 84947);22410;(2, 6, 4, 13, 22410);מגריהם;3;13;וגם הקמתי את בריתי אתם לתת להם את ארץ כנען את ארץ מגריהם אשר גרו בה
(143827, 92, 4);1;א;85039;(2, 6, 6, 27, 85039);22434;(2, 6, 6, 7, 22434);והוצאתי;5;7;לכן אמר לבני ישראל אני יהוה והוצאתי אתכם מתחת סבלת מצרים והצלתי אתכם מעבדתם וגאלתי אתכם בזרוע נטויה ובשפטים גדלים
(143827, 92, 4);30;ל;85131;(2, 6, 7, 25, 85131);22454;(2, 6, 7, 7, 22454);לאלהים;1;7;ולקחתי אתכם לי לעם והייתי לכם לאלהים וידעתם כי אני יהוה אלהיכם המוציא אתכם מתחת סבלות מצרים
(143827, 92, 4);30;ל;85223;(2, 6, 8, 42, 85223);22476;(2, 6, 8, 12, 22476);ליצחק;1;12;והבאתי אתכם אל הארץ אשר נשאתי את ידי לתת אתה לאברהם ליצחק וליעקב ונתתי אתה לכם מורשה אני יהוה
(143827, 92, 4);30;ל;85315;(2, 6, 10, 11, 85315);22500;(2, 6, 10, 3, 22500);אל;2;3;וידבר יהוה אל משה לאמר
(143827, 92, 4);40;מ;85407;(2, 6, 12, 46, 85407);22526;(2, 6, 12, 13, 22526);ישמעני;3;13;וידבר משה לפני יהוה לאמר הן בני ישראל לא שמעו אלי ואיך ישמעני פרעה ואני ערל שפתים
(143827, 92, 4);90;צ;85499;(2, 6, 13, 73, 85499);22550;(2, 6, 13, 20, 22550);מצרים;2;20;וידבר יהוה אל משה ואל אהרן ויצום אל בני ישראל ואל פרעה מלך מצרים להוציא את בני ישראל מארץ מצרים
(143827, 92, 4);50;ן;85591;(2, 6, 15, 28, 85591);22571;(2, 6, 15, 6, 22571);ויכין;5;6;ובני שמעון ימואל וימין ואהד ויכין וצחר ושאול בן הכנענית אלה משפחת שמעון
(143827, 92, 4);2;ב;85683;(2, 6, 17, 1, 85683);22594;(2, 6, 17, 1, 22594);בני;1;1;בני גרשון לבני ושמעי למשפחתם
(143827, 92, 4);6;ו;85775;(2, 6, 19, 15, 85775);22615;(2, 6, 19, 4, 22615);ומושי;3;4;ובני מררי מחלי ומושי אלה משפחת הלוי לתלדתם
(143827, 92, 4);2;ב;85867;(2, 6, 21, 2, 85867);22640;(2, 6, 21, 1, 22640);ובני;2;1;ובני יצהר קרח ונפג וזכרי
(143827, 92, 4);4;ד;85959;(2, 6, 23, 49, 85959);22663;(2, 6, 23, 14, 22663);נדב;2;14;ויקח אהרן את אלישבע בת עמינדב אחות נחשון לו לאשה ותלד לו את נדב ואת אביהוא את אלעזר ואת איתמר
(143827, 92, 4);6;ו;86051;(2, 6, 25, 30, 86051);22685;(2, 6, 25, 8, 22685);לו;2;8;ואלעזר בן אהרן לקח לו מבנות פוטיאל לו לאשה ותלד לו את פינחס אלה ראשי אבות הלוים למשפחתם
(143827, 92, 4);90;צ;86143;(2, 6, 26, 52, 86143);22710;(2, 6, 26, 15, 22710);צבאתם;1;15;הוא אהרן ומשה אשר אמר יהוה להם הוציאו את בני ישראל מארץ מצרים על צבאתם
(143827, 92, 4);4;ד;86235;(2, 6, 29, 3, 86235);22733;(2, 6, 29, 1, 22733);וידבר;3;1;וידבר יהוה אל משה לאמר אני יהוה דבר אל פרעה מלך מצרים את כל אשר אני דבר אליך
(143827, 92, 4);40;מ;86327;(2, 6, 30, 36, 86327);22760;(2, 6, 30, 10, 22760);ישמע;3;10;ויאמר משה לפני יהוה הן אני ערל שפתים ואיך ישמע אלי פרעה
