(7025, 93, 4);10;י;226226;(4, 22, 18, 60, 226226);59666;(4, 22, 18, 19, 59666);פי;2;19;ויען בלעם ויאמר אל עבדי בלק אם יתן לי בלק מלא ביתו כסף וזהב לא אוכל לעבר את פי יהוה אלהי לעשות קטנה או גדולה
(7025, 93, 4);1;א;226319;(4, 22, 20, 27, 226319);59693;(4, 22, 20, 8, 59693);אם;1;8;ויבא אלהים אל בלעם לילה ויאמר לו אם לקרא לך באו האנשים קום לך אתם ואך את הדבר אשר אדבר אליך אתו תעשה
(7025, 93, 4);80;ף;226412;(4, 22, 22, 6, 226412);59720;(4, 22, 22, 2, 59720);אף;2;2;ויחר אף אלהים כי הולך הוא ויתיצב מלאך יהוה בדרך לשטן לו והוא רכב על אתנו ושני נעריו עמו
(7025, 93, 4);2;ב;226505;(4, 22, 23, 30, 226505);59745;(4, 22, 23, 8, 59745);וחרבו;4;8;ותרא האתון את מלאך יהוה נצב בדרך וחרבו שלופה בידו ותט האתון מן הדרך ותלך בשדה ויך בלעם את האתון להטתה הדרך
(7025, 93, 4);5;ה;226598;(4, 22, 24, 38, 226598);59768;(4, 22, 24, 9, 59768);מזה;3;9;ויעמד מלאך יהוה במשעול הכרמים גדר מזה וגדר מזה
(7025, 93, 4);10;י;226691;(4, 22, 26, 34, 226691);59793;(4, 22, 26, 9, 59793);אין;2;9;ויוסף מלאך יהוה עבור ויעמד במקום צר אשר אין דרך לנטות ימין ושמאול
(7025, 93, 4);6;ו;226784;(4, 22, 28, 19, 226784);59818;(4, 22, 28, 6, 59818);ותאמר;1;6;ויפתח יהוה את פי האתון ותאמר לבלעם מה עשיתי לך כי הכיתני זה שלש רגלים
(7025, 93, 4);1;א;226877;(4, 22, 30, 11, 226877);59843;(4, 22, 30, 3, 59843);אל;1;3;ותאמר האתון אל בלעם הלוא אנכי אתנך אשר רכבת עלי מעודך עד היום הזה ההסכן הסכנתי לעשות לך כה ויאמר לא
(7025, 93, 4);40;מ;226970;(4, 22, 31, 25, 226970);59869;(4, 22, 31, 8, 59869);מלאך;1;8;ויגל יהוה את עיני בלעם וירא את מלאך יהוה נצב בדרך וחרבו שלפה בידו ויקד וישתחו לאפיו
(7025, 93, 4);90;צ;227063;(4, 22, 32, 51, 227063);59893;(4, 22, 32, 15, 59893);יצאתי;2;15;ויאמר אליו מלאך יהוה על מה הכית את אתנך זה שלוש רגלים הנה אנכי יצאתי לשטן כי ירט הדרך לנגדי
(7025, 93, 4);200;ר;227156;(4, 22, 34, 5, 227156);59916;(4, 22, 34, 1, 59916);ויאמר;5;1;ויאמר בלעם אל מלאך יהוה חטאתי כי לא ידעתי כי אתה נצב לקראתי בדרך ועתה אם רע בעיניך אשובה לי
(7025, 93, 4);50;נ;227249;(4, 22, 35, 26, 227249);59943;(4, 22, 35, 8, 59943);האנשים;3;8;ויאמר מלאך יהוה אל בלעם לך עם האנשים ואפס את הדבר אשר אדבר אליך אתו תדבר וילך בלעם עם שרי בלק
(7025, 93, 4);200;ר;227342;(4, 22, 36, 46, 227342);59970;(4, 22, 36, 14, 59970);ארנן;2;14;וישמע בלק כי בא בלעם ויצא לקראתו אל עיר מואב אשר על גבול ארנן אשר בקצה הגבול
(7025, 93, 4);5;ה;227435;(4, 22, 38, 17, 227435);59996;(4, 22, 38, 5, 59996);הנה;3;5;ויאמר בלעם אל בלק הנה באתי אליך עתה היכל אוכל דבר מאומה הדבר אשר ישים אלהים בפי אתו אדבר
(7025, 93, 4);1;א;227528;(4, 22, 40, 14, 227528);60021;(4, 22, 40, 4, 60021);וצאן;3;4;ויזבח בלק בקר וצאן וישלח לבלעם ולשרים אשר אתו
(7025, 93, 4);300;ש;227621;(4, 23, 1, 23, 227621);60047;(4, 23, 1, 8, 60047);שבעה;1;8;ויאמר בלעם אל בלק בנה לי בזה שבעה מזבחת והכן לי בזה שבעה פרים ושבעה אילים
(7025, 93, 4);90;צ;227714;(4, 23, 3, 17, 227714);60070;(4, 23, 3, 4, 60070);התיצב;4;4;ויאמר בלעם לבלק התיצב על עלתך ואלכה אולי יקרה יהוה לקראתי ודבר מה יראני והגדתי לך וילך שפי
(7025, 93, 4);70;ע;227807;(4, 23, 4, 37, 227807);60094;(4, 23, 4, 10, 60094);ערכתי;1;10;ויקר אלהים אל בלעם ויאמר אליו את שבעת המזבחת ערכתי ואעל פר ואיל במזבח
(7025, 93, 4);10;י;227900;(4, 23, 7, 2, 227900);60120;(4, 23, 7, 1, 60120);וישא;2;1;וישא משלו ויאמר מן ארם ינחני בלק מלך מואב מהררי קדם לכה ארה לי יעקב ולכה זעמה ישראל
(7025, 93, 4);20;כ;227993;(4, 23, 9, 1, 227993);60148;(4, 23, 9, 1, 60148);כי;1;1;כי מראש צרים אראנו ומגבעות אשורנו הן עם לבדד ישכן ובגוים לא יתחשב
(7025, 93, 4);10;י;228086;(4, 23, 10, 41, 228086);60172;(4, 23, 10, 12, 60172);ישרים;4;12;מי מנה עפר יעקב ומספר את רבע ישראל תמת נפשי מות ישרים ותהי אחריתי כמהו
(7025, 93, 4);1;א;228179;(4, 23, 12, 32, 228179);60198;(4, 23, 12, 10, 60198);אשמר;1;10;ויען ויאמר הלא את אשר ישים יהוה בפי אתו אשמר לדבר
(7025, 93, 4);200;ר;228272;(4, 23, 14, 16, 228272);60225;(4, 23, 14, 5, 60225);ראש;1;5;ויקחהו שדה צפים אל ראש הפסגה ויבן שבעה מזבחת ויעל פר ואיל במזבח
(7025, 93, 4);10;י;228365;(4, 23, 16, 24, 228365);60250;(4, 23, 16, 7, 60250);בפיו;3;7;ויקר יהוה אל בלעם וישם דבר בפיו ויאמר שוב אל בלק וכה תדבר
(7025, 93, 4);300;ש;228458;(4, 23, 18, 21, 228458);60277;(4, 23, 18, 6, 60277);ושמע;2;6;וישא משלו ויאמר קום בלק ושמע האזינה עדי בנו צפר
(7025, 93, 4);30;ל;228551;(4, 23, 21, 1, 228551);60302;(4, 23, 21, 1, 60302);לא;1;1;לא הביט און ביעקב ולא ראה עמל בישראל יהוה אלהיו עמו ותרועת מלך בו
(7025, 93, 4);60;ס;228644;(4, 23, 23, 17, 228644);60327;(4, 23, 23, 6, 60327);קסם;2;6;כי לא נחש ביעקב ולא קסם בישראל כעת יאמר ליעקב ולישראל מה פעל אל
(7025, 93, 4);30;ל;228737;(4, 23, 25, 10, 228737);60352;(4, 23, 25, 3, 60352);אל;2;3;ויאמר בלק אל בלעם גם קב לא תקבנו גם ברך לא תברכנו
(7025, 93, 4);2;ב;228830;(4, 23, 27, 11, 228830);60380;(4, 23, 27, 4, 60380);בלעם;1;4;ויאמר בלק אל בלעם לכה נא אקחך אל מקום אחר אולי יישר בעיני האלהים וקבתו לי משם
(7025, 93, 4);2;ב;228923;(4, 23, 29, 6, 228923);60405;(4, 23, 29, 2, 60405);בלעם;1;2;ויאמר בלעם אל בלק בנה לי בזה שבעה מזבחת והכן לי בזה שבעה פרים ושבעה אילם
(7025, 93, 4);20;כ;229016;(4, 24, 1, 9, 229016);60431;(4, 24, 1, 3, 60431);כי;1;3;וירא בלעם כי טוב בעיני יהוה לברך את ישראל ולא הלך כפעם בפעם לקראת נחשים וישת אל המדבר פניו
(7025, 93, 4);30;ל;229109;(4, 24, 2, 30, 229109);60456;(4, 24, 2, 9, 60456);לשבטיו;1;9;וישא בלעם את עיניו וירא את ישראל שכן לשבטיו ותהי עליו רוח אלהים
(7025, 93, 4);3;ג;229202;(4, 24, 4, 31, 229202);60481;(4, 24, 4, 10, 60481);וגלוי;2;10;נאם שמע אמרי אל אשר מחזה שדי יחזה נפל וגלוי עינים
(7025, 93, 4);200;ר;229295;(4, 24, 7, 14, 229295);60503;(4, 24, 7, 4, 60503);וזרעו;3;4;יזל מים מדליו וזרעו במים רבים וירם מאגג מלכו ותנשא מלכתו
(7025, 93, 4);70;ע;229388;(4, 24, 9, 3, 229388);60524;(4, 24, 9, 1, 60524);כרע;3;1;כרע שכב כארי וכלביא מי יקימנו מברכיך ברוך וארריך ארור
(7025, 93, 4);10;י;229481;(4, 24, 10, 52, 229481);60548;(4, 24, 10, 15, 60548);קראתיך;5;15;ויחר אף בלק אל בלעם ויספק את כפיו ויאמר בלק אל בלעם לקב איבי קראתיך והנה ברכת ברך זה שלש פעמים
(7025, 93, 4);20;כ;229574;(4, 24, 12, 25, 229574);60574;(4, 24, 12, 8, 60574);מלאכיך;4;8;ויאמר בלעם אל בלק הלא גם אל מלאכיך אשר שלחת אלי דברתי לאמר
(7025, 93, 4);1;א;229667;(4, 24, 13, 72, 229667);60602;(4, 24, 13, 23, 60602);אתו;1;23;אם יתן לי בלק מלא ביתו כסף וזהב לא אוכל לעבר את פי יהוה לעשות טובה או רעה מלבי אשר ידבר יהוה אתו אדבר
(7025, 93, 4);300;ש;229760;(4, 24, 15, 35, 229760);60626;(4, 24, 15, 10, 60626);שתם;1;10;וישא משלו ויאמר נאם בלעם בנו בער ונאם הגבר שתם העין
(7025, 93, 4);40;ם;229853;(4, 24, 17, 39, 229853);60650;(4, 24, 17, 10, 60650);וקם;3;10;אראנו ולא עתה אשורנו ולא קרוב דרך כוכב מיעקב וקם שבט מישראל ומחץ פאתי מואב וקרקר כל בני שת
(7025, 93, 4);4;ד;229946;(4, 24, 19, 19, 229946);60673;(4, 24, 19, 4, 60673);שריד;4;4;וירד מיעקב והאביד שריד מעיר
(7025, 93, 4);30;ל;230039;(4, 24, 21, 40, 230039);60696;(4, 24, 21, 10, 60696);בסלע;3;10;וירא את הקיני וישא משלו ויאמר איתן מושבך ושים בסלע קנך
(7025, 93, 4);4;ד;230132;(4, 24, 24, 34, 230132);60724;(4, 24, 24, 10, 60724);עדי;2;10;וצים מיד כתים וענו אשור וענו עבר וגם הוא עדי אבד
(7025, 93, 4);10;י;230225;(4, 25, 2, 18, 230225);60747;(4, 25, 2, 4, 60747);אלהיהן;4;4;ותקראן לעם לזבחי אלהיהן ויאכל העם וישתחוו לאלהיהן
(7025, 93, 4);400;ת;230318;(4, 25, 4, 35, 230318);60770;(4, 25, 4, 11, 60770);אותם;3;11;ויאמר יהוה אל משה קח את כל ראשי העם והוקע אותם ליהוה נגד השמש וישב חרון אף יהוה מישראל
(7025, 93, 4);200;ר;230411;(4, 25, 6, 14, 230411);60793;(4, 25, 6, 4, 60793);ישראל;3;4;והנה איש מבני ישראל בא ויקרב אל אחיו את המדינית לעיני משה ולעיני כל עדת בני ישראל והמה בכים פתח אהל מועד
(7025, 93, 4);20;כ;230504;(4, 25, 7, 24, 230504);60818;(4, 25, 7, 7, 60818);הכהן;2;7;וירא פינחס בן אלעזר בן אהרן הכהן ויקם מתוך העדה ויקח רמח בידו
(7025, 93, 4);70;ע;230597;(4, 25, 8, 68, 230597);60843;(4, 25, 8, 19, 60843);מעל;2;19;ויבא אחר איש ישראל אל הקבה וידקר את שניהם את איש ישראל ואת האשה אל קבתה ותעצר המגפה מעל בני ישראל
(7025, 93, 4);50;נ;230690;(4, 25, 11, 37, 230690);60867;(4, 25, 11, 11, 60867);בני;2;11;פינחס בן אלעזר בן אהרן הכהן השיב את חמתי מעל בני ישראל בקנאו את קנאתי בתוכם ולא כליתי את בני ישראל בקנאתי
(7025, 93, 4);200;ר;230783;(4, 25, 13, 20, 230783);60891;(4, 25, 13, 5, 60891);ברית;2;5;והיתה לו ולזרעו אחריו ברית כהנת עולם תחת אשר קנא לאלהיו ויכפר על בני ישראל
(7025, 93, 4);70;ע;230876;(4, 25, 14, 53, 230876);60916;(4, 25, 14, 15, 60916);לשמעני;4;15;ושם איש ישראל המכה אשר הכה את המדינית זמרי בן סלוא נשיא בית אב לשמעני
(7025, 93, 4);90;צ;230969;(4, 25, 18, 3, 230969);60941;(4, 25, 18, 2, 60941);צררים;1;2;כי צררים הם לכם בנכליהם אשר נכלו לכם על דבר פעור ועל דבר כזבי בת נשיא מדין אחתם המכה ביום המגפה על דבר פעור
(7025, 93, 4);80;פ;231062;(4, 25, 19, 12, 231062);60966;(4, 25, 19, 3, 60966);המגפה;4;3;ויהי אחרי המגפה
(7025, 93, 4);300;ש;231155;(4, 26, 2, 56, 231155);60993;(4, 26, 2, 17, 60993);בישראל;3;17;שאו את ראש כל עדת בני ישראל מבן עשרים שנה ומעלה לבית אבתם כל יצא צבא בישראל
(7025, 93, 4);10;י;231248;(4, 26, 4, 46, 231248);61016;(4, 26, 4, 12, 61016);היצאים;5;12;מבן עשרים שנה ומעלה כאשר צוה יהוה את משה ובני ישראל היצאים מארץ מצרים
(7025, 93, 4);10;י;231341;(4, 26, 6, 32, 231341);61035;(4, 26, 6, 6, 61035);הכרמי;5;6;לחצרן משפחת החצרוני לכרמי משפחת הכרמי
(7025, 93, 4);6;ו;231434;(4, 26, 9, 26, 231434);61055;(4, 26, 9, 6, 61055);הוא;2;6;ובני אליאב נמואל ודתן ואבירם הוא דתן ואבירם קרואי העדה אשר הצו על משה ועל אהרן בעדת קרח בהצתם על יהוה
(7025, 93, 4);1;א;231527;(4, 26, 10, 38, 231527);61081;(4, 26, 10, 11, 61081);באכל;2;11;ותפתח הארץ את פיה ותבלע אתם ואת קרח במות העדה באכל האש את חמשים ומאתים איש ויהיו לנס
(7025, 93, 4);20;כ;231620;(4, 26, 12, 52, 231620);61102;(4, 26, 12, 10, 61102);ליכין;3;10;בני שמעון למשפחתם לנמואל משפחת הנמואלי לימין משפחת הימיני ליכין משפחת היכיני
(7025, 93, 4);50;ן;231713;(4, 26, 15, 17, 231713);61121;(4, 26, 15, 4, 61121);לצפון;5;4;בני גד למשפחתם לצפון משפחת הצפוני לחגי משפחת החגי לשוני משפחת השוני
(7025, 93, 4);8;ח;231806;(4, 26, 17, 26, 231806);61140;(4, 26, 17, 5, 61140);משפחת;4;5;לארוד משפחת הארודי לאראלי משפחת האראלי
(7025, 93, 4);40;מ;231899;(4, 26, 20, 15, 231899);61163;(4, 26, 20, 4, 61163);למשפחתם;2;4;ויהיו בני יהודה למשפחתם לשלה משפחת השלני לפרץ משפחת הפרצי לזרח משפחת הזרחי
(7025, 93, 4);5;ה;231992;(4, 26, 22, 3, 231992);61182;(4, 26, 22, 1, 61182);אלה;3;1;אלה משפחת יהודה לפקדיהם ששה ושבעים אלף וחמש מאות
(7025, 93, 4);10;י;232085;(4, 26, 24, 12, 232085);61202;(4, 26, 24, 3, 61202);הישבי;2;3;לישוב משפחת הישבי לשמרן משפחת השמרני
(7025, 93, 4);6;ו;232178;(4, 26, 26, 33, 232178);61221;(4, 26, 26, 7, 61221);לאלון;4;7;בני זבולן למשפחתם לסרד משפחת הסרדי לאלון משפחת האלני ליחלאל משפחת היחלאלי
(7025, 93, 4);10;י;232271;(4, 26, 29, 3, 232271);61240;(4, 26, 29, 1, 61240);בני;3;1;בני מנשה למכיר משפחת המכירי ומכיר הוליד את גלעד לגלעד משפחת הגלעדי
(7025, 93, 4);10;י;232364;(4, 26, 30, 41, 232364);61260;(4, 26, 30, 9, 61260);החלקי;5;9;אלה בני גלעד איעזר משפחת האיעזרי לחלק משפחת החלקי
(7025, 93, 4);50;נ;232457;(4, 26, 33, 28, 232457);61282;(4, 26, 33, 10, 61282);בנות;2;10;וצלפחד בן חפר לא היו לו בנים כי אם בנות ושם בנות צלפחד מחלה ונעה חגלה מלכה ותרצה
(7025, 93, 4);40;ם;232550;(4, 26, 35, 18, 232550);61303;(4, 26, 35, 4, 61303);למשפחתם;7;4;אלה בני אפרים למשפחתם לשותלח משפחת השתלחי לבכר משפחת הבכרי לתחן משפחת התחני
(7025, 93, 4);5;ה;232643;(4, 26, 37, 22, 232643);61323;(4, 26, 37, 5, 61323);לפקדיהם;6;5;אלה משפחת בני אפרים לפקדיהם שנים ושלשים אלף וחמש מאות אלה בני יוסף למשפחתם
(7025, 93, 4);80;פ;232736;(4, 26, 38, 54, 232736);61343;(4, 26, 38, 11, 61343);משפחת;3;11;בני בנימן למשפחתם לבלע משפחת הבלעי לאשבל משפחת האשבלי לאחירם משפחת האחירמי
(7025, 93, 4);2;ב;232829;(4, 26, 41, 7, 232829);61363;(4, 26, 41, 3, 61363);בנימן;1;3;אלה בני בנימן למשפחתם ופקדיהם חמשה וארבעים אלף ושש מאות
(7025, 93, 4);8;ח;232922;(4, 26, 43, 6, 232922);61383;(4, 26, 43, 2, 61383);משפחת;4;2;כל משפחת השוחמי לפקדיהם ארבעה וששים אלף וארבע מאות
(7025, 93, 4);200;ר;233015;(4, 26, 44, 57, 233015);61402;(4, 26, 44, 12, 61402);הבריעי;3;12;בני אשר למשפחתם לימנה משפחת הימנה לישוי משפחת הישוי לבריעה משפחת הבריעי
(7025, 93, 4);1;א;233108;(4, 26, 47, 36, 233108);61423;(4, 26, 47, 9, 61423);וארבע;2;9;אלה משפחת בני אשר לפקדיהם שלשה וחמשים אלף וארבע מאות
(7025, 93, 4);80;פ;233201;(4, 26, 50, 10, 233201);61442;(4, 26, 50, 3, 61442);נפתלי;2;3;אלה משפחת נפתלי למשפחתם ופקדיהם חמשה וארבעים אלף וארבע מאות
(7025, 93, 4);30;ל;233294;(4, 26, 52, 11, 233294);61463;(4, 26, 52, 3, 61463);אל;2;3;וידבר יהוה אל משה לאמר
(7025, 93, 4);5;ה;233387;(4, 26, 55, 14, 233387);61487;(4, 26, 55, 5, 61487);הארץ;1;5;אך בגורל יחלק את הארץ לשמות מטות אבתם ינחלו
(7025, 93, 4);8;ח;233480;(4, 26, 57, 45, 233480);61508;(4, 26, 57, 9, 61508);משפחת;4;9;ואלה פקודי הלוי למשפחתם לגרשון משפחת הגרשני לקהת משפחת הקהתי למררי משפחת המררי
(7025, 93, 4);400;ת;233573;(4, 26, 58, 72, 233573);61528;(4, 26, 58, 16, 61528);את;2;16;אלה משפחת לוי משפחת הלבני משפחת החברני משפחת המחלי משפחת המושי משפחת הקרחי וקהת הולד את עמרם
(7025, 93, 4);1;א;233666;(4, 26, 60, 17, 233666);61554;(4, 26, 60, 5, 61554);ואת;2;5;ויולד לאהרן את נדב ואת אביהוא את אלעזר ואת איתמר
(7025, 93, 4);40;מ;233759;(4, 26, 62, 37, 233759);61577;(4, 26, 62, 10, 61577);ומעלה;2;10;ויהיו פקדיהם שלשה ועשרים אלף כל זכר מבן חדש ומעלה כי לא התפקדו בתוך בני ישראל כי לא נתן להם נחלה בתוך בני ישראל
(7025, 93, 4);2;ב;233852;(4, 26, 63, 42, 233852);61602;(4, 26, 63, 11, 61602);בערבת;4;11;אלה פקודי משה ואלעזר הכהן אשר פקדו את בני ישראל בערבת מואב על ירדן ירחו
(7025, 93, 4);40;מ;233945;(4, 26, 65, 21, 233945);61628;(4, 26, 65, 7, 61628);במדבר;2;7;כי אמר יהוה להם מות ימתו במדבר ולא נותר מהם איש כי אם כלב בן יפנה ויהושע בן נון
(7025, 93, 4);6;ו;234038;(4, 27, 1, 53, 234038);61655;(4, 27, 1, 15, 61655);יוסף;2;15;ותקרבנה בנות צלפחד בן חפר בן גלעד בן מכיר בן מנשה למשפחת מנשה בן יוסף ואלה שמות בנתיו מחלה נעה וחגלה ומלכה ותרצה
(7025, 93, 4);4;ד;234131;(4, 27, 2, 56, 234131);61676;(4, 27, 2, 13, 61676);מועד;4;13;ותעמדנה לפני משה ולפני אלעזר הכהן ולפני הנשיאם וכל העדה פתח אהל מועד לאמר
(7025, 93, 4);40;מ;234224;(4, 27, 4, 19, 234224);61703;(4, 27, 4, 6, 61703);משפחתו;1;6;למה יגרע שם אבינו מתוך משפחתו כי אין לו בן תנה לנו אחזה בתוך אחי אבינו
(7025, 93, 4);50;נ;234317;(4, 27, 7, 16, 234317);61729;(4, 27, 7, 5, 61729);נתן;1;5;כן בנות צלפחד דברת נתן תתן להם אחזת נחלה בתוך אחי אביהם והעברת את נחלת אביהן להן
(7025, 93, 4);400;ת;234410;(4, 27, 8, 45, 234410);61754;(4, 27, 8, 13, 61754);את;2;13;ואל בני ישראל תדבר לאמר איש כי ימות ובן אין לו והעברתם את נחלתו לבתו
(7025, 93, 4);30;ל;234503;(4, 27, 11, 25, 234503);61780;(4, 27, 11, 7, 61780);נחלתו;3;7;ואם אין אחים לאביו ונתתם את נחלתו לשארו הקרב אליו ממשפחתו וירש אתה והיתה לבני ישראל לחקת משפט כאשר צוה יהוה את משה
(7025, 93, 4);10;י;234596;(4, 27, 12, 26, 234596);61804;(4, 27, 12, 8, 61804);העברים;5;8;ויאמר יהוה אל משה עלה אל הר העברים הזה וראה את הארץ אשר נתתי לבני ישראל
(7025, 93, 4);200;ר;234689;(4, 27, 14, 21, 234689);61829;(4, 27, 14, 6, 61829);במריבת;3;6;כאשר מריתם פי במדבר צן במריבת העדה להקדישני במים לעיניהם הם מי מריבת קדש מדבר צן
(7025, 93, 4);4;ד;234782;(4, 27, 16, 31, 234782);61853;(4, 27, 16, 9, 61853);העדה;3;9;יפקד יהוה אלהי הרוחת לכל בשר איש על העדה
(7025, 93, 4);20;ך;234875;(4, 27, 18, 18, 234875);61878;(4, 27, 18, 6, 61878);לך;2;6;ויאמר יהוה אל משה קח לך את יהושע בן נון איש אשר רוח בו וסמכת את ידך עליו
(7025, 93, 4);5;ה;234968;(4, 27, 20, 7, 234968);61903;(4, 27, 20, 2, 61903);מהודך;2;2;ונתתה מהודך עליו למען ישמעו כל עדת בני ישראל
(7025, 93, 4);6;ו;235061;(4, 27, 21, 64, 235061);61927;(4, 27, 21, 17, 61927);הוא;2;17;ולפני אלעזר הכהן יעמד ושאל לו במשפט האורים לפני יהוה על פיו יצאו ועל פיו יבאו הוא וכל בני ישראל אתו וכל העדה
(7025, 93, 4);10;י;235154;(4, 27, 23, 8, 235154);61952;(4, 27, 23, 3, 61952);ידיו;1;3;ויסמך את ידיו עליו ויצוהו כאשר דבר יהוה ביד משה
(7025, 93, 4);400;ת;235247;(4, 28, 2, 45, 235247);61977;(4, 28, 2, 13, 61977);תשמרו;1;13;צו את בני ישראל ואמרת אלהם את קרבני לחמי לאשי ריח ניחחי תשמרו להקריב לי במועדו
(7025, 93, 4);100;ק;235340;(4, 28, 4, 16, 235340);62000;(4, 28, 4, 5, 62000);בבקר;3;5;את הכבש אחד תעשה בבקר ואת הכבש השני תעשה בין הערבים
(7025, 93, 4);8;ח;235433;(4, 28, 6, 26, 235433);62022;(4, 28, 6, 7, 62022);ניחח;3;7;עלת תמיד העשיה בהר סיני לריח ניחח אשה ליהוה
(7025, 93, 4);1;א;235526;(4, 28, 8, 44, 235526);62045;(4, 28, 8, 11, 62045);אשה;1;11;ואת הכבש השני תעשה בין הערבים כמנחת הבקר וכנסכו תעשה אשה ריח ניחח ליהוה
(7025, 93, 4);10;י;235619;(4, 28, 10, 20, 235619);62068;(4, 28, 10, 6, 62068);התמיד;4;6;עלת שבת בשבתו על עלת התמיד ונסכה
(7025, 93, 4);30;ל;235712;(4, 28, 12, 20, 235712);62090;(4, 28, 12, 5, 62090);בלולה;2;5;ושלשה עשרנים סלת מנחה בלולה בשמן לפר האחד ושני עשרנים סלת מנחה בלולה בשמן לאיל האחד
(7025, 93, 4);1;א;235805;(4, 28, 13, 45, 235805);62113;(4, 28, 13, 12, 62113);אשה;1;12;ועשרן עשרון סלת מנחה בלולה בשמן לכבש האחד עלה ריח ניחח אשה ליהוה
(7025, 93, 4);8;ח;235898;(4, 28, 15, 11, 235898);62135;(4, 28, 15, 3, 62135);אחד;2;3;ושעיר עזים אחד לחטאת ליהוה על עלת התמיד יעשה ונסכו
(7025, 93, 4);10;י;235991;(4, 28, 17, 28, 235991);62158;(4, 28, 17, 8, 62158);ימים;3;8;ובחמשה עשר יום לחדש הזה חג שבעת ימים מצות יאכל
(7025, 93, 4);2;ב;236084;(4, 28, 19, 50, 236084);62182;(4, 28, 19, 13, 62182);בני;1;13;והקרבתם אשה עלה ליהוה פרים בני בקר שנים ואיל אחד ושבעה כבשים בני שנה תמימם יהיו לכם
(7025, 93, 4);400;ת;236177;(4, 28, 21, 27, 236177);62203;(4, 28, 21, 6, 62203);לשבעת;5;6;עשרון עשרון תעשה לכבש האחד לשבעת הכבשים
(7025, 93, 4);30;ל;236270;(4, 28, 24, 34, 236270);62228;(4, 28, 24, 10, 62228);ליהוה;1;10;כאלה תעשו ליום שבעת ימים לחם אשה ריח ניחח ליהוה על עולת התמיד יעשה ונסכו
(7025, 93, 4);300;ש;236363;(4, 28, 26, 27, 236363);62249;(4, 28, 26, 5, 62249);חדשה;3;5;וביום הבכורים בהקריבכם מנחה חדשה ליהוה בשבעתיכם מקרא קדש יהיה לכם כל מלאכת עבדה לא תעשו
(7025, 93, 4);5;ה;236456;(4, 28, 27, 48, 236456);62272;(4, 28, 27, 12, 62272);שבעה;4;12;והקרבתם עולה לריח ניחח ליהוה פרים בני בקר שנים איל אחד שבעה כבשים בני שנה
(7025, 93, 4);300;ש;236549;(4, 28, 30, 1, 236549);62294;(4, 28, 30, 1, 62294);שעיר;1;1;שעיר עזים אחד לכפר עליכם
(7025, 93, 4);40;ם;236642;(4, 29, 1, 33, 236642);62315;(4, 29, 1, 8, 62315);לכם;3;8;ובחדש השביעי באחד לחדש מקרא קדש יהיה לכם כל מלאכת עבדה לא תעשו יום תרועה יהיה לכם
(7025, 93, 4);50;נ;236735;(4, 29, 3, 3, 236735);62341;(4, 29, 3, 1, 62341);ומנחתם;3;1;ומנחתם סלת בלולה בשמן שלשה עשרנים לפר שני עשרנים לאיל
(7025, 93, 4);20;כ;236828;(4, 29, 5, 24, 236828);62362;(4, 29, 5, 6, 62362);עליכם;4;6;ושעיר עזים אחד חטאת לכפר עליכם
(7025, 93, 4);30;ל;236921;(4, 29, 7, 31, 236921);62383;(4, 29, 7, 8, 62383);לכם;1;8;ובעשור לחדש השביעי הזה מקרא קדש יהיה לכם ועניתם את נפשתיכם כל מלאכה לא תעשו
(7025, 93, 4);30;ל;237014;(4, 29, 8, 63, 237014);62408;(4, 29, 8, 18, 62408);לכם;1;18;והקרבתם עלה ליהוה ריח ניחח פר בן בקר אחד איל אחד כבשים בני שנה שבעה תמימם יהיו לכם
(7025, 93, 4);1;א;237107;(4, 29, 11, 14, 237107);62429;(4, 29, 11, 4, 62429);חטאת;3;4;שעיר עזים אחד חטאת מלבד חטאת הכפרים ועלת התמיד ומנחתה ונסכיהם
(7025, 93, 4);3;ג;237200;(4, 29, 12, 56, 237200);62451;(4, 29, 12, 15, 62451);וחגתם;3;15;ובחמשה עשר יום לחדש השביעי מקרא קדש יהיה לכם כל מלאכת עבדה לא תעשו וחגתם חג ליהוה שבעת ימים
