(99813, 75, 4);7;ז;157038;(3, 11, 37, 28, 157038);41444;(3, 11, 37, 9, 41444);יזרע;2;9;וכי יפל מנבלתם על כל זרע זרוע אשר יזרע טהור הוא
(99813, 75, 4);5;ה;157113;(3, 11, 39, 29, 157113);41466;(3, 11, 39, 9, 41466);הנגע;1;9;וכי ימות מן הבהמה אשר היא לכם לאכלה הנגע בנבלתה יטמא עד הערב
(99813, 75, 4);70;ע;157188;(3, 11, 40, 56, 157188);41484;(3, 11, 40, 14, 41484);עד;1;14;והאכל מנבלתה יכבס בגדיו וטמא עד הערב והנשא את נבלתה יכבס בגדיו וטמא עד הערב
(99813, 75, 4);30;ל;157263;(3, 11, 42, 41, 157263);41507;(3, 11, 42, 13, 41507);לכל;3;13;כל הולך על גחון וכל הולך על ארבע עד כל מרבה רגלים לכל השרץ השרץ על הארץ לא תאכלום כי שקץ הם
(99813, 75, 4);40;ם;157338;(3, 11, 43, 46, 157338);41528;(3, 11, 43, 12, 41528);בם;2;12;אל תשקצו את נפשתיכם בכל השרץ השרץ ולא תטמאו בהם ונטמתם בם
(99813, 75, 4);1;א;157413;(3, 11, 44, 75, 157413);41547;(3, 11, 44, 19, 41547);הארץ;2;19;כי אני יהוה אלהיכם והתקדשתם והייתם קדשים כי קדוש אני ולא תטמאו את נפשתיכם בכל השרץ הרמש על הארץ
(99813, 75, 4);6;ו;157488;(3, 11, 46, 13, 157488);41566;(3, 11, 46, 4, 41566);והעוף;1;4;זאת תורת הבהמה והעוף וכל נפש החיה הרמשת במים ולכל נפש השרצת על הארץ
(99813, 75, 4);30;ל;157563;(3, 11, 47, 34, 157563);41584;(3, 11, 47, 8, 41584);הנאכלת;5;8;להבדיל בין הטמא ובין הטהר ובין החיה הנאכלת ובין החיה אשר לא תאכל
(99813, 75, 4);1;א;157638;(3, 12, 2, 39, 157638);41605;(3, 12, 2, 11, 41605);וטמאה;4;11;דבר אל בני ישראל לאמר אשה כי תזריע וילדה זכר וטמאה שבעת ימים כימי נדת דותה תטמא
(99813, 75, 4);200;ר;157713;(3, 12, 4, 28, 157713);41623;(3, 12, 4, 7, 41623);טהרה;3;7;ושלשים יום ושלשת ימים תשב בדמי טהרה בכל קדש לא תגע ואל המקדש לא תבא עד מלאת ימי טהרה
(99813, 75, 4);400;ת;157788;(3, 12, 5, 37, 157788);41644;(3, 12, 5, 9, 41644);וששת;4;9;ואם נקבה תלד וטמאה שבעים כנדתה וששים יום וששת ימים תשב על דמי טהרה
(99813, 75, 4);8;ח;157863;(3, 12, 6, 59, 157863);41667;(3, 12, 6, 18, 41667);פתח;3;18;ובמלאת ימי טהרה לבן או לבת תביא כבש בן שנתו לעלה ובן יונה או תר לחטאת אל פתח אהל מועד אל הכהן
(99813, 75, 4);40;ם;157938;(3, 12, 8, 3, 157938);41686;(3, 12, 8, 1, 41686);ואם;3;1;ואם לא תמצא ידה די שה ולקחה שתי תרים או שני בני יונה אחד לעלה ואחד לחטאת וכפר עליה הכהן וטהרה
(99813, 75, 4);200;ר;158013;(3, 13, 1, 5, 158013);41707;(3, 13, 1, 1, 41707);וידבר;5;1;וידבר יהוה אל משה ואל אהרן לאמר
(99813, 75, 4);6;ו;158088;(3, 13, 2, 55, 158088);41729;(3, 13, 2, 16, 41729);והובא;3;16;אדם כי יהיה בעור בשרו שאת או ספחת או בהרת והיה בעור בשרו לנגע צרעת והובא אל אהרן הכהן או אל אחד מבניו הכהנים
(99813, 75, 4);70;ע;158163;(3, 13, 3, 45, 158163);41749;(3, 13, 3, 12, 41749);הנגע;4;12;וראה הכהן את הנגע בעור הבשר ושער בנגע הפך לבן ומראה הנגע עמק מעור בשרו נגע צרעת הוא וראהו הכהן וטמא אתו
(99813, 75, 4);6;ו;158238;(3, 13, 4, 38, 158238);41770;(3, 13, 4, 11, 41770);העור;3;11;ואם בהרת לבנה הוא בעור בשרו ועמק אין מראה מן העור ושערה לא הפך לבן והסגיר הכהן את הנגע שבעת ימים
(99813, 75, 4);30;ל;158313;(3, 13, 5, 37, 158313);41789;(3, 13, 5, 9, 41789);לא;1;9;וראהו הכהן ביום השביעי והנה הנגע עמד בעיניו לא פשה הנגע בעור והסגירו הכהן שבעת ימים שנית
(99813, 75, 4);80;פ;158388;(3, 13, 6, 40, 158388);41808;(3, 13, 6, 11, 41808);פשה;1;11;וראה הכהן אתו ביום השביעי שנית והנה כהה הנגע ולא פשה הנגע בעור וטהרו הכהן מספחת הוא וכבס בגדיו וטהר
(99813, 75, 4);50;ן;158463;(3, 13, 7, 35, 158463);41826;(3, 13, 7, 9, 41826);הכהן;4;9;ואם פשה תפשה המספחת בעור אחרי הראתו אל הכהן לטהרתו ונראה שנית אל הכהן
(99813, 75, 4);10;י;158538;(3, 13, 9, 12, 158538);41845;(3, 13, 9, 4, 41845);תהיה;3;4;נגע צרעת כי תהיה באדם והובא אל הכהן
(99813, 75, 4);50;נ;158613;(3, 13, 11, 8, 158613);41865;(3, 13, 11, 2, 41865);נושנת;4;2;צרעת נושנת הוא בעור בשרו וטמאו הכהן לא יסגרנו כי טמא הוא
(99813, 75, 4);5;ה;158688;(3, 13, 12, 38, 158688);41886;(3, 13, 12, 11, 41886);הנגע;1;11;ואם פרוח תפרח הצרעת בעור וכסתה הצרעת את כל עור הנגע מראשו ועד רגליו לכל מראה עיני הכהן
(99813, 75, 4);80;פ;158763;(3, 13, 13, 44, 158763);41906;(3, 13, 13, 13, 41906);הפך;2;13;וראה הכהן והנה כסתה הצרעת את כל בשרו וטהר את הנגע כלו הפך לבן טהור הוא
(99813, 75, 4);1;א;158838;(3, 13, 16, 1, 158838);41928;(3, 13, 16, 1, 41928);או;1;1;או כי ישוב הבשר החי ונהפך ללבן ובא אל הכהן
(99813, 75, 4);200;ר;158913;(3, 13, 17, 43, 158913);41948;(3, 13, 17, 11, 41948);טהור;4;11;וראהו הכהן והנה נהפך הנגע ללבן וטהר הכהן את הנגע טהור הוא
(99813, 75, 4);5;ה;158988;(3, 13, 19, 47, 158988);41968;(3, 13, 19, 12, 41968);הכהן;3;12;והיה במקום השחין שאת לבנה או בהרת לבנה אדמדמת ונראה אל הכהן
(99813, 75, 4);20;כ;159063;(3, 13, 21, 10, 159063);41988;(3, 13, 21, 3, 41988);הכהן;2;3;ואם יראנה הכהן והנה אין בה שער לבן ושפלה איננה מן העור והיא כהה והסגירו הכהן שבעת ימים
(99813, 75, 4);9;ט;159138;(3, 13, 22, 16, 159138);42008;(3, 13, 22, 5, 42008);וטמא;2;5;ואם פשה תפשה בעור וטמא הכהן אתו נגע הוא
(99813, 75, 4);40;מ;159213;(3, 13, 24, 16, 159213);42029;(3, 13, 24, 6, 42029);מכות;1;6;או בשר כי יהיה בערו מכות אש והיתה מחית המכוה בהרת לבנה אדמדמת או לבנה
(99813, 75, 4);70;ע;159288;(3, 13, 25, 36, 159288);42048;(3, 13, 25, 10, 42048);עמק;1;10;וראה אתה הכהן והנה נהפך שער לבן בבהרת ומראה עמק מן העור צרעת הוא במכוה פרחה וטמא אתו הכהן נגע צרעת הוא
(99813, 75, 4);50;ן;159363;(3, 13, 26, 30, 159363);42068;(3, 13, 26, 8, 42068);לבן;3;8;ואם יראנה הכהן והנה אין בבהרת שער לבן ושפלה איננה מן העור והוא כהה והסגירו הכהן שבעת ימים
(99813, 75, 4);6;ו;159438;(3, 13, 27, 33, 159438);42087;(3, 13, 27, 9, 42087);וטמא;1;9;וראהו הכהן ביום השביעי אם פשה תפשה בעור וטמא הכהן אתו נגע צרעת הוא
(99813, 75, 4);20;כ;159513;(3, 13, 28, 55, 159513);42107;(3, 13, 28, 15, 42107);כי;1;15;ואם תחתיה תעמד הבהרת לא פשתה בעור והוא כהה שאת המכוה הוא וטהרו הכהן כי צרבת המכוה הוא
(99813, 75, 4);200;ר;159588;(3, 13, 30, 32, 159588);42129;(3, 13, 30, 9, 42129);העור;4;9;וראה הכהן את הנגע והנה מראהו עמק מן העור ובו שער צהב דק וטמא אתו הכהן נתק הוא צרעת הראש או הזקן הוא
(99813, 75, 4);1;א;159663;(3, 13, 31, 30, 159663);42152;(3, 13, 31, 9, 42152);מראהו;3;9;וכי יראה הכהן את נגע הנתק והנה אין מראהו עמק מן העור ושער שחר אין בו והסגיר הכהן את נגע הנתק שבעת ימים
(99813, 75, 4);6;ו;159738;(3, 13, 32, 25, 159738);42173;(3, 13, 32, 7, 42173);והנה;1;7;וראה הכהן את הנגע ביום השביעי והנה לא פשה הנתק ולא היה בו שער צהב ומראה הנתק אין עמק מן העור
(99813, 75, 4);5;ה;159813;(3, 13, 33, 28, 159813);42194;(3, 13, 33, 7, 42194);הכהן;3;7;והתגלח ואת הנתק לא יגלח והסגיר הכהן את הנתק שבעת ימים שנית
(99813, 75, 4);40;מ;159888;(3, 13, 34, 56, 159888);42214;(3, 13, 34, 15, 42214);מן;1;15;וראה הכהן את הנתק ביום השביעי והנה לא פשה הנתק בעור ומראהו איננו עמק מן העור וטהר אתו הכהן וכבס בגדיו וטהר
(99813, 75, 4);400;ת;159963;(3, 13, 36, 19, 159963);42233;(3, 13, 36, 5, 42233);הנתק;3;5;וראהו הכהן והנה פשה הנתק בעור לא יבקר הכהן לשער הצהב טמא הוא
(99813, 75, 4);5;ה;160038;(3, 13, 37, 46, 160038);42254;(3, 13, 37, 13, 42254);וטהרו;3;13;ואם בעיניו עמד הנתק ושער שחר צמח בו נרפא הנתק טהור הוא וטהרו הכהן
(99813, 75, 4);5;ה;160113;(3, 13, 39, 34, 160113);42274;(3, 13, 39, 9, 42274);בהק;2;9;וראה הכהן והנה בעור בשרם בהרת כהות לבנת בהק הוא פרח בעור טהור הוא
(99813, 75, 4);5;ה;160188;(3, 13, 41, 30, 160188);42296;(3, 13, 41, 9, 42296);הוא;1;9;ואם מפאת פניו ימרט ראשו גבח הוא טהור הוא
(99813, 75, 4);400;ת;160263;(3, 13, 43, 18, 160263);42315;(3, 13, 43, 5, 42315);שאת;3;5;וראה אתו הכהן והנה שאת הנגע לבנה אדמדמת בקרחתו או בגבחתו כמראה צרעת עור בשר
(99813, 75, 4);1;א;160338;(3, 13, 44, 32, 160338);42334;(3, 13, 44, 9, 42334);בראשו;3;9;איש צרוע הוא טמא הוא טמא יטמאנו הכהן בראשו נגעו
(99813, 75, 4);1;א;160413;(3, 13, 46, 6, 160413);42354;(3, 13, 46, 3, 42354);אשר;1;3;כל ימי אשר הנגע בו יטמא טמא הוא בדד ישב מחוץ למחנה מושבו
(99813, 75, 4);10;י;160488;(3, 13, 47, 37, 160488);42375;(3, 13, 47, 11, 42375);פשתים;4;11;והבגד כי יהיה בו נגע צרעת בבגד צמר או בבגד פשתים
(99813, 75, 4);6;ו;160563;(3, 13, 49, 32, 160563);42396;(3, 13, 49, 9, 42396);או;2;9;והיה הנגע ירקרק או אדמדם בבגד או בעור או בשתי או בערב או בכל כלי עור נגע צרעת הוא והראה את הכהן
(99813, 75, 4);10;י;160638;(3, 13, 50, 33, 160638);42418;(3, 13, 50, 9, 42418);ימים;3;9;וראה הכהן את הנגע והסגיר את הנגע שבעת ימים
(99813, 75, 4);70;ע;160713;(3, 13, 51, 74, 160713);42439;(3, 13, 51, 21, 42439);צרעת;3;21;וראה את הנגע ביום השביעי כי פשה הנגע בבגד או בשתי או בערב או בעור לכל אשר יעשה העור למלאכה צרעת ממארת הנגע טמא הוא
(99813, 75, 4);2;ב;160788;(3, 13, 52, 59, 160788);42463;(3, 13, 52, 20, 42463);בו;1;20;ושרף את הבגד או את השתי או את הערב בצמר או בפשתים או את כל כלי העור אשר יהיה בו הנגע כי צרעת ממארת הוא באש תשרף
(99813, 75, 4);70;ע;160863;(3, 13, 53, 49, 160863);42486;(3, 13, 53, 16, 42486);עור;1;16;ואם יראה הכהן והנה לא פשה הנגע בבגד או בשתי או בערב או בכל כלי עור
(99813, 75, 4);80;פ;160938;(3, 13, 55, 30, 160938);42506;(3, 13, 55, 9, 42506);הפך;2;9;וראה הכהן אחרי הכבס את הנגע והנה לא הפך הנגע את עינו והנגע לא פשה טמא הוא באש תשרפנו פחתת הוא בקרחתו או בגבחתו
(99813, 75, 4);5;ה;161013;(3, 13, 56, 18, 161013);42527;(3, 13, 56, 6, 42527);הנגע;1;6;ואם ראה הכהן והנה כהה הנגע אחרי הכבס אתו וקרע אתו מן הבגד או מן העור או מן השתי או מן הערב
(99813, 75, 4);70;ע;161088;(3, 13, 57, 24, 161088);42551;(3, 13, 57, 8, 42551);בערב;2;8;ואם תראה עוד בבגד או בשתי או בערב או בכל כלי עור פרחת הוא באש תשרפנו את אשר בו הנגע
(99813, 75, 4);60;ס;161163;(3, 13, 58, 35, 161163);42574;(3, 13, 58, 11, 42574);תכבס;4;11;והבגד או השתי או הערב או כל כלי העור אשר תכבס וסר מהם הנגע וכבס שנית וטהר
(99813, 75, 4);9;ט;161238;(3, 13, 59, 53, 161238);42597;(3, 13, 59, 17, 42597);לטהרו;2;17;זאת תורת נגע צרעת בגד הצמר או הפשתים או השתי או הערב או כל כלי עור לטהרו או לטמאו
(99813, 75, 4);40;מ;161313;(3, 14, 3, 11, 161313);42617;(3, 14, 3, 4, 42617);מחוץ;1;4;ויצא הכהן אל מחוץ למחנה וראה הכהן והנה נרפא נגע הצרעת מן הצרוע
(99813, 75, 4);70;ע;161388;(3, 14, 4, 36, 161388);42635;(3, 14, 4, 9, 42635);ועץ;2;9;וצוה הכהן ולקח למטהר שתי צפרים חיות טהרות ועץ ארז ושני תולעת ואזב
(99813, 75, 4);1;א;161463;(3, 14, 6, 18, 161463);42657;(3, 14, 6, 6, 42657);ואת;2;6;את הצפר החיה יקח אתה ואת עץ הארז ואת שני התולעת ואת האזב וטבל אותם ואת הצפר החיה בדם הצפר השחטה על המים החיים
(99813, 75, 4);5;ה;161538;(3, 14, 7, 7, 161538);42678;(3, 14, 7, 3, 42678);המטהר;1;3;והזה על המטהר מן הצרעת שבע פעמים וטהרו ושלח את הצפר החיה על פני השדה
(99813, 75, 4);6;ו;161613;(3, 14, 8, 28, 161613);42698;(3, 14, 8, 8, 42698);שערו;4;8;וכבס המטהר את בגדיו וגלח את כל שערו ורחץ במים וטהר ואחר יבוא אל המחנה וישב מחוץ לאהלו שבעת ימים
(99813, 75, 4);1;א;161688;(3, 14, 9, 27, 161688);42718;(3, 14, 9, 8, 42718);את;1;8;והיה ביום השביעי יגלח את כל שערו את ראשו ואת זקנו ואת גבת עיניו ואת כל שערו יגלח וכבס את בגדיו ורחץ את בשרו במים וטהר
(99813, 75, 4);50;נ;161763;(3, 14, 10, 10, 161763);42738;(3, 14, 10, 2, 42738);השמיני;5;2;וביום השמיני יקח שני כבשים תמימם וכבשה אחת בת שנתה תמימה ושלשה עשרנים סלת מנחה בלולה בשמן ולג אחד שמן
(99813, 75, 4);70;ע;161838;(3, 14, 11, 3, 161838);42757;(3, 14, 11, 1, 42757);והעמיד;3;1;והעמיד הכהן המטהר את האיש המטהר ואתם לפני יהוה פתח אהל מועד
(99813, 75, 4);300;ש;161913;(3, 14, 12, 30, 161913);42776;(3, 14, 12, 8, 42776);לאשם;3;8;ולקח הכהן את הכבש האחד והקריב אתו לאשם ואת לג השמן והניף אתם תנופה לפני יהוה
(99813, 75, 4);4;ד;161988;(3, 14, 13, 44, 161988);42796;(3, 14, 13, 12, 42796);הקדש;3;12;ושחט את הכבש במקום אשר ישחט את החטאת ואת העלה במקום הקדש כי כחטאת האשם הוא לכהן קדש קדשים הוא
(99813, 75, 4);70;ע;162063;(3, 14, 14, 45, 162063);42816;(3, 14, 14, 12, 42816);ועל;2;12;ולקח הכהן מדם האשם ונתן הכהן על תנוך אזן המטהר הימנית ועל בהן ידו הימנית ועל בהן רגלו הימנית
(99813, 75, 4);90;צ;162138;(3, 14, 16, 12, 162138);42836;(3, 14, 16, 4, 42836);אצבעו;2;4;וטבל הכהן את אצבעו הימנית מן השמן אשר על כפו השמאלית והזה מן השמן באצבעו שבע פעמים לפני יהוה
(99813, 75, 4);70;ע;162213;(3, 14, 17, 13, 162213);42855;(3, 14, 17, 4, 42855);על;1;4;ומיתר השמן אשר על כפו יתן הכהן על תנוך אזן המטהר הימנית ועל בהן ידו הימנית ועל בהן רגלו הימנית על דם האשם
(99813, 75, 4);400;ת;162288;(3, 14, 18, 5, 162288);42875;(3, 14, 18, 1, 42875);והנותר;5;1;והנותר בשמן אשר על כף הכהן יתן על ראש המטהר וכפר עליו הכהן לפני יהוה
(99813, 75, 4);200;ר;162363;(3, 14, 19, 26, 162363);42896;(3, 14, 19, 7, 42896);המטהר;5;7;ועשה הכהן את החטאת וכפר על המטהר מטמאתו ואחר ישחט את העלה
(99813, 75, 4);1;א;162438;(3, 14, 21, 10, 162438);42916;(3, 14, 21, 4, 42916);ואין;2;4;ואם דל הוא ואין ידו משגת ולקח כבש אחד אשם לתנופה לכפר עליו ועשרון סלת אחד בלול בשמן למנחה ולג שמן
(99813, 75, 4);40;ם;162513;(3, 14, 22, 8, 162513);42935;(3, 14, 22, 2, 42935);תרים;4;2;ושתי תרים או שני בני יונה אשר תשיג ידו והיה אחד חטאת והאחד עלה
(99813, 75, 4);400;ת;162588;(3, 14, 23, 34, 162588);42956;(3, 14, 23, 9, 42956);פתח;2;9;והביא אתם ביום השמיני לטהרתו אל הכהן אל פתח אהל מועד לפני יהוה
(99813, 75, 4);2;ב;162663;(3, 14, 25, 8, 162663);42977;(3, 14, 25, 3, 42977);כבש;2;3;ושחט את כבש האשם ולקח הכהן מדם האשם ונתן על תנוך אזן המטהר הימנית ועל בהן ידו הימנית ועל בהן רגלו הימנית
(99813, 75, 4);400;ת;162738;(3, 14, 25, 83, 162738);42996;(3, 14, 25, 22, 42996);הימנית;6;22;ושחט את כבש האשם ולקח הכהן מדם האשם ונתן על תנוך אזן המטהר הימנית ועל בהן ידו הימנית ועל בהן רגלו הימנית
(99813, 75, 4);70;ע;162813;(3, 14, 27, 46, 162813);43016;(3, 14, 27, 12, 43016);פעמים;2;12;והזה הכהן באצבעו הימנית מן השמן אשר על כפו השמאלית שבע פעמים לפני יהוה
(99813, 75, 4);200;ר;162888;(3, 14, 28, 64, 162888);43037;(3, 14, 28, 19, 43037);רגלו;1;19;ונתן הכהן מן השמן אשר על כפו על תנוך אזן המטהר הימנית ועל בהן ידו הימנית ועל בהן רגלו הימנית על מקום דם האשם
(99813, 75, 4);70;ע;162963;(3, 14, 30, 2, 162963);43058;(3, 14, 30, 1, 43058);ועשה;2;1;ועשה את האחד מן התרים או מן בני היונה מאשר תשיג ידו
(99813, 75, 4);50;נ;163038;(3, 14, 31, 37, 163038);43081;(3, 14, 31, 12, 43081);המנחה;3;12;את אשר תשיג ידו את האחד חטאת ואת האחד עלה על המנחה וכפר הכהן על המטהר לפני יהוה
(99813, 75, 4);300;ש;163113;(3, 14, 33, 13, 163113);43102;(3, 14, 33, 4, 43102);משה;2;4;וידבר יהוה אל משה ואל אהרן לאמר
(99813, 75, 4);200;ר;163188;(3, 14, 35, 6, 163188);43123;(3, 14, 35, 2, 43123);אשר;3;2;ובא אשר לו הבית והגיד לכהן לאמר כנגע נראה לי בבית
(99813, 75, 4);30;ל;163263;(3, 14, 36, 42, 163263);43144;(3, 14, 36, 12, 43144);ולא;2;12;וצוה הכהן ופנו את הבית בטרם יבא הכהן לראות את הנגע ולא יטמא כל אשר בבית ואחר כן יבא הכהן לראות את הבית
(99813, 75, 4);100;ק;163338;(3, 14, 37, 37, 163338);43164;(3, 14, 37, 9, 43164);ירקרקת;3;9;וראה את הנגע והנה הנגע בקירת הבית שקערורת ירקרקת או אדמדמת ומראיהן שפל מן הקיר
(99813, 75, 4);20;כ;163413;(3, 14, 39, 5, 163413);43184;(3, 14, 39, 2, 43184);הכהן;2;2;ושב הכהן ביום השביעי וראה והנה פשה הנגע בקירת הבית
(99813, 75, 4);1;א;163488;(3, 14, 40, 39, 163488);43202;(3, 14, 40, 10, 43202);אתהן;1;10;וצוה הכהן וחלצו את האבנים אשר בהן הנגע והשליכו אתהן אל מחוץ לעיר אל מקום טמא
(99813, 75, 4);40;ם;163563;(3, 14, 41, 53, 163563);43223;(3, 14, 41, 15, 43223);מקום;4;15;ואת הבית יקצע מבית סביב ושפכו את העפר אשר הקצו אל מחוץ לעיר אל מקום טמא
(99813, 75, 4);8;ח;163638;(3, 14, 43, 21, 163638);43243;(3, 14, 43, 6, 43243);אחר;2;6;ואם ישוב הנגע ופרח בבית אחר חלץ את האבנים ואחרי הקצות את הבית ואחרי הטוח
(99813, 75, 4);1;א;163713;(3, 14, 44, 38, 163713);43262;(3, 14, 44, 10, 43262);הוא;3;10;ובא הכהן וראה והנה פשה הנגע בבית צרעת ממארת הוא בבית טמא הוא
(99813, 75, 4);1;א;163788;(3, 14, 46, 4, 163788);43284;(3, 14, 46, 1, 43284);והבא;4;1;והבא אל הבית כל ימי הסגיר אתו יטמא עד הערב
(99813, 75, 4);10;י;163863;(3, 14, 48, 6, 163863);43306;(3, 14, 48, 3, 43306);יבא;1;3;ואם בא יבא הכהן וראה והנה לא פשה הנגע בבית אחרי הטח את הבית וטהר הכהן את הבית כי נרפא הנגע
(99813, 75, 4);5;ה;163938;(3, 14, 49, 11, 163938);43328;(3, 14, 49, 4, 43328);הבית;1;4;ולקח לחטא את הבית שתי צפרים ועץ ארז ושני תולעת ואזב
(99813, 75, 4);1;א;164013;(3, 14, 51, 14, 164013);43350;(3, 14, 51, 5, 43350);ואת;2;5;ולקח את עץ הארז ואת האזב ואת שני התולעת ואת הצפר החיה וטבל אתם בדם הצפר השחוטה ובמים החיים והזה אל הבית שבע פעמים
(99813, 75, 4);10;י;164088;(3, 14, 51, 89, 164088);43369;(3, 14, 51, 24, 43369);פעמים;4;24;ולקח את עץ הארז ואת האזב ואת שני התולעת ואת הצפר החיה וטבל אתם בדם הצפר השחוטה ובמים החיים והזה אל הבית שבע פעמים
(99813, 75, 4);10;י;164163;(3, 14, 53, 13, 164163);43387;(3, 14, 53, 4, 43387);החיה;3;4;ושלח את הצפר החיה אל מחוץ לעיר אל פני השדה וכפר על הבית וטהר
(99813, 75, 4);30;ל;164238;(3, 14, 56, 2, 164238);43407;(3, 14, 56, 1, 43407);ולשאת;2;1;ולשאת ולספחת ולבהרת
(99813, 75, 4);4;ד;164313;(3, 15, 2, 1, 164313);43425;(3, 15, 2, 1, 43425);דברו;1;1;דברו אל בני ישראל ואמרתם אלהם איש איש כי יהיה זב מבשרו זובו טמא הוא
(99813, 75, 4);200;ר;164388;(3, 15, 3, 23, 164388);43445;(3, 15, 3, 6, 43445);בשרו;3;6;וזאת תהיה טמאתו בזובו רר בשרו את זובו או החתים בשרו מזובו טמאתו הוא
(99813, 75, 4);9;ט;164463;(3, 15, 4, 44, 164463);43466;(3, 15, 4, 13, 43466);יטמא;2;13;כל המשכב אשר ישכב עליו הזב יטמא וכל הכלי אשר ישב עליו יטמא
(99813, 75, 4);3;ג;164538;(3, 15, 6, 30, 164538);43486;(3, 15, 6, 9, 43486);בגדיו;2;9;והישב על הכלי אשר ישב עליו הזב יכבס בגדיו ורחץ במים וטמא עד הערב
(99813, 75, 4);6;ו;164613;(3, 15, 8, 15, 164613);43506;(3, 15, 8, 5, 43506);וכבס;1;5;וכי ירק הזב בטהור וכבס בגדיו ורחץ במים וטמא עד הערב
(99813, 75, 4);10;י;164688;(3, 15, 10, 23, 164688);43526;(3, 15, 10, 7, 43526);יטמא;1;7;וכל הנגע בכל אשר יהיה תחתיו יטמא עד הערב והנושא אותם יכבס בגדיו ורחץ במים וטמא עד הערב
(99813, 75, 4);6;ו;164763;(3, 15, 11, 29, 164763);43547;(3, 15, 11, 10, 43547);וכבס;1;10;וכל אשר יגע בו הזב וידיו לא שטף במים וכבס בגדיו ורחץ במים וטמא עד הערב
(99813, 75, 4);40;מ;164838;(3, 15, 13, 11, 164838);43569;(3, 15, 13, 4, 43569);מזובו;1;4;וכי יטהר הזב מזובו וספר לו שבעת ימים לטהרתו וכבס בגדיו ורחץ בשרו במים חיים וטהר
(99813, 75, 4);10;י;164913;(3, 15, 14, 22, 164913);43587;(3, 15, 14, 6, 43587);תרים;3;6;וביום השמיני יקח לו שתי תרים או שני בני יונה ובא לפני יהוה אל פתח אהל מועד ונתנם אל הכהן
(99813, 75, 4);20;כ;164988;(3, 15, 15, 28, 164988);43609;(3, 15, 15, 8, 43609);וכפר;2;8;ועשה אתם הכהן אחד חטאת והאחד עלה וכפר עליו הכהן לפני יהוה מזובו
(99813, 75, 4);4;ד;165063;(3, 15, 17, 6, 165063);43630;(3, 15, 17, 2, 43630);בגד;3;2;וכל בגד וכל עור אשר יהיה עליו שכבת זרע וכבס במים וטמא עד הערב
(99813, 75, 4);40;ם;165138;(3, 15, 18, 33, 165138);43651;(3, 15, 18, 9, 43651);במים;4;9;ואשה אשר ישכב איש אתה שכבת זרע ורחצו במים וטמאו עד הערב
(99813, 75, 4);6;ו;165213;(3, 15, 20, 1, 165213);43673;(3, 15, 20, 1, 43673);וכל;1;1;וכל אשר תשכב עליו בנדתה יטמא וכל אשר תשב עליו יטמא
(99813, 75, 4);4;ד;165288;(3, 15, 21, 36, 165288);43692;(3, 15, 21, 9, 43692);עד;2;9;וכל הנגע במשכבה יכבס בגדיו ורחץ במים וטמא עד הערב
(99813, 75, 4);10;י;165363;(3, 15, 23, 21, 165363);43714;(3, 15, 23, 7, 43714);הכלי;4;7;ואם על המשכב הוא או על הכלי אשר הוא ישבת עליו בנגעו בו יטמא עד הערב
(99813, 75, 4);5;ה;165438;(3, 15, 24, 44, 165438);43736;(3, 15, 24, 13, 43736);המשכב;1;13;ואם שכב ישכב איש אתה ותהי נדתה עליו וטמא שבעת ימים וכל המשכב אשר ישכב עליו יטמא
(99813, 75, 4);9;ט;165513;(3, 15, 25, 56, 165513);43759;(3, 15, 25, 19, 43759);טמאתה;1;19;ואשה כי יזוב זוב דמה ימים רבים בלא עת נדתה או כי תזוב על נדתה כל ימי זוב טמאתה כימי נדתה תהיה טמאה הוא
