(7025, 93, 4);40;מ;77240;(1, 50, 11, 66, 77240);20397;(1, 50, 11, 19, 20397);מצרים;1;19;וירא יושב הארץ הכנעני את האבל בגרן האטד ויאמרו אבל כבד זה למצרים על כן קרא שמה אבל מצרים אשר בעבר הירדן
(7025, 93, 4);5;ה;77333;(1, 50, 13, 57, 77333);20421;(1, 50, 13, 15, 20421);השדה;1;15;וישאו אתו בניו ארצה כנען ויקברו אתו במערת שדה המכפלה אשר קנה אברהם את השדה לאחזת קבר מאת עפרן החתי על פני ממרא
(7025, 93, 4);6;ו;77426;(1, 50, 15, 5, 77426);20445;(1, 50, 15, 1, 20445);ויראו;5;1;ויראו אחי יוסף כי מת אביהם ויאמרו לו ישטמנו יוסף והשב ישיב לנו את כל הרעה אשר גמלנו אתו
(7025, 93, 4);400;ת;77519;(1, 50, 16, 29, 77519);20471;(1, 50, 16, 8, 20471);מותו;3;8;ויצוו אל יוסף לאמר אביך צוה לפני מותו לאמר
(7025, 93, 4);6;ו;77612;(1, 50, 18, 5, 77612);20496;(1, 50, 18, 1, 20496);וילכו;5;1;וילכו גם אחיו ויפלו לפניו ויאמרו הננו לך לעבדים
(7025, 93, 4);30;ל;77705;(1, 50, 20, 25, 77705);20520;(1, 50, 20, 7, 20520);לטבה;1;7;ואתם חשבתם עלי רעה אלהים חשבה לטבה למען עשה כיום הזה להחית עם רב
(7025, 93, 4);1;א;77798;(1, 50, 22, 17, 77798);20544;(1, 50, 22, 4, 20544);הוא;3;4;וישב יוסף במצרים הוא ובית אביו ויחי יוסף מאה ועשר שנים
(7025, 93, 4);6;ו;77891;(1, 50, 24, 15, 77891);20569;(1, 50, 24, 4, 20569);אחיו;4;4;ויאמר יוסף אל אחיו אנכי מת ואלהים פקד יפקד אתכם והעלה אתכם מן הארץ הזאת אל הארץ אשר נשבע לאברהם ליצחק וליעקב
(7025, 93, 4);1;א;77984;(1, 50, 25, 21, 77984);20593;(1, 50, 25, 6, 20593);לאמר;2;6;וישבע יוסף את בני ישראל לאמר פקד יפקד אלהים אתכם והעלתם את עצמתי מזה
(7025, 93, 4);300;ש;78077;(2, 1, 1, 13, 78077);20616;(2, 1, 1, 4, 20616);ישראל;2;4;ואלה שמות בני ישראל הבאים מצרימה את יעקב איש וביתו באו
(7025, 93, 4);10;י;78170;(2, 1, 5, 13, 78170);20638;(2, 1, 5, 4, 20638);יצאי;4;4;ויהי כל נפש יצאי ירך יעקב שבעים נפש ויוסף היה במצרים
(7025, 93, 4);400;ת;78263;(2, 1, 7, 38, 78263);20661;(2, 1, 7, 9, 20661);ותמלא;2;9;ובני ישראל פרו וישרצו וירבו ויעצמו במאד מאד ותמלא הארץ אתם
(7025, 93, 4);6;ו;78356;(2, 1, 10, 18, 78356);20689;(2, 1, 10, 6, 20689);והיה;1;6;הבה נתחכמה לו פן ירבה והיה כי תקראנה מלחמה ונוסף גם הוא על שנאינו ונלחם בנו ועלה מן הארץ
(7025, 93, 4);20;כ;78449;(2, 1, 11, 41, 78449);20712;(2, 1, 11, 10, 20712);מסכנות;3;10;וישימו עליו שרי מסים למען ענתו בסבלתם ויבן ערי מסכנות לפרעה את פתם ואת רעמסס
(7025, 93, 4);200;ר;78542;(2, 1, 14, 5, 78542);20735;(2, 1, 14, 1, 20735);וימררו;5;1;וימררו את חייהם בעבדה קשה בחמר ובלבנים ובכל עבדה בשדה את כל עבדתם אשר עבדו בהם בפרך
(7025, 93, 4);5;ה;78635;(2, 1, 15, 31, 78635);20759;(2, 1, 15, 8, 20759);האחת;1;8;ויאמר מלך מצרים למילדת העברית אשר שם האחת שפרה ושם השנית פועה
(7025, 93, 4);1;א;78728;(2, 1, 17, 13, 78728);20782;(2, 1, 17, 3, 20782);את;1;3;ותיראן המילדת את האלהים ולא עשו כאשר דבר אליהן מלך מצרים ותחיין את הילדים
(7025, 93, 4);8;ח;78821;(2, 1, 18, 46, 78821);20804;(2, 1, 18, 11, 20804);ותחיין;3;11;ויקרא מלך מצרים למילדת ויאמר להן מדוע עשיתן הדבר הזה ותחיין את הילדים
(7025, 93, 4);30;ל;78914;(2, 1, 20, 11, 78914);20826;(2, 1, 20, 3, 20826);למילדת;1;3;וייטב אלהים למילדת וירב העם ויעצמו מאד
(7025, 93, 4);10;י;79007;(2, 1, 22, 37, 79007);20849;(2, 1, 22, 10, 20849);תשליכהו;4;10;ויצו פרעה לכל עמו לאמר כל הבן הילוד היארה תשליכהו וכל הבת תחיון
(7025, 93, 4);6;ו;79100;(2, 2, 3, 9, 79100);20875;(2, 2, 3, 3, 20875);עוד;2;3;ולא יכלה עוד הצפינו ותקח לו תבת גמא ותחמרה בחמר ובזפת ותשם בה את הילד ותשם בסוף על שפת היאר
(7025, 93, 4);2;ב;79193;(2, 2, 5, 5, 79193);20901;(2, 2, 5, 2, 20901);בת;1;2;ותרד בת פרעה לרחץ על היאר ונערתיה הלכת על יד היאר ותרא את התבה בתוך הסוף ותשלח את אמתה ותקחה
(7025, 93, 4);2;ב;79286;(2, 2, 6, 25, 79286);20926;(2, 2, 6, 7, 20926);בכה;1;7;ותפתח ותראהו את הילד והנה נער בכה ותחמל עליו ותאמר מילדי העברים זה
(7025, 93, 4);30;ל;79379;(2, 2, 8, 6, 79379);20950;(2, 2, 8, 2, 20950);לה;1;2;ותאמר לה בת פרעה לכי ותלך העלמה ותקרא את אם הילד
(7025, 93, 4);30;ל;79472;(2, 2, 9, 61, 79472);20976;(2, 2, 9, 17, 20976);הילד;3;17;ותאמר לה בת פרעה היליכי את הילד הזה והינקהו לי ואני אתן את שכרך ותקח האשה הילד ותניקהו
(7025, 93, 4);1;א;79565;(2, 2, 11, 24, 79565);20999;(2, 2, 11, 6, 20999);ויצא;4;6;ויהי בימים ההם ויגדל משה ויצא אל אחיו וירא בסבלתם וירא איש מצרי מכה איש עברי מאחיו
(7025, 93, 4);5;ה;79658;(2, 2, 13, 9, 79658);21025;(2, 2, 13, 3, 21025);השני;1;3;ויצא ביום השני והנה שני אנשים עברים נצים ויאמר לרשע למה תכה רעך
(7025, 93, 4);90;צ;79751;(2, 2, 14, 51, 79751);21049;(2, 2, 14, 14, 21049);המצרי;3;14;ויאמר מי שמך לאיש שר ושפט עלינו הלהרגני אתה אמר כאשר הרגת את המצרי ויירא משה ויאמר אכן נודע הדבר
(7025, 93, 4);5;ה;79844;(2, 2, 15, 67, 79844);21074;(2, 2, 15, 19, 21074);הבאר;1;19;וישמע פרעה את הדבר הזה ויבקש להרג את משה ויברח משה מפני פרעה וישב בארץ מדין וישב על הבאר
(7025, 93, 4);300;ש;79937;(2, 2, 17, 33, 79937);21093;(2, 2, 17, 7, 21093);וישק;3;7;ויבאו הרעים ויגרשום ויקם משה ויושען וישק את צאנם
(7025, 93, 4);1;א;80030;(2, 2, 19, 48, 80030);21117;(2, 2, 19, 13, 21117);הצאן;3;13;ותאמרן איש מצרי הצילנו מיד הרעים וגם דלה דלה לנו וישק את הצאן
(7025, 93, 4);1;א;80123;(2, 2, 22, 11, 80123);21143;(2, 2, 22, 3, 21143);ויקרא;5;3;ותלד בן ויקרא את שמו גרשם כי אמר גר הייתי בארץ נכריה
(7025, 93, 4);70;ע;80216;(2, 2, 23, 63, 80216);21167;(2, 2, 23, 15, 21167);שועתם;3;15;ויהי בימים הרבים ההם וימת מלך מצרים ויאנחו בני ישראל מן העבדה ויזעקו ותעל שועתם אל האלהים מן העבדה
(7025, 93, 4);4;ד;80309;(2, 2, 25, 22, 80309);21191;(2, 2, 25, 6, 21191);וידע;3;6;וירא אלהים את בני ישראל וידע אלהים
(7025, 93, 4);400;ת;80402;(2, 3, 2, 20, 80402);21216;(2, 3, 2, 5, 21216);בלבת;4;5;וירא מלאך יהוה אליו בלבת אש מתוך הסנה וירא והנה הסנה בער באש והסנה איננו אכל
(7025, 93, 4);10;י;80495;(2, 3, 4, 5, 80495);21242;(2, 3, 4, 2, 21242);יהוה;1;2;וירא יהוה כי סר לראות ויקרא אליו אלהים מתוך הסנה ויאמר משה משה ויאמר הנני
(7025, 93, 4);200;ר;80588;(2, 3, 5, 39, 80588);21266;(2, 3, 5, 11, 21266);אשר;3;11;ויאמר אל תקרב הלם של נעליך מעל רגליך כי המקום אשר אתה עומד עליו אדמת קדש הוא
(7025, 93, 4);10;י;80681;(2, 3, 6, 72, 80681);21290;(2, 3, 6, 18, 21290);האלהים;5;18;ויאמר אנכי אלהי אביך אלהי אברהם אלהי יצחק ואלהי יעקב ויסתר משה פניו כי ירא מהביט אל האלהים
(7025, 93, 4);5;ה;80774;(2, 3, 8, 21, 80774);21313;(2, 3, 8, 5, 21313);ולהעלתו;3;5;וארד להצילו מיד מצרים ולהעלתו מן הארץ ההוא אל ארץ טובה ורחבה אל ארץ זבת חלב ודבש אל מקום הכנעני והחתי והאמרי והפרזי והחוי והיבוסי
(7025, 93, 4);70;ע;80867;(2, 3, 9, 9, 80867);21336;(2, 3, 9, 3, 21336);צעקת;2;3;ועתה הנה צעקת בני ישראל באה אלי וגם ראיתי את הלחץ אשר מצרים לחצים אתם
(7025, 93, 4);40;מ;80960;(2, 3, 11, 4, 80960);21360;(2, 3, 11, 1, 21360);ויאמר;4;1;ויאמר משה אל האלהים מי אנכי כי אלך אל פרעה וכי אוציא את בני ישראל ממצרים
(7025, 93, 4);10;י;81053;(2, 3, 12, 40, 81053);21386;(2, 3, 12, 11, 21386);בהוציאך;5;11;ויאמר כי אהיה עמך וזה לך האות כי אנכי שלחתיך בהוציאך את העם ממצרים תעבדון את האלהים על ההר הזה
(7025, 93, 4);8;ח;81146;(2, 3, 13, 58, 81146);21410;(2, 3, 13, 15, 21410);שלחני;3;15;ויאמר משה אל האלהים הנה אנכי בא אל בני ישראל ואמרתי להם אלהי אבותיכם שלחני אליכם ואמרו לי מה שמו מה אמר אלהם
(7025, 93, 4);200;ר;81239;(2, 3, 15, 5, 81239);21434;(2, 3, 15, 1, 21434);ויאמר;5;1;ויאמר עוד אלהים אל משה כה תאמר אל בני ישראל יהוה אלהי אבתיכם אלהי אברהם אלהי יצחק ואלהי יעקב שלחני אליכם זה שמי לעלם וזה זכרי לדר דר
(7025, 93, 4);20;כ;81332;(2, 3, 15, 98, 81332);21459;(2, 3, 15, 26, 21459);זכרי;2;26;ויאמר עוד אלהים אל משה כה תאמר אל בני ישראל יהוה אלהי אבתיכם אלהי אברהם אלהי יצחק ואלהי יעקב שלחני אליכם זה שמי לעלם וזה זכרי לדר דר
(7025, 93, 4);5;ה;81425;(2, 3, 16, 86, 81425);21483;(2, 3, 16, 22, 21483);העשוי;1;22;לך ואספת את זקני ישראל ואמרת אלהם יהוה אלהי אבתיכם נראה אלי אלהי אברהם יצחק ויעקב לאמר פקד פקדתי אתכם ואת העשוי לכם במצרים
(7025, 93, 4);70;ע;81518;(2, 3, 18, 4, 81518);21504;(2, 3, 18, 1, 21504);ושמעו;4;1;ושמעו לקלך ובאת אתה וזקני ישראל אל מלך מצרים ואמרתם אליו יהוה אלהי העבריים נקרה עלינו ועתה נלכה נא דרך שלשת ימים במדבר ונזבחה ליהוה אלהינו
(7025, 93, 4);6;ו;81611;(2, 3, 18, 97, 81611);21527;(2, 3, 18, 24, 21527);ונזבחה;1;24;ושמעו לקלך ובאת אתה וזקני ישראל אל מלך מצרים ואמרתם אליו יהוה אלהי העבריים נקרה עלינו ועתה נלכה נא דרך שלשת ימים במדבר ונזבחה ליהוה אלהינו
(7025, 93, 4);300;ש;81704;(2, 3, 20, 35, 81704);21550;(2, 3, 20, 9, 21550);אשר;2;9;ושלחתי את ידי והכיתי את מצרים בכל נפלאתי אשר אעשה בקרבו ואחרי כן ישלח אתכם
(7025, 93, 4);400;ת;81797;(2, 3, 22, 22, 81797);21574;(2, 3, 22, 5, 21574);ביתה;3;5;ושאלה אשה משכנתה ומגרת ביתה כלי כסף וכלי זהב ושמלת ושמתם על בניכם ועל בנתיכם ונצלתם את מצרים
(7025, 93, 4);10;י;81890;(2, 4, 1, 40, 81890);21599;(2, 4, 1, 12, 21599);יאמרו;1;12;ויען משה ויאמר והן לא יאמינו לי ולא ישמעו בקלי כי יאמרו לא נראה אליך יהוה
(7025, 93, 4);6;ו;81983;(2, 4, 3, 47, 81983);21620;(2, 4, 3, 10, 21620);מפניו;5;10;ויאמר השליכהו ארצה וישלכהו ארצה ויהי לנחש וינס משה מפניו
(7025, 93, 4);1;א;82076;(2, 4, 5, 37, 82076);21645;(2, 4, 5, 10, 21645);אברהם;1;10;למען יאמינו כי נראה אליך יהוה אלהי אבתם אלהי אברהם אלהי יצחק ואלהי יעקב
(7025, 93, 4);20;ך;82169;(2, 4, 7, 11, 82169);21668;(2, 4, 7, 3, 21668);ידך;3;3;ויאמר השב ידך אל חיקך וישב ידו אל חיקו ויוצאה מחיקו והנה שבה כבשרו
(7025, 93, 4);1;א;82262;(2, 4, 8, 51, 82262);21693;(2, 4, 8, 14, 21693);האחרון;2;14;והיה אם לא יאמינו לך ולא ישמעו לקל האת הראשון והאמינו לקל האת האחרון
(7025, 93, 4);10;י;82355;(2, 4, 9, 89, 82355);21716;(2, 4, 9, 23, 21716);והיו;3;23;והיה אם לא יאמינו גם לשני האתות האלה ולא ישמעון לקלך ולקחת ממימי היאר ושפכת היבשה והיו המים אשר תקח מן היאר והיו לדם ביבשת
(7025, 93, 4);10;י;82448;(2, 4, 11, 2, 82448);21744;(2, 4, 11, 1, 21744);ויאמר;2;1;ויאמר יהוה אליו מי שם פה לאדם או מי ישום אלם או חרש או פקח או עור הלא אנכי יהוה
(7025, 93, 4);200;ר;82541;(2, 4, 12, 35, 82541);21772;(2, 4, 12, 9, 21772);תדבר;4;9;ועתה לך ואנכי אהיה עם פיך והוריתיך אשר תדבר
(7025, 93, 4);6;ו;82634;(2, 4, 14, 70, 82634);21799;(2, 4, 14, 20, 21799);וראך;1;20;ויחר אף יהוה במשה ויאמר הלא אהרן אחיך הלוי ידעתי כי דבר ידבר הוא וגם הנה הוא יצא לקראתך וראך ושמח בלבו
(7025, 93, 4);6;ו;82727;(2, 4, 16, 15, 82727);21824;(2, 4, 16, 6, 21824);והיה;1;6;ודבר הוא לך אל העם והיה הוא יהיה לך לפה ואתה תהיה לו לאלהים
(7025, 93, 4);20;כ;82820;(2, 4, 18, 30, 82820);21851;(2, 4, 18, 9, 21851);אלכה;3;9;וילך משה וישב אל יתר חתנו ויאמר לו אלכה נא ואשובה אל אחי אשר במצרים ואראה העודם חיים ויאמר יתרו למשה לך לשלום
(7025, 93, 4);5;ה;82913;(2, 4, 19, 36, 82913);21877;(2, 4, 19, 12, 21877);האנשים;1;12;ויאמר יהוה אל משה במדין לך שב מצרים כי מתו כל האנשים המבקשים את נפשך
(7025, 93, 4);6;ו;83006;(2, 4, 21, 8, 83006);21900;(2, 4, 21, 2, 21900);יהוה;3;2;ויאמר יהוה אל משה בלכתך לשוב מצרימה ראה כל המפתים אשר שמתי בידך ועשיתם לפני פרעה ואני אחזק את לבו ולא ישלח את העם
(7025, 93, 4);5;ה;83099;(2, 4, 22, 11, 83099);21925;(2, 4, 22, 3, 21925);פרעה;4;3;ואמרת אל פרעה כה אמר יהוה בני בכרי ישראל
(7025, 93, 4);6;ו;83192;(2, 4, 24, 20, 83192);21949;(2, 4, 24, 4, 21949);ויפגשהו;7;4;ויהי בדרך במלון ויפגשהו יהוה ויבקש המיתו
(7025, 93, 4);400;ת;83285;(2, 4, 26, 26, 83285);21974;(2, 4, 26, 7, 21974);למולת;5;7;וירף ממנו אז אמרה חתן דמים למולת
(7025, 93, 4);30;ל;83378;(2, 4, 28, 36, 83378);21999;(2, 4, 28, 11, 21999);כל;2;11;ויגד משה לאהרן את כל דברי יהוה אשר שלחו ואת כל האתת אשר צוהו
(7025, 93, 4);5;ה;83471;(2, 4, 30, 48, 83471);22025;(2, 4, 30, 14, 22025);העם;1;14;וידבר אהרן את כל הדברים אשר דבר יהוה אל משה ויעש האתת לעיני העם
(7025, 93, 4);5;ה;83564;(2, 5, 1, 34, 83564);22050;(2, 5, 1, 10, 22050);יהוה;2;10;ואחר באו משה ואהרן ויאמרו אל פרעה כה אמר יהוה אלהי ישראל שלח את עמי ויחגו לי במדבר
(7025, 93, 4);1;א;83657;(2, 5, 2, 62, 83657);22076;(2, 5, 2, 18, 22076);לא;2;18;ויאמר פרעה מי יהוה אשר אשמע בקלו לשלח את ישראל לא ידעתי את יהוה וגם את ישראל לא אשלח
(7025, 93, 4);30;ל;83750;(2, 5, 4, 7, 83750);22098;(2, 5, 4, 2, 22098);אלהם;2;2;ויאמר אלהם מלך מצרים למה משה ואהרן תפריעו את העם ממעשיו לכו לסבלתיכם
(7025, 93, 4);80;פ;83843;(2, 5, 6, 5, 83843);22121;(2, 5, 6, 2, 22121);פרעה;1;2;ויצו פרעה ביום ההוא את הנגשים בעם ואת שטריו לאמר
(7025, 93, 4);20;כ;83936;(2, 5, 8, 6, 83936);22145;(2, 5, 8, 2, 22145);מתכנת;3;2;ואת מתכנת הלבנים אשר הם עשים תמול שלשם תשימו עליהם לא תגרעו ממנו כי נרפים הם על כן הם צעקים לאמר נלכה נזבחה לאלהינו
(7025, 93, 4);2;ב;84029;(2, 5, 9, 7, 84029);22169;(2, 5, 9, 2, 22169);העבדה;3;2;תכבד העבדה על האנשים ויעשו בה ואל ישעו בדברי שקר
(7025, 93, 4);20;כ;84122;(2, 5, 11, 5, 84122);22194;(2, 5, 11, 2, 22194);לכו;2;2;אתם לכו קחו לכם תבן מאשר תמצאו כי אין נגרע מעבדתכם דבר
(7025, 93, 4);200;ר;84215;(2, 5, 13, 27, 84215);22218;(2, 5, 13, 6, 22218);דבר;3;6;והנגשים אצים לאמר כלו מעשיכם דבר יום ביומו כאשר בהיות התבן
(7025, 93, 4);30;ל;84308;(2, 5, 14, 72, 84308);22242;(2, 5, 14, 19, 22242);תמול;4;19;ויכו שטרי בני ישראל אשר שמו עלהם נגשי פרעה לאמר מדוע לא כליתם חקכם ללבן כתמול שלשם גם תמול גם היום
(7025, 93, 4);4;ד;84401;(2, 5, 16, 39, 84401);22266;(2, 5, 16, 10, 22266);עבדיך;3;10;תבן אין נתן לעבדיך ולבנים אמרים לנו עשו והנה עבדיך מכים וחטאת עמך
(7025, 93, 4);400;ת;84494;(2, 5, 18, 35, 84494);22290;(2, 5, 18, 10, 22290);תתנו;2;10;ועתה לכו עבדו ותבן לא ינתן לכם ותכן לבנים תתנו
(7025, 93, 4);200;ר;84587;(2, 5, 20, 39, 84587);22313;(2, 5, 20, 10, 22313);פרעה;2;10;ויפגעו את משה ואת אהרן נצבים לקראתם בצאתם מאת פרעה
(7025, 93, 4);6;ו;84680;(2, 5, 22, 12, 84680);22335;(2, 5, 22, 4, 22335);יהוה;3;4;וישב משה אל יהוה ויאמר אדני למה הרעתה לעם הזה למה זה שלחתני
(7025, 93, 4);40;מ;84773;(2, 6, 1, 12, 84773);22362;(2, 6, 1, 4, 22362);משה;1;4;ויאמר יהוה אל משה עתה תראה אשר אעשה לפרעה כי ביד חזקה ישלחם וביד חזקה יגרשם מארצו
(7025, 93, 4);200;ר;84866;(2, 6, 3, 9, 84866);22386;(2, 6, 3, 3, 22386);אברהם;3;3;וארא אל אברהם אל יצחק ואל יעקב באל שדי ושמי יהוה לא נודעתי להם
(7025, 93, 4);6;ו;84959;(2, 6, 5, 1, 84959);22414;(2, 6, 5, 1, 22414);וגם;1;1;וגם אני שמעתי את נאקת בני ישראל אשר מצרים מעבדים אתם ואזכר את בריתי
(7025, 93, 4);30;ל;85052;(2, 6, 6, 40, 85052);22437;(2, 6, 6, 10, 22437);סבלת;3;10;לכן אמר לבני ישראל אני יהוה והוצאתי אתכם מתחת סבלת מצרים והצלתי אתכם מעבדתם וגאלתי אתכם בזרוע נטויה ובשפטים גדלים
(7025, 93, 4);1;א;85145;(2, 6, 7, 39, 85145);22457;(2, 6, 7, 10, 22457);אני;1;10;ולקחתי אתכם לי לעם והייתי לכם לאלהים וידעתם כי אני יהוה אלהיכם המוציא אתכם מתחת סבלות מצרים
(7025, 93, 4);10;י;85238;(2, 6, 8, 57, 85238);22478;(2, 6, 8, 14, 22478);ונתתי;5;14;והבאתי אתכם אל הארץ אשר נשאתי את ידי לתת אתה לאברהם ליצחק וליעקב ונתתי אתה לכם מורשה אני יהוה
(7025, 93, 4);200;ר;85331;(2, 6, 11, 9, 85331);22506;(2, 6, 11, 4, 22506);פרעה;2;4;בא דבר אל פרעה מלך מצרים וישלח את בני ישראל מארצו
(7025, 93, 4);400;ת;85424;(2, 6, 12, 63, 85424);22530;(2, 6, 12, 17, 22530);שפתים;3;17;וידבר משה לפני יהוה לאמר הן בני ישראל לא שמעו אלי ואיך ישמעני פרעה ואני ערל שפתים
(7025, 93, 4);2;ב;85517;(2, 6, 14, 15, 85517);22555;(2, 6, 14, 5, 22555);בני;1;5;אלה ראשי בית אבתם בני ראובן בכר ישראל חנוך ופלוא חצרן וכרמי אלה משפחת ראובן
(7025, 93, 4);1;א;85610;(2, 6, 15, 47, 85610);22576;(2, 6, 15, 11, 22576);אלה;1;11;ובני שמעון ימואל וימין ואהד ויכין וצחר ושאול בן הכנענית אלה משפחת שמעון
(7025, 93, 4);80;פ;85703;(2, 6, 17, 21, 85703);22598;(2, 6, 17, 5, 22598);למשפחתם;4;5;בני גרשון לבני ושמעי למשפחתם
(7025, 93, 4);6;ו;85796;(2, 6, 20, 1, 85796);22620;(2, 6, 20, 1, 22620);ויקח;1;1;ויקח עמרם את יוכבד דדתו לו לאשה ותלד לו את אהרן ואת משה ושני חיי עמרם שבע ושלשים ומאת שנה
(7025, 93, 4);10;י;85889;(2, 6, 22, 4, 85889);22645;(2, 6, 22, 1, 22645);ובני;4;1;ובני עזיאל מישאל ואלצפן וסתרי
(7025, 93, 4);400;ת;85982;(2, 6, 23, 72, 85982);22669;(2, 6, 23, 20, 22669);איתמר;3;20;ויקח אהרן את אלישבע בת עמינדב אחות נחשון לו לאשה ותלד לו את נדב ואת אביהוא את אלעזר ואת איתמר
(7025, 93, 4);10;י;86075;(2, 6, 25, 54, 86075);22692;(2, 6, 25, 15, 22692);ראשי;4;15;ואלעזר בן אהרן לקח לו מבנות פוטיאל לו לאשה ותלד לו את פינחס אלה ראשי אבות הלוים למשפחתם
(7025, 93, 4);200;ר;86168;(2, 6, 27, 21, 86168);22716;(2, 6, 27, 6, 22716);מצרים;3;6;הם המדברים אל פרעה מלך מצרים להוציא את בני ישראל ממצרים הוא משה ואהרן
(7025, 93, 4);1;א;86261;(2, 6, 29, 29, 86261);22741;(2, 6, 29, 9, 22741);אל;1;9;וידבר יהוה אל משה לאמר אני יהוה דבר אל פרעה מלך מצרים את כל אשר אני דבר אליך
(7025, 93, 4);400;ת;86354;(2, 7, 1, 19, 86354);22768;(2, 7, 1, 6, 22768);נתתיך;2;6;ויאמר יהוה אל משה ראה נתתיך אלהים לפרעה ואהרן אחיך יהיה נביאך
(7025, 93, 4);100;ק;86447;(2, 7, 3, 6, 86447);22792;(2, 7, 3, 2, 22792);אקשה;2;2;ואני אקשה את לב פרעה והרביתי את אתתי ואת מופתי בארץ מצרים
(7025, 93, 4);10;י;86540;(2, 7, 4, 53, 86540);22816;(2, 7, 4, 14, 22816);בני;3;14;ולא ישמע אלכם פרעה ונתתי את ידי במצרים והוצאתי את צבאתי את עמי בני ישראל מארץ מצרים בשפטים גדלים
(7025, 93, 4);5;ה;86633;(2, 7, 6, 10, 86633);22839;(2, 7, 6, 3, 22839);ואהרן;3;3;ויעש משה ואהרן כאשר צוה יהוה אתם כן עשו
(7025, 93, 4);10;י;86726;(2, 7, 9, 3, 86726);22866;(2, 7, 9, 2, 22866);ידבר;1;2;כי ידבר אלכם פרעה לאמר תנו לכם מופת ואמרת אל אהרן קח את מטך והשלך לפני פרעה יהי לתנין
(7025, 93, 4);200;ר;86819;(2, 7, 10, 29, 86819);22891;(2, 7, 10, 8, 22891);כאשר;4;8;ויבא משה ואהרן אל פרעה ויעשו כן כאשר צוה יהוה וישלך אהרן את מטהו לפני פרעה ולפני עבדיו ויהי לתנין
(7025, 93, 4);40;ם;86912;(2, 7, 11, 44, 86912);22913;(2, 7, 11, 10, 22913);מצרים;5;10;ויקרא גם פרעה לחכמים ולמכשפים ויעשו גם הם חרטמי מצרים בלהטיהם כן
(7025, 93, 4);5;ה;87005;(2, 7, 14, 9, 87005);22936;(2, 7, 14, 2, 22936);יהוה;4;2;ויאמר יהוה אל משה כבד לב פרעה מאן לשלח העם
(7025, 93, 4);40;מ;87098;(2, 7, 16, 3, 87098);22963;(2, 7, 16, 1, 22963);ואמרת;3;1;ואמרת אליו יהוה אלהי העברים שלחני אליך לאמר שלח את עמי ויעבדני במדבר והנה לא שמעת עד כה
(7025, 93, 4);5;ה;87191;(2, 7, 17, 26, 87191);22989;(2, 7, 17, 9, 22989);הנה;1;9;כה אמר יהוה בזאת תדע כי אני יהוה הנה אנכי מכה במטה אשר בידי על המים אשר ביאר ונהפכו לדם
(7025, 93, 4);1;א;87284;(2, 7, 19, 3, 87284);23013;(2, 7, 19, 1, 23013);ויאמר;3;1;ויאמר יהוה אל משה אמר אל אהרן קח מטך ונטה ידך על מימי מצרים על נהרתם על יאריהם ועל אגמיהם ועל כל מקוה מימיהם ויהיו דם והיה דם בכל ארץ מצרים ובעצים ובאבנים
(7025, 93, 4);5;ה;87377;(2, 7, 19, 96, 87377);23039;(2, 7, 19, 27, 23039);והיה;4;27;ויאמר יהוה אל משה אמר אל אהרן קח מטך ונטה ידך על מימי מצרים על נהרתם על יאריהם ועל אגמיהם ועל כל מקוה מימיהם ויהיו דם והיה דם בכל ארץ מצרים ובעצים ובאבנים
(7025, 93, 4);2;ב;87470;(2, 7, 20, 67, 87470);23063;(2, 7, 20, 18, 23063);עבדיו;2;18;ויעשו כן משה ואהרן כאשר צוה יהוה וירם במטה ויך את המים אשר ביאר לעיני פרעה ולעיני עבדיו ויהפכו כל המים אשר ביאר לדם
(7025, 93, 4);40;ם;87563;(2, 7, 21, 68, 87563);23087;(2, 7, 21, 18, 23087);מצרים;5;18;והדגה אשר ביאר מתה ויבאש היאר ולא יכלו מצרים לשתות מים מן היאר ויהי הדם בכל ארץ מצרים
(7025, 93, 4);6;ו;87656;(2, 7, 24, 6, 87656);23112;(2, 7, 24, 1, 23112);ויחפרו;6;1;ויחפרו כל מצרים סביבת היאר מים לשתות כי לא יכלו לשתת ממימי היאר
