(302170, -60, 4);6;ו;77110;(1, 50, 10, 5, 77110);20361;(1, 50, 10, 1, 20361);ויבאו;5;1;ויבאו עד גרן האטד אשר בעבר הירדן ויספדו שם מספד גדול וכבד מאד ויעש לאביו אבל שבעת ימים
(302170, -60, 4);400;ת;77170;(1, 50, 10, 65, 77170);20377;(1, 50, 10, 17, 20377);שבעת;4;17;ויבאו עד גרן האטד אשר בעבר הירדן ויספדו שם מספד גדול וכבד מאד ויעש לאביו אבל שבעת ימים
(302170, -60, 4);50;ן;77230;(1, 50, 11, 56, 77230);20393;(1, 50, 11, 15, 20393);כן;2;15;וירא יושב הארץ הכנעני את האבל בגרן האטד ויאמרו אבל כבד זה למצרים על כן קרא שמה אבל מצרים אשר בעבר הירדן
(302170, -60, 4);200;ר;77290;(1, 50, 13, 14, 77290);20410;(1, 50, 13, 4, 20410);ארצה;2;4;וישאו אתו בניו ארצה כנען ויקברו אתו במערת שדה המכפלה אשר קנה אברהם את השדה לאחזת קבר מאת עפרן החתי על פני ממרא
(302170, -60, 4);200;ר;77350;(1, 50, 13, 74, 77350);20425;(1, 50, 13, 19, 20425);עפרן;3;19;וישאו אתו בניו ארצה כנען ויקברו אתו במערת שדה המכפלה אשר קנה אברהם את השדה לאחזת קבר מאת עפרן החתי על פני ממרא
(302170, -60, 4);200;ר;77410;(1, 50, 14, 46, 77410);20441;(1, 50, 14, 12, 20441);אחרי;3;12;וישב יוסף מצרימה הוא ואחיו וכל העלים אתו לקבר את אביו אחרי קברו את אביו
(302170, -60, 4);50;נ;77470;(1, 50, 15, 49, 77470);20457;(1, 50, 15, 13, 20457);לנו;2;13;ויראו אחי יוסף כי מת אביהם ויאמרו לו ישטמנו יוסף והשב ישיב לנו את כל הרעה אשר גמלנו אתו
(302170, -60, 4);200;ר;77530;(1, 50, 17, 6, 77530);20474;(1, 50, 17, 2, 20474);תאמרו;4;2;כה תאמרו ליוסף אנא שא נא פשע אחיך וחטאתם כי רעה גמלוך ועתה שא נא לפשע עבדי אלהי אביך ויבך יוסף בדברם אליו
(302170, -60, 4);20;ך;77590;(1, 50, 17, 66, 77590);20491;(1, 50, 17, 19, 20491);אביך;4;19;כה תאמרו ליוסף אנא שא נא פשע אחיך וחטאתם כי רעה גמלוך ועתה שא נא לפשע עבדי אלהי אביך ויבך יוסף בדברם אליו
(302170, -60, 4);40;מ;77650;(1, 50, 19, 4, 77650);20505;(1, 50, 19, 1, 20505);ויאמר;4;1;ויאמר אלהם יוסף אל תיראו כי התחת אלהים אני
(302170, -60, 4);40;מ;77710;(1, 50, 20, 30, 77710);20521;(1, 50, 20, 8, 20521);למען;2;8;ואתם חשבתם עלי רעה אלהים חשבה לטבה למען עשה כיום הזה להחית עם רב
(302170, -60, 4);400;ת;77770;(1, 50, 21, 39, 77770);20537;(1, 50, 21, 10, 20537);אותם;3;10;ועתה אל תיראו אנכי אכלכל אתכם ואת טפכם וינחם אותם וידבר על לבם
(302170, -60, 4);10;י;77830;(1, 50, 23, 5, 77830);20553;(1, 50, 23, 2, 20553);יוסף;1;2;וירא יוסף לאפרים בני שלשים גם בני מכיר בן מנשה ילדו על ברכי יוסף
(302170, -60, 4);10;י;77890;(1, 50, 24, 14, 77890);20569;(1, 50, 24, 4, 20569);אחיו;3;4;ויאמר יוסף אל אחיו אנכי מת ואלהים פקד יפקד אתכם והעלה אתכם מן הארץ הזאת אל הארץ אשר נשבע לאברהם ליצחק וליעקב
(302170, -60, 4);200;ר;77950;(1, 50, 24, 74, 77950);20585;(1, 50, 24, 20, 20585);לאברהם;4;20;ויאמר יוסף אל אחיו אנכי מת ואלהים פקד יפקד אתכם והעלה אתכם מן הארץ הזאת אל הארץ אשר נשבע לאברהם ליצחק וליעקב
(302170, -60, 4);400;ת;78010;(1, 50, 25, 47, 78010);20599;(1, 50, 25, 12, 20599);את;2;12;וישבע יוסף את בני ישראל לאמר פקד יפקד אלהים אתכם והעלתם את עצמתי מזה
(302170, -60, 4);40;מ;78070;(2, 1, 1, 6, 78070);20614;(2, 1, 1, 2, 20614);שמות;2;2;ואלה שמות בני ישראל הבאים מצרימה את יעקב איש וביתו באו
(302170, -60, 4);300;ש;78130;(2, 1, 3, 3, 78130);20628;(2, 1, 3, 1, 20628);יששכר;3;1;יששכר זבולן ובנימן
(302170, -60, 4);80;ף;78190;(2, 1, 5, 33, 78190);20643;(2, 1, 5, 9, 20643);ויוסף;5;9;ויהי כל נפש יצאי ירך יעקב שבעים נפש ויוסף היה במצרים
(302170, -60, 4);10;י;78250;(2, 1, 7, 25, 78250);20658;(2, 1, 7, 6, 20658);ויעצמו;2;6;ובני ישראל פרו וישרצו וירבו ויעצמו במאד מאד ותמלא הארץ אתם
(302170, -60, 4);1;א;78310;(2, 1, 9, 6, 78310);20675;(2, 1, 9, 2, 20675);אל;1;2;ויאמר אל עמו הנה עם בני ישראל רב ועצום ממנו
(302170, -60, 4);8;ח;78370;(2, 1, 10, 32, 78370);20692;(2, 1, 10, 9, 20692);מלחמה;3;9;הבה נתחכמה לו פן ירבה והיה כי תקראנה מלחמה ונוסף גם הוא על שנאינו ונלחם בנו ועלה מן הארץ
(302170, -60, 4);70;ע;78430;(2, 1, 11, 22, 78430);20708;(2, 1, 11, 6, 20708);ענתו;1;6;וישימו עליו שרי מסים למען ענתו בסבלתם ויבן ערי מסכנות לפרעה את פתם ואת רעמסס
(302170, -60, 4);20;כ;78490;(2, 1, 12, 20, 78490);20723;(2, 1, 12, 6, 20723);וכן;2;6;וכאשר יענו אתו כן ירבה וכן יפרץ ויקצו מפני בני ישראל
(302170, -60, 4);40;ם;78550;(2, 1, 14, 13, 78550);20737;(2, 1, 14, 3, 20737);חייהם;5;3;וימררו את חייהם בעבדה קשה בחמר ובלבנים ובכל עבדה בשדה את כל עבדתם אשר עבדו בהם בפרך
(302170, -60, 4);40;מ;78610;(2, 1, 15, 6, 78610);20753;(2, 1, 15, 2, 20753);מלך;1;2;ויאמר מלך מצרים למילדת העברית אשר שם האחת שפרה ושם השנית פועה
(302170, -60, 4);2;ב;78670;(2, 1, 16, 16, 78670);20767;(2, 1, 16, 4, 20767);העבריות;3;4;ויאמר בילדכן את העבריות וראיתן על האבנים אם בן הוא והמתן אתו ואם בת הוא וחיה
(302170, -60, 4);5;ה;78730;(2, 1, 17, 15, 78730);20783;(2, 1, 17, 4, 20783);האלהים;1;4;ותיראן המילדת את האלהים ולא עשו כאשר דבר אליהן מלך מצרים ותחיין את הילדים
(302170, -60, 4);40;מ;78790;(2, 1, 18, 15, 78790);20797;(2, 1, 18, 4, 20797);למילדת;2;4;ויקרא מלך מצרים למילדת ויאמר להן מדוע עשיתן הדבר הזה ותחיין את הילדים
(302170, -60, 4);5;ה;78850;(2, 1, 19, 18, 78850);20810;(2, 1, 19, 4, 20810);פרעה;4;4;ותאמרן המילדת אל פרעה כי לא כנשים המצרית העברית כי חיות הנה בטרם תבוא אלהן המילדת וילדו
(302170, -60, 4);30;ל;78910;(2, 1, 20, 7, 78910);20825;(2, 1, 20, 2, 20825);אלהים;2;2;וייטב אלהים למילדת וירב העם ויעצמו מאד
(302170, -60, 4);40;ם;78970;(2, 1, 21, 35, 78970);20839;(2, 1, 21, 9, 20839);בתים;4;9;ויהי כי יראו המילדת את האלהים ויעש להם בתים
(302170, -60, 4);2;ב;79030;(2, 2, 1, 9, 79030);20855;(2, 2, 1, 3, 20855);מבית;2;3;וילך איש מבית לוי ויקח את בת לוי
(302170, -60, 4);10;י;79090;(2, 2, 2, 44, 79090);20872;(2, 2, 2, 12, 20872);ירחים;4;12;ותהר האשה ותלד בן ותרא אתו כי טוב הוא ותצפנהו שלשה ירחים
(302170, -60, 4);40;ם;79150;(2, 2, 3, 59, 79150);20888;(2, 2, 3, 16, 20888);ותשם;4;16;ולא יכלה עוד הצפינו ותקח לו תבת גמא ותחמרה בחמר ובזפת ותשם בה את הילד ותשם בסוף על שפת היאר
(302170, -60, 4);50;נ;79210;(2, 2, 5, 22, 79210);20906;(2, 2, 5, 7, 20906);ונערתיה;2;7;ותרד בת פרעה לרחץ על היאר ונערתיה הלכת על יד היאר ותרא את התבה בתוך הסוף ותשלח את אמתה ותקחה
(302170, -60, 4);1;א;79270;(2, 2, 6, 9, 79270);20921;(2, 2, 6, 2, 20921);ותראהו;4;2;ותפתח ותראהו את הילד והנה נער בכה ותחמל עליו ותאמר מילדי העברים זה
(302170, -60, 4);200;ר;79330;(2, 2, 7, 15, 79330);20937;(2, 2, 7, 5, 20937);פרעה;2;5;ותאמר אחתו אל בת פרעה האלך וקראתי לך אשה מינקת מן העברית ותינק לך את הילד
(302170, -60, 4);6;ו;79390;(2, 2, 8, 17, 79390);20954;(2, 2, 8, 6, 20954);ותלך;1;6;ותאמר לה בת פרעה לכי ותלך העלמה ותקרא את אם הילד
(302170, -60, 4);1;א;79450;(2, 2, 9, 39, 79450);20970;(2, 2, 9, 11, 20970);ואני;2;11;ותאמר לה בת פרעה היליכי את הילד הזה והינקהו לי ואני אתן את שכרך ותקח האשה הילד ותניקהו
(302170, -60, 4);2;ב;79510;(2, 2, 10, 30, 79510);20985;(2, 2, 10, 8, 20985);לבן;2;8;ויגדל הילד ותבאהו לבת פרעה ויהי לה לבן ותקרא שמו משה ותאמר כי מן המים משיתהו
(302170, -60, 4);10;י;79570;(2, 2, 11, 29, 79570);21001;(2, 2, 11, 8, 21001);אחיו;3;8;ויהי בימים ההם ויגדל משה ויצא אל אחיו וירא בסבלתם וירא איש מצרי מכה איש עברי מאחיו
(302170, -60, 4);10;י;79630;(2, 2, 12, 23, 79630);21018;(2, 2, 12, 8, 21018);ויך;2;8;ויפן כה וכה וירא כי אין איש ויך את המצרי ויטמנהו בחול
(302170, -60, 4);300;ש;79690;(2, 2, 13, 41, 79690);21032;(2, 2, 13, 10, 21032);לרשע;3;10;ויצא ביום השני והנה שני אנשים עברים נצים ויאמר לרשע למה תכה רעך
(302170, -60, 4);40;מ;79750;(2, 2, 14, 50, 79750);21049;(2, 2, 14, 14, 21049);המצרי;2;14;ויאמר מי שמך לאיש שר ושפט עלינו הלהרגני אתה אמר כאשר הרגת את המצרי ויירא משה ויאמר אכן נודע הדבר
(302170, -60, 4);6;ו;79810;(2, 2, 15, 33, 79810);21065;(2, 2, 15, 10, 21065);ויברח;1;10;וישמע פרעה את הדבר הזה ויבקש להרג את משה ויברח משה מפני פרעה וישב בארץ מדין וישב על הבאר
(302170, -60, 4);6;ו;79870;(2, 2, 16, 23, 79870);21080;(2, 2, 16, 6, 21080);ותדלנה;1;6;ולכהן מדין שבע בנות ותבאנה ותדלנה ותמלאנה את הרהטים להשקות צאן אביהן
(302170, -60, 4);10;י;79930;(2, 2, 17, 26, 79930);21092;(2, 2, 17, 6, 21092);ויושען;2;6;ויבאו הרעים ויגרשום ויקם משה ויושען וישק את צאנם
(302170, -60, 4);10;י;79990;(2, 2, 19, 8, 79990);21106;(2, 2, 19, 2, 21106);איש;2;2;ותאמרן איש מצרי הצילנו מיד הרעים וגם דלה דלה לנו וישק את הצאן
(302170, -60, 4);5;ה;80050;(2, 2, 20, 19, 80050);21122;(2, 2, 20, 5, 21122);למה;3;5;ויאמר אל בנתיו ואיו למה זה עזבתן את האיש קראן לו ויאכל לחם
(302170, -60, 4);40;מ;80110;(2, 2, 21, 33, 80110);21140;(2, 2, 21, 10, 21140);למשה;2;10;ויואל משה לשבת את האיש ויתן את צפרה בתו למשה
(302170, -60, 4);40;ם;80170;(2, 2, 23, 17, 80170);21156;(2, 2, 23, 4, 21156);ההם;3;4;ויהי בימים הרבים ההם וימת מלך מצרים ויאנחו בני ישראל מן העבדה ויזעקו ותעל שועתם אל האלהים מן העבדה
(302170, -60, 4);70;ע;80230;(2, 2, 23, 77, 80230);21171;(2, 2, 23, 19, 21171);העבדה;2;19;ויהי בימים הרבים ההם וימת מלך מצרים ויאנחו בני ישראל מן העבדה ויזעקו ותעל שועתם אל האלהים מן העבדה
(302170, -60, 4);200;ר;80290;(2, 2, 25, 3, 80290);21186;(2, 2, 25, 1, 21186);וירא;3;1;וירא אלהים את בני ישראל וידע אלהים
(302170, -60, 4);3;ג;80350;(2, 3, 1, 35, 80350);21202;(2, 3, 1, 10, 21202);וינהג;5;10;ומשה היה רעה את צאן יתרו חתנו כהן מדין וינהג את הצאן אחר המדבר ויבא אל הר האלהים חרבה
(302170, -60, 4);60;ס;80410;(2, 3, 2, 28, 80410);21219;(2, 3, 2, 8, 21219);הסנה;2;8;וירא מלאך יהוה אליו בלבת אש מתוך הסנה וירא והנה הסנה בער באש והסנה איננו אכל
(302170, -60, 4);5;ה;80470;(2, 3, 3, 27, 80470);21235;(2, 3, 3, 8, 21235);הגדל;1;8;ויאמר משה אסרה נא ואראה את המראה הגדל הזה מדוע לא יבער הסנה
(302170, -60, 4);6;ו;80530;(2, 3, 4, 40, 80530);21251;(2, 3, 4, 11, 21251);ויאמר;1;11;וירא יהוה כי סר לראות ויקרא אליו אלהים מתוך הסנה ויאמר משה משה ויאמר הנני
(302170, -60, 4);400;ת;80590;(2, 3, 5, 41, 80590);21267;(2, 3, 5, 12, 21267);אתה;2;12;ויאמר אל תקרב הלם של נעליך מעל רגליך כי המקום אשר אתה עומד עליו אדמת קדש הוא
(302170, -60, 4);70;ע;80650;(2, 3, 6, 41, 80650);21282;(2, 3, 6, 10, 21282);יעקב;2;10;ויאמר אנכי אלהי אביך אלהי אברהם אלהי יצחק ואלהי יעקב ויסתר משה פניו כי ירא מהביט אל האלהים
(302170, -60, 4);200;ר;80710;(2, 3, 7, 28, 80710);21298;(2, 3, 7, 8, 21298);אשר;3;8;ויאמר יהוה ראה ראיתי את עני עמי אשר במצרים ואת צעקתם שמעתי מפני נגשיו כי ידעתי את מכאביו
(302170, -60, 4);10;י;80770;(2, 3, 8, 17, 80770);21312;(2, 3, 8, 4, 21312);מצרים;4;4;וארד להצילו מיד מצרים ולהעלתו מן הארץ ההוא אל ארץ טובה ורחבה אל ארץ זבת חלב ודבש אל מקום הכנעני והחתי והאמרי והפרזי והחוי והיבוסי
(302170, -60, 4);6;ו;80830;(2, 3, 8, 77, 80830);21329;(2, 3, 8, 21, 21329);והחתי;1;21;וארד להצילו מיד מצרים ולהעלתו מן הארץ ההוא אל ארץ טובה ורחבה אל ארץ זבת חלב ודבש אל מקום הכנעני והחתי והאמרי והפרזי והחוי והיבוסי
(302170, -60, 4);400;ת;80890;(2, 3, 9, 32, 80890);21342;(2, 3, 9, 9, 21342);ראיתי;4;9;ועתה הנה צעקת בני ישראל באה אלי וגם ראיתי את הלחץ אשר מצרים לחצים אתם
(302170, -60, 4);30;ל;80950;(2, 3, 10, 37, 80950);21358;(2, 3, 10, 10, 21358);ישראל;5;10;ועתה לכה ואשלחך אל פרעה והוצא את עמי בני ישראל ממצרים
(302170, -60, 4);90;צ;81010;(2, 3, 11, 54, 81010);21375;(2, 3, 11, 16, 21375);ממצרים;3;16;ויאמר משה אל האלהים מי אנכי כי אלך אל פרעה וכי אוציא את בני ישראל ממצרים
(302170, -60, 4);4;ד;81070;(2, 3, 12, 57, 81070);21390;(2, 3, 12, 15, 21390);תעבדון;4;15;ויאמר כי אהיה עמך וזה לך האות כי אנכי שלחתיך בהוציאך את העם ממצרים תעבדון את האלהים על ההר הזה
(302170, -60, 4);30;ל;81130;(2, 3, 13, 42, 81130);21407;(2, 3, 13, 12, 21407);להם;1;12;ויאמר משה אל האלהים הנה אנכי בא אל בני ישראל ואמרתי להם אלהי אבותיכם שלחני אליכם ואמרו לי מה שמו מה אמר אלהם
(302170, -60, 4);1;א;81190;(2, 3, 14, 16, 81190);21423;(2, 3, 14, 5, 21423);אהיה;1;5;ויאמר אלהים אל משה אהיה אשר אהיה ויאמר כה תאמר לבני ישראל אהיה שלחני אליכם
(302170, -60, 4);40;מ;81250;(2, 3, 15, 16, 81250);21438;(2, 3, 15, 5, 21438);משה;1;5;ויאמר עוד אלהים אל משה כה תאמר אל בני ישראל יהוה אלהי אבתיכם אלהי אברהם אלהי יצחק ואלהי יעקב שלחני אליכם זה שמי לעלם וזה זכרי לדר דר
(302170, -60, 4);30;ל;81310;(2, 3, 15, 76, 81310);21453;(2, 3, 15, 20, 21453);שלחני;2;20;ויאמר עוד אלהים אל משה כה תאמר אל בני ישראל יהוה אלהי אבתיכם אלהי אברהם אלהי יצחק ואלהי יעקב שלחני אליכם זה שמי לעלם וזה זכרי לדר דר
(302170, -60, 4);5;ה;81370;(2, 3, 16, 31, 81370);21469;(2, 3, 16, 8, 21469);יהוה;4;8;לך ואספת את זקני ישראל ואמרת אלהם יהוה אלהי אבתיכם נראה אלי אלהי אברהם יצחק ויעקב לאמר פקד פקדתי אתכם ואת העשוי לכם במצרים
(302170, -60, 4);30;ל;81430;(2, 3, 16, 91, 81430);21484;(2, 3, 16, 23, 21484);לכם;1;23;לך ואספת את זקני ישראל ואמרת אלהם יהוה אלהי אבתיכם נראה אלי אלהי אברהם יצחק ויעקב לאמר פקד פקדתי אתכם ואת העשוי לכם במצרים
(302170, -60, 4);8;ח;81490;(2, 3, 17, 52, 81490);21497;(2, 3, 17, 12, 21497);והחוי;3;12;ואמר אעלה אתכם מעני מצרים אל ארץ הכנעני והחתי והאמרי והפרזי והחוי והיבוסי אל ארץ זבת חלב ודבש
(302170, -60, 4);40;ם;81550;(2, 3, 18, 36, 81550);21512;(2, 3, 18, 9, 21512);מצרים;5;9;ושמעו לקלך ובאת אתה וזקני ישראל אל מלך מצרים ואמרתם אליו יהוה אלהי העבריים נקרה עלינו ועתה נלכה נא דרך שלשת ימים במדבר ונזבחה ליהוה אלהינו
(302170, -60, 4);200;ר;81610;(2, 3, 18, 96, 81610);21526;(2, 3, 18, 23, 21526);במדבר;5;23;ושמעו לקלך ובאת אתה וזקני ישראל אל מלך מצרים ואמרתם אליו יהוה אלהי העבריים נקרה עלינו ועתה נלכה נא דרך שלשת ימים במדבר ונזבחה ליהוה אלהינו
(302170, -60, 4);6;ו;81670;(2, 3, 20, 1, 81670);21542;(2, 3, 20, 1, 21542);ושלחתי;1;1;ושלחתי את ידי והכיתי את מצרים בכל נפלאתי אשר אעשה בקרבו ואחרי כן ישלח אתכם
(302170, -60, 4);6;ו;81730;(2, 3, 21, 1, 81730);21557;(2, 3, 21, 1, 21557);ונתתי;1;1;ונתתי את חן העם הזה בעיני מצרים והיה כי תלכון לא תלכו ריקם
(302170, -60, 4);6;ו;81790;(2, 3, 22, 15, 81790);21573;(2, 3, 22, 4, 21573);ומגרת;1;4;ושאלה אשה משכנתה ומגרת ביתה כלי כסף וכלי זהב ושמלת ושמתם על בניכם ועל בנתיכם ונצלתם את מצרים
(302170, -60, 4);40;ם;81850;(2, 3, 22, 75, 81850);21587;(2, 3, 22, 18, 21587);מצרים;5;18;ושאלה אשה משכנתה ומגרת ביתה כלי כסף וכלי זהב ושמלת ושמתם על בניכם ועל בנתיכם ונצלתם את מצרים
(302170, -60, 4);10;י;81910;(2, 4, 2, 2, 81910);21604;(2, 4, 2, 1, 21604);ויאמר;2;1;ויאמר אליו יהוה מזה בידך ויאמר מטה
(302170, -60, 4);8;ח;81970;(2, 4, 3, 34, 81970);21617;(2, 4, 3, 7, 21617);לנחש;3;7;ויאמר השליכהו ארצה וישלכהו ארצה ויהי לנחש וינס משה מפניו
(302170, -60, 4);5;ה;82030;(2, 4, 4, 47, 82030);21633;(2, 4, 4, 13, 21633);ויהי;3;13;ויאמר יהוה אל משה שלח ידך ואחז בזנבו וישלח ידו ויחזק בו ויהי למטה בכפו
(302170, -60, 4);1;א;82090;(2, 4, 5, 51, 82090);21648;(2, 4, 5, 13, 21648);ואלהי;2;13;למען יאמינו כי נראה אליך יהוה אלהי אבתם אלהי אברהם אלהי יצחק ואלהי יעקב
(302170, -60, 4);40;מ;82150;(2, 4, 6, 53, 82150);21664;(2, 4, 6, 15, 21664);מצרעת;1;15;ויאמר יהוה לו עוד הבא נא ידך בחיקך ויבא ידו בחיקו ויוצאה והנה ידו מצרעת כשלג
(302170, -60, 4);200;ר;82210;(2, 4, 7, 52, 82210);21679;(2, 4, 7, 14, 21679);כבשרו;4;14;ויאמר השב ידך אל חיקך וישב ידו אל חיקו ויוצאה מחיקו והנה שבה כבשרו
(302170, -60, 4);5;ה;82270;(2, 4, 9, 4, 82270);21694;(2, 4, 9, 1, 21694);והיה;4;1;והיה אם לא יאמינו גם לשני האתות האלה ולא ישמעון לקלך ולקחת ממימי היאר ושפכת היבשה והיו המים אשר תקח מן היאר והיו לדם ביבשת
(302170, -60, 4);2;ב;82330;(2, 4, 9, 64, 82330);21709;(2, 4, 9, 16, 21709);היבשה;3;16;והיה אם לא יאמינו גם לשני האתות האלה ולא ישמעון לקלך ולקחת ממימי היאר ושפכת היבשה והיו המים אשר תקח מן היאר והיו לדם ביבשת
(302170, -60, 4);4;ד;82390;(2, 4, 10, 26, 82390);21727;(2, 4, 10, 9, 21727);דברים;1;9;ויאמר משה אל יהוה בי אדני לא איש דברים אנכי גם מתמול גם משלשם גם מאז דברך אל עבדך כי כבד פה וכבד לשון אנכי
(302170, -60, 4);40;מ;82450;(2, 4, 11, 4, 82450);21744;(2, 4, 11, 1, 21744);ויאמר;4;1;ויאמר יהוה אליו מי שם פה לאדם או מי ישום אלם או חרש או פקח או עור הלא אנכי יהוה
(302170, -60, 4);5;ה;82510;(2, 4, 12, 4, 82510);21764;(2, 4, 12, 1, 21764);ועתה;4;1;ועתה לך ואנכי אהיה עם פיך והוריתיך אשר תדבר
(302170, -60, 4);80;ף;82570;(2, 4, 14, 6, 82570);21781;(2, 4, 14, 2, 21781);אף;2;2;ויחר אף יהוה במשה ויאמר הלא אהרן אחיך הלוי ידעתי כי דבר ידבר הוא וגם הנה הוא יצא לקראתך וראך ושמח בלבו
(302170, -60, 4);200;ר;82630;(2, 4, 14, 66, 82630);21798;(2, 4, 14, 19, 21798);לקראתך;3;19;ויחר אף יהוה במשה ויאמר הלא אהרן אחיך הלוי ידעתי כי דבר ידבר הוא וגם הנה הוא יצא לקראתך וראך ושמח בלבו
(302170, -60, 4);5;ה;82690;(2, 4, 15, 45, 82690);21813;(2, 4, 15, 12, 21813);פיהו;3;12;ודברת אליו ושמת את הדברים בפיו ואנכי אהיה עם פיך ועם פיהו והוריתי אתכם את אשר תעשון
(302170, -60, 4);5;ה;82750;(2, 4, 16, 38, 82750);21830;(2, 4, 16, 12, 21830);תהיה;4;12;ודבר הוא לך אל העם והיה הוא יהיה לך לפה ואתה תהיה לו לאלהים
(302170, -60, 4);6;ו;82810;(2, 4, 18, 20, 82810);21848;(2, 4, 18, 6, 21848);חתנו;4;6;וילך משה וישב אל יתר חתנו ויאמר לו אלכה נא ואשובה אל אחי אשר במצרים ואראה העודם חיים ויאמר יתרו למשה לך לשלום
(302170, -60, 4);5;ה;82870;(2, 4, 18, 80, 82870);21863;(2, 4, 18, 21, 21863);למשה;4;21;וילך משה וישב אל יתר חתנו ויאמר לו אלכה נא ואשובה אל אחי אשר במצרים ואראה העודם חיים ויאמר יתרו למשה לך לשלום
(302170, -60, 4);300;ש;82930;(2, 4, 19, 53, 82930);21880;(2, 4, 19, 15, 21880);נפשך;3;15;ויאמר יהוה אל משה במדין לך שב מצרים כי מתו כל האנשים המבקשים את נפשך
(302170, -60, 4);1;א;82990;(2, 4, 20, 59, 82990);21897;(2, 4, 20, 17, 21897);האלהים;2;17;ויקח משה את אשתו ואת בניו וירכבם על החמר וישב ארצה מצרים ויקח משה את מטה האלהים בידו
(302170, -60, 4);6;ו;83050;(2, 4, 21, 52, 83050);21912;(2, 4, 21, 14, 21912);ועשיתם;1;14;ויאמר יהוה אל משה בלכתך לשוב מצרימה ראה כל המפתים אשר שמתי בידך ועשיתם לפני פרעה ואני אחזק את לבו ולא ישלח את העם
(302170, -60, 4);50;נ;83110;(2, 4, 22, 22, 83110);21929;(2, 4, 22, 7, 21929);בני;2;7;ואמרת אל פרעה כה אמר יהוה בני בכרי ישראל
(302170, -60, 4);20;כ;83170;(2, 4, 23, 50, 83170);21945;(2, 4, 23, 14, 21945);בכרך;2;14;ואמר אליך שלח את בני ויעבדני ותמאן לשלחו הנה אנכי הרג את בנך בכרך
(302170, -60, 4);5;ה;83230;(2, 4, 25, 24, 83230);21959;(2, 4, 25, 7, 21959);בנה;3;7;ותקח צפרה צר ותכרת את ערלת בנה ותגע לרגליו ותאמר כי חתן דמים אתה לי
(302170, -60, 4);200;ר;83290;(2, 4, 27, 5, 83290);21975;(2, 4, 27, 1, 21975);ויאמר;5;1;ויאמר יהוה אל אהרן לך לקראת משה המדברה וילך ויפגשהו בהר האלהים וישק לו
(302170, -60, 4);30;ל;83350;(2, 4, 28, 8, 83350);21991;(2, 4, 28, 3, 21991);לאהרן;1;3;ויגד משה לאהרן את כל דברי יהוה אשר שלחו ואת כל האתת אשר צוהו
(302170, -60, 4);20;כ;83410;(2, 4, 29, 21, 83410);22008;(2, 4, 29, 6, 22008);כל;1;6;וילך משה ואהרן ויאספו את כל זקני בני ישראל
(302170, -60, 4);10;י;83470;(2, 4, 30, 47, 83470);22024;(2, 4, 30, 13, 22024);לעיני;5;13;וידבר אהרן את כל הדברים אשר דבר יהוה אל משה ויעש האתת לעיני העם
(302170, -60, 4);6;ו;83530;(2, 4, 31, 57, 83530);22040;(2, 4, 31, 15, 22040);וישתחוו;7;15;ויאמן העם וישמעו כי פקד יהוה את בני ישראל וכי ראה את ענים ויקדו וישתחוו
(302170, -60, 4);10;י;83590;(2, 5, 1, 60, 83590);22057;(2, 5, 1, 17, 22057);לי;2;17;ואחר באו משה ואהרן ויאמרו אל פרעה כה אמר יהוה אלהי ישראל שלח את עמי ויחגו לי במדבר
(302170, -60, 4);400;ת;83650;(2, 5, 2, 55, 83650);22074;(2, 5, 2, 16, 22074);את;2;16;ויאמר פרעה מי יהוה אשר אשמע בקלו לשלח את ישראל לא ידעתי את יהוה וגם את ישראל לא אשלח
