(201382, -86, 4);5;ה;226494;(4, 22, 23, 19, 226494);59742;(4, 22, 23, 5, 59742);יהוה;4;5;ותרא האתון את מלאך יהוה נצב בדרך וחרבו שלופה בידו ותט האתון מן הדרך ותלך בשדה ויך בלעם את האתון להטתה הדרך
(201382, -86, 4);5;ה;226580;(4, 22, 24, 20, 226580);59764;(4, 22, 24, 5, 59764);הכרמים;1;5;ויעמד מלאך יהוה במשעול הכרמים גדר מזה וגדר מזה
(201382, -86, 4);20;ך;226666;(4, 22, 26, 9, 226666);59786;(4, 22, 26, 2, 59786);מלאך;4;2;ויוסף מלאך יהוה עבור ויעמד במקום צר אשר אין דרך לנטות ימין ושמאול
(201382, -86, 4);6;ו;226752;(4, 22, 27, 42, 226752);59809;(4, 22, 27, 12, 59809);ויך;1;12;ותרא האתון את מלאך יהוה ותרבץ תחת בלעם ויחר אף בלעם ויך את האתון במקל
(201382, -86, 4);400;ת;226838;(4, 22, 29, 18, 226838);59832;(4, 22, 29, 5, 59832);התעללת;2;5;ויאמר בלעם לאתון כי התעללת בי לו יש חרב בידי כי עתה הרגתיך
(201382, -86, 4);5;ה;226924;(4, 22, 30, 58, 226924);59856;(4, 22, 30, 16, 59856);הסכנתי;1;16;ותאמר האתון אל בלעם הלוא אנכי אתנך אשר רכבת עלי מעודך עד היום הזה ההסכן הסכנתי לעשות לך כה ויאמר לא
(201382, -86, 4);80;פ;227010;(4, 22, 31, 65, 227010);59878;(4, 22, 31, 17, 59878);לאפיו;3;17;ויגל יהוה את עיני בלעם וירא את מלאך יהוה נצב בדרך וחרבו שלפה בידו ויקד וישתחו לאפיו
(201382, -86, 4);6;ו;227096;(4, 22, 33, 12, 227096);59901;(4, 22, 33, 3, 59901);ותט;1;3;ותראני האתון ותט לפני זה שלש רגלים אולי נטתה מפני כי עתה גם אתכה הרגתי ואותה החייתי
(201382, -86, 4);70;ע;227182;(4, 22, 34, 31, 227182);59924;(4, 22, 34, 9, 59924);ידעתי;3;9;ויאמר בלעם אל מלאך יהוה חטאתי כי לא ידעתי כי אתה נצב לקראתי בדרך ועתה אם רע בעיניך אשובה לי
(201382, -86, 4);2;ב;227268;(4, 22, 35, 45, 227268);59948;(4, 22, 35, 13, 59948);אדבר;3;13;ויאמר מלאך יהוה אל בלעם לך עם האנשים ואפס את הדבר אשר אדבר אליך אתו תדבר וילך בלעם עם שרי בלק
(201382, -86, 4);2;ב;227354;(4, 22, 36, 58, 227354);59973;(4, 22, 36, 17, 59973);הגבול;3;17;וישמע בלק כי בא בלעם ויצא לקראתו אל עיר מואב אשר על גבול ארנן אשר בקצה הגבול
(201382, -86, 4);1;א;227440;(4, 22, 38, 22, 227440);59998;(4, 22, 38, 7, 59998);אליך;1;7;ויאמר בלעם אל בלק הנה באתי אליך עתה היכל אוכל דבר מאומה הדבר אשר ישים אלהים בפי אתו אדבר
(201382, -86, 4);6;ו;227526;(4, 22, 40, 12, 227526);60021;(4, 22, 40, 4, 60021);וצאן;1;4;ויזבח בלק בקר וצאן וישלח לבלעם ולשרים אשר אתו
(201382, -86, 4);100;ק;227612;(4, 23, 1, 14, 227612);60043;(4, 23, 1, 4, 60043);בלק;3;4;ויאמר בלעם אל בלק בנה לי בזה שבעה מזבחת והכן לי בזה שבעה פרים ושבעה אילים
(201382, -86, 4);6;ו;227698;(4, 23, 3, 1, 227698);60067;(4, 23, 3, 1, 60067);ויאמר;1;1;ויאמר בלעם לבלק התיצב על עלתך ואלכה אולי יקרה יהוה לקראתי ודבר מה יראני והגדתי לך וילך שפי
(201382, -86, 4);70;ע;227784;(4, 23, 4, 14, 227784);60088;(4, 23, 4, 4, 60088);בלעם;3;4;ויקר אלהים אל בלעם ויאמר אליו את שבעת המזבחת ערכתי ואעל פר ואיל במזבח
(201382, -86, 4);30;ל;227870;(4, 23, 6, 6, 227870);60111;(4, 23, 6, 2, 60111);אליו;2;2;וישב אליו והנה נצב על עלתו הוא וכל שרי מואב
(201382, -86, 4);7;ז;227956;(4, 23, 7, 58, 227956);60136;(4, 23, 7, 17, 60136);זעמה;1;17;וישא משלו ויאמר מן ארם ינחני בלק מלך מואב מהררי קדם לכה ארה לי יעקב ולכה זעמה ישראל
(201382, -86, 4);400;ת;228042;(4, 23, 9, 50, 228042);60160;(4, 23, 9, 13, 60160);יתחשב;2;13;כי מראש צרים אראנו ומגבעות אשורנו הן עם לבדד ישכן ובגוים לא יתחשב
(201382, -86, 4);10;י;228128;(4, 23, 11, 27, 228128);60184;(4, 23, 11, 9, 60184);איבי;2;9;ויאמר בלק אל בלעם מה עשית לי לקב איבי לקחתיך והנה ברכת ברך
(201382, -86, 4);200;ר;228214;(4, 23, 13, 28, 228214);60208;(4, 23, 13, 9, 60208);אחר;3;9;ויאמר אליו בלק לך נא אתי אל מקום אחר אשר תראנו משם אפס קצהו תראה וכלו לא תראה וקבנו לי משם
(201382, -86, 4);1;א;228300;(4, 23, 14, 44, 228300);60232;(4, 23, 14, 12, 60232);ואיל;2;12;ויקחהו שדה צפים אל ראש הפסגה ויבן שבעה מזבחת ויעל פר ואיל במזבח
(201382, -86, 4);200;ר;228386;(4, 23, 16, 45, 228386);60256;(4, 23, 16, 13, 60256);תדבר;4;13;ויקר יהוה אל בלעם וישם דבר בפיו ויאמר שוב אל בלק וכה תדבר
(201382, -86, 4);6;ו;228472;(4, 23, 18, 35, 228472);60280;(4, 23, 18, 9, 60280);בנו;3;9;וישא משלו ויאמר קום בלק ושמע האזינה עדי בנו צפר
(201382, -86, 4);6;ו;228558;(4, 23, 21, 8, 228558);60304;(4, 23, 21, 3, 60304);און;2;3;לא הביט און ביעקב ולא ראה עמל בישראל יהוה אלהיו עמו ותרועת מלך בו
(201382, -86, 4);60;ס;228644;(4, 23, 23, 17, 228644);60327;(4, 23, 23, 6, 60327);קסם;2;6;כי לא נחש ביעקב ולא קסם בישראל כעת יאמר ליעקב ולישראל מה פעל אל
(201382, -86, 4);1;א;228730;(4, 23, 25, 3, 228730);60350;(4, 23, 25, 1, 60350);ויאמר;3;1;ויאמר בלק אל בלעם גם קב לא תקבנו גם ברך לא תברכנו
(201382, -86, 4);1;א;228816;(4, 23, 26, 51, 228816);60376;(4, 23, 26, 15, 60376);אעשה;1;15;ויען בלעם ויאמר אל בלק הלא דברתי אליך לאמר כל אשר ידבר יהוה אתו אעשה
(201382, -86, 4);5;ה;228902;(4, 23, 28, 22, 228902);60400;(4, 23, 28, 7, 60400);הנשקף;1;7;ויקח בלק את בלעם ראש הפעור הנשקף על פני הישימן
(201382, -86, 4);200;ר;228988;(4, 23, 30, 14, 228988);60423;(4, 23, 30, 4, 60423);אמר;3;4;ויעש בלק כאשר אמר בלעם ויעל פר ואיל במזבח
(201382, -86, 4);2;ב;229074;(4, 24, 1, 67, 229074);60446;(4, 24, 1, 18, 60446);המדבר;4;18;וירא בלעם כי טוב בעיני יהוה לברך את ישראל ולא הלך כפעם בפעם לקראת נחשים וישת אל המדבר פניו
(201382, -86, 4);40;ם;229160;(4, 24, 3, 30, 229160);60468;(4, 24, 3, 8, 60468);ונאם;4;8;וישא משלו ויאמר נאם בלעם בנו בער ונאם הגבר שתם העין
(201382, -86, 4);6;ו;229246;(4, 24, 6, 10, 229246);60490;(4, 24, 6, 2, 60490);נטיו;4;2;כנחלים נטיו כגנת עלי נהר כאהלים נטע יהוה כארזים עלי מים
(201382, -86, 4);90;צ;229332;(4, 24, 8, 5, 229332);60512;(4, 24, 8, 2, 60512);מוציאו;3;2;אל מוציאו ממצרים כתועפת ראם לו יאכל גוים צריו ועצמתיהם יגרם וחציו ימחץ
(201382, -86, 4);6;ו;229418;(4, 24, 9, 33, 229418);60531;(4, 24, 9, 8, 60531);ברוך;3;8;כרע שכב כארי וכלביא מי יקימנו מברכיך ברוך וארריך ארור
(201382, -86, 4);6;ו;229504;(4, 24, 11, 1, 229504);60555;(4, 24, 11, 1, 60555);ועתה;1;1;ועתה ברח לך אל מקומך אמרתי כבד אכבדך והנה מנעך יהוה מכבוד
(201382, -86, 4);400;ת;229590;(4, 24, 12, 41, 229590);60578;(4, 24, 12, 12, 60578);דברתי;4;12;ויאמר בלעם אל בלק הלא גם אל מלאכיך אשר שלחת אלי דברתי לאמר
(201382, -86, 4);400;ת;229676;(4, 24, 14, 3, 229676);60604;(4, 24, 14, 1, 60604);ועתה;3;1;ועתה הנני הולך לעמי לכה איעצך אשר יעשה העם הזה לעמך באחרית הימים
(201382, -86, 4);40;ם;229762;(4, 24, 15, 37, 229762);60626;(4, 24, 15, 10, 60626);שתם;3;10;וישא משלו ויאמר נאם בלעם בנו בער ונאם הגבר שתם העין
(201382, -86, 4);70;ע;229848;(4, 24, 17, 34, 229848);60649;(4, 24, 17, 9, 60649);מיעקב;3;9;אראנו ולא עתה אשורנו ולא קרוב דרך כוכב מיעקב וקם שבט מישראל ומחץ פאתי מואב וקרקר כל בני שת
(201382, -86, 4);70;ע;229934;(4, 24, 19, 7, 229934);60671;(4, 24, 19, 2, 60671);מיעקב;3;2;וירד מיעקב והאביד שריד מעיר
(201382, -86, 4);10;י;230020;(4, 24, 21, 21, 230020);60692;(4, 24, 21, 6, 60692);ויאמר;2;6;וירא את הקיני וישא משלו ויאמר איתן מושבך ושים בסלע קנך
(201382, -86, 4);20;כ;230106;(4, 24, 24, 8, 230106);60717;(4, 24, 24, 3, 60717);כתים;1;3;וצים מיד כתים וענו אשור וענו עבר וגם הוא עדי אבד
(201382, -86, 4);40;ם;230192;(4, 25, 1, 21, 230192);60739;(4, 25, 1, 5, 60739);העם;3;5;וישב ישראל בשטים ויחל העם לזנות אל בנות מואב
(201382, -86, 4);2;ב;230278;(4, 25, 3, 29, 230278);60759;(4, 25, 3, 8, 60759);בישראל;1;8;ויצמד ישראל לבעל פעור ויחר אף יהוה בישראל
(201382, -86, 4);9;ט;230364;(4, 25, 5, 13, 230364);60782;(4, 25, 5, 4, 60782);שפטי;3;4;ויאמר משה אל שפטי ישראל הרגו איש אנשיו הנצמדים לבעל פעור
(201382, -86, 4);20;כ;230450;(4, 25, 6, 53, 230450);60803;(4, 25, 6, 14, 60803);כל;1;14;והנה איש מבני ישראל בא ויקרב אל אחיו את המדינית לעיני משה ולעיני כל עדת בני ישראל והמה בכים פתח אהל מועד
(201382, -86, 4);200;ר;230536;(4, 25, 8, 7, 230536);60826;(4, 25, 8, 2, 60826);אחר;3;2;ויבא אחר איש ישראל אל הקבה וידקר את שניהם את איש ישראל ואת האשה אל קבתה ותעצר המגפה מעל בני ישראל
(201382, -86, 4);1;א;230622;(4, 25, 9, 16, 230622);60849;(4, 25, 9, 4, 60849);ארבעה;1;4;ויהיו המתים במגפה ארבעה ועשרים אלף
(201382, -86, 4);10;י;230708;(4, 25, 11, 55, 230708);60871;(4, 25, 11, 15, 60871);קנאתי;5;15;פינחס בן אלעזר בן אהרן הכהן השיב את חמתי מעל בני ישראל בקנאו את קנאתי בתוכם ולא כליתי את בני ישראל בקנאתי
(201382, -86, 4);400;ת;230794;(4, 25, 13, 31, 230794);60894;(4, 25, 13, 8, 60894);תחת;1;8;והיתה לו ולזרעו אחריו ברית כהנת עולם תחת אשר קנא לאלהיו ויכפר על בני ישראל
(201382, -86, 4);300;ש;230880;(4, 25, 15, 2, 230880);60917;(4, 25, 15, 1, 60917);ושם;2;1;ושם האשה המכה המדינית כזבי בת צור ראש אמות בית אב במדין הוא
(201382, -86, 4);40;ם;230966;(4, 25, 17, 23, 230966);60939;(4, 25, 17, 5, 60939);אותם;4;5;צרור את המדינים והכיתם אותם
(201382, -86, 4);10;י;231052;(4, 25, 19, 2, 231052);60964;(4, 25, 19, 1, 60964);ויהי;2;1;ויהי אחרי המגפה
(201382, -86, 4);2;ב;231138;(4, 26, 2, 39, 231138);60988;(4, 26, 2, 12, 60988);לבית;2;12;שאו את ראש כל עדת בני ישראל מבן עשרים שנה ומעלה לבית אבתם כל יצא צבא בישראל
(201382, -86, 4);6;ו;231224;(4, 26, 4, 22, 231224);61010;(4, 26, 4, 6, 61010);צוה;2;6;מבן עשרים שנה ומעלה כאשר צוה יהוה את משה ובני ישראל היצאים מארץ מצרים
(201382, -86, 4);30;ל;231310;(4, 26, 6, 1, 231310);61030;(4, 26, 6, 1, 61030);לחצרן;1;1;לחצרן משפחת החצרוני לכרמי משפחת הכרמי
(201382, -86, 4);6;ו;231396;(4, 26, 8, 1, 231396);61047;(4, 26, 8, 1, 61047);ובני;1;1;ובני פלוא אליאב
(201382, -86, 4);400;ת;231482;(4, 26, 9, 74, 231482);61068;(4, 26, 9, 19, 61068);בהצתם;4;19;ובני אליאב נמואל ודתן ואבירם הוא דתן ואבירם קרואי העדה אשר הצו על משה ועל אהרן בעדת קרח בהצתם על יהוה
(201382, -86, 4);6;ו;231568;(4, 26, 11, 12, 231568);61092;(4, 26, 11, 4, 61092);מתו;3;4;ובני קרח לא מתו
(201382, -86, 4);300;ש;231654;(4, 26, 13, 21, 231654);61109;(4, 26, 13, 5, 61109);משפחת;2;5;לזרח משפחת הזרחי לשאול משפחת השאולי
(201382, -86, 4);6;ו;231740;(4, 26, 15, 44, 231740);61127;(4, 26, 15, 10, 61127);לשוני;3;10;בני גד למשפחתם לצפון משפחת הצפוני לחגי משפחת החגי לשוני משפחת השוני
(201382, -86, 4);4;ד;231826;(4, 26, 18, 13, 231826);61145;(4, 26, 18, 4, 61145);גד;2;4;אלה משפחת בני גד לפקדיהם ארבעים אלף וחמש מאות
(201382, -86, 4);8;ח;231912;(4, 26, 20, 28, 231912);61165;(4, 26, 20, 6, 61165);משפחת;4;6;ויהיו בני יהודה למשפחתם לשלה משפחת השלני לפרץ משפחת הפרצי לזרח משפחת הזרחי
(201382, -86, 4);10;י;231998;(4, 26, 22, 9, 231998);61184;(4, 26, 22, 3, 61184);יהודה;1;3;אלה משפחת יהודה לפקדיהם ששה ושבעים אלף וחמש מאות
(201382, -86, 4);5;ה;232084;(4, 26, 24, 11, 232084);61202;(4, 26, 24, 3, 61202);הישבי;1;3;לישוב משפחת הישבי לשמרן משפחת השמרני
(201382, -86, 4);5;ה;232170;(4, 26, 26, 25, 232170);61220;(4, 26, 26, 6, 61220);הסרדי;1;6;בני זבולן למשפחתם לסרד משפחת הסרדי לאלון משפחת האלני ליחלאל משפחת היחלאלי
(201382, -86, 4);8;ח;232256;(4, 26, 28, 12, 232256);61237;(4, 26, 28, 3, 61237);למשפחתם;5;3;בני יוסף למשפחתם מנשה ואפרים
(201382, -86, 4);8;ח;232342;(4, 26, 30, 19, 232342);61256;(4, 26, 30, 5, 61256);משפחת;4;5;אלה בני גלעד איעזר משפחת האיעזרי לחלק משפחת החלקי
(201382, -86, 4);200;ר;232428;(4, 26, 32, 31, 232428);61272;(4, 26, 32, 6, 61272);החפרי;4;6;ושמידע משפחת השמידעי וחפר משפחת החפרי
(201382, -86, 4);10;י;232514;(4, 26, 34, 22, 232514);61295;(4, 26, 34, 5, 61295);שנים;3;5;אלה משפחת מנשה ופקדיהם שנים וחמשים אלף ושבע מאות
(201382, -86, 4);2;ב;232600;(4, 26, 36, 5, 232600);61314;(4, 26, 36, 2, 61314);בני;1;2;ואלה בני שותלח לערן משפחת הערני
(201382, -86, 4);2;ב;232686;(4, 26, 38, 4, 232686);61334;(4, 26, 38, 2, 61334);בנימן;1;2;בני בנימן למשפחתם לבלע משפחת הבלעי לאשבל משפחת האשבלי לאחירם משפחת האחירמי
(201382, -86, 4);400;ת;232772;(4, 26, 39, 27, 232772);61349;(4, 26, 39, 5, 61349);משפחת;5;5;לשפופם משפחת השופמי לחופם משפחת החופמי
(201382, -86, 4);40;ם;232858;(4, 26, 41, 36, 232858);61367;(4, 26, 41, 7, 61367);וארבעים;7;7;אלה בני בנימן למשפחתם ופקדיהם חמשה וארבעים אלף ושש מאות
(201382, -86, 4);300;ש;232944;(4, 26, 43, 28, 232944);61387;(4, 26, 43, 6, 61387);וששים;3;6;כל משפחת השוחמי לפקדיהם ארבעה וששים אלף וארבע מאות
(201382, -86, 4);2;ב;233030;(4, 26, 45, 12, 233030);61405;(4, 26, 45, 3, 61405);לחבר;3;3;לבני בריעה לחבר משפחת החברי למלכיאל משפחת המלכיאלי
(201382, -86, 4);2;ב;233116;(4, 26, 48, 1, 233116);61425;(4, 26, 48, 1, 61425);בני;1;1;בני נפתלי למשפחתם ליחצאל משפחת היחצאלי לגוני משפחת הגוני
(201382, -86, 4);400;ת;233202;(4, 26, 50, 11, 233202);61442;(4, 26, 50, 3, 61442);נפתלי;3;3;אלה משפחת נפתלי למשפחתם ופקדיהם חמשה וארבעים אלף וארבע מאות
(201382, -86, 4);200;ר;233288;(4, 26, 52, 5, 233288);61461;(4, 26, 52, 1, 61461);וידבר;5;1;וידבר יהוה אל משה לאמר
(201382, -86, 4);1;א;233374;(4, 26, 55, 1, 233374);61483;(4, 26, 55, 1, 61483);אך;1;1;אך בגורל יחלק את הארץ לשמות מטות אבתם ינחלו
(201382, -86, 4);6;ו;233460;(4, 26, 57, 25, 233460);61504;(4, 26, 57, 5, 61504);לגרשון;5;5;ואלה פקודי הלוי למשפחתם לגרשון משפחת הגרשני לקהת משפחת הקהתי למררי משפחת המררי
(201382, -86, 4);80;פ;233546;(4, 26, 58, 45, 233546);61522;(4, 26, 58, 10, 61522);משפחת;3;10;אלה משפחת לוי משפחת הלבני משפחת החברני משפחת המחלי משפחת המושי משפחת הקרחי וקהת הולד את עמרם
(201382, -86, 4);50;ן;233632;(4, 26, 59, 55, 233632);61544;(4, 26, 59, 15, 61544);אהרן;4;15;ושם אשת עמרם יוכבד בת לוי אשר ילדה אתה ללוי במצרים ותלד לעמרם את אהרן ואת משה ואת מרים אחתם
(201382, -86, 4);10;י;233718;(4, 26, 61, 30, 233718);61566;(4, 26, 61, 7, 61566);לפני;4;7;וימת נדב ואביהוא בהקריבם אש זרה לפני יהוה
(201382, -86, 4);50;נ;233804;(4, 26, 62, 82, 233804);61590;(4, 26, 62, 23, 61590);בני;2;23;ויהיו פקדיהם שלשה ועשרים אלף כל זכר מבן חדש ומעלה כי לא התפקדו בתוך בני ישראל כי לא נתן להם נחלה בתוך בני ישראל
(201382, -86, 4);6;ו;233890;(4, 26, 64, 23, 233890);61613;(4, 26, 64, 7, 61613);ואהרן;1;7;ובאלה לא היה איש מפקודי משה ואהרן הכהן אשר פקדו את בני ישראל במדבר סיני
(201382, -86, 4);10;י;233976;(4, 26, 65, 52, 233976);61638;(4, 26, 65, 17, 61638);ויהושע;2;17;כי אמר יהוה להם מות ימתו במדבר ולא נותר מהם איש כי אם כלב בן יפנה ויהושע בן נון
(201382, -86, 4);8;ח;234062;(4, 27, 1, 77, 234062);61661;(4, 27, 1, 21, 61661);וחגלה;2;21;ותקרבנה בנות צלפחד בן חפר בן גלעד בן מכיר בן מנשה למשפחת מנשה בן יוסף ואלה שמות בנתיו מחלה נעה וחגלה ומלכה ותרצה
(201382, -86, 4);6;ו;234148;(4, 27, 3, 13, 234148);61681;(4, 27, 3, 4, 61681);והוא;1;4;אבינו מת במדבר והוא לא היה בתוך העדה הנועדים על יהוה בעדת קרח כי בחטאו מת ובנים לא היו לו
(201382, -86, 4);50;ן;234234;(4, 27, 4, 29, 234234);61705;(4, 27, 4, 8, 61705);אין;3;8;למה יגרע שם אבינו מתוך משפחתו כי אין לו בן תנה לנו אחזה בתוך אחי אבינו
(201382, -86, 4);400;ת;234320;(4, 27, 7, 19, 234320);61730;(4, 27, 7, 6, 61730);תתן;1;6;כן בנות צלפחד דברת נתן תתן להם אחזת נחלה בתוך אחי אביהם והעברת את נחלת אביהן להן
(201382, -86, 4);200;ר;234406;(4, 27, 8, 41, 234406);61753;(4, 27, 8, 12, 61753);והעברתם;5;12;ואל בני ישראל תדבר לאמר איש כי ימות ובן אין לו והעברתם את נחלתו לבתו
(201382, -86, 4);10;י;234492;(4, 27, 11, 14, 234492);61777;(4, 27, 11, 4, 61777);לאביו;4;4;ואם אין אחים לאביו ונתתם את נחלתו לשארו הקרב אליו ממשפחתו וירש אתה והיתה לבני ישראל לחקת משפט כאשר צוה יהוה את משה
(201382, -86, 4);6;ו;234578;(4, 27, 12, 8, 234578);61798;(4, 27, 12, 2, 61798);יהוה;3;2;ויאמר יהוה אל משה עלה אל הר העברים הזה וראה את הארץ אשר נתתי לבני ישראל
(201382, -86, 4);50;ן;234664;(4, 27, 13, 38, 234664);61822;(4, 27, 13, 10, 61822);אהרן;4;10;וראיתה אתה ונאספת אל עמיך גם אתה כאשר נאסף אהרן אחיך
(201382, -86, 4);40;מ;234750;(4, 27, 15, 17, 234750);61844;(4, 27, 15, 5, 61844);לאמר;3;5;וידבר משה אל יהוה לאמר
(201382, -86, 4);4;ד;234836;(4, 27, 17, 53, 234836);61866;(4, 27, 17, 13, 61866);עדת;2;13;אשר יצא לפניהם ואשר יבא לפניהם ואשר יוציאם ואשר יביאם ולא תהיה עדת יהוה כצאן אשר אין להם רעה
(201382, -86, 4);30;ל;234922;(4, 27, 19, 10, 234922);61893;(4, 27, 19, 3, 61893);לפני;1;3;והעמדת אתו לפני אלעזר הכהן ולפני כל העדה וצויתה אתו לעיניהם
(201382, -86, 4);5;ה;235008;(4, 27, 21, 11, 235008);61913;(4, 27, 21, 3, 61913);הכהן;1;3;ולפני אלעזר הכהן יעמד ושאל לו במשפט האורים לפני יהוה על פיו יצאו ועל פיו יבאו הוא וכל בני ישראל אתו וכל העדה
(201382, -86, 4);200;ר;235094;(4, 27, 22, 11, 235094);61936;(4, 27, 22, 3, 61936);כאשר;4;3;ויעש משה כאשר צוה יהוה אתו ויקח את יהושע ויעמדהו לפני אלעזר הכהן ולפני כל העדה
(201382, -86, 4);10;י;235180;(4, 27, 23, 34, 235180);61958;(4, 27, 23, 9, 61958);ביד;2;9;ויסמך את ידיו עליו ויצוהו כאשר דבר יהוה ביד משה
(201382, -86, 4);6;ו;235266;(4, 28, 3, 1, 235266);61981;(4, 28, 3, 1, 61981);ואמרת;1;1;ואמרת להם זה האשה אשר תקריבו ליהוה כבשים בני שנה תמימם שנים ליום עלה תמיד
(201382, -86, 4);10;י;235352;(4, 28, 4, 28, 235352);62003;(4, 28, 4, 8, 62003);השני;4;8;את הכבש אחד תעשה בבקר ואת הכבש השני תעשה בין הערבים
(201382, -86, 4);30;ל;235438;(4, 28, 6, 31, 235438);62024;(4, 28, 6, 9, 62024);ליהוה;1;9;עלת תמיד העשיה בהר סיני לריח ניחח אשה ליהוה
(201382, -86, 4);300;ש;235524;(4, 28, 8, 42, 235524);62044;(4, 28, 8, 10, 62044);תעשה;3;10;ואת הכבש השני תעשה בין הערבים כמנחת הבקר וכנסכו תעשה אשה ריח ניחח ליהוה
(201382, -86, 4);6;ו;235610;(4, 28, 10, 11, 235610);62065;(4, 28, 10, 3, 62065);בשבתו;5;3;עלת שבת בשבתו על עלת התמיד ונסכה
(201382, -86, 4);300;ש;235696;(4, 28, 12, 4, 235696);62086;(4, 28, 12, 1, 62086);ושלשה;4;1;ושלשה עשרנים סלת מנחה בלולה בשמן לפר האחד ושני עשרנים סלת מנחה בלולה בשמן לאיל האחד
(201382, -86, 4);5;ה;235782;(4, 28, 13, 22, 235782);62106;(4, 28, 13, 5, 62106);בלולה;5;5;ועשרן עשרון סלת מנחה בלולה בשמן לכבש האחד עלה ריח ניחח אשה ליהוה
(201382, -86, 4);70;ע;235868;(4, 28, 14, 56, 235868);62128;(4, 28, 14, 14, 62128);עלת;1;14;ונסכיהם חצי ההין יהיה לפר ושלישת ההין לאיל ורביעת ההין לכבש יין זאת עלת חדש בחדשו לחדשי השנה
(201382, -86, 4);4;ד;235954;(4, 28, 16, 26, 235954);62148;(4, 28, 16, 6, 62148);לחדש;3;6;ובחדש הראשון בארבעה עשר יום לחדש פסח ליהוה
(201382, -86, 4);400;ת;236040;(4, 28, 19, 6, 236040);62170;(4, 28, 19, 1, 62170);והקרבתם;6;1;והקרבתם אשה עלה ליהוה פרים בני בקר שנים ואיל אחד ושבעה כבשים בני שנה תמימם יהיו לכם
(201382, -86, 4);200;ר;236126;(4, 28, 20, 25, 236126);62192;(4, 28, 20, 6, 62192);עשרנים;3;6;ומנחתם סלת בלולה בשמן שלשה עשרנים לפר ושני עשרנים לאיל תעשו
(201382, -86, 4);5;ה;236212;(4, 28, 23, 8, 236212);62212;(4, 28, 23, 3, 62212);הבקר;1;3;מלבד עלת הבקר אשר לעלת התמיד תעשו את אלה
(201382, -86, 4);6;ו;236298;(4, 28, 25, 4, 236298);62234;(4, 28, 25, 1, 62234);וביום;4;1;וביום השביעי מקרא קדש יהיה לכם כל מלאכת עבדה לא תעשו
(201382, -86, 4);300;ש;236384;(4, 28, 26, 48, 236384);62253;(4, 28, 26, 9, 62253);קדש;3;9;וביום הבכורים בהקריבכם מנחה חדשה ליהוה בשבעתיכם מקרא קדש יהיה לכם כל מלאכת עבדה לא תעשו
(201382, -86, 4);50;נ;236470;(4, 28, 28, 3, 236470);62276;(4, 28, 28, 1, 62276);ומנחתם;3;1;ומנחתם סלת בלולה בשמן שלשה עשרנים לפר האחד שני עשרנים לאיל האחד
(201382, -86, 4);40;ם;236556;(4, 28, 30, 8, 236556);62295;(4, 28, 30, 2, 62295);עזים;4;2;שעיר עזים אחד לכפר עליכם
(201382, -86, 4);40;ם;236642;(4, 29, 1, 33, 236642);62315;(4, 29, 1, 8, 62315);לכם;3;8;ובחדש השביעי באחד לחדש מקרא קדש יהיה לכם כל מלאכת עבדה לא תעשו יום תרועה יהיה לכם
(201382, -86, 4);400;ת;236728;(4, 29, 2, 54, 236728);62340;(4, 29, 2, 16, 62340);תמימם;1;16;ועשיתם עלה לריח ניחח ליהוה פר בן בקר אחד איל אחד כבשים בני שנה שבעה תמימם
(201382, -86, 4);1;א;236814;(4, 29, 5, 10, 236814);62359;(4, 29, 5, 3, 62359);אחד;1;3;ושעיר עזים אחד חטאת לכפר עליכם
(201382, -86, 4);300;ש;236900;(4, 29, 7, 10, 236900);62377;(4, 29, 7, 2, 62377);לחדש;4;2;ובעשור לחדש השביעי הזה מקרא קדש יהיה לכם ועניתם את נפשתיכם כל מלאכה לא תעשו
(201382, -86, 4);30;ל;236986;(4, 29, 8, 35, 236986);62400;(4, 29, 8, 10, 62400);איל;3;10;והקרבתם עלה ליהוה ריח ניחח פר בן בקר אחד איל אחד כבשים בני שנה שבעה תמימם יהיו לכם
