(285910, 96, 4);50;נ;220438;(4, 18, 29, 45, 220438);58109;(4, 18, 29, 12, 58109);ממנו;3;12;מכל מתנתיכם תרימו את כל תרומת יהוה מכל חלבו את מקדשו ממנו
(285910, 96, 4);70;ע;220534;(4, 18, 31, 40, 220534);58133;(4, 18, 31, 12, 58133);עבדתכם;1;12;ואכלתם אתו בכל מקום אתם וביתכם כי שכר הוא לכם חלף עבדתכם באהל מועד
(285910, 96, 4);30;ל;220630;(4, 19, 1, 22, 220630);58158;(4, 19, 1, 7, 58158);לאמר;1;7;וידבר יהוה אל משה ואל אהרן לאמר
(285910, 96, 4);1;א;220726;(4, 19, 3, 9, 220726);58186;(4, 19, 3, 3, 58186);אל;1;3;ונתתם אתה אל אלעזר הכהן והוציא אתה אל מחוץ למחנה ושחט אתה לפניו
(285910, 96, 4);40;ם;220822;(4, 19, 4, 54, 220822);58210;(4, 19, 4, 14, 58210);פעמים;5;14;ולקח אלעזר הכהן מדמה באצבעו והזה אל נכח פני אהל מועד מדמה שבע פעמים
(285910, 96, 4);3;ג;220918;(4, 19, 7, 6, 220918);58237;(4, 19, 7, 2, 58237);בגדיו;2;2;וכבס בגדיו הכהן ורחץ בשרו במים ואחר יבא אל המחנה וטמא הכהן עד הערב
(285910, 96, 4);10;י;221014;(4, 19, 9, 6, 221014);58262;(4, 19, 9, 2, 58262);איש;2;2;ואסף איש טהור את אפר הפרה והניח מחוץ למחנה במקום טהור והיתה לעדת בני ישראל למשמרת למי נדה חטאת הוא
(285910, 96, 4);10;י;221110;(4, 19, 10, 23, 221110);58287;(4, 19, 10, 7, 58287);בגדיו;4;7;וכבס האסף את אפר הפרה את בגדיו וטמא עד הערב והיתה לבני ישראל ולגר הגר בתוכם לחקת עולם
(285910, 96, 4);10;י;221206;(4, 19, 12, 23, 221206);58312;(4, 19, 12, 6, 58312);וביום;3;6;הוא יתחטא בו ביום השלישי וביום השביעי יטהר ואם לא יתחטא ביום השלישי וביום השביעי לא יטהר
(285910, 96, 4);50;נ;221302;(4, 19, 13, 47, 221302);58337;(4, 19, 13, 14, 58337);ונכרתה;2;14;כל הנגע במת בנפש האדם אשר ימות ולא יתחטא את משכן יהוה טמא ונכרתה הנפש ההוא מישראל כי מי נדה לא זרק עליו טמא יהיה עוד טמאתו בו
(285910, 96, 4);40;מ;221398;(4, 19, 14, 45, 221398);58365;(4, 19, 14, 14, 58365);יטמא;3;14;זאת התורה אדם כי ימות באהל כל הבא אל האהל וכל אשר באהל יטמא שבעת ימים
(285910, 96, 4);400;ת;221494;(4, 19, 16, 53, 221494);58394;(4, 19, 16, 17, 58394);שבעת;4;17;וכל אשר יגע על פני השדה בחלל חרב או במת או בעצם אדם או בקבר יטמא שבעת ימים
(285910, 96, 4);300;ש;221590;(4, 19, 18, 50, 221590);58420;(4, 19, 18, 14, 58420);הנפשות;4;14;ולקח אזוב וטבל במים איש טהור והזה על האהל ועל כל הכלים ועל הנפשות אשר היו שם ועל הנגע בעצם או בחלל או במת או בקבר
(285910, 96, 4);10;י;221686;(4, 19, 19, 58, 221686);58445;(4, 19, 19, 13, 58445);בגדיו;4;13;והזה הטהר על הטמא ביום השלישי וביום השביעי וחטאו ביום השביעי וכבס בגדיו ורחץ במים וטהר בערב
(285910, 96, 4);10;י;221782;(4, 19, 21, 3, 221782);58472;(4, 19, 21, 1, 58472);והיתה;3;1;והיתה להם לחקת עולם ומזה מי הנדה יכבס בגדיו והנגע במי הנדה יטמא עד הערב
(285910, 96, 4);2;ב;221878;(4, 20, 1, 3, 221878);58498;(4, 20, 1, 1, 58498);ויבאו;3;1;ויבאו בני ישראל כל העדה מדבר צן בחדש הראשון וישב העם בקדש ותמת שם מרים ותקבר שם
(285910, 96, 4);5;ה;221974;(4, 20, 3, 5, 221974);58525;(4, 20, 3, 2, 58525);העם;1;2;וירב העם עם משה ויאמרו לאמר ולו גוענו בגוע אחינו לפני יהוה
(285910, 96, 4);10;י;222070;(4, 20, 5, 8, 222070);58549;(4, 20, 5, 2, 58549);העליתנו;4;2;ולמה העליתנו ממצרים להביא אתנו אל המקום הרע הזה לא מקום זרע ותאנה וגפן ורמון ומים אין לשתות
(285910, 96, 4);6;ו;222166;(4, 20, 6, 30, 222166);58574;(4, 20, 6, 9, 58574);מועד;2;9;ויבא משה ואהרן מפני הקהל אל פתח אהל מועד ויפלו על פניהם וירא כבוד יהוה אליהם
(285910, 96, 4);50;נ;222262;(4, 20, 8, 47, 222262);58599;(4, 20, 8, 13, 58599);לעיניהם;4;13;קח את המטה והקהל את העדה אתה ואהרן אחיך ודברתם אל הסלע לעיניהם ונתן מימיו והוצאת להם מים מן הסלע והשקית את העדה ואת בעירם
(285910, 96, 4);400;ת;222358;(4, 20, 10, 16, 222358);58623;(4, 20, 10, 4, 58623);את;2;4;ויקהלו משה ואהרן את הקהל אל פני הסלע ויאמר להם שמעו נא המרים המן הסלע הזה נוציא לכם מים
(285910, 96, 4);40;ם;222454;(4, 20, 11, 43, 222454);58650;(4, 20, 11, 12, 58650);רבים;4;12;וירם משה את ידו ויך את הסלע במטהו פעמים ויצאו מים רבים ותשת העדה ובעירם
(285910, 96, 4);300;ש;222550;(4, 20, 12, 82, 222550);58676;(4, 20, 12, 23, 58676);אשר;2;23;ויאמר יהוה אל משה ואל אהרן יען לא האמנתם בי להקדישני לעיני בני ישראל לכן לא תביאו את הקהל הזה אל הארץ אשר נתתי להם
(285910, 96, 4);20;כ;222646;(4, 20, 14, 51, 222646);58704;(4, 20, 14, 15, 58704);כל;1;15;וישלח משה מלאכים מקדש אל מלך אדום כה אמר אחיך ישראל אתה ידעת את כל התלאה אשר מצאתנו
(285910, 96, 4);8;ח;222742;(4, 20, 16, 25, 222742);58724;(4, 20, 16, 6, 58724);וישלח;5;6;ונצעק אל יהוה וישמע קלנו וישלח מלאך ויצאנו ממצרים והנה אנחנו בקדש עיר קצה גבולך
(285910, 96, 4);40;מ;222838;(4, 20, 17, 56, 222838);58750;(4, 20, 17, 17, 58750);ימין;2;17;נעברה נא בארצך לא נעבר בשדה ובכרם ולא נשתה מי באר דרך המלך נלך לא נטה ימין ושמאול עד אשר נעבר גבלך
(285910, 96, 4);5;ה;222934;(4, 20, 19, 39, 222934);58774;(4, 20, 19, 9, 58774);נשתה;4;9;ויאמרו אליו בני ישראל במסלה נעלה ואם מימיך נשתה אני ומקני ונתתי מכרם רק אין דבר ברגלי אעברה
(285910, 96, 4);200;ר;223030;(4, 20, 21, 22, 223030);58799;(4, 20, 21, 6, 58799);עבר;3;6;וימאן אדום נתן את ישראל עבר בגבלו ויט ישראל מעליו
(285910, 96, 4);10;י;223126;(4, 20, 24, 1, 223126);58826;(4, 20, 24, 1, 58826);יאסף;1;1;יאסף אהרן אל עמיו כי לא יבא אל הארץ אשר נתתי לבני ישראל על אשר מריתם את פי למי מריבה
(285910, 96, 4);6;ו;223222;(4, 20, 26, 1, 223222);58856;(4, 20, 26, 1, 58856);והפשט;1;1;והפשט את אהרן את בגדיו והלבשתם את אלעזר בנו ואהרן יאסף ומת שם
(285910, 96, 4);300;ש;223318;(4, 20, 28, 7, 223318);58882;(4, 20, 28, 2, 58882);משה;2;2;ויפשט משה את אהרן את בגדיו וילבש אתם את אלעזר בנו וימת אהרן שם בראש ההר וירד משה ואלעזר מן ההר
(285910, 96, 4);5;ה;223414;(4, 20, 29, 29, 223414);58910;(4, 20, 29, 9, 58910);אהרן;2;9;ויראו כל העדה כי גוע אהרן ויבכו את אהרן שלשים יום כל בית ישראל
(285910, 96, 4);200;ר;223510;(4, 21, 2, 12, 223510);58934;(4, 21, 2, 3, 58934);נדר;3;3;וידר ישראל נדר ליהוה ויאמר אם נתן תתן את העם הזה בידי והחרמתי את עריהם
(285910, 96, 4);1;א;223606;(4, 21, 3, 52, 223606);58958;(4, 21, 3, 12, 58958);ויקרא;5;12;וישמע יהוה בקול ישראל ויתן את הכנעני ויחרם אתהם ואת עריהם ויקרא שם המקום חרמה
(285910, 96, 4);6;ו;223702;(4, 21, 5, 38, 223702);58983;(4, 21, 5, 8, 58983);למות;3;8;וידבר העם באלהים ובמשה למה העליתנו ממצרים למות במדבר כי אין לחם ואין מים ונפשנו קצה בלחם הקלקל
(285910, 96, 4);70;ע;223798;(4, 21, 7, 6, 223798);59008;(4, 21, 7, 2, 59008);העם;2;2;ויבא העם אל משה ויאמרו חטאנו כי דברנו ביהוה ובך התפלל אל יהוה ויסר מעלינו את הנחש ויתפלל משה בעד העם
(285910, 96, 4);80;ף;223894;(4, 21, 8, 22, 223894);59034;(4, 21, 8, 7, 59034);שרף;3;7;ויאמר יהוה אל משה עשה לך שרף ושים אתו על נס והיה כל הנשוך וראה אתו וחי
(285910, 96, 4);60;ס;223990;(4, 21, 10, 3, 223990);59063;(4, 21, 10, 1, 59063);ויסעו;3;1;ויסעו בני ישראל ויחנו באבת
(285910, 96, 4);6;ו;224086;(4, 21, 13, 8, 224086);59087;(4, 21, 13, 3, 59087);ויחנו;1;3;משם נסעו ויחנו מעבר ארנון אשר במדבר היצא מגבל האמרי כי ארנון גבול מואב בין מואב ובין האמרי
(285910, 96, 4);5;ה;224182;(4, 21, 14, 31, 224182);59111;(4, 21, 14, 9, 59111);בסופה;5;9;על כן יאמר בספר מלחמת יהוה את והב בסופה ואת הנחלים ארנון
(285910, 96, 4);40;מ;224278;(4, 21, 16, 46, 224278);59137;(4, 21, 16, 14, 59137);מים;1;14;ומשם בארה הוא הבאר אשר אמר יהוה למשה אסף את העם ואתנה להם מים
(285910, 96, 4);50;נ;224374;(4, 21, 19, 15, 224374);59160;(4, 21, 19, 3, 59160);ומנחליאל;3;3;וממתנה נחליאל ומנחליאל במות
(285910, 96, 4);1;א;224470;(4, 21, 22, 7, 224470);59182;(4, 21, 22, 2, 59182);בארצך;2;2;אעברה בארצך לא נטה בשדה ובכרם לא נשתה מי באר בדרך המלך נלך עד אשר נעבר גבלך
(285910, 96, 4);90;צ;224566;(4, 21, 23, 44, 224566);59210;(4, 21, 23, 13, 59210);ויצא;3;13;ולא נתן סיחן את ישראל עבר בגבלו ויאסף סיחן את כל עמו ויצא לקראת ישראל המדברה ויבא יהצה וילחם בישראל
(285910, 96, 4);6;ו;224662;(4, 21, 24, 60, 224662);59235;(4, 21, 24, 18, 59235);עמון;3;18;ויכהו ישראל לפי חרב ויירש את ארצו מארנן עד יבק עד בני עמון כי עז גבול בני עמון
(285910, 96, 4);40;מ;224758;(4, 21, 26, 38, 224758);59260;(4, 21, 26, 11, 59260);מואב;1;11;כי חשבון עיר סיחן מלך האמרי הוא והוא נלחם במלך מואב הראשון ויקח את כל ארצו מידו עד ארנן
(285910, 96, 4);60;ס;224854;(4, 21, 28, 24, 224854);59285;(4, 21, 28, 7, 59285);סיחן;1;7;כי אש יצאה מחשבון להבה מקרית סיחן אכלה ער מואב בעלי במות ארנן
(285910, 96, 4);4;ד;224950;(4, 21, 30, 16, 224950);59310;(4, 21, 30, 5, 59310);דיבן;1;5;ונירם אבד חשבון עד דיבן ונשים עד נפח אשר עד מידבא
(285910, 96, 4);30;ל;225046;(4, 21, 33, 9, 225046);59334;(4, 21, 33, 2, 59334);ויעלו;4;2;ויפנו ויעלו דרך הבשן ויצא עוג מלך הבשן לקראתם הוא וכל עמו למלחמה אדרעי
(285910, 96, 4);1;א;225142;(4, 21, 34, 48, 225142);59362;(4, 21, 34, 16, 59362);ארצו;1;16;ויאמר יהוה אל משה אל תירא אתו כי בידך נתתי אתו ואת כל עמו ואת ארצו ועשית לו כאשר עשית לסיחן מלך האמרי אשר יושב בחשבון
(285910, 96, 4);6;ו;225238;(4, 22, 1, 1, 225238);59388;(4, 22, 1, 1, 59388);ויסעו;1;1;ויסעו בני ישראל ויחנו בערבות מואב מעבר לירדן ירחו
(285910, 96, 4);5;ה;225334;(4, 22, 3, 23, 225334);59414;(4, 22, 3, 8, 59414);הוא;1;8;ויגר מואב מפני העם מאד כי רב הוא ויקץ מואב מפני בני ישראל
(285910, 96, 4);30;ל;225430;(4, 22, 4, 74, 225430);59440;(4, 22, 4, 21, 59440);למואב;1;21;ויאמר מואב אל זקני מדין עתה ילחכו הקהל את כל סביבתינו כלחך השור את ירק השדה ובלק בן צפור מלך למואב בעת ההוא
(285910, 96, 4);90;ץ;225526;(4, 22, 5, 85, 225526);59467;(4, 22, 5, 25, 59467);הארץ;4;25;וישלח מלאכים אל בלעם בן בעור פתורה אשר על הנהר ארץ בני עמו לקרא לו לאמר הנה עם יצא ממצרים הנה כסה את עין הארץ והוא ישב ממלי
(285910, 96, 4);200;ר;225622;(4, 22, 6, 85, 225622);59496;(4, 22, 6, 26, 59496);ואשר;4;26;ועתה לכה נא ארה לי את העם הזה כי עצום הוא ממני אולי אוכל נכה בו ואגרשנו מן הארץ כי ידעתי את אשר תברך מברך ואשר תאר יואר
(285910, 96, 4);400;ת;225718;(4, 22, 8, 29, 225718);59519;(4, 22, 8, 7, 59519);אתכם;2;7;ויאמר אליהם לינו פה הלילה והשבתי אתכם דבר כאשר ידבר יהוה אלי וישבו שרי מואב עם בלעם
(285910, 96, 4);90;צ;225814;(4, 22, 10, 23, 225814);59545;(4, 22, 10, 7, 59545);צפר;1;7;ויאמר בלעם אל האלהים בלק בן צפר מלך מואב שלח אלי
(285910, 96, 4);40;ם;225910;(4, 22, 12, 16, 225910);59571;(4, 22, 12, 4, 59571);בלעם;4;4;ויאמר אלהים אל בלעם לא תלך עמהם לא תאר את העם כי ברוך הוא
(285910, 96, 4);1;א;226006;(4, 22, 14, 12, 226006);59600;(4, 22, 14, 3, 59600);מואב;3;3;ויקומו שרי מואב ויבאו אל בלק ויאמרו מאן בלעם הלך עמנו
(285910, 96, 4);200;ר;226102;(4, 22, 16, 33, 226102);59626;(4, 22, 16, 10, 59626);צפור;4;10;ויבאו אל בלעם ויאמרו לו כה אמר בלק בן צפור אל נא תמנע מהלך אלי
(285910, 96, 4);100;ק;226198;(4, 22, 18, 32, 226198);59657;(4, 22, 18, 10, 59657);בלק;3;10;ויען בלעם ויאמר אל עבדי בלק אם יתן לי בלק מלא ביתו כסף וזהב לא אוכל לעבר את פי יהוה אלהי לעשות קטנה או גדולה
(285910, 96, 4);10;י;226294;(4, 22, 20, 2, 226294);59686;(4, 22, 20, 1, 59686);ויבא;2;1;ויבא אלהים אל בלעם לילה ויאמר לו אם לקרא לך באו האנשים קום לך אתם ואך את הדבר אשר אדבר אליך אתו תעשה
(285910, 96, 4);1;א;226390;(4, 22, 21, 20, 226390);59714;(4, 22, 21, 6, 59714);אתנו;1;6;ויקם בלעם בבקר ויחבש את אתנו וילך עם שרי מואב
(285910, 96, 4);400;ת;226486;(4, 22, 23, 11, 226486);59740;(4, 22, 23, 3, 59740);את;2;3;ותרא האתון את מלאך יהוה נצב בדרך וחרבו שלופה בידו ותט האתון מן הדרך ותלך בשדה ויך בלעם את האתון להטתה הדרך
(285910, 96, 4);200;ר;226582;(4, 22, 24, 22, 226582);59764;(4, 22, 24, 5, 59764);הכרמים;3;5;ויעמד מלאך יהוה במשעול הכרמים גדר מזה וגדר מזה
(285910, 96, 4);40;מ;226678;(4, 22, 26, 21, 226678);59789;(4, 22, 26, 5, 59789);ויעמד;4;5;ויוסף מלאך יהוה עבור ויעמד במקום צר אשר אין דרך לנטות ימין ושמאול
(285910, 96, 4);5;ה;226774;(4, 22, 28, 9, 226774);59814;(4, 22, 28, 2, 59814);יהוה;4;2;ויפתח יהוה את פי האתון ותאמר לבלעם מה עשיתי לך כי הכיתני זה שלש רגלים
(285910, 96, 4);40;מ;226870;(4, 22, 30, 4, 226870);59841;(4, 22, 30, 1, 59841);ותאמר;4;1;ותאמר האתון אל בלעם הלוא אנכי אתנך אשר רכבת עלי מעודך עד היום הזה ההסכן הסכנתי לעשות לך כה ויאמר לא
(285910, 96, 4);200;ר;226966;(4, 22, 31, 21, 226966);59867;(4, 22, 31, 6, 59867);וירא;3;6;ויגל יהוה את עיני בלעם וירא את מלאך יהוה נצב בדרך וחרבו שלפה בידו ויקד וישתחו לאפיו
(285910, 96, 4);10;י;227062;(4, 22, 32, 50, 227062);59893;(4, 22, 32, 15, 59893);יצאתי;1;15;ויאמר אליו מלאך יהוה על מה הכית את אתנך זה שלוש רגלים הנה אנכי יצאתי לשטן כי ירט הדרך לנגדי
(285910, 96, 4);30;ל;227158;(4, 22, 34, 7, 227158);59917;(4, 22, 34, 2, 59917);בלעם;2;2;ויאמר בלעם אל מלאך יהוה חטאתי כי לא ידעתי כי אתה נצב לקראתי בדרך ועתה אם רע בעיניך אשובה לי
(285910, 96, 4);1;א;227254;(4, 22, 35, 31, 227254);59944;(4, 22, 35, 9, 59944);ואפס;2;9;ויאמר מלאך יהוה אל בלעם לך עם האנשים ואפס את הדבר אשר אדבר אליך אתו תדבר וילך בלעם עם שרי בלק
(285910, 96, 4);90;צ;227350;(4, 22, 36, 54, 227350);59972;(4, 22, 36, 16, 59972);בקצה;3;16;וישמע בלק כי בא בלעם ויצא לקראתו אל עיר מואב אשר על גבול ארנן אשר בקצה הגבול
(285910, 96, 4);5;ה;227446;(4, 22, 38, 28, 227446);59999;(4, 22, 38, 8, 59999);עתה;3;8;ויאמר בלעם אל בלק הנה באתי אליך עתה היכל אוכל דבר מאומה הדבר אשר ישים אלהים בפי אתו אדבר
(285910, 96, 4);300;ש;227542;(4, 22, 40, 28, 227542);60024;(4, 22, 40, 7, 60024);ולשרים;3;7;ויזבח בלק בקר וצאן וישלח לבלעם ולשרים אשר אתו
(285910, 96, 4);5;ה;227638;(4, 23, 1, 40, 227638);60051;(4, 23, 1, 12, 60051);בזה;3;12;ויאמר בלעם אל בלק בנה לי בזה שבעה מזבחת והכן לי בזה שבעה פרים ושבעה אילים
(285910, 96, 4);5;ה;227734;(4, 23, 3, 37, 227734);60075;(4, 23, 3, 9, 60075);יקרה;4;9;ויאמר בלעם לבלק התיצב על עלתך ואלכה אולי יקרה יהוה לקראתי ודבר מה יראני והגדתי לך וילך שפי
(285910, 96, 4);40;ם;227830;(4, 23, 5, 4, 227830);60099;(4, 23, 5, 1, 60099);וישם;4;1;וישם יהוה דבר בפי בלעם ויאמר שוב אל בלק וכה תדבר
(285910, 96, 4);30;ל;227926;(4, 23, 7, 28, 227926);60127;(4, 23, 7, 8, 60127);מלך;2;8;וישא משלו ויאמר מן ארם ינחני בלק מלך מואב מהררי קדם לכה ארה לי יעקב ולכה זעמה ישראל
(285910, 96, 4);50;ן;228022;(4, 23, 9, 30, 228022);60154;(4, 23, 9, 7, 60154);הן;2;7;כי מראש צרים אראנו ומגבעות אשורנו הן עם לבדד ישכן ובגוים לא יתחשב
(285910, 96, 4);70;ע;228118;(4, 23, 11, 17, 228118);60181;(4, 23, 11, 6, 60181);עשית;1;6;ויאמר בלק אל בלעם מה עשית לי לקב איבי לקחתיך והנה ברכת ברך
(285910, 96, 4);200;ר;228214;(4, 23, 13, 28, 228214);60208;(4, 23, 13, 9, 60208);אחר;3;9;ויאמר אליו בלק לך נא אתי אל מקום אחר אשר תראנו משם אפס קצהו תראה וכלו לא תראה וקבנו לי משם
(285910, 96, 4);1;א;228310;(4, 23, 15, 3, 228310);60234;(4, 23, 15, 1, 60234);ויאמר;3;1;ויאמר אל בלק התיצב כה על עלתך ואנכי אקרה כה
(285910, 96, 4);400;ת;228406;(4, 23, 17, 20, 228406);60262;(4, 23, 17, 6, 60262);עלתו;3;6;ויבא אליו והנו נצב על עלתו ושרי מואב אתו ויאמר לו בלק מה דבר יהוה
(285910, 96, 4);6;ו;228502;(4, 23, 19, 27, 228502);60289;(4, 23, 19, 8, 60289);ההוא;3;8;לא איש אל ויכזב ובן אדם ויתנחם ההוא אמר ולא יעשה ודבר ולא יקימנה
(285910, 96, 4);40;מ;228598;(4, 23, 21, 48, 228598);60314;(4, 23, 21, 13, 60314);מלך;1;13;לא הביט און ביעקב ולא ראה עמל בישראל יהוה אלהיו עמו ותרועת מלך בו
(285910, 96, 4);200;ר;228694;(4, 23, 24, 17, 228694);60340;(4, 23, 24, 5, 60340);וכארי;4;5;הן עם כלביא יקום וכארי יתנשא לא ישכב עד יאכל טרף ודם חללים ישתה
(285910, 96, 4);400;ת;228790;(4, 23, 26, 25, 228790);60368;(4, 23, 26, 7, 60368);דברתי;4;7;ויען בלעם ויאמר אל בלק הלא דברתי אליך לאמר כל אשר ידבר יהוה אתו אעשה
(285910, 96, 4);30;ל;228886;(4, 23, 28, 6, 228886);60395;(4, 23, 28, 2, 60395);בלק;2;2;ויקח בלק את בלעם ראש הפעור הנשקף על פני הישימן
(285910, 96, 4);20;כ;228982;(4, 23, 30, 8, 228982);60422;(4, 23, 30, 3, 60422);כאשר;1;3;ויעש בלק כאשר אמר בלעם ויעל פר ואיל במזבח
(285910, 96, 4);10;י;229078;(4, 24, 1, 71, 229078);60447;(4, 24, 1, 19, 60447);פניו;3;19;וירא בלעם כי טוב בעיני יהוה לברך את ישראל ולא הלך כפעם בפעם לקראת נחשים וישת אל המדבר פניו
(285910, 96, 4);40;ם;229174;(4, 24, 4, 3, 229174);60472;(4, 24, 4, 1, 60472);נאם;3;1;נאם שמע אמרי אל אשר מחזה שדי יחזה נפל וגלוי עינים
(285910, 96, 4);20;כ;229270;(4, 24, 6, 34, 229270);60497;(4, 24, 6, 9, 60497);כארזים;1;9;כנחלים נטיו כגנת עלי נהר כאהלים נטע יהוה כארזים עלי מים
(285910, 96, 4);70;ע;229366;(4, 24, 8, 39, 229366);60520;(4, 24, 8, 10, 60520);ועצמתיהם;2;10;אל מוציאו ממצרים כתועפת ראם לו יאכל גוים צריו ועצמתיהם יגרם וחציו ימחץ
(285910, 96, 4);30;ל;229462;(4, 24, 10, 33, 229462);60543;(4, 24, 10, 10, 60543);בלק;2;10;ויחר אף בלק אל בלעם ויספק את כפיו ויאמר בלק אל בלעם לקב איבי קראתיך והנה ברכת ברך זה שלש פעמים
(285910, 96, 4);40;ם;229558;(4, 24, 12, 9, 229558);60568;(4, 24, 12, 2, 60568);בלעם;4;2;ויאמר בלעם אל בלק הלא גם אל מלאכיך אשר שלחת אלי דברתי לאמר
(285910, 96, 4);2;ב;229654;(4, 24, 13, 59, 229654);60598;(4, 24, 13, 19, 60598);מלבי;3;19;אם יתן לי בלק מלא ביתו כסף וזהב לא אוכל לעבר את פי יהוה לעשות טובה או רעה מלבי אשר ידבר יהוה אתו אדבר
(285910, 96, 4);70;ע;229750;(4, 24, 15, 25, 229750);60623;(4, 24, 15, 7, 60623);בער;2;7;וישא משלו ויאמר נאם בלעם בנו בער ונאם הגבר שתם העין
(285910, 96, 4);40;מ;229846;(4, 24, 17, 32, 229846);60649;(4, 24, 17, 9, 60649);מיעקב;1;9;אראנו ולא עתה אשורנו ולא קרוב דרך כוכב מיעקב וקם שבט מישראל ומחץ פאתי מואב וקרקר כל בני שת
(285910, 96, 4);4;ד;229942;(4, 24, 19, 15, 229942);60672;(4, 24, 19, 3, 60672);והאביד;6;3;וירד מיעקב והאביד שריד מעיר
(285910, 96, 4);60;ס;230038;(4, 24, 21, 39, 230038);60696;(4, 24, 21, 10, 60696);בסלע;2;10;וירא את הקיני וישא משלו ויאמר איתן מושבך ושים בסלע קנך
(285910, 96, 4);1;א;230134;(4, 24, 24, 36, 230134);60725;(4, 24, 24, 11, 60725);אבד;1;11;וצים מיד כתים וענו אשור וענו עבר וגם הוא עדי אבד
(285910, 96, 4);1;א;230230;(4, 25, 2, 23, 230230);60748;(4, 25, 2, 5, 60748);ויאכל;3;5;ותקראן לעם לזבחי אלהיהן ויאכל העם וישתחוו לאלהיהן
(285910, 96, 4);3;ג;230326;(4, 25, 4, 43, 230326);60772;(4, 25, 4, 13, 60772);נגד;2;13;ויאמר יהוה אל משה קח את כל ראשי העם והוקע אותם ליהוה נגד השמש וישב חרון אף יהוה מישראל
(285910, 96, 4);30;ל;230422;(4, 25, 6, 25, 230422);60796;(4, 25, 6, 7, 60796);אל;2;7;והנה איש מבני ישראל בא ויקרב אל אחיו את המדינית לעיני משה ולעיני כל עדת בני ישראל והמה בכים פתח אהל מועד
(285910, 96, 4);5;ה;230518;(4, 25, 7, 38, 230518);60821;(4, 25, 7, 10, 60821);העדה;4;10;וירא פינחס בן אלעזר בן אהרן הכהן ויקם מתוך העדה ויקח רמח בידו
(285910, 96, 4);400;ת;230614;(4, 25, 9, 8, 230614);60847;(4, 25, 9, 2, 60847);המתים;3;2;ויהיו המתים במגפה ארבעה ועשרים אלף
(285910, 96, 4);400;ת;230710;(4, 25, 11, 57, 230710);60872;(4, 25, 11, 16, 60872);בתוכם;2;16;פינחס בן אלעזר בן אהרן הכהן השיב את חמתי מעל בני ישראל בקנאו את קנאתי בתוכם ולא כליתי את בני ישראל בקנאתי
(285910, 96, 4);5;ה;230806;(4, 25, 13, 43, 230806);60897;(4, 25, 13, 11, 60897);לאלהיו;4;11;והיתה לו ולזרעו אחריו ברית כהנת עולם תחת אשר קנא לאלהיו ויכפר על בני ישראל
(285910, 96, 4);400;ת;230902;(4, 25, 15, 24, 230902);60922;(4, 25, 15, 6, 60922);בת;2;6;ושם האשה המכה המדינית כזבי בת צור ראש אמות בית אב במדין הוא
(285910, 96, 4);4;ד;230998;(4, 25, 18, 32, 230998);60949;(4, 25, 18, 10, 60949);דבר;1;10;כי צררים הם לכם בנכליהם אשר נכלו לכם על דבר פעור ועל דבר כזבי בת נשיא מדין אחתם המכה ביום המגפה על דבר פעור
(285910, 96, 4);5;ה;231094;(4, 26, 1, 31, 231094);60975;(4, 26, 1, 9, 60975);הכהן;3;9;ויאמר יהוה אל משה ואל אלעזר בן אהרן הכהן לאמר
(285910, 96, 4);30;ל;231190;(4, 26, 3, 32, 231190);61001;(4, 26, 3, 8, 61001);על;2;8;וידבר משה ואלעזר הכהן אתם בערבת מואב על ירדן ירחו לאמר
(285910, 96, 4);300;ש;231286;(4, 26, 5, 28, 231286);61025;(4, 26, 5, 7, 61025);משפחת;2;7;ראובן בכור ישראל בני ראובן חנוך משפחת החנכי לפלוא משפחת הפלאי
