(179668, -95, 4);200;ר;77828;(1, 50, 23, 3, 77828);20552;(1, 50, 23, 1, 20552);וירא;3;1;וירא יוסף לאפרים בני שלשים גם בני מכיר בן מנשה ילדו על ברכי יוסף
(179668, -95, 4);40;ם;77923;(1, 50, 24, 47, 77923);20577;(1, 50, 24, 12, 20577);אתכם;4;12;ויאמר יוסף אל אחיו אנכי מת ואלהים פקד יפקד אתכם והעלה אתכם מן הארץ הזאת אל הארץ אשר נשבע לאברהם ליצחק וליעקב
(179668, -95, 4);5;ה;78018;(1, 50, 25, 55, 78018);20601;(1, 50, 25, 14, 20601);מזה;3;14;וישבע יוסף את בני ישראל לאמר פקד יפקד אלהים אתכם והעלתם את עצמתי מזה
(179668, -95, 4);50;ן;78113;(2, 1, 2, 5, 78113);20624;(2, 1, 2, 1, 20624);ראובן;5;1;ראובן שמעון לוי ויהודה
(179668, -95, 4);6;ו;78208;(2, 1, 6, 9, 78208);20648;(2, 1, 6, 3, 20648);וכל;1;3;וימת יוסף וכל אחיו וכל הדור ההוא
(179668, -95, 4);60;ס;78303;(2, 1, 8, 30, 78303);20673;(2, 1, 8, 10, 20673);יוסף;3;10;ויקם מלך חדש על מצרים אשר לא ידע את יוסף
(179668, -95, 4);6;ו;78398;(2, 1, 10, 60, 78398);20699;(2, 1, 10, 16, 20699);בנו;3;16;הבה נתחכמה לו פן ירבה והיה כי תקראנה מלחמה ונוסף גם הוא על שנאינו ונלחם בנו ועלה מן הארץ
(179668, -95, 4);80;פ;78493;(2, 1, 12, 23, 78493);20724;(2, 1, 12, 7, 20724);יפרץ;2;7;וכאשר יענו אתו כן ירבה וכן יפרץ ויקצו מפני בני ישראל
(179668, -95, 4);4;ד;78588;(2, 1, 14, 51, 78588);20747;(2, 1, 14, 13, 20747);עבדתם;3;13;וימררו את חייהם בעבדה קשה בחמר ובלבנים ובכל עבדה בשדה את כל עבדתם אשר עבדו בהם בפרך
(179668, -95, 4);5;ה;78683;(2, 1, 16, 29, 78683);20770;(2, 1, 16, 7, 20770);האבנים;1;7;ויאמר בילדכן את העבריות וראיתן על האבנים אם בן הוא והמתן אתו ואם בת הוא וחיה
(179668, -95, 4);100;ק;78778;(2, 1, 18, 3, 78778);20794;(2, 1, 18, 1, 20794);ויקרא;3;1;ויקרא מלך מצרים למילדת ויאמר להן מדוע עשיתן הדבר הזה ותחיין את הילדים
(179668, -95, 4);10;י;78873;(2, 1, 19, 41, 78873);20816;(2, 1, 19, 10, 20816);כי;2;10;ותאמרן המילדת אל פרעה כי לא כנשים המצרית העברית כי חיות הנה בטרם תבוא אלהן המילדת וילדו
(179668, -95, 4);400;ת;78968;(2, 1, 21, 33, 78968);20839;(2, 1, 21, 9, 20839);בתים;2;9;ויהי כי יראו המילדת את האלהים ויעש להם בתים
(179668, -95, 4);200;ר;79063;(2, 2, 2, 17, 79063);20865;(2, 2, 2, 5, 20865);ותרא;3;5;ותהר האשה ותלד בן ותרא אתו כי טוב הוא ותצפנהו שלשה ירחים
(179668, -95, 4);80;פ;79158;(2, 2, 3, 67, 79158);20891;(2, 2, 3, 19, 20891);שפת;2;19;ולא יכלה עוד הצפינו ותקח לו תבת גמא ותחמרה בחמר ובזפת ותשם בה את הילד ותשם בסוף על שפת היאר
(179668, -95, 4);1;א;79253;(2, 2, 5, 65, 79253);20918;(2, 2, 5, 19, 20918);אמתה;1;19;ותרד בת פרעה לרחץ על היאר ונערתיה הלכת על יד היאר ותרא את התבה בתוך הסוף ותשלח את אמתה ותקחה
(179668, -95, 4);40;מ;79348;(2, 2, 7, 33, 79348);20942;(2, 2, 7, 10, 20942);מינקת;1;10;ותאמר אחתו אל בת פרעה האלך וקראתי לך אשה מינקת מן העברית ותינק לך את הילד
(179668, -95, 4);50;נ;79443;(2, 2, 9, 32, 79443);20968;(2, 2, 9, 9, 20968);והינקהו;4;9;ותאמר לה בת פרעה היליכי את הילד הזה והינקהו לי ואני אתן את שכרך ותקח האשה הילד ותניקהו
(179668, -95, 4);10;י;79538;(2, 2, 10, 58, 79538);20993;(2, 2, 10, 16, 20993);משיתהו;3;16;ויגדל הילד ותבאהו לבת פרעה ויהי לה לבן ותקרא שמו משה ותאמר כי מן המים משיתהו
(179668, -95, 4);400;ת;79633;(2, 2, 12, 26, 79633);21019;(2, 2, 12, 9, 21019);את;2;9;ויפן כה וכה וירא כי אין איש ויך את המצרי ויטמנהו בחול
(179668, -95, 4);5;ה;79728;(2, 2, 14, 28, 79728);21043;(2, 2, 14, 8, 21043);הלהרגני;3;8;ויאמר מי שמך לאיש שר ושפט עלינו הלהרגני אתה אמר כאשר הרגת את המצרי ויירא משה ויאמר אכן נודע הדבר
(179668, -95, 4);200;ר;79823;(2, 2, 15, 46, 79823);21068;(2, 2, 15, 13, 21068);פרעה;2;13;וישמע פרעה את הדבר הזה ויבקש להרג את משה ויברח משה מפני פרעה וישב בארץ מדין וישב על הבאר
(179668, -95, 4);200;ר;79918;(2, 2, 17, 14, 79918);21089;(2, 2, 17, 3, 21089);ויגרשום;4;3;ויבאו הרעים ויגרשום ויקם משה ויושען וישק את צאנם
(179668, -95, 4);4;ד;80013;(2, 2, 19, 31, 80013);21112;(2, 2, 19, 8, 21112);דלה;1;8;ותאמרן איש מצרי הצילנו מיד הרעים וגם דלה דלה לנו וישק את הצאן
(179668, -95, 4);6;ו;80108;(2, 2, 21, 31, 80108);21139;(2, 2, 21, 9, 21139);בתו;3;9;ויואל משה לשבת את האיש ויתן את צפרה בתו למשה
(179668, -95, 4);5;ה;80203;(2, 2, 23, 50, 80203);21164;(2, 2, 23, 12, 21164);העבדה;5;12;ויהי בימים הרבים ההם וימת מלך מצרים ויאנחו בני ישראל מן העבדה ויזעקו ותעל שועתם אל האלהים מן העבדה
(179668, -95, 4);400;ת;80298;(2, 2, 25, 11, 80298);21188;(2, 2, 25, 3, 21188);את;2;3;וירא אלהים את בני ישראל וידע אלהים
(179668, -95, 4);6;ו;80393;(2, 3, 2, 11, 80393);21214;(2, 3, 2, 3, 21214);יהוה;3;3;וירא מלאך יהוה אליו בלבת אש מתוך הסנה וירא והנה הסנה בער באש והסנה איננו אכל
(179668, -95, 4);60;ס;80488;(2, 3, 3, 45, 80488);21240;(2, 3, 3, 13, 21240);הסנה;2;13;ויאמר משה אסרה נא ואראה את המראה הגדל הזה מדוע לא יבער הסנה
(179668, -95, 4);100;ק;80583;(2, 3, 5, 34, 80583);21265;(2, 3, 5, 10, 21265);המקום;3;10;ויאמר אל תקרב הלם של נעליך מעל רגליך כי המקום אשר אתה עומד עליו אדמת קדש הוא
(179668, -95, 4);1;א;80678;(2, 3, 6, 69, 80678);21290;(2, 3, 6, 18, 21290);האלהים;2;18;ויאמר אנכי אלהי אביך אלהי אברהם אלהי יצחק ואלהי יעקב ויסתר משה פניו כי ירא מהביט אל האלהים
(179668, -95, 4);30;ל;80773;(2, 3, 8, 20, 80773);21313;(2, 3, 8, 5, 21313);ולהעלתו;2;5;וארד להצילו מיד מצרים ולהעלתו מן הארץ ההוא אל ארץ טובה ורחבה אל ארץ זבת חלב ודבש אל מקום הכנעני והחתי והאמרי והפרזי והחוי והיבוסי
(179668, -95, 4);100;ק;80868;(2, 3, 9, 10, 80868);21336;(2, 3, 9, 3, 21336);צעקת;3;3;ועתה הנה צעקת בני ישראל באה אלי וגם ראיתי את הלחץ אשר מצרים לחצים אתם
(179668, -95, 4);300;ש;80963;(2, 3, 11, 7, 80963);21361;(2, 3, 11, 2, 21361);משה;2;2;ויאמר משה אל האלהים מי אנכי כי אלך אל פרעה וכי אוציא את בני ישראל ממצרים
(179668, -95, 4);5;ה;81058;(2, 3, 12, 45, 81058);21388;(2, 3, 12, 13, 21388);העם;1;13;ויאמר כי אהיה עמך וזה לך האות כי אנכי שלחתיך בהוציאך את העם ממצרים תעבדון את האלהים על ההר הזה
(179668, -95, 4);40;ם;81153;(2, 3, 13, 65, 81153);21411;(2, 3, 13, 16, 21411);אליכם;5;16;ויאמר משה אל האלהים הנה אנכי בא אל בני ישראל ואמרתי להם אלהי אבותיכם שלחני אליכם ואמרו לי מה שמו מה אמר אלהם
(179668, -95, 4);1;א;81248;(2, 3, 15, 14, 81248);21437;(2, 3, 15, 4, 21437);אל;1;4;ויאמר עוד אלהים אל משה כה תאמר אל בני ישראל יהוה אלהי אבתיכם אלהי אברהם אלהי יצחק ואלהי יעקב שלחני אליכם זה שמי לעלם וזה זכרי לדר דר
(179668, -95, 4);1;א;81343;(2, 3, 16, 4, 81343);21463;(2, 3, 16, 2, 21463);ואספת;2;2;לך ואספת את זקני ישראל ואמרת אלהם יהוה אלהי אבתיכם נראה אלי אלהי אברהם יצחק ויעקב לאמר פקד פקדתי אתכם ואת העשוי לכם במצרים
(179668, -95, 4);40;ם;81438;(2, 3, 16, 99, 81438);21485;(2, 3, 16, 24, 21485);במצרים;6;24;לך ואספת את זקני ישראל ואמרת אלהם יהוה אלהי אבתיכם נראה אלי אלהי אברהם יצחק ויעקב לאמר פקד פקדתי אתכם ואת העשוי לכם במצרים
(179668, -95, 4);100;ק;81533;(2, 3, 18, 19, 81533);21508;(2, 3, 18, 5, 21508);וזקני;3;5;ושמעו לקלך ובאת אתה וזקני ישראל אל מלך מצרים ואמרתם אליו יהוה אלהי העבריים נקרה עלינו ועתה נלכה נא דרך שלשת ימים במדבר ונזבחה ליהוה אלהינו
(179668, -95, 4);6;ו;81628;(2, 3, 19, 1, 81628);21530;(2, 3, 19, 1, 21530);ואני;1;1;ואני ידעתי כי לא יתן אתכם מלך מצרים להלך ולא ביד חזקה
(179668, -95, 4);300;ש;81723;(2, 3, 20, 54, 81723);21555;(2, 3, 20, 14, 21555);ישלח;2;14;ושלחתי את ידי והכיתי את מצרים בכל נפלאתי אשר אעשה בקרבו ואחרי כן ישלח אתכם
(179668, -95, 4);300;ש;81818;(2, 3, 22, 43, 81818);21580;(2, 3, 22, 11, 21580);ושמתם;2;11;ושאלה אשה משכנתה ומגרת ביתה כלי כסף וכלי זהב ושמלת ושמתם על בניכם ועל בנתיכם ונצלתם את מצרים
(179668, -95, 4);200;ר;81913;(2, 4, 2, 5, 81913);21604;(2, 4, 2, 1, 21604);ויאמר;5;1;ויאמר אליו יהוה מזה בידך ויאמר מטה
(179668, -95, 4);2;ב;82008;(2, 4, 4, 25, 82008);21628;(2, 4, 4, 8, 21628);בזנבו;1;8;ויאמר יהוה אל משה שלח ידך ואחז בזנבו וישלח ידו ויחזק בו ויהי למטה בכפו
(179668, -95, 4);10;י;82103;(2, 4, 6, 6, 82103);21651;(2, 4, 6, 2, 21651);יהוה;1;2;ויאמר יהוה לו עוד הבא נא ידך בחיקך ויבא ידו בחיקו ויוצאה והנה ידו מצרעת כשלג
(179668, -95, 4);100;ק;82198;(2, 4, 7, 40, 82198);21676;(2, 4, 7, 11, 21676);מחיקו;4;11;ויאמר השב ידך אל חיקך וישב ידו אל חיקו ויוצאה מחיקו והנה שבה כבשרו
(179668, -95, 4);1;א;82293;(2, 4, 9, 27, 82293);21701;(2, 4, 9, 8, 21701);האלה;2;8;והיה אם לא יאמינו גם לשני האתות האלה ולא ישמעון לקלך ולקחת ממימי היאר ושפכת היבשה והיו המים אשר תקח מן היאר והיו לדם ביבשת
(179668, -95, 4);10;י;82388;(2, 4, 10, 24, 82388);21726;(2, 4, 10, 8, 21726);איש;2;8;ויאמר משה אל יהוה בי אדני לא איש דברים אנכי גם מתמול גם משלשם גם מאז דברך אל עבדך כי כבד פה וכבד לשון אנכי
(179668, -95, 4);8;ח;82483;(2, 4, 11, 37, 82483);21756;(2, 4, 11, 13, 21756);חרש;1;13;ויאמר יהוה אליו מי שם פה לאדם או מי ישום אלם או חרש או פקח או עור הלא אנכי יהוה
(179668, -95, 4);5;ה;82578;(2, 4, 14, 14, 82578);21783;(2, 4, 14, 4, 21783);במשה;4;4;ויחר אף יהוה במשה ויאמר הלא אהרן אחיך הלוי ידעתי כי דבר ידבר הוא וגם הנה הוא יצא לקראתך וראך ושמח בלבו
(179668, -95, 4);50;נ;82673;(2, 4, 15, 28, 82673);21808;(2, 4, 15, 7, 21808);ואנכי;3;7;ודברת אליו ושמת את הדברים בפיו ואנכי אהיה עם פיך ועם פיהו והוריתי אתכם את אשר תעשון
(179668, -95, 4);5;ה;82768;(2, 4, 17, 10, 82768);21835;(2, 4, 17, 3, 21835);הזה;3;3;ואת המטה הזה תקח בידך אשר תעשה בו את האתת
(179668, -95, 4);10;י;82863;(2, 4, 18, 73, 82863);21862;(2, 4, 18, 20, 21862);יתרו;1;20;וילך משה וישב אל יתר חתנו ויאמר לו אלכה נא ואשובה אל אחי אשר במצרים ואראה העודם חיים ויאמר יתרו למשה לך לשלום
(179668, -95, 4);70;ע;82958;(2, 4, 20, 27, 82958);21888;(2, 4, 20, 8, 21888);על;1;8;ויקח משה את אשתו ואת בניו וירכבם על החמר וישב ארצה מצרים ויקח משה את מטה האלהים בידו
(179668, -95, 4);10;י;83053;(2, 4, 21, 55, 83053);21912;(2, 4, 21, 14, 21912);ועשיתם;4;14;ויאמר יהוה אל משה בלכתך לשוב מצרימה ראה כל המפתים אשר שמתי בידך ועשיתם לפני פרעה ואני אחזק את לבו ולא ישלח את העם
(179668, -95, 4);50;ן;83148;(2, 4, 23, 28, 83148);21938;(2, 4, 23, 7, 21938);ותמאן;5;7;ואמר אליך שלח את בני ויעבדני ותמאן לשלחו הנה אנכי הרג את בנך בכרך
(179668, -95, 4);1;א;83243;(2, 4, 25, 37, 83243);21962;(2, 4, 25, 10, 21962);ותאמר;3;10;ותקח צפרה צר ותכרת את ערלת בנה ותגע לרגליו ותאמר כי חתן דמים אתה לי
(179668, -95, 4);10;י;83338;(2, 4, 27, 53, 83338);21987;(2, 4, 27, 13, 21987);וישק;2;13;ויאמר יהוה אל אהרן לך לקראת משה המדברה וילך ויפגשהו בהר האלהים וישק לו
(179668, -95, 4);1;א;83433;(2, 4, 30, 10, 83433);22014;(2, 4, 30, 3, 22014);את;1;3;וידבר אהרן את כל הדברים אשר דבר יהוה אל משה ויעש האתת לעיני העם
(179668, -95, 4);8;ח;83528;(2, 4, 31, 55, 83528);22040;(2, 4, 31, 15, 22040);וישתחוו;5;15;ויאמן העם וישמעו כי פקד יהוה את בני ישראל וכי ראה את ענים ויקדו וישתחוו
(179668, -95, 4);300;ש;83623;(2, 5, 2, 28, 83623);22066;(2, 5, 2, 8, 22066);לשלח;2;8;ויאמר פרעה מי יהוה אשר אשמע בקלו לשלח את ישראל לא ידעתי את יהוה וגם את ישראל לא אשלח
(179668, -95, 4);6;ו;83718;(2, 5, 3, 57, 83718);22090;(2, 5, 3, 13, 22090);ליהוה;4;13;ויאמרו אלהי העברים נקרא עלינו נלכה נא דרך שלשת ימים במדבר ונזבחה ליהוה אלהינו פן יפגענו בדבר או בחרב
(179668, -95, 4);10;י;83813;(2, 5, 5, 14, 83813);22113;(2, 5, 5, 4, 22113);רבים;3;4;ויאמר פרעה הן רבים עתה עם הארץ והשבתם אתם מסבלתם
(179668, -95, 4);6;ו;83908;(2, 5, 7, 31, 83908);22137;(2, 5, 7, 8, 22137);כתמול;4;8;לא תאספון לתת תבן לעם ללבן הלבנים כתמול שלשם הם ילכו וקששו להם תבן
(179668, -95, 4);30;ל;84003;(2, 5, 8, 73, 84003);22164;(2, 5, 8, 21, 22164);לאמר;1;21;ואת מתכנת הלבנים אשר הם עשים תמול שלשם תשימו עליהם לא תגרעו ממנו כי נרפים הם על כן הם צעקים לאמר נלכה נזבחה לאלהינו
(179668, -95, 4);40;מ;84098;(2, 5, 10, 37, 84098);22187;(2, 5, 10, 10, 22187);אמר;2;10;ויצאו נגשי העם ושטריו ויאמרו אל העם לאמר כה אמר פרעה אינני נתן לכם תבן
(179668, -95, 4);300;ש;84193;(2, 5, 13, 5, 84193);22213;(2, 5, 13, 1, 22213);והנגשים;5;1;והנגשים אצים לאמר כלו מעשיכם דבר יום ביומו כאשר בהיות התבן
(179668, -95, 4);20;כ;84288;(2, 5, 14, 52, 84288);22237;(2, 5, 14, 14, 22237);חקכם;3;14;ויכו שטרי בני ישראל אשר שמו עלהם נגשי פרעה לאמר מדוע לא כליתם חקכם ללבן כתמול שלשם גם תמול גם היום
(179668, -95, 4);40;ם;84383;(2, 5, 16, 21, 84383);22261;(2, 5, 16, 5, 22261);ולבנים;6;5;תבן אין נתן לעבדיך ולבנים אמרים לנו עשו והנה עבדיך מכים וחטאת עמך
(179668, -95, 4);50;נ;84478;(2, 5, 18, 19, 84478);22286;(2, 5, 18, 6, 22286);ינתן;2;6;ועתה לכו עבדו ותבן לא ינתן לכם ותכן לבנים תתנו
(179668, -95, 4);100;ק;84573;(2, 5, 20, 25, 84573);22310;(2, 5, 20, 7, 22310);לקראתם;2;7;ויפגעו את משה ואת אהרן נצבים לקראתם בצאתם מאת פרעה
(179668, -95, 4);6;ו;84668;(2, 5, 21, 79, 84668);22331;(2, 5, 21, 18, 22331);להרגנו;6;18;ויאמרו אלהם ירא יהוה עליכם וישפט אשר הבאשתם את ריחנו בעיני פרעה ובעיני עבדיו לתת חרב בידם להרגנו
(179668, -95, 4);10;י;84763;(2, 6, 1, 2, 84763);22359;(2, 6, 1, 1, 22359);ויאמר;2;1;ויאמר יהוה אל משה עתה תראה אשר אעשה לפרעה כי ביד חזקה ישלחם וביד חזקה יגרשם מארצו
(179668, -95, 4);6;ו;84858;(2, 6, 3, 1, 84858);22384;(2, 6, 3, 1, 22384);וארא;1;1;וארא אל אברהם אל יצחק ואל יעקב באל שדי ושמי יהוה לא נודעתי להם
(179668, -95, 4);200;ר;84953;(2, 6, 4, 47, 84953);22411;(2, 6, 4, 14, 22411);אשר;3;14;וגם הקמתי את בריתי אתם לתת להם את ארץ כנען את ארץ מגריהם אשר גרו בה
(179668, -95, 4);8;ח;85048;(2, 6, 6, 36, 85048);22436;(2, 6, 6, 9, 22436);מתחת;3;9;לכן אמר לבני ישראל אני יהוה והוצאתי אתכם מתחת סבלת מצרים והצלתי אתכם מעבדתם וגאלתי אתכם בזרוע נטויה ובשפטים גדלים
(179668, -95, 4);20;כ;85143;(2, 6, 7, 37, 85143);22456;(2, 6, 7, 9, 22456);כי;1;9;ולקחתי אתכם לי לעם והייתי לכם לאלהים וידעתם כי אני יהוה אלהיכם המוציא אתכם מתחת סבלות מצרים
(179668, -95, 4);10;י;85238;(2, 6, 8, 57, 85238);22478;(2, 6, 8, 14, 22478);ונתתי;5;14;והבאתי אתכם אל הארץ אשר נשאתי את ידי לתת אתה לאברהם ליצחק וליעקב ונתתי אתה לכם מורשה אני יהוה
(179668, -95, 4);5;ה;85333;(2, 6, 11, 11, 85333);22506;(2, 6, 11, 4, 22506);פרעה;4;4;בא דבר אל פרעה מלך מצרים וישלח את בני ישראל מארצו
(179668, -95, 4);10;י;85428;(2, 6, 13, 2, 85428);22531;(2, 6, 13, 1, 22531);וידבר;2;1;וידבר יהוה אל משה ואל אהרן ויצום אל בני ישראל ואל פרעה מלך מצרים להוציא את בני ישראל מארץ מצרים
(179668, -95, 4);2;ב;85523;(2, 6, 14, 21, 85523);22556;(2, 6, 14, 6, 22556);ראובן;4;6;אלה ראשי בית אבתם בני ראובן בכר ישראל חנוך ופלוא חצרן וכרמי אלה משפחת ראובן
(179668, -95, 4);300;ש;85618;(2, 6, 15, 55, 85618);22578;(2, 6, 15, 13, 22578);שמעון;1;13;ובני שמעון ימואל וימין ואהד ויכין וצחר ושאול בן הכנענית אלה משפחת שמעון
(179668, -95, 4);400;ת;85713;(2, 6, 18, 7, 85713);22600;(2, 6, 18, 2, 22600);קהת;3;2;ובני קהת עמרם ויצהר וחברון ועזיאל ושני חיי קהת שלש ושלשים ומאת שנה
(179668, -95, 4);20;כ;85808;(2, 6, 20, 13, 85808);22623;(2, 6, 20, 4, 22623);יוכבד;3;4;ויקח עמרם את יוכבד דדתו לו לאשה ותלד לו את אהרן ואת משה ושני חיי עמרם שבע ושלשים ומאת שנה
(179668, -95, 4);90;צ;85903;(2, 6, 22, 18, 85903);22648;(2, 6, 22, 4, 22648);ואלצפן;4;4;ובני עזיאל מישאל ואלצפן וסתרי
(179668, -95, 4);30;ל;85998;(2, 6, 24, 14, 85998);22673;(2, 6, 24, 4, 22673);ואלקנה;3;4;ובני קרח אסיר ואלקנה ואביאסף אלה משפחת הקרחי
(179668, -95, 4);6;ו;86093;(2, 6, 26, 2, 86093);22696;(2, 6, 26, 1, 22696);הוא;2;1;הוא אהרן ומשה אשר אמר יהוה להם הוציאו את בני ישראל מארץ מצרים על צבאתם
(179668, -95, 4);40;מ;86188;(2, 6, 27, 41, 86188);22721;(2, 6, 27, 11, 22721);ממצרים;2;11;הם המדברים אל פרעה מלך מצרים להוציא את בני ישראל ממצרים הוא משה ואהרן
(179668, -95, 4);50;נ;86283;(2, 6, 29, 51, 86283);22748;(2, 6, 29, 16, 22748);אני;2;16;וידבר יהוה אל משה לאמר אני יהוה דבר אל פרעה מלך מצרים את כל אשר אני דבר אליך
(179668, -95, 4);5;ה;86378;(2, 7, 1, 43, 86378);22773;(2, 7, 1, 11, 22773);יהיה;2;11;ויאמר יהוה אל משה ראה נתתיך אלהים לפרעה ואהרן אחיך יהיה נביאך
(179668, -95, 4);400;ת;86473;(2, 7, 3, 32, 86473);22799;(2, 7, 3, 9, 22799);ואת;3;9;ואני אקשה את לב פרעה והרביתי את אתתי ואת מופתי בארץ מצרים
(179668, -95, 4);4;ד;86568;(2, 7, 5, 3, 86568);22822;(2, 7, 5, 1, 22822);וידעו;3;1;וידעו מצרים כי אני יהוה בנטתי את ידי על מצרים והוצאתי את בני ישראל מתוכם
(179668, -95, 4);50;נ;86663;(2, 7, 7, 9, 86663);22848;(2, 7, 7, 3, 22848);שמנים;3;3;ומשה בן שמנים שנה ואהרן בן שלש ושמנים שנה בדברם אל פרעה
(179668, -95, 4);30;ל;86758;(2, 7, 9, 35, 86758);22874;(2, 7, 9, 10, 22874);אל;2;10;כי ידבר אלכם פרעה לאמר תנו לכם מופת ואמרת אל אהרן קח את מטך והשלך לפני פרעה יהי לתנין
(179668, -95, 4);50;נ;86853;(2, 7, 10, 63, 86853);22900;(2, 7, 10, 17, 22900);ולפני;4;17;ויבא משה ואהרן אל פרעה ויעשו כן כאשר צוה יהוה וישלך אהרן את מטהו לפני פרעה ולפני עבדיו ויהי לתנין
(179668, -95, 4);10;י;86948;(2, 7, 12, 27, 86948);22921;(2, 7, 12, 6, 22921);ויבלע;2;6;וישליכו איש מטהו ויהיו לתנינם ויבלע מטה אהרן את מטתם
(179668, -95, 4);50;נ;87043;(2, 7, 15, 14, 87043);22949;(2, 7, 15, 5, 22949);הנה;2;5;לך אל פרעה בבקר הנה יצא המימה ונצבת לקראתו על שפת היאר והמטה אשר נהפך לנחש תקח בידך
(179668, -95, 4);40;מ;87138;(2, 7, 16, 43, 87138);22973;(2, 7, 16, 11, 22973);עמי;2;11;ואמרת אליו יהוה אלהי העברים שלחני אליך לאמר שלח את עמי ויעבדני במדבר והנה לא שמעת עד כה
(179668, -95, 4);40;ם;87233;(2, 7, 17, 68, 87233);23000;(2, 7, 17, 20, 23000);לדם;3;20;כה אמר יהוה בזאת תדע כי אני יהוה הנה אנכי מכה במטה אשר בידי על המים אשר ביאר ונהפכו לדם
(179668, -95, 4);70;ע;87328;(2, 7, 19, 47, 87328);23027;(2, 7, 19, 15, 23027);על;1;15;ויאמר יהוה אל משה אמר אל אהרן קח מטך ונטה ידך על מימי מצרים על נהרתם על יאריהם ועל אגמיהם ועל כל מקוה מימיהם ויהיו דם והיה דם בכל ארץ מצרים ובעצים ובאבנים
(179668, -95, 4);90;צ;87423;(2, 7, 20, 20, 87423);23051;(2, 7, 20, 6, 23051);צוה;1;6;ויעשו כן משה ואהרן כאשר צוה יהוה וירם במטה ויך את המים אשר ביאר לעיני פרעה ולעיני עבדיו ויהפכו כל המים אשר ביאר לדם
(179668, -95, 4);1;א;87518;(2, 7, 21, 23, 87518);23075;(2, 7, 21, 6, 23075);היאר;3;6;והדגה אשר ביאר מתה ויבאש היאר ולא יכלו מצרים לשתות מים מן היאר ויהי הדם בכל ארץ מצרים
(179668, -95, 4);2;ב;87613;(2, 7, 22, 50, 87613);23100;(2, 7, 22, 13, 23100);דבר;2;13;ויעשו כן חרטמי מצרים בלטיהם ויחזק לב פרעה ולא שמע אלהם כאשר דבר יהוה
(179668, -95, 4);2;ב;87708;(2, 7, 25, 7, 87708);23126;(2, 7, 25, 2, 23126);שבעת;2;2;וימלא שבעת ימים אחרי הכות יהוה את היאר
(179668, -95, 4);5;ה;87803;(2, 7, 27, 16, 87803);23153;(2, 7, 27, 5, 23153);הנה;3;5;ואם מאן אתה לשלח הנה אנכי נגף את כל גבולך בצפרדעים
(179668, -95, 4);40;מ;87898;(2, 7, 28, 71, 87898);23174;(2, 7, 28, 15, 23174);ובמשארותיך;3;15;ושרץ היאר צפרדעים ועלו ובאו בביתך ובחדר משכבך ועל מטתך ובבית עבדיך ובעמך ובתנוריך ובמשארותיך
(179668, -95, 4);10;י;87993;(2, 8, 1, 58, 87993);23197;(2, 8, 1, 17, 23197);האגמים;5;17;ויאמר יהוה אל משה אמר אל אהרן נטה את ידך במטך על הנהרת על היארים ועל האגמים והעל את הצפרדעים על ארץ מצרים
(179668, -95, 4);70;ע;88088;(2, 8, 3, 23, 88088);23221;(2, 8, 3, 5, 23221);ויעלו;3;5;ויעשו כן החרטמים בלטיהם ויעלו את הצפרדעים על ארץ מצרים
(179668, -95, 4);8;ח;88183;(2, 8, 4, 73, 88183);23242;(2, 8, 4, 16, 23242);ויזבחו;5;16;ויקרא פרעה למשה ולאהרן ויאמר העתירו אל יהוה ויסר הצפרדעים ממני ומעמי ואשלחה את העם ויזבחו ליהוה
(179668, -95, 4);6;ו;88278;(2, 8, 6, 10, 88278);23263;(2, 8, 6, 3, 23263);ויאמר;1;3;ויאמר למחר ויאמר כדברך למען תדע כי אין כיהוה אלהינו
(179668, -95, 4);70;ע;88373;(2, 8, 8, 18, 88373);23284;(2, 8, 8, 5, 23284);פרעה;3;5;ויצא משה ואהרן מעם פרעה ויצעק משה אל יהוה על דבר הצפרדעים אשר שם לפרעה
