(99813, 75, 4);1;א;226413;(4, 22, 22, 7, 226413);59721;(4, 22, 22, 3, 59721);אלהים;1;3;ויחר אף אלהים כי הולך הוא ויתיצב מלאך יהוה בדרך לשטן לו והוא רכב על אתנו ושני נעריו עמו
(99813, 75, 4);30;ל;226488;(4, 22, 23, 13, 226488);59741;(4, 22, 23, 4, 59741);מלאך;2;4;ותרא האתון את מלאך יהוה נצב בדרך וחרבו שלופה בידו ותט האתון מן הדרך ותלך בשדה ויך בלעם את האתון להטתה הדרך
(99813, 75, 4);70;ע;226563;(4, 22, 24, 3, 226563);59760;(4, 22, 24, 1, 59760);ויעמד;3;1;ויעמד מלאך יהוה במשעול הכרמים גדר מזה וגדר מזה
(99813, 75, 4);30;ל;226638;(4, 22, 25, 40, 226638);59779;(4, 22, 25, 11, 59779);רגל;3;11;ותרא האתון את מלאך יהוה ותלחץ אל הקיר ותלחץ את רגל בלעם אל הקיר ויסף להכתה
(99813, 75, 4);200;ר;226713;(4, 22, 27, 3, 226713);59798;(4, 22, 27, 1, 59798);ותרא;3;1;ותרא האתון את מלאך יהוה ותרבץ תחת בלעם ויחר אף בלעם ויך את האתון במקל
(99813, 75, 4);200;ר;226788;(4, 22, 28, 23, 226788);59818;(4, 22, 28, 6, 59818);ותאמר;5;6;ויפתח יהוה את פי האתון ותאמר לבלעם מה עשיתי לך כי הכיתני זה שלש רגלים
(99813, 75, 4);3;ג;226863;(4, 22, 29, 43, 226863);59840;(4, 22, 29, 13, 59840);הרגתיך;3;13;ויאמר בלעם לאתון כי התעללת בי לו יש חרב בידי כי עתה הרגתיך
(99813, 75, 4);5;ה;226938;(4, 22, 30, 72, 226938);59859;(4, 22, 30, 19, 59859);כה;2;19;ותאמר האתון אל בלעם הלוא אנכי אתנך אשר רכבת עלי מעודך עד היום הזה ההסכן הסכנתי לעשות לך כה ויאמר לא
(99813, 75, 4);6;ו;227013;(4, 22, 32, 1, 227013);59879;(4, 22, 32, 1, 59879);ויאמר;1;1;ויאמר אליו מלאך יהוה על מה הכית את אתנך זה שלוש רגלים הנה אנכי יצאתי לשטן כי ירט הדרך לנגדי
(99813, 75, 4);1;א;227088;(4, 22, 33, 4, 227088);59899;(4, 22, 33, 1, 59899);ותראני;4;1;ותראני האתון ותט לפני זה שלש רגלים אולי נטתה מפני כי עתה גם אתכה הרגתי ואותה החייתי
(99813, 75, 4);40;מ;227163;(4, 22, 34, 12, 227163);59919;(4, 22, 34, 4, 59919);מלאך;1;4;ויאמר בלעם אל מלאך יהוה חטאתי כי לא ידעתי כי אתה נצב לקראתי בדרך ועתה אם רע בעיניך אשובה לי
(99813, 75, 4);30;ל;227238;(4, 22, 35, 15, 227238);59939;(4, 22, 35, 4, 59939);אל;2;4;ויאמר מלאך יהוה אל בלעם לך עם האנשים ואפס את הדבר אשר אדבר אליך אתו תדבר וילך בלעם עם שרי בלק
(99813, 75, 4);6;ו;227313;(4, 22, 36, 17, 227313);59962;(4, 22, 36, 6, 59962);ויצא;1;6;וישמע בלק כי בא בלעם ויצא לקראתו אל עיר מואב אשר על גבול ארנן אשר בקצה הגבול
(99813, 75, 4);200;ר;227388;(4, 22, 37, 32, 227388);59982;(4, 22, 37, 9, 59982);לקרא;3;9;ויאמר בלק אל בלעם הלא שלח שלחתי אליך לקרא לך למה לא הלכת אלי האמנם לא אוכל כבדך
(99813, 75, 4);5;ה;227463;(4, 22, 38, 45, 227463);60004;(4, 22, 38, 13, 60004);הדבר;1;13;ויאמר בלעם אל בלק הנה באתי אליך עתה היכל אוכל דבר מאומה הדבר אשר ישים אלהים בפי אתו אדבר
(99813, 75, 4);70;ע;227538;(4, 22, 40, 24, 227538);60023;(4, 22, 40, 6, 60023);לבלעם;4;6;ויזבח בלק בקר וצאן וישלח לבלעם ולשרים אשר אתו
(99813, 75, 4);2;ב;227613;(4, 23, 1, 15, 227613);60044;(4, 23, 1, 5, 60044);בנה;1;5;ויאמר בלעם אל בלק בנה לי בזה שבעה מזבחת והכן לי בזה שבעה פרים ושבעה אילים
(99813, 75, 4);200;ר;227688;(4, 23, 2, 32, 227688);60064;(4, 23, 2, 9, 60064);פר;2;9;ויעש בלק כאשר דבר בלעם ויעל בלק ובלעם פר ואיל במזבח
(99813, 75, 4);20;ך;227763;(4, 23, 3, 66, 227763);60082;(4, 23, 3, 16, 60082);לך;2;16;ויאמר בלעם לבלק התיצב על עלתך ואלכה אולי יקרה יהוה לקראתי ודבר מה יראני והגדתי לך וילך שפי
(99813, 75, 4);2;ב;227838;(4, 23, 5, 12, 227838);60102;(4, 23, 5, 4, 60102);בפי;1;4;וישם יהוה דבר בפי בלעם ויאמר שוב אל בלק וכה תדבר
(99813, 75, 4);50;ן;227913;(4, 23, 7, 15, 227913);60123;(4, 23, 7, 4, 60123);מן;2;4;וישא משלו ויאמר מן ארם ינחני בלק מלך מואב מהררי קדם לכה ארה לי יעקב ולכה זעמה ישראל
(99813, 75, 4);40;ם;227988;(4, 23, 8, 24, 227988);60146;(4, 23, 8, 9, 60146);זעם;3;9;מה אקב לא קבה אל ומה אזעם לא זעם יהוה
(99813, 75, 4);1;א;228063;(4, 23, 10, 18, 228063);60166;(4, 23, 10, 6, 60166);את;1;6;מי מנה עפר יעקב ומספר את רבע ישראל תמת נפשי מות ישרים ותהי אחריתי כמהו
(99813, 75, 4);5;ה;228138;(4, 23, 11, 37, 228138);60186;(4, 23, 11, 11, 60186);והנה;2;11;ויאמר בלק אל בלעם מה עשית לי לקב איבי לקחתיך והנה ברכת ברך
(99813, 75, 4);8;ח;228213;(4, 23, 13, 27, 228213);60208;(4, 23, 13, 9, 60208);אחר;2;9;ויאמר אליו בלק לך נא אתי אל מקום אחר אשר תראנו משם אפס קצהו תראה וכלו לא תראה וקבנו לי משם
(99813, 75, 4);40;מ;228288;(4, 23, 14, 32, 228288);60229;(4, 23, 14, 9, 60229);מזבחת;1;9;ויקחהו שדה צפים אל ראש הפסגה ויבן שבעה מזבחת ויעל פר ואיל במזבח
(99813, 75, 4);2;ב;228363;(4, 23, 16, 22, 228363);60250;(4, 23, 16, 7, 60250);בפיו;1;7;ויקר יהוה אל בלעם וישם דבר בפיו ויאמר שוב אל בלק וכה תדבר
(99813, 75, 4);6;ו;228438;(4, 23, 18, 1, 228438);60272;(4, 23, 18, 1, 60272);וישא;1;1;וישא משלו ויאמר קום בלק ושמע האזינה עדי בנו צפר
(99813, 75, 4);5;ה;228513;(4, 23, 19, 38, 228513);60292;(4, 23, 19, 11, 60292);יעשה;4;11;לא איש אל ויכזב ובן אדם ויתנחם ההוא אמר ולא יעשה ודבר ולא יקימנה
(99813, 75, 4);6;ו;228588;(4, 23, 21, 38, 228588);60311;(4, 23, 21, 10, 60311);אלהיו;5;10;לא הביט און ביעקב ולא ראה עמל בישראל יהוה אלהיו עמו ותרועת מלך בו
(99813, 75, 4);2;ב;228663;(4, 23, 23, 36, 228663);60331;(4, 23, 23, 10, 60331);ליעקב;5;10;כי לא נחש ביעקב ולא קסם בישראל כעת יאמר ליעקב ולישראל מה פעל אל
(99813, 75, 4);2;ב;228738;(4, 23, 25, 11, 228738);60353;(4, 23, 25, 4, 60353);בלעם;1;4;ויאמר בלק אל בלעם גם קב לא תקבנו גם ברך לא תברכנו
(99813, 75, 4);1;א;228813;(4, 23, 26, 48, 228813);60375;(4, 23, 26, 14, 60375);אתו;1;14;ויען בלעם ויאמר אל בלק הלא דברתי אליך לאמר כל אשר ידבר יהוה אתו אעשה
(99813, 75, 4);1;א;228888;(4, 23, 28, 8, 228888);60396;(4, 23, 28, 3, 60396);את;1;3;ויקח בלק את בלעם ראש הפעור הנשקף על פני הישימן
(99813, 75, 4);200;ר;228963;(4, 23, 29, 46, 228963);60417;(4, 23, 29, 14, 60417);פרים;2;14;ויאמר בלעם אל בלק בנה לי בזה שבעה מזבחת והכן לי בזה שבעה פרים ושבעה אילם
(99813, 75, 4);200;ר;229038;(4, 24, 1, 31, 229038);60437;(4, 24, 1, 9, 60437);ישראל;3;9;וירא בלעם כי טוב בעיני יהוה לברך את ישראל ולא הלך כפעם בפעם לקראת נחשים וישת אל המדבר פניו
(99813, 75, 4);10;י;229113;(4, 24, 2, 34, 229113);60456;(4, 24, 2, 9, 60456);לשבטיו;5;9;וישא בלעם את עיניו וירא את ישראל שכן לשבטיו ותהי עליו רוח אלהים
(99813, 75, 4);8;ח;229188;(4, 24, 4, 17, 229188);60477;(4, 24, 4, 6, 60477);מחזה;2;6;נאם שמע אמרי אל אשר מחזה שדי יחזה נפל וגלוי עינים
(99813, 75, 4);50;נ;229263;(4, 24, 6, 27, 229263);60495;(4, 24, 6, 7, 60495);נטע;1;7;כנחלים נטיו כגנת עלי נהר כאהלים נטע יהוה כארזים עלי מים
(99813, 75, 4);90;צ;229338;(4, 24, 8, 11, 229338);60513;(4, 24, 8, 3, 60513);ממצרים;3;3;אל מוציאו ממצרים כתועפת ראם לו יאכל גוים צריו ועצמתיהם יגרם וחציו ימחץ
(99813, 75, 4);20;כ;229413;(4, 24, 9, 28, 229413);60530;(4, 24, 9, 7, 60530);מברכיך;4;7;כרע שכב כארי וכלביא מי יקימנו מברכיך ברוך וארריך ארור
(99813, 75, 4);200;ר;229488;(4, 24, 10, 59, 229488);60550;(4, 24, 10, 17, 60550);ברכת;2;17;ויחר אף בלק אל בלעם ויספק את כפיו ויאמר בלק אל בלעם לקב איבי קראתיך והנה ברכת ברך זה שלש פעמים
(99813, 75, 4);100;ק;229563;(4, 24, 12, 14, 229563);60570;(4, 24, 12, 4, 60570);בלק;3;4;ויאמר בלעם אל בלק הלא גם אל מלאכיך אשר שלחת אלי דברתי לאמר
(99813, 75, 4);30;ל;229638;(4, 24, 13, 43, 229638);60594;(4, 24, 13, 15, 60594);לעשות;1;15;אם יתן לי בלק מלא ביתו כסף וזהב לא אוכל לעבר את פי יהוה לעשות טובה או רעה מלבי אשר ידבר יהוה אתו אדבר
(99813, 75, 4);40;מ;229713;(4, 24, 14, 40, 229713);60614;(4, 24, 14, 11, 60614);לעמך;3;11;ועתה הנני הולך לעמי לכה איעצך אשר יעשה העם הזה לעמך באחרית הימים
(99813, 75, 4);10;י;229788;(4, 24, 16, 22, 229788);60634;(4, 24, 16, 7, 60634);עליון;3;7;נאם שמע אמרי אל וידע דעת עליון מחזה שדי יחזה נפל וגלוי עינים
(99813, 75, 4);6;ו;229863;(4, 24, 17, 49, 229863);60653;(4, 24, 17, 13, 60653);ומחץ;1;13;אראנו ולא עתה אשורנו ולא קרוב דרך כוכב מיעקב וקם שבט מישראל ומחץ פאתי מואב וקרקר כל בני שת
(99813, 75, 4);5;ה;229938;(4, 24, 19, 11, 229938);60672;(4, 24, 19, 3, 60672);והאביד;2;3;וירד מיעקב והאביד שריד מעיר
(99813, 75, 4);300;ש;230013;(4, 24, 21, 14, 230013);60690;(4, 24, 21, 4, 60690);וישא;3;4;וירא את הקיני וישא משלו ויאמר איתן מושבך ושים בסלע קנך
(99813, 75, 4);10;י;230088;(4, 24, 23, 18, 230088);60711;(4, 24, 23, 5, 60711);מי;2;5;וישא משלו ויאמר אוי מי יחיה משמו אל
(99813, 75, 4);100;ק;230163;(4, 24, 25, 27, 230163);60732;(4, 24, 25, 7, 60732);בלק;3;7;ויקם בלעם וילך וישב למקמו וגם בלק הלך לדרכו
(99813, 75, 4);300;ש;230238;(4, 25, 2, 31, 230238);60750;(4, 25, 2, 7, 60750);וישתחוו;3;7;ותקראן לעם לזבחי אלהיהן ויאכל העם וישתחוו לאלהיהן
(99813, 75, 4);6;ו;230313;(4, 25, 4, 30, 230313);60769;(4, 25, 4, 10, 60769);והוקע;3;10;ויאמר יהוה אל משה קח את כל ראשי העם והוקע אותם ליהוה נגד השמש וישב חרון אף יהוה מישראל
(99813, 75, 4);10;י;230388;(4, 25, 5, 37, 230388);60787;(4, 25, 5, 9, 60787);הנצמדים;6;9;ויאמר משה אל שפטי ישראל הרגו איש אנשיו הנצמדים לבעל פעור
(99813, 75, 4);6;ו;230463;(4, 25, 6, 66, 230463);60807;(4, 25, 6, 18, 60807);והמה;1;18;והנה איש מבני ישראל בא ויקרב אל אחיו את המדינית לעיני משה ולעיני כל עדת בני ישראל והמה בכים פתח אהל מועד
(99813, 75, 4);10;י;230538;(4, 25, 8, 9, 230538);60827;(4, 25, 8, 3, 60827);איש;2;3;ויבא אחר איש ישראל אל הקבה וידקר את שניהם את איש ישראל ואת האשה אל קבתה ותעצר המגפה מעל בני ישראל
(99813, 75, 4);40;מ;230613;(4, 25, 9, 7, 230613);60847;(4, 25, 9, 2, 60847);המתים;2;2;ויהיו המתים במגפה ארבעה ועשרים אלף
(99813, 75, 4);30;ל;230688;(4, 25, 11, 35, 230688);60866;(4, 25, 11, 10, 60866);מעל;3;10;פינחס בן אלעזר בן אהרן הכהן השיב את חמתי מעל בני ישראל בקנאו את קנאתי בתוכם ולא כליתי את בני ישראל בקנאתי
(99813, 75, 4);40;ם;230763;(4, 25, 12, 26, 230763);60886;(4, 25, 12, 8, 60886);שלום;4;8;לכן אמר הנני נתן לו את בריתי שלום
(99813, 75, 4);5;ה;230838;(4, 25, 14, 15, 230838);60905;(4, 25, 14, 4, 60905);המכה;4;4;ושם איש ישראל המכה אשר הכה את המדינית זמרי בן סלוא נשיא בית אב לשמעני
(99813, 75, 4);2;ב;230913;(4, 25, 15, 35, 230913);60926;(4, 25, 15, 10, 60926);בית;1;10;ושם האשה המכה המדינית כזבי בת צור ראש אמות בית אב במדין הוא
(99813, 75, 4);200;ר;230988;(4, 25, 18, 22, 230988);60945;(4, 25, 18, 6, 60945);אשר;3;6;כי צררים הם לכם בנכליהם אשר נכלו לכם על דבר פעור ועל דבר כזבי בת נשיא מדין אחתם המכה ביום המגפה על דבר פעור
(99813, 75, 4);5;ה;231063;(4, 25, 19, 13, 231063);60966;(4, 25, 19, 3, 60966);המגפה;5;3;ויהי אחרי המגפה
(99813, 75, 4);2;ב;231138;(4, 26, 2, 39, 231138);60988;(4, 26, 2, 12, 60988);לבית;2;12;שאו את ראש כל עדת בני ישראל מבן עשרים שנה ומעלה לבית אבתם כל יצא צבא בישראל
(99813, 75, 4);5;ה;231213;(4, 26, 4, 11, 231213);61007;(4, 26, 4, 3, 61007);שנה;3;3;מבן עשרים שנה ומעלה כאשר צוה יהוה את משה ובני ישראל היצאים מארץ מצרים
(99813, 75, 4);8;ח;231288;(4, 26, 5, 30, 231288);61025;(4, 26, 5, 7, 61025);משפחת;4;7;ראובן בכור ישראל בני ראובן חנוך משפחת החנכי לפלוא משפחת הפלאי
(99813, 75, 4);100;ק;231363;(4, 26, 7, 22, 231363);61040;(4, 26, 7, 5, 61040);פקדיהם;2;5;אלה משפחת הראובני ויהיו פקדיהם שלשה וארבעים אלף ושבע מאות ושלשים
(99813, 75, 4);50;ן;231438;(4, 26, 9, 30, 231438);61056;(4, 26, 9, 7, 61056);דתן;3;7;ובני אליאב נמואל ודתן ואבירם הוא דתן ואבירם קרואי העדה אשר הצו על משה ועל אהרן בעדת קרח בהצתם על יהוה
(99813, 75, 4);1;א;231513;(4, 26, 10, 24, 231513);61077;(4, 26, 10, 7, 61077);ואת;2;7;ותפתח הארץ את פיה ותבלע אתם ואת קרח במות העדה באכל האש את חמשים ומאתים איש ויהיו לנס
(99813, 75, 4);1;א;231588;(4, 26, 12, 20, 231588);61096;(4, 26, 12, 4, 61096);לנמואל;5;4;בני שמעון למשפחתם לנמואל משפחת הנמואלי לימין משפחת הימיני ליכין משפחת היכיני
(99813, 75, 4);10;י;231663;(4, 26, 13, 30, 231663);61110;(4, 26, 13, 6, 61110);השאולי;6;6;לזרח משפחת הזרחי לשאול משפחת השאולי
(99813, 75, 4);30;ל;231738;(4, 26, 15, 42, 231738);61127;(4, 26, 15, 10, 61127);לשוני;1;10;בני גד למשפחתם לצפון משפחת הצפוני לחגי משפחת החגי לשוני משפחת השוני
(99813, 75, 4);10;י;231813;(4, 26, 17, 33, 231813);61141;(4, 26, 17, 6, 61141);האראלי;6;6;לארוד משפחת הארודי לאראלי משפחת האראלי
(99813, 75, 4);10;י;231888;(4, 26, 20, 4, 231888);61160;(4, 26, 20, 1, 61160);ויהיו;4;1;ויהיו בני יהודה למשפחתם לשלה משפחת השלני לפרץ משפחת הפרצי לזרח משפחת הזרחי
(99813, 75, 4);40;מ;231963;(4, 26, 21, 17, 231963);61177;(4, 26, 21, 5, 61177);משפחת;1;5;ויהיו בני פרץ לחצרן משפחת החצרני לחמול משפחת החמולי
(99813, 75, 4);30;ל;232038;(4, 26, 23, 9, 232038);61193;(4, 26, 23, 3, 61193);למשפחתם;1;3;בני יששכר למשפחתם תולע משפחת התולעי לפוה משפחת הפוני
(99813, 75, 4);10;י;232113;(4, 26, 25, 9, 232113);61208;(4, 26, 25, 3, 61208);יששכר;1;3;אלה משפחת יששכר לפקדיהם ארבעה וששים אלף ושלש מאות
(99813, 75, 4);50;נ;232188;(4, 26, 26, 43, 232188);61223;(4, 26, 26, 9, 61223);האלני;4;9;בני זבולן למשפחתם לסרד משפחת הסרדי לאלון משפחת האלני ליחלאל משפחת היחלאלי
(99813, 75, 4);6;ו;232263;(4, 26, 28, 19, 232263);61239;(4, 26, 28, 5, 61239);ואפרים;1;5;בני יוסף למשפחתם מנשה ואפרים
(99813, 75, 4);200;ר;232338;(4, 26, 30, 15, 232338);61255;(4, 26, 30, 4, 61255);איעזר;5;4;אלה בני גלעד איעזר משפחת האיעזרי לחלק משפחת החלקי
(99813, 75, 4);4;ד;232413;(4, 26, 32, 16, 232413);61269;(4, 26, 32, 3, 61269);השמידעי;5;3;ושמידע משפחת השמידעי וחפר משפחת החפרי
(99813, 75, 4);6;ו;232488;(4, 26, 33, 59, 232488);61290;(4, 26, 33, 18, 61290);ותרצה;1;18;וצלפחד בן חפר לא היו לו בנים כי אם בנות ושם בנות צלפחד מחלה ונעה חגלה מלכה ותרצה
(99813, 75, 4);300;ש;232563;(4, 26, 35, 31, 232563);61306;(4, 26, 35, 7, 61306);השתלחי;2;7;אלה בני אפרים למשפחתם לשותלח משפחת השתלחי לבכר משפחת הבכרי לתחן משפחת התחני
(99813, 75, 4);30;ל;232638;(4, 26, 37, 17, 232638);61323;(4, 26, 37, 5, 61323);לפקדיהם;1;5;אלה משפחת בני אפרים לפקדיהם שנים ושלשים אלף וחמש מאות אלה בני יוסף למשפחתם
(99813, 75, 4);1;א;232713;(4, 26, 38, 31, 232713);61339;(4, 26, 38, 7, 61339);לאשבל;2;7;בני בנימן למשפחתם לבלע משפחת הבלעי לאשבל משפחת האשבלי לאחירם משפחת האחירמי
(99813, 75, 4);30;ל;232788;(4, 26, 40, 10, 232788);61353;(4, 26, 40, 3, 61353);בלע;2;3;ויהיו בני בלע ארד ונעמן משפחת הארדי לנעמן משפחת הנעמי
(99813, 75, 4);300;ש;232863;(4, 26, 41, 41, 232863);61369;(4, 26, 41, 9, 61369);ושש;2;9;אלה בני בנימן למשפחתם ופקדיהם חמשה וארבעים אלף ושש מאות
(99813, 75, 4);200;ר;232938;(4, 26, 43, 22, 232938);61386;(4, 26, 43, 5, 61386);ארבעה;2;5;כל משפחת השוחמי לפקדיהם ארבעה וששים אלף וארבע מאות
(99813, 75, 4);5;ה;233013;(4, 26, 44, 55, 233013);61402;(4, 26, 44, 12, 61402);הבריעי;1;12;בני אשר למשפחתם לימנה משפחת הימנה לישוי משפחת הישוי לבריעה משפחת הבריעי
(99813, 75, 4);80;פ;233088;(4, 26, 47, 16, 233088);61419;(4, 26, 47, 5, 61419);לפקדיהם;2;5;אלה משפחת בני אשר לפקדיהם שלשה וחמשים אלף וארבע מאות
(99813, 75, 4);10;י;233163;(4, 26, 48, 48, 233163);61433;(4, 26, 48, 9, 61433);הגוני;5;9;בני נפתלי למשפחתם ליחצאל משפחת היחצאלי לגוני משפחת הגוני
(99813, 75, 4);40;מ;233238;(4, 26, 50, 47, 233238);61449;(4, 26, 50, 10, 61449);מאות;1;10;אלה משפחת נפתלי למשפחתם ופקדיהם חמשה וארבעים אלף וארבע מאות
(99813, 75, 4);90;ץ;233313;(4, 26, 53, 12, 233313);61468;(4, 26, 53, 3, 61468);הארץ;4;3;לאלה תחלק הארץ בנחלה במספר שמות
(99813, 75, 4);1;א;233388;(4, 26, 55, 15, 233388);61487;(4, 26, 55, 5, 61487);הארץ;2;5;אך בגורל יחלק את הארץ לשמות מטות אבתם ינחלו
(99813, 75, 4);300;ש;233463;(4, 26, 57, 28, 233463);61505;(4, 26, 57, 6, 61505);משפחת;2;6;ואלה פקודי הלוי למשפחתם לגרשון משפחת הגרשני לקהת משפחת הקהתי למררי משפחת המררי
(99813, 75, 4);400;ת;233538;(4, 26, 58, 37, 233538);61520;(4, 26, 58, 8, 61520);משפחת;5;8;אלה משפחת לוי משפחת הלבני משפחת החברני משפחת המחלי משפחת המושי משפחת הקרחי וקהת הולד את עמרם
(99813, 75, 4);40;מ;233613;(4, 26, 59, 36, 233613);61540;(4, 26, 59, 11, 61540);במצרים;2;11;ושם אשת עמרם יוכבד בת לוי אשר ילדה אתה ללוי במצרים ותלד לעמרם את אהרן ואת משה ואת מרים אחתם
(99813, 75, 4);200;ר;233688;(4, 26, 60, 39, 233688);61559;(4, 26, 60, 10, 61559);איתמר;5;10;ויולד לאהרן את נדב ואת אביהוא את אלעזר ואת איתמר
(99813, 75, 4);20;כ;233763;(4, 26, 62, 41, 233763);61578;(4, 26, 62, 11, 61578);כי;1;11;ויהיו פקדיהם שלשה ועשרים אלף כל זכר מבן חדש ומעלה כי לא התפקדו בתוך בני ישראל כי לא נתן להם נחלה בתוך בני ישראל
(99813, 75, 4);6;ו;233838;(4, 26, 63, 28, 233838);61598;(4, 26, 63, 7, 61598);פקדו;4;7;אלה פקודי משה ואלעזר הכהן אשר פקדו את בני ישראל בערבת מואב על ירדן ירחו
(99813, 75, 4);200;ר;233913;(4, 26, 64, 46, 233913);61619;(4, 26, 64, 13, 61619);ישראל;3;13;ובאלה לא היה איש מפקודי משה ואהרן הכהן אשר פקדו את בני ישראל במדבר סיני
(99813, 75, 4);100;ק;233988;(4, 27, 1, 3, 233988);61641;(4, 27, 1, 1, 61641);ותקרבנה;3;1;ותקרבנה בנות צלפחד בן חפר בן גלעד בן מכיר בן מנשה למשפחת מנשה בן יוסף ואלה שמות בנתיו מחלה נעה וחגלה ומלכה ותרצה
(99813, 75, 4);3;ג;234063;(4, 27, 1, 78, 234063);61661;(4, 27, 1, 21, 61661);וחגלה;3;21;ותקרבנה בנות צלפחד בן חפר בן גלעד בן מכיר בן מנשה למשפחת מנשה בן יוסף ואלה שמות בנתיו מחלה נעה וחגלה ומלכה ותרצה
(99813, 75, 4);10;י;234138;(4, 27, 3, 3, 234138);61678;(4, 27, 3, 1, 61678);אבינו;3;1;אבינו מת במדבר והוא לא היה בתוך העדה הנועדים על יהוה בעדת קרח כי בחטאו מת ובנים לא היו לו
(99813, 75, 4);300;ש;234213;(4, 27, 4, 8, 234213);61700;(4, 27, 4, 3, 61700);שם;1;3;למה יגרע שם אבינו מתוך משפחתו כי אין לו בן תנה לנו אחזה בתוך אחי אבינו
(99813, 75, 4);200;ר;234288;(4, 27, 6, 5, 234288);61720;(4, 27, 6, 1, 61720);ויאמר;5;1;ויאמר יהוה אל משה לאמר
(99813, 75, 4);30;ל;234363;(4, 27, 7, 62, 234363);61741;(4, 27, 7, 17, 61741);להן;1;17;כן בנות צלפחד דברת נתן תתן להם אחזת נחלה בתוך אחי אביהם והעברת את נחלת אביהן להן
(99813, 75, 4);8;ח;234438;(4, 27, 9, 19, 234438);61763;(4, 27, 9, 7, 61763);נחלתו;2;7;ואם אין לו בת ונתתם את נחלתו לאחיו
(99813, 75, 4);200;ר;234513;(4, 27, 11, 35, 234513);61782;(4, 27, 11, 9, 61782);הקרב;3;9;ואם אין אחים לאביו ונתתם את נחלתו לשארו הקרב אליו ממשפחתו וירש אתה והיתה לבני ישראל לחקת משפט כאשר צוה יהוה את משה
(99813, 75, 4);1;א;234588;(4, 27, 12, 18, 234588);61802;(4, 27, 12, 6, 61802);אל;1;6;ויאמר יהוה אל משה עלה אל הר העברים הזה וראה את הארץ אשר נתתי לבני ישראל
(99813, 75, 4);200;ר;234663;(4, 27, 13, 37, 234663);61822;(4, 27, 13, 10, 61822);אהרן;3;10;וראיתה אתה ונאספת אל עמיך גם אתה כאשר נאסף אהרן אחיך
(99813, 75, 4);200;ר;234738;(4, 27, 15, 5, 234738);61840;(4, 27, 15, 1, 61840);וידבר;5;1;וידבר משה אל יהוה לאמר
(99813, 75, 4);10;י;234813;(4, 27, 17, 30, 234813);61861;(4, 27, 17, 8, 61861);יוציאם;1;8;אשר יצא לפניהם ואשר יבא לפניהם ואשר יוציאם ואשר יביאם ולא תהיה עדת יהוה כצאן אשר אין להם רעה
(99813, 75, 4);1;א;234888;(4, 27, 18, 31, 234888);61883;(4, 27, 18, 11, 61883);איש;1;11;ויאמר יהוה אל משה קח לך את יהושע בן נון איש אשר רוח בו וסמכת את ידך עליו
(99813, 75, 4);50;נ;234963;(4, 27, 20, 2, 234963);61902;(4, 27, 20, 1, 61902);ונתתה;2;1;ונתתה מהודך עליו למען ישמעו כל עדת בני ישראל
(99813, 75, 4);5;ה;235038;(4, 27, 21, 41, 235038);61920;(4, 27, 21, 10, 61920);יהוה;2;10;ולפני אלעזר הכהן יעמד ושאל לו במשפט האורים לפני יהוה על פיו יצאו ועל פיו יבאו הוא וכל בני ישראל אתו וכל העדה
(99813, 75, 4);6;ו;235113;(4, 27, 22, 30, 235113);61942;(4, 27, 22, 9, 61942);יהושע;3;9;ויעש משה כאשר צוה יהוה אתו ויקח את יהושע ויעמדהו לפני אלעזר הכהן ולפני כל העדה
(99813, 75, 4);2;ב;235188;(4, 28, 1, 4, 235188);61960;(4, 28, 1, 1, 61960);וידבר;4;1;וידבר יהוה אל משה לאמר
(99813, 75, 4);70;ע;235263;(4, 28, 2, 61, 235263);61980;(4, 28, 2, 16, 61980);במועדו;4;16;צו את בני ישראל ואמרת אלהם את קרבני לחמי לאשי ריח ניחחי תשמרו להקריב לי במועדו
(99813, 75, 4);2;ב;235338;(4, 28, 4, 14, 235338);62000;(4, 28, 4, 5, 62000);בבקר;1;5;את הכבש אחד תעשה בבקר ואת הכבש השני תעשה בין הערבים
(99813, 75, 4);10;י;235413;(4, 28, 6, 6, 235413);62017;(4, 28, 6, 2, 62017);תמיד;3;2;עלת תמיד העשיה בהר סיני לריח ניחח אשה ליהוה
