(n,d,k);LetterGematriaNumberValue;Letter;LetterPositionIndex;LetterCoordinatesD5K;WordNumber;WordCoordinatesDWTK;Found in Word in Text;LetterPositionIndex In Word;WordNumberInVerse;Found In Verse
(120469, 64, 4);40;ם;21;(1, 1, 1, 21, 21);5;(1, 1, 1, 5, 5);השמים;5;5;בראשית ברא אלהים את השמים ואת הארץ
(120469, 64, 4);200;ר;85;(1, 1, 3, 5, 85);22;(1, 1, 3, 1, 22);ויאמר;5;1;ויאמר אלהים יהי אור ויהי אור
(120469, 64, 4);6;ו;149;(1, 1, 5, 1, 149);40;(1, 1, 5, 1, 40);ויקרא;1;1;ויקרא אלהים לאור יום ולחשך קרא לילה ויהי ערב ויהי בקר יום אחד
(120469, 64, 4);10;י;213;(1, 1, 6, 16, 213);56;(1, 1, 6, 4, 56);רקיע;3;4;ויאמר אלהים יהי רקיע בתוך המים ויהי מבדיל בין מים למים
(120469, 64, 4);30;ל;277;(1, 1, 7, 36, 277);73;(1, 1, 7, 10, 73);לרקיע;1;10;ויעש אלהים את הרקיע ויבדל בין המים אשר מתחת לרקיע ובין המים אשר מעל לרקיע ויהי כן
(120469, 64, 4);6;ו;341;(1, 1, 8, 35, 341);89;(1, 1, 8, 9, 89);יום;2;9;ויקרא אלהים לרקיע שמים ויהי ערב ויהי בקר יום שני
(120469, 64, 4);5;ה;405;(1, 1, 10, 8, 405);105;(1, 1, 10, 2, 105);אלהים;3;2;ויקרא אלהים ליבשה ארץ ולמקוה המים קרא ימים וירא אלהים כי טוב
(120469, 64, 4);300;ש;469;(1, 1, 11, 23, 469);121;(1, 1, 11, 6, 121);עשב;2;6;ויאמר אלהים תדשא הארץ דשא עשב מזריע זרע עץ פרי עשה פרי למינו אשר זרעו בו על הארץ ויהי כן
(120469, 64, 4);200;ר;533;(1, 1, 12, 18, 533);140;(1, 1, 12, 5, 140);מזריע;3;5;ותוצא הארץ דשא עשב מזריע זרע למינהו ועץ עשה פרי אשר זרעו בו למינהו וירא אלהים כי טוב
(120469, 64, 4);10;י;597;(1, 1, 13, 15, 597);158;(1, 1, 13, 5, 158);יום;1;5;ויהי ערב ויהי בקר יום שלישי
(120469, 64, 4);400;ת;661;(1, 1, 14, 57, 661);172;(1, 1, 14, 13, 172);לאתת;4;13;ויאמר אלהים יהי מארת ברקיע השמים להבדיל בין היום ובין הלילה והיו לאתת ולמועדים ולימים ושנים
(120469, 64, 4);10;י;725;(1, 1, 16, 8, 725);186;(1, 1, 16, 2, 186);אלהים;4;2;ויעש אלהים את שני המארת הגדלים את המאור הגדל לממשלת היום ואת המאור הקטן לממשלת הלילה ואת הכוכבים
(120469, 64, 4);400;ת;789;(1, 1, 16, 72, 789);201;(1, 1, 16, 17, 201);ואת;3;17;ויעש אלהים את שני המארת הגדלים את המאור הגדל לממשלת היום ואת המאור הקטן לממשלת הלילה ואת הכוכבים
(120469, 64, 4);10;י;853;(1, 1, 18, 24, 853);215;(1, 1, 18, 5, 215);בין;2;5;ולמשל ביום ובלילה ולהבדיל בין האור ובין החשך וירא אלהים כי טוב
(120469, 64, 4);6;ו;917;(1, 1, 20, 15, 917);231;(1, 1, 20, 3, 231);ישרצו;5;3;ויאמר אלהים ישרצו המים שרץ נפש חיה ועוף יעופף על הארץ על פני רקיע השמים
(120469, 64, 4);30;ל;981;(1, 1, 21, 22, 981);248;(1, 1, 21, 5, 248);הגדלים;4;5;ויברא אלהים את התנינם הגדלים ואת כל נפש החיה הרמשת אשר שרצו המים למינהם ואת כל עוף כנף למינהו וירא אלהים כי טוב
(120469, 64, 4);10;י;1045;(1, 1, 21, 86, 1045);265;(1, 1, 21, 22, 265);כי;2;22;ויברא אלהים את התנינם הגדלים ואת כל נפש החיה הרמשת אשר שרצו המים למינהם ואת כל עוף כנף למינהו וירא אלהים כי טוב
(120469, 64, 4);10;י;1109;(1, 1, 23, 9, 1109);282;(1, 1, 23, 3, 282);ויהי;2;3;ויהי ערב ויהי בקר יום חמישי
(120469, 64, 4);6;ו;1173;(1, 1, 24, 51, 1173);298;(1, 1, 24, 13, 298);ויהי;1;13;ויאמר אלהים תוצא הארץ נפש חיה למינה בהמה ורמש וחיתו ארץ למינה ויהי כן
(120469, 64, 4);1;א;1237;(1, 1, 25, 59, 1237);314;(1, 1, 25, 15, 314);וירא;4;15;ויעש אלהים את חית הארץ למינה ואת הבהמה למינה ואת כל רמש האדמה למינהו וירא אלהים כי טוב
(120469, 64, 4);2;ב;1301;(1, 1, 26, 54, 1301);329;(1, 1, 26, 12, 329);ובבהמה;2;12;ויאמר אלהים נעשה אדם בצלמנו כדמותנו וירדו בדגת הים ובעוף השמים ובבהמה ובכל הארץ ובכל הרמש הרמש על הארץ
(120469, 64, 4);1;א;1365;(1, 1, 27, 34, 1365);345;(1, 1, 27, 9, 345);אתו;1;9;ויברא אלהים את האדם בצלמו בצלם אלהים ברא אתו זכר ונקבה ברא אתם
(120469, 64, 4);300;ש;1429;(1, 1, 28, 48, 1429);361;(1, 1, 28, 12, 361);וכבשה;4;12;ויברך אתם אלהים ויאמר להם אלהים פרו ורבו ומלאו את הארץ וכבשה ורדו בדגת הים ובעוף השמים ובכל חיה הרמשת על הארץ
(120469, 64, 4);30;ל;1493;(1, 1, 29, 24, 1493);378;(1, 1, 29, 7, 378);כל;2;7;ויאמר אלהים הנה נתתי לכם את כל עשב זרע זרע אשר על פני כל הארץ ואת כל העץ אשר בו פרי עץ זרע זרע לכם יהיה לאכלה
(120469, 64, 4);8;ח;1557;(1, 1, 30, 5, 1557);400;(1, 1, 30, 2, 400);חית;1;2;ולכל חית הארץ ולכל עוף השמים ולכל רומש על הארץ אשר בו נפש חיה את כל ירק עשב לאכלה ויהי כן
(120469, 64, 4);50;ן;1621;(1, 1, 30, 69, 1621);419;(1, 1, 30, 21, 419);כן;2;21;ולכל חית הארץ ולכל עוף השמים ולכל רומש על הארץ אשר בו נפש חיה את כל ירק עשב לאכלה ויהי כן
(120469, 64, 4);200;ר;1685;(1, 2, 1, 14, 1685);437;(1, 2, 1, 3, 437);והארץ;4;3;ויכלו השמים והארץ וכל צבאם
(120469, 64, 4);1;א;1749;(1, 2, 2, 56, 1749);452;(1, 2, 2, 13, 452);אשר;1;13;ויכל אלהים ביום השביעי מלאכתו אשר עשה וישבת ביום השביעי מכל מלאכתו אשר עשה
(120469, 64, 4);300;ש;1813;(1, 2, 3, 59, 1813);469;(1, 2, 3, 16, 469);לעשות;3;16;ויברך אלהים את יום השביעי ויקדש אתו כי בו שבת מכל מלאכתו אשר ברא אלהים לעשות
(120469, 64, 4);200;ר;1877;(1, 2, 5, 12, 1877);484;(1, 2, 5, 4, 484);טרם;2;4;וכל שיח השדה טרם יהיה בארץ וכל עשב השדה טרם יצמח כי לא המטיר יהוה אלהים על הארץ ואדם אין לעבד את האדמה
(120469, 64, 4);5;ה;1941;(1, 2, 5, 76, 1941);503;(1, 2, 5, 23, 503);האדמה;1;23;וכל שיח השדה טרם יהיה בארץ וכל עשב השדה טרם יצמח כי לא המטיר יהוה אלהים על הארץ ואדם אין לעבד את האדמה
(120469, 64, 4);5;ה;2005;(1, 2, 7, 30, 2005);520;(1, 2, 7, 8, 520);האדמה;5;8;וייצר יהוה אלהים את האדם עפר מן האדמה ויפח באפיו נשמת חיים ויהי האדם לנפש חיה
(120469, 64, 4);5;ה;2069;(1, 2, 8, 32, 2069);538;(1, 2, 8, 10, 538);האדם;1;10;ויטע יהוה אלהים גן בעדן מקדם וישם שם את האדם אשר יצר
(120469, 64, 4);20;ך;2133;(1, 2, 9, 55, 2133);554;(1, 2, 9, 14, 554);בתוך;4;14;ויצמח יהוה אלהים מן האדמה כל עץ נחמד למראה וטוב למאכל ועץ החיים בתוך הגן ועץ הדעת טוב ורע
(120469, 64, 4);5;ה;2197;(1, 2, 11, 3, 2197);572;(1, 2, 11, 2, 572);האחד;1;2;שם האחד פישון הוא הסבב את כל ארץ החוילה אשר שם הזהב
(120469, 64, 4);5;ה;2261;(1, 2, 12, 27, 2261);590;(1, 2, 12, 8, 590);השהם;1;8;וזהב הארץ ההוא טוב שם הבדלח ואבן השהם
(120469, 64, 4);40;מ;2325;(1, 2, 14, 27, 2325);607;(1, 2, 14, 7, 607);קדמת;3;7;ושם הנהר השלישי חדקל הוא ההלך קדמת אשור והנהר הרביעי הוא פרת
(120469, 64, 4);5;ה;2389;(1, 2, 15, 42, 2389);622;(1, 2, 15, 10, 622);ולשמרה;6;10;ויקח יהוה אלהים את האדם וינחהו בגן עדן לעבדה ולשמרה
(120469, 64, 4);10;י;2453;(1, 2, 17, 26, 2453);641;(1, 2, 17, 8, 641);כי;2;8;ומעץ הדעת טוב ורע לא תאכל ממנו כי ביום אכלך ממנו מות תמות
(120469, 64, 4);6;ו;2517;(1, 2, 18, 45, 2517);658;(1, 2, 18, 12, 658);כנגדו;5;12;ויאמר יהוה אלהים לא טוב היות האדם לבדו אעשה לו עזר כנגדו
(120469, 64, 4);30;ל;2581;(1, 2, 19, 64, 2581);677;(1, 2, 19, 19, 677);לו;1;19;ויצר יהוה אלהים מן האדמה כל חית השדה ואת כל עוף השמים ויבא אל האדם לראות מה יקרא לו וכל אשר יקרא לו האדם נפש חיה הוא שמו
(120469, 64, 4);30;ל;2645;(1, 2, 20, 35, 2645);694;(1, 2, 20, 8, 694);ולכל;4;8;ויקרא האדם שמות לכל הבהמה ולעוף השמים ולכל חית השדה ולאדם לא מצא עזר כנגדו
(120469, 64, 4);30;ל;2709;(1, 2, 21, 39, 2709);711;(1, 2, 21, 10, 711);מצלעתיו;3;10;ויפל יהוה אלהים תרדמה על האדם ויישן ויקח אחת מצלעתיו ויסגר בשר תחתנה
(120469, 64, 4);6;ו;2773;(1, 2, 23, 1, 2773);728;(1, 2, 23, 1, 728);ויאמר;1;1;ויאמר האדם זאת הפעם עצם מעצמי ובשר מבשרי לזאת יקרא אשה כי מאיש לקחה זאת
(120469, 64, 4);2;ב;2837;(1, 2, 24, 8, 2837);745;(1, 2, 24, 3, 745);יעזב;4;3;על כן יעזב איש את אביו ואת אמו ודבק באשתו והיו לבשר אחד
(120469, 64, 4);10;י;2901;(1, 2, 25, 29, 2901);762;(1, 2, 25, 7, 762);יתבששו;1;7;ויהיו שניהם ערומים האדם ואשתו ולא יתבששו
(120469, 64, 4);10;י;2965;(1, 3, 1, 59, 2965);779;(1, 3, 1, 17, 779);אלהים;4;17;והנחש היה ערום מכל חית השדה אשר עשה יהוה אלהים ויאמר אל האשה אף כי אמר אלהים לא תאכלו מכל עץ הגן
(120469, 64, 4);40;מ;3029;(1, 3, 3, 20, 3029);798;(1, 3, 3, 6, 798);אמר;2;6;ומפרי העץ אשר בתוך הגן אמר אלהים לא תאכלו ממנו ולא תגעו בו פן תמתון
(120469, 64, 4);1;א;3093;(1, 3, 5, 6, 3093);817;(1, 3, 5, 3, 817);אלהים;1;3;כי ידע אלהים כי ביום אכלכם ממנו ונפקחו עיניכם והייתם כאלהים ידעי טוב ורע
(120469, 64, 4);9;ט;3157;(1, 3, 6, 11, 3157);832;(1, 3, 6, 4, 832);טוב;1;4;ותרא האשה כי טוב העץ למאכל וכי תאוה הוא לעינים ונחמד העץ להשכיל ותקח מפריו ותאכל ותתן גם לאישה עמה ויאכל
(120469, 64, 4);300;ש;3221;(1, 3, 6, 75, 3221);847;(1, 3, 6, 19, 847);לאישה;4;19;ותרא האשה כי טוב העץ למאכל וכי תאוה הוא לעינים ונחמד העץ להשכיל ותקח מפריו ותאכל ותתן גם לאישה עמה ויאכל
(120469, 64, 4);400;ת;3285;(1, 3, 7, 55, 3285);862;(1, 3, 7, 13, 862);חגרת;4;13;ותפקחנה עיני שניהם וידעו כי עירמם הם ויתפרו עלה תאנה ויעשו להם חגרת
(120469, 64, 4);40;ם;3349;(1, 3, 8, 64, 3349);877;(1, 3, 8, 15, 877);אלהים;5;15;וישמעו את קול יהוה אלהים מתהלך בגן לרוח היום ויתחבא האדם ואשתו מפני יהוה אלהים בתוך עץ הגן
(120469, 64, 4);20;כ;3413;(1, 3, 10, 24, 3413);895;(1, 3, 10, 7, 895);כי;1;7;ויאמר את קלך שמעתי בגן ואירא כי עירם אנכי ואחבא
(120469, 64, 4);1;א;3477;(1, 3, 11, 50, 3477);913;(1, 3, 11, 15, 913);אכלת;1;15;ויאמר מי הגיד לך כי עירם אתה המן העץ אשר צויתיך לבלתי אכל ממנו אכלת
(120469, 64, 4);40;מ;3541;(1, 3, 13, 19, 3541);930;(1, 3, 13, 5, 930);מה;1;5;ויאמר יהוה אלהים לאשה מה זאת עשית ותאמר האשה הנחש השיאני ואכל
(120469, 64, 4);200;ר;3605;(1, 3, 14, 33, 3605);946;(1, 3, 14, 9, 946);ארור;4;9;ויאמר יהוה אלהים אל הנחש כי עשית זאת ארור אתה מכל הבהמה ומכל חית השדה על גחנך תלך ועפר תאכל כל ימי חייך
(120469, 64, 4);10;י;3669;(1, 3, 15, 16, 3669);964;(1, 3, 15, 4, 964);ובין;3;4;ואיבה אשית בינך ובין האשה ובין זרעך ובין זרעה הוא ישופך ראש ואתה תשופנו עקב
(120469, 64, 4);90;צ;3733;(1, 3, 16, 19, 3733);981;(1, 3, 16, 6, 981);עצבונך;2;6;אל האשה אמר הרבה ארבה עצבונך והרנך בעצב תלדי בנים ואל אישך תשוקתך והוא ימשל בך
(120469, 64, 4);300;ש;3797;(1, 3, 17, 20, 3797);997;(1, 3, 17, 6, 997);אשתך;2;6;ולאדם אמר כי שמעת לקול אשתך ותאכל מן העץ אשר צויתיך לאמר לא תאכל ממנו ארורה האדמה בעבורך בעצבון תאכלנה כל ימי חייך
(120469, 64, 4);20;כ;3861;(1, 3, 17, 84, 3861);1012;(1, 3, 17, 21, 1012);כל;1;21;ולאדם אמר כי שמעת לקול אשתך ותאכל מן העץ אשר צויתיך לאמר לא תאכל ממנו ארורה האדמה בעבורך בעצבון תאכלנה כל ימי חייך
(120469, 64, 4);4;ד;3925;(1, 3, 19, 26, 3925);1030;(1, 3, 19, 8, 1030);האדמה;3;8;בזעת אפיך תאכל לחם עד שובך אל האדמה כי ממנה לקחת כי עפר אתה ואל עפר תשוב
(120469, 64, 4);6;ו;3989;(1, 3, 21, 1, 3989);1051;(1, 3, 21, 1, 1051);ויעש;1;1;ויעש יהוה אלהים לאדם ולאשתו כתנות עור וילבשם
(120469, 64, 4);40;מ;4053;(1, 3, 22, 28, 4053);1066;(1, 3, 22, 8, 1066);ממנו;1;8;ויאמר יהוה אלהים הן האדם היה כאחד ממנו לדעת טוב ורע ועתה פן ישלח ידו ולקח גם מעץ החיים ואכל וחי לעלם
(120469, 64, 4);30;ל;4117;(1, 3, 23, 13, 4117);1083;(1, 3, 23, 3, 1083);אלהים;2;3;וישלחהו יהוה אלהים מגן עדן לעבד את האדמה אשר לקח משם
(120469, 64, 4);6;ו;4181;(1, 3, 24, 35, 4181);1101;(1, 3, 24, 10, 1101);ואת;1;10;ויגרש את האדם וישכן מקדם לגן עדן את הכרבים ואת להט החרב המתהפכת לשמר את דרך עץ החיים
(120469, 64, 4);400;ת;4245;(1, 4, 1, 32, 4245);1119;(1, 4, 1, 10, 1119);ותאמר;2;10;והאדם ידע את חוה אשתו ותהר ותלד את קין ותאמר קניתי איש את יהוה
(120469, 64, 4);6;ו;4309;(1, 4, 3, 1, 4309);1138;(1, 4, 3, 1, 1138);ויהי;1;1;ויהי מקץ ימים ויבא קין מפרי האדמה מנחה ליהוה
(120469, 64, 4);5;ה;4373;(1, 4, 4, 29, 4373);1153;(1, 4, 4, 7, 1153);ומחלבהן;6;7;והבל הביא גם הוא מבכרות צאנו ומחלבהן וישע יהוה אל הבל ואל מנחתו
(120469, 64, 4);1;א;4437;(1, 4, 6, 3, 4437);1171;(1, 4, 6, 1, 1171);ויאמר;3;1;ויאמר יהוה אל קין למה חרה לך ולמה נפלו פניך
(120469, 64, 4);200;ר;4501;(1, 4, 7, 33, 4501);1190;(1, 4, 7, 10, 1190);רבץ;1;10;הלוא אם תיטיב שאת ואם לא תיטיב לפתח חטאת רבץ ואליך תשוקתו ואתה תמשל בו
(120469, 64, 4);5;ה;4565;(1, 4, 8, 41, 4565);1207;(1, 4, 8, 12, 1207);הבל;1;12;ויאמר קין אל הבל אחיו ויהי בהיותם בשדה ויקם קין אל הבל אחיו ויהרגהו
(120469, 64, 4);200;ר;4629;(1, 4, 10, 5, 4629);1223;(1, 4, 10, 1, 1223);ויאמר;5;1;ויאמר מה עשית קול דמי אחיך צעקים אלי מן האדמה
(120469, 64, 4);8;ח;4693;(1, 4, 11, 33, 4693);1242;(1, 4, 11, 10, 1242);לקחת;3;10;ועתה ארור אתה מן האדמה אשר פצתה את פיה לקחת את דמי אחיך מידך
(120469, 64, 4);5;ה;4757;(1, 4, 13, 12, 4757);1263;(1, 4, 13, 4, 1263);יהוה;2;4;ויאמר קין אל יהוה גדול עוני מנשוא
(120469, 64, 4);90;ץ;4821;(1, 4, 14, 49, 4821);1279;(1, 4, 14, 13, 1279);בארץ;4;13;הן גרשת אתי היום מעל פני האדמה ומפניך אסתר והייתי נע ונד בארץ והיה כל מצאי יהרגני
(120469, 64, 4);2;ב;4885;(1, 4, 15, 48, 4885);1297;(1, 4, 15, 14, 1297);לבלתי;2;14;ויאמר לו יהוה לכן כל הרג קין שבעתים יקם וישם יהוה לקין אות לבלתי הכות אתו כל מצאו
(120469, 64, 4);6;ו;4949;(1, 4, 17, 14, 4949);1315;(1, 4, 17, 5, 1315);ותהר;1;5;וידע קין את אשתו ותהר ותלד את חנוך ויהי בנה עיר ויקרא שם העיר כשם בנו חנוך
(120469, 64, 4);200;ר;5013;(1, 4, 18, 20, 5013);1332;(1, 4, 18, 5, 1332);ועירד;4;5;ויולד לחנוך את עירד ועירד ילד את מחויאל ומחייאל ילד את מתושאל ומתושאל ילד את למך
(120469, 64, 4);5;ה;5077;(1, 4, 19, 19, 5077);1350;(1, 4, 19, 7, 1350);האחת;1;7;ויקח לו למך שתי נשים שם האחת עדה ושם השנית צלה
(120469, 64, 4);5;ה;5141;(1, 4, 21, 15, 5141);1369;(1, 4, 21, 5, 1369);היה;1;5;ושם אחיו יובל הוא היה אבי כל תפש כנור ועוגב
(120469, 64, 4);400;ת;5205;(1, 4, 22, 45, 5205);1388;(1, 4, 22, 14, 1388);תובל;1;14;וצלה גם הוא ילדה את תובל קין לטש כל חרש נחשת וברזל ואחות תובל קין נעמה
(120469, 64, 4);10;י;5269;(1, 4, 23, 54, 5269);1404;(1, 4, 23, 14, 1404);הרגתי;5;14;ויאמר למך לנשיו עדה וצלה שמען קולי נשי למך האזנה אמרתי כי איש הרגתי לפצעי וילד לחברתי
(120469, 64, 4);2;ב;5333;(1, 4, 25, 21, 5333);1421;(1, 4, 25, 7, 1421);בן;1;7;וידע אדם עוד את אשתו ותלד בן ותקרא את שמו שת כי שת לי אלהים זרע אחר תחת הבל כי הרגו קין
(120469, 64, 4);1;א;5397;(1, 4, 26, 19, 5397);1442;(1, 4, 26, 6, 1442);ויקרא;5;6;ולשת גם הוא ילד בן ויקרא את שמו אנוש אז הוחל לקרא בשם יהוה
(120469, 64, 4);40;ם;5461;(1, 5, 1, 38, 5461);1460;(1, 5, 1, 10, 1460);אלהים;5;10;זה ספר תולדת אדם ביום ברא אלהים אדם בדמות אלהים עשה אתו
(120469, 64, 4);400;ת;5525;(1, 5, 3, 16, 5525);1477;(1, 5, 3, 4, 1477);ומאת;4;4;ויחי אדם שלשים ומאת שנה ויולד בדמותו כצלמו ויקרא את שמו שת
(120469, 64, 4);300;ש;5589;(1, 5, 4, 33, 5589);1495;(1, 5, 4, 10, 1495);שנה;1;10;ויהיו ימי אדם אחרי הולידו את שת שמנה מאת שנה ויולד בנים ובנות
(120469, 64, 4);8;ח;5653;(1, 5, 6, 7, 5653);1513;(1, 5, 6, 3, 1513);חמש;1;3;ויחי שת חמש שנים ומאת שנה ויולד את אנוש
(120469, 64, 4);50;נ;5717;(1, 5, 7, 40, 5717);1530;(1, 5, 7, 11, 1530);שנה;2;11;ויחי שת אחרי הולידו את אנוש שבע שנים ושמנה מאות שנה ויולד בנים ובנות
(120469, 64, 4);70;ע;5781;(1, 5, 9, 11, 5781);1547;(1, 5, 9, 3, 1547);תשעים;3;3;ויחי אנוש תשעים שנה ויולד את קינן
(120469, 64, 4);10;י;5845;(1, 5, 10, 48, 5845);1564;(1, 5, 10, 13, 1564);ויולד;2;13;ויחי אנוש אחרי הולידו את קינן חמש עשרה שנה ושמנה מאות שנה ויולד בנים ובנות
(120469, 64, 4);5;ה;5909;(1, 5, 12, 16, 5909);1580;(1, 5, 12, 4, 1580);שנה;3;4;ויחי קינן שבעים שנה ויולד את מהללאל
(120469, 64, 4);30;ל;5973;(1, 5, 13, 51, 5973);1595;(1, 5, 13, 12, 1595);ויולד;4;12;ויחי קינן אחרי הולידו את מהללאל ארבעים שנה ושמנה מאות שנה ויולד בנים ובנות
(120469, 64, 4);6;ו;6037;(1, 5, 15, 18, 6037);1612;(1, 5, 15, 5, 1612);וששים;1;5;ויחי מהללאל חמש שנים וששים שנה ויולד את ירד
(120469, 64, 4);10;י;6101;(1, 5, 16, 47, 6101);1628;(1, 5, 16, 12, 1628);ויולד;2;12;ויחי מהללאל אחרי הולידו את ירד שלשים שנה ושמנה מאות שנה ויולד בנים ובנות
(120469, 64, 4);300;ש;6165;(1, 5, 18, 8, 6165);1644;(1, 5, 18, 3, 1644);שתים;1;3;ויחי ירד שתים וששים שנה ומאת שנה ויולד את חנוך
(120469, 64, 4);6;ו;6229;(1, 5, 19, 35, 6229);1661;(1, 5, 19, 10, 1661);ויולד;1;10;ויחי ירד אחרי הולידו את חנוך שמנה מאות שנה ויולד בנים ובנות
(120469, 64, 4);300;ש;6293;(1, 5, 21, 11, 6293);1677;(1, 5, 21, 3, 1677);חמש;3;3;ויחי חנוך חמש וששים שנה ויולד את מתושלח
(120469, 64, 4);400;ת;6357;(1, 5, 22, 43, 6357);1692;(1, 5, 22, 10, 1692);מאות;4;10;ויתהלך חנוך את האלהים אחרי הולידו את מתושלח שלש מאות שנה ויולד בנים ובנות
(120469, 64, 4);400;ת;6421;(1, 5, 24, 12, 6421);1709;(1, 5, 24, 3, 1709);את;2;3;ויתהלך חנוך את האלהים ואיננו כי לקח אתו אלהים
(120469, 64, 4);20;ך;6485;(1, 5, 25, 39, 6485);1725;(1, 5, 25, 10, 1725);למך;3;10;ויחי מתושלח שבע ושמנים שנה ומאת שנה ויולד את למך
(120469, 64, 4);400;ת;6549;(1, 5, 26, 64, 6549);1740;(1, 5, 26, 15, 1740);ובנות;5;15;ויחי מתושלח אחרי הולידו את למך שתים ושמונים שנה ושבע מאות שנה ויולד בנים ובנות
(120469, 64, 4);40;מ;6613;(1, 5, 28, 22, 6613);1757;(1, 5, 28, 6, 1757);ומאת;2;6;ויחי למך שתים ושמנים שנה ומאת שנה ויולד בן
(120469, 64, 4);200;ר;6677;(1, 5, 29, 52, 6677);1773;(1, 5, 29, 13, 1773);אשר;3;13;ויקרא את שמו נח לאמר זה ינחמנו ממעשנו ומעצבון ידינו מן האדמה אשר אררה יהוה
(120469, 64, 4);6;ו;6741;(1, 5, 30, 56, 6741);1790;(1, 5, 30, 15, 1790);ובנות;4;15;ויחי למך אחרי הולידו את נח חמש ותשעים שנה וחמש מאת שנה ויולד בנים ובנות
(120469, 64, 4);50;נ;6805;(1, 5, 32, 24, 6805);1809;(1, 5, 32, 8, 1809);נח;1;8;ויהי נח בן חמש מאות שנה ויולד נח את שם את חם ואת יפת
(120469, 64, 4);30;ל;6869;(1, 6, 2, 11, 6869);1829;(1, 6, 2, 3, 1829);האלהים;3;3;ויראו בני האלהים את בנות האדם כי טבת הנה ויקחו להם נשים מכל אשר בחרו
(120469, 64, 4);1;א;6933;(1, 6, 3, 21, 6933);1847;(1, 6, 3, 6, 1847);באדם;2;6;ויאמר יהוה לא ידון רוחי באדם לעלם בשגם הוא בשר והיו ימיו מאה ועשרים שנה
(120469, 64, 4);10;י;6997;(1, 6, 4, 28, 6997);1863;(1, 6, 4, 7, 1863);אחרי;4;7;הנפלים היו בארץ בימים ההם וגם אחרי כן אשר יבאו בני האלהים אל בנות האדם וילדו להם המה הגברים אשר מעולם אנשי השם
(120469, 64, 4);1;א;7061;(1, 6, 5, 4, 7061);1880;(1, 6, 5, 1, 1880);וירא;4;1;וירא יהוה כי רבה רעת האדם בארץ וכל יצר מחשבת לבו רק רע כל היום
(120469, 64, 4);40;ם;7125;(1, 6, 6, 20, 7125);1900;(1, 6, 6, 6, 1900);האדם;4;6;וינחם יהוה כי עשה את האדם בארץ ויתעצב אל לבו
(120469, 64, 4);70;ע;7189;(1, 6, 7, 49, 7189);1918;(1, 6, 7, 14, 1918);עד;1;14;ויאמר יהוה אמחה את האדם אשר בראתי מעל פני האדמה מאדם עד בהמה עד רמש ועד עוף השמים כי נחמתי כי עשיתם
(120469, 64, 4);10;י;7253;(1, 6, 9, 18, 7253);1937;(1, 6, 9, 6, 1937);צדיק;3;6;אלה תולדת נח נח איש צדיק תמים היה בדרתיו את האלהים התהלך נח
(120469, 64, 4);5;ה;7317;(1, 6, 11, 6, 7317);1956;(1, 6, 11, 2, 1956);הארץ;1;2;ותשחת הארץ לפני האלהים ותמלא הארץ חמס
(120469, 64, 4);4;ד;7381;(1, 6, 12, 39, 7381);1973;(1, 6, 12, 12, 1973);דרכו;1;12;וירא אלהים את הארץ והנה נשחתה כי השחית כל בשר את דרכו על הארץ
(120469, 64, 4);400;ת;7445;(1, 6, 13, 55, 7445);1990;(1, 6, 13, 15, 1990);משחיתם;5;15;ויאמר אלהים לנח קץ כל בשר בא לפני כי מלאה הארץ חמס מפניהם והנני משחיתם את הארץ
(120469, 64, 4);70;ע;7509;(1, 6, 15, 8, 7509);2009;(1, 6, 15, 3, 2009);תעשה;2;3;וזה אשר תעשה אתה שלש מאות אמה ארך התבה חמשים אמה רחבה ושלשים אמה קומתה
(120469, 64, 4);40;מ;7573;(1, 6, 16, 16, 7573);2026;(1, 6, 16, 5, 2026);אמה;2;5;צהר תעשה לתבה ואל אמה תכלנה מלמעלה ופתח התבה בצדה תשים תחתים שנים ושלשים תעשה
(120469, 64, 4);2;ב;7637;(1, 6, 17, 17, 7637);2041;(1, 6, 17, 5, 2041);המבול;3;5;ואני הנני מביא את המבול מים על הארץ לשחת כל בשר אשר בו רוח חיים מתחת השמים כל אשר בארץ יגוע
(120469, 64, 4);200;ר;7701;(1, 6, 18, 10, 7701);2060;(1, 6, 18, 3, 2060);בריתי;2;3;והקמתי את בריתי אתך ובאת אל התבה אתה ובניך ואשתך ונשי בניך אתך
(120469, 64, 4);1;א;7765;(1, 6, 19, 24, 7765);2077;(1, 6, 19, 7, 2077);תביא;4;7;ומכל החי מכל בשר שנים מכל תביא אל התבה להחית אתך זכר ונקבה יהיו
(120469, 64, 4);10;י;7829;(1, 6, 20, 38, 7829);2093;(1, 6, 20, 9, 2093);למינהו;3;9;מהעוף למינהו ומן הבהמה למינה מכל רמש האדמה למינהו שנים מכל יבאו אליך להחיות
