(256908, -75, 4);400;ת;223158;(4, 20, 24, 33, 223158);58836;(4, 20, 24, 11, 58836);נתתי;3;11;יאסף אהרן אל עמיו כי לא יבא אל הארץ אשר נתתי לבני ישראל על אשר מריתם את פי למי מריבה
(256908, -75, 4);1;א;223233;(4, 20, 26, 12, 223233);58859;(4, 20, 26, 4, 58859);את;1;4;והפשט את אהרן את בגדיו והלבשתם את אלעזר בנו ואהרן יאסף ומת שם
(256908, -75, 4);5;ה;223308;(4, 20, 27, 38, 223308);58880;(4, 20, 27, 12, 58880);העדה;1;12;ויעש משה כאשר צוה יהוה ויעלו אל הר ההר לעיני כל העדה
(256908, -75, 4);5;ה;223383;(4, 20, 28, 72, 223383);58901;(4, 20, 28, 21, 58901);ההר;1;21;ויפשט משה את אהרן את בגדיו וילבש אתם את אלעזר בנו וימת אהרן שם בראש ההר וירד משה ואלעזר מן ההר
(256908, -75, 4);2;ב;223458;(4, 21, 1, 24, 223458);58921;(4, 21, 1, 6, 58921);הנגב;4;6;וישמע הכנעני מלך ערד ישב הנגב כי בא ישראל דרך האתרים וילחם בישראל וישב ממנו שבי
(256908, -75, 4);40;ם;223533;(4, 21, 2, 35, 223533);58941;(4, 21, 2, 10, 58941);העם;3;10;וידר ישראל נדר ליהוה ויאמר אם נתן תתן את העם הזה בידי והחרמתי את עריהם
(256908, -75, 4);40;ם;223608;(4, 21, 3, 54, 223608);58959;(4, 21, 3, 13, 58959);שם;2;13;וישמע יהוה בקול ישראל ויתן את הכנעני ויחרם אתהם ואת עריהם ויקרא שם המקום חרמה
(256908, -75, 4);5;ה;223683;(4, 21, 5, 19, 223683);58979;(4, 21, 5, 4, 58979);ובמשה;5;4;וידבר העם באלהים ובמשה למה העליתנו ממצרים למות במדבר כי אין לחם ואין מים ונפשנו קצה בלחם הקלקל
(256908, -75, 4);8;ח;223758;(4, 21, 6, 17, 223758);58998;(4, 21, 6, 5, 58998);הנחשים;3;5;וישלח יהוה בעם את הנחשים השרפים וינשכו את העם וימת עם רב מישראל
(256908, -75, 4);80;פ;223833;(4, 21, 7, 41, 223833);59017;(4, 21, 7, 11, 59017);התפלל;3;11;ויבא העם אל משה ויאמרו חטאנו כי דברנו ביהוה ובך התפלל אל יהוה ויסר מעלינו את הנחש ויתפלל משה בעד העם
(256908, -75, 4);10;י;223908;(4, 21, 8, 36, 223908);59039;(4, 21, 8, 12, 59039);והיה;3;12;ויאמר יהוה אל משה עשה לך שרף ושים אתו על נס והיה כל הנשוך וראה אתו וחי
(256908, -75, 4);300;ש;223983;(4, 21, 9, 57, 223983);59061;(4, 21, 9, 17, 59061);הנחשת;4;17;ויעש משה נחש נחשת וישמהו על הנס והיה אם נשך הנחש את איש והביט אל נחש הנחשת וחי
(256908, -75, 4);40;מ;224058;(4, 21, 11, 49, 224058);59079;(4, 21, 11, 12, 59079);השמש;3;12;ויסעו מאבת ויחנו בעיי העברים במדבר אשר על פני מואב ממזרח השמש
(256908, -75, 4);6;ו;224133;(4, 21, 13, 55, 224133);59098;(4, 21, 13, 14, 59098);מואב;2;14;משם נסעו ויחנו מעבר ארנון אשר במדבר היצא מגבל האמרי כי ארנון גבול מואב בין מואב ובין האמרי
(256908, -75, 4);300;ש;224208;(4, 21, 15, 12, 224208);59117;(4, 21, 15, 3, 59117);אשר;2;3;ואשד הנחלים אשר נטה לשבת ער ונשען לגבול מואב
(256908, -75, 4);10;י;224283;(4, 21, 17, 3, 224283);59139;(4, 21, 17, 2, 59139);ישיר;1;2;אז ישיר ישראל את השירה הזאת עלי באר ענו לה
(256908, -75, 4);50;נ;224358;(4, 21, 18, 45, 224358);59157;(4, 21, 18, 10, 59157);מתנה;3;10;באר חפרוה שרים כרוה נדיבי העם במחקק במשענתם וממדבר מתנה
(256908, -75, 4);30;ל;224433;(4, 21, 21, 4, 224433);59173;(4, 21, 21, 1, 59173);וישלח;4;1;וישלח ישראל מלאכים אל סיחן מלך האמרי לאמר
(256908, -75, 4);30;ל;224508;(4, 21, 22, 45, 224508);59193;(4, 21, 22, 13, 59193);נלך;2;13;אעברה בארצך לא נטה בשדה ובכרם לא נשתה מי באר בדרך המלך נלך עד אשר נעבר גבלך
(256908, -75, 4);5;ה;224583;(4, 21, 23, 61, 224583);59213;(4, 21, 23, 16, 59213);המדברה;6;16;ולא נתן סיחן את ישראל עבר בגבלו ויאסף סיחן את כל עמו ויצא לקראת ישראל המדברה ויבא יהצה וילחם בישראל
(256908, -75, 4);50;נ;224658;(4, 21, 24, 56, 224658);59234;(4, 21, 24, 17, 59234);בני;2;17;ויכהו ישראל לפי חרב ויירש את ארצו מארנן עד יבק עד בני עמון כי עז גבול בני עמון
(256908, -75, 4);8;ח;224733;(4, 21, 26, 13, 224733);59253;(4, 21, 26, 4, 59253);סיחן;3;4;כי חשבון עיר סיחן מלך האמרי הוא והוא נלחם במלך מואב הראשון ויקח את כל ארצו מידו עד ארנן
(256908, -75, 4);8;ח;224808;(4, 21, 27, 19, 224808);59274;(4, 21, 27, 6, 59274);חשבון;1;6;על כן יאמרו המשלים באו חשבון תבנה ותכונן עיר סיחון
(256908, -75, 4);30;ל;224883;(4, 21, 29, 4, 224883);59293;(4, 21, 29, 2, 59293);לך;1;2;אוי לך מואב אבדת עם כמוש נתן בניו פליטם ובנתיו בשבית למלך אמרי סיחון
(256908, -75, 4);40;ם;224958;(4, 21, 30, 24, 224958);59311;(4, 21, 30, 6, 59311);ונשים;5;6;ונירם אבד חשבון עד דיבן ונשים עד נפח אשר עד מידבא
(256908, -75, 4);1;א;225033;(4, 21, 32, 42, 225033);59331;(4, 21, 32, 11, 59331);אשר;1;11;וישלח משה לרגל את יעזר וילכדו בנתיה ויירש את האמרי אשר שם
(256908, -75, 4);5;ה;225108;(4, 21, 34, 14, 225108);59350;(4, 21, 34, 4, 59350);משה;3;4;ויאמר יהוה אל משה אל תירא אתו כי בידך נתתי אתו ואת כל עמו ואת ארצו ועשית לו כאשר עשית לסיחן מלך האמרי אשר יושב בחשבון
(256908, -75, 4);300;ש;225183;(4, 21, 34, 89, 225183);59372;(4, 21, 34, 26, 59372);בחשבון;3;26;ויאמר יהוה אל משה אל תירא אתו כי בידך נתתי אתו ואת כל עמו ואת ארצו ועשית לו כאשר עשית לסיחן מלך האמרי אשר יושב בחשבון
(256908, -75, 4);200;ר;225258;(4, 22, 1, 21, 225258);59392;(4, 22, 1, 5, 59392);בערבות;3;5;ויסעו בני ישראל ויחנו בערבות מואב מעבר לירדן ירחו
(256908, -75, 4);2;ב;225333;(4, 22, 3, 22, 225333);59413;(4, 22, 3, 7, 59413);רב;2;7;ויגר מואב מפני העם מאד כי רב הוא ויקץ מואב מפני בני ישראל
(256908, -75, 4);1;א;225408;(4, 22, 4, 52, 225408);59433;(4, 22, 4, 14, 59433);את;1;14;ויאמר מואב אל זקני מדין עתה ילחכו הקהל את כל סביבתינו כלחך השור את ירק השדה ובלק בן צפור מלך למואב בעת ההוא
(256908, -75, 4);50;נ;225483;(4, 22, 5, 42, 225483);59454;(4, 22, 5, 12, 59454);בני;2;12;וישלח מלאכים אל בלעם בן בעור פתורה אשר על הנהר ארץ בני עמו לקרא לו לאמר הנה עם יצא ממצרים הנה כסה את עין הארץ והוא ישב ממלי
(256908, -75, 4);7;ז;225558;(4, 22, 6, 21, 225558);59478;(4, 22, 6, 8, 59478);הזה;2;8;ועתה לכה נא ארה לי את העם הזה כי עצום הוא ממני אולי אוכל נכה בו ואגרשנו מן הארץ כי ידעתי את אשר תברך מברך ואשר תאר יואר
(256908, -75, 4);20;כ;225633;(4, 22, 7, 4, 225633);59499;(4, 22, 7, 1, 59499);וילכו;4;1;וילכו זקני מואב וזקני מדין וקסמים בידם ויבאו אל בלעם וידברו אליו דברי בלק
(256908, -75, 4);10;י;225708;(4, 22, 8, 19, 225708);59517;(4, 22, 8, 5, 59517);הלילה;3;5;ויאמר אליהם לינו פה הלילה והשבתי אתכם דבר כאשר ידבר יהוה אלי וישבו שרי מואב עם בלעם
(256908, -75, 4);10;י;225783;(4, 22, 9, 27, 225783);59536;(4, 22, 9, 7, 59536);האנשים;5;7;ויבא אלהים אל בלעם ויאמר מי האנשים האלה עמך
(256908, -75, 4);90;ץ;225858;(4, 22, 11, 29, 225858);59557;(4, 22, 11, 8, 59557);הארץ;4;8;הנה העם היצא ממצרים ויכס את עין הארץ עתה לכה קבה לי אתו אולי אוכל להלחם בו וגרשתיו
(256908, -75, 4);200;ר;225933;(4, 22, 12, 39, 225933);59580;(4, 22, 12, 13, 59580);ברוך;2;13;ויאמר אלהים אל בלעם לא תלך עמהם לא תאר את העם כי ברוך הוא
(256908, -75, 4);6;ו;226008;(4, 22, 14, 14, 226008);59601;(4, 22, 14, 4, 59601);ויבאו;1;4;ויקומו שרי מואב ויבאו אל בלק ויאמרו מאן בלעם הלך עמנו
(256908, -75, 4);1;א;226083;(4, 22, 16, 14, 226083);59620;(4, 22, 16, 4, 59620);ויאמרו;3;4;ויבאו אל בלעם ויאמרו לו כה אמר בלק בן צפור אל נא תמנע מהלך אלי
(256908, -75, 4);10;י;226158;(4, 22, 17, 41, 226158);59644;(4, 22, 17, 13, 59644);לי;2;13;כי כבד אכבדך מאד וכל אשר תאמר אלי אעשה ולכה נא קבה לי את העם הזה
(256908, -75, 4);5;ה;226233;(4, 22, 18, 67, 226233);59668;(4, 22, 18, 21, 59668);אלהי;3;21;ויען בלעם ויאמר אל עבדי בלק אם יתן לי בלק מלא ביתו כסף וזהב לא אוכל לעבר את פי יהוה אלהי לעשות קטנה או גדולה
(256908, -75, 4);30;ל;226308;(4, 22, 20, 16, 226308);59690;(4, 22, 20, 5, 59690);לילה;1;5;ויבא אלהים אל בלעם לילה ויאמר לו אם לקרא לך באו האנשים קום לך אתם ואך את הדבר אשר אדבר אליך אתו תעשה
(256908, -75, 4);6;ו;226383;(4, 22, 21, 13, 226383);59712;(4, 22, 21, 4, 59712);ויחבש;1;4;ויקם בלעם בבקר ויחבש את אתנו וילך עם שרי מואב
(256908, -75, 4);70;ע;226458;(4, 22, 22, 52, 226458);59733;(4, 22, 22, 15, 59733);על;1;15;ויחר אף אלהים כי הולך הוא ויתיצב מלאך יהוה בדרך לשטן לו והוא רכב על אתנו ושני נעריו עמו
(256908, -75, 4);20;ך;226533;(4, 22, 23, 58, 226533);59752;(4, 22, 23, 15, 59752);ותלך;4;15;ותרא האתון את מלאך יהוה נצב בדרך וחרבו שלופה בידו ותט האתון מן הדרך ותלך בשדה ויך בלעם את האתון להטתה הדרך
(256908, -75, 4);1;א;226608;(4, 22, 25, 10, 226608);59771;(4, 22, 25, 3, 59771);את;1;3;ותרא האתון את מלאך יהוה ותלחץ אל הקיר ותלחץ את רגל בלעם אל הקיר ויסף להכתה
(256908, -75, 4);6;ו;226683;(4, 22, 26, 26, 226683);59790;(4, 22, 26, 6, 59790);במקום;4;6;ויוסף מלאך יהוה עבור ויעמד במקום צר אשר אין דרך לנטות ימין ושמאול
(256908, -75, 4);1;א;226758;(4, 22, 27, 48, 226758);59811;(4, 22, 27, 14, 59811);האתון;2;14;ותרא האתון את מלאך יהוה ותרבץ תחת בלעם ויחר אף בלעם ויך את האתון במקל
(256908, -75, 4);6;ו;226833;(4, 22, 29, 13, 226833);59830;(4, 22, 29, 3, 59830);לאתון;4;3;ויאמר בלעם לאתון כי התעללת בי לו יש חרב בידי כי עתה הרגתיך
(256908, -75, 4);4;ד;226908;(4, 22, 30, 42, 226908);59851;(4, 22, 30, 11, 59851);מעודך;4;11;ותאמר האתון אל בלעם הלוא אנכי אתנך אשר רכבת עלי מעודך עד היום הזה ההסכן הסכנתי לעשות לך כה ויאמר לא
(256908, -75, 4);200;ר;226983;(4, 22, 31, 38, 226983);59872;(4, 22, 31, 11, 59872);בדרך;3;11;ויגל יהוה את עיני בלעם וירא את מלאך יהוה נצב בדרך וחרבו שלפה בידו ויקד וישתחו לאפיו
(256908, -75, 4);1;א;227058;(4, 22, 32, 46, 227058);59892;(4, 22, 32, 14, 59892);אנכי;1;14;ויאמר אליו מלאך יהוה על מה הכית את אתנך זה שלוש רגלים הנה אנכי יצאתי לשטן כי ירט הדרך לנגדי
(256908, -75, 4);400;ת;227133;(4, 22, 33, 49, 227133);59912;(4, 22, 33, 14, 59912);אתכה;2;14;ותראני האתון ותט לפני זה שלש רגלים אולי נטתה מפני כי עתה גם אתכה הרגתי ואותה החייתי
(256908, -75, 4);40;ם;227208;(4, 22, 34, 57, 227208);59931;(4, 22, 34, 16, 59931);אם;2;16;ויאמר בלעם אל מלאך יהוה חטאתי כי לא ידעתי כי אתה נצב לקראתי בדרך ועתה אם רע בעיניך אשובה לי
(256908, -75, 4);30;ל;227283;(4, 22, 35, 60, 227283);59952;(4, 22, 35, 17, 59952);וילך;3;17;ויאמר מלאך יהוה אל בלעם לך עם האנשים ואפס את הדבר אשר אדבר אליך אתו תדבר וילך בלעם עם שרי בלק
(256908, -75, 4);10;י;227358;(4, 22, 37, 2, 227358);59974;(4, 22, 37, 1, 59974);ויאמר;2;1;ויאמר בלק אל בלעם הלא שלח שלחתי אליך לקרא לך למה לא הלכת אלי האמנם לא אוכל כבדך
(256908, -75, 4);5;ה;227433;(4, 22, 38, 15, 227433);59996;(4, 22, 38, 5, 59996);הנה;1;5;ויאמר בלעם אל בלק הנה באתי אליך עתה היכל אוכל דבר מאומה הדבר אשר ישים אלהים בפי אתו אדבר
(256908, -75, 4);200;ר;227508;(4, 22, 39, 20, 227508);60016;(4, 22, 39, 6, 60016);קרית;2;6;וילך בלעם עם בלק ויבאו קרית חצות
(256908, -75, 4);2;ב;227583;(4, 22, 41, 32, 227583);60035;(4, 22, 41, 9, 60035);בעל;1;9;ויהי בבקר ויקח בלק את בלעם ויעלהו במות בעל וירא משם קצה העם
(256908, -75, 4);10;י;227658;(4, 23, 2, 2, 227658);60056;(4, 23, 2, 1, 60056);ויעש;2;1;ויעש בלק כאשר דבר בלעם ויעל בלק ובלעם פר ואיל במזבח
(256908, -75, 4);200;ר;227733;(4, 23, 3, 36, 227733);60075;(4, 23, 3, 9, 60075);יקרה;3;9;ויאמר בלעם לבלק התיצב על עלתך ואלכה אולי יקרה יהוה לקראתי ודבר מה יראני והגדתי לך וילך שפי
(256908, -75, 4);200;ר;227808;(4, 23, 4, 38, 227808);60094;(4, 23, 4, 10, 60094);ערכתי;2;10;ויקר אלהים אל בלעם ויאמר אליו את שבעת המזבחת ערכתי ואעל פר ואיל במזבח
(256908, -75, 4);30;ל;227883;(4, 23, 6, 19, 227883);60115;(4, 23, 6, 6, 60115);עלתו;2;6;וישב אליו והנה נצב על עלתו הוא וכל שרי מואב
(256908, -75, 4);40;מ;227958;(4, 23, 7, 60, 227958);60136;(4, 23, 7, 17, 60136);זעמה;3;17;וישא משלו ויאמר מן ארם ינחני בלק מלך מואב מהררי קדם לכה ארה לי יעקב ולכה זעמה ישראל
(256908, -75, 4);6;ו;228033;(4, 23, 9, 41, 228033);60158;(4, 23, 9, 11, 60158);ובגוים;1;11;כי מראש צרים אראנו ומגבעות אשורנו הן עם לבדד ישכן ובגוים לא יתחשב
(256908, -75, 4);30;ל;228108;(4, 23, 11, 7, 228108);60177;(4, 23, 11, 2, 60177);בלק;2;2;ויאמר בלק אל בלעם מה עשית לי לקב איבי לקחתיך והנה ברכת ברך
(256908, -75, 4);30;ל;228183;(4, 23, 12, 36, 228183);60199;(4, 23, 12, 11, 60199);לדבר;1;11;ויען ויאמר הלא את אשר ישים יהוה בפי אתו אשמר לדבר
(256908, -75, 4);10;י;228258;(4, 23, 14, 2, 228258);60221;(4, 23, 14, 1, 60221);ויקחהו;2;1;ויקחהו שדה צפים אל ראש הפסגה ויבן שבעה מזבחת ויעל פר ואיל במזבח
(256908, -75, 4);50;נ;228333;(4, 23, 15, 26, 228333);60241;(4, 23, 15, 8, 60241);ואנכי;3;8;ויאמר אל בלק התיצב כה על עלתך ואנכי אקרה כה
(256908, -75, 4);6;ו;228408;(4, 23, 17, 22, 228408);60263;(4, 23, 17, 7, 60263);ושרי;1;7;ויבא אליו והנו נצב על עלתו ושרי מואב אתו ויאמר לו בלק מה דבר יהוה
(256908, -75, 4);6;ו;228483;(4, 23, 19, 8, 228483);60285;(4, 23, 19, 4, 60285);ויכזב;1;4;לא איש אל ויכזב ובן אדם ויתנחם ההוא אמר ולא יעשה ודבר ולא יקימנה
(256908, -75, 4);6;ו;228558;(4, 23, 21, 8, 228558);60304;(4, 23, 21, 3, 60304);און;2;3;לא הביט און ביעקב ולא ראה עמל בישראל יהוה אלהיו עמו ותרועת מלך בו
(256908, -75, 4);8;ח;228633;(4, 23, 23, 6, 228633);60324;(4, 23, 23, 3, 60324);נחש;2;3;כי לא נחש ביעקב ולא קסם בישראל כעת יאמר ליעקב ולישראל מה פעל אל
(256908, -75, 4);4;ד;228708;(4, 23, 24, 31, 228708);60344;(4, 23, 24, 9, 60344);עד;2;9;הן עם כלביא יקום וכארי יתנשא לא ישכב עד יאכל טרף ודם חללים ישתה
(256908, -75, 4);100;ק;228783;(4, 23, 26, 18, 228783);60366;(4, 23, 26, 5, 60366);בלק;3;5;ויען בלעם ויאמר אל בלק הלא דברתי אליך לאמר כל אשר ידבר יהוה אתו אעשה
(256908, -75, 4);300;ש;228858;(4, 23, 27, 39, 228858);60388;(4, 23, 27, 12, 60388);יישר;3;12;ויאמר בלק אל בלעם לכה נא אקחך אל מקום אחר אולי יישר בעיני האלהים וקבתו לי משם
(256908, -75, 4);50;נ;228933;(4, 23, 29, 16, 228933);60408;(4, 23, 29, 5, 60408);בנה;2;5;ויאמר בלעם אל בלק בנה לי בזה שבעה מזבחת והכן לי בזה שבעה פרים ושבעה אילם
(256908, -75, 4);6;ו;229008;(4, 24, 1, 1, 229008);60429;(4, 24, 1, 1, 60429);וירא;1;1;וירא בלעם כי טוב בעיני יהוה לברך את ישראל ולא הלך כפעם בפעם לקראת נחשים וישת אל המדבר פניו
(256908, -75, 4);1;א;229083;(4, 24, 2, 4, 229083);60448;(4, 24, 2, 1, 60448);וישא;4;1;וישא בלעם את עיניו וירא את ישראל שכן לשבטיו ותהי עליו רוח אלהים
(256908, -75, 4);50;נ;229158;(4, 24, 3, 28, 229158);60468;(4, 24, 3, 8, 60468);ונאם;2;8;וישא משלו ויאמר נאם בלעם בנו בער ונאם הגבר שתם העין
(256908, -75, 4);300;ש;229233;(4, 24, 5, 23, 229233);60488;(4, 24, 5, 6, 60488);ישראל;2;6;מה טבו אהליך יעקב משכנתיך ישראל
(256908, -75, 4);200;ר;229308;(4, 24, 7, 27, 229308);60506;(4, 24, 7, 7, 60506);וירם;3;7;יזל מים מדליו וזרעו במים רבים וירם מאגג מלכו ותנשא מלכתו
(256908, -75, 4);40;מ;229383;(4, 24, 8, 56, 229383);60523;(4, 24, 8, 13, 60523);ימחץ;2;13;אל מוציאו ממצרים כתועפת ראם לו יאכל גוים צריו ועצמתיהם יגרם וחציו ימחץ
(256908, -75, 4);1;א;229458;(4, 24, 10, 29, 229458);60542;(4, 24, 10, 9, 60542);ויאמר;3;9;ויחר אף בלק אל בלעם ויספק את כפיו ויאמר בלק אל בלעם לקב איבי קראתיך והנה ברכת ברך זה שלש פעמים
(256908, -75, 4);6;ו;229533;(4, 24, 11, 30, 229533);60563;(4, 24, 11, 9, 60563);והנה;1;9;ועתה ברח לך אל מקומך אמרתי כבד אכבדך והנה מנעך יהוה מכבוד
(256908, -75, 4);1;א;229608;(4, 24, 13, 13, 229608);60584;(4, 24, 13, 5, 60584);מלא;3;5;אם יתן לי בלק מלא ביתו כסף וזהב לא אוכל לעבר את פי יהוה לעשות טובה או רעה מלבי אשר ידבר יהוה אתו אדבר
(256908, -75, 4);6;ו;229683;(4, 24, 14, 10, 229683);60606;(4, 24, 14, 3, 60606);הולך;2;3;ועתה הנני הולך לעמי לכה איעצך אשר יעשה העם הזה לעמך באחרית הימים
(256908, -75, 4);2;ב;229758;(4, 24, 15, 33, 229758);60625;(4, 24, 15, 9, 60625);הגבר;3;9;וישא משלו ויאמר נאם בלעם בנו בער ונאם הגבר שתם העין
(256908, -75, 4);30;ל;229833;(4, 24, 17, 19, 229833);60645;(4, 24, 17, 5, 60645);ולא;2;5;אראנו ולא עתה אשורנו ולא קרוב דרך כוכב מיעקב וקם שבט מישראל ומחץ פאתי מואב וקרקר כל בני שת
(256908, -75, 4);70;ע;229908;(4, 24, 18, 22, 229908);60665;(4, 24, 18, 6, 60665);שעיר;2;6;והיה אדום ירשה והיה ירשה שעיר איביו וישראל עשה חיל
(256908, -75, 4);70;ע;229983;(4, 24, 20, 33, 229983);60683;(4, 24, 20, 9, 60683);עמלק;1;9;וירא את עמלק וישא משלו ויאמר ראשית גוים עמלק ואחריתו עדי אבד
(256908, -75, 4);50;ן;230058;(4, 24, 22, 15, 230058);60702;(4, 24, 22, 5, 60702);קין;3;5;כי אם יהיה לבער קין עד מה אשור תשבך
(256908, -75, 4);10;י;230133;(4, 24, 24, 35, 230133);60724;(4, 24, 24, 10, 60724);עדי;3;10;וצים מיד כתים וענו אשור וענו עבר וגם הוא עדי אבד
(256908, -75, 4);6;ו;230208;(4, 25, 2, 1, 230208);60744;(4, 25, 2, 1, 60744);ותקראן;1;1;ותקראן לעם לזבחי אלהיהן ויאכל העם וישתחוו לאלהיהן
(256908, -75, 4);30;ל;230283;(4, 25, 3, 34, 230283);60759;(4, 25, 3, 8, 60759);בישראל;6;8;ויצמד ישראל לבעל פעור ויחר אף יהוה בישראל
(256908, -75, 4);300;ש;230358;(4, 25, 5, 7, 230358);60780;(4, 25, 5, 2, 60780);משה;2;2;ויאמר משה אל שפטי ישראל הרגו איש אנשיו הנצמדים לבעל פעור
(256908, -75, 4);50;נ;230433;(4, 25, 6, 36, 230433);60799;(4, 25, 6, 10, 60799);המדינית;5;10;והנה איש מבני ישראל בא ויקרב אל אחיו את המדינית לעיני משה ולעיני כל עדת בני ישראל והמה בכים פתח אהל מועד
(256908, -75, 4);10;י;230508;(4, 25, 7, 28, 230508);60819;(4, 25, 7, 8, 60819);ויקם;2;8;וירא פינחס בן אלעזר בן אהרן הכהן ויקם מתוך העדה ויקח רמח בידו
(256908, -75, 4);2;ב;230583;(4, 25, 8, 54, 230583);60840;(4, 25, 8, 16, 60840);קבתה;2;16;ויבא אחר איש ישראל אל הקבה וידקר את שניהם את איש ישראל ואת האשה אל קבתה ותעצר המגפה מעל בני ישראל
(256908, -75, 4);60;ס;230658;(4, 25, 11, 5, 230658);60857;(4, 25, 11, 1, 60857);פינחס;5;1;פינחס בן אלעזר בן אהרן הכהן השיב את חמתי מעל בני ישראל בקנאו את קנאתי בתוכם ולא כליתי את בני ישראל בקנאתי
(256908, -75, 4);100;ק;230733;(4, 25, 11, 80, 230733);60878;(4, 25, 11, 22, 60878);בקנאתי;2;22;פינחס בן אלעזר בן אהרן הכהן השיב את חמתי מעל בני ישראל בקנאו את קנאתי בתוכם ולא כליתי את בני ישראל בקנאתי
(256908, -75, 4);6;ו;230808;(4, 25, 13, 45, 230808);60897;(4, 25, 13, 11, 60897);לאלהיו;6;11;והיתה לו ולזרעו אחריו ברית כהנת עולם תחת אשר קנא לאלהיו ויכפר על בני ישראל
(256908, -75, 4);1;א;230883;(4, 25, 15, 5, 230883);60918;(4, 25, 15, 2, 60918);האשה;2;2;ושם האשה המכה המדינית כזבי בת צור ראש אמות בית אב במדין הוא
(256908, -75, 4);5;ה;230958;(4, 25, 17, 15, 230958);60938;(4, 25, 17, 4, 60938);והכיתם;2;4;צרור את המדינים והכיתם אותם
(256908, -75, 4);2;ב;231033;(4, 25, 18, 67, 231033);60959;(4, 25, 18, 20, 60959);ביום;1;20;כי צררים הם לכם בנכליהם אשר נכלו לכם על דבר פעור ועל דבר כזבי בת נשיא מדין אחתם המכה ביום המגפה על דבר פעור
(256908, -75, 4);20;כ;231108;(4, 26, 2, 9, 231108);60980;(4, 26, 2, 4, 60980);כל;1;4;שאו את ראש כל עדת בני ישראל מבן עשרים שנה ומעלה לבית אבתם כל יצא צבא בישראל
(256908, -75, 4);2;ב;231183;(4, 26, 3, 25, 231183);60999;(4, 26, 3, 6, 60999);בערבת;4;6;וידבר משה ואלעזר הכהן אתם בערבת מואב על ירדן ירחו לאמר
(256908, -75, 4);40;ם;231258;(4, 26, 4, 56, 231258);61018;(4, 26, 4, 14, 61018);מצרים;5;14;מבן עשרים שנה ומעלה כאשר צוה יהוה את משה ובני ישראל היצאים מארץ מצרים
(256908, -75, 4);300;ש;231333;(4, 26, 6, 24, 231333);61034;(4, 26, 6, 5, 61034);משפחת;2;5;לחצרן משפחת החצרוני לכרמי משפחת הכרמי
(256908, -75, 4);2;ב;231408;(4, 26, 8, 13, 231408);61049;(4, 26, 8, 3, 61049);אליאב;5;3;ובני פלוא אליאב
(256908, -75, 4);40;ם;231483;(4, 26, 9, 75, 231483);61068;(4, 26, 9, 19, 61068);בהצתם;5;19;ובני אליאב נמואל ודתן ואבירם הוא דתן ואבירם קרואי העדה אשר הצו על משה ועל אהרן בעדת קרח בהצתם על יהוה
(256908, -75, 4);2;ב;231558;(4, 26, 11, 2, 231558);61089;(4, 26, 11, 1, 61089);ובני;2;1;ובני קרח לא מתו
(256908, -75, 4);10;י;231633;(4, 26, 12, 65, 231633);61104;(4, 26, 12, 12, 61104);היכיני;6;12;בני שמעון למשפחתם לנמואל משפחת הנמואלי לימין משפחת הימיני ליכין משפחת היכיני
(256908, -75, 4);40;ם;231708;(4, 26, 15, 12, 231708);61120;(4, 26, 15, 3, 61120);למשפחתם;7;3;בני גד למשפחתם לצפון משפחת הצפוני לחגי משפחת החגי לשוני משפחת השוני
(256908, -75, 4);200;ר;231783;(4, 26, 17, 3, 231783);61136;(4, 26, 17, 1, 61136);לארוד;3;1;לארוד משפחת הארודי לאראלי משפחת האראלי
(256908, -75, 4);5;ה;231858;(4, 26, 19, 8, 231858);61152;(4, 26, 19, 2, 61152);יהודה;5;2;בני יהודה ער ואונן וימת ער ואונן בארץ כנען
